{
  "number": "10880",
  "title": "所得税決定処分取消等請求事件",
  "court": "東京地方裁判所",
  "date": "平成２０年１月３１日",
  "date_iso": "2008-01-31",
  "result": "取消",
  "topics": [
    "所得税",
    "消費税"
  ],
  "laws": [
    "国税通則法65条",
    "所得税法36条",
    "消費税法2条"
  ],
  "keywords": [
    "更正処分",
    "課税処分",
    "過少申告加算税"
  ],
  "text": "\n \n 目次に戻る \n \n 判決 10880 \n 所得税決定処分取消等請求事件 \n \n 裁判所:  東京地方裁判所 \n 判決日:  平成２０年１月３１日 \n 結果:  取消 \n \n \n 主文 \n １ 原告の請求をいずれも棄却する。\n２ 訴訟費用は原告の負担とする。 \n \n \n 第１ 請求 \n １ 被告が平成１６年２月２６日付けで原告の平成１３年分及び平成１４年分の所得税についてした各更正処分（ただし、いずれも裁決により一部取り消された後のもの）のうち、別紙１「確定申告」欄記載の各納付すべき税額を超える部分及び各過少申告加算税賦課決定処分（ただし、いずれも裁決により一部取り消された後のもの）の全部を取り消す。\n２ 被告が平成１６年２月２６日付けで原告の平成１３年１月１日から同年１２月３１日まで及び平成１４年１月１日から同年１２月３１日までの各課税期間の消費税及び地方消費税の各更正処分（ただし、いずれも裁決により一部取り消された後のもの）のうち、別紙２「確定申告」欄記載の各納付すべき消費税額及び地方消費税額を超える部分並びに各過少申告加算税賦課決定処分（ただし、いずれも裁決により一部取り消された後のもの）の全部を取り消す。 \n \n \n 第２ 事案の概要本件は \n 、法律事務所を経営する弁護士である原告が、所得税について各更正処分及び過少申告加算税の各賦課決定処分を受け、かつ、消費税及び地方消費税（以下「消費税等」\nという。）の各更正処分並びに過少申告加算税の各賦課決定処分を受けたことから、これらの各更正処分の一部取消しと過少申告加算税の各賦課決定処分の全部取消しを求めている事案である。\n１ 前提事実（顕著な事実及び当事者間に争いのない事実）\n(1) 原告は、平成４年４月、神奈川県相模原市内で法律事務所を開設した弁護士である。\n(2)ア 原告は、平成１３年分及び平成１４年分の所得税について、青色の確定申告書に別紙３「課税処分の経緯（所得税）」の「平成１３年分」及び「平成１４年分」\nの各「確定申告」欄のとおり記載して、いずれも法定申告期限までに申告した。\nイ 処分行政庁は、これに対し、平成１６年２月２６日付けで上記アの各年分の所得税について、別紙３「課税処分の経緯（所得税）」のとおりの各更正処分及び各過少申告加算税賦課決定処分をした。\nウ 原告は、上記イの各処分を不服として、平成１６年４月１日、審査請求をした。\n(3)ア 原告は、平成１３年１月１日から同年１２月３１日まで及び平成１４年１月１日から同年１２月３１日までの各課税期間の消費税等について、確定申告書に別紙\n４「課税処分の経緯（消費税）」「平成１３年分」及び「平成１４年分」の各「確定申告」欄のとおり記載して、いずれも法定申告期限までに申告した。\nイ 処分行政庁は、これに対し、平成１６年２月２６日付けで上記アの各課税期間の消費税等について、別紙４「課税処分の経緯（消費税）」のとおりの各更正処分及び各過少申告加算税賦課決定処分をした。\nウ 原告は、上記イの処分を不服として、平成１６年４月１日、異議申立てをしたところ、異議審理庁が、これを国税通則法８９条１項の規定により審査請求として扱うことが適当であると認め、その旨異議申立人である原告に通知し、原告がこれに同意したため、同年６月１４日付けで裁決庁に審査請求がされたものとみなされた。\n(4) 前記(2)ウ及び(3)ウの各審査請求について、平成１７年３月１４日付けで、別紙\n３「課税処分の経緯（所得税）」及び別紙４「課税処分の根拠（消費税）」の各「審査裁決」欄のとおり、裁決がされた。これによれば、平成１３年分及び平成１４年分の所得税についてした各更正処分及び各過少申告加算税賦課決定処分並びに平成１３年１月１日から同年１２月３１日まで及び平成１４年１月１日から同年１２月３１日までの各課税期間の消費税等の各更正処分及び過少申告加算税の各賦課決定処分は、一部取り消された。\n(5) 原告は、平成１７年９月９日、上記(4)の裁決のうち、原処分を維持した部分について、本件の取消訴訟を提起した（顕著な事実）。\n２ 本件における課税の根拠は、別紙５「課税の根拠」記載のとおりである（ただし、所得税の課税根拠のうち事業所得額について、当事者間に争いがある。また、消費税等のうち、平成１３年の返還等対価に係る税額並びに平成１４年の控除対象仕入税額、中間納付税額及び中間納付譲渡割額については当事者間に争いがないが、その余の項目に記載された税額については、当事者間に争いがある。）。\n３ 争点本件の主要な争点は、原告の事業所得に係る弁護士報酬の額を総収入金額に算入すべき時期である。\n争点に関する当事者の摘示すべき主張は、後記第３「争点に対する判断」に記載するとおりであるが、その要旨は、次のとおりである。所得税及び消費税等を通じて、まず、\n①着手金の収入計上時期について、被告は、委任契約時に着手金請求権が確定する旨主張するのに対し、原告は、着手金請求権は、人的役務の提供が完了されたときに収入として計上すべきである旨主張する。また、②報酬金の収入計上時期について、被告は、\n弁護士が受任した事件の処理が終了し依頼者に報酬金を請求した時に報酬金請求権が確定する旨主張するのに対し、原告は、報酬金について具体的な合意がないことが多く、\nこうした場合には、弁護士と依頼者が事件の処理が終了した後改めて合意に達した時に収入として計上すべきである旨主張する。原告はさらに、着手金と報酬金を通じて、多重債務者の債務整理事件の場合には着手金ないし報酬金請求権を回収できない可能性が高いことから、そもそもこれらの金員が現実に支払われた段階で収入として計上すべきである旨主張する。\nなお、以上のほか、後記第３の５(3)のとおり、個別の依頼者に係る着手金、報酬金等請求権の有無及び金額について、争いがあるものもある。 \n \n \n 第３ 争点に対する判断 \n １ 収入金額の計上時期の基本的考え方についてまず、所得税及び消費税等を課税する上での収入金額の計上時期の基本的考え方について検討する。 \n (1) 弁護士報酬について、原告は、弁護士報酬のうち、着手金は着手時に、報酬金は事件が終了した後成功度合いに応じて、それぞれ一括して支払われるのが通常であったが、多重債務事件などにおいて分割払が励行されるようになったことなどから、契約締結時に着手金を受領し、事件終了後請求書を発行することにより報酬金が受領できるとは限らなくなったのみならず、こうした多重債務事件では、分割払の定めがあっても、実際に弁護士費用を回収することは困難になってきており、こうした事情の下では、弁護士報酬については、現金主義が適用される慣習があるというべきであり、 \n また、そうでなくとも、所得税法３６条１項の解釈において、①金額に対する具体的合意が成立し、②事件が解決し役務の提供が完了し、かつ、③法的手段に訴えて履行を求めることが法律上、社会通念上可能となった場合に初めて、弁護士報酬が「その年において収入すべき金額」に当たるというべきである旨主張する。 \n 【判示(1)】 (2) しかしながら、所得税法は、一暦年を単位としてその期間ごとに課税所得を計算し、課税を行うこととしており、同法３６条１項が、右期間中の総収入金額又は収入金額の計算について、「収入すべき金額による」と定め、「収入した金額による」としていないことからすると、同法は、現実の収入がなくても、その収入の原因たる権利が確定的に発生した場合には、その時点で所得の実現があったものとして、同権利発生の時期の属する年度の課税を計算するという建前（いわゆる権利確定主義）を採用しているものと解される。これは、所得税が、経済的な利得を対象とするものであるから、究極的には実現された収支によってもたらされる所得について課税するのが基本原則であり、ただ、その課税に当たって常に現実収入の時まで課税できないとしたのでは、納税者の恣意を許し、課税の公平を期し難いので、徴税政策上の技術的見地から、収入すべき権利の確定したときをとらえて課税することとしたものであり（最高裁判所昭和４９年３月８日第二小法廷判決民集２８巻２号１８６頁参照）、ここにいう収入の原因となる権利が確定する時期はそれぞれの権利の特質を考慮し決定されるべきものである（最高裁判所昭和５３年２月２４日第二小法廷判決民集３２巻１号４３頁）。 \n そして、弁護士報酬について、原告が上記(1)のとおり主張する内容をもってしては、上記の考え方を採らずに現金主義が適用されるべきであるとまではいえない。原告の当該主張するところは、具体的な検討に当たって、上記の権利が確定する時期がいつになるかという問題において検討されるべきものである。 \n 【判示(2)】 また、国税通則法１５条２項７号は、消費税は、課税資産の譲渡等をした時に納税義務が成立する旨定めており、消費税法２条１項８号によれば、事業として対価を得て行われる役務の提供もここにいう課税資産の譲渡等に含まれるところ、この課税資産の譲渡等が行われた具体的な時期の判断についても、同様に、上記の考え方を踏まえ、課税資産の譲渡による対価や役務の提供による報酬を収受する権利が確定した時点で課税資産の譲渡等があったとすることを原則としつつ、取引の実態に応じて個別的に検討するのが相当である。 \n そこで、以下、弁護士報酬等につき、原告が依頼者から受領した金員の内容に応じて検討することとする。 \n ２ 着手金についてそこで、まず、これを着手金について検討する。 \n (1)ア 被告は、上記着手金の収入計上時期について、以下のとおり主張する。すなわち、所得税基本通達３６－８は、人的役務の提供（請負を除く。）による収入が、 \n その人的役務の提供を完了した日に生ずるものとする一方で、人的役務の提供による報酬を期間の経過又は役務の提供の程度等に応じて収入する特約又は慣習がある場合におけるその期間の経過又は役務の提供の程度等に対応する報酬については、その特約又は慣習によりその収入すべき事由が生じた日とする旨規定している。 \n 本件で問題となっている前記第２の１(2)アの各申告当時における原告の所属する \n Ａ弁護士会の報酬規程によれば、着手金は事件等の依頼を受けたとき支払を受けるものとされており、原告も、依頼者との間で締結する民事事件又は刑事事件等の処理に関する委任契約（以下「受任契約」ともいう。）において、同旨の合意をしている。こうした事情によれば、原告は、受任契約に基づき、受任契約締結時において、依頼者に対して当該委任契約において定められた着手金の全額を請求する権利を確定的に取得する。 \n イ また、被告は、着手金が人的役務の提供の過程において発生するものではなく、 \n 事件等の依頼を受けたときに支払を受ける性質の金員として支払われるものであるから、たとえ分割払特約が付されたとしても、それは単にその支払方法を定めたものにすぎず、委任契約締結時に既に権利が確定しているというべきであるとも主張する。 \n 【判示(3)】 (2) 証拠（乙１、２９）及び弁論の全趣旨によれば、弁護士報酬の種類としては、一般に、法律相談料、書面による鑑定料、着手金、報酬金、手数料、顧問料及び日当があること、このうち、着手金とは、事件又は法律事務（以下「事件等」という。）の性質上、委任事務処理の結果に成功不成功があるものについて、その結果のいかんにかかわらず受任時に受けるべき委任事務処理の対価をいうこと、及び、着手金は、事件等の依頼を受けたときに支払を受けるものであることが認められる。このように、 \n 着手金は、ほかの種類の弁護士報酬と異なり、事件等の結果のいかんにかかわらず、 \n 委任事務処理が開始される前に支払を受けるものであり、その金額も受任時に確定されることによれば、弁護士が依頼者から事件等を受任した時点で収入の原因となる権利が確定するとみるのが自然である。 \n (3) これに対し、原告は、着手金は、事件の受任時に依頼者から支払われるが、その性質は、委任事務処理の対価、すなわち、弁護士としての人的役務の提供の対価であるから、着手金請求権は、事件等の処理という人的役務の提供が完了するまで確定しないとして、着手金が現実に支払われた時点で、収入として計上する慣習があり、また、権利確定主義の解釈としても、着手金が現実に支払われた時点で収入として計上するべきである旨主張し、甲１７６、１８５にはこれにそう部分がある。 \n 【判示(4)】 ア そこでまず、原告のこの主張について検討すると、仮に原告主張のように、着手金は役務の提供があって初めて収入として計上されるとするならば、原告が受領した着手金について、役務の提供が既にあり、収入に計上される分と、役務の提供が未了で、収入に計上されない分に配分しなければならないはずであるが、本件全証拠によっても、このような会計処理が原告のみにとどまらず弁護士一般によって行われている形跡はうかがわれない。 \n また、前記のとおり原告が第一義的に主張するように、着手金について現金主義を採用するならば、着手金が受任契約締結時に一括して支払われたときには、その時点で役務の提供がないにもかかわらず、当該着手金を収入として計上することになり、着手金が人的役務が提供されるまで確定しないという原告の上記主張と相いれないことになってしまう。原告本人の供述には、このような場合には、管理支配基準を採用することになるとする部分があるが、このように複数の基準を適用すべき合理的根拠を見いだすことはできない。 \n さらに、着手金が分割で支払われる場合には、予想される業務進捗状況に対応するように、分割払の日程及び方法を定めることも十分可能であると考えられるが、 \n このような配慮が行われた形跡もうかがわれない。このことに照らすと、着手金について分割払の定めがあったとしても、それは単に着手金の支払方法を定めたものにすぎず、受任時に支払われる金員であるという着手金の本質を変更するものではなく、着手金に係る権利の確定時期を左右するものではないというべきである。 \n こうした事情に照らすと、原告の主張にそうような慣習があるということはできないし、原告の主張のような扱いに合理性があるともいえない。 \n イ なお、この点に関し、原告は、当時のＡ弁護士会報酬規程（甲１２、乙１）４４条１項において、受任契約に基づく事件等の処理が、解任、辞任又は委任事務処理の継続不能により、中途で終了したときは、弁護士は、依頼者との協議の上、委任事務処理の程度に応じて、受領済みの弁護士報酬の全部若しくは一部を返還し、又は弁護士報酬の全部若しくは一部を請求する旨定められていることを指摘する。 \n 【判示(5)】 しかしながら、受任後の事情により、着手金の全部又は一部について返還義務が生じたとしても、それは所得税法の規定に従い、別途処理すれば足りるものであるから、原告指摘の上記事実は、着手金を収入として計上する時期を左右するものでない。 \n また、証拠（甲１１、１６の１・２、１７の１・２、２０の１・２、２８の１・ \n ２、７９の１・２、１１７の１・２並びに甲１４、１５、１８、１９、２１ないし \n ２７、２９ないし３９、４２ないし４９、５１、５３ないし５８、６０、６２、６ \n ４、６５、６７、６８、７０ないし７８、８０ないし８５、８７、８８、９０、９ \n ２ないし９５、９７、１０３、１０４、１０６、１０７、１１０ないし１１６、１ \n １８、１２２ないし１２４、１２６、１３０ないし１３３、１３５、１３６、１３ \n ８、１４０ないし１４２、１４４ないし１４６、１４９ないし１５１、１５３、１ \n ５４、１５６、１５７、１５９、１６３及び１６４のいずれも各枝番１）によれば、 \n 原告が依頼者との間で交わしていた契約書には、「既払いの着手金については、理由の如何を問わず、返還を求めることができない。」との定型文言が記載されていたことが認められる（なお、原告は、平成１６年に自由化されるまでは、弁護士と依頼者との間で弁護士の報酬を勝手に決めることはできず、所属弁護士会の報酬規程に従うことが要請されており、上記定型文言がＡ弁護士会報酬規程に反し無効である旨主張するが、依頼者と及び関係においては、弁護士報酬について同規程を離れて独自の合意をすることに何ら法的な制限はなく、原告が実際に上記契約書を使用して受任契約を締結し、それに当たって何ら留保していた形跡がうかがわれないことからすれば、この主張は、採用の限りではない。）。のみならず、甲１９の２及び１４０の２によれば、原告は、辞任した後に、依頼者との合意により着手金ないし概算実費の一部を返還したことがあることが認められるものの、甲１４の２・３、 \n １８の２・３、２１の２、７０の２・３、１４０の３及び原告本人によれば、原告が中途で事件等に関する委任事務処理を終了した場合であっても、着手金の全部又は一部を返還しなかった例もあることが認められる。これらのことによれば、必ずしも上記規程に従った扱いが慣習となっていたということはできないから上記報酬規程の定めの存在によっても前記(2)の判断を覆すに足りない。 \n ウ さらに、原告は、多重債務者の債務整理の場合には、弁護士に一時金を支払う余裕がない者が多いため、事件終了時までに何回かの分割払を行わざるを得ないことが少なくなくなってきているが、こうした場合、弁護士が受任したことによって債権者からの圧力が一時的にせよなくなると、約束どおりに分割の着手金を支払わなくなる依頼者が少なくなく、分割金が約束どおりに支払われない事態がしばしば起こるが、これらの分割金の支払を求めて、弁護士が依頼者に対し法的手段をとるよう求めることは弁護士の公益的地位にかんがみ相当でなく、破産手続により免責が認められた場合には法的にも取り立ては不能となり、弁護士がこれを貸倒れ処理をすることも現実的には困難であるとして、債務整理事案等で着手金の支払が分割で行われる場合には、分割金が現実に支払われた時点で、収入として計上されるべきである旨主張し、甲１０、１８０、１８４、１８５ないし１８７及び１９１ないし \n １９４、乙２１並びに原告本人には、これにそう部分がある。そして、原告は、このような観点は、多重債務者などの貧困者に対する司法アクセスを確保するため、 \n 極めて重要なことであると位置づけて主張している。 \n しかしながら、着手金を任意に支払うかどうかは当該依頼者の個人的な属性によるところが大きく、多重債務者の債務整理の場合であっても、一概に着手金が任意に支払われないと言い切ることはできない。のみならず、権利確定主義の下では一般に、一定額の金銭の支払を目的とする債権は、その現実の支払がされる以前に当該支払があったのと同様に課税されることとなり（換言すれば、権利確定主義の下において金銭債権の確定的発生の時期を基準として所得税を賦課徴収するのは、実質的には、いわば未必所得に対する租税の前納的性格を有するものである。）、課税後に至りその債権が貸倒れ等によって回収不能となった場合には、所得税法５２条 \n ２項などによって、これを是正することは、当然に想定されているものである。また、取引先に対し支払の催告や請求等を行うことは、事業者の債権管理として当然に想定される内容であり、弁護士の活動が公益的な性格を有するとしても、一般の事業者と同様に債権管理を行うことは、その方法において相応の配慮があってしかるべきであるとはいえ、やむを得ないことに照らせば、多重債務整理事件で依頼者が着手金を任意に支払わない可能性がほかの受任事件に比べ一般的に高いと予想されるとしても、前記(2)の判断を左右するに足りない。なお、後記４(4)イのとおり、実際、原告は、免責決定後、依頼者に対し、未収着手金を請求し回収しているところであり、以上のように考えることが、本件の具体的事案を離れて、原告が主張するように、直ちに貧困者の司法アクセスを確保できなくするということに繋がるということもできない。 \n 【判示(6)】 (4) 以上によれば、着手金請求権は、受任時において確定したというべきである。したがって、着手金は、事件等の処理について委任契約が締結された日の属する年の収入に計上すべきものと解するのが相当である。また、消費税についても、事件等の処理について委任契約が締結された日の属する期間に資産の譲渡等があったとみることができると解するのが相当である。 \n ３ 概算実費について原告は、破産免責申立事件等において、受任時に概算実費の支払を受けているところ、 \n 原告本人及び弁論の全趣旨によれば、これは、通常の郵券、交通費、送料等に充てることが想定される金員で、事件終了後清算を予定されていないものであることが認められる。 \n 【判示(7)】 原告は、これについても、着手金と同様に、現実の支払があった時点で収入として計上すべきである旨主張するが、同金員の支払が委任契約において合意され、かつ、事件終了後清算を予定されていないことにかんがみると、その内容は、委任契約において確定するというべきであるから、受任時に収入として計上し、また、同時点で資産の譲渡等があったと解するのが相当である。 \n ４ 報酬金について \n (1) 被告は、報酬金について、原告が受任契約上、依頼者との間で、依頼者は事件が終了した時に、Ａ弁護士会報酬規程に基づいて原告が依頼者に請求する金額を報酬金として支払う旨の合意をしていることから、受任契約に基づき、当該事件の処理が終了した後、原告が同報酬規程に基づいて依頼者に報酬金を請求した時に、当該請求額の報酬金請求権を確定的に取得するというべきであり、権利確定主義に照らして、その金額は、当該請求の日の属する年分の収入金額に算入されるべきである旨主張する。 \n (2) そして、証拠（乙１、２９）及び弁論の全趣旨によれば、弁護士の報酬のうち、 \n 報酬金は事件等の性質上、委任事務処理の結果に成功不成功があるものについて、その成功の程度に応じて受ける委任事務処理の対価をいい、事件等の処理が終了したときに、それぞれ支払を受けるものとされており、その額は、委任事務処理により確保した経済的利益の額をそれぞれ基準として算定することが原則とされていることが認められる。 \n このことによれば、報酬金請求権は、委任事務処理が終了し、原告が依頼者に対し報酬金を請求した時に、権利として確定するというべきである。 \n (3) 原告は、報酬金は、成功結果が得られない限り取得できない報酬であり、通常の場合、事件を着手する段階では確定しておらず、しかも、多くの場合には「Ａ弁護士会規程に基づく額」、「Ａ弁護士会の報酬規程に基づいて乙（弁護士）が甲に請求する金額」などの抽象的な定めしかなく、事件が終了したからといって直ちに金額が自動的に確定するものではないため、事件完結時において、弁護士と依頼者との間で、事件の難易、経済的利益、労力の程度、依頼者との関係等を踏まえ、成功結果の評価を巡り報酬内容を確定するための協議が必要であり（なお、弁護士から請求書を発信したというだけでは報酬金額に関する合意が成立したということはできない。）、報酬金額に関する合意が成立しない限り、報酬金債権が確定したといえない旨主張する。 \n しかしながら、証拠（甲１１ないし１３、１６の１・２、１７の１・２、２０の１・ \n ２、２８の２、７９の１・２並びに甲１４、１５、１８、１９、２１、２２、２４、 \n ２５、２７、３３、３５ないし３７、３９ないし４４、４７ないし４９、５１、５３ないし５６、６２ないし６５、６７、６８、７０、７２ないし７８、８０ないし８５、 \n ８８、９２ないし９４、９７、１０１、１０３、１０４、１０６、１０７、１０９、 \n １２６ないし１２８、１３０ないし１３３、１３５ないし１３７、１４０、１４２、 \n １４４ないし１４６、１４９及び１５０のいずれも各枝番１）によれば、平成１３年から１４年にかけての当時、各単位弁護士会において報酬規程を定め、その中で、報酬金の原則的な算定方法を定めており、原告と依頼者との契約で同規程を引用していたことが認められる。このことと、前記(1)のとおり、報酬金は委任事務処理の成功の程度に応じて、同事務処理により確保した経済的利益の額を基準として算定されるものであり、受任時にあらかじめ具体的な金額を定めることが性質上困難であることを併せ考慮すると、受任契約に報酬金額として具体的な金額を明示していなかったとしても、当事者間には報酬金額を上記算定方法に従って決められた相当額にする旨の合意があるというべきであり、したがって、報酬金請求権の内容は、委任事務処理が終了し、弁護士が依頼者に対し報酬金を請求した時点で確定されたものと考えられる。 \n さらに、①原告が依頼者との間で締結した委任契約において、委任事務処理終了後報酬金について改めて協議する旨の文言がなく、かえって、報酬金額をＡ弁護士会報酬規程に基づいて原告が依頼者に請求する金額とすることを想定している定型文言が記載された契約書があること（前段落掲記の甲号各証。ただし、甲１３、４０の１、 \n ４１の１、６３の１、１０９の１及び１３７の１を除く。）、②原告が、依頼者に送付した請求書に記載された金額が原告の希望にすぎず、この点について改めて合意する予定であることことを依頼者に説明した形跡がうかがわれないこと及び③原告が一部の報酬金を預り金債務と相殺する旨の意思表示をしているところ（甲３３、４９、 \n ５６、９０、９３、１００、１０１、１２６、１４５、１４７、１５０、１５９、乙 \n １０（いずれも枝番を含む。）など）、これが、報酬金に関する依頼者との間の何らかの合意に基づくものであったと認めるに足りる証拠がないこと等の事情によれば、原告としても、当時、委任事務処理の終了後合意がなくとも報酬請求権が権利として確定したものとして取り扱っていたと推認できるのであるから、原告の上記主張は採用できない。 \n (4) また、原告は、多重債務者の整理事件の場合、弁護士は、成功報酬の分割収受を認めているが、法的手続が採られ、債権者からの追及を受けなくなると、弁護士報酬も支払わなくなる依頼者が少なくなく、分割金が約束どおりに支払われない事態がしばしば起こるが、これらの報酬金の支払を求めて、弁護士が依頼者に対し法的手段をとるよう求めることは弁護士の公益的地位にかんがみ相当でなく、弁護士がこれを貸倒れ処理をすることも現実的には困難であるとして、人的役務の提供が完了し、報酬金額の合意がされていたとしても、現実の回収がされるまでは、報酬金について、権利が確定したということはできない旨主張する。そして、ここでも、原告は、このような観点は、多重債務者などの貧困者に対する司法アクセスを確保するため、極めて重要なことであると位置づけて主張している。 \n ア しかしながら、まず、仮に依頼者の任意の弁済が見込めないことがあるとしても、 \n 前記１(2)のとおり、権利確定主義の下では一般に、一定額の金銭の支払を目的とする債権は、その現実の支払がされる以前に右支払があったのと同様に課税され、 \n 課税後に至りその債権が貸倒れ等によって回収不能となった場合には、別途対応することが予定されているのであるから、直ちに、現実の入金がないと権利が確定しないということはできない。のみならず、前記２(3)ウと同様に、弁護士報酬金を任意に支払うかどうかは当該依頼者の個人的な属性によるところが大きいのであり、こうした依頼者の不確定な属性を基準として権利確定時期を決することは、恣意的な運用を招くおそれがあり、相当でない。 \n イ(ア) 次に、免責申立事件の委任契約について検討するに、免責申立事件においては免責決定が確定し、同手続が終了することによって、委任事務処理が終了し、 \n 報酬金請求権が発生すると考えられる。証拠（甲１１、１３、１７の１・２、２ \n ０の２、２８の２、７９の１・２並びに甲１４、１５、１８、１９、２２、２３、 \n ２５ないし２７、２９、３０、３５ないし３７、３９ないし４４、４７、４８、 \n ５０、５３、５５ないし５９、６１ないし７８、８１、８３ないし８６、８８、 \n ８９、９１、９２、１０４、１０６、１０９ないし１１６、１１８ないし１２５、 \n １３０ないし１３２、１３５ないし１３８、１４１、１４３、１４４、１４６、 \n １４９、１５１、１５２、１５４、１５６ないし１５９、１６４のいずれも各枝番１）によれば、原告と依頼者との間で、免責申立事件が終了したとき、又は免責決定が得られたときに報酬金を支払うものとする旨合意しているものがあることが認められるところ、こうした合意も、上記検討でみたところと同趣旨のものと解される。 \n (イ) そして、証拠（甲１０４、１０６、１０９ないし１１６、１１８ないし１２ \n ５、１３２、１３８、１４６、１４９、１５１、１５２、１５４、１５６、１５ \n ９（いずれも枝番を含む。））によれば、原告は免責決定後、依頼者に対し、報酬金を請求していること（なお、甲１２２の３及び１５１の５では概算実費の未収分を、また、甲１５４の４では着手金の未収分を、それぞれ併せて請求している。）、 \n その際に、原告に対する報酬金債務についても免責された旨の説明がされた形跡がないこと、かえって、決定正本がないと免責の効力は生じないなどと記載した上で、原本正本類は全額入金後返却する旨通知していること（甲１４９の４、１ \n ５１の５、原告本人など）に照らすと、原告としても、当時、免責申立事件に係る報酬金請求権が、免責決定により回収不能となるとは扱っていなかったものと推認することができる。 \n (ウ) さらに、原告は、免責申立事件を受任した場合について、免責決定の効果によって、報酬金が法律的にも回収不能となる旨主張するものの、証拠（甲２０、 \n ９４、１１１、１１９、１２０、１２３、１２４、１５２、１５３、１９１）によれば、原告が本件で回収不能であると主張している報酬金請求権のうち、現実には回収されているものがあることが認められる。 \n なお、この点に関し、原告は甲１１１の２、１１９の２、１２０の２、１２３の２、１２４の２及び１５２の２は、入金管理のためのメモとして入力していたパソコンのデータであるが、必ずしもすべての入金が入力されているわけではなく、誤った入力が修正されていない部分もあり、信用性がない旨主張し、甲１７ \n ７及び１９１にはこれにそう部分がある。しかしながら、上記データは、甲１１ \n １の６（元帳）と一致する記載があり、また、入金日付が不定期であったり、入金額に変動があり、具体性に富むものである。さらに、乙３によれば、原告が依頼者に発出した請求書は、このパソコンデータ及びそれを扱うプログラムを利用して作成されたことが認められる。こうした事情にかんがみると、同パソコンデ \n ータは、誤記や不正確な点がある可能性を完全には否定できないものの、ほかにその信用性を否定する明確な証拠のない限り、信用性を認めることができる。そして、上記のものに関する限りは、各記載内容についても信用性を疑うべき具体的な事情はうかがわれない。 \n ウ こうした事情によれば、原告の前記冒頭の主張は採用できず、以上のように考えることが、本件の具体的事案を離れて、原告が主張するように、直ちに貧困者の司法アクセスを確保できなくするということに繋がるということもできないのは、前記着手金の場合と同様である。 \n 【判示(8)】 (5) 以上によれば、報酬金請求権は、委任事務処理が終了した時点（委任契約に、原告が請求した時とする特約がある場合には、請求があったとき）に権利が確定するというべきであるから、当該時点の属する年の収入に計上すべきものと解するのが相当である。また、消費税に関しても、同時点の属する期間に資産等の譲渡があったと解するのが相当である。 \n ５ 以上を踏まえ、当事者に争いのある収入の有無又は金額について、収入の類型や依頼者ごとに検討することとする。 \n (1) 着手金及び概算実費ア 前記２及び３の検討によれば、着手金請求権及び概算実費請求権は、受任時に権利として確定したというべきであるから、各受任の日の属する年の収入として計上すべきである。 \n イ これに対し、原告は、別紙６（平成１３年分）の番号２、１２、１７、１９、２ \n ５、４１、４４、６１、６７、７３、７５、７６、７８、９４、９８、１０１、１ \n １１、１１４、１１６、１１９、１２３、１３０、１３８、１４１、１５１、１５ \n ２、１５５、１６７、１７４、１８５、１９１、２０７、２３７、２３８、２４２、 \n ２４３、２６１、２６２、２６４、２６９、別紙７（平成１４年分）の番号１５、 \n １６、２５、２９、３４、３９、４１、４７、４８、５３、５４、６８、７２、７ \n ３、７７、９５、９６、１０９、１１０、１１８、１２６、１３２、１５１、１５ \n ６、１６４、１７７、１７８、１９５、２００、２０２、２０３、２１９、２２２、 \n ２２４、２３５、２３８、２４０、２８４、２８８、２９２、２９３、２９５、３ \n ０７、３２７、３３０、３４０の各依頼者について、免責決定が当該年になされなかったことから、役務の提供が完了していないとして、各年に着手金報酬請求権の全額について、権利が確定したことを争うが、前記２のとおり、採用できない。 \n 【判示(9)】 ウ また、原告は、別紙６の番号２５０（乙）及び別紙７の番号３４３（丙。ただし、 \n 着手金のうち１１万５０００円）の各依頼者について、着手金が回収不能であるとして、これらの着手金を各年の収入に計上すべきでない旨主張するが、前記２(3)ウのとおり、これらの着手金請求権は権利として確定しており、その後、仮に回収が困難になったとしても、このことは、着手金請求権の権利確定を左右しない（ちなみに、原告の主張によれば、原告は、平成１８年に前者の着手金を全額回収し終わっている。）。 \n エ 以下の依頼者との関係では、原告との委任契約が委任事務処理の途中で終了し、 \n 又は変更されたことが認められるので、個別に検討するが、いずれについても、以下に述べる各理由によって、前記アの判断を左右するものではない。 \n (ア) 別紙６の番号１９（丁。甲１８の３）、１１４（戊。甲１４の３）、別紙７の番号３４０（Ｂ。甲７０の３）について掲記の証拠によれば、原告は、上記各依頼者との間の委任契約を中途で解約していることが認められるが、原告が各依頼者に対し、着手金の全部又は一部を返還した形跡はうかがわれない。 \n (イ) 別紙６の番号６７（Ｃ、Ｄ）について甲１７の４・５によれば、原告が平成１３年３月７日付けで委任契約を締結したが、平成１７年７月２７日にこれを合意解除し、既受領の着手金について返還義務を負わない旨合意したことが認められる。しかしながら、着手金請求権は、 \n 受任時にその権利が確定するのであるから、その後の課税期間において、減額の合意ないし受領した金員の一部返還があったとしても関係はない。なお、これらの依頼者については、着手金の一部しか支払われていないことが認められるが、 \n 同着手金請求権は受任時に確定したというべきであるから、このことは、着手金請求権の権利確定の事実を左右するものではない。 \n (ウ) 別紙６の番号１０１（Ｅ）、２６４（Ｆ）、別紙７の番号１７８（Ｇ）について \n 甲１９の１～３によれば、原告がＥとの間で、平成１３年３月１３日付けで委任契約を締結したが、平成１５年４月２日にこれを合意解除し、着手金及び概算実費の半額を返還する旨合意したことが認められる。また、甲１４０の１～３によれば、原告がＦとの間で、平成１３年５月２８日付で委任契約を締結したが、 \n 同年８月２４日付けで辞任予告通知をし、その後、同人に対し９万９６８５円（振込手数料３１５円別）を送金したことが認められる（ただし、本件全証拠によっても、同送金が本件で問題となっている平成１３年又は１４年に行われた形跡はうかがわれないので、同送金分を平成１３年又は平成１４年の収入から控除することは相当でない。）。さらに、甲７３の１・３・５によれば、原告がＧとの間で、 \n 平成１４年１１月６日付けで委任契約を締結したが、平成１７年５月１０日付けで、辞任通知を発出し、かつ、着手金１０万円を返還したことが認められる。しかしながら、着手金請求権は、受任時にその権利が確定するのであるから、その後の課税期間において、減額の合意ないし受領した金員の一部返還があったとしても関係はない。 \n (エ) 原別紙６の番号７３（Ｈ）について原告は、着手金を減額する旨の合意があったと主張する。 \n ａ この点について、甲２６の１～４によれば、原告と、Ｈ及び有限会社Ｉは、 \n 平成１３年６月１２日付けで、着手金を１７８万５０００円、概算実費３０万円とする約定で有限会社Ｉの破産事件と、Ｈの破産免責申立事件に関する委任契約を締結し、原告は、これに基づき、同日付けで、Ｈ及び有限会社Ｉの債権者に対し、受任通知を発出し、平成１５年８月４日、Ｈに対する免責決定がされたこと及び平成１４年１１月２２日までに、上記着手金のうち合計１１６万５０００円が支払われたことが認められる。 \n ｂ 原告は、こうした事実関係の下で、平成１４年５月２９日、上記着手金が１ \n ２６万円に、また、上記概算実費が１０万円に減額することが合意された旨主張し、原告の入金管理のメモであるパソコンデータである甲２６の２には、これにそう部分がある。 \n しかしながら、証拠（甲２０の３、７１の２、１３３の２、１４５の２、１５ \n ５の３、１６０の２、乙２ないし４、１０、１１、１５、１７）によれば、同パソコンデータには、本件における処分後に、原告の主張する事実関係にそうよう加除訂正された部分があることが認められ、上記原告の主張にそう甲２６の２の記載も同様に修正された可能性が否定できないので、これによって、原告の上記主張事実を認めるには足りず、ほかに原告の上記主張を認めるに足りる証拠はない。 \n (オ) 別紙７の番号３０７（Ｊ）について原告は、上記Ｊの着手金が当初２１万円、概算実費５万円と合意されていたのが、平成１５年４月１０日、概算実費を２万円に減額する旨合意された旨主張するが、仮にこのような合意があったとしても、概算実費請求権は、受任時にその権利が確定するのであるから、その後に、減額の合意があったとしても関係はない。 \n オ 別紙６の番号１０（Ｋ）、５１（Ｌ）について被告は、原告と上記各依頼者との間に委任契約が成立した旨主張し、甲１３５の \n １には被告の主張にそう記載がある。 \n しかしながら、証拠（甲１３３の１～３、乙４）及び弁論の全趣旨によれば、Ｋと原告は、平成１３年６月ころ、契約解除交渉事件の委任契約の締結について協議し、原告は委任契約書を作成し、着手金１６万８０００円及び概算実費１万円の入金予定がある旨アクセスデータに記入したが、Ｋは上記着手金及び概算実費を支払わず、契約書に署名しないままこれを原告に返送したことが認められ、これらの事実によれば、Ｋと原告との間に、委任契約が成立しなかったことが認められる。そうすると、原告に上記着手金及び概算実費相当の入金があったということはできない。 \n また、甲１３５の１～３によれば、Ｌと原告は、平成１３年１０月２２日付けで、 \n 着手金を３１万５０００円（同年１０月末日限り１０万円、同年１１月１５日限り \n １０万円、同月末日限り１０万円、同年１２月１５日限り１万５０００円を支払う。）、概算実費５万円（同年１２月１５日限り支払う。）との約定で、Ｌの破産免責事件について委任契約を締結したが、着手金の支払がなかったことから、平成１ \n ４年５月２０日、原告がＬに対し、上記契約は不成立ということで処理する旨通知したことが認められる。そうすると、原告に上記着手金及び概算実費相当の入金があったということはできない。 \n これらの事実によれば、これらの者に関する着手金請求権及び概算実費請求権はないとみるべきである。 \n (2) 報酬金ア 前記４のとおり、原告の報酬金請求権は、委任事務処理終了時に発生し、原告が依頼者に対し報酬金を請求した時にその権利が確定する。 \n イ 原告は、別紙６の番号５、６４、１６６、１８４及び別紙７の番号３、１１、３ \n ８、１００、１１１、１６２、１８３、２３１、２３２、２４２、２４７ないし２ \n ４９、２７２、３２９の各依頼者については、報酬金について具体的な合意がなかったとして、報酬金を当該年の収入に計上することを争うが、前記４のとおり、報酬金請求権が権利として確定するために、委任事務処理の終了後に改めて報酬金について合意することは必要でないので、採用できない。 \n 【判示(10)】 ウ また、原告は、別紙６の番号３８、１２５、２１９、２４８及び別紙７の番号４ \n ６、６９、７６、９０、１１７、１２９、１５５、１８５、１８８、２８６、２９ \n ７、３１４、３２１、３３１、３４３の各依頼者について、報酬金が回収不能であるとして、これらの報酬金を請求した各年の収入に計上すべきでない旨主張する。 \n しかしながら、前記４のとおり、これらの報酬金請求権は権利として確定しており、 \n その後、仮に回収が困難になったとしても、このことは、報酬金請求権の権利確定を左右しない。 \n (3) その他ア 別紙６の番号１８（Ｍ）について被告は、原告がＭに係る地代供託の件について、平成１３年６月２２日、供託手数料３万２０００円、交通費１万６９５０円及び消費税１６００円合計５万０５５ \n ０円を、同年１２月２８日に、供託手数料３万２０００円、交通費１万７１５０円及び消費税１６００円の合計５万０７５０円を各請求したことから、平成１３年には、上記依頼者に関し、合計１０万１３００円の収入がある旨主張する。 \n これに対し、原告は、上記交通費はいずれも委任事務処理費用として支出された実額であり、概算実費と異なり原告の収入とされるべきものではない旨主張し、また、平成１３年６月２２日の交通費が１万６９５０円とされたのは誤記であり、実際には１万６６９０円であった（過払い分２６０円は供託金手数料額３万３６００円（消費税相当額を含む。）に加算して申告した。）旨主張する。 \n そこで検討するに、証拠（甲１３４の１～６、乙１１、３０）によれば、原告は、 \n いずれも「地代供託の件」について、平成１３年６月２２日、供託手数料３万２０ \n ００円、交通費１万６９５０円及び消費税１６００円合計５万０５５０円を請求したところ、同月２６日、報酬（消費税相当額を含む。）として３万３６００円、交通費として１万６６９０円、更に「売上実費収入繰」として扱われた２６０円合計 \n ５万０５５０円の支払を受けたこと、同年１２月２８日、供託手数料３万２０００円、交通費１万７１５０円及び消費税１６００円の合計５万０７５０円を各請求し、 \n 平成１４年１月８日、報酬３万３６００円（消費税相当額を含む。）及び交通費１万７１５０円の支払を受けたことが認められる。 \n そして、本件が地代供託に係る事務処理の委任であり、概算実費を受け取る必要性が必ずしも認められないこと、その名目が「概算実費」でなく、単に「交通費」 \n とされていること、及び、その請求が委任事務処理後に行われていることによれば、 \n 上記「交通費」は交通費の実額の補てんを求めたものと解される。そして、こうした交通費の実費は、委任事務処理費用として、委任者が負担すべきものであるので、 \n これを受任者である原告の収入とみるべきではない。 \n そうすると、Ｍに係る原告の平成１３年の収入は、３万３８６０円及び３万３６ \n ００円の合計６万７４６０円であるというべきである。 \n イ 別紙６の番号９６（Ｎ）及び９７（Ｏ）について原告は、平成１３年、Ｎについて収入がなく、Ｏについて４７万円の収入があった旨主張し、乙５の１～３（原告の元帳）にはこれにそう部分がある。これに対し、 \n 被告は、Ｎについて４７万円の収入があり、Ｏについては収入がない旨主張する。 \n そこで検討するに、甲１３６の１によれば、ＯはＮを代理して、原告と委任契約を締結し、報酬を支払ったことが認められるので、被告の主張どおり、Ｎについて \n ４７万円の収入があり、Ｏについては、収入がなかったことが認められる。 \n ウ 別紙６の番号２３２（Ｐ協会Ｑ）について被告は、着手金１７万８５００円と概算実費２万円の約定があり、これに基づき、 \n 平成１３年、原告に合計１９万８５００円の収入があった旨主張する。これに対し、 \n 原告は、上記２万円は概算実費でなく、一般民事の預り金、すなわち実費の預り金であり、概算実費と異なり、原告の収入に当たらない旨主張する。 \n そこで検討するに、甲１３９の１～３によれば、Ｑと原告は、平成１３年８月８日、着手金１７万８５００円、「実費等」２万円の約定で、Ｑの不当利得返還請求事件について委任契約を締結し、同月３１日、Ｐ協会からこれらの金員相当額が支払われたことが認められるが、本件全証拠によっても、上記実費の内訳が明らかにされ、精算された形跡はうかがわれないので、上記２万円を実費の預り金とみることはできず、これは、原告の収入に当たるというべきである。 \n エ 別紙７の番号２０（Ｍ）について被告は、平成１４年６月２５日に手数料３万３６００円及び交通費１万７１５０円（合計５万０７５０円）を請求し、また、平成１５年１月９日、Ｍから５万０７ \n ５０円の入金を受けており、これは、原告が平成１４年中にＭに対し請求したものであるから、原告の平成１４年の収入に当たる旨主張する（合計１０万１５００円）。 \n これに対し、原告は、上記交通費はいずれも実費であり、原告の収入とされるべきではない旨主張するとともに、平成１５年１月９日に入金された５万０７５０円は、同月６日に請求したものであり、平成１４年中に同金員に関し、権利が確定していなかった旨主張する。 \n そこで検討するに、証拠（甲１５５の１・３、乙１２）に加え、報酬金請求権は、 \n 委任事務処理終了時に発生し、原告が請求した時にその権利が確定することによれば、原告はＭから受任した地代の供託に関する事務について、交通費の実額を請求する扱いをしていたことが認められ、このことによれば、上記交通費も概算実費でなく、委任事務処理費用の実費であるというべきであるから、これを原告の収入ということはできない。 \n また、乙１２によれば、原告は平成１４年１２月２２日、Ｍの委任事務処理に関し、旅費交通費１万６８９０円を支出したことが認められ、また、同月２５日、同人の預り金実費勘定から２６万３５２０円の出金があったことが認められる。これによれば、原告は同月２２日ないし２５日ころ、Ｍから受任した地代供託の事務を行ったと推認される。そして、甲１５５の３・４に原告が平成１５年１月６日、Ｍに対し、報酬として３万２０００円（消費税相当額別）を請求した旨の記載があること及び本件全証拠によっても、平成１４年１２月２２日ないし２５日ころから上記入金があった平成１５年１月９日までの間に、原告がほかにＭのための業務を行った形跡がないことによれば、上記平成１４年１２月２２日ないし２５日ころに行われた業務に係る報酬金が確定したのは、平成１５年１月６日であることが認められ、これを覆すに足りる証拠はない。そうすると、上記報酬金３万２０００円（消費税相当額込みで３万３６００円）についても、原告の平成１４年の収入に計上することはできない。 \n したがって、原告の上記依頼者に係る平成１４年の収入は、５万０７５０円（１ \n ０万１５００円－１万７１５０円－３万３６００円）となる。 \n オ 別紙７の番号３３Ｒについて被告は、平成１４年中の報酬が１０万５０００円あった旨主張し、原告は、同年中に支払のあった９万円に限り、収入があった旨主張する。 \n そこで検討するに、証拠（甲１５６の１～４、乙２６）によれば、Ｒと原告は、 \n 平成１２年１０月２０日付けで、報酬金１０万５０００円を免責決定時に支払う約定で、Ｒの破産免責事件について委任契約を締結したこと、平成１４年５月２９日、 \n Ｒに対する免責決定がされたこと、上記報酬のうち、１万５０００円については、 \n 同年５月３１日、Ｒからの預り金より充当する方法で弁済され、残額９万円については、同年７月から１１月にかけて支払われたことが認められる。 \n これによれば、上記依頼者に係る原告の平成１４年の収入は１０万５０００円となる。 \n カ 別紙７の番号１２８（Ｓ）及び１２９（Ｓ）について原告本人の陳述書（甲１９１）において、被告は番号１２８と番号１２９の受任事件を混同しており、番号１２８の収入額として被告が主張すべき金額は、２４万円ではなく、２１万１９９０円（着手金２１万円と実費収入組入分１９９０円の合計額）であるとする部分がある。 \n 証拠（甲１５３の１～６、乙２０、３０（平成１４年１月２２日欄））によれば、 \n 原告は、平成１３年５月９日、Ｓとの間で、報酬金３１万５０００円の約定で、同人の民事再生申立事件を受任し、平成１４年２月２７日、同人に対する再生計画が認可されたこと、同受任契約によれば、報酬金は一括払いの約定であったが、Ｓは、 \n これを平成１４年５月から平成１５年２月まで１か月３万円ずつ及び同年３月に \n １万５０００円の分割で支払ったこと並びに平成１４年１月２２日、同人との間で、 \n 同人の建築請負契約に関する示談解決事件について、実費預り金として１万円、着手金として２１万円の支払を受けたことが認められる。これらのことに照らすと、 \n 番号１２８の欄に記載されるべき金額は、上記建築請負契約に関する示談解決事件に係る着手金２１万円及び原告が自認する実費収入組入分１９９０円の合計２１万１９９０円であるというべきである。 \n キ 別紙７の番号２３０（Ｔ）について被告は、原告が平成１４年７月５日、着手金として２６万５０００円を請求したとし、同額が平成１４年の収入に当たる旨主張し、乙１５にはこれにそう部分がある。原告は、同金額は、本来２５万円及びこれに対する消費税相当額の合計２６万 \n ２５００円の誤記であった旨主張する。 \n 甲１６０の１によれば、原告の事務員は、Ｔとの間で、平成１４年７月５日、着手金を２５万円及びこれに対する消費税相当額とすることを電話で確認した旨の記載があり、これによれば、上記依頼者に係る原告の平成１４年の収入は、２６万 \n ２５００円であることが認められる。乙１５は、原告の入金管理のためのメモであり、その性質上誤記がある可能性が否定できないので、この認定を覆すに足りない。 \n ク 別紙７の番号２７３（Ｕ）に係る報酬金について被告はこれが１０万５０００円であった旨主張するのに対し、原告はこれが９万円にとどまる旨主張する。 \n 証拠（甲１６４の１～４、乙２７、３０）によれば、Ｕと原告は、平成１３年３月１日付けで、報酬金１０万円を免責決定時に支払う約定で、Ｕの破産事件について委任契約を締結したこと、平成１４年５月２９日、Ｕに対する免責決定がされたこと、上記報酬のうち６万円が同年６月３日までに支払われ、４万５０００円が、 \n 同月から同年１０月にかけて分割で支払われたことが認められる。これらによれば、 \n Ｕに係る報酬金は１０万５０００円であることが認められる。 \n ケ 別紙７の番号２７６（Ｖ）について被告は、原告が、Ｖに係る準強制わいせつ事件について、平成１４年６月１２日、 \n 同人に対し、手数料６万円を請求し、同年４月４日、着手金５６万円を請求した旨主張する。 \n これに対し、原告は、上記手数料６万円は、別紙７の番号２５７の１４万８００ \n ０円に別途計上されており（合計１２万円から１割を源泉徴収した額である１０万 \n ８０００円に通訳費用相当額４万円を加算した額）、改めて収入として計上すべきではない旨主張する。 \n そこで検討するに、証拠（甲１６５の１～４、乙１６、３０、原告本人）及び弁論の全趣旨によれば、上記事件は、当初私選弁護であったが、後にＰ協会の法律扶助を求めるに至った事件であったこと、原告は、平成１４年４月４日、着手金として５６万円の支払を受けたこと、Ｐ協会は同年５月３０日、報酬金として１２万円、 \n 通訳費用として４万円の支給決定をし、同年６月１１日、原告に対し、１４万８０ \n ００円を支払ったこと及び原告が同月１２日、このうち５万４０００円を報酬金として計上し、同月１３日、同事件における弁護を共同して受任したＺ弁護士に９万 \n ４０００円を送金したことが認められる。これらの事情に加え、Ｚ弁護士への送金日に近接した時期にほかにＰ協会からの入金がないことによれば、別紙７の番号２ \n ５７に記載された１４万８０００円は、上記支給決定によるものであることが推認され、これを覆すに足りる証拠はない。したがって、上記報酬金６万円のうち、５万４０００円は、別紙２の番号２５７に記載された金員に含まれるものというべきである（上記６万円の残額６０００円は、源泉徴収された金額に相当するが、Ｐ協会からの支払が原告に対するものであることからすると、上記源泉徴収も原告について行われたものであると推認され、これを覆すに足りる証拠はないから、上記６ \n ０００円は原告の収入とみるほかない。）。 \n 以上によれば、別紙７の番号２７６の項目で計上されるべき原告の収入は、６万円から上記５万４０００円を控除した残額の６０００円に、着手金として支払を受けた５６万円の合計５６万６０００円ということになる。 \n コ 別紙６の番号７８（Ｗ）に係る着手金及び概算実費について被告は、当初、上記着手金等を９４万円と主張していたが、その後、これを９９万２５００円と訂正したので、この点につき検討する。 \n 甲２２の１によれば、原告とＷは、平成１３年４月２４日、Ｗ及び株式会社Ｘの破産免責申立事件について、着手金を８４万円、概算実費を１０万円とする委任契約を締結したことが認められる。また、証拠（甲２２の２、乙２５）及び弁論の全趣旨によれば、原告とＷは、平成１３年中に、Ｗの母の任意整理事件について、着手金５万２５００円の約定で委任契約を締結したことが認められる。これらの事情によれば、原告の上記依頼者に係る平成１３年の収入は、被告の上記訂正後の主張のとおり、９９万２５００円であることが認められる。 \n ６ 以上によれば、原告の事業所得における総収入金額は、平成１３年においては別紙６のとおり、１億０６９５万１２１２円となり、平成１４年においては、別紙７のとおり、 \n １億０１５８万９６１３円となるから、これらの点に関する被告の主張は、これらの金額の限度で理由があり、その余については理由がない。 \n しかしながら、原告が納付すべき所得税額は、別紙８のとおり、平成１３年には１１ \n １７万３４００円となり、平成１４年には△１５９万３６００円となる。これは、本件各所得税更正処分（平成１７年３月１４日付けの裁決により一部取り消された後のもの。 \n 以下同じ。）による原告の所得税の納付すべき税額又は還付金の額に相当する所得税の額を、平成１３年分（更正処分による納付すべき所得税額は１１０７万１３００円）、 \n 平成１４年分（更正処分による納付すべき所得税額は△１６８万２０００円）のいずれについても上回るから、本件各所得税更正処分はいずれも適法である。 \n 同様に、原告の本件係争各年分の消費税等の額は、別紙８のとおり、平成１３年課税期間については、２４０万０５００円となり、平成１４年課税期間については、２３万 \n ０５００円となり、いずれも本件各消費税等更正処分（平成１７年３月１４日付けの裁決により一部取り消された後のもの。以下同じ。）による原告の納付すべき消費税等の額を上回るから、本件各消費税等更正処分はいずれも適法である。さらに、本件各賦課決定処分についても、国税通則法６５条４項に規定する正当な理由があった旨の具体的な主張も立証もないことから、いずれも適法であるというべきである。 \n ７ よって、原告の請求はいずれも理由がないから、これらを棄却することとし、訴訟費用の負担について、行政事件訴訟法７条、民事訴訟法６１条を適用して、主文のとおり判決する。 \n 東京地方裁判所民事第２部裁判長裁判官 大門 匡裁判官 奩田 徹裁判官 倉澤 守春 \n （別紙１） \n （所得税関係計算書） \n 区分 \n 年平成12年分 平成13年分 平成14年分項目総所得金額 17,523,934 46,229,304 30,945,567事業所得の金額 8,231,906 33,346,680 15,262,406内 不動産所得の金額 △579,970 1,614,624 4,227,590訳 配当所得の金額 200,000 200,000 200,984 確定 \n 給与所得の金額 9,671,998 11,068,000 11,254,587申 \n 告 所得控除の合計額 2,045,942 2,008,770 2,009,370課税総所得金額 15,477,000 44,220,000 28,936,000配当控除額 10,000 － 10,049納付すべき税額 △858,208 9,069,200 △2,850,500総所得金額 18,449,555 52,674,644 34,496,962事業所得の金額 9,157,527 39,792,020 18,813,801内 不動産所得の金額 △579,970 1,614,624 4,227,590訳 配当所得の金額 200,000 200,000 200,984 更正 \n 給与所得の金額 9,671,998 11,068,000 11,254,587処 \n 分 所得控除の合計額 2,045,942 2,008,770 2,009,370等 課税総所得金額 16,403,000 50,665,000 32,487,000配当控除額 10,000 10,000 10,049納付すべき税額 △580,408 11,443,900 △1,536,600過少申告加算税の額 27,000 237,000 131,000総所得金額 51,667,144 34,103,712事業所得の金額 38,784,520 18,420,551内 不動産所得の金額 1,614,624 4,227,590訳 \n 配当所得の金額 200,000 200,984裁 給与所得の金額 11,068,000 11,254,587決 \n 所得控除の合計額 2,008,770 2,009,370課税総所得金額 49,658,000 32,094,000配当控除額 10,000 10,049納付すべき税額 11,071,300 △1,682,000過少申告加算税の額 200,000 116,000総所得金額 46,089,304 30,711,567事業所得の金額 33,206,680 15,028,406内 不動産所得の金額 1,614,624 4,227,590訳 \n 配当所得の金額 200,000 200,984取 \n 消 給与所得の金額 11,068,000 11,254,587訴 \n 所得控除の合計額 2,008,770 2,009,370訟 \n 課税総所得金額 44,080,000 28,702,000配当控除額 10,000 10,049納付すべき税額 9,017,400 △2,937,000過少申告加算税の額 0 0 \n （注）「不動産所得の金額」欄の△印は損失金額を、また、「納付すべき税額」欄の△印は還付金の額に相当する税額を、それぞれ示す。以下同じ。 \n （別紙２） \n （消費税関係計算書） \n 区分 \n 課税期間平成12年分 平成13年分 平成14年分項目課税標準額 71,422,000 112,255,000 112,247,000確 \n 定 仕入税額控除の額 4,352,038 2,781,516 3,580,677申 \n 納付すべき消費税額 △1,495,158 1,708,600 909,200告 \n 納付すべき地方消費税額 △373,789 427,100 227,300課税標準額 72,305,000 118,393,000 115,629,000更 \n 正 仕入税額控除の額 4,352,038 2,781,516 3,580,677処 納付すべき消費税額 △1,459,838 1,954,200 1,044,400分 \n 納付すべき地方消費説額 △364,959 488,500 261,100等 \n 過少申告加算税の額 － 30,000 16,000課税標準額 117,525,000 115,478,000仕入税額控除の額 2,791,040 3,589,591裁 \n 納付すべき消費税額 1,909,900 1,029,500決 \n 納付すべき地方消費税額 477,400 257,300過少申告加算税の額 25,000 15,000課税標準額 106,796,000 109,017,000取 仕入税額控除の額 2,781,516 3,580,677消 \n 納付すべき消費税額 1,480,800 771,000訴 \n 訟 納付すべき地方消費税額 370,200 192,700過少申告加算税の額 \n （注）「納付すべき消費税額」及び「納付すべき地方消費税額」欄の△印は、還付金の額に相当する税額を示す。以下同じ。 \n （別紙３） \n 課税処分の経緯（所得税） \n （単位：円） \n 平成13年分確定申告 更正 更正 審査請求 審査裁決区分平成14年3月2日 平成14年6月14日 平成16年2月26日 平成16年4月1日 平成17年3月14日総 所 得 金 額 46,229,304 46,229,304 52,674,644 46,229,304 51,667,144事業所得の金額 33,346,680 33,346,680 39,792,020 33,346,680 38,784,520不動産所得の金額 1,614,624 1,614,624 1,614,624 1,614,624 1,614,624内 \n 訳配当所得の金額 200,000 200,000 200,000 200,000 200,000給与所得の金額 11,068,000 11,068,000 11,068,000 11,068,000 11,068,000所 得 控 除 の 合 計 額 2,008,770 2,008,770 2,008,770 2,008,770 2,008,770課 税 総 所 得 金 額 44,220,000 44,220,000 50,665,000 44,220,000 49,658,000課 税 総 所 得 金 額 \n 13,871,400 13,871,400 16,256,050 13,871,400 15,883,460に 対 す る 税 額配 当 控 除 0 10,000 10,000 10,000 10,000定 率 減 税 額 250,000 250,000 250,000 250,000 250,000源 泉 徴 収 税 額 4,552,102 4,552,102 4,552,102 4,552,102 4,552,102申 告 納 税 額 9,069,200 9,059,200 11,443,900 9,059,200 11,071,300予 定 納 税 額 0 0 0 0 0納 付 す べ き 税 額 9,069,200 9,059,200 11,443,900 9,059,200 11,071,300過 少 申 告 加 算 税 237,000 200,000課税処分の経緯（所得税） \n （単位：円） \n 平成14年分確定申告 更正 審査請求 審査裁決区分平成15年3月10日 平成16年2月26日 平成16年4月1日 平成17年3月14日総 所 得 金 額 30,945,567 34,496,962 30,945,567 34,103,712事業所得の金額 15,262,406 18,813,801 15,262,406 18,420,551不動産所得の金額 4,227,590 4,227,590 4,227,590 4,227,590内 \n 訳配当所得の金額 200,984 200,984 200,984 200,984給与所得の金額 11,254,587 11,254,587 11,254,587 11,254,587所 得 控 除 の 合 計 額 2,009,370 2,009,370 2,009,370 2,009,370課 税 総 所 得 金 額 28,936,000 32,487,000 28,936,000 32,094,000課 税 総 所 得 金 額 \n 8,216,320 9,530,190 8,216,320 9,384,780に 対 す る 税 額配 当 控 除 10,049 10,049 10,049 10,049定 率 減 税 額 250,000 250,000 250,000 250,000源 泉 徴 収 税 額 4,767,322 4,767,322 4,767,322 4,767,322申 告 納 税 額 3,188,900 4,502,800 3,188,900 4,357,400予 定 納 税 額 6,039,400 6,039,400 6,039,400 6,039,400納 付 す べ き 税 額 ▲2,850,500 ▲1,536,600 ▲2,850,500 ▲1,682,000過 少 申 告 加 算 税 131,000 116,000 \n （注）納付すべき税額欄における▲印は、還付金の額に相当する税額を示す。 \n （別紙４） \n 課税処分の経緯（消費税） \n （単位：円） \n 平成13年課税期間確定申告 更正 異議申立て 審査請求 審査裁決区分平成14年3月2日 平成16年2月26日 平成16年4月1日 平成16年6月14日 平成17年3月14日課 税 標 準 額 112,255,000 118,393,000 112,255,000 112,255,000 117,525,000消 費 税 額 4,490,200 4,735,720 4,490,200 4,490,200 4,701,000消 \n 費 控 除 税 額 2,781,516 2,781,516 2,781,516 2,781,516 2,791,040税 \n 中 間 納 付 税 額 0 0 0 0 0納 付 税 額 1,708,600 1,954,200 1,708,600 1,708,600 1,909,900地方消費税の課税標 \n 1,708,600 1,954,200 1,708,600 1,708,600 1,909,900準となる消費税額地 \n 譲 渡 割 納 税 額 427,100 488,500 427,100 427,100 477,400方 \n 消費 \n 税 中間納付譲渡割額 0 0 0 0 0地 方 消 費 税 \n 427,100 488,500 427,100 427,100 477,400納 付 譲 渡 割 額消費税及び地方消費税 \n 2,135,700 2,442,700 2,135,700 2,135,700 2,387,300の 合 計 税 額過 少 申 告 加 算 税 30,000 25,000 \n （注）異議申立てについては、国税通則法第８９条１項（合意によるみなす審査請求）の規定により、 \n 原告から同意があった日に審査請求とみなされた。 \n 課税処分の経緯（消費税） \n （単位：円） \n 平成14年課税期間確定申告 更正 異議申立て 審査請求 審査裁決区分平成15年3月10日 平成16年2月26日 平成16年4月1日 平成16年6月14日 平成17年3月14日課 税 標 準 額 112,247,000 115,629,000 112,247,000 112,247,000 115,478,000消 費 税 額 4,489,880 4,625,160 4,489,880 4,489,880 4,619,120消 \n 費 控 除 税 額 3,580,677 3,580,677 3,580,677 3,580,677 3,589,591税 \n 中 間 納 付 税 額 854,200 854,200 854,200 854,200 854,200納 付 税 額 55,000 190,200 55,000 55,000 175,300地方消費税の課税標 \n 909,200 1,044,400 909,200 909,200 1,029,500準となる消費税額地 \n 譲 渡 割 納 税 額 227,300 261,100 227,300 227,300 257,300方 \n 消費 \n 税 中間納付譲渡割額 213,500 213,500 213,500 213,500 213,500地 方 消 費 税 \n 13,800 47,600 13,800 13,800 43,800納 付 譲 渡 割 額消費税及び地方消費税 \n 68,800 237,800 68,800 68,800 219,100の 合 計 税 額過 少 申 告 加 算 税 16,000 15,000 \n （注）異議申立てについては、国税通則法第８９条１項（合意によるみなす審査請求）の規定により、 \n 原告から同意があった日に審査請求とみなされた。 \n （別紙５） \n 課税の根拠 \n １ 平成１３年分所得税被告が本訴において主張する原告の平成１３年分所得税の総所得金額及び納付すべき税額は、次のとおりである。 \n (1) 総所得金額 ５３１０万７５８８円上記金額は、次のアないしエの各金額の合計額である。 \n ア 事業所得の金額 ４０２２万４９６４円上記金額は、次の(ア)の金額から(イ)の金額を差し引いた後の金額である。 \n (ア) 総収入金額 １億１６１０万９２１６円上記金額は、原告の平成１３年分の事業所得に係る総収入金額であり、別表１の「１ 平成１ \n ３年分の弁護士報酬等」の「本訴における被告主張額」の「総収入金額」欄の金額である。 \n (イ) 必要経費の額 ７５８８万４２５２円上記金額は、原告が平成１３年分所得税の事業所得の金額の計算上必要経費として確定申告 \n （以下、同確定申告に係る申告書を「平成１３年分所得税確定申告書」という。）した金額７ \n ５６３万４２５２円と、平成１２年分の事業所得の計算上、総収入金額に計上されたＹに係る着手金について、委任契約が解除されたことにより回収できないと認められる金額２５万円の合計額である。 \n イ 不動産所得の金額 １６１万４６２４円上記金額は、原告が平成１３年分所得税確定申告書に記載した金額と同額である。 \n ウ 配当所得の金額 ２０万円上記金額は、原告が平成１３年分所得税確定申告書に記載した金額と同額である。 \n エ 給与所得の金額 １１０６万８０００円上記金額は、原告が平成１３年分所得税確定申告書に記載した金額と同額である。 \n (2) 所得控除の合計額 ２００万８７７０円上記金額は、原告の平成１３年分の総所得金額から控除すべき各種所得控除の合計額であり、原告が平成１３年分所得税確定申告書に記載した金額と同額である。 \n (3) 課税総所得金額 ５１０９万８０００円上記金額は、上記(1)総所得金額５３１０万７５８８円から、上記(2)の所得控除の合計額２００万８７７０円を差し引いた後の金額（国税通則法１１８条１項の規定に基づき１０００円未満の端数を切り捨てた後のもの。以下同じ。）である。 \n (4) 納付すべき税額 １１６０万４１００円上記金額は、次のアの金額からイないしエの各金額を差し引いた後の金額（国税通則法１１９条 \n １項の規定に基づき１００円未満の端数を切り捨てた後のもの。以下同じ。）である。 \n ア 課税総所得金額に対する税額 １６４１万６２６０円上記金額は、上記(3)の課税総所得金額５１０９万８０００円に所得税法８９条１項（経済社会の変化等に対応して早急に講ずべき所得税及び法人税の負担軽減措置に関する法律（平成１１年法律第８号、以下「負担軽減措置法」という。）４条の特例を適用したもの。以下同じ。）に規定する税率を乗じて算出した金額である。 \n イ 配当控除 １万円上記金額は、上記(1)ウの配当所得の金額に所得税法９２条１項の規定を適用して算出した金額である。 \n ウ 定率減税額 ２５万円上記金額は、負担軽減措置法６条の規定により算出した金額であり、原告が平成１３年分所得税確定申告書に記載した金額と同額である。 \n エ 源泉徴収税額 ４５５万２１０２円上記金額は、原告が平成１３年分所得税確定申告書に記載した金額と同額である。 \n ２ 平成１４年分所得税被告が本訴において主張する原告の平成１４年分所得税の総所得金額及び納付すべき税額は、次のとおりである。 \n (1) 総所得金額 ３４７１万７８１３円上記金額は、次のアないしエの各金額の合計額である。 \n ア 事業所得の金額 １９０３万４６５２円上記金額は、次の(ア)の金額から(イ)の金額を差し引いた後の金額である。 \n (ア) 総収入金額 １億１１７５万４５７０円上記金額は、原告の平成１４年分の事業所得に係る総収入金額であり、別表１の「２ 平成 \n １４年分の弁護士報酬等」の「本訴における被告主張額」の「総収入金額」欄の金額である。 \n (イ) 必要経費の額 ９２７１万９９１８円上記金額は、原告が平成１４年分の事業所得の金額の計算上必要経費として確定申告（以下、 \n 同確定申告に係る申告書を「平成１４年分所得税確定申告書」という。）した金額９１７６万 \n ０９１８円と、平成１３年分の事業所得の計算上、総収入金額に計上された丁に係る着手金について、委任契約が解除されたことにより回収できないと認められる金額２３万４０００円及び原告がＨ及び有限会社Ｉを委任者として平成１３年６月１２日に作成し取り交わした契約書記載の金額（着手金１７８万５０００円、概算実費３０万円）が同１４年５月２９日に変更 \n （変更後着手金１２６万円、概算実費１０万円）したことにより減少した金額７２万５千円との合計額である。 \n イ 不動産所得の金額 ４２２万７５９０円上記金額は、原告が平成１４年分所得税確定申告書に記載した金額と同額である。 \n ウ 配当所得の金額 ２０万０９８４円上記金額は、原告が平成１４年分所得税確定申告書に記載した金額と同額である。 \n エ 給与所得の金額 １１２５万４５８７円上記金額は、原告が平成１４年分所得税確定申告書に記載した金額と同額である。 \n (2) 所得控除の合計額 ２００万９３７０円上記金額は、原告の平成１４年分の総所得金額から控除すべき各種所得控除の合計額であり、原告が平成１４年分所得税確定申告書に記載した金額と同額である。 \n (3) 課税総所得金額 ３２７０万８０００円上記金額は、上記(1)総所得金額３４７１万７８１３円から、上記(2)の所得控除の合計額２００万９３７０円を差し引いた後の金額である。 \n (4) 納付すべき税額 △１４５万４９００円上記金額は、次のアの金額からイないしエの各金額を差し引いた後の金額からさらにオの金額を差し引いた後の金額である。 \n なお、「△」は還付金の額に相当する税額を示す。 \n ア 課税総所得金額に対する税額 ９６１万１９６０円上記金額は、上記(3)の課税総所得金額３２７０万８０００円に所得税法８９条１項に規定する税率を乗じて算出した金額である。 \n イ 配当控除 １万００５０円上記金額は、前記(1)ウの配当所得の金額に所得税法９２条１項の規定を適用して算出した金額である。 \n ウ 定率減税額 ２５万円上記金額は、負担軽減措置法６条の規定により算出した金額であり、原告が平成１４年分所得税確定申告書に記載した定率減税額と同額である。 \n エ 源泉徴収税額 ４７６万７３２２円上記金額は、原告が平成１４年分所得税確定申告書に記載した金額と同額である。 \n オ 予定納税額 ６０３万９４００円上記金額は、所得税法１０４条に基づいて原告が予定納税額として第一期及び第二期において納付した金額であり、原告が平成１４年分所得税確定申告書に記載した金額と同額である。 \n ３ 平成１３年課税期間の消費税等被告が本訴において主張する原告の平成１３年課税期間の消費税等の課税標準額及び納付すべき税額は、次のとおりである。 \n (1) 消費税ア 課税標準額 １億１８８９万７０００円上記金額は、原告の平成１３年課税期間における課税資産の譲渡等の対価の額であり、原告の \n 「自平成１３年１月１日至平成１３年１２月３１日課税期間分の消費税等の確定申告書」（以下 \n 「平成１３年消費税等確定申告書」という。）の付表の２に記載されている課税売上額１億１２ \n １０万８９４０円（付表２①参照）に、同課税期間に係る課税資産の譲渡等の対価の額として本来計上すべきであった金額７１２万８２８４円（別表１「１ 平成１３年分の弁護士報酬等」の \n 「申告額」と「本訴における被告主張額」との差額）に１０５分の１００を乗じた金額６７８万 \n ８８４１円を加算した金額である（ただし、国税通則法１１８条１項の規定に基づき１０００円未満の端数を切り捨てた後のもの。以下同じ）。 \n イ 消費税額 ４７５万５８８０円上記金額は、上記アの金額に消費税法２９条に規定する消費税の税率１００分の４を乗じて算出した金額である。 \n ウ 控除対象仕入税額 ２７７万５６３１円上記金額は、原告が平成１３年消費税等確定申告書に記載した金額と同額である。 \n エ 返還等対価に係る税額 ５８８５円上記金額は、原告が平成１３年消費税等確定申告書に記載した金額と同額である。 \n オ 貸倒れに係る税額 ９５２４円上記金額は、前記１(1)アで述べたＹに係る着手金について、回収できないと認められる金額 \n ２５万円に係る消費税額である。 \n カ 差引納付すべき税額 １９６万４８００円上記金額は、上記イの金額からウないしオの各金額を差し引いた後の金額である（ただし、国税通則法１１９条１項の規定に基づき１００円未満の端数を切り捨てた後のもの。以下同じ。）。 \n (2) 地方消費税ア 課税標準となる消費税額 １９６万４８００円上記金額は、地方税法７２条の７７第２号及び同法７７条の８２の規定により、上記(1)カの金額となる。 \n イ 譲渡割額 ４９万１２００円上記金額は、上記アの金額に、地方税法７２条の８３に規定する税率１００分の２５を乗じて算出した金額である（ただし、地方税法２０条の４の２第３項に基づき１００円未満の端数を切り捨てた後のもの。以下同じ。） \n ウ 差引納付すべき譲渡割額 ４９万１２００円上記金額は、上記イの金額と同額である。 \n (3) 消費税等の合計税額 ２４５万６０００円上記金額は、上記(1)カの金額と(2)ウの金額の合計額である。 \n ４ 平成１４年課税期間の消費税等被告が本訴において主張する原告の平成１４年課税期間の消費税等の課税標準額及び納付すべき税額は、次のとおりである。 \n (1) 消費税ア 課税標準額 １億１６７５万３０００円上記金額は、原告の平成１４年課税期間における課税資産の譲渡等の対価の額であり、原告の \n 「自平成１４年１月１日至平成１４年１２月３１日課税期間分の消費税等の確定申告書」（以下 \n 「平成１４年消費税等確定申告書」という。）の付表２に記載されている課税売上額１億１２２ \n ４万７７００円（付表２①参照）に、同課税期間に係る課税資産の譲渡等の対価の額として本来計上すべきであった金額４７３万１２４６円（別表１「２ 平成１４年分の弁護士報酬等」の「申告額」と「本訴における被告主張額」との差額）に１０５分の１００を乗じた金額４５０万５９ \n ４８円を加算した金額である。 \n イ 消費税額 ４６７万０１２０円上記金額は、上記アの金額に消費税法２９条に規定する消費税の税率１００分の４を乗じて算出した金額である。 \n ウ 控除対象仕入税額 ３５８万０６７７円上記金額は、原告が平成１４年消費税等確定申告書に記載した金額と同額である。 \n エ 返還等対価に係る税額 ２万７６１９円上記金額は、前記２(1)ア(イ)で述べたとおり、原告とＨ及び有限会社Ｉとの間の契約金額の変更に伴い生じるものであり、当初の契約金額（着手金１７８万５０００円、概算実費３０万円） \n と変更後の金額（着手金１２６万円、概算実費１０万円）との差額７２万５０００円に係る消費税額である（消費税法３８条１項）。 \n オ 貸倒れに係る税額 ８９１４円上記金額は、前記２(1)ア(イ)で述べた丁に係る着手金について、回収できないと認められる金額２３万４０００円に係る消費税額である。 \n カ 差引税額 １０５万２９００円上記金額は、上記イの金額からウないしオの各金額を差し引いた後の金額である。 \n キ 中間納付税額 ８５万４２００円上記金額は、消費税法４４条（平成１５年法律第８号による改正前のもの）の規定により提出があったとみなされた同法４８条（平成１５年法律第８号による改正前のもの）に規定する中間申告による納付税額であり、原告が平成１４年消費税等確定申告書に記載した中間納付税額と同額である。 \n ク 差引納付すべき税額 １９万８７００円上記金額は、上記カの金額からキの金額を差し引いた後の金額である。 \n (2) 地方消費税ア 課税標準となる消費税額 １０５万２９００円上記金額は、地方税法７２条の７７第２号及び同法７７条の８２の規定により、前記(1)カの金額となる。 \n イ 譲渡割額 ２６万３２００円上記金額は、上記アの金額に、地方税法７２条の８３に規定する税率１００分の２５を乗じて算出した金額である。 \n ウ 中間納付譲渡割額 ２１万３５００円上記金額は、地方税法７２条の８７の規定により提出があったとみなされた譲渡割の中間申告による納付税額であり、原告が平成１４年消費税等確定申告書に記載した中間納付譲渡割額と同額である。 \n エ 差引納付すべき譲渡割額 ４万９７００円上記金額は、上記イの金額からウの金額を差し引いた後の金額である。 \n (3) 消費税等の合計納付税額 ２４万８４００円上記金額は、前記(1)クの金額と上記(2)エの金額の合計額である。 \n （別紙５） \n 別表１ \n １ 平成１３年分の弁護士報酬等申告額 本訴における被告主張額 \n 1 売上高報酬 97,394,237 \n 108,115,552 \n 2 売上実費収入繰 3,593,031 \n 3 売上相談料 2,418,925 2,418,925 \n 4 売上顧問料 2,383,500 2,383,500 \n 5 売上その他 827,469 827,469 \n 6 雑収入 2,057,410 2,057,410 \n 7 売上国選 460,860 460,860 \n 8 売上値引 △154,500 △154,500総収入金額 108,980,932 116,109,216 \n ２ 平成１４年分の弁護士報酬等申告額 本訴における被告主張額 \n 1 売上高報酬 92,407,539 \n 101,964,873 \n 2 売上実費収入繰 4,826,088 \n 3 売上相談料 3,204,400 3,204,400 \n 4 売上顧問料 1,933,500 1,933,500 \n 5 売上その他 1,633,483 1,633,483 \n 6 雑収入 2,515,782 2,515,782 \n 7 売上国選 502,532 502,532 \n 8 売上値引総収入金額 107,023,324 111,754,570 \n （注） 平成１３年分及び１４年分の売上高報酬と売上実費収入繰は、原告の元帳上も明確な基準により区分されていないことから、本訴の主張に当たっては便宜上合計して表示した。 \n （別紙６） \n 平成13年分番号 委任者名等 原告元帳合計額 被告本訴主張額 認定 \n 1 105,000 105,000 105,000 \n 2 450,000 575,000 575,000 \n 3 260,000 260,000 260,000 \n 4 472,500 0 0 \n 5 440,000 630,000 630,000 \n 6 210,000 210,000 210,000 \n 7 100,000 0 0 \n 8 365,000 365,000 365,000 \n 9 2,250,000 2,250,000 2,250,000 \n 10 0 168,000 0 \n 11 1,618,450 1,618,450 1,618,450 \n 12 420,000 940,000 940,000 \n 13 67,500 0 0 \n 14 210,000 210,000 210,000 \n 15 319,000 319,000 319,000 \n 16 105,000 105,000 105,000 \n 17 2,395,000 2,405,000 2,405,000 \n 18 33,860 101,300 67,460 \n 19 131,000 365,000 365,000 \n 20 52,500 52,500 52,500 \n 21 315,000 315,000 315,000 \n 22 625,000 625,000 625,000 \n 23 157,500 157,500 157,500 \n 24 210,000 210,000 210,000 \n 25 200,000 627,500 627,500 \n 26 147,000 147,000 147,000 \n 27 545,000 545,000 545,000 \n 28 46,380 0 0 \n 29 500,000 500,000 500,000 \n 30 510,000 0 0 \n 31 472,500 472,500 472,500 \n 32 250,000 0 0 \n 33 315,000 315,000 315,000 \n 34 1,050,000 1,050,000 1,050,000 \n 35 2,000 0 0 \n 36 8,000 0 0 \n 37 102,928 102,928 102,928 \n 38 0 210,000 210,000 \n 39 525,000 525,000 525,000 \n 40 976,500 976,500 976,500 \n 41 224,000 365,000 365,000 \n 42 365,000 365,000 365,000 \n 43 470,000 470,000 470,000 \n 44 130,000 262,500 262,500 \n 45 147,000 147,000 147,000 \n 46 1,575,000 1,575,000 1,575,000 \n 47 378,000 378,000 378,000番号 委任者名等 原告元帳合計額 被告本訴主張額 認定 \n 48 105,000 105,000 105,000 \n 49 105,000 105,000 105,000 \n 50 20,000 0 0 \n 51 0 365,000 0 \n 52 105,000 105,000 105,000 \n 53 157,500 157,500 157,500 \n 54 312,500 312,500 312,500 \n 55 105,000 105,000 105,000 \n 56 648,500 648,500 648,500 \n 57 840,000 840,000 840,000 \n 58 30,000 0 0 \n 59 420,000 420,000 420,000 \n 60 45,500 0 0 \n 61 100,000 312,500 312,500 \n 62 107,500 0 0 \n 63 52,500 52,500 52,500 \n 64 105,000 105,000 \n 65 105,000 105,000 105,000 \n 66 210,000 210,000 210,000 \n 67 170,000 625,000 625,000 \n 68 100,000 0 0 \n 69 50,000 0 0 \n 70 105,000 105,000 105,000 \n 71 610,000 610,000 610,000 \n 72 100,000 0 0 \n 73 1,015,000 2,085,000 2,085,000 \n 74 105,000 105,000 105,000 \n 75 190,000 260,000 260,000 \n 76 1,150,000 1,955,000 1,955,000 \n 77 420,000 420,000 420,000 \n 78 800,000 992,500 992,500 \n 79 420,000 420,000 420,000 \n 80 365,000 365,000 365,000 \n 81 950,000 950,000 950,000 \n 82 273,000 273,000 273,000 \n 83 5,000 0 0 \n 84 36,750 36,750 36,750 \n 85 790,000 790,000 790,000 \n 86 170,000 105,000 105,000 \n 87 29,215 29,215 29,215 \n 88 210,000 210,000 210,000 \n 89 956,807 956,807 956,807 \n 90 1,167,710 1,167,710 1,167,710 \n 91 20,000 0 0 \n 92 1,635,050 1,635,050 1,635,050 \n 93 420,000 420,000 420,000 \n 94 300,000 625,000 625,000 \n 95 525,000 525,000 525,000 \n 96 0 470,000 470,000 \n 97 470,000 0 0番号 委任者名等 原告元帳合計額 被告本訴主張額 認定 \n 98 190,000 315,000 315,000 \n 99 260,000 260,000 260,000 \n 100 70,000 0 0 \n 101 130,000 365,000 365,000 \n 102 30,000 0 0 \n 103 430,000 430,000 430,000 \n 104 40,000 40,000 40,000 \n 105 7,000 0 0 \n 106 120,000 120,000 120,000 \n 107 912,000 912,000 912,000 \n 108 731,500 556,500 556,500 \n 109 60,000 0 0 \n 110 396,500 396,500 396,500 \n 111 150,000 470,000 470,000 \n 112 31,500 31,500 31,500 \n 113 420,000 420,000 420,000 \n 114 142,000 365,000 365,000 \n 115 630,000 630,000 630,000 \n 116 230,000 260,000 260,000 \n 117 210,000 210,000 210,000 \n 118 262,500 262,500 262,500 \n 119 320,000 365,000 365,000 \n 120 650,000 0 0 \n 121 63,000 63,000 63,000 \n 122 77,766 77,766 77,766 \n 123 260,000 365,000 365,000 \n 124 365,000 365,000 365,000 \n 125 100,000 105,000 105,000 \n 126 257,250 257,250 257,250 \n 127 200,000 0 0 \n 128 415,000 415,000 415,000 \n 129 105,000 105,000 105,000 \n 130 500,000 1,360,000 1,360,000 \n 131 75,600 75,600 75,600 \n 132 78,964 78,964 78,964 \n 133 575,000 575,000 575,000 \n 134 575,000 575,000 575,000 \n 135 317,500 312,500 312,500 \n 136 260,000 260,000 260,000 \n 137 365,000 365,000 365,000 \n 138 170,000 365,000 365,000 \n 139 60,000 0 0 \n 140 20,000 20,000 20,000 \n 141 300,000 600,000 600,000 \n 142 210,000 210,000 210,000 \n 143 260,000 260,000 260,000 \n 144 650,000 0 0 \n 145 157,500 157,500 157,500 \n 146 365,000 365,000 365,000 \n 147 1,180 1,180 1,180番号 委任者名等 原告元帳合計額 被告本訴主張額 認定 \n 148 8,400 8,400 8,400 \n 149 10,500 10,500 10,500 \n 150 10,500 10,500 10,500 \n 151 300,000 404,250 404,250 \n 152 285,000 365,000 365,000 \n 153 3,500,000 3,500,000 3,500,000 \n 154 420,000 420,000 420,000 \n 155 1,547,500 2,042,500 2,042,500 \n 156 525,000 525,000 525,000 \n 157 100,000 0 0 \n 158 20,000 20,000 20,000 \n 159 260,000 260,000 260,000 \n 160 470,000 470,000 470,000 \n 161 470,000 470,000 470,000 \n 162 45,000 0 0 \n 163 30,000 0 0 \n 164 912,580 912,580 912,580 \n 165 575,000 575,000 575,000 \n 166 0 210,000 210,000 \n 167 170,000 367,500 367,500 \n 168 420,000 420,000 420,000 \n 169 367,500 367,500 367,500 \n 170 2,270,000 2,270,000 2,270,000 \n 171 315,000 315,000 315,000 \n 172 1,043,930 1,043,930 1,043,930 \n 173 264,170 264,170 264,170 \n 174 200,000 470,000 470,000 \n 175 110,410 110,410 110,410 \n 176 210,000 210,000 210,000 \n 177 520,000 470,000 470,000 \n 178 210,000 210,000 210,000 \n 179 600,000 600,000 600,000 \n 180 551,250 551,250 551,250 \n 181 210,000 210,000 210,000 \n 182 105,000 0 0 \n 183 480,082 480,082 480,082 \n 184 5,000 52,500 52,500 \n 185 260,000 1,725,000 1,725,000 \n 186 276,745 276,745 276,745 \n 187 108,590 108,590 108,590 \n 188 78,750 78,750 78,750 \n 189 40,000 0 0 \n 190 420,000 420,000 420,000 \n 191 200,000 315,000 315,000 \n 192 420,000 420,000 420,000 \n 193 155,400 155,400 155,400 \n 194 420,000 420,000 420,000 \n 195 2,440 2,440 2,440 \n 196 52,500 52,500 52,500 \n 197 1,620,407 1,620,407 1,620,407番号 委任者名等 原告元帳合計額 被告本訴主張額 認定 \n 198 172,000 0 0 \n 199 315,590 315,590 315,590 \n 200 525,000 525,000 525,000 \n 201 735,000 735,000 735,000 \n 202 157,500 157,500 157,500 \n 203 365,000 365,000 365,000 \n 204 63,000 63,000 63,000 \n 205 210,000 210,000 210,000 \n 206 160,000 0 0 \n 207 450,000 1,095,000 1,095,000 \n 208 848,625 848,625 848,625 \n 209 530,610 530,610 530,610 \n 210 120,000 120,000 120,000 \n 211 848,825 848,825 848,825 \n 212 210,000 210,000 210,000 \n 213 210,000 210,000 210,000 \n 214 2,115,000 2,115,000 2,115,000 \n 215 447,978 447,978 447,978 \n 216 265,500 265,500 265,500 \n 217 35,000 0 0 \n 218 168,000 168,000 168,000 \n 219 0 105,000 105,000 \n 220 315,000 315,000 315,000 \n 221 555,000 555,000 555,000 \n 222 470,000 470,000 470,000 \n 223 100,000 100,000 100,000 \n 224 349,000 349,000 349,000 \n 225 255,000 255,000 255,000 \n 226 100,000 100,000 100,000 \n 227 120,000 120,000 120,000 \n 228 380,500 380,500 380,500 \n 229 161,000 161,000 161,000 \n 230 161,000 161,000 161,000 \n 231 220,000 220,000 220,000 \n 232 178,500 198,500 198,500 \n 233 161,000 161,000 161,000 \n 234 161,000 161,000 161,000 \n 235 100,000 100,000 100,000 \n 236 210,000 210,000 210,000 \n 237 150,000 365,000 365,000 \n 238 120,000 210,000 210,000 \n 239 365,000 365,000 365,000 \n 240 270,000 260,000 260,000 \n 241 315,000 315,000 315,000 \n 242 60,000 73,500 73,500 \n 243 100,000 451,500 451,500 \n 244 32,963 32,963 32,963 \n 245 105,000 105,000 105,000 \n 246 52,500 52,500 52,500 \n 247 312,500 312,500 312,500番号 委任者名等 原告元帳合計額 被告本訴主張額 認定 \n 248 160,000 210,000 210,000 \n 249 420,000 420,000 420,000 \n 250 40,000 210,000 210,000 \n 251 365,000 365,000 365,000 \n 252 1,315,000 0 0 \n 253 143,526 0 0 \n 254 52,500 52,500 52,500 \n 255 67,287 67,287 67,287 \n 256 1,344,700 1,344,700 1,344,700 \n 257 200,000 200,000 200,000 \n 258 36,000 36,000 36,000 \n 259 262,500 262,500 262,500 \n 260 30,000 0 0 \n 261 140,000 420,000 420,000 \n 262 90,000 265,000 265,000 \n 263 2,100,000 2,100,000 2,100,000 \n 264 205,000 315,000 315,000 \n 265 445,000 0 0 \n 266 142,500 142,500 142,500 \n 267 120,000 120,000 120,000 \n 268 552,000 552,000 552,000 \n 269 300,000 575,000 575,000 \n 270 265,000 0 0 \n 271 420,000 420,000 420,000 \n 272 230,000 0 0 \n 273 240,000 240,000 240,000 \n 274 685,000 685,000 685,000 \n 275 261,400 261,400 261,400 \n 276 52,500 52,500 52,500 \n 277 535,000 525,000 525,000 \n 278 472,500 472,500 472,500 \n 279 160,000 0 0 \n 280 105,000 105,000 105,000 \n 281 292,050 292,050 292,050 \n 282 1,344,190 1,344,190 1,344,190 \n 283 76,960 76,960 76,960 \n 284 10,500 10,500 10,500 \n 285 1,000 1,000 1,000 \n 286 315,000 315,000 315,000 \n 287 105,000 105,000 105,000合計 101,017,268 107,518,052 106,951,212 \n （別紙７） \n 平成14年分番号 委任者名等 原告元帳合計額 被告本訴主張額 認定 \n 1 577,500 577,500 577,500 \n 2 232,190 232,190 232,190 \n 3 125,000 157,500 157,500 \n 4 210,000 210,000 210,000 \n 5 625,000 625,000 625,000 \n 6 20,000 20,000 20,000 \n 7 546,090 546,090 546,090 \n 8 120,000 0 0 \n 9 495,000 495,000 495,000 \n 10 520,000 0 0 \n 11 680,000 890,000 890,000 \n 12 365,000 365,000 365,000 \n 13 365,000 365,000 365,000 \n 14 52,500 52,500 52,500 \n 15 400,000 470,000 470,000 \n 16 100,000 210,000 210,000 \n 17 273,000 273,000 273,000 \n 18 472,500 472,500 472,500 \n 19 850,000 840,000 840,000 \n 20 84,350 101,500 50,750 \n 21 365,000 365,000 365,000 \n 22 420,000 420,000 420,000 \n 23 134,298 134,298 134,298 \n 24 20,000 0 0 \n 25 0 315,000 315,000 \n 26 377,500 0 0 \n 27 52,500 52,500 52,500 \n 28 20,000 20,000 20,000 \n 29 230,000 365,000 365,000 \n 30 525,000 525,000 525,000 \n 31 210,000 210,000 210,000 \n 32 1,023,870 1,023,870 1,023,870 \n 33 90,000 105,000 105,000 \n 34 270,000 312,500 312,500 \n 35 254,000 254,000 254,000 \n 36 1,502,500 1,502,500 1,502,500 \n 37 63,000 63,000 63,000 \n 38 114,685 212,500 212,500 \n 39 250,000 365,000 365,000 \n 40 52,500 52,500 52,500 \n 41 100,000 315,000 315,000 \n 42 417,500 417,500 417,500 \n 43 71,000 0 0 \n 44 52,500 52,500 52,500 \n 45 365,000 365,000 365,000 \n 46 30,000 210,000 210,000 \n 47 160,000 260,000 260,000番号 委任者名等 原告元帳合計額 被告本訴主張額 認定 \n 48 190,000 260,000 260,000 \n 49 365,000 365,000 365,000 \n 50 1,156,930 1,156,930 1,156,930 \n 51 365,000 365,000 365,000 \n 52 365,000 365,000 365,000 \n 53 239,500 509,500 509,500 \n 54 200,000 365,000 365,000 \n 55 260,000 260,000 260,000 \n 56 30,000 0 0 \n 57 633,911 633,911 633,911 \n 58 0 105,000 105,000 \n 59 283,500 283,500 283,500 \n 60 365,000 365,000 365,000 \n 61 906,501 906,501 906,501 \n 62 126,000 126,000 126,000 \n 63 138,443 138,443 138,443 \n 64 420,740 420,740 420,740 \n 65 52,500 52,500 52,500 \n 66 210,000 210,000 210,000 \n 67 260,000 260,000 260,000 \n 68 230,000 365,000 365,000 \n 69 212,500 262,500 262,500 \n 70 780 780 780 \n 71 365,000 365,000 365,000 \n 72 100,000 210,000 210,000 \n 73 100,000 312,500 312,500 \n 74 420,000 420,000 420,000 \n 75 52,500 52,500 52,500 \n 76 0 145,000 145,000 \n 77 100,000 365,000 365,000 \n 78 60,000 0 0 \n 79 650,000 650,000 650,000 \n 80 565,000 0 0 \n 81 105,000 105,000 105,000 \n 82 25,000 0 0 \n 83 150,000 0 0 \n 84 70,000 0 0 \n 85 805,000 0 0 \n 86 402,500 210,000 210,000 \n 87 525,000 525,000 525,000 \n 88 126,000 126,000 126,000 \n 89 390,327 390,327 390,327 \n 90 10,000 105,000 105,000 \n 91 1,194 1,194 1,194 \n 92 8,926 8,926 8,926 \n 93 273,000 273,000 273,000 \n 94 618,000 618,000 618,000 \n 95 200,000 210,000 210,000 \n 96 250,000 575,000 575,000 \n 97 250,000 207,500 207,500番号 委任者名等 原告元帳合計額 被告本訴主張額 認定 \n 98 231,000 231,000 231,000 \n 99 20,000 0 0 \n 100 319,820 474,570 474,570 \n 101 52,500 52,500 52,500 \n 102 315,000 315,000 315,000 \n 103 60,000 60,000 60,000 \n 104 10,000 0 0 \n 105 738,200 738,200 738,200 \n 106 312,500 312,500 312,500 \n 107 20,000 20,000 20,000 \n 108 420,000 420,000 420,000 \n 109 30,000 260,000 260,000 \n 110 617,000 1,985,000 1,985,000 \n 111 325,000 525,000 525,000 \n 112 20,000 20,000 20,000 \n 113 270,810 270,810 270,810 \n 114 210,000 210,000 210,000 \n 115 940,000 940,000 940,000 \n 116 365,000 365,000 365,000 \n 117 0 210,000 210,000 \n 118 100,000 1,100,000 1,100,000 \n 119 317,500 317,500 317,500 \n 120 498,550 498,550 498,550 \n 121 235,000 0 0 \n 122 80,000 0 0 \n 123 105,000 105,000 105,000 \n 124 4,000 0 0 \n 125 210,000 210,000 210,000 \n 126 0 210,000 210,000 \n 127 105,000 105,000 105,000 \n 128 211,990 240,000 211,990 \n 129 315,000 315,000 315,000 \n 130 20,000 20,000 20,000 \n 131 125,000 0 0 \n 132 280,000 685,250 685,250 \n 133 62,000 0 0 \n 134 315,000 315,000 315,000 \n 135 20,000 20,000 20,000 \n 136 20,000 20,000 20,000 \n 137 1,675,000 1,675,000 1,675,000 \n 138 30,000 0 0 \n 139 45,000 0 0 \n 140 1,710 1,710 1,710 \n 141 157,500 157,500 157,500 \n 142 238,765 0 0 \n 143 365,000 365,000 365,000 \n 144 260,000 260,000 260,000 \n 145 315,000 315,000 315,000 \n 146 52,500 52,500 52,500 \n 147 105,000 105,000 105,000番号 委任者名等 原告元帳合計額 被告本訴主張額 認定 \n 148 40,000 0 0 \n 149 260,000 260,000 260,000 \n 150 421,130 421,130 421,130 \n 151 215,000 365,000 365,000 \n 152 126,000 126,000 126,000 \n 153 860,000 0 0 \n 154 315,000 315,000 315,000 \n 155 40,000 262,500 262,500 \n 156 150,000 365,000 365,000 \n 157 467,500 467,500 467,500 \n 158 315,000 315,000 315,000 \n 159 195,000 0 0 \n 160 545,000 545,000 545,000 \n 161 422,519 422,519 422,519 \n 162 300,000 315,000 315,000 \n 163 500,000 500,000 500,000 \n 164 455,000 575,000 575,000 \n 165 482,500 482,500 482,500 \n 166 565,000 0 0 \n 167 262,500 262,500 262,500 \n 168 157,500 157,500 157,500 \n 169 105,000 105,000 105,000 \n 170 365,000 365,000 365,000 \n 171 470,000 470,000 470,000 \n 172 104,250 0 0 \n 173 105,000 105,000 105,000 \n 174 185,000 105,000 105,000 \n 175 1,055,600 1,055,600 1,055,600 \n 176 367,500 367,500 367,500 \n 177 220,000 260,000 260,000 \n 178 130,000 365,000 365,000 \n 179 300,000 0 0 \n 180 600,000 600,000 600,000 \n 181 105,000 105,000 105,000 \n 182 120,000 0 0 \n 183 0 52,500 52,500 \n 184 315,000 315,000 315,000 \n 185 110,000 210,000 210,000 \n 186 675,000 675,000 675,000 \n 187 210,000 210,000 210,000 \n 188 20,000 157,500 157,500 \n 189 10,000 0 0 \n 190 315,000 315,000 315,000 \n 191 910,000 257,500 257,500 \n 192 270,000 0 0 \n 193 0 0 0 \n 194 105,000 105,000 105,000 \n 195 150,000 365,000 365,000 \n 196 315,000 315,000 315,000 \n 197 238,360 238,360 238,360番号 委任者名等 原告元帳合計額 被告本訴主張額 認定 \n 198 5,450 5,450 5,450 \n 199 790,000 0 0 \n 200 165,000 365,000 365,000 \n 201 45,000 45,000 45,000 \n 202 210,000 260,000 260,000 \n 203 130,000 260,000 260,000 \n 204 365,000 365,000 365,000 \n 205 15,000 0 0 \n 206 31,500 31,500 31,500 \n 207 63,000 63,000 63,000 \n 208 52,500 52,500 52,500 \n 209 1,050,000 1,050,000 1,050,000 \n 210 52,500 52,500 52,500 \n 211 105,000 105,000 105,000 \n 212 1,775,000 1,775,000 1,775,000 \n 213 120,000 5,000 5,000 \n 214 630,000 630,000 630,000 \n 215 365,000 365,000 365,000 \n 216 14,650 14,650 14,650 \n 217 105,000 105,000 105,000 \n 218 365,000 365,000 365,000 \n 219 250,000 625,000 625,000 \n 220 315,000 315,000 315,000 \n 221 1,575,000 1,575,000 1,575,000 \n 222 127,250 257,250 257,250 \n 223 157,500 157,500 157,500 \n 224 162,500 260,000 260,000 \n 225 110,250 110,250 110,250 \n 226 525,000 525,000 525,000 \n 227 2,500 0 0 \n 228 110,250 110,250 110,250 \n 229 105,000 105,000 105,000 \n 230 262,500 265,000 262,500 \n 231 0 157,500 157,500 \n 232 140,000 141,750 141,750 \n 233 420,000 420,000 420,000 \n 234 20,000 20,000 20,000 \n 235 900,000 1,097,500 1,097,500 \n 236 36,750 36,750 36,750 \n 237 645,000 0 0 \n 238 700,000 2,035,000 2,035,000 \n 239 52,500 52,500 52,500 \n 240 250,000 624,750 624,750 \n 241 600,000 600,000 600,000 \n 242 0 210,000 210,000 \n 243 133,470 420 420 \n 244 800,000 800,000 800,000 \n 245 38,010 38,010 38,010 \n 246 812,220 812,220 812,220 \n 247 0 19,300 19,300番号 委任者名等 原告元帳合計額 被告本訴主張額 認定 \n 248 0 56,010 56,010 \n 249 305,000 315,000 315,000 \n 250 420,000 420,000 420,000 \n 251 1,150,000 1,150,000 1,150,000 \n 252 161,000 161,000 161,000 \n 253 369,000 369,000 369,000 \n 254 90,000 90,000 90,000 \n 255 237,500 237,500 237,500 \n 256 33,250 33,250 33,250 \n 257 148,000 148,000 148,000 \n 258 161,000 161,000 161,000 \n 259 213,500 213,500 213,500 \n 260 161,000 161,000 161,000 \n 261 181,000 181,000 181,000 \n 262 328,000 328,000 328,000 \n 263 18,400 18,400 18,400 \n 264 161,000 161,000 161,000 \n 265 161,000 161,000 161,000 \n 266 161,000 161,000 161,000 \n 267 112,940 112,940 112,940 \n 268 20,000 20,000 20,000 \n 269 215,000 0 0 \n 270 20,000 20,000 20,000 \n 271 105,000 105,000 105,000 \n 272 40,000 157,500 157,500 \n 273 95,000 105,000 105,000 \n 274 260,000 260,000 260,000 \n 275 365,000 365,000 365,000 \n 276 560,000 620,000 566,000 \n 277 150,000 150,000 150,000 \n 278 2,510,000 2,510,000 2,510,000 \n 279 357,000 357,000 357,000 \n 280 13,500 0 0 \n 281 814,220 462,720 462,720 \n 282 420,000 420,000 420,000 \n 283 73,500 73,500 73,500 \n 284 230,000 365,000 365,000 \n 285 55,000 55,000 55,000 \n 286 62,500 262,500 262,500 \n 287 80,000 0 0 \n 288 315,000 365,000 365,000 \n 289 120,000 0 0 \n 290 157,500 157,500 157,500 \n 291 525,000 525,000 525,000 \n 292 100,000 239,000 239,000 \n 293 250,000 365,000 365,000 \n 294 315,000 315,000 315,000 \n 295 265,000 365,000 365,000 \n 296 1,050,000 1,050,000 1,050,000 \n 297 100,000 315,000 315,000番号 委任者名等 原告元帳合計額 被告本訴主張額 認定 \n 298 365,000 365,000 365,000 \n 299 33,974 0 0 \n 300 950,350 950,350 950,350 \n 301 420,000 420,000 420,000 \n 302 36,000 36,000 36,000 \n 303 347,210 347,210 347,210 \n 304 105,000 105,000 105,000 \n 305 52,500 52,500 52,500 \n 306 683,240 683,240 683,240 \n 307 220,000 260,000 260,000 \n 308 6,000 0 0 \n 309 126,000 126,000 126,000 \n 310 415,000 155,000 155,000 \n 311 175,000 0 0 \n 312 805,096 805,096 805,096 \n 313 210,000 210,000 210,000 \n 314 0 182,500 182,500 \n 315 357,000 357,000 357,000 \n 316 36,480 36,480 36,480 \n 317 90,000 90,000 90,000 \n 318 262,500 262,500 262,500 \n 319 275,000 0 0 \n 320 157,500 157,500 157,500 \n 321 77,500 157,500 157,500 \n 322 365,000 365,000 365,000 \n 323 1,100,000 1,100,000 1,100,000 \n 324 115,000 0 0 \n 325 672,000 672,000 672,000 \n 326 304,500 304,500 304,500 \n 327 150,000 260,000 260,000 \n 328 210,000 210,000 210,000 \n 329 115,000 210,000 210,000 \n 330 200,000 365,000 365,000 \n 331 15,000 157,500 157,500 \n 332 420,000 420,000 420,000 \n 333 207,500 207,500 207,500 \n 334 21,650 21,650 21,650 \n 335 302,150 302,150 302,150 \n 336 78,293 78,293 78,293 \n 337 420,000 420,000 420,000 \n 338 315,000 315,000 315,000 \n 339 443,135 443,135 443,135 \n 340 150,000 365,000 365,000 \n 341 365,000 365,000 365,000 \n 342 365,000 365,000 365,000 \n 343 200,000 525,000 525,000 \n 344 315,000 315,000 315,000合計 97,411,127 101,724,873 101,589,613 \n （別紙８） \n １ 平成１３年分所得税 \n (1) 総所得金額 ５１９４万３２４８円上記金額は、次のアないしエの各金額の合計額である。 \n ア 事業所得の金額 ３９０６万０６２４円上記金額は、次の(ア)の金額から(イ)の金額を差し引いた後の金額である。 \n (ア) 総収入金額 １億１４９４万４８７６円 \n (イ) 必要経費の額 ７５８８万４２５２円イ 不動産所得の金額 １６１万４６２４円ウ 配当所得の金額 ２０万円エ 給与所得の金額 １１０６万８０００円 \n (2) 所得控除の合計額 ２００万８７７０円 \n (3) 課税総所得金額 ４９９３万４０００円上記金額は、上記(1)総所得金額５１９４万３２４８円から、上記(2)の所得控除の合計額２００万８７７０円を差し引いた後の金額である（ただし、国税通則法１１８条１項の規定に基づき１０ \n ００円未満の端数を切り捨てた後のもの。以下同じ。）。 \n (4) 納付すべき税額 １１１７万３４００円上記金額は、次のアの金額からイないしエの各金額を差し引いた後の金額である。 \n ア 課税総所得金額に対する税額 １５９８万５５８０円上記金額は、上記(3)の課税総所得金額４９９３万４０００円に所得税法８９条１項に規定する税率を乗じて算出した金額である。 \n イ 配当控除 １万円ウ 定率減税額 ２５万円エ 源泉徴収税額 ４５５万２１０２円 \n ２ 平成１４年分所得税 \n (1) 総所得金額 ３４３４万２５５３円上記金額は、次のアないしエの各金額の合計額である。 \n ア 事業所得の金額 １８６５万９３９２円上記金額は、次の(ア)の金額から(イ)の金額を差し引いた後の金額である。 \n (ア) 総収入金額 １億１１３７万９３１０円 \n (イ) 必要経費の額 ９２７１万９９１８円イ 不動産所得の金額 ４２２万７５９０円ウ 配当所得の金額 ２０万０９８４円エ 給与所得の金額 １１２５万４５８７円 \n (2) 所得控除の合計額 ２００万９３７０円 \n (3) 課税総所得金額 ３２３３万３０００円上記金額は、上記(1)総所得金額３４３４万２５５３円から、上記(2)の所得控除の合計額２００万９３７０円を差し引いた後の金額である。 \n (4) 納付すべき税額 △１５９万３６００円上記金額は、次のアの金額からイないしエの各金額を差し引いた後の金額からさらにオの金額を差し引いた後の金額である。 \n なお、「△」は還付金の額に相当する税額を示す。 \n ア 課税総所得金額に対する税額 ９４７万３２１０円上記金額は、上記(3)の課税総所得金額３２３３万３０００円に所得税法８９条１項に規定する税率を乗じて算出した金額である。 \n イ 配当控除 １万００５０円ウ 定率減税額 ２５万円エ 源泉徴収税額 ４７６万７３２２円オ 予定納税額 ６０３万９４００円 \n ３ 平成１３年課税期間の消費税等 \n (1) 消費税ア 課税標準額 １億１７７８万８０００円上記金額は、原告の平成１３年課税期間における課税資産の譲渡等の対価の額であり、原告の平成１３年消費税等確定申告書の付表の２に記載されている課税売上額１億１２１０万８９４ \n ０円（付表２①参照）に、同課税期間に係る課税資産の譲渡等の対価の額として本来計上すべきであった金額５９６万３９４４円（別紙５別表１「１ 平成１３年分の弁護士報酬等」の「申告額」１億０８９８万０９３２円と上記総収入金額１億１４９４万４８７６円との差額）に１０５分の１００を乗じた金額５６７万９９４６円を加算した金額である（ただし、国税通則法１１８条１項の規定に基づき１０００円未満の端数を切り捨てた後のもの。以下同じ。）。 \n イ 消費税額 ４７１万１５２０円上記金額は、上記アの金額に消費税法２９条に規定する消費税の税率１００分の４を乗じて算出した金額である。 \n ウ 控除対象仕入税額 ２７７万５６３１円エ 返還等対価に係る税額 ５８８５円オ 貸倒れに係る税額 ９５２４円上記金額は、前記１(1)アで述べたＹに係る着手金について、回収できないと認められる金額 \n ２５万円に係る消費税額である。 \n カ 差引納付すべき税額 １９２万０４００円上記金額は、上記イの金額からウないしオの各金額を差し引いた後の金額である（ただし、国税通則法１１９条１項の規定に基づき１００円未満の端数を切り捨てた後のもの。以下同じ。）。 \n (2) 地方消費税ア 課税標準となる消費税額 １９２万０４００円上記金額は、地方税法７２条の７７第２号及び同法７７条の８２の規定により、上記(1)カの金額となる。 \n イ 譲渡割額 ４８万０１００円上記金額は、上記アの金額に、地方税法７２条の８３に規定する税率１００分の２５を乗じて算出した金額である。 \n ウ 差引納付すべき譲渡割額 ４８万０１００円上記金額は、上記イの金額と同額である。 \n (3) 消費税等の合計税額 ２４０万０５００円上記金額は、上記(1)カの金額と(2)ウの金額の合計額である。 \n ４ 平成１４年課税期間の消費税等 \n (1) 消費税ア 課税標準額 １億１６３９万６０００円上記金額は、原告の平成１４年課税期間における課税資産の譲渡等の対価の額であり、平成１ \n ４年消費税等確定申告書の付表２に記載されている課税売上額１億１２２４万７７００円（付表 \n ２①参照）に、同課税期間に係る課税資産の譲渡等の対価の額として本来計上すべきであった金額４３５万５９８６円（別紙５別表１「２ 平成１４年分の弁護士報酬等」の「申告額」１億０ \n ７０２万３３２４円と上記認定額１億１１３７万９３１０円との差額）に１０５分の１００を乗じた金額４１４万８５５８円を加算した金額である。 \n イ 消費税額 ４６５万５８４０円上記金額は、上記アの金額に消費税法２９条に規定する消費税の税率１００分の４を乗じて算出した金額である。 \n ウ 控除対象仕入税額 ３５８万０６７７円エ 返還等対価に係る税額 ２万７６１９円上記金額は、前記２(1)ア(イ)で述べたとおり、原告とＨらとの間の契約金額の変更に伴い生じるものであり、当初の契約金額（着手金１７８万５０００円、概算実費３０万円）と変更後の金額（着手金１２６万円、概算実費１０万円）との差額７２万５０００円に係る消費税額である \n （消費税法３８条１項）。 \n オ 貸倒れに係る税額 ８９１４円上記金額は、前記２(1)ア(イ)で述べた丁に係る着手金について、回収できないと認められる金額２３万４０００円に係る消費税額である。 \n カ 差引税額 １０３万８６００円上記金額は、上記イの金額からウないしオの各金額を差し引いた後の金額である。 \n キ 中間納付税額 ８５万４２００円ク 差引納付すべき税額 １８万４４００円上記金額は、上記カの金額からキの金額を差し引いた後の金額である。 \n (2) 地方消費税ア 課税標準となる消費税額 １０３万８６００円上記金額は、地方税法７２条の７７第２号及び同法７７条の８２の規定により、上記(1)カの金額となる。 \n イ 譲渡割額 ２５万９６００円上記金額は、上記アの金額に、地方税法７２条の８３に規定する税率１００分の２５を乗じて算出した金額である。 \n ウ 中間納付譲渡割額 ２１万３５００円エ 差引納付すべき譲渡割額 ４万６１００円上記金額は、上記イの金額からウの金額を差し引いた後の金額である。 \n (3) 消費税等の合計納付税額 ２３万０５００円上記金額は、上記(1)クの金額と(2)エの金額の合計額である。 \n \n"
}