{
  "number": "11036",
  "title": "登録免許税還付請求事件",
  "court": "横浜地方裁判所",
  "date": "平成２０年９月２４日",
  "date_iso": "2008-09-24",
  "result": "棄却",
  "topics": [],
  "laws": [],
  "keywords": [
    "不当利得"
  ],
  "text": "\n \n 目次に戻る \n \n 判決 11036 \n 登録免許税還付請求事件 \n \n 裁判所:  横浜地方裁判所 \n 判決日:  平成２０年９月２４日 \n 結果:  棄却 \n \n \n 主文 \n １ 原告の請求を棄却する。\n２ 訴訟費用は原告の負担とする。 \n \n \n 第１ 請求被告は \n 、原告に対し、金２８００万円を支払え。 \n \n \n 第２ 事案の概要本件は \n 、原告が、別紙物件目録１ないし７４記載の各不動産（以下「本件各不動産」という。）を競売により取得して所有権移転登記又は持分移転登記（以下「本件各登記」という。）を経由する際に、被告に対し登録免許税として２８１２万８３００円を納付したが、本件各登記について登録免許税法（以下「法」ともいう。）４条２項が規定する非課税事由があったとして、被告に対し、不当利得に基づき、上記納付金額のうち２８００万円の返還を請求した事案である。 \n １ 争いのない事実等 \n (1) 原告は、昭和２９年に設立された宗教法人である（甲１）。 \n (2) 横浜地方裁判所は、平成１７年１２月２日、本件各不動産の競売手続（同庁平成 \n ●●年(○○)第● ●号、同年(○○)第● ●号）において原告に対し本件各不動産の売却許可の決定をした（原告は、平成１８年４月１３日にこれについての代金を納付した。）。本件各不動産中土地の地目は、その一部は宅地等であるが、大部分は山林や雑種地というものであった（乙１の１）。 \n (3) 原告は、平成１９年３月２８日、被告に対し、本件各登記等の登録免許税として \n ２８１２万８３００円（移転登記分２８１０万８３００円、抹消登記分２万円）を納付した（甲２、乙１の１・２）。 \n (4) 横浜地方裁判所裁判所書記官は、同月３０日、横浜地方法務局神奈川出張所に対し、本件各不動産について、登記権利者を原告、登記義務者をＢ株式会社、丙、丁、 \n 戊、Ｃ、Ｄ、Ｅとし、登記原因を、別紙物件目録１ないし５１の各不動産については平成１８年４月１３日担保不動産競売による売却、別紙物件目録５２ないし７４については同日強制競売による売却とする所有権移転登記又は持分移転登記（本件各登記）、並びに差押登記及び抵当権設定登記等の各抹消登記の嘱託をした（乙１の１）。 \n その際、原告から法別表第３の１２第４欄に定める書類の提出はなく、したがって、 \n 上記登記嘱託につき、これら書類の添付はなかった。 \n (5) 横浜地方法務局神奈川出張所登記官は、平成１９年３月３０日、上記嘱託を受けて本件各登記等をした（乙１の１）。 \n ２ 登録免許税法等の定め \n (1) 法４条２項 別表第３の第１欄に掲げる者が自己のために受けるそれぞれ同表の第３欄に掲げる登記等（同表の第４欄に財務省令で定める書類の添付があるものに限る旨の規定がある登記等にあっては、当該書類を添付して受けるものに限る。）については、登録免許税を課さない。 \n (2) 法別表第３の１２第１欄（名称） 宗教法人第２欄（根拠法） 宗教法人法第３欄（非課税の登記等） \n １ 専ら自己又はその包括する宗教法人の宗教の用に供する宗教法人法第３条（境内建物及び境内地の定義）に規定する境内建物の所有権の取得登記又は同条に規定する境内地の権利の取得登記 \n ２ 省略第４欄（備考） 第３欄の第１号又は第２号に該当するものであることを証する財務省令で定める書類の添付があるものに限る。 \n (3) 登録免許税法施行規則４条は、上記第４欄中第３欄の第１号に掲げる登記に係る部分につき規定する書類を、登記に係る不動産が第３欄の第１号に規定する不動産に該当する旨を証する当該不動産の所在地の都道府県知事等の書類（以下「非課税証明書」という。）としている。 \n ３ 争点及びこれに対する当事者の主張本件の争点は、本件各登記について法４条２項、別表第３の１２第３欄１号に規定する非課税事由があったことを理由に、原告が被告に対し、納付した登録免許税の還付を請求できるかどうかである。 \n （原告の主張） \n 原告は、本件各不動産を法別表第３の１２第３欄１号及び宗教法人法３条にいう「境内建物」及び「境内地」として取得し、現にそのように利用している。原告は、登録免許税を納付する際、本件各登記が非課税となることを知らずに、錯誤により納付してしまった。現実に本件各不動産が「境内建物」及び「境内地」である以上は、手続上の問題に関わらず、原告の還付請求は認められるべきである。 \n よって、原告は、不当利得に基づき、被告に対し、納付した登録免許税中２８００万円の支払を求める。 \n （被告の認否等） \n (1) 本件各不動産が法別表第３の１２第３欄１号及び宗教法人法３条にいう「境内建物」及び「境内地」に該当することは不知。 \n (2)ア 法４条２項、別表第３の１２第４欄は、法の特例を受けるための手続的課税要件を定めたものである。そして、当該法人が登録免許税の免除を受けたい場合には、 \n あらかじめ非課税証明書の交付を受けた上、登記等の申請をする際にこれを添付しなければならず、非課税証明書の添付がない限りは当該法人に登録免許税を納付させるべきである。 \n 本件では、本件各不動産が法別表第３の１２第３欄１号及び宗教法人法３条にいう「境内建物」及び「境内地」に該当するか不明である。そして、仮にこれらに該当するとしても、原告は本件各不動産の登記嘱託の際、非課税証明書の添付をしてはおらず、また、本件各登記が完了したことによって、適法に登録免許税の納付義務が成立するとともに納税額も確定したのであるから、原告の２８１２万８３００円を納付した行為は誤納付に当たらず登録免許税の還付を求めることはできない。 \n イ 原告は錯誤により登録免許税を納付したと主張するが、登録免許税は、納付義務者の主観に関係なく、登記の完了という客観的な事実によって納付義務が発生するとともに納税額が決定される租税であって、原告は錯誤無効を理由として登録免許税相当額の還付を請求することはできない。 \n \n \n 第３ 当裁判所の判断 \n １ 争点について \n 【判示(1)】 (1) 登録免許税は、国税通則法１５条３項所定のいわゆる自動確定の租税の一つであり、納税義務の成立と同時に、納税者又は税務官庁の特別の行為を要することなくいわば自動的に納付すべき税額が確定する租税である。そして、登録免許税の納税義務は登記等のときに成立し（国税通則法１５条２項１２号）、そのときに同時に納付すべき税額が確定することになる。また、登記を担当する登記官は、登記の申請、嘱託があったとき、その適正か否かの審査につき、形式的な審査権のみを有するものである。 \n 【判示(2)】 ところで、前記第２の２のとおり、登録免許税法４条２項、別表第３の１２第３欄 \n １号は、宗教法人が、専ら自己又はその包括する宗教法人の宗教の用に供する宗教法人法３条に規定する境内建物の所有権の取得登記又は同条に規定する境内地の権利の取得登記については、登録免許税を課さない旨規定するが、同第４欄は、これを同号に該当するものであることを証する財務省令で定める書類（非課税証明書）の添付があるものに限るとしている。また、法４条２項は、非課税となる登記等は、「同表の第４欄に財務省令で定める書類の添付があるものに限る旨の規定がある登記等にあっては、当該書類を添付して受けるものに限る。」旨その要件を明確に規定している。 \n 以上によると、法は、上記境内建物等の取得についての登記を非課税とすることにつき、登記を担当する登記官が形式的審査権しか有しないことも考慮し、非課税証明書の添付を要件（いわゆる手続的課税要件）としたものと解される。 \n (2) 本件についてみると、前記第２の１のとおり、原告は、平成１９年３月２８日、 \n 被告に対し本件各登記等の登録免許税として２８１２万８３００円を納付し、、横浜地方裁判所裁判所書記官は、同月３０日、横浜地方法務局神奈川出張所に対し本件各登記等の嘱託をし、横浜地方法務局神奈川出張所登記官は、同日、上記嘱託を受けて本件各登記等をしたというところ、この際、原告が非課税証明書を添付しなかったことについては当事者間に争いがない。 \n 【判示(3)】 そうすると、本件各登記については、手続的課税要件を満たしてはおらず、法４条 \n ２項の適用を受けることができないから、原告が登録免許税を過大に納付したということはできない（なお、原告は、同項の適用を受けられない場合、２８１２万８３０ \n ０円という額が過大であると主張するものではない。）。 \n 【判示(4)】 また、原告は、本件各登記が非課税になることを知らずに錯誤により登録免許税を納付したと主張する。しかし、本件各不動産中土地の地目は、前記第２の１(2)のとおり、その一部は宅地等であり、大部分は山林や雑種地というものであって、本件各登記の手続がされた時点で、原告が非課税証明書の交付を受けることができたかどうかは明らかではないが、いずれにせよ、原告が非課税証明書を添付しなかったために法４条２項の適用を受けることができないという以上は、自動確定の租税の一つである登録免許税の性質上、２８１２万８３００円の納付義務があるというべきであって、 \n これについて錯誤を論じる余地はない。 \n ２ 結論以上のとおりであって、原告の請求は理由がないからこれを棄却することとして、主文のとおり判決する。 \n 横浜地方裁判所第１民事部裁判長裁判官 北澤 章功裁判官 土谷 裕子裁判官 高橋 心平 \n （別紙） \n 物件目録 \n １ 所 在 横浜市地 番地 目 雑種地地 積 １９４９平方メートル \n ２ 所 在 横浜市地 番地 目 原野地 積 ８１０平方メートル \n ３ 所 在 横浜市地 番地 目 山林地 積 ２１１７平方メートル \n ４ 所 在 横浜市地 番地 目 山林地 積 ７３１平方メートル \n ５ 所 在 横浜市地 番地 目 公衆用道路地 積 １０８平方メートル \n ６ 所 在 横浜市地 番地 目 雑種地地 積 １３０平方メートル \n ７ 所 在 横浜市地 番地 目 雑種地地 積 ６４０平方メートル \n ８ 所 在 横浜市地 番地 目 雑種地地 積 ４４５平方メートル \n ９ 所 在 横浜市地 番地 目 畑地 積 １７平方メートル \n １０ 所 在 横浜市地 番地 目 雑種地地 積 １９９平方メートル \n １１ 所 在 横浜市地 番地 目 公衆用道路地 積 ３５９平方メートル \n １２ 所 在 横浜市地 番地 目 雑種地地 積 ４９２平方メートル \n １３ 所 在 横浜市地 番地 目 宅地地 積 ８７２．１１平方メートル \n １４ 所 在 横浜市地 番地 目 雑種地地 積 ３４１平方メートル \n １５ 所 在 横浜市地 番地 目 公衆用道路地 積 １７平方メートル \n １６ 所 在 横浜市地 番地 目 雑種地地 積 ０．０５平方メートル \n １７ 所 在 横浜市地 番地 目 山林地 積 １８９０平方メートル \n １８ 所 在 横浜市地 番地 目 山林地 積 １８９１平方メートル \n １９ 所 在 横浜市地 番地 目 山林地 積 １５９平方メートル \n ２０ 所 在 横浜市地 番地 目 山林地 積 ７．７４平方メートル \n ２１ 所 在 横浜市地 番地 目 雑種地地 積 ７６５平方メートル \n ２２ 所 在 横浜市地 番地 目 雑種地地 積 １７５８平方メートル \n ２３ 所 在 横浜市地 番地 目 雑種地地 積 ５４５平方メートル \n ２４ 所 在 横浜市地 番地 目 雑種地地 積 １５４平方メートル \n ２５ 所 在 横浜市地 番地 目 雑種地地 積 ３１２平方メートル \n ２６ 所 在 横浜市地 番地 目 雑種地地 積 １０７平方メートル \n ２７ 所 在 横浜市地 番地 目 山林地 積 １２２０平方メートル \n ２８ 所 在 横浜市地 番地 目 公衆用道路地 積 ５７平方メートル \n ２９ 所 在 横浜市地 番地 目 畑地 積 １３６平方メートル \n ３０ 所 在 横浜市地 番地 目 公衆用道路地 積 ３７平方メートル \n ３１ 所 在 横浜市地 番地 目 雑種地地 積 １５平方メートル \n ３２ 所 在 横浜市地 番地 目 雑種地地 積 ５．２７平方メートル \n ３３ 所 在 横浜市地 番地 目 公衆用道路地 積 １５２平方メートル \n ３４ 所 在 横浜市地 番地 目 雑種地地 積 １６平方メートル \n ３５ 所 在 横浜市地 番地 目 宅地地 積 ３０１．２１平方メートル \n ３６ 所 在 横浜市地 番地 目 畑地 積 １６９平方メートル \n ３７ 所 在 横浜市地 番地 目 畑地 積 ３５平方メートル \n ３８ 所 在 横浜市地 番地 目 公衆用道路地 積 ３．９４平方メートル \n ３９ 所 在 横浜市地 番地 目 公衆用道路地 積 ４２平方メートル \n ４０ 所 在 横浜市地 番地 目 雑種地地 積 １０５５平方メートル \n ４１ 所 在 横浜市地 番地 目 雑種地地 積 ４８３平方メートル \n ４２ 所 在 横浜市地 番地 目 雑種地地 積 ２１４平方メートル \n ４３ 所 在 横浜市地 番地 目 雑種地地 積 ７９５平方メートル \n ４４ 所 在 横浜市地 番地 目 公衆用道路地 積 １６平方メートル \n ４５ 所 在 横浜市地 番地 目 雑種地地 積 ３１６平方メートル \n ４６ 所 在 横浜市地 番地 目 雑種地地 積 １３６平方メートル \n ４７ 所 在 横浜市地 番地 目 雑種地地 積 ０．０９平方メートル \n ４８ 所 在 横浜市地 番地 目 山林地 積 ９６９平方メートル \n ４９ 所 在 横浜市地 番地 目 山林地 積 ２２３平方メートル \n ５０ 所 在 横浜市地 番地 目 山林地 積 ２５９平方メートル \n ５１ 所 在 横浜市家屋番号種 類 スポーツクラブハウス構 造 鉄筋コンクリート造陸屋根地下１階付き２階建床 面 積 １階 １６９３．５２平方メートル \n ２階 １０２７．１０平方メートル地下１階 ３８５．２９平方メートル \n ５２ 所 在 横浜市地 番地 目 雑種地地 積 ７９平方メートル \n ５３ 所 在 横浜市地 番地 目 雑種地地 積 ５７平方メートル \n ５４ 所 在 横浜市地 番地 目 山林地 積 ６８８平方メートル \n ５５ 所 在 横浜市地 番地 目 雑種地地 積 １１２平方メートル \n ５６ 所 在 横浜市地 番地 目 雑種地地 積 １５０平方メートル \n ５７ 所 在 横浜市地 番地 目 雑種地地 積 ７３平方メートル \n ５８ 所 在 横浜市地 番地 目 雑種地地 積 ３３平方メートル \n ５９ 所 在 横浜市地 番地 目 雑種地地 積 ２０３平方メートル \n ６０ 所 在 横浜市地 番地 目 雑種地地 積 １９平方メートル \n ６１ 所 在 横浜市地 番地 目 雑種地地 積 ６４平方メートル \n ６２ 所 在 横浜市地 番地 目 雑種地地 積 ９５平方メートル \n ６３ 所 在 横浜市地 番地 目 雑種地地 積 ４８平方メートル \n ６４ 所 在 横浜市地 番地 目 雑種地地 積 ８．０９平方メートル \n ６５ 所 在 横浜市地 番地 目 雑種地地 積 １０平方メートル \n ６６ 所 在 横浜市地 番地 目 雑種地地 積 ３．１３平方メートル \n ６７ 所 在 横浜市地 番地 目 雑種地地 積 ０．１７平方メートル \n ６８ 所 在 横浜市地 番地 目 雑種地地 積 ２０平方メートル \n ６９ 所 在 横浜市地 番地 目 山林地 積 １０４０平方メートル \n （持分２分の１） \n ７０ 所 在 横浜市家屋番号種 類 調理場・便所構 造 鉄筋コンクリート造陸屋根平家建床 面 積 ９８．００平方メートル \n ７１ 所 在 横浜市家屋番号種 類 倉庫構 造 鉄筋コンクリート造陸屋根平家建床 面 積 １３０．３８平方メートル \n ７２ 所 在 横浜市家屋番号種 類 機械室構 造 鉄筋コンクリート造陸屋根地下１階建床 面 積 ２０１．２５平方メートル \n ７３ 所 在 横浜市家屋番号種 類 調理場構 造 鉄筋コンクリート造陸屋根スレート葺平家建床 面 積 ２８．００平方メートル \n ７４ 所 在 横浜市家屋番号種 類 便所構 造 鉄筋コンクリート造陸屋根平家建床 面 積 ５２．５０平方メートル \n \n"
}