{
  "number": "11054",
  "title": "損害賠償請求事件",
  "court": "松山地方裁判所",
  "date": "平成２０年１０月２０日",
  "date_iso": "2008-10-20",
  "result": "棄却",
  "topics": [
    "相続税"
  ],
  "laws": [],
  "keywords": [
    "国家賠償",
    "損害賠償"
  ],
  "text": "\n \n 目次に戻る \n \n 判決 11054 \n 損害賠償請求事件 \n \n 裁判所:  松山地方裁判所 \n 判決日:  平成２０年１０月２０日 \n 結果:  棄却 \n \n \n 主文 \n １ 原告の請求を棄却する。\n２ 訴訟費用は、原告の負担とする。 \n \n \n 第１ 請求被告は \n 、原告に対し、１０万円を支払え。 \n \n \n 第２ 事案の概要本件は \n 、原告が、原告は、八幡浜税務署が平成９年６月に行った相続税の調査結果について、そのころ不服申立制度に基づく不服申立てを行ったが、同署職員から「待ってくれ」\nと言われて回答を引き延ばされ、その後最近になって高松国税局から「回答の義務がない」\nとの回答があったが、不服申立制度に基づいて行った申立てに対して回答をしないことは不法行為であると主張し、また、制度上回答の義務がないものであれば不服申立制度に不備があり、被告が改善せずに運用したことは不法行為であると主張し、被告の上記不法行為により精神的苦痛を被ったとして、被告に対し、国家賠償法１条１項に基づき損害賠償を請求した事案である。 \n \n \n 第３ 判断 \n 【判示】 １ 原告は、不服申立制度に基づいて行った申立てに対して回答をしないことは不法行為であり、この不法行為により精神的苦痛を被ったと主張する。\nしかし、原告は、どのような法的根拠に基づいて、どのような内容の不服申立てをしたのかを明らかにしないのであり、違法性についての主張がなされていないものというべきであるから、上記不法行為の主張は主張自体失当である。\n２ 原告は、制度上回答の義務がないものであれば不服申立制度に不備があり、被告が改善せずに運用したことは不法行為であり、この不法行為により精神的苦痛を被ったと主張する。\nしかし、原告は、どのような法的根拠に基づいて、どのような内容の不服申立てをしたのかを明らかにしないのであり、違法性についての主張がなされていないものというべきであるから、上記不法行為の主張は主張自体失当である。 \n \n \n 第４ 結論以上によれば \n 、原告の請求は理由がないからこれを棄却することとし、訴訟費用の負担について民事訴訟法６１条を適用して、主文のとおり判決する。\n松山地方裁判所民事第１部裁判官 山本 剛史 \n \n"
}