{
  "number": "11117",
  "title": "損害賠償請求事件",
  "court": "松山地方裁判所",
  "date": "平成２１年１月１９日",
  "date_iso": "2009-01-19",
  "result": "棄却",
  "topics": [
    "相続税"
  ],
  "laws": [],
  "keywords": [
    "国家賠償",
    "損害賠償"
  ],
  "text": "\n \n 目次に戻る \n \n 判決 11117 \n 損害賠償請求事件 \n \n 裁判所:  松山地方裁判所 \n 判決日:  平成２１年１月１９日 \n 結果:  棄却 \n \n \n 主文 \n １ 原告の請求を棄却する。\n２ 訴訟費用は、原告の負担とする。 \n \n \n 第１ 請求被告は \n 、原告に対し、１０万円を支払え。 \n \n \n 第２ 事案の概要本件は \n 、原告が、八幡浜税務署員は原告に対し、平成６年ころの亡乙の遺産の税務調査の結果について、「相続税の申告書が丙（原告の弟）税理事務所から提出されたので、丁先生に税務調査の結果を説明した」との説明（以下「本件説明」という。）をしたが、丙税理事務所が亡乙の遺産についての相続税の申告書を提出した事実はなく、本件説明は虚偽の説明であり不法行為であると主張し、本件説明により精神的苦痛を被ったとして、被告に対し、国家賠償法１条１項に基づき損害賠償を請求した事案である。 \n \n \n 第３ 判断 \n １ 弁論の全趣旨によれば亡乙の遺産について税務調査が行われたのは平成９年ころであることが認められ、平成６年ころに八幡浜税務署員が本件説明を行うことは考えられないこと、原告は本件説明をした八幡浜税務署員の氏名はわからないと釈明していることからすれば、原告が不法行為であると主張する本件説明については、いつ、誰が行ったものであるのか不明であって、不法行為となる事実が特定されておらず、不法行為の主張は主張自体失当である。\n２ また、仮に原告の主張によって不法行為となる事実が特定されていると解するとしても、本件説明が、原告に慰謝料請求権が発生する程度の不法行為に該当するということはできず、原告の請求は理由がない。\n３ 以上によれば、原告の請求は理由がない。 \n \n \n 第４ 結論したがって \n 、原告の請求は理由がないからこれを棄却することとし、訴訟費用の負担について民事訴訟法６１条を適用して、主文のとおり判決する。\n松山地方裁判所民事第１部裁判官 山本 剛史 \n \n"
}