{
  "number": "11170",
  "title": "国家賠償法に基づく損害賠償請求事件",
  "court": "宇都宮地方裁判所",
  "date": "平成２１年３月２５日",
  "date_iso": "2009-03-25",
  "result": "棄却",
  "topics": [
    "所得税"
  ],
  "laws": [],
  "keywords": [
    "国家賠償",
    "損害賠償"
  ],
  "text": "\n \n 目次に戻る \n \n 判決 11170 \n 国家賠償法に基づく損害賠償請求事件 \n \n 裁判所:  宇都宮地方裁判所 \n 判決日:  平成２１年３月２５日 \n 結果:  棄却 \n \n \n 主文 \n １ 原告の請求を棄却する。\n２ 訴訟費用は原告の負担とする。 \n \n \n 第１ 請求被告は \n 、原告に対し、２０２７万０４３５円及びこれに対する平成２０年７月１日から支払済みまで年５分の割合による金員を支払え。 \n \n \n 第２ 事案の概要本件は \n 、足利税務署長が、原告に対し、平成２０年２月２７日付けで原告の平成１６年分及び平成１７年分の所得税について更正（以下「本件各更正」という。）を行ったところ、原告が、本件各更正に従った結果、実際には還付されていない還付金の額相当額についても納付する義務があると誤信してこれを納付し、それにより同額の損害及び本訴提起のための弁護士費用相当の損害を被ったとして、被告に対し、国家賠償法１条１項に基づき、上記各損害の賠償及びこれに対する民法所定の年５分の割合による遅延損害金の支払を求めた事案である。\n１ 前提事実（争いのない事実及び括弧内掲記の証拠等により容易に認められる事実）\n(1) 原告は、足利税務署長に対し、平成１９年５月１８日、平成１６年分及び平成１７年分の所得税の確定申告書を提出した。平成１６年分の確定申告書の内容は、事業所得が赤字であり、\n不動産所得及び給与所得と損益通算を行うと、６５６万０２５９円の還付金が生じるというものであり、平成１７年分の確定申告書の内容は、同様に１１９１万０１７６円の還付金（以下、\n平成１６年分の還付金と併せて「本件各還付金」という。）が生じるというものであった（乙\n２、３）。\n(2) 足利税務署長は、平成１９年５月１８日当時、原告の個人事業等に対する実地調査を行っていたことから、所得税法施行令２６７条４項に基づき、原告に対する本件各還付金の還付を留保した（弁論の全趣旨）。\n(3) 足利税務署長は、原告に対し、平成２０年２月２７日付けで、別紙１及び２記載のとおり、\n本件各更正を行った（甲１、３、乙６、７）。\n(4) 原告は、国に対し、平成２０年３月２７日、本件各更正の更正通知書に記載された「本税の額」（別紙１及び２のしのⒸ欄「差引納付すべき税額又は減少する税額」欄括弧内記載の額）\nの金額（平成１６年分につき１８８３万２９００円、平成１７年分につき１６８４万２３００円。）を納付した（甲２、４）。\n２ 争点及びこれに関する当事者の主張本件各更正は違法か。\n（原告の主張）\n足利税務署長は、還付金の有無及びその額を正確に把握する職務上の注意義務があるところ、\n本件各還付金が実際には還付されていないにもかかわらず、これを看過して本件各更正を行ったのであるから、本件各更正は上記注意義務に違反した違法なものである。そうでないとしても、\n本件各更正は、還付されていない還付金が加算されて記載されている旨通知すべき注意義務に違反してされた違法なものである。\nこの足利税務署長の不法行為により、原告は、本件各更正の「本税の額」欄記載の納税義務があると誤信し、所得税を課す者としての被告（以下、この意味における被告を「国」という。）\nに対し、平成２０年３月２７日、平成１６年分の更正後の「本税の額」の一部として受領していない還付金の額に相当する税額である６５６万０２５９円を、平成１７年分の更正後の「本税の額」の一部として受領していない還付金の額に相当する税額である１１９１万０１７６円を、それぞれ納付し、これにより同額の損害を被った。また、これと相当因果関係のある弁護士費用は\n１８０万円である。よって、被告は国家賠償法１条１項に基づきこれらの損害を賠償すべき義務を負う。\n（被告の主張）\n更正通知書には、納付すべき税額が更正により増加するときはその増加する部分の金額を、還付金の額に相当する税額が更正により減少するときはその減少する部分の金額を、いずれも記載することとされているが（国税通則法２８条２項３号イ及びロ）、更正通知書の「本税の額」には、更正により増加する税額及び減少する還付金額がいずれも存在する場合には、これらが合算された金額が記載されることになる。また、更正により減少する還付金額は、更正前の還付金が実際に還付されたか否かにかかわらず、減少する金額を機械的に算出して記載されるのであって、\n本件各更正の通知書の記載に何ら違法性はなく、本件各更正も違法ではない。したがって、被告が原告に対し国家賠償法に基づく損害賠償責任を負うこともない。 \n \n \n 第３ 当裁判所の判断申告納税方式による国税は \n 、納付すべき税額が納税者のする申告により確定することを原則とし、\nその申告がない場合又は納税者の申告に係る税額が税務署長又は税関長の調査したところと異なる場合に限り、決定（国税通則法２５条）又は更正（同法２４条）により確定する（同法１６条１項１号）。このように、申告納税方式による国税は、納税者の申告により第一次的に確定するのであり、更正は既に確定した税額を変更する処分であるところ、このような更正の性質から、国税通則法は、納税者の申告に係る還付金が現実に還付されたか否かにかかわらず、更正通知書に「その更正前の還付金の額に相当する税額がその更正により減少するときは、その減少する部分の税額」\nを記載しなければならないとしている（同法２８条２項３号ロ）。したがって、更正の時点において、その更正前の還付金の額に相当する税額が還付されていないとしても、その更正前の還付金の額に相当する税額が更正により減少するときは、更正通知書にその減少する部分の税額を記載する必要があることとなる。\n本件各更正の更正通知書においても、更正前の「還付金の額に相当する税額」として本件各還付金額が記載され（別紙１及び２のごのⒶ欄）、これが更正により存在しないことになる（同ごのⒷ欄が空欄となっている。）ため、更正前後の「還付金の額に相当する税額」の増減差額としては、\n本件各還付金額分のマイナス（△）となる旨記載されている（別紙１及び２のごのⒸ欄）ところ、\nこのような記載は上記国税通則法の定めに従ったものであって、何ら違法であるとは認められない。\nそして、更正が、納税者の申告により第一次的に確定した税額を変更して、納付すべき税額を算出して確定することを目的とする処分であることからすれば、足利税務署長が、原告の税の未納状況や還付金の還付状況にかかわらず、本件各更正により増加した「納付すべき税額」（同このⒸ欄）\n及び減少した「還付金の額に相当する税額」の和を「本税の額」とした本件各更正を行い、その旨の更正通知書を原告に交付したことにも違法性は認められない。\nこれに対して、原告は、本件各更正が還付金の有無及びその額を把握すべき注意義務に違反してされた違法なものである旨主張する。しかし、本件各還付金が原告に還付されたか否かにかかわらず、行われるべき更正の内容に異なるところがないことは上記したところから明らかであるから、\n原告が主張する注意義務違反が本件各更正の違法性を基礎付けるものでないことも自ずから明らかである。\nまた、原告は、本件各更正が、還付されていない還付金が加算されて記載されている旨通知すべき注意義務に違反してされた違法なものであるとも主張する。しかし、申告により確定した税額を変更して納付すべき税額を確定するという更正の本質からすると、納税者が還付金があるとして申告した以上、それを前提とした更正が行われ、その旨の通知がされるのは当然のことであり、それ以上に足利税務署長において原告が主張するような通知を行うべき義務があったとはいえない。 \n \n \n 第４ 結論よって \n 、その余の点について判断するまでもなく、原告の請求は理由がないからこれを棄却することとし、主文のとおり判決する。 \n 宇都宮地方裁判所第２民事部裁判長裁判官 柴田 秀裁判官 熊代 なつみ裁判官 近藤 義浩 \n （別紙１） \n 別表 平成１６年分 \n (青白) (番号)氏名 甲 殿 白 \n Ⓒ 増減（△印）差額区 分 Ⓐ 更正前の額 Ⓑ 更正後の額 \n （Ⓑ－Ⓐ） \n 事 業 所 得 ① △36,815,839円 8,773,681円不 動 産 所 得 ② 2,043,754 7,589,390所 給 与 所 得 ③ 54,589,727 54,589,727得 ④金 ⑤額 \n 計 （ 総 所 得 ） ⑥ 19,817,642 70,952,798 51,135,156 円 \n ⑦ \n ⑧雑 損 、 医 療 費 控 除 ⑨所 \n 得 ＊社会保険料、小規模企業共済等掛金控除 ⑩ 1,443,710 1,443,710金 \n 生命保険料、損害保険料、寄付金控除 ⑪額 \n か 障害者、寡婦（寡夫）、勤労学生控除 ⑫ら \n 差 配 偶 者 控 除 ⑬ 380,000 380,000し 配 偶 者 特 別 控 除 ⑭引 \n か 扶 養 控 除 ⑮ 860,000 860,000れ \n 基 礎 控 除 ⑯ 380,000 380,000る \n 金 ⑰額 \n 所 得 控 除 額 の 計 ⑱ 3,063,710 3,063,710課税される所得金額 総 所 得 ⑲ 16,753,000 67,889,000 \n （⑱の金額を⑥、⑦、⑧から ⑳順に控除） あ算 ⑲ に 対 す る 税 額 ぃ 3,795,900 22,628,930出 ⑳ に 対 す る 税 額 い税 あ に 対 す る 税 額 ぅ額 \n 計 う 3,795,900 22,628,930税金から差し ぇ引かれる金額 え差引得税額（う－ぇ－え） （引ききれないときは０） ぉ 3,795,900 22,628,930災 害 減 免 額 お外 国 税 額 控 除 か再 差 引 所 得 税 額 （ぉ－お－か） が 3,795,900 22,628,930き \n 定 率 減 税 額 ぎ 250,000 250,000源 泉 徴 収 税 額 く 10,106,159 10,106,159申 告 納 税 額 （が－き－ぎ－く） ぐ △6,560,259 12,272,700 18,832,959円第 １ 期 け予 定 納 税 額第 ２ 期 げ確 定 納 税 額 納 付 す べ き 税 額 こ 12,272,700 12,272,700 \n （ぐ－け－げ） 還付金の額に相当する税額 ご 6,560,259 △6,560,259還付金の額に相当する税額 さ損 失 の 繰 戻 し減 少 す る 還 付 加 算 金 ざ差引納付すべき税額又は減少（△印）する税額 ( 18,832,900)し \n （こ－ご－さ＋ざ） 18,832,959加算税の基礎となる税額 じ 円 円 加重分の過少（無）申告加算税がある場合には、付表で計算した加算税申 告 加 算 税 加 算 税 の 割 合 す ％ ％の額がず欄に移記してあります。 \n 加 算 税 の 額 （じ×す） ず 円 円 円加算税の基礎となる税額 せ 18,830,000重 加 算 税 加 算 税 の 割 合 ぜ ％ 40％加 算 税 の 額 （せ×ぜ） そ 円 7,532,000円 7,532,000円翌年へ繰り越す純損失・雑損失の金額 ぞ翌年へ繰り越す株式等に係る譲渡損失の金額 た翌年へ繰り越す先物取引に係る損失の金額 だ \n （別紙２） \n 別表 平成１７年分 \n (青白) (番号)氏名 甲 殿 白 \n Ⓒ 増減（△印）差額区 分 Ⓐ 更正前の額 Ⓑ 更正後の額 \n （Ⓑ－Ⓐ） \n 事 業 所 得 ① △34,181,286円 7,695,095円不 動 産 所 得 ② 2,034,898 5,298,454所 給 与 所 得 ③ 76,200,000 76,200,000得 ④金 ⑤額 \n 計 （ 総 所 得 ） ⑥ 44,053,612 89,193,549 45,139,937 円 \n ⑦ \n ⑧雑 損 、 医 療 費 控 除 ⑨所 \n 得 ＊社会保険料、小規模企業共済等掛金控除 ⑩ 1,075,922 1,075,922金 \n 生命保険料、損害保険料、寄付金控除 ⑪額 \n か 障害者、寡婦（寡夫）、勤労学生控除 ⑫ら \n 差 配 偶 者 控 除 ⑬ 380,000 380,000し 配 偶 者 特 別 控 除 ⑭引 \n か 扶 養 控 除 ⑮ 860,000 480,000れ \n 基 礎 控 除 ⑯ 380,000 380,000る \n 金 ⑰額 \n 所 得 控 除 額 の 計 ⑱ 2,695,922 2,315,922課税される所得金額 総 所 得 ⑲ 41,357,000 86,877,000 \n （⑱の金額を⑥、⑦、⑧から ⑳順に控除） あ算 ⑲ に 対 す る 税 額 ぃ 12,812,090 29,654,490出 ⑳ に 対 す る 税 額 い税 あ に 対 す る 税 額 ぅ額 \n 計 う 12,812,090 29,654,490税金から差し ぇ引かれる金額 え差引得税額（う－ぇ－え） （引ききれないときは０） ぉ 12,812,090 29,654,490災 害 減 免 額 お外 国 税 額 控 除 か再 差 引 所 得 税 額 （ぉ－お－か） が 12,812,090 29,654,490き \n 定 率 減 税 額 ぎ 250,000 250,000源 泉 徴 収 税 額 く 24,472,266 24,472,265申 告 納 税 額 （が－き－ぎ－く） ぐ △11,910,176 4,932,200 16,842,376円第 １ 期 け予 定 納 税 額第 ２ 期 げ確 定 納 税 額 納 付 す べ き 税 額 こ 4,932,200 4,932,200 \n （ぐ－け－げ） 還付金の額に相当する税額 ご 11,910,176 △11,910,176還付金の額に相当する税額 さ損 失 の 繰 戻 し減 少 す る 還 付 加 算 金 ざ差引納付すべき税額又は減少（△印）する税額 ( 16,842,300)し \n （こ－ご－さ＋ざ） 16,842,376加算税の基礎となる税額 じ 円 140,000円 加重分の過少（無）申告加算税がある場合には、付表で計算した加算税無 申 告 加 算 税 加 算 税 の 割 合 す ％ 15％の額がず欄に移記してあります。 \n 加 算 税 の 額 （じ×す） ず 円 21,000円 21,000円加算税の基礎となる税額 せ 16,700,000重 加 算 税 加 算 税 の 割 合 ぜ ％ 40％加 算 税 の 額 （せ×ぜ） そ 円 6,680,000円 6,680,000円翌年へ繰り越す純損失・雑損失の金額 ぞ翌年へ繰り越す株式等に係る譲渡損失の金額 た翌年へ繰り越す先物取引に係る損失の金額 だ \n \n"
}