{
  "number": "11269",
  "title": "税務訴訟資料 第２５９号－１５６（順号１１２６９） 東京高等裁判所 平成●●年（○○）第●●号 所得税課税処分無効確認、債務不存在確認等請求控 訴事件 国側当事者・国（長野税務署長） 平成２１年９月１",
  "court": "東京高等裁判所",
  "date": "平成２１年９月１６日",
  "date_iso": "2009-09-16",
  "result": "棄却",
  "topics": [
    "所得税"
  ],
  "laws": [],
  "keywords": [
    "更正処分",
    "課税処分",
    "過少申告加算税"
  ],
  "text": "\n \n 目次に戻る \n \n 判決 11269 \n 税務訴訟資料 第２５９号－１５６（順号１１２６９） 東京高等裁判所 平成●●年（○○）第●●号 所得税課税処分無効確認、債務不存在確認等請求控 訴事件 国側当事者・国（長野税務署長） 平成２１年９月１ \n \n 裁判所:  東京高等裁判所 \n 判決日:  平成２１年９月１６日 \n 結果:  棄却 \n \n \n 主文 \n １ 本件控訴を棄却する。\n２ 控訴費用は控訴人の負担とする。 \n \n \n 第１ 控訴の趣旨 \n １ 原判決を取り消す。\n２ 処分行政庁長野税務署長が控訴人に対し平成元年度及び平成２年度をもってなした所得税賦課（課税）処分は無効であることを確認する。 \n \n \n 第２ 事案の概要 \n １ 本件は、長野税務署長から平成元年分及び平成２年分の所得税の更正処分及び過少申告加算税の賦課処分（以下「本件課税処分」という。）を受け、本件課税処分に基づいて全額を納付した控訴人が、本件課税処分の無効確認を求めた事案である。\n原判決は、本件訴えは不適法であるとしてこれを却下し、控訴人は、これを不服として控訴した。\n２ 当事者の主張は、原判決の「事実及び理由」の「第２ 当事者の主張」の１及び２に記載のとおりであるから、これを引用する。 \n \n \n 第３ 当裁判所の判断控訴人が本件課税処分に基づ \n いて全額を納付済みであることについては、当事者間に争いがないところ、控訴人が本件課税処分に基づいて全額を納付した後においては、滞納処分を受けるおそれはないのであるから、現時点において、本件課税処分に起因する紛争を解決するための訴訟形態としては、本件課税処分の無効を前提とした既納税金の返還を求める訴えが直截的で適切な訴訟形態であり、この返還請求訴訟により、控訴人はその目的を達することができるといえる。\nしたがって、控訴人に行政事件訴訟法３６条所定の無効確認の訴えの原告適格を認めることはできず、本件訴えは不適法として却下を免れない。\nよって、本件訴えを却下した原判決は相当であり、本件控訴は理由がないから、これを棄却する。\n東京高等裁判所第５民事部裁判長裁判官 小林 克已裁判官 山﨑 まさよ裁判官 林 俊之 \n \n"
}