{
  "number": "11264",
  "title": "法人税更正処分等取消請求事件",
  "court": "札幌地方裁判所",
  "date": "平成２１年８月２８日",
  "date_iso": "2009-08-28",
  "result": "取消",
  "topics": [
    "法人税"
  ],
  "laws": [
    "法人税法22条"
  ],
  "keywords": [
    "更正処分",
    "重加算税",
    "過少申告加算税",
    "役員報酬"
  ],
  "text": "\n \n 目次に戻る \n \n 判決 11264 \n 法人税更正処分等取消請求事件 \n \n 裁判所:  札幌地方裁判所 \n 判決日:  平成２１年８月２８日 \n 結果:  取消 \n \n \n 主文 \n １ 原告の請求をいずれも棄却する。\n２ 訴訟費用は原告の負担とする。 \n \n \n 第１ 当事者の求めた裁判 \n １ 請求の趣旨\n(1) 札幌南税務署長が原告に対し平成１７年７月８日付けでした、平成１１年３月１日から平成１２年２月２９日までの事業年度に係る法人税の更正処分及び重加算税の賦課決定処分を取り消す。\n(2) 札幌南税務署長が原告に対し平成１７年７月８日付けでした、平成１２年３月１日から平成１３年２月２８日までの事業年度に係る法人税の更正処分及び重加算税の賦課決定処分を取り消す。\n(3) 札幌南税務署長が原告に対し平成１７年７月８日付けでした、平成１３年３月１日から平成１４年２月２８日までの事業年度に係る法人税の更正処分のうち修正申告による所得金額\n６０７万１６６１円、納付すべき税額１３３万５１００円を超える部分及び過少申告加算税・重加算税の賦課決定処分、並びに、修正申告に基づく増加税額に係る重加算税の賦課決定処分を取り消す。\n(4) 札幌南税務署長が原告に対し平成１７年７月８日付けでした、平成１４年３月１日から平成１５年２月２８日までの事業年度に係る法人税の更正処分のうち修正申告による所得金額\n２３０９万２４１２円、納付すべき税額６３１万８５００円を超える部分及び重加算税の賦課決定処分、並びに、修正申告に基づく増加税額に係る重加算税の賦課決定処分を取り消す。\n(5) 訴訟費用は被告の負担とする。\n２ 請求の趣旨に対する答弁\n(1) 原告の請求をいずれも棄却する。\n(2) 訴訟費用は原告の負担とする。 \n \n \n 第２ 前提となる事実 \n １ 原告は、金融業、各種債権の売買、金銭債権買取業務及び総合管理等を目的とする株式会社である（弁論の全趣旨）。 \n ２ 原告は、札幌南税務署長に対し、別表の順号①「確定申告」欄記載のとおり、各事業年度に係る法人税の各確定申告書を、いずれも法定申告期限内に提出した（乙１の①ないし④）（なお、 \n 原告における事業年度は３月１日から翌年の２月末日までであり、平成１２年２月期とは平成１ \n １年３月１日から平成１２年２月２９日までの事業年度を意味する。平成１３年２月期以下についても同じ。）。 \n ３ 原告は、平成１７年３月２５日、同署長に対し、確定申告の内容に誤りがあったとして、別表の順号②「修正申告」欄記載のとおり、各修正申告書（以下「本件各修正申告書」という。）を提出した（乙２の①、②）。 \n ４ 本件各修正申告書の内容は、別表１記載のとおりである（乙２の①、②）。 \n ５ 札幌南税務署長は、本件各修正申告書の提出を受けて、平成１７年７月８日付けで、別表の順号③「賦課決定処分」欄記載のとおり、平成１４年２月期及び平成１５年２月期の法人税に係る重加算税の各賦課決定処分（以下「本件各賦課決定処分１」という。）を行った（甲１の①）。 \n ６ 札幌南税務署長は、平成１７年７月８日付けで、別表の順号④「更正処分等」欄のうち、「所得金額」欄及び「納付すべき税額」欄記載のとおり、各事業年度に係る法人税の各更正処分（以下「本件各更正処分」という。）を行うとともに、別表の順号④「更正処分等」欄のうち、「過少申告加算税の額」欄及び「重加算税の額」欄記載のとおり、過少申告加算税及び重加算税の各賦課決定処分（以下「本件各賦課決定処分２」といい、本件各賦課決定処分１と併せて「本件各賦課決定処分」というほか、本件各賦課決定処分と本件各更正処分とを併せて「本件各処分」という。）を行った（甲１の②ないし⑤）。 \n ７ 札幌南税務署長が本件各処分を行った経緯等は、次のとおりである（弁論の全趣旨）。 \n (1) 同署長は、平成１５年１０月６日、原告の平成１２年２月期から平成１５年２月期まで（以下「本件各事業年度」という。）に係る法人税の調査（以下「本件調査」という。）に着手し、 \n その結果、後記(2)記載の本件各事業年度の所得金額計算上の非違事項を把握したと判断した。 \n (2) 非違事項ア 平成１２年２月期 \n (ア) 売上げ原告は、原告に帰属するＢ銀行本店営業部の乙名義の普通預金口座（以下「本件乙口座」 \n という。）、Ｃ銀行赤坂支店の丙名義の普通預金口座（以下「本件丙口座」という。）及び \n Ｄ銀行東京中央支店の丁名義の普通預金口座（以下「本件丁口座」といい、「本件乙口座」 \n 及び「本件丙口座」と併せて「本件３口座」という。）に振り込まれた売上金合計８６８万６５０６円を公表帳簿に記載せず、申告から除外していた。 \n (イ) 仕入れ原告は、乙（以下「乙」という。）に対する架空の仕入代金合計４２０万円を計上していた。 \n 一方、原告は、乙を代表者とする有限会社Ｅ（以下「Ｅ」という。）との間の携帯電話解約違約金債権の取立てに係る委託契約に基づき、原告が同社に支払うべき仕入代金合計 \n ７９万７０４８円を計上していなかった。 \n (ウ) 預金利子及び道府県民税利子割原告は、原告に帰属する本件３口座及びＢ銀行本店営業部の戊名義の普通預金口座（以下「本件戊口座」という。）に係る各預金利子（以下「本件預金利子」という。）及び各道府県民税利子割（以下「本件道府県民税利子割」という。）合計１８０円を収入から除外していた。 \n イ 平成１３年２月期 \n (ア) 売上げ原告は、本件３口座に振り込まれた売上金５９５万８３４４円を公表帳簿に記載せず、 \n 申告から除外していた。 \n (イ) 仕入れ原告は、乙に対する架空の仕入代金合計２００万円を計上していた一方、Ｅに支払うべき仕入代金７万０６４８円を計上していなかった。 \n (ウ) 役員報酬及び給料手当原告は、原告の取締役である戊（以下「戊」という。）に対する架空の役員報酬及び給料手当合計４２万５０００円を計上していた。 \n (エ) 預金利子及び道府県民税利子割原告は、本件預金利子及び本件道府県民税利子割合計１４８円を収入から除外していた。 \n (オ) 還付道府県民税利子割原告は、法人税法２６条１項１号の規定により益金の額に算入されない道府県民税利子割の還付金２５円を雑収入として計上していたが、確定申告書において所得金額から減算していなかった。 \n ウ 平成１４年２月期 \n (ア) 売上げ原告は、本件３口座に振り込まれた売上金合計６６万５０００円及び株式会社Ｆ（以下 \n 「Ｆ」という。）へ譲渡した債権（以下「本件Ｆ転売債権」という。）に係る売上金５５０万円並びに平成１３年１１月２日にＧへ譲渡した債権（以下「本件Ｇ転売債権１」という。） \n に係る売上金３８００万円について、いずれも公表帳簿に記載せず、申告から除外していた。 \n (イ) 仕入れ原告は、有限会社Ｈ（以下「Ｈ」という。）に対する真実は５００万円の仕入代金を１ \n ０００万円として過大に計上していた。 \n (ウ) 役員報酬原告は、戊に対する架空の役員報酬１０２万円を計上していたほか、原告の取締役であるＩ（以下「Ｉ」という。）に対する架空の役員報酬１２５万円も計上していた。 \n (エ) 福利厚生費原告は、原告の代表取締役である甲（以下「原告代表者」という。）及びその家族の海外旅行に係る費用を、国内で行った社員旅行に係る費用であると仮装し、架空の福利厚生費１１１万２６１０円を計上していた。 \n (オ) 預金利子及び道府県民税利子割原告は、本件預金利子及び本件道府県民税利子割合計７２円を収入から除外していた。 \n (カ) 販売手数料原告は、Ｊ及びＫに対し、債権の仕入れに係る販売手数料合計５９５万０５５１円を簿外で支出していたが、かかる簿外支出を販売手数料として計上していなかった。 \n エ 平成１５年２月期 \n (ア) 売上げ原告は、平成１４年１２月１６日にＧへ譲渡した債権（以下「本件Ｇ転売債権２」という。）に係る売上金８０００万円を公表帳簿に記載せず、申告から除外していた。 \n また、原告は、有限会社Ｌに対する架空の売上金１２６８万２６６６円を計上していた。 \n (イ) 仕入れ原告は、Ｍ株式会社からの債権仕入れに係る仕入代金合計３０００万円を簿外で支出していたが、かかる簿外支出を仕入代金として計上していなかった。 \n (ウ) 役員報酬原告は、戊に対する架空の役員報酬５１万円及びＩに対する架空の役員報酬３００万円をいずれも計上していた。 \n (エ) 福利厚生費原告は、原告代表者及びその家族の海外旅行に係る費用を、国内で行った社員旅行に係る費用であると仮装し、架空の福利厚生費１２２万００９０円を計上していた。 \n (オ) 預金利子原告は、本件預金利子６円を収入から除外していた。 \n (カ) 販売手数料原告は、有限会社Ｎに対し、債権の仕入れに係る販売手数料３６４万１６５４円を簿外で支出していたが、かかる簿外支出を販売手数料として計上していなかった。 \n (3) 同署長は、本件調査を受けていた原告が平成１７年３月２５日に提出した本件各修正申告書を受け、平成１７年７月８日付けで本件各賦課決定処分１を行ったほか、本件各修正申告書により修正されなかった本件各事業年度の所得金額計算上の非違事項等を是正するため、同日付で本件各更正処分及び本件各賦課決定処分２を行った。 \n ８ 原告は、平成１７年８月９日、札幌南税務署長に対し、本件各処分に不服があるとして、国税通則法（以下「通則法」という。）７５条１項１号に基づき、別表の順号⑤「異議申立て」欄記載のとおり、異議申立てを行った（甲２）。 \n これに対し、同署長は、同年１１月２日付けで、別表の順号⑥「異議決定」欄記載のとおり、 \n 原告の異議申立てをいずれも棄却する旨の異議決定を行った（甲３）。 \n ９ 原告は、平成１７年１１月３０日、国税不服審判所長に対し、８の異議決定を経た後の本件各処分になお不服があるとして、通則法７５条３項に基づき、別表の順号⑦「審査請求」欄記載のとおり、審査請求を行った（甲４）。 \n これに対し、同所長は、平成１８年１１月２９日付けで、別表の順号⑧「裁決」欄記載のとおり、原告の審査請求をいずれも棄却する旨の裁決を行った（甲５）。 \n \n \n 第３ 当事者の主張の要旨 \n （被告の主張）\n１ 本件各更正処分の適法性について原告の本件各事業年度の所得金額及び納付すべき税額は、別表２記載のとおりであり、その内訳は、別紙別表２の内訳記載のとおりである。\nしかしながら、原告が札幌南税務署長に提出した平成１２年２月期及び平成１３年２月期の各確定申告書並びに平成１４年２月期及び平成１５年２月期の本件各修正申告書に記載された所得金額及び納付すべき税額は、国税に関する法律の規定に従っていなかったか、又は札幌南税務署長が調査したところと異なるものであったため、札幌南税務署長は、通則法２４条の規定に基づき、本件各更正処分を行った。\nそして、本件各更正処分における所得金額及び納付すべき金額（別表の順号④「更正処分等」\n欄のうち、「所得金額」欄及び「納付すべき税額」欄参照）は、いずれも、別表２の原告の本件各事業年度の所得金額及び納付すべき税額の範囲内である。\nよって、本件各更正処分は適法である。\n２ 本件各賦課決定処分１の適法性について原告は、国税の課税標準等又は税額等の計算の基礎となるべき事実の全部又は一部を隠ぺいし、\n又は仮装し、その隠ぺいし、又は仮装したところに基づき納税申告書を提出していたため、札幌南税務署長は、通則法６８条１項の規定に基づき、本件各賦課決定処分１を行った（各加算税の額の算出方法は、別紙各加算税の算出方法１記載のとおりである。）。\nよって、本件各賦課決定処分１は適法である。\n３ 本件各賦課決定処分２の適法性について原告は、国税の課税標準等又は税額等の計算の基礎となるべき事実の全部又は一部を隠ぺいし、\n又は仮装し、その隠ぺいし、又は仮装したところに基づき納税申告書を提出していたため、札幌南税務署長は、通則法６５条１項又は６８条１項に基づき、本件各賦課決定処分２を行った。\nそして、原告の本件各事業年度の加算税の額は、別表２記載のとおりとなるから（各加算税の額の算出方法は、別紙各加算税の算出方法２記載のとおりである。）、本件各賦課決定処分２における加算税の額（別表の順号④「更正処分等」欄のうち、「重加算税の額」欄及び「過少申告加算税の額額」欄参照）は、いずれも、その範囲内である。\nよって、本件各賦課決定処分２は適法である。\n（原告の主張）\n１ 本件各更正処分の適法性について原告の本件各事業年度の所得金額及び納付すべき税額が別表２記載のとおりであることは否認ないし争う。\n２ 本件各賦課決定処分１及び２の適法性について原告が、国税の課税標準等又は税額等の計算の基礎となるべき事実の全部又は一部を隠ぺいし、\n又は仮装し、その隠ぺいし、又は仮装したところに基づき納税申告書を提出していたことは否認ないし争う。 \n \n \n 第４ 争点本件の争点は \n 、①原告の本件各事業年度の所得金額及び納付すべき税額はいくらか、②原告が、 \n 国税の課税標準等又は税額等の計算の基礎となるべき事実の全部又は一部を隠ぺいし、又は仮装し、 \n その隠ぺいし、又は仮装したところに基づき納税申告書を提出していたか否か、の２点であるが、 \n 具体的には次のとおりである。 \n １ 本件Ｇ転売債権１に係る売上金について（争点１） \n (1) 本件Ｇ転売債権１に係る売上金３８００万円は平成１４年２月期に計上すべきか。 \n (2) 原告が平成１４年２月期において、上記売上金３８００万円を売上高に計上しなかったことについて、通則法６８条１項に規定する「隠ぺい」又は「仮装」の事実（以下「隠ぺい・仮装の事実」という。）があるか。 \n （被告の主張） \n (1) 収益は、収入すべき権利が確定したときの属する事業年度に計上することが原則であるところ、原告は、平成１３年１１月２日、Ｇに対して本件Ｇ転売債権１を譲渡（転売）した際、 \n Ｇとの間で、借用書等の書類と現金を交換しているから、この時点で、収入すべき権利が確定したというべきである。したがって、本件Ｇ転売債権１に係る売上金は、平成１３年１１月２日の属する事業年度である平成１４年２月期に計上すべきである。 \n (2) 原告は、平成１４年２月期及び平成１５年２月期のいずれの事業年度においても本件Ｇ転売債権１に係る売上金を計上せず、むしろ、原告名ではなく「Ｏ株式会社」名義の領収証を発行しているから、本件Ｇ転売債権１に係る売上金を意図的に申告除外したというべきである。 \n よって、原告には隠ぺい・仮装の事実がある。 \n （原告の主張） \n (1) 本件Ｇ転売債権１は、多数の債務者に対する不良債権の集合であるところ、この種の債権の取引では、債務者に死亡、所在不明、破産等がないか調査すること（すなわち、検収すること）が重要である。そのため、原告は、この種の不良債権の売買においては、買主が検収を終了した旨を連絡してきた時点をもって、収入すべき権利が確定したとして売上高に計上することにしていた。 \n 本件Ｇ転売債権１の売買においても、Ｇが同債権を検収することになっており、当該検収は、 \n 契約が成立した平成１３年１１月２日から約４か月後の平成１４年３月ころに終了する予定であった。よって、本件Ｇ転売債権１に係る売上金は、平成１４年２月期ではなく、平成１５年２月期に計上すべきものである。 \n (2) (1)のとおり、本件Ｇ転売債権１に係る売上金は、平成１５年２月期に計上すべきものであったが、平成１５年２月期の確定申告の段階で計上することを失念してしまった。そして、原告は、その後、修正申告により、平成１５年２月期に本件Ｇ転売債権１に係る売上金を計上したから、原告に隠ぺい・仮装の事実はない。 \n ２ 本件Ｇ転売債権２に係る売上金について（争点２） \n (1) 本件Ｇ転売債権２に係る売上金８０００万円は平成１５年２月期に計上すべきか。 \n (2) 原告が平成１５年２月期において、上記売上金８０００万円を売上高に計上しなかったことについて、隠ぺい・仮装の事実があるか。 \n （被告の主張） \n (1) 原告は、平成１４年１２月１６日、Ｇに対して本件Ｇ転売債権２を譲渡（転売）した際、 \n Ｇとの間で、借用書等の書類と現金を交換しているから、この時点で、収入すべき権利が確定したというべきである。したがって、本件Ｇ転売債権２に係る売上金は、平成１４年１２月１ \n ６日の属する事業年度である平成１５年２月期に計上すべきである。 \n (2) 原告は、平成１４年１２月１６日、Ｐ（以下「Ｐ」という。）から本件Ｇ転売債権２を３６ \n ４１万６５４０円で仕入れ、同日、Ｇに対して本件Ｇ転売債権２を８０００万円で譲渡（転売） \n したところ、原告は、Ｐとの取引は平成１５年２月期の公表帳簿に記載したが、Ｇとの取引は公表帳簿に記載せず、あえて簿外とした。また、原告は、平成１４年１２月１７日、Ｇから受領した８０００万円のうちの２０００万円を、「Ｑ」（以下「Ｑ」という。）の名義を用いて原告の預金口座に振り込み、Ｑからの借入金と仮装した。このような事情等からすれば、原告は、 \n 本件Ｇ転売債権２に係る売上金を意図的に申告除外したというべきである。よって、原告には隠ぺい・仮装の事実がある。 \n （原告の主張） \n (1) 本件Ｇ転売債権２の売買においても、Ｇが同債権を検収することとなっており、当該検収は、契約が成立した平成１４年１２月１６日から約８か月後の平成１５年８月ころに終了する予定であった。よって、本件Ｇ転売債権２に係る売上金は、平成１５年２月期ではなく、平成 \n １６年２月期に計上すべきものである。 \n (2) (1)のとおり、本件Ｇ転売債権２に係る売上金は、平成１５年２月期ではなく平成１６年２月期に計上すべきものであり、原告は、その平成１６年２月期に本件Ｇ転売債権２に係る売上金を計上したから、原告に隠ぺい・仮装の事実はない。 \n ３ 原告代表者及びその家族の海外旅行に係る費用について（争点３） \n 原告が平成１４年２月期及び平成１５年２月期において、原告代表者及びその家族の海外旅行に係る費用を福利厚生費として計上したことについて、隠ぺい・仮装の事実があるか。 \n （被告の主張） \n 原告は、平成１４年２月期の福利厚生費に、大阪への社員旅行費用であるとして１１１万２６ \n １０円を計上したが、実際には大阪への社員旅行を実施しておらず、原告代表者及びその家族によるハワイ旅行の費用を計上していた。また、原告は、平成１５年２月期の福利厚生費に、沖縄への社員旅行費用であるとして１２２万００９０円を計上したが、実際には沖縄への社員旅行を実施しておらず、原告代表者及びその家族によるニューヨーク旅行及びハワイ旅行の費用を計上していた。よって、原告には隠ぺい・仮装の事実がある。 \n （原告の主張） \n 平成１４年２月期及び平成１５年２月期の福利厚生費に計上した金額は、業務遂行上の必要に迫られて実施した正規の役員による海外視察及び研修費用である。そして、原告が大阪及び沖縄への社員旅行として計上したのは、顧問税理士から国内旅行費用として計上した方がよいと指導を受けたからであり、原告に仮装の意思はなかった。よって、原告に隠ぺい・仮装の事実はない。 \n なお、原告は、修正申告により、原確定申告を修正した。 \n ４ 本件Ｆ転売債権に係る売上金について（争点４） \n 本件Ｆ転売債権に係る売上金５５０万円を売上高に計上しなかったことについて、隠ぺい・仮装の事実があるか。 \n （被告の主張） \n 原告は、平成１３年１２月１０日、Ｆに対してＨから仕入れた債権の一部（本件Ｆ転売債権） \n を譲渡（転売）したところ、原告は、その事実を十分認識しながら、本件Ｆ転売債権に係る売上金５５０万円を売上高に計上しなかった。よって、原告には隠ぺい・仮装の事実がある。 \n （原告の主張） \n 平成１４年２月期のＦとの取引は、原告代表者をはじめ役員・社員は直接関与しておらず、すべて仲介人・代理人を通じての取引であったため、原告は、同取引があったことの認識が希薄となっていた。また、原告は、売上金のほとんどを販売手数料その他の経費等で費消してしまったことから、同売上金を計上することを失念してしまった。よって、原告に隠ぺい・仮装の事実はない。 \n なお、原告は、修正申告により、原確定申告を修正した。 \n ５ Ｈに対する仕入代金について（争点５） \n 原告が平成１４年２月期において、Ｈに対する仕入代金であるとして５００万円を過大に計上したことについて、隠ぺい・仮装の事実があるか。 \n （被告の主張） \n 原告は、平成１３年６月７日、Ｈから債権を５００万円で仕入れたにもかかわらず、所得金額を圧縮し税負担を免れることを意図して架空の領収証を作成し、Ｈに対する仕入代金を１０００万円として計上した（５００万円を過大に計上した。）。よって、原告には隠ぺい・仮装の事実がある。 \n （原告の主張） \n 平成１４年２月期のＨに対する仕入代金が５００万円過大に計上されたのは、原告が同社から \n ５００万円で債権を仕入れた時に、原告代表者も同社から無償で評価額５００万円の債権を譲り受けたため、両債権を誤って混同してしまったからである。よって、原告に隠ぺい・仮装の事実はない。 \n なお、原告は、修正申告により、原確定申告を修正した。 \n ６ 本件３口座に振込入金された売上金について（争点６） \n (1) 平成１２年２月期ないし平成１４年２月期において、本件３口座に振込入金された売上金は、原告に帰属するか。 \n (2) 原告が平成１２年２月期ないし平成１４年２月期において、本件３口座に振込入金された売上金を売上高に計上しなかったことについて、隠ぺい・仮装の事実があるか。 \n （被告の主張） \n (1) 本件３口座は、いずれも原告代表者が開設手続を行った口座であること、原告が保有を公表している口座（以下「本件公表口座」という。）と本件３口座の入出金は連続して行われ、 \n 本件３口座の資金は本件公表口座に入金されていること、本件３口座への振込入金者の大多数は原告の顧客であること等の事情からすれば、本件３口座は、原告が管理していた口座であることが明らかである。よって、本件３口座に振込入金された売上金は、原告に帰属する。 \n (2) 原告は、平成１２年２月期ないし平成１４年２月期の確定申告に当たり、本件３口座に振込入金された売上金を売上高に計上していないところ、(1)の事実からすれば、原告に隠ぺい・仮装の事実があることは明らかである。 \n （原告の主張） \n 本件３口座のうち本件乙口座は乙の口座であって、原告の口座ではない。原告は、乙から、携帯電話解約違約金債権回収の委託を受けて本件乙口座の通帳を預かり、その回収を行っていたものにすぎず、本件乙口座に振込入金された売上金は全額乙に返還されている。 \n その余の本件丙口座及び本件丁口座は、確かに、原告が金融業を営む上で必要に迫られて作成した架空・借名口座であるが、本件当時、両口座は既に他の者へ譲渡されていた。 \n よって、本件３口座に振込入金された売上金は、原告に帰属するものではない。 \n ７ 乙に対する仕入代金について（争点７） \n (1) 原告が乙に対する仕入代金として計上した平成１２年２月期の４２０万円及び平成１３年 \n ２月期の２００万円は、いずれも架空か。 \n (2) 原告が平成１２年２月期及び平成１３年２月期において、上記(1)の各金額を乙に対する仕入代金として計上したことについて、隠ぺい・仮装の事実があるか。 \n （被告の主張） \n (1) 原告は、乙に対する仕入代金として、平成１２年２月期に合計４２０万円、平成１３年２月期に合計２００万円をそれぞれ計上しているところ、原告は、その仕入代金を、本件乙口座とは別の口座であるＣ銀行札幌支店の乙名義の普通預金口座（以下「本件乙口座２」という。） \n に振り込んでいる。しかしながら、本件乙口座２は、原告が乙に対する仕入代金を振り込むために自ら開設した原告の口座であり、また、原告が乙又は乙を代表者とするＥから債権を仕入れた事実や、原告が乙又はＥにその仕入代金を支払った事実もない。よって、平成１２年２月期及び平成１３年２月期に計上された乙に対する仕入代金は、いずれも架空のものである。 \n (2) (1)の事実からすれば、原告に隠ぺい・仮装の事実があることは明らかである。 \n （原告の主張） \n 平成１２年２月期及び平成１３年２月期に計上した乙に対する仕入代金は、原告が乙から仕入れた携帯電話解約違約金債権の仕入代金である。よって、平成１２年２月期及び平成１３年２月期に計上された乙に対する仕入代金は、いずれも架空のものではない。 \n ８ 戊に対する役員報酬及び給与手当について（争点８） \n (1) 原告が戊に対する役員報酬及び給与手当として計上した平成１３年２月期の４２万５００ \n ０円、平成１４年２月期の１０２万円及び平成１５年２月期の５１万円は、いずれも架空か。 \n (2) 原告が平成１３年２月期ないし平成１５年２月期において、上記(1)の役員報酬及び給与手当を計上したことについて、隠ぺい・仮装の事実があるか。 \n （被告の主張） \n (1) 原告は、平成１３年２月期ないし平成１５年２月期に、戊に対する役員報酬及び給与手当を計上しているところ、原告は、その役員報酬等を、Ｂ銀行本店営業部の戊名義の普通預金口座（本件戊口座）に振り込んでいる。しかしながら、本件戊口座は、原告が戊に対する役員報酬等を振り込むために自ら開設した原告の口座であり、また、原告が戊に対して役員報酬等を支払っていた事実もない。よって、平成１３年２月期ないし平成１５年２月期に計上された戊に対する役員報酬等は、いずれも架空のものである。 \n (2) (1)の事実からすれば、原告に隠ぺい・仮装の事実があることは明らかである。 \n （原告の主張） \n 戊は、会社経営の経験があり、とりわけ労務管理についての知識が豊富であったことから、原告は、常日頃から経営等について戊の助言を受けてきた。平成１３年２月期ないし平成１５年２月期に計上された戊に対する役員報酬等は、間違いなく戊に支給されたものであり、いずれも架空のものではない。このことは、戊が、原告から振り込まれた役員報酬等を自らの所得として確定申告していることからも明らかである。 \n ９ Ｉに対する役員報酬について（争点９） \n 原告がＩに対する役員報酬として計上した平成１４年２月期の１２５万円及び平成１５年２月期の３００万円は、いずれも架空か。 \n （被告の主張） \n 原告は、平成１４年２月期及び平成１５年２月期に、Ｉ（原告代表者の子）に対する役員報酬を計上しているところ、原告は、その役員報酬を、Ｃ銀行札幌支店のＩ名義の普通預金口座（以下「本件Ｉ口座」という。）に振り込んでいる。しかしながら、本件Ｉ口座は、原告がＩに対する役員報酬を振り込むために自ら開設した原告の口座であり、また、Ｉが原告の取締役として活動していた事実も一切ない。よって、平成１４年２月期及び平成１５年２月期に計上されたＩに対する役員報酬は、いずれも架空のものである。 \n （原告の主張） \n 原告は、原告の取締役であるＩに対し、Ｉが国内で就学中は原告の業務を手伝った対価として、 \n Ｉが米国に留学中は米国の専門学校に通学する傍ら、米国債権回収市場等の実態動向調査等を行ったことに対する対価として、役員報酬を支払ったものであり、平成１４年２月期及び平成１５年２月期に計上されたＩに対する役員報酬は、いずれも架空のものではない。 \n １０ 被告が認定した原告代表者への貸付金に係る利息について（争点１０） \n (1) 被告が平成１２年２月期ないし平成１５年２月期において、本件調査により把握した所得金額計算上の非違事項のうち一部の金額を原告代表者への貸付金（以下「本件貸付金」という。） \n として認定し、それに係る利息（以下「本件貸付金に係る認定利息」という。）を所得金額に加算したことは適法か。 \n (2) 原告が平成１２年２月期ないし平成１５年２月期において、本件貸付金に係る認定利息を所得金額に加算しなかったことについて、隠ぺい・仮装の事実があるか。 \n （被告の主張） \n (1) 本件Ｇ転売債権１及び本件Ｇ転売債権２に係る各売買代金並びに本件Ｆ転売債権に係る売買代金を現金で受領したのは原告代表者であること、本件３口座、本件乙口座２、本件戊口座及び本件Ｉ口座を管理していたのは原告代表者であることなどからすると、被告が本件各更正処分において加算した所得金額については、原告代表者が管理していたというべきである。 \n したがって、被告が、本件各更正処分に際して本件各事業年度の所得金額に加算し減算した各金額のうち、別表３－２のとおり、原告代表者への貸付金（本件貸付金）として認定し、同別表３－１のとおり、本件貸付金に係る認定利息を算出したこと、及び、同別表２のとおり、 \n 本件貸付金に係る認定利息を所得金額に加算したことは適法である。 \n (2) 被告が主張する本件貸付金は、別表３－２のとおりであるところ、本件各修正申告に基づく役員貸付金及び被告が主張する所得金額に基づく役員貸付金の加算額のうち、本件Ｉ報酬の役員報酬否認額にかかる役員貸付金を除いた役員貸付金について、いずれも原告に隠ぺい・仮装の事実があるから、これら隠ぺい・仮装の事実に起因する本件貸付金に基づいて算定した本件認定利息を所得金額から除外して申告していたことについても、隠ぺい・仮装の事実がある。 \n （原告の主張） \n (1) 本件各事業年度の所得金額のうち増加が認められるのは、本件各修正申告書に係る増加所得金額及び平成１４年２月期の更正処分に係る福利厚生費５２０円のみである。したがって、 \n 原告代表者に対する貸付金は、平成１４年２月期の修正申告に係る１１６１万２０９０円、平成１５年２月期の修正申告に係る２６５３万７６２４円及び平成１４年２月期の更正処分に係る５２０円であり、これに基づく認定利息は、平成１４年２月期が１１万６１２５円、平成 \n １５年２月期が３８万１４９７円となり、これを超える認定利息並びに平成１２年２月期及び平成１３年２月期の認定利息は発生しない。 \n (2) 平成１４年２月期及び平成１５年２月期の各修正申告に係る増加所得金額並びに平成１４年２月期の更正処分に係る福利厚生費５２０円には、隠ぺい・仮装の事実はないので、これに基づく平成１４年２月期の１１万６１２５円及び平成１５年２月期の３８万１４９７円の各認定利息についても、隠ぺい・仮装の事実はない。 \n １１ 本件預金利子及び本件道府県民税利子割について（争点１１） \n (1) 被告が平成１２年２月期ないし平成１５年２月期において、本件３口座及び本件戊口座に係る本件預金利子及び本件道府県民税利子割を所得金額に加算したことは適法か。 \n (2) 原告が平成１２年２月期ないし平成１５年２月期において、本件預金利子及び本件道府県民税利子割を所得金額に加算しなかったことについて、隠ぺい・仮装の事実があるか。 \n （被告の主張） \n (1) 本件３口座及び本件戊口座は、いずれも原告の口座であるから、同口座に係る本件預金利子及び本件道府県民税利子割も原告に帰属する。そして、本件乙口座の預金取引明細書及び普通預金口座別残高表、本件丙口座の普通預金元帳、本件丁口座の預金取引明細表、並びに、本件戊口座の普通預金口座別残高表に基づき、本件預金利子及び本件道府県民税利子割を算定すると、別表４のとおりとなる。 \n よって、被告が平成１２年２月期ないし平成１５年２月期において、本件３口座及び本件戊口座に係る本件預金利子及び本件道府県民税利子割を所得金額に加算したことは適法である。 \n (2) 原告は、本件３口座及び本件戊口座がそれぞれの名義人に帰属するものであるかのように仮装していたから、本件３口座及び本件戊口座に係る本件預金利子及び本件道府県民税利子割についても、原告に隠ぺい・仮装の事実がある。 \n （原告の主張） \n 本件３口座及び本件戊口座は、いずれも原告の口座ではないから、同口座に係る本件預金利子及び本件道府県民税利子割も原告に帰属しない。よって、被告が平成１２年２月期ないし平成１ \n ５年２月期において、本件３口座及び本件戊口座に係る本件預金利子及び本件道府県民税利子割を所得金額に加算したことは違法である。 \n １２ 事業税の額について（争点１２） \n 被告が平成１３年２月期ないし平成１５年２月期において、本件各更正処分に基づく所得金額の増加に伴い納付すべきとした事業税の額は適法か。 \n （被告の主張） \n すでに述べたとおり、被告が本件において主張する原告の本件各事業年度の所得金額は適法であるところ、被告は、これら適法な所得金額の加算額及び減算額に基づいて、平成１２年２月期ないし平成１４年２月期の所得金額を計算し、各事業年度の翌事業年度において納付すべきこととなる事業税の額を算定した。よって、被告が、平成１３年２月期ないし平成１５年２月期において、本件各更正処分に基づく所得金額の増加に伴い納付すべきとした事業税の額は適法である。 \n （原告の主張） \n 被告が主張する事業税相当額のうち、平成１４年２月期の福利厚生費５２０円及び認定利息１ \n １万６１２５円に係る平成１５年２月期の事業税については損金の額に算入されるが、それ以外の事業税は発生しないから、被告が納付すべきとした事業税の額は違法である。 \n \n \n 第５ 争点に対する当裁判所の判断 \n １ 本件Ｇ転売債権１に係る売上金について（争点１） \n (1) 本件Ｇ転売債権１に係る売上金３８００万円は平成１４年２月期に計上すべきかについてア 法人税法２２条２項は、「内国法人の各事業年度の所得の金額の計算上当該事業年度の益金の額に算入すべき金額は、別段の定めがあるものを除き、資産の販売、有償又は無償による資産の譲渡又は役務の提供、無償による資産の譲受けその他の取引で資産等取引以外のものに係る当該事業年度の収益の額とする。」と規定し、４項は、同条２項に規定する「当該事業年度の収益の額」は、「一般に公正妥当と認められる会計処理の基準に従って計算されるものとする。」と規定しているところ、収益は、原則として、その実現があった時、すなわち、その収入すべき権利が確定したときの属する年度の益金に計上すべきものであり、ただ例外として、取引の経済的実態からみて合理的なものとみられる収益計上の基準の中から当該法人が特定の基準を選択し、継続してその基準によって収益を計上している場合は、法人税法上も同会計処理を正当なものとして是認することができるというべきである（最高裁平成●●年（○○）第●●号同５年１１月２５日第一小法廷判決・民集４７巻９号５２７８頁参照）。 \n イ 証拠と弁論の全趣旨によれば、原告の属する業界では、通常、債務者が、提出した借入れ当初の「借用書」、金融業者が入金状況を管理している「入金状況表」及び本人を確認できるものとしての「申込書」といういわゆる「３点セット」（以下「３点セット書類」という。） \n と現金との交換により売買が成立し（乙３）、一般的には３点セット書類と現金とを交換した日が取引日であり、売上金を計上すべき日であるという運用が取られていたところ（乙４）、 \n 原告は、Ｇに対し、平成１３年１１月２日、本件Ｇ転売債権１を譲渡（転売）し、同日、Ｇから、３点セット書類と引換えにその売買代金として３８００万円を受領したこと（乙４、 \n ５、弁論の全趣旨）が認められるから、本件Ｇ転売債権１の売買においては、本件Ｇ転売債権１に係る３点セット書類と売上金３８００万円の交換が行われた平成１３年１１月２日に収入すべき権利が確定したというべきである。 \n ウ これに対し、原告は、本件Ｇ転売債権１のような不良債権の集合債権の取引では検収が重要であるから、原告は、買主が検収を終了した旨を連絡してきた時点をもって収入すべき権利が確定したとして売上高に計上することにしていたと主張し、原告代表者も本人尋問においてこれに沿う供述をする。 \n しかしながら、証拠によれば、原告は、平成１５年１０月６日、Ｇとの間で、本件Ｇ転売債権１と同種の債権の取引を行っているところ（乙１２）、原告は、平成１６年２月期の総勘定元帳（非課税売上高）に、当該債権に係る売上金１１５６万３６９５円を、取引日である平成１５年１０月６日付けで記載していること（乙１３）が認められるから、原告が、買主が検収を終了した旨を連絡してきた時点をもって収入すべき権利が確定したとして売上高に計上するという会計処理を行っていたとする原告代表者の供述は信用することができず、他に原告の主張する事実を認めるに足りる証拠はない。 \n エ よって、本件Ｇ転売債権１に係る売上金３８００万円は、原則どおり、平成１３年１１月 \n ２日の属する事業年度である平成１４年２月期に計上すべきであったというべきである。 \n (2) 原告が平成１４年２月期において、本件Ｇ転売債権に係る売上金３８００万円を売上高に計上しなかったことについて、隠ぺい・仮装の事実があるかについてア 証拠と弁論の全趣旨によれば、①原告は、本件Ｇ転売債権１の売買契約を締結する際、契約書及び領収証を作成しなかったこと（弁論の全趣旨）、②原告は、本件Ｇ転売債権１に係る売上金３８００万円を、平成１４年２月期及び平成１５年２月期における総勘定元帳（売上高）及び総勘定元帳（非課税売上高）に記載しなかったこと（乙１０の①、②、１１の①、 \n ②）、③原告は、平成１５年９月ころ、Ｇから、本件Ｇ転売債権１の売買について、Ｇ宛ての領収証を作成して持ってきてほしい旨の連絡を受けた際、原告名義ではなく、原告が所持していた本件Ｇ転売債権１の元債権者であるＯ株式会社（以下「Ｏ」という。）のゴム印及び会社印を使用してＯ名義の領収証を作成してＧに交付していること（乙４、５）、④原告は、本件Ｇ転売債権１に係る売上金３８００万円を会社の経費には計上しづらい交際費等の支払に当てたほか、原告代表者からの貸付金として処理していたこと（乙４）が認められ、 \n これらの事実を総合すれば、原告は、本件Ｇ転売債権１に係る売上金３８００万円をあえて原告の売上高に計上せず、意図的に申告除外したと強く推認される。 \n イ これに対し、原告代表者は、本人尋問において、本件Ｇ転売債権１に係る売上金を隠したものではない旨供述するが、前記認定事実に照らして信用することができず、他に前記推認を覆すに足りる証拠はない。 \n ウ よって、原告には隠ぺい・仮装の事実があると認められる。 \n ２ 本件Ｇ転売債権２に係る売上金について（争点２） \n (1) 本件Ｇ転売債権２に係る売上金８０００万円は平成１５年２月期に計上すべきかについてア 証拠（乙７、１７の①、②）と弁論の全趣旨によれば、原告は、Ｇに対し、平成１４年１ \n ２月１６日、本件Ｇ転売債権２を譲渡（転売）し、同日、Ｇから、３点セット書類と同種の契約書及び申込カード等の債権書類と引換えにその売買代金として８０００万円を受領したことが認められるから、本件Ｇ転売債権２に係る債権書類と売上金８０００万円の交換が行われた平成１４年１２月１６日に収入すべき権利が確定したというべきである。 \n イ これに対し、原告は、本件Ｇ転売債権２のような不良債権の集合債権の取引では買主が検収を終了した旨を連絡してきた時点をもって収入すべき権利が確定したとして売上高に計上することにしていたと主張するが、同主張が認められないことは前記説示のとおりである。 \n ウ よって、本件Ｇ転売債権２に係る売上金８０００万円は、原則どおり、平成１４年１２月 \n １６日の属する事業年度である平成１５年２月期に計上すべきであったというべきである。 \n (2) 原告が平成１５年２月期において、本件Ｇ転売債権２に係る売上金８０００万円を売上高に計上しなかったことについて、隠ぺい・仮装の事実があるかについてア 証拠と弁論の全趣旨によれば、①原告は、平成１４年１２月１６日、Ｐから、債権額７億 \n ２８４３万０８０５円の本件Ｇ転売債権２を３６４１万６５４０円で買い受け、同日、Ｇに対し、本件Ｇ転売債権２を８０００万円で譲渡（転売）し、Ｇからその売買代金として８０ \n ００万円を受領しているところ、原告は、平成１５年２月期の総勘定元帳に、平成１４年１ \n ２月１６日になされた本件Ｇ転売債権２の取引のうち、Ｐとの取引は記載したが、Ｇとの取引は記載しなかったこと（前記認定事実、乙１４ないし１８、弁論の全趣旨）、②原告は、 \n 平成１４年１２月１７日、Ｇから受領した８０００万円のうちの２０００万円を、Ｑの名義を用いて原告の預金口座に振り込んでＱからの借入金と仮装し（乙８、弁論の全趣旨）、平成１５年２月期の総勘定元帳（短期借入金）に、平成１４年１２月１７日にＱから２０００万円を借り受けた旨の虚偽の記載をしたこと（乙２０）が認められ、これらの事実を総合すれば、原告は、本件Ｇ転売債権２に係る売上金８０００万円をあえて原告の売上高に計上せず、意図的に申告除外したと強く推認される。 \n イ これに対し、原告は、本件Ｇ転売債権２に係る売上金は、平成１５年２月期ではなく平成 \n １６年２月期に計上すべきものであり、実際、原告は、その平成１６年２月期に本件Ｇ転売債権２に係る売上金を計上したから、原告に隠ぺい・仮装の事実はないと主張し、原告代表者も本人尋問においてこれに沿う供述をする。 \n しかしながら、そもそも本件Ｇ転売債権２に係る売上金は平成１５年２月期に計上すべきものであり、平成１６年２月期に計上すべきものではないことは前記説示のとおりである上、 \n 原告が平成１６年２月期に本件Ｇ転売債権２に係る売上金（ただし、一部の４０００万円） \n を計上したのは、平成１５年１２月２５日であり（乙１２、１３）、本件調査が始まった後であるから、平成１６年２月期に本件Ｇ転売債権２に係る売上金を計上したことをもって、 \n 本件Ｇ転売債権２に係る売上金を意図的に申告除外したとの前記推認を覆すことはできず、 \n 他に前記推認を覆すに足りる証拠はない。 \n ウ よって、原告には隠ぺい・仮装の事実があると認められる。 \n ３ 原告代表者及びその家族の海外旅行に係る費用について（争点３） \n 原告が平成１４年２月期及び平成１５年２月期において、原告代表者及びその家族の海外旅行に係る費用を福利厚生費として計上したことについて、隠ぺい・仮装の事実があるかについて \n (1) 証拠によれば、次の事実が認められる（証拠は認定事実ごとに摘示する。）。 \n ア 原告は、平成１４年２月期の総勘定元帳（福利厚生費）の平成１３年８月１０日の欄の摘要欄に、「社員旅行 大阪 ８／１０～８／１４ １０名」、借方金額欄に「１，１１２，６ \n １０」と記載した（乙２１）。 \n イ 原告は、株式会社Ｒ札幌支店に対し、旅行代金として、１１１万２６１０円を支払い、株式会社Ｒ札幌支店は、原告に対し、平成１３年８月１０日、その旨の領収証を発行した（乙 \n ２２、２３）。 \n ウ 前記アの社員旅行は、実際には、原告代表者、その前妻であるＳ、子のＴ及び子のＩによるハワイ旅行であり、前記イの領収証はその旅行費用の領収証である（乙２３、２４）。 \n エ 原告は、平成１５年２月期の総勘定元帳（福利厚生費）の平成１４年３月２０日の欄の摘要欄に「社員旅行 沖縄 内金（株）Ｒ」、借方金額欄に「１５０，０００」と記載し、同年４月１５日の欄の摘要欄に「社員旅行 沖縄 ９名 ５泊６日（株）Ｒ」、借方金額欄に \n 「９４８，５９０」と記載し、同月１６日の欄の摘要欄に「社員旅行 沖縄 残金（株）Ｒ」、 \n 借方金額欄に「９９，３４０」と記載し、同月１７日の欄の摘要欄に「社員旅行 沖縄 残金（株）Ｒ」、借方金額欄に「２２，１６０」と記載した（乙２５）。 \n オ 株式会社Ｒ札幌支店は、原告に対し、平成１４年４月１７日、旅行代金として１２２万０ \n ０９０円（前記エの各金額を合計した金額）を受領した旨の領収証を発行した（乙２６）。 \n カ 前記エの社員旅行は、実際には、原告代表者、Ｓ、Ｔがアメリカ合衆国のニューヨークへ行き、そこに当時在住していたＩをガイド兼通訳として加えた家族４人で、ニューヨーク及びハワイを旅行したというものであり（乙２３）、前記オの領収証はその旅行費用の領収証である（乙２３、２４）。 \n (2) 前記認定事実によれば、原告は、平成１４年２月期の総勘定元帳（福利厚生費）の欄に、 \n 社員１０名による大阪への旅行費用と記載しているところ、実際には、原告代表者、その前妻であるＳ、子のＴ及び子のＩによるハワイ旅行であることが認められる。また、原告は、平成 \n １５年２月期の総勘定元帳（福利厚生費）の欄に、社員９名による沖縄への旅行費用を記載しているところ、実際には、原告代表者、Ｓ、Ｔがアメリカ合衆国のニューヨークへ行き、そこに当時在住していたＩをガイド兼通訳として加えた家族４人で、ニューヨーク及びハワイを旅行したというものであることが認められる。 \n いずれの旅行時においても、原告代表者、Ｓ及びＩは会社役員の地位にあったことが認められるものの（乙４７）、Ｔは会社役員又は従業員ではなかったこと（弁論の全趣旨）、旅行をしたのは家族４人のみであり他の役員及び従業員は参加していないことからすると、これらの旅行は、社員旅行ではなく原告代表者家族による家族旅行であることが明らかである。そして、 \n 原告は、このような家族旅行を社員旅行として記載していること、旅行に参加した社員の人数を１０名または９名として実際の人数（４人）よりも多く記載していることからすると、原告は、原告代表者の家族による私的な旅行を社員旅行と仮装して申告したと認められる。 \n (3) これに対し、原告は、平成１４年２月期及び平成１５年２月期の福利厚生費に計上した金額は、業務遂行上の必要に迫られて実施した正規の役員による海外視察及び研修費用であり、 \n また、原告が大阪及び沖縄への社員旅行として計上したのは顧問税理士の指導によるものであるから、原告に仮装の意思はないと主張する。 \n しかしながら、原告代表者は、旅行当時、新しい事業の具体的なイメージはなかった旨供述していること（乙２３）、Ｓは、平成１４年２月期計上のハワイ旅行については、単なる観光が目的であること、平成１５年２月期計上のニューヨーク及びハワイ旅行は、観光に加えて、 \n ニューヨークでホームステイ中のＩの元を訪れ、５月以降の留学に備えてアパートを探したり、 \n 家財道具を調達するための旅行である旨述べていることからすると（乙２４）、業務遂行上の必要に迫られて実施した旅行であるとは認められない。また、原告代表者の家族しか参加していないこと、平成１５年２月期計上のニューヨーク及びハワイ旅行はホームステイ中のＩの元を訪れていることからすると、社員を慰労する目的の旅行とも認められない。さらに、顧問税理士の指導によるとの主張については、原告は、当該指導の内容、そのときの状況、国内旅行にするように指導した理由等を何ら具体的に主張しないから、指導の存在自体疑わしいと言わざるを得ない。 \n よって、原告の主張は採用することができない。 \n (4) 以上のとおりであるから、原告には隠ぺい・仮装の事実があると認められる。 \n ４ 本件Ｆ転売債権に係る売上金について（争点４）及びＨに対する仕入代金について（争点５） \n (1) 証拠によれば、次の事実が認められる（証拠は認定事実ごとに摘示する。）。 \n ア 原告は、平成１３年６月７日、Ｈから、見積額１億円の不良債権を５００万円で買い受け \n （以下、原告が買い受けたこの債権を「Ｈ債権」という。）（乙２７）、Ｈに対し、その売買代金を支払った（乙８、３３）。その際、原告は、契約書を作成せず、また、Ｈから領収証も受領しなかった（乙３３）。 \n イ 原告は、平成１４年２月期の総勘定元帳（仕入高）の６月７日の摘要欄に「（株）Ｈ」、借方金額欄に「１０，０００，０００」とそれぞれ記載した（乙２８、３３）。 \n ウ 原告代表者は、Ｈ債権の一部である本件Ｆ転売債権をＦに譲渡（転売）することを決め、 \n Ｆの取締役であるＵ（以下「Ｕ」という。）と電話で取引金額や取引日等について協議した。 \n 原告とＦとの取引は京都市内で行われることになったことから、原告代表者は、友人であるＫ（以下「Ｋ」という。）に紹介してもらった名古屋市在住のＶ（以下「Ｖ」という。）に対してＦとの取引を依頼することにし、Ｖに対し、本件Ｆ転売債権の借用書等の３点セット書類を宅急便で送るととともに、電話で、「取引相手にダンボールに入っている書類を現金と引換えに渡し、受け取った現金はＫに渡してもらいたい。」と直接伝えた（乙８、２７、 \n ２９ないし３１）。 \n Ｖは、平成１３年１２月１０日、京都市内において、Ｕに対して前記３点セット書類を渡し、それと引換えにＵから売買代金５５０万円を受領した。その後、Ｖは受領した売買代金 \n ５５０万円をＫに預け、Ｋが原告代表者に対して売買代金５５０万円を交付した（乙８、２ \n ７、２９ないし３２）。この取引の際、原告は、契約書を作成せず、また、領収証も発行しなかった（乙２７）。 \n エ 原告は、本件Ｆ転売債権に係る売上金５５０万円を平成１４年２月期の総勘定元帳（売上高）及び総勘定元帳（非課税売上高）に記載しなかった（乙１０の①、②、２７）。 \n オ 原告は、平成１４年２月期の決算前に、原告の債権売買等の仲介業務を請け負っていたＪに指示して、平成１３年６月７日付けで、Ｈ債権の売買代金を１０００万円とする原告宛てのＨ名義の領収証を発行させた（乙３３、３４）。 \n (2) 本件Ｆ転売債権に係る売上金５５０万円を売上高に計上しなかったことについて、隠ぺい・仮装の事実があるかについてア 前記認定事実によれば、原告は、平成１４年２月期の総勘定元帳に、本件Ｆ転売債権の取引のうち、Ｈとの取引は記載したが、Ｆとの取引は記載しなかったことが認められるところ、 \n すでに認定してきたように、原告は本件Ｇ転売債権１及び２に係る各売上金についても隠ぺい行為を行っていることを総合すると、原告は、本件Ｆ転売債権に係る売上金５５０万円をあえて原告の売上高に計上せず、意図的に申告除外したと強く推認される。 \n イ これに対し、原告は、Ｆとの取引はすべて仲介人・代理人を通じての取引であったため、 \n 同取引があったことの認識が希薄となっていたこと等から、Ｆ転売債権に係る売上金を計上することを失念してしまったものであり、原告に隠ぺい・仮装の事実はないと主張する。 \n しかしながら、前記認定事実によれば、原告代表者がＦとの取引を認識していたことは明らかであるし、原告代表者は、本件調査の際、本件Ｆ転売債権に係る売上金を売上高として計上しなかった理由について、原告の帳簿に記載していないリベートや交際費の支払があったためであるとか、仕入資金を確保するためであるなどと供述していたこと（乙２７）に照らすと、前記原告の主張は、到底これを採用することができない。 \n ウ よって、原告には隠ぺい・仮装の事実があると認められる。 \n (3) 原告が平成１４年２月期において、Ｈに対する仕入代金であるとして５００万円を過大に計上したことについて、隠ぺい・仮装の事実があるかについてア 前記認定事実によれば、原告は、ＨからＨ債権を５００万円で買い受けたにもかかわらず、 \n 平成１４年２月期の総勘定元帳（仕入高）に、Ｈ債権を１０００万円で仕入れた旨を記載し、 \n かつ、その後、Ｊに対し、Ｈ債権の売買代金を１０００万円とする原告宛てのＨ名義の領収証を発行させているのである。また、証拠（乙８）によれば、原告代表者は、本件調査の際、 \n Ｈ債権の仕入代金を１０００万円とした理由について、所得金額を圧縮して税金を少なくすることにより、次の期の仕入資金を確保するためであったと供述していることが認められる。 \n これらの事実からすれば、原告は、所得金額を圧縮して税負担を免れることを意図して、 \n Ｈに対する仕入代金を５００万円過大に計上して１０００万円としたと認められる。 \n イ これに対し、原告は、Ｈから５００万円でＨ債権を仕入れた時に、原告代表者もＨから無償で評価額５００万円の債権を譲り受けたため、両債権を誤って混同してしまったからであると主張し、原告代表者も本人尋問においてこれに沿う供述をする。 \n しかしながら、原告代表者は、債権回収業を営んでいないのであるから（原告代表者本人）、 \n 原告代表者名で不良債権を譲り受けること自体不自然、不合理である上、原告代表者の供述は、自らが５００万円相当の債権を無償で譲り受けたと供述する一方で、原告がその債権を保管・請求していると供述するなど一貫していないから、原告代表者の供述を信用することはできず、他に前記認定を覆すに足りる証拠はない。 \n ウ よって、原告には隠ぺい・仮装の事実があると認められる。 \n ５ 本件３口座に振込入金された売上金について（争点６） \n (1) 証拠と弁論の全趣旨によれば、次の事実が認められる（証拠は認定事実ごとに摘示する。）。 \n ア 本件乙口座は、平成１１年１月２８日、Ｂ銀行本店営業部で開設された普通預金口座（口座番号 ）であり、同年２月９日から、平成１２年７月３１日までの間、入出金の取引が行われた。また、本件乙名義口座には、複数の者からの振込入金がある（乙３５の①、②、弁論の全趣旨）。 \n イ 本件丙口座は、平成１０年１０月２２日、Ｃ銀行（現Ｃ銀行）六本木支店で開設された普通預金口座（六本木支店から赤坂支店に移管されており、それに伴い、口座番号も開設時のから へと変更されている。）であり、平成１０年１２月１５日から平成１３年１０月１７日までの間、入出金の取引が行われた。また、本件丙口座には、 \n 複数の者からの振込入金がある（乙３６の①、②、弁論の全趣旨）。 \n ウ 本件丁口座は、平成１１年２月４日、Ｄ銀行本店営業部（現Ｄ銀行東京中央支店）で開設された普通預金口座（口座番号 ）であり、同年４月５日から平成１３年１２月１４日までの間、入出金の取引が行われた。また、本件丁口座には、複数の者からの振込入金がある（乙３７の①、②、弁論の全趣旨）。 \n エ 原告は、別表６記載のとおりの普通預金口座（以下「本件公表口座」という。）を保有している（乙１の①ないし③に添付された預貯金等の内訳書）。また、原告代表者は、本件公表口座に含まれる他人名義口座以外にも、平成１０年から平成１１年頃にかけて複数の預金口座を開設した（乙３８）。 \n オ Ｂ銀行登川支店の現金自動預払機の操作記録によると、平成１２年５月８日午前９時７分から同日午前９時１３分までの間、本件丙口座、本件乙口座並びに本件公表口座であるＷ名義口座、丁名義口座（本件丁口座とは別の口座である。）、Ｘ名義口座及び原告名義口座のＡ \n ＴＭ操作が連続して行われた上、これらの口座から出金された金員の合計額５０万３０００円が、直ちに原告名義の預金口座に振り込まれている（乙３９の①）。 \n また、同年８月２３日午前９時１１分から同日午前９時１３分までの間、本件丁口座及び本件公表口座である原告名義口座のＡＴＭ操作が連続して行われ、本件丁口座から出金された６０万円が、直ちに原告名義の口座に振り込まれている（乙３９の②）。 \n カ 原告は、顧客の業務管理資料として「Ｙ」と題する顧客の管理名簿（以下「本件顧客名簿」 \n という。）を作成しており、同名簿には、顧客名及び債権管理の情報が記載されている（乙 \n ４０）。 \n キ 原告は、平成１２年２月期ないし平成１４年２月期において、本件３口座に振込入金された金額を、平成１２年２月期ないし平成１４年２月期の各総勘定元帳（売上高）に記載しなかった（乙１０の①、弁論の全趣旨）。 \n (2) 平成１２年２月期ないし平成１４年２月期において、本件３口座に振込入金された売上金は、原告に帰属するかについてア 前記認定事実によれば、平成１２年５月８日午前９時７分から同日午前９時１３分までの間、Ｂ銀行登川支店の現金自動預払機において、本件丙口座、本件乙口座並びに本件公表口座であるＷ名義口座、丁名義口座（本件丁口座とは別の口座である。）、Ｘ名義口座及び原告名義口座のＡＴＭ操作が連続して行われた上、これらの口座から出金された金員の合計額５ \n ０万３０００円が、直ちに原告名義の預金口座に振り込まれており、また、同年８月２３日午前９時１１分から同日午前９時１３分までの間、本件丁口座及び本件公表口座である原告名義口座のＡＴＭ操作が連続して行われ、本件丁口座から出金された６０万円が、直ちに原告名義の口座に振り込まれているのである。 \n そして、本件３口座の取引記録によると、本件３口座には延べ５４２回の振込入金がされており、本件３口座に振込入金した者は別表７の１記載のとおりであるところ（乙３５の②、 \n ３６の②、３７の②）、本件３口座への振込入金者を五十音名寄せ順に並べ替えた上で、原告の顧客名簿の顧客名と照らし合わせると、別表７の２記載のとおり、計３５２回の振込入金のうち２８１回の振込入金が、原告の顧客名簿の顧客名による振込みであることが認められる（弁論の全趣旨）。 \n さらに、乙は、本件乙口座の総合口座（普通預金）印鑑票（乙３５の①）に記載されている生年月日が自己のものと違う上、筆跡や印鑑も自己のものではないから、本件乙口座は自己の口座ではないと供述しているところ（乙４２）、原告代表者が札幌国税局収税官吏に対して提出した申述書（乙４１）の筆跡、本件乙口座の総合口座（普通預金）印鑑票（乙３５の①）の筆跡、本件丙口座の印鑑（署名鑑）届（乙３６の①）の筆跡及び本件丁口座のスーパー総合口座取引印鑑等届（乙３７の①）の筆跡は、それぞれ似ている箇所が見受けられることからすると、本件３口座はいずれも原告代表者によって開設された口座であると推認され、この推認を覆すに足りる証拠はない。 \n 以上のとおり、本件３口座と原告の口座が短時間に同じ現金自動預払機において連続して取引されていること、本件３口座へ振込入金した者の多くが原告の顧客であること、本件３口座は原告代表者によって開設された口座であること等といった事実を総合すれば、本件３口座は原告に帰属する口座であると認められる。 \n イ これに対し、原告は、本件乙口座は乙の口座であって原告の口座ではなく、原告は、乙から、携帯電話解約違約金債権回収の委託を受けて本件乙口座の通帳を預かり、その回収を行っていたものにすぎないと主張するところ、確かに、証拠（乙４５、４６）によれば、原告は、平成１１年初めころ、Ｅの代表取締役である乙から、携帯電話解約違約金債権回収の委託を受けたことが認められる（乙４５、４６）。 \n しかしかながら、この事実は、本件３口座は原告に帰属する口座であるとの前記認定を左右するには足りず、他に前記認定を左右するに足りる証拠はない。 \n また、原告は、本件丙口座及び本件丁口座は、原告の口座であったが、本件当時、両口座は既に他の者へ譲渡されていたと主張する。 \n しかしながら、原告の主張は、譲渡の日時、相手方等が明らかにされないなど具体性が全くない上、原告の主張を認めるに足りる証拠もないから、到底採用することができない。 \n ウ 以上のとおりであるから、平成１２年２月期ないし平成１４年２月期において、本件３口座に振込入金された売上金は、原告に帰属すると認められる。 \n (3) 原告が平成１２年２月期ないし平成１４年２月期において、本件３口座に振込入金された売上金を売上高に計上しなかったことについて、隠ぺい・仮装の事実があるかについてア (1)で認定した事実に(2)で説示したところを総合すれば、原告は、原告に帰属する本件３口座に振込入金された売上金を意図的に申告除外したと認められ、この認定を覆すに足りる証拠はない。 \n よって、原告には隠ぺい・仮装の事実があると認められる。 \n イ そして、平成１２年２月期ないし平成１４年２月期の各事業年度の売上金から除外された本件３口座に係る振込入金額は、別表８の１ないし４記載のとおりとなるから（弁論の全趣旨）、原告の平成１２年２月期ないし平成１４年２月期の各事業年度の所得金額に加算すべき本件３口座の振込入金に係る売上金は、平成１２年２月期が１１４１万４２１４円、平成 \n １３年２月期が６０７万９７４５円、平成１４年２月期が６８万３０００円となる。 \n ６ 乙に対する仕入代金について（争点７） \n (1) 証拠と弁論の全趣旨によれば、次の事実が認められる（証拠は認定事実ごとに摘示する。）。 \n ア 原告は、平成１２年２月期の総勘定元帳（仕入高）の平成１１年１２月２日の摘要欄に「商品を仕入れた（預金）乙」、借方金額欄に「３００，０００」と記載し、同月１７日の摘要欄に「商品を仕入れた（預金）乙」、借方金額欄に「１，９００，０００」と記載し、平成 \n １２年１月５日の摘要欄に「商品を仕入れた（預金）乙」、借方金額欄に「１，０００，０ \n ００」と記載し、同年２月９日の摘要欄に「商品を仕入れた（預金）乙」、借方金額欄に「１， \n ０００，０００」と記載した（乙４３の①）。 \n また、原告は、平成１３年２月期の総勘定元帳（仕入高）に、平成１２年１１月８日の摘要欄に「乙」、借方金額欄に「１，０００，０００」と記載し、平成１２年１２月１日の摘要欄に「乙」、借方金額欄に「１，０００，０００」と記載した（乙４３の②）。 \n イ 本件乙口座２は、平成１１年１月２７日、Ｃ銀行（現Ｃ銀行）札幌支店で開設された普通預金口座（口座番号 ）であり、同年１２月２日から平成１２年１２月１日までの間、入出金の取引が行われた（甲４４の①、②、弁論の全趣旨。）。 \n ウ 本件乙口座２には、前記アに対応して、原告から、平成１１年１２月２日に３０万円、同月１７日に１９０万円、平成１２年１月５日に１００万円、同年２月９日１００万円、同年 \n １１月８日に１００万円、平成１２年１２月１日に１００万円が振り込まれ、そして、上記原告からの振込金額は、各振込日に、振込金額全額が引き出されている（乙４４の②）。 \n (2) 原告が乙に対する仕入代金として計上した平成１２年２月期の４２０万円及び平成１３年 \n ２月期の２００万円は、いずれも架空か、及び、原告が平成１２年２月期及び平成１３年２月期において、上記各金額を乙からの仕入代金として計上したことについて、隠ぺい・仮装の事実があるかについてア 前記認定事実によれば、原告は、平成１２年２月期に合計４２０万円、平成１３年２月期に合計２００万円をそれぞれ本件乙口座２に振り込むとともに、これを乙に対する仕入代金として計上しているところ、乙は、本件乙口座２に係る印鑑（署名鑑）届について、本件乙口座と同様、生年月日や筆跡が違う上、届出印も保管しておらず、また、原告代表者から同口座を作るという連絡を受けたこともないと供述していること（乙４２）、本件乙口座２に係る印鑑（署名鑑）届の筆跡は、原告代表者が札幌国税局収税官吏に対して提出した申述書 \n （乙４１）の筆跡と酷似していることからすると、本件乙口座２も本件３口座同様、原告代表者によって開設された原告に帰属する口座であると推認され、この推認を覆すに足りる証拠はない。 \n この事実に、原告は様々な売上金をあえて原告の売上高に計上せず意図的に申告除外したり、あるいは、所得金額を圧縮して税負担を免れることを意図して仕入代金を仮装したりしていたこと等といった前記認定事実を総合すれば、原告は、所得金額を圧縮して税負担を免れることを意図して、乙に対する架空の仕入代金を平成１２年２月期及び平成１３年２月期に計上したと推認される。 \n イ これに対し、原告は、平成１２年２月期及び平成１３年２月期に計上した乙に対する仕入代金は、原告が乙から仕入れた携帯電話解約違約金債権の仕入代金であり、架空のものではないと主張するところ、確かに、証拠（乙４５）によれば、原告は、平成１１年初めころ、 \n Ｅの代表取締役である乙から、携帯電話解約違約金債権回収の委託を受け、当初、原告とＥとの間では、原告が回収した携帯電話解約違約金を原告とＥが折半して取得することになっていたが、その後、回収がはかどらないとの原告から申出により、回収した携帯電話解約違約金のうち７ないし８割を原告が、その余をＥがそれぞれ取得することを合意したことが認められる。 \n しかしながら、証拠（乙４２）によれば、原告は、Ｅに対し、回収した携帯電話解約違約金を支払っていないと認められるから、前記認定事実は、平成１２年２月期及び平成１３年 \n ２月期に計上した乙に対する仕入代金が架空であるとの前記認定を左右するものではなく、 \n 他に前記認定を左右するに足りる証拠はない。 \n ウ 以上のとおりであるから、原告には隠ぺい・仮装の事実があると認められる。 \n ７ 戊に対する役員報酬及び給与手当について（争点８） \n (1) 証拠と弁論の全趣旨によれば、次の事実が認められる（証拠は認定事実ごとに摘示する。）。 \n ア 戊は、平成１３年５月３０日から平成１５年１０月３１日まで、原告の取締役の地位にあった（乙４７）。 \n イ 原告は、平成１３年２月期の総勘定元帳（給料手当）の平成１２年１０月２４日の摘要欄に「従業員に給料を支払う 戊」、借方金額欄に「８５，０００」と記載した（乙４８の①）。 \n また、原告は、平成１３年２月期の総勘定元帳（役員報酬）の平成１２年１１月２２日の摘要欄に「従業員に給料を支払う 戊」、借方金額欄に「８５，０００」と記載し、同年１２月２２日の摘要欄に「役員報酬を支払う 戊」、借方金額欄に「８５，０００」と記載し、 \n 平成１３年１月２３日の摘要欄に「役員報酬を支払う 戊」、借方金額欄に「８５，０００」 \n と記載し、同年２月２３日の摘要欄に「役員報酬を支払う 戊」、借方金額欄に「８５，０ \n ００」と記載した（乙４８の②。以上支払額合計４２万５０００円）。 \n 原告は、平成１４年２月期の総勘定元帳（役員報酬）において、平成１３年３月２３日、 \n 同年４月２４日、同年５月２３日、同年６月２１日、同年７月２３日、同年８月２２日、同年９月２０日、同年１０月２４日、同年１１月２１日、同年１２月２５日、平成１４年１月 \n ２３日及び同年２月２２日の各摘要欄に「役員報酬を支払う 戊」、同借方金額欄に「８５， \n ０００」とそれぞれ記載した（乙４８の③。以上支払額合計１０２万円）。 \n さらに、原告は、平成１５年２月期の総勘定元帳（役員報酬）において、平成１４年３月 \n ２２日、同年４月２４日、同年５月２４日、同年６月２４日、同年７月２４日及び同年８月 \n ２２日の各摘要欄に「役員報酬を支払う 戊」、同借方金額欄に「８５，０００」とそれぞれ記載した（乙４８の④。以上支払額合計５１万円）（以下、原告が戊に対する役員報酬及び給与手当として計上した平成１３年２月期の４２万５０００円、平成１４年２月期の１０ \n ２万円及び平成１５年２月期の５１万円を「本件戊報酬」という。）。 \n ウ 本件戊口座は、平成１２年１０月６日にＢ銀行本店営業部で開設された普通預金口座（口座番号 ）であり、同年１０月２４日から平成１４年９月７日までの間、入出金の取引が行われている（乙４９の①、②）。 \n エ 本件戊口座には、前記イの本件戊報酬に対応して、原告から、平成１２年１０月２４日、 \n 同年１１月２２日、同年１２月２５日、平成１３年１月２４日、同年２月２３日、同年３月 \n ２３日、同年４月２４日、同年５月２４日、同年６月２２日、同年７月２４日、同年８月２ \n ３日、同年９月２１日、同年１０月２４日、同年１１月２１日、同年１２月２５日、平成１ \n ４年１月２４日、同年２月２２日、同年３月２２日、同年４月２４日、同年５月２４日、同年６月２４日、同年７月２４日及び同年８月２２日に、それぞれ８万５０００円が振り込まれている（乙４９の②）。 \n オ 本件戊口座の取引があった平成１２年１０月２４日から平成１４年９月７日までの間、同口座へ振込入金された金額は、前記エの原告による本件戊報酬の振込入金のほかに、有限会社Ｌから平成１２年１２月１１日に振り込まれた２４万１７０５円、有限会社Ｚから平成１ \n ３年１月１７日に振り込まれた７０万円がある（乙４９の②）。 \n カ Ｂ銀行登川支店の現金自動預払機の操作記録によると、平成１３年１月１８日１３時３１分から同日１３時３３分までの間、本件戊口座及び原告名義の口座のＡＴＭ操作が連続して行われ、本件戊口座から出金された７０万円が、直ちに原告名義の口座に振り込まれている \n （乙５０の①）。 \n また、同支店の現金自動預払機の操作記録によると、平成１３年３月２８日１０時５２分から同日１０時５５分までの間、本件戊口座、本件丙口座並びに本件公表口座である丁口座、 \n Ｗ口座、Ｘ口座及び原告名義口座のＡＴＭ操作が連続して行われ、本件戊口座から出金された１０１万円が、直ちに原告名義の口座に振り込まれている（乙５０の②）。 \n (2) 本件戊報酬は、いずれも架空か、及び、原告が本件戊報酬を計上したことについて、隠ぺい・仮装の事実があるかについてア 前記認定事実を前提として、以下、上記争点について判断する。 \n 戊は、本件調査の際、元娘婿である原告代表者に頼まれて原告の取締役として名前を貸しただけであり、原告の仕事をしたことや原告の経営に関して助言をしたことはなく、本件戊報酬も受け取っていないと供述しているところ（乙５２）、この戊の供述は、戊が上記供述当時、すでに原告の取締役を辞任しており、原告と利害関係を有していなかったこと、戊は本件戊報酬について確定申告しており（乙５２）、報酬の受領について虚偽の供述をする動機が特に認められないことからすると、信用することができる。よって、戊は、原告の業務につき何ら関わっておらず、また、原告から本件戊報酬を受け取っていないことが認められる。 \n そして、①本件戊口座と原告に帰属する口座は連続してＡＴＭ操作されていること（前記認定事実）、②本件戊口座に係る総合口座（普通預金）印鑑票、（乙４９の①）の筆跡は、原告代表者が札幌国税局収税官吏に対して提出した申述書（乙４１）の筆跡と似ていること、 \n Ｓは、同印鑑票の筆跡は原告代表者のものであり、開設手続を行ったのは原告代表者であると供述していること（乙２４）、戊は同印鑑票の筆跡について、自己のものではなく、そもそもＢ銀行本店と取引したことはない旨供述していること（乙５２）を総合すれば、本件戊口座は原告代表者によって開設された口座であると認められること、③本件戊口座には、原告による本件戊報酬のほかに、有限会社Ｌから２４万１７０５円、有限会社Ｚから７０万円が振り込まれているところ（前記認定事実）、原告代表者は、いずれの入金も、原告代表者が、有限会社Ｌ及び有限会社Ｚの各代表者に貸し付けた金銭の返済であると供述していること（乙５１）、④Ｓは、本件戊口座の通帳及びキャッシュカードは、原告代表者が管理し、 \n 入出金も原告代表者が行っていたと供述していること（乙２４）を総合すれば、本件戊口座は、原告に帰属する口座であると認められる。 \n そうすると、原告は、原告に帰属する本件戊口座に本件戊報酬を振り込んで、実際に戊に対して本件戊報酬を支払ったように装ったと認められる。 \n イ これに対し、原告は、本件戊報酬は間違いなく戊に支給されたものであって、このことは、 \n 戊が原告から振り込まれた役員報酬等を自らの所得として確定申告していることからも明らかであると主張し、原告代表者も本人尋問においてこれに沿う供述をするところ、確かに、 \n 戊が原告から振り込まれた本件戊報酬を自らの所得として確定申告していたこと（乙５２） \n は原告が主張するとおりである。 \n しかしながら、戊が確定申告をしていたのは、原告の経理上、本件戊報酬が支払われたことになっていたからにすぎず（乙５２）、実際に戊は本件戊報酬を受け取っていないのであるから（前記認定事実）、戊が確定申告していたとの事実は、原告が戊に対して本件戊報酬を支払ったかのように装ったとの前記認定を左右するものではなく、他に前記認定を左右するに足りる証拠はない。 \n ウ 以上のとおりであるから、本件戊報酬は、いずれも架空のものであり、かつ、原告には隠ぺい・仮装の事実があると認められる。 \n ８ Ｉに対する役員報酬について（争点９） \n (1) 証拠と弁論の全趣旨によれば、次の事実が認められる（証拠は認定事実ごとに摘示する。）。 \n ア Ｉは、平成１３年５月３０日から、原告の取締役の地位にある（乙４７）。 \n イ 原告は、平成１４年２月期の総勘定元帳（役員報酬）において、平成１３年１０月２４日、 \n 同年１１月２１日、同年１２月２５日、平成１４年１月２３日及び同年２月２２日の各摘要欄に「役員報酬を支払う Ｉ」、借方金額欄に「２３９，７６０」と記載し、また、上記各日の別の摘要欄に「源泉税預かり Ｉ」、借方金額「１０，２４０」と記載した（乙４８の \n ③。上記金額の合計１２５万円）。 \n また、原告は、平成１５年２月期の総勘定元帳（役員報酬）において、平成１４年３月２ \n ２日、同年４月２４日、同年５月２４日、同年６月２４日、同年７月２３日、同年８月２１日、同年９月２４日、同年１０月２４日、同年１１月２５日、平成１５年１月２２日及び同年２月２４日の各摘要欄に「役員報酬を支払う Ｉ」借方金額欄に「２３９，７６０」と記載し、また、上記各日の別の摘要欄（ただし、７月は２３日ではなく２４日である。）に「源泉税預かり Ｉ」、借方金額「１０，２４０」と記載した（乙４８の④。上記金額の合計３ \n ００万円）（以下、原告がＩに対する役員報酬として計上した平成１４年２月期の１２５万円及び平成１５年２月期の３００万円を「本件Ｉ報酬」という。）。 \n ウ 本件Ｉ口座は、平成１３年１０月５日、Ｃ銀行札幌支店で開設され、同年１０月１７日から入出金の取引が行われた（乙５５の①、②）。 \n エ 本件Ｉ口座には、前記イに対応して、平成１３年１０月２４日、同年１１月２１日、平成 \n １４年１月２４日、同年２月２２日、同年３月２２日、同年４月２４日、同年５月２４日、 \n 同年６月２４日、同年７月２３日、同年８月２１日、同年９月２４日、同年１０月２４日、 \n 同年１１月２５日、平成１５年１月２２日及び同年２月２４日に原告からそれぞれ２３万９ \n ７６０円、平成１３年１２月２５日に原告から２７万４８０円、平成１４年１２月２４日に原告から２３万９４４０円が振り込まれている（乙５５の②）。 \n オ Ｉは、平成１２年４月から平成１４年３月までの間、専門学校ａ札幌校においてデザイン等を学んでおり、そのころからｂ内の服飾関係のテナントでアルバイトをしていた。Ｉは、 \n その後、平成１４年４月から、アメリカに留学した（乙２４）。 \n (2) 本件Ｉ報酬は、いずれも架空かについてア 前記認定事実を前提として、以下、上記争点について判断する。 \n Ｓは、本件調査の際、本件Ｉ口座は、原告代表者の指示により、Ｃ銀行のメールオーダーサービスを利用して開設した旨（乙２４）、印鑑（署名鑑）届（乙５５の①）への記入及び捺印は原告代表者の指示により行った旨（乙２４）、本件Ｉ口座の預金通帳及びキャッシュカードは、平成１４年６月にＳが原告代表者と離婚するまでは原告代表者が管理しており、 \n その後も原告代表者が管理していると思われる旨（乙２４）、本件Ｉ口座の金銭の出し入れは原告代表者が行っていた旨供述している。 \n ところで、Ｓは、平成１３年５月３０日から平成１４年５月３１日までの間、原告の取締役として主に経理を担当していたから（乙２４）、当時の原告の経理に詳しい人物であるといえる。また、Ｓは、原告代表者の元配偶者であり、Ｉの母でもあるから（乙５４）、原告代表者及びＩの財産等の実情について最も詳しい人物であるということができる。そうすると、そのような地位にあるＳの前記供述は、信用することができるというべきである。 \n よって、本件Ｉ口座は、原告代表者の指示によって開設された口座であって、原告代表者によって管理されていた口座であると認められる。 \n また、前記認定事実によれば、Ｉは、平成１２年４月から平成１４年３月までの間、専門学校ａ札幌校に通学し、平成１４年４月から、アメリカに留学しているところ、Ｓは、本件調査の際、この間、Ｉが原告の経営や業務に関与したことはなかった旨（乙２４、５４）、 \n 原告代表者は、会社の経営に関して子に相談するような人間ではなく、Ｉも債権回収や会社経営に関する知識を有していない旨（乙２４）、Ｉを原告の取締役にしたのはＩが留学する費用を捻出するためであったと思われる旨（乙２４）供述しているのであるから、Ｉは、原告の経営及び業務に一切関与していなかったと認められる。 \n 以上の事実を総合すれば、本件Ｉ報酬は、いずれも架空のものであると認められる。 \n イ これに対し、原告は、Ｉが国内で就学中は原告の業務を手伝った対価として、Ｉが米国に留学中は米国の専門学校に通学する傍ら米国債権回収市場等の実態動向調査等を行ったことに対する対価としてそれぞれ役員報酬を支払ったものであり、本件Ｉ報酬は、いずれも架空のものではないと主張するが、前記認定事実に反し採用することができない。 \n ウ よって、本件Ｉ報酬は、いずれも架空のものであると認められる。 \n ９ 本件預金利子及び本件道府県民税利子割について（争点１１） \n (1) 被告が平成１２年２月期ないし平成１５年２月期において、本件３口座及び本件戊口座に係る本件預金利子及び本件道府県民税利子割を所得金額に加算したことは適法かについてすでに認定してきたように、本件３口座及び本件戊口座はいずれも原告に帰属する口座であるところ、本件乙口座の預金取引明細表及び普通預金口座別残高表（乙３５の②）、本件丙口座の普通預金元帳（乙３６の②）、本件丁口座の預金取引明細表（乙３７の②）及び本件戊口座の普通預金口座別残高表（乙４９の②）に基づいて、本件預金利子及び本件道府県民税利子割を算定すると、別表４のとおりになると認められる。 \n よって、被告が平成１２年２月期ないし平成１５年２月期において、本件３口座及び本件戊口座に係る本件預金利子及び本件道府県民税利子割を所得金額に加算したことは適法である。 \n (2) 原告が平成１２年２月期ないし平成１５年２月期において、本件預金利子及び本件道府県民税利子割を所得金額に加算しなかったことについて、隠ぺい・仮装の事実があるかについてすでに認定してきたように、原告は、本件３口座及び本件戊口座が原告に帰属するものであるにもかかわらず、それぞれの名義人に帰属するものであるかのように装っていたのであるから、本件３口座及び本件戊口座に係る本件預金利子及び本件道府県民税利子割についても、原告には隠ぺい・仮装の事実があると認められる。 \n １０ 被告が認定した原告代表者への貸付金に係る利息について（争点１０） \n (1) 被告が平成１２年２月期ないし平成１５年２月期において、本件調査により把握した所得金額計算上の非違事項のうち一部の金額を原告代表者への貸付金（本件貸付金）として認定し、 \n それに係る利息（本件貸付金に係る認定利息）を所得金額に加算したことは適法かについてすでに認定してきた事実に弁論の全趣旨を総合すれば、本件Ｇ転売債権１及び本件Ｇ転売債権２に係る各売買代金並びに本件Ｆ転売債権に係る売買代金を現金で受領したのは原告代表者であること、本件３口座、本件乙口座２、本件戊口座及び本件Ｉ口座を管理していたのは原告代表者であることがそれぞれ認められるところ、この事実に弁論の全趣旨を総合すれば、被告が本件各更正処分において加算した所得金額については、原告代表者が管理していたと認めるのが相当である。 \n よって、被告が、本件各更正処分に際して本件各事業年度の所得金額に加算し減算した各金額のうち、別表３－２のとおり、原告代表者への貸付金（本件貸付金）として認定し、同別表 \n ３－１のとおり、本件貸付金に係る認定利息を算出したこと、及び、同別表２のとおり、本件貸付金に係る認定利息を所得金額に加算したことは適法であるというべきである。 \n (2) 原告が平成１２年２月期ないし平成１５年２月期において、本件貸付金に係る認定利息を所得金額に加算しなかったことについて、隠ぺい・仮装の事実があるかについてすでに認定してきたところによれば、本件貸付金は、別表３－１のとおりであるところ、本件各修正申告に基づく役員貸付金及び被告が主張する所得金額に基づく役員貸付金の加算額のうち、本件Ｉ報酬の役員報酬否認額にかかる役員貸付金を除いた役員貸付金について、いずれも原告に隠ぺい・仮装の事実があると認められるから、これら隠ぺい・仮装の事実に起因する本件貸付金に基づいて算定した本件認定利息を所得金額から除外して申告していたことについても、隠ぺい・仮装の事実があると認められる。 \n １１ 事業税の額について（争点１２） \n 被告が平成１３年２月期ないし平成１５年２月期において、本件各更正処分に基づく所得金額の増加に伴い納付すべきとした事業税の額は適法かについてすでに認定してきたところによれば、原告の本件各事業年度の所得金額は、別表２記載のとおりであると認められるところ、本件各更正処分における所得金額（別表の順号④「更正処分等」 \n 欄のうち「所得金額」欄参照）は、その範囲内であるから、本件各更正処分における所得金額は適法である。 \n そして、弁論の全趣旨によれば、被告は、本件各更正処分における所得金額を前提として納付すべき事業税の額を算定していると認められるから、その事業税の額も適法である。 \n １２ 本件各更正処分の適法性についてすでに認定してきたところによれば、原告の本件各事業年度の所得金額及び納付すべき税額は、 \n 別表２記載のとおりになると認められるところ、本件各更正処分における所得金額及び納付すべき金額は、いずれもその範囲内である。 \n よって、本件各更正処分は適法である。 \n １３ 本件各賦課決定処分１の適法性について証拠（乙２の①、②）と弁論の全趣旨によれば、本件各修正申告書の内容は、別表１記載のとおりであり、原告が、本件各修正申告書において、所得金額に加算及び減算した額及び所得金額に対する納付すべき税額とした金額は、別紙別表１の内訳記載のとおりであると認められるところ、すでに認定してきたところ（争点１、３ないし５に対する当裁判所の判断）によれば、本件各賦課決定処分１は適法である。 \n １４ 本件各賦課決定処分２の適法性についてすでに認定してきたところによれば、原告の本件各事業年度の加算税の額は、別表２記載のとおりになると認められるところ、本件各賦課決定処分２における加算税の額は、いずれもその範囲内である。 \n よって、本件各賦課決定処分２は適法である。 \n １５ 結論以上のとおりであるから、本件各処分は適法であり、原告の請求は理由がないから、これを棄却することとし、訴訟費用について民事訴訟法６１条を適用して、主文のとおり判決する。 \n 札幌地方裁判所民事第５部裁判長裁判官 中山 幾次郎裁判官 村主 隆行裁判官 鷺坂 計知 \n （別紙） \n 別表２の内訳 \n １ 平成１２年２月期 \n (1) 所得金額 １４７４万６５８８円 \n （別表２の「平成１２年２月期」欄の順号⑰） \n ア 加算額 １５８３万３９１９円 \n （別表２の「平成１２年２月期」欄の順号⑩） \n (ア) 売上除外 １１４１万４２１４円 \n （別表２の「平成１２年２月期」欄の順号②） \n 上記金額は、原告に帰属する本件３口座に振り込まれた売上金であるが、原告はこれを公表帳簿に記載せず申告から除外していた（争点６参照）。 \n (イ) 架空仕入 ４２０万円 \n （別表２の「平成１２年２月期」欄の順号③） \n 上記金額は、原告が公表帳簿に乙からの仕入れであるとして仮装し、架空に計上していたものである（争点７参照）。 \n (ウ) 本件貸付金に係る認定利息 ２１万９５２５円 \n （別表２の「平成１２年２月期」欄の順号⑦） \n 上記金額は、被告が認定した平成１２年２月期の本件貸付金の額を基に同期における本件貸付金の平均残高を算定の上、年３パーセントの利率を乗じて算定したもの（別表３－１の「平成１２年２月期」欄の順号⑱の金額）である（争点１０参照）。 \n (エ) 本件預金利子 １７１円 \n （別表２の「平成１２年２月期」欄の順号⑧） \n 上記金額は、平成１２年２月期における本件預金利子（別表４の「平成１２年２月期」欄のうち「本件預金利子」欄の順号⑤の金額）であるが、原告はこれを公表帳簿に記載せず申告から除外していた（争点１１参照）。 \n (オ) 本件道府県民税利子割 ９円 \n （別表２の「平成１２年２月期」欄の順号⑨） \n 上記金額は、平成１２年２月期における本件道府県民税利子割（別表４の「平成１２年２月期」欄のうち「本件道府県民税利子割」欄の順号⑤の金額）であるが、同金額は、法人税法（平成１８年法律第１０号による改正前のもの）３８条２項３号の規定により損金の額に算入されない（争点１１参照）。 \n イ 減算額 ７９万７０４８円 \n （別表２の「平成１２年２月期」欄の順号⑯） \n 仕入認容 ７９万７０４８円 \n （別表２の「平成１２年２月期」欄の順号⑫） \n 上記金額は、原告がＥとの間の携帯電話解約違約金債権の取立てに係る委託契約に基づき、原告が同社に支払うべき仕入代金であるが、原告はこれを仕入高に計上していなかった。 \n (2) 納付すべき税額 ４３２万７２００円 \n （別表２の「平成１２年２月期」欄の順号⑱） \n 上記金額は、下記アの金額４３２万７３７０円から下記イの金額１０２円を差し引いた金額（通則法１１９条１項の規定に基づき百円未満の端数金額を切り捨てた後のもの）である。 \n ア 所得金額に対する法人税額 ４３２万７３７０円上記金額は、前記(1)の所得金額１４７４万６５８８円（通則法１１８条１項の規定に基づき千円未満の端数を切り捨てた後のもの）に法人税法（平成１８年法律第１０号による改正前のもの）６６条１項及び２項に規定する税率を乗じて計算した金額である。 \n イ 法人税額から控除される所得税額等 １０２円上記金額は、法人税法（平成１５年法律第８号による改正前のもの）６８条１項に規定する法人税額から控除される所得税額であり、原告の平成１２年２月期に係る法人税の確定申告書に記載されている金額である。 \n ２ 平成１３年２月期 \n (1) 所得金額 ７４３万５９９０円 \n （別表２の「平成１３年２月期」欄の順号⑰） \n ア 加算額 ９０５万６５８０円 \n （別表２の「平成１３年２月期」欄の順号⑩） \n (ア) 売上除外 ６０７万９７４５円 \n （別表２の「平成１３年２月期」欄の順号②） \n 上記金額は、原告に帰属する本件３口座に振り込まれた売上金であるが、原告はこれを公表帳簿に記載せず申告から除外していた（争点６参照）。 \n (イ) 架空仕入 ２００万円 \n （別表２の「平成１３年２月期」欄の順号③） \n 上記金額は、原告が公表帳簿に乙からの仕入れであるとして仮装し、架空に計上していたものである（争点７参照）。 \n (ウ) 役員報酬否認 ３４万円 \n （別表２の「平成１３年２月期」欄の順号④） \n 上記金額は、原告が公表帳簿に戊に対する役員報酬として仮装し、架空に計上していたものである（争点８参照）。 \n (エ) 給料手当否認 ８万５０００円 \n （別表２の「平成１３年２月期」欄の順号⑤） \n 上記金額は、原告が公表帳簿に戊に対する役員報酬として仮装し、架空に計上していたものである（争点８参照）。 \n (オ) 本件貸付金に係る認定利息 ５５万１７３５円 \n （別表２の「平成１３年２月期」欄の順号⑦） \n 上記金額は、被告が認定した平成１３年２月期の本件貸付金の額を基に同期における本件貸付金の平均残高を算定の上、年３パーセントの利率を乗じて算定したもの（別表３－１の「平成１３年２月期」欄の順号⑱の金額）である（争点１０参照）。 \n (カ) 本件預金利子 ９６円 \n （別表２の「平成１３年２月期」欄の順号⑧） \n 上記金額は、平成１３年２月期における本件預金利子（別表４の「平成１３年２月期」欄のうち「本件預金利子」欄の順号⑤の金額）であるが、原告はこれを公表帳簿に記載せず申告から除外していた（争点１１参照）。 \n (キ) 本件道府県民税利子割 ４円 \n （別表２の「平成１３年２月期」欄の順号⑨） \n 上記金額は、平成１３年２月期における本件道府県民税利子割（別表４の「平成１３年２月期」欄のうち「本件道府県民税利子割」欄の順号⑤の金額）であるが、同金額は、法人税法（平成１８年法律第１０号による改正前のもの）３８条２項３号の規定により損金の額に算入されない（争点１１参照）。 \n イ 減算額 １０６万８０７３円 \n （別表２の「平成１３年２月期」欄の順号⑯） \n (ア) 仕入認容 ７万０６４８円 \n （別表２の「平成１３年２月期」欄の順号⑫） \n 上記金額は、原告がＥとの間の携帯電話解約違約金債権の取立てに係る委託契約に基づき、 \n 原告が同社に支払うべき仕入代金であるが、原告はこれを仕入高に計上していなかった。 \n (イ) 未払事業税認容 ９９万７４００円 \n （別表２の「平成１３年２月期」欄の順号⑭） \n 上記金額は、本件各更正処分のうち、平成１２年２月期に係る更正処分に基づく所得金額の増加に伴い納付すべき事業税の額であり、法人税基本通達９－５－２に基づき、平成１３年２月期の所得金額の計算上、損金の額として認容した（争点１２参照）。 \n (ウ) 還付道府県民税利子割認容 ２５円 \n （別表２の「平成１３年２月期」欄の順号⑮） \n 上記金額は、平成１３年２月期に係る法人税の確定申告において、雑収入に計上した平成１ \n ０年３月１日から平成１１年２月２８日までの事業年度に係る道府県民税利子割の還付金であるが、同還付金は法人税法２６条１項１号の規定により益金の額に算入されない。 \n (2) 納付すべき税額 １６３万５４００円 \n （別表２の「平成１３年２月期」欄の順号⑱） \n 上記金額は、下記アの金額１６３万５７００円から下記イの金額２３４円を差し引いた金額（通則法１１９条１項の規定に基づき百円未満の端数金額を切り捨てた後のもの）である。 \n ア 所得金額に対する法人税額 １６３万５７００円上記金額は、前記(1)の所得金額７４３万５９９０円（通則法１１８条１項の規定に基づき千円未満の端数を切り捨てた後のもの）に法人税法（平成１８年法律第１０号による改正前のもの） \n ６６条１項及び２項に規定する税率（経済社会の変化等に対応して早急に講ずべき所得税及び法人税法の負担軽減措置に関する法律（平成１１年法律第８号）１６条１項による置換え後のもの） \n を乗じて計算した金額である。 \n イ 法人税額から控除される所得税額等 ２３４円上記金額は、法人税法（平成１５年法律第８号による改正前のもの）６８条１項に規定する法人税額から控除される所得税額であり、原告の平成１３年２月期に係る法人税の確定申告書に記載されている金額である。 \n ３ 平成１４年２月期 \n (1) 所得金額 ４７４９万７５９５円 \n （別表２の「平成１４年２月期」欄の順号⑰） \n ア 加算額 ４１８６万１５３４円 \n （別表２の「平成１４年２月期」欄の順号⑩） \n (ア) 売上除外 ３８６８万３０００円 \n （別表２の「平成１４年２月期」欄の順号②） \n 上記金額は、次のａ及びｂの額の合計額である。 \n ａ ６８万３０００円上記金額は、原告に帰属する本件３口座に振り込まれた売上金であるが、原告はこれを公表帳簿に記載せず申告から除外していた（争点６参照）。 \n ｂ ３８００万円上記金額は、原告が平成１３年１１月２日にＧへ譲渡した債権に係る売上金であるが、原告はこれを公表帳簿に記載せず申告から除外していた（争点１参照）。 \n (イ) 役員報酬否認 ２２７万円 \n （別表２の「平成１４年２月期」欄の順号④） \n 上記金額は、次のａ及びｂの額の合計額である。 \n ａ １０２万円上記金額は、原告が公表帳簿に戊に対する役員報酬として仮装し、架空に計上していたものである（争点８参照）。 \n ｂ １２５万円上記金額は、原告が公表帳簿にＩに対する役員報酬として仮装し、架空に計上していたものである（争点９参照）。 \n (ウ) 福利厚生費否認５２０円 \n （別表２の「平成１４年２月期」欄の順号⑥） \n 上記金額は、平成１４年２月期における正当な福利厚生否認額１１１万２６１０円と、原告が修正申告書により所得金額に加算した福利厚生費否認額１１１万２０９０円との差額である（争点３参照）。 \n (エ) 本件貸付金に係る認定利息 ９０万７９７６円 \n （別表２の「平成１４年２月期」欄の順号⑦） \n 上記金額は、被告が認定した平成１４年２月期の本件貸付金の額を基に同期における本件貸付金の平均残高を算定の上、年２パーセントの利率を乗じて算定したもの（別表３－１の「平成１４年２月期」欄の順号⑱の金額）である（争点１０参照）。 \n (オ) 本件預金利子 ３７円 \n （別表２の「平成１４年２月期」欄の順号⑧） \n 上記金額は、平成１４年２月期における本件預金利子（別表４の「平成１４年２月期」欄のうち「本件預金利子」欄の順号⑤の金額）であるが、原告はこれを公表帳簿に記載せず申告から除外していた（争点１１参照）。 \n (カ) 本件道府県民税利子割 １円 \n （別表２の「平成１４年２月期」欄の順号⑨） \n 上記金額は、平成１４年２月期における本件道府県民税利子割（別表４の「平成１４年２月期」欄のうち「本件道府県民税利子割」欄の順号⑤の金額）であるが、同金額は、法人税法（平成１８年法律第１０号による改正前のもの）３８条２項３号の規定により損金の額に算入されない（争点１１参照）。 \n イ 減算額 ４３万５６００円 \n （別表２の「平成１４年２月期」欄の順号⑯） \n 未払事業税認容 ４３万５６００円 \n （別表２の「平成１４年２月期」欄の順号⑭） \n 上記金額は、本件各更正処分のうち、平成１３年２月期に係る更正処分に基づく所得金額の増加に伴い納付すべき事業税の額であり、法人税基本通達９－５－２に基づき、平成１４年２月期の所得金額の計算上、損金の額として認容したものである（争点１２参照）。 \n (2) 納付すべき税額 １５０２万９３００円 \n （別表２の「平成１４年２月期」欄の順号⑱） \n 上記金額は、下記ア及びイの金額を合計した金額１５０２万９８００円からから下記ウの金額４ \n ８５円を差し引いた金額（通則法１１９条１項の規定に基づき百円未満の端数金額を切り捨てた後のもの）である。 \n ア 所得金額に対する法人税額 １３６０万９１００円上記金額は、前記(1)の所得金額４７４９万７５９５円（通則法１１８条１項の規定に基づき千円未満の端数を切り捨てた後のもの）に法人税法（平成１８年法律第１０号による改正前のもの）６６条１項及び２項に規定する税率（経済社会の変化等に対応して早急に講ずべき所得税及び法人税法の負担軽減措置に関する法律（平成１１年法律第８号）１６条１項による置換え後のもの）を乗じて計算した金額である。 \n イ 課税留保金額に対する税額 １４２万０７００円上記金額は、前記(1)の所得金額４７４９万７５９５円に係る課税留保金額１４２０万７００ \n ０円（通則法１１８条１項の規定に基づき千円未満の端数を切り捨てた後のもの）に法人税法（平成１８年法律第１０号による改正前のもの）６７条１項に規定する税率を乗じて計算した金額である。 \n ウ 法人税額から控除される所得税額等 ４８５円上記金額は、法人税法（平成１５年法律第８号による改正前のもの）６８条１項に規定する法人税額から控除される所得税額であり、原告の平成１４年２月期に係る法人税の確定申告書に記載されている金額である。 \n ４ 平成１５年２月期 \n (1) 所得金額 ３６３１万１４６２円 \n （別表２の「平成１５年２月期」欄の順号⑰） \n ア 加算額 ８５１４万４３５０円 \n （別表２の「平成１５年２月期」欄の順号⑩） \n (ア) 売上除外 ８０００万円 \n （別表２の「平成１５年２月期」欄の順号②） \n 上記金額は、原告が平成１４年１２月１６日にＧへ譲渡した債権に係る売上金であるが、原告はこれを公表帳簿に記載せず申告から除外していた（争点２参照）。 \n (イ) 役員報酬否認 ３５１万円 \n （別表２の「平成１５年２月期」欄の順号④） \n 上記金額は、次のａ及びｂの額の合計額である。 \n ａ ５１万円上記金額は、原告が公表帳簿に戊に対する役員報酬として仮装し、架空に計上していたものである（争点８参照）。 \n ｂ ３００万円上記金額は、原告が公表帳簿にＩに対する役員報酬として仮装し、架空に計上していたものである（争点９参照）。 \n (ウ) 本件貸付金に係る認定利息 １６３万４３４８円 \n （別表２の「平成１５年２月期」欄の順号⑦） \n 上記金額は、被告が認定した平成１５年２月期の本件貸付金の額を基に同期における本件貸付金の平均残高を算定の上、年２パーセントの利率を乗じて算定したもの（別表３－１の「平成１５年２月期」欄の順号⑱の金額）である（争点１０参照）。 \n (エ) 本件預金利子 ２円 \n （別表２の「平成１５年２月期」欄の順号⑧） \n 上記金額は、平成１５年２月期における本件預金利子（別表４の「平成１５年２月期」欄のうち「本件預金利子」欄の順号⑤の金額）であるが、原告はこれを公表帳簿に記載せず申告から除外していた（争点１１参照）。 \n イ 減算額 ７１９２万５３００円 \n （別表２の「平成１５年２月期」欄の順号⑯） \n 上記金額は、次の(ア)ないし(エ)の金額の合計額である。 \n (ア) 売上減算 ３８００万円 \n （別表２の「平成１５年２月期」欄の順号⑪） \n 上記金額は、原告が平成１５年２月期の修正申告書において所得金額に加算したものであるが、平成１４年２月期の所得金額に加算すべきものであるから、平成１５年２月期の所得金額から減算したものである（争点１参照）。 \n (イ) 仕入認容 ３０００万円 \n （別表２の「平成１５年２月期」欄の順号⑫） \n 上記金額は、原告がＭ株式会社から仕入れた債権の代金であるが、原告はこれを仕入高に計上していなかった。 \n (ウ) 福利厚生費認容 ２００円 \n （別表２の「平成１５年２月期」欄の順号⑬） \n 上記金額は、平成１５年２月期における正当な福利厚生費否認額１２２万００９０円と原告が本件修正申告書により所得金額に加算した福利厚生費否認額１２２万０２９０円との差額である（争点３参照）。 \n (エ) 未払事業税認容 ３９２万５１００円 \n （別表２の「平成１５年２月期」欄の順号⑭） \n 上記金額は、本件各更正処分のうち、平成１４年２月期に係る更正処分に基づく所得金額の増加に伴い納付すべき事業税の額であり、法人税基本通達９－５－２に基づき、平成１５年２月期の所得金額の計算上損金の額として認容すべき金額４２５万５７００円と、原告が平成１ \n ５年２月期の法人税の修正申告書により所得金額から減算した未払事業税３３万０６００円との差額である（争点１２参照）。 \n (2) 納付すべき税額 １１１２万７４００円 \n （別表２の「平成１５年２月期」欄の順号⑱） \n 上記金額は、下記ア及びイの金額を合計した金額１１１２万７５００円からから下記ウの金額６ \n ９円を差し引いた金額（通則法１１９条１項の規定に基づき百円未満の端数金額を切り捨てた後のもの）である。 \n ア 所得金額に対する法人税額 １０２５万３３００円上記金額は、前記(1)の所得金額３６３１万１４６２円（通則法１１８条１項の規定に基づき千円未満の端数を切り捨てた後のもの）に法人税法（平成１８年法律第１０号による改正前のもの）６６条１項及び２項に規定する税率（経済社会の変化等に対応して早急に講ずべき所得税及び法人税法の負担軽減措置に関する法律（平成１１年法律第８号）１６条１項による置換え後のもの）を乗じて計算した金額である。 \n イ 課税留保金額に対する税額 ８７万４２００円上記金額は、前記(1)の所得金額３６３１万１４６２円に係る課税留保金額８７４万２０００円（通則法１１８条１項の規定に基づき千円未満の端数を切り捨てた後のもの）に法人税法（平成１８年法律第１０号による改正前のもの）６７条１項に規定する税率を乗じて計算した金額である。 \n ウ 法人税額から控除される所得税額等 ６９円上記金額は、法人税法（平成１５年法律第８号による改正前のもの）６８条１項に規定する法人税額から控除される所得税額であり、原告の平成１４年２月期に係る法人税の確定申告書に記載されている金額である。 \n 以上 \n （別紙） \n 各加算税の算出方法 \n １ 本件各賦課決定処分１の各加算税の算出方法 \n (1) 平成１４年２月期の重加算税の額４３万４０００円平成１４年２月期に係る修正申告による納付すべき税額１２４万円（別表の平成１４年２月期の \n 「納付すべき税額」欄の順号②の金額から順号①の金額を差し引いた金額につき、通則法１１８条 \n ３項の規定に基づき１万円未満の端数を切り捨てた後のもの）を基礎として、通則法６８条１項の規定に基づき、同金額に１００分の３５の割合を乗じて算出 \n (2) 平成１５年２月期の重加算税の額２１７万円平成１５年２月期に係る修正申告による納付すべき税額６２０万円（別表の平成１５年２月期の \n 「納付すべき税額」欄の順号②の金額から順号①の金額を差し引いた金額につき、通則法１１８条 \n ３項の規定に基づき１万円未満の端数を切り捨てた後のもの）を基礎として、通則法６８条１項の規定に基づき、同金額に１００分の３５の割合を乗じて算出 \n ２ 本件各賦課決定処分２の各加算税の算出方法 \n (1) 平成１２年２月期の重加算税の額１５１万２０００円加算税の計算の基礎となるべき税額４３２万円（別表２の「平成１２年２月期」欄の順号⑲の金額）を基礎として、通則法６８条１項の規定に基づき、同金額に１００分の３５の割合を乗じて算出 \n (2) 平成１３年２月期の重加算税の額５７万０５００円加算税の計算の基礎となるべき税額１６３万円（別表２の「平成１３年２月期」欄の順号⑲の金額）を基礎として、通則法６８条１項の規定に基づき、同金額に１００分の３５の割合を乗じて算出 \n (3) 平成１４年２月期の過少申告加算税１万８０００円原告の平成１４年２月期の更正処分により増加する納付すべき税額１３６９万４２００円（別表 \n ２の「平成１４年２月期」欄の順号⑱の金額から、別表の順号②の同事業年度の「納付すべき税額」 \n 欄の金額を差し引いた金額）のうちの過少申告加算税の対象となる所得金額８２万６９００円（別表５の「過少申告加算税の対象金額」欄の順号⑧の金額）に対応する税額１８万円（別表２の「平成１４年２月期」欄の順号⑲の上段の金額）を基礎として、通則法６５条１項の規定に基づき、同金額に１００分の１０の割合を乗じて算出 \n (4) 平成１４年２月期の重加算税の額４７２万８５００円原告の平成１４年２月期の更正処分により増加する納付すべき税額１３６９万４２００円のうちの重加算税の対象となる増加した所得金額４０５９万９０３４円（別表５の「重加算税の対象金額」欄の順号⑧の金額）に対応する税額１３５１万円（別表２の「平成１４年２月期」欄の順号⑲の下段の金額）を基礎として、通則法６８条１項の規定に基づき、同金額に１００分の３５の割合を乗じて算出 \n (5) 平成１５年２月期の重加算税の額１６８万円原告の平成１５年２月期の更正処分により増加する納付すべき税額４８０万円（別表２の「平成 \n １５年２月期」欄の順号⑱の金額から、別表の順号②の同事業年度の「納付すべき税額」欄の金額を差し引いた金額につき、通則法１１８条３項の規定に基づき１万円未満の端数を切り捨てた後のもの）を基礎として、通則法６８条１項の規定に基づき、同金額に１００分の３５の割合を乗じて算出以上 \n （別紙） \n 別表１の内訳 \n １ 平成１４年２月期 \n (1) 所得金額 ６０７万１６６１円 \n （別表１の「平成１４年２月期」欄の順号⑨） \n ア 加算額 １１６１万２０９０円 \n （別表１の「平成１４年２月期」欄の順号⑤） \n (ア) 売上計上漏れ ５５０万円 \n （別表１の「平成１４年２月期」欄の順号②） \n 上記金額は、原告が、Ｆに対する売上金の計上漏れであるとしたものである（争点４参照）。 \n (イ) 福利厚生費否認 １１１万２０９０円 \n （別表１の「平成１４年２月期」欄の順号③） \n 上記金額は、原告が、国内で行った社員旅行の費用として計上していた福利厚生費のうちの一部を否認したものである（争点３参照）。 \n (ウ) 仕入過大計上 ５００万円 \n （別表１の「平成１４年２月期」欄の順号④） \n 上記金額は、原告が、Ｈからの仕入代金を過大計上であるとしたものである（争点５参照）。 \n イ 減算額 ５９５万０５５１円 \n （別表１の「平成１４年２月期」欄の順号⑧） \n 販売手数料認容 ５９５万０５５１円 \n （別表１の「平成１４年２月期」欄の順号⑥） \n 上記金額は、原告が、債権の仕入れに係る販売手数料の金額を計上したものである。 \n (2) 納付すべき税額 １３３万５１００円 \n （別表１の「平成１４年２月期」欄の順号⑩） \n ２ 平成１５年２月期 \n (1) 所得金額 ２３０９万２４１２円 \n （別表１の「平成１５年２月期」欄の順号⑨） \n ア 加算額 ２６５３万７６２４円 \n （別表１の「平成１５年２月期」欄の順号⑤） \n (ア) 売上計上漏れ ２５３１万７３３４円 \n （別表１の「平成１５年２月期」欄の順号②） \n 上記金額は、次のａ及びｂの金額の合計額である。 \n ａ 売上計上漏れ ３８００万円上記金額は、原告が、Ｇに対する売上金の計上漏れであるとしたものである（争点１参照）。 \n ｂ 売上過大計上 １２６８万２６６６円上記金額は、原告が、有限会社Ｌに対する売上金として過大に計上していたものである。 \n (イ) 福利厚生費否認 １２２万０２９０円 \n （別表１の「平成１５年２月期」欄の順号③） \n 上記金額は、原告が、国内で行った社員旅行の費用として計上していた福利厚生費のうちの一部を否認したものである（争点３参照）。 \n イ 減算額 ３９７万２２５４円 \n （別表１の「平成１５年２月期」欄の順号⑧） \n 上記金額は、次の(ア)及び(イ)の金額の合計額である。 \n (ア) 販売手数料認容 ３６４万１６５４円 \n （別表１の「平成１５年２月期」欄の順号⑥） \n 上記金額は、原告が、債権の仕入れに係る販売手数料の金額を計上したものである。 \n (イ) 未払事業税認容 ３３万０６００円 \n （別表１の「平成１５年２月期」欄の順号⑦） \n (2) 納付すべき税額 ６３１万８５００円 \n （別表１の「平成１５年２月期」欄の順号⑩） \n 以上別表本件各事業年度の法人税に係る各課税処分等の経緯 \n （単位：円） \n 順号 ① ② ③ ④ ⑤ ⑥ ⑦ ⑧事業年度区分 確定申告 修正申告 賦課決定処分 更正処分等 異議申立て 異議決定 審査請求 裁決年 月 日 平成12年4月28日 平成17年7月8日 平成17年8月9日 平成17年11月2日 平成17年11月30日 平成18年11月29日平成12年 所 得 金 額 △290,283 11,977,964 額 確 \n 2月期 ど 定納 付 す べ き 税 額 △102 3,371,900お 申り 告重 加 算 税 の 額 － 1,179,500棄 \n 却額 確ど 定お 申り 告棄 \n 却年 月 日 平成13年4月27日 平成17年7月8日 平成17年8月9日 平成17年11月2日 平成17年11月30日 平成18年11月29日平成13年 所 得 金 額 △552,517 7,228,435 額 確 \n 2月期 ど 定納 付 す べ き 税 額 △234 1,589,900お 申り 告重 加 算 税 の 額 － 556,500棄 \n 却額 確ど 定お 申り 告棄 \n 却年 月 日 平成14年4月30日 平成17年3月25日 平成17年7月8日 平成17年7月8日 平成17年8月9日 平成17年11月2日 平成17年11月30日 平成18年11月29日所 得 金 額 410,122 6,071,661 － 47,419,020 修平成14年 正納 付 す べ き 税 額 89,700 1,335,100 － 15,003,600 \n 2月期 お 申り 告過少申告加算税の額 － － － 18,000額 \n ど重 加 算 税 の 額 － － 434,000 4,718,000棄 \n 却修 \n 正お 申り 告額 \n ど棄 \n 却年 月 日 平成15年4月28日 平成17年3月25日 平成17年7月8日 平成17年7月8日 平成17年8月9日 平成17年11月2日 平成17年11月30日 平成18年11月29日平成15年 所 得 金 額 527,042 23,092,412 － 36,244,720 額 修 \n 2月期 ど 正納 付 す べ き 税 額 115,800 6,318,500 － 11,103,100お 申り 告重 加 算 税 の 額 － － 2,170,000 1,673,000棄 \n 却額 修ど 正お 申り 告棄 \n 却 \n （注） １ 「所得金額」欄の△印の金額は、欠損金額である。 \n ２ 「納付すべき税額」欄の△印の金額は、還付金の額に相当する税額である。 \n 別表１本件各修正申告書の内容 \n （単位：円） \n 区分 平成14年2月期 平成15年2月期申 告 所 得 金 額 ① 410,122 527,042売 上 計 上 漏 れ ② 5,500,000 25,317,334加 福 利 厚 生 費 否 認 ③ 1,112,090 1,220,290算 \n 額仕 入 過 大 計 上 ④ 5,000,000 －加算額の合計額（②＋③＋④） ⑤ 11,612,090 26,537,624販 売 手 数 料 認 容 ⑥ 5,950,551 3,641,654減 \n 算 未 払 事 業 税 認 容 ⑦ － 330,600額 \n 減算額の合計額（⑥＋⑦） ⑧ 5,950,551 3,972,254所 得 金 額 （ ① ＋ ⑤ － ⑧ ） ⑨ 6,071,661 23,092,412納 付 す べ き 税 額 ⑩ 1,335,100 6,318,500 \n 別表２被告が主張する本件各事業年度の所得金額等の計算表 \n （単位：円） \n 区分 平成12年2月期 平成13年2月期 平成14年2月期 平成15年2月期申 告 所 得 金 額 ① △290,283 △552,517 6,071,661 23,092,412売 上 除 外 ② 11,414,214 6,079,745 38,683,000 80,000,000架 空 仕 入 ③ 4,200,000 2,000,000 － －役 員 報 酬 否 認 ④ － 340,000 2,270,000 3,510,000給 料 手 当 否 認 ⑤ － 85,000 － －加 \n 福 利 厚 生 費 否 認 ⑥ － － 520 －算 \n 額本 件 貸 付 金 に 係 る \n ⑦ 219,525 551,735 907,976 1,634,348認 定 利 息本 件 預 金 利 子 ⑧ 171 96 37 2本件道府県民税利子割 ⑨ 9 4 1 －加 算 額 の 合 計 額 \n ⑩ 15,833,919 9,056,580 41,861,534 85,144,350 \n （②ないし⑨の合計） \n 売 上 減 算 ⑪ － － － 38,000,000仕 入 認 容 ⑫ 797,048 70,648 － 30,000,000減 福 利 厚 生 費 認 容 ⑬ － － － 200算 \n 額 未 払 事 業 税 認 容 ⑭ － 997,400 435,600 3,925,100還付道府県民税利子割 ⑮ － 25 － －減 算 額 の 合 計 額 \n ⑯ 797,048 1,068,073 435,600 71,925,300 \n （⑪ないし⑮の合計） \n 所得金額（①＋⑩－⑯） ⑰ 14,746,588 7,435,990 47,497,595 36,311,462納 付 す べ き 税 額 ⑱ 4,327,200 1,635,400 15,029,300 11,127,400加 算 税 の 計 算 の 基 礎 180,000 \n ⑲ 4,320,000 1,630,000 4,800,000と な る べ き 税 額 13,510,000過 少 申 告 加 算 税 の 額 ⑳ － － 18,000 －重 加 算 税 の 額 あ 1,512,000 570,500 4,728,500 1,680,000 \n （注） １ 「申告所得金額」欄の△印の金額は、欠損金額である。 \n ２ 「申告所得金額」欄の平成１４年２月期及び平成１５年２月期の各金額は、それぞれ、別表１の「平成１４年２月期」欄及び「平成１５年２月期」欄の順号⑨に記載されている金額である。 \n ３ 「加算税の計算の基礎となるべき税額」欄の平成１４年２月期の上段の額は過少申告加算税の計算の基礎となるべき金額であり、下段は重加算税の計算の基礎となるべき金額である。 \n なお、同欄の各金額は、１万円未満の端数を切り捨てた後の金額である。 \n 別表３－１被告が主張する本件貸付金に係る認定利息の計算表 \n （単位：円） \n 区分 平成12年2月期 平成13年2月期 平成14年2月期 平成15年2月期本件各修正申告書に基づく \n ① － － 11,612,090 26,537,624役 員 貸 付 金 の 額被告が主張する所得金額に \n ② 15,614,394 8,504,845 40,953,558 15,509,802基 づ く 役 員 貸 付 金 の 額期 中 に 減 少 し た \n ③ 331,629 － 18,308 169,103本件３口座等の預金残高加 \n 算 売 上 減 算 ④ － － － 12,682,666額 \n 加 算 額 の 合 計 額 \n ⑤ 331,629 － 18,308 12,851,769 \n （③＋④） \n 期 中 に 増 加 し た \n ⑥ － 37,655 － －本件３口座等の預金残高本件代表者からの借入金 ⑦ 1,310,987 954,873 110,000 25,000,000減 販 売 手 数 料 認 容 ⑧ － － 5,950,551 3,641,654算 \n 額 未 収 還 付 \n ⑨ 9 4 1 －道 府 県 民 税 利 子 割未収還付源泉所得税 ⑩ － － 20,480 123,200減 算 額 の 合 計 額 \n ⑪ 1,310,996 992,532 6,081,032 28,764,854 \n （⑥＋⑦＋⑧＋⑨＋⑩） \n 本 件 貸 付 金 の 額 \n ⑫ 14,635,027 7,512,313 46,502,924 26,134,341 \n （①＋②＋⑤－⑪） \n と認期 首 残 高 ⑬ 0 14,635,027 22,147,340 68,650,264な定る利期 中 増 加 額本息 ⑭ 14,635,027 7,512,313 46,502,924 26,134,341件の （⑫欄の額） \n 貸算 期 末 残 高付定 ⑮ 14,635,027 22,147,340 68,650,264 94,784,605 \n （⑬＋⑭） \n 金のの基 平 均 残 高 \n ⑯ 7,317,513 18,391,183 45,398,802 81,717,434額礎 〔（⑬＋⑮）×1/2〕適 用 利 率 ⑰ 3% 3% 2% 2%認 定 利 息 の 額 \n ⑱ 219,525 551,735 907,976 1,634,348 \n （⑯×⑰） \n （注）１ 「本件各修正申告書に基づく役員貸付金の額」欄の平成１４年２月期及び平成１５年２月期の各金額は、それぞれ、別表１の平成１４年２月期及び平成１５年２月期の順号⑤に記載されている金額である。 \n ２ 「被告が主張する所得金額に基づく役員貸付金の額」欄の平成１４年２月期及び平成１５年 \n ２月期の各金額は、それぞれ、別表３－２の平成１２年２月期ないし平成１５年２月期の順号 \n ⑬に記載されている金額である。 \n ３ 「期中に減少した本件３口座等の残高」欄及び「期中に増加した本件３口座等の残高」欄に係る本件３口座等とは、本件３口座及び本件戊口座である。 \n ４ 「平均残高」欄及び「認定利息の額」欄の金額は、１円未満の端数を切捨てた後の金額である。 \n 別表３－２被告が主張する所得金額に基づく役員貸付金の額 \n （単位：円） \n 区分 平成12年2月期 平成13年2月期 平成14年2月期 平成15年2月期売 上 除 外 ① 11,414,214 6,079,745 38,683,000 80,000,000架 空 仕 入 ② 4,200,000 2,000,000 － －役 員 報 酬 否 認 ③ － 340,000 2,270,000 3,510,000加 給 料 手 当 否 認 ④ － 85,000 － －算 \n 額福 利 厚 生 費 否 認 ⑤ － － 520 －本 件 預 金 利 子 ⑥ 171 96 37 2本件道府県民税利子割 ⑦ 9 4 1 －加 算 額 の 合 計 額 \n ⑧ 15,614,394 8,504,845 40,953,558 83,510,002 \n （①ないし⑦の合計） \n 売 上 減 算 ⑨ － － － 38,000,000減 仕 入 認 容 ⑩ － － － 30,000,000算 \n 額 福 利 厚 生 費 認 容 ⑪ － － － 200減 算 額 の 合 計 額 \n ⑫ 0 0 0 68,000,200 \n （⑨ないし⑪の合計） \n 差 引 金 額 \n ⑬ 15,614,394 8,504,845 40,953,558 15,509,802 \n （⑧－⑫） \n 別表４被告が主張する本件預金利子及び本件道府県民税利子割の内訳 \n （単位：円） \n 平成12年2月期 平成13年2月期 平成14年2月期 平成15年2月期区分本件道府県 本件道府県 本件道府県 本件道府県本件預金利子 本件預金利子 本件預金利子 本件預金利子民税利子割 民税利子割 民税利子割 民税利子割本 件 乙 口 座 ① 125 7 6 － － － － －本 件 丙 口 座 ② 45 2 26 1 1 － － －本 件 丁 口 座 ③ 1 － 23 1 7 － － －本 件 戊 口 座 ④ － － 41 2 29 1 2 －合 計 額 \n ⑤ 171 9 96 4 37 1 2 － \n （①ないし④の合計） \n 別表５被告が主張する平成１４年２月期の更正処分に係る重加算税及び過少申告加算税の対象金額の内訳 \n （単位：円） \n 加算・減算金額区分重加算税 過少申告加算税の対象金額 の対象金額売 上 除 外 ① 38,683,000 38,683,000 0役 員 報 酬 否 認 ② 2,270,000 1,020,000 1,250,000福 利 厚 生 費 否 認 ③ 520 520 0本件貸付金に係る認定利息 ④ 907,976 895,476 12,500本 件 預 金 利 子 ⑤ 37 37 0本件道府県民税利子割 ⑥ 1 1 0未 払 事 業 税 認 容 ⑦ △435,600 0 △435,600合 計 額 \n ⑧ 41,425,934 40,599,034 826,900 \n （①ないし⑦の合計） \n 別表６ \n 【平成１２年２月期（乙第１号証の１〔１１枚目〕）】金融機関名 口座番号 名義 \n Ｂ銀行本店 \n Ｃ銀行本店 丁 \n ｄ銀行梅田北支店 Ｗ \n 【平成１３年２月期（乙第１号証の２〔１３枚目〕）】金融機関名 口座番号 名義 \n Ｂ銀行本店 \n Ｃ銀行大阪本店 Ｗ \n Ｃ銀行大阪本店 丁 \n ｅ信用組合澄川支店 \n Ｂ銀行澄川支店 Ｘ \n Ｃ銀行蒲田支店 \n （引用者注：上表の名義欄に「Ｘ」とあるのは「Ｘ」が正しいと考えられる。） \n 【平成１４年２月期（乙第１号証の３〔１３枚目〕）】金融機関名 口座番号 名義 \n Ｂ銀行本店 \n Ｂ銀行澄川支店 Ｘ \n Ｃ銀行蒲田支店 \n Ｃ銀行大阪本店 Ｗ \n Ｃ銀行大阪本店 丁 \n Ｃ銀行本店営業部 ｆ \n Ｃ銀行本店営業部 \n ｅ信用組合澄川支店別表７－１本件３口座振込入金者本件乙口座振込入金書 本件丙口座入金者 本件丁口座入金者 \n No. 入金者名 入金者名 入金者名 入金者名 入金者名 入金者名 入金者名 \n 1 101 1 101 201 301 1 \n 2 102 2 102 202 302 2 \n 3 103 3 103 203 303 3 \n 4 104 4 104 204 304 4 \n 5 105 5 105 205 305 5 \n 6 106 6 106 206 306 6 \n 7 107 7 107 207 307 7 \n 8 108 8 108 208 308 8 \n 9 109 9 109 209 309 9 \n 10 110 10 110 210 310 10 \n 11 111 11 111 211 311 11 \n 12 112 12 112 212 312 12 \n 13 113 13 113 213 313 13 \n 14 114 14 114 214 314 14 \n 15 115 15 115 215 315 15 \n 16 116 16 116 216 316 16 \n 17 117 17 117 217 317 17 \n 18 118 18 118 218 318 18 \n 19 119 19 119 219 319 19 \n 20 120 20 120 220 320 20 \n 21 121 21 121 221 321 21 \n 22 122 22 122 222 322 22 \n 23 123 23 123 223 323 23 \n 24 124 24 124 224 324 24 \n 25 125 25 125 225 325 25 \n 26 126 26 126 226 326 26 \n 27 127 27 127 227 327 27 \n 28 128 28 128 228 328 28 \n 29 129 29 129 229 329 29 \n 30 130 30 130 230 330 30 \n 31 31 131 231 331 31 \n 32 32 132 232 332 32 \n 33 33 133 233 333 33 \n 34 34 134 234 334 34 \n 35 35 135 235 335 35 \n 36 36 136 236 336 36 \n 37 37 137 237 337 37 \n 38 38 138 238 338 38 \n 39 39 139 239 339 39 \n 40 40 140 240 340 40 \n 41 41 141 241 341 41 \n 42 42 142 242 342 42 \n 43 43 143 243 343 43 \n 44 44 144 244 344 44 \n 45 45 145 245 345 45 \n 46 46 146 246 346 46 \n 47 47 147 247 347 47 \n 48 48 148 248 348 48 \n 49 49 149 249 349 49 \n 50 50 150 250 350 50 \n 51 51 151 251 351 51 \n 52 52 152 252 352 52 \n 53 53 153 253 53 \n 54 54 154 254 54 \n 55 55 155 255 55 \n 56 56 156 256 56 \n 57 57 157 257 57 \n 58 58 158 258 58 \n 59 59 159 259 59 \n 60 60 160 260 60 \n 61 61 161 261 \n 62 62 162 262 \n 63 63 163 263 \n 64 64 164 264 \n 65 65 165 265 \n 66 66 166 266 \n 67 67 167 267 \n 68 68 168 268 \n 69 69 169 269 \n 70 70 170 270 \n 71 71 171 271 \n 72 72 172 272 \n 73 73 173 273 \n 74 74 174 274 \n 75 75 175 275 \n 76 76 176 276 \n 77 77 177 277 \n 78 78 178 278 \n 79 79 179 279 \n 80 80 180 280 \n 81 81 181 281 \n 82 82 182 282 \n 83 83 183 283 \n 84 84 184 284 \n 85 85 185 285 \n 86 86 186 286 \n 87 87 187 287 \n 88 88 188 288 \n 89 89 189 289 \n 90 90 190 290 \n 91 91 191 291 \n 92 92 192 292 \n 93 93 193 293 \n 94 94 194 294 \n 95 95 195 295 \n 96 96 196 296 \n 97 97 197 297 \n 98 98 198 298 \n 99 99 199 299 \n 100 100 200 300入金件数130件 入金件数352件 入金件数60件 \n （注） 「本件乙口振込入金者」欄のNo.１２「氏名不明」の入金者は、本件乙口座には住所の記載がある（乙第３５号証の２）。 \n 別表７－２本件３口座振込入金者（五十音名寄せ順） \n 本件乙口座振込入金書 本件丙口座入金者 本件丁口座入金者 \n No. 入金者名 入金者名 入金者名 入金者名 入金者名 入金者名 入金者名 \n 9 55 39 87 51 336 4 \n 38 81 43 2 101 341 12 \n 64 46 24 4 130 351 5 \n 82 11 44 33 169 177 21 \n 92 14 138 13 173 205 23 \n 96 71 53 143 198 246 26 \n 105 67 108 16 218 269 32 \n 109 73 134 15 244 327 35 \n 65 24 179 65 261 14 39 \n 86 8 123 17 278 19 42 \n 28 3 136 153 292 29 46 \n 68 41 146 168 305 40 49 \n 27 54 163 22 313 45 53 \n 30 42 193 36 324 66 16 \n 91 43 220 55 332 92 2 \n 98 57 243 56 337 128 17 \n 110 78 262 109 343 11 1 \n 13 87 277 131 27 30 10 \n 39 94 280 178 63 206 19 \n 47 100 288 195 75 234 24 \n 1 104 303 224 79 253 31 \n 16 108 320 67 89 270 36 \n 20 111 326 78 18 105 45 \n 33 113 333 90 21 117 50 \n 19 114 334 126 32 166 54 \n 61 118 347 175 82 201 56 \n 124 123 348 203 93 99 59 \n 128 126 113 223 139 42 60 \n 119 129 145 49 158 9 7 \n 80 12 3 231 183 69 8 \n 90 6 250 210 106 20 \n 101 119 284 232 142 18 \n 2 162 340 251 184 22 \n 23 191 135 141 207 25 \n 5 216 181 12 233 28 \n 25 237 204 50 252 30 \n 77 256 227 80 268 34 \n 35 272 246 102 283 37 \n 72 285 266 151 297 41 \n 115 299 281 186 118 44 \n 120 308 295 213 140 48 \n 125 321 306 230 149 51 \n 130 115 315 259 155 14 \n 6 148 325 273 23 9 \n 7 171 331 286 28 13 \n 60 212 339 298 112 11 \n 63 249 344 309 161 15 \n 76 267 152 318 194 27 \n 89 287 187 328 221 29 \n 48 319 188 57 240 33 \n 85 38 214 83 37 38 \n 29 46 236 121 127 40 \n 52 71 20 296 43 \n 62 95 25 317 47 \n 97 1 34 338 52 \n 121 5 52 345 55 \n 56 26 97 349 57 \n 53 35 124 352 58 \n 69 48 132 116 3 \n 99 58 176 165 6 \n 103 72 103 196 \n 106 94 144 222 \n 112 120 180 242 \n 34 159 209 260 \n 36 190 235 276 \n 75 217 10 290 \n 116 239 31 302 \n 122 254 41 311 \n 127 271 47 322 \n 10 293 64 329 \n 44 304 91 335 \n 70 310 125 342 \n 31 314 182 346 \n 50 62 208 350 \n 59 85 98 84 \n 83 96 157 133 \n 95 107 88 154 \n 102 122 137 174 \n 107 147 172 211 \n 117 170 202 228 \n 21 185 225 264 \n 18 200 245 279 \n 40 229 265 74 \n 51 247 282 54 \n 66 255 294 111 \n 84 263 307 114 \n 15 60 129 104 \n 45 81 61 110 \n 74 100 88 160 \n 88 150 167 164 \n 93 189 197 192 \n 4 215 226 219 \n 37 73 241 238 \n 49 156 257 258 \n 53 199 275 274 \n 79 7 291 289 \n 17 68 301 300 \n 26 59 312 316 \n 32 70 77 323 \n 22 76 8 330入金者件数130件中114件合致 入金者件数352件中301件合致 入金者件数60件中55件合致 \n （注） １ 色表示している入金者は、本件顧客名簿に登載されている者である。 \n ２ 「本件乙口座振込入金者」欄のNo.１２「氏名不明」の入金者は、本件乙口座には住所の記載がある（乙第３５号証の２）。 \n 別表８－１本件３口座の振込入金（売上金）額集計表 \n （単位：円） \n 口座名 平成12年2月期 平成13年2月期 平成14年2月期本 件 乙 口 座 2,866,921 102,676 0本 件 丙 口 座 8,286,400 3,968,288 203,000本 件 丁 口 座 260,893 2,008,781 480,000合計 11,414,214 6,079,745 683,000別表８－２本件乙口座の振込入金（売上金）額集計表 \n （単位：円） \n 平成12年2月期 平成13年2月期 平成14年2月期 \n No. 年月日 入金額 年月日 入金額 年月日 入金額 年月日 入金額 \n 1 11.03.01 18,000 101 11.09.28 20,000 1 12.03.16 5,000 \n 2 11.03.01 10,000 102 11.10.08 5,275 2 12.03.27 5,000 \n 3 11.03.01 60,000 103 11.10.15 12,333 3 12.03.28 10,550 \n 4 11.03.01 14,000 104 11.10.25 5,000 4 12.03.28 5,000 \n 5 11.03.01 63,000 105 11.11.02 3,000 5 12.04.07 3,000 \n 6 11.03.01 78,876 106 11.11.15 12,333 6 12.04.17 5,000 \n 7 11.03.01 63,000 107 11.11.18 10,550 7 12.04.21 17,869 \n 8 11.03.02 63,000 108 11.11.29 5,000 8 12.04.25 5,000 \n 9 11.03.02 2,000 109 11.12.01 12,000 9 12.04.28 5,000 \n 10 11.03.02 63,000 110 11.12.06 6,000 10 12.05.10 10,000 \n 11 11.03.02 63,000 111 11.12.28 5,000 11 12.05.19 5,000 \n 12 11.03.03 63,000 112 12.01.14 12,333 12 12.05.29 5,000 \n 13 11.03.03 30,000 113 12.01.25 5,000 13 12.06.06 5,000 \n 14 11.03.04 78,876 114 12.02.28 5,000 14 12.06.06 10,000 \n 15 11.03.04 63,000 15 12.07.04 1,257 \n 16 11.03.04 63,000 16 12.07.17 5,000 \n 17 11.03.04 63,000 \n 18 11.03.05 13,735 \n 19 11.03.08 63,000 \n 20 11.03.08 30,000 \n 21 11.03.09 5,275 \n 22 11.03.09 63,000 \n 23 11.03.10 63,000 \n 24 11.03.11 13,735 \n 25 11.03.11 63,000 \n 26 11.03.16 31,500 \n 27 11.03.16 63,000 \n 28 11.03.17 63,000 \n 29 11.03.19 10,000 \n 30 11.03.25 78,876 \n 31 11.03.25 5,275 \n 32 11.03.25 31,500 \n 33 11.03.29 33,000 \n 34 11.03.30 10,000 \n 35 11.03.31 63,000 \n 36 11.03.31 78,876 \n 37 11.04.01 14,000 \n 38 11.04.01 5,000 \n 39 11.04.02 3,000 \n 40 11.04.05 13,735 \n 41 11.04.06 14,000 \n 42 11.04.15 63,000 \n 43 11.04.20 78,876 \n 44 11.04.20 63,000 \n 45 11.04.22 13,734 \n 46 11.04.26 58,876 \n 47 11.04.27 30,000 \n 48 11.04.27 10,000 \n 49 11.04.27 14,000 \n 50 11.04.28 5,275 \n 51 11.04.30 13,735 \n 52 11.05.06 10,000 \n 53 11.05.14 12,333 \n 54 11.05.17 15,000 \n 55 11.05.20 10,000 \n 56 11.05.24 13,734 \n 57 11.05.26 10,000 \n 58 11.05.26 14,000 \n 59 11.05.31 5,275 \n 60 11.06.01 78,876 \n 61 11.06.01 10,000 \n 62 11.06.01 20,000 \n 63 11.06.01 23,000 \n 64 11.06.02 3,000 \n 65 11.06.03 5,000 \n 66 11.06.04 13,735 \n 67 11.06.09 3,000 \n 68 11.06.11 5,000 \n 69 11.06.15 12,333 \n 70 11.06.15 63,000 \n 71 11.06.18 42,000 \n 72 11.06.21 33,000 \n 73 11.06.22 10,000 \n 74 11.06.22 13,734 \n 75 11.06.24 5,961 \n 76 11.06.25 20,000 \n 77 11.06.25 14,000 \n 78 11.06.28 10,000 \n 79 11.06.28 14,000 \n 80 11.06.28 20,000 \n 81 11.07.01 10,000 \n 82 11.07.01 3,000 \n 83 11.07.02 5,275 \n 84 11.07.05 13,735 \n 85 11.07.07 32,000 \n 86 11.07.19 5,000 \n 87 11.07.26 5,000 \n 88 11.07.26 13,734 \n 89 11.07.27 20,000 \n 90 11.07.28 20,000 \n 91 11.08.03 3,000 \n 92 11.08.04 3,000 \n 93 11.08.24 13,734 \n 94 11.08.26 5,000 \n 95 11.08.26 10,550 \n 96 11.09.01 3,000 \n 97 11.09.09 10,000 \n 98 11.09.14 3,000 \n 99 11.09.16 12,333 \n 100 11.09.27 5,000合計(114件) 2,866,921 合計(16件) 102,676 合計(-件) 0別表８－３本件丙口座の振込入金（売上金）額集計表 \n （単位：円） \n 平成12年2月期 平成13年2月期 平成14年2月期 \n No. 年月日 入金額 年月日 入金額 年月日 入金額 年月日 入金額 年月日 入金額 \n 1 11.06.23 150,000 101 12.01.13 13,000 1 12.03.01 15,000 101 12.07.25 15,000 1 13.03.02 30,000 \n 2 11.06.30 35,520 102 12.01.13 20,000 2 12.03.01 20,000 102 12.07.25 10,000 2 13.03.06 5,000 \n 3 11.07.01 10,000 103 12.01.13 5,072 3 12.03.01 30,000 103 12.07.26 20,000 3 13.03.26 20,000 \n 4 11.07.05 30,000 104 12.01.13 10,000 4 12.03.01 10,000 104 12.07.31 30,000 4 13.03.27 5,000 \n 5 11.07.22 100,000 105 12.01.14 10,000 5 12.03.02 15,000 105 12.07.31 10,000 5 13.03.30 95,000 \n 6 11.07.22 37,040 106 12.01.14 10,000 6 12.03.02 15,000 106 12.07.31 10,000 6 13.04.01 5,000 \n 7 11.07.28 31,500 107 12.01.17 30,000 7 12.03.02 30,000 107 12.08.01 20,000 7 13.04.26 20,000 \n 8 11.07.28 40,000 108 12.01.17 3,000 8 12.03.02 30,000 108 12.08.01 30,000 8 13.05.28 15,000 \n 9 11.08.02 15,876 109 12.01.20 15,000 9 12.03.02 10,000 109 12.08.03 50,000 9 13.08.30 8,000 \n 10 11.08.03 10,000 110 12.01.21 15,000 10 12.03.06 30,000 110 12.08.07 5,000 \n 11 11.08.03 33,000 111 12.01.24 10,000 11 12.03.10 5,000 111 12.08.07 10,000 \n 12 11.08.03 63,000 112 12.01.25 30,000 12 12.03.15 30,000 112 12.08.22 20,000 \n 13 11.08.03 63,000 113 12.01.25 100,000 13 12.03.15 20,000 113 12.08.22 20,000 \n 14 11.08.04 63,000 114 12.01.26 290,000 14 12.03.15 18,789 114 12.08.22 10,000 \n 15 11.08.04 43,000 115 12.01.26 3,850 15 12.03.15 10,000 115 12.08.24 50,000 \n 16 11.08.09 63,000 116 12.01.26 20,000 16 12.03.16 11,000 116 12.08.25 15,000 \n 17 11.08.10 200,000 117 12.01.27 30,000 17 12.03.21 100,000 117 12.08.25 20,000 \n 18 11.08.11 10,000 118 12.01.27 56,000 18 12.03.21 20,000 118 12.08.28 10,000 \n 19 11.08.12 20,000 119 12.01.28 20,000 19 12.03.22 15,000 119 12.08.28 10,000 \n 20 11.08.12 10,000 120 12.01.28 25,000 20 12.03.24 50,000 120 12.08.28 80,000 \n 21 11.08.16 30,000 121 12.01.31 400,000 21 12.03.24 30,000 121 12.08.31 50,000 \n 22 11.08.16 15,000 122 12.01.31 30,000 22 12.03.27 15,000 122 12.09.04 30,000 \n 23 11.08.20 40,000 123 12.01.31 30,000 23 12.03.27 20,000 123 12.09.04 5,000 \n 24 11.08.23 13,000 124 12.01.31 250,000 24 12.03.27 10,000 124 12.09.07 5,000 \n 25 11.08.25 15,000 125 12.01.31 10,000 25 12.03.27 10,000 125 12.09.21 20,000 \n 26 11.08.27 100,000 126 12.01.31 20,000 26 12.03.29 1,000 126 12.09.21 20,000 \n 27 11.08.27 63,000 127 12.01.31 131,429 27 12.03.29 20,000 127 12.09.21 15,000 \n 28 11.08.31 38,876 128 12.02.01 9,816 28 12.03.29 25,378 128 12.09.25 10,000 \n 29 11.09.01 9,812 129 12.02.01 100,000 29 12.03.31 50,000 129 12.09.26 20,000 \n 30 11.09.01 10,000 130 12.02.01 10,000 30 12.03.31 20,000 130 12.09.29 50,000 \n 31 11.09.02 10,000 131 12.02.01 15,000 31 12.04.03 30,000 131 12.09.29 80,000 \n 32 11.09.06 38,876 132 12.02.01 50,000 32 12.04.03 10,000 132 12.10.02 10,000 \n 33 11.09.06 67,000 133 12.02.01 5,000 33 12.04.03 10,000 133 12.10.03 30,000 \n 34 11.09.10 10,000 134 12.02.02 15,000 34 12.04.03 5,000 134 12.10.03 50,000 \n 35 11.09.22 100,000 135 12.02.02 30,000 35 12.04.05 10,000 135 12.10.23 20,000 \n 36 11.09.27 15,000 136 12.02.03 20,000 36 12.04.05 30,000 136 12.10.25 20,000 \n 37 11.09.27 31,500 137 12.02.03 50,000 37 12.04.06 30,000 137 12.10.25 50,000 \n 38 11.09.30 10,000 138 12.02.04 10,000 38 12.04.07 15,000 138 12.10.25 20,000 \n 39 11.10.04 3,000 139 12.02.07 30,000 39 12.04.11 10,000 139 12.10.26 10,000 \n 40 11.10.04 9,830 140 12.02.07 150,000 40 12.04.12 20,000 140 12.10.30 10,000 \n 41 11.10.04 10,000 141 12.02.08 280,000 41 12.04.12 28,789 141 12.10.30 30,000 \n 42 11.10.19 20,000 142 12.02.08 5,000 42 12.04.12 11,000 142 12.10.31 30,000 \n 43 11.10.27 10,000 143 12.02.08 30,000 43 12.04.20 20,000 143 12.10.31 15,000 \n 44 11.10.29 11,000 144 12.02.09 30,000 44 12.04.21 100,000 144 12.11.07 10,000 \n 45 11.11.01 9,821 145 12.02.09 510,000 45 12.04.24 10,000 145 12.11.17 20,000 \n 46 11.11.02 10,000 146 12.02.14 50,000 46 12.04.24 15,000 146 12.11.20 20,000 \n 47 11.11.08 10,000 147 12.02.14 30,000 47 12.04.25 50,000 147 12.11.20 50,000 \n 48 11.11.08 100,000 148 12.02.14 10,000 48 12.04.25 30,000 148 12.11.21 20,000 \n 49 11.11.08 2,000 149 12.02.14 100,000 49 12.04.26 20,000 149 12.11.27 20,000 \n 50 11.11.12 20,000 150 12.02.15 11,000 50 12.04.26 20,000 150 12.11.27 15,000 \n 51 11.11.12 10,000 151 12.02.15 20,000 51 12.04.07 15,000 151 12.11.30 10,000 \n 52 11.11.15 13,000 152 12.02.15 5,000 52 12.04.27 50,000 152 12.12.04 30,000 \n 53 11.11.15 50,000 153 12.02.16 50,000 53 12.04.28 10,000 153 12.12.04 50,000 \n 54 11.11.18 150,000 154 12.02.16 10,000 54 12.05.01 30,000 154 12.12.07 9,793 \n 55 11.11.22 15,000 155 12.02.17 50,000 55 12.05.01 15,000 155 12.12.25 17,000 \n 56 11.11.25 15,000 156 12.02.18 1,000 56 12.05.01 20,000 156 12.12.26 20,000 \n 57 11.11.29 30,000 157 12.02.21 110,000 57 12.05.02 20,000 157 12.12.26 15,000 \n 58 11.11.29 70,000 158 12.02.21 30,000 58 12.05.08 5,000 158 12.12.29 30,000 \n 59 11.11.30 50,000 159 12.02.22 75,000 59 12.05.08 20,000 159 13.01.04 10,000 \n 60 11.11.30 11,000 160 12.02.24 10,000 60 12.05.09 5,000 160 13.01.16 10,000 \n 61 11.11.30 31,500 161 12.02.24 30,000 61 12.05.11 10,000 161 13.01.25 40,000 \n 62 11.11.30 30,000 162 12.02.24 20,000 62 12.05.11 20,637 162 13.01.25 20,000 \n 63 11.11.30 10,000 163 12.02.25 50,000 63 12.05.11 28,789 163 13.01.29 15,000 \n 64 11.12.01 10,000 164 12.02.25 5,000 64 12.05.22 20,000 164 13.01.31 10,000 \n 65 11.12.01 50,000 165 12.02.25 20,000 65 12.05.23 15,000 165 13.02.01 10,000 \n 66 11.12.01 9,821 166 12.02.28 30,000 66 12.05.24 100,000 166 13.02.02 30,000 \n 67 11.12.01 10,000 167 12.02.28 10,000 67 12.05.24 20,113 167 13.02.20 3,000 \n 68 11.12.01 63,000 168 12.02.28 20,000 68 12.05.26 10,000 168 13.02.23 15,000 \n 69 11.11.30 111,740 169 12.02.29 5,000 69 12.05.26 20,000 169 13.02.26 20,000 \n 70 11.12.02 2,500 170 12.02.29 30,000 70 12.05.29 50,000 170 13.02.28 10,000 \n 71 11.12.02 10,000 171 12.02.29 10,000 71 12.05.29 10,000 \n 72 11.12.02 30,000 172 12.02.29 50,000 72 12.05.30 50,000 \n 73 11.12.06 30,000 173 12.02.29 5,000 73 12.05.31 30,000 \n 74 11.12.07 60,000 74 12.05.31 30,000 \n 75 11.12.08 300,000 75 12.06.02 15,000 \n 76 11.12.09 150,000 76 12.06.05 10,000 \n 77 11.12.10 30,000 77 12.06.07 5,000 \n 78 11.12.10 10,000 78 12.06.08 20,000 \n 79 11.12.13 100,000 79 12.06.09 5,000 \n 80 11.12.15 21,000 80 12.06.13 10,000 \n 81 11.12.15 11,000 81 12.06.15 80,000 \n 82 11.12.15 20,000 82 12.06.16 50,000 \n 83 11.12.16 100,000 83 12.06.20 20,000 \n 84 11.12.20 15,000 84 12.06.23 10,000 \n 85 11.12.21 30,000 85 12.06.23 15,000 \n 86 11.12.27 31,500 86 12.06.26 20,000 \n 87 11.12.27 179,700 87 12.06.26 20,000 \n 88 11.12.27 50,000 88 12.06.26 10,000 \n 89 11.12.29 100,000 89 12.06.28 50,000 \n 90 11.12.29 20,000 90 12.06.29 50,000 \n 91 11.12.30 10,000 91 12.07.03 10,000 \n 92 11.12.30 9,821 92 12.07.03 50,000 \n 93 11.12.30 30,000 93 12.07.03 30,000 \n 94 11.12.30 100,000 94 12.07.04 10,000 \n 95 12.01.04 40,000 95 12.07.06 5,000 \n 96 12.01.07 30,000 96 12.07.07 5,000 \n 97 12.01.12 30,000 97 12.07.17 8,000 \n 98 12.01.12 20,000 98 12.07.21 80,000 \n 99 12.01.12 320,000 99 12.07.24 20,000 \n 100 12.01.12 11,000 100 12.07.25 20,000合計(173件) 8,286,400 合計(170件) 3,968,288 合計(9件) 203,000別表８－４本件丁口座の振込入金（売上金）額集計表 \n （単位：円） \n 平成12年2月期 平成13年2月期 平成14年2月期 \n No. 年月日 入金額 年月日 入金額 年月日 入金額 \n 1 11.04.05 35,785 1 12.07.03 20,000 1 13.03.08 30,000 \n 2 11.04.06 31,343 2 12.07.03 30,000 2 13.03.09 5,000 \n 3 11.04.06 5,000 3 12.07.10 14,380 3 13.03.14 20,000 \n 4 11.04.20 150,000 4 12.08.17 1,401 4 13.03.23 25,000 \n 5 11.04.22 12,765 5 12.08.21 10,000 5 13.04.09 30,000 \n 6 11.04.28 26,000 6 12.08.21 100,000 6 13.04.16 10,000 \n 7 12.08.22 500,000 7 13.04.23 15,000 \n 8 12.08.24 50,000 8 13.05.08 30,000 \n 9 12.08.28 20,000 9 13.05.14 30,000 \n 10 12.08.28 100,000 10 13.05.17 10,000 \n 11 12.09.05 500,000 11 13.06.01 15,000 \n 12 12.09.06 200,000 12 13.06.08 30,000 \n 13 12.09.13 50,000 13 13.06.20 20,000 \n 14 12.09.14 3,000 14 13.06.20 20,000 \n 15 12.09.18 10,000 15 13.07.04 30,000 \n 16 12.10.03 30,000 16 13.07.05 15,000 \n 17 12.10.13 65,000 17 13.07.19 10,000 \n 18 12.10.20 50,000 18 13.07.26 30,000 \n 19 12.11.08 30,000 19 13.08.06 15,000 \n 20 12.11.13 25,000 20 13.09.03 20,000 \n 21 12.11.27 15,000 21 13.09.05 15,000 \n 22 12.12.06 30,000 22 13.10.10 15,000 \n 23 12.12.27 15,000 23 13.11.06 20,000 \n 24 13.01.10 30,000 24 13.11.27 20,000 \n 25 13.01.11 30,000 \n 26 13.01.29 10,000 \n 27 13.02.02 15,000 \n 28 13.02.07 30,000 \n 29 13.02.20 10,000 \n 30 13.02.28 15,000合計(6件) 260,893 合計(30件) 2,008,781 合計(24件) 480,000更 正 決 定原告 Ａ株式会社被告 国上記当事者間の当庁平成●●（○○）第●●号法人税更正処分等取消請求事件について、平成２１年８月２８日当裁判所において言い渡した判決に明白な誤謬があったので、次のとおり決定する。 \n 主 文上記判決の３２ページ２０行目、３３ページ１４行目及び４０ページ５行目に、各「登川支店」とあるのをいずれも「澄川支店」と更正する。 \n 平成２１年８月３１日札幌地方裁判所民事第５部裁判長裁判官 中山 幾次郎裁判官 村主 隆行裁判官 鷺坂 計知 \n \n"
}