{
  "number": "11301",
  "title": "相続税更正処分取消請求事件",
  "court": "那覇地方裁判所",
  "date": "平成２１年１０月２８日",
  "date_iso": "2009-10-28",
  "result": "取消",
  "topics": [
    "相続税"
  ],
  "laws": [
    "国税通則法65条",
    "相続税法22条"
  ],
  "keywords": [
    "更正処分",
    "過少申告加算税",
    "財産評価"
  ],
  "text": "\n \n 目次に戻る \n \n 判決 11301 \n 相続税更正処分取消請求事件 \n \n 裁判所:  那覇地方裁判所 \n 判決日:  平成２１年１０月２８日 \n 結果:  取消 \n \n \n 主文 \n １ 沖縄税務署長が、平成１３年３月１３日相続開始に係る亡Ａを被相続人とする相続税について、\n平成１６年１２月２４日付けで原告甲に対してした、更正処分及び過少申告加算税賦課決定処分\n（いずれも平成１７年５月２０日付け異議決定及び平成１８年６月１５日付け裁決により一部取り消された後のもの。）のうち、納付すべき税額９６６８万６５００円を超える部分及び過少申告加算税額９３８万２０００円を超える部分をいずれも取り消す。\n２ 沖縄税務署長が、平成１３年３月１３日相続開始に係る亡Ａを被相続人とする相続税について、\n平成１６年１２月２４日付けで原告乙に対してした、更正処分及び過少申告加算税賦課決定処分\n（いずれも平成１７年５月２０日付け異議決定及び平成１８年６月１５日付け裁決により一部取り消された後のもの。）のうち、納付すべき税額２９９９万５９００円を超える部分及び過少申告加算税額１７７万８５００円を超える部分をいずれも取り消す。\n３ 沖縄税務署長が、平成１３年３月１３日相続開始に係る亡Ａを被相続人とする相続税について、\n平成１６年１２月２４日付けで原告丙に対してした、更正処分及び過少申告加算税賦課決定処分\n（いずれも平成１７年５月２０日付け異議決定及び平成１８年６月１５日付け裁決により一部取り消された後のもの。）のうち、納付すべき税額１４０５万３７００円を超える部分及び過少申告加算税額１０８万５０００円を超える部分をいずれも取り消す。\n４ 沖縄税務署長が、平成１３年３月１３日相続開始に係る相続税について、平成１６年１２月２４日付けで原告丁に対してした、更正処分及び過少申告加算税賦課決定処分（いずれも平成１７年５月２０日付け異議決定及び平成１８年６月１５日付け裁決により一部取り消された後のもの。）のうち、納付すべき税額２９２２万０６００円を超える部分及び過少申告加算税額１８３万１０００円を超える部分をいずれも取り消す。\n５ 沖縄税務署長が、平成１３年３月１３日相続開始に係る亡Ａを被相続人とする相続税について、\n平成１６年１２月２４日付けで原告戊に対してした、更正処分及び過少申告加算税賦課決定処分\n（いずれも平成１７年５月２０日付け異議決定及び平成１８年６月１５日付け裁決により一部取り消された後のもの。）のうち、納付すべき税額２８８２万３１００円を超える部分及び過少申告加算税額３０７万９５００円を超える部分をいずれも取り消す。\n６ 原告らのその余の請求をいずれも棄却する。\n７ 訴訟費用は、これを３分し、その１を原告らの負担とし、その余は被告の負担とする。 \n \n \n 第１ 請求の趣旨 \n １ 沖縄税務署長が、平成１３年３月１３日相続開始に係る亡Ａ（以下「亡Ａ」という。）を被相続人とする相続税について、平成１６年１２月２４日付けで原告甲（以下「原告甲」という。）\nに対してした、更正処分及び過少申告加算税賦課決定処分（いずれも平成１７年５月２０日付け異議決定及び平成１８年６月１５日付け裁決により一部取り消された後のもの。）のうち、納付すべき税額９１１５万２７００円を超える部分及びこれに対応する過少申告加算税額を超える部分をいずれも取り消す。\n２ 沖縄税務署長が、平成１３年３月１３日相続開始に係る亡Ａを被相続人とする相続税について、\n平成１６年１２月２４日付けで原告乙（以下「原告乙」という。）に対してした、更正処分及び過少申告加算税賦課決定処分（いずれも平成１７年５月２０日付け異議決定及び平成１８年６月\n１５日付け裁決により一部取り消された後のもの。）のうち、納付すべき税額２９３１万１１０\n０円を超える部分及びこれに対応する過少申告加算税額を超える部分をいずれも取り消す。\n３ 沖縄税務署長が、平成１３年３月１３日相続開始に係る亡Ａを被相続人とする相続税について、\n平成１６年１２月２４日付けで原告丙（以下「原告丙」という。）に対してした、更正処分及び過少申告加算税賦課決定処分（いずれも平成１７年５月２０日付け異議決定及び平成１８年６月\n１５日付け裁決により一部取り消された後のもの。）のうち、納付すべき税額９９５万７５００円を超える部分及びこれに対応する過少申告加算税額を超える部分をいずれも取り消す。\n４ 沖縄税務署長が、平成１３年３月１３日相続開始に係る亡Ａを被相続人とする相続税について、\n平成１６年１２月２４日付けで原告丁（以下「原告丁」という。）に対してした、更正処分及び過少申告加算税賦課決定処分（いずれも平成１７年５月２０日付け異議決定及び平成１８年６月\n１５日付け裁決により一部取り消された後のもの。）のうち、納付すべき税額２８５６万２４０\n０円を超える部分及びこれに対応する過少申告加算税額を超える部分をいずれも取り消す。\n５ 沖縄税務署長が、平成１３年３月１３日相続開始に係る亡Ａを被相続人とする相続税について、\n平成１６年１２月２４日付けで原告戊（以下「原告戊」という。）に対してした、更正処分及び過少申告加算税賦課決定処分（いずれも平成１７年５月２０日付け異議決定及び平成１８年６月\n１５日付け裁決により一部取り消された後のもの。）のうち、納付すべき税額２８１８万８１０\n０円を超える部分及びこれに対応する過少申告加算税額を超える部分をいずれも取り消す。 \n \n \n 第２ 事案の概要本件は \n 、亡Ａの死亡により、亡Ａの遺産を相続した原告らが、財産評価基本通達（昭和３９年４月２５日付直資５６、直審（資）１７による国税庁長官通達。ただし、平成１４年６月４日付け課評２－２ほかによる改正前のもの。以下「本件通達」という。）によらずに遺産の時価を算定して相続税の申告をしたところ、沖縄税務署長（処分行政庁）から、平成１６年１２月２４日付けで相続税の更正及び過少申告加算税賦課決定処分（これらを併せて、以下「本件更正処分等」という。） \n を受けたため、本件更正処分等（ただし、いずれも平成１７年５月２０日付け異議決定及び平成１ \n ８年６月１５日付け裁決により一部取り消された後のもの。）の各取消しを求める事案である。 \n １ 前提事実等（各掲記の証拠（すべての枝番を含む場合は、枝番の表記を省略する。以下同じ。） \n 等によるほかは、弁論の全趣旨により認められるか、当事者間に争いがない。） \n (1) 本件相続について亡Ａは、平成１３年３月１３日に死亡し、原告らが亡Ａを相続した（以下「本件相続」という。）。 \n 原告らは、別紙物件目録記載の各土地（別紙物件目録１(1)ないし(3)各記載の土地は、相互に隣接していない３筆の土地であり、それぞれ以下「本件土地１－Ａ」、「本件土地１－Ｂ」及び「本件土地１－Ｃ」といい、これらを併せて「本件土地１」という。また、以下順に「本件土地２」などといい、これらを併せて「本件各土地」という。）を含む亡Ａの財産（以下「本件相続財産」という。）について、原告らで遺産分割協議を行った結果、別紙遺産分割目録記載のとおり、本件土地１ないし６及び８については原告甲が、本件土地７については原告丙が、 \n 本件土地９については原告乙が、それぞれ所有権を取得するなどした（乙２）。 \n (2) 本件各土地の状況について本件相続財産のうち、本件土地１ないし６については、宅地開発業者が本件土地１ないし６を含む周辺の土地所有者から複数の土地を一括して賃借し、当該複数の土地の筆界にかかわらず道路を築造し、区画割りを行うという宅地造成を行った後、転借権付き戸建住宅として分譲するといった開発が行われ、その結果、本件相続開始時において、一筆の土地について土地所有者（底地権者）、宅地開発業者（借地権者）及び複数の建物所有者（転借権者）が存在するという複雑な権利関係を有する状態にあった（以下このような状態を「三層構造」という。）。 \n 一方、本件土地７ないし９については、本件相続開始時において、三層構造の状態にはなかった。 \n (3) 相続税の申告について原告らは、原告らが依頼した鑑定等に基づいて、それぞれ時価を算出するなどして、それぞれ納付すべき相続税額を計算した上、法定申告期限内である平成１４年１月１５日、沖縄税務署長に対し、別紙「本件更正処分等の経緯」中の「申告額」欄認載のとおり、本件各土地等につき、相続税を申告した（以下「本件申告」という。乙１）。 \n (4) 本件処分の経緯についてア 沖縄税務署長は、本件申告が、本件相続財産のうち本件各土地を含む不動産の時価について、本件通達によらずに評価したものであり、かつ、本件土地１ないし６については、三層構造の土地という特殊性があったため、本件通達により難い特別な事情の存否や同事情が存在する場合の時価の検証が必要であるとして、Ｃ不動産鑑定士（以下「Ｃ鑑定士」という。） \n に本件土地１及び６の、Ｄ不動産鑑定士（以下「Ｄ鑑定士」という。）に本件土地２の、Ｅ不動産鑑定士（以下「Ｅ鑑定士」といい、Ｃ鑑定士、Ｄ鑑定士及びＥ鑑定士を併せて以下「国税鑑定士ら」という。）に本件土地３ないし５の、それぞれ本件相続開始時における時価の算出を依頼した（国税鑑定士らによる鑑定を併せて、以下「国税鑑定」といい、本件土地１に対応する国税鑑定を「国税鑑定１」などという。乙６ないし１３）。 \n イ 沖縄税務署長は、本件土地７ないし９については、三層構造の土地ではなく、本件通達により難い特別な事情が認められないから、本件通達によることとし、本件土地２ないし４及び６については、本件通達による評価額が国税鑑定による評価額を上回り当該土地において本件通達により難い特別な事情が認められるから本件相続開始時における時価として国税鑑定による評価額が妥当であるとし、本件土地１及び５については、本件通達による評価額が国税鑑定による評価額を下回り本件通達による評価額を不適当とする特別な事情があるとは認められないから本件通達による評価額の限度で算定することとして、それぞれ本件各土地の本件相続開始時における時価を算出するなどした上、平成１６年１２月２４日付けで、 \n 原告らに対し、別紙「本件更正処分等の経韓」中の「更正処分額」欄記載のとおり、本件更正処分等をした。本件更正処分等の内容は、別表１－１「課税価格等の計算明細表（更正処分額）」記載のとおりであり、同別表記載の各財産及び債務等の内訳は、別表１－２「土地等の明細（更正処分額）」、別表１－３「家屋、構築物の明細」、別表１－４「有価証券の明細」、別表１－５「現金、預貯金等の明細（更正処分額）」、別表１－６「その他の財産の明細」、別表１－７「債務等の明細」記載のとおりである（乙３）。 \n ウ 原告らは、本件更正処分等を不服として、平成１７年２月２３日、沖縄税務署長に対し、 \n 異議を申し立てた（乙４）。 \n エ 沖縄税務署長は、本件各土地について、それぞれ時価を算出した上、原告らに対し、別紙 \n 「本件更正処分等の経緯」中の「異議決定額」欄記載のとおり、平成１７年５月２０日付けで本件更正処分等の一部を取り消す異議決定（以下「本件異議決定」という。）をした（乙 \n ５）。 \n オ 原告らは、本件異議決定を不服として、平成１７年６月１６日、国税不服審判所長に対し、 \n 審査請求をした。 \n カ 国税不服審判所長は、本件各土地について、それぞれ時価を算出した上、原告らに対し、 \n 別紙「本件更正処分等の経緯」中の「裁決額」欄記載のとおり、平成１８年６月１５日付けで、本件異議決定を経た後の本件更正処分等の一部を取り消す裁決（以下「本件裁決」といい、本件異議決定及び本件裁決によって一部取り消された後の本件更正処分等を以下「本件処分」という。）をした（甲１）。 \n (5) 本訴提起について原告らは、本件裁決を不服として、平成１８年１２月１５日、本件処分のうち原告ら主張額を超える部分の取消し等を求める本訴を提起した（当裁判所に顕著な事実）。 \n ２ 当事者の主張の概要及び争点被告は、本件土地７ないし９について、本件通達に基づいて土地の時価を評価すべきでない特別な事情はなく、本件処分は本件通達に基づいて適正に評価している旨主張する。また、本件土地１ないし６について、いずれも三層構造の土地であり、容易に更地化して売買ができないという事情を有することから、本件通達により難い特別な事情の存否や同事情が存在する場合の時価の検証が必要とされるところ、本件土地１ないし６の本件相続開始時における時価を検証すべく、 \n 国税鑑定を依頼するとともに、併せて本件通達による評価額を算出し、本件通達による評価額が、 \n 国税鑑定による評価額を上回る場合には、かかる土地について本件通達により難い特別な事情が認められると判断して、国税鑑定による評価額が時価として妥当であるとし、本件通達による評価額が、国税鑑定による評価額を下回る場合には、国税鑑定による評価額の妥当性があるとしても、原則的に利用されている本件通達による評価額を不適当とする特別な事情があるとは認められないことから、原則に立ち返り、本件通達による評価額の限度で算定することとした旨主張する。 \n これに対し、原告らは、本件土地９については、本件通達に基づいて土地の時価を評価すべきであるが、本件裁決における評価ではなく、本件更正処分等及び本件異議決定における評価が相当である旨主張する。また、本件土地７については、本件通達に基づいて土地の価額を評価すべきではなく、現実の譲渡金額に従った評価額を時価として採用すべきである旨主張する。さらに、 \n 本件土地８については、本件通達に基づいて土地の価額を評価すべきではなく、原告らが依頼したＢ不動産鑑定士による鑑定（以下「Ｂ鑑定」という。）による評価額を時価として採用すべきである旨主張する。そして、本件土地１ないし６については、国税鑑定には誤りがあるから、その評価額を本件通達に基づいた評価額と比較して時価を決することは失当であり、いずれもＢ鑑定による評価額を時価として採用すべきである旨主張する。 \n なお、本件通達に従った場合の本件各土地の評価額については、別表１「課税価格に算入される本件土地の価額の計算表（土地７ないし土地９）」の順号１ないし１２、別表２－１「課税価格に算入される本件土地の価額の計算表（土地１及び２）」の順号１ないし１０及び１５ないし \n １９、別表２－２「課税価格に算入される本件土地の価額の計算表（土地３及び４）」の順号１ないし５及び７ないし１３、別表２－３「課税価格に算入される本件土地の価額の計算表（土地 \n ５及び６）」の順号１ないし４及び８ないし１７の計算及び金額となることに争いはない。 \n したがって、本件の争点は、被告が主張する本件各土地の時価が適切であるかであり、具体的には、本件土地７及び８について、本件通達に基づいて時価を評価すべきであるか、本件土地１ないし６について、国税鑑定による評価が適切であるかである。 \n 以上が、当事者の主張の概要及び争点であり、更に摘示すべき具体的な当事者の主張は、以下のとおりである。 \n ３ 当事者の主張 \n (1) 本件土地９についてア 原告らの主張 ７６２９万１８２８円本件土地９について、本件裁決では、親族の使用貸借部分と隣人の無断使用部分の２つの画地に分けて評価するのが相当であるとし、使用貸借部分につき７３１２万７７８８円、無断使用部分につき２９０万３７６０円、合計７６０３万１５４８円と評価しているが、同土地は自用地であるから評価単位は一つとすべきである。したがって、本件土地９の評価額は、 \n 本件更正処分等及び本件異議決定の評価額である７５２９万１８２８円とするのが相当である。 \n イ 被告の主張 ７５２９万１８２８円認める。 \n (2) 本件土地７についてア 原告らは主張 ３２５０万円原告らは、本件土地７を本件相続当時から売りに出していたが、売却できたのは本件相続から約３年後であり、ようやく成立した売買契約でさえ、３２５０万円でしか売却できなかった。このような事情に照らせば、４７８１万０９０８円という本件処分の評価額が実際の市場価格から乖離していることは明らかであり、本件処分の評価額は時価を上回っていると認められる。 \n したがって、本件土地７の時価は、現実の譲渡代金である３２５０万円と認定すべきである。 \n イ 被告の主張 ４７８１万０９０８円原告らは、現実の譲渡代金をもって時価とすべき旨主張するが、相続税法２２条が規定する「取得するときにおける時価」とは、当該財産の相続価始時点における客観的な交換価値をいうと解されるところ、本件相続開始時から譲渡時までの地価情勢を考慮して時価を算出すべきであり、個別事情の調査や補正等を行うことなく、時価とすることが相当でないことは明らかである。 \n 本件土地７は、一般的な使用貸借地であるから、本件通達により難い特別な事情はなく、 \n 本件通達に従って時価を評価するのが妥当である。したがって、本件土地７の時価は、別表 \n １「課税価格に算入される本件土地の価額の計算表（土地７ないし９）」の順号１記載のとおり、４７８１万０９０８円とするのが相当である。 \n (3) 本件土地８についてア 原告らの主張 ６１９０万円本件土地８は、開発当初、特殊開発土地に該当していたこと及び地主の了解なく転借権を設定し、又は、借地権を譲渡することができることからすれば、特殊開発土地と評価すべきであり、本件通達により時価を評価し難い特別な事情が認められる。したがって、本件土地 \n ８の時価は、Ｂ鑑定に従い、６１９０万円と認定すべきである。 \n イ 被告の主張 ７５６０万５６３７円本件土地８は、本件相続開始時において、底地権者と複数の借地権者がいるにすぎない、 \n いわゆる通常の貸宅地である。また、証拠上、地主の了解なく転借権を設定し、又は、借地権を譲渡することができるとは認められない。そうすると、本件通達により難い特別な事情はなく、本件通達による評価が妥当である。したがって、本件土地８の時価は、別表１「課税価格に算入される本件土地の価額の計算表（土地７ないし９）」の順号２ないし１１記載のとおり、７５６０万５６３７円とするのが相当である。 \n (4) 本件土地１ないし６についてア 被告の主張 \n (ア) 国税鑑定の合理性について国税鑑定士らは、第三者間取引事例の重要性は十分に認識しているが、底地の第三者間取引が極めて少ないため、第三者間取引事例を用いた取引事例比較法では適正な評価ができないと考え、これに替えてＣ鑑定士は、当事者間取引事例を用いた取引事例比較法を、 \n Ｄ鑑定士及びＥ鑑定士はいわゆる控除方式をそれぞれ採用し、いずれも収益価格と関連づけるなどして、本件土地１ないし６の評価額を算出したものであり、その判断は合理的であって、不動産鑑定評価基準にも合致する。 \n ａ 当事者間取引事例を採用することの妥当性（国税鑑定１及び６） \n 国税鑑定１及び６を行ったＣ鑑定士は、取引事例比較法において、当事者間取引事例を用いたことから、事情補正についても検討しているが、現実の底地市場において、底地の第三者間取引がほとんどないため、補正作業そのものが不可能であるとして、やむなく事情補正を断念している。一方で、同鑑定士は、当事者間取引事例は評価対象の近隣地域内又は同一需給圏内の類似地域に存するものであること、底地の買受人は借地権との併合による思わぬ利益を享受する地位を獲得するが、その分の期待値を含めた評価、 \n つまり、底地の経済的評価のみを重視した場合よりも高めの評価が妥当するとの判断により、採用した資料と評価の手順等を再点検し、底地の評価特性等を総合的に考量した結果、収益価格と比準価格との中庸値をもって、それぞれ本件土地１及び６の価格としたのであり、かかる評価手法及び評価過程に不合理な点はない。 \n 原告らは、求めるべき底地の正常価格を、第三者間取引事例に代表される完全競争市場の正常価格であると主張し、更に第三者間取引事例の価格は借地賃料収入が目的とされる価格であると主張するようであるが、底地の価格には、地代徴収権に相応する価格のほかに将来の借地契約満了によって復帰する経済的利益の現在価値を当然に含んでいるものであるから、かかる原告らの主張は、底地の価格の概念を正解しないものである。 \n ｂ 控除方式を採用することの妥当性（国税鑑定２ないし５） \n 国税鑑定２ないし５を行ったＤ鑑定士及びＥ鑑定士が取引事例比較法を採用していないのは、比準価格を算出するための取引事例が少なく、かかる取引事例が正常な事情で成立した取引か否か、取引当事者が適正価格を十分に把握していたかなどの判断が困難であったためである。また、不動産鑑定評価基準上定められていない控除方式を採用したのは、前記のとおり、取引事例比較法を採用できない事情の下、控除方式が底地の限定価格を求める場合と同様に一般的に認められている評価方法であり、底地の定義及び総合的勘案事項からすると、不動産鑑定評価基準が示唆する評価方法といえるからである。 \n したがって、底地の第三者間取引が極めて少ない状況の中、Ｄ及びＥ両鑑定士が控除方式を用いて本件土地２ないし５の鑑定評価額を算出したことに何ら問題はない。 \n ｃ 収益価格の算出方法の妥当性（国税鑑定１ないし６） \n 国税鑑定１ないし６では、三層構造の特性を当然に考慮しており、更地復帰価格の算出に使用する割引率を基本利率よりも１パーセント程度高く決定した上で収益価格を算出している。 \n また、本件各土地上の建物は、土地ごとにほぼ同時期に建築されており、転借権の満了時期もほぼ同時期と見込まれること、実際に本件土地８は三層構造を解消しており、 \n 三層構造が将来的に解消される可能性は否定できず、価格時点である本件相続開始時において、国税鑑定士らが更地復帰時期を建物の残存期間で見積もっていることに何ら問題はない。三層構造であることの斟酌は既に割引率で考慮している以上、更に更地復帰時期を遅らせて収益価格を算出する必要性は認められない。 \n ｄ 試算価格の調整方法の妥当性不動産鑑定評価基準上、底地の鑑定評価額は、実際支払賃料に基づく純収益等の現在価値の総和を求めることにより得た収益価格及び比準価格を関連づけて決定するものであり、どのように調整するかは不動産鑑定士の裁量に委ねられているところである。 \n 国税鑑定士らは、本件各土地の鑑定評価額を決するに当たり、取引事例比較法における取引事例がすべて当事者間取引事例であることや控除方式により求めた価格を試算価格としていることなども考慮した上、試算価格の調整を行っており、かかる考慮の結果として、各試算価格の中庸値を鑑定評価額と決定したものであるから、理由なく中庸値を採用しているわけではない。 \n (イ) Ｂ鑑定の不合理性についてこれに対し、原告らが主張するＢ鑑定は形式上は不動産鑑定評価基準に沿っているものの、形式に拘泥するあまり、その実体はおよそ適正な評価とはいい難い。 \n ａ 収益価格算出上の問題点 \n (a) 収益価格の算出に当たり、実際支払賃料を補正せずに用いていること \n Ｂ鑑定が採用した本件土地１ないし６に係る支払賃料は、年間で坪当たり５４９円ないし７４９円であり、国税鑑定士らが採用した周辺の標準的な賃料（坪当たり１４ \n ４０円）に比して、３７パーセントないし５２パーセントと著しく低額であり、適正な地代への補正をすべきところ、何ら補正を行わずに収益価格を算出している。このようなＢ鑑定の評価手法は、妥当性を欠いているといわざるを得ない。 \n (b) 無期還元式を採用して更地復帰価格を加味していること原告らの主張によれば、三層構造の特殊性から所有権が復帰しないことを前提に、 \n 無期還元式を採用しているが、他方で将来の更地復帰可能性を還元利回りで考慮している。しかしながら、無期還元式は、純利益が永久に得られること意味するものであり、その性格上、更地復帰価格を考慮することはできない。また、この点について、 \n Ｂ鑑定では、更地復帰の標準的あるいは具体的な時期について触れられてもいない。 \n (c) 還元利回りによる調整底地の価格とは、地代徴収権に相当する価格のほかに将来見込まれる権利金等の一時金の経済的利益及び借地権が消滅して完全所有権に復帰することによる経済的利益を加味して形成されるものである。したがって、借地権の復帰見込みが遅ければ、 \n 「地代徴収権の価格」が増加するが、「更地の復帰価格」が減少するというように、 \n 互いに相反する性質のものであり、両者を別途計算の上、加算することで底地価格としての整合性が保たれる。国税鑑定はこのような手法で収益価格を算出しているが、 \n Ｂ鑑定では、更地価格を算出していないことから、更地の復帰価格も算出しておらず、 \n 互いに相反する性質の「地代徴収権の価格」と「更地の復帰価格」を還元利回りのみで調整している。 \n その結果、Ｂ鑑定は、後記(d)及び(f)のように、本来還元利回りを増算すべきである更地の復帰見込みが早いという事情をもって、還元利回りを減算させるという矛盾を起こしている。 \n (d) 将来の更地復帰可能性について還元利回りの算定に当たっては、純利益を増加させる要因があれば、還元利回りを減算（収益価格を増加）し、純利益を減少させる要因があれば、還元利回りを増算（収益価格を減少）する。すなわち、更地に復帰するとなると、その後は純利益を得られなくなるのであるから、更地復帰が困難な場合には、還元利回りを減算（収益価格を増加）し、更地復帰が容易な場合には、還元利回りを増算（収益価格を減少）しなければならない。Ｂ鑑定は、将来の復帰可能性として、本件土地６を基準に、これよりも土地上の建物が少ない本件土地１ないし５の還元利回りを減算（収益価格を増加） \n しているが、建物が少なく更地復帰が容易な場合には、本来還元利回りを増算（収益価格を減少）しなければならず、還元利回りの計算を誤っている。 \n (e) 将来の一時金授受について国税鑑定では、実際の支払賃料を周辺地域の標準的な支払賃料に補正した後、将来の賃料上昇率及び底地の収益性を考慮している。これに対し、Ｂ鑑定では、周辺地域の標準的な支払賃料に比して著しく低廉な実際の支払賃料を前提にしており、一括授受や標準賃料への是正可能性を加味しているにとどまる。 \n (f) 住環境による市場性について \n Ｂ鑑定では、前記(d)のとおり、将来の更地復帰可能性を独立した要素として考慮しているにもかかわらず、住環境による市場性においても、更地として復帰する可能性等を勘案しており、更地の復帰可能性を二重に計上し、還元利回りを減算（収益価格を増加）している。 \n ｂ 比準価格算出上の問題点 \n (a) １事例により比準価格を算出していること取引事例比較法により比準価格を算出する場合、多数の取引事例を収集して適切な事例の選択を行うことが必要である。原告らは、当事者間取引事例を含めた多数の取引事例を収集しつつ、特に三層構造という点にかんがみて、当事者間取引事例を排除し、第三者間取引事例を慎重に選別した旨主張するが、Ｂ鑑定の鑑定書に、そのような記述はうかがわれない上、結局は第三者間取引事例の２事例のみを採用しているのであるから、同事例のみに基づいて鑑定しているのにほかならない。また、同鑑定士は、第三者間取引事例のうち、１事例については、採用を見送っており、実質的には \n １事例を根拠に比準価格を算出している。 \n (b) Ｂ鑑定が採用した第三者間取引事例は事例として不適当であること取引事例比較法により比準価格を算出した国税鑑定１及び６において、Ｃ鑑定士が同一需給圏内の判定を約２キロメール以内としているのに対し、Ｂ鑑定が採用した第三者間取引事例の土地と本件土地１ないし６は、Ｎを挟んで直線距離にして約６キロメートル離れており、同一需給圏内における取引とはいい難い。 \n また、同第三者間取引事例は、土地上の６棟の建物のうち、１棟が譲渡人所有の建物であり、当該建物が併せて売買されているが、Ｂ鑑定は、当該建物部分について、 \n 売買代金の配分や借地権のない完全な所有権が取得できることについて考慮していない。 \n さらに、同第三者間取引事例の取引価格は、仮に当該建物を無価値としても１平方メートル当たり７４８９円であるが、平成１５年分路線価図によれば当該土地が５万 \n ８０００円の路線に接していることなどからすれば、底地の取引であることを考慮しても著しく低廉であり、底地であること以外の何らかの事情を含んだ価格であることが容易に想定できる。 \n 以上によれば、同第三者間取引事例は、およそ正常な底地の売買実例とはいい難く、 \n 比準価格の根拠として採用するにはばかられる取引事例である。 \n (c) 事情補正等がなされていないこと前記(b)のとおり、同第三者間取引事例には、低廉な価格で売却せざるを得ない事情があったと想定されたため、被告が買い主から聴き取ったところ、借金の返済に迫られていた売り主が、不動産業者である買い主に対し、競売と同等の極めて低廉な価格で売却した事例であることが判明した。また、当該土地はいわゆるうなぎの寝床のような奥行長大の地形であり、これらの事情が価格を引き下げる要因となることは明らかであるにもかかわらず、Ｂ鑑定は何ら補正を行わずに、かかる同第三者間取引事例を採用している。 \n (d) 個別的要因による補正が妥当でないこと \n Ｂ鑑定は、採用した第三者間取引事例の取引価格を基に、時点修正や地域要因格差による修正をし、近隣地域の標準的な底地の比準価格を算出した上、本件土地１ないし６及び８の個別要因による補正をして、それぞれの比準価格を算出している。しかしながら、比準価格算出の際に用いられた個別的要因による格差の調整は、その根拠もあいまいであり、いかなる基準によって数値が決定されたのか不明である。 \n また、前記(b)及び(c)のとおり、価格が著しく低廉な事例を補正等も行わずに用いているため、個別的要因のみで調整せざるを得なくなり、本件土地１ないし６の中でも更地復帰が困難な本件土地６を標準的と判断して、他の土地の格差率を増加させたり、本来格差率を減少すべきである道路等による分断が多く購入意欲の削がれる土地の格差率を増加させるなどしており、不合理な調整をせざるを得なかったことがうかがわれる。 \n (ウ) 平成１７年改正通達について平成１７年６月１６日付け「財産評価基本通達の一部改正について（法令解釈通達）」 \n （以下「平成１７年改正通達」という。）は、平成１７年１月１日以降に相続等により取得した財産の評価に適用するとされており、通達が改正されたときは、それが全国的に下級行政庁の税務徴収事務ないし税務指導を画一的に規律する関係上、特段の事情がない限り遡及適用を認めることはできない。したがって、本件土地１及び５について、平成１７年改正通達に従った借地権割合を採用せず、本件相続開始時における財産評価基本通達 \n （平成１４年６月４日付け通達による改正前のもの。以下「改正前基本通達」という。） \n に従った借地権割合を用いて評価したことが直ちに違法とはいえない。また、本件土地２ないし４及び６については、本件通達により難い特別な事情が認められたことから、国税鑑定による評価を行っており、平成１７年改正通達による基準が用いられていないことをもって違法をいう、原告らの主張には理由がない。 \n 原告らが指摘する競売事例は、民事執行法１条に規定する強制執行、担保権の実行としての競売等の一環として行われたものであるところ、同法５８条２項によれば、選任された評価人は、強制競売手続において不動産の売却を実施するための評価であることを考慮しなければならないとされている。このような競売における評価の特殊性にかんがみれば、 \n 民事執行法に基づく競売の価額と相続税法２２条に規定する「時価」とを同等に扱うことは到底認められるものではなく、参考に値するものではない。 \n なお、Ｂ鑑定が算出した収益価格及び比準価格は、いずれも平成１７年改正通達による借地権割合を適用した額を若干上回る程度であるが、前記のとおり、収益価格については、 \n 更地価格・更地復帰価格を算出せず、周辺地域の標準的な賃料を比準せず、あいまいな基準により還元利回りを調整し、比準価格については、第三者間取引事例を１事例のみ採用し、取引に関する事情補正や標準化補正を行わず、あいまいな基準により個別的要因による補正率を調整するなどしており、原告らの意図する価格に調整されたことが推認される。 \n イ 原告らの主張 \n (ア) 国税鑑定の不合理性について不動産鑑定評価基準は、国土交通事務次官から発せられた通知であり、法令ではないから、不動産鑑定に関し必ず準拠しなければならない法的義務があるわけではない。しかしながら、同基準が、不動産の鑑定評価の統一的基準であるとともに、不動産の鑑定評価に関する法律４０条１項及び２項の規定に基づき不当な不動産の鑑定評価についての懲戒処分を行う際の判断根拠となるものであるとされていることなどによれば、強い事実上の拘束力を有しているというべきである。したがって、同基準の採用していない、あるいは同基準に反する評価手法等を採用できるのは、同基準よりも合理的かつ適切であることが認められる場合でなければならない。 \n 国税鑑定は、同基準に照らし、以下のような問題点がある。 \n ａ 取引事例比較法適用上の問題点（国税鑑定１及び６） \n (a) 当事者間取引事例を用いていること一般的な借地関係の場合、当事者間取引は取引と同時に更地化を実現して土地の有効利用を可能とするから、その経済価値の増分が加味され、第三者間取引事例よりも高い価格で取引される。したがって、その価格は限定価格とされる。もっとも、一般的な借地関係の場合、当事者間取引でも第三者間取引でも混同が生じる可能性があり、 \n 理論上は同一の価格路線上にあるといえる。したがって、不動産鑑定評価基準上は、 \n 第三者間取引事例を用いて正常価格を導くべきであっても、第三者間取引事例が収集できないなどの場合には、例外的に当事者間取引を準用して価格を求めることを是認し得る余地がある。しかしながら、これは一般的な借地関係において、消極的に認められるにすぎないというべきである。三層構造の土地の場合、一般的な借地関係の場合と異なり、混同による更地化が取引と同時に実現することはあり得ず、第三者間取引と理論上同等といえるような当事者間取引はそもそも存在しない。前記のとおり、 \n 一般的な借地関係において準用を是認する余地があるにすぎない当事者間取引事例を三層構造の土地を評価するために用いることは準用の基礎すら欠いており不可能であるといわざるを得ない。したがって、当事者間取引事例を用いて三層構造の土地を評価している点に問題がある。 \n (b) 事情補正を行っていないこと取引事例比較法において、当事者間取引を採用した場合、事情補正が不可欠であるところ、国税鑑定１及び６は、取引事例比較法によって比準価格を算出する際に事情補正を行わず、最終的な評価額を算出する際に収益価格との中庸値を用いることで済ませている点に問題がある。 \n ｂ 控除方式を採用する問題点（国税鑑定２ないし５） \n 不動産鑑定評価基準によれば、更地の価格から借地権の価格を差し引く控除方式を採用して底地の価格を求めることは明確に否定されており、一般的な借地関係において、 \n 取引と同時に更地化が実現する場合に採用できるにすぎず、かかる更地化があり得ない三層構造の土地においては採用の前提を欠いている。また、この点を措くとしても、三層構造の土地については、更地の価格から借地権に加え、転借地権の価格も差し引くべきである。したがって、三層構造の土地に、一般的な控除方式を採用することは、二重の意味で問題である。 \n ｃ 収益還元法適用上の問題点（国税鑑定１ないし６） \n 三層構造の土地は、一筆の土地を多数の転借地人が使用していたり、転借地人の敷地が複数の土地にまたがるなどしている。したがって、一人の借地人との賃貸借関係が終了しても、借地人との賃貸借関係が残存しているため、直ちに更地としての利用はできず、一部ずつの転借地の終了が何年にもわたり実現し、その後全体が返還された後に更地全体の価値が復帰することとなる。有期還元方式を適用するのであれば、単に割引率の微調整にとどまらず、更地復帰時期を平均的な収益収受終了時期よりも遅らせて計算すべきである。 \n ｄ 試算価格の調整についての問題点（国税鑑定１ないし６） \n 国税鑑定１及び６は、当事者間取引事例を用いた取引事例比較法で算出した比準価格を、国税鑑定２ないし５は、控除方式により算出した価格を、それぞれ試算価格とし、 \n 収益還元法により算出した収益価格との中庸値を当該土地の評価額としている。 \n しかしながら、前記ａ及びｂで指摘した問題は中庸値を採用したからといって解消されるものではない。また、この点を措くとしても、本来、どの方式による価格も適正な価格を指向し、その価格は一致するはずであるから、試算価格間に大きな開きが生じた場合には、適正かつ合理性を欠く算出がなされたものと疑われ、手順をさかのぼって検証して、その開差の理由を検討し、最終的にどの試算価格が説得的であるかを判断しなければならないというべきである。本件では、比準価格及び控除方式による価格と収益価格との間に極端な差が生じており、前記のような検証・検討を行うべきであるにもかかわらず、国税鑑定はこれを怠ったものである。 \n (イ) Ｂ鑑定の合理性について \n ａ 収益価格算出について \n (a) 収益価格の算出に実際支払賃料を用いていること不動産鑑定評価基準によれば、収益価格とは、実際支払賃料に基づく純利益等の現在価値の総和を求めることにより得た価格とされているところ、Ｂ鑑定は、同基準に従い、実際支払賃料に基づいて収益価格を算出している。 \n 被告は、実際支払賃料は周辺の標準賃料に比して著しく低額であり、これを補正せずに用いることは妥当性を欠く旨主張するが、その評価手法は、同基準に反するものである。Ｂ鑑定は、適正賃料への是正可能性及び更地復帰可能性を下記(b)の還元利回りの査定において適正に勘案しており、被告の主張は失当である。 \n (b) 還元利回りについて不動産鑑定評価基準によれば、還元利回りとは、一期間の純利益から対象不動産の価格を直接求める際に使用される率であり、将来の収益に影響を与える要因の変動予測と予測を伴う不確実性を含むものであり、Ｂ鑑定は、同基準に従い、以下のとおり、 \n 将来の更地復帰可能性、将来の一時金収受の可能性及び住環境による市場性を考慮して還元利回りを計算している。 \n 将来の更地復帰可能性については、建物数が多いほど更地復帰が困難であり、還元利回りは高くなる（控除する率は減少する）ところ、Ｂ鑑定は、５戸の建物がある本件土地６を基準に、建物数１戸の増減に応じ、０．５パーセント刻みで控除率を減増させており、その数値には十分整合性がある。 \n また、将来の一時金収受の可能性については、Ｂ鑑定は、現在の実際支払賃料が低いことから、一括授受や標準賃料への是正可能性を加味しており、不合理な点はない。 \n さらに、住環境による市場性について、Ｂ鑑定は、更地として復帰する可能性、その期間、復帰する更地価格の状況について、総合的に勘案した数値で修正したものであり、特に更地として復帰する場合の経済的価値、そのリスクとしての借地人の状況や借地建物の状況等を重視して勘案されにものであるから、不合理な点はない。 \n ｂ 比準価格の算出について \n (a) 第三者間取引事例を用いるのが原則であること \n Ｂ鑑定は、第三者間取引事例である２事例を採用して検討し、検討後に１事例については不適切として参考程度にとどめたものである。被告は、取引事例が少ない旨主張するが、正常価格が競争市場を前提とするものである以上、第三者間取引事例を用いるのが原則であり、更地化が困難な三層構造の土地の比準価格を算出するのであれば尚更である。 \n (b) 本件第三者間取引事例が不適切ではないこと被告は、本件土地１ないし６及び８と採用した第三者間取引事例の土地が同一需給圏内にない旨主張するが、同一需給圏とは代替・競争関係にある不動産の存する範囲であるところ、本件各土地のような第三者への賃貸を前提とした収益物件については、 \n その範囲は比較的広くなる傾向にあるから、被告の主張は妥当しない。 \n また、被告は、採用した第三者間取引事例について、Ｂ鑑定が譲渡人所有の建物を含む取引であることを考慮していない旨指摘するが、仮に補正を行えば、底地の価格は更に安くなる上、譲渡人所有の建物は６棟のうち１棟であり、画地条件等で複雑な補正を要するため、恣意性を排除することが困難であると判断して補正を行わなかったものであり、被告の指摘は妥当しない。 \n さらに、被告は、採用した第三者間取引事例の売買価格が著しく低廉であることから、およそ正常な底地の売買実例とはいい難いと主張するが、三層構造の土地の底地取引価格は実際このような低額になるのである。 \n (c) 事情補正等を行わなかったことは妥当であること事情補正や標準化補正は、多数の取引事例を元に当該地域の適正な価格水準を把握し、取引価格にその水準との乖離等が認められる場合に行うものである。しかし、本件のように第三者間取引が極端に少ない場合、補正の前提となる適正な価格水準の把握が困難である。したがって、Ｂ鑑定が補正を行わなかったことには合理的な理由がある。また、採用した第三者間取引事例に係る事情の解明が不十分であることや適正な価格水準との乖離があることなども認識した上、Ｂ鑑定は試算価格の調整段階で収益価格を重視するなどの措置を採っている。 \n (d) 個別的要因による補正について \n Ｂ鑑定は、建物が画地をまたがっているか、建物の維持管理の程度等の諸事情から建物の状況に応じた補正を施し、また、転借人の数に応じて１０パーセント刻みで格差率を算出し、さらに、道路等により画地が分断されているかなどの諸事情から底地状況の市場性に応じた補正を施しており、その結果、本件各土地ごとに格差が生じることは何ら不合理でない。 \n (ウ) 平成１７年改正通達について本件通達による貸宅地の評価は、更地評価から借地権割合を控除して算出されるところ、 \n 本件土地１ないし６に係る借地権割合は、改正前基本通達では、３０パーセントとされていたものが、平成１７年改正通達により、７０パーセントと大幅に変更された。この点、 \n 借地権割合とは、貸宅地の取引価格算出を簡便化する目的で観念的にその評価を求めるために設定されたものであり、貸宅地としての利用方法が変わらない限り変動は考えられないにもかかわらず、４年後には上記のように大幅な変更がなされたことにかんがみると、 \n そもそも改正前基本通達の借地権割合が実情を踏まえない不適切なものであったことがうかがわれる。 \n また、本件土地１ないし６と同様に三層構造の土地である沖縄県宜野湾市所在の訴外土地が競売されているところ、同競売の評価書（甲２２）において、改正前基本通達に基づき、借地権割合を２５パーセントとした控除方式での評価が行われている。この点、同評価では、競売価格の特殊性については、競売市場修正が加えられている上、市場性修正（４ \n ０パーセント控除）や積算価格と収益価格の中庸値を用いることなど、被告の主張に沿った評価方法による限りで三層構造の特殊性を考慮しているにもかかわらず、その評価書が示した６４０万円という評価額の半額程度に近い３５８万４０００円で落札されていること（甲１９）からしても、改正前基本通達の借地権割合が現実から乖離していることを示している。なお、同競売事例について、原告らが主張する借地権割合７０パーセントを採用し、その他の数値は変更せずに評価額を再計算すると、３４０万７３６７円となり、 \n 実際の競売価格に近似する。 \n 被告らは、Ｂ鑑定の算出した比準価格が原告らの主張する借地権割合を適用した額に近似することを理由に、Ｂ鑑定が個別的要因を調整・操作している旨主張するが、Ｂ鑑定は、 \n 不動産鑑定評価基準の原則に従って第三者間取引事例を採用し、合理的な理由により事情補正等を行わないなどの措置をしたものであり、その結果偶然両者の値が近似したものであるから、かかる主張は妥当せず、平成１７年改正通達による借地権割合こそが、本件相続時から妥当であったことを裏付けている。 \n \n \n 第３ 当裁判所の判断 \n １ 相続財産の時価について相続税法２２条にいう「時価」とは、当該財産の取得時において、その財産の現況に応じ、不特定多数の当事者間において自由な取引が行われる場合に通常成立すると認められる価額、すなわち、当該財産の客観的交換価値をいうものと解される。 \n ところで、すべての財産の客観的交換価値は必ずしも一義的に確定されるものではないから、 \n これを個別に評価する方法を採った場合には、その評価方法等により異なる評価額が生じたり、 \n 課税庁の事務負担が重くなり、課説事務の迅速な処理が困難となるおそれもある。そこで、課税実務上は、法に特別の定めのあるものを除き、財産評価の一般的基準が本件通達によって定められ、原則としてこれに定められた画一的な評価方法によって、当該財産の評価をすることとされている。そして、このようにあらかじめ定められた評価方法により、画一的に財産の評価を行うことは、税負担の公平、効率的な租税行政の実現という観点からみて合理的であり、これを形式的にすべての納税者に適用して財産の評価を行うことは、一般的には、税務負担の実質的な公平をも実現し、租税平等主義にかなうものである。 \n しかしながら、評価の目的は、あくまでも当該財産の客観的交換価値を確定することにあり、 \n 本件通達に定められた評価方法により財産を評価すべきであるとする趣旨が上記のとおりであることからすれば、本件通達に定められた評価方法を画一的に適用することによって、明らかに当該財産の客観的交換価値とは乖離した結果を導くこととなり、そのため、実質的な租税負担の公平を著しく害し、法の趣旨及び本件通達の趣旨に反することとなるなど、本件通達に定める評価方式によらないことが正当として是認されるような特別な事情がある場合には、他の合理的な評価方式によることが許されると解すべきであり、本件通達６においても、「この通達の定めによって評価することが著しく不適当と認められる財産の価額は、国税庁長官の指示を受けて評価する。」と定められている。 \n ２ 本件土地９について本件土地９について、本件通達によって評価すべきこと、及び、同評価による時価が７５２９万１８２８円となることは、当事者間に争いがない。 \n ３ 本件土地７について \n (1) 原告らは、体件土地７を本件相続当時から売りに出していたが、売却できたのは本件相続から約３年後であり、３年待って成立した売買契約においても、３２５０万円という低額でしか売却できなかったのであるから、本件通達に基づいてした４７８１万０９０８円という評価は実際の市場価格から乖離していることは明らかであり、本件土地７の時価は、現実の譲渡代金である３２５０万円と認定すべきである旨主張する。 \n しかしながら、前記のとおり、本件通達により画一的に財産の評価を行うことは、税負担の公平、効率的な租税行政の実現という観点からみて合理的であり、一般的には租税平等主義にもかなうものであることからすれば、本件通達に定める評価方式によらないことが正当として是認されるような特別な事情がある場合とは、本件通達に定められた評価方法を画一的に適用することによって、明らかに当該財産の客観的交換価値とは乖離した結果を導くこととなり、 \n そのため、実質的な租税負担の公平を著しく害し、法の趣旨及び本件通達の趣旨に反することとなる場合でなければならない。そして、相続財産の時価とは、相続時において、その財産の現況に応じ、不特定多数の当事者間において自由な取引が行われる場合に通常成立すると認められる価額、すなわち、相続時における当該財産の客観的交換価値をいうところ、現実の譲渡価格は、いかなる時期に譲渡するかといった判断を含め、譲渡時における譲渡当事者間の諸事情を反映して決せられるため、何らの事情補正等を行うことなく、客観的交換価値を現していると見ることはできないばかりか、相続税の算定の基礎となる時価の概念に、そのような不確定要素を持ち込むことは、むしろ実質的な租税負担の公平を害することにもなりかねない。この点、原告らは、本件土地７が本件相続当時から売りに出されていたことや、その後３年経って成立した売買契約に係る売買代金も本件通達による評価額よりも大幅に低いものであったことを指摘するが、上記説示の諸点にかんがみれば、これら原告らの主張を基に、本件土地７について、本件通達によらないことが正当として是認されるような特別な事情が存するものとは認められず、本件土地７の価額算出は本件通達の定める評価方式によるべきである。 \n (2) そして、本件通達の定める評価方式によった場合、本件土地７の相続税評価額の計算及び結果が別表１「課税価格に算入される本件土地の価額の計算表（土地７ないし土地９）」の順号１のとおりとなることについては、使用貸借による土地の使用権を土地の時価に影響を与えるような土地利用権と認めて、自用地価値から控除する必要がないことも含めて当事者間に争いがない。 \n したがって、本件土地７の時価は、４７８１万０９０８円と認められる。 \n ４ 本件土地８について \n (1) 原告らは、本件土地８は、開発当初、特殊開発土地に該当していたこと及び地主の了解なく転借権を設定し、又は、借地権を譲渡することができることから、特殊開発土地として扱うべきであるとし、三層構造の土地に準じた土地として、本件通達によらないことが正当として是認されるような特別な事情がある旨主張する。 \n しかしながら、相続財産の時価とは、前記のとおり、相続時における当該財産の客観的交換価値をいうところ、本件土地８が、本件相続開始以前において、原告らのいう特殊開発土地あるいは三層構造の土地に該当していたことがあったとしても、本件相続時において、亡Ａと本件土地８の建物所有者である賃借人９人がそれぞれ直接賃貸借契約を締結している状況にあったことに争いはない。また、亡Ａと上記賃借人の一人であるＦとの間で締結された宅地賃貸借契約の契約書（乙２６の１ないし３）の第６条によれば、土地を転借する時や建物を売却して借地権を他に譲渡する時には、必ず賃貸人である亡Ａの承諾を受けなければならない旨定められている。 \n 以上によれば、本件土地８は、本件相続開始時において、三層構造でなく、また、本件全証拠によっても原告らの主張するその余の事情は認められず、その評価を本件通達によらないことが正当として是認されるような特別な事情は認められない。したがって、本件土地８の価額算出は本件通達の定める評価方式によるべきである。 \n (2) そして本件通達の定める評価方式によった場合、本件土地８の相続税評価額の計算及び結果が別表１「課税価格に算入される本件土地の価額の計算表（土地７ないし土地９）」の順号 \n ２ないし１１のとおりとなることについては、当事者間に争いがない。 \n したがって、本件土地８の時価は、７５６０万５６３７円と認められる。 \n ５ 本件土地１ないし６について \n (1) 前記前提事実等(2)のとおり、本件土地１ないし６は、宅地開発業者が本件土地１ないし６を含む周辺の土地所有者から複数の土地を一括して賃借し、当該複数の土地の筆界にかかわらず道路を築造し、区画割りを行うという宅地造成を行った後、転借権付き戸建住宅として分譲するといった開発が行われ、その結果、一筆の土地について、土地所有者（底地権者）、宅地開発業者（借地権者）及び複数の建物所有者（転借権者）が存在するという複雑な権利関係を有する状態にある三層構造の土地である。そして、このうち、本件土地２ないし４及び６について、本件通達に定める評価方式によらないことが正当として是認されるような特別な事情が認められることは、被告も認めるところであり、本件処分においても、これら各土地の評価は、 \n 本件通達に定める評価方式によっていない。これに対し、被告は、本件土地１及び５は、本件通達による評価額が国税鑑定による評価額を下回るから、本件通達に定める評価方式によらないことが正当として是認されるような特別な事情があるとは認められないとする。しかしながら、本件土地１及び５についても、本件土地２ないし４及び６と同様、上記のように複雑な権利関係を有する状態にある三層構造の土地にある（なお、このうち、本件土地１－Ｂと本件土地５については、これら各土地上に存する建物はそれぞれ１戸と認められるが、これら各建物は、いずれも本件土地１－Ｂないし本件土地５と、隣接する土地とにまたがって建っていることが認められ（甲６、１１、乙７、１２）、複雑な権利関係を有する状態にある三層構造の土地であることにかわりはない。）ことに照らせば、宅地の評価として、同宅地の面する路線に付された路線価を基とし、奥行価格補正や側方路線影響加算等の補正等をほどこし、さらに、 \n 貸宅地として、これら各土地の自用地としての価額に、地域毎に定められた借地権の価額を控除して評価する（なお、本件相続時点における、本件土地１及び５に係る借地権の価額の割合 \n （借地権割合）は３割である（当事者間に争いがない。）。）という本件通達に定める評価方式 \n （本件通達１１ないし２５）をそのまま適用することによって、上記のような複雑な権利関係を有する状態にある三層構造の土地の適切な時価を算定することは困難であって、本件土地１及び５を含むこれら三層構造の土地については、本件通達に定める評価方式によらないことが正当として是認できるような特別な事情が存するものというべきであり、上記のような三層構造の土地の特質に照らせば、同じく三層構造となっている本件土地１ないし６のうち、国税鑑定による評価額が本件通達による評価額を下回る本件土地２ないし４及び６には上記特別な事情があるが、国税鑑定による評価額が本件通達による評価額を上回る本件土地１及び５には上記特別な事情は存しないものということは相当でない。以上から、本件土地１ないし６については、本件通達に定める評価方式によらないことが正当として是認される特別な事情があるものであって、その場合の適正な時価については、被告が主張立証責任を負う。したがって、 \n 以下、国税鑑定による評価額が適切であるか否かを検討する。 \n (2) 宅地の底地価格を求める手法について、不動産鑑定評価基準（乙１６）は、対象不動産が将来生み出すであろうと期待される純収益の現在価値の総和を求める方法である収益還元法による収益価格及び多数の取引事例を収集して適切な事例の選択を行い、これらに係る取引価格に必要に応じて事情補正及び時点修正を行い、かつ、地域要因の比較及び個別的要因の比較を行って求められた価格を比較考量する方法である取引事例比較法による比準価格を関連づけて決定するものとしている。また、不動産鑑定評価基準によれば、不動産鑑定により求めるべき価格は、基本的には正常価格、すなわち、市場性を有する不動産について、現実の社会経済情勢の下で合理的と考えられる条件を満たす市場で形成されるであろう市場価格を表示する適正な価格であるとされ、他方、限定価格、すなわち、市場性を有する不動産はついて、当該不動産と取得する他の不動産の併合又は不動産の一部を取得する際の分割等に基づき正常価格と同一の市場概念の下において形成されるであろう市場価格と乖離することにより、市場が相対的に限定される場合における取得部分の当該市場限定に基づく市場価値を適正に表示する価格を求める場合の例示として、借地権者が底地の併合を目的とする売買に関連する場合があげられていることに照らせば、不動産鑑定評価基準は、取引事例比較法による比準価格の算出に当たり、原則として、第三者間取引事例を用いるべきであるとしているものと解される。 \n そして、かかる不動産鑑定評価基準は、法令ではないものの、不動産鑑定士等が不動産の鑑定評価を行うに当たっての統一的基準であり、不動産の鑑定評価に関する法律４０条１項及び２項の規定に基づき不当な不動産の鑑定評価についての懲戒処分を行う際の判断根拠となるとして、国土交通事務次官から国土交通大臣登録不動産鑑定業者、Ｏ協会及び都道府県知事に対する各通知が発せられていること（甲１５）にかんがみれば不動産鑑定に当たっては不動産鑑定評価基準に従った手法によることが求められているというべきである。もっとも、鑑定すべき不動産は多種多様であり、不動産鑑定評価基準による手法によることが不可能又は著しく困難な場合にまで、同基準による手法による鑑定を強制するものではないと解される。 \n これを本件についてみると、本件土地１ないし６のような三層構造の土地については、第三者間取引が極めて少ないという事情があり、第三者間取引事例を用いた取引事例比較法により比準価格を求めることは、不可能又は著しく困難であるといわざるを得ない。 \n もっとも、不動産鑑定評価基準の定める評価方式によらない方法による場合であっても、採用する評価方式及びその内容が合理的であることが必要であることはいうまでもない。そこで、 \n (1)国税鑑定１及び６が第三者間取引事例を用いた取引事例比較法に代えて採用した当事者間取引事例を用いた取引事例比較法、(2)国税鑑定２ないし５が第三者間取引事例を用いた取引事例比較法に代えて採用したいわゆる控除方式について、評価方式及びその内容が合理的であるかを以下検討する。 \n ア 当事者間取引事例を用いた取引事例比較法について借地の所有者と借地人による当事者間取引の場合、取引と同時に混同を生じ、更地復帰が容易となるため、第三者間取引事例と比較して、当該土地の売買価格が高めに設定される傾向にあり、正常価格が指向すべき市場価値から乖離すると考えられることから、取引事例比較法により比準価格を求めるに当たっては、原則として、第三者間取引事例を用いるべきであり、前記のとおり、不動産鑑定評価基準も第三者間取引事例を用いるべきであるとしているものと解される。 \n そして、不動産鑑定評価基準では、取引事例に係る取引に特殊な事情、すなわち、正常価格の前提となる現実の社会経済情勢の下で合理的と考えられる諸条件を欠くに至らしめる事情がある場合には、適切に事情補正を行う必要があるとされているところ、これは、三層構造ではない一般的な借地関係の土地における底地価格を算出するに当たっても、当事者間取引事例を用いる場合には、上記のような特殊な事情があると認められるから、事情補正が必要とする趣旨と解される。そうすると、本件土地１及び６のような三層構造の土地については、一般的な借地関係の土地に比較して更地復帰が格段に困難であるという事情があることにかんがみると、このような三層構造の土地について取引事例比較法により比準価格を求めるに当たって、一般的な借地関係の土地における当事者間取引事例を用いるのであれば、 \n なおのこと正常価格の前提となる現実の社会経済情勢の下で合理的と考えられる諸条件を欠くに至らしめる事情があると認められるのであって、事情補正が不可欠であったというべきである。 \n この点、三層構造の土地に係る第三者間取引が極めて少ないという事情にかんがみると、 \n 国税鑑定１及び６が、第三者間取引事例を用いた取引事例比較法を採用せず、当事者間取引事例を用いた取引事例比較法を採用したこと自体は、首肯し得る余地があるものの（この点、 \n 原告らは、三層構造の土地の場合、一般的な借地関係の土地と異なり、混同による更地化が取引と同時に実現することはあり得ないから、第三者間取引と理論上同等といえるような当事者間取引は存在せず、当事者間取引事例を三層構造の土地を評価するために用いることは不可能である旨主張するが、三層構造の土地であるか、一般的な借地関係の土地であるかにかかわらず、第三者間取引の場合には取引と同時に混同が生じることはあり得ない点に変わりはないのであるから、原告らの主張は採用できない。）、一般的な借地関係の土地における当事者間取引事例を用いているにもかかわらず、何ら事情補正を行うことなく比準価格を算出したことは不適切であるといわざるを得ない。 \n これに対し、被告は、国税鑑定１及び６を行ったＣ鑑定士によれば、取引事例比較法において、当事者間取引事例を用いたことから、事情補正についても検討したが、現実の底地市場において、底地の第三者間取引事例がほとんどないため、補正作業そのものが不可能であるとして、やむなく事情補正を断念したものであり（乙２７の１）、事情補正を行わなかったことに理由がある旨主張するが、前記のとおり、本件土地１及び６が三層構造の土地であるため、本件において事情補正は不可欠であったのであるから、事情補正をする作業が不可能であるならば、当事者間取引事例を用いた取引事例比較法による比準価格の算出自体を断念すべきであったと解される。また、被告は、当事者間取引事例では高めの売買価格が設定されることなども踏まえ、総合的に判断し、比準価格と収益価格との中庸値をもって、それぞれ本件土地１及び６の価格としたものであるとも主張するが、各試算価格はそれぞれ正常価格を指向すべきであるから、各試算価格から評価額を決するに当たり、いかなる総合的判断があったにせよ、比準価格の算出において、上記不可欠な事情補正を行わなかったことを正当化する理由足り得ず、かかる主張は採用できない。 \n イ 控除方式について国税鑑定２ないし５は、取引事例比較法に代えて、更地価格から借地権割合を控除する、 \n いわゆる控除方式を採用しているが、かかる方式は、不動産鑑定評価基準に定められていない。この点、被告は、国税鑑定２ないし５が控除方式を採用した理由として、取引事例比較法を採用できない事情がある上、控除方式が一般的に認められている評価方法であり、底地の定義および総合的勘案事項からすると、不動産鑑定評価基準が示唆する評価方法といえる点をあげている。 \n 確かに、本件土地２ないし５についても、取引事例比較法による算出、特に第三者間取引事例を用いた取引事例比較法による算出は、前記本件土地１及び６と同様、不可能又は著しく困難と認められ、また、控除方式が借地の底地価格を算出する手法として一般的に認められていること自体は被告主張のとおりである。 \n しかしながら、不動産鑑定の合理的な手法といえるためには、鑑定目的に沿った手法でなければならないことはいうまでもないところ、本件土地２ないし５について、本件通達に従った場合には、自用地としての価額から本件相続開始時の借地権割合である３０パーセントを控除することにより、底地の価額を評価することになるが、本件土地２ないし５について、 \n 本件通達に定める評価方式によらないことが正当として是認されるような特別な事情があるとされるのは、これら土地が三層構造の土地であって、土地所有者（底地権者）、宅地開発業者（借地権者）及び建物所有者（転借権者）が存在する複雑な権利関係を有し、一般的な借地関係の土地に比較して更地化が格段に困難であるからにほかならない。そうすると、 \n 国税鑑定の目的は、本件通達に従った場合には、借地権の負担として３０パーセントの借地権割合が控除されることにより評価されるにすぎないが、このような評価が三層構造の土地においても妥当するかを検証する点に本来存したはずであり、ここで採用すべき評価手法は、 \n 本件通達に従った場合の本件相続開始時の借地権割合から離れたものでなければならないというべきである（なお、本件土地１ないし６が存する地域について、本件相続時点では借地権割合３０パーセント、貸宅地割合７０パーセントとされていたのが、平成１７年改正により、これら地域のうち転借権付き住宅として分譲された地域については、貸宅地割合が３ \n ０パーセントと、大きくその割合が変更されていること（甲２、３）からしても、本件土地 \n １ないし６のような三層構造の土地についての従前の借地権割合（貸宅地割合）が適切なものであったかを問題とすべきことは明らかであり、この点からしても本件相続開始時の借地権割合から離れて評価すべき要請は強いといわざるを得ない。）。そうであるにもかかわらず、 \n 国税鑑定２ないし５は、控除方式として、本件相続開始時の借地権割合である３０パーセントを更地価格から控除する方式を採用しており、実質的には、本件通達に従った場合と同様の手法により試算価格を算出しているのであるから、本件通達に従った評価額が適正であったことを検証するに相応しくない、すなわち、鑑定目的に沿わない手法であったといわざるを得ない。 \n また、国税鑑定２ないし５は、上記により求めた価格を試算価格とし、収益還元法により算出した収益価格と関連づけて評価額を決しているが、前記アの当事者間取引事例を用いた取引事例比較法による比準価格の算出に当たり事情補正を行わなかったことと同様、各試算価格はそれぞれ正常価格を指向すべきであるから、各試算価格から評価額を決するに当たり、 \n いかなる総合的判断があったにせよ、鑑定目的に沿わない手法を採用した問題点は解消されるものではない。 \n (3) 収益還元法について不動産鑑定評価基準によれば、底地の鑑定評価額を決する際の収益価格とは、「実際支払賃料に基づく純収益等の現在価値の総和を求めることにより得」た価格とされるところ、国税鑑定１ないし６は、いずれも収益還元法による収益価格を算出するに当たり、実際支払賃料に基づかず、国税鑑定１及び６は、当該土地が存在する地域における適正地代を実査した結果に基づいて推定した当該土地の地代相当額、国税鑑定２は、近隣地域及び同一需給圏内の類似地域における継続賃料の事例資料に基づき、賃料事例比較法を適用して査定した価格、国税鑑定３ないし５は、近隣地域における適正な継続地代にそれぞれ基づいており、上記不動産鑑定評価基準が定める方式に反している。 \n この点について、被告は、国税鑑定士らの意見（乙２７）を引用するなどして、収益価格を算出するに当たり、実際支払賃料が周辺の標準的な賃料に比して著しく低額である場合、適正な地代へと補正をすべきである旨主張する。しかしながら、収益価格から底地の評価額が導かれるのは、底地の買い主が底地を買い受けることにより、収益価格を得ることができるから、 \n その価格で底地の売買代金が決せられるであろうという推測を前提としている。そうである以上、ここにいう収益価格とは、底地の買い主が底地を買い受けることで現に得ることができる価格、すなわち、実際支払賃料に基づいた収益価格を指すというべきである。この点、実際支払賃料が周辺の標準的な賃料に比して低額であるという事情は、将来における賃料の改定の現実性が高く、その程度が大きいものと推測させる一事情として、還元利回り又は割引率の中で斟酌すべきであり、かかる事情をもって、賃料自体を補正するのは相当でない。特に、本件土地１ないし６は、三層構造の土地であり、一般的な借地関係の土地に比較して、底地の所有者が取得できる収益が少ない状態に置かれることが常態であると考えられるのであるから、周辺の標準的な賃料に基づいて収益価格を算出することが尚更相当でないことは明らかである。なお、被告は、Ｅ鑑定士の意見を引用し、仮に底地の所有者が亡くなるおそれがある場合に地代を半分に値下げしたような場合、地代の補正を行わずに地代徴収権の経済的価値を求めるほかなく、更地の復帰可能性も認めないとすれば、国税の課税根拠を求めることができない旨の主張もするが、本件において、本件相続開始を見越して賃料が引き下げられたような事情はうかがわれず、その主張は前提を欠くものとして失当といわざるを得ない。 \n (4) 以上によれば、国税鑑定１及び６は、第三者間取引事例を用いた取引事例比較法による比準価格を算出するに当たり、必要な事情補正を行っていない点、国税鑑定２ないし５は、本件相続開始時の借地権割合である３０パーセントを更地価格から控除する控除方式を採用している点でそれぞれ不適切である上、国税鑑定１ないし６は、いずれも収益還元法による収益価格を算出するに当たり、実際支払賃料に基づいていない点で不適切であり、本件土地１ないし \n ６の時価として、国税鑑定が評価した額は、いずれも適切とはいえない。 \n 他方、Ｂ鑑定は、第三者間取引事例を用いた取引事例比較法により比準価格を算出しているものの、比準価格を算出する基礎となった事例は１事例のみであり、地域要因や個別的要因の比較を行って得られた価格を比較考量することができないのであるから、やはり不動産鑑定評価基準に従った鑑定とはいえない。また、かかる事例について、補正すべき事情の存在がうかがわれるにもかかわらず（乙３７ないし３９）、Ｂ鑑定が何ら補正をしていないことにも問題がある（なお、原告らは、第三者間取引が極端に少ないため、補正の前提となる適正な価格水準を把握することが困難であるなどとして、補正をしなかった理由を説明するが、ここで求められる補正とは、適正な価格を算出する前提として、個々の取引事例の事情に応じた補正を施すことであり、適正な価格水準が把握できないからといって補正をしない合理的な理由とはならない上、取引事例の事情に応じた補正さえ行うことができないのであれば、そもそも比準価格の算出に当たって用いるべき事例ではないと解される。）。さらに、Ｂ鑑定は、収益還元法により収益価格を算出するに当たり、本件土地１ないし６のうち、土地上の建物数が多い土地について、これが少ない土地に比較して、更地の復帰が遅れることが予想されるのであるから、 \n 本来は、還元利回りを減算することで、収益価格を増算しなければならないにもかかわらず、 \n 還元利回りを増算しており、明らかな誤りがある。したがって、Ｂ鑑定による評価額は、本件各土地の時価として採用できない。 \n 結局、本件土地１ないし６については、本件通達に定める評価方式によらないことが正当として是認されるような特別な事情があるから、本件通達に定める評価方式に従った評価ができない上、被告が主張する国税鑑定による評価、原告らが主張するＢ鑑定による評価のいずれも適切であるとはいえず、採用することができないことに帰するところ、そうである以上、本件土地１ないし６の本件相続開始時点の時価についての立証責任を負う被告による同時価の立証がされていないものというほかなく、原告らが認める限度、すなわち、原告ら主張の時価を基準とするほかない。 \n ６ 結論以上検討した結果によれば、本件各土地の時価は、別紙「本件更正処分等の経緯」中の「認定額」欄記載の本件各土地に係る認定額のとおりとなる。そして、本件相続財産のうち、本件各土地の時価以外の点は、当事者間に争いがない。そうすると、本件処分のうち、取り消すべき相続税額及び過少申告加算税額は、別紙「本判決により取り消すべき税額」中の［Ｂ本判決後の額」 \n 欄記載の「納付すべき税額」及び「加算税の額」欄記載の額をそれぞれ超える部分となる。したがって、原告らの請求は、上記判示の限度で理由があるから認容し、原告らのその余の請求は、 \n 理由がないので棄却することとする。 \n よって、主文のとおり判決する。 \n 那覇地方裁判所民事第１部裁判長裁判官 田中 健治裁判官 新海 寿加子裁判官 横倉 雄一郎別紙物件目録 \n １ 本件土地１ \n (1) 本 件土地１－Ａ所 在 沖縄県宜野湾市地 番地 目 田地 積 ２０８平方メートル \n (2) 本件土地１－Ｂ所 在 沖縄県宜野湾市地 番地 目 田地 積 １３１平方メートル \n (3) 本件土地１－Ｃ所 在 沖縄県宜野湾市地 番地 目 田地 積 １７６平方メートル \n ２ 本件土地２所 在 沖縄県宜野湾市地 番地 目 畑地 積 １３８８平方メートル \n ３ 本件土地３所 在 沖縄県宜野湾市地 番地 目 畑地 積 ８６６平方メートル \n ４ 本件土地４所 在 沖縄県宜野湾市地 番地 目 原野、畑地 積 ８３６平方メートル、５０９平方メートル、１７５平方メートル \n ５ 本件土地５所 在 沖縄県宜野湾市地 番地 目 原野地 積 ４０８平方メートル \n ６ 本件土地６所 在 沖縄県宜野湾市地 番地 目 原野地 積 １６８３平方メートル \n ７ 本件土地７所 在 沖縄県宜野湾市地 番地 目 宅地地 積 ５１４．７６平方メートル \n ８ 本件土地８所 在 沖縄県浦添市地 番地 目 畑地 積 １５６０平方メートル \n ９ 本件土地９所 在 沖縄県浦添市地 番地 目 宅地地 積 ７７４．９９平方メートル以上別紙遺産分割目録 \n １．相続人甲取得分 \n (1) 所 在 宜野湾市地 番地 目 宅地地 積 ７４．７３㎡ \n (2) 所 在 宜野湾市地 番地 目 宅地地 積 ９６２．１６㎡ \n (3) 所 在 宜野湾市地 番地 目 畑地 積 ５４㎡ \n (4) 所 在 宜野湾市地 番地 目 田地 積 ２０８㎡ \n (5) 所 在 宜野湾市地 番地 目 田地 積 １３１㎡ \n (6) 所 在 宜野湾市地 番地 目 田地 積 １７６㎡ \n (7) 所 在 宜野湾市地 番地 目 畑地 積 ３５５㎡ \n (8) 所 在 宜野湾市地 番地 目 畑地 積 １３３８㎡ \n (9) 所 在 宜野湾市地 番地 目 畑地 積 ８６６㎡ \n (10) 所 在 宜野湾市地 番地 目 墓地地 積 ５０９㎡ \n (11) 所 在 宜野湾市地 番地 目 原野地 積 ４２０㎡ \n (12) 所 在 宜野湾市地 番地 目 原野地 積 ４０８㎡ \n (13) 所 在 宜野湾市地 番地 目 原野地 積 ８３６㎡ \n (14) 所 在 宜野湾市地 番地 目 畑地 積 ５０９㎡ \n (15) 所 在 宜野湾市地 番地 目 原野地 積 １７５㎡ \n (16) 所 在 宜野湾市地 番地 目 畑地 積 ２６７㎡ \n (17) 所 在 宜野湾市地 番地 目 原野地 積 １６８３㎡ \n (18) 所 在 中頭郡地 番地 目 畑地 積 ３５０６㎡ \n (19) 所 在 浦添市地 番地 目 畑地 積 １５６０㎡ \n (20) 所 在 浦添市地 番地 目 原野地 積 １５０５㎡ \n (21) 所 在 浦添市地 番地 目 原野地 積 ３１０㎡ \n (22) 所 在 沖縄市地 番地 目 雑種地地 積 ６４７㎡ \n (23) 所 在 宜野湾市地 番地 目 畑地 積 ３７４㎡（持分２分の１） \n (24) 所 在 宜野湾市地 番地 目 畑地 積 ３４８㎡（持分２分の１） \n (25) 所 在 宜野湾市 （未登記） \n 家屋番号種 類 居宅構 造 木造床面積 ６８．５９㎡ \n (26) 所 在 宜野湾市家屋番号建物の名称 Ｇ種 類 居宅構 造 鉄筋コンクリートブロック造陸屋根平屋建床面積 ８５．２８㎡ \n (27) 所 在 宜野湾市家屋番号種 類 工場構 造 コンクリートブロック造亜鉛メッキ鋼板葺平屋建床面積 ７１．０６㎡ \n (28) 所 在 宜野湾市家屋番号種 類 居宅構 造 鉄筋コンクリートブロック造陸屋根２階建床面積 １階 ３９．５１㎡ \n ２階 ４６．８８㎡ \n (27) 出資金 Ｈ農業協同組合 ３７口 \n (28) 現金２９７３万３５８５円 \n (29) 普通預金 Ｉ銀行真栄原支店口座番号 \n (31) 電話加入権 \n ２．相続人乙取得分 \n (1) 所 在 浦添市地 番地 目 宅地地 積 １０９６㎡ \n (2) 所 在 浦添市地 番地 目 宅地地 積 ７７４．９９㎡ \n (3) 所 在 宜野湾市地 番地 目 宅地地 積 ２１１．２２㎡ \n (4) 現金 １４００万円 \n ３．相続人丙取得分 \n (1) 所 在 宜野湾市地 番地 目 宅地地 積 ５１４．７６㎡ \n (2) 所 在 浦添市家屋番号種 類 共同住宅構 造 鉄筋コンクリートブロック造陸屋根２階建床面積 １階 １７４．７２㎡ \n ２階 １７４．７２㎡ （持分２分の１） \n (3) 現金 ６００万円 \n ４．相続人丁取得分 \n (1) 所 在 宜野湾市地 番地 目 宅地地 積 ４３９．１７㎡ \n (2) 所 在 宜野湾市地 番地 目 畑地 積 ８４㎡ \n (3) 所 在 宜野湾市地 番地 目 原野地 積 １８３㎡ \n (4) 所 在 宜野湾市地 番地 目 宅地地 積 ４９６．６２㎡（持分２分の１） \n (5) 所 在 宜野湾市地 番地 目 畑地 積 ３７４㎡ （持分２分の１） \n (6) 所 在 宜野湾市地 番地 目 畑地 積 ３４８㎡ （持分２分の１） \n (7) 現金 １２００万円 \n ５．相続人戊取得分 \n (1) 所 在 浦添市地 番地 目 宅地地 積 ７９４．２５㎡ \n (2) 所 在 宜野湾市地 番地 目 宅地地 積 ４９６．６２㎡ （持分２分の１） \n (3) 現金 ７００万円以上別紙 本件更正処分等の経緯更正処分額 訴え提起額異議決定額 裁決額 認定額区分 申告額 (括弧書は更正処分に (括弧書は異議決定に (括弧書は裁決により (平成20年7月7日付け訴 (括弧書は判決によりより新たに納付すべ え変更後のもの)(括弧書き本税の額)より取り消された額) 取り消された額)は取消しを求める額)取り消すべき額) \n \\122,372,100 \\120,763,200 \\113,692,600 \\91,152,700 \\96,686,500本税 \\25,599,100 \n (\\96,773,000) (\\1,608,900) (\\7,070,600) (\\22,539,900) (\\17,006,100)原告甲 \n \\13,235,500 \\12,994,000 \\11,933,500 本税に対応する過少申告 \\9,382,000加算税 \n (\\241,500) (\\1,060,500) 加算税額を超える部分 (\\2,551,500) \n \\31,606,000 \\31,470,400 \\31,284,700 \\29,311,100 \\29,995,900本税 \\13,600,100 \n (\\18,005,900) (\\135,600) (\\185,700) (\\1,973,600) (\\1,288,800)原告乙 \n \\2,020,000 \\2,000,500 \\1,972,000 本税に対応する過少申告 \\1,778,500加算税納 (\\19,500) (\\28,500) 加算税額を超える部分 (\\193,500)付 \\14,812,900 \\14,749,400 \\14,565,800 \\9,957,500 \\14,053,700す 本税 \\5,113,500 \n (\\9,699,400) (\\63,500) (\\183,600) (\\4,608,300) (\\512,100)原告丙 べき \\1,198,000 \\1,189,000 \\1,161,500 本税に対応する過少申告 \\1,085,000加算税税 (\\9,000) (\\27,500) 加算税額を超える部分 (\\76,500)額 \n \\31,664,600 \\30,664,900 \\30,274,100 \\28,562,400 \\29,220,600本税 \\12,758,400 \n (\\18,906,200) (\\999,700) (\\390,800) (\\1,711,700) (\\1,053,500)原告丁 \n \\2,197,000 \\2,047,000 \\1,988,500 本税に対応する過少申告 \\1,831,000加算税 \n (\\150,000) (\\58,500) 加算税額を超える部分 (\\157,500) \n \\30,382,200 \\30,251,900 \\29,878,600 \\28,188,100 \\28,823,100本税 \\6,214,600 \n (\\24,167,600) (\\130,300) (\\373,300) (\\1,690,500) (\\1,055,500)原告戊 \n \\3,313,500 \\3,294,000 \\3,238,000 \\3,079,500本税に対応する過少申告加算税 \n (\\19,500) (\\56,000) 加算税額を超える部分 (\\158,500)本件土地１ \\1,477,000 \\13,801,153 \\13,801,153 \\15,798,000 \\6,100,000 \\6,100,000本件土地２ \\3,572,000 \\38,300,000 \\38,300,000 \\30,324,000 \\23,000,000 \\23,000,000本件土地３ \\1,963,000 \\31,314,000 \\31,314,000 \\25,233,000 \\16,500,000 \\16,500,000本件土地４ \\4,405,000 \\57,320,000 \\57,320,000 \\50,708,000 \\37,500,000 \\37,500,000本件土地５ \\1,017,000 \\5,095,487 \\5,095,487 \\12,734,000 \\4,460,000 \\4,460,000本件土地６ \\5,529,000 \\51,430,000 \\51,430,000 \\41,214,000 \\36,900,000 \\36,900,000本件土地７ \\24,554,000 \\47,810,908 \\47,810,908 \\47,810,908 \\32,500,000 \\47,810,908本件土地８ \\8,263,000 \\76,435,092 \\75,605,637 \\75,605,637 \\61,900,000 \\75,605,637本件土地９ \\42,004,000 \\75,291,828 \\75,291,828 \\76,031,548 \\75,291,828 \\75,291,828 \n 別表１－１ 課税価格等の計算明細表（更正処分額） \n （単位：円） \n 各人の金額順号 区分 合計原告甲 原告乙 原告丙 原告丁 原告戊 \n 1 土 地 等 791,766,226 425,164,840 104,722,423 47,810,908 106,942,947 107,125,108 \n 2 家 屋 、 構 築 物 6,120,584 4,560,800 1,559,784 \n 3 有 価 証 券 370,000 370,000財 \n 4 産 現 金 、 預 貯 金 等 71,401,964 32,130,121 14,000,000 6,271,843 12,000,000 7,000,000 \n 5 そ の 他 の 財 産 27,000 27,000 \n 31合 計 \n 869,685,774 452,252,761 118,722,423 55,642,535 118,942,947 114,125,108 \n （ 取 得 財 産 の 価 額 ） \n 7 債 務 等 2,585,150 2,585,150差 引 純 資 産 価 額 \n 8 867,100,624 459,667,611 118,722,423 55,642,535 118,942,947 114,125,108 \n （ 順 号 ６ － 順 号 ７ ） \n 相 続 税 の 課 税 価 額 \n 9 867,098,000 459,667,000 118,722,000 55,642,000 118,942,000 114,125,000 \n （ 千 円 未 満 切 捨 て ） \n 10 遺 産 に 係 る 基 礎 控 除 額 100,000,000 （50,000,000＋10,000,000×５）－100,000,000課 税 遺 産 総 額 \n 11 767,098,000 \n （ 順 号 ９ － 順 号 1 0 ） \n 1 1 1 1 1 1 \n 12 法 定 相 続 分 の 割 合 \n 1 5 5 5 5 5法 定 相 続 分 に 応 ず る 取 得 金 額 \n 13 767,095,000 153,419,000 153,419,000 153,419,000 153,419,000 153,419,000 \n （順号11×順号12（1,000円未満切捨て）） \n 相 続 税 の 総 額 の 基 と な る 税 額 \n 14 46,167,600 46,167,600 46,167,600 46,167,600 46,167,600 \n （ 順 号 1 3 × 税 率 ） \n 15 相 続 税 の 総 額 230,838,000あ ん 分 割 合 \n 16 1 0.5301211628 0.1359187797 0.0641703706 0.1371724995 0.1316171874 \n （各人の課税価格＋課税価格の合計額） \n 各 人 の 相 続 税 額 \n 17 230,838,000 122,372,109 31,606,057 14,812,960 31,664,626 30,382,248 \n （ 順 号 1 5 × 順 号 1 6 ） \n 18 税 額 控 除 額 0 0 0 0 0 0納 付 す べ き 相 続 税 額 \n 19 230,837,800 122,372,100 31,606,000 14,812,900 31,664,600 30,382,200 \n （ 1 0 0 未 満 切 捨 て ） \n 納 付 す べ き 相 続 税 額 \n 20 63,285,700 25,599,100 13,600,100 5,113,500 12,758,400 6,214,600 \n （ 当 初 申 告 額 ） \n 増 減 （ △ ） 差 額 \n 21 167,552,100 96,773,000 18,005,900 9,699,400 18,906,200 24,167,600 \n （ 順 号 1 9 － 順 号 2 0 ） \n 過 少 申 告 加 算 税 \n 22 16,752,000 9,677,000 1,800,000 969,000 1,890,000 2,416,000 \n （ 通 則 法 6 5 条 １ 項 ） \n 過 少 申 告 加 算 税 \n 23 5,212,000 3,558,500 220,000 229,000 307,000 897,500 \n （ 通 則 法 6 5 条 ２ 項 ） \n 過 少 申 告 加 算 税 \n 24 21,964,000 13,235,500 2,020,000 1,198,000 2,197,000 3,313,500 \n （ 順 号 2 2 ＋ 順 号 2 3 ） \n 別表１－２ 土地等の明細（更正処分額） （単位：円） \n 順号 財産の種類等 数量 合計金領 相続人ら種類 所在地等 （㎡） （円） 原告甲 原告乙 原告丙 原告丁 原告戊 \n 1 土地（畑） 宜野湾市 54.00 1,117,216 1,117,216 \n 2 土地（畑） 宜野湾市 267.00 11,889,563 14,889,563 \n 3 土地（畑） 3,506.00 3,373,463 3,373,463 \n 4 小計 16,380,242 16,380,242 0 0 0 0 \n 5 土地（宅地） 浦添市 1,096.00 9,137,000 9,137,000 \n 6 土地（宅地） 浦添市 794.25 83,034,072 83,034,072 \n 7 土畑（宅地） ※ 浦添市 774.99 75,291,828 75,291,828 \n 8 土地（宅地） ※ 浦添市 1,560.00 76,435,092 76,435,092 \n 9 土地（宅地） 宜野湾市 496.62 48,182,072 24,091,036 24,091,036 \n 10 土地（宅地） 宜野湾市 211.22 20,293,595 20,293,595 \n 11 土地（宅地） 宜野湾市 74.73 5,437,055 5,437,055 \n 12 土地（宅地） ※ 宜野湾市 514.76 47,810,908 47,810,908 \n 13 土地（宅地） 宜野湾市 962.16 61,511,850 61,511,850 \n 14 土地（宅地） 宜野湾市 439.17 31,960,157 31,960,157 \n 15 土地（宅地） 宜野湾市 267.00 23,829,750 23,829,750 \n 16 土地（宅地） ※ 宜野湾市 515.00 13,801,153 13,801,153 \n 17 土地（宅地） ※ 宜野湾市 1,321.00 38,300,000 38,300,000 \n 18 土地（宅地） 宜野湾市 405.53 17,645,957 17,645,957 \n 19 土地（宅地） ※ 宜野湾市 866.00 31,314,000 31,314,000 \n 20 土地（宅地） ※ 宜野湾市 408.00 5,095,487 5,095,487 \n 21 土地（宅地） ※ 宜野湾市 1,520.00 57,320,000 57,320,000 \n 22 土地（宅地） ※ 宜野湾市 1,683.00 51,430,000 51,430,000 \n 23 土地（宅地） 沖縄市 351.00 19,656,000 19,656,000 \n 24 小計 717,485,976 377,946,594 104,722,423 47,810,908 79,880,943 107,125,108 \n 25 土地（原野） 浦添市 1,815.00 3,776,000 3,776,000 \n 26 土地（原野） 宜野湾市 722.00 54,124,008 27,062,004 27,062,004 \n 27 土地（墓地、原野）宜野湾市 929.00 0 0 \n 28 小計 57,900,008 30,838,004 0 0 27,062,004 0 \n 29 合計 791,766,226 425,164,840 104,722,423 47,810,908 106,942,947 107,125,108 \n （注）「所在地等」欄の※印の土地は、係争各土地である。 \n 別表１－３ 家屋、構築物の明細 \n （単位：円） \n 順号 所在地等 面積（㎡） 価額 原告甲 原告丙 \n 1 浦添市 349.44 1,559,784 0 1,559,784 \n 2 宜野湾市 68.59 247,034 247,034 0 \n 3 宜野湾市 119.24 4,313,766 4,313,766 0 \n 4 合計 6,120,584 4,560,800 1,559,784別表１一４ 有価証券の明細 \n （単位：株、円） \n 順号 銘柄等 数量 単価 価額 原告丙 \n 1 その他の出資 370 1,000 370,000 370,000 \n 2 合計 370,000 370,000別表１－５ 現金、預貯金等の明細（更正処分額） \n （単位：株、円） \n 順号 預金種別 金融機関等 価額 原告甲 原告乙 原告丙 原告丁 原告戊 \n 1 現金 14,000,000 14,000,000 \n 2 現金 6,000,000 6,000,000 \n 3 現金 12,000,000 12,000,000 \n 4 現金 7,000,000 7,000,000 \n 5 現金 29,733,585 29,733,585 \n 6 普通預金 Ｉ銀行真栄原支店 973,966 973,966 271,843 \n 7 普通預金 Ｈ農業協同組合 1,422,570 1,422,570 \n 8 合計 71,401,964 32,130,121 14,000,000 6,271,843 12,000,000 7,000,000別表１－６ その他の財産の明細 \n （単位：円） \n 順号 内訳 価額 原告甲 \n １ 電話加入権 27,000 27,000 \n ２ 合計 27,000 27,000別表１－７ 債務等の明細 \n （単位：円） \n 順号 種類 金類 原告甲 \n １ Ｊ 568,000 \n ２ Ｋ 144,350 \n ３ Ｌ 150,150 2,585,150 \n ４ Ｍ 150,150 \n ５ その他 1,572,500 \n ６ 合計 2,585,150 2,585,150別表１ 課税価格に算入される本件土地の価額の計算表（土地７ないし土地９） \n 二路線及び三 ⑫ ⑰財産の種類等 ①上段 間口 奥行 路線価(円) 奥行価格補正率 路線に接する ⑩ ⑪ 著し 自用地宅地1平方メートル当たりの価額(円) ⑯ 借地権割 相続税総地積 距離 距離 宅地の加算率 不整 無道路 い利 自用宅地 合控除後 評価額順号 下段 形地 の評価額評価地積 ② ③ ④ ⑤ ⑥ ⑦ ⑧ ⑨ 補正 地補正 用価 ⑬ ⑭ ⑮ (⑮×①下 の割合 ⑯×⑰×⑫備考 種類 所在地番 (㎡) (m) (m) 正面 側方 裏面 ②に対③に対④に対③に対④に対 率 率 値の 加算 加算後の 減算 減算後の補正後の 段)(円) (底地 (円)する率する率する率する率する率 低下 価額(円) 価額(円)価額(円) 割合)相 \n 1 評 \n ②×⑤＋（③ \n 514.76土地７ 宜野湾市 24.0 21.4 86,000 86,000 86,000 1.00 1.00 1.00 0.05 0.03 ×⑥×⑧）＋ 92,880 92,880 47,810,908 1.0 47,810,908 514.76 \n （④×⑦×⑪） \n 相 \n 2 評 \n 0.05 \n 1560.00 ②×⑤＋（③浦添市（Ａ画地） 14.7 6.2 100,000 100,000 0.95 1.00 ×5.4 0.94 0.90 98,375⑬×⑩ 92,472 92,472 8,401,081 0.7 5,292,680 90.85 ×⑥×⑧） \n /8相 1560.00 ②×⑤＋（③ \n 3 評 浦添市（Ｂ画地） 184.14 15.6 11.8 100,000 100,000 1.00 1.00 0.05 ×⑥×⑧） 105,000 105,000 19,334,700 0.7 13,534,290相 \n 4 評 \n 1560.00 ②×⑤＋（③浦添市（Ｃ画地） 15.5 14.5 100,000 100,000 1.00 1.00 0.05 105,000 105,000 22,789,200 0.7 15,952,440 217.04 ×⑥×⑧） \n 相 \n 5 評 \n 1560.00浦添市（Ｄ画地） 11.0 16.7 100.000 1.00 0.96 ②×⑥×⑩ 96,000 96,000 16,564,800 0.7 11,595,360 172.85相 \n 6 評 \n 1560.00浦添市（Ｅ画地） 9.0 22.3 100,000 1.00 0.94 ②×⑥×⑩ 94,000 94,000 19,050,040 0.7 13,335,028 802.65土地８相 1560.00 \n 7 評 浦添市（Ｆ画地） 200.05 13.0 15.4 100,000 1.00 0.98 ②×⑥×⑩ 98,000 98,000 19,604,900 0.7 13,723,430相 1560.00 \n 8 評 浦添市（Ｇ画地） 34.75 12.8 2.7 100,000 0.90 0.88 0.90 ②×⑥×⑩ 79,200 79,200 2,752,200 0.7 1,733,686相 1560.00 \n 9 評 浦添市（Ｈ画地） 9.79 10.8 0.9 100,000 0.90 0.79 0.90 ②×⑥×⑩ 71,100 71,100 696,069 0.7 438,523相 浦添市 1560.00 不特定多数の者の通行の用に供されていることから評価 \n 10 評 （Ｉ画地・私道） 448.17 しない(評価通達24) 0 0小 1560.00 \n 11 計 浦添市 1560.00 76,605,637相 774.99 \n 12 評 土地９ 浦添市 774.99 11.5 35.0 110,000 0.96 0.92 ②×⑥×⑩ 97,152 97,152 75,291,828 1.0 75,291,828 \n 別表２－１ 課税価格に算入される本件土地の価額の計算表（土地１及び２） \n 二路線及び三 ⑬ ⑭ ⑲財産の種類等 ①上段 間口 奥行 路線価(千円) 奥行価格補正率 路線に接する ⑩ ⑪ 宅地 著し 自用地宅地1平方メートル当たりの価額(円) ⑱ 借地権割 相続税総地積 距離 距離 宅地の加算率 不整 無道路 ⑫ 造成 い利 自用宅地 合控除後 評価額順号 下段 形地 の評価額評価地積 ② ③ ④ ⑤ ⑥ ⑦ ⑧ ⑨ 補正 地補正 私道 費 用価 ⑮ ⑯ ⑰ (⑰×①下 の割合 ⑱×⑲×⑭備考 種類 所在地番 (㎡) (m) (m) 正面 側方 裏面 ②に対③に対④に対③に対④に対 率 率 (円/ 値の 加算 加算後の 減算 減算後の補正後の 段)(円) (底地 (円)する率する率する率する率する率 ㎡) 低下 価額(円) 価額(円)価額(円) 割合)相 \n 1 評宜野湾市 208.00 ②×⑤×⑩ \n 2.0 28.6 81,000 0.98 0.63 0.76989 38,501 38,501 5,638,086 0.7 3,946,660 （１－Ａ１画地） 146.44 ×⑪相 \n 2 評宜野湾市 208.00 ②×⑤×⑩ \n 2.0 31.0 81,000 0.98 0.60 0.61849 29,457 29,457 1,181,814 0.7 827,269 （１－Ａ２画地） 40.12 ×⑪相 \n 3 評土地 \n １－Ａ 宜野湾市 208.00 不特定多数の者の通行の用に供されていることから評価 \n 0 0 （１－Ａ３画地） 21.44 しない（評価通達24） \n 1-A 208.00 \n 4 宜野湾市 4,773,929計 208.00相 \n 5 評土地 131.00 ②×⑤×⑩宜野湾市 2.0 19.0 81,000 1.00 0.67 0.89746 48,705 48,705 5,380,366 0.7 4,466,248 １－Ｂ 131.00 ×⑪相 \n 6 評宜野湾市 176.00 \n 5.4 1.3 81,000 0.90 0.77 ②×⑤×⑩ 56,133 56,133 362,266 0.7 267,585 （１－Ｃ１画地） 6.81相 \n 7 評宜野湾市 176.00 \n 16.2 5.8 81,000 0.92 0.88 ②×⑤×⑩ 65,577 65,577 6,133,416 0.7 4,293,391 土地 （１－Ｃ２画地） 93.53相 １－Ｃ 宜野湾市 176.00 不特定多数の者の通行の用に供されていることから評価 \n 8 評 （１－Ｃ３画地） 75.66 しない（評価通達24） 0 0 \n 1-C 176.00 \n 9 宜野湾市 4,600,976計 176.00小 516.00 \n 10 計土地１ 宜野湾市 \n 516.00 \n 13,801,163鑑 土地 208.00 ①（比準価格）②（収益価格）③（規準価格）④（標準価格）比準価格を重視（底地収益価格）（底地比準価格） （底地価格） \n 11 定 １－Ａ 宜野湾市 208.00 114,000 72,000 116,000 114,000 （6,510,000 ＋ 10,260,000）÷２ ≒ 8,380,000円 22,460,000 0.373 8,380,000鑑 土地 131.00 ①（比準価格）②（収益価格）③（規準価格）④（標準価格） （底地収益価格）（底地比準価格） （底地価格） \n 12 定 １－Ｂ 宜野湾市 131.00 114,000 72,000 116,000 114,000 （3,610,000 ＋ 6,460,000）÷２ ≒ 5,030,000円 14,140,000 0.373 5,030,000鑑 土地 176.00 ①（比準価格）②（収益価格）③（規準価格）④（標準価格） （底地収益価格）（底地比準価格） （底地価格） \n 13 定 １－Ｃ 宜野湾市 176.00 114,000 72,000 116,000 114,000 （4,190,000 ＋ 5,950,000）÷２ ≒ 5,070,000円 13,040,000 0.373 5,070,000小 \n 14 計土地１ 宜野湾市 515.00 18,480,000相 宜野湾市 1183.22 \n 15 評 （Ａ画地） 512.97 14.5 24.0 77,000 1.00 0.86 ②×⑤×⑩ 65,450 65,450 33,573,886 0.7 23,501,720相 宜野湾市 1183.22 \n 16 評 （Ｂ画地） 484.65 7.5 29.5 74,000 0.98 0.89 ②×⑤×⑩ 64,542 64,542 31,280,280 0.7 21,896,196相 \n 17 評宜野湾市 1183.22 \n 2.0 6.5 74,000 0.95 0.71 ②×⑤×⑩ 49,913 49,913 1,865,747 0.7 1,306,022 （Ｃ画地） 37.38相 \n 18 評宜野湾市 1183.22 ②×⑤×⑩ \n 7.5 19.8 77,000 1.00 0.79 0.30 18,249 18,249 2,704,866 0.7 1,893,406 （Ｄ画地・私道） 148.22 ×⑫小 \n 19 計土地２ \n 1183.22宜野湾市 48,597,344 1183.22鑑 \n 20 定 \n （比準価格） （個別格差） （収益価格）（控除方式） （底地価格） \n 宜野湾市 1321.00 \n 14.5 24.0 86 80,300,000 0.462 37,098,600 （1,388㎡の内） 1035.00 90,200 × ×①下段 ≒ 80,300,000（更地価格） （18,500円 ＋39,500円）÷２ ≒ 29,000円 \n （比準価格） （個別格差） （収益価格）（控除方式） （底地価格） \n 鑑 土地２ 宜野湾市 1321.00 \n 21 定 （1,388㎡の内） 286.00 14.5 24.0 90,200 × 10 （道路敷）×①下段 ≒2,580,000（更地価格） （18,500円 ＋39,500円）÷２ ≒ 29,000円 2,580,000 0.462 1,191,960小 宜野湾市 1321.00 \n 22 計 （1,388㎡の内） 1321.00 38,300,000 \n 別表２－２ 課税価格に算入される本件土地の価額の計算表（土地３及び４） \n 二路線及び三 ⑬ ⑭ ⑲財産の種類等 ①上段 間口 奥行 路線価(千円) 奥行価格補正率 路線に接する ⑩ ⑪ 宅地 著し 自用地宅地1平方メートル当たりの価額(円) ⑱ 借地権割 相続税総地積 距離 距離 宅地の加算率 不整 無道路 ⑫ 造成 い利 自用宅地 合控除後 評価額順号 下段 形地 の評価額評価地積 ② ③ ④ ⑤ ⑥ ⑦ ⑧ ⑨ 補正 地補正 私道 費 用価 ⑮ ⑯ ⑰ (⑰×①下 の割合 ⑱×⑲×⑭備考 種類 所在地番 (㎡) (m) (m) 正面 側方 裏面 ②に対③に対④に対③に対④に対 率 率 (円/ 値の 加算 加算後の 減算 減算後の補正後の 段)(円) (底地 (円)する率する率する率する率する率 ㎡) 低下 価額(円) 価額(円)価額(円) 割合)相 \n 1 評宜野湾市 866.00 \n 8.8 16.6 77,000 1.00 0.88 ②×⑤×⑩ 67,760 67,760 11,008,967 0.7 7,706,276 （Ａ画地） 162.47相 \n 2 評宜野湾市 866.00 \n 7.0 25.2 77,000 0.99 0.89 ②×⑤×⑩ 67,844 67,844 27,622,006 0.7 19,336,404 （Ｂ画地） 407.14相 \n 3 評宜野湾市 866.00 ②×⑤×⑩ \n 2.0 27.0 77,000 0.99 0.73 0.92077 51,238 51,238 12,528,715 0.7 8,770,100 （Ｃ画地） 244.52 ×⑪相 \n 4 評宜野湾市 866.00 \n － － 77,000 1.00 0.30 ②×⑤×⑩ 23,100 23,100 1,198,197 0.7 838,737 （Ｄ画地・私道） 51.87小 \n 5 計土地３ \n 866.00宜野湾市 36,650,517 866.00鑑 \n 6 定 \n （標準単価）（個別価格） （収益価格） （控除方式） （底地価格） \n 宜野湾市 866土地３ 9.8 16.6 932 70,793,000 0.442 31,314,000 （866㎡の内） 814.13 93,300 × ×① ≒70,793,000（更地価格） （18,027,000円＋44,600,000円）÷２≒31,314,000 \n 1000相 宜野湾市 1520.00 \n 7 評 （Ａ画地） 279.04 3.5 16.3 77,000 1.00 0.81 ②×⑤×⑩ 62,370 62,370 17,403,724 0.7 12,182,606相 宜野湾市 1520.00 \n 8 評 （Ｂ画地） 297.88 15.0 19.9 77,000 1.00 0.94 ②×⑤×⑩ 72,380 72,380 21,560,554 0.7 16,092,387相 宜野湾市 1520.00 \n 9 評 （Ｃ画地） 204.72 17.6 11.7 77,000 1.00 0.92 ②×⑤×⑩ 70,840 70,840 14,502,364 0.7 10,151,654相 宜野湾市 1520.00 \n 10 評 土地４ （Ｄ画地） 98.71 6.0 15.5 77,000 1.00 0.79 ②×⑤×⑩ 60,830 60,830 6,004,529 0.7 4,203,170相 宜野湾市 1520.00 \n 11 評 （Ｅ画地・私道） 139.30 4.5 30.95 77,000 1.00 0.30 ②×⑤×⑫ 23,100 23,100 3,217,830 0.7 2,262,481相 宜野湾市 1520.00 ②×⑤×⑩ \n 12 評 （Ｆ画地・裸地） 500.35 31.0 16.1 77,000 1.00 0.78 16,520 －⑬ 43,540 43,540 21,785,239 1.0 21,786,239小 1520.00 \n 13 計 宜野湾市 1520.00 65,667,637鑑 14 定 \n （標準単価）（個別格差） （収益価格） （控除方式） （底地価格） \n 宜野湾市 1520.00 96 77,745,000 0.446 (836㎡)敷地部分868㎡ 868.00 93,300 × ×① ≒77,745,000（更地価格） （20,354,000円＋48,979,000円）÷２≒34,667,000円鑑 \n 15 定 \n 34,667,000宜野湾市 1520.00既存道路部分ゼロ評価 0 (175㎡)既存道路150㎡ 175.00鑑 16 定 \n 3.5 16.3土地４ \n （標準単価）（個別格差） \n 宜野湾市 1520.00 95 22,653,000 1.0 22,653,000 (509㎡)敷地部分502㎡ 502.00 47,500 × ×① ≒ 22,653,000（底地価格） \n 小 1520.00 \n 17 計 宜野湾市 1520.00 57,320,000 \n 別表２－３ 課税価格に算入される本件土地の価額の計算表（土地５及び６） \n 二路線及び三 ⑬ ⑭ ⑲財産の種類等 ①上段 間口 奥行 路線価(千円) 奥行価格補正率 路線に接する ⑩ ⑪ 宅地 著し 自用地宅地1平方メートル当たりの価額(円) ⑱ 借地権割 相続税総地積 距離 距離 宅地の加算率 不整 無道路 ⑫ 造成 い利 自用宅地 合控除後 評価額順号 下段 形地 の評価額評価地積 ② ③ ④ ⑤ ⑥ ⑦ ⑧ ⑨ 補正 地補正 私道 費 用価 ⑮ ⑯ ⑰ (⑰×①下 の割合 ⑱×⑲×⑭備考 種類 所在地番 (㎡) (m) (m) 正面 側方 裏面 ②に対③に対④に対③に対④に対 率 率 (円/ 値の 加算 加算後の 減算 減算後の補正後の 段)(円) (底地 (円)する率する率する率する率する率 ㎡) 低下 価額(円) 価額(円)価額(円) 割合)相 \n 1 評宜野湾市 408.00 ②×⑤×⑩ \n 4.0 54.0 77,000 0.90 0.60 0.60 24,948 24,948 6,724,982 0.7 4,707,487 （Ａ面地） 269.56 ×⑪相 \n 2 評宜野湾市 408.00 ②×⑤×⑩ \n 4.0 54.0 77,000 0.88 0.80 0.60 24,908 24,393 142,039 1.0 142,039 （Ｂ画地・裸地） 112.73 ×⑪－⑬相 \n 3 評宜野湾市 408.00 ②×⑤×⑩ \n 4.0 44.5 77,000 0.91 0,60 0.50 17,096 0.90 32,394 1.0 32,394 （Ｃ画地・裸地） 25.71 ×⑪－⑬小 \n 4 計土地５ \n 408.00宜野湾市 4,881,920 408.00鑑 \n 5 定 \n ①（比準価格）②（収益価格）③（規準価格）④（標準価格）比準価格を重視 （更地価格） \n 宜野湾市 408.00 93,600 41,900 92,600 93,300×0.882（個別補正率））×①＝21,230,974 円 \n 21,230,974 0.43 9,123,000 （貸宅地部分） 258.00 （敷地価格から借地権価格を控除した底地価格） （底地収益価格） \n 21,230,974円（更地価格）－（1-0.1）×（1-0.3）＝（⑤13,375,530円＋⑥4,869,000円）÷２≒9,123,000円鑑 土地６ 宜野湾市 408.00 ①（比準価格）②（規準価格）④（標準価格）比準価格を重視 （更地価格） \n 6 定 （裸地部分） 150.00 47,600 47,400 47,500×0.765(個別補正率))×①≒5,451,000円 5,451,000 1.0 5,451,000小 408.00 \n 7 計 宜野湾市 408.00 14,574,000相 宜野湾市 1683.00 ②×⑤＋（③× \n 8 評 （Ａ画地） 297.78 20.8 14.3 86,000 86,000 1.00 1.00 0.05 0.98 ⑥×⑧） 90,300⑮×⑩ 88,494 88,494 26,361,743 0.7 18,446,220相 宜野湾市 1683.00 ②×⑤＋（③× \n 9 評 （Ｂ画地） 308.10 22.0 14.0 86,000 86,000 1.00 1.00 0.05 ⑥×⑧） 90,300 90,300 27,821,430 0.7 19,475,001相 宜野湾市 1683.00 \n 10 評 （Ｃ画地） 169.37 12.4 13.5 86,000 1.00 0.98 ②×⑤×⑩ 84,280 84,280 14,274,503 0.7 9,992,152相 宜野湾市 1683.00 \n 11 評 （Ｄ画地） 142.95 9.5 15.0 86,000 1.00 0.92 ②×⑤×⑩ 79,120 79,120 11,310,204 0.7 7,917,142相 宜野湾市 1683.00 \n 12 評 （Ｅ画地） 232.02 16.0 14.5 86,000 1.00 0.90 ②×⑤×⑩ 77,400 77,400 17,958,348 0.7 12,570,843相 宜野湾市 1683.00 \n 13 評 （Ｆ画地） 53.61 15.0 3.6 86,000 0.90 0.94 ②×⑤×⑩ 72,756 72,756 3,000,449 0.7 2,730,314相 \n 14 評宜野湾市 1683.00 \n 5.4 0.6 86,000 0.90 0.74 ②×⑤×⑩ 57,276 57,276 185,574 0.7 129,901 （Ｇ画地） 3.24相 \n 15 評宜野湾市 1683.00 ②×⑤×⑩ \n 4.5 15.5 86,000 1.00 0.90 0.30 23,220 23,220 1,678,806 0.7 1,175,164 （Ｈ画地・私道） 72.30 ×⑫相 \n 16 評土地５宜野湾市 1683.00 ②×⑤×⑩ \n 2.0 11.0 86,000 1.00 0.76 0.90627 26,500 33,733 33,733 3,693,763 1.0 3,693,763 （Ｉ画地・裸地） 109.50 ×⑪－⑮ \n 17 小 宜野湾市 1683.00計 1388.87 76,130,500 \n （比準価格） （個別格差） （収益価格） （比準価格相当額） （底地価格） \n 鑑 1683 \n 18 定 土地６ 宜野湾市 1683 20.8 14.3 114,000× 70 ×①：≒134,300,000（更地価格） （41,490,000円＋61,370,000円）÷２＝51,430,000円 134,300,000 0.383 51,430,000別紙本判決により取り消すべき税額 \n １ 相続税の総額の計算区分 Ａ本件裁決後の額 Ｂ本判決後の額 取消額（Ａ－Ｂ） \n 総 遺 産 価 格 ① \\841,826,739 \\789,536,019 \\52,290,720債 務 控 除 の 合 計 額 ② \\2,585,150 \\2,585,150 \\0 \n ３ 年 以 内 の 贈 与 加 算 税 の 合 計 額 ③課税価格の合計額（①－②＋③(1000円未満切り捨て)） ④ \\839,240,000 \\786,950,000 \\52,290,000法 定 相 続 人 数 ⑤ 5人 5人遺 産 に 係 る 基 礎 控 除 額 ⑥ \\100,000,000 \\100,000,000 \\0計 算 の 基 礎 と な る 金 額 （ ④ － ⑥ ） ⑦ \\739,240,000 \\686,950,000 \\52,290,000相 続 税 の 総 額 ⑧ \\219,696,000 \\198,780,000 \\20,916,000 \n ２ 原告甲の課税標準等及び税額等の計算区分 Ａ本件裁決後の額 Ｂ本判決後の額 取消額（Ａ－Ｂ） \n 取 得 財 産 の 価 格 ① \\436,913,836 \\385,362,836 \\51,551,000債 務 控 除 ② \\2,585,150 \\2,585,150 \\0 \n ３ 年 以 内 の 贈 与 加 算 額 ③課税価格（①－②＋③（1000円未満切り捨て)) ④ \\434,328,000 \\382,777,000 \\51,551,000相 続 税 の 総 額 （ １ の ⑧ の 金 額 ） ⑤ \\219,696,000 \\198,780,000 \\20,916,000同上の按分割合（④／１の④） ⑥ 0.5175 0.4864一 般 の 場 合相 続 税 額 （ ⑤ × ⑥ ） ⑦ \\113,692,680 \\96,686,592 \\17,006,088措置法70条の６第２項相 続 税 額 ⑧の 規 定 適 用 の 場 合法 １ ８ 条 の 規 定 に よ る 加 算 額 ⑨贈 与 税 額 控 除 額 ⑩配 偶 者 の 税 額 軽 減 額 ⑪税 \n 額 未 成 年 者 控 除 額 ⑫控 障 害 者 控 除 額 ⑬除 \n 相 次 相 続 控 除 額 ⑭額 \n 外 国 税 額 控 除 額 ⑮小 計 ⑯差引税額（⑦＋⑨－⑯又は⑧＋⑨－⑯（100円未満切り捨て））⑰ \\113,692,600 \\96,686,500 \\17,006,100納 税 猶 予 税 額 ⑱納 付 す べ き 税 額 ⑲ \\113,692,600 \\96,686,500 \\17,006,100 \n ３ 原告甲の加算税の額の計算過少申告加算税区分 \n Ａ本件裁決後の額 Ｂ本判決後の額 取消額（Ａ－Ｂ） \n 加算税の基礎となる税額（１万円未満切り捨て） ① \\88,090,000 \\71,080,000 \n ①のうち通則法６５条２項の規定による加算税の基 \n ② \\62,490,000 \\45,480,000礎となる税額（１万円未満切り捨て） \n ① に 対 す る 加 算 税 の 割 合 ③ 10/100 10/100 \n ② に 対 す る 加 算 税 の 割 合 ④ 5/100 5/100加算税の額（①×③と②×④の合計額（100円未満切り捨て））⑤ \\11,933,500 \\9,382,000 \\2,551,500 \n ４ 原告乙の課税標準等及び税額等の計算区分 Ａ本件裁決後の額 Ｂ本判決後の額 取消額（Ａ－Ｂ） \n 取 得 財 産 の 価 格 ① \\119,462,143 \\118,722,423 \\739,720債 務 控 除 ② \n ３ 年 以 内 の 贈 与 加 算 額 ③課税価格（①－②＋③（1000円未満切り捨て)) ④ \\119,462,000 \\118,722,000 \\740,000相 続 税 の 総 額 （ １ の ⑧ の 金 額 ） ⑤ \\219,696,000 \\198,780,000 \\20,916,000同上の按分割合（④／１の④） ⑥ 0.1424 0.1509一 般 の 場 合相 続 税 額 （ ⑤ × ⑥ ） ⑦ \\31,284,710 \\29,995,902 \\1,288,808措置法70条の６ \n \n \n 第２ 相 \n 続 税 額 ⑧法 １ ８ 条 の 規 定 に よ る 加 算 額 ⑨贈 与 税 額 控 除 額 ⑩配 偶 者 の 税 額 軽 減 額 ⑪税\n額 未 成 年 者 控 除 額 ⑫控 障 害 者 控 除 額 ⑬除\n相 次 相 続 控 除 額 ⑭額\n外 国 税 額 控 除 額 ⑮小 計 ⑯差引税額（⑦＋⑨－⑯又は⑧＋⑨－⑯（100円未満切り捨て））⑰ \\31,284,700 \\29,995,900 \\1,288,800納 税 猶 予 税 額 ⑱納 付 す べ き 税 額 ⑲ \\31,284,700 \\29,995,900 \\1,288,800\n５ 原告乙の加算税の額の計算過少申告加算税区分\nＡ本件裁決後の額 Ｂ本判決後の額 取消額（Ａ－Ｂ）\n加算税の基礎となる税額（１万円未満切り捨て） ① \\17,680,000 \\16,390,000\n①のうち通則法６５条２項の規定による加算税の基礎 ② \\4,080,000 \\2,790,000\n① に 対 す る 加 算 税 の 割 合 ③ 10/100 10/100\n② に 対 す る 加 算 税 の 割 合 ④ 5/100 5/100加算税の額（①×③と②×④の合計額（100円未満切り捨て））⑤ \\1,972,000 \\1,778,500 \\193,500\n\n６ 原告丙の課税標準等及び税額等の計算区分 Ａ本件裁決後の額 Ｂ本判決後の額 取消額（Ａ－Ｂ）\n取 得 財 産 の 価 格 ① \\55,642,535 \\55,642,535 \\0債 務 控 除 ②\n３ 年 以 内 の 贈 与 加 算 額 ③課税価格（①－②＋③（1000円未満切り捨て)) ④ \\55,642,000 \\55,642,000 \\0相 続 税 の 総 額 （ １ の ⑧ の 金 額 ） ⑤ \\219,696,000 \\198,780,000 \\20,916,000同上の按分割合（④／１の④） ⑥ 0.0663 0.0707一 般 の 場 合相 続 税 額 （ ⑤ × ⑥ ） ⑦ \\14,565,844 \\14,053,746 \\512,098措置法70条の６ \n \n \n 第２ 相 \n 続 税 額 ⑧法 １ ８ 条 の 規 定 に よ る 加 算 額 ⑨贈 与 税 額 控 除 額 ⑩配 偶 者 の 税 額 軽 減 額 ⑪税\n額 未 成 年 者 控 除 額 ⑫控 障 害 者 控 除 額 ⑬除\n相 次 相 続 控 除 額 ⑭額\n外 国 税 額 控 除 額 ⑮小 計 ⑯差引税額（⑦＋⑨－⑯又は⑧＋⑨－⑯（100円未満切り捨て））⑰ \\14,565,800 \\14,053,700 \\512,100納 税 猶 予 税 額 ⑱納 付 す べ き 税 額 ⑲ \\14,565,800 \\14,053,700 \\512,100\n７ 原告丙の加算税の額の計算過少申告加算税区分\nＡ本件裁決後の額 Ｂ本判決後の額 取消額（Ａ－Ｂ）\n加算税の基礎となる税額（１万円未満切り捨て） ① \\9,450,000 \\8,940,000\n①のうち通則法６５条２項の規定による加算税の基礎 ② \\4,330,000 \\3,820,000\n① に 対 す る 加 算 税 の 割 合 ③ 10/100 10/100\n② に 対 す る 加 算 税 の 割 合 ④ 5/100 5/100加算税の額（①×③と②×④の合計額（100円未満切り捨て））⑤ \\1,161,500 \\1,085,000 \\76,500\n\n８ 原告丁の課税標準等及び税額等の計算区分 Ａ本件裁決後の額 Ｂ本判決後の額 取消額（Ａ－Ｂ）\n取 得 財 産 の 価 格 ① \\115,683,117 \\115,683,117 \\0債 務 控 除 ②\n３ 年 以 内 の 贈 与 加 算 額 ③課税価格（①－②＋③（1000円未満切り捨て)) ④ \\115,683,000 \\115,683,000 \\0相 続 税 の 総 額 （ １ の ⑧ の 金 額 ） ⑤ \\219,696,000 \\198,780,000 \\20,916,000同上の按分割合（④／１の④） ⑥ 0.1378 0.1470一 般 の 場 合相 続 税 額 （ ⑤ × ⑥ ） ⑦ \\30,274,108 \\29,220,660 \\1,053,448措置法70条の６ \n \n \n 第２ 相 \n 続 税 額 ⑧法 １ ８ 条 の 規 定 に よ る 加 算 額 ⑨贈 与 税 額 控 除 額 ⑩配 偶 者 の 税 額 軽 減 額 ⑪税\n額 未 成 年 者 控 除 額 ⑫控 障 害 者 控 除 額 ⑬除\n相 次 相 続 控 除 額 ⑭額\n外 国 税 額 控 除 額 ⑮小 計 ⑯差引税額（⑦＋⑨－⑯又は⑧＋⑨－⑯（100円未満切り捨て））⑰ \\30,274,100 \\29,220,600 \\1,053,500納 税 猶 予 税 額 ⑱納 付 す べ き 税 額 ⑲ \\30,274,100 \\29,220,600 \\1,053,500\n９ 原告丁の加算税の額の計算過少申告加算税区分\nＡ本件裁決後の額 Ｂ本判決後の額 取消額（Ａ－Ｂ）\n加算税の基礎となる税額（１万円未満切り捨て） ① \\17,510,000 \\16,460,000\n①のうち通則法６５条２項の規定による加算税の基礎 ② \\4,750,000 \\3,700,000\n① に 対 す る 加 算 税 の 割 合 ③ 10/100 10/100\n② に 対 す る 加 算 税 の 割 合 ④ 5/100 5/100加算税の額（①×③と②×④の合計額（100円未満切り捨て））⑤ \\1,988,500 \\1,831,000 \\157,500\n\n１０ 原告戊の課税標準等及び税額等の計算区分 Ａ本件裁決後の額 Ｂ本判決後の額 取消額（Ａ－Ｂ）\n取 得 財 産 の 価 格 ① \\114,125,108 \\114,125,108 \\0債 務 控 除 ②\n３ 年 以 内 の 贈 与 加 算 額 ③課税価格（①－②＋③（1000円未満切り捨て)) ④ \\114,125,000 \\114,125,000 \\0相 続 税 の 総 額 （ １ の ⑧ の 金 額 ） ⑤ \\219,696,000 \\198,780,000 \\20,916,000同上の按分割合（④／１の④） ⑥ 0.1360 0.1450一 般 の 場 合相 続 税 額 （ ⑤ × ⑥ ） ⑦ \\29,878,656 \\28,823,100 \\1,055,556措置法70条の６ \n \n \n 第２ 相 \n 続 税 額 ⑧法 １ ８ 条 の 規 定 に よ る 加 算 額 ⑨贈 与 税 額 控 除 額 ⑩配 偶 者 の 税 額 軽 減 額 ⑪税\n額 未 成 年 者 控 除 額 ⑫控 障 害 者 控 除 額 ⑬除\n相 次 相 続 控 除 額 ⑭額\n外 国 税 額 控 除 額 ⑮小 計 ⑯差引税額（⑦＋⑨－⑯又は⑧＋⑨－⑯（100円未満切り捨て））⑰ \\29,878,600 \\28,823,100 \\1,055,500納 税 猶 予 税 額 ⑱納 付 す べ き 税 額 ⑲ \\29,878,600 \\28,823,100 \\1,055,500\n１１ 原告戊の加算税の額の計算過少申告加算税区分\nＡ本件裁決後の額 Ｂ本判決後の額 取消額（Ａ－Ｂ）\n加算税の基礎となる税額（１万円未満切り捨て） ① \\23,660,000 \\22,600,000\n①のうち通則法６５条２項の規定による加算税の基礎 ② \\17,440,000 \\16,390,000\n① に 対 す る 加 算 税 の 割 合 ③ 10/100 10/100\n② に 対 す る 加 算 税 の 割 合 ④ 5 100 5/100加算税の額（①×③と②×④の合計額（100円未満切り捨て））⑤ \\3,238,000 \\3,079,500 \\158,500 \n \n"
}