{
  "number": "11309",
  "title": "所得税更正処分取消等請求控訴事件",
  "court": "東京高等裁判所",
  "date": "平成２１年１１月１１日",
  "date_iso": "2009-11-11",
  "result": "取消",
  "topics": [
    "所得税"
  ],
  "laws": [],
  "keywords": [
    "更正処分",
    "課税処分",
    "過少申告加算税"
  ],
  "text": "\n \n 目次に戻る \n \n 判決 11309 \n 所得税更正処分取消等請求控訴事件 \n \n 裁判所:  東京高等裁判所 \n 判決日:  平成２１年１１月１１日 \n 結果:  取消 \n \n \n 主文 \n １ 本件控訴を棄却する。\n２ 控訴費用は控訴人の負担とする。 \n \n \n 第１ 控訴の趣旨 \n １ 原判決を取り消す。\n２ 被控訴人は、控訴人に対し、３１万０６１２円を支払え。 \n \n \n 第２ 事案の概要 \n １ 本件は、老齢厚生年金の受給者である控訴人が、平成１６年分ないし平成１９年分の所得税について、確定申告をしたところ、柏税務署長から、雑所得や雑損控除の金額の計算が誤っている等として、上記各年分の所得税につき更正処分及び過少申告加算税の賦課決定処分を受け、上記各処分に基づき所得税及び過少申告加算税を納付したが、上記各処分は法令に違反する無効なものであり、控訴人が納付した所得税及び過少申告加算税の一部は過誤納金に当たるとして、その還付を求めている事案である。\n原判決は、上記各処分に無効事由は認められないとして、控訴人の請求を棄却し、控訴人は、\nこれを不服として、控訴した。\n２ 事案の概要の詳細は、原判決の「事実及び理由」の「第２ 事案の概要」の１ないし４に記載のとおりであるから、これを引用する（ただし、原判決１３頁１６行目冒頭から１７行目末尾までを除く。）。 \n \n \n 第３ 当裁判所の判断 \n １ 当裁判所も、本件各処分に重大かつ明白な瑕疵又は課税処分の根幹についての過誤による瑕疵があるとは認められず、本件各処分について無効事由は認められないのであるから、本件各処分が無効であることを前提とする控訴人の本件請求は理由がないものと判断する。その理由は、原判決の「事実及び理由」の「第３ 当裁判所の判断」の１、２に記載のとおりであるから、これを引用する（ただし、原判決１７頁２３行目冒頭から２４行目末尾までを「算入されるべきである旨主張する。」に改める。）。\n２ 以上によれば、控訴人の本件請求を棄却した原判決は相当であり、本件控訴は理由がないから、\nこれを棄却する。\n東京高等裁判所第５民事部裁判長裁判官 小林 克已裁判官 山﨑 まさよ裁判官 林 俊之 \n \n"
}