{
  "number": "11457",
  "title": "無効徴税返還請求控訴事件",
  "court": "東京高等裁判所",
  "date": "平成２２年６月２３日",
  "date_iso": "2010-06-23",
  "result": "棄却",
  "topics": [
    "所得税"
  ],
  "laws": [],
  "keywords": [
    "更正処分"
  ],
  "text": "\n \n 目次に戻る \n \n 判決 11457 \n 無効徴税返還請求控訴事件 \n \n 裁判所:  東京高等裁判所 \n 判決日:  平成２２年６月２３日 \n 結果:  棄却 \n \n \n 主文 \n １ 本件控訴を棄却する。\n２ 控訴費用は控訴人の負担とする。 \n \n \n 第１ 控訴の趣旨 \n (1) 原判決を取り消す。\n(2) 被控訴人は控訴人に対し、２７６６万７３００円及び内金２７５６万０８００円に対する平成６年６月２８日から、内金１０万６５００円に対する平成７年３月３１日から、各支払い済みまで年５分の割合による金員を支払え。\n(3) 訴訟費用は第１、２審とも被控訴人の負担とする。 \n \n \n 第２ 事案の概要本件は \n 、糸魚川税務署長が、控訴人に対し、平成６年５月３０日にした所得税額の更正及び加算税の賦課決定が無効であるとして、これに基づいて納付した金員の返還を求めるものであり、当事者の主張は、原判決「事実及び理由」の「第２ 原告の主張」及び「第３ 被告の主張」に記載のとおりであるから、これを引用する。 \n \n \n 第３ 当裁判所の判断 \n １ 当裁判所も、控訴人の請求には理由がないものと判断する。その理由は、２のとおり付加するほか、原判決「事実及び理由」の「第４ 判断」に記載のとおりであるから、これを引用する。\n２ 控訴人は、本訴で主張する無効原因は、本件更正処分等の通知が控訴人に到達する以前に徴税行為がなされたことなどであり、前訴と異なると主張するが、前訴の既判力は本件更正処分等の無効事由すべてに及ぶと解されるから、控訴人の主張には理由がない。\n３ よって、控訴人の請求を棄却した原判決は相当であり、本件控訴は理由がないから、これを棄却することとし、主文のとおり判決する。\n東京高等裁判所第１７民事部裁判長裁判官 南 敏文裁判官 野山 宏裁判官 野村 高弘 \n \n"
}