{
  "number": "11527",
  "title": "法人税更正処分取消等請求事件",
  "court": "東京地方裁判所",
  "date": "平成２２年１０月７日",
  "date_iso": "2010-10-07",
  "result": "取消",
  "topics": [
    "法人税"
  ],
  "laws": [
    "法人税法22条",
    "法人税法37条"
  ],
  "keywords": [
    "更正処分",
    "重加算税",
    "過少申告加算税"
  ],
  "text": "\n \n 目次に戻る \n \n 判決 11527 \n 法人税更正処分取消等請求事件 \n \n 裁判所:  東京地方裁判所 \n 判決日:  平成２２年１０月７日 \n 結果:  取消 \n \n \n 主文 \n １ 武蔵府中税務署長が平成１６年５月３１日付けで原告に対してした原告の平成１３年６月１日から平成１４年５月３１日までの事業年度の法人税に係る更正処分（ただし、平成１８年４月５日付け裁決及び平成２０年２月１５日付け再更正処分後のもの）のうち所得の金額につき１億４１８\n９万５５５９円及び納付すべき法人税額につき４９６８万９４００円を超える部分並びに過少申告加算税賦課決定処分（ただし、平成１８年４月５日付け裁決、同年１２月２６日付け変更決定処分及び平成２０年２月１５日付け再変更決定処分後のもの）のうち７２４万円を超える部分を取り消す。\n２ 原告のその余の請求を棄却する。\n３ 訴訟費用は、これを２分し、その１を被告の負担とし、その余を原告の負担とする。 \n \n \n 第１ 請求武蔵府中税務署長が平成 \n １６年５月３１日付けで原告に対してした原告の平成１３年６月１日から平成１４年５月３１日までの事業年度の法人税に係る更正処分（ただし、平成１８年４月５日付け裁決及び平成２０年２月１５日付け再更正処分後のもの）のうち所得の金額につき４８４万１\n１３２円及び納付すべき法人税額につき１０６万１９００円を超える部分並びに過少申告加算税賦課決定処分（ただし、平成１８年４月５日付け裁決、同年１２月２６日付け変更決定処分及び平成２０年２月１５日付け再変更決定処分後のもの）を取り消す。 \n \n \n 第２ 事案の概要本件は \n 、土地の死因贈与を受けた内国法人である原告が、平成１３年６月１日から平成１４年５月３１日までの事業年度（以下「本件事業年度」という。）の法人税の確定申告をしたところ、武蔵府中税務署長から、更正処分及び過少申告加算税賦課決定処分を受けたことについて、上記の各処分は、上記の死因贈与に係る受贈益として土地の時価額を上回る金額を当該事業年度の益金の額に算入しているものの、当該時価額に基づき当該事業年度の所得の金額及び納付すべき法人税額を計算すると確定申告時の金額を超えないのであるから、違法であると主張して、上記の各処分の取消しを求めた事案である。 \n １ 法人税法の定め \n (1) 法人税法２２条２項は、内国法人の各事業年度の所得の金額の計算上当該事業年度の益金の額に算入すべき金額は、別段の定めがあるものを除き、資産の販売、有償又は無償による資産の譲渡又は役務の提供、無償による資産の譲受けその他の取引で資本等取引（同条５項参照） \n 以外のものに係る当該事業年度の収益の額とする旨を定めている。 \n (2) 法人税法２２条４項は、同条２項に規定する当該事業年度の収益の額等は、一般に公正妥当と認められる会計処理の基準に従って計算されるものとする旨を定めている。 \n ２ 前提事実（争いのない事実、各項末尾に掲記の証拠及び弁論の全趣旨により容易に認められる事実並びに当裁判所に顕著な事実） \n (1) 原告等ア 原告は、昭和３１年６月２２日に設立された植木及び同種苗の栽培並びに販売等を目的とする株式会社である。 \n イ 乙（以下「乙」という。）は、原告の代表者であった者であり、平成１４年１月２７日に死亡した。 \n (2) 土地の所有関係等ア 乙は、平成１４年１月２７日当時、別紙１物件目録記載１(1)の土地（甲６３の１。以下 \n 「本件土地イ」という。）及び同(2)の土地（甲６３の２。以下「本件土地ロ」といい、本件土地イと併せて「本件土地１」という。）、同記載２の各土地（甲６３の３～４。以下「本件土地２」という。）並びに同記載３の各土地（甲６３の５～８。以下「本件土地３」といい、 \n 本件土地１及び本件土地２と併せて「本件各土地」という。）を所有していた。 \n イ 本件土地イと本件土地ロとの間には、原告代表者である甲（以下「甲」という。）が所有する調布市の土地（畑、３０．３２平方メートル。以下「本件土地ハ」という。）がある。（甲 \n １１） \n ウ 本件土地１及び本件土地ハのほぼ中央の上空には、Ｂ株式会社（以下「Ｂ」という。）が架設する送電線がある。乙は、昭和５８年ころ、Ｂとの間で、本件土地１の一部（本件土地イにつき１７５．３０平方メートル、本件土地ロにつき７５．１７平方メートル）について架設送電線路に関する契約（以下「本件送電線契約１」という。）を締結しており、甲は、 \n 平成９年４月１４日、Ｂとの間で、本件土地ハの一部について架設送電線路に関する契約（以下「本件送電線契約２」といい、本件送電線契約１と併せて「本件各送電線契約」という。） \n を締結していた。本件各送電線契約においては、乙及び甲は、上記の各土地の部分内に建造物を築造することなどができないものとされる一方、補償料の支払を受けることなどが定められている。（甲７、８、４５） \n (3) 死因贈与ア 原告は、平成１３年１１月２日付けで、乙との間で、乙が原告に対して本件各土地について死因贈与する旨の契約（以下「本件各死因贈与契約」という。）を締結した。（乙２の１～ \n ３） \n イ 原告は、平成１４年１月２７日に乙が死亡したことにより、本件各死因贈与契約に基づき、 \n 本件各土地を取得した（以下、当該死因贈与により原告が得た利益を「本件受贈益」という。）。 \n なお、これに伴って、原告とＢとの間で、平成１４年１０月９日、本件送電線契約１と同内容の契約が締結された。（甲７） \n (4) 確定申告原告は、平成１４年７月３１日、武蔵府中税務署長に対し、本件受贈益の額を５億９１２０万円として、これを本件事業年度の益金の額に算入し、別表１の「確定申告」欄記載のとおり、 \n 本件事業年度の法人税の確定申告（以下「本件確定申告」という。）をした。（乙３） \n (5) 更正処分等の経緯ア 原告は、平成１６年２月２３日付けで、武蔵府中税務署長等に対し、本件受贈益の額は４億７４００万円であるから職権によりこれを反映して法人税の課税を行ってほしい旨の嘆願書を提出した。 \n イ 武蔵府中税務署長は、平成１６年５月３１日、原告に対し、本件確定申告において完成工事高の益金計上漏れ等があったことなどを理由として、別表１の「更正処分等」欄記載のとおり、本件事業年度の法人税の更正処分（以下「本件更正処分」という。）、過少申告加算税の賦課決定処分（以下「本件賦課決定処分」といい、本件更正処分と併せて「本件各処分」 \n という。）及び重加算税の賦課決定処分（以下「本件重加算税賦課決定処分」という。）をした。（甲１） \n ウ 原告は、平成１６年６月２１日、武蔵府中税務署長に対し、上記イの各処分を不服として異議申立てをした。同署長は、同年９月１３日、原告に対し、これを棄却する旨の決定をした。 \n エ 原告は、平成１６年１０月１３日、国税不服審判所長に対し、上記ウの決定を不服として審査請求をした。同所長は、平成１８年４月５日、原告に対し、本件受贈益の額を５億６４ \n ３６万４４４２円であると認め、別表１の「裁決」欄記載のとおり、本件更正処分及び本件賦課決定処分の一部を取り消す旨の裁決（以下「本件裁決」という。）をした。（甲２） \n オ 原告は、平成１８年１０月５日、本件訴えを提起した。 \n カ 武蔵府中税務署長は、平成１８年１２月２６日、原告に対し、別表１の「変更決定処分」 \n 欄記載のとおり、本件賦課決定処分（ただし、本件裁決により一部が取り消された後のもの） \n 及び本件重加算税賦課決定処分を、それぞれ変更する旨の決定（以下「本件変更決定処分」 \n という。）をした。（乙１） \n キ 武蔵府中税務署長は、平成２０年２月１５日、原告に対し、本件受贈益の額を５億６４０ \n ８万２３１１円であると認め、別表１の「再更正処分等」欄記載のとおり、本件更正処分の一部を取り消す旨の再更正処分（以下「本件再更正処分」という。）及び本件賦課決定処分を再度変更する旨の決定（以下「本件再変更決定処分」という。）をした。（乙４６） \n (6) 裁判所鑑定当裁判所は、本件訴訟において、平成２２年１月６日、原告及び被告の各鑑定の申出を採用した上、丙を鑑定人として指定し、本件各土地の平成１４年１月２７日時点における各時価額等について鑑定して書面をもって報告すべき旨を命じたところ、同鑑定人は、平成２２年３月 \n １６日及び２５日、本件各土地に係る各不動産鑑定評価書及び各補充鑑定評価書を提出し、上記の各鑑定の結果（以下「丙鑑定」という。）を報告した。その概要についでは、別表３－１ないし３－３の各「丙鑑定］欄記載のとおりである。 \n ３ 本件各処分の根拠等に関する被告の主張本件更正処分（ただし、本件裁決及び本件再更正処分により一部が取り消された後のもの。以下同じ。）及び本件賦課決定処分（ただし、本件裁決、本件変更決定処分及び本件再変更決定処分により変更された後のもの。以下同じ。）の根拠及び適法性に関する被告の主張は、後記４において述べるほか、別紙２に記載のとおりである。 \n ４ 争点本件の争点は、本件事業年度の益金の額に算入されるべき本件受贈益の額であり、具体的には、 \n 本件受贈益の額とされるべき本件各土地の平成１４年１月２７日における時価額の合計が、本件更正処分において最後に認定された５億６４０８万２３１１円又はこれを超えるか否かである。 \n （被告の主張の要点） \n (1) 本件受贈益の額の算定方法ア 法人の遺贈による土地の取得に係る収益の額の算定は、取得時の時価額、すなわち、通常の取引がされた場合に成立すると認められる客観的な価額によるべきである。 \n 法人税の課税実務上、土地の時価額の評価方式に関する特段の定めはないため、法人税の所得金額の計算において、法人が取得した不動産の時価を算定する場合には、具体的事案に即して、対象不動産の種類（土地、建物）、場所、近隣における売買実例の有無、近隣における公示地等の有無など、当該不動産に関する所与の条件を総合的に勘案した上で、当該不動産の価格を算定するために最も有効かつ合理的な方法を用いて、その時価額を算定することになるというべきである。 \n 不動産の価格を求めるための一般的な方式、特に、不動産鑑定評価の際に用いられる基本的な手法として、原価法、取引事例比較法及び収益還元法の三手法があるところ、①本件各土地の近隣の売買実例のうち、本件各土地と同様の更地で、かつ、取引時点が近接し、さらに、本件各土地と諸条件が一致ないし類似する売買実例がそれぞれ存在するため、これらの売買実例における取引価格は、本件各土地の時価額の評価に当たりしんしゃくすることができること、②本件各土地の近隣に、それぞれ公示地が存在し、その公示価格は、建物等が存しないものとして通常成立すると認められる土地の価格であり（地価公示法２条２項）、一般の土地の取引価格の指標とされ、あるいは、不動産鑑定士の鑑定評価及び公共事業の用地の買収価格の算定等の基準とされていることから（同法１条参照）、その公示価格も本件各土地の時価額の評価に当たり指標となり得るものである。本件各土地がいずれも更地であることから、主として建物又は建物及びその敷地の価格を算定するのに有効な原価法、主として賃貸用不動産等の価格を求めるのに有効な収益還元法よりも、取引事例比較法の手法を採用することがより適切な時価額の評価手法であるといえる。 \n 以上の観点から、被告は、取引事例比較法の手法を採ることが本件各土地の評価に最も有効かつ合理的であると判断したものであり、評価方式の選択に不合理な点はない。 \n イ 被告が採用した取引事例比較法による評価の方式（以下「被告取引事例比較法」という。） \n は、次のとおりであり、十分な合理性を有するものである。 \n (ア) 基準地の選定本件各土地の存する地域（近隣地域）及び同一需給圏内で当該地域の特性と類似する特性を有する地域（類似地域）にある公示地及び取引事例地を収集し、その中から、更地（公示地を除く。）で、かつ、本件各土地の条件（行政的条件、画地条件）にできる限り類似し、又は格差の小さい公示地及び取引事例地を選択して、これを基準地とする。 \n (イ) 基準地の事情補正及び時点修正基準地の価格（公示地につき公示価格、取引事例地につき１平方メートル当たりの取引価格）について、事情補正（取引における売急ぎ、買進みなどの特殊事情を考慮した価格の補正）及び時点修正（死因贈与の効力発生時である平成１４年１月２７日現在の価格への修正）をする。 \n 事情補正に関しては、本件において、被告は、取引価格の決定について、上記の特殊事情の寄与した度合いの少ないものとの観点から基準地を選択しているから、選定された取引事例には当該取引価格に影響を与えるような特殊事情の存在は認められず、いずれの基準地についても事情補正をしていない。 \n 時点修正に関しては、本件において、被告は、公示価格については、平成１４年の地価公示の基準日である同年１１月１日を、取引価格については、当該取引における売買契約の締結日を、それぞれの価格時点とした上で、公示価格の年間変動率を基礎として時点修正値を算出し、当該修正値を基準地の価格に乗ずることにより、基準地の公示価格及び取引価格について、それぞれ同年１月２７日時点における価格に修正している。 \n (ウ) 基準地の標準的な画地条件への補正基準地のうち公示地を想定地（その地域における標準的な画地条件の土地）とし、当該公示地とその他の基準地（公示地を除く。）との画地条件の比較をして補正値（以下「標準化補正値」という。）を算出し、これを各基準地の価格に乗じ、各基準地の画地条件に係る個別性を補正して、それぞれの価格を標準化する。 \n (エ) 本件各土地の近隣地域における標準的な画地への補正基準地の存する地域と本件各土地の存する地域の画地条件以外の地域要因を比較し、その補正値（以下「地域要因補正値」という。）を算出した上、これを前記(ウ)の標準化補正後の各価格に乗じる。 \n (オ) 本件各土地の標準的な画地価格の平均化前記(エ)により算出された各価格を集計した後、当該集計値の平均をもって、本件各土地の標準的な画地条件下の価格（標準価格）とする。 \n (カ) 本件土地の試算価格本件各土地とこれに対応する各想定地との個別的要因を比較し、その補正値（以下「個別的要因補正値」という。）を算出した上、これを前記(オ)の標準価格に乗じ、本件各土地の１平方メートル当たりの価格（試算価格）を算出する。 \n (キ) 本件各土地の時価前記(カ)の試算価格に本件各土地の地積を乗じ、本件各土地の評価額を算定する。 \n (ク) 土地価格比準表を用いた理由等土地価格比準表（昭和５０年１月２０日付け国土庁土地局地価調査課長通達（５０国土地第４号）「国土利用計画法の施行に伴う土地価格の評価等について」。ただし、平成６年 \n ３月１５日付け「６国土第５６号」による改正後のもの。）は、地域要因及び個別的要因の把握、比較等についての合理的、統一的な評価方法を内容とするものであることから、 \n 標準化補正値、地域要因補正値及び個別要因補正値の算出に当たって土地価格比準表を用いた。 \n そして、前記(エ)における基準地の存する地域と本件各土地の存する地域の地域要因の比較に土地価格比準表を用いるに当たっては、基準地及びこれに対応する本件各土地が存在する地域について、それぞれの圏域における相対的な比較を基礎に置いて判定した。 \n ウ 本件各処分における本件各土地の時価額は、上記イの被告取引事例比較法を用いて算定されたものであるから合理的であるといえ、しかも、財産評価基本通達（以下「評価通達」という。）による土地の評価額（以下「相続税評価額」という。）を０．８で除した額をもって当該土地の時価額とする手法（以下「相続税評価額還元法」という。）による評価額もその近似値を示すから、その合理性は明らかというべきである。 \n (2) 本件土地１の時価額ア 本件土地１（本件土地イ及び本件土地ロ）の一体評価の可否及びその最有効利用について本件土地イと本件土地ロとの間には本件土地ハがあるところ、これらの土地の近隣地域における土地の利用状況、本件土地ハの形状等からすれば、それらの土地の最有効利用は、一体として戸建住宅地として利用することである。そして、本件土地１の所有者は原告であり、 \n 本件土地ハの所有者は原告の株式の過半数を有する原告代表者の甲であるから、本件土地１及び本件土地ハの一体利用に障害はなく、現況においても、原告の資材置場、車両置場などとして一体利用がされている。また、本件土地１及び本件土地ハは、現状では、本件各送電線契約により建造物の築造等が禁止されているものの、Ｂとの協議により建造物の築造を可能とする契約内容への変更も容易とされている。 \n したがって、本件土地１は、本件土地ハと共に一体として評価されるべきであり、その最有効利用は戸建住宅地である。 \n イ 被告取引事例比較法による評価額について \n (ア) 本件土地１は、第一種低層住居専用地域（建ぺい率４０％、容積率８０％）にあるところ、別表４－１のとおり、行政的条件を同じくする近隣の地域において、公示地（調布 \n ●●）が存在するほか、取引時点が近接し、本件土地１と地積、形状、接面街路との関係等の画地条件の格差が最小となる取引事例として、本件土地Ａないし本件土地Ｃ（同表記載のものをいう。以下同じ。）が存在するので、これらを本件土地１の基準地とした。 \n (イ) 公示地（調布●●）及び本件土地Ａないし本件土地Ｃの公示価格又は取引価格、事情補正値、標準化補正値、地域要因補正値、地域要因補正後の価格、標準価格、個別的要因補正値、試算価格、本件土地１の地積及びそれらを適用して得られた本件土地１の時価額に関する被告の主張は、別表５－１の「被告主張」欄記載のとおりである。 \n なお、標準化補正値、地域要因補正値及び個別的要因補正値の算定根拠については、別表６－１の「被告主張」欄記載のとおりである。 \n (ウ) したがって、被告取引事例比較法による本件土地１の評価額は、１億０５５１万１４ \n ３４円となる。 \n ウ 相続税評価額還元法による評価額について \n (ア) 自用地１平方メートル当たりの価額 １９万６０５２円財産評価通達１３ないし２０－５の定めに基づき算出した自用地１平方メートル当たりの相続税額であり、その計算過程は、次のとおりである。 \n ［２２万円（正面路線価）×１．００（奥行価格補正率）＋２２万円（側方路線価）× \n １．００（奥行価格補正率）×０．０５（側方路線影響加算率）×｛２２．５６ｍ／２ \n ３．３０ｍ（接道部分の割合）｝］×０．８５（不整形地補正率）＝１９万６０５０２円 \n (イ) 本件送電線契約１設定部分以外の価額 ４１９６万８８５１円本件土地１のうち本件送電線契約１が設定された部分以外の相続税評価額であり、その計算過程は、次のとおりである。 \n １９万６０５２円（前記(ア)）×２１４．０７㎡（本件送電線契約１設定部分以外の面積）＝４１９６万８８５１円 \n (ウ) 本件送電線契約１設定部分の価額 １９６４万２０５７円財産評価通達２７－５に基づき算出した本件土地１のうち本件送電線契約１が設定された部分の相続税評価額であり、その計算過程は、次のとおりである。 \n １９万６０５２円（前記(ア)）×｛１－０．６（借地権割合）｝×２５０．４７㎡（本件土地１の本件送電線契約１設定部分の面積）＝１９６４万２０５７円 \n (エ) 相続税評価額還元法による評価額 ７７０１万３６３５円 \n ６１６１万０９０８円（前記(イ)及び(ウ)の合計）÷０．８＝７７０１万３６３５円 \n (3) 本件土地２の時価額ア 被告取引事例比較法による評価額について \n (ア) 本件土地２は、第二種中高層住居専用地域（建ぺい率６０％、容積率２００％）にあるところ、別表４－２のとおり、行政的条件を同じくする近隣の地域において、公示地（調布●●）が存在するほか、取引時点が近接し、本件土地２と地積、形状、接面街路との関係等の画地条件の格差が最小となる取引事例として、本件土地Ｄないし本件土地Ｆ（同表記載のものをいう。以下同じ。）が存在するので、これらを本件土地２の基準地とした。 \n (イ) 公示地（調布●●）及び本件土地Ｄないし本件土地Ｆの公示価格又は取引価格、時点修正値、標準化補正値、地域要因補正値、地域要因補正後の価格、標準価格、個別的要因補正値、試算価格、本件土地２の地積及びそれらを適用して得られた本件土地２の時価額に関する被告の主張は、別表５－２の「被告主張」欄記載のとおりである。 \n なお、標準化補主値、地域要因補正値及び個別的要因補正値の算定根拠については、別表６－２の「被告主張」欄記載のとおりである。 \n (ウ) したがって、被告取引事例比較法による本件土地２の評価額は、２億３９９８万００ \n ０７円となる。 \n イ 相続税評価額還元法による評価額について \n (ア) 広大地評価の手法について平成１６年６月４日付け改正後の評価通達２４－４（広大地の評価）は、平成１６年１月１日以後に相続、遺贈又は贈与により取得した財産の評価等に適用する旨が規定されているから、本件には同改正後の評価通達を適用することはできず、同改正前の評価通達２ \n ４－４に基づき、有効宅地化率を考慮すべきか否かが問題となるにすぎない。 \n そして、同改正前の評価通達２４－４によれば、広大地とは、その地域における標準的な宅地の地積に比して著しく地積が広大な土地で、都市計画法に規定する開発行為を行うとした場合には、公共公益的施設用地（潰れ地）として相当規模の負担が認められるものであるところ、本件土地２については、その最有効利用は標準的程度の８区画（旗竿状地を含む。）に分割することを前提とした戸建住宅素地であり、その場合、潰れ地を生じないから、上記評価通達は適用されない。 \n (イ) 自用地１平方メートル当たりの価額 ２５万４３４１円財産評価通達１３ないし２０－５の定めに基づき算出した自用地１平方メートル当たりの相続税額であり、その計算過程は、次のとおりである。 \n ［２５万円（正面路線価）×１．００（奥行価格補正率）＋２１万５０００円（側方路線価）×０．９４（奥行価格補正率）×０．０５（側方路線影響加算率）×｛２１． \n ９９ｍ／３２．１５ｍ（接道部分の割合）｝］×０．９９（不整形地補正率）＝２５万 \n ４３４１円 \n (ウ) 相続税評価額還元法による評価額 ２億５７０１万１５８０円 \n ２５万４３４１円（前記(イ)）×８０８．４０㎡（本件土地２の面積）＝２億０５６ \n ０万９２６４円（相続税評価額） \n ２億０５６０万９２６４円÷０．８＝２億５７０１万１５８０円 \n (4) 本件土地３の時価額ア 被告取引事例比較法による評価額について \n (ア) 本件土地３は、第二種住居地域（建ぺい率６０％、容積率２００％）にあるところ、 \n 別表４－３のとおり、行政的条件の格差の小さい近隣の地域において、地積及び形状等が同程度又はこれらについての格差が最小限となる公示地（三鷹●●）、同（三鷹●●）及び同（三鷹●●）並びに上記と同様にいうことができ、取引時点が近接する取引事例として本件土地Ｇ（同表記載のものをいう。以下同じ。）が存在するので、これらを本件土地 \n ３の基準地とした。 \n (イ) 公示地（三鷹●●）、同（三鷹●●）、同（三鷹●●）及び本件土地Ｇの公示価格又は取引価格、時点修正値、標準化補正値、地域要因補正値、地域要因補正後の価格、標準価格、個別的要因補正値、試算価格、本件土地３の地積及びそれらを適用して得られた本件土地３の時価額に関する被告の主張は、別表５－３の「被告主張」欄記載のとおりである。 \n なお、標準化補正値、地域要因補正値及び個別的要因補正値の算定根拠に関する被告の主張は、別表６－３の「被告主張」欄記載のとおりである。 \n (ウ) したがって、被告取引事例比較法による本件土地３の評価額は、２億１８５９万０８ \n ７０円となる。 \n イ 相続税評価額還元法による評価額について \n (ア) 広大地評価の手法について前記(3)イ(ア)と同様、本件に平成１６年６月４日付け改正後の評価通達２４－４（広大地の評価）を適用することはできず、同改正前の評価通達２４－４に基づき、有効宅地化率を考慮すべきか否かが問題となるにすぎない。 \n そして、本件土地３については、その最有効利用は中層店舗付共同住宅地であり、潰れ地を生じないで利用することが最有効利用であると認められるから、上記の評価通達は適用されない。 \n (イ) 自用地１平方メートル当たりの価額 ２７万８４８７円財産評価通達１３ないし２０－５の定めに基づき算出した自用地１平方メートル当たりの相続税額であり、その計算過程は、次のとおりである。 \n ２９万円（正面路線価）×０．９９（奥行価格補正率）×０．９７（不整形地補正率） \n ＝２７万８４８７円 \n (ウ) 相続税評価額還元法による評価額 ２億１５６７万０７７５円 \n ２７万８４８７円（前記(イ)）×６１９．５５㎡（本件土地３の面積）＝１億７２５３万６６２０円（相続税評価額） \n １億７２５３万６６２０円÷０．８＝２億１５６７万０７７５円 \n (5) 不動産鑑定士丁による不動産鑑定について被告が不動産鑑定士丁に依頼して行われた本件各土地の平成１４年１月２７日時点の価格についての不動産鑑定（乙５６～５８。以下「丁鑑定」という。）における評価額は、別表３ \n －１ないし３－３の各「丁鑑定欄」記載のとおり、本件土地１につき１億１７０６万円、本件土地２につき、２億６１１１万円、本件土地３につき２億６３３１万円の合計６億４１４８万円であり、このことからも、被告の主張する本件各土地の価格は、本件各土地の時価を超えるものではなく、合理的であると裏付けられる。 \n (6) 丙鑑定についてア 本件土地１について丙鑑定は、本件土地１の収益価格を導くに際して、還元利回りの率について、「周辺地域における不動産の取引事例との比較から求めた利回り（いわゆる取引利回り）や下記Ｃ研究所調査による調査結果を参考とし、さらに市場動向や対象不動産の投資対象としての危険性、 \n 流動性、管理の困難性、資産としての安全性等の個別性を加味して７％と査定した」とするものの、比較の対象とする値の選択が不適切であり、また、個別性を加味した過程も、全く不明である。すなわち、丙鑑定１が取引事例として掲げるのは、東京都三鷹市に所在するＮ線の駅から徒歩１２分のマンションと、東京都府中市に所在するＭ駅から徒歩１２分の地上 \n １８階地下２階建てのオフィスビルであり、前者については、本件土地１とは最寄り駅の路線も異なる上、駅からの距離も異なり、後者については、本件土地１の収益価格を求めるに当たって建築を想定する木造２階建ての共同住宅とはおよそかけ離れた取引事例であって、 \n 参考にならない。また、Ｃ研究所による調査結果については、Ｏ線沿線のＰ地区で駅から徒歩１０分の場所とするが、Ｏ線は、東京都渋谷区と横浜市を結ぶ路線であり、東京のＰ地区をその沿線地区とはしておらず、どこの地区の取引かは不明である。仮に、取引事例がＯ線沿線のＱ地区であるとしても、本件土地１の周辺地域とはいい難いのであり、丙鑑定は、これらの取引事例や調査結果をどのように利用したのか、個別性をどのように加味したのか、 \n 具体的な方法について全く述べておらず、戊不動産鑑定士作成の不動産鑑定評価書（甲５６） \n 及び丁鑑定（乙５６）においていずれも本件土地１の還元利回りの率が４．５パーセントとされているのに比較して、５割以上も高い７パーセントと査定したことには合理性がないといわざるを得ない。なお、本件土地１の還元利回りの率を４．５パーセントとした場合には、 \n その他を丙鑑定によるとすると、本件土地１の収益価格は、１６万円（／㎡）となる。 \n イ 本件土地２について \n (ア) 丙鑑定は、取引事例比較法による比準価格の算出に際し、別表７－２－１－１の４つの取引事例ｉないしｌ（別表３－２の「丙鑑定」欄の「取引事例比較法」項①ないし④） \n を選択し、このうち取引事例ｊ（同項②）を除外し、残りの３つの取引事例の各比準価格の平均値をもって、標準画地の比準価格を算定している。しかしながら、取引事例ｊの比準価格は、他の取引事例（同項の①、③及び④）の比準価格よりも高額であるが、これらの平均値を算出すること自体を不合理ならしめる程度に異常に突出した価格であるとまでは到底いえない。他の取引事例の所在地と比較しても、取引事例ｊの所在地は、本件土地２に最も近接していることは明らかであり、これを「周辺地域に所在するものではな」 \n いとして除外する理由は全くないというべきである。また、丙鑑定は、宅地分譲を想定した開発法による試算価格算定の前提として、本件土地２の標準画地価格を求めるに際し、 \n 別表７－２－３－１の４つの取引事例ｍないしｐ（別表３－２の「丙鑑定」欄の「開発法 \n Ａ」項記載の⑤ないし⑧）を選択して、それぞれ比準価格を算定しているが、これらの比準価格が１平方メートル当たり３０万４０００円（／㎡）から３６万円（／㎡）と開きが生じたにもかかわらず、各取引事例は周辺地域に所在するもので試算結果は妥当なものと判断し、各試算結果を平均し標準画地の比準価格を求めている。 \n このように、丙鑑定は、選択した取引事例が周辺地域に所在するか否かで、その取引事例を価格算定の根拠とするかどうかを判断しているのであるから、丙鑑定が、取引事例比較法による比準価格を求めるに際して、取引事例ｊの価格を除外したことには全く合理性がなく、同価格を考慮に入れるべきである。 \n なお、仮に、丙鑑定の算定方法に従った上で、取引事例ｊの比準価格を除外せずに、鑑定評価額を求めると、以下のとおり、本件土地２の価格は、２億３９３３万４９０４円（後記(イ)に述べる還元利回りの率を前提とすると、２億４４８３万２０２４円）となる。 \n ａ 取引事例比較法による比準価格 \n (a) 標準画地の比準価格 ３１万１２５０円（／㎡） \n （３０万６０００円（／㎡）［取引事例ｉ］＋３６万１０００円円（／㎡）［同ｊ］ \n ＋３０万８０００円（／㎡）［同ｋ］＋２７万円（／㎡）［同ｌ］）÷４＝３１万１ \n ２５０円（／㎡） \n (b) 個別格差による補正 ３２万３７００円（／㎡） \n ３１万１２５０円（／㎡）×（１＋４％）＝３２万３７００円（／㎡） \n ｂ 収益価格 １２万２０００円（／㎡） \n ｃ 開発法 ２４万９０００円（／㎡） \n ｄ 鑑定評価額 ２９万６０６０円（／㎡） \n ３２万３７００円（／㎡）×０．８＋１２万２０００円（／㎡）×０．１＋２４万９ \n ０００円（／㎡）×０．１＝２９万６０６０円（／㎡） \n ｅ 総額 ２億３９３３万４９０４（円） \n ２９万６０６０円（／㎡）×８０８．４０㎡＝２億３９３３万４９０４円 \n (イ) 丙鑑定は、本件土地２に鉄骨造３階建ての共同住宅を建築して賃貸することを想定して収益価格を求めているところ、その賃料について、最寄り駅からバス便の利用を要する土地であること及び高圧線が嫌悪施設としてマイナス要因となることを挙げて、最寄り駅周辺の賃料相場から減額して査定している。しかしながら、本件土地２の上空に高圧線は通っておらず、丙鑑定においても、取引事例比較法では、本件土地２の上空に高圧線が通っていることを減額要素として考慮していないのであるから、丙鑑定は、適当でない要素を考慮している上、同一鑑定書内で矛盾する立場をとっているといわざるを得ない。また、 \n 丙鑑定は、収益価格を導くに際して、還元利回りの率を７パーセントと査定しているところ、前記アと同様の批判が当てはまる上、本件土地２には、鉄骨造３階建ての共同住宅を建築して賃貸することを想定しており、木造２階建ての共同住宅を建築して賃貸することを想定する本件土地１とは状況が異なるにもかかわらず、そのことには一切触れずに漫然と還元利回りを７パーセントと査定しており、信用性が低いといわざるを得ない。なお、 \n 本件土地２の還元利回りの率を４．５パーセントとした場合には、その他を丙鑑定によるとすると、本件土地２の収益価格は、１９万円（／㎡）となる。 \n ウ 本件土地３について丙鑑定は、本件土地３について、鉄筋コンクリート造６階建の共同住宅を建築して賃貸することを想定し、還元利回りの率を本件土地１及び本件土地２と同様に７パーセントと査定しているものの、同率を４．５パーセントとした場合には、その他を丙鑑定によるとすると、 \n 本件土地３の収益価格は、２１万円（／㎡）となる。 \n (7) 以上によれば、本件各処分における本件各土地の時価額の合計５億６４０８万２３１１円 \n （１億０５５１万１４３４円（本件土地１）＋２億３９９８万０００７円（本件土地２）＋２億１８５９万０８７０円（本件土地３））は、被告取引事例比較法を用いて算定されたものであるから合理的である。また、相続税評価額還元法による本件各土地の評価額が合計５億４９ \n ６９万５９９０円（７７０１万３６３５円（本件土地１）＋２億５７０１万１５８０円（本件土地２）＋２億１５６７万０７７５円（本件土地３））と近似する額となっていることや、丁鑑定における本件各土地の評価額が６億４１４８万円（１億１７０６万円（本件土地１）＋２億６１１１万円（本件土地２）＋２億６３３１万円（本件土地３））であることからも、本件各処分における本件各土地の時価額の合理性は明らかというべきである。 \n したがって、本件各処分は適法である。 \n （原告の主張の要旨） \n (1) 本件各土地の評価手法ア 相続税評価額を０．８で除した価額は、公示価格の近似値を示すということができ、公示価格は、自由な取引において通常成立すると考えられる価格、すなわち、通常の取引がされた場合に成立すると認められる客観的価格であるから、法人の取得した土地の時価額を評価するに当たっても、相続税評価額還元法（相続税評価額を０．８で除して得た額が評価対象土地の時価額であるとする方式）によって評価することが著しく不適当であると認められない限り、同手法を用いるべきである。このように解することにより、課税担当職員の恣意の排除、納税者の便宜、公平、徴税費用の節減等を図ることができ、合理的である。 \n 本件各処分においては、相続税評価額還元法によって評価することが著しく不適当であると認められるような事情が見当たらないのであるから、同手法を用いて得られた評価額を本件各土地の時価額とすべきである。 \n イ 不動産の鑑定評価に当たっては、単一の評価手法のみを用いて評価することは妥当とはされていない。被告取引事例比較法においては、①比較の対象として選択された基準地、想定地について、本件各土地とは面積、周辺環境等が著しく異なる土地が恣意的に選択されていること、②調査不足により誤認した事実を前提として評価がされていること、③土地価格比準表における格差の評価の基準やこれを採用した具体的根拠も明らかではないこと、④標準化補正値を算出するに際し、画地条件以外の個別的要因が比較されていないこと、⑤本件土地２及び本件土地３は広大であって、本件土地２は、現況が雑種地で多数の樹木・庭石等が設置されている上、土地に段差があり、本件土地３は、現況が畑であり、いずれも多額の造成費がかかると判断されるにもかかわらず、被告は、本件土地２及び本件土地３の時価額を評価するにつき、そのことを考慮していないことなど不合理な点がある。仮に、取引事例比較法が土地の鑑定評価の方法の一つとして確立されたものであり、土地価格比準表がそれなりの合理性をもって作成され、被告取引事例比較法における評価が土地価格比準表に基づいたものであるとしても、実際の本件各土地についての被告取引事例比較法による評価は、到底信用することはできず、合理性は認められない。 \n なお、取引事例比較法を正しく適用した場合の本件各土地の評価額は、本件各処分における本件各土地の評価額を大きく下回るのであるから、このことからも、本件取引事例比較法により算定された本件各土地の評価額が不合理であることは明らかである。そして、原告が不動産鑑定士戊に依頼して行った本件各土地の平成１４年１月２７日時点の価格についての不動産鑑定（甲５６～５８。以下「戊鑑定」という。）の評価額も、本件各処分における本件各土地の評価額を下回るのであるから、このことからも、本件取引事例比較法により算定された本件各土地の評価額が不合理であることは明らかである。 \n (2) 本件土地１の時価額ア 本件土地１（本件土地イ及び本件土地ロ）の一体評価の可否及びその最有効利用について原告が乙から死因贈与を受けたのは本件土地１であり、本件土地イと本件土地ロとの間には、不動産として別個独立の甲所有の本件土地ハが存在する。また、甲が本件土地ハを一緒に処分するという仮定的な事実を前提としなければ、本件土地１を一体として処分することは不可能である。実際に、甲は、原告が本件土地１を取得する以前から本件土地ハを購入して所有していたのであり、甲自身が本件土地ハを所有する意図をもって購入したことは明らかである上、甲は、Ｂとの間で、本件送電線契約２を締結して、原告とは独立して、本件土地１について補償を受けて収益している。そのような本件土地１及び本件土地ハについて、 \n 単純に、表面上の利用形態が一体利用しているように見えるからといって、実際上の権利関係を捨象して所有者の異なる複数の土地を一体として評価することは、実態を見誤った前提に基づく評価であって採用すべきではない。したがって、本件土地１は、別個に評価することが妥当である。 \n また、本件土地１は、その中央に位置する送電線下地部分において、本件送電線契約１により建造物の築造等が禁止されており、これを変更することについては不確定要因を伴うのであるから、その変更が容易であることを前提にその最有効利用が戸建住宅地であるとはいえない。 \n イ 相続税評価額還元法による評価額について \n (ア) 本件土地イの相続税評価額（ｂとｃの合計） ３６０３万５８２３円 \n ａ １平方メートル当たりの価額 １５万１１７６円 \n ［２２万円（正面路線価）×１．００（奥行価格補正率）＋２２万円（側方路線価） \n ×０．９８（奥行価格補正率）×０．０３（二方路線影響加算率）×｛１２．２ｍ／ \n １４．０ｍ（接道部分のあん分割合）｝］×０．６７（不整形地補正率）＝１５万１１ \n ７６円 \n ｂ 本件送電線契約１設定部分の価額 １０６０万０４６１円 \n １５万１１７６円（前記ａ）×｛１－０．６（借地権割合）｝×１７５．３０㎡（本件土地イの本件送電線契約１設定部分の面積）＝１０６０万０４６１円 \n ｃ 本件送電線契約１設定部分以外の価額 ２５４３万５３６２円 \n １５万１１７６円（前記ａ）×１６８．２５㎡（本件土地イの本件送電線契約１設定部分以外の面積）＝２５４３万５３６２円 \n (イ) 本件土地ロの相続税評価額（ｂとｃの合計） １２９６万４６３８円 \n ａ １平方メートル当たりの価額 １８万１７９４円 \n ｛２２万円（正面路線価）×１．００（奥行価格補正率）＋２２万円（側方路線価） \n ×０．９２（奥行価格補正率）×０．０５（側方路線影響加算率）｝×０．７９（不整形地補正率）＝１８万１７９４円 \n ｂ 本件送電線契約１設定部分の価額 ５４６万６１８１円 \n １８万１７９４円（前記ａ）×｛１－０．６（借地権割合）｝×７５．１７㎡（本件土地ロの本件送電線契約１設定部分の面積）＝５４６万６１８１円 \n ｃ 本件送電線契約１設定部分以外の価額 ７４９万８４５７円 \n １８万１７９４円（前記ａ）×４５．８３㎡（本件土地ロの本件送電線契約１設定部分以外の面積）×｛１－０．１（残地部分の面積が狭小であるため、著しく利用制限のある土地として１０％の控除を適用）｝＝７４９万８４５７円 \n (ウ) 相続税評価額還元法による評価額 ６１２５万０５７５円 \n ４５０４万４７７８円（＝３６０３万５８２３円（前記(ア)）÷０．８）＋１６２０万 \n ５７９７円（＝１２９６万４６３８円（前記(イ)）÷０．８）＝６１２５万０５７５円ウ 取引事例比較法による評価額について \n (ア) 別紙４－１記載の公示地（調布●●）並びに本件土地Ａないし本件土地Ｃについては、 \n いずれも建造物等の築造に制限はなく、街区の整った住宅地域が展開されており、本件土地１とは条件を大いに異にするから、本件土地１の評価のための基準地としては不適切である。 \n (イ) 公示地（調布●●）及び本件土地Ａないし本件土地Ｃの公示価格又は取引価格、事情補正値、時点修正値、標準化補正値、地域要因補正値、地域要因補正後の価格、標準価格、 \n 個別的要因補正値、試算価格、本件土地１の地積及びそれらを適用して得られた本件土地 \n １の時価額に関する原告の主張は、別表５－１の「原告主張」欄記載のとおりである。 \n なお、標準化補正値、地域要因補正値及び個別的要因補正値の算定根拠に関する原告の主張は、別表６－１の「原告主張」欄記載のとおりである。 \n (ウ) これに対し、被告の主張する各補正値は、次のとおり、考慮すべき事情を十分考慮していないから、不合理である（本項中の表は、すべて別表６－１中の表を指す。）。 \n ａ 「街路条件」について \n (a) 「接面街路系統・構造等の状態」中の「系統及び連続性」について、本件土地Ｂは、幹線道路から離れているから、１－２表においては「やや劣る」、２－３表においては「劣る」とされるべきであり、本件土地Ｃは、前面道路が一方通行であるから、 \n １－３表及び２－４表においては「劣る」とされるべきである。 \n (b) 本件土地Ａ及び本体土地Ｂの周辺は区画整理されており、接面街路や周辺道路においては一方通行や行き止まり等もなく、街路の配置につき比較的均衡が取れているから、２－２表及び２－３表において、「接面街路の系統・構造等の状態」中の「配置」は「普通」とされるべきである。 \n (c) 本件土地Ｂは、４メートル道路に接道しているから、２－３表において、「接面街路の系統・構造等の状態」中の「幅員」は「普通」とされるべきである。 \n ｂ 「交通・接近条件」について公示地（調布●●）及び本件土地Ａの徒歩圏内には大型スーパーマーケットがあり、 \n 本件土地Ｂの近くにはスーパーマーケット及び健康センターがあり、その周辺には商店街があるから、「商店街の配置の状態」又は「商店街との接近の程度」中の「最寄商店街への接近性」について、１－１表、１－２表、２－１表、２－２表及び２－３表においては「やや優る」とされるべきであり、本件土地Ｂ及び本件土地Ｃの近くにはスーパ \n ーマーケットがあるから、「商店街の配置の状態」中の「最寄商店街の性格」について、 \n ２－３表、２－４表においては「普通」とされるべきである。 \n ｃ 「環境条件」について \n (a) 本件土地１は、道路を挟んだ東側に、Ｄ協会の試験場が存在し、煤煙脱硫装置等があることによる醜い景観となっており、騒音が甚だしいから、２－１表ないし２－ \n ４表において、「自然的環境の良否」は「劣る」とされるべきである。 \n (b) 本件土地１は、上空に送電線があり、その下地部分は建造物の築造が禁止されており、周囲には、Ｄ協会の試験場、農地、未利用地が混在し、農家住宅が点在し、夜間は人通りも絶える地域であるから、２－１表ないし２－４表において、「社会的環境の良否」並びに「各画地の面積・配置及び利用の状態」中の「土地の利用度」及び \n 「周辺の利用の状態」は「劣る」とされるべきである。 \n (c) 本件土地１は、上下水道及び都市ガス等の工事をすれば設置することが可能であるが、現状では設置されていないから、「供給処理施設の状態」中の「上水道」、「下水道」及び「都市ガス等」は、２－１表ないし２－４表においては「可能」、３表においては「劣る」とされるべきである。 \n (d) 本件土地１は、上空に送電線があるから、２－１表ないし２－４表及び３表において、「危険施設、処理施設等の有無」又は「危険施設・処理施設等との接近の程度」 \n は「やや大きい」とされるべきである。 \n (e) 公示地（調布●●）は、もともと水田であり、地盤が軟弱であるから、２－１表において、「自然的環境の良否」は「劣る」とされるべきである。 \n (f) 公示地（調布●●）は、優良住宅地にあるから、２－１表において、「社会的環境の良否」は「優る」とされるべきである。 \n (g) 本件土地Ｂの所在する地区は、整然と区画整理されているから、２－３表において、「各画地の面積・配置及び利用の状態」中の「各画地の配置状態」は「優る」とされるべきである。 \n ｄ 「画地条件」について本件土地１のうち約５３．９％を占める送電線下地部分は、建造物の築造をすることができず、当該部分は６０％は減価するとみるべきであるから、３表において、「その他」中の「高圧線下地」は「３２％（＝５３．９％×６０％）減」とされるべきである。 \n (エ) したがって、公示地（調布●●）及び本件土地Ａないし本件土地Ｃを基準地とし、取引事例比較法を用いたとしても、本件土地１の評価額は、４６３３万１３６１円となる。 \n エ 戊鑑定の評価額について戊鑑定における本件土地１の評価額は、別表３－１「戊鑑定欄」記載のとおり、本件土地イが６５６０万円、本件土地ロが１５７０万円であるから、合計８１３０万円である。 \n (3) 本件土地２の時価額ア 相続税評価額還元法による評価額について \n (ア) 広大地評価の手法について平成１６年６月４日付け改正後の評価通達２４－４（広大地の評価）は、平成１６年１月１日以降に発生した相続等に適用すべきものとされているものの、より正確な時価額を反映することができることから改正された以上、本件各土地の時価額の評価に当たっては、 \n 通達の適用時期にとらわれることなく、改正後の評価通達を採用し、広大化補正率を用いて本件土地２の時価額を評価すべきである。 \n なお、本件土地２は、８０８．４０平方メートルある広大な土地であり、宅地の安全性を考えた有効利用を行おうとすれば、中央に開発道路を設け、７区画の宅地造成をすることが最適であり、この場合の潰れ地は１０２．４０平方メートルとなるから、仮に、改正前の評価通達を適用するとしても、有効宅地面積は７０６平方メートルとして、有効宅地化率を計算するべきである。 \n (イ) １平方メートル当たりの価額 １３万９８９５円 \n ２５万円（正面路線価）×（０．６－０．０５×８０８．４０㎡÷１０００㎡）（広大地補正率）＝１３万９８９５円 \n (ウ) 相続税評価額還元法による評価額 １億４１３６万３８９７円 \n １３万９８９５円（前記(イ)）×８０８．４０㎡（本件土地２の面積）÷０．８＝１億 \n ４１３６万３８９７円イ 取引事例比較法による評価額について \n (ア) 本件土地２は、著しく広大であり、分筆及び区画整理を行った上でなければ、一般消費者が購入することができる宅地として利用することはできず、開発許可も必要となるのに対し、各基準地は、そのまま一般消費者が購入することができる宅地として利用することができる土地であり、本件土地Ｆの標準化補正値による補正後の価格は突出して高い。 \n また、別表４－２記載の公示地（調布●●）並びに本件土地Ｅ及び本件土地Ｆは、平成１ \n ４年当時、更地ではなく、上記の公示地には、小規模な私設郵便局が建っていた。 \n (イ) 公示地（調布●●）及び本件土地Ｄないし本件土地Ｆの公示価格又は取引価格、事情補正値、時点修正値、標準化補正値、地域要因補正値、地域要因補正後の価格、標準価格、 \n 個別的要因補正値、試算価格、本件土地２の地積及びそれらを適用して得られた本件土地 \n ２の時価額に関する原告の主張は、別表５－２の「原告主張」欄記載のとおりである。 \n なお、標準化補正値、地域要因補正値及び個別的要因補正値の算定根拠に関する原告の主張は、別表６－２の「原告主張」欄記載のとおりである。 \n (ウ) これに対し、被告の主張する補正値は、次のとおり、考慮すべき事情を十分考慮していないから、不合理である（本項中の表は、すべて別表６－２中の表を指す。）。 \n ａ 「街路条件」について \n (a) 「接面街路の系統・構造等の状態」中の「系統及び連続性」について、本件土地 \n ２、公示地（調布●●）、本件土地Ｄ及び本件土地Ｅは、幹線街路との系統、連続性が一般的に優れているとは必ずしもいえないから、それぞれ２－１表ないし２－４表において「普通」とされるべきであり、本件土地Ｆは一般的に優れているといえるから、１－３表において「やや優る」とされるべきである。 \n (b) 本件土地Ｆの接面道路の幅員は１０メートルであるから、「接面街路の系統・構造等の状態」中の「幅員」は、１－３表において「やや優る」、２－４表においで「優る」とされるべきである。 \n ｂ 「交通・接近条件」について本件土地Ｆは、児童館、小学校及びＥ公園が近隣にあるから、１－３表、２－４表において、「公共施設等との接近の程度」又は「学校、公園、病院の配置の状態」は「やや優る」とされるべきである。 \n ｃ 「環境条件」について \n (a) 本件土地２は、造園関係の資材置き場であり、周囲には、Ｄ協会の試験場、農地、 \n 未利用地が混在し、農家住宅が点在し、夜間は人通りも絶える地域であるから、２－ \n １表ないし２－４表において、「社会的環境の良否」並びに「各画地の面積・配置及び利用の状態」中の「土地の利用度」及び「周辺の利用の状態」は「劣る」とされるべきである。 \n (b) 本件土地２は、上下水道及び都市ガス等は工事を行えば設置可能であるが、現状では設置されていないから、「供給処理施設の状態」中の「上水道」、「下水道」及び \n 「都市ガス等」は、２－１表ないし２－４表において「可能」、３表において「劣る」 \n とされるべきである。 \n ｄ 「画地条件」について本件土地Ｆについては、間口の長さは２４．９４メートル、奥行の長さは２０．０１メートルであるから、１－３表において「地積・間口・奥行・形状等」中の「奥行長大」 \n は「やや劣る」とされるべきである。 \n (エ) したがって、公示地（調布●●）及び本件土地Ｄないし本件土地Ｆを基準地とし、取引事例比較法を用いたとしても、本件土地２の評価額は、１億５４９６万４６２１円となる。 \n ウ 戊鑑定の評価額について戊鑑定における本件土地２の評価額は、別表３－２「戊鑑定欄」記載のとおり、２億２４ \n ００万円である。 \n (4) 本件土地３の時価額ア 相続税評価額還元法による評価額について \n (ア) 広大地評価の手法について前記(3)ア(ア)と同様に、本件各土地の時価額の評価に当たっては、通達の適用時期にとらわれることなく、改正後の評価通達を採用し、広大化補正率を用いて本件土地３の時価額を評価すべきである。 \n なお、本件土地３は、６１９．５５平方メートルある広大な土地であり、宅地の安全性を考えた有効利用をしようとすれば、中央に開発道路を設け、５区画の宅地造成をすることが最適であり、この場合の潰れ地は１１９．５５平方メートルとなるから、仮に、改正前の評価通達を適用するとしても、有効宅地面積は５００平方メートルとして、有効宅地化率を計算するべきである。 \n (イ) １平方メートル当たりの価額 １６万５０１６．５２５円 \n ２９万円（正面路線価）×（０．６－０．０５×６１９．５５㎡÷１０００㎡）（広大地補正率）＝１６万５０１６．５２５円 \n (ウ) 相続税評価額還元法による評価額 １億２７７９万４９８５円 \n １６万５０１６．５２５円（前記(イ)）×６１９．５５㎡（本件土地３の面積）÷０． \n ８＝１億２７７９万４９８５円イ 取引事例比較法による評価額について \n (ア) 本件土地３は、ＪＲＬ駅の徒歩圏には属さず、第二種住居地域にあり、規模の大きな廃棄物処理施設群に囲まれ、それに伴う臭気等の公害が生じているのに対し、別紙４－３記載の公示地（三鷹●●）は、ＪＲＬ駅の徒歩圏に属し、公示地（三鷹●●）及び同（三鷹●●）は、準工業地域にあり、公示地（三鷹●●）、同（三鷹●●）、同（三鷹●●）及び本件土地Ｇは、上記のような公害を全く考慮に入れる必要がない土地であって、本件土地３の諸条件と格段の差があるほか、本件土地Ｇは三方路の角地で幹線道路から一方通行を入った特殊な位置にあり、およそ標準的な画地にはなじまないものである。 \n また、本件土地３は、本件土地２と同様に、広大であり、分筆及び区画整理を行った上でなければ、宅地として利用することはできないなどの事情があり、公示地（三鷹●●）、 \n 同（三鷹●●）及び同（三鷹●●）は、いずれも平成１４年当時にはマンションが建設されていた。 \n このようなことからすると、本件土地３の時価額を評価するに当たっては、不動産鑑定評価の手法のうち開発法が採用されるべきであったものであり、仮に被告の主張する手法を採用するとしても、これらの土地は、本件土地３の時価額を評価するための基準地としては不適切である。 \n (イ) 公示地（三鷹●●）、同（三鷹●●）、同（三鷹●●）及び本件土地Ｇの公示価格又は取引価格、事情補正値、時点修正値、標準化補正値、地域要因補正値、地域要因補正後の価格、標準価格、個別的要因補正値、試算価格、本件土地３の地積及びそれらを適用して得られた本件土地３の時価額に関する原告の主張は、別表５－３の「原告主張」欄記載のとおりである。 \n なお、標準化補正値、地域要因補正値及び個別的要因補正値の算定根拠に関する原告の主張は、別表６－３の「原告主張」欄記載のとおりである。 \n (ウ) これに対し、被告の主張する補正値は、次のとおり、考慮すべき事情を十分考慮していないから、不合理である（本項中の表は、すべて別表６－３中の表を指す。）。 \n ａ 取引価格等について本件土地Ｇは、地積が６１０．７２平方メートルであり、１平方メートル当たりの価格は３７万２０６９円であるにも関わらず、被告は、地積更正前の登記簿上の地積である５８９．７３平方メートルを前提として１平方メートル当たりの価格を３８万５３１ \n ２円と算出しており、誤りである。また、被告の主張する価格時点にも問題がある \n ｂ 「街路条件」について \n (a) 本件土地３及び公示地（三鷹●●）は、Ｒ線（以下「Ｓ通り」という。）に接しているから、１－２表及び３表において、「接面街路の系統・構造等の状態」中の「系統及び連続性」は「やや優る」とされるべきであり、本件土地Ｇは、Ｓ通りからの進入路が一方通行であるから、１－３表において、上記項目は「やや劣る」とされるべきである。 \n (b) 公示地（三鷹●●）の接面道路の幅員は１０メートル以上あるから、「接面街路の系統・構造等の状態」中の「幅員」は１－２表においては「やや優る」、２－３表においては「優る」とされるべきである。 \n ｃ 「交通・接近条件」について \n (a) 「都心との距離及び交通施設の状態」又は「交通施設との距離」中の「最寄駅への接近性」について、本件土地３は、Ｌ駅から２．３キロメートルと遠く、バス便も少なく、バス停も遠いから、２－１表ないし２－４表及び３表において「やや劣る」 \n とされるべきであり、公示地（三鷹●●）は、Ｌ駅から１．３キロメートルで徒歩圏内にあり、駅までのバス便も多く、バス停も近いから、１－２表において「やや優る」 \n とされるべきである。 \n (b) 「商店街との接近の程度」又は「商店街の配置の状態」中の「最寄商店街への接近性」について、本件土地３は、スーパーマーケットまで約７５０メートルも離れているから、２－１表ないし２－４表及び３表において「劣る」とされるべきであり、 \n 公示地（三鷹●●）はスーパーマーケットまで近いから、１－２表において「優る」 \n とされるべきである。 \n (c) 「学校・公園・病院の配置の状態」又は「公共施設との接近の程度」について、 \n 本件土地３は、徒歩圏内に市役所、小中学校、病院等の公共施設が徒歩圏内に存在しないから、２－１表ないし２－４表及び３表において「劣る」とされるべきであり、 \n 公示地（三鷹●●）は、市役所、図書館、小中学校、公園が徒歩５分以内の近隣に所在するから、２－１表において「優る」とされるべきであり、公示地（三鷹●●）は、 \n 小中学校、病院が徒歩５分以内の近隣に所在するから、１－１表及び２－２表において、「やや優る」とされるべきである。 \n ｄ 「環境条件」について \n (a) 本件土地３は、隣地にごみ処理施設群があるから、２－１表ないし２－４表において、「自然的環境の良否」並びに「各画地の面積・配置及び利用の状態」中の「土地の利用度」及び「周辺の利用の状態」は「劣る」とされるべきであり、「危険施設、 \n 処理施設等の有無」は「大きい」とされるべきであり、「公害の発生の程度」は「大きい」とされるべきであり、３表において、「周囲の状態」中の「隣接地の利用状況」 \n は、「相当に劣る」とされるべきであり、「危険施設処理施設等との接近の程度」は「大きい」とされるべきである。 \n (b) 本件土地３は、公共交通の便が悪い陸の孤島のような場所に存し、生活のための公共施設や商店街もない一方、研究所やごみ処理施設があるから、２－１表ないし２ \n －４表において、「社会的環境の良否」は「劣る」とされるべきである。 \n (c) 本件土地３は、上水道及び都市ガス等は工事を行えば設置可能であるが、現状では設置されていないから、「供給処理施設の状態」中の「上水道」及び「都市ガス等」 \n は、２－１表ないし２－４表において「可能」、３表において「劣る」とされるべきである。 \n (d) 公示地（三鷹●●）は、２－１表において、文教施設が整備され、街路も整然とした中高級住宅地であるから、「社会的環境の良否」は「優る」とされるべきであり、 \n 各画地の地積、形状等の均衡が取れ、配置が整然としている地域であるから、「各画地の面積・配置及び利用の状態」中の「各画地の配置の状態」は「優る」とされるべきである \n (e) 公示地（三鷹●●）は、近隣に工場が建ち並んでおり、１－１表において、「周囲の状態」中の「隣接地の利用状況」は「やや劣る」とされるべきである。 \n ｅ 「画地条件」について本件土地３は、南側に底辺の長い台形の不整形地であるから、３表において「地積・間口・奥行・形状等」中の「不整形地」は「やや劣る」とされるべきである。 \n ｆ 「行政的条件」について公示地（三鷹●●）及び公示地（三鷹●●）は、用途制限が格段に少ない準工業地域に存するから、１－１表及び１－２表において、「公法上の規制の程度」中の「用途地域及びその他の地域、地区等」は「弱い」とされるべきである。 \n ｇ 「その他」について本件土地３は、現在のごみ処理施設に加え、ごみ焼却施設の計画もあるから、２－１表ないし２－４表において「将来の動向」は「やや劣る」とされるべきであり、３表において「その他」は「やや劣る」とされるべきである。 \n (エ) したがって、公示地（三鷹●●）、同（三鷹●●）、同（三鷹●●）及び本件土地Ｇを基準地とし、取引事例比較法を用いたとしても、本件土地３の評価額は、１億０４１４万 \n ７５９４円となる。 \n ウ 戊鑑定の評価額について戊鑑定における本件土地３の評価額は、別表３－３「戊鑑定欄」記載のとおり、１億７９ \n ００万円である。 \n (5) 以上のとおりであって、本件各処分における本件各土地の時価額５億６４０８万２３１１円は、合理的な手法である相続税評価額還元法を用いず、不合理な手法である本件取引事例比較法を用いて算定されたものである上、相続税評価額還元法による評価額合計３億３０４０万 \n ９４５７円、取引事例比較法を正しく適用した場合の評価額合計３億０５４４万３５７６円及び戊鑑定の評価額による評価額合計４億８４３０万円のいずれをも上回るから、不合理であることは明らかである。 \n \n \n 第３ 当裁判所の判断 \n １ 本件各土地の時価額等に関する被告の主張について \n (1) 法人が死因贈与により土地を取得することは、法人税法２２条２項の「無償による資産の譲受け」に当たり、当該法人の所得の金額の計算上、これに係る収益の額を益金の額に算入すべきであり、当該収益の額については、当該資産の取得時の時価額をもって計算されるべきと解されるところ、その具体的な計算の在り方については、同条４項において、一般に公正妥当と認められる会計処理の基準に従って計算されるものとする旨が規定されているほかは、関係する法令に具体的な定めはない。 \n 前記前提事実（第２の２）のとおり、原告は乙の死亡により本件死因贈与契約に基づき本件各土地を取得しており、本件受贈益の額、すなわち本件各土地の乙の死亡時の時価額については、原告の本件事業年度の所得の金額の計算上、益金の額に算入すべきところ、被告は、前記第２の４（被告の主張の要点）(1)のとおり、本件各処分において、被告取引事例比較法を用いて本件各土地の時価額を算定したと主張していることから、その算定の結果を採用することができるか否かについて検討する。 \n (2) 国土交通省が作成した不動産鑑定評価基準（平成１４年７月３日全部改正に係るもの。甲 \n ５５、乙５３）によれば、不動産の価格を求める鑑定評価の基本的な手法は、原価法、取引事例比較法及び収益還元法に大別されるほか、これらの三手法の考え方を活用した開発法等の手法があり、このうち、取引事例比較法は、多数の取引事例を収集して適切な事例の選択を行い、 \n これらに係る取引価格に必要に応じて事情補正及び時点修正を行い、かつ、地域要因の比較及び個別的要因の比較を行って求められた価格を比較考量し、これによって対象不動産の試算価格（比準価格）を求める手法であり、収益還元法は、対象不動産が将来生み出すであろうと期待される純収益の現在価値の総和を求めることにより対象不動産の試算価格（収益価格）を求める手法であるとされている。本件各土地は更地であるところ、不動産鑑定評価基準によれば、 \n 不動産の価格は、一般に当該不動産の収益性を反映して形成されるものであり、収益は、不動産の経済価値の本質を形成するものであるから、収益還元法の手法は、文化財の指定を受けた建築物等の一般的に市場性を有しない不動産以外のものにはすべて適用すべきであり、自用の住宅地といえども賃貸を想定することにより適用すべきとされており、更地の鑑定評価額は、 \n 更地並びに自用の建物及びその敷地の取引事例に基づく比準価格並びに収益還元法中の土地残余法（建物等の価格を収益還元法以外の手法によって求めることができる場合に、敷地と建物等からなる不動産について敷地に帰属する純収益から敷地の収益価格を求める方法）による収益価格を関連付けて決定するものとされており、このような考え方は、平成１４年１月当時に施行されていた不動産鑑定評価基準においても同様であった（公知の事実）。そして、不動産鑑定評価基準は、不動産鑑定士が不動産の鑑定評価を行うに当たっての統一的基準に位置付けられるものであるから、本件各土地の時価額の算定については、特段の事情の存する場合は別論として、同基準に従うことが法人税法２２条４項の趣旨に沿うものというべきである。 \n 証拠（乙４～１２）及び弁論の全趣旨によれば、本件各処分において本件各土地の時価額を算定するに当たって用いられた被告取引事例比較法の内容については、前記第２の４（被告の主張の要点）(1)イのとおりであることが認められ、被告取引事例比較法は、公示価格及び取引事例の価格を基として、時点修正並びに標準化補正値、地域要因補正値及び個別的要因補正値による補正をすることにより、対象地である本件各土地の平成１４年１月２７日における時価額を評価しようとするものであり、取引事例比較法の考え方を基礎とする鑑定評価の手法であるということができる。しかしながら、本件各土地については、一般的に市場性を有しない不動産であるとは認められないにもかかわらず、被告取引事例比較法においては、本件各土地の時価額の評価に当たって収益還元法が適用されておらず、本件に提出された証拠をもっても、 \n そのことについて、やむを得ないといった肯認するに足りる事情を認めることはできないから、 \n 丙鑑定も指摘するように、被告取引事例比較法による算定の結果については、不動産の価格の評価につき社会通念上確立された考え方であるというべき上記の不動産鑑定評価基準に照らし、その信用性を直ちには肯定し難いというべきである。 \n また、被告取引事例比較法においては、土地価格比準表を用いて（弁論の全趣旨）、対象地である本件各土地のそれぞれにつき幾つかの基準地を選定した上で、それらの存する地域がそれぞれ別のものであるとの前提の下に、各種の評価がされているところ、証拠（甲２６）によれば、一般に、基準地が対象地の存する地域以外の地域に存する場合の土地価格比準表を用いての評価においては、それぞれの地域において標準的な画地を設定し、これらの間で地域要因の比較を行うとともに、各地域における標準的な画地と基準地又は対象地との間で画地条件のみに限られない各種の個別的要因の比較を行うものとされていることが認められる。被告取引事例比較法は、上記とは異なり、本件各土地のそれぞれにつき選定された幾つかの基準地について、それらのうち想定地とされるものとの間において画地条件の比較をして補正をした各金額を算出した上で、各基準地及び本件各土地の存する各地域の間で地域要因の比較をして算出した地域要因補正値を上記の各金額に乗じ、それらを平均して標準価格を求め、これを基礎に、 \n 基準地中の想定地とされるものと本件各土地との個別的要因の比較をした補正を行ったものである。もっとも、この手法においては、地域要因の比較をするに当たって各地域につき基礎とされた画地は示されておらず、結局、各基準地及び本件各土地を基準としてその判断内容を検討することとなるところ、各基準地につき想定地との画地条件の相違のみに着目して補正をしたものが、地域要因の比較をする上で適切な当該地域における画地に当然に当たるということができるのかどうか。また、本件各土地をもって地域要因の比較をする上で適切な当該地域における画地に当たると仮定することが当然に相当ということができるのかどうか、その上で、 \n 上記の補正された各基準地の金額に本件各土地の存する地域との比較により算出したとされる地域要因補正値を乗じたものを単純に平均することに、十分な合理性があるということができるのかどうか、それぞれ異なる地域にあることが前提とされている想定地と本件各土地との間であたかも同一の地域に存するように個別的要因を比較することに問題がないのか等の点については、なお検討の余地が残るところである。 \n (3) 被告取引事例比較法に基づく本件各土地の時価額の算定において、被告が主張する本件各土地及び各基準地の「所在」、「公示価格又は取引価格」、「価格時点」、「地目」、「類型」、「地積」、「形状及び間口と奥行との比率」、「街路条件」、「交通・接近条件」、「環境条件」及び「行政的条件」については、別紙４－１ないし４－３のとおりであり、「時点修正値」、「標準化補正値」、「地域要因補正値」、「個別要因補正値」等については、別紙５－１ないし５－３の各「被告主張」欄のとおりであり、それらの補正値の算出の根拠等については、別紙６－１ないし６ \n －３の各「被告主張」のとおりである。 \n 上記の被告が主張する被告取引事例比較法に基づく本件各土地の時価額の算定等については、別表５－１ないし５－３及び別表６－１ないし６－３のとおり、標準化補正値、地域要因補正値及び個別要因補正値並びにそれらの算出根拠についての当事者の主張には争いがあるところであり、被告の主張の上記の各補正値の算出等の合理性については、なお検討の余地があるものと考えられる。 \n その上で、例えば、証拠（甲５８、乙５８、本件土地３についての丙鑑定）によれば、①本件土地３の西側道路には、上水道の配管が敷設されておらず、本件土地３につきこの点を手当てするには、これが敷設されている南方約８０メートルを東西に走るＴ道路等から敷設する必要があること、②本件土地３の南方の近隣には、Ｆ等の嫌悪施設が存在することが認められる。 \n 一方、本件各処分においては、別表６－３の「被告主張」欄記載のとおり、地域要因補正値及び個別的要因補正値の算出等において、①「供給処理施設の状態」の「上水道」が「有」（２ \n －１表ないし２－４表）又は「普通」（３表）とされており、上記の上水道の配管が敷設されていないことが適切に考慮されていることはうかがわれず、工事を行えば上水道を設置することが可能であることを踏まえても、上記のような評価をすることの合理性には疑問が残らざるを得ず、また、②上記の嫌悪施設の存在について、「危険施設、処理施設等の有無」が「無」 \n とされており（上記各表）、「公害発生の程度」の「騒音、大気汚染等」が「やや大きい」とされているとしても（２－１表ないし２－４表）、十分に考慮されているか否かには疑問が残らざるを得ない。さらに、証拠（甲２３、２４の１ないし１７、乙４５）によれば、本件土地Ｇは、平成１３年３月２７日付けで、売買総額を２億２７２３万０２００円とし、地積を実測面積とするものとして、仮の実測面積である６１０．７２平方メートルを前提として売買されたこと、上記の土地については、後に分筆がされ、それらの地積の合計は上記の仮の実測面積のとおりとなることが認められ、上記の取引日における本件土地Ｇの１平方メートル当たりの取引価格は、３７万２０６９円（＝２億２７２３万０２００円÷６１０．７２平方メートル）となるから、本件土地３の時価額の算定において、別表３－３及び同４－３で被告の主張する金額（３８万５３１２円）には誤りがあるといわざるを得ない。 \n (4) 以上に述べたように、本件各処分における被告取引事例比較法による本件各土地の時価額の算定の結果については、その信用性に疑問があるというべきである。 \n (5) なお、被告は、別紙３－１ないし３－３の各「丁鑑定」欄記載のとおり、丁鑑定における本件各土地の評価額は本件各処分における本件各土地の価格を上回る合計６億４１４８万円であることからすれば、被告の主張する本件各処分における本件各土地の価格は、本件各土地の時価額を超えるものではなく、合理的であると主張する。 \n しかしながら、丁鑑定は、被告の依頼により行われたものであり、その信用性は十分慎重に検討すべきものである一方、本件においては、訴訟手続中で丙鑑定が行われており、後に述べるとおり、丙鑑定の内容については、特段信用性を否定すべき事情は見当たらないことからすれば、丁鑑定をもって、被告が主張するところが立証されたものと直ちに認めることはできないというべきである。 \n ２ 本件各土地の時価額について \n (1) 丙鑑定についてア 鑑定評価の手法等について丙鑑定は、更地である本件各土地の更地としての正常価格を求めるものとし、それぞれ、 \n 取引事例比較法による比準価格、土地残余法による収益価格及び開発法による試算価格を求め、それらの各価格について客観的、批判的に再吟味しながら、各手法に共通する価格形成要因に係る判断の整合性も考慮して調整を行って、評価額を求めるものとしている。前記１ \n (2)に述べたとおり、不動産鑑定評価基準においては、更地の価格の評価の手法として、更地等の取引事例に基づく比準価格並びに土地残余法による収益価格を関連付けて決定するものとされている上、同基準（甲５５、乙５３）によれば、当該更地の面積が近隣地域の標準的な土地の面積に比べて大きい場合等においては、開発法（大規模画地について、開発（一体利用又は分割利用）を想定して当該土地の価格を求める手法）による価格を比較考量して決定するものとされているところ、本件土地１の地積（実測）が４６４．５４平方メートル、 \n 本件土地２の地積（実測）が合計８０８．４０平方メートル、本件土地３の地積（実測）が合計６１９．５５平方メートルであり、比較的大きいということができることからすれば、 \n 上記の丙鑑定の評価の手法については、不動産鑑定評価基準に沿ったものであり、合理的であると認められる。 \n イ 本件土地１について \n (ア) 取引事例比較法による比準価格について丙鑑定は、本件土地１について２階建て住宅等を建築して使用することが最有効使用であると判断した上、①標準画地（東北側を５メートル市道に面して、地積１００平方メートル程度の整形な中間画地。なお、本件土地１についての丙鑑定書の１９頁には、５００平方メートルと記載されているが、１３頁及び２１頁の記載に照らし、誤記であることが明らかである。）を設定し、別表３－１の「丙鑑定」欄及び別表７－１－１－１のとおり、 \n ４の取引事例を選択して、必要に応じて事情補正、時点修正、建付減価補正、標準化補正及び地域格差補正をして各価格を算出し、各価格を平均して標準画地の比準価格を１平方メートル当たり２６万１０００円と算出したところ、上記の標準化補正及び地域格差補正の各率の根拠については、別表７－１－１－２のとおりであり、②個別格差による補正として、本件土地１の地積が上記の標準画地の地積と比較して広いこと及び上空に架設されている高圧線が嫌悪施設となることからマイナス１５パーセント、本件送電線契約１に基づく私法上の制限が存在することからマイナス５パーセント、本件土地１が不整形であることからマイナス３パーセント、本件土地が角画地であることからプラス５パーセントの計マイナス１８パーセントと査定し、比準価格として２１万４０００円（２６万１０００円×（１－１８％））と算出したものである。 \n 本件土地１及びその付近の状況等に関する他の証拠（甲８、１３、１４の１～５、１５、 \n ３６、５６、乙４、６、１９、２０、５６）に照らし、上記のような最有効使用についての判断や上記の各取引事例の選択に、特段不合理な点は見当たらず、また、上記の各補正についても、特段不合理な点は見当たらず、比準の過程も適切であることからすれば、上記の比準価格は、合理的に算出されたものと認めることができる。 \n (イ) 土地残余法による収益価格について丙鑑定は、別表７－１－２のとおり、本件土地１に木造２階建ての共同住宅を建築して賃貸することを想定し、駐車場収入及びＢからの本件送電線契約１に基づく補償料を加算して総収益を求め、総費用を求めて土地及び建物一体の純利益を算出し、これから建物に係る純収益を控除して土地に係る純収益を求め、これを還元利回りの率（７．０パーセント）を用いて還元して、収益価格を１平方メートル当たり１０万３０００円と算出したものである。 \n 上記の収益価格の算出方法については、上記の収益の算出の方法や過程等について特段不合理な点は見当たらず、また、上記の還元利回りの率についても、周辺地域における不動産賃貸の取引事例及びＣ研究所による不動産投資家調査の結果（平成１４年４月時点） \n を参考とし、市場動向、本件土地１の投資対象としての危険性、流動性、管理の困難性、 \n 資産としての安全性等の個別性を加味して査定されたものであり、著しく不合理とは認められないことなどからすれば、上記の収益価格は、合理的に算出されたものと認めることができる。 \n 被告は、丙鑑定が本件土地１の収益価格の算出の際に還元利回りの率を７パーセントと査定している点について、丙鑑定が比較の対象として選択した取引事例はいずれもおよそ参考にならないものであり、Ｃ研究所による不動産投資家調査の結果についても、本件土地１の周辺地域とはいい難いことなど、比較の対象とする値の選択が不適切であり、個別性を加味した過程も、全く不明であって、戊鑑定及び丁鑑定がいずれも還元利回り率を４． \n ５パーセントしていることからすれば、７パーセントと査定したことには合理性がないと主張する。 \n しかしながら、不動産の収益価格の算出に用いる還元利回りの率を査定するに当たっての資料の選択や勘案の仕方等については、評価主体の合理的な裁量にゆだねられているということができるところ、丙鑑定においては、その実施に先立って本件において証拠として提出されていた戊鑑定及び丁鑑定等の内容を参照した上で、新たに収集した取引事例や調査の結果を踏まえ、戊鑑定等における還元利回りの率が低率すぎるとして、７パーセントと査定するに至ったと認められるのであって、被告が指摘する点を勘案したとしても、 \n 丙鑑定における上記の還元利回りの率の査定が著しく不合理であるとまではいえないというべきである。 \n (ウ) 開発法による試算価格について丙鑑定は、本件土地１を４区画に区分し宅地として販売することを想定し、宅地等の販売総額を価格時点に割り戻した額から、建物の建築費及び発注者が直接負担すべき通常の付帯費用等を価格時点に割り戻した額を、それぞれ控除して求める方法により、開発法による試算価格を１平方メートル当たり２０万２０００円と算出し、その算出の根拠等については、別表７－１－３－１ないし別表７－１－５のとおりであるところ、上記の試算価格の算出の方法や過程に不合理な点は見当たらず、上記の試算価格は、合理的に算出されたものと認めることができる。 \n (エ) 鑑定評価額について丙鑑定は、前記(ア)の取引事例比較法による比準価格については、近隣地域及び周辺類似地域に存する取引事例から求めたものであり、比準の過程も適切にされ、実証的で比較的説得力が高いとする一方、前記(イ)の土地残余法による収益価格については、本件土地 \n １が最寄り駅からバスの利用を要する土地であることから比較的収益性が劣るとともに、 \n 容積率が８０パーセントであることから、土地を取得して建物を建築して賃貸しても、一般的には採算が合わないものであり、また、前記(ウ)の開発法による試算価格については私法上の制限が考慮されていないとして、これらを踏まえ、本件土地１の地域の同種の不動産に対する需給の動向、単価と総額との関連（市場性）等をも総合勘案した結果、比準価格を重視する一方、収益価格は本来の収益物件ではないために比重を低くし、開発法による試算価格は参考にとどめるべきものとし、比準価格を９０パーセント、収益価格を１ \n ０パーセントの割合で考慮して、本件土地１を一体とした評価額については、１平方メートル当たり２０万３０００円（２１万４０００円／㎡×０．９＋１０万３０００円／㎡× \n ０．１）、総額９４３０万円（２０万３０００円／㎡×４６４．５４㎡）と算出したものであり、その評価の過程に特段不合理な点は見当たらず、合理的に算出されたものと認められる。 \n (オ) 原告は、原告が乙から死因贈与を受けたのは本件土地１（本件土地イ及び本件土地ロ） \n であり、本件土地イと本件土地ロとの間には、不動産として別個独立の甲所有の本件土地ハが存在するところ、甲が本件土地ハを一緒に処分するという仮定的な事実を前提としなければ、本件土地１を一体として処分することは不可能であり、実際に、甲が本件土地ハを所有する意図をもって購入したことは明らかである上、甲は、Ｂとの間で、本件送電線契約２を締結して、原告とは独立して、本件土地１について補償を受けて収益していることなどからすれば、実際上の権利関係を捨象して所有者の異なる複数の本件土地を一体として評価することはできず、本件土地１は、別個に評価することが妥当であると主張し、 \n また、本件土地１は、その中央に位置する送電線下地部分において本件送電線契約１により建造物の築造等が禁止されており、これを変更することについては不確定要因を伴うのであるから、その変更が容易であることを前提に本件土地１を鑑定評価すべきではないと主張する。 \n しかしながら、本件土地１の最有効使用はいわゆる戸建住宅地であると認められるところ、このような宅地については、利用の単位となっている１区画のものごとに評価することが合理的であると考えられ（乙３２（評価通達７－２））、証拠（甲８、１１、１４の１、 \n 乙１３、１４の１・２）及び弁論の全趣旨によれば、本件土地イと本件土地ロとは、その間にある本件土地ハとともに、現に原告の資材置場等として一体として利用されていること、本件土地ロの形状は３角形であり、本件土地ハの形状は細長い路地状のものであって、 \n 単独又はこれら２筆の土地での利用については大幅な制約が生ずるであろうことが認められる上、本件土地１の所有者は原告であり、本件土地ハの所有者は原告代表者であり原告の出資金額の約６割を有する甲であって（乙１６）、死因贈与がされた平成１４年１月の時点において当面引き続きこれらを一体として利用することに支障はなかったと判断することは相当であったと認められるから、本件土地１の価格については、一体として評価するのが相当である。そして、証拠（乙１７）によれば、本件送電線契約１については、 \n 土地の所有者の申出により、建造物の築造を可能とする内容に容易に変更することができることが認められるから、本件送電線契約１の存在をもって、建造物の築造が可能であることを前提として本件土地１の評価をすることが妨げられるといい難く、前記のとおり、 \n 丙鑑定においては、取引事例比較法による比準価格の算出において、個別要因による補正として本件送電線契約１による制限を考慮しているのであって、このような丙鑑定の評価が不合理とはいえず、上記の原告の主張は、採用することができない。 \n ウ 本件土地２について \n (ア) 取引事例比較法による比準価格について丙鑑定は、本件土地２について７区画に分割の上２階建て住宅等の敷地として、又は低層マンションの敷地として使用することが最有効使用であると判断した上、①標準画地 \n （南側を８メートル市道に面して、地積１００平方メートル程度の整形な中間画地。なお、 \n 本件土地２についての丙鑑定書の１７頁には、８００平方メートルと記載されているが、 \n １３頁及び１９頁の記載に照らし、誤記であることが明らかである。）を設定し、別表３ \n －２の「丙鑑定」欄及び別表７－２－１－１のとおり、４の取引事例を選択して、必要に応じて事情補正、時点修正、建付減価補正、標準化補正及び地域格差補正をして各価格を算出した上、上記の取引事例のうち別表７－２－１－１の取引事例ｊ（別表３－２の「丙鑑定」欄の②）の価格のみが突出しており、規範性も劣る等と判断し、同取引事例の価格を除外し、他の３つの取引事例の各価格を平均して標準画地の比準価格を１平方メートル当たり２９万５０００円と算出したところ、上記の標準化補正及び地域格差補正の各率の根拠については、別表７－２－１－２のとおりであり、②個別格差による補正として、本件土地２が標準画地と比較して角画地であることからプラス５パーセント、南側道路沿いの庭石等の対策費用等としてマイナス１パーセントの計プラス４パーセントと査定し、比準価格として３０万７０００円（２９万５０００円×（１＋４％））と算出したものである。 \n 本件土地２及びその付近の状況等に関する他の証拠（甲９、１３、１５、１６の１～５、 \n １７、３６、５７、乙７、９、１８、２２、２３、２５、２６、３８、５７）に照らし、 \n 上記のような最有効使用についての判断や上記の各取引事例の選択に、特段不合理な点は見当たらず、また、上記の各補正についても、特段不合理な点は見当たらず、比準の過程も適切であることからすれば、上記の比準価格は、合理的に算出されたものと認めることができる。 \n 被告は、丙鑑定が別表７－２－１－１の取引事例ｊ（別表３－２の「丙鑑定」欄の②） \n の価格を除外し、他の３つの取引事例の各価格を平均して標準画地の比準価格を求めていることについて、取引事例ｊの価格が異常に突出した価格であるとまでは到底いえないこと、他の取引事例の所在地と比較しても、取引事例ｊの所在地は、本件土地２に最も近接していること、開発法による試算価格の算定においては、別表７－２－３－１の取引事例 \n ｍないしｐ（別表３－２の「丙鑑定」欄の⑤ないし⑧）の比準価格に開きが生じていたにもかかわらず、それらの取引事例がいずれも本件土地２の周辺地域に所在することを理由に、それらの各価格を平均し比準価格を求めていることなどからすれば、取引事例ｊの価格を除外したことには全く合理性がなく、同価格を考慮に入れるべきであると主張する。 \n しかしながら、取引事例比較法による比準価格を算出するに当たっての取引事例の選択等については、評価主体の合理的な裁量にゆだねられているということができるところ、 \n 取引事例ｊの価格が３６万１０００円（／㎡）であるのに対し、上記の土地よりも本件土地２に近い調布市所在の公示地（調布－●●）の価格が３２万１０００円であること（別表７－２－１－１）や、他の取引事例の価格が３０万６０００円（／㎡）、３０万８００ \n ０円（／㎡）及び２７万円（／㎡）であることを考慮すると、取引事例ｊの価格のみが突出して高いとの判断がおよそ不合理なものであるとまではいえず、別表７－２－３－１及び別表３－２の「丙鑑定」欄に各記載された開発法による試算価格の算出における取引事例は、開発法の適用に当たりその手法に適切なものとの観点から選択されたもので、取引事例比較法における選択とは観点が異なると考えられるから、上記の被告の指摘する点を勘案しても、丙鑑定が上記のとおり取引事例ｊの価格を除外して標準画地の比準価格を算出したことについて、著しく不合理であるとまではいえないというべきである。上記の被告の主張は、採用することができない。 \n (イ) 土地残余法による収益価格について丙鑑定は、別表７－２－２のとおり、本件土地２に鉄骨造３階建ての共同住宅を建築して賃貸することを想定し、駐車場収入を加算して総収益を求め、前記イ(イ)に述べた方法と同様に、還元利回りの率（７．０パーセント）を用いて還元して、収益価格を１平方メ \n ートル当たり１２万２０００円と算出したものである。 \n 上記の収益価格の算出方法については、前記イ(イ)に述べたところと同様に、上記の収益の算出の方法や過程等に特段不合理な点は見当たらず、還元利回りの率等についても、 \n 著しく不合理とは認められない。 \n 被告は、丙鑑定は、本件土地２に鉄骨造３階建ての共同住宅を建築して賃貸することを想定して収益価格を求めているところ、その賃料について、最寄り駅からバス便の利用を要する地であること及び高圧線が嫌悪施設としてマイナス要因となるため、最寄り駅周辺の賃料相場から減額して査定しているものの、本件土地２の上空に高圧線は通っておらず、 \n 丙鑑定においても、本件土地２の上空に高圧線が通っていることを減額要素として考慮していないのであるから、上記の減額査定は不合理であると主張する。 \n しかしながら、収益価格の算出における前提条件となる想定される賃貸建物の賃料額の設定等については、評価主体の合理的な裁量にゆだねられているということができるところ、証拠（甲１６の１、５７、本件土地２についての丙鑑定書）によれば、本件土地２の南方の比較的近くに高圧線が架設されていることがうかがわれるほか、この点をおくとしても、本件土地２が最寄り駅からバスの利用を要する土地であることからすれば、最寄り駅周辺における賃料相場である２５００円（／㎡）から１９００～２０００円（／㎡）と減価して査定したことが不合理であるとまではいえないというべきである。 \n なお、被告は、丙鑑定が還元利回りの率を７パーセントと査定したことには合理性がないと主張するものの、上記の査定が著しく不合理とまではいえないことは、前記イ(イ)で述べたとおりである。 \n (ウ) 開発法による試算価格について丙鑑定は、本件土地２を７区画に区分し宅地として販売することを想定し、次にマンション販売を想定して、細区分した宅地又はマンション等の販売総額を価格時点に割り戻した額から、建物の建築費及び発注者が直接負担すべき通常の付帯費用等を価格時点に割り戻した額を、それぞれ控除して求める方法により、開発法による試算価格として、宅地分譲を想定した価格を１平方メートル当たり２４万９０００円と算出し、マンション分譲を想定した価格を１平方メートル当たり２４万７０００円と算出し、その算出の根拠等については、別表７－２－３－１ないし別表７－２－５－２のとおりであるところ、宅地分譲を想定した価格が高く、最有効使用に基づくものであると判断し、同価格を開発法による試算価格としたものであり、上記の試算価格の算出の方法や過程に不合理な点は見当たらず、上記の試算価格は、合理的に算出されたものと認めることができる。 \n (エ) 鑑定評価額について丙鑑定は、前記(ア)の取引事例比較法による比準価格については、近隣地域及び周辺類似地域に存する取引事例から求めたものであり、比準の過程も適切にされ、実証的で比較的説得力が高いとする一方、前記(イ)の土地残余法による収益価格については、本件土地 \n ２が最寄り駅からバスの利用を要する土地であることから比較的収益性が劣り、前記(ウ)の開発法による試算価格については、比較考量して決定するとされていることから、その比重はやや低いものとであるとして、これらを踏まえ、本件土地２の地域の同種の不動産に対する需給の動向、単価と総額との関連（市場性）等をも総合勘案した結果、比準価格を重視し、収益価格は本来の収益物件ではないためにやや比重を低くし、開発法による試算価格をも比較考量して、比準価格を８０パーセント、収益価格を１０パーセント、開発法による試算価格を１０パーセントの割合で考慮して、本件土地２の評価額を１平方メートル当たり２８万３０００円（３０万７０００円／㎡×０．８＋１２万２０００円／㎡× \n ０．１＋２４万９０００円／㎡×０．１）とし、総額２億２８００万円（２８万３０００円／㎡×８０８．４０㎡）としたものであり、その評価の過程に特段不合理な点は見当たらず、合理的に算出されたものと認められる。 \n エ 本件土地３について \n (ア) 取引事例比較法による比準価格について丙鑑定は、本件土地３については５区画程度に分譲の上２階建て住宅等の敷地として、 \n 又は中低層マンションの敷地として使用することが最有効使用であると判断した上、①標準画地（西側を１６メートル市道に面して、地積１００平方メートル程度の整形な中間画地。なお、本件土地２についての丙鑑定書の１７頁には、６００平方メートルと記載されているが、１３頁及び１９頁の記載に照らし、誤記であることが明らかである。）を設定し、別表３－３の「丙鑑定」欄及び別表７－３－１－１のとおり、４の取引事例を選択して、必要に応じて事情補正、時点修正、建付減価補正、標準化補正及び地域格差補正をして各価格を算出し、各価格を平均して標準画地の比準価格を１平方メートル当たり３１万 \n ４０００円と算出したところ、上記の標準化補正及び地域格差補正の各率の根拠については、別表７－３－１－２記載のとおりであり、②個別格差による補正として、標準画地と比較して近隣に所在するリサイクルセンターが嫌悪施設であることからマイナス８パーセント、上水道の配管がないことからマイナス２パーントの計マイナス１０パーセントと査定し、比準価格として２８万３０００円（３０万４０００円×（１－１０％））と算出したものである。 \n 本件土地３及びその付近の状況等に関する他の証拠（甲１０、１３、１８の１～５、１ \n ９、２５、５８、乙１０、１２、２８、２９、３９、５８）に照らし、上記のような最有効使用についての判断や上記の各取引事例の選択に、特段不合理な点は見当たらず、また、 \n 上記の各補正についても、特段不合理な点は見当たらず、比準の過程も適切であることからすれば、上記の比準価格は、合理的に算出されたものと認めることができる。 \n (イ) 土地残余法による収益価格について丙鑑定は、別表７－３－２記載のとおり、本件土地３に鉄筋コンクリート６階建ての共同住宅を建築して賃貸することを想定し、駐車場収入を加算して総収益を求め、前記イ \n (イ)に述べた方法と同様に、還元利回りの率（７．０パーセント）を用いて還元して、収益価格を１平方メートル当たり１３万５０００円と算出したものである。 \n 上記の収益価格の算出方法については、前記イ(イ)に述べたところと同様に、上記の収益の算出の方法や過程等に特段不合理な点は見当たらず、還元利回りの率等についても、 \n 著しく不合理とは認められない。 \n なお、被告は、丙鑑定が還元利回りの率を７パーセントと査定したことには合理性がないと主張するものの、上記の査定が著しく不合理とまではいえないことは、前記イ(イ)で述べたとおりである。 \n (ウ) 開発法による試算価格について丙鑑定は、本件土地３を５区画に区分し宅地として販売することを想定し、次にマンション販売を想定して、細区分した宅地又はマンション等の販売総額を価格時点に割り戻した額から、建物の建築費及び発注者が直接負担すべき通常の付帯費用等を価格時点に割り戻した額を、それぞれ控除して求める方法により、開発法による試算価格として、宅地分譲を想定した価格を１平方メートル当たり２３万７０００円と算出し、マンション分譲を想定した価格を１平方メートル当たり２２万６０００円と算出し、その算出の根拠等については、別表７－３－３－１ないし別表７－３－５－２記載のとおりであるところ、宅地分譲を想定した価格が高く、最有効使用に基づくものであると判断し、同価格を開発法による試算価格としたものであり、上記の試算価格の算出の方法や過程に不合理な点は見当たらず、上記の試算価格は、合理的に算出されたものと認めることができる。 \n (エ) 鑑定評価額について丙鑑定は、前記(ア)の取引事例比較法による比準価格については、近隣地域及び周辺類似地域に存する取引事例から求めたものであり、比準の過程も適切にされ、実証的で比較的説得力が高いとする一方、前記(イ)の土地残余法による収益価格については、本件土地 \n ３が最寄り駅からバスの利用を要する土地であることから比較的収益性が劣り、また、前記(ウ)の開発法による試算価格については、比較考量して決定するとされていることから、 \n その比重はやや低いものとであるとして、これらを踏まえ、本件土地３の地域の同種の不動産に対する需給の動向、単価と総額との関連（市場性）等をも総合勘案した結果、比準価格を重視し、収益価格は本来の収益物件ではないためにやや比重を低くし、開発法による試算価格をも比較考量して、比準価格を８０パーセント、収益価格を１０パーセント、 \n 開発法による試算価格を１０パーセントの割合で考慮して、本件土地３の評価額を１平方メートル当たり２６万４０００円（２８万３０００円／㎡×０．８＋１３万５０００円／ \n ㎡×０．１＋２３万７０００円／㎡×０．１）とし、総額１億６３００万円（２６万４０ \n ００円／㎡×６１９．５５㎡）としたものであり、その評価の過程に特段不合理な点は見当たらず、合理的に算出されたものと認められる。 \n オ 以上に述べたところに加え、丙鑑定が裁判所に命じられて公正中立な立場で行われた鑑定であり、一般的に信用性が高いということができることを併せ考慮すれば、丙鑑定における本件各土地の評価額は合理的であり、同額をもって、本件各土地の平成１４年１月２７日における時価額と認めるのが相当である。 \n (2) 本件各土地の時価額ア 以上に述べたところによれば、丙鑑定のとおり、本件各土地の平成１４年１月２７日における時価額は、本件土地１について９４３０万円、本件土地２について２億２８００万円、 \n 本件土地３について１億６３００万円の合計４億８５３０万円であると認めるのが相当である。 \n イ なお、原告は、法人の取得した土地の時価額を算定するに当たっては、相続税評価額還元法によって評価することが著しく不適当であると認められない限り、同手法を用いるべきであり、本件各土地の時価額も同手法を用いて評価すべきであると主張する。 \n しかしながら、上記の算定をするに当たり原告のいう相続税評価額還元法によらなければならないとする法令の規定は存しない上、相続税評価額は、対象地が接する路線について定められた路線価に必要な画地調整率を乗じて算出されるものであって（甲４）、これを一律に０．８で除して得られる金額は、原告も自認するとおり、あくまで対象地の時価額に近似するものにとどまり、対象地の時価額を評価する手法として、丙鑑定における手法よりも当然に優れるものであるとはいい難く、上記の原告の主張は採用することができない。 \n ３ 本件各処分の適法性について以上のとおり、本件各土地の平成１４年１月２７日における時価額は、合計４億８５３０万円となり、本件受贈益の額として、同額が本件事業年度の益金の額に算入されるべきこととなる。 \n これを前提として、証拠（甲１、乙５９）及び弁論の全趣旨により認められる各金額に基づき、 \n 関係法令の適用により原告の本件事業年度の法人税に係る所得の金額及び納付すべき法人税額を計算すると、別表８のとおり、所得の金額が１億４１８９万５５５９円、納付すべき法人税額が４９６８万９４００円、過少申告加算税の額が７２４万円であると認められる。 \n \n \n 第４ 結論以上によれば \n 、原告の請求は、本件更正処分（ただし、本件裁決及び本件再更正処分により一部が取り消された後のもの）のうち所得の金額が１億４１８９万５５５９円、納付すべき法人税額が \n ４９６８万９４００円を超える部分及び本件賦課決定処分（ただし、本件裁決、本件変更決定処分及び本件再変更決定処分により変更された後のもの）のうち７２４万円を超える部分の取消しを求める限度で理由があるからこれを認容し、その余は理由がないからこれを棄却することとし、訴訟費用の負担について行政事件訴訟法７条、民事訴訟法６１条、６４条本文を適用して、主文のとおり判決する。 \n 東京地方裁判所民事第３部裁判長裁判官 八木 一洋裁判官 田中 一彦裁判官 髙橋 信慶 \n （別紙１） \n 物件目録 \n １(1) 所 在 調布市地 番地 目 雑種地地 積 ３０８平方メートル（実測３４３．５４平方メートル） \n (2) 所 在 調布市地 番地 目 雑種地地 積 １２５平方メートル（実測１２１平方メートル） \n ２(1) 所 在 調布市地 番地 目 山林地 積 ６３平方メートル（実測６３．７６平方メートル） \n (2) 所 在 調布市地 番地 目 山林地 積 ７４４平方メートル（実測７４４．６４平方メートル） \n ３(1) 所 在 調布市地 番地 目 雑種地地 積 ３２平方メートル \n (2) 所 在 調布市地 番地 目 雑種地地 積 ３２１平方メートル \n (3) 所 在 調布市地 番地 目 雑種地地 積 ４０平方メートル \n (4) 所 在 調布市地 番地 目 雑種地地 積 １０４平方メートル \n （別紙２） \n 本件各処分の根拠及び適法性 \n １ 本件更正処分の根拠及び適法性原告の本件事業年度の法人税に係る所得金額及び納付すべき税額は、以下のとおりであるところ、 \n 本件再更正処分における所得金額及び納付すべき税額と同額であるから、本件更正処分は、適法である。 \n (1) 所得金額（別表２の順号⑬） ２億１９６９万３０９２円以下のアの金額にイの金額を加算し、ウの金額を減算した金額である。 \n ア 申告所得金額（同順号１） ４８４万１１３２円本件確定申告の確定申告書（以下「本件確定申告書」という。）に記載された所得金額である。 \n イ 所得金額に加算すべき金額（同順号７） ３億５４５３万９４５０円以下の(ア)ないし(オ)の金額を合計した金額である。 \n (ア) 完成工事高の計上漏れ（同順号２） ２億９２３８万０９５３円原告が平成１４年５月３１日付けで完成工事高の減算処理をした金額であるところ、当該処理は、原告が平成１２年６月１日から平成１３年５月３１日までの事業年度（以下「平成１３年５月期」という。）以前の事前年度において、架空の工事収入金を計上し、完成工事高を過大に計上したものの一部を本件事業年度の完成工事高から減算する経理処理をしたものであり、その間に期間対応が存しないから、本件事業年度の完成工事高からの減算処理が認められない。 \n (イ) 損金の額に算入されない外注費（同順号３） ５０００万円原告の平成１４年５月３１日付けで外注費の計上処理をした金額であるところ、当該処理は、 \n 原告が平成１３年５月期に仮装経理として行った外注費の減算金額に相当する額を本件事業年度に計上するため経理処理をしたものであるから、本件事業年度の外注費として損金の額への算入は認められない。 \n (ウ) 損金の額に算入されない貸倒損失（同順号４） ７９５万２３８１円原告は、平成１４年５月２０日付けで、株式会社Ｇに対するＨ工事及びＩ工事に係る工事未収入金８３５万円から仮受消費税等の額３９万７６１９円を控除した７９５万２３８１円を貸倒損失として計上していたところ、同社は、本件事業年度の末日において営業を継続し、同社に対する上記以外の工事による債権については継続的に回収していることから、本件事業年度の貸倒損失として損金の額への算入は認められない。 \n (エ) 雑益の計上漏れ（同順号５） ２００円平成１３年６月１月から平成１４年５月３１日までの課税期間（以下「平成１４年５月期課税期間」という。）において増加又は減少した仮受消費税等の額と仮払消費税等の額との差引額１６３４万３８００円と、武蔵府中税務署長が平成１６年５月３１日付けでした平成１４年 \n ５月期課税期間の消費税等の更正処分による納付すべき消費税等の額１６３４万３６００円との差額であり、本件事業年度の益金の額に算入されるものである。 \n (オ) 寄附金の損金不算入額（同順号６） ４２０万５９１６円次のウ(ア)の寄附金８３５万円について、法人税法３７条３項（平成１４年法律第７９号による改正前のもの。）及び同法施行令７３条１項１号（平成１４年政令第１０４号による改正前のもの。）の各規定に基づいて計算した寄附金の損金不算入額である。 \n ウ 所得金額から減算すべき金額（同順号１２） １億３９６８万７４９０円次の(ア)ないし(エ)の金額を合計した金額である。 \n (ア) 損金の額に算入される寄附金（同順号８） ８３５万円前記イ(ウ)の工事未収入金８３５万円は、原告の株式会社Ｇに対する経済的な利益の供与であり、寄附金として本件事業年度の損金の額に算入される。 \n (イ) 損金の額に算入される貸倒損失（同順号９） １３２万７１３４円原告は、本件事業年度において、工事未収入金８３７１万６５１１円から、その１０５分の \n ５に相当する仮受消費税等相当額３９８万６５００円を控除した７９７３万００１１円を貸倒損失として計上しているところ、上記の工事未収入金には、平成６年法律第１０９号による改正前の消費税法２９条による３パーセントの税率が適用されたものがあることから、再計算した結果、貸倒損失の計上漏れが認められた金額である。 \n (ウ) 雑収入の過大計上額（同順号１０） ２７１１万７６８９円原告が本件受贈益として計上した５億９１２０円のうち、本件各土地の時価評価額５億６４ \n ０８万２３１１円を超える過大計上部分の金額である。 \n (エ) 繰越欠損金の損金算入額（同順号１１） １億０２８９万２６６７円武蔵府中税務署長が平成１６年５月３１日付けした平成１０年６月１日から平成１３年５月３１日までの各事業年度及び本件事業年度に係る法人税の更正処分に伴い、法人税法５７条 \n １項（平成１４年法律第７９号による改正前のもの）の規定に基づき、本件事業年度の損金の額に算入される金額である。 \n (2) 所得金額に対する法人税額（同順号１４） ６５２６万７９００円前記(1)の所得金額（ただし、国税通則法１１８条１項の規定に基づき１０００円未満の端数金額を切り捨てた後のもの）に経済社会の変化等に対応して早急に講ずべき所得税及び法人税の負担軽減措置に関する法律１６条１項（平成１４年法律第７９号による改正前のもの）に規定する税率を乗じて計算した金額である。 \n (3) 課税留保金額に対する税額（同順号１５） １５９７万４４００円課税留保金額１億１２３７万２０００円（ただし、国税通則法１１８条１項の規定に基づき１０ \n ００円未満の端数金額を切り捨てた後のもの）に法人税法６７条１項（平成１８年法律第１０号による改正前のもの）に規定する税率を乗じて計算した金額である。 \n (4) 法人税額から控除される所得金額（同順号１６） ３０９０円法人税法６８条１項（平成１５年法律第８号による改正前のもの）に規定する法人税額から控除される所得金額であり、原告が本件確定申告書に記載した金額と同額である。 \n (5) 納付すべき法人税額（同順号１７） ８１２３万９２００円前記(2)及び(3)の各金額の合計額から前記(4)の金額を控除した金額（ただし、国税通則法１１ \n ９条１項の規定に基づき１００円未満の端数金額を切り捨てた後のもの）である。 \n ２ 本件賦課決定処分の根拠及び適法性原告の本件事業年度の過少申告加算税の額は、原告の本件確定申告における納付すべき法人税額１ \n ０６万１９００円と本件再更正処分における納付すべき法人税額８１２３万９２００円との差額８ \n ０１７万円（ただし、国税通則法１１８条３項の規定に基づき１万円未満の端数金額を切り捨てた後のもの）を基礎となる金額（別表２の順号２０）とし、これに同法６５条１項及び２項の規定を適用して算出した１１９７万２５００円（同順号２１）であるところ、本件再変更決定処分における額と同額であるから、本件賦課決定処分は、適法である。 \n 別表１更正処分等の経緯 \n （単位：円） \n 加算税の額納付すべき区分 年月日 所得金額法人税額過少申告加算税 重加算税確 定 申 告 平成14年7月31日 4,841,132 1,061,900 － －更正処分等 平成16年5月31日 246,471,810 92,756,800 13,629,500 164,500裁 決 平成18年4月5日 219,971,696 81,359,000 11,920,000 164,500変更決定処分 平成18年12月26日 － － 11,990,000 0再更正処分等 平成20年2月5日 219,693,092 81,239,200 11,972,500 0別表２ \n １ 所得金額の計算 \n （単位：円） \n 項目 順号 被告主張額申告所得金額 1 4,841,132完成工事高の計上漏れ 2 292,380,953損金の額に算入されない外注費 3 50,000,000加 損金の額に算入されない貸倒損失 4 7,952,381算 \n 雑益の計上漏れ 5 200寄付金の損金不算入額 6 4,205,916所得金額に加算すべき金額（２～６の計） 7 354,539,450損金の額に算入される寄附金 8 8,350,000損金の額に算入される貸倒損失 9 1,327,134減 雑収入の過大計上額 10 27,117,689算 \n 繰越欠損金の損益算入額 11 102,892,667所得金額から減算すべき金額（８～１１の計） 12 139,687,490所得金額（１＋７－１２） 13 219,693,092 \n ２ 税額の計算 \n （単位：円） \n 項目 順号 被告主張額所得金額に対する法人税額 14 65,267,900課税留保金額に対する税額 15 15,974,400法人税額から控除される所得税額等 16 3,090納付すべき法人税額（１４＋１５－１６） 17 81,239,200確定申告における法人税額 18 1,061,900差引納付すべき法人税額（１７－１８） 19 80,177,300 \n ３ 加算税額の計算 \n （単位：円） \n 項目 順号 被告主張額過少申告加算税の計算の基礎となる税額 20 80,170,000過少申告加算税の額 21 11,972,500 \n 別表３－１本件土地１：464.54㎡（ただし、30番13は343.54㎡、同14は121㎡） \n 丙鑑定 最有効使用：２階建住宅等の建築使用一体評価所在地 地目 地積(㎡) 取引価格(円/㎡) 試算価格(円/㎡) \n ① 調布市 宅地 779.34 193,598 251,000試 \n 算 ② 同 宅地 356.00 266,208 265,000別表１価 ③ 同 宅地 232.00 224,138 255,000格 \n ④ 三鷹市 宅地 583.56 166,368 272,000取 \n 引事 \n 例比 \n 較比準価格(平均値) 261,000法 \n 個別格差補正 △18% (高圧線-15、私法制限-5、不整形-3、角画地+5)補正後比準価格 261,000円×(1-18%) 214,000 (比準価格)土地残余法 (土地帰属純収益)7,201円÷(還元利回り)7% 103,000 (収益価格)：木造2階建共同住宅を想定所在地 地目 地積(㎡) 取引価格(円/㎡) 試算価格(円/㎡) \n ⑤ 調布市 宅地 155.30 270,444 277,000試 ⑥ 同 宅地 169.27 348,556 314,000 4区画に区分した宅地の分譲を想定した算 \n ⑦ 同 宅地 48.65 345,324 297,000 場合の標準画地価格価 \n 格 ⑧ 同 宅地 107.50 188,837 290,000比準価格(平均値) 295,000開 \n 発法 \n 個別格差補正 248,000規準価格 宅地 254.00 301,000 262,000 Ｈ14.1.1公示価格（調布●●） \n 開発法に基づく試算価格 202,000単価(㎡当たり) 203,000 比準価格90%、収益価格10%鑑定評価額（一体評価） \n 203,000円×464.54㎡ 94,300,000個別評価(30番13の評価) \n (一体評価の鑑定評価額)203,000円×(30番13の分譲販売収入)226,000円÷(一体評価の分譲販売収入)248,000円単価(㎡当たり) 185,000 比準価格90%、収益価格10%鑑定評価額（一体評価） \n 185,000円×343.54㎡ 63,500,000個別評価(30番14の評価) \n (一体評価の鑑定評価額)203,000円×(30番14の分譲販売収入)230,000円÷(一体評価の分譲販売収入)248,000円単価（㎡当たり） 188,000 比準価格90%、収益価格10%鑑定評価額（一体評価） \n 188,000円×121.00㎡ 22,700,000合計鑑定評価額 86,200,000丁鑑定(乙56) 最有効使用の判定：適正規模に分割の上低層住宅地所在地 地目 地積(㎡) 取引価格(円/㎡) 試算価格(円/㎡) \n ① 調布市 宅地 107.08 266,156 310,000 \n ② 同 宅地 155.30 270,444 288,000平均値306,000円と査定標準的 ③ 同 宅地 92.26 317,581 305,000使用に \n ④ 同 宅地 169.27 348,556 319,000おける収益価格 (純収益)1,009,300円÷(還元利回り)4.5% 126,000 2階建て共同往宅(敷地120㎡)標準価格 規準価格 161.00 266,000 公示地：調布●●標準価格査定 295,000 比準価格重視 \n △16% (高圧線-15、接道方位+2、不整形-2、整地費用-2、角画地+1)個別格差補正 \n 295,000円×0.84 248,000 \n ⑤ 三鷹市 宅地 3089.74 287,403 263,000取引事 取引事例による比準価格(個別格差△1 \n ⑥ 同 宅地 543.54 231,814 249,000例比較 4%を加味) \n ⑦ 同 宅地 320.35 329.608 257,000法 \n 255,000 比準価格(⑥及び⑦中心)単価(㎡当たり) 252,000 中間値鑑定評価額（一体評価） \n 252,000円×464.54㎡ 117,060,000 \n 戊鑑定(甲56) 最有効使用の判定：Ａ及びＢそれぞれ駐車場、資材置場等の敷地 \n Ａ：(121㎡)所在地 地目 地積(㎡) 取引価格(円/㎡) 試算価格(円/㎡) \n ① 調布市 宅地 148.00 282,566 306,000標準的使用に ② 同 宅地 93.00 291,600 313,000中庸値308,000円と査定おける ③ 同 宅地 111.00 263,324 288,000標準価 \n ④ 同 宅地 108.00 188,837 308,000格 \n △59% (高圧線-60、角地+3)個別格差補正 \n 308,000円×0.41 126,000規準価 公示価格 161.00 275,000 276,000 公示地：調布●● 14.1.1格 価格補正 276,000円×0.41 113,000比準価 126,000 標準価格重視収益 \n (純利益)729,500円÷(還元利回り)4.5% 134,000還元法単価(㎡当たり) 130,000 比準価格と収益価格との中間値鑑定評価額(A土地個別) \n 130,000円×121.00㎡ 15,700,000 \n Ｂ：(343.54㎡)所在地 地目 地積(㎡) 取引価格(円/㎡) 試算価格(円/㎡) \n ① 調布市 宅地 148.00 282,566 306,000標準的使用に ② 同 宅地 93.00 291,600 313,000中庸値308,000円と査定おける ③ 同 宅地 111.00 263,324 288,000標準価 \n ④ 同 宅地 108.00 188,837 308,000格 \n △51% (二方路+2、高圧下地-40、規模大-20)個別格差補正 \n 308,000円×0.49 151,000規準価 公示価格 161.00 275,000 276,000 公示地：調布●● 14.1.1格 価格補正 276,000円×0.49 135,000比準価 151,000 標準価格重視収益 \n (純利益)3,211,595円÷(還元利回り)4.5% 208,000 還元利回り4.5%還元法単価(㎡当たり) 191,000 収益価格重視鑑定評価額(B土地個別) \n 191,000円×343.54㎡ 65,600,000鑑定評価額(A土地＋B土地) 81,300,000別表３－２本件土地２：808.40㎡丙鑑定 最有効使用の判定：７区画に分割の上２階建住宅又は低層マンションの敷地一体評価所在地 地目 地積(㎡) 取引価格(円/㎡) 試算価格(円/㎡) \n ① 三鷹市 宅地 1184.15 300,215 306,000試 ② 調布市 宅地 610.72 372,069 361,000算 ※本件土地Ｇ ③ 三鷹市 宅地 495.84 219,869 308,000価 \n 格 ④ 同市 宅地 526.16 305,040 270,000取 \n 引事 \n 例比 \n 較比準価格(①③④の平均値) 295,000法 \n 個別格差補正 +4% (庭石等対策費-1、角画地+5)補正後比準価格 295,000円×(1+4%) 307,000 (比準価格)土地残余法 (土地帰属純収益)8,552円÷(還元利回り)7% 122,000 (収益価格)3階建て共同住宅想定宅地分譲 所在地 地目 地積(㎡) 取引価格(円/㎡) 試算価格(円/㎡) \n ⑤ 調布市 宅地 52.00 457,019 352,000 \n ⑥ 同 宅地 97.44 346,880 345,000試 7区画での分譲を想定した標準画地価格算 ⑦ 三鷹市 宅地 102.09 320,306 360,000価 \n ⑧ 調布市 宅地 227.00 227,742 304,000格 \n 比準価格(平均値) 340,000開 \n 発法 \n Ａ個別格補正 316,000 7区画分譲規準価格 宅地 186.00 321,000 299,000 H14.1.1公示価格(調布●●)試算価格Ａ 249,000同 \n マンション \n 3階建てマンションの分譲を想定 \n Ｂ試算価格Ｂ 247,000開発法に基づく試算価 249,000 最有効使用(宅地)単価(㎡当たり) 283,000 比準価格80%、収益価格10%、開発法10%鑑定評価額(一体評価) \n 283,000円×808.40㎡ 228,000,000丁鑑定(乙57) 最有効使用の判定：適正規模に分割の上低層住宅地又は中層集合住宅地所在地 地目 地積(㎡) 取引価格(円/㎡) 試算価格(円/㎡) \n ① 調布市 宅地 97.44 346,880 344,000 \n ② 同 宅地 132.00 363,636 354,000平均値344,000円と査定 \n ③ 三鷹市 宅地 154.02 300,000 341,000標準的使用に ④ 三鷹市 宅地 161.98 277,812 337,000おける 収益価格 (純収益)1,009,300円÷(還元利回り)4.5% 187,000 2階建て共同住宅(敷地120㎡)標準価規準価格 186.00 321,000 305,000 公示地：調布●●格 \n 標準価格査定 340,000 全関連 \n △7% (規模大-8、+1)個別格差補正 \n 340,000円×0.93 316,000開発法 開発法による価格：265,990,000円 329,000 中層集合住宅の分譲を想定単価(㎡当たり) 323,000 中間値鑑定評価額(一体評価) \n 323,000円×808.40㎡ 261,110,000 \n 戊鑑定(甲57) 最有効使用の判定：戸建分譲素地所在地 地目 地積(㎡) 取引価格(円/㎡) 試算価格(円/㎡) \n ① 三鷹市 宅地 90.00 410,000 350,000 \n ② 調布市 宅地 97.00 346,880 350,000 \n ③ 三鷹市 宅地 102.00 320,306 358,000 \n ④ 同 宅地 85.00 327,598 329,000開発法 \n ⑤ 同 宅地 110.00 264,357 330,000公示価格 調布●● 161.00 275,000 316,000査定標準価格 345,000 ①、②事例重視開発法に基づく試算価 223,000,000円 276,000 \n ① 三鷹市 宅地 526.16 305,040 283,000試 ② 三鷹市 宅地 543.54 231,814 289,000算 中庸値308,000円と査定 ③ 三鷹市 宅地 429.35 317,605 292,000価 \n 格 ④ 調布市 宅地 779.34 193,598 294,000取 \n 引事 \n 例比 \n 較法 \n 査定比準価格 289,000 ①、②、③事例関連単価(㎡当たり) 277,000 開発法重視鑑定評価額(A土地個別) \n 277,000円×808.40㎡ 224,000,000 \n 別表３－３本件土地３：619.55㎡丙鑑定 最有効使用の判定：５区画程度に分割の上戸建住宅等又は中低層マンションの敷地所在地 地目 地積(㎡) 取引価格(円/㎡) 試算価格(円/㎡) \n ① 三鷹市 宅地 1184.15 300,215 311,000試 ② 調布市 宅地 610.72 372,069 363,000算 ③ 三鷹市 宅地 495.84 219,869 304,000価 \n 格 ④ 三鷹市 宅地 526.16 305,040 279,000取 \n 引事 \n 例比 \n 較比準価格(平均値) 314,000法 \n 個別格差補正 △10% (嫌悪施設-8、水道管設備-2)補正後比準価格 314,000円×(1-10%) 283,000 (比準価格)土地残余法 (土地帰属純収益)9,451円÷(還元利回り)7% 135,000 (収益価格)宅地分譲 所在地 地目 地積(㎡) 取引価格(円/㎡) 試算価格(円/㎡) \n ⑤ 三鷹市 宅地 54.32 349,779 408,000 \n ⑥ 同 宅地 172.52 292,720 383,000試 5区画での分譲を想定した標準画地価格算 ⑦ 同 宅地 194.29 303,670 373,000価 \n ⑧ 三鷹市 宅地 90.00 410,000 398,000格 \n 比準価格(平均値) 391,000 \n Ａ開 \n 発法 \n 個別格差補正 △10% 352,000 7区画分譲 \n 5区画分割の個別補正 304,000 別表4試算価格A 237,000 別表5 \n Ｂ 6階建てマンションの分譲を想定開 マンション発 \n 試算価格Ｂ 226,000 別表6開発法に基づく試算価格 237,000 最有効使用(宅地)宅地 547.00 337,000 323,000 H14.1.1公示価格(三鷹●●)規準価格 \n 323,000円×90% 291,000比準価格80%、収益価格10%、開発法10単価(㎡当たり) 264,000鑑定評価額(一体評価) パーセント \n 264,000円×619.55㎡ 163,000,000丁鑑定(乙58) 最有効使用の判定：中層集合住宅地所在地 地目 地積(㎡) 取引価格(円/㎡) 試算価格(円/㎡) \n ① 調布市 宅地 97.44 346,880 423,000 \n ② 同 宅地 132.00 363,636 435,000平均値428,000円と査定 \n ③ 三鷹市 宅地 154.02 300,000 428,000標準的使用に ④ 三鷹市 宅地 161.98 277,812 424,000おける 収益価格 (純収益)3,104,300円÷(還元利回り)4.5% 345,000 4階建て共同住宅(敷地200㎡)標準価規準価格 115.00 420,000 385,000 公示地：三鷹●●(13.7.1)格 \n 標準価格査定 425,000 比準価格重点 \n △2% (整地・施設整備-2)個別格差補正 \n 425,000円×0.98 417,000開発法 開発法による価格：268,250,000円 433,000 集合住宅の分譲を想定単価(㎡当たり) 425,000 中間値鑑定評価額(一体評価) \n 425,000円×619.55㎡ 263,310,000 \n 戊鑑定(甲58) 最有効使用の判定：戸建分譲素地所在地 地目 地積(㎡) 取引価格(円/㎡) 試算価格(円/㎡) \n ① 三鷹市 宅地 90.00 410,000 394,000 \n ② 調布市 宅地 97.00 346,880 411,000 \n ③ 三鷹市 宅地 120.00 332,447 410,000開発法 \n (開発 ④ 同 宅地 100.00 373,000 386,000道路設 ⑤ 同 宅地 92.00 327,761 404,000置)公示価格 調布●● 115.00 420,000 385,000査定標準価格 406,000 ①、②事例重視開発法に基づく試算価 175,000,000円 282,000 \n ① 三鷹市 宅地 90.00 410,000 394,000 \n ② 調布市 宅地 97.00 346,880 411,000 \n ③ 三鷹市 宅地 120.00 332,447 410,000開発法 \n (開発 ④ 同 宅地 100.00 373,000 386,000道路不 ⑤ 同 宅地 92.00 327,761 404,000設置)公示価格 三鷹●● 115.00 420,000 385,000査定標準価格 406,000 ①、②事例重視開発法に基づく試算価 182,000,000円 294,000開発法による査定価格 288,000 \n ① 三鷹市 宅地 526.16 305,040 292,000開 \n ② 三鷹市 宅地 543.54 231,814 284,000 発道 ③ 三鷹市 宅地 429.35 317,605 320,000路 \n 有 ④ 調布市 宅地 779.34 193,598 312,000取 \n 引事 \n 例比 \n 較法 \n 査定比準価格 299,000 ①、②、③事例関連 \n ① 三鷹市 宅地 526.16 305,040 289,000開 \n ② 三鷹市 宅地 543.54 231,814 304,000 発道 ③ 三鷹市 宅地 429.35 317,605 317,000路 \n 無 ④ 調布市 宅地 779.34 193,598 300,000取 \n 引事 \n 例比 \n 較法 \n 査定比準価格 303,000 ①、②、③事例関連取引事例比較法による査定価格 301,000 中庸値収益還元法による価格 (純利益)7,645,141円÷(還元利回り)4.5% 274,000単価(㎡当たり) 289,000 開発法重視鑑定評価額(A土地個別) \n 289,000円×619.55㎡ 179,000,000 \n 別表４－１所在 地目 形状及び間口と区分 価格時点 地積 街路条件 交通・接近条件 環境条件 行政的条件公示価格又は取引価格 類型 奥行との比率北東側5.5ｍ（市道） 形状等がやや不均衡である調布市南側5.5ｍ（市道） Ｕ線Ｊ駅約3.4㎞（Ｕ線 が、配置はやや整然としてい不整形地 第一種低層住居専用地域平成14年 雑種地 Ｋ駅約2.4㎞） る。有効利用されている土地本件土地1 － 464.54㎡ 建ぺい率 40％ \n 1月27日 更 地 比較的均衡がとれ、幹線道 大型スーパーマーケッ は半数程度である。アパート \n １：0.5 容積率 80％路との系統連続性は優れ トが存する。 等もいくらかみられるが、専ている。 用住宅が多い。 \n 調布市 東側6.0ｍ（市道） \n 長方形 Ｕ線Ｊ駅約3.1㎞（Ｕ線 形状等の均衡がとれ、配置は第一種低層住居専用地域公示地 平成14年 宅 地 ほぼ整形地 Ｋ駅約2.0㎞） 整然としている。大部分が有 \n 301,000円／㎡ 254㎡ 放射状、基盤目状で均衡が 建ぺい率 40％ \n (調布●●) 1月1日 更 地 大型スーパーマーケッ 効利用され、中規模一般住宅とれ、幹線道路との系統連 容積率 80％ \n １：1.5 トが存する。 地で大部分が専用住宅。 \n 続性は優れている。 \n 形状等がやや不均衡である調布市 北西側4.0ｍ（市道） \n 長方形 Ｕ線Ｊ駅約2.9㎞（Ｕ線 が、配置はやや整然としてい第一種低層住居専用地域平成13年 宅 地 ほぼ整形地 Ｋ駅約1.8㎞） る。有効利用されている土地本件土地A 279,175円／㎡ 308.05㎡ おおまかに整備されてい 建ぺい率 40％ \n 2月6日 更 地 大型スーパーマーケッ は半数程度である。アパートるが、行止路やＴ字路があ 容積率 80％ \n １：2.4 トが存する。 等もいくらかみられるが、専る。 \n 用住宅が多い。 \n 形状等がやや不均衡である調布市 北西側4.0ｍ（市道） \n 長方形 Ｕ線Ｊ駅約3.3㎞（Ｕ線 が、配置はやや整然としてい第一種低層住居専用地域平成14年 宅 地 ほぼ整形地 Ｋ駅約3.1㎞） る。有効利用されている土地本件土地B 248,263円／㎡ 463.58㎡ おおまかに整備されてい 建ぺい率 40％ \n 7月4日 更 地 大型店舗、専門店は存 は半数程度である。アパートるが、行止路やＴ字路があ 容積率 80％ \n １：0.3 しない。 等もいくらかみられるが、専る。 \n 用住宅が多い。 \n 形状等がやや不均衡である調布市 南側4.0ｍ（市道） \n 台形 Ｕ線Ｊ駅約4.0㎞（Ｕ線 が、配置はやや整然としてい第一種低層住居専用地域平成14年 宅 地 やや不整形地 Ｋ駅約2.9㎞） る。有効利用されている土地本件土地C 224,065円／㎡ 432.91㎡ おおまかに整備されてい 建ぺい率 40％ \n 9月25日 更 地 大型店舗、専門店は存 は半数程度である。アパートるが、行止路やＴ字路があ 容積率 80％ \n １：0.6 しない。 等もいくらかみられるが、専る。 \n 用住宅が多い。 \n 別表４－２所在 地目 形状及び間口と区分 価格時点 地積 街路条件 交通・接近条件 環境条件 行政的条件公示価格又は取引価格 類型 奥行との比率北東側6.0ｍ（市道） \n 調布市長方形 南東側8.0ｍ（市道） Ｕ線Ｊ駅約3.4㎞（Ｕ線 有効利用されている土地は半第二種中高層住居専用地域平成14年 山 林 ほぼ整形地 Ｋ駅約2.5㎞） 数程度である。アパート等も本件土地2 － 808.40㎡ 建ぺい率 60％ \n 1月27日 更 地 比較的均衡がとれ、幹線道 大型スーパーマーケッ いくらかみられるが、専用住容積率 200％ \n １：0.5 路との系統連続性は優れ トが存する。 宅が多い。 \n ている。 \n 調布市 南側12.0ｍ（市道） \n 長方形 Ｕ線Ｊ駅約3.3㎞（Ｕ線大部分が有効利用されてい 第二種中高層住居専用地域公示地 平成14年 宅 地 ほぼ整形地 Ｋ駅約2.5㎞） \n 321,000円／㎡ 186㎡ 比較的均衡がとれ、幹線道 る。アパートがいくらかみら 建ぺい率 60％ \n (調布●●) 1月1日 更 地 大型スーパーマーケッ路との系統連続性は優れ れるが、専用住宅も多い。 容積率 200％ \n １：1.5 トが存する。 \n ている。 \n 南側8.0ｍ（市道） \n 調布市長方形 東側5.0ｍ（市道） Ｕ線Ｊ駅約3.3㎞（Ｕ線大部分が有効利用されてい 第二種中高層住居専用地域平成13年 宅 地 ほぼ整形地 Ｋ駅約2.4㎞） \n 本件土地D 260,144円／㎡ 165.26㎡ る。アパートがいくらかみら 建ぺい率 60％ \n 9月30日 更 地 比較的均衡がとれ、幹線道 大型スーパーマーケッれるが、専用住宅も多い。 容積率 200％ \n １：1.5 路との系統連続性は優れ トが存する。 \n ている。 \n 調布市 北側8.0ｍ（市道） \n 長方形 Ｕ線Ｊ駅約3.3㎞（Ｕ線大部分が有効利用されてい 第二種中高層住居専用地域平成13年 宅 地 ほぼ整形地 Ｋ駅約2.4㎞） \n 本件土地E 272,177円／㎡ 99.20㎡ 比較的均衡がとれ、幹線道 る。アパートがいくらかみら 建ぺい率 60％ \n 6月20日 更 地 大型スーパーマーケッ路との系統連続性は優れ れるが、専用住宅も多い。 容積率 200％ \n １：1.9 トが存する。 \n ている。 \n 調布市 西側6.0ｍ（市道） \n 台形 Ｕ線Ｊ駅約3.3㎞（Ｕ線大部分が有効利用されてい 第二種中高層住居専用地域平成13年 宅 地 不整形地 Ｋ駅約2.4㎞） \n 本件土地F 290,386円／㎡ 499.13㎡ 比較的均衡がとれ、幹線道 る。アパート等がみられるが、 建ぺい率 60％ \n 9月14日 更 地 大型スーパーマーケッ路との系統連続性は優れ 専用住宅もある。 容積率 200％ \n １：0.8 トにやや遠い。 \n ている。 \n 別表４－３所在 地目 形状及び間口と区分 価格時点 地積 街路条件 交通・接近条件 環境条件 行政的条件公示価格又は取引価格 類型 奥行との比率調布市 西側16.0ｍ（都道） Ｖ線Ｌ駅約2.3㎞大型 有効利用されている土地は半長方形スーパーマーケットが 数程度である。一般住宅、共 第二種住居地域平成14年 雑種地 ほぼ整形地本件土地3 － 619.55㎡ 配置は均衡がとれている。存する。 同住宅、大手企業の研修所等 建ぺい率 60％ \n 1月27日 更 地幹線道路との系統連続性 調布市役所まで約3.9 が存する地域である。東側に 容積率 200％ \n １：1.2は優れている。 ㎞ ゴミ処理施設がある。 \n 三鷹市 Ｖ線Ｌ駅約2.0㎞大型長方形 有効利用されている土地は半西側7.7ｍ（市道） スーパーマーケットが 第一種住居地域公示地 平成14年 宅 地 ほぼ整形地 数程度である。中規模マンシ \n 337,000円／㎡ 547㎡ 存する。 建ぺい率 60％ \n (三鷹●●) 1月1日 更 地 ョン、アパートがみられる住配置は均衡がとれている。 三鷹市役所に近接して 容積率 200％ \n １：1.5 宅地域である。 \n いる。 \n 三鷹市 Ｖ線Ｌ駅約2.3㎞大型長方形 有効利用されている土地は半西側7.0ｍ（市道） スーパーマーケットが 準工業地域公示地 平成14年 宅 地 ほぼ整形地 数程度である。集合住宅が多 \n 332,000円／㎡ 581㎡ 存する。 建ぺい率 60％ \n (三鷹●●) 1月1日 更 地 く、工場等も多数存在する地配置は均衡がとれている。 三鷹市役所に近接して 容積率 200％ \n １：1.5 域である。 \n いる。 \n Ｖ線Ｌ駅約1.3㎞大型三鷹市 西側16.0ｍ（都道） \n 台形 店舗を含む繁華性の高大部分が有効利用されてい 準工業地域公示地 平成14年 宅 地 ほぼ整形地 い駅前商店街が存す \n 429,000円／㎡ 260㎡ 配置は均衡がとれている。 る。マンション、アパート店 建ぺい率 60％ \n (三鷹●●) 1月1日 更 地 る。 \n 幹線道路との系統連続性 舗等が混在する地域である。 容積率 200％ \n １：1.2 三鷹市役所に近接しては優れている。 \n いる。 \n 北側5.0ｍ（市道） \n 東側4.0ｍ（市道） Ｖ線Ｌ駅約2.3㎞大型長方形 有効利用されている土地は半三鷹市 南側4.0ｍ（市道） スーパーマーケットが 第一種住居地域平成13年 宅 地 ほぼ整形地 数程度である。中層マンショ本件土地G 589.73㎡ 存する。 建ぺい率 60％ \n 3月27日 更 地 ン、アパートが戸建住宅が混 \n 385,312円／㎡ 配置は均衡がとれている。三鷹市役所に近接して 容積率 200％ \n １：1.7 在する地域である。 \n 幹線道路との系統連続性 いる。 \n は優れている。 \n 別表５－１本件土地１の時価公示価格又 標準化 地域要因 地域要因補 個別的要因 本件土地1 本件土地1の時価公示地及び 事情補正値 時点修正値 標準価格 試算価格は取引価格 補正値 補正値 正後の価格 補正値 の地積 (評価額)取引事例 \n ① ② ③ ④ ⑤ ⑥ ⑦ ⑧ ⑨ ⑩ ⑪公示地 100 99.5 100 72.0 \n 301,000円 × × × × 215,636円 \n (調布●●) 100 100 100 100 \n 100 95.3 99.4 77.9本件土地A 279,175円 × × × × 206,012円原 100 100 100 100告 \n 主張 100 102.7 104.6 78.0本件土地B 248,263円 × × × × 208,021円 \n 100 100 100 100 \n 48.6 \n 205,219円 × 99,736円 464.54㎡ 46,331,361円 \n 100 104.3 102.4 79.9本件土地C 224,065円 × × × × 191,207円 \n 100 100 100 100公示地 100 99.5 100 93.6 \n 301,000円 × × × × 280,327円 \n (調布●●) 100 100 100 100 \n 100 95.3 103.0 104.0本件土地A 279,175円 × × × × 284,997円被 100 100 100 100告 \n 主張 100 102.7 105.1 108.6本件土地B 248,263円 × × × × 291,014円 \n 100 100 100 100 \n 81.3 \n 279,374円 × 227,131円 464.54㎡ 105,511,434円 \n 100 104.3 102.9 108.6本件土地C 224,065円 × × × × 261,158円 \n 100 100 100 100 \n 別表５－２本件土地２の時価公示価格又 標準化 地域要因 地域要因補 個別的要因 本件土地2 本件土地2の時価公示地及び 事情補正値 時点修正値 標準価格 試算価格は取引価格 補正値 補正値 正後の価格 補正値 の地積 (評価額)取引事例 \n ① ② ③ ④ ⑤ ⑥ ⑦ ⑧ ⑨ ⑩ ⑪公示地 100 99.5 100 84.5 \n 321,000円 × × × × 269,888円 \n (調布●●) 100 100 100 100 \n 100 98.4 97.0 84.5本件土地D 260,144円 × × × × 209,815円原 100 100 100 100告 \n 主張 100 97.2 109.7 80.3本件土地E 272,177円 × × × × 233,045円 \n 100 100 100 100 \n 78.5 \n 244,195円 × 191,693円 808.40㎡ 154,964,621円 \n 100 98.0 121.6 76.3本件土地F 290,386円 × × × × 264,034円 \n 100 100 100 100公示地 100 99.5 100 98.5 \n 321,000円 × × × × 314,604円 \n (調布●●) 100 100 100 100 \n 100 98.4 97.0 98.5本件土地D 260,144円 × × × × 244,578円被 100 100 100 100告 \n 主張 100 97.2 110.3 98.5本件土地E 272,177円 × × × × 287,428円 \n 100 100 100 100 \n 99.8 \n 297,453円 × 296,858円 800.40㎡ 239,980,007円 \n 100 98.0 120.0 100.5本件土地F 290,386円 × × × × 343,201円 \n 100 100 100 100 \n 別表５－３本件土地３の時価公示価格又 標準化 地域要因 地域要因補 個別的要因 本件土地3 本件土地3の時価公示地及び 事情補正値 時点修正値 標準価格 試算価格は取引価格 補正値 補正値 正後の価格 補正値 の地積 (評価額)取引事例 \n ① ② ③ ④ ⑤ ⑥ ⑦ ⑧ ⑨ ⑩ ⑪公示地 100 99.8 100 71.9 \n 337,000円 × × × × 241,818円 \n (三鷹●●) 100 100 100 100公示地 100 99.8 98.5 71.2 \n 332,000円 × × × × 232,372円原 (三鷹●●) 100 100 100 100告 \n 主張 公示地 100 99.8 88.4 56.7 \n 429,000円 × × × × 214,596円 \n (三鷹●●) 100 100 100 100 \n 71.3 \n 235,768円 × 168,102円 619.55㎡ 104,147,594円 \n 100 97.7 92.9 75.3本件土地G 372,069円 × × × × 254,289円 \n 100 100 100 100公示地 100 99.8 100 102.4 \n 337,000円 × × × × 344,398円 \n (三鷹●●) 100 100 100 100公示地 100 99.8 100 100.9 \n 332,000円 × × × × 334,318円被 (三鷹●●) 100 100 100 100告 \n 主張 公示地 100 99.8 100 84.2 \n 429,000円 × × × × 360,496円 \n (三鷹●●) 100 100 100 100 \n 352,822円 × 352,822円 619.55㎡ 218,590,870円 \n 100 97.7 92.2 107.2本件土地G 385,312円 × × × × 372,077円 \n 100 100 100 100 \n 別表６－１ \n １－１表（本件土地Ａ・標準化補正値、個別的要因比準表） 標準住宅地域個別的要因 本件土地Ａ 標準化補正後の本件土地Ａ格差 計条件 項目 細項目 基準地 対象地原告主張 被告主張 原告主張 被告主張 原告主張 被告主張 原告主張 被告主張系統及び連続性 普通 普通 普通 普通街路条件 接面街路の系統・構造等の状態 幅員 普通 普通 普通 普通舖装 普通 普通 普通 普通 (100)/100 (100)/100交通施設との距離 最寄駅への接近性 普通 普通 普通 普通交通・接近条件 商店街との接近の程度 最寄商店街への接近性 やや優る 普通 やや優る 普通 △2.0公共施設との接近の程度 幼稚園、小学校、公園、病院、官公署等 普通 普通 普通 普通 (98)/100 (100)/100日照・通風・乾湿等の良否 日照、通風、乾湿等 普通 普通 普通 普通地勢・地質・地盤等の良否 地勢、地質、地盤等 普通 普通 劣る 普通 △1.5周囲の状態 隣接地の利用状況 普通 普通 普通 普通環境条件 上水道 普通 普通 普通 普通供給処理施設の状態 下水道 普通 普通 普通 普通都市ガス等 普通 普通 普通 普通危険施設・処理施設等との接近の程度 危険施設、処理施設等の有無 無 無 無 無 (98.5)/100 (100)/100地積 普通 普通 普通 普通間口狭小 普通 普通 普通 普通地積・間口・奥行・形状等 奥行逓減 普通 普通 普通 普通奥行短小 普通 普通 普通 普通画地条件 奥行長大 やや劣る やや劣る 普通 普通 1.02 1.02不整形地 普通 普通 普通 普通三角地方位・高低・角地・その他接面街路との間係 方位 西 西 東 東 1.01 1.01高低 普通 普通 普通 普通角地準角地二方路三方路袋地無道路地崖地等私道減価その他 高圧線下地 (103)/100 (103.0)/100行政的条件 公法上の規制の程度 用途地域及びその他の地域、地区等 普通 普通 普通 普通 (100)/100 (100)/100その他 その他 普通 普通 普通 普通 (100)/100 (100)/100個別的要因の 原告集計 (100)/100×(98)/100×(98.5)/100×(103)/100×(100)/100×(100)/100＝(99.4)/100 ④比較計 被告集計 (100)/100×(100)/100×(100)/100×(103)/100×(100)/100×(100)/100＝(103.0)/100 ④ \n １－２表（本件土地Ｂ・標準化補正値、個別的要因比準表） 標準住宅地域個別的要因 本件土地Ｂ 標準化補正後の本件土地Ｂ格差 計条件 項目 細項目 基準地 対象地原告主張 被告主張 原告主張 被告主張 原告主張 被告主張 原告主張 被告主張系統及び連続性 やや劣る 普通 普通 普通 1.00街路条件 接面街路の系統・構造等の状態 幅員 普通 普通 普通 普通舖装 普通 普通 普通 普通 (101)/100 (100)/100交通施設との距離 最寄駅への接近性 普通 普通 普通 普通交通・接近条件 商店街との接近の程度 最寄商店街への接近性 やや優る 普通 普通 普通公共施設との接近の程度 幼稚園、小学校、公園、病院、官公署等 普通 普通 普通 普通 (100)/100 (100)/100日照・通風・乾湿等の良否 日照、通風、乾湿等 普通 普通 普通 普通地勢・地質・地盤等の良否 地勢、地質、地盤等 普通 普通 劣る 普通 △1.5周囲の状態 隣接地の利用状況 普通 普通 普通 普通環境条件 上水道 普通 普通 普通 普通供給処理施設の状態 下水道 普通 普通 普通 普通都市ガス等 普通 普通 普通 普通危険施設・処理施設等との接近の程度 危険施設、処理施設等の有無 無 無 無 無 (98.5)/100 (100)/100地積 普通 普通 普通 普通間口狭小 普通 普通 普通 普通地積・間口・奥行・形状等 奥行逓減 普通 普通 普通 普通奥行短小 やや劣る やや劣る 普通 普通 1.02 1.02画地条件 奥行長大 普通 普通 普通 普通不整形地 普通 普通 普通 普通三角地方位・高低・角地・その他接面街路との関係 方位 北 北 東 東 1.03 1.03高低角地準角地二方路三方路袋地無道路地崖地等私道減価その他 高圧線下地 (105.1)/100 (105.1)/100行政的条件 公法上の規制の程度 用途地域及びその他の地域、地区等 普通 普通 普通 普通 (100)/100 (100)/100その他 その他 普通 普通 普通 普通 (100)/100 (100)/100個別的要因の 原告集計 (101)/100×(100)/100×(98.5)/100×(105.1)/100×(100)/100×(100)/100＝(104.6)/100 ④比較計 被告集計 (100)/100×(100)/100×(100)/100×(105.1)×100×(100)/100×(100)/100＝(105.1)/100 ④ \n １－３表（本件土地Ｃ・標準化補正値、個別的要因比準表） 標準住宅地域個別的要因 本件土地Ｃ 標準化補正後の本件土地Ｃ格差 計条件 項目 細項目 基準地 対象地原告主張 被告主張 原告主張 被告主張 原告主張 被告主張 原告主張 被告主張系統及び連続性 劣る 普通 普通 普通 1.00街路条件 接面街路の系統・構造等の状態 幅員 普通 普通 普通 普通舖装 普通 普通 普通 普通 (101)/100 (100)/100交通施設との距離 最寄駅への接近性 普通 普通 普通 普通交通・接近条件 商店街との接近の程度 最寄商店街への接近性 普通 普通 普通 普通公共施設との接近の程度 幼稚園、小学校、公園、病院、官公署等 普通 普通 普通 普通 (100)/100 (100)/100日照・通風・乾湿等の良否 日照、通風、乾湿等 普通 普通 普通 普通地勢・地質・地盤等の良否 地勢、地質、地盤等 普通 普通 劣る 普通 △1.5周囲の状態 隣接地の利用状況 普通 普通 普通 普通環境条件 上水道 普通 普通 普通 普通供給処理施設の状態 下水道 普通 普通 普通 普通都市ガス等 普通 普通 普通 普通危険施設・処理施設等との接近の程度 危険施設、処理施設等の有無 無 無 無 無 (98.5)/100 (100)/100地積 普通 普通 普通 普通間口狭小 普通 普通 普通 普通地積・間口・奥行・形状等 奥行逓減 普通 普通 普通 普通奥行短小 普通 普通 普通 普通画地条件 奥行長大 普通 普通 普通 普通不整形地 やや劣る やや劣る 普通 普通 1.05 1.05三角地方位・高低・角地・その他接面街路との関係 方位 南 南 東 東 0.98 0.98高低 普通 普通 普通 普通角地準角地二方路三方路袋地無道路地崖地等私道減価その他 高圧線下地 (102.9)/100 (102.9)/100行政的条件 公法上の規制の程度 用途地域及びその他の地域、地区等 普通 普通 普通 普通 (100)/100 (100)/100その他 商店街の配置の状態 普通 普通 普通 普通 (100)/100 (100)/100個別的要因の 原告集計 (101)/100×(100)/100×(98.5)/100×(102.9)/100×(100)/100×(100)/100＝(102.4)/100 ④比較計 被告集計 (100)/100×(100)/100×(100)/100×(102.9)/100×(100)/100×(100)/100＝(102.9)/100 ④ \n ２－１表（公示地（調布●●）・地域要因補正値、地域要因比準表 標準住宅地域個別的要因 公示地（調布●●） 本件土地１の標準的な画地格差 計条件 項目 細項目 基準地の属する地域 対象地の属する地域原告主張 被告主張 原告主張 被告主張 原告主張 被告主張 原告主張 被告主張幅員 普通 普通 普通 普通街路条件 接面街路の系統・構造等の状態 舗装 普通 普通 普通 普通配置 優る 優る 普通 普通 △2.0 △2.0系統及び連続性 普通 優る 普通 優る (98)/100 (98)/100交通・接近条件 都心との距離及び交通施設の状態 最寄駅への接近性 普通 普通 普通 普通都心への接近性 普通 普通 普通 普通商店街の配置の状態 最寄商店街への接近性 やや優る 普通 普通 普通 △4.0最寄商店街の性格 普通 普通 普通 普通学校・公園・病院の配置の状態 小学校、公園、病院、官公署等 普通 普通 普通 普通 (96)/100 (100)/100環境条件 気象の条件 日照、通風、乾湿等 普通 普通 普通 普通自然的環境の良否 眺望、景観、地勢、地盤等 劣る 普通 劣る 普通居住者の移動等の状態 居住者の増減家族構成等 普通 普通 普通 普通社会的環境の良否 社会的環境の良否 優る 普通 劣る 普通 △5.0画地の標準面積 普通 普通 普通 普通各画地の面積・配置及び利用の状態 各画地の配置状態 優る 優る 普通 普通 △1.5 △1.5土地の利用度 優る 優る 劣る 普通 △3.0 △1.5周辺の利用の状態 優る 優る 劣る 普通 △3.0 △1.5上水道 有 有 可能 有 △1.5供給処理施設の状態 下水道 有 有 可能 有 △2.0都市ガス等 有 有 可能 有 △1.0危険施設、処理施設等の有無 危険施設、処理施設等の有無 無 無 やや大きい 無 △4.0災害発生の危険性 洪水、地すべり等 無 無 無 無公害発生の程度 騒音、大気汚染等 やや大きい ほぼ同じ △2.5 (76.5)/100 (95.5)/100行政的条件 土地の利用に関する公法上の規制の程度 用途地域及び建ペイ率、容積率 普通 普通 普通 普通その他の規制 普通 普通 普通 普通 (100)/100 (100)/100その他 その他 将来の動向 普通 普通 普通 普通その他 普通 普通 普通 普通 (100)/100 (100)/100地域要因の 原告集計 (98)/100×(96)/100×(76.5)/100×(100)/100×(100)/100＝(72.0)/100 ⑤比較計 被告集計 (98)/100×(100)/100×(95.5)/100×(100)/100×(100)/100＝(93.6)/100 ⑤ \n ２－２表（本件土地Ａ・地域要因補正値、地域要因比準表） 標準住宅地域個別的要因 本件土地Ａ 本件土地１の標準的な画地格差 計条件 項目 細項目 基準地の属する地域 対象地の属する地域原告主張 被告主張 原告主張 被告主張 原告主張 被告主張 原告主張 被告主張幅員 普通 普通 普通 普通街路条件 接面街路の系統・構造等の状態 舗装 普通 普通 普通 普通配置 普通 劣る 普通 普通 2.0系統及び連続性 普通 普通 普通 優る 2.0 (100)/100 (104)/100交通・接近条件 都心との距離及び交通施設の状態 最寄駅への接近性 普通 普通 普通 普通都心への接近性 普通 普通 普通 普通商店街の配置の状態 最寄商店街への接近性 やや優る 普通 普通 普通 △2.0最寄商店街の性格 普通 普通 普通 普通学校・公園・病院の配置の状態 小学校、公園、病院、官公署等 普通 普通 普通 普通 (98)/100 (100)/100環境条件 気象の条件 日照、通風、乾湿等 普通 普通 普通 普通自然的環境の良否 眺望、景観、地勢、地盤等 普通 普通 劣る 普通 △1.5居住者の移動等の状態 居住者の増減家族構成等 普通 普通 普通 普通社会的環境の良否 社会的環境の良否 優る 普通 劣る 普通 △5.0画地の標準面積 普通 普通 普通 普通各画地の面積・配置及び利用の状態 各画地の配置状態 優る 普通 普通 普通 △1.5土地の利用度 普通 普通 劣る 普通 △1.5周辺の利用の状態 普通 普通 劣る 普通 △1.5上水道 有 有 可能 有 △1.5供給処理施設の状態 下水道 有 有 可能 有 △2.0都市ガス等 有 有 可能 有 △1.0危険施設、処理施設等の有無 危険施設、処理施設等の有無 無 無 やや大きい 無 △4.0災害発生の危険性 洪水、地すべり等 無 無 無 無公害発生の程度 騒音、大気汚染等 やや大きい ほぼ同じ △2.5 (79.5)/100 (100)/100行政的条件 土地の利用に関する公法上の規制の程度 用途地域及びその他の地域、地区等 普通 普通 普通 普通その他の規制 普通 普通 普通 普通 (100)/100 (100)/100その他 その他 将来の動向 普通 普通 普通 普通その他 普通 普通 普通 普通 (100)/100 (100)/100地域要因の 原告集計 (100)/100×(98)/100×(79.5)/100×(100)/100×(100)/100＝(77.9)/100 ⑤比較計 被告集計 (104)/100×(100)/100×(100)/100×(100)/100×(100)/100＝(104)/100 ⑤ \n ２－３表（本件土地Ｂ・地域要因補正値、地域要因比準表） 標準住宅地域個別的要因 本件土地Ｂ 本件土地１の標準的な画地格差 計条件 項目 細項目 基準地の属する地域 対象地の属する地域原告主張 被告主張 原告主張 被告主張 原告主張 被告主張 原告主張 被告主張幅員 普通 劣る 普通 普通 3.0街路条件 接面街路の系統・構造等の状態 舗装 普通 普通 普通 普通配置 普通 劣る 普通 普通 2.0系統及び連続性 劣る 普通 普通 優る 2.0 2.0 (102)/100 (107)/100交通・接近条件 都心との距離及び交通施設の状態 最寄駅への接近性 普通 普通 普通 普通都心への接近性 普通 普通 普通 普通商店街の配置の状態 最寄商店街への接近性 やや優る 普通 普通 普通 △2.0最寄商店街の性格 普通 劣る 普通 普通 1.5学校・公園・病院の配置の状態 小学校、公園、病院、官公署等 普通 普通 普通 普通 (98)/100 (101.5)/100環境条件 気象の条件 日照、通風、乾湿等 普通 普通 普通 普通自然的環境の良否 眺望、景観、地勢、地盤等 普通 普通 劣る 普通 △1.5居住者の移動等の状態 居住者の増減家族構成等 普通 普通 普通 普通社会的環境の良否 社会的環境の良否 優る 普通 劣る 普通 △5.0画地の標準面積 普通 普通 普通 普通各画地の面積・配置及び利用の状態 各画地の配置状態 優る 普通 普通 普通 △1.5土地の利用度 普通 普通 劣る 普通 △1.5周辺の利用の状態 普通 普通 劣る 普通 △1.5上水道 有 有 可能 有 △1.5供給処理施設の状態 下水道 有 有 可能 有 △2.0都市ガス等 有 有 可能 有 △1.0危険施設、処理施設等の有無 危険施設、処理施設等の有無 無 無 やや大きい 無 △4.0災害発生の危険性 洪水、地すべり等 無 無 無 無公害発生の程度 騒音、大気汚染等 やや大きい ほぼ同じ △2.5 (78.0)/100 (100)/100行政的条件 土地の利用に関する公法上の規制の程度 用途地域及びその他の地域、地区等 普通 普通 普通 普通その他の規制 普通 普通 普通 普通 (100)/100 (100)/100その他 その他 将来の動向 普通 普通 普通 普通その他 普通 普通 普通 普通 (100)/100 (100)/100地域要因の 原告集計 (102)/100×(98)/100×(78.0)/100×(100)/100×(100)/100＝(80.4)/100 ⑤比較計 被告集計 (107)/100×(101.5)/100×(100)/100×(100)/100×(100)/100＝(108.6)/100 ⑤ \n ２－４表（本件土地Ｃ・地域要因補正値、地域要因比準表） 標準住宅地域個別的要因 本件土地Ｃ 本件土地１の標準的な画地格差 計条件 項目 細項目 基準地の属する地域 対象地の属する地域原告主張 被告主張 原告主張 被告主張 原告主張 被告主張 原告主張 被告主張幅員 普通 劣る 普通 普通 3.0街路条件 接面街路の系統・構造等の状態 舗装 普通 普通 普通 普通配置 劣る 劣る 普通 普通 2.0 2.0系統及び連続性 劣る 普通 普通 優る 2.0 2.0 (104)/100 (107)/100交通・接近条件 都心との距離及び交通施設の状態 最寄駅への接近性 普通 普通 普通 普通都心への接近性 普通 普通 普通 普通商店街の配置の状態 最寄商店街への接近性 普通 普通 普通 普通最寄商店街の性格 普通 劣る 普通 普通 1.5学校・公園・病院の配置の状態 小学校、公園、病院、官公署等 やや優る 普通 普通 普通 △1.5 (98.5)/100 (101.5)/100環境条件 気象の条件 日照、通風、乾湿等 普通 普通 普通 普通自然的環境の良否 眺望、景観、地勢、地盤等 普通 普通 劣る 普通 △1.5居住者の移動等の状態 居住者の増減家族構成等 普通 普通 普通 普通社会的環境の良否 社会的環境の良否 優る 普通 劣る 普通 △5.0画地の標準面積 普通 普通 普通 普通各画地の面積・配置及び利用の状態 各画地の配置状態 優る 普通 普通 普通 △1.5土地の利用度 普通 普通 劣る 普通 △1.5周辺の利用の状態 普通 普通 劣る 普通 △1.5上水道 有 有 可能 有 △1.5供給処理施設の状態 下水道 有 有 可能 有 △2.0都市ガス等 有 有 可能 有 △1.0危険施設、処理施設等の有無 危険施設、処理施設等の有無 無 無 やや大きい 無 △4.0災害発生の危険性 洪水、地すべり等 無 無 無 無公害発生の程度 騒音、大気汚染等 やや大きい ほぼ同じ △2.5 (78.0)/100 (100)/100行政的条件 土地の利用に関する公法上の規制の程度 用途地域及び建ぺい率、容積率 普通 普通 普通 普通その他の規制 普通 普通 普通 普通 (100)/100 (100)/100その他 その他 将来の動向 普通 普通 普通 普通その他 普通 普通 普通 普通 (100)/100 (100)/100地域要因の 原告集計 (104)/100×(98.5)/100×(78.0)/100×(100)/100×(100)/100＝(79.9)/100 ⑤比較計 被告集計 (107)/100×(101.5)/100×(100)/100×(100)/100×(100)/100＝(108.6)/100 ⑤ \n ３表（本件土地１・個別的要因補正値、個別的要因比準表） 標準住宅地域個別的要因 本件土地１の標準的画地 本件土地１格差 計条件 項目 細項目 基準地 対象地原告主張 被告主張 原告主張 被告主張 原告主張 被告主張 原告主張 被告主張系統及び連続性 普通 普通 普通 普通街路条件 接面街路の系統・構造等の状態 幅員 普通 普通 普通 普通舖装 普通 普通 普通 普通 (100)/100 (100)/100交通施設との距離 最寄駅への接近性 普通 普通 普通 普通交通・接近条件 商店街との接近の程度 最寄商店街への接近性 優る 普通 普通 普通 △4.0公共施設との接近の程度 幼稚園、小学校、公園、病院、官公署等 普通 普通 普通 普通 (96)/100 (100)/100日照・通風・乾湿等の良否 日照、通風、乾湿等 普通 普通 普通 普通地勢・地質・地盤等の良否 地勢、地質、地盤等 劣る 普通 普通 普通 1.5周囲の状態 隣接地の利用状況 普通 普通 劣る 普通 △4.0環境条件 上水道 普通 普通 劣る 普通 △1.5供給処理施設の状態 下水道 普通 普通 劣る 普通 △1.5都市ガス等 普通 普通 劣る 普通 △1.0危険施設・処理施設等との接近の程度 危険施設、処理施設等の有無 無 無 やや大きい 無 △6.0 (87.5)/100 (100)/100地積 普通 普通 劣る 普通 0.9間口狭小 普通 普通 普通 普通地積・間口・奥行・形状等 奥行逓減 普通 普通 普通 普通奥行短小 普通 普通 普通 普通画地条件 奥行長大 普通 普通 普通 普通不整形地 普通 普通 劣る 劣る 0.90 0.90三角地方位・高低・角地・その他接面街路との関係 方位 東 東 東 東高低 普通 普通 普通 普通角地 普通 普通 優る 優る 1.05 1.05準角地二方路三方路袋地無道路地崖地等私道減価その他 高圧線下地250.47/464.54＝0.539 高圧線32%減 高圧線14%減 0.68 0.86 (57.8)/100 (81.3)/100行政的条件 公法上の規制の程度 用途地域及びその他の地域、地区等 普通 普通 普通 普通 (100)/100 (100)/100その他 商店街の配置の状態 普通 普通 普通 普通 (100)/100 (100)/100個別的要因の 原告集計 (100)/100×(96)/100×(87.5)/100×(57.8)/100×(100)/100×(100)/100＝(48.6)/100 ⑧比較計 被告集計 (100)/100×(100)/100×(100)/100×(81.3)/100×(100)/100×(100)/100＝(81.3)/100 ⑧別表６－２ \n １－１表（本件土地Ｄ・標準化補正値、個別的要因比準表） 標準住宅地域個別的要因 本件土地Ｄ 標準化補正後の本件土地Ｄ格差 計条件 項目 細項目 基準地 対象地原告主張 被告主張 原告主張 被告主張 原告主張 被告主張 原告主張 被告主張系統及び連続性 普通 普通 普通 普通街路条件 接面街路の系統・構造等の状態 幅員 普通 普通 普通 普通舖装 普通 普通 普通 普通 (100)/100 (100)/100交通施設との距離 最寄駅への接近性 普通 普通 普通 普通交通・接近条件 商店街との接近の程度 最寄商店街への接近性 普通 普通 普通 普通公共施設との接近の程度 幼稚園、小学校、公園、病院、官公署等 普通 普通 普通 普通 (100)/100 (100)/100日照・通風・乾湿等の良否 日照、通風、乾湿等 普通 普通 普通 普通地勢・地質・地盤等の良否 地勢、地質、地盤等 普通 普通 普通 普通周囲の状態 隣接地の利用状況 普通 普通 普通 普通環境条件 上水道 普通 普通 普通 普通供給処理施設の状態 下水道 普通 普通 普通 普通都市ガス等 普通 普通 普通 普通危険施設・処理施設等との接近の程度 危険施設、処理施設等の有無 無 無 無 無 (100)/100 (100)/100地積 普通 普通 普通 普通間口狭小 普通 普通 普通 普通地積・間口・奥行・形状等 奥行逓減 普通 普通 普通 普通奥行短小 普通 普通 普通 普通画地条件 奥行長大 普通 普通 普通 普通不整形地 普通 普通 普通 普通三角地方位・高低・角地・その他接面街路との関係 方位 南 南 南 南高低 普通 普通 普通 普通角地 やや優る やや優る 普通 普通 0.97 0.97準角地二方路三方路袋地無道路地崖地等私道減価その他 高圧線下地 (97)/100 (97)/100行政的条件 公法上の規制の程度 用途地域及びその他の地域、地区等 普通 普通 普通 普通 (100)/100 (100)/100その他 その他 普通 普通 普通 普通 (100)/100 (100)/100個別的要因の 原告集計 (100)/100×(100)/100×(100)/100×(97)/100×(100)/100×(100)/100＝(97)/100 ④比較計 被告集計 (100)/100×(100)/100×(100)/100×(97)/100×(100)/100×(100)/100＝(97)/100 ④ \n １－２表（本件土地Ｅ・標準化補正値、個別的要因比準表） 標準住宅地域個別的要因 本件土地Ｅ 標準化補正後の本件土地Ｅ格差 計条件 項目 細項目 基準地 対象地原告主張 被告主張 原告主張 被告主張 原告主張 被告主張 原告主張 被告主張系統及び連続性 普通 普通 普通 普通街路条件 接面街路の系統・構造等の状態 幅員 普通 普通 普通 普通舖装 普通 普通 普通 普通 (100)/100 (100)/100交通施設との距離 最寄駅への接近性 普通 普通 普通 普通交通・接近条件 商店街との接近の程度 最寄商店街への接近性 普通 普通 普通 普通公共施設との接近の程度 幼稚園、小学校、公園、病院、官公署等 普通 普通 普通 普通 (100)/100 (100)/100日照・通風・乾湿等の良否 日照、通風、乾湿等 普通 普通 普通 普通地勢・地質・地盤等の良否 地勢、地質、地盤等 普通 普通 普通 普通周囲の状態 隣接地の利用状況 普通 普通 普通 普通環境条件 上水道 普通 普通 普通 普通供給処理施設の状態 下水道 普通 普通 普通 普通都市ガス等 普通 普通 普通 普通危険施設・処理施設等との接近の程度 危険施設、処理施設等の有無 無 無 無 無 (100)/100 (100)/100地積 普通 普通 普通 普通間口狭小 やや劣る やや劣る 普通 普通 1.05 1.05地積・間口・奥行・形状等 奥行逓減 普通 普通 普通 普通奥行短小 普通 普通 普通 普通画地条件 奥行長大 普通 普通 普通 普通不整形地 普通 普通 普通 普通三角地方位・高低・角地・その他接面街路との関係 方位 北 北 東 南 1.05 1.05高低 普通 普通 普通 普通角地準角地二方路三方路袋地無道路地崖地等私道減価その他 高圧線下地 (110.3)/100 (110.3)/100行政的条件 公法上の規制の程度 用途地域及びその他の地域、地区等 普通 普通 普通 普通 (100)/100 (100)/100その他 その他 優る 普通 普通 普通 △0.5 (99.5)/100 (100)/100個別的要因の 原告集計 (100)/100×(100)/100×(100)/100×(110.3)/100×(100)/100×(99.5)/100＝(109.7)/100 ④比較計 被告集計 (100)/100×(100)/100×(100)/100×(110.3)/100×(100)/100×(100)/100＝(110.3)/100 ④ \n １－３表（本件土地Ｆ・標準化補正値、個別的要因比準表） 標準住宅地域個別的要因 本件土地Ｆ 標準化補正後の本件土地Ｆ格差 計条件 項目 細項目 基準地 対象地原告主張 被告主張 原告主張 被告主張 原告主張 被告主張 原告主張 被告主張街路条件 接面街路の系統・構造等の状態 系統及び連続性 やや優る 普通 普通 普通 △1.0幅員 やや優る 普通 普通 普通 △1.0舖装 普通 普通 普通 普通 (98)/100 (100)/100交通・接近条件 交通施設との距離 最寄駅への接近性 普通 普通 普通 普通商店街との接近の程度 最寄商店街への接近性 普通 普通 普通 普通公共施設との接近の程度 幼稚園、小学校、公園、病院、官公署等 やや優る 普通 普通 普通 △1.5 (98.5)/100 (100)/100環境条件 日照・通風・乾湿等の良否 日照、通風、乾湿等 普通 普通 普通 普通地勢・地質・地盤等の良否 地勢、地質、地盤等 普通 普通 普通 普通周囲の状態 隣接地の利用状況 普通 普通 普通 普通供給処理施設の状態 上水道 普通 普通 普通 普通下水道 普通 普通 普通 普通都市ガス等 普通 普通 普通 普通危険施設・処理施設等との接近の程度 危険施設、処理施設等の有無 無 無 無 無 (100)/100 (100)/100地積 やや劣る やや劣る 普通 普通 1.05 1.05間口狭小 普通 普通 普通 普通地積・間口・奥行・形状等 奥行逓減 普通 普通 普通 普通 1.05奥行短小 普通 普通 普通 普通奥行長大 やや劣る 普通 普通 普通画地条件 不整形地 劣る 劣る 普通 普通 1.11 1.11三角地方位・高低・角地・その他接面街路との関係 方位 西 西 南 南 1.03 1.03高低 普通 普通 普通 普通角地準角地二方路三方路袋地無道路地崖地等私道減価その他 高圧線下地 (126)/100 (120)/100行政的条件 公法上の規制の程度 用途地域及びその他の地域、地区等 普通 普通 普通 普通 (100)/100 (100)/100その他 その他 普通 普通 普通 普通 (100)/100 (100)/100個別的要因の 原告集計 (98)/100×(98.5)/100×(100)/100×(126.0)/100×(100)/100×(100)/100＝(121.6)/100 ④比較計 被告集計 (100)/100×(100)/100×(100)/100×(120.0)/100×(100)/100×(100)/100＝(120.0)/100 ④ \n ２－１表（公示地（調布●●）・地域要因補正値、地域要因比準表） 標準住宅地域個別的要因 公示地（調布●●） 本件土地２の標準的な画地格差 計条件 項目 細項目 基準地の属する地域 対象地の属する地域原告主張 被告主張 原告主張 被告主張 原告主張 被告主張 原告主張 被告主張幅員 普通 普通 普通 普通街路条件 接面街路の系統・構造等の状態 舗装 普通 普通 普通 普通配置 普通 普通 普通 普通系統及び連続性 普通 優る 普通 優る (100)/100 (100)/100交通・接近条件 都心との距離及び交通施設の状態 最寄駅への接近性 普通 普通 普通 普通都心への接近性 普通 普通 普通 普通商店街の配置の状態 最寄商店街への接近性 普通 普通 普通 普通最寄商店街の性格 普通 普通 普通 普通学校・公園・病院の配置の状態 小学校、公園、病院、官公署等 普通 普通 普通 普通 (100)/100 (100)/100環境条件 気象の条件 日照、通風、乾湿等 普通 普通 普通 普通自然的環境の良否 眺望、景観、地勢、地盤等 普通 普通 普通 普通居住者の移動等の状態 居住者の増減家族構成等 普通 普通 普通 普通社会的環境の良否 社会的環境の良否 普通 普通 劣る 普通 △2.5画地の標準面積 劣る 普通 優る 普通 3.0各画地の面積・配置及び利用の状態 各画地の配置状態 優る 普通 劣る 普通 △3.0土地の利用度 優る 優る 劣る 普通 △3.0 △1.5周辺の利用の状態 優る 普通 劣る 普通 △3.0上水道 有 有 可能 有 △1.5供給処理施設の状態 下水道 有 有 可能 有 △2.0都市ガス等 有 有 可能 有 △1.0危険施設、処理施設等の有無 危険施設、処理施設等の有無 無 無 無 無災害発生の危険性 洪水、地すべり等 無 無 無 無公害発生の程度 騒音、大気汚染等 やや大きい ほぼ同じ △2.5 (84.5)/100 (98.5)/100行政的条件 土地の利用に関する公法上の規制の程度 用途地域及びその他の地域、地区等 普通 普通 普通 普通その他の規制 普通 普通 普通 普通 (100)/100 (100)/100その他 その他 将来の動向 普通 普通 普通 普通その他 普通 普通 普通 普通 (100)/100 (100)/100地域要因の 原告集計 (100)/100×(100)/100×(84.5)/100×(100)/100×(100)/100＝(84.5)/100 ⑤比較計 被告集計 (100)/100×(100)/100×(98.5)/100×(100)/100×(100)/100＝(98.5)/100 ⑤ \n ２－２表（本件土地Ｄ・地域要因補正値、地域要因比準表） 標準住宅地域個別的要因 本件土地Ｄ 本件土地２の標準的な画地格差 計条件 項目 細項目 基準地の属する地域 対象地の属する地域原告主張 被告主張 原告主張 被告主張 原告主張 被告主張 原告主張 被告主張幅員 普通 普通 普通 普通街路条件 接面街路の系統・構造等の状態 舗装 普通 普通 普通 普通配置 普通 普通 普通 普通系統及び連続性 普通 優る 普通 優る (100)/100 (100)/100交通・接近条件 都心との距離及び交通施設の状態 最寄駅への接近性 普通 普通 普通 普通都心への接近性 普通 普通 普通 普通商店街の配置の状態 最寄商店街への接近性 普通 普通 普通 普通最寄商店街の性格 普通 普通 普通 普通学校・公園・病院の配置の状態 小学校、公園、病院、官公署等 普通 普通 普通 普通 (100)/100 (100)/100環境条件 気象の条件 日照、通風、乾湿等 普通 普通 普通 普通自然的環境の良否 眺望、景観、地勢、地盤等 普通 普通 普通 普通居住者の移動等の状態 居住者の増減家族構成等 普通 普通 普通 普通社会的環境の良否 社会的環境の良否 普通 普通 劣る 普通 △2.5画地の標準面積 劣る 普通 優る 普通 3.0各画地の面積・配置及び利用の状態 各画地の配置状態 優る 普通 劣る 普通 △3.0土地の利用度 優る 優る 劣る 普通 △3.0 △1.5周辺の利用の状態 優る 普通 劣る 普通 △3.0上水道 有 有 可能 有 △1.5供給処理施設の状態 下水道 有 有 可能 有 △2.0都市ガス等 有 有 可能 有 △1.0危険施設、処理施設等の有無 危険施設、処理施設等の有無 無 無 無 無災害発生の危険性 洪水、地すべり等 無 無 無 無公害発生の程度 騒音、大気汚染等 やや大きい ほぼ同じ △2.5 (84.5)/100 (98.5)/100行政的条件 土地の利用に関する公法上の規制の程度 用途地域及び建ぺい率、容積率 普通 普通 普通 普通その他の規制 著通 普通 普通 普通 (100)/100 (100)/100その他 その他 将来の動向 普通 普通 普通 普通その他 普通 普通 普通 普通 (100)/100 (100)/100地域要因の 原告集計 (100)/100×(100)/100×(84.5)/100×(100)/100×(100)/100＝(84.5)/100 ⑤比較計 被告集計 (100)/100×(100)/100×(98.5)/100×(100)/100×(100)/100＝(98.5)/100 ⑤ \n ２－３表（本件土地Ｅ・地域要因補正値、地域要因比準表） 標準住宅地域個別的要因 本件土地Ｅ 本件土地２の標準的な画地格差 計条件 項目 細項目 基準地の属する地域 対象地の属する地域原告主張 被告主張 原告主張 被告主張 原告主張 被告主張 原告主張 被告主張幅員 普通 普通 普通 普通街路条件 接面街路の系統・構造等の状態 舗装 普通 普通 普通 普通配置 普通 普通 普通 普通系統及び連続性 普通 優る 普通 優る (100)/100 (100)/100交通・接近条件 都心との距離及び交通施設の状態 最寄駅への接近性 普通 普通 普通 普通都心への接近性 普通 普通 普通 普通商店街の配置の状態 最寄商店街への接近性 普通 普通 普通 普通最寄商店街の性格 普通 普通 普通 普通学校・公園・病院の配置の状態 小学校、公園、病院、官公署等 普通 普通 普通 普通 (100)/100 (100)/100環境条件 気象の条件 日照、通風、乾湿等 普通 普通 普通 普通自然的環境の良否 眺望、景観、地勢、地盤等 普通 普通 普通 普通居住者の移動等の状態 居住者の増減家族構成等 普通 普通 普通 普通社会的環境の良否 社会的環境の良否 普通 普通 劣る 普通 △2.5画地の標準面積 劣る 普通 優る 普通 3.0各画地の面積・配置及び利用の状態 各画地の配置状態 優る 普通 劣る 普通 △3.0土地の利用度 優る 優る 劣る 普通 △3.0 △1.5周辺の利用の状態 優る 普通 劣る 普通 △3.0上水道 有 有 可能 有 △1.5供給処理施設の状態 下水道 有 有 可能 有 △2.0都市ガス等 有 有 可能 有 △1.0危険施設、処理施設等の有無 危険施設、処理施設等の有無 無 無 無 無災害発生の危険性 洪水、地すべり等 無 無 無 無公害発生の程度 騒音、大気汚染等 やや大きい ほぼ同じ △2.5 (84.5)/100 (98.5)/100行政的条件 土地の利用に関する公法上の規制の程度 用途地域及び建ぺい率、容積率 普通 普通 普通 普通その他の規制 普通 普通 普通 普通 (100)/100 (100)/100その他 その他 将来の動向 普通 普通 普通 普通その他 優る 普通 普通 普通 △0.5 (95)/100 (100)/100地域要因の 原告集計 (100)/100×(100)/100×(84.5)/100×(100)/100×(95)/100＝(80.3)/100 ⑤比較計 被告集計 (100)/100×(100)/100×(98.5)/100×(100)/100×(100)/100＝(98.5)/100 ⑤ \n ２－４表（本件土地Ｆ・地域要因補正値、地域要因比準表） 標準住宅地域個別的要因 本件土地Ｆ 本件土地２の標準的な画地格差 計条件 項目 細項目 基準地の属する地域 対象地の属する地域原告主張 被告主張 原告主張 被告主張 原告主張 被告主張 原告主張 被告主張幅員 優る 普通 普通 普通 △3.0街路条件 接面街路の系統・構造等の状態 舗装 普通 普通 普通 普通配置 普通 普通 普通 普通系統及び連続性 優る 優る 普通 優る △2.0 (95)/100 (100)/100交通・接近条件 都心との距離及び交通施設の状態 最寄駅への接近性 普通 普通 普通 普通都心への接近性 普通 普通 普通 普通商店街の配置の状態 最寄商店街への接近性 普通 やや劣る 普通 普通 2.0最寄商店街の性格 普通 普通 普通 普通学校・公園・病院の配置の状態 小学校、公園、病院、官公署等 やや優る 普通 普通 普通 △1.5 (98.5)/100 (102)/100環境条件 気象の条件 日照、通風、乾湿等 普通 普通 普通 普通自然的環境の良否 眺望、景観、地勢、地盤等 普通 普通 普通 普通居住者の移動等の状態 居住者の増減家族構成等 普通 普通 普通 普通社会的環境の良否 社会的環境の良否 普通 普通 劣る 普通 △2.5画地の標準的面積 普通 普通 普通 普通各画地の面積・配置及び利用の状態 各画地の配置状態 優る 普通 劣る 普通 △3.0土地の利用度 優る 優る 劣る 普通 △3.0 △1.5周辺の利用の状態 優る 普通 劣る 普通 △3.0上水道 有 有 可能 有 △1.5供給処理施設の状態 下水道 有 有 可能 有 △2.0都市ガス等 有 有 可能 有 △1.0危険施設、処理施設等の有無 危険施設、処理施設等の有無 無 無 無 無災害発生の危険性 洪水、地すべり等 無 無 無 無公害発生の程度 騒音、大気汚染等 やや大きい ほぼ同じ △2.5 (81.5)/100 (98.5)/100行政的条件 土地の利用に関する公法上の規制の程度 用途地域及び建ぺい率、容積率 普通 普通 普通 普通その他の規制 普通 普通 普通 普通 (100)/100 (100)/100その他 その他 将来の動向 普通 普通 普通 普通その他 普通 普通 普通 普通 (100)/100 (100)/100地域要因の 原告集計 (95)/100×(98.5)/100×(81.5)/100×(100)/100×(100)/100＝(76.3)/100 ⑤比較計 被告集計 (100)/100×(102)/100×(98.5)/100×(100)/100×(100)/100＝(100.5)/100 ⑤ \n ３表（本件土地２・個別的要因補正値、個別的要因比準表） 標準住宅地域個別的要因 本件土地２の標準的画地 本件土地２格差 計条件 項目 細項目 基準地 対象地原告主張 被告主張 原告主張 被告主張 原告主張 被告主張 原告主張 被告主張系統及び連続性 普通 普通 普通 普通街路条件 接面街路の系統・構造等の状態 幅員 普通 普通 普通 普通舖装 普通 普通 普通 普通 (100)/100 (100)/100交通施設との距離 最寄駅への接近性 普通 普通 普通 普通交通・接近条件 商店街との接近の程度 最寄商店街への接近性 普通 普通 普通 普通公共施設との接近の程度 幼稚園、小学校、公園、病院、官公署等 普通 普通 普通 普通 (100)/100 (100)/100日照・通風・乾湿等の良否 日照、通風、乾湿等 普通 普通 普通 普通地勢・地質・地盤等の良否 地勢、地質、地盤等 普通 普通 普通 普通周囲の状態 隣接地の利用状況 普通 普通 劣る 普通 △4.0環境条件 上水道 普通 普通 劣る 普通 △1.5供給処理施設の状態 下水道 普通 普通 劣る 普通 △1.5都市ガス等 普通 普通 劣る 普通 △1.0危険施設・処理施設等との接近の程度 危険施設、処理施設等の有無 無 無 無 無 (92)/100 (100)/100地積 普通 普通 劣る やや劣る 0.90 0.95間口狭小 普通 普通 普通 普通地積・間口・奥行・形状等 奥行逓減 普通 普通 普通 普通奥行短小 普通 普通 普通 普通画地条件 奥行長大 普通 普通 普通 普通不整形地 普通 普通 やや劣る 普通 0.95三角地方位・高低・角地・その他接面街路との関係 方位 南 南 南 南高低 普通 普通 やや劣る 普通 0.95角地 普通 普通 優る 優る 1.05 1.05準角地二方路三方路袋地無道路地崖地等私道減価その他 高圧線下地 (85.3)/100 (99.8)/100行政的条件 公法上の規制の程度 用途地域及びその他の地域、地区等 (100)/100 (100)/100その他 その他 (100)/100 (100)/100個別的要因の 原告集計 (100)/100×(100)/100×(92.0)/100×(85.3)/100×(100)/100×(100)/100＝(78.5)/100 ⑧比較計 被告集計 (100)/100×(100)/100×(100)/100×(99.8)/100×(100)/100×(100)/100＝(99.8)/100 ⑧別表６－３ \n １－１表（公示地（三鷹●●）・標準化補正値、個別的要因比準表） 混在住宅地域個別的要因 公示地（三鷹●●） 標準化補正後の公示地（三鷹●●） \n 格差 計条件 項目 細項目 基準地 対象地原告主張 被告主張 原告主張 被告主張 原告主張 被告主張 原告主張 被告主張系統及び連続性 普通 普通 普通 普通街路条件 接面街路の系統・構造等の状態 幅員 普通 普通 普通 普通舖装 普通 普通 普通 普通 (100)/100 (100)/100交通施設との距離 最寄駅への接近性 普通 普通 普通 普通交通・接近条件 商店街との接近の程度 最寄商店街への接近性 普通 普通 普通 普通公共施設との接近の程度 幼稚園、小学校、公園、病院、官公署等 やや優る 普通 やや優る 普通 (100)/100 (100)/100日照・通風・乾湿等の良否 日照、通風、乾湿等 普通 普通 普通 普通地勢・地質・地盤等の良否 地勢、地質、地盤等 普通 普通 普通 普通周囲の状態 隣接地の利用状況 やや劣る 普通 普通 普通 1.5環境条件 上水道 普通 普通 普通 普通供給処理施設の状態 下水道 普通 普通 普通 普通都市ガス等 普通 普通 普通 普通危険施設・処理施設等との接近の程度 危険施設、処理施設等の有無 無 無 無 無 (101.5)/100 (100)/100地積 普通 普通 普通 普通間口狭小 普通 普通 普通 普通地積・間口・奥行・形状等 奥行逓減 普通 普通 普通 普通奥行短小 普通 普通 普通 普通画地条件 奥行長大 普通 普通 普通 普通不整形地 普通 普通 普通 普通三角地 普通 普通 普通 普通方位・高低・角地・その他接面街路との関係 方位 西 西 西 西高低 普通 普通 普通 普通角地準角地二方路三方路袋地無道路地崖地等私道減価その他 高圧線下地 (100)/100 (100)/100行政的条件 公法上の規制の程度 用途地域及びその他の地域、地区等 弱い やや弱い 普通 やや弱い △3.0 (97)/100 (100)/100その他 その他 普通 普通 普通 普通 (100)/100 (100)/100個別的要因の 原告集計 (100)/100×(100)/100×(101.5)/100×(97)/100×(100)/100×(100)/100＝(98.5)/100 ④比較計 被告集計 (100)/100×(100)/100×(100)/100×(100)/100×(100)/100×(100)/100＝(100)/100 ④ \n １－２表（公示地（三鷹●●）・標準化補正値、個別的要因比準表） 混在住宅地域個別的要因 公示地（三鷹●●） 標準化補正後の公示地（三鷹●●） \n 格差 計条件 項目 細項目 基準地 対象地原告主張 被告主張 原告主張 被告主張 原告主張 被告主張 原告主張 被告主張系統及び連続性 やや優る 普通 普通 普通 △1.0街路条件 接面街路の系統・構造等の状態 幅員 やや優る 普通 普通 普通 △1.0舖装 普通 普通 普通 普通 (98)/100 (100)/100交通施設との距離 最寄駅への接近性 やや優る 普通 普通 普通 △2.0交通・接近条件 商店街との接近の程度 最寄商店街への接近性 優る 普通 普通 普通 △5.0公共施設との接近の程度 幼稚園、小学校、公園、病院、官公署等 やや優る 普通 やや優る 普通 (93)/100 (100)/100日照・通風・乾湿等の良否 日照、通風、乾湿等 普通 普通 普通 普通地勢・地質・地盤等の良否 地勢、地質、地盤等 普通 普通 普通 普通周囲の状態 隣接地の利用状況 普通 普通 普通 普通環境条件 上水道 普通 普通 普通 普通供給処理施設の状態 下水道 普通 普通 普通 普通都市ガス等 普通 普通 普通 普通危険施設・処理施設等との接近の程度 危険施設、処理施設等の有無 無 無 無 無 (100.0)/100 (100)/100地積 普通 普通 普通 普通間口狭小 普通 普通 普通 普通地積・間口・奥行・形状等 奥行逓減 普通 普通 普通 普通奥行短小 普通 普通 普通 普通画地条件 奥行長大 普通 普通 普通 普通不整形地 普通 普通 普通 普通三角地方位・高低・角地・その他接面街路との関係 方位 西 西 西 西高低 普通 普通 普通 普通角地準角地二方路三方路袋地無道路地崖地等私道減価その他 高圧線下地 (100)/100 (100)/100行政的条件 公法上の規制の程度 用途地域及びその他の地域、地区等 弱い やや弱い 普通 やや弱い △3.0 (97)/100 (100)/100その他 その他 普通 普通 普通 普通 (100)/100 (100)/100個別的要因の 原告集計 (98)/100×(93)/100×(100)/100×(100)/100×(97)/100×(100)/100＝(88.4)/100 ④比較計 被告集計 (100)/100×(100)/100×(100)/100×(100)/100×(100)/100×(100)/100＝(100)/100 ④ \n １－３表（本件土地Ｇ・標準化補正値、個別的要因比準表） 混在住宅地域個別的要因 本件土地Ｇ 標準化補正後の本件土地Ｇ格差 計条件 項目 細項目 基準地 対象地原告主張 被告主張 原告主張 被告主張 原告主張 被告主張 原告主張 被告主張系統及び連続性 やや劣る 普通 普通 普通 1.00街路条件 接面街路の系統・構造等の状態 幅員 普通 普通 普通 普通舖装 普通 普通 普通 普通 (101)/100 (100)/100交通施設との距離 最寄駅への接近性 普通 普通 普通 普通交通・接近条件 商店街との接近の程度 最寄商店街への接近性 普通 普通 普通 普通公共施設との接近の程度 幼稚園、小学校、公園、病院、官公署等 やや優る 普通 やや優る 普通 (100)/100 (100)/100日照・通風・乾湿等の良否 日照、通風、乾湿等 普通 普通 普通 普通地勢・地質・地盤等の良否 地勢、地質、地盤等 普通 普通 普通 普通周囲の状態 隣接地の利用状況 普通 普通 普通 普通環境条件 上水道 普通 普通 普通 普通供給処理施設の状態 下水道 普通 普通 普通 普通都市ガス等 普通 普通 普通 普通危険施設・処理施設等との接近の程度 危険施設、処理施設等の有無 無 無 無 無 (100)/100 (100)/100地積 普通 普通 普通 普通間口狭小 普通 普通 普通 普通地積・間口・奥行・形状等 奥行逓減 普通 普通 普通 普通奥行短小 普通 普通 普通 普通画地条件 奥行長大 普通 普通 普通 普通不整形地 普通 普通 普通 普通三角地方位・高低・角地・その他接面街路との関係 方位 北東南 北東南 西 西 0.97 0.97高低 普通 普通 普通 普通角地準角地二方路三方路 優る 優る 普通 普通 0.95 0.95袋地無道路地崖地等私道減価その他 高圧線下地 (92)/100 (92.2)/100行政的条件 公法上の規制の程度 用途地域及びその他の地域、地区等 普通 やや強い 普通 やや強い (100)/100 (100)/100その他 その他 普通 普通 普通 普通 (100)/100 (100)/100個別的要因の 原告集計 (101)/100×(100)/100×(100)/100×(92)/100×(100)/100×(100)/100＝(92.9)/100 ④比較計 被告集計 (100)/100×(100)/100×(100)/100×(92.2)/100×(100)/100×(100)/100＝(92.2)/100 ④ \n ２－１表（公示地（三鷹●●）・地域要因補正値、地域要因比準表） 混在住宅地域個別的要因 公示地（三鷹●●） 本件土地３の標準的な画地格差 計条件 項目 細項目 基準地の属する地域 対象地の属する地域原告主張 被告主張 原告主張 被告主張 原告主張 被告主張 原告主張 被告主張幅員 普通 普通 優る 優る 3.0 3.0街路条件 接面街路の系統・構造等の状態 舗装 普通 普通 普通 普通配置 普通 普通 普通 普通系統及び連続性 普通 普通 優る 優る 2.0 2.0 (105)/100 (105)/100交通・接近条件 都心との距離及び交通施設の状態 最寄駅への接近性 普通 普通 やや劣る 普通 △2.5都心への接近性 普通 普通 普通 普通商店街の配置の状態 最寄商店街への接近性 普通 普通 劣る 普通 △5.0最寄商店街の性格 普通 普通 普通 普通学校・公園・病院の配置の状態 小学校、公園、病院、官公署等 優る 普通 劣る やや劣る △6.0 △1.5 (86.5)/100 (98.5)/100環境条件 気象の条件 日照、通風、乾湿等 普通 普通 普通 普通自然的環境の良否 眺望、景観、地勢、地盤等 普通 普通 劣る 普通 △1.5居住者の移動等の状態 居住者の増減家族構成等 普通 普通 普通 普通社会的環境の良否 社会的環境の良否 優る 普通 劣る 普通 △3.0画地の標準面積 普通 普通 普通 普通各画地の面積・配置及び利用の状態 各画地の配置状態 優る 普通 普通 普通 △1.5土地の利用度 普通 普通 劣る 普通 △1.5周辺の利用の状態 普通 普通 劣る 普通 △1.5上水道 有 有 可能 有 △1.0供給処理施設の状態 下水道 有 有 有 有都市ガス等 有 有 可能 有 △1.0危険施設、処理施設等の有無 危険施設、処理施設等の有無 無 無 大きい 無 △4.0災害発生の危険性 洪水、地すべり等 無 無 無 無公害発生の程度 騒音、大気汚染等 大きい やや大きい △5.0 △2.5 (80.0)/100 (97.5)/100行政的条件 土地の利用に関する公法上の規制の程度 用途地域及び建ぺい率、容積率 やや強い やや強い 普通 普通 1.5 1.5その他の規制 普通 普通 普通 普通 (101.5)/100 (101.5)/100その他 その他 将来の動向 普通 普通 やや劣る 普通 △2.5その他 普通 普通 普通 普通 (97.5)/100 (100)/100地域要因の 原告集計 (105)/100×(86.5)/100×(80.0)/100×(101.5)/100×(97.5)/100＝(71.9)/100 ⑤比較計 被告集計 (105)/100×(98.5)/100×(97.5)/100×(101.5)/100×(100)/100＝(102.4)/100 ⑤ \n ２－２表（公示地（三鷹●●）・地域要因補正値、地域要因比準表） 混在住宅地域個別的要因 公示地（三鷹●●） 本件土地３の標準的な画地格差 計条件 項目 細項目 基準地の属する地域 対象地の属する地域原告主張 被告主張 原告主張 被告主張 原告主張 被告主張 原告主張 被告主張幅員 普通 普通 優る 優る 3.0 3.0街路条件 接面街路の系統・構造等の状態 舗装 普通 普通 普通 普通配置 普通 普通 普通 普通系統及び連続性 普通 普通 優る 優る 2.0 2.0 (105)/100 (105)/100交通・接近条件 都心との距離及び交通施設の状態 最寄駅への接近性 普通 普通 やや劣る 普通 △2.5都心への接近性 普通 普通 普通 普通商店街の配置の状態 最寄商店街への接近性 普通 普通 劣る 普通 △5.0最寄商店街の性格 普通 普通 普通 普通学校・公園・病院の配置の状態 小学校、公園、病院、官公署等 やや優る 普通 劣る やや劣る △4.5 △1.5 (88)/100 (98.5)/100環境条件 気象の条件 日照、通風、乾湿等 普通 普通 普通 普通自然的環境の良否 眺望、景観、地勢、地盤等 普通 普通 劣る 普通 △1.5居住者の移動等の状態 居住者の増減家族構成等 普通 普通 普通 普通社会的環境の良否 社会的環境の良否 優る 普通 劣る 普通 △3.0画地の標準的面積 普通 普通 普通 普通各画地の面積・配置及び利用の状態 各画地の配置状態 優る 普通 普通 普通 △1.5土地の利用度 普通 普通 劣る 普通 △1.5周辺の利用の状態 劣る 劣る 劣る 普通 1.5上水道 有 有 可能 有 △1.0供給処理施設の状態 下水道 有 有 有 有都市ガス等 有 有 可能 有 △1.0危険施設、処理施設等の有無 危険施設、処理施設等の有無 無 無 大きい 無 △4.0災害発生の危険性 洪水、地すべり等 無 無 無 無公害発生の程度 騒音、大気汚染等 大きい やや大きい △5.0 △2.5 (81.5)/100 (99)/100行政的条件 土地の利用に関する公法上の規制の程度 用途地域及びその他の地域、地区等 弱い やや弱い 普通 普通 △3.0 △1.5その他の規制 普通 普通 普通 普通 (97)/100 (98.5)/100その他 その他 将来の動向 普通 普通 やや劣る 普通 △2.5その他 普通 普通 普通 普通 (97.5)/100 (100)/100地域要因の 原告集計 (105)/100×(88)/100×(81.5)/100×(97)/100×(97.5)/100＝(71.2)/100 ⑤比較計 被告集計 (105)/100×(98.5)/100×(99)/100×(98.5)/100×(100)/100＝(100.9)/100 ⑤ \n ２－３表（公示地（三鷹●●）・地域要因補正値、地域要因比準表） 混在住宅地域個別的要因 公示地（三鷹●●） 本件土地３の標準的な画地格差 計条件 項目 細項目 基準地の属する地域 対象地の属する地域原告主張 被告主張 原告主張 被告主張 原告主張 被告主張 原告主張 被告主張幅員 優る 優る 優る 優る街路条件 接面街路の系統・構造等の状態 舗装 普通 普通 普通 普通配置 普通 普通 普通 普通系統及び連続性 優る 優る 優る 優る (100)/100 (100)/100交通・接近条件 都心との距離及び交通施設の状態 最寄駅への接近性 やや優る やや優る やや劣る 普通 △5.0 △2.5都心への接近性 普通 普通 普通 普通商店街の配置の状態 最寄商店街への接近性 優る 普通 劣る 普通 △10.0最寄商店街の性格 優る 優る 劣る 劣る △7.0 △7.0学校・公園・病院の配置の状態 小学校、公園、病院、官公署等 やや優る 普通 劣る やや劣る △4.5 △1.5 (73.5)/100 (89.0)/100環境条件 気象の条件 日照、通風、乾湿等 普通 普通 普通 普通自然的環境の良否 眺望、景観、地勢、地盤等 普通 普通 劣る 普通 △1.5居住者の移動等の状態 居住者の増減家族構成等 普通 普通 普通 普通社会的環境の良否 社会的環境の良否 優る 普通 劣る 普通 △3.0画地の標準面積 劣る 普通 普通 普通 1.5各画地の面積・配置及び利用の状態 各画地の配置状態 優る 普通 普通 普通 △1.5土地の利用度 優る 優る 劣る 普通 △1.5 △1.5周辺の利用の状態 普通 普通 劣る 普通 △1.5上水道 有 有 可能 有 △1.0供給処理施設の状態 下水道 有 有 有 有都市ガス等 有 有 可能 有 △1.0危険施設、処理施設等の有無 危険施設、処理施設等の有無 無 無 大きい 無 △4.0災害発生の危険性 洪水、地すべり等 無 無 無 無公害発生の程度 騒音、大気汚染等 大きい やや大きい △5.0 △2.5 (81.5)/100 (96)/100行政的条件 土地の利用に関する公法上の規制の程度 用途地域及びその他の地域、地区等 弱い やや弱い 普通 普通 △3.0 △1.5その他の規制 普通 普通 普通 普通 (97)/100 (98.5)/100その他 その他 将来の動向 普通 普通 やや劣る 普通 △2.5その他 普通 普通 普通 普通 (97.5)/100 (100)/100地域要因の 原告集計 (100)/100×(73.5)/100×(81.5)/100×(97)/100×(97.5)/100＝(56.7)/100 ⑤比較計 被告集計 (100)/100×(89.0)/100×(96.0)/100×(98.5)/100×(100)/100＝(84.2)/100 ⑤ \n ２－４表（本件土地Ｇ・地域要因補正値、地域要因比準表） 混在住宅地域個別的要因 本件土地Ｇ 本件土地３の標準的な画地格差 計条件 項目 細項目 基準地の属する地域 対象地の属する地域原告主張 被告主張 原告主張 被告主張 原告主張 被告主張 原告主張 被告主張幅員 普通 劣る 優る 優る 6.0 6.0街路条件 接面街路の系統・構造等の状態 舗装 普通 普通 普通 普通配置 普通 普通 普通 普通系統及び連続性 劣る 劣る 優る 優る 4.0 4.0 (110)/100 (110)/100交通・接近条件 都心との距離及び交通施設の状態 最寄駅への接近性 普通 普通 やや劣る 普通 △2.5都心への接近性 普通 普通 普通 普通商店街の配置の状態 最寄商店街への接近性 普通 普通 劣る 普通 △5.0最寄商店街の性格 普通 普通 普通 普通学校・公園・病院の配置の状態 小学校、公園、病院、官公署等 優る 普通 劣る やや劣る △6.0 △1.5 (86.5)/100 (98.5)/100環境条件 気象の条件 日照、通風、乾湿等 普通 普通 普通 普通自然的環境の良否 眺望、景観、地勢、地盤等 普通 普通 劣る 普通 △1.5居住者の移動等の状態 居住者の増減家族構成等 普通 普通 普通 普通社会的環境の良否 社会的環境の良否 優る 普通 劣る 普通 △3.0画地の標準的面積 普通 普通 普通 普通各画地の面積・配置及び利用の状態 各画地の配置状態 優る 普通 普通 普通 △1.5土地の利用度 優る 普通 劣る 普通 △1.5周辺の利用の状態 普通 普通 劣る 普通 △1.5上水道 有 有 可能 有 △1.0供給処理施設の状態 下水道 有 有 有 有都市ガス等 有 有 可能 有 △1.0危険施設、処理施設等の有無 危険施設、処理施設等の有無 無 無 大きい 無 △4.0災害発生の危険性 洪水、地すべり等 無 無 無 無公害発生の程度 騒音、大気汚染等 大きい やや大きい △5.0 △2.5 (80.0)/100 (97.5)/100行政的条件 土地の利用に関する公法上の規制の程度 用途地域及びその他の地域、地区等 やや強い やや強い 普通 普通 1.5 1.5その他の規制 普通 普通 普通 普通 (101.5)/100 (101.5)/100その他 その他 将来の動向 普通 普通 やや劣る 普通 △2.5その他 普通 普通 普通 普通 (97.5)/100 (100)/100地域要因の 原告集計 (110)/100×(86.5)/100×(80.0)/100×(101.5)/100×(97.5)/100＝(75.3)/100 ⑤比較計 被告集計 (110)/100×(98.5)/100×(97.5)/100×(101.5)/100×(100)/100＝(107.2)/100 ⑤ \n ３表（本件土地３・個別的要因補正値、個別的要因比準表） 混在住宅地域個別的要因 本件土地３の標準的画地 本件土地３格差 計条件 項目 細項目 基準地 対象地原告主張 被告主張 原告主張 被告主張 原告主張 被告主張 原告主張 被告主張系統及び連続性 普通 普通 やや優る 普通 1.00街路条件 接面街路の系統・構造等の状態 幅員 普通 普通 やや優る 普通 1.00舖装 普通 普通 普通 普通 (102)/100 (100)/100交通施設との距離 最寄駅への接近性 普通 普通 やや劣る 普通 △2.0交通・接近条件 商店街との接近の程度 最寄商店街への接近性 普通 普通 やや劣る 普通 △2.5公共施設との接近の程度 幼稚園、小学校、公園、病院、官公署等 やや優る 普通 劣る 普通 △4.5 (91)/100 (100)/100日照・通風・乾湿等の良否 日照、通風、乾湿等 普通 普通 普通 普通地勢・地質・地盤等の良否 地勢、地質、地盤等 普通 普通 普通 普通周囲の状態 隣接地の利用状況 普通 普通 相当に劣る 普通 △4.5環境条件 上水道 普通 普通 劣る 普通 △1.0供給処理施設の状態 下水道 普通 普通 普通 普通都市ガス等 普通 普通 劣る 普通 △1.0危険施設・処理施設等との接近の程度 危険施設、処理施設等の有無 無 無 大きい 無 △7.5 (86)/100 (100)/100地積 普通 普通 普通 普通間口狭小 普通 普通 普通 普通地積・間口・奥行・形状等 奥行逓減 普通 普通 普通 普通奥行短小 普通 普通 普通 普通画地条件 奥行長大 普通 普通 普通 普通不整形地 普通 普通 やや劣る 普通 0.95三角地方位・高低・角地・その他接面街路との関係 方位 西 西 西 西高低 普通 普通 やや劣る 普通 0.95角地準角地二方路三方路袋地無道路地崖地等私道減価その他 高圧線下地 (90.3)/100 (105.1)/100行政的条件 公法上の規制の程度 用途地域及びその他の地域、地区等 やや強い 普通 普通 普通 1.50 (101.5)/100 (100)/100その他 その他 普通 普通 やや劣る 普通 △2.5 (97.5)/100 (100)/100個別的要因の 原告集計 (102)/100×(91)/100×(86.0)/100×(90.3)/100×(101.5)/100×(97.5)/100＝(71.3)/100 ⑧比較計 被告集計 (100)/100×(100)/100×(100)/100×(100)/100×(100)/100×(100)/100＝(100)/100 ⑧別表７－１－１－１ \n ＜取引事例の比準＞符 ① ② ③ ④ ⑤取引事例の概要号 取引価格 事情補正 時点修正 建付減価補正 標準化補正 地域格差所在地 地目 地積 取引時点 100 108.4 100 100 100 \n 193,598円/㎡ × × × × × ≒ 251,000円/㎡調布市 宅地 779.34㎡ H15.3.31 100 100 100 107 78 \n (概況) 備考 下記参照 別表参照 接近 -13 \n ａ Ｕ線「Ｊ」駅の北方約3700ｍに所在。 第1種低層住居専用地域 街路 -1南西側を幅員約４ｍの市道及び側道に面する略長方形の角画地。 (40，80%) 行政農地の目立つ低層住宅地域。 基準容積率80% 環境 -10格差率 8.4 7 相乗積 -22所在地 地目 地積 取引時点 100 110.5 100 100 100 \n 266,208円/㎡ × × × × × ≒ 265,000円/㎡調布市 宅地 356.00㎡ H15.7.17 100 100 100 102 109 \n (概況) 備考 下記参照 別表参照 接近 \n ｂ Ｕ線「Ｊ」駅の北方約2500ｍに所在。 第1種低層住居専用地域 街路 -1南側を幅員約４ｍの市道に面する長方形の中間画地。 (40，80%) 行政一般住宅地 基準容積率80% 環境 10格差率 10.5 2 相乗積 9所在地 地目 地積 取引時点 100 101.8 100 100 100 \n 224,138円/㎡ × × × × × ≒ 255,000円/㎡調布市 宅地 232.00㎡ H14.5.10 100 100 100 104 86 \n (概況) 備考 下記参照 別表参照 接近 8 \n ｃ Ｕ線「Ｍ」駅の北方約1700ｍに所在。 第1種低層住居専用地域 街路 -1南東側を幅員約４ｍの市道及び側道に面する不整形な角画地。 (40，80%) 行政農地、未利用地も混在する低層住宅地域。 基準容積率80% 環境 -20格差率 1.8 4 相乗積 -14所在地 地目 地積 取引時点 100 98.6 100 100 100 \n 166,368円/㎡ × × × × × ≒ 272,000円/㎡三鷹市 宅地 583.56㎡ H13.10.26 80 100 100 74 102 \n (概況) 備考 売り急ぎ 下記参照 別表参照 接近 14 \n ｄ Ｕ線「Ｋ」駅の北方約1200ｍに所在。 第1種低層住居専用地域 街路 -1北側を幅員約４ｍの市道に面する不整形な中間画地。 (40，80%) 行政小規模一般住宅のほか農地等も残る住宅地城。 基準容積率80% 環境 -10格差率 -20 -1.4 -26 相乗積 2 \n （取引時点は、登記原因日） \n 公示地の概要価格公示番号 所在地 地積 価格時点 \n 316,000円/㎡調布-●● 調布市 254.00㎡ H13.1.1 \n (概況) 備考 \n Ｕ線「Ｋ」駅の北西方約2000ｍに所在。 第1種低層住居専用地域東側を幅員約６ｍの舗装市道に面する長方形の中間画地。 (40，80%)中規模一般住宅が整然と立ち並ぶ住宅地域。 基準容積率80% \n ※時点修正率の査定時点修正率は取引事例等の規模及び価格水準を考慮して、周辺公示地等の価格変動率等を基に以下の通り期間配分して求めた。 \n 価格時点以降の取引事例に対する時点修正は、平１４年と１５年の公示価格変動率に大きな差がないことから、平成１４年の変動率を採用した。 \n 期間 H12.1.1～H13.1.1 H13.1.1～H14.1.1 H14.1.1～価格時点 \n ａ (1-0.006×-14/1)≒1.084変動率 -3.4% -4.7% -0.6%期間 H12.1.1～H13.1.1 H13.1.1～H14.1.1 H14.1.1～価格時点 \n ｂ (1-0.006×-17.5/1)≒1.105変動率 -3.4% -4.7% -0.6%期間 H12.1.1～H13.1.1 H13.1.1～H14.1.1 H14.1.1～価格時点 \n ｃ (1-0.006×-3/1)≒1.018変動率 -3.4% -4.7% -0.6%期間 H12.1.1～H13.1.1 H13.1.1～H14.1.1 H14.1.1～価格時点 \n ｄ (1-0.047×2/12)×(1-0.006×1/1)≒0.986変動率 -3.4% -4.7% -0.6%期間 H12.1.1～H13.1.1 H13.1.1～H14.1.1 H14.1.1～価格時点規準地 (1-0.047×12/12)×(1-0.006×1/1)≒0.947変動率 -3.4% -4.7% -0.6%別表７－１－１－２ \n ＜対象不動産・取引事例等要因比較表＞標準化補正 ａ ｂ ｃ ｄ \n (対象地は個別格差) 標準化補正 標準化補正 標準化補正 標準化捕正最寄り駅への接近性最寄りバス停への接近性接 \n 近 最寄り駅の性格条 商業施設への接近性件 \n 公共施設への接近性小計 1.00 1.00 1.00 1.00道路の幅員街 道路の系統・連続性路 \n 条 道路の舗装の状態件 道路の歩道の状態小計 1.00 1.00 1.00 1.00規模間口・奥行の関係形状 -3 -3方位 2 2 2 -2高低差画 角画地 5 5地 \n 条 二方路画地件 三方路画地四方路画地セットバック私道負担 -22その他小計 1.07 1.02 1.04 0.74容積率 行政 用途地域的 その他の地域・地区等条 \n 件 建蔽率小計 1.00 1.00 1.00 1.00日照・通風等隣接不動産等周囲の状況居住環境用途の多様性環 \n 境 繁華性の程度条 \n 供給処理施設の状態件 \n 危険・嫌悪施設への接近性背後地の状態商業施設の配置 \n ａ ｂ ｃ ｄ地域格差地域格差 地域格差 地域格差 地域格差最寄り駅への接近性 -18 -3 8 14交 最寄りバス停への接近性通 \n ・ 最寄り駅の性格 5接 商業施設への接近性近 \n 条 公共施設への接近性件 都心との距離小計 1.00 1.00 1.00 1.00漂準化補正格差（個別格差）合計 1.07 1.02 1.04 0.74小計 0.87 1.00 1.08 1.14道路の幅員 -1 -1 -1 -1道路の系統・連続性街 道路の舗装の状態路 \n 条 道路の歩道の状態件 街路の整然性街路の方位小計 0.99 0.99 0.99 0.99容積率行 \n 政 用途地域的 その他の地域・地区等条 \n 件 建蔽率小計 1.00 1.00 1.00 1.00日照・通風等隣接不動産等周囲の状況 -10 10 -20 -10居住環境用途の多様性環 繁華性の程度境 \n 条 供給処理施設の状態件 危険・嫌悪施設への接近性背後地の状態商業施設の配置画地の規模小計 0.90 1.10 0.80 0.90地域格差合計 0.78 1.09 0.86 1.02各条件項目内は総和で計算し（画地条件を除く）、小計同士を相乗で計算。 \n 画地条件は項目内も相乗で計算。 \n 別表７－１－２ \n ＜土地残余法による収益価格＞ \n （想定建物の概要） ２．総費用算出内訳項目 実額・査定額 算出根拠対象不動産 敷地面積 464.54㎡ （有効面積 464.54㎡） (1)修繕費 310,000円 10,320,916円 × 3.0% \n (2)維持管理費 276,000円 9,192,000円 × 3.0%想定建物 構造・用途 木造地上２階建共同住宅 土地 291,000円 推定 \n (3)公租公課容積対象床面積 371.63㎡ （有効面積 371.63㎡） 建物 293,000円 57,417,000円 × 0.5 × 1.70% 0.6 \n (4)損害保険料 57,000円 57,417,000円 × 0.10% \n (5)貸倒れ準備費 0円 保証金等により充分担保されているので計上しない。 \n （想定賃貸条件） \n (6)空室損失等相当額 516,000円 10,320,916円 × 5.0%階層 容積対象 有効率 有効面積 ㎡当たり月 月額支払 敷金 敷金 礼金 礼金 \n (7)建物等取壊費用積立金 0円 57,417,000円 × 0.00%床面積 額支払賃料 賃料 \n (8)その他費用 0円 \n (㎡) (%) (㎡) (円) (円) (月数) (円) (月数) (円) (9)総費用(1)～(8) 1,743,000円 (経費率 16.9%) \n ３．基本利率等 \n r:基本利率 7.0% g：賃料の変動率 0.0% \n a:躯体割合(躯体価格÷建物等価格) 80% na：躯体の経済的耐用年数 30年 \n b:設備割合(設備価格÷建物等価格) 20% nb：設備の経済的耐用年数 15年 \n m：未収入期間 1年 \n ４．建物等に帰属する純収益項目 査定額 算出根拠 \n 2 185.82 1 185.82 1,900 353,000 2 706,000 1 353,000 (1)建物等の初期投資額 57,417,000円 150,000円/㎡×371.63㎡×設計監理料(100+3%) \n 1 185.82 1 185.82 1,900 353,000 2 706,000 1 353,000 躯体部分 設備部分 \n (2)年賦償還率 \n 0.08644 0.0806 × 80% ＋ 0.1098 × 20% \n (3)建物等に帰属する純収益 4,963,000円 \n (1)×(2) 10,684/㎡小計 371.63 1 371.63 706,000 1,412,000 706,000 \n ５．土地に帰属する純収益駐車場 5 12,000 60,000 1 60,000 0 0 \n (1)総収益 10,320,916円 \n (2)総費用 1,743,000円 \n 0 0 0 0 0 \n (3)純収益(1)－(2) 8,577,916円 \n (4)建物等に帰属する純収益 4,963,000円合計 766,000 1,472,000 706,000 \n (5)土地に帰属する純収益(3)－(4) 3,614,916円 \n (6)未収入期間を考慮した土地に帰属する純収益 3,345,243円 \n １．総収益算出内訳 \n (5)×（未收入期間を考慮した補正率） 0.9324 （7,201円/㎡） \n (1)年額支払賃料 766,000円 × 12ヶ月 ≒ 9,192,000円 \n (2)敷金の運用益 1,472,000円 × 2.0% ≒ 29,000円 ６．土地の収益価格 \n (3)礼金の運用益及び償却額 償却年数 10年 運用利回り2.0% 土地帰属純収益 還元利回り(r-g)土地の収益価格 \n 706,000円 × 0.1113 ≒ 79,000円 7,201 円 ÷ 7.0% ≒ 103,000円/㎡ \n (4)その他収入（東電使用料） 4,076 250.47 1,020,916円 \n (5)総収益 \n (1)＋(2)＋(3)＋(4) 10,320,916円 （ 22,217円／㎡） \n 別表７－１－３－１ \n ＜取引事例の比準及び公示価格の規準＞標準画地価格符 ① ② ③ ④ ⑤取引事例の概要号 取引価格 事情補正 時点修正 建付減価補正 標準化補正 地域格差所在地 地目 地積 取引時点 100 105.4 100 100 100 \n 270,444円/㎡ × × × × × ≒ 277,000円/㎡調布市 宅地 155.30㎡ H14.11.6 100 100 100 92 112 \n (概況) 備考 下記参照 別表参照 接近 7 \n ｅ Ｕ線「Ｋ」駅の北西方約1900ｍに所在。 第1種低層住居專用地域 街路北側を幅員約5.5ｍの私道に面する略正方形の中間画地。 (40，80%) 行政戸建て住宅・共同住宅が建ち並ぶ畑も見られる地域。 基準容積率80% 環境 5格差率 5.4 -8 相乗積 12所在地 地目 地積 取引時点 100 101.2 100 100 100 \n 348,556円/㎡ × × × × × ≒ 314,000円/㎡調布市 宅地 169.27㎡ H14.3.27 100 100 100 105 107 \n (概況) 備考 下記参照 別表参照 接近 2 \n ｆ Ｕ線「Ｋ」駅の北西方約2200ｍに所在。 第1種低層住居專用地域 街路南東側を幅員約５ｍの市道及び側道に面する台形の角画地。 (40，80%) 行政一般住宅、共同住宅等が混在する地域。 基準容積率80% 環境 5格差率 1.2 5 相乗積 7所在地 地目 地積 取引時点 100 97.1 100 100 100 \n 345,324円/㎡ × × × × × ≒ 297,000円/㎡調布市 宅地 48.65㎡ Ｈ13.7.10 120 100 100 94 100 \n (概況) 備考 高目取引 下記参照 別表参照 接近 -4 \n ｇ Ｕ線「Ｋ」駅の北西方約2600ｍに所在。 第1種低層住居專用地域 街路 -1北側を幅員約４ｍの私道に面する長方形の中間面地。 (40，80%) 行政戸建て中心の低層住宅地域。 基準容積率80% 環境 5格差率 20 -2.9 -6 相乗積所在地 地目 地積 取引時点 100 108.4 100 100 100 \n 188,837円/㎡ × × × × × ≒ 290,000円/㎡調布市 宅地 107.50㎡ H15.3.31 80 100 100 94 94 \n (概況) 備考 売り急ぎ 下記参照 別表参照 接近 -5 \n ｈ Ｕ線「Ｋ」駅の北西方約2600ｍに所在。 第1種低層住居專用地域 街路 -1北西側を幅員約４ｍの私道に面する長方形の中間面地。 (40，80%) 行政小規模住宅の多い低層住宅地域。 基準容積率80% 環境格差率 -20 8.4 -6 相乗積 -6 \n （取引時点は、登記原因日） \n ① ② ③ ④ ⑤公示地の概要取引価格 事情補正 時点修正 建付減価補正 標準化補正 地域格差公示番号 所在地 地積 価格時点 99.4 100 100 \n 301,000円/㎡ × ＊＊＊ × × ＊＊＊ × × ≒ 262,000円/㎡調布-●● 調布市 254.00㎡ H14.1.1 100 100 114 \n (概況) 備考 接近 4 \n Ｕ線「Ｋ」駅の北西方約2000ｍに所在。 第1種低層住居專用地域 街路東側を幅員約６ｍの舗装市道に面する長方形の中間面地。 (40，80%) 行政中規模一般住宅が整然と立ち並ぶ住宅地域。 基準容積率80% 環境 10格差率 -0.6 相乗積 14 \n ※時点修正率の査定時点修正率は取引事例等の規模及び価格水準を考慮して、周辺公示地等の価格変動率等を基に以下の通り期間配分して求めた。 \n 価格時点以降の取引事例に対する時点修正は、平成１４年と１５年の公示価格変動率に大きな差がないことから、平成１４年の変動率を採用した。 \n 期間 H12.1.1～H13.1.1 H13.1.1～H14.1.1 H14.1.1～価格時点 \n e (1-0.006×-9/1)≒1.054変動率 -3.4% -4.7% -0.6%期間 H12.1.1～H13.1.1 H13.1.1～H14.1.1 H14.1.1～価格時点 \n f (1-0.006×-2/1)≒1.012変動率 -3.4% -4.7% -0.6%期間 H12.1.1～H13.1.1 H13.1.1～H14.1.1 H14.1.1～価格時点 \n g (1-0.047×6/12)×(1-0.006×1/1)≒0.971変動率 -3.4% -4.7% -0.6%期間 H12.1.1～H13.1.1 H13.1.1～H14.1.1 H14.1.1～価格時点 \n h (1-0.006×-14/1)≒1.084変動率 -3.4% -4.7% -0.6%期間 H12.1.1～H13.1.1 H13.1.1～H14.1.1 H14.1.1～価格時点規準地 (1-0.006×1/1)≒0.994変動率 -3.4% -4.7% -0.6%別表７－１－３－２ \n ＜対象不動産・取引事例等要因比較表＞標準化補正 ｅ ｆ ｇ ｈ 公示地 \n (対象地は個別格差) 標準化補正 標準化補正 標準化補正 標準化補正 標準化補正最寄り駅への接近性最寄りバス停への接近性接 \n 近 最寄り駅の性格条 商業施設への接近性件 \n 公共施設への接近性小計 1.00 1.00 1.00 1.00 1.00道路の幅員街 道路の系統・連続性 -3路 \n 条 道路の舗装の状態件 道路の歩道の状態小計 1.00 1.00 0.97 1.00 1.00規模間口・奥行の関係形状方位 -3 2 -3 -3高低差画 角画地 3地 \n 条 二方路画地件 三方路画地四方路画地セットバック私道負担その他 -5 -3小計 0.92 1.05 0.97 0.94 1.00容積率 行政 用途地域的 その他の地域・地区等条 \n 件 建蔽率小計 1.00 1.00 1.00 1.00 1.00日照・通風等隣接不動産等周囲の状況居住環境用途の多様性環 \n 境 繁華性の程度条 \n 供給処理施設の状態件 \n 危険・嫌悪施設への接近性背後地の状態商業施設の配置 \n ｅ ｆ ｇ ｈ 公示地地域格差地域格差 地域格差 地域格差 地域格差 地域格差最寄り駅への接近性 5 1 -4 -5 4交 最寄りバス停への接近性 2 1通 \n ・ 最寄り駅の性格接 商業施設への接近性近 \n 条 公共施設への接近性件 都心との距離小計 1.00 1.00 1.00 1.00 1.00標準化補正格差（個別格差）合計 0.92 1.05 0.94 0.94 1.00小計 1.07 1.02 0.96 0.95 1.04道路の幅員 -1 -1道路の系統・連続性街 道路の舗装の状態路 \n 条 道路の歩道の状態件 街路の整然性街路の方位小計 1.00 1.00 0.99 0.99 1.00容積率行 \n 政 用途地域的 その他の地域・地区等条 \n 件 建蔽率小計 1.00 1.00 1.00 1.00 1.00日照・通風等隣接不動産等周囲の状況居住環境 5 5 5 10用途の多様性環 繁華性の程度境 \n 条 供給処理施設の状態件 危険・嫌悪施設への接近性背後地の状態商業施設の配置画地の規模小計 1.05 1.05 1.05 1.00 1.10地域格差合計 1.12 1.07 1.00 0.94 1.14各条件項目内は総和で計算し（画地条件を除く）、小計同士を相乗で計算。 \n 画地条件は項目内も相乗で計算。 \n 別表７－１－４分譲販売収入一体評価 464.54㎡ \n ①標準的画地の価格 ②個別格差 ③各画地の単価 ④面積 ⑤分譲価格画地番 \n ㎡＠ 円 方立 街路 位置 形状 間口 高圧線下 格差率 ③＝①×② ㎡ ⑤＝③×④ \n ① 295,000 0 0 -2 -15 83/100 246,000 116.14 28,600,000 \n ② 295,000 0 0 -5 -15 81/100 238,000 116.14 27,600,000 \n ③ 295,000 2 0 -2 -15 85/100 251,000 116.14 29,100,000 \n ④ 295,000 2 2 -2 -15 87/100 256,000 116.14 29,700,000合計 464.54 115,000,000 \n ㎡＠ 248,000個別評価（●●番●●） 343.54㎡ \n ①標準的画地の価格 ②個別格差 ③各画地の単価 ④面積 ⑤分譲価格画地番 \n ㎡＠ 円 方立 街路 位置 形状 間口 高圧線下 格差率 ③＝①×② ㎡ ⑤＝③×④ \n ⑤ 295,000 0 0 -2 -5 -15 79/100 233,000 103.15 24,000,000 \n ⑥ 295,000 0 0 -20 -15 68/100 201,000 137.25 27,600,000 \n ⑦ 295,000 2 0 -2 -15 85/100 251,000 103.15 25,900,000合計 343.54 77,500,000 \n ㎡＠ 226,000個別評価（●●番●●） 121㎡ \n ①標準的画地の価格 ②個別格差 ③各画地の単価 ④面積 ⑤分譲価格画地番 \n ㎡＠ 円 方立 街路 位置 形状 間口 高圧線下 格差率 ③＝①×② ㎡ ⑤＝③×④ \n ⑧ 295,000 0 2 -10 -15 78/100 230,000 121.00 27,800,000 \n ㎡＠ 230,000別表７－１－５ \n ＜宅地開発分譲を前提とした価格＞ \n １．想定区画割等の概要 ２．開発費用等 ３．開発収入開発面積 464.54㎡ (1) 求めるべき土地価格 Ｘ円 販売総額 115,000,000円 〔 248,000円/㎡〕提供敷地等面積 ㎡ (2) 造成工事費 1,400,000円有効敷地面積 464.54㎡ （開発面積当 3,000円／㎡） ４．開発法による価格 \n (3) 販売費・一般管理費 （開発収入の 12％） \n 計画区画数 ４区画 （但し、利益込） 14,000,000円 収入の複利現価額(下表⑭) 支出の複利現価額(⑫＋⑬)平均区画面積 116.14㎡ (4) 公共公益施設負担金等 0円 104,738,000円 ＝ 14,439,000円 ＋ 0.95851 Ｘ円負担金 円建物延床面積合計 ㎡ 近隣対策費 0円 ∴ Ｘ ＝ 94,000,000円平均建物延床面積 0.00㎡ (5) その他 円 〔202,000円/㎡〕 \n ○開発スケジュール及び支出・収入複利現価額算出表 \n ＜開発スケジュール等＞ ＜支出＞ ＜収入＞期間 開発スケジュール 複利現価率 支出時期・支出割合 支出 支出の 土地代 土地代 収入時期 収入 収入の \n 12% 造成費 販売費 負担金 その他 ⑥=(2)×②+(3)×③ 複利現価額 Ｘ 複利現価額 収入割合 複利現価額月 支出項目 収入項目 ① ② ③ ④ ⑤ +(4)×④+(5)×⑤ ⑦＝⑥×① ⑧ ⑨＝⑧×① ⑩ ⑪＝⑩×① \n 0 土地売買契約及び手付金 1.0000 0 0 0.1X 0.10000X 0 0 \n 1 0.9906 0 0 0.00000X 0 0 \n 2 0.9813 0 0 0.00000X 0 0 \n 3 土地代金決済 0.9721 0 0 0.00000X 0 0 \n 4 １期造成 0.9629 0 0 0.00000X 0 0 \n 5 １期造成終了・１期着工 0.9539 1 1,400,000 1,335,000 0.9X 0.85851X 0 0 \n 6 １期販売開始 0.9449 1/2 7,000,000 6,614,000 0.00000X 0 0 \n 7 0.9360 0 0 0.00000X 0 0 \n 8 １期峻工 0.9272 1/2 7,000,000 6,490,000 0.00000X 1/20 5,750,000 5,331,000 \n 9 １期販売完了 0.9185 0 0 0.00000X 0 0 \n 10 0.9099 0 0 0.00000X 19/20 109,260,000 99,407,000 \n 11 0.9013 0 0 0.00000X 0 0 \n 12 0.8929 0 0 0.00000X 0 0 \n 13 0.8845 0 0 0.00000X 0 0 \n 14 0.8762 0 0 0.00000X 0 0 \n 15 0.8679 0 0 0.00000X 0 0 \n 16 0.8598 0 0 0.00000X 0 0 \n 17 0.8517 0 0 0.00000X 0 0 \n 18 0.8437 0 0 0.00000X 0 0 \n 19 0.8357 0 0 0.00000X 0 0 \n 20 0.8279 0 0 0.00000X 0 0 \n 21 0.8201 0 0 0.00000X 0 0 \n 22 0.8124 0 0 0.00000X 0 0 \n 23 0.8048 0 0 0.00000X 0 0 \n 24 0.7972 0 0 0.00000X 0 0 \n 25 0.7897 0 0 0.00000X 0 0 \n 26 0.7823 0 0 0.00000X 0 0 \n 27 0.7749 0 0 0.00000X 0 0 \n 28 0.7676 0 0 0.00000X 0 0 \n 29 0.7604 0 0 0.00000X 0 0 \n 30 0.7533 0 0 0.00000X 0 0 \n ⑫ ⑬ ⑭合計 1 1 0 0 15,400,000 14,439,000 1.0X 0．95851X 1 115,000,000 104,738,000別表７－２－１－１ \n ＜取引事例の比準＞符 ① ② ③ ④ ⑤取引事例の概要号 取引価格 事情補正 時点修正 建付減価補正 標準化補正 地域格差所在地 地目 地積 取引時点 100 104 100 100 100 \n 300,215円/㎡ × × × × × ≒ 306,000円/㎡三鷹市 宅地 1,184.15㎡ H14.10.4 100 100 100 98 104 \n (概況) 備考 下記参照 別表参照 接近 3 \n ｉ Ｕ線「Ｎ」駅の北西方約2200ｍに所在。 第1種中高層住居専用地域 街路 1北東側を幅員約9.6ｍの都道及び側道に面する台形の角画地。 (60，200%) 行政店舗、事務所、一般住宅等が混在する地域。 基準容積率200% 環境準防火地域 格差率 4 -2 相乗積 4所在地 地目 地積 取引時点 100 96.9 100 100 100 \n 372,069円/㎡ × × × × × ≒ 361,000円/㎡調布市 宅地 610.72㎡ H13.5.24 100 100 100 104 96 \n (概況) 備考 下記参照 別表参照 接近 1 \n ｊ Ｕ線「Ｋ」駅の北西方約2300ｍに所在。 第1種低層住居專用地域 街路 -5南東側を幅員約５ｍの市道及び側道に面する台形の角画地。 (40，80%) 行政一般住宅、共同住宅等が混在する地域。 基準容積率80% 環境格差率 -3.1 4 相乗積 -4所在地 地目 地積 取引時点 100 106.5 100 100 100 \n 219,869円/㎡ × × × × × ≒ 308,000円/㎡三鷹市 宅地 495.84㎡ H15.3.10 80 100 100 99 96 \n (概況) 備考 売り急ぎ 下記参照 別表参照 接近 3 \n ｋ Ｖ線「Ｌ」駅の南方約2300ｍに所在。 第1種中高層住居専用地域 街路 -5東側を幅員約４ｍの市道及び側道等に面する長方形の三方路画地。 (60，200%) 行政 -2一般住宅、低層マンション等が混在する地域。 基準容積率200% 環境準防火地域 格差率 -20 6.6 -1 相乗積 -4所在地 地目 地積 取引時点 100 103 100 100 100 \n 305,040円/㎡ × × × × × ≒ 270,000円/㎡三鷹市 宅地 526.16㎡ H14.7.29 100 100 100 103 113 \n (概況) 備考 下記参照 別表参照 接近 13 \n ｌ Ｎ線「Ｏ」駅の南西方約1350ｍに所在。 第2種中高層住居専用地域 街路南西側を幅員約7.4ｍの都道及び側道に面する台形の角画地。 (60，200%) 行政低層店舗、共同住宅等の混在する地域。 基準容積率200% 環境準防火地域 格差率 3 3 相乗積 13 \n （取引時点は、登記原因日） \n 公示地の概要価格公示番号 所在地 地積 価格時点 \n 321,000円/㎡調布-●● 調布市 186.00㎡ H14.1.1 \n (概況) 備考 \n Ｕ線「Ｊ」駅の北東方約3300ｍに所在。 第2種中高層住居専用地域南東側を幅員約12ｍの舗装市道に面する長方形の中間画地。 (60，200%)店舗併用住宅、低層マンション等の混在住宅地域。 基準容積率200% \n ※時点修正率の査定時点修正率は取引事例等の規模及び価格水準を考慮して、周辺公示地等の価格変動率等を基に以下の通り期間配分して求めた。 \n 価格時点以降の取引事例に対する時点修正は、公示価格変動率１５年の公示価格変動率に大きな差がないことから、平成１４年の変動率を採用した。 \n 期間 H12.1.1～H13.1.1 H13.1.1～H14.1.1 H14.1.1～価格時点 \n ｉ (1-0.005×-8/1)≒1.04変動率 -2.6% -4.5% -0.5%期間 H12.1.1～H13.1.1 H13.1.1～H14.1.1 H14.1.1～価格時点 \n ｊ (1-0.045×7/12)×(1-0.005×1/1)≒0.969変動率 -2.6% -4.5% -0.5%期間 H12.1.1～H13.1.1 H13.1.1～H14.1.1 H14.1.1～価格時点 \n ｋ (1-0.005×-13/1)≒1.065変動率 -2.6% -4.5% -0.5%期間 H12.1.1～H13.1.1 H13.1.1～H14.1.1 H14.1.1～価格時点 \n ｌ (1-0.005×-6/1)≒1.03変動率 -2.6% -4.5% -0.5%期間 H12.1.1～H13.1.1 H13.1.1～H14.1.1 H14.1.1～価格時点規準地 (1-0.005×-1/1)≒0.995変動率 -2.6% -4.5% -0.5%別表７－２－１－２ \n ＜対象不動産・取引事例等要因比較表＞標準化補正 ｉ ｊ ｋ ｌ \n (対象地は個別格差) 標準化補正 標準化補正 標準化補正 標準化補正最寄り駅への接近性最寄りバス停への接近性接 \n 近 最寄り駅の性格条 商業施設への接近性件 \n 公共施設への接近性小計 1.00 1.00 1.00 1.00道路の幅員街 道路の系統・連続性 -2 -2路 \n 条 道路の舗装の状態件 道路の歩道の状熊小計 1.00 1.00 0.98 0.98規模間口・奥行の関係形状 -2方位 -5 -2 -2高低差画 角画地 5 3 5地 \n 条 二方路画地件 三方路画地 6四方路画地セットバック私道負担その他小計 0.98 1.04 1.01 1.05容積率 行政 用途地域的 その他の地域・地区等条 \n 件 建蔽率小計 1.00 1.00 1.00 1.00日照・通風等隣接不動産等周囲の状況居住環境用途の多様性環 \n 境 繁華性の程度条 \n 供給処理施設の状態件 \n 危険・嫌悪施設への接近性背後地の状態商業施設の配置 \n ｉ ｊ ｋ ｌ地域格差地域格差 地域格差 地域格差 地域格差最寄り駅への接近性 3 1 3 13交 最寄りバス停への接近性通 \n ・ 最寄り駅の性格接 商業施設への接近性近 \n 条 公共施設への接近性件 都心との距離小計 1.00 1.00 1.00 1.00標準化補正格差（個別格差）合計 0.98 1.04 0.99 1.03小計 1.03 1.01 1.03 1.13道路の幅員 1 -2 -2道路の系統・連続性 -3 -3街 道路の舖装の状熊路 \n 条 道路の歩道の状態件 街路の整然性街路の方位小計 1.01 0.95 0.95 1.00容積率 -2行 \n 政 用途地域的 その他の地域・地区等条 \n 件 建蔽率小計 1.00 1.00 0.98 1.00日照・通風等隣接不動産等周囲の状況居住環境用途の多様性環 繁華性の程度境 \n 条 供給処理施設の状態件 危険・嫌悪施設への接近性背後地の状態商業施設の配置画地の規模小計 1.00 1.00 1.00 1.00地域格差合計 1.04 0.96 0.96 1.13各条件項目内は総和で計算し（画地条件を除く）、小計同士を相乗で計算。 \n 画地条件は項目内も相乗で計算。 \n 別表７－２－２ \n ＜土地残余法による収益価格＞ \n （想定建物の概要） ２．総費用算出内訳項目 実額・査定額 算出根拠対象不動産 敷地面積 808.40㎡ （有効面積 808.40㎡） (1)修繕費 944,000円 31,477,000円 × 3.0% \n (2)維持管理費 933,000円 31,104,000円 × 3.0%想定建物 構造・用途 鉄骨造地上３階建共同住宅 土地 589,000円 推定 \n (3)公租公課容積対象床面積 1,333.86㎡ （有効面積 1,333.86㎡） 建物 1,189,000円 233,100,000円 × 0.5 × 1.70% 0.6 \n (4)損害保険料 233,000円 233,100,000円 × 0.10% \n (5)貸倒れ準備費 0円 保証金等により充分担保されているので計上しない。 \n （想定賃貸条件） \n (6)空室損失等相当額 1,574,000 31,477,000円 × 5.0%階層 容積対象 有効率 有効面積 ㎡当たり月 月額支払 敷金 敷金 礼金 礼金 \n (7)建物等取壊費用積立金 0円 233,100,000円 × 0.00%床面積 額支払賃料 賃料 \n (8)その他費用 0円 \n (㎡) (%) (㎡) (円) (円) (月数) (円) (月数) (円) (9)総費用(1)～(8) 5,462,000円 (経費率 17.4%) \n ３．基本利率等 \n r:基本利率 7.0% g：賃料の変動率 \n a:躯体割合(躯体価格÷建物等価格) 80% na：躯体の経済的耐用年数 50年 \n b:設備割合(設備価格÷建物等価格) 20% nb：設備の経済的耐用年数 15年 \n m：未収入期間 1年 \n ４．建物等に帰属する純収益 \n 3 444.62 0.95 422.39 1,900 803,000 2 1,606,000 1 803,000 項目 査定額 算出根拠 \n 2 444.62 0.95 422.39 2,000 845,000 2 1,690,000 1 845,000 (1)建物等の初期投資額 (注) 233,100,000円 166,000/㎡×1,333.86㎡×設計監理料(100+3%) \n 1 444.62 0.9 400.16 2,000 800,000 2 1,600,000 1 800,000 躯体部分 設備部分 \n (2)年賦償還率 \n 0.07996 0.0725 × 80% ＋ 0.1098 × 20% \n (3)建物等に帰属する純収益 18,600,000円 (注)土地造成工事 2,000,000円含む \n (1)×(2) 23,008/㎡ 石撤去費用 3,000,000円含む小計 1,333.88 0.933 1,244.94 2,448,000 4,896,000 2,448,000 \n ５．土地に帰属する純収益駐車場 12 12,000 144,000 1 144,000 0 0 \n (1)総収益 31,477,000円 \n (2)総費用 5,462,000円広告施設 0 0 0 0 0 0 0 \n (3)純収益(1)－(2) 26,015,000円 \n (4)建物等に帰属する純収益 18,600,000円合計 2,592,000 5,040,000 2,448,000 \n (5)土地に帰属する純収益(3)－(4) 7,416,000円 \n (6)未収入期間を考慮した土地に帰属する純収益 6,913,746円 \n １．総収益算出内訳 \n (5)×（未収入期間を考慮した補正率） 0.9324 （8,552円/㎡） \n (1)年額支払賃料 2,592,000円 × 12ヶ月 ≒ 31,104,000円 \n (2)敷金の運用益 5,040,000円 × 2.0% ≒ 101,000円 ６．土地の収益価格 \n (3)礼金の運用益及び償却額 償却年数 10年 運用利回り2.0% 土地帰属純収益 還元利回り(r-g)土地の収益価格 \n 2,448,000円 × 0.1113 ≒ 272,000円 8,552 円 ÷ 7.0% ≒ 122,000円/㎡ \n (4)その他収入 0円 \n (5)総収益 \n (1)＋(2)＋(3)＋(4) 31,477,000円 （ 38,937円／㎡） \n 別表７－２－３－１ \n ＜取引事例の比準及び公示価格の規準＞標準画地価格符 ① ② ③ ④ ⑤取引事例の概要号 取引価格 事情補正 時点修正 建付減価補正 標準化補正 地域格差所在地 地目 地積 取引時点 100 101 100 100 100 \n 457,019円/㎡ × × × × × ≒ 352,000円/㎡調布市 宅地 52.00㎡ H14.3.29 100 100 100 116 113 \n (概況) 備考 下記参照 別表参照 接近 6 \n ｅ Ｕ線「Ｋ」駅の北西方約1900ｍに所在。 第1種中高層住居専用地域 街路 -1南側を幅員約６ｍの市道及び側道に面する長方形の角画地。 (60，200%) 行政戸建て住宅・共同住宅が建ち並ぶ畑も見られる地域。 基準容積率200% 環境 8準防火地域 格差率 1 16 相乗積 13所在地 地目 地積 取引時点 100 103 100 100 100 \n 346,880円/㎡ × × × × × ≒ 345,000円/㎡調布市 宅地 97.44㎡ H14.7.31 100 100 100 95 109 \n (概況) 備考 下記参照 別表参照 接近 5 \n ｆ Ｕ線「Ｋ」駅の北西方約2000ｍに所在。 第1種中高層住居専用地域 街路 2東側を幅員約12ｍの市道に面する台形の中間画地。 (60，200%) 行政幹線道路沿いの混在住宅地域。 基準容積率200% 環境 2準防火地域 格差率 3 -5 相乗積 9所在地 地目 地積 取引時点 100 103.5 100 100 100 \n 320,306円/㎡ × × × × × ≒ 360,000円/㎡三鷹市 宅地 102.09㎡ H14.8.27 100 100 100 93 99 \n (概況) 備考 下記参照 別表参照 接近 3 \n ｇ Ｕ線「Ｋ」駅の北方約2200ｍに所在。 第2種中高層住居専用地域 街路 -2南側を幅員約４ｍの市道に面する略長方形の中間画地。 (60，200%) 行政 -2空地が残り高圧線に近く、一般住宅・共同住宅の混在する住宅地域。 基準容積率160% 環境準防火地域 格差率 3.5 -7 相乗積 -1所在地 地目 地積 取引時点 100 103 100 100 100 \n 227,742円/㎡ × × × × × ≒ 304,000円/㎡調布市 宅地 227.00㎡ H14.7.26 100 100 100 82 94 \n (概況) 備考 下記参照 別表参照 接近 8 \n ｈ Ｕ線「Ｋ」駅の北方約1800ｍに所在。 第1種中高層住居専用地域 街路 -2北東側を幅員約4.5ｍの市道及び側道に面する三角形の角画地。 (60，200%) 行政 -1農地、空地も混在する一般住宅地域。 基準容積率180% 環境 -10準防火地域 格差率 3 -18 相乗積 -6 \n （取引時点は、登記原因日） \n ① ② ③ ④ ⑤公示地の概要取引価格 事情補正 時点修正 建付減価補正 標準化補正 地域格差公示番号 所在地 地積 価格時点 99.5 100 100 \n 321,000円/㎡ × ＊＊＊ × × ＊＊＊ × × ≒ 299,000円/㎡調布-●● 調布市 186.00㎡ H14.1.1 100 100 107 \n (概況) 備考 下記参照 別表参照 接近 \n Ｕ線「Ｊ」駅の北東方約3300ｍに所在。 第1種中高層住居専用地域 街路 2南東側を幅員約12ｍの舗装市道に面する長方形の中間画地。 (60，200%) 行政店舗併用住宅、低層マンション等の混在住宅地域。 基準容積率200% 環境 5格差率 -0.5 相乗積 7 \n ※時点修正率の査定時点修正率は取引事例等の規模及び価格水準を考慮して、周辺公示地等の価格変動率等を基に以下の通り期間配分して求めた。 \n 期間 H12.1.1～H13.1.1 H13.1.1～H14.1.1 H14.1.1～価格時点 \n ｍ (1-0.005×-2/1)≒1.01変動率 -2.6% -4.5% -0.5%期間 H12.1.1～H13.1.1 H13.1.1～H14.1.1 H14.1.1～価格時点 \n ｎ (1-0.005×-6/1)≒1.03変動率 -2.6% -4.5% -0.5%期間 H12.1.1～H13.1.1 H13.1.1～H14.1.1 H14.1.1～価格時点 \n ｏ (1-0.005×-7/1)≒1.035変動率 -2.6% -4.5% -0.5%期間 H12.1.1～H13.1.1 H13.1.1～H14.1.1 H14.1.1～価格時点 \n ｐ (1-0.005×-6/1)≒1.03変動率 -2.6% -4.5% -0.5%期間 H12.1.1～H13.1.1 H13.1.1～H14.1.1 H14.1.1～価格時点規準地 (1-0.005×1/1)≒0.995変動率 -2.6% -4.5% -0.5%別表７－２－３－２ \n ＜対象不動産・取引事例等要因比較表＞標準化補正 ｍ ｎ ｏ ｐ 公示地 \n (対象地は個別格差) 標準化補正 標準化補正 標準化補正 標準化補正 標準化補正最寄り駅への接近性最寄りバス停への接近性接 \n 近 最寄り駅の性格条 商業施設への接近性件 \n 公共施設への接近性小計 1.00 1.00 1.00 1.00 1.00道路の幅員街 道路の系統・連続性 -2路 \n 条 道路の舗装の状態件 道路の歩道の状態小計 1.00 1.00 0.98 1.00 1.00規模 10 -10間口・奥行の関係形状 -3 -10方位 -2 -2高低差画 角画地 5 3地 \n 条 二方路画地件 三方路画地四方路画地セットバック私道負担その他小計 1.16 0.95 1.00 0.82 1.00容積率 行政 用途地域的 その他の地域・地区等条 \n 件 建蔽率小計 1.00 1.00 1.00 1.00 1.00日照・通風等隣接不動産等周囲の状況居住環境用途の多様性環 \n 境 繁華性の程度条 \n 供給処理施設の状態件 \n 危険・嫌悪施設への接近性 -5背後地の状態商業施設の配置 \n ｍ ｎ ｏ ｐ 公示地地域格差地域格差 地域格差 地域格差 地域格差 地域格差最寄り駅への接近性 6 5 3 8交 最寄りバス停への接近性通 \n ・ 最寄り駅の性格接 商業施設への接近性近 \n 条 公共施設への接近性件 都心との距離小計 1.00 1.00 0.95 1.00 1.00標準化補正格差（個別格差）合計 1.16 0.95 0.93 0.82 1.00小計 1.06 1.05 1.03 1.08 1.00道路の幅員 -1 2 -2 -2 2道路の系統・連続性街 道路の舗装の状態路 \n 条 道路の歩道の状態件 街路の整然性街路の方位小計 0.99 1.02 0.98 0.98 1.02容積率 -2 -1行 \n 政 用途地城的 その他の地域・地区等条 \n 件 建蔽率小計 1.00 1.00 0.98 0.99 1.00日照・通風等隣接不動産等周囲の状況 -10居住環境用途の多様性 8 2 5環 繁華性の程度境 \n 条 供給処理施設の状態件 危険・嫌悪施設への接近性背後地の状態商業施設の配置画地の規模小計 1.08 1.02 1.00 0.90 1.05地域格差合計 1.13 1.09 0.99 0.94 1.07各条件項目内は総和で計算し（画地条件を除く）、小計同士を相乗で計算。 \n 画地条件は項目内も相乗で計算。 \n 別表７－２－４分譲販売収入 \n ①標準的画地の価格 ②個別格差 ③各画地の単価 ④面積 ⑤分譲価格画地番 \n ㎡＠ 円 方立 街路 位置 形状 間口 格差率 ③＝①×② ㎡ ⑤＝③×④ \n ① 340,000 -2 0 0 -20 0 78/100 267,000 132.63 35,400,000 \n ② 340,000 0 0 0 0 100/100 340,000 108.63 36,900,000 \n ③ 340,000 -2 0 0 -20 0 78/100 267,000 132.63 35,400,000 \n ④ 340,000 0 0 0 0 100/100 340,000 108.63 36,900,000 \n ⑤ 340,000 -2 0 0 0 0 98/100 333,000 108.63 36,200,000 \n ⑥ 340,000 0 0 0 0 100/100 340,000 108.63 36,900,000 \n ⑦ 340,000 2 0 0 0 102/100 347,000 108.63 37,700,000合計 808.40 255,400,000 \n ㎡＠ 316,000別表７－２－５－１ \n ＜宅地開発分譲を前提とした価格＞ \n １．想定区画割等の概要 ２．開発費用等 ３．開発収入開発面積 808.40㎡ (1) 求めるべき土地価格 Ｘ円 販売総額 255,400,000円 〔 316,000円/㎡〕提供敷地等面積 0.00㎡ (2) 造成工事費 2,000,000円有効敷地面積 808.40㎡ （開発面積当 2,000円／㎡） ４．開発法による価格 \n (3) 販売費・一般管理費 （開発収入の 15％） \n 計画区画数 ７区画 （但し、利益込） 38,000,000円 収入の複利現価額(下表⑭) 支出の複利現価額(⑫＋⑬)平均区画面積 115.49㎡ (4) 公共公益施設負担金等 0円 232,831,000円 ＝ 40,148,000円 ＋ 0.95851 Ｘ円負担金 円建物延床面積合計 ㎡ 近隣対策費 0円 ∴ Ｘ ＝ 201,000,000円平均建物延床面積 0.00㎡ (5) その他 3,000,000円 〔249,000円/㎡〕 \n （庭石等対策費用） \n ○開発スケジュール及び支出・収入複利現価額算出表 \n ＜開発スケジュール等＞ ＜支出＞ ＜収入＞期間 開発スケジュール 複利現価率 支出時期・支出割合 支出 支出の 土地代 土地代 収入時期 収入 収入の \n 12% 造成費 販売費 負担金 その他 ⑥=(2)×②+(3)×③ 複利現価額 Ｘ 複利現価額 収入割合 複利現価額月 支出項目 収入項目 ① ② ③ ④ ⑤ +(4)×④+(5)×⑤ ⑦＝⑥×① ⑧ ⑨＝⑧×① ⑩ ⑪＝⑩×① \n 0 土地売買契約及び手付金 1.0000 0 0 0.1X 0.10000X 0 0 \n 1 0.9906 0 0 0.00000X 0 0 \n 2 0.9813 0 0 0.00000X 0 0 \n 3 土地代金決済 0.9721 0 0 0.00000X 0 0 \n 4 造成 0.9629 0 0 0.00000X 0 0 \n 5 造成終了・着工 0.9539 1/2 1 4,000,000 3,816,000 0.9X 0.85851X 0 0 \n 6 販売開始 0.9449 1/2 19,000,000 17,953,000 0.00000X 0 0 \n 7 0.9360 0 0 0.00000X 0 0 \n 8 竣工 0.9272 1/2 1,000,000 927,000 0.00000X 1/10 25,540,000 23,681,000 \n 9 販売完了 0.9185 1/2 19,000,000 17,452,000 0.00000X 0 0 \n 10 0.9099 0 0 0.00000X 9/10 229,860,000 209,150,000 \n 11 0.9013 0 0 0.00000X 0 0 \n 12 0.8929 0 0 0.00000X 0 0 \n 13 0.8845 0 0 0.00000X 0 0 \n 14 0.8762 0 0 0.00000X 0 0 \n 15 0.8679 0 0 0.00000X 0 0 \n 16 0.8598 0 0 0.00000X 0 0 \n 17 0.8517 0 0 0.00000X 0 0 \n 18 0.8437 0 0 0.00000X 0 0 \n 19 0.8357 0 0 0.00000X 0 0 \n 20 0.8279 0 0 0.00000X 0 0 \n 21 0.8201 0 0 0.00000X 0 0 \n 22 0.8124 0 0 0.00000X 0 0 \n 23 0.8048 0 0 0.00000X 0 0 \n 24 0.7972 0 0 0.00000X 0 0 \n 25 0.7897 0 0 0.00000X 0 0 \n 26 0.7823 0 0 0.00000X 0 0 \n 27 0.7749 0 0 0.00000X 0 0 \n 28 0.7676 0 0 0.00000X 0 0 \n 29 0.7604 0 0 0.00000X 0 0 \n 30 0.7533 0 0 0.00000X 0 0 \n ⑫ ⑬ ⑭合計 1 1 0 1 43,000,000 40,148,000 1.0X 0.95851X 1 255,400,000 232,831,000別表７－２－５－２ \n ＜マンション開発を前提とした価格＞ \n １．想定建物の概要 ２．開発費用等 ３．開発収入開発面積 808.40㎡ (1) 求めるべき土地価格 Ｘ円 販売総額 560,000,000円 〔 450,000円/㎡)税抜 〕提供敷地等面積 0.00㎡ (2) 建築工事費 232,000,000円 〔 459,000円/㎡ 税込 〕有効敷地面積 808.40㎡ （容積対象面積当 174,000円／㎡） \n ＲＣ地上３階建共同住宅 (3) 販売費・一般管理費 （開発収入の 15％） ４．開発法による価格建物容積対象面積 1,333.86㎡ （但し、利益込） 84,000,000円建物専有面積 1,244,94㎡ (4) 公共公益施設負担金等 2,000,000円 収入の複利現価額(下表⑭) 支出の複利現価額(⑫＋⑬)計画戸数 18戸 負担金 円 472,629,000円 ＝ 282,723,000円 ＋ 0.95041 Ｘ円 \n １戸当り平均面積 69.16㎡ 近隣対策費 2,000,000円平均分譲価格 32,000,000円 (5) その他 3,000,000円 ∴ Ｘ ＝ 200,000,000円 \n （庭石等対策費用） 〔247,000円/㎡〕 \n ○開発スケジュール及び支出・収入複利現価額算出表 \n ＜開発スケジュール等＞ ＜支出＞ ＜収入＞期間 開発スケジュール 複利現価率 支出時期・支出割合 支出 支出の 土地代 土地代 収入時期 収入 収入の \n 12% 造成費 販売費 負担金 その他 ⑥=(2)×②+(3)×③ 複利現価額 Ｘ 複利現価額 収入割合 複利現価額月 支出項目 収入項目 ① ② ③ ④ ⑤ +(4)×④+(5)×⑤ ⑦＝⑥×① ⑧ ⑨＝⑧×① ⑩ ⑪＝⑩×① \n 0 土地取得（価格時点） 1.0000 0 0 0.1X 0.10000X 0 0 \n 1 0.9906 0 0 0.00000X 0 0 \n 2 0.9813 0 0 0.00000X 0 0 \n 3 0.9721 0 0 0.00000X 0 0 \n 4 0.9629 0 0 0.00000X 0 0 \n 5 0.9539 0 0 0.00000X 0 0 \n 6 着工 0.9449 0.2 1 1 51,400,000 48,568,000 0.9X 0.85041X 0 0 \n 7 0.9360 0 0 0.00000X 0 0 \n 8 0.9272 0 0 0.00000X 0 0 \n 9 分譲開始 0.9185 1/2 42,000,000 38,577,000 0.00000X 0.1 56,000,000 51,436,000 \n 10 0.9099 0 0 0.00000X 0 0 \n 11 0.9013 0 0 0.00000X 0 0 \n 12 販売完了 0.8929 1/2 42,000,000 37,502,000 0.00000X 0 0 \n 13 0.8845 0 0 0.00000X 0 0 \n 14 0.8762 0 0 0.00000X 0 0 \n 15 0.8679 0 0 0.00000X 0 0 \n 16 0.8598 0 0 0.00000X 0 0 \n 17 竣工・工事残代金支払 0.8517 0.8 185,600,000 158,076,000 0.00000X 0 0 \n 18 0.8437 0 0 0.00000X 0 0 \n 19 残金収入 0.8357 0 0 0.00000X 0.9 504,000,000 421,193,000 \n 20 0.8279 0 0 0.00000X 0 0 \n 21 0.8201 0 0 0.00000X 0 0 \n 22 0.8124 0 0 0.00000X 0 0 \n 23 0.8048 0 0 0.00000X 0 0 \n 24 0.7972 0 0 0.00000X 0 0 \n 25 0.7897 0 0 0.00000X 0 0 \n 26 0.7823 0 0 0.00000X 0 0 \n 27 0.7749 0 0 0.00000X 0 0 \n 28 0.7676 0 0 0.00000X 0 0 \n 29 0.7604 0 0 0.00000X 0 0 \n 30 0.7533 0 0 0.00000X 0 0 \n ⑫ ⑬ ⑭合計 1 1 1 1 321,000,000 282,723,000 1.0X 0.95041X 1 560,000,000 472,629,000別表７－３－１－１ \n ＜取引事例の比準及び公示価格の規準＞符 ① ② ③ ④ ⑤取引事例の概要号 取引価格 事情補正 時点修正 建付減価補正 標準化補正 地域格差所在地 地目 地積 取引時点 100 102.4 100 100 100 \n 300,215円/㎡ × × × × × ≒ 311,000円/㎡三鷹市 宅地 1,184.15㎡ H14.10.4 100 100 100 101 98 \n (概況) 備考 下記参照 別表参照 接近 1 \n ｊ Ｕ線「Ｎ」駅の北西方約2200ｍに所在。 第1種中高層住居專用地域 街路 -3北東側を幅員約9.6ｍの都道及び側道に面する台形の角画地。 (60，200%) 行政店舗、事務所、一般住宅等が混在する地域。 基準容積率200% 環境準防火地域 格差率 2.4 1 相乗積 -2所在地 地目 地積 取引時点 100 98.2 100 100 100 \n 372,069円/㎡ × × × × × ≒ 363,000円/㎡調布市 宅地 610.72㎡ H13.5.24 100 100 100 107 94 \n (概況) 備考 下記参照 別表参照 接近 \n ｉ Ｖ線「Ｌ」駅の南方約2300ｍに所在。 第1種中高層住居専用地域 街路 -6東側を幅員約５ｍの市道及び側道等に面する長方形の三方路画地。 (60，200%) 行政一般住宅，低層マンション等が混在する地域。 基準容積率200% 環境準防火地域 格差率 -1.8 7 相乗積 -6所在地 地目 地積 取引時点 100 103.9 100 100 100 \n 219,869円/㎡ × × × × × ≒ 304,000円/㎡三鷹市 宅地 495.84㎡ H15.3.10 80 100 100 101 93 \n (概況) 備考 売り急ぎ 下記参照 別表参照 接近 1 \n ｋ Ｖ線「Ｌ」駅の南方約2200ｍに所在。 第1種住居地域 街路 -6西側を幅員約４ｍの市道及び側道に面する略長方形の角画地。 (60，200%) 行政 -2空地が残り共同住宅の多い住宅地域。 基準容積率160% 環境準防火地域 格差率 -20 3.9 1 相乗積 -7所在地 地目 地積 取引時点 100 101.8 100 100 100 \n 305,040円/㎡ × × × × × ≒ 279,000円/㎡三鷹市 宅地 526.16㎡ H14.7.29 100 100 100 103 108 \n (概況) 備考 下記参照 別表参照 接近 12 \n ｌ Ｎ線「Ｏ」駅の南西方約1350ｍに所在。 第2種中高層住居専用地域 街路 -4南西側を幅員約7.4ｍの都道及び側道に面する台形の角画地。 (60，200%) 行政低層店舗，共同住宅等の混在する地域。 基準容積率200% 環境準防火地域 格差率 1.8 3 相乗積 8 \n （取引時点は、登記原因日） \n ① ② ③ ④ ⑤公示地の概要取引価格 事情補正 時点修正 建付減価補正 標準化補正 地域格差公示番号 所在地 地積 価格時点 99.7 100 100 \n 337,000円/㎡ × ＊＊＊ × × ＊＊＊ × × ≒ 323,000円/㎡三鷹-●● 三鷹市 547.00㎡ H14.1.1 100 100 104 \n (概況) 備考 下記参照 別表参照 接近 2 \n Ｖ線「Ｌ」駅の南方約2000ｍに所在。 第1種住居地域 街路 -3西側を幅員約7.7ｍの舗装市道に面する長方形の中間画地。 (60，200%) 行政中規模マンション、アパートが見られる住宅地域。 基準容積率200% 環境 5格差率 -0.3 相乗積 4 \n ※時点修正率の査定時点修正率は取引事例等の規模及び価格水準を考慮して、周辺公示地等の価格変動率等を基に以下の通り期間配分して求めた。 \n 価格時点以降の取引事例に対する時点修正は、公示価格変動率１５年の公示価格変動率に大きな差がないことから、平成１４年の変動率を採用した。 \n 期間 H12.1.1～H13.1.1 H13.1.1～H14.1.1 H14.1.1～価格時点 \n ｉ (1-0.003×-8/1)≒1.024変動率 -2.8% -2.6% -0.3%期間 H12.1.1～H13.1.1 H13.1.1～H14.1.1 H14.1.1～価格時点 \n ｊ (1-0.026×7/12)×(1-0.003×1/1)≒0.982変動率 -2.8% -2.6% -0.3%期間 H12.1.1～H13.1.1 H13.1.1～H14.1.1 H14.1.1～価格時点 \n ｋ (1-0.003×-13/1)≒1.039変動率 -2.8% -2.6% -0.3%期間 H12.1.1～H13.1.1 H13.1.1～H14.1.1 H14.1.1～価格時点 \n ｌ (1-0.003×-6/1)≒1.018変動率 -2.8% -2.6% -0.3%期間 H12.1.1～H13.1.1 H13.1.1～H14.1.1 H14.1.1～価格時点規準地 (1-0.003×1/1)≒0.997変動率 -2.8% -2.6% -0.3%別表７－３－１－２ \n ＜対象不動産・取引事例等要因比較表＞標準化補正 ｉ ｊ ｋ ｌ 公示地 \n (対象地は個別格差) 標準化補正 標準化補正 標準化補正 標準化捕正 標準化補正最寄り駅への接近性最寄りバス停への接近性接 \n 近 最寄り駅の性格条 商業施設への接近性件 \n 公共施設への接近性小計 1.00 1.00 1.00 1.00 1.00道路の幅員街 道路の系統・連続性 -2 -2路 \n 条 道路の舗装の状態件 道路の歩道の状態小計 1.00 1.00 0.98 0.98 1.00規模間口・奥行の関係形状 -2方位 -2 1高低差画 角画地 5 3 5地 \n 条 二方路画地件 三方路画地 6四方路画地セットバック私道負担その他小計 1.01 1.07 1.03 1.05 1.00容積率 行政 用途地域的 その他の地域・地区等条 \n 件 建蔽率小計 1.00 1.00 1.00 1.00 1.00日照・通風等隣接不動産等周囲の状況居住環境用途の多様性環 \n 境 繁華性の程度条 \n 供給処理施設の状態件 \n 危険・嫌悪施設への接近性背後地の状態商業施設の配置 \n ｉ ｊ ｋ ｌ 公示地地域格差地域格差 地域格差 地域格差 地域格差 地域格差最寄り駅への接近性 1 1 12 2交 最寄りバス停への接近性通 \n ・ 最寄り駅の性格接 商業施設への接近性近 \n 条 公共施設への接近性件 都心との距離小計 1.00 1.00 1.00 1.00 1.00標準化補正格差（個別格差）合計 1.01 1.07 1.01 1.03 1.00小計 1.01 1.00 1.01 1.12 1.02道路の幅員 -3 -6 -6 -4 -3道路の系統・連続性街 道路の舗装の状態路 \n 条 道路の歩道の状態件 街路の整然性街路の方位小計 0.97 0.94 0.94 0.96 0.97容積率 －２行 \n 政 用途地域的 その他の地域・地区等条 \n 件 建蔽率小計 1.00 1.00 0.98 1.00 1.00日照・通風等隣接不動産等周囲の状況居住環境 5用途の多様性環 繁華性の程度境 \n 条 供給処理施設の状態件 危険・嫌悪施設への接近性背後地の状態商業施設の配置画地の規模小計 1.00 1.00 1.00 1.00 1.05地域格差合計 0.98 0.94 0.93 1.08 1.04各条件項目内は総和で計算し（画地条件を除く）、小計同士を相乗で計算。 \n 画地条件は項目内も相乗で計算。 \n 別表７－３－２ \n ＜土地残余法による収益価格＞ \n （想定建物の概要） ２．総費用算出内訳項目 実額・査定額 算出根拠対象不動産 敷地面積 619.55㎡ （有効面積 619.55㎡） (1)修繕費 847,000円 28,238,000円 × 3.0% \n (2)維持管理費 827,000円 27,564,000円 × 3.0%想定建物 構造・用途 鉄筋コンクリート造地上６階建共同住宅 土地 524,000円 推定 \n (3)公租公課容積対象床面積 1,082.10㎡ （有効面積 1,021.00㎡） 建物 1,043,000円 204,600,000円 × 0.5 × 1.70% 0.6 \n (4)損害保険料 205,000円 204,600,000円 × 0.10% \n (5)貸倒れ準備費 0円 保証金等により充分担保されているので計上しない。 \n （想定賃貸条件） \n (6)空室損失等相当額 1,412,000円 28,238,000円 × 5.0%階層 容積対象 有効率 有効面積 ㎡当たり月 月額支払 敷金 敷金 礼金 礼金 \n (7)建物等取壊費用積立金 0円 204,600,000円 × 0.00%床面積 額支払賃料 賃料 \n (8)その他費用 0円 \n (㎡) (%) (㎡) (円) (円) (月数) (円) (月数) (円) (9)総費用(1)～(8) 4,858,000円 (経費率 17.2%) \n ３．基本利率等 ＥＶ付 \n r:基本利率 7.0% g：賃料の変動率 \n a:躯体割合(躯体価格÷建物等価格) 70% na：躯体の経済的耐用年数 50年 \n b:設備割合(設備価格÷建物等価格) 30% nb：設備の経済的耐用年数 15年 \n 6 71.00 1 71.00 2,300 163,000 2 326,000 1 163,000 m：未収入期間 1年 \n 5 124.00 1 124.00 2,300 285,000 2 570,000 1 285,000 \n 4 199.00 1 199.00 2,200 438,000 2 876,000 1 438,000 ４．建物等に帰属する純収益 ＥＶ付 \n 3 219.00 1 219.00 2,200 482,000 2 964,000 1 482,000 項目 査定額 算出根拠 \n 2 270.00 1 270.00 2,100 567,000 2 1,134,000 1 567,000 (1)建物等の初期投資額 (注) 204,600,000円 180,000/㎡×1,082.10㎡×設計監理料(100+3%) \n 1 138.00 1 138.00 2,100 290,000 2 580,000 1 290,000 躯体部分 設備部分 \n (2)年賦償還率 \n 0.08369 0.0725 × 70% ＋ 0.1098 × 30% \n (3)建物等に帰属する純収益 17,100,000円 (注)水道管工事費 4,000,000円含む \n (1)×(2) 27,601円/㎡小計 1,021.00 1 1,021.00 2,225,000 4,450,000 2,225,000 \n ５．土地に帰属する純収益駐車場 6 12,000 72,000 1 72,000 0 0 \n (1)総収益 28,238,000円 \n (2)総費用 4,858,000円広告施設 0 0 0 0 0 0 0 \n (3)純収益(1)－(2) 23,380,000円 \n (4)建物等に帰属する純収益 17,100,000円合計 2,297,000 4,522,000 2,225,000 \n (5)土地に帰属する純収益(3)－(4) 6,280,000円 \n (6)未収入期間を考慮した土地に帰属する純収益 5,855,472円 \n １．総収益算出内訳 \n (5)×（未収入期間を考慮した補正率） 0.9324 （9,451円／㎡） \n (1)年額支払賃料 2,297,000円 × 12ヶ月 ≒ 27,564,000円 \n (2)敷金の運用益 4,522,000円 × 2.0% ≒ 90,000円 ６．土地の収益価格 \n (3)礼金の運用益及び償却額 償却年数 ４年 運用利回り2.0% 土地帰属純収益 還元利回り(r-g)土地の収益価格 \n 2,225,000円 × 0.2626 ≒ 584,000円 9,451 円 ÷ 7.0% ≒ 135,000円/㎡ \n (4)その他収入 0円 \n (5)総収益 \n (1)＋(2)＋(3)＋(4) 28,238,000円 （ 45,578円円／㎡） \n 別表７－３－３－１ \n ＜取引事例の比準＞符 ① ② ③ ④ ⑤取引事例の概要号 取引価格 事情補正 時点修正 建付減価補正 標準化補正 地域格差所在地 地目 地積 取引時点 100 103.9 100 100 100 \n 349,779円/㎡ × × × × × ≒ 408,000円/㎡三鷹市 宅地 54.32㎡ H15.2.24 100 100 100 100 89 \n (概況) 備考 下記参照 別表参照 接近 \n ｑ Ｖ線「Ｌ」駅の南西方約2300ｍに所在。 近隣商業地域 街路 -6西側を幅員約４ｍの市道に面する長方形の中間画地。 (60，200%) 行政中小規模の一般住宅、共同住宅等が混在する地域。 基準容積率200% 環境 -5準防火地域 格差率 3.9 相乗積 -11所在地 地目 地積 取引時点 100 103.6 100 100 100 \n 292,720円/㎡ × × × × × ≒ 383,000円/㎡三鷹市 宅地 172.52㎡ H15.1.23 80 100 100 103 96 \n (概況) 備考 売り急ぎ 下記参照 別表参照 接近 10 \n ｒ Ｖ線「Ｌ」駅の南方約1200ｍに所在。 第1種住居地域 街路 -6南側を幅員約４ｍの私道に面する長方形の中間画地。 (60，200%) 行政 -2一般住宅、共同住宅等が混在する地域。 基準容積率160% 環境 -5準防火地域 格差率 -20 3.6 3 相乗積 -4所在地 地目 地積 取引時点 100 101.8 100 100 100 \n 303,670円/㎡ × × × × × ≒ 373,000円/㎡三鷹市 宅地 194.29㎡ H14.7.30 100 100 100 89 93 \n (概況) 備考 下記参照 別表参照 接近 6 \n ｓ Ｖ線「Ｌ」駅の南方約1700ｍに所在。 第1種住居地域 街路 -6西側を幅員約4.1ｍの市道及び背面道に面する台形の二方路画地。 (60，200%) 行政 -2一般住宅、駐車場、公共施設等が混在する地域。 基準容積率160% 環境 -5準防火地域 格差率 1.8 -11 相乗積 -7所在地 地目 地積 取引時点 100 103 100 100 100 \n 410,000円/㎡ × × × × × ≒ 398,000円/㎡三鷹市 宅地 90.00㎡ H14.11.28 100 100 100 106 100 \n (概況) 備考 下記参照 別表参照 接近 10 \n ｔ Ｎ線「Ｏ」駅の南西方約1350ｍに所在。 第2種中高層住居專用地域 街路 -4南西側を幅員約7.4ｍの都道及び側道に面する台形の角画地。 (60，200%) 行政低層店舗、共同住宅等の混在する地域。 基準容積率200% 環境 -5準防火地域 格差率 3 6 相乗積 \n （取引時点は、登記原因日） \n ① ② ③ ④ ⑤公示地の概要取引価格 事情補正 時点修正 建付減価補正 標準化補正 地域格差公示番号 所在地 地積 価格時点 \n 337,000円/㎡三鷹-●● 三鷹市 547.00㎡ H14.1.1 \n (概況) 備考 \n Ｖ線「Ｌ」駅の南方約2000ｍに所在。 第1種住居地域西側を幅員約7.7ｍの舗装市道に面する長方形の中間画地。 (60，200%)中規模マンション、アパートが見られる住宅地域。 基準容積率200%格差率 \n ※時点修正率の査定時点修正率は取引事例等の規模及び価格水準を考慮して、周辺公示地等の価格変動率等を基に以下の通り期間配分して求めた。 \n 価格時点以降の取引事例に対する時点修正は、公示価格変動率１５年の公示価格変動率に大きな差がないことから、平成１４年の変動率を採用した。 \n 期間 H12.1.1～H13.1.1 H13.1.1～H14.1.1 H14.1.1～価格時点 \n ｑ (1-0.003×-13/1)≒1.039変動率 -2.8% -2.6% -0.3%期間 H12.1.1～H13.1.1 H13.1.1～H14.1.1 H14.1.1～価格時点 \n ｒ (1-0.003×-12/1)≒1.036変動率 -2.8% -2.6% -0.3%期間 H12.1.1～H13.1.1 H13.1.1～H14.1.1 H14.1.1～価格時点 \n ｓ (1-0.003×-6/1)≒1.018変動率 -2.8% -2.6% -0.3%期間 H12.1.1～H13.1.1 H13.1.1～H14.1.1 H14.1.1～価格時点 \n ｔ (1-0.003×-10/1)≒1.03変動率 -2.8% -2.6% -0.3%期間 H12.1.1～H13.1.1 H13.1.1～H14.1.1 H14.1.1～価格時点規準地 (1-0.003×1/1)≒0.997変動率 -2.8% -2.6% -0.3%別表７－３－３－２ \n ＜対象不動産・取引事例等要因比較表＞標準化補正 ｑ ｒ ｓ ｔ \n (対象地は個別格差) 標準化補正 標準化補正 標準化補正 標準化補正最寄り駅への接近性最寄りバス停への接近性接 \n 近 最寄り駅の性格条 商業施設への接近性件 \n 公共施設への接近性小計 1.00 1.00 1.00 1.00道路の幅員街 道路の系統・連続性 -5路 \n 条 道路の舗装の状態件 道路の歩道の状態小計 1.00 1.00 0.95 1.00規模 -5間口・奥行の関係形状 -5方位 3 3高低差画 角画地 3地 \n 条 二方路画地 5件 三方路画地四方路画地セットバック -1私道負担その他小計 1.00 1.03 0.94 1.06容積率 行政 用途地域的 その他の地域・地区等条 \n 件 建蔽率小計 1.00 1.00 1.00 1.00日照・通風等隣接不動産等周囲の状況居住環境用途の多様性環 \n 境 繁華性の程度条 \n 供給処理施設の状態件 \n 危険・嫌悪施設への接近性背後地の状態商業施設の配置 \n ｑ ｒ ｓ ｔ地域格差地域格差 地域格差 地域格差 地域格差最寄り駅への接近性 10 6 10交 最寄りバス停への接近性通 \n ・ 最寄り駅の性格接 商業施設への接近性近 \n 条 公共施設への接近性件 都心との距離小計 1.00 1.00 1.00 1.00標準化補正格差（個別格差）合計 1.00 1.03 0.89 1.06小計 1.00 1.10 1.06 1.10道路の幅員 -6 -6 -6 -4道路の系統・連続性街 道路の舗装の状態路 \n 条 道路の歩道の状態件 街路の整然性街路の方位小計 0.94 0.94 0.94 0.96容積率 -2 -2行 \n 政 用途地域的 その他の地域・地区等条 \n 件 建蔽率小計 1.00 0.98 0.98 1.00日照・通風等隣接不動産等周囲の状況居住環境 -5 -5 -5 -5用途の多様性環 繁華性の程度境 \n 条 供給処理施設の状態件 危険・嫌悪施設への接近性背後地の状態商業施設の配置画地の規模小計 0.95 0.95 0.95 0.95地域格差合計 0.89 0.96 0.93 1.00各条件項目内は総和で計算し（画地条件を除く）、小計同士を相乗で計算。 \n 画地条件は項目内も相乗で計算。 \n 別表７－３－４分譲販売収入開発道路なしの場合 \n ①標準的画地の価格 ②個別格差 ③各画地の単価 ④面積 ⑤分譲価格画地番 \n ㎡＠ 円 方立 街位 位置 形状 間口 格差率 ③＝①×② ㎡ ⑤＝③×④ \n ① 352,000 0 0 0 -20 0 80/100 282,000 125.00 35,300,000 \n ② 352,000 0 0 0 0 100/100 352,000 116.00 40,800,000 \n ③ 352,000 0 0 0 -20 0 80/100 282,000 128.00 36,100,000 \n ④ 352,000 0 0 0 -5 0 95/100 334,000 106.00 35,400,000 \n ⑤ 352,000 0 0 0 -20 0 80/100 282,000 144.55 40,800,000合計 619.55 188,400,000 \n ㎡＠ 304,000開発道路有りの場合 \n ①標準的画地の価格 ②個別格差 ③各画地の単価 ④面積 ⑤分譲価格画地番 \n ㎡＠ 円 方立 街位 位置 形状 間口 格差率 ③＝①×② ㎡ ⑤＝③×④ \n ① 352,000 3 2 0 105/100 370,000 102.00 37,700,000 \n ② 352,000 3 0 103/100 363,000 102.00 37,000,000 \n ③ 352,000 0 0 -10 90/100 317,000 121.55 38,500,000 \n ④ 352,000 0 0 -10 90/100 317,000 102.00 32,300,000 \n ⑤ 352,000 2 0 0 102/100 359,000 102.00 36,600,000道路 90.00 0合計 619.55 182,100,000 \n ㎡＠ 294,000別表７－３－５－１ \n ＜宅地開発分譲を前提とした価格＞ \n １．想定区画割等の概要 ２．開発費用等 ３．開発収入開発面積 619.55㎡ (1) 求めるべき土地価格 Ｘ円 販売総額 188,400,000円 〔 304,000円/㎡〕提供敷地等面積 ㎡ (2) 造成工事費 1,000,000円有効敷地面積 619.55㎡ （開発面積当 2,000円／㎡） ４．開発法による価格 \n (3) 販売費・一般管理費 （開発収入の 15％） \n 計画区画数 ５区画 （但し、利益込） 28,000,000円 収入の複利現価額(下表⑭) 支出の複利現価額(⑫＋⑬)平均区画面積 123.91㎡ (4) 公共公益施設負担金等 0円 171,588,000円 ＝ 30,980,000円 ＋ 0.95851 Ｘ円負担金 円(水道工事費)建物延床面積合計 ㎡ 近隣対策費 0円 ∴ Ｘ ＝ 147,000,000円平均建物延床面積 0.00㎡ (5) その他（水道管設置費月 4,000,000円 〔237,000円/㎡〕 \n ○開発スケジュール及び支出・収入複利現価額算出表 \n ＜開発スケジュール等＞ ＜支出＞ ＜収入＞期間 開発スケジュール 複利現価率 支出時期・支出割合 支出 支出の 土地代 土地代 収入時期 収入 収入の \n 12% 造成費 販売費 負担金 その他 ⑥=(2)×②+(3)×③ 複利現価額 Ｘ 複利現価額 収入割合 複利現価額月 支出項目 収入項目 ① ② ③ ④ ⑤ +(4)×④+(5)×⑤ ⑦＝⑥×① ⑧ ⑨＝⑧×① ⑩ ⑪＝⑩×① \n 0 土地売買契約及び手付金 1.0000 0 0 0.1X 0.10000X 0 0 \n 1 0.9906 0 0 0.00000X 0 0 \n 2 0.9813 0 0 0.00000X 0 0 \n 3 土地代金決済 0.9721 0 0 0.00000X 0 0 \n 4 １期造成 0.9629 0 0 0.00000X 0 0 \n 5 １期造成終了・１期着工 0.9539 1 1 1 5,000,000 4,770,000 0.9X 0.85851X 0 0 \n 6 １期販売開始 0.9449 1/2 14,000,000 13,229,000 0.00000X 0 0 \n 7 0.9360 0 0 0.00000X 0 0 \n 8 １期峻工 0.9272 1/2 14,000,000 12,981,000 0.00000X 1/20 9,420,000 8,734,000 \n 9 １期販売完了 0.9185 0 0 0.00000X 0 0 \n 10 0.9099 0 0 0.00000X 19/20 178,980,000 162,854,000 \n 11 0.9013 0 0 0.00000X 0 0 \n 12 0.8929 0 0 0.00000X 0 0 \n 13 0.8845 0 0 0.00000X 0 0 \n 14 0.8762 0 0 0.00000X 0 0 \n 15 0.8679 0 0 0.00000X 0 0 \n 16 0.8598 0 0 0.00000X 0 0 \n 17 0.8517 0 0 0.00000X 0 0 \n 18 0.8437 0 0 0.00000X 0 0 \n 19 0.8357 0 0 0.00000X 0 0 \n 20 0.8279 0 0 0.00000X 0 0 \n 21 0.8201 0 0 0.00000X 0 0 \n 22 0.8124 0 0 0.00000X 0 0 \n 23 0.8048 0 0 0.00000X 0 0 \n 24 0.7972 0 0 0.00000X 0 0 \n 25 0.7897 0 0 0.00000X 0 0 \n 26 0.7823 0 0 0.00000X 0 0 \n 27 0.7749 0 0 0.00000X 0 0 \n 28 0.7676 0 0 0.00000X 0 0 \n 29 0.7604 0 0 0.00000X 0 0 \n 30 0.7533 0 0 0.00000X 0 0 \n ⑫ ⑬ ⑭合計 1 1 1 1 33,000,000 30,980,000 1.0X 0.95851X 1 188,400,000 171,588,000別表７－３－５－２ \n ＜マンション開発を前提とした価格＞ \n ３．開発収入 \n １．想定建物の概要 ２．開発費用等販売総額 459,000,000円 〔 450,000円/㎡〕税抜 〕開発面積 619.55㎡ (1) 求めるべき土地価格 Ｘ円 \n 〔 460,000円/㎡ 税込 〕提供敷地等面積 0.00㎡ (2) 建築工事費 214,000,000円有効敷地面積 619.55㎡ （容積対象面積当 198,000円／㎡） \n ４．開発法による価格 \n ＲＣ地上６階建共同住宅 (3) 販売費・一般管理費 （開発収入の 15％） \n 健物容積対象面積 1,082.10㎡ （但し、利益込） 69,000,000円収入の複利現価額(下表⑭) 支出の複利現価額(⑫＋⑬)建物専有面積 1,021.00㎡ (4) 公共公益施設負担金等 2,000,000円 \n 387,387,000円 ＝ 254,043,000円 ＋ 0.95041 Ｘ円計画戸数 15戸 負担金 0円 \n １戸当り平均面積 68.07㎡ 近隣対策費 2,000,000円 \n ∴ Ｘ ＝ 140,000,000円平均分譲価格 31,000,000円 (5) その他（水道管設置費 4,000,000円 \n 〔226,000円/㎡〕 \n ○開発スケジュール及び支出・収入複利現価額算出表 \n ＜開発スケジュール等＞ ＜支出＞ ＜収入＞期間 開発スケジュール 複利現価率 支出時期・支出割合 支出 支出の 土地代 土地代 収入時期 収入 収入の \n 12% 造成費 販売費 負担金 その他 ⑥=(2)×②+(3)×③ 複利現価額 Ｘ 複利現価額 収入割合 複利現価額月 支出項目 収入項目 ① ② ③ ④ ⑤ +(4)×④+(5)×⑤ ⑦＝⑥×① ⑧ ⑨＝⑧×① ⑩ ⑪＝⑩×① \n 0 土地取得（価格時点） 1.0000 0 0 0.1X 0.10000X 0 0 \n 1 0.9906 0 0 0.00000X 0 0 \n 2 0.9813 0 0 0.00000X 0 0 \n 3 0.9721 0 0 0.00000X 0 0 \n 4 0.9629 0 0 0.00000X 0 0 \n 5 0.9539 0 0 0.00000X 0 0 \n 6 着工 0.9449 0.2 1 44,800,000 42,332,000 0.9X 0.85041X 0 0 \n 7 0.9360 0 0 0.00000X 0 0 \n 8 0.9272 0 0 0.00000X 0 0 \n 9 分譲開始 0.9185 1/2 34,500,000 31,688,000 0.00000X 0.1 45,900,000 42,159,000 \n 10 0.9099 0 0 0.00000X 0 0 \n 11 0.9013 0 0 0.00000X 0 0 \n 12 販売完了 0.8929 1/2 34,500,000 30,805,000 0.00000X 0 0 \n 13 0.8845 0 0 0.00000X 0 0 \n 14 0.8762 0 0 0.00000X 0 0 \n 15 0.8679 0 0 0.00000X 0 0 \n 16 0.8598 0 0 0.00000X 0 0 \n 17 竣工・工事残代金支払 0.8517 0.8 1 175,200,000 149,218,000 0.00000X 0 0 \n 18 0.8437 0 0 0.00000X 0 0 \n 19 残金収入 0.8357 0 0 0.00000X 0.9 413,100,000 345,228,000 \n 20 0.8279 0 0 0.00000X 0 0 \n 21 0.8201 0 0 0.00000X 0 0 \n 22 0.8124 0 0 0.00000X 0 0 \n 23 0.8048 0 0 0.00000X 0 0 \n 24 0.7972 0 0 0.00000X 0 0 \n 25 0.7897 0 0 0.00000X 0 0 \n 26 0.7823 0 0 0.00000X 0 0 \n 27 0.7749 0 0 0.00000X 0 0 \n 28 0.7676 0 0 0.00000X 0 0 \n 29 0.7604 0 0 0.00000X 0 0 \n 30 0.7533 0 0 0.00000X 0 0 \n ⑫ ⑬ ⑭合計 1 1 1 1 289,000,000 254,043,000 1.0X 0.95041X 1 459,000,000 387,387,000別表８ \n １ 所得金額の計算 \n （単位：円） \n 項目 順号 認定額申告所得金額 1 4,841,132完成工事高の計上漏れ 2 292,380,953損金の額に算入されない外注費 3 50,000,000損金の額に算入されない貸倒損失 4 7,952,381加 \n 算雑益の計上漏れ 5 200寄付金の損金不算入額 6 5,190,694所得金額に加算すべき金額（２～６の計） 7 355,524,228損金の額に算入される寄附金 8 8,350,000損金の額に算入される貸倒損失 9 1,327,134減 \n 雑収入の過大計上額 10 105,900,000算 \n 繰越欠損金の損益算入額 11 102,892,667所得金額から減算すべき金額（８～１１の計） 12 218,469,801所得金額（１＋７－１２） 13 141,895,559 \n ２ 税額の計算 \n （単位：円） \n 項目 順号 認定額所得金額に対する法人税額 14 41,928,500課税留保金額に対する税額 15 7,764,000法人税額から控除される所得税額等 16 3,090納付すべき法人税額（１４＋１５－１６） 17 49,689,410確定申告における法人税額 18 1,061,900差引納付すべき法人税額（１７－１８） 19 48,627,510 \n ３ 加算税額の計算 \n （単位：円） \n 項日 順号 認定額過少申告加算税の計算の基礎となる税額 20 48,627,500過少申告加算税の額 21 7,240,000 \n \n"
}