{
  "number": "11610",
  "title": "更正処分等取消請求事件",
  "court": "那覇地方裁判所",
  "date": "平成２３年２月９日",
  "date_iso": "2011-02-09",
  "result": "取消",
  "topics": [
    "法人税",
    "所得税",
    "消費税"
  ],
  "laws": [
    "国税通則法68条"
  ],
  "keywords": [
    "更正処分",
    "重加算税",
    "青色申告"
  ],
  "text": "\n \n 目次に戻る \n \n 判決 11610 \n 更正処分等取消請求事件 \n \n 裁判所:  那覇地方裁判所 \n 判決日:  平成２３年２月９日 \n 結果:  取消 \n \n \n 主文 \n １ 原告の請求をいずれも棄却する。\n２ 訴訟費用は原告の負担とする。 \n \n \n 第１ 請求の趣旨 \n １ 名護税務署長が、平成１８年５月３０日付けで原告に対してした平成１１年７月１日から平成\n１２年６月３０日まで（以下「平成１２年６月期」という。）の事業年度の法人税の更正処分のうち、所得金額５５万６０５５円、納付すべき税額１２万２２００円を超える部分及び重加算税の賦課決定処分を取り消す。\n２ 名護税務署長が、平成１８年５月３０日付けで原告に対してした平成１２年７月１日から平成\n１３年６月３０日まで（以下「平成１３年６月期」という。）の事業年度の法人税の更正処分のうち、所得金額１３５万７５６３円、納付すべき税額２９万７９００円を超える部分及び重加算税の賦課決定処分を取り消す。\n３ 名護税務署長が、平成１８年５月３０日付けで原告に対してした平成１４年７月１日から平成\n１５年６月３０日まで（以下「平成１５年６月期」という。）の事業年度の法人税の更正処分のうち、所得金額１５４万１３４２円、納付すべき税額３３万８９００円を超える部分及び重加算税の賦課決定処分（ただし、いずれも平成２０年３月３１日付け裁決により一部取り消された後のもの。）を取り消す。\n４ 名護税務署長が、平成１８年５月３０日付けで原告に対してした平成１５年７月１日から平成\n１６年６月３０日まで（以下「平成１６年６月期」という。）の事業年度の法人税の更正処分のうち、所得金額８１万６２４４円、納付すべき税額１７万９４００円を超える部分及び重加算税の賦課決定処分（ただし、いずれも平成２０年３月３１日付け裁決により一部取り消された後のもの。）を取り消す。\n５ 名護税務署長が、平成１８年５月３０日付けで原告に対してした平成１６年７月１日から平成\n１７年６月３０日まで（以下「平成１７年６月期」という。）の事業年度の法人税の更正処分のうち、所得金額３４万６１５１円、納付すべき税額７万６１００円を超える部分及び重加算税の賦課決定処分（ただし、いずれも平成２０年３月３１日付け裁決により一部取り消された後のもの。）を取り消す。\n６ 名護税務署長が、平成１８年５月３０日付けで原告に対してした平成１３年６月期の事業年度以降の法人税に係る青色申告の承認の取消処分（以下「本件青色申告承認取消処分」という。）\nを取り消す。\n７ 名護税務署長が、平成１８年５月３０日付けで原告に対してした平成１３年６月期の課税期間の消費税及び地方消費税（併せて以下「消費税等」という。）の更正処分のうち、課税標準額２億７１２４万６０００円、納付すべき消費税１１５万４６００円及び地方消費税２８万８６００円を超える部分並びに重加算税の賦課決定処分を取り消す。\n８ 名護税務署長が、平成１８年５月３０日付けで原告に対してした平成１４年６月期の課税期間の消費税等の更正処分のうち、課税標準額２億０６５６万円、納付すべき消費税１３７万６９０\n０円及び地方消費税３４万４２００円を超える部分並びに重加算税の賦課決定処分（ただし、いずれも平成２０年３月３１日付け裁決により一部取り消された後のもの。）を取り消す。\n９ 名護税務署長が、平成１８年５月３０日付けで原告に対してした平成１５年６月期の課税期間の消費税等の更正処分のうち、課税標準額２億４５７８万２０００円、納付すべき消費税２６２万４４００円及び地方消費税６５万６１００円を超える部分並びに重加算税の賦課決定処分を取り消す。\n１０ 名護税務署長が、平成１８年５月３０日付けで原告に対してした平成１６年６月期の課税期間の消費税等の更正処分のうち、課税標準額２億４４２３万６０００円、納付すべき消費税２７\n１万３７００円及び地方消費税６７万８４００円を超える部分並びに重加算税の賦課決定処分\n（ただし、いずれも平成２０年３月３１日付け裁決により一部取り消された後のもの。）を取り消す。\n１１ 名護税務署長が、平成１８年５月３０日付けで原告に対してした平成１７年６月期の課税期間の消費税等の更正処分のうち、課税標準額２億５７９２万円、納付すべき消費税２９１万１５\n００円及び地方消費税７２万７８００円を超える部分並びに重加算税の賦課決定処分を取り消す。 \n \n \n 第２ 事案の概要本件は \n 、原告が、別紙「更正処分等一覧」の「確定申告」欄記載のとおり、平成１１年２月２６日から同年６月３０日まで（以下「平成１１年６月期」という。）、平成１２年６月期、平成１３年 \n ６月期、平成１４年６月期、平成１５年６月期、平成１６年６月期及び平成１７年６月期の各事業年度の法人税並びに平成１３年６月期ないし平成１７年６月期の各課税期間の消費税等を申告したところ、名護税務署長から、同申告に計上されていない伐採・害虫駆除・造林・治山の各事業等 \n （以下「本件森林事業」という。）による売上（以下「本件森林売上」という。）に係る所得等が原告に帰属するなどとして納付すべき税額等を算定した同別紙「更正処分」欄記載の各更正処分及び各重加算税賦課処分を受けるとともに、法人税法１２７条１項３号に該当する事由があるとして本件青色申告承認取消処分を受けたところ、上記所得等について、原告ではなく、原告の代表取締役である甲（以下「甲」という。）に帰属するものであり、青色申告承認取消事由もないと主張して、 \n 同別紙番号２、３、５ないし１２の「更正処分」欄記載の各更正処分のうち、原告の申告額を超える部分及びこれに対応する各重加算税賦課処分（ただし、同別紙番号５ないし７、９、１１の各更正処分及び各重加算税賦課処分については、いずれも平成２０年３月３１日付け裁決により一部取り消された後のもの。これらを併せて以下「本件各更正処分等」という。）並びに本件青色申告承認取消処分の取消しを求める事案である。 \n １ 前提事実等（各掲記の証拠等によるほかは、当事者間に争いがない。） \n (1) 原告の確定申告ア 原告は、土木工事業、林業及び木材伐出請負業等を目的として平成１１年２月２６日に設立された有限会社であり、設立当初から甲が代表取締役を務めている。 \n また、甲は、平成２、３年ころから、甲班の班長として、複数の班員を用いて、Ｂ組合（以下「Ｂ組合」という。）から受注した森林病害虫防除（松くい虫駆除）、伐採、造林及び治山の事業を行っていたほか、平成１４年１１月、樹木の伐採や伐採した木材によるチップの製造を行うことを目的として、１４名の組合員からなるＣ組合を結成し、その代表理事を務めていた。 \n （甲３、２１、原告代表者） \n イ 原告は、平成１１年６月期ないし平成１７年６月期の各事業年度の法人税について、平成 \n １１年６月期及び平成１２年６月期は白色の確定申告書により、平成１３年６月期以降は青色の確定申告書により、別紙「更正処分等一覧」番号１ないし７の「確定申告」欄記載のとおり、名護税務署長へ申告した。 \n ウ 原告は、平成１３年６月期ないし平成１７年６月期の各課税期間の消費税等について、別紙「更正処分等一覧」番号８ないし１２の「確定申告」欄記載のとおり、名護税務署長へ申告した。 \n エ 上記イ及びウのうち、平成１１年６月期、平成１２年６月期、平成１６年６月期及び平成 \n １７年６月期の各事業年度の法人税の確定申告書並びに平成１６年６月期及び平成１７年 \n ６月期の各課税期間の消費税等の確定申告書については、法定申告期限後に提出されている。 \n (2) 名護税務署による税務調査名護税務署は、平成１７年１１月から平成１８年２月にかけて、原告の税務調査を行い、その結果、上記(1)の申告に計上されていない本件森林事業による本件森林売上、本件森林事業同事業によって伐採し、Ｂ組合から処分を任されていた原木を販売したことによる売上（以下 \n 「本件原木売上」という。）及び自動販売機に係る手数料（以下「本件自動販売機手数料」という。）の存在が明らかとなった。 \n これらの収入は、原告の法人税、甲の所得税のいずれにおいても申告されていない。 \n (3) 青色申告承認の取消処分及び更正処分ア 名護税務署長は、法人税法１２７条１項４号の規定に基づき、平成１８年３月２７日付けで、原告の平成１７年６月期事業年度以後の法人税の青色申告承認の取消処分をした。 \n イ 名護税務署長は、原告が帳簿書類に取引の一部を隠ぺいし又は仮装して記載し又は記録し、 \n その他その記載又は記録した事項の全体について、以下のとおり、その真実性を疑うに足りる相当の理由があるとして、法人税法１２７条１項３号の規定に基づき、平成１８年５月３ \n ０日付けで、原告の平成１３年６月期事業年度以降の法人税の青色申告承認の取消処分（本件青色申告承認取消処分）をした。 \n (ア) 平成１３年６月期事業年度において、Ｂ組合に対する森林伐採工事等の売上金額８７ \n ７７万５２６０円（税抜き）を総勘定元帳の売上科目に計上せず、小切手等で取り立てていること。 \n (イ) 原告の定款２条（目的）には、土木工事業、林業及び木材伐出請負業が記載されていること。 \n (ウ) 平成１３年６月期事業年度に行われた森林伐採工事等については、当該事業年度以降においても、Ｂ組合との間で同様の工事を長年にわたって反復継続して請け負っているほか、その工事の一部については、原告名義で注文請書を交わしていること。 \n (エ) Ｂ組合に対する売上に係る経費の一部（燃料費などの付随費用）については、原告の経費として計上していると申し述べていること。 \n (オ) 平成１１年６月期までの事業年度以降において、Ｂ組合に対する森林伐採工事等の売上及び当該工事に対する人件費（雑給）に関する書類のほとんどが保存されていないこと。 \n （乙１６） \n ウ 名護税務署長は、平成１８年５月３０日付けで、別紙「更正処分等一覧」番号１ないし７の「更正処分」欄記載のとおり、平成１１年６月期ないし平成１７年６月期の各事業年度に係る法人税の更正処分及び重加算税賦課決定処分（これらを併せて「法人税更正処分等」という。）並びに別紙「更正処分等一覧」番号８ないし１２の「更正処分」欄記載のとおり、 \n 平成１３年６月期ないし平成１７年６月期の各課税期間の消費税等に対する更正処分及び重加算税賦課決定処分（これらを併せて「消費税等更正処分等」という。）をした。 \n （乙１７ないし２８） \n (4) 異議申立てア 原告は、前記(3)イ及びウの各処分を不服として、平成１８年７月２７日付けで、名護税務署長に対し、異議申立てをした。 \n イ 名護税務署長は、同年１０月２５日付けで、原告の上記異議申立てをいずれも棄却する異議決定をした。 \n (5) 審査請求ア 原告は、前記(4)イの異議決定を経た後の各処分を不服として、平成１８年１１月２４日付けで、国税不服審判所長に対し、審査請求をした。 \n イ 国税不服審判所長は、平成２０年３月３１日付けで、別紙「更正処分等一覧」の「裁決」 \n 欄記載のとおり、平成１１年６月期の事業年度の法人税の更正処分及び平成１４年６月期の事業年度の法人税更正処分等の全部を取り消すとともに、平成１５年６月期ないし平成１７年６月期の各事業年度の法人税更正処分等並びに平成１４年６月期及び平成１６年６月期の各課税期間の消費税等更正処分等の一部を取り消し（現金主義に基づいて計算した売上金額の一部について実現主義に基づいて再計算し、新たに提出された資料に基づいて給与その他の経費を認定したことによる。）、また、その他の原処分に対する審査請求をいずれも棄却する裁決（以下「本件裁決」という。）をした。 \n （甲１） \n (6) 納付すべき税及び重加算税の額本件森林売上、本件原木売上及び本件自動販売機手数料が原告に帰属する場合、原告の納付すべき法人税の額、同重加算税の額、納付すべき消費税及び地方消費税の額並びに同重加算税の額、また、その算定根拠は、別紙「納付すべき税及び重加算税の額一覧」にそれぞれ記載のとおりである。 \n (7) 本訴の提起原告は、本件裁決を不服として、平成２０年９月１０日、本件各更正処分等及び本件青色申告承認取消処分の取消しを求める本訴を提起した。 \n （当裁判所に顕著な事実） \n ２ 関連法令等の定め \n (1) 法人税法１２７条１項 \n １２１条第１項（青色申告）の承認を受けた内国法人につき次の各号のいずれかに該当する事実がある場合には、納税地の所轄税務署長は、当該各号に定める事業年度までさかのぼって、 \n その承認を取り消すことができる。この場合において、その取消しがあったときは、当該事業年度開始の日以後その内国法人が提出したその承認に係る青色申告書（納付すべき義務が同日前に成立した法人税に係るものを除く。）は、青色申告書以外の申告書とみなす。 \n 一、二（略） \n 三 その事業年度に係る帳簿書類に取引の全部又は一部を隠ぺいし又は仮装して記載し又は記録し、その他その記載又は記録をした事項の全体についてその真実性を疑うに足りる相当の理由があること。 当該事業年度四 ７４条１項（確定申告）の規定による申告書をその提出期限までに提出しなかったこと当該申告書に係る事業年度五（略） \n (2) 国税通則法６８条１項 \n ６５条１項（過少申告加算税）の規定に該当する場合（同条５項の規定の適用がある場合を除く。）において、納税者がその国税の課税標準等又は税額等の計算の基礎となるべき事実の全部又は一部を隠ぺいし、又は仮装し、その隠ぺいし、又は仮装したところに基づき納税申告書を提出していたときは、当該納税者に対し、政令で定めるところにより、過少申告加算税の額の計算の基礎となるべき税額（その税額の計算の基礎となるべき事実で隠ぺいし、又は仮装されていないものに基づくことが明らかであるものがあるときは、当該隠ぺいし、又は仮装されていない事実に基づく税額として政令で定めるところにより計算した金額を控除した税額） \n に係る過少申告加算税に代え、当該基礎となるべき税額に１００分の３５の割合を乗じて計算した金額に相当する重加算税を課する。 \n (3) 国税庁長官が定めた「法人税の重加算税の取扱いについて（事務運営指針）（平成１２年７月３日課所２－８外）」（乙３３。以下「法人税事務運営指針」という。）は、国税通則法６８条１項又は２項の規定の適用に関する取扱いの内容を下記のとおり定めている。 \n 記 \n （隠ぺい又は仮装に該当する場合） \n 第１－１ 通則法第６８条第１項又は第２項に規定する「国税の課税標準等又は税額等の計算の基礎となるべき事実の全部又は一部を隠ぺいし、又は仮装し」とは、例えば、次に掲げるような事実（以下「不正事実」という。）がある場合をいう。 \n (1) いわゆる二重帳簿を作成していること。 \n (2) 次に掲げる事実（以下「帳簿書類の隠匿、虚偽記載等」という。）があること。 \n ① 帳簿、原始記録、証ひょう書類、貸借対照表、損益計算書、勘定科目内訳明細書、 \n 棚卸表その他決算に関係のある書類（以下「帳簿書類」という。）を、破棄又は隠匿していること \n ② 帳簿書類の改ざん（偽造及び変造を含む。以下同じ。）、帳簿書類への偽造記載、相手方との通謀による虚偽の証ひょう書類の作成、帳簿書類の意図的な集計違算その他の方法により仮装の経理を行っていること \n ③ 帳簿書類の作成又は帳簿書類への記録をせず、売上げその他の収入（営業外の収入を含む。）の脱ろう又は棚卸資産の除外をしていること \n (3)ないし(6) （略） \n (4) 国税庁長官が定めた「消費税及び地方消費税の更正等及び加算税の取扱いについて（事務運営指針）（平成１２年７月３日課消２－１７外）」（乙３３。以下「消費税事務運営指針」という。）は、国税通則法６８条１項又は２項の規定の適用に関する取扱いの内容を下記のとおり定めている。 \n 記第２－Ⅳ 重加算税の取扱い \n １ （略） \n （所得税等に不正事実がある場合） \n ２ 所得税又は法人税（以下「所得税等」という。）につき不正事実があり、所得税等について重加算税を賦課する場合には、当該不正事実が影響する消費税の不正事実に係る増差税額については重加算税を課する。 \n ３ないし５ （略） \n ３ 争点本件の争点は、①本件各更正処分等の適法性、すなわち本件森林売上、本件原木売上及び本件自動販売機手数料が原告に帰属するものであるか否か、また、重加算税の賦課に関する国税通則法６８条１項に該当する事実の有無、②本件青色申告承認取消処分の適法性を基礎付ける法人税法１２７条１項３号に該当する事実の有無であり、争点に関する当事者の主張は、以下のとおりである。 \n (1) 本件各更正処分等の適法性 \n （被告の主張） \n ア 本件森林事業は、Ｂ組合を注文者、原告を請負人として締結された請負契約に基づく事業であり、同事業により生じた本件森林売上及び本件原木売上並びに本件自動販売機手数料の各所得は、いずれも原告に帰属するものである。これらを売上計上漏れとして申告所得金額に加算し、これらに対応する給与等の経費を減算するなどして計算すると、平成１２年６月期、平成１３年６月期、平成１５年６月期、平成１６年６月期及び平成１７年６月期の各事業年度に係る所得金額、納付すべき法人税及び重加算税の額並びに平成１３年６月期ないし平成１７年６月期の各課税期間に係る課税標準額、納付すべき消費税等及び重加算税は、別紙「納付すべき税及び重加算税の額一覧」の計算及び金額となる。したがって、その範囲内でなされた本件各更正処分等は適法である。 \n 本件森林売上、本件原木売上及び本件自動販売機手数料に係る所得が、原告に帰属すると判断すべき根拠は、次のとおりである。 \n (ア) 本件森林事業に係る収入 \n ａ 本件森林事業に係る契約の法的性質と当事者原告は、Ｂ組合から個々の受注をするに当たって、自らの名義による注文請書を作成し、給与の支払であれば加算されるはずのない消費税を加算していた。また、Ｂ組合は、 \n 少なくとも１０年前から本件森林事業の対価の額が請負の対価の額であること及び消費税額が含まれていることについて各班長に説明し、税理士を紹介して税務申告をするよう指導しており、甲以外の各班長は事業所得という認識で所得税の申告をしていた。 \n したがって、本件森林事業に係る契約は、Ｂ組合を注文者、原告を請負人として締結された請負契約である。 \n ｂ 原告の目的及び設立経緯本件森林事業は、原告の定款上の事業目的である「林業及び木材伐出請負業」及び「前各号に附帯する一切の事業」に含まれている。また、甲は、本件森林事業について、原告が設立される以前は甲の所得として所得税の確定申告をしていたことがあったものの、原告が設立された平成１１年以降は甲の所得としても所得税の確定申告をしていない。 \n したがって、甲は、それまでに個人で請け負っていた本件森林事業を請け負うために原告を設立して、その代表取締役に就任し、原告に本件森林事業を引き継いだものと推認すべきである。 \n ｃ 原告の従業員と甲班の班員との関係原告の従業員と、甲が個人として森林事業を行っていた甲班の班員は、対内的にも、 \n 対外的にも、明確な区別がされておらず、甲班は、原告の一部門だったと見るのが相当である。 \n ｄ 本件森林事業に係る経費原告の総勘定元帳における燃料費の記載には、土木工事等に係る燃料費と本件森林事業に係る燃料費が混在しており、本件森林事業に係る燃料費が原告で経理処理されていたといえる。そうすると、本件森林事業に伴う売上もまた原告に帰属すると考えるのが合理的である。 \n (イ) 原木の販売に係る収入原告は、Ｂ組合から請け負った伐採事業により伐採した原木の処分を任されており、伐採した原木をＤ組合及びＥ組合に販売していた。したがって、これによって発生した本件原木売上は、本件森林事業に付随して発生した収益であり、原告に帰属すべきものである。 \n (ウ) 自動販売機に係る手数料収入本件自動販売機手数料は、Ｆ株式会社（現、Ｈ株式会社）から甲名義の預金口座に入金されていた。しかし、原告が、その設立当時から当該自動販売機に係る電気料金を負担していたこと、甲が、国税不服審判所に対し、本件自動販売機手数料は原告の収入に計上すべきものであると述べていたことからすれば、本件自動販売機手数料は、原告に帰属すべきものである。 \n イ 原告は、別紙「納付すべき税及び重加算税の額一覧」のそれぞれの事業年度に係る「本件森林売上」、「本件原木売上」及び「本件自動販売機手数料」の「金額等」の欄に対応する売上が、原告に帰属するものであるにもかかわらず、原告の帳簿書類に記録せず、当該帳簿書類に基づいて、別紙「更正処分等一覧」番号１ないし７（平成１１年６月期から平成１７年 \n ６月期までの各事業年度）の「確定申告」欄に記載のとおり、所得金額及び納付すべき税額を記載した確定申告書を提出した。 \n ウ 原告が上記イの行為をしたことは、国税通則法６８条１項に規定する事由に該当する。 \n （原告の主張） \n 本件森林事業により生じた本件森林売上に係る所得は、原告ではなく、甲個人に帰属するものである。したがって、これを原告に帰属するものとしてなされた本件各更正処分等及び本件青色申告承認取消処分にはいずれも取り消されるべき違法がある。 \n 本件森林売上、本件原木売上及び本件自動販売機手数料に係る所得が、甲に帰属すると判断すべき根拠は、次のとおりである。 \n ア 本件森林事業に係る契約の性質と当事者本件森林事業は、原告ではなく、甲の個人事業である甲班によるものであるから、本件森林売上に係る所得は甲に帰属するものであり、原告に帰属するものとはいえない。 \n すなわち、甲班の班員は、本件森林事業の現場に派遣されたＢ組合の主任である乙（以下 \n 「乙」という。）の指揮監督に基づいて作業をしていた。作業の対価は、各作業員についてそれぞれ金額が定められており、甲は、同金額から諸経費及び利益を控除して、甲班の班員に賃金を支払っていた。したがって、本件森林事業に係る契約の実態は、甲が作業員を手配し、甲班として、労務をまとめて提供し、乙が同作業員を指揮して事業を行わせるものであり、雇用契約と派遣労務契約の合体した一種の無名契約と評価すべきものである。 \n Ｂ組合は、課税の問題が生じた後、各班長に対して、事業の対価を請負代金として申告するよう指導していたことがあるが、それ以前は、労働賃金の名目で長年対価を支払っていた。 \n 本件森林事業に係る契約は、発注段階では契約書が作成されず、支払額は事業終了後に、Ｂ組合において一方的に作業の対価を算定をしていたものであり、いわゆる請負とは異なる実態を有するものであった。 \n イ 原告の目的及び設立経緯甲は、甲班としてＢ組合から受託した業務がないときに業務を確保して収益をあげるために原告を設立したものであり、原告の事業目的に「林業及び木材伐出請負業」が含まれているが、そのことは、原告も同事業を行っていたからにすぎない。したがって、甲班の事業と原告の事業は別個のものであって、これを同一のものであると解することはできない。 \n ウ 原告従業員と甲班の班員との関係原告の従業員と甲班の班員との間に同一性はなく、原告と甲は、これらを混同して扱っていたことはなかった。 \n エ 本件森林事業に係る経費原告と甲班の燃料費が、混在して原告の経費として処理されていたことはあったが、甲班の班員は、個人名義では給油の買掛ができなかったことから、原告名義で給油の買掛を行っていたにすぎない。また、甲班が本件森林事業の燃料費を原告の経費として計上したことはない。 \n (2) 本件青色申告承認取消処分の適法性 \n （被告の主張） \n 原告は、平成１３年６月期事業年度について、本件森林売上、本件原木売上及び本件自動販売機手数料が、原告に帰属する収益であるにもかかわらず、原告の帳簿書類への記録をせず、 \n 売上その他の収入の脱ろうをし、かかる帳簿書類に基づいて確定申告をした。 \n したがって、原告には、帳簿書類に取引の一部を隠ぺいし又は仮装して記載し又は記録し、 \n その他その記載又は記録をした事項の全体について、その真実性を疑うに足りる相当の理由があり、法人税法１２７条１項３号に該当する事由があるから、本件青色申告承認取消処分は適法である。 \n （原告の主張） \n 被告の主張事実は否認し、法的主張は争う。(1)で主張したとおり、本件森林売上、本件原木売上及び本件自動販売機手数料は、いずれも原告に帰属する所得ではなく、甲に帰属する所得であり、原告の所得と甲の所得は、区別されて申告されていたから、法人税法１２７条１項 \n ３号に規定する「その事業年度に係る帳簿書類に取引の全部又は一部を隠ぺいし又は仮装して記載し又は記録し、その他その記載又は記録をした事項の全体についてその真実性を疑うに足りる相当の理由があること」に該当する事由はない。 \n また、被告は、本件青色申告承認取消処分に関する主張をする十分な期間を有し、早急な審理の終結も求めていたものであるにもかかわらず、本件訴え提起後、２年以上が経過してから終結した口頭弁論の再開を申し立てて、本件青色申告承認取消処分の適法性を主張したものであるから、時機に後れた攻撃防御方法であって却下を免れない。 \n \n \n 第３ 当裁判所の判断 \n １ 本件各更正処分等の適法性の有無 \n (1) 後掲各証拠及び前記前提事実等を総合すると、本件更正処分等がされた経緯について、以下の事実が認められる。 \n ア 甲は、平成２、３年ころから、個人事業として、甲班の名でＢ組合から受注した森林事業を行い、平成１４年１１月からは、自ら代表理事と務めるＣ組合を通じて同個人事業を行っていたところ、平成１１年２月２６日に原告を設立してからは、個人事業主と原告の代表取締役の立場を併有しながら、事業を行っていた。 \n イ 原告も甲も、平成１０年７月１日以降、労働者派遣事業の適正な運営の確保及び派遣労働者の就業条件の整備等に関する法律５条１項、１６条１項に基づく必要な許可申請又は届出をしたことがなかった。（乙５３） \n ウ Ｂ組合は、甲班を含む外注先の班の各班員との間で雇用契約を締結し、給与（労賃）を支払う体裁をとっていた。しかし、その理由は、原告が労災保険料の支払をするためには、雇用契約を締結した形式をとった上で、各班員の給与明細を明らかにする必要があったからにすぎなかった。そして、Ｂ組合は、外注費を算定するに当たり、甲班の各班員に対する給与を基礎としていたものではなく、Ｂ組合の職員と甲班の各班員との間には、業務上の指揮監督関係はなかった。（甲４、７、乙４６、４８） \n エ 甲は、自らの所得税の確定申告を平成９、１０年ころの２回くらいしか行ったことがなく、 \n 原告が設立された平成１１年以降は一切所得税の確定申告を行っておらず、個人事業として帳簿書類を作成したこともなかった。他方、甲は、平成１１年以降、原告からの役員報酬を受領し、自らの所得税は、源泉徴収によってのみ納付していた。（原告代表者） \n オ 名護税務署は、平成１７年１１月１７日、原告の本店において税務調査を行い、原告に対して事前に帳簿書類を準備するように要請していたにもかかわらず、総勘定元帳しか準備されていなかったことから、原告の本店事務室内を確認していたところ、背表紙に「労賃支払明細綴り 甲」と記載されたファイルを発見した。これによって、同ファイルの中に編てつされていた本件森林事業に係る「平成１５年度Ｂ組合伐採発注一覧表」に記載されていた事業に係る注文請書は、すべて原告名義で作成されていたことが明らかになった。そして、名護税務署のＢ組合に対する調査の結果、Ｂ組合で保存していた平成１２年４月以降の注文請書が、原告名義で作成されていることも明らかになった。Ｂ組合は、カーボン複写式の注文書と注文請書を使用していなかったため、表計算ソフトでそれぞれ作成した上、受注者に対し、空白にしていた注文請書の受注者欄を記入させ、その結果、原告が、自らを受注者と記載した。（乙１３、４５、４６、証人乙） \n カ 原告は、Ｂ組合に対し、Ｉ村に所在するＧダムの伐採清掃及び伐採木運搬の作業を受注した旨の平成１４年１月４日付け注文請書を提出し、給油業者から、同作業現場で用いたものを含む燃料費の請求書の送付を受けていた。同請求書に記載された燃料費は、原告の平成１ \n ４年６月期の総勘定元帳に反映された上、事業年度に係る確定申告においても、経費として計上されていた。（乙４、３８、３９の１及び２、４０） \n キ 名護税務署は、平成１８年２月１３日、本件森林事業に係る売上金額の把握に係る作業が終了したことから、甲に対し、①本件森林事業に係る売上が存在すること、②原告と甲のいずれも、同売上を申告していないこと、③本件森林事業に係る帳簿書類が保存されていないこと、以上の点に係る事実関係を確認した。その結果、甲は、名護税務署長宛に、Ｂ組合に関する売上を、原告とＣ組合の申告から除いていたこと、燃料費などの付随費用については、 \n 原告の経費として計上したこと、売上と除外した資金については、甲が個人的な費用や蓄財として使い込んだり、労務賃等の経費に充てた、として、不正経理を深く反省し、今後、正しく申告、納税することを誓う内容の申述書を提出した。（乙１４、４５） \n (2) 本件各更正処分等の適法性についてア 法人税の更正処分 \n (ア) 上記(1)の認定事実、とりわけ、原告が、平成１２年４月以降、原告を受注者とする \n Ｂ組合宛の注文請書を提出していたこと、原告も甲も、本件森林売上を帳簿書類に記録せず、税務調査によって、同注文請書の存在が明らかになったため、不正経理の事実を認める申述書を作成したこと、原告は、少なくとも平成１４年６月期事業年度においては、本件森林事業に含まれる業務の経費を原告の経費として帳簿書類に記録した上、法人税の確定申告をしていたものであり、経費に対応する収入があったことがうかがわれること、以上の事実関係に加えて、原告は、本訴において、本件森林売上が甲個人に帰属するものであると主張する一方、甲の売上を原告の売上から明確に区別することができるような帳簿書類は作成されていなかったこと、甲は、平成１２年６月期事業年度以降、自らの所得税の申告をしておらず、そのことについて合理的な説明がされていないことに照らせば、甲が原告を設立してからは、それまで甲班として行っていた事業を原告に移行させたものであって、本件森林事業は、Ｂ組合を発注者、原告を受注者とする請負契約に基づく事業であり、同事業によって発生した本件森林売上、本件森林事業により発生した原木を売却したことによって生じた本件原木売上及び原告が光熱費を支出している本件自動販売機手数料は、原告に帰属すると認められる。 \n (イ) 以上によれば、原告の納付すべき法人税の額及び算定根拠は、別紙「納付すべき税及び重加算税の額一覧」記載のとおりとなり、本件各更正処分のうち、その範囲内でなされた法人税の更正処分に係る部分は、適法に行われたということができる。 \n イ 消費税等の更正処分 \n Ｂ組合に係る売上は、森林伐採等の役務の提供に対する対価であり、消費税法２条１項８号の資産の譲渡等に該当するものであるから、原告が上記役務の提供の主体であると判断すべきものである以上、原告の納付すべき消費税等の額及び算定根拠は、別紙「納付すべき税及び重加算税の額一覧」記載のとおりとなり、本件各更正処分のうち、その範囲内でなされた消費税等の更正処分に係る部分は、適法に行われたということができる。 \n ウ 重加算税の賦課処分上記認定のとおり、原告は、別紙「納付すべき税及び重加算税の額一覧」のそれぞれの事業年度に係る「本件森林売上」、「本件原木売上」及び「本件自動販売機手数料」の「金額等」 \n の欄に対応する売上が、原告に帰属するものであるにもかかわらず、原告の帳簿書類に記録しなかったものであり、さらに、当該帳簿書類に基づいて、別紙「更正処分等一覧」記載１ないし７（平成１１年６月期から平成１７年６月期までの各事業年度）の「確定申告」欄に記載のとおり、所得金額及び納付すべき税額を記載した確定申告書を提出したものであるから、国税通則法６８条１項の定めるところにより、同別紙の「重加算税の額」欄に記載のとおりに行った重加算税の賦課処分は、適法に行われたということができる。 \n エ 以上のとおりであるから、平成１２年６月期、平成１３年６月期、平成１５年６月期、平成１６年６月期及び平成１７年６月期の各事業年度に係る所得金額、納付すべき法人税及び重加算税の額並びに平成１３年６月期ないし平成１７年６月期の各課税期間に係る課税標準額、納付すべき消費税等及び重加算税は、別紙「納付すべき税及び重加算税の額一覧」の計算及び金額となり、本件各更正処分等を下回る部分はなく、本件各更正処分等は適法ということができる。 \n (3) 次に、原告の主張立証のうち、上記認定判断に反するものについて検討する。 \n ア 本件森林売上に関して、Ｂ組合が甲班の班員に対して労賃を支払う形式がとられていたことは前記認定のとおりであるが、そのことは、原告が労災保険料の支払をするために行われた便宜的なものであって、Ｂ組合の外注費と労賃が連動していたものではなく、Ｂ組合と甲班の班員との間に雇用の実質を有するような指揮監督関係はなく、Ｂ組合が甲班の班員のために所得税の源泉徴収をしていたことも証拠上うかがわれないことからすれば、Ｂ組合と甲班の班員との間に雇用関係があったとか、本件森林売上が、甲班の班員に帰属していたということはできない。 \n イ 原告は、原告従業員と甲班の班員との間には同一性がなく、出勤簿や給与明細に現場名が記載されており、別個に給与計算を行っているから、両者は混同されていないことを主張する。 \n しかし、原告従業員及び甲班の班員の構成については、原告代表者かつ甲班の班長である甲が把握しているはずであるにもかかわらず、本訴提起時点から見ても変遷しており、また、 \n 客観的な裏付けもないから、この点に関する原告の主張は採用することができない。また、 \n 原告が、原告の従業員について、勤務した現場ごとに給与を算定したかのような記載のある出勤簿が存在しているが（乙３５）、同証拠によっても、各現場が原告又は甲班の事業であると明示されているものではなく、これをもって、経理上、原告従業員としての給与と甲班の班員としての給与が別個に計算されていたと認めることはできない。 \n ウ 甲は、Ｂ組合からの注文書及び注文請書が原告を受注者として作成されている理由について、乙から、受注者を原告名義にしてくれた方が助かるといわれたため、年度末にまとめて原告名義として作成したものであり、上記注文書及び注文請書は実体を反映していないという趣旨の供述をする。しかし、Ｂ組合が、注文書及び注文請書を原告名義とすることによって、何らかの利益を享受したり不利益を回避することができるとは考え難いし、注文書及び注文請書は、受注者の所得を反映するものであるから、受注者の名義をだれにするかは、専ら受注者の利害にかかわるものであって、原告が、Ｂ組合の要請があったからといって、実体を反映しない注文書及び注文請書を作成することを、自らの利害を離れて容認するとはおよそ考え難い。したがって、乙から受注者を原告名義とするよう指示されたという甲の供述は採用することができない。 \n エ 原告は、原告を受注者とする注文書及び注文請書は、事後的に作成されたものであって、 \n 顕出されている甲の印影もいわゆる三文判によるものであるから、その記載内容は、契約の実体を反映したものではないという趣旨の証拠を提出する（甲７ないし１０、１２）。しかし、原告を受注者とする注文書及び注文請書が作成されている取引については、別途、契約の実体を反映するような書面の存在はうかがわれないから、原告は、注文書及び注文請書によって個々の契約を管理していたと解するのが合理的であり、その記載内容が、契約の実体を反映していないものであるということはできない。 \n オ 原告は、背表紙に「労賃支払明細綴り 甲」と記載されたファイル（乙１３）には、原告が行った土木工事に係る注文請書とともに本件森林事業に係る注文請書が編てつされていたものではないと主張する。しかし、本件森林事業に係る原告を受注者とする注文請書が、 \n 原告又は甲の税務申告において提出されたことはなく、税務調査によって同ファイルの存在が発覚したものであり、これによって甲が不正経理を認める申述書（乙１４）を提出したものであることからすれば、原告の上記主張は採用することができない。 \n また、原告は、上記申述書も、気が動転している中で、担当者に指示されるまま、ひな形のとおり作成したにすぎないという趣旨の供述をするが、同供述によっても、上記申述書の記載が真実に反するものであると直ちに認めることはできない。 \n カ 原告は、Ｂ組合と甲が、雇用契約と派遣労務契約の合体した一種の無名契約を締結したと主張する。 \n しかし、証拠（乙２９、３１）によれば、原告は、本件の異議申立て及び審査請求において、Ｂ組合と甲及び甲班の班員との間で個別に雇用契約が締結されていた旨の主張をしていたことが認められ、主張内容に一貫性がみられない。 \n さらに、注文請書において消費税額が計上されていること、甲が、労働者派遣事業の適正な運営の確保及び派遣労働者の就業条件の整備等に関する法律５条１項、１６条１項に基づくに必要な許可申請又は届出をしていないこと、Ｂ組合と甲班の班員との間の指揮監督関係もなかったことからすれば、本件森林事業に関し、Ｂ組合と甲との間に、雇用契約、労働者派遣契約又はこれらの混合契約が成立していたと評価することはできず、原告の上記主張は採用することができない。 \n キ 原告は、原告と甲班の燃料費が、混在して原告の経費として処理されていたことはあったが、甲班の班員は、個人名義では燃料費の買掛ができなかったことから、原告名義で燃料費の買掛を行っていたと主張する。しかし、そのような主張を前提とすると、原告が設立される前には、いかなる名義で燃料費の買掛をしていたのかが説明できないし、甲の個人事業に関する燃料費であれば、甲班の班員は、甲名義で買掛をすべきであったとも考えられるが、 \n 原告がこの点について何ら言及していないこと、そもそも、甲班の事業に関する帳簿記録は存在せず、その収支内容が明らかになっているものではないことからすれば、原告の上記主張は採用することができない。 \n ク 原告は、本件原木売上が、本件森林事業によるものではなく、他の業者からの受託によって行った森林事業によって取得した原木を原告が売却したことによるものであるなどとも主張するが、仮に原告の主張するとおりであったとしても、本件原木売上が原告に帰属する売上であることに変わりはないから、原告の上記主張は採用することができない。 \n ケ 以上のとおりであり、当裁判所の認定判断に反する原告の主張立証は、いずれも採用することができない。 \n ２ 本件青色申告承認取消処分の適法性 \n (1) 国税通則法６８条１項所定の重加算税の賦課要件である隠ぺい、仮装と、法人税法１２７条１項３号所定の青色申告の承認の取消要件としての隠ぺい、仮装は、各規定の文言・趣旨等に照らし、同義であると解するのが相当である。 \n したがって、原告の平成１３年６月期の事業年度の法人税の申告につき、国税通則法６８条 \n １項所定の重加算税の賦課要件に該当する行為があれば、法人税法１２７条１項３号所定の青色申告の承認の取消要件に該当し、本件青色申告承認取消処分は理由があることになる。 \n (2) 前記認定のとおり、原告は、平成１３年６月期の事業年度について、本件森林売上、本件原木売上及び本件自動販売機手数料が、原告に帰属する収益であるにもかかわらず、原告の帳簿書類への記録をしていなかったものであるから、売上その他の収入の脱ろうをし、かかる帳簿書類に基づいて確定申告をしたものといわざるを得ない（なお、本件青色申告承認取消処分の理由となっていない平成１２年、平成１６年及び平成１７年の各６月期の事業年度についても同様である。）。 \n したがって、原告には、帳簿書類に取引の一部を隠ぺいし又は仮装して記載し又は記録し、 \n その他その記録又は記録をした事項の全体について、その真実性を疑うに足りる相当の理由があり、法人税法１２７条１項３号に該当する事由があるから、本件青色申告承認取消処分は適法である。 \n (3) なお、原告は、被告の本件青色申告承認取消処分の適法性を基礎付ける事実に関する主張は、時機に後れた攻撃防御方法であると主張して却下を求めている。 \n この点、記録によれば、当裁判所が平成２２年９月３日に口頭弁論を終結して判決言渡期日を同年１１月１７日に指定したが、被告が、同月８日、口頭弁論再開申立書を提出するとともに、本件青色申告承認取消処分の適法性を基礎付ける事実に関する主張を記載した準備書面を提出したことは、当裁判所に顕著である。しかし、同準備書面における被告の主張は、要するに、被告は、従前から、重加算税賦課処分の適法性を基礎付ける事実の主張をしていたものであるところ、同事実は、青色申告承認取消処分の適法性を基礎付ける事実にも該当するということを補充的に主張したものであって、被告の従前の主張や平成１８年５月３０日付け「青色申告の承認の取消通知書」に記載されている「取消処分の基因となった事実」（乙１６）との関係で、従前、主張を一義的に解釈しにくかった部分を、明確化したものにとどまるということができる。そして、青色申告承認取消処分の適法性を基礎付ける事実の有無を判断するに当たって、新たな争点整理や証拠調べを必要とするものではないから、被告の上記主張が、時機に後れた攻撃防御方法であるということまではできない。 \n ３ 結論よって、本訴請求は理由がないからこれをいずれも棄却し、訴訟費用の負担につき行政事件訴訟法７条、民事訴訟法６１条を適用して、主文のとおり判決する。 \n 那覇地方裁判所民事第１部裁判長裁判官 酒井 良介裁判官 新海 寿加子裁判官 横倉 雄一郎別紙 更正処分等一覧番号 区分 確定申告 更正処分 異議申立 異議決定 審査請求 裁決平成１１年２月２６年 月 日 H12.4.26 H18.5.30 H18.7.27 H18.10.25 H18.11.24 H20.3.31日から平成１１年６所 得 金 額 \\-1,745,526 \\-1,617,017月３０日までの事業納付すべき税額 0 0 全部取消 棄却 全部取消 全部取消年度の法人税 重 加 算 税平成１１年７月１日年 月 日 H12.9.18 H18.5.30 H18.7.27 H18.10.25 H18.11.24 H20.3.31から平成１２年６月所 得 金 額 \\556,055 \\17,733,209 \n ３０日までの事業年納付すべき税額 \\122,200 \\4,679,800 全部取消 棄却 全部取消 棄却度の法人税 重 加 算 税 \\1,820,000平成１２年７月１日年 月 日 期限内 H18.5.30 H18.7.27 H18.10.25 H18.11.24 H20.3.31から平成１３年６月所 得 金 額 \\1,357,563 \\18,655,184 \n ３０日までの事業年納付すべき税額 \\297,900 \\4,955,800 全部取消 棄却 全部取消 棄却度の法人税 重 加 算 税 \\1,627,500平成１３年７月１日年 月 日 期限内 H18.5.30 H18.7.27 H18.10.25 H18.11.24 H20.3.31から平成１４年６月所 得 金 額 \\2,422,217 \\22,683,412 \n ３０日までの事業年納付すべき税額 \\532,600 \\6,164,700 全部取消 棄却 全部取消 全部取消度の法人税 重 加 算 税 \\1,970,500平成１４年７月１日年 月 日 期限内 H18.5.30 H18.7.27 H18.10.25 H18.11.24 H20.3.31から平成１５年６月所 得 金 額 \\1,541,342 \\42,130,839 \\21,841,177 \n ３０日までの事業年納付すべき税額 \\338,900 \\11,998,900 全部取消 棄却 全部取消 \\5,912,200度の法人税 重 加 算 税 \\4,081,000 \\1,949,500平成１５年７月１日年 月 日 H16.9.9 H18.5.30 H18.7.27 H18.10.25 H18.11.24 H20.3.31から平成１６年６月所 得 金 額 \\816,244 \\10,825,175 \\1,165,416 \n ３０日までの事業年納付すべき税額 \\179,400 \\2,607,400 全部取消 棄却 全部取消 \\256,200度の法人税 重 加 算 税 \\968,000 \\28,000平成１６年７月１日年 月 日 H17.9.27 H18.5.30 H18.7.27 H18.10.25 H18.11.24 H20.3.31から平成１７年６月所 得 金 額 \\346,151 \\13,341,752 \\5,648,275 \n ３０日までの事業年納付すべき税額 \\76,100 \\3,362,200 全部取消 棄却 全部取消 \\1,242,500度の法人税 重 加 算 税 \\1,312,000 \\464,000年 月 日 期限内 H18.5.30 H18.7.27 H18.10.25 H18.11.24 H20.3.31平成１２年７月１日課 税 標 準 額 \\271,246,000 \\359,021,000から平成１３年６月控 除 税 額 \\9,695,177 \\9,695,177 \n ８ ３０日までの課税期納付すべき税額 \\1,443,200 \\5,832,000全部取消 棄却 全部取消 棄却間の消費税及び地方 うち消費税 \\1,154,600 \\4,665,600消費税 うち地方消費税 \\288,600 \\1,166,400重 加 算 税 の 額 \\1,533,000年 月 日 期限内 H18.5.30 H18.7.27 H18.10.25 H18.11.24 H20.3.31平成１３年７月１日課 税 標 準 額 \\206,560,000 \\312,868,000 \\304,306,000から平成１４年６月控 除 税 額 \\6,885,486 \\6,885,486 \\6,885,486 \n ９ ３０日までの課税期納付すべき税額 \\1,721,100 \\7,036,500 \\6,608,300全部取消 棄却 全部取消間の消費税及び地方 うち消費税 \\1,376,900 \\5,629,200 \\5,286,700消費税 うち地方消費税 \\344,200 \\1,407,300 \\1,321,600重 加 算 税 の 額 \\1,858,500 \\1,708,000年 月 日 期限内 H18.5.30 H18.7.27 H18.10.25 H18.11.24 H20.3.31平成１４年７月１日課 税 標 準 額 \\245,782,000 \\333,695,000から平成１５年６月控 除 税 額 \\7,206,832 \\7,206,832 \n 10 ３０日までの課税期納付すべき税額 \\3,280,500 \\7,676,100全部取消 棄却 全部取消 棄却間の消費税及び地方 うち消費税 \\2,624,400 \\6,140,900消費税 うち地方消費税 \\656,100 \\1,535,200重 加 算 税 の 額 \\1,536,500年 月 日 H16.9.9 H18.5.30 H18.7.27 H18.10.25 H18.11.24 H20.3.31平成１５年７月１日課 税 標 準 額 \\244,236,000 \\300,874,000 \\298,532,000から平成１６年６月控 除 税 額 \\7,055,740 \\7,104,303 \\7,055,740 \n 11 ３０日までの課税期納付すべき税額 \\3,392,100 \\6,163,200 \\6,106,800全部取消 棄却 全部取消間の消費税及び地方 うち消費税 \\2,713,700 \\4,930,600 \\4,885,500消費税 うち地方消費税 \\678,400 \\1,232,600 \\1,221,300重 加 算 税 の 額 \\1,108,000 \\1,084,000年 月 日 H17.9.27 H18.5.30 H18.7.27 H18.10.25 H18.11.24 H20.3.31平成１６年７月１日課 税 標 準 額 \\257,920,000 \\288,890,000から平成１７年６月控 除 税 額 \\7,405,216 \\7,438,410 \n 12 ３０日までの課税期納付すべき税額 \\3,639,300 \\5,146,300全部取消 棄却 全部取消 棄却間の消費税及び地方 うち消費税 \\2,911,500 \\4,117,100消費税 うち地方消費税 \\727,800 \\1,029,200重 加 算 税 の 額 \\600,000別紙 納付すべき税及び重加算税の額一覧番号 区分 金額等年 月 日 H12.9.18 \n ① 所 得 金 額 （ ( ア ) ＋ ( イ ) － ( ウ ) － ( エ ) － ( オ ) ） \\53,298,818 \n (ア) 申 告 所 得 金 額 \\556,055 \n (イ) 売 上 計 上 漏 れ \\99,115,619本 件 森 林 売 上 \\85,744,347本 件 原 木 売 上 \\13,329,280平成１１年７月１日から平成 本 件 自 動 販 売 機 手 数 料 \\41,992 \n ２ １２年６月３０日までの事業 (ウ) 給 与 計 上 漏 れ \\41,512,000年度の法人税 (エ) 経 費 計 上 漏 れ \\4,824,222 \n (オ) 寄 附 金 の 損 金 不 算 入 額 過 大 \\36,634 \n ② 法 人 税 の 額 \\15,349,400 \n ③ 所 得 税 額 の 控 除 額 \\98 \n ④ 納 付 す べ き 法 人 税 の 額 \\15,349,300 \n ⑤ 重 加 算 税 の 基 礎 と な る 税 額 \\15,220,000 \n ⑥ 重 加 算 税 の 額 \\6,088,000年 月 日 期限内 \n ① 所得金額（(ア)＋(イ)＋(ウ)－(エ)－(オ)－(カ)－(キ)） \\24,408,408 \n (ア) 申 告 所 得 金 額 \\1,357,563 \n (イ) 売 上 計 上 漏 れ \\92,935,447本 件 森 林 売 上 \\92,800,482本 件 原 木 売 上 \\92,885本 件 自 動 販 売 機 手 数 料 \\42,080平成１２年７月１日から平成 (ウ) 損 金 不 算 入 額 \\5,640 \n ３ １３年６月３０日までの事業 (エ) 給 与 計 上 漏 れ \\63,877,847年度の法人税 (オ) 経 費 計 上 漏 れ \\1,199,570 \n (カ) 事 業 税 の 損 金 算 入 額 \\4,812,800 \n (キ) 雑 損 失 の 損 金 算 入 \\25 \n ② 法 人 税 の 額 \\6,682,400 \n ③ 所 得 税 額 の 控 除 額 \\627 \n ④ 納 付 す べ き 法 人 税 の 額 \\6,681,700 \n ⑤ 重 加 算 税 の 基 礎 と な る 税 額 \\6,380,000 \n ⑥ 重 加 算 税 の 額 \\2,233,000年 月 日 期限内 \n ① 所得金額（(ア)＋(イ)＋(ウ)＋(エ)－(オ)－(カ)－(キ)） \\21,841,177 \n (ア) 申 告 所 得 金 額 \\1,541,342 \n (イ) 売 上 計 上 漏 れ \\92,246,759本 件 森 林 売 上 \\91,818,638本 件 原 木 売 上 \\380,952本 件 自 動 販 売 機 手 数 料 \\47,169平成１４年７月１日から平成 (ウ) 交 際 費 の 損 金 不 算 入 額 \\18,390 \n ５ １５年６月３０日までの事業 (エ) 雑 収 入 の 益 金 算 入 \\41年度の法人税 (オ) 給 与 計 上 漏 れ \\64,800,750 \n (カ) 経 費 計 上 漏 れ \\6,991,077 \n (キ) 寄 附 金 の 損 金 不 算 入 額 過 大 \\173,528 \n ② 法 人 税 の 額 \\5,912,300 \n ③ 所 得 税 額 の 控 除 額 \\33 \n ④ 納 付 す べ き 法 人 税 の 額 \\5,912,200 \n ⑤ 重 加 算 税 の 基 礎 と な る 税 額 \\5,570,000 \n ⑥ 重 加 算 税 の 額 \\1,949,500年 月 日 H16.9.9 \n ① 所得金額（(ア)＋(イ)＋(ウ)＋(エ)－(オ)－(カ)－(キ)－(ク)） \\1,165,416 \n (ア) 申 告 所 得 金 額 \\816,244 \n (イ) 売 上 計 上 漏 れ \\54,295,863本 件 森 林 売 上 \\54,258,964本 件 原 木 売 上 \\0本 件 自 動 販 売 機 手 数 料 \\36,899 \n (ウ) 交 際 費 の 損 金 不 算 入 額 \\5,329平成１５年７月１日から平成 \n (エ) 雑 収 入 の 益 金 算 入 \\95 \n ６ １６年６月３０日までの事業 \n (オ) 給 与 計 上 漏 れ \\50,751,800年度の法人税 \n (カ) 経 費 計 上 漏 れ \\1,452,195 \n (キ) 事 業 税 の 損 金 算 入 額 \\1,743,700 \n (ク) 寄 附 金 の 損 金 不 算 入 額 過 大 \\4,420 \n ② 法 人 税 の 額 \\256,300 \n ③ 所 得 税 額 の 控 除 額 \\27 \n ④ 納 付 す べ き 法 人 税 の 額 \\256,200 \n ⑤ 重 加 算 税 の 基 礎 と な る 税 額 \\70,000 \n ⑥ 重 加 算 税 の 額 \\28,000番号 区分 金額等年 月 日 H17.9.27 \n ① 所得金額（(ア)＋(イ)＋(ウ)－(エ)－(オ)－(カ)－(キ)） \\5,648,275 \n (ア) 申 告 所 得 金 額 \\346,151 \n (イ) 売 上 計 上 漏 れ \\32,185,835本 件 森 林 売 上 \\32,143,670本 件 原 木 売 上 \\0本 件 自 動 販 売 機 手 数 料 \\42,165平成１６年７月１日から平成 (ウ) 交 際 費 の 損 金 不 算 入 額 \\5,225 \n ７ １７年６月３０日までの事業 (エ) 給 与 計 上 漏 れ \\25,942,574年度の法人税 (オ) 経 費 計 上 漏 れ \\928,856 \n (カ) 事 業 税 の 損 金 算 入 額 \\17,400 \n (キ) 雑 収 入 の 損 金 算 入 \\106 \n ② 法 人 税 の 額 \\1,242,560 \n ③ 所 得 税 額 の 控 除 額 \\10 \n ④ 納 付 す べ き 法 人 税 の 額 \\1,242,500 \n ⑤ 重 加 算 税 の 基 礎 と な る 税 額 \\1,160,000 \n ⑥ 重 加 算 税 の 額 \\464,000年 月 日 期限内 \n ① 課税標準額（(ア)＋(イ)（１０００円未満切り捨て）） \\364,181,000 \n (ア) 申 告 に よ る 課 税 売 上 高 \\271,246,522 \n (イ) 売 上 計 上 漏 れ \\92,935,447本 件 森 林 売 上 \\92,800,482本 件 原 木 売 上 \\92,885本 件 自 動 販 売 機 手 数 料 \\42,080平成１２年７月１日から平成 \n ② 消 費 税 額 \\14,567,240 \n ８ １３年６月３０日までの課税 \n ③ 控 除 税 額 \\9,695,177期間の消費税及び地方消費税 \n ④ 納 付 す べ き 消 費 税 額 \\4,872,000 \n ⑤ 地 方 消 費 税 の 課 税 標 準 と な る 消 費 税 額 \\4,872,000 \n ⑥ 納 付 す べ き 譲 渡 割 額 \\1,218,000 \n ⑦ 納 付 す べ き 消 費 税 等 の 合 計 税 額 \\6,090,000 \n ⑧ 差 引 納 付 す べ き 消 費 税 等 の 合 計 税 額 \\4,646,800 \n ⑨ 重 加 算 税 の 基 礎 と な る 税 額 \\4,640,000 \n ⑩ 重 加 算 税 の 額 \\1,624,000年 月 日 期限内 \n ① 課税標準額（(ア)＋(イ)（１０００円未満切り捨て）） \\304,306,000 \n (ア) 申 告 に よ る 課 税 売 上 高 \\206,560,874 \n (イ) 売 上 計 上 漏 れ \\97,745,691本 件 森 林 売 上 \\97,621,129本 件 原 木 売 上 \\97,509本 件 自 動 販 売 機 手 数 料 \\27,053平成１３年７月１日から平成 \n ② 消 費 税 額 \\12,172,240 \n ９ １４年６月３０日までの課税 \n ③ 控 除 税 額 \\6,885,486期間の消費税及び地方消費税 \n ④ 納 付 す べ き 消 費 税 額 \\5,286,700 \n ⑤ 地 方 消 費 税 の 課 税 標 準 と な る 消 費 税 額 \\5,286,700 \n ⑥ 納 付 す べ き 譲 渡 割 額 \\1,321,600 \n ⑦ 納 付 す べ き 消 費 税 等 の 合 計 税 額 \\6,608,300 \n ⑧ 差 引 納 付 す べ き 消 費 税 等 の 合 計 税 額 \\4,887,200 \n ⑨ 重 加 算 税 の 基 礎 と な る 税 額 \\4,880,000 \n ⑩ 重 加 算 税 の 額 \\1,708,000年 月 日 期限内 \n ① 課税標準額（(ア)＋(イ)（１０００円未満切り捨て）） \\338,029,000 \n (ア) 申 告 に よ る 課 税 売 上 高 \\245,782,261 \n (イ) 売 上 計 上 漏 れ \\92,246,759本 件 森 林 売 上 \\91,818,638本 件 原 木 売 上 \\380,952本 件 自 動 販 売 機 手 数 料 \\47,169平成１４年７月１日から平成 \n ② 消 費 税 額 \\13,521,160 \n １０ １５年６月３０日までの課税 \n ③ 控 除 税 額 \\7,206,832期間の消費税及び地方消費税 \n ④ 納 付 す べ き 消 費 税 額 \\6,314,300 \n ⑤ 地 方 消 費 税 の 課 税 標 準 と な る 消 費 税 額 \\6,314,300 \n ⑥ 納 付 す べ き 譲 渡 割 額 \\1,578,500 \n ⑦ 納 付 す べ き 消 費 税 等 の 合 計 税 額 \\7,892,800 \n ⑧ 差 引 納 付 す べ き 消 費 税 等 の 合 計 税 額 \\4,612,300 \n ⑨ 重 加 算 税 の 基 礎 と な る 税 額 \\4,610,000 \n ⑩ 重 加 算 税 の 額 \\1,613,500番号 区分 金額等年 月 日 H16.9.9 \n ① 課税標準額（(ア)＋(イ)（１０００円未満切り捨て）） \\298,532,000 \n (ア) 申 告 に よ る 課 税 売 上 高 \\244,236,363 \n (イ) 売 上 計 上 漏 れ \\54,295,863本 件 森 林 売 上 \\54,258,964本 件 原 木 売 上 \\0本 件 自 動 販 売 機 手 数 料 \\36,899平成１５年７月１日から平成 \n ② 消 費 税 額 \\11,941,280 \n １１ １６年６月３０日までの課税 \n ③ 控 除 税 額 \\7,055,740期間の消費税及び地方消費税 \n ④ 納 付 す べ き 消 費 税 額 \\4,885,500 \n ⑤ 地 方 消 費 税 の 課 税 標 準 と な る 消 費 税 額 \\4,885,500 \n ⑥ 納 付 す べ き 譲 渡 割 額 \\1,221,300 \n ⑦ 納 付 す べ き 消 費 税 等 の 合 計 税 額 \\6,106,800 \n ⑧ 差 引 納 付 す べ き 消 費 税 等 の 合 計 税 額 \\2,714,700 \n ⑨ 重 加 算 税 の 基 礎 と な る 税 額 \\2,710,000 \n ⑩ 重 加 算 税 の 額 \\1,084,000年 月 日 H17.9.27 \n ① 課税標準額（(ア)＋(イ)（１０００円未満切り捨て）） \\290,106,000 \n (ア) 申 告 に よ る 課 税 売 上 高 \\257,920,232 \n (イ) 売 上 計 上 漏 れ \\32,185,835本 件 森 林 売 上 \\32,143,670本 件 原 木 売 上 \\0本 件 自 動 販 売 機 手 数 料 \\42,165平成１６年７月１日から平成 \n ② 消 費 税 額 \\11,604,240 \n １２ １７年６月３０日までの課税 \n ③ 控 除 税 額 \\7,405,216期間の消費税及び地方消費税 \n ④ 納 付 す べ き 消 費 税 額 \\4,199,000 \n ⑤ 地 方 消 費 税 の 課 税 標 準 と な る 消 費 税 額 \\4,199,000 \n ⑥ 納 付 す べ き 譲 渡 割 額 \\1,049,700 \n ⑦ 納 付 す べ き 消 費 税 等 の 合 計 税 額 \\5,248,700 \n ⑧ 差 引 納 付 す べ き 消 費 税 等 の 合 計 税 額 \\1,609,400 \n ⑨ 重 加 算 税 の 基 礎 と な る 税 額 \\1,600,000 \n ⑩ 重 加 算 税 の 額 \\640,000 \n \n"
}