{
  "number": "11748",
  "title": "所得税更正処分取消等上告提起事件",
  "court": "東京高等裁判所",
  "date": "平成２３年９月５日",
  "date_iso": "2011-09-05",
  "result": "取消",
  "topics": [
    "所得税"
  ],
  "laws": [],
  "keywords": [
    "更正処分"
  ],
  "text": "\n \n 目次に戻る \n \n 判決 11748 \n 所得税更正処分取消等上告提起事件 \n \n 裁判所:  東京高等裁判所 \n 判決日:  平成２３年９月５日 \n 結果:  取消 \n \n \n 主文 \n １ 本件上告を却下する。\n２ 本件上告受理申立てを却下する。\n３ 上告費用及び上告受理申立ての費用は、上告人兼申立人の負担とする。\n理 由本件記録によれば、当審の判決正本が上告人兼申立人に送達されたのは、平成２３年８月９日であって、本件上告状兼上告受理申立書を当庁に提出したのは同年８月２４日である。\nしたがって、本件上告提起及び上告受理の申立ては、民事訴訟法３１８条５項、３１３条、２８５条に規定する期間の経過後に提起された不適法なものであって、その不備を補正することができない。\nよって、主文のとおり決定する。\n平成２３年９月５日東京高等裁判所第２０民事部裁判長裁判官 春日 通良裁判官 太田 武聖裁判官 小林 元二事件番号 平成●●年（○○）第●●号平成●●年（○○）第●●号送達報告書\n□民訴法１０７条１項１号\n□レ民訴法１０７条１項２号、３号、２項決定(23.9.5付け)正本送 達 書 類予納郵便切手返還書(4040円)受 送 達 者 牛木純郎茨城県龍ヶ崎市 牛木法律事務所あて先とした場所\n（上告状兼上告受理申立書記載の送達場所）\n上記の書類は、平成23年10月3日 午後2時30分 東京高等裁判所内郵便局の書留郵便に付して送達した。\n書留郵便物受領証は、□末尾に添付する。\n□レ書留郵便物受領証つづりにつづる。\n平成23年10月3日東京高等裁判所第２０民事部裁判所書記官 松本昌邦方 法 □封書・□はがき・□レファクシミリ民訴規則 裁判所\n□レ通 知 相手方 受送達者\n４４条の 書記官年月日 上記送達日通知 印\n□非通知 ４条５項（受送達者□所在不明・□外国所在）\n（注）該当する事項の□にレを付する。 \n \n"
}