{
  "number": "11801",
  "title": "裁決取消等請求控訴事件",
  "court": "東京高等裁判所",
  "date": "平成２３年１０月２６日",
  "date_iso": "2011-10-26",
  "result": "取消",
  "topics": [],
  "laws": [],
  "keywords": [
    "更正処分",
    "過少申告加算税"
  ],
  "text": "\n \n 目次に戻る \n \n 判決 11801 \n 裁決取消等請求控訴事件 \n \n 裁判所:  東京高等裁判所 \n 判決日:  平成２３年１０月２６日 \n 結果:  取消 \n \n \n 主文 \n 本件控訴を棄却する。\n控訴費用は控訴人の負担とする。 \n \n \n 第１ 控訴の趣旨 \n １ 原判決を取り消す。\n２ 国説不服審判所長が、控訴人に対し、平成２１年１１月１９日付けでした、本郷税務署長によってされた不動産の各参加差押処分に対する控訴人の審査請求を棄却する旨の裁決を取り消す。\n３ 被控訴人は、控訴人に対し、１０５４万７０００円及びこれに対する平成１４年３月１４日から支払済みまで年５分の割合による金員を支払え。 \n \n \n 第２ 事案の概要本件事案の概要は \n 、原判決の「事実及び理由」中「第２ 事案の概要」に記載のとおりであるから（ただし、原判決３頁２１行目の次に行を改めて「本件滞納国税は、１２６万２０００円（本件更正処分等に係る国税［納付すべき額１０６６万円＋過少申告加算税額１３万７０００円］－本件申告に係る納付額９２８万５０００円－本件更正処分等に係る国税の一部納付額２５万円）である。」を加える。）、これを引用する。 \n \n \n 第３ 当裁判所の判断 \n １ 当裁判所も、控訴人の本件請求はいずれも理由がないものと判断する。その理由は、原判決の\n「事実及び理由」中「第３ 当裁判所の判断」に記載のとおりであるから、これを引用する。\n２ 以上によれば、控訴人の本件請求をいずれも棄却した原判決は相当であり、本件控訴は理由がないから棄却することとして、主文のとおり判決する。\n東京高等裁判所第１５民事部裁判長裁判官 井上 繁規裁判官 坂本 宗一裁判官 齋藤 繁道 \n \n"
}