{
  "number": "11951",
  "title": "損害賠償請求事件",
  "court": "松山地方裁判所",
  "date": "平成２４年５月１１日",
  "date_iso": "2012-05-11",
  "result": "棄却",
  "topics": [
    "相続税"
  ],
  "laws": [],
  "keywords": [
    "国家賠償",
    "損害賠償"
  ],
  "text": "\n \n 目次に戻る \n \n 判決 11951 \n 損害賠償請求事件 \n \n 裁判所:  松山地方裁判所 \n 判決日:  平成２４年５月１１日 \n 結果:  棄却 \n \n \n 主文 \n １ 原告の請求を棄却する。\n２ 訴訟費用は原告の負担とする。 \n \n \n 第１ 請求被告は \n 、原告に対し、１０万円を支払え。 \n \n \n 第２ 当事者の主張 \n １ 請求原因\n(1) 八幡浜税務署は、平成７年ころ、同６年に死亡した原告の父の遺産について税務調査をした。\n(2) 八幡浜税務署は、上記税務調査の結果、脱税を指摘したが、脱税内容を全く関係のない訴外丙税理士に漏らした。同行為は、守秘義務違反及び個人情報保護法違反に該当する。\n(3) 八幡浜税務署は、当初、「内容は乙先生（原告の弟乙税理士）が税務申告をしていたので乙先生に話した」と回答していたが、真実は、訴外丙税理士経由で脱税内容を回答していたものであって、上記回答は虚偽である。\n(4) 前記(2)及び同(3)により、原告は、金銭にて評価すれば１０万円を下らない精神的苦痛を被った。\n(5) よって、原告は、被告に対し、国家賠償法１条に基づき、１０万円の支払を求める。\n２ 請求原因に対する認否\n(1) 請求原因(1)は、時期を除き認める。\n(2) 請求原因(2)のうち、八幡浜税務署が、税務調査を行い、申告漏れを指摘したことは認めるが、その余は否認ないし争う。\n(3) 請求原因(3)は否認する。 \n \n \n 第３ 当裁判所の判断 \n １ 請求原因(1)は、その時期を除き、当事者間に争いがない。\n２ 請求原因(2)のうち、八幡浜税務署が税務調査を行い、申告漏れを指摘したとの限度では当事者間に争いがない。他方、本件全証拠によるも、八幡浜税務署の職員が、丙税理士に対してその指摘を行ったとの事実を認めるには足りない。\n３ 請求原因(3)のうち、八幡浜税務署の職員が、丙税理士に対して申告漏れの指摘を行ったとの事実を認めるに足りないことは、前記２のとおりである。なお、弁論の全趣旨によれば、乙税理士は、原告の父の相続税の申告者であったことが認められるから、八幡浜税務署の職員が乙税理士に対して申告漏れの指摘を行ったとしても、同行為が違法であるとはいえない。\n４ 以上によれば、その余の点につき判断するまでもなく、原告の請求には理由がない。\n松山地方裁判所民事第２部裁判官 瀬戸 茂峰 \n \n"
}