{
  "number": "11974",
  "title": "慰謝料等請求控訴事件",
  "court": "東京高等裁判所",
  "date": "平成２４年６月２１日",
  "date_iso": "2012-06-21",
  "result": "棄却",
  "topics": [
    "相続税"
  ],
  "laws": [],
  "keywords": [],
  "text": "\n \n 目次に戻る \n \n 判決 11974 \n 慰謝料等請求控訴事件 \n \n 裁判所:  東京高等裁判所 \n 判決日:  平成２４年６月２１日 \n 結果:  棄却 \n \n \n 主文 \n １ 本件控訴を棄却する。\n２ 控訴費用は、控訴人の負担とする。 \n \n \n 第１ 当事者の求めた裁判 \n １ 控訴の趣旨\n(1) 原判決を取り消す。\n(2) 被控訴人は、控訴人に対し、３００万円を支払え。\n(3) 被控訴人（国税庁、税務署）は、相続税申告時等の遺産分割協議書の作成において、一般的には実印の押印に伴い印鑑証明書を提出することでその実印であることが確認され、その効力が発揮されるものとみなされている印鑑証明書の提出を、税務署に限ってその必要がないことを、全国の税務署を通じて公表せよ。\n２ 控訴の趣旨に対する答弁\n(1) 本件控訴を棄却する。\n(2) 控訴費用は控訴人の負担とする。\n(3) 仮執行宣言を付する場合は、担保を条件とする仮執行免脱宣言及びその執行開始時期を判決が被控訴人に送達された後１４日経過した時とする。 \n \n \n 第２ 事案の概要本件の事案の概要 \n （事案の骨子、前提事実並びに争点及び当事者の主張）は、原判決「事実及び理由」欄の第２に記載のとおりであるから、これを引用する。 \n \n \n 第３ 当裁判所の判断 \n １ 当裁判所の判断は、原判決「事実及び理由」欄の第３、１及び２に記載のとおりであるから、\nこれを引用する。\n２ したがって、控訴人の本件訴えのうち、公表の義務付けを求める部分は不適法であるから却下し、その余の請求は理由がないから棄却するべきである。 \n \n \n 第４ 結語よって \n 、原判決は相当であって、本件控訴は理由がないからこれを棄却することとして、主文のとおり判決する。\n東京高等裁判所第２４民事部裁判長裁判官 三輪 和雄裁判官 小池 喜彦裁判官 松村 徹 \n \n"
}