{
  "number": "12406",
  "title": "損害賠償請求事件",
  "court": "福井地方裁判所",
  "date": "平成２６年２月１２日",
  "date_iso": "2014-02-12",
  "result": "棄却",
  "topics": [
    "所得税",
    "相続税"
  ],
  "laws": [],
  "keywords": [
    "国家賠償",
    "不当利得",
    "損害賠償"
  ],
  "text": "\n \n 目次に戻る \n \n 判決 12406 \n 損害賠償請求事件 \n \n 裁判所:  福井地方裁判所 \n 判決日:  平成２６年２月１２日 \n 結果:  棄却 \n \n \n 主文 \n １ 原告の請求をいずれも棄却する。\n２ 訴訟費用は原告の負担とする。 \n \n \n 第１ 請求被告は \n 、原告に対し、１６８５万０２６３円を支払え。 \n \n \n 第２ 事案の概要等 \n １ 事案の概要本件は、原告が、 \n (1) 父である乙（変更後の名は「丙」である。以下、名を変更した者については、すべて変更前の名で表示する。）を被相続人とする相続（以下「本件相続」という。）に係る相続税につき、 \n 乙以外の者の財産が乙の相続財産であることを前提とする違法・無効な処分が行われ、滞納処分による充当が法律上の原因を欠くと主張して、被告に対し、不当利得返還請求権に基づき、 \n 原告の相続税等に充当された預金債権及び賃料債権相当額である１６８５万０２６３円の支払 \n (2) 上記相続税の賦課徴収に関連して、税務署職員等に違法行為があったと主張して、国家賠償法１条１項に基づき、損害賠償金１６８５万０２６３円の支払を、選択的に求めると解される事案である。 \n ２ 前提事実（争いがないか、掲記の証拠及び弁論の全趣旨により容易に認定できる事実） \n (1) 当事者等〔甲１、２、５ないし７、乙１４（枝番のあるものはこれを含む。）〕ア 原告及び丁は、乙（平成６年７月５日死亡）と戊の子である。 \n イ Ａ（昭和１０年３月２９日死亡）は、戊の夫である。 \n ウ Ｂは、Ａと戊の子である。 \n エ Ａ及び乙は、Ｃ（昭和３年１月１４日死亡）とＤ（昭和３７年１月１７日死亡）の子である。 \n (2) 相続税の申告等ア 原告及び丁は、平成７年３月６日、Ｅ税理士（以下「Ｅ税理士」という。）に依頼して、 \n 武生税務署長に対し、本件相続に係る相続税の申告を行った。同申告に係る申告書には、取得財産の価額が８億０３０１万１７５４円、原告の相続税額が１億４８０３万円と記載されている。〔乙１〕イ 原告及び丁は、平成８年２月１３日、Ｅ税理士に依頼して、武生税務署長に対し、本件相続に係る相続税の修正申告を行った。同申告に係る修正申告書には、修正後の取得財産の価額が８億３９５３万９５９６円と、修正後の原告の相続税額が１億５６５５万３０００円と記載されている。〔乙３〕ウ 原告及び丁は、平成８年１２月９日、武生税務署長に対し、本件相続に係る相続税の修正申告を行った。同申告に係る修正申告書には、修正後の取得財産の価額が９億０９５９万３ \n ２７５円と、修正後の原告の相続税額が１億７５７６万６８００円と記載されている。〔乙 \n ６〕エ 原告は、平成１２年１月１９日、武生税務署長に対し、更正の請求をする理由を「減額」 \n とする本件相続に係る相続税の更正の請求を行った。同請求に係る請求書には、「預貯金・株式・その他は、相続時の総額×１／２をＢへ」との記載がある。〔乙７〕オ 原告は、平成１２年３月１７日、武生税務署長に対し、異議申立てに係る処分を「平成１ \n ２年１月１９日の相続税の減額更正請求に対する処分」とする異議申立てを行った。〔乙８〕カ 武生税務署長は、平成１２年４月１１日、上記オの異議申立てを却下する決定をした。〔乙 \n ９〕キ 武生税務署長は、平成１２年４月１７日、原告に対し、上記エの更正の請求には国税通則法２３条に規定する理由及び相続税法３２条に規定する事由が確認できないとして、更正をすべき理由がない旨の通知をした。〔乙１０〕ク 原告は、平成１２年５月１１日、武生税務署長に対し、更正の請求をする理由を「相続回復のための和解が成立。（あわせて未分割だった丁と甲の間での遺産分割も確定したため。）」とする本件相続に係る相続税の更正の請求を行った。同請求に係る請求書には、「相続回復のための、和解と、それによる登記の、一応の終了を見たため。丙（Ｃ）→Ｄ→Ｂ（代襲相続）と、財産が相続されている。」との記載がある。〔乙１１〕ケ 武生税務署長は、平成１２年６月３０日、原告に対し、上記クの更正の請求には国税通則法２３条に規定する理由及び相続税法３２条に規定する事由が確認できないとして、更正をすべき理由がない旨の通知をした。〔乙１２〕コ 原告は、平成１２年８月１４日、武生税務署長に対し、異議申立てに係る処分を上記ケの通知とする異議申立てを行った。〔乙１３〕サ 武生税務署長は、平成１２年１０月１８日、原告に対し、上記コの異議申立てを棄却する旨の決定をした。〔乙１４〕シ 原告は、平成１２年１１月１５日、国税不服審判所長に対し、審査請求をした。〔乙９〕ス 国税不服審判所長は、平成１４年６月２６日、上記シの審査請求を棄却する裁決をした。 \n 〔乙９〕 \n (3) 不動産に係る滞納処分等ア 金沢国税局長は、平成１５年５月８日から平成１８年９月２６日の間、別紙１記載１ないし２２、２５ないし２９、３１、３２、３４ないし４０の各土地について、原告に対する滞納処分として差押え又は参加差押えをした。〔乙５の１ないし２２、２５ないし２９、３１、 \n ３２、３４ないし４０、乙２９の１ないし３、乙３０ないし３２、乙３３の１、２〕イ 金沢国税局長は、別紙１記載９ないし１３、１６ないし２０、２５ないし２７、３１、３ \n ４及び３６ないし３８の土地について、公売及び売却決定を行い、換価代金のうち１６６万 \n ７４００円を滞納処分費に充当し、９５１７万０６００円を原告の相続税に充当した。〔乙 \n ５の９ないし１３、１６ないし２０、２５ないし２７、３１、３４及び３６ないし３８、乙 \n １８、乙３４の３、６、７、９ないし１１、１４、乙４０の５ないし７、乙４１の１ないし \n ４、７ないし１２、乙４２の１ないし１０、乙４３の１ないし１０、乙４４の１ないし１８〕 \n (4) 預金債権等に係る滞納処分等金沢国税局長は、別紙２記載の各債権につき、差し押さえた上で取り立て、又は、交付要求をした上で配当を受け、合計１６８５万０２６３円を原告の相続税及び申告所得税並びに丁の相続税に係る原告の連帯納付義務に充当した。〔乙４５の１ないし２０、乙４６の１ないし１ \n ０、乙４７の１ないし９、乙４８〕 \n ３ 争点及び当事者の主張 \n (1) 滞納処分による充当が法律上の原因を欠くものであるか \n （原告の主張） \n ア 乙とＢは、Ｄの遺産をＢが全部取得する旨の遺産分割の合意をした。しかし、乙は、後に、 \n 不動産について同人の単独名義とする登記手続をしてしまった。 \n そのため、原告は、本件相続に係る相続税の申告に際し、Ｅ税理士に対し、乙名義の不動産からＢの持分を控除した分を乙の相続財産とするように求めた。しかし、Ｅ税理士は、Ｂの持分を控除せずに相続税の申告をした。 \n このように、本件相続に係る相続税について申告された相続財産中にはＢの財産が含まれていた。 \n イ したがって、申告された相続財産がすべて乙の財産であることを前提として、原告に対してされた更正をすべき理由がない旨の通知や滞納処分等はいずれも重大な違法があり、無効である。 \n よって、滞納処分による充当は法律上の原因を欠く。 \n （被告の主張） \n 行政処分が当然無効であるというためには、処分に重大・明白な違法があることを要するところ、本件相続に係る相続税について行われた処分はいずれも適法なものであるし、原告の主張は被告に対する不平不満に過ぎず、処分の瑕疵を具体的に主張するものでもないから、処分に重大・明白な違法があるとはおよそ認められない。 \n したがって、滞納処分による充当は法律上の原因を有する。 \n (2) 税務署職員等が原告に対する違法行為を行ったか \n （原告の主張） \n ア 別紙３の「①いつ」欄の時期に、「②誰が」欄の者が、「③何を行ったことが違法であるか」 \n 欄の違法行為を行った。これらが違法であるのは、「④なぜ違法であるか」欄記載のとおりである。 \n イ 別紙３記載の人物については以下のとおりである。 \n (ア) ３人の税理士武生税務署に配置されていた税理士である。 \n (イ) Ｆ武生税務署徴収課課長である。 \n (ウ) Ｇの前任者武生税務署課税課課長である。 \n (エ) Ｇ武生税務署課税課課長である。 \n (オ) Ｈ武生税務署課税課上席である。 \n (カ) Ｉ武生税務署課税課課長で、Ｈの上司である。 \n (キ) Ｊ武生税務署課税課課長である。 \n (ク) Ｋ金沢国税不服審判所国税審判官である。 \n (ケ) Ｌ金沢国税不服審判所国税審判官である。 \n (コ) Ｍ福井地方裁判所書記官である。 \n (サ) 局及び局員金沢国税局及びその職員である。 \n （被告の主張） \n 原告が挙げる者は国家賠償法上の違法行為を行っていない。 \n (3) 消滅時効の成否 \n （被告の主張） \n 本件訴え提起までに３年を経過した処分、行為に基づく損害賠償請求権は時効により消滅した。被告は、消滅時効を援用するとの意思表示をした。 \n （原告の主張） \n 税務署職員等の行為は継続的不法行為であり、本件訴え提起までに時効期間は経過していない。 \n \n \n 第３ 当裁判所の判断 \n １ 争点(1)（滞納処分による充当が法律上の原因を欠くものであるか）について\n(1) 後掲の証拠によれば、以下の事実が認められる。\nア Ｃは、昭和３年１月●日、①土地の２分の１をＤに遺贈する、②建物及びその他の債権の価格の２分の１をＤに遺贈するとの公正証書遺言を行った。〔甲３の１、２〕イ Ａは、昭和１０年１月●日、①国債１万９０００円のうち１万円を妻戊に、９０００円を長女Ｂに遺贈する、②Ｎ銀行四谷支店の据置貯金４５００円を長女Ｂに遺贈し、その他の現金及び預金は妻戊に遺贈する、③貸金２７００円の残債権（７００円は弁済済み）を長女Ｂに遺贈する、④福井県今立郡内の田のうち２丁５反（遺言者であるＡが後日選択するが、選択する前に死亡した場合は遺言執行者において選択する。）は長女Ｂに遺贈する旨の公正証書遺言を行った。〔甲４〕ウ 別紙１記載１ないし３、５、１０、１２、１４、１５、２１、２３、２４、３０、３１、\n３４、３５、３６、３９、４０の各土地は原告名義の所有権移転登記がされていたが、その後、真正な登記名義の回復を原因としてＢへの所有権移転登記又は所有権一部移転登記がされている。〔乙５の１ないし３、５、１０、１２、１４、１５、２１、２３、２４、３０、\n３１、３４、３５、３６、３９、４０〕\n(2) もっとも、上記(1)の事実のみによっては、Ｂが取得したという財産が乙の相続財産に含まれていることを前提として本件相続に係る相続税に関する処分がされたと認めることができず、他にこれを認めるに足りる証拠もない。\nかえって、原告は、ＢがＤの取得した財産を取得することが従前から前提とされてきた旨主張しているところ、前提事実記載のとおり、原告がＢの取得分と主張する財産を含めて相続税の申告をしたと考えられること、これを前提に２回にわたって修正申告をしたことなど、原告が上記主張と整合しがたい行動をとっていることが認められる。\nなお、原告は、相続税の申告に際し、Ｅ税理士に対してＢの財産を控除して申告するよう求めたものの同税理士がこれを行わなかった旨主張するが、同主張のとおりの事実を認めるに足りる証拠もない。\n(3) よって、滞納処分による充当が法律上の原因を欠くとは認められない。\n２ 争点(2)（税務署職員等が原告に対する違法行為を行ったか）について原告の主張する違法行為をうかがわせる証拠は全くない。\n３ 以上によれば、その余の点について検討するまでもなく、原告が被告に対して不当利得返還請求権又は損害賠償請求権を有するとは認められない。 \n \n \n 第４ 結論よって \n 、原告の請求はいずれも理由がないからこれらを棄却することとし、主文のとおり判決する。 \n 福井地方裁判所民事第２部裁判長裁判官 樋口 英明裁判官 千葉 健一裁判官 坂井 唯弥別紙１及び別紙２ 省略別紙３ \n ①いつ ②誰が ③何を行ったことが違法であ ④なぜ違法であ ⑤ 該 当 箇るか るか 所平、７年３月 ３人の税理士 １）物納させないという税務署 １）税法違反 準備書面 \n １日 の方針に与した。 ２）国賠法上の違 の(2)、(1 \n ２）それによって原告に、多大 法もある。 4)、(22)、 \n な損害を与えた。 (23)平、７年３月 Ｅ税理士 １）違法であり、無効である申 １）税法違反。 準備書面 \n １日 告書を作成し、それを提出し ２）法規範違反。 (2)、(11)、 \n た。 ３）国賠法上の違 (16)、(2 \n ２）ざん言し、減額させまいと 法もある。 2)、(23)した。 \n ３）結果、原告に損害を与えた。 \n 平、７年５月 Ｆ (2)、(11)、 \n １７日 (17)、(2 \n 2)、(23)、 \n 平、７年８月 Ｇの前任者 １）減額するべきであったの １）税法違反。 (2)、(11)、 \n ２３日 に、減額しなかった。 ２）行政法違反。 (16)、(1 \n ２）自分がするべきことを裁判 ３）国賠法上の違 7)、(22)、 \n 所に押しつけた。 法もある。 (23) \n ３）結果、原告に多大な損害を与えた。 \n 特に関係のある条文。 \n ①いつ ②誰が ③何を行ったことが違法であ ④なぜ違法であ ⑤ 該 当 箇るか るか 所 \n ３人の税理士 ・相税４１条。 \n ・国賠法１条。 \n Ｅ税理士 ・税通１７条。 \n ・税通２３条。 \n ・国賠法１条。 \n Ｆ \n Ｇの前任者 ・税通２３条。 \n ・国賠法１条。 \n ①いつ ②誰が ③何を行ったことが違法であ ④なぜ違法であ ⑤ 該 当 箇るか るか 所平、１０年４月 Ｇ １）減額するべきであったの １）税法違反。 準備書面 \n １０日 に、減額しなかった。 ２）行政法違反。 (2)、(11)、 \n ２）原告が更正の請求をするの ３）国賠法上の違 (16)、(1を、阻止しようとした。 法もある。 7)、(22)、 \n ３）結果、原告に多大な損害を (23)与えた。 \n 平、１２年１月 Ｈ １）更正請求書の収受を拒否し １）税法違反。 (2)、(11)、 \n ９日 た。 ２）行政法違反。 (22)、(23) \n ２）嘘をついて、原告に、更正 ３）国賠法上の違請求書を提出させまいとし 法もある。 \n た。 \n ３）結果、原告に多大な損害を与えた。 \n 平、１２年６月 Ｉ １）減額しなかった（更正の請 １）税法違反。 (2)、(11)、 \n ７日 求を却下した）。 ２）行政法違反。 (22)、(23) \n ２）原告を脅し、原告が更正の ３）法規範違反。 \n 請求をすることをやめさせ ４）国賠法上の違ようとした。 法もある。 \n ３）違法状態を維持し、 \n そしてその違法状態を後続の違法行為の基礎にさせた。 \n ４）結果、原告に多大な損害を与えた。 \n 平、１２年１０ Ｊ １）虚偽の事実をでっち上げ、 １）法規範違反。 (1)、(2)、 \n 月２０日 その虚偽の事実を理由にし ２）国賠法上の違 (5)、(6)、 \n て、異議申立てを却下した。 法もある。 (11)、(2 \n ２）違法状態を維持し、それを ３）税法違反。 2)、(23)後続の違法行為の基礎 ４）行政法違反。 \n にさせた。 \n ３）結果、原告に多大な損害を与えた。 \n ①いつ ②誰が ③何を行ったことが違法であ ④なぜ違法であ ⑤ 該 当 箇るか るか 所 \n Ｇ ・税通２３条。 \n ・国賠法１条。 \n ・行政手続法７条、９条。 \n Ｈ ・税通２３条。 \n ・国賠法１条。 \n ・行政手続法７条、９条。 \n Ｉ ・税通２３条。 \n ・国賠法１条。 \n ・行政手続法７条、９条。 \n Ｊ ・税通２３条。 \n ・国賠法１条。 \n ・行政手続法７条、９条。 \n ①いつ ②誰が ③何を行ったことが違法であ ④なぜ違法であ ⑤ 該 当 箇るか るか 所平、１３年７月 Ｋ １）減額するべきという裁決を １）税法違反。 (2)、(11)、 \n ４日 しなかった。 ２）行政法違反。 (22)、(23) \n ２）裁決をすることから逃げま ３）国賠法上の違くった。 法もある。 \n ３）結果、原告に多大な損害を与えた。 \n 平、１４年７月 Ｌ １）決定書の虚偽の事実を新た １）法規範違反。 (1)、(2)、 \n １日 なＬ自身の嘘でカバーし、審 ２）国賠法上の違 (7)、(11)、 \n 査請求を却下した。 法もある。 (22)の特 \n ２）違法状態を維持し、それを ３）税法違反。 に１０、１後続の違法行為の基礎にさ ４）行政法違反。 １ページ。 \n せた。 (23) \n ３）結果、原告に多大な損害を与えた。 \n 平、１６年３月 Ｍ（書記官） １）局に情報を流した。 法規範違反。 (2)、(8)、 \n ８日 ２）原告の裁判を受ける権利を (22)、(23)侵害した。 \n ３）被告の利を図り、原告を不利にした。 \n ４）賄賂を受け取っている。 \n ５）結果、原告に多大な損害を与えた。 \n 平、１６年６月 局および局員 １）Ｂの持分があることを知っ １）税法違反。 (1)の３、 \n ３日以後 ていた。 ２）行政法違反。 (2)、(10)、 \n ２）局の処分（＝行為）が違法 ３）法規範違反。 (11)、(1であることを認識していた。 ４）国賠法上の違 2)、(13)、 \n ３）公売と言えるようなもので 法もある。 (14)、(1ないものを公売と偽って原 5)、(18)、 \n 告の (19)、(2 \n 0)、 \n ①いつ ②誰が ③何を行ったことが違法であ ④なぜ違法であ ⑤ 該 当 箇るか るか 所 \n Ｋ ・税通２３条。 \n ・国賠法１条。 \n Ｌ ・税通２３条。 \n ・国賠法１条。 \n ・行政手続法７条、９条。 \n ・行政不服審査法 \n ２１条。 \n ・税通９１条。 \n Ｍ（書記官） \n 局および局員 ・税通２３条。 \n ・国賠法１条。 \n ・民法７０３条。 \n （以上） \n ①いつ ②誰が ③何を行ったことが違法であ ④なぜ違法であ ⑤ 該 当 箇るか るか 所財産を取り上げていた。 (21)、(22) \n ４）原告に、計り知れない損害 の 特 に １を与えた。 ０、１１ペ \n ージ。(23) \n \n"
}