{
  "number": "12486",
  "title": "所得税更正処分取消等請求控訴事件",
  "court": "東京高等裁判所",
  "date": "平成２６年６月１８日",
  "date_iso": "2014-06-18",
  "result": "取消",
  "topics": [
    "所得税"
  ],
  "laws": [
    "所得税法37条"
  ],
  "keywords": [
    "更正処分",
    "課税処分",
    "重加算税",
    "必要経費",
    "青色申告"
  ],
  "text": "\n \n 目次に戻る \n \n 判決 12486 \n 所得税更正処分取消等請求控訴事件 \n \n 裁判所:  東京高等裁判所 \n 判決日:  平成２６年６月１８日 \n 結果:  取消 \n \n \n 主文 \n １ 本件控訴を棄却する。\n２ 控訴費用は控訴人の負担とする。 \n \n \n 第１ 控訴の趣旨 \n １ 原判決を取り消す。\n２ 宇都宮税務署長が控訴人に対して平成２１年２月２０日付けでした平成１５年分、平成１６年分、平成１７年分、平成１８年分及び平成１９年分の所得税の各更正処分のうち、別紙１ないし\n５の各「Ａ確定申告」欄の「総所得金額」欄（順号①）及び「納付すべき税額」欄（順号⑨又は\n⑩）に記載された各金額を超える部分並びに重加算税の各賦課決定処分をいずれも取り消す。 \n \n \n 第２ 事案の概要 \n （以下、略語等は原判決の例による。）\n１ 控訴人は、質屋営業及び古物営業を営み、平成１５年分から平成１９年分まで（本件各係争年分）の所得税の各確定申告（本件各確定申告）をした。宇都宮税務署長は、平成２１年２月２０日付けで、控訴人に対し、事業所得金額の計算上算入すべき金製品の取引（本件金製品取引）に係る収入金額が算入されていなかったとして、本件各係争年分の所得税の各更正処分（本件更正処分）及び重加算税の各賦課決定処分（本件賦課決定処分。本件更正処分と併せて「本件更正処分等」）をした。本件は、控訴人が、本件更正処分等には、必要経費の金額として算入すべき本件金製品取引に係る売上原価の額をこれに算入しなかった違法があると主張して、本件更正処分等の取消しを求めた事案である。\n２ 原判決は、処分行政庁が、控訴人の本件青色申告決算書に記載された仕入金額の各年分の合計額をもって当該各年分の必要経費に算入すべき金額として把握したことは合理的であるなどとして、控訴人の請求をいずれも棄却したため、控訴人が控訴をして、第１記載のとおりの判決を求めた。\n３ 関係法令の定め、前提事実、争点及びこれに関する当事者の主張の要点は、次項のとおり当審における控訴人の主張を加えるほかは、原判決「事実及び理由」欄の「第２ 事案の概要等」の\n２ないし４項（原判決２頁１７行目から４３頁２１行目まで）に記載のとおりであるから、これを引用する。\n４ 当審における控訴人の主張\n(1) 納税者が主張する簿外の必要経費には、① その存在自体が疑われるような類の特殊な経費と、② その存在自体を否定できない経費との２種類があり、本件金製品取引に係る売上原価は、②である。原判決は、税務署長による必要経費の把握の合理性が示されると、それ以外の経費については、納税者がその内容を具体的に主張立証しない限り、当該費用の必要経費該当性が否定されるとの事実上の推定が働くとするけれども、そのような理論は、上記①の経費には当てはまるが、上記②のその存在自体を否定できない経費には当てはまらない。\n納税者が、その存在を否定できない必要経費を主張する場合、税務署長は、課税処分を正当化するために、当該経費が納税者の当初申告の必要経費の中に含まれていることを立証すべきである。被控訴人が、本件金製品取引に係る売上原価の額が控訴人の当初申告の売上原価の額に含まれていることを立証するには、原処分庁による必要経費の把握の仕方が通常合理的であることを示すだけでは不十分である。\n(2) 原処分庁が本件調査時に行ったという本件質物台帳のうちの「流質」の表示がある記載部分と本件古物台帳の「払出し」の表示のある記載部分の集計には、売却先をＩ及びＪとする本件金製品取引に係るものはほとんど含まれていなかった。したがって、上記集計は、本件金製品取引に係る売上原価の額の把握方法としては見当違いであった。そのような集計結果を控訴人の当初申告の「仕入金額」と比較しても、本件金製品取引に係る売上原価の額が控訴人の確定申告済みの売上原価の額に含まれているという事実を推認することはできない。この点を確認せず、原処分庁の売上原価の把握方法を合理的な範囲内とした原判決の認定は誤りである。\n(3) 次のような間接事実をみれば、本件金製品取引に係る売上原価の額が、控訴人の確定申告済みの売上原価の額に含まれているという事実を推認することはできない。\nア 本件金製品取引に係る売上原価の額が控訴人の確定申告済みの売上原価の額に含まれているとすると、控訴人が当初申告において簿外取引の売上を隠しつつ、仕入のみを計上するという処理をしていたことになり、合理性を欠き不自然である。\nイ 控訴人の流質物等に関し、一般の金製品取引の売上原価率、本件各係争年分の前後の年分の金製品取引の売上原価率等を算定し、被控訴人主張の本件各係争年分の流質物等に関する売上原価率と比較すると、本件金製品取引については、売上だけでなく仕入も簿外としていたことが優に推認できる。\nウ 控訴人の妻Ｒの作成した本件収支計算ノートによれば、控訴人が所得税青色申告決算書の売上金額に含めていた流質物等の売却先は、一部の例外的な場合を除き、全てＩ及びＪ以外である。原判決が本件収支計算ノートの記載事項の証拠価値を否定するのは誤りである。 \n \n \n 第３ 当裁判所の判断 \n １ 当裁判所も、控訴人の請求は、いずれも理由がないと判断する。その理由は、次項のとおり補足するほかは、原判決の「事実及び理由」欄の「第３ 当裁判所の判断」に記載のとおりであるから、これを引用する。ただし、原判決６４頁４行目の「(2)エ参照」を「(3)エ参照」に改める。 \n ２ 当審における控訴人の主張について \n (1) 控訴人は、納税者が、簿外の必要経費として、本件金製品取引に係る売上原価のような、 \n その存在自体を否定できない経費を主張する場合には、その存在自体が疑われるような類の特殊な経費を主張する場合とは異なり、納税者が当該費用の内容を具体的に主張立証しない限り当該費用の必要経費該当性が否定されるとの事実上の推定をするべきではないと主張する。 \n しかし、申告納税制度の下において、納税者は、法令の定めに従い正しい申告をすべきものとされ、所得税法に基づき一定の範囲で帳簿書類等の備付け等の義務を負い、かつ、自己に有利な事実である仕入れ等の証拠となる書類を保存し又はそれに関する事項を帳簿書類等に記録することは容易にできることなどからすれば、納税者において、税務署長が合理的と認められる方法により把握した必要経費以外の費用が帳簿書類等に記録されたところとは別に必要経費として存在すると主張する場合には、売上原価を必要経費と主張するときであっても、その納税者においてそのような費用の存在及びその金額を含む当該費用の内容につき具体的に主張及び立証をすべき必要があり、その主張立証がされない限り、当該費用については所得税法３７条１項の定める必要経費に該当しないとの事実上の推定が働くというべきことは、原判決の説示するとおりである。 \n そして、控訴人のいう二種の経費を区別する基準は必ずしも明確ではないが、その経費の存在を否定できない、すなわち経費の存在が認められるか、あるいはその経費の存在自体が疑われるものであるかは、結局その経費の存在を証拠資料をもって認定できるかどうかということに帰着するのであり、一般的に存在することが明らかな経費であれば、納税者においてその資料を保存し、記録することも容易にすることができ、それらの証拠をもって上記の事実上の推定を覆すこともまた容易にすることができるはずである。したがって、控訴人のいうような経費の区別が可能であったとしても、その区別によって上記の事実上の推定を排除すべき理由も必要性もないというべきである。 \n (2) 控訴人は、宇都宮税務署長が本件金製品取引に係る売上原価の額を把握するために集計した本件質物台帳等の記載には、本件金製品取引に係るものがほとんど含まれていなかったから、 \n 宇都宮税務署長がその集計を基に必要経費を把握したことが合理的ということはできないと主張する。 \n しかし、本件調査の経緯並びにその際の控訴人及びその妻子と顧問税理士の対応の状況、本件金製品取引に関する書類等の提出状況及びそれら書類の記載と本件各確定申告の内容等の事実は、原判決の認定するとおり（原判決２頁２１行目から４頁１２行目まで、４３頁２６行目から５４頁１８行目まで）である。そして、本件調査の過程において、調査担当者らが再三にわたって売上原価の額を示す書類等の提示を求めたのに対し、控訴人は本件質物台帳等を提出したのみで、それ以外の仕入れに関する帳簿書類はないとして、本件各係争年分の本件収支計算ノートを提出せず、本件金製品取引の相手方であるＪとの間の当該期間中の取引の存在も否定していたこと、本件調査担当者らが修正申告を促していたにもかかわらず、控訴人は本件訴訟における主張に立脚した修正申告もしなかったこと、他方、乙は、本件質物台帳には質受けの際に記載すべき事項を漏れなく正確に記載していると証言しており（証人乙）、質受け時の質物や貸付金額等についての本件質物台帳の記載の正確性を疑わせる証拠は見当たらないところ、控訴人が本件各係争年度の青色申告決算書に計上した売上原価は、平成１９年分を除き本件質物台帳等により流質等の記載のある取引の貸付金額等を集計した金額を相当に上回っていること等の事情からすると、控訴人の指摘する事情を考慮に入れても、宇都宮税務署長において、本件金製品取引に関する資料として本件質物台帳等の記載を集計するなどしたうえで、本件各確定申告に計上された売上原価に基づき必要経費に算入すべき売上原価の金額を把握したことは、合理的であったというべきである。 \n (3) また、控訴人は、本件金製品取引に係る売上原価の額が控訴人の確定申告済みの売上原価の額に含まれているとの推認を妨げる間接事実があると主張する。しかし、前記(2)に挙げた事実に加えて、本件金製品取引に係る流質物の質入れ又は買取りから売却までの期間は一定せず、長年保管した後に売却された物もあったとみられ（甲３６）、その間に金取引価格も変動すること等を考慮すると、控訴人の算定した一般の金製品取引の売上原価率、本件各係争年分以外の金製品取引の売上原価率等と、被控訴人の主張する本件各係争年分の流質物等に関する売上原価率とを対比しても、その異同からただちに確定申告額を超えて本件金製品取引に係る売上原価があったと推認するには足りない。加えて、控訴人が立論の基礎とする本件収支計算ノートは、本件調査時において提示されておらず、本件各確定申告前に税理士に開示されてもいなかったうえ、その記載内容は本件各確定申告の内容とも必ずしも合致しておらず、控訴人の主張によってもその記載中には誤りがあること等からして、本件収支計算ノートの証拠価値を重視することもできない。したがって、控訴人の上記主張をにわかに採用することはできない。 \n (4) そのほか控訴人の指摘する事情及び証拠を考慮に入れても、本件各確定申告に計上された額を超えて必要経費として算入すべき本件各金製品取引にかかる売上原価が存在することやその内容について、控訴人が前記(1)の事実上の推定を妨げるに足りる主張立証をしたと認めることはできない。 \n \n \n 第４ 結論以上によれば \n 、控訴人の請求をいずれも棄却した原判決は相当であって、本件控訴は理由がないから、これを棄却することとして、主文のとおり判決する。 \n 東京高等裁判所第２３民事部裁判長裁判官 鈴木 健太裁判官 若林 辰繁裁判官 瀬川 卓男別紙１本件各更正処分等の経緯（平成１５年分） \n （単位：円） \n Ｇ変更後の項目 Ａ確定申告 Ｂ更正処分等 Ｃ異議申立て Ｄ異議決定 Ｅ審査請求 Ｆ審査裁決被告主張額年月日 平成16年3月1日 平成21年2月20日 平成21年3月30日 平成21年5月27日 平成21年6月11日 平成22年6月8日総 所 得 金 額 ① 2,424,932 45,125,631 2,424,932 2,424,932 45,550,239事 業 所 得 の 金 額 ② 2,424,932 45,125,631 2,424,932 2,424,932 45,550,239内 \n 給 与 所 得 の 金 額 ③ 0 0 0 0 0訳 \n 雑 所 得 の 金 額 ④ 0 0 0 0 0所 得 控 除 の 額 の 合 計 額 ⑤ 2,406,300 1,906,300 2,406,300 2,406,300 1,906,300棄 \n 課 税 総 所 得 金 額 ⑥ 18,000 43,219,000 18,000 18,000 43,643,000却 \n 課税総所得金額に対する税額 ⑦ 1,800 13,501,030 1,800 1,800 13,657,910定 率 減 税 額 ⑧ 360 250,000 360 360 250,000源 泉 徴 収 税 額 ⑨ 30,000 30,000 30,000 30,000 30,000納 付 す べ き 税 額 ⑩ △28,560 13,221,000 △28,560 △28,560 13,377,900重 加 算 税 の 額 ⑪ － 4,326,000 0棄 \n 却 \n 0 4,326,000 \n （注）「納付すべき税額」欄の△は、還付金の額に相当する税額を表す。 \n 別紙２本件各更正処分等の経緯（平成１６年分） \n （単位：円） \n Ｇ変更後の項目 Ａ確定申告 Ｂ更正処分等 Ｃ異議申立て Ｄ異議決定 Ｅ審査請求 Ｆ審査裁決被告主張額年月日 平成17年2月25日 平成21年2月20日 平成21年3月30日 平成21年5月27日 平成21年6月11日 平成22年6月8日総 所 得 金 額 ① 2,139,610 65,419,907 2,139,610 2,139,610 65,521,382事 業 所 得 の 金 額 ② 2,139,610 65,419,907 2,139,610 2,139,610 65,521,382内 \n 給 与 所 得 の 金 額 ③ 0 0 0 0 0訳 \n 雑 所 得 の 金 額 ④ 0 0 0 0 0所 得 控 除 の 額 の 合 計 額 ⑤ 2,417,500 1,917,500 2,417,500 2,417,500 1,917,500棄 \n 課 税 総 所 得 金 額 ⑥ 0 63,502,000 0 0 63,603,000却 \n 課税総所得金額に対する税額 ⑦ 0 21,005,740 0 0 21,043,110定 率 減 税 額 ⑧ 0 250,000 0 0 250,000源 泉 徴 収 税 額 ⑨ 30,000 30,000 30,000 30,000 30,000納 付 す べ き 税 額 ⑩ △30,000 20,725,700 △30,000 △30,000 20,763,100重 加 算 税 の 額 ⑪ － 6,972,000 0棄 \n 却 \n 0 6,972,000 \n （注）「納付すべき税額」欄の△は、還付金の額に相当する税額を表す。 \n 別紙３本件各更正処分等の経緯（平成１７年分） \n （単位：円） \n Ｇ変更後の項目 Ａ確定申告 Ｂ更正処分等 Ｃ異議申立て Ｄ異議決定 Ｅ審査請求 Ｆ審査裁決被告主張額年月日 平成18年2月20日 平成21年2月20日 平成21年3月30日 平成21年5月27日 平成21年6月11日 平成22年6月8日総 所 得 金 額 ① 618,970 39,699,262 618,970 618,970 39,709,122事 業 所 得 の 金 額 ② 618,970 39,699,262 618,970 618,970 39,709,122内 \n 給 与 所 得 の 金 額 ③ 0 0 0 0 0訳 \n 雑 所 得 の 金 額 ④ 0 0 0 0 0所 得 控 除 の 額 の 合 計 額 ⑤ 1,898,412 1,829,360 1,898,412 1,898,412 1,829,360棄 \n 課 税 総 所 得 金 額 ⑥ 0 37,869,000 0 0 37,879,000却 \n 課税総所得金額に対する税額 ⑦ 0 11,521,530 0 0 11,525,230定 率 減 税 額 ⑧ 0 250,000 0 0 250,000源 泉 徴 収 税 額 ⑨ 30,000 30,000 30,000 30,000 30,000納 付 す べ き 税 額 ⑩ △30,000 11,241,500 △30,000 △30,000 11,245,200重 加 算 税 の 額 ⑪ － 3,706,500 0棄 \n 却 \n 0 3,706,500 \n （注）「納付すべき税額」欄の△は、還付金の額に相当する税額を表す。 \n 別紙４本件各更正処分等の経緯（平成１８年分） \n （単位：円） \n 項目 Ａ確定申告 Ｂ更正処分等 Ｃ異議申立て Ｄ異議決定 Ｅ審査請求 Ｆ審査裁決年月日 平成19年3月7日 平成21年2月20日 平成21年3月30日 平成21年5月27日 平成21年6月11日 平成22年6月8日総 所 得 金 額 ① 971,648 69,601,150 971,648 971,648事 業 所 得 の 金 額 ② 971,648 69,601,150 971,648 971,648内 \n 給 与 所 得 の 金 額 ③ 0 0 0 0訳 \n 雑 所 得 の 金 額 ④ 0 0 0 0所 得 控 除 の 額 の 合 計 額 ⑤ 1,987,218 1,935,800 1,987,218 1,987,218棄 \n 課 税 総 所 得 金 額 ⑥ 0 67,665,000 0 0却 \n 課税総所得金額に対する税額 ⑦ 0 22,546,050 0 0定 率 減 税 額 ⑧ 0 125,000 0 0源 泉 徴 収 税 額 ⑨ 36,000 36,000 36,000 36,000納 付 す べ き 税 額 ⑩ △36,000 22,385,000 △36,000 △36,000重 加 算 税 の 額 ⑪ － 7,563,500 0棄 \n 却 \n （注）「納付すべき税額」欄の△は、還付金の額に相当する税額を表す。 \n 別紙５本件各更正処分等の経緯（平成１９年分） \n （単位：円） \n Ｇ変更後の項目 Ａ確定申告 Ｂ更正処分等 Ｃ異議申立て Ｄ異議決定 Ｅ審査請求 Ｆ審査裁決被告主張額年月日 平成20年2月27日 平成21年2月20日 平成21年3月30日 平成21年5月27日 平成21年6月11日 平成22年6月8日総 所 得 金 額 ① 5,029,790 85,943,876 5,029,790 5,029,790 85,983,606事 業 所 得 の 金 額 ② 5,029,790 85,943,876 5,029,790 5,029,790 85,983,606内 \n 給 与 所 得 の 金 額 ③ 0 0 0 0 0訳 \n 雑 所 得 の 金 額 ④ 0 0 0 0 0所 得 控 除 の 額 の 合 計 額 ⑤ 1,971,550 1,971,550 1,971,550 1,971,550 1,971,550棄 \n 却課 税 総 所 得 金 額 ⑥ 3,058,000 83,972,000 3,058,000 3,058,000 84,012,000課税総所得金額に対する税額 ⑦ 208,300 30,792,800 208,300 208,300 30,808,800源 泉 徴 収 税 額 ⑧ 18,000 18,000 18,000 18,000 18,000納 付 す べ き 税 額 ⑨ 190,300 30,774,800 190,300 190,300 30,790,800重 加 算 税 の 額 ⑩ － 10,136,000 0棄 \n 却 \n 0 10,136,000 \n \n"
}