{
  "number": "12680",
  "title": "国家賠償請求控訴事件",
  "court": "東京高等裁判所",
  "date": "平成２７年６月１７日",
  "date_iso": "2015-06-17",
  "result": "棄却",
  "topics": [
    "所得税"
  ],
  "laws": [],
  "keywords": [
    "更正処分",
    "課税処分",
    "過少申告加算税",
    "国家賠償",
    "損害賠償"
  ],
  "text": "\n \n 目次に戻る \n \n 判決 12680 \n 国家賠償請求控訴事件 \n \n 裁判所:  東京高等裁判所 \n 判決日:  平成２７年６月１７日 \n 結果:  棄却 \n \n \n 主文 \n １ 本件控訴を棄却する。\n２ 控訴費用は控訴人の負担とする。 \n \n \n 第１ 控訴の趣旨 \n １ 原判決を取り消す。\n２ 被控訴人は、控訴人に対し、１４０万４４８７円を支払え。 \n \n \n 第２ 事案の概要等 \n １ 本件は、被控訴人の公権力の行使に当たる公務員が控訴人に対し故意又は過失により違法に過大な課税処分をした上、控訴人が提起した抗告訴訟等において、裁判官が法律上の根拠や関連法令の精査検討をすることなく誤った判断をしたことを理由に、控訴人が被控訴人に対し国家賠償法に基づき損害賠償を請求した事案である。\n原判決が控訴人の請求を棄却したため、控訴人が控訴した。\n２ 前提事実は、次のとおり補正するほか、原判決（更正決定後のもの。以下、同じ。）「事実及び理由」中の第２の２記載のとおりであるから、これを引用する。\n原判決３頁２行目の「第●●号」の次に「、控訴人が同事件において違法・無効であると主張した処分は、平成１６年分ないし平成１８年分の所得税の更正処分及び過少申告加算税の賦課決定処分並びに平成１９年分の所得税の更正処分であった。」を加える。\n３ 当事者の主張は原判決「事実及び理由」中の第３記載のとおりであるから、これを引用する。 \n \n \n 第３ 当裁判所の判断当裁判所も \n 、控訴人の請求は理由がないものと判断する。その理由は、次のとおり補正するほか、原判決「事実及び理由」中の第４の１及び２記載のとおりであるから、これを引用する。\n１ 原判決８頁１０行目の「平成１８年分」を「平成１９年分」に改める。\n２ 原判決８頁２３行目末尾の後に次のとおり加える。\n「３ 請求の成否以上によれば、その余の点について判断するまでもなく、控訴人の請求は理由がない。」 \n \n \n 第４ 結論よって \n 、控訴人の請求は理由がなく、これを棄却した原判決は相当であり、本件控訴は理由がないから棄却することとし、主文のとおり判決する。\n東京高等裁判所第１１民事部裁判長裁判官 瀧澤 泉裁判官 中平 健裁判官 松田 典浩 \n \n"
}