{
  "number": "13007",
  "title": "信用毀損損害賠償請求控訴事件",
  "court": "名古屋高等裁判所",
  "date": "平成２９年４月１２日",
  "date_iso": "2017-04-12",
  "result": "棄却",
  "topics": [],
  "laws": [],
  "keywords": [
    "国家賠償",
    "損害賠償"
  ],
  "text": "\n \n 目次に戻る \n \n 判決 13007 \n 信用毀損損害賠償請求控訴事件 \n \n 裁判所:  名古屋高等裁判所 \n 判決日:  平成２９年４月１２日 \n 結果:  棄却 \n \n \n 主文 \n １ 本件控訴をいずれも棄却する。\n２ 控訴費用は、控訴人らの負担とする。 \n \n \n 第１ 控訴の趣旨 \n １ 原判決を取り消す。\n２ 被控訴人は、控訴人甲に対し、３００万円及びこれに対する平成２６年６月７日から支払済みまで年５分の割合による金員を支払え。\n３ 被控訴人は、控訴人乙に対し、３万円及びこれに対する平成２６年６月７日から支払済みまで年５分の割合による金員を支払え。\n４ 被控訴人は、控訴人丙に対し、３万円及びこれに対する平成２６年６月７日から支払済みまで年５分の割合による金員を支払え。\n５ 被控訴人は、控訴人丁に対し、３万円及びこれに対する平成２６年６月７日から支払済みまで年５分の割合による金員を支払え。 \n \n \n 第２ 事案の概要 \n １ 本件は、控訴人らが、控訴人乙と被控訴人との間の別件訴訟（金沢地方裁判所平成●●年\n（○○）第●●号不当税金国家賠償請求事件）において、被告であった被控訴人の指定代理人が提出した答弁書に、控訴人甲の信用を毀損する内容の記載があり、これによって控訴人らが精神的苦痛を受けたと主張して、被控訴人に対し、国家賠償法１条１項に基づく損害賠償請求として、控訴人甲については３００万円、控訴人乙、控訴人丙及び控訴人丁についてはいずれも３万円の各慰謝料、並びにこれらに対する不法行為後の日である平成２６年６月７日から支払済みまで民法所定の年５分の割合による遅延損害金の支払を求める事案である。\n原審が控訴人らの本件請求をいずれも棄却したところ、控訴人らが控訴した。\n２ 本件の前提事実は原判決「事実及び理由」欄の第２の２に、争点及び当事者の主張は同３にそれぞれ記載されたとおりであるから、これらを引用する。 \n \n \n 第３ 当裁判所の判断当裁判所も \n 、控訴人らの本件請求は理由がないからいずれも棄却されるべきであると判断するところ、その理由は、原判決「事実及び理由」欄の第３に記載されたとおりであるから、これを引用する。\n控訴人らは、原判決が、別件答弁書の「想定される」との文言を仮定的な主張を表現したものであると解釈したことについて、誤りである旨主張するが、採用できない。 \n \n \n 第４ 結論よって \n 、控訴人らの本件請求をいずれも棄却した原判決は相当であり、本件控訴はいずれも理由がない。\n名古屋高等裁判所金沢支部第１部裁判長裁判官 内藤 正之裁判官 鳥飼 晃嗣裁判官 大野 博隆 \n \n"
}