{
  "number": "13659",
  "title": "更正すべき理由がない旨の通知処分取消請求事件",
  "court": "東京地方裁判所",
  "date": "令和４年１月１４日",
  "date_iso": "2022-01-14",
  "result": "取消",
  "topics": [
    "法人税",
    "所得税",
    "相続税"
  ],
  "laws": [],
  "keywords": [
    "復興特別所得税",
    "所得税",
    "損害賠償",
    "更正の請求",
    "更正処分",
    "法人税",
    "相続税"
  ],
  "sections": {
    "主文": [
      "１ 原告の請求をいずれも棄却する。\n２ 訴訟費用は原告の負担とする。"
    ]
  },
  "full_text": "13659 更正すべき理由がない旨の通知処分取消請求事件 - 国税庁判決事例集\n\n\n\n\n\n\n\n\n\n\n目次に戻る\n\n\n\n\n判決 13659\n\n\n更正すべき理由がない旨の通知処分取消請求事件\n\n\n\n\n裁判所:\n 東京地方裁判所\n\n\n判決日:\n 令和４年１月１４日\n\n\n結果:\n 取消\n\n\n\n\n\n\n主文\n\n\n１ 原告の請求をいずれも棄却する。\n２ 訴訟費用は原告の負担とする。\n\n\n\n\n\n\n第１ 請求青梅税務署長が令和元年\n\n\n５月２２日付けでした原告の平成２７年分、平成２８年分及び平成\n２９年分の所得税及び復興特別所得税に係る更正の請求に対する更正をすべき理由がない旨の通知処分をいずれも取り消す。\n\n\n\n\n\n\n第２ 事案の概要本件は\n\n\n、原告が、沖縄県うるま市に所在の合計１０筆の土地（以下、同土地の全部又は一部を指して「本件各土地」という。）の売却に関して、その売却代金の管理等を訴外乙（以下\n「乙」という。）に任せていたところ、乙により同売却代金の一部である合計３億４７５４万\n３０００円（平成２７年分につき１億１７００万円、平成２８年分につき１億１３０２万３\n０００円、平成２９年分につき１億１７５２万円）を横領された（以下、この横領を「本件横領」という。）ことから、本件横領に係る損失の金額につき雑損控除がされるとして、平成\n２７年分から平成２９年分まで（以下「本件各年分」という。）の所得税及び復興特別所得税\n（以下「所得税等」という。）の各更正の請求（以下「本件各更正請求」という。）をしたが、\n青梅税務署長から本件各更正請求につき更正をすべき理由がない旨の各通知処分（以下「本件各通知処分」という。）を受けたため、本件各通知処分の取消しを求める事案である。\n１ 関係法令の定め本件に関係する法令の定めは、別紙２「関係法令の定め」に記載のとおりである\n２ 前提事実（争いのない事実並びに後掲証拠及び弁論の全趣旨により容易に認められる事実）\n\n\n（１）本件各土地の相続及び売却原告は、平成２６年５月●日、被相続人を原告の父親である丙（以下「被相続人」という。）とする相続（以下「本件相続」という。）により、沖縄県うるま市に所在する合計１０筆の土地（本件各土地）の所有権を取得し、うち２筆を平成２７年１０月に１億２５００万円で、うち６筆を平成２８年５月から同年１１月までに合計１億２５７２万３０００円で、\nうち２筆を平成２９年１月から４月までに合計１億２７６４万円でそれぞれ売却した（甲１\n４、１９、乙１～３、２０）。\n\n\n（２）本件各年分の確定申告及び更正処分についてア 原告は、別表１ないし３の各「確定申告」欄記載のとおり、青梅税務署長に対し、本件各年分に係る所得税の確定申告書（以下「本件各確定申告書」という。）を提出した。\nなお、本件各確定申告書には、それぞれ「譲渡所得の内訳書」（以下「本件各内訳書」\nという。）が添付されているところ、本件各内訳書のうち、平成２７年分及び平成２８年分の各確定申告書に添付されていたものには、本件各土地の売却理由につき「借入金を返済するため」という項目にチェックがされていたが、平成２９年分の確定申告書に添付されていたものには本件各土地の売却理由についての記載はなかった。（乙１～３）\nイ 青梅税務署長は、平成２９年７月２８日、原告が平成２８年分の所得税等の申告において、予定納税額を控除していなかったことから、別表２の「更正処分」欄記載のとおり、\n同年分の所得税等の税額等の更正（以下「平成２８年分更正処分」という。）をした（乙\n４）。\nウ 原告は、平成３０年７月２３日、平成２９年分の所得税等の申告において、予定納税額を控除していなかったとして、別表３の「更正の請求」欄記載のとおり、同年分の所得税等の税額等につき更正の請求をし、青梅税務署長は、平成３０年８月２８日、別表３の\n「更正処分」欄記載のとおり、同年分の所得税等の税額等の更正（以下「平成２９年分更正処分」という。）をした（乙６）。\n\n\n（３）別件訴訟についてア 原告は、本件各土地の売却並びに原告名義の普通預金口座（Ａ銀行●●支店・口座番号\n●●●●（以下「本件口座」という。））及び売却代金の管理を任せていた乙が、本件各土地の売却代金の一部を横領したとして、乙に対し、不当利得に基づき３億４７５４万３０\n００円及びこれに対する平成２９年９月１１日から支払済みまで民法７０４条前段所定の法定利息の支払を求めて、東京地方裁判所立川支部に別件訴訟を提起した（甲１４、１８、\n１９）。\nイ 東京地方裁判所立川支部は、平成３０年１０月１１日、弁論の全趣旨により、乙が請求原因事実を争ったものと認めるとした上で、証拠及び弁論の全趣旨によれば、請求原因事実が認められるとして、原告の別件訴訟に係る請求を認容する旨の判決（以下「別件判決」\nという。）をし、別件判決は同月２７日に確定した（甲１９、２０）。\n\n\n（４）本件各更正請求等ア 原告は、平成３０年１１月１６日、本件各年分の所得税等について、それぞれ本件横領による被害にあったことを理由に雑損控除を適用して計算した税額による更正を求める旨の本件各更正請求をした（甲１～３）。\nイ 青梅税務署長は、本件各更正請求に対して、令和元年５月２２日付けで本件各更正請求につき更正をすべき理由がない旨の各通知処分（本件各通知処分）をした（甲４～６）。\nウ 原告は、令和元年６月９日、本件各通知処分を不服として、青梅税務署長（再調査審理庁）に対して再調査の請求をしたが、青梅税務署長は、同年８月３０日付けで同再調査の請求をいずれも棄却する旨の決定をした（甲７、８）。\nエ 原告は、令和元年９月１６日、本件各通知処分を不服として、国税不服審判所長に対して審査請求をしたが、国税不服審判所長は、令和２年６月４日付けで、同審査請求をいずれも棄却する旨の裁決をした（甲９、１３）。\n\n\n（５）本件訴えの提起原告は、令和２年１０月１４日、本件訴えを提起した。\n３ 被告が主張する本件各通知処分の根拠及び適法性本件において被告が主張する本件各通知処分の根拠及び適法性は、別紙３「本件各通知処分の根拠及び適法性」に記載のとおりである。\n\n\n\n\n\n\n第３ 争点及び争点に関する当事者の主張\n\n\n１ 本件横領の存否\n（原告の主張）\n\n\n（１）原告は、乙に対し、本件各土地の売買等に関する金銭管理を委ねていたところ、乙は売却代金の一部である３億４７５４万３０００円を横領し（本件横領）、別件訴訟において、本件横領に係る原告の乙に対する同額の不当利得返還請求を認容する旨の別件判決がされ、別件判決は確定した。\n\n\n（２）被告は、被相続人が乙に対し２億２０００万円の債務を負っていたと主張するが、そのような事実はなく、平成２８年１１月１３日付け「相続についてのお尋ね（相続税申告の簡易判定シート）」（乙２０。以下「本件お尋ね」という。）は、乙が原告の同意なく青梅税務署に提出したものにすぎない。\nなお、原告は、本件相続に関する相続税の対応を乙に任せていたものであるが、乙が虚偽の内容を含む本件お尋ねを提出したのは、一時的にせよ相続税の支払を免れて、本件相続に係る相続財産をできる限り横領するためであったと考えられる。\n（被告の主張）\n\n\n（１）原告は、別件判決等を根拠に本件各年分において本件横領による損失が生じたとするが、\n別件訴訟においては、乙は一度も裁判所に出頭しておらず、本件横領の事実の有無について実質的な審理は行われていない。加えて、乙は、別件訴訟の弁論終結後に原告の主張を否定する旨を記載した答弁書を提出するなどしていたのであるから、確定した別件判決の存在をもって、本件横領の事実が認められるものではない。\n\n\n（２）また、以下のとおり本件横領の事実の存在を疑わせる事情があり、本件横領の事実が立証されたということはできない。\nア 原告は、本件口座の開設後から本件横領が発覚するまで乙に本件口座の管理を任せており、本件口座から現金での引出しや振込みによって乙に売却代金を横領された旨主張する。\nしかし、本件口座の取引明細（乙１７）によれば、本件口座からの乙宛ての送金記録は合計１億７４００万円にとどまるほか、本件口座から原告宛ての送金記録も多数存在しており、本件口座の管理を乙のみが行っていたのか判然としない。\nイ 原告は、乙に本件各土地の売却等に関する金銭の管理を委ねており、また、乙に報酬を支払う旨記載された顧問契約書を作成したとしながら、別件訴訟で提出した陳述書（乙１\n９）では当該契約に係る報酬は支払っていないとされている。\nしかしながら、原告が乙に依頼した業務の内容及びそれに対する報酬の額が不明である以上、乙が原告からの委任の範囲を超えて横領したか否かを確認することができているとはいえず、また、本件横領の額の中に乙に対する報酬が含まれていないといえるのかという疑問もある。\nウ 本件各内訳書のうち平成２７年分及び平成２８年分の各確定申告書に添付されたものには、本件各土地の売却理由につき「借入金を返済するため」との項目にチェックがされているところ、本件相続に関して青梅税務署長に提出された本件お尋ね（乙２０）には、被相続人が乙に対して２億２０００万円の債務を負担していた旨が記載されており、本件口座から乙宛てに送金された金額（１億７４００万円）は上記債務の金額よりも少額である。\nこれらの記載内容からすると、仮に、本件口座を乙のみが管理しており、かつ、本件口座の預金を乙が自己に帰属する金員として費消していた部分があったとしても、当該金員は被相続人に対する貸付金の返済として受領したものではないかとの疑いも生ずる。\n２ 雑損控除の時期等\n（原告の主張）\n\n\n（１）横領による被害が発生した場合においては、各被害発生年度において、当該年度に生じた被害額を雑損控除の対象となる損失として計上できると解するのが相当である。\nすなわち、法人税基本通達２－１－４３は、他の者から支払を受ける損害賠償金の額は、\nその支払を受けるべきことが確定した日の属する事業年度の益金の額に算入するのであるが、\n法人がその損害賠償金の額について実際に支払を受けた日の属する事業年度の益金の額に算入している場合には、これを認める旨を定めており、益金の額に算入する収益の額の帰属年度については、原則として権利が確定した日が属する年度となるところ（権利確定主義）、\n所得税法においてもこれと同様に解釈するのが合理的である。\nなお、上記の点は、所得税基本通達５１－７及び８が、横領被害による損害賠償金の金額の確定やその支払があった場合、それらの事実が属する年分において考慮するのではなく、\n遡及して横領による損失が生じた年分の申告内容の訂正をする旨を明確に定めていることからも明らかである。\n\n\n（２）以上によれば、仮に、原告の乙に対する請求権（以下「本件債権」という。）についての\n「支払を受けるべきことが確定した日」を別件判決の確定日としたとしても、当該確定日は本件各年分より後の平成３０年１０月２７日であることから、本件各年分については損失のみが計上されることになるというべきである。\n（被告の主張）\n\n\n（１）居住者又はその者と生計を一にする親族の有する資産について、災害、盗難又は横領による損失が生じた場合において、その年における損失の金額の合計額が、その損失の金額のうちに含まれている災害関連支出の金額の多寡に応じて定められている限度額を超えるときは、\nその超える部分の金額が、その者の総所得金額等から雑損控除として控除される（所得税法\n７２条１項）。これは、どの家計にも災害や病気などに伴う資産の損失や特別な支出が生ずるところ、かかる損失等のうち日常生活に通常伴う程度のものは課税最低限でカバーされる一方、それが相当の額となれば、その損失等による担税力の減殺も当然に生ずることになるから、一般的な家計の負担の水準を上回って偶発的に損失や支出を余儀なくされるもので、\n災害、盗難又は横領という不可避的な損失については、納税者の税負担を軽減するための税制上の配慮として設けられたものと解されている。\n他方、所得税法７２条１項は、雑損控除の対象となる損失の金額は、保険金等により補填される部分の金額を除いて算定する旨規定しているところ、その趣旨は、雑損控除が所得税法に定められた所得控除の一種であり、一定の金額を超える雑損失は納税者の担税力を弱めるという考え方に基づき、この担税力の低下を課税上考慮しようとするものであり、保険金等でその損失の金額が補填される部分については、実際に損失が生じているとはいい難く、\n担税力が低下したとはいえないことにあると解される。\nそして、横領による損失については、同損失が発生した場合に同時に発生する横領行為者に対する損害賠償請求権が回収不能となったときにその属する年度の損失として確定し、その損失が雑損控除の対象として控除されるものと解される。\n\n\n（２）なお、原告は、法人税法基本通達２－１－４３に係る取扱いを前提として、各被害発生年度において当該年度に生じた被害額を雑損控除の対象となる損失に計上できるなどとする。\nしかし、法人税法においては、不法行為により生じた損失の額を損金の額に算入するとともに、相手方から支払を受ける損害賠償金の額を益金の額に算入することとしているのに対して、所得税法においては、不法行為により資産について生じた損失の額を、その資産の区分に応じて必要経費に算入又は雑損控除の対象とした上で、相手方から支払を受ける損害賠償金の額については、これを損失の額から控除するとともに、各種所得の収入金額には算入しないこととしているものであり、法人税法と所得税法とでは、不法行為により生ずる損失の取扱いが基本的に異なっているのであるから、法人税基本通達に係る取扱いが所得税法の雑損控除の対象となる損失の額の計算において参考になるものではない。\n３ 乙からの回収可能性について\n（原告の主張）\n前記２（原告の主張）によれば、本件横領による被害が発生した時点で損失を計上し、その後、「支払を受け」あるいは「支払を受けるべきことが確定した」場合に、これがその日の属する年度の所得として計上することになるため、損失の計上との関係では、原告の乙に対する本件債権が回収不能か否かは問題とはならないと解される。\n仮に、損失として計上するためには本件債権につき回収不能であることが必要とされたとしても、乙は、別件訴訟において答弁書を提出せず、期日に一度も出頭しなかったこと、乙が別件訴訟で提出した移送申立書（甲１５）には「現在定職についておらず、不定期のアルバイトで最低限の生活費を得ている状態であり、東京地方裁判所立川支部に出廷する交通費も捻出することが不可能である」とされていること、乙は原告からの平成３０年２月５日付け内容証明郵便を受領せず、現在に至るまで音信不通であること、原告は、興信所に依頼して乙の銀行口座の調査を行ったが、同調査により確認された口座の残高はほとんどなく、強制執行により本件債権の回収を図ることもできない状況にあることなどに照らせば、本件債権については回収不能というべきである。\n（被告の主張）\n\n\n（１）一般に、債権の回収不能とは、債務者の資産・負債の状況のほか、債務者の生活状況、素質、能力及び年齢その他諸般の状況に照らし、社会通念上、債権の回収が不能となったような場合を意味するものと解される。\n\n\n（２）本件においては、原告が調査したとする乙の口座の情報（甲２４）は、平成３０年１月１\n５日時点における口座の状況を表したものであり、本件各年分の年末の時点における乙の口座の状況を表したものではないから、上記口座の情報により乙に対する本件債権が回収不能になっていることが証明されているとは認められない。\nかえって、本件横領が存在するのであれば、乙は、本件各年分において、いずれも１億円以上の金員を横領していたことになるのであるから、それぞれの年末の時点において当該金員を全て費消し、原告の乙に対する本件債権が回収不能になっていたとは考え難い。\n\n\n（３）原告は、乙が、別件訴訟において具体的な反論をせず、期日に出頭しなかったことなどから乙に返済の意思がなかったことを回収不能の根拠とするが、乙は、平成３０年６月４日付けで別件訴訟について移送申立書（甲１５）を提出しており、期日に出頭しなかったのは遠隔地であったためと考えられることのほか、弁論終結後ではあるものの答弁書を提出するなどしているのであって、乙から具体的な反論がなかったなどとする原告の上記主張は事実に反するものであって、回収不能を証明するものとはならない。\n\n\n\n\n\n\n第４ 当裁判所の判断\n\n\n１ 本件横領の存否（争点１）\n\n\n（１）原告は、乙による本件横領により合計３億４７５４万３０００円の損失を被ったと主張し、\nこれに関して別件判決（甲１９）を提出する。\nア しかしながら、前記前提事実、証拠（甲１９）及び弁論の全趣旨によれば、別件訴訟については、第1回口頭弁論期日に被告である乙が出頭せず、弁論終結後に原告の本件横領に係る主張を否認する旨の答弁書が提出されているところ、東京地方裁判所立川支部において、弁論の全趣旨により乙が請求原因事実を争ったものと認めるとした上で、原告が提出した証拠及び弁論の全趣旨によれば、請求原因事実が認められるとして、原告の別件訴訟に係る請求を認容する旨の判決（別件判決）をしたものと認められる。かかる別件訴訟の審理の経過等に照らせば、別件訴訟においては、本件横領の存否についての実質的な審理はほとんどされていないことが認められ、別件判決の存在をもって直ちに本件横領の事実を認めることはできない。\nイ また、前記前提事実、証拠（甲１４、乙１７、２０）及び弁論の全趣旨によれば、原告が乙に管理を委ねて本件横領がされるに至ったと主張する本件口座から乙宛てに合計１億\n７４００万円が振り込まれているところ、本件各内訳書のうち平成２７年分及び平成２８年分のものにおいては、本件各土地の売却理由が借入金を返済するためとされていること、\n本件相続に関して原告名義で青梅税務署に提出された本件お尋ねには、被相続人が乙に対して２億２０００万円の債務を負担していた旨が記載されていることが認められる。これらの各事実によれば、上記１億７４００万円については、被相続人が乙に負担していた借入金債務の返済に充てられたことが否定できず、その余の本件口座の引出し等に係る金額を乙が取得していたことを裏付ける的確な証拠もない。\nウ 加えて、証拠（乙１７）及び弁論の全趣旨によれば、本件口座から原告宛ての振込みのほか、原告から本件口座への振込みもされていることが認められるところ、本件各土地の売却代金の管理のための本件口座に原告自身が多額の金員を振り込む合理的理由も見たらず、これらの点に鑑みると、本件口座の管理を全て乙に委ねていたという原告の主張に疑問を抱かざるを得ない。\n\n\n（２）なお、原告は、本件お尋ねに関して、乙が原告に無断で提出したものであると主張するが、\n証拠（甲７、３４、乙２０、２２、２３）及び弁論の全趣旨によれば、本件お尋ねの用紙は青梅税務署から原告宛てに送付されたものであり、本件お尋ねが同封された返信用封筒には、\n原告の住所地を管轄する青梅郵便局による平成２８年１１月１９日の通信日付印が押されていること（当時の乙の住所地は神戸市である。）、本件お尋ねの回答者欄には原告の住所氏名のほか、原告が使用する携帯電話の番号が記載されていることなどに照らせば、原告自身が本件お尋ねを作成して青梅税務署に送付したことがうかがわれ、少なくとも本件お尋ねを全く把握していなかったなどという原告の上記主張は信用し難い。\n\n\n（３）以上に照らせば、原告が主張する本件横領の事実を認めることはできず、その余の点について判断するまでもなく、本件横領に係る損失の額を所得税法７２条１項所定の雑損控除として本件各年分の総所得金額等から控除することはできない。\n２ 本件各通知処分の適法性以上を前提にすると、原告の本件各年分における納付すべき所得税等の額は、別紙３「本件各通知処分の根拠及び適法性」に記載のとおりであり、これらの金額は、平成２７年分の所得税等の確定申告、平成２８年分更正処分及び平成２９年更正処分に係る各納付すべき税額といずれも同額であるから、本件各通知処分はいずれも適法である。\n３ 結論以上によれば、原告の請求はいずれも理由がないから、これらを棄却することとして、主文のとおり判決する。\n東京地方裁判所民事第３８部裁判長裁判官 鎌野 真敬裁判官 中畑 啓輔裁判官 池田 好英\n·\n．\n•\n.•..・ . ● . .● .．、． ・ ．\n•·\n \n（別紙1)指定代理人目録高 橋 紀 子 木 村智広 今 中 ．暉 中 村芳一金光昭二 的 場将男 佐藤公．・・信\n., 以 上\n ．\n·•●\n. . ．\n• • • •\n（別紙2)関係法令の定め．\n°\n:· ·.. I 国税通則法（以下「通則法」という。）\n5 通則法2 3条1項柱書きは，納税申告書を提出した者は，次の各号のいずれかに該当する場合には，当該申告書に係る国税の法定申告期限から5年以内に限り，\n・税務署長に対し， その申牛司こ係る課税標準等又は税額等（当該課税標準等又は税額等に関し次条又は26条（再更正）の規定による更正があった場合には，当該更正後の課税標準等又は税額等）につき更正をすべき旨の請求をすることができ\nio . る旨を規定し，その1号は，当該申告書に記載した課税標準等若しくは税額等の計算が国税に関する法律の規定に従っていなかったこと又は当該計算に誤りがあ\n． . ー．.•. . ． ．ったことにより，当該申告書の提出により納付すべき税額（当該税額に関し上記\n• ．\n.,.． ．\n 更正があった場合には，当該更正後の税額）が過大であるときと規定している.0\n... · ．•. ．`’，● . •\n \n●・ ●’ 2 所得税法\n·15 ． 所得税法72条1項柱書き（租税特別措置法3·1条 3項3号による読替え後のもの）は，居住者又はその者と生計を一にする配偶者その他の親族で政令で定めるものの有する資産（第6 2条第1項（生活に通常必要でない資産の災害による損失）及び第70条第3項（被災事業用資産の損失の金額）に規定する資産を除く。）について災害又は盗難若しくは横領による損失が生じた場合（その災害又は\n・盗難若しくは横領に関連してその居住者が政令で定めるやむを得ない支出をした場合を含む。）において，その年における当該損失の金額（当該支出をした金額を含むものとし，保険金，損害賠償金その他これらに類するものにより補てんされる部分の金額志除く。）の合計額が次の各号に掲げる場合の区分に応じ当該各号に掲げる金額を超えるときは，その超える部分の金額を，その居住者のその年分の総所得金額，長期譲渡所得の金額，退職所得金額又は山林所得金額から控除する旨を規定している。\n（・\n\n以上\n● ●\n-.\n.\n. —\n.●\n.\n●\n-\n＇\n.\n.\n•.\n.\n.\n.\nf\n．．．．．． .）\n \n.\n.\n● -\n·\n．\n·\n' .\n.\n.'\n.\nr\n.\n（別紙３）\n本件各通知処分の根拠及び適法性\n１ 本件各通知処分の根拠\n\n\n（１）平成２７年分ア 総所得金額 １４３１万１３７６円上記金額は、原告が平成２７年分確定申告書第一表に記載した総所得金額と同額である。\nイ 分離長期譲渡所得の金額 １億１４６４万００００円上記金額は、原告が平成２７年分確定申告書第三表に記載した分離長期譲渡所得の金額と同額である。\nウ 所得控除の額の合計額 １１４万７７３８円上記金額は、原告が平成２７年分確定申告書第一表に記載した所得控除の額の合計額と同額である。\nエ 課税される所得金額\n（ア）課税総所得金額 １３１６万３０００円上記金額は、前記アの総所得金額１４３１万１３７６円から前記ウの所得控除の額の合計額１１４万７７３８円を控除した後の金額（ただし、通則法１１８条１項の規定により１０００円未満の端数を切り捨てた後のもの。後記\n\n\n（２）及び\n\n\n（３）の各エ（ア）\nにおいて同じ。）であり、原告が平成２７年分確定申告書第三表に記載した課税総所得金額と同額である。\n（イ）課税分離長期譲渡所得の金額 １億１４６４万００００円上記金額は、前記イの分離課税の長期譲渡所得の金額であり、原告が平成２７年分確定申告書第三表に記載した課税分離長期譲渡所得の金額と同額である。\nオ 課税される所得金額に対する税額 ２０００万３７９０円上記金額は、下記の（ア）及び（イ）の各金額の合計額であり、原告が平成２７年分確定申告書第一表に記載した課税される所得金額に対する税額と同額である。\n（ア）課税総所得金額に対する税額 ２８０万７７９０円上記金額は、前記エ（ア）の課税総所得金額１３１６万３０００円に所得税法８９条\n１項の規定を適用して算出した金額である。\n（イ）課税分離長期譲渡所得の金額に対する税額 １７１９万６０００円上記金額は、前記エ（イ）の課税分離長期譲渡所得の金額１億１４６４万００００円に、租税特別措置法（平成３０年法律第７号による改正前のもの。以下「措置法」という。）３１条１項の規定を適用して算出した金額である。\nカ 復興特別所得税額 ４２万００７９円上記金額は、前記オの課税される所得金額に対する税額２０００万３７９０円に、東日本大震災からの復興のための施策を実施するために必要な財源の確保に関する租税特別措置法（以下「復興財源確保法」という。）１３条の規定を適用して算出した金額であり、\n原告が平成２７年分確定申告書第一表に記載した復興特別所得税額と同額である。\nキ 源泉徴収税額 １０万４１００円上記金額は、原告が平成２７年分確定申告書第一表に記載した源泉徴収税額と同額である。\nク 納付すべき税額 ２０３１万９７００円上記金額は、前記オの課税される所得金額に対する税額２０００万３７９０円及び前記カの復興特別所得税額４２万００７９円を合計した金額から、前記キの源泉徴収税額１０万４１００円を控除した金額（ただし、復興財源確保法２４条２項の規定により１００円未満の端数を切り捨てた後のもの。後記\n\n\n（２）及び\n\n\n（３）の各ケにおいて同じ。）であり、\n原告が平成２７年分確定申告書第一表に記載した納付すべき税額と同額である。\n\n\n（２）平成２８年分ア 総所得金額 ８４２万７２１０円上記金額は、原告が平成２８年分確定申告書第一表に記載した総所得金額と同額である。\nイ 分離長期譲渡所得の金額 １億１９４３万６８５０円上記金額は、原告が平成２８年分確定申告書第三表に記載した分離長期譲渡所得の金額と同額である。\nウ 所得控除の額の合計額 １０８万８９８３円上記金額は、原告が平成２８年分確定申告書第一表に記載した所得控除の額の合計額と同額である。\nエ 課税される所得金額\n（ア）課税総所得金額 ７３３万８０００円上記金額は、前記アの総所得金額８４２万７２１０円から前記ウの所得控除の額の合計額１０８万８９８３円を控除した後の金額であり、原告が平成２８年分確定申告書第三表に記載した課税総所得金額と同額である。\n（イ）課税分離長期譲渡所得の金額 １億１９４３万６０００円上記金額は、前記イの分離課税の長期譲渡所得の金額（ただし、通則法１１８条１項の規定により１０００円未満の端数を切り捨てた後のもの。）であり、原告が平成２８年分確定申告書第三表に記載した課税分離長期譲渡所得の金額と同額である。\nオ 課税される所得金額に対する税額 １８９６万７１４０円上記金額は、下記の（ア）及び（イ）の各金額の合計額であり、原告が平成２８年分確定申告書第一表に記載した課税される所得金額に対する税額と同額である。\n（ア）課税総所得金額に対する税額 １０５万１７４０円上記金額は、前記エ（ア）の課税総所得金額７３３万８０００円に所得税法８９条１項の規定を適用して算出した金額である。\n（イ）課税分離長期譲渡所得の金額に対する税額 １７９１万５４００円上記金額は、前記エ（イ）の課税分離長期譲渡所得の金額１億１９４３万６０００円に、措置法３１条１項の規定を適用して算出した金額である。\nカ 復興特別所得税額 ３９万８３０９円上記金額は、前記オの課税される所得金額に対する税額１８９６万７１４０円に、復興財源確保法１３条の規定を適用して算出した金額であり、原告が平成２８年分確定申告書第一表に記載した復興特別所得税額と同額である。\nキ 源泉徴収税額 ７万８２００円上記金額は、原告が平成２８年分確定申告書第一表に記載した源泉徴収税額と同額である。\nク 予定納税額 １８４万１６００円上記金額は、原告の平成２８年分の所得税等に係る予定納税額（第１期及び第２期の合計額）である。\nケ 納付すべき税額 １７４４万５６００円上記金額は、前記オの課税される所得金額に対する税額１８９６万７１４０円及び前記カの復興特別所得税額３９万８３０９円を合計した金額から、前記キの源泉徴収税額７万\n８２００円及び前記クの予定納税額１８４万１６００円を控除した金額である。\n\n\n（３）平成２９年分ア 総所得金額 ２５６万０３１１円上記金額は、原告が平成２９年分確定申告書第一表に記載した総所得金額と同額である。\nイ 分離長期譲渡所得の金額 １億２１０１万８０００円上記金額は、原告が平成２９年分確定申告書第三表に記載した分離長期譲渡所得の金額と同額である。\nウ 所得控除の額の合計額 １０１万４８３５円上記金額は、原告が平成２９年分確定申告書第一表に記載した所得控除の額の合計額と同額である。\nエ 課税される所得金額\n（ア）課税総所得金額 １５４万５０００円上記金額は、前記アの総所得金額２５６万０３１１円から前記ウの所得控除の額の合計額１０１万４８３５円を控除した後の金額であり、原告が平成２９年分確定申告書第三表に記載した課税総所得金額と同額である。\n（イ）課税分離長期譲渡所得の金額 １億２１０１万８０００円上記金額は、前記イの分離課税の長期譲渡所得の金額であり、原告が平成２９年分確定申告書第三表に記載した課税分離長期譲渡所得の金額と同額である。\nオ 課税される所得金額に対する税額 １８２２万９９５０円上記金額は、下記の（ア）及び（イ）の各金額の合計額であり、原告が平成２９年分確定申告書第一表に記載した課税される所得金額に対する税額と同額である\n（ア）課税総所得金額に対する税額 ７万７２５０円上記金額は、前記エ（ア）の課税総所得金額１５４万５０００円に所得税法８９条１項の規定を適用して算出した金額である。\n（イ）課税分離長期譲渡所得の金額に対する税額 １８１５万２７００円上記金額は、前記エ（イ）の課税分離長期譲渡所得の金額１億２１０１万８０００円に、措置法３１条１項の規定を適用して算出した金額である。\nカ 復興特別所得税額 ３８万２８２８円上記金額は、前記オの課税される所得金額に対する税額１８２２万９９５０円に、復興財源確保法１３条の規定を適用して算出した金額であり、原告が平成２９年分確定申告書第一表に記載した復興特別所得税額と同額である。\nキ 源泉徴収税額 ７万３０００円上記金額は、原告が平成２９年分確定申告書第一表に記載した源泉徴収税額と同額である。\nク 予定納税額 ６６万３６００円上記金額は、原告の平成２９年分の所得税等に係る予定納税額（第１期及び第２期の合計額）である。\nケ 納付すべき税額 １７８７万６１００円上記金額は、前記オの課税される所得金額に対する税額１８２２万９９５０円及び前記カの復興特別所得税額３８万２８２８円を合計した金額から、前記キの源泉徴収税額７万\n３０００円及び前記クの予定納税額６６万３６００円を控除した金額である。\n２ 本件各通知処分の適法性被告が本訴において主張する原告の本件各年分における所得税等の納付すべき税額は、前記\n１\n\n\n（１）ク並びに\n\n\n（２）及び\n\n\n（３）の各ケで述べたとおり、それぞれ、\n平成２７年分 ２０３１万９７００円平成２８年分 １７４４万５６００円平成２９年分 １７８７万６１００円であるところ、上記各金額は、いずれも本件各更正請求の直前の申告又は更正処分（平成２\n７年分は、平成２７年分確定申告書、平成２８年分は、平成２８年分更正処分、平成２９年分は、平成２９年分更正処分）に係る納付すべき税額といずれも同額であるから、原告が行った本件各更正の請求に理由がないとして行われた本件各通知処分はいずれも適法である。\n以上\n..' ..別表 平成21年分通知処分に係る経緯等\n• 項 目 羅定申告 ． 更 平 正 成2 の 7年 請求 分 ・ ．” ・ ． ・ 平 通 成 知 27 処 年 分 分 ・ 再調査請求＇ ， 再調査決定 ・ 審 , 査 . 請求 ヽ ' ’ .. :審査裁 . 決 . ．\n. ． ．申告等の年月B 平成、 2 ． 8年月3 ． i6日 平成30年11月16日 令和元年5月i2日 令和' 元年6月9• 日 ' 付け ' 令和元年8月30日 令和元年9月16日 ．令和碕渇月4日 ．’総 ．所 得\n＂金\n額・・\n① •14, 31、1,316 'J.4,311,376 ( ②, 十’' ③ ．． ．） ·‘ ， ．． ． ．． 、 •, ． ．内\n不動産所得．の金額 ② 11,.161!,176 11:168,176\n.. .\n．． ． ． ' '訳 .m. ’ ヽ給与 得の金額・ ③ •3,r 43,200 3,143.2-00 そ\n．．\n． ．平 棄 平 棄．\n．．\n の 成 ． 成 分雇長期譲渡所得の金額・・ ． ④ ・ '114,640;000 l l4 ,6 4 0 ;0 0 Q ．． ， ． ,., ' . 更 ．． .. 2· ．．' .·. 2 ： ．、 所得控除の額の合·' 計額 .. ． ． . ••{ . .⑥ · + . ⑦ ・ ） .⑤ •1,1 47,738 105,252,60.i ·jE. ． ． ？ 7. .\n. ' . ｝雑 損 ． ． 控 ． 除 ' .@ -.. •1 04,104,863 ..を ． ． . ． . 年 年 ..内\n訳 諜 ． , ． • 税 そ の の 合 穏 他 . の . ー • 所 ．□ 所： 計 得 得 控 金 金 除\n．．\n， の 額 額 額 • ⑦ •1;147,738 [,14 i ,138 ・・ペす\nき ．． 一、 ·, . :\n•·分通 ．． ． ．分 . 通 . •,\n.\n' ．\n.'\n. ． （ ． (l)•9・9 '• - ⑤ ） • ． • ⑧ , '13,163;00 ｀．0 0 ．． ・ ．理 ．． ．． 知'.· 知． ． ·\n＇ 課税\n⑧\n.に\n分離 ·.対\n長期す\n． 譲渡る\n＇ .•税\n． 得所額\n金額\n• ⑩\n⑨． 114\n•2\n,6\n,8\n�\n0\n7．\n,\n,\n7\n9\n0\n.2 3,69�\n•.\no, o\n•\no\nO由\nが\n. . ．処分\n・；． .. 処分 ． ．\n\"\n．．の のな\n⑨．に対する税額． ⑪ • .1 7,196',0.00 .． .3, 554;700 �ヽ· 全 ． ． ． ．・ ． ． . ·. . ・ 全 ,'基·準所得税額 ' ・・ ． 部 ‘ •: 輝 ,. 、 ⑫ . (. ⑩ ＋ ⑪.） •・ ．、 20,00�,790 3,554,700. • • . ·に臼コ .- ． ．取 ：\n,·\n・ . .'復 '( 興 ⑫ 特 .·x, 別所 ・' 得 Z.l 税 % の 額： · ). ．． • ⑬ · · • 420,079 74-,\"6 48 ・ .· ・通 の ．’ '•• ．． 潤 • ｀ ．消 . 取 ' ;\n．． 源 • 泉· ・． 徴収 税． 額 ． ⑭ 10 4 ,1 0 0 ． ． • ..104,100 ,' ・ ・ ・知 .. し． ． ． 、 ． 却 ． ．． ・ .. し ・ .. 却 ． ． ／ ． ・ 予 定． ・ 納 ' 税 • 額 ' .• ／ ’’ .. ． ． ・ ⑮ ‘ .. ： ． ．．\n，• 納 （⑫ 付 十 す ⑬ ．． べ ー ． ⑭ き 一 税 • ．⑮ 額 ）', ⑯ .. • ·' 20,3197,00 • 3,-525;20 0 ぱ ， 千 円 未 潤 の 蟷 数 t 切 り 捨 て た 後 の 金 1 で あ る （国 税 通 則 fl 1 1 8 条 1 項 。 以 下 ， 9\n● • \n. 表1-2及び1.:..3'\n_ • •. ．． , _\n. .\n.\n●\n. ..\n• • . ．\n．．\n．．\n. ,;..\n• . : ...•• • · . ·、 し ·.\n▼ . '\n• . 埠\n. ,:.\n \n． ．\n．． '｀.．\n．\n＇ · '\nヽ\n.' ．． ．．．\n（注1)I• 課税総所需金頭」及び1課祝分疇長刀細震所得金躙J(•上記⑥及び②躙）の金額 • . •. において同じ．）．． ， ． • ·\n_:..俎沿．屯坦ぢ芯序円警：！唸9Jもぷ悶？ の端数籾り捨てた後の金額である僚：日本大震災からの復興のための施策を実篇するために必要な財源の口保に関する特別措置法24 • .• ..\n.: .\n: ...-..\n• 9\n:. .\n.\n.\n.. • ●―・・ ． ．・\n:\n.\n:. ・＇ �. 別 表 2'\n. \"...\n....参..•..•\n`’ ．\n＇ヽ ．． ●● •’●’•平成28年分通知処分に係る経緯等 • • ・・ ． ', ・ · . • . • • · : . .\n●, J\n•, :..\n｛単位';円）\n項 目 • ·\n’申｀告 等の年月日総 ’ '所・ 得．金額1. I .. ①' （．②,十：．9 ③.\n＇伍翌芸分 離 畏 期• 譲 渡 所 得 の 金 額\n” 求 審査裁決 • • ...年\n平成ごこしこここ竺」令ごこ』ここ」二：令和：査：月16日 令和2 6月4日\n8,427,2IOl\n..\n'.. ② . ．. .\n③\n．9 '所得控除の額の合計額・ (· ⑥十．⑦ ：)臼壺五鰈税総所得金● 額 (<D..;,..●⑤)\n:'諫税分隣． 長翔譲渡所得金額．\n⑧•に対する税額\n8 4, 2 7 2, 1 0 1 • · . • 8\n5 :9, :\n」 ゜0\n: モ\nI• ; · •\n• • :、 -'.. .・'\n5,8 05,6 10 . -5, 80 5 - ,61 0 | .\n�.621,600 2,621;600 .• ..2;621,6001.\n；・\n, ① 119心6,850 ll 9',436,850.. ll�,436,850 ． 更 •, ． · .\n;.< . ·. ⑤' . 1,088,983 1―,088_,983 1 • 01,325,5T,7 • 8·\n· •\n⑥., 1.00,236,594 を ...年 ・'\n． ＇ す． ．\n. 1,0灰，983•· ⑦ ,.. ・\n· ⑧ 'r 7,338ー·，000|7ー,338,000\n⑨ ·119,436,00Q\n．，⑩ .’• ·\n． ．\n1 1 9 4, 3 6 0, 0 0\n1, 9 -...· . ::\n· 26;538,000\n。\n. 1,051,7如 1,051;.740\n⑪\n⑨．に対する税額． ＇. 17,915,400\n-·. . 基\n（準\n⑩\n· ·所 ’\n＋\n' 得 ’ . 税\n⑪\n, 額\n)\n• · • ⑫ . 18 . , . 96 . 7,140,.復興特別所得税の；額· . （⑫．· X 2.1 %.)泉 徴醗 収 税 額，\n⑬一⑭\n17、915;400,.\n18,967,1-40\n. 398,3og\n•78,200\n3 9 8 3, 0 9\n78,200\n. '.. •, '\n. 1 8, 4 1 6, 0 0\n3\n9,\n9,\n8\nQ\n7,\n1;\n0\n0\n83,594''\n1 8 2, 0 0\n・・ 平棄 棄成\n、. · _ ...• . � 2 ．.\n8 ．年\n分\n．\n．\n．\n.. 分．\n• ．. 通 ． ． ． ． ． 通·理．\n． .知\n.由\n処\n·が\n••分\n． ． な の\n・し‘ 全\n・ ． 部旨\nの ＇ 取·· 通 ．＇消\n．．却\n知 し知処分の全部取消し\n．．．． ．． ，却\n,'予定納税額 ・ ⑮ °’’ o\n1.\n_...、 ·•納 （⑫ ・付 ヤ ャ ⑬ •ぺ ＇ 一⑭ き ー ・税 ⑮ 額 ） ⑯ 19,287,20 •‘ 0 1 7 4,- 4 5 6, 0 0 紐 8 6 0, 0 0 \n. ', .\n16 ．．．．． ．．．．\n\n•,• ..” ·\n．別表3 平成29年分通知処分に係る経緯等 ．．\n• ' ..:. 項 、. ’目． 確定申告 ·.\n'申 ． :1告．． 等．の• ,年 月•日’ ‘ 平成30年3月が日\n・総’\n（ ② 所 得 ＋ ． 金 ③ ・ 額 ） ． ·<D. 2,660,311\n' \n' '·.. 不動産所得の金額 ② ., II4,711 内訳．\n.\n \n＇． ．．\n：\n \n． ． ． ． ． \n・\n.\n．．\n•\n・\n．\n．・\n.\n．．・\n• .\n・. ・． ・\n．.\n●\n・ ・\n.\n• ・...\n• ●● ● ·• ...更正 ‘• の請求 更正処．分． ． . ． · ．平 更• 正· 血 11). 9 請 年分 求 ・ 平 通 成2知9 処 年分 分 ' 再調査請求．． 再＂査決定 審査請求\n·. ' 平成30年7月23日 平成30年8月28日 平成30年 ・ i .. l月•16R . 令..和元.年 . 6月 22日 令和元年6月9日付け令和元年8月•30日 令和元年9月16 i 日\n• ・ • 2,660,311 ·・ : ·2,560 •. 311 2,560,311 ・ ． ． -\n．． 1 14 , 7 11 ｀ノ .114,711 .. ,. l l4,711 ',. ． ． ．．． ．．\n． ． ．\n.. ’•• ； し給与所得の金額＇’ ③ 2,;4 ー 4 ・ 5,6.90 . `.2,445',600. 2,445,600 · 2;445,600 ，そ ：平 棄' ． ：平 ， 分隈長期譲渡所得の金額 ． ④ 121,01.8,000 121,018,000 121,018,000 \" ． ． ，． ．． ’ ．，＇\n.. （ 所 ． 得 ・⑤ 控 ． 除 ・' + の額の合 ⑦ 計額 ) '@ 1,014,835 1,014,835 1,014,836 ', 雑• 積·・｀控．． . 除 ．． ® ＇ '内 ． ： . .訳 .. そ の の ・・ 他 合 の 計 所得控 金 除の額 額' ⑦ 1,014,835 1,014,835 . • 1,014-,835\n・ 課 .税. 総 ． 所 得 ・金 額 · （ ① 一 ⑤ ．） ® '• ． . ． l.;545,000 1, ． 6 ． 4 5',000 ·.i,545;000 ..\nヽ課税分離長期譲渡所得金額 ® 121;018,000 121,018,000 121,018,000\n.. ・＇・ ： ．． ®に対する税額 ® • 77,260 . 77,250 ”,250\n⑨に対す . く . る 税額 ‘ ・⑪ • 18,162,70.0. ． ． . 18.,152,700 18,152;700 ・ ・ ・・ 基 ( 準 .⑩ ． ’ 所 ． ＋ ．得 ． ． 税 ⑪ ． 額 ） ⑫ 18,22 . 9 . ,950 . 18,229,950 18,229;960 ． ． ｀ ・ ． 復 （• 真 ⑫ 特別 x · 所 u 得 税 % の . 額 ). ・ ⑬ •. • 382;828 382,828 ”、 . -382,828 ． ．源泉徴収税 額 ⑭ ．． 7:!,000 73,000 . 73,000 9, . ＾ ゜予定納 ・・税 額 ’ ⑮ ： ·663·,函. • • ·663,600.\n•’納 付 ’ 十 べき 税額 •'• ゜\n⑯ ・ · • 18,539 ..7 0 '. 17,87�1100 • 17,876,ll)O ． •⑫（ 十 @ . - •⑭ ― ⑮ ) .\n．． ． の 成＇ 121,018,000 ． ． 更 ·2 ' . '\n• ： 曲 10 . � ． . ． . 1 1 7 6 7 2 ; , 0 1 0 6 . 4 9 正 を ・ ．， •. ; ・ 年 9 ｀ ． ' ， ． ' ． • . ヽ ず ・、\n．． 分 1,014,835' ・．ベ\n： 通\n゜ き .. 知．，•\n・理\n..\n．．\n1 ヽ 7,401,000. 由· ， 処 ． ． ．．\n... ·o 、\" ． ・カs . 分 ．の••. •な ． ． :· 祖10,lfjO ． ． ． ． ． ． しヽ． ． ． ．全· • 2,610,150 旨・・ 部・． .. ． の ． ． 取• 64.8�3 ・ 通 ．．消\n73.-000 知・ ..\n663,600 .,\n’I;928,30.0 ． ．． ．\n \n．・. •.\n.,..\n・＇\n，，\n(lll位：円）\n．事査戟決\n 令和2年6月4日．\n..\n•' ..棄・ : : 成 .• \" •. 2..\n： .,.9 .. ： •こ . \" ．． ． ． ・年..\n,·. 分\n·通\n.. ．． 知処\n． ． ．分-· ：の\n． ． 全 ． .• ． .. _:.. 蔀 ： . •取• ・ ・ •: ，消 ．． ． ． ． ’ ’\n： し .. ・・ ． 却． 、 •． ． し .. ・ 却 ． ． ． ‘\n． ． ． ,: ' . ． ． ． \n•.\n｀今 \n． ．\n. . •• :"
}