{
  "number": "13674",
  "title": "所得税更正処分等取消請求事件",
  "court": "東京地方裁判所",
  "date": "令和４年２月２４日",
  "date_iso": "2022-02-24",
  "result": "取消",
  "topics": [],
  "laws": [],
  "keywords": [],
  "sections": {
    "主文": [
      "１ 原告の請求を棄却する。\n２ 訴訟費用は原告の負担とする。"
    ]
  },
  "full_text": "13674 所得税更正処分等取消請求事件 - 国税庁判決事例集\n\n\n\n\n\n\n\n\n\n\n目次に戻る\n\n\n\n\n判決 13674\n\n\n所得税更正処分等取消請求事件\n\n\n\n\n裁判所:\n 東京地方裁判所\n\n\n判決日:\n 令和４年２月２４日\n\n\n結果:\n 取消\n\n\n\n\n\n\n主文\n\n\n１ 原告の請求を棄却する。\n２ 訴訟費用は原告の負担とする。\n\n\n\n\n\n\n第１ 請求昭和税務署長が平成\n\n\n３１年３月１２日付けでした原告の平成２５年分所得税及び復興特別所得税の更正処分のうち上場株式等の譲渡所得の金額２０億９０２０万１９５４円、納付すべき税額１億４９４７万９６００円を超える部分及び過少申告加算税の賦課決定処分を取り消す。\n\n\n\n\n\n\n第２ 事案の概要原告は\n\n\n、同一銘柄の上場株式を、租税特別措置法（平成２５年法律第５号による改正前のもの。以下同じ。）３７条の１１の３第３項１号に規定する特定口座と特定口座以外の口座の双方において保有していたところ、平成２５年６月１３日から同月２４日までの間に、そのうち特定口座以外の口座において保有する株式のみを譲渡した。\n本件は、原告が、上記譲渡に係る譲渡所得の計算上控除する資産の取得費に算入する金額は、\n特定口座以外の口座において保有する当該上場株式の取得価額だけでなく、特定口座において保有する当該上場株式の取得価額も含めて所得税法施行令１１８条１項に規定する総平均法に準ずる方法により算出した額であるとして、平成２５年分の所得税及び復興特別所得税の申告をしたところ、処分行政庁は、上記取得費に算入する金額は、特定口座において保有する当該上場株式の取得価額を含めずに算出すべきであるとして、平成２５年分の所得税及び復興特別所得税に係る更正処分及び過少申告加算税の賦課決定処分をしたことから、同更正処分のうち原告主張額を超える部分及び同賦課決定処分の取消しを求める事案である。\n１ 関係法令の定め本件に関する法令の定めは別紙２－１ないし２－６のとおりである。また、上場株式等の譲渡所得の計算に係る法令等の定めの概要は以下のとおりである。\n\n\n（１）有価証券を譲渡した際の取得費の計算に関する所得税法等の定めア 譲渡所得について所得税法３３条は、譲渡所得とは、資産の譲渡による所得をいい、その年中の譲渡所得に係る総収入金額から当該所得の基因となった資産の取得費及びその譲渡に要した費用の額の合計額を控除し、その残額の合計額から譲渡所得の特別控除額を控除した金額を譲渡所得の金額とする旨規定している。\nイ 必要経費、譲渡所得の金額の計算上控除する取得費について所得税法３７条１項は、その年分の事業所得の金額等の計算上必要経費に算入すべき金額は、別段の定めがあるものを除き、これらの所得の総収入金額に係る売上原価その他当該総収入金額を得るため直接に要した費用の額及びその年における販売費、一般管理費その他これらの所得を生ずべき業務について生じた費用の額とする旨規定している。\n所得税法３８条１項は、譲渡所得の金額の計算上控除する資産の取得費は、別段の定めがあるものを除き、その資産の取得に要した金額並びに設備費及び改良費の額の合計額とする旨規定している。\nウ 有価証券の譲渡原価等の計算及びその評価の方法について所得税法４８条１項は、居住者の有価証券につき同法３７条１項の規定によりその者の事業所得の金額の計算上必要経費に算入する金額を算定する場合におけるその算定の基礎となるその年１２月３１日において有する有価証券の価額は、その者が有価証券について選定した評価の方法により評価した金額（評価の方法を選定しなかった場合又は選定した評価の方法により評価しなかった場合には、評価の方法のうち政令で定める方法により評価した金額）とする旨規定している。所得税法施行令１０５条１項１号は、所得税法４８条１項の規定による有価証券の評価額の計算上選定をすることができる評価の方法として、\n総平均法を定めている。総平均法とは、有価証券をその種類及び銘柄（以下「種類等」という。）の異なるごとに区別し、その種類等の同じものについて、その年１月１日において有していた種類等を同じくする有価証券の取得価額の総額とその年中に取得した種類等を同じくする有価証券の取得価額の総額との合計額をこれらの有価証券の総数で除して計算した価額をその一単位当たりの取得価額とする方法をいう（所得税法施行令１０５条１項１号）。\n所得税法４８条３項は、居住者が二回以上にわたって取得した同一銘柄の有価証券につき、同法３７条１項の規定によりその者の雑所得の金額の計算上必要経費に算入する金額又は同法３８条１項の規定によりその者の譲渡所得の金額の計算上取得費に算入する金額は、政令で定めるところにより、それぞれの取得に要した金額を基礎として、同法４８条\n１項の規定に準じて評価した金額とする旨規定している。所得税法施行令１１８条１項は、\n所得税法４８条３項に規定する、雑所得の金額の計算上必要経費に算入する金額又は譲渡所得の金額の計算上取得費に算入する金額は、当該有価証券を最初に取得した時（その後既に当該有価証券の譲渡をしている場合には、直前の譲渡の時。）から当該譲渡の時までの期間を基礎として、当該最初に取得した時において有していた当該有価証券及び当該期間内に取得した当該有価証券について、所得税法施行令１０５条１項１号に掲げる総平均法に準ずる方法（以下「総平均法に準ずる方法」という。）によって算出した１単位当たりの金額により計算した金額とする旨規定している。\n\n\n（２）株式等に係る譲渡所得等の課税の特例租税特別措置法（以下「措置法」という。）３７条の１０第１項及び租税特別措置法施行令（平成２５年政令第１１４号による改正前のもの。以下「措置法施行令」という。）２５条の８第１項は、居住者又は国内に恒久的施設を有する非居住者（以下「居住者等」という。）が、平成１６年１月１日以後に株式等の譲渡をした場合には、当該株式等の譲渡による事業所得、譲渡所得及び雑所得（以下「株式等に係る譲渡所得等」という。）については、\n他の所得と区分し、その年中の株式等に係る譲渡所得等の合計額に対し、株式等に係る課税譲渡所得等の金額の１００分の１５（ただし、平成２０年法律第２３号附則４３条２項所定の要件を満たす上場株式等の譲渡に係る譲渡所得については、１００分の７）に相当する金額に相当する所得税を課する旨規定している。\n\n\n（３）特定口座内保管上場株式等の譲渡等に係る所得計算等の特例措置法３７条の１１の３第１項は、居住者等が、金融商品取引業者等に特定口座を開設した場合に、その特定口座に係る振替口座簿に記載若しくは記録がされ、又は特定口座に保管の委託がされている上場株式等（以下「特定口座内保管上場株式等」という。）の譲渡をした場合には、政令で定めるところにより、当該特定口座内保管上場株式等の譲渡による事業所得の金額、譲渡所得の金額又は雑所得の金額については、当該特定口座内保管上場株式等以外の株式等の譲渡による事業所得の金額、譲渡所得の金額及び雑所得の金額と区分して、\nこれらの金額を計算する旨規定している。\nそして、同項の委任を受けた措置法施行令２５条の１０の２第１項は、特定口座内保管上場株式等の譲渡による事業所得の金額、譲渡所得の金額又は雑所得の金額の計算は、個々の特定口座ごとに、特定口座以外の株式等の譲渡による事業所得の金額、譲渡所得の金額又は雑所得の金額と区分して、各所得を計算することにより行うとし、この場合において、特定口座内保管上場株式等の譲渡による譲渡所得の金額の計算上取得費に算入する金額の計算に係る所得税法４８条の規定等の適用については、措置法施行令２５条の１０の２第１項２号が、当該居住者等の有する同一銘柄の上場株式等のうちに特定口座内保管上場株式等とそれ以外の上場株式等とがある場合には、これらの上場株式等については、それぞれその銘柄が異なるものとして、所得税法施行令第二編第一章第四節第三款の規定（同施行令１０５条から１１９条まで。以下同じ。）を適用する旨規定している。\n措置法施行令２５条の１０の２第２６項は、居住者等が、特定口座から特定口座内保管上場株式等の全部又は一部の払出し（一部例外を除く。）をした場合には、当該払出し後の当該払出しをした上場株式等と同一銘柄の上場株式等（特定口座内保管上場株式等であるものを除く。）の譲渡による所得の金額の計算上総収入金額から控除すべき売上原価又は取得費の額の計算については、同項１号で、所得税法施行令第二編第一章第四節三款及び１６７条の７第３項から第６項までの規定の適用については、当該払出しをした上場株式等は、当該払出しの時に、措置法施行令２５条の１０の２第１２項２号イに規定する取得費等の額として計算される金額（同号イに規定する費用がある場合には、同号イに規定する合計額）により取得されたものとする旨規定している。そして、同号イは、取得費等の額として計算される金額について、特定口座内保管上場株式等を銘柄ごとに区分し、当該移管をした時に当該移管をした特定口座内保管上場株式等の譲渡があったものとした場合に、所得税法施行令第二編第一章第四節三款及び１６７条の７第３項から第６項までの規定（同条１項後段の規定により適用される場合を含む。）により当該特定口座内保管上場株式等の売上原価の額又は取得費の額として計算される金額に相当する金額である旨規定している。\n\n\n（４）概算取得費について平成１４年６月２４日付け課資３－１ほか国税庁長官通達「租税特別措置法（株式等に係る譲渡所得等関係）の取扱いについて（法令解釈通達）」（平成２５年９月９日付け課資３－\n６ほかによる改正前のもの。乙２）３７の１０－１４（株式等の取得価額）は、株式等を譲渡した場合における事業所得の金額、譲渡所得の金額又は雑所得の金額の計算上必要経費又は取得費に算入する金額について、譲渡をした同一銘柄の株式等につき、当該株式等の譲渡による収入金額の１００分の５に相当する金額を当該株式等の取得価額として譲渡所得の金額の計算上収入金額から控除する取得費として計算しているときは、これを認めて差し支えないものとする旨規定している（以下、当該計算により算出した取得費を「概算取得費」という。）。\n２ 争いのない事実及び当裁判所に顕著な事実\n\n\n（１）株式の譲渡に係る経緯ア 原告は、昭和４８年から平成２２年までの間に、特定口座以外の口座（以下「一般口座」\nということがある。）において、Ａ株式会社（現在の商号はＢ株式会社）の発行に係る株式（以下「本件法人株式」という。）の取得及び譲渡を繰り返し行っていた。\nイ 原告は、平成２５年６月６日、Ｃ証券株式会社（以下「Ｃ証券」という。）名古屋支店に特定口座申込書を提出し、同店との間で上場株式等保管委託契約を締結した上で、特定口座を開設した。\nウ 原告は、保有する本件法人株式８５万株のうち、平成２５年６月１１日に７２万５００\n０株を総額２１億３５８５万円で、同月１２日に１万２０００株を総額３４０３万２００\n０円で、それぞれ譲渡した。\n原告は、上記平成２５年６月１１日の譲渡の直前において、本件法人株式の全て（８５万株）をＣ証券名古屋支店の一般口座において保有していたところ、同株式について、総平均法に準ずる方法により算出した１株当たりの取得価額は５９円であった。\nエ 原告は、平成２５年６月１２日、Ｃ証券名古屋支店の特定口座において、本件法人株式\n７２万５０００株を総額２１億３８２７万７９４６円（手数料及び消費税の合計２４２万\n７９４６円を含む。）で取得した。\nオ 原告は、平成２５年６月１３日から同月２４日までの間に、一般口座において保有していた本件法人株式の残り１１万３０００株を、総額３億２０５２万２０００円で順次譲渡した（以下、これら本件法人株式１１万３０００株を併せて「本件譲渡株式」という。）。\n\n\n（２）原告に対する更正処分等ア 原告は、法定申告期限内である平成２６年３月１７日、処分行政庁に対し、平成２５年分の所得税及び復興特別所得税（以下「所得税等」という。）の確定申告書を提出した。\n同申告書において、原告は、平成２５年分の所得税等に係る株式等の譲渡所得の金額の計算上、取得費に算入する金額を、平成２５年６月１１日及び同月１２日に譲渡した本件法人株式（前記\n\n\n（１）ウ）については概算取得費とし、本件譲渡株式（前記\n\n\n（１）オ）については、特定口座で取得した本件法人株式の取得費（前記\n\n\n（１）エ）を含めて総平均法に準ずる方法により算出した。上記申告書における本件譲渡株式の取得費の具体的な計算方法は以下のとおりであった。\n（ア）１単位当たりの金額の計算\n（５９円／株×１１万３０００株＋２１億３８２７万７９４６円）÷（１１万３０００株＋７２万５０００株）\n＝２５６０円／株（１円未満の端数は切り上げ）\n（イ）本件譲渡株式の取得費の計算\n２５６０円／株×１１万３０００株＝２億８９２８万円イ 処分行政庁は、平成３１年３月１２日、原告に対し、本件譲渡株式の譲渡所得の金額の計算においては、措置法３７条の１１の３第１項及び措置法施行令２５条の１０の２第１項２号の規定により、特定口座内で保管する株式と当該特定口座以外で保管する株式が同一銘柄の株式であったとしても、それぞれの銘柄が異なるものとして区分して計算することとなるから、一般口座において譲渡した本件株式に係る１単位当たりの取得単価を算定するに当たって特定口座内の本件法人株式の取得費を含めるのは相当ではないとして、平成２５年分の所得税等に係る更正処分（以下「本件更正処分」という。）及び過少申告加算税の賦課決定処分（以下「本件賦課決定処分」といい、本件更正処分と併せて「本件更正処分等」という。）をした。本件更正処分における本件譲渡株式の取得費の具体的な計算方法は以下のとおりであった。\n（ア）１単位当たりの金額\n５９円／株\n（イ）本件譲渡株式の取得費の計算\n５９円／株×１１万３０００株＝６６６万７０００円\n\n\n（３）訴え提起に至る経緯ア 原告は、令和元年５月２７日、国税不服審判所長に対し、本件更正処分等を不服として審査請求をしたが、国税不服審判所長は、令和２年４月１７日、原告に対し、原告の審査請求を棄却する旨の裁決をした。\nイ 原告は、令和２年９月２３日、本件訴えを提起した。\n３ 本件更正処分等の根拠及び適法性に関する被告の主張本件更正処分等の根拠及び適法性に関する被告の主張は後記５（被告の主張）のほか別紙３\n「被告の主張を前提とした各課税の根拠及び適法性」記載のとおりである。なお、原告は、\n争点に関する部分を除き、その計算の基礎となる金額及び計算方法を争っていない。\n４ 争点本件の争点は、本件譲渡株式の取得費の計算方法及びその金額であり、具体的には、措置法\n３７条の１１の３の規定は、特定口座内保管上場株式等を譲渡した場合だけでなく、一般口座に保有する同一銘柄の上場株式等を譲渡した場合にも適用があり、それぞれの銘柄が異なるものとして取得費の計算を行うべきである（被告主張）か、特定口座内保管上場株式等が譲渡された場合にのみ適用され、一般口座内に保管されている上場株式等が譲渡された場合には適用がない（原告主張）かである。\n５ 争点に関する当事者の主張\n（被告の主張）\n以下のとおり、措置法３７条の１１の３の規定は、特定口座内保管上場株式等の譲渡による所得と当該特定口座内保管上場株式等以外の株式等の譲渡による所得とを、常に区分して計算することを前提としており、特定口座内保管上場株式等を譲渡した場合だけでなく、一般口座に保有する同一銘柄の上場株式等を譲渡した場合であっても、それぞれの銘柄が異なるものとして取得費の計算を行うべきである。したがって、本件譲渡株式の取得費に算入する金額は、特定口座で取得した本件法人株式の取得費を含めずに総平均法に準ずる方法により算出した金額である６６６万７０００円（＝５９円／株×１１万３０００株）となる。\n\n\n（１）措置法及び措置法施行令の規定上、株式等の譲渡に係る譲渡所得等の金額を算出するに当たっては、金融商品取引業者等が特定口座内保管上場株式等の譲渡による所得を計算し、居住者等が特定口座内保管上場株式等以外の株式等の譲渡による所得を計算し、居住者等がこれを合算する仕組みとなっており、この合算前に、居住者等が特定口座内保管上場株式等以外の株式等の譲渡による事業所得、譲渡所得及び雑所得の計算において、特定口座内保管上場株式等の取得費を含めて計算することは予定されていない。\nまた、特定口座内保管上場株式等は、措置法３７条の１１の３の適用を受けることを予定して特定口座において管理される上場株式等であり、同条の適用が予定されていない一般口座で保管されている上場株式等とは銘柄が異なるものとして区分して取り扱われる。そうすると、特定口座を利用している以上、将来的に同一銘柄の特定口座内保管上場株式等を譲渡したときには、それぞれの銘柄が異なるものとして、総平均法に準ずる方法によって取得費を計算することになるのであるから、同一銘柄の特定口座内保管上場株式等の譲渡がなくても、一般口座に係る同一銘柄の上場株式等を譲渡した場合の当該上場株式の取得費の計算については、それぞれの銘柄が異なるものとして取得費の計算を行うべきである。\n\n\n（２）これに対して原告は、租税法の解釈は原則として文理解釈によるべきところ、措置法３７条の１１の３第１項は「特定口座内保管上場株式等…の譲渡をした場合には」と規定しているから、文理解釈上、一般口座に保管されている上場株式等を譲渡した場合には適用されないと主張する。\nしかしながら、措置法３７条の１１の３第１項は、上記\n\n\n（１）の特定口座内保管上場株式等は一般口座で保管されている上場株式等とは銘柄が異なるものとして区分して取得費が計算されるという区分計算（以下、この意味で単に「区分計算」ということがある。）の趣旨を確認的に規定したものであって、特定口座内保管上場株式等の譲渡をした場合に限定して区分計算をすることを規定したものではない。\n特定口座制度は、証券会社が特定口座に関する情報のみをもって取得費等の額を計算することを可能とする制度であることからすれば、特定口座内保管上場株式等の譲渡による所得と当該特定口座内保管上場株式等以外の株式等の譲渡による所得とは常に区分して計算することが法の趣旨及び目的とも合致する。他方で、仮に原告が主張する計算方式を用いた場合、\n取得費の計算において、特定口座で取得した株式の取得価額を、特定口座における計算と一般口座における計算とで二重に考慮することとなり、正確な取得費を算出できないこととなる。\nまた、措置法３７条の１１の３第１項は、特定口座内保管上場株式等を譲渡した場合に\n「限り」、区分計算するとは規定していないから、原告の主張は、措置法３７条の１１の３第１項の文理解釈によるものではなく、同項の反対解釈又はそれに類する解釈に基づく主張にすぎない。\n\n\n（３）原告の主張する計算方式で取得費の計算をするためには、特定口座内保管上場株式等の取得に要した金額を継続的に記録していることを前提としなければならず、投資家の上場株式等の譲渡に係る譲渡所得等の金額の計算の負担を軽減するという特定口座制度の趣旨を没却するものである。また、総平均法に準ずる方法によれば、本来、保有する同一銘柄の株式等の一部を譲渡した場合には、譲渡の都度、１単位当たりの株式等の価額が、譲渡せずに引き続き保有している同一銘柄の株式等の取得価額に引き継がれるはずである。一方、原告の主張する計算方式は、算出した１単位当たりの株式等の取得価額が特定口座内保管上場株式の取得価額に引き継がれない結果を生じることからすれば、所得税法４８条３項及び所得税法施行令１１８条１項に規定する総平均法に準ずる方法とはいえない。\n\n\n（４）譲渡所得に対する課税は、資産の値上がりによりその資産の所有者に帰属する増加益（キャピタル・ゲイン）を所得として、その資産が所有者の支配を離れて他に移転するのを機会にこれを清算して課税する趣旨のものであり、増加益の計算は、譲渡所得の起因となった資産の取得費を控除して算出するものであるから、総平均法に準ずる方法を用いる場合であっても、譲渡所得の起因となる資産の取得に要した金額と異なる金額を算出し、当該金額を取得費として控除することはできない。しかしながら、原告主張に係る計算方式によれば、本件のように、特定口座内保管上場株式等以外の上場株式等の取得単価が、特定口座内保管上場株式等の取得単価を下回る場合には、資産の取得に要した金額を超える取得費を控除した結果となる。原告は、本件譲渡所得について上記計算方式を採ることによって取得費を過大に計上して譲渡益を圧縮しており、同方式は譲渡所得の課税の趣旨に反するものである。\n（原告の主張）\n以下のとおり、措置法３７条の１１の３の規定は、特定口座内保管上場株式等が譲渡された場合にのみ適用され、一般口座内に保管されている上場株式等が譲渡された場合には適用されない。したがって、本件譲渡株式の取得費に算入する金額は、特定口座で取得した本件法人株式の取得費を含めて総平均法に準ずる方法により算出した金額である２億８９２８万円\n（＝２５６０円／株×１１万３０００株）となる。\n\n\n（１）租税法は侵害規範であり、法的安定性の要請が強く働くから、その解釈は原則として文理解釈によるべきであり、みだりに拡張解釈や類推解釈をすることは許されない。措置法３７条の１１の３第１項は、「居住者…が…特定口座内保管上場株式等…の譲渡をした場合には」\nと規定し、措置法施行令２５条の１０の２第１項は、「法第３７条の１１の３第１項に規定する特定口座内保管上場株式等…の譲渡…による…譲渡所得の金額…の計算は」と規定しており、これらの条項が一般口座に保管されている上場株式等を譲渡した場合に適用されないことは、その文言から明らかである。措置法及び措置法施行令の規定は、個別租税法の規定に対する特例の性質を有しているところ、措置法３７条の１１の３第１項等は所得税法４８条３項等の特例であって、区分計算の趣旨を確認的に規定したものではない。したがって、\n措置法３７条の１１の３第１項等は、特定口座内保管上場株式等が譲渡された場合にのみ適用され、特定口座内保管上場株式等以外の株式等が譲渡された場合には適用されない。\n\n\n（２）被告は、原告の主張する計算方式について、特定口座制度の趣旨を没却するものであると主張する。しかしながら、同制度の趣旨は、特定口座内に保管されていた上場株式等を譲渡した場合における譲渡所得の金額を計算する際の負担軽減にあるのであって、一般口座内に保管されている上場株式等の譲渡について原告の主張する計算方式を用いたとしても、上記趣旨を没却するものではない。\nまた、被告は、原告の主張する計算方式は、算出した１単位当たりの株式等の取得価額が特定口座内保管上場株式の取得価額に引き継がれない結果を生じるから、所得税法４８条３項及び所得税法施行令１１８条１項に規定する総平均法に準ずる方法とはいえないと主張する。しかしながら、特定口座内保管上場株式等は、その特定口座における同一銘柄の特定口座内保管上場株式等の中で、１単位当たりの株式等の取得価額の計算が連続しているから何ら不都合は生じないし、一般口座の株式を譲渡した場合に、算出された１単位当たりの株式等の取得価額が、引き続き保有している特定口座内保管上場株式等の取得費に引き継がれない結果を生じることは、法が特定口座制度を採用したことにより当然に予定されていることである。\n\n\n（３）被告は、原告の主張する計算方式によれば、資産の取得に要した金額を超える取得費を控除することになると主張するが、原告の主張する計算方式も、譲渡所得の起因となる資産である本件譲渡株式の取得に要した金額に基づく計算である。原告の主張と被告の主張との違いは、総平均法に準ずる方法において取得価額が加算される有価証券の範囲が、一般口座内の有価証券に限られるのか、それのみではなく特定口座内の有価証券も含まれるかの違いであり、被告の主張は、自己の主張が正しいという前提の上で、原告の主張する計算方式による取得費と被告の主張する計算方式とに差異が生じることを捉えて、前者によれば資産の取得に要した金額を超える取得費を控除する結果になると主張するものにすぎない。\n\n\n\n\n\n\n第３ 当裁判所の判断\n\n\n１ 特定口座制度の内容及び趣旨等\n\n\n（１）特定口座制度が創設された趣旨、経緯等株式の譲渡による所得については、昭和２８年以降原則として非課税とされていたが、昭和６３年の税制改正において、原則として課税対象とすることに改められた。その際、課税方式については、申告分離課税方式（他の所得と分離して一定の税率により確定申告を通じて課税する方式）を原則としつつ源泉分離課税（株式等の譲渡価額の一定割合相当額を所得とみなし、他の所得と分離して一定の税率により源泉徴収を通じて課税する方式）の選択を認める源泉分離選択課税制度が採用された。その後、平成１３年の税制改正等により、上記源泉分離選択課税制度は廃止され、平成１５年１月１日以降は申告分離課税方式に一本化された。\nこのような申告分離課税方式への一本化に伴い、申告分離課税になじみのなかった個人投資家の申告事務の負担を軽減するために、金融商品取引業者等に開設した特定口座を通じて上場株式等の譲渡を行うなどの場合に限って、他の株式等の譲渡による所得と区別して所得計算をすることができることとした。特定口座は、居住者等が金融商品取引業者等との間で上場株式等保管委託契約（措置法３７条の１１の３第３項２号）等を締結して開設する口座であり（同項１号）、特定口座内保管上場株式等の譲渡による所得については、金融商品取引業者等が、居住者等に代わって、上場株式等の譲渡の対価及び取得費の額、当該譲渡に要した費用の額、当該譲渡に係る所得の金額を計算し、これらの金額を記載した年間取引報告書を１年に１回、所轄税務署長及び居住者等に送付するものとされている（同条７項）。\nそして、措置法３７条の１１の３第１項及び措置法施行令２５条の１０の２第１項（以下\n「本件各規定」という。）は、特定口座内保管上場株式等の譲渡をした場合には、当該特定口座内保管上場株式等の譲渡による譲渡所得の金額の計算は、これと当該特定口座内保管上場株式等以外の株式等の譲渡による譲渡所得の金額とを区分して行い、この場合において、\n同一銘柄の上場株式等のうちに特定口座内保管上場株式等とそれ以外の上場株式等がある場合には、それぞれ銘柄が異なるものとして取得費の計算等を行う旨規定している。また、特定口座内の取引に係る所得については、納税者において、源泉徴収を選択することも可能であり（措置法３７条の１１の４第１項）、その場合には源泉徴収が選択された口座における取引から生じた所得を除外して確定申告をすることができるとされている（同法３７条の１\n１の５第１項）。\n\n\n（２）特定口座への受入れと特定口座からの払出し特定口座内保管上場株式等については、金融商品取引業者等が、居住者等に代わって一元的に取得費等を計算することが予定され、既に開設された特定口座に新たに受け入れることのできる上場株式等は、原則としてその特定口座において行われた取引により取得した上場株式等に限られるものとされたが、特定口座制度導入当初は、居住者等が特定口座外で保管している株式を特定口座へ受け入れることができるとする経過措置が定められた。しかし、\n同経過措置は、平成２１年５月３１日をもって廃止された（平成１７年政令第１０３号附則\n１１条１項、２項参照）。\n他方、特定口座内保管上場株式等を特定口座外へ払い出すことは現在も可能であるところ、\n上記払出しがされた場合、当該払出し後の一般口座内の上場株式等に係る譲渡所得の計算上、\n当該払出しをした上場株式等は、当該払出しの時に特定口座内保管上場株式等の譲渡があったものとした場合に、総平均法に準ずる方法により取得費の額として計算される金額に相当する金額により取得されたものと扱われる（措置法施行令２５条の１０の２第２６項１号、\n同条１２項２号イ、所得税法施行令１１８条、１０５条１項１号）。すなわち、特定口座内保管上場株式等を一般口座に払い出した場合には、当該払出しの際に特定口座から譲渡されたと仮定した場合に算出される取得費の額が、当該払出しがされた上場株式等の取得費として、一般口座に引き継がれることとなる。そして、金融商品取引業者等は、特定口座から一般口座への払出しがされた場合、当該特定口座を開設している居住者等に対し、当該払出しがされた上場株式等について、上記の計算により算出された取得費の額等を通知するものとされている（措置法３７条の１１の３第３項２号、措置法施行令２５条の１０の２第１０項\n１号）。\n\n\n（３）所得税法及び所得税法施行令の定める有価証券の評価の方法所得税法４８条３項の委任を受けた所得税法施行令１１８条１項は、前記第２の１\n\n\n（１）\nのとおり、譲渡所得の計算上取得費に算入する金額に関し、２回以上にわたって取得した同一銘柄の有価証券の取得費については、総平均法に準ずる方法を用いて算出した１単位当たりの金額により計算をすることとしている。これは、総平均法が棚卸資産の評価方法として企業会計処理上の合理性が認められることを踏まえ、同一銘柄の有価証券が代替性を有し、\n各有価証券の取得価額が異なるとしても、一株ごとの株主の当該株式会社に対する社員としての地位は同一であることから、その価値を等価とみて単価を平均化することが合理的であること、また、これによって取得価額の変動を利用した利益操作の可能性を排除することができることから、取得費の算出方法として総平均法に準ずる方法を採用したものであると解される。\n２ 本件各規定等の解釈について\n\n\n（１）１において判示したとおり、措置法及び措置法施行令は、個人投資家である居住者等の申告事務の負担を軽減することを目的として、特定口座内保管上場株式等の譲渡に係る区分計算を定めた（本件各規定）。そして、既に開設された特定口座に新たに受け入れることのできる上場株式等は、原則としてその特定口座において行われた取引により取得した上場株式等に限られるものとされ、居住者等が特定口座外で保管している株式を特定口座へ受け入れることができるとする経過措置は廃止された。また、特定口座内保管上場株式等が一般口座に払い出された場合において一般口座に引き継がれる取得費の計算方法を定め、上記計算方法に従って算出された当該払出しに係る上場株式等の取得費の額を、居住者等に通知するものとしている。以上に判示した各規定の内容や経過措置の廃止等に照らせば、措置法及び措置法施行令は、特定口座内保管上場株式等と一般口座において保管されている上記株式等とを、譲渡、払出しの各処理において区分して取り扱うことを前提としているものと解される。\nそうすると、特定口座内保管上場株式等を譲渡した場合だけでなく、一般口座内に保管されている同一銘柄の上場株式等を譲渡した場合についても、それぞれの銘柄が異なるものとして取得費の計算をする被告主張に係る計算方法が、上記の各口座に保管された株式を区分して取り扱うという前提に沿うものといえる。\n\n\n（２）他方、原告主張に係る計算方法は、以下のア及びイのとおり、２\n\n\n（１）において判示した特定口座内保管上場株式等と一般口座において保管されている上記株式等とを譲渡、払出しの各処理において区分して取り扱うという趣旨、内容と整合的であるということはできない。\nア １\n\n\n（２）において判示したとおり、特定口座内保管上場株式等を一般口座に払い出した場合には、当該払出しの際に特定口座から譲渡されたと仮定した場合に算出される取得費の額が、当該払出しがされた上場株式等の取得費として、一般口座に引き継がれることとなる。そうすると、一般口座内に保管されている上場株式等を譲渡した場合、原告主張に係る特定口座内保管上場株式等の取得価額も含めて総平均法に準ずる方法により１単位当たりの取得費の額を算出するという計算方法は、当該譲渡の直前に、特定口座内保管上場株式等を一旦全て一般口座に払い出した上で、当該一般口座から上場株式等を譲渡した場合の計算方法と全く同じものとなる。その結果、取得費の計算上、払出しの手続を経ずに、\n払出しがされた場合と同じ計算をすることを容認することになり、払出しがされた場合の取得費に関する定めが無意味なものとなる。法がこのような取得費に関する定めが無意味となるような原告主張に係る計算方法を前提としているとは解し難い。\nイ また、原告主張に係る計算方法を用いた場合、総平均法に準ずる方法による１単位当たりの金額を算出するに当たって、特定口座内保管上場株式等の取得価額は、特定口座内保管上場株式等を譲渡した場合と、一般口座内に保管されている上場株式等を譲渡した場合のいずれについても、計算上考慮に入れることになる。他方、一般口座内に保管されている上場株式等の取得価額は、一般口座内に保管されている上場株式等を譲渡した場合にのみ考慮され、特定口座内保管上場株式等を譲渡した場合には考慮されないことになる。しかしながら、所得税法４８条３項等が、同一銘柄の有価証券について、総平均法に準ずる方法を採用した趣旨は、１\n\n\n（３）において判示したとおり、有価証券の性質上、取得費が異なるとしてもこれを等価とみて平均化することが合理的であるといえるからであって、\n同一銘柄の有価証券のうち、一般口座内に保管されている上場株式等を譲渡した場合には、\n一般口座内に保管されている上場株式等の取得価額及び特定口座内保管上場株式等の取得価額が考慮され、特定口座内保管上場株式等を譲渡した場合には、後者のみが考慮され前者が考慮されないという取扱いは、上記趣旨に反し、相当とはいい難い。\n\n\n（３）もっとも、法令の文言を見ると、措置法３７条の１１の３第１項は、「居住者…が…特定口座内保管上場株式等…の譲渡をした場合には」と定め、また、措置法施行令２５条の１０の２第１項が、「法第３７条の１１の３第１項に規定する特定口座内保管上場株式等…の譲渡…による…譲渡所得の金額…の計算は」と定めていることからすれば、少なくとも文理上は、本件各規定が適用されるのは、特定口座内保管上場株式等の譲渡の場合のみであって、\nこれと同一銘柄の一般口座内の上場株式等が譲渡された場合には、特定口座と一般口座との間の区分計算をすることなく、総平均法に準ずる方法により１単位当たりの株式の取得価額を算出するものと解するのが自然であるとも思われるところ、原告は、租税法は侵害規範であり、法的安定性の要請が強く働くから、その解釈は原則として文理解釈によるべきであり、\nみだりに拡張解釈や類推解釈をすることは許されないとして、上記文理解釈に従い、各条項は一般口座に保管されている上場株式等を譲渡した場合に適用されないと主張する。\n確かに、租税法規は、みだりに規定の文言を離れて解釈すべきものではない。しかしながら、租税法規についても、規定の趣旨や目的等を勘案して解釈することが許されないとはいえないところ、上記のとおり、特定口座制度を設けた趣旨、措置法及び措置法施行令の規定内容、一般口座保管株式の特定口座内への受入れ不可、保管上場株式等の払出しの場合の取得費引継ぎと原告主張に係る計算方法との整合性等の前判示に係る諸事情を考慮すると、本件各規定の文言につき、原告主張に係る解釈ではなく、法の趣旨や目的等に沿って、一般口座に保管されている上場株式等を譲渡した場合にも適用されると解釈することも許されるというべきである。\n\n\n（４）以上に判示したとおり、特定口座制度が創設された趣旨等、特定口座の受入れと払出しの規制等、取得費の算出方法として総平均法に準ずる方法が採用された趣旨等を総合考慮すると、一般口座内に保管されている上場株式等を譲渡した場合に所得税法４８条３項及び所得税法施行令１１８条１項を適用するに当たり、同一銘柄の特定口座内保管上場株式等については、その銘柄が異なるものとして、その取得価額は、一般口座内に保管されている上場株式等の取得費の計算において考慮されないものと解するのが相当である。\nしたがって、本件譲渡株式の取得費は、特定口座において取得した本件法人株式の取得費を含めずに総平均法に準ずる方法により算出した金額である６６６万７０００円（＝５９円\n／株×１１万３０００株）となる。\n３ 本件各更正処分等の適法性について以上に加え、証拠（甲１）及び弁論の全趣旨によれば、原告について課されるべき平成２５年分の所得税等の額及び過少申告加算税の額は、別紙３のとおりであって、本件更正処分における納付すべき税額及び本件賦課決定処分における過少申告加算税の額は、その金額の範囲内であるから、本件各更正処分等はいずれも適法である。\n４ 結論以上によれば、原告の請求はいずれも理由がないから棄却することとして、主文のとおり判決する。\n東京地方裁判所民事第２部裁判長裁判官 春名 茂裁判官 横井 靖世裁判官 廣瀬 智彦\n·9\n． ． ． ． 、• ． 、 - : ' 9. ． • . ,t - . •.. t. • ••.，..5/ッ. -.f\" ． ． .• 盆 号 、•• •••• r • • • ••• • i し • t • ‘ 5.- ｀ 思 ： 、 - r \" g 9 r f . · 1 ·• I . i' 、,．]1 9日 J1�\n．\n（別紙1) ．\n．\n＇指定代理人目録\n、\n高橋紀子、淵政博、 宮脇智砂子、住田和彦、鷹箸直矢ハ\n・ .'\nヽ 以 上\n．\n.\n-.. :\n. '.: . .\n•.\n•．\n．．..•\n．•9\n..\n．\n．\n．.\n,．\n.\n． ．．\n．•\n．\n．\n．\n. .•．\n．\n．\n＜\n,.\n（別紙2.- 1)．\n・ ．\n4 ， •\n， 第 （ 4 、 3 .2り 第 （ Qび 定 三 二 一 額 お 額 し 金 額 得 中 ＼ じ 。使 と 三 譲 所改 め 十 農 5 （ じ 。 と い を た 額 の 費 の 譲 〔 ） 用 す 十 渡 得費 良 あ が 八 条 所 得 〔 . 産 資 令 政 ）資 産 す る 。 て 「 ． 他 の 用 費 が 当 合 計 及 び 該 当 所 渡 略 〕 に せ さ 堆 る 条 三 得 所 ） 税の る の 略〕 の で で の 譲 号 の 該 額 そ 所 得 よ る 上 法額 も 譲 金 譲 定 そ 譲 ． 渡 に 額 所 （ の 得 の る 行 権 譲ム の の を 所 渡 額 の 渡 にる め 資 の 渡 ( ' 」 益 捲 け 合 の 得 の 該 当 資 産 係 に 額 金 所 得 為 で 又 は 所 渡且 m 除 得 計 よ も 産 前 と る 計 基 各 の る は 、 を 政 賃 得額 • き、 の 算 る の の 項 い 所 額 因 号 譲 総 い 令 借 とす\nとそ\n•額\n金控\n上得\n所除\nを 取得 規の\n）\nう。 得に 満に とな\nのう\n渡に 入収 次の\nう 。で定\n権の\nは、・る 。 の の 除 で く 。 の 定 係 た っ ち 要 金 各 め 設 資\n．． 産 資の 上算 計 す取\nる 前 号に\n）\n． 後以 日 該当\nに譲\nか ら残額\nる場\nい な産\n資 た ずれ\nい費\nし た 額 から 掲に 号の\nる も そ 定の\nの譲\n産取 控 得 掲 五 す 渡 か 合 の か 用 当 げ 他 猿を\n得 除 費） げ 年 る 所 ら に 取 の の 該 る含\n契 （要 に る ず 所 る 以 内 の も の 得 控 除 ● は 得 費 に 号 額 の 所 得 所 得 む 。 約 に 建 物 、タ ・ペし 資 得 に を 特 しそ 及 掲 ＾の に よ 又金 額 並 た 得 産 取 の 外 以 の も れ た も さ 次 除 ． く 。 別 額 控 除 金 額 た 。 額 不 足 の そ 資 び の 得 所 げ る 額 控 且 m を 基 因 な と そ つ き、 下 以 の こ 他 人 に り は 歴 茫 匹び 費 の の 号 を 以 に 産 に 除 つ れ 条 土 のに は 、 に に 控 下 相 の 係 し、 だぞ に 池 所設 よお 除こ 当 譲 る 資 れ お を 有備 別 る い しの す 渡 総 そ 産 そ い 長 を費 段 所 て た 条 る に 収 の の の て 期 目及 の 得 同 •• 金 に 金 要 入 残 取 年 同 間 的\nL ・ • 、 . 、\n•\n3 2 ． 第 （ 2A\n, ;• た 算 す に 三 の 又 た に を 規 四 .\nー｀ 金 入 る 算 十 居 〔 う は 評 お 算 定 十 在 〔額\nをす\nる取 入す 条七 住者\n〕略政\nち 選定\n価の てい\nす定 によ 条八 証券\n〕略\n．\n' ． ｀ ，' ・ 礎 基 金 額 ）得費 ． 金 る 一 第 1 が 一 令 で た し 方 法 有 す 場 る そ り 居 譲 の\n． ． ． ． ． と は 、 の 額 項 回 定 評 に る 合 の 住 渡\n. • • ヽ ’ .. •• ●． ．● . ,'. て し 政 規 定 又 は の 上 以 め る 価 の よ り価 有 お に 者 の 者 の 価 原\n0 •.，. ＾ 第 一• 令 で に よ 第 三 規定 に わ に 法 方 方 法価 評 券 証 け る 業 事 価 有 等 の\n• ．• •．• 項 定 り 十 よ た に に し の そ 所 証 計の め そ 八 り つ よ よ た 価 の 得 券 算規 る の 条 そ て り り金 額 算 の に 及定 と 者 第 一 の 取 評 評 額 は 、 定 金 つ びに こ の 者 得 価 価 （ の 額 き そ準 ろ 譲 項＾の し し し評 そ 基 の 第 のじ に 渡 （ 雑 た た な 価 の 礎 計 三 評て よ所 譲 所 同 金 か の 者 と 算 十 価評 り 、得 波 得 一 額） っ 方が な 上 七 の価 の 所 の 銘 た 法 有 る 必 条 方\n， ヽ た し れ そ 金 額 得 の 金 額 柄 の と す 合 場 選 を 価 証 そ の 経 要 第 一 法 ） 、\n金 ぞ の 金 の 有 る 。に 定 券 年 費 項額 れ 計 額 計 価 は、 し に 十 に （と の 算 の 算 証 な つ 二 算 必す 取 上 計 上 券 評 か い 月 入 要\n·、\nVる 。得 取 算 必 に 価 っ て 三 す 経\n, 以 に 得 上 要 つ の た 選 十 る費一 ）\n． 要 費 控 経 き 方 場 定 金 口上 ． し に・除 費 ． 第 法 ．合 ・ し H 額 の\n．\n,.. , .\n\" （別紙2� 2) -.·\n・\n．\n． ．\n．\n＞．‘ ． ． ．\n.• ． 経 要 必 上 算 計 の 額 金 の 雑 得 の 所 分 年 る す 属 の 日 の 渡 譲 の そ の 者 の そ り 、 ． よ に 定 規 の ） 費 経 要 必項 （一 第 条 七 十 三 第 法 き つ に 渡 譲 の そ ｀ は に 合 場 た し 渡 譲 を の も る な と 因 基 の 得 譲 所 は 渡 又 得 所 雑 で 券 証 価 有 の 柄 銘 ・同 た し 得 取 て つ た わ に 上 以 回 二 る す 定 規 に ） 算 計 の 等 費 得 取 の 券 証 一＾ 〔 第 百 十 八 条 � 居 住 者 が 法 第 四 十 八 条 第 三 項 （ 醸 渡 所 得 の 基 因 と な る 有 ・ （ 譲 渡 所 得 の 基 因 と な る 有 価 証 券 の 取 得 費 等 ） ． ． 〕 略 [ 2 1 二 [ 〔 竪 を . い 法 ） う 。 ． 数 で 除 し て 計 算 し た 価 額 を そ の 一 単 位 当 た り の 取 得 価 額 と す る 方 ー る 有 価証 券 の 取 得 価 額 の 総 額 と の 4 品 m 額 を こ れ ら の 有 価 証 券 の 価 証 券 の 取 得 価 額 の 総 額 と そ の 年 中 に 取 得 し た 種 類 等 を 同 じ く す つ い て 、 そ の 年 一 月 一 日 に お い て 有 し て い た 種 類 等 を 同 じ く す る ． ． ＾ 類 等 」 と い う こ の 異 な る ご と に 区 別 し ｀ そ の 種 類 等 の 同 じ も の に ． 一 総 平 均 法 （ 有 価 証 券 を そ の 種 類 及 び 銘 柄 （ 以 下 こ の 項 に お い て 価 額 を も っ て 当 該 期 杢 丑 価 証 券 の 評 価 額 と す る 方 法 と す る 。 ・ ち い ず れ か の 方 法 に よ っ て そ の 取 得 価 額 を 算 出 し 、 そ の 算 出 し た 取 こ と が で き る 評 価 の 方 法 は ● 期 末 有 価 証 券 に つ き 次 に 掲 げ る 方 法 の す を 定 選 上 算 計 の 額 価 評 の ） 。 う い と 」 券 証 価 有 末 期 「 て い お に 項 の こ 券下 証 価 有 る す 有 て い お に ） 。 じ 同 て い お に 条 の こ 下 以 。 時 （以 の 国 ． 出 は 又 亡 死 の そ 、 は に 合 場 た し を 国 出 は 又 し 亡 て死 い お に 途 中 の が 者 住 居 の 項 同 （ 日 一 十 三 月 二 十 年 の そ る よ に 定 規 の ） 法 方 の 価 評 第 百 五 条 法 第 四 十 八 条 第 一 ． 項 （ 有 価 証 券 の 譲 渡 原 価 等 の 計 算 及 び そ （ 有 価 証 券 の 評 価 の 方 法 ） ＼ ” 0 所 得 税 法 施 行 令 ＂一 価 総 有 \" 「 得2 う る 年 の賣\n， 種 金 法 期 て 以 の 計 控 品有価 第 額 ） 間 、 下 後 算 除 入証 百 に に 内 当 こ 既 上 す す券 九 よ 掲 に 該 の に 取 る る\n． ． , ． ． ． ． ． ． ． • • • . • • • ． ． ． .. • ” ● ● , ． ..' . • ` ' , 以 上 に つ い て 準 用 す る 。 定 は 、 前 項 に 規 定 す る 所 得 の 基 因 と な る 条 か ら 前 条 ま で の 規 り 計 算 し た 金 額 と す る 。 当 の り だ 位 単 一た し 出 算 て つ よ に 法 方 る 準ず に 法 均 平 総 る げ 平 総 （ 号 一 第 項 一 第 条 五 百 第 き つ に 券 証 価 有 該 当 た し 得 取 当 び 及 券 証 価 有 該 当 た い て し 有 て い お に 時 た し 得 取 に 初 最 と 礎 基 を 間 期 の で ま 時 の 渡 譲 該 当 ら か ｝ 。 じ 同 て い お に 項 時 。 る 場 合 に は 、 直 前 の 譲 裟 の 当 該 有 価 証 券 の 譲 渡 を し て い 時 た し 得 取 に 初 最 を 券 証 価 有 該 当 、 は 額 金 る す 入 算 に 費 得 額 金 の 得 所 渡 譲 の 分 年 該 当 の 者 の そ り よ t 定 規 の ） 費 得 取 上 算 計 の 額 金 の 得 所 渡 譲 （ ・ 項 一 第 条 八 十 三 第 法 は 又 額 金均 該 し （ のそ\n（別紙2-3)同 て い て 当 割 の 式 株 、 利 権 る な と ） 。 う い を 主 資 投 る す 定 規 に 項 ハ 士 第 条 式 株 の 二 第 律 法 る す 関 に 人 法 資 投 び 及 託 信 資 投 （ 主 資 投 は 又 主 株 （ 式株 一 得 所 渡 。 う い を ） 。 く 除 を 分 持 の 者 資 出 は 又 式 株 る め 定 で 令 政 て し と の も 当 、 り る す 類 に 利 権 る す 関 に 用 利 の 設 施 の 他 の そ 場 フ ル ゴ 、 t と の も む 含 を 等 式 株 の も る 係 に 人 法 国 外 （ 、 の も る げ 掲 に 次 、 は と 等 式 株 る す 定 規 に 項 前 2 条 の こ 。 す な み と の も た っ か な じ 生 は 額 金 の 失 損 該 当 、 は て い つ に · · 口 定 特 用 適 の 定 規 の 令 法 る す 関 に 税 得 所 他 の そ 法 同 、 は き と る あ が 額 金 の 失 い お に 損 た じ 生 上 算 計 の 額 金 の 等 得 所 渡 鶴 る 係 に 等 式 株 、 て い お に 合 場 の こ 座 。 口 る 定 す 課 を 税 得 所 る す 当 相 に 額 金 る す 当 相 に 玉 十 ． の 分 百 の ） 。 う い を か ら 第 八 十 七 条 ま で の 規 定 の 適 用 が あ る 場 合 に は 、 そ の 適 用 後 の 金 額 ）が 、 上 第 三 十 七 等 の 金 額 （ 第 六 項 第 五 号 の 規 定 に よ り 読 み 替 え ら れ た 同 法 第 七 十 二 条 □ に 対 し 、 株 式 等 に 係 る 課 税 譲 渡 所 得 等 の 金 額 （ 株 式 等 に 係 る 譲 渡 所 得 ＂（ 特 定 金 額 （ 以 下 こ の 項 に お い て 「 株 式 等 に 係 る 譲 渡 所 得 等 の 金 額 」 と い う 。 ） ． し と 額 金 の 得 所 雑 び 及 額 金 の 得 て 政 冷 で 定 め る と こ ろ に よ り 計 算 し た 四 ー 七 ・ 区 分 し 、 そ の 年 中 の 当 該 株 式 等 の 譲 渡 に 係 る 事 業 所 た 金 得 の 金 額 、 ． ． 譲 渡 所 及 び 第 八 十 九 条 並 び に 第 百 六 十 五 条 の 規 定 に か か わ ら ず 、 ， 他 の 所 得 に と お 式 等 に 係 る 譲 渡 所 得 等 」 と い う に つ い て は 、 所 得 税 法 第 二 十 二 条 と 、 q ) 二 項 の 規 定 に 該 当 す る 譲 渡 所 得 を 除 く 。 第 三 項 及 び 第 四 項 に お い て 「 株 の 年 該 株 式 等 の 譲 猿 に よ る 事 業 所 得 { 譲 渡 所 得 及 ぴ 雑 所 三 得 士 合 云 雀 ん 渡 に R t 次 条 及 び 第 三 十 七 条 の 十 二 の 一 」 に お い て 同 をじ し た 場 合 に は 渡 、 所 当 Q ) 八 項 第 三 号 イ に 掲 げ る 取 引 の 方 法 に よ り 行 う も の を 除 べ 以 下 こ の 項 ‘ - i 一 成 士 ハ 年 一 月 一 日 以 後 に 株 式 等 の． 譲 渡 （ 金 融 商 品 取 引 法 第 二 十 八 条 第 一 、 ニ 平 ・ 一 、 6 第 が 者 住 居 非 る す 有 を 設 施 的 久 恒 に 内 国 は 又 者 住 居 十 の 条 七 十 三 第 ． ． ） 例 特 の 税 課 の 等 得 所 渡 譲 る 係 に 等 控 （ 3 5 t 二 ＼ 六 む 含 ） の も の 前 正 改 ． 受 を る よ に 号 五 第 律 法 年 五 十 二 成 平 （ 法 置 措 爾 特 税 租 〇じ 等 の 該 」 か 座 て を 場 条 口 額 い 「 中 要 得 所 項 ． 9 け\n. •• , • ． ． ． ． ． ． ． は 又 額 金 の 得 所 渡 譲 、 額 金 の 得 所 業 事 る よ に 涙 譲 の ） ． 。 に 項 次 。 う い を 等 式 株 る す 定 規 に 項 二 第 十 の 条 七 十 三 第 （ 以 等 式 株 場 上 管 保 内 座 口 定 特 該 当 と 額 金 の 得 所 雑 は 又 額 金 、 額 金 の 得 所 業 事 る よ に 渡 譲 の 等 式 株 場 上 管 保 内 座 口 定 特 ろ こ と る め 定 で 令 政 、 は に 合 場 た し を 渡 譲 の ． ） 。 う い と 上 管 保 内 座 口 定 特 「 て い お に で ま 六 の 一 十 の 条 七 十 三 第 ら 以 （ 等 式 株 場 上 る す 定 規 に 項 次 る い て れ さ が 託 委 の 管 保、 に 又 、 れ さ が 録 記 は く し 若 載 記 に 簿 座 口 替 振 る 係 に ） 。 じ 同 及 項 の こ 下 以 • 。 座 口 定 特 の れ ぞ れ そ ． 、 は に 合 場 る す 有 基 づ き 特 定 口 座 （ そ の 者 が 二 以 上 の 特 株 式 等 保 管 委 託 契 約 に の 十 一 の 三 居 住 者 又 は 国 内 に 恒 久 的 施 設 を 有す る 非 居 住 者 座 内 保 管 上 場 株 式 等 の 譲 渡 等 に 係 る 所 得 計 算 等 の 特 例 ） 〔 略 〕 ＇ と す る 」． と あ る の は 「 ） と す る 」 と す る 。 う 。 ） か ら 譲 渡 所 得 て の 「 特 譲 渡 別 益 」 控 と 除 い 額 を 控 除 し し 、 そ の 残 額 」 と あ る の は 「 し た 残 額 」 と 、 P 以 下 こ の 条 に 支 払 う ぺ き そ の 資 産 を 取 得 す る た め に 要 し た 負 債 の 利 子 し た 費 用 の 額 」 と あ る に の 要 は し 云 た 霊 費 用 の 額 並 ぴ に そ g の 金 額 」 と あ る の は 「 株式 等 に 係 る 譲 渡 所 得 の 金 額 」 と 、 「 得 税 法 第 三 十 三 条 第 三 項 の 規 定 の 適 用 に つ い て は 、 同 項 中 〕 略 〔 ． る よ に ろ こ と る め 定 に 次 ＇ 、 は に 合 場 る あ が 用 適 の 定 規 の ． 略 〕 ． 〔 略 ． 〕 ． ) 利 権 る け 受 を て 当 割 の 権 約 予 株 新 び 及 楕 約 予 株 新 、 利 権 る ,.. 、\n雑 お 外 譲 に 場 下、 は び 」 譲 ． ・ 。 を所 よ 次 ， 「項 譲\n・\n（別紙2.- 3)\n`\n·\n3 ．さ 設 開等契 引 取 用 信 等 式 株 場 上 は 又 約 契 託 委 管 保 等 式 株 場 上 た し 結 締 で ．融 金 7間 の 吝 盆 杢 臥 枢 品 商 融 金 該 当 ヽ と を ） 。 じ 同 て い お に 項 二 第 六 項 の 提 供 を 含 む 。 以 下 こ の 条 、 次 条 第 五 項 及 び 第 三 十 七 条 の 十一 の4 S 6 〔\n｛ 術 を 利 用 す る 方 法 に よ る 当 該 特 定 口 座 開 設 届 出 書 に 記 載 す べ き事 三\n． ．，\n． イ Sえ て 行 う 電 子 情 報 処 理 組 織 を 使 用 す る 方 法 そ の 他 の 情 報 通 信 の技\n設 ＂ 届 出 書 」 と い う 。 ． ） の 提 出 （ 当 該 特 定 口 座 開 設 届 出 書 の 提出 そ に 代 と\n．業 引開 座 口 定 て特 い「 お に 項 二 第 六 の 一 十 の 条 七 十 三 第 び 及 項 五 第 条 次当 、 は 条 のこ 下 以 （ 書 出 届 た し 載 記 を 項 事 る め 定 で 令 省 務 財 の 他 の そ 旨 る載 け 記 受を 用 適 の 定 規 の 項 前 は 又 項 一 第 き つ に 算 計 の 額 金 の 得 所 雑 は 、 - に 係 る 上 場 株 式 等 の 譲 渡 に よ る 事 業 所 得 の 金 額 、 譲 渡 所 得 の 金額 又 ＂ のみる 上 場 株 式 等 の 譲 渡 及 び そ の 口 座 に お い て 処 理 さ れ た 信 用 取 引等 る す ， ． ． 該 特し く は 記 録 が さ れ 、 又 は そ の 口 座 に 保 管 の 委 託 が さ れて いに 記 載 若 ・ ・ 所 在 地 、 そ の 口 座 に 設 け る 勘 定 の 種 類 、 そ の 口 座 に 係 る 振 替口 座 簿 る 記り 、 そ の 口 座 の 名 称 、 当 該 金 融 瓶 品 取 引 業 者 等 の 営 業 所 の 名 称 及び ＇ 記 載に 、 政 令 で 定 め る と こ ろ に よ記 載三 十 七 条 の 十 一 の 六 に お い て 同 じ ● ） ＇ ． 所 （ 国 内 に あ る 営 業 所 又 は 事 務 所 を い う 。 以 下 こ の 条 、 次 条 及び 第 る 係\n． 七 条 の 十 ． 一 の 六 に お い て 「 金 融 商 品 取 引 業 者 等 」 と い う 。 ） の 営 業記 は '\n｀ ． 十 一 項 に 規 定 す る 投 資 信 託 委 託 会 社 （ 以 下 こ の 条 ＇ 次 条 及 び\n\n\n\n\n\n\n第三 十\n\n\n、 でる 登 録 金 融 機 関 又 は 投 資 信 託 及 び 投 資 法 人 に 関 す る 法 律 第\n\n\n． 記録二 条 第 ＇ ｀ 金 融 商 品 取 引 業 を 行 う 者 に 限 る 。 ） 、 同 法 第 二 条 第 十 一 項 に 規 定 す\n\n\n· 取 引\n\n\n． 定 す 孟 冒 品 取 引 業 者 （ 同 法 第 二 十 八 条 第 一 項 に 規 定 す る 第 一 種同 項 ， ． 二二 項 の 規 定 の 適 用 を 受 け る た め 、 金 融 商 品 取 引 法 第 二 条 第 九 項に 規 上 ．\n\n\nー ー 特 定 口 座 居 住 者 又 は 国 内 に 恒 久 的 施 設 を 有 する 非 居 住 者 が 、 ．前 外 のる と こ ろ に よ る。\n\n\n第 項 q ＜こ の 条 に お い て 、 次 の 各 号 に 掲 げ る 用 語 の 意 義 は 、 当 該 各 号 に定 め （\n\n\n〕 略 〔 2録 記 に 約\n\n\n。 る す と の も る す 算 計 を 額 金 の ら れ こ 、 て し 分 区 を と 額 金 の 得 ， t ｀れ 商 賂 〔 ノ の 者 該 若 を 非 定 録 若 若 口 録 そ 又 業 の 場 取 ・ 当 若 基て 品 〕． 賂 ． 他 等 金 し 受 居 保 と し し 座 又 の は 者 居 株 引 一 該 し づい 取 〕 〔 政 に 融 く け 住 管 区 く く に は 契 保 等 住 式 に 号 口座 く き\n\n\n． ． ．． ． • • • • • • • ． ． ., ● . 9 ろ こ と る め 定 で 令 省 務 財 、 は に 合 場 る あ が 座 口 定 特 た 等 者 業 引 取 品 商 融 金 該 当 て い お に 年 の そ 、 は 等 者 業 引 ＞ ． 略 〕 。 う い を ． の も る い て れ ら め 定 が 項 事 る め 定 で 令 ． こ る す り よ に 法 方 る め 定 で 令 政 他 の そ 法 方 る す て し 対 品 ． 商 融 金 該 当 、 法 万 る よ に 託 委 売 の へ 等 者 業 引 取 商 品 猿 譲 の 等 式 株 場 上 る い て れ さ が 託 委 の 管 保 は 又 録 記 は 入 れ る こ と 、 当 該 特 定 保 管 勘 定 に お い て 振 替 口 座 簿 へ 除 を の も る め 定 で 令 政 （ い 等 式 株 場 上 る げ 掲 に 次 の 者 勘 定 に お い て は 当 該 居 住 者 又 は 国 内 に 恒 久 的 施 設 を 有 に お い て 行 う こ と 、 分 し て 行 う た め の 勘 定 を い う 。 ） 当． 関 は 記 録 又 は 保 管 の 委 託 に 関 す る 記 録 を 他 の 取 引 にす 式 等 に つ き 、 当 該 は 記 録 又 は 保 管 の 委 託 が さ れ る 上 湯 株 口 該 当 き づ 基 に 約 契 該 当 （ ． 定 勘 管 保 定 特 た れ ら け 設 に 託 委 の 管 保 は 又 録 記 は く し 若 載 記 該 当 は 託 委 の 管 保 く し 若 載 簿 記 座 の 口 へ 替 振 の 等 式 株 場 上 、 て い お に 書 約 ． ．（ 信 用 取 引 等 に 係 る も の を 除 く 。 ） 管 の 委 託 に 係 る 契 約 し く は ． と 締 結 し た 上 場 株 式 等 の 振 替 口 座 簿 へ の 記 載 若 国 内 に 恒 久 的 施 設 を 有 す る 非 居 住 者 沿 金 融 商 品 者 又 は 定 の 適 用 を 受 け る た め に 等 保 管 委 託 契 約 第 一 項 の 規 関 す る 事 項 を 扱 わ な い も の に 限 る ● ） を い う 。 引 取 く づ 基 に 約 契 任 委 領 受 等 当 配 式 株 場 上 る す 定 規 に 第 い て こ れ ら の 契 約 及 び 第 三十 七 条 の 十 一 の 六 四 に お 座 口 る 係 に 等 引 取 用 信 の 等 式 株 場 上 は 又 託 委 の 管 保 は は く し 若 載 記 の へ 簿 座 口 替 振 の 等 式 株 場 上 た れ さ 定 設に に 取 の く 座 以\n\n\n＇ 。 に\n\n\n．\n\n\n）\n\n\n（別紙2-3)\n\n\n｀な 当 口 る の 羹 を と 場 当 譲 た 喜 ょ\n\n\n〔 ら 該 座 月 他 約 作 い 株 該 渡 上 住 り以 な 居 を の 政 又 成 う 式 特 に 揚 者 、\n\n\n当下 い 住者 開 翌 令 は し 。 等 定 要 株 の\n\n\n〕賂 ． 。 又 設 月 で 上 そ 、 ） の 口 し 式 氏 特 該は す 末 定 場 の の 配 座 た 等 名 定国 内 る 営業 ま 日 ） 、 め る 株 式 年 の 額 そ 等 当 に 受 費 用 譲 の び 及 座 口に 所 で 事 等 翌 の （ け の 渡 住 をょ�ヽ ヽ 以 J:: c • 恒 久 的 施 設 を 有 す る 非 居 住 者 に 交 付 し な け の 所 在 地 の 所 轄 税 務 署 長 に 提 出 し ． ． 他 の 一 、 に 一 涌 を 当 該 金 融 商 品 取 引 業 者 等 の 当 該 特 、 由 が 生 じ た 場 合 に は当 該 事 由 が 生 じ た 日 の 属す 、 信 用 取 閾 鷹 の 解 に よ る 特 定 口 座 の 廃 止 そ 年 一 月 三 十 一 日 （ 年 の 中 途 で 上 場 株 式 等 保 他 の 財 務 省 令 で 定 め る 事 項 を 記 載 し た 報 告 の 等 式 株 場 上 「 て い お に 項 一 十 第 び 及 項 次 入 れ た 第 三 十 七 条 の 十 一 の 六 第 一 項 に 規 定 当 該 譲 渡 に 係 る 所 得 の 金 額 又 は 差 益 の 金 額 額 、 、 該 当 額 の 費 得 取 の 等 式 株 場 上 該 額当 の 価 対 の 、 、 れ さ 理 処 て い お に 座 口 特定 該 当 に 中 年 の そ 所 、 有 を 設 施 的 久 恒 に 内 国 は 又 者 住 居 た し 設 開 A9 ▲ ` · · ． , 3 、 ” •\n\n\n＇ れ ば 通 を ・ 定\n\n\n“管 委 ． 9 書 二通 等当 配 す る上 ．\n\n\n‘, ， る す\n\n\n」\n\n\n. • 9 ． ． ｀ ． .． ． ． ． ． . • ．． . ＾ . ． c\n\n\n．．．\n\n\n．．\n\n\n.\n\n\n.\n\n\n，\n\n\n.\n\n\n．\n\n\n．\n\n\n. ｀．\n\n\n．\n\n\n． ． ．\n\n\n．\n\n\n． ．\n\n\n． .. >\n\n\n．\n\n\n・＇\n\n\n．\n\n\n．\n\n\n...\n\n\n. .,\n\n\n（別紙2·-4)\n\n\n.\n\n\n.\n\n\n.\n\n\n•\n\n\n•の\n\n\n後十\n\n\n七所\n\n\n渡ず\n\n\nらう\n\n\nい額\n\n\n金の\n\n\n得の\n\n\n等第\n\n\n十る\n\n\nす 渡酉 の等\n\n\n租新\n\n\n．措\n\n\n別 ． • , 附則\n\n\n\n\n\n\n第二 一月\n\n\n住居 2十\n\n\n四 第関\n\n\n•場 （上 ＾ 則 附律 得所 〇\n\n\n〔 金 二 得 、 。 （ 金 金 一 譲 得 譲 税 置 第 十 日 者 三 す 株 第 税下以 懇 条 等 上 ） 以 額 額 項 渡 及 渡 特 法 四 七 か 又 条 る 式 ニ 法略 を か の 場 に 下 及 の 前 所 び を 別 第 十 条 ら は 経 等 ー 等\n\n\n． 〕 ｀ 。 る す と 額 る す 当 相 に 七 の 分 百 の ） 。 う い は に 合 場 る あ が 用 適 の 規定 の で ま 粂 七 十 八 第 ら れ ら え 替 み 読 り よ に 定 規 の 号 一 第 項 次 （ 額 金 株 湯 上 （ 額 金 の 等 得 所 渡 譲 税 課 る 係 に 等 式 株 の 段 訓 項 一 第 条 同 ● は 額 の 税 得 所 る す 課 し 対 得 所 渡 譲 る 係 に 等 式 株 場 上 「 て い お に 項 の こ に ろ こ と る め 定 で 令 政 て し と 額 金 の 得 所 雑 び の 得 所 業 事 る 係 に 渡 譲 の 等 式 株 場 上 該 当 ち う に 等 式 株 る す 定 規 に 段 前 項 詞 り よ に 定 規 の 段 法 置 措 別 特 税 租 新 、 は て い つ に ） 。 く 除 を 得 （ 新 租 税 特 別 措 置 法 第 三 十 二 条 第 二 項 雑 所 得． る よ に 渡 譲 の 等 式 株 場 上 該 当 、 は に 合 場 た し 掲 に 号 各 項 二 第 二 の 二 十 の 条 七 十 三 第 法 置 措 。 う い 渡を 譲 る に 項 二 第 二 の ＋ の 条 七 十 三 規定す 五 条 に お い て ． 「 上 場 株 式 等 」 と い う 。 ） ． ． （ 以 ． の ＿ 1 - 第 二 項 に 規 定 す る 土 場 株 式 等 の 十 一 税 租 新 に 問 の で ま ＋ 日 三 月 二 十 年 五 十 二 成 平 1 成 平 、 が 者 住 居 非 る す 有 を 設 施 的 久 恒 に 内 国 ． 〕 略 〔 ． ． ） 置 措 過 の 等 得 所 渡 譲 る 係 に 等 式 株 の 合 場 た し 渡 譲 を ） 号 一 『 ． 二 成 平 （ 律 法 る す 正 改 を 部 ． の l\n\n\n, 、 た 式 規 等 よ 金 係 第 の 事 げ ） の 下 特 二 課\n\n\n＇ そ 所 等 定 の り 額 る 三 規 業 る ． 譲 こ 別 十 税 0り 適 の 税 得 係 に か に 額 金 J 算 計 譲 、 渡 譲 七 十 定 に 得 所 楊 上 う の 渡 ・ の 条 置 措 年 一 特 の 法 年用 法 る か と し 渡 所 条 該 、 株 ち ・ 及 法 一 例 一第． 譲 わ た 所 得 の 当 譲 式 （ ．び に ．\n\n\n． ． ＇ ＞ 新 ．租\n\n\n税特\n\n\nヽa\n\n\n．.\n\n\n.．• ．．．\n\n\n.\n\n\n,． ． •．••\n\n\n•\n\n\n．\n\n\n．\n\n\n．\n\n\n•．．．．\n\n\n．\n\n\n•．\n\n\n．\n\n\n•\n\n\n•\n\n\n.\n\n\n•.\n\n\n（別紙2-:-5)\n\n\n,．\n\n\n. 、\n\n\n贔 ' •\n\n\n．\n\n\n． .\n\n\n．\n\n\n・第 2 ． ー 、 ｀ 第 0ま 一 ． ＋ の 同 （ 渡 譲 の 条 五 十 二 第 上 官 堡 内 座 の 条 五 十 二 略 下 以〔 び 譲 渡 所 額 当 該 損 ． 三 当 該 株 式 ・ 及 び 雑 所 金額 当 該 二 当 該 株 及 び 雑 所 金 額 当 該 ― “ 当 該 の 区 分 に 応 金 額 が あ る 計 額 と す る の 譲 渡 に 係 め る と こ ろ る 事 業 所 得 二 十 五 条 の 一 覧 等 に 係 よ に 号 四 別 特 税 祖で 項 の 場 ＋ 〕 得 失 等 得 損 式 得 損 株 じ と 。 る に の 八 る る 措及 に 十 株 の の の の の 失 等 の 失 式等 当 き こ 事 よ 金 法 譲 改 置事 る よ に ） ー じ 同 て い お に 三 十 の 十 の 条 五 十 二 第 び 十 の 条 第 五 ら ＋ か 条 の こ 下 以 。 う い を 渡 譲 る す 定規 -i い ． と 」 等 式 株 場 上 管 保 内 座 口 定 特 「 て い お に 三 十 の 及 で ま 一 十 の ＋ の 条 玉 十 二 第 ら か 条 の こ 下 以 （ 等 式 口 定 特 る す 定 規 に 項 一 第 三 の 一 十 の 条 七 十 三 第 法 二 ・， 金 額 か ら 控 除 す る 。 金 額 は 、 当 該 株 式 等 の 譲 渡に 係 る 事 業 所 得 の 金 額 及 ． 譲 渡 に 係 る 維 所 得 の 金 額 の 計 算 上 生 じ た 損 失 の 金． 金 額 か ら 控 除 す る 。 ． ・¥ の 金 額 は 、 当 該 株 式 等 の 譲 渡 に 係 る の 事 金 業 額 所 得 の 譲 渡 に 係 る 譲 渡 所 得 額 の の 金 計 算 上 生 じ た 損 失 の． 金 額 か ら 控 除 す ．る 。 ： ， ． の 金 額 は 、 当 該 株 式 等 の 譲 渡 に 係 る 譲 渡 所 得 の 金 額 の 譲 裟 に 係 る 事 業 所 得 の 金 額 の 計 算 上 生 じ た 損 失 の 該 各 号 に 定 め る と こ ろ に よ り 控 除 す る 。 ， は 、 当 該 損 失 の 金 額 は 、 次 の 各 号 に 掲 げ る 損 失 の 金 ． ． の 場 合 に お い て こ 、 れ ら の 金 額 の 計 算 上 生 じ た 損 失 の i 業 所 得 の 金 額 、 譲 渡 所 得 の 金 額 及 び 雑 所 得 の 金 額 の ． り 計 算 し た 金 額 は 、 そ の 年 中 の 同 項 に 規 定 す る 株 式 等 ． 額 、 譲 渡 所 得 の 金 額 及 び 雑 所 得 の 金 額 と し て 政 令 で 第 三 十 七 条 の 十 第 一 項 に 規 定 す る 株 式 等 の 譲 渡 に 係 裟 所 得 等 の 課 税 の 特 例 ） ． . ． ． ） の も の 前 正 ＿ 第 令 政 年 五 十 ． ＿ 一 成 平 （ 令 行 施 法 ． l場 所 業 一 二） 。 う び は 適 十 項 上 ． 式 9 - · ら か 、 得 税 ． は 取 業 所 ’ り そ お い 又 は 額 口 座 の 譲 、合 第 二 ． U 定 譲 渡 当 該 特 以 下 （法 は 又 の 得\n\n\n． ． ． ． ． 9 9 お に で ま 一 十 の ＋ の 条 五 十 二 第 ら か 条 の こ 下 以 。 う い を 等 式 株 す 定 規 に 項 二 第 三 の 一 十 の 条 七 十 三 第 法 （ 等 式 株 場 上 の 柄 銘 ． 同 る す 有 の 者 住 居 非 る す 有 を 設 施 的 久 恒 に 内 国 は 又 者 住 居 該 当 。 る す と 」 額 金 の 得 所 雑 は く し 若 額 金 の 得 所 業 事 「 、 る あ と 」 額 金 の 得 所 雑 「 中 項 一 第 条 同 び 及 項 同 、 は て い つ に 用 定 規 の 条 同 び 及 項 同 る け お に 合 場 の こ 。 る す 用 適 を 定 規 の 条 八 令 行 施 法 税 得 所 び 及 定 規 の 項 三 第 条 同 ． ｀ ず ら わ か か に 定 規 の ． 原 価 の 額 の 計 算 に つ い て は 、 所 得 税 法 第 四 十 八 条 第 一 項 及 び 第 二 等 の 譲 渡 に よ る 事 業 所 得 の 金 額 の 計 算 上 必 要 経 費 に 算 入 す る 売 ・ ・ 回 以 上 に わ た っ て 取 得 し た 同 一銘 柄 の 特 定 口 座 内 保 管 上 場 株 l l る よ に ろ • - と る め 定 に 、次 は． て い つ に 用 適 の 定 規 の で ま 項 六 第 法 施 行 令 第 二 編 第 一 章 第 四 節 第 三 款 及 び 第 百 六 十 七 条 の 七 第 三 得 費 に 算 入 す る 金 額 の 計 算 に 係 る 同 法 第 四 十 八 条 の 規 定 並 び に 得 の 金 額 ● 誤 渡 所 得 の 金 額 又 は 雑 所 得 の 金 額 の 計 算 上 必 要 経 費 の 者 の そ の 年 分 の 当 該 特 定 口 座 内 保 管 上 湯 株 式 等 の 譲 渡 に よ る ． て 、 屈 坦 安 鯰 担 ― - ＋ 七 条 第 一 項 又 は 第 三 十 八 条 第 一 ． 項 の 規 定 に 雑 所 得 の 金 額 を 計 算 す る こ と に よ り 行 う も の と す こ る の 場 合 に 9 内 保 管 上 場 株 式 等 の 譲 に渡 よ る 事 業 所 得 の 金 額 、 譲 渡 所 得 の 金 額 渡 に よ る 事 業 所 得 ＞ 譲 猿 所 得 又 は 雑 所 得 と を 区 分 し て 、 当 該 特 十 五 条 の ＋ の ＋ ま で 及 び 第 二 十 五 条 の 一十 の 二 に お い て 同 じ 。 ） 猛 三 十 七 条 の 十 第 二 項 に 以 規 下 定 こ す の る • 条 株 か 式 ら 等 を い う 。 R 所 得 又 は 雑 所 得 と 当 該 特 定 口 座 内 保 管 上 場 株 式 等 以 外 の 株 式 等 定 口 座 に 係 る 特 定 口 座 内 保 管 上 場 株 式 等 の 譲 渡 に よ る 事 業 所 得 こ の 条 か ら 第 二 十 五 条 の 十 の 十 一 ま で に お い て 同 じ 。 ） ご と に い を 座 口 ． 定 特 る す 定 規 に 号 一 第 項 三 第 三 の 一 十 の 粂 七 十 三 第 座 口 定 特 の れ ぞ れ そ る す 有 が 有 佳 居 巷 る す 有 を 設 施 的 久 恒 に 屑 住 居 の 項 同 ＾ は 算 計 の 額 ． 金 の 得 所 雑 は 又 額 金 の 得 所 漉． 譲 、 ． 額 金い る の の 第 。 項 所 又 事 よ 定 、 、 う 者上 百 ． ． 。\n\n\n} （別紙2�5）\n\n\n．． ‘知 を 含 む 。 同 項 に お い て 同 じ 。 ） を す る こ と 。 に よ り 通 知 （ そ の 書 面 に よ る 通 知 に 代 え て 行 う 電 磁 的 方 法 に よ る 取 得 E 及 び 当 該 取 得 日 に 係 る 数 そ の 他 参 考 と な る べ き 事 項 を 書 面 項 第 二 号 イ に 定 め る と こ ろ に よ り 計 算 し た 金 額 、 同 号 口 に 規 定 す 住 者 に 対 し 、 当 該 払 出 し を し た 特 定 口 座 内 保 管 上 場 株 式 等 の 第 十 定 口 座 を 開 設 し て い る 居 住 者 又 は 国 内 に 恒 久 的 施 設 を 有 す る 非 居 ） 場 合 に は 、 当 該 特 定 口 座 を 開 設 す る 金 融 商 品 取 引 業 者 等 は 、 当 該 該 特 定 口 座 以 外 の 特 定 口 座 へ の 移 管 に 係 る も の を 除 く 。 ） が あ っ ＿ ． 二 項 第 一 号 に 規 定 す る 方 法 に よ ● 行 わ れ る 譲 渡 に 係 る も の 及 び 当 1 ． 出 し （ 振 替 に よ る も の を 含 む も の と し 、 法 第 三 十 七 条 の 十 一 の 三 ー 定特 口 座 か ら の 特 定 口 座 内 保 管 上 場 株 式 等 の 至 部 又 は 一 部の払 ． ． ． ． は 、 次 に 定 め る 事 項 と す る 。 ． ＇ 10 法 第 三 十 七 条 の 十 一 の 三 第 三 項 第 二 号 に 規 定 す る 政 令 で 定 め る 事 . 〕 . 2 ー 9 〔 略 ] ● ・ 6 ハ 条 の 規 定 を 適 用 す る 。 • ・ 時 に こ れ ら の 譲 渡 が あ っ た も の と み な し て 、 所 得 税 法 施 行 令 第 百 ． お け る こ れ ら の 譲 渡 に つ い て は 、 こ れ ら の 譲 渡 の う ち 最 後 の 譲 渡 特 定 口 座 内 堡 官 上 場 株 式 等 の 譲 渡 が あ っ た 場 合 に は 、 当 該 一 の 13 に 三 一 の 特 定 口 座 に お い て ． 一 ‘ の 日 に 二 回 以 上 に わ た つ て 同 一 銘 柄 ． 項 か ら 第 六 項 ま で の 規 定 を 適 用 す る 。 ． 税 法 施 行 令第 二 編 第 一 ぃ 章 第 四 節 第 三 款 及 び 第 百 六 十 七 条 の 七 第 三 ． 場 株 式 等 に つ い て は 、そ れ ぞ れ そ の 銘 柄 が 異 な る も の と し て 、 所 得 内 保 管 上 場 株 式 等 以 外 の 土 場 株 式 等 と が あ る 場 合 に は 、 こ れ ら の て 同 じ 。 〉 の う ち に 当 該 特 定 口 座 内 保 管 上 場 株 式 等 と 当 該 特 定 口通 る 二 特 た 第 項 十 の の 上 座\n\n\n·二、三、〔略〕 12 11 前 〔 項 略 の 〕 場 ． 合 ．．． に お い て 、同 項 の 移 管 元 の 金 融 商 品 取 引 業 者 等 の 営 業 所の長は、その移管の際、移管先の特定口座を開設する金融商品取引業．\n\n\n' ' .の 者 営業 等所 （ の 以長 下に こ 次 の の 項 各 に 号 お に い 掲 て げ 「 る 移 書 管 類 先 の の 送 金 付 融 （ 商 当 品 該 取 書 引 類 業 の 者 送 等 付 」\n\n\nに と代 い え う\n\n\n。\n\n\n）\n\n\nて行う電磁的方法による当該書類に記載すぺき事項の提供を含む。以恒\n\n\n務 下 久 省 こ 的令 の 施 で 項 設定 に をめ お 有 る い す 事 て る 項 同 非 を じ 届 書 。 任 面 ） 者 に を に よ す 第 り る 二 通 と 号 知 と イ を も 及 し に び な 、 口 け 前 に れ 項 掲 ば の げ な 居 る ら 9 事 住 こな 者 項 の い そ 又場 の は国 他 べ 内 財に\n\n\n[合において、当該移管先の金融商品取引業者等の営業所の長は．、．当該\n\n\n， 二 一 株 各 金 ． 式 号融 当 ． 等 に 〔 商 該 略 の 掲品 移 〕 移 げ取 管 管 る 引 に ． を 書 業 係 ． 受 類 者 る け の 特 等 な 送 定 の い 付 旦 営 も が 座 業 の な 内 所 と い 保 の す 場 管 長 る 合 上 の 。 に 場 次 は 株 に 、 式 掲 同 等 げ 項 に る の つ 事 特 き 項 定 当 を 口 該 証 座 移 す 内 管る 保 元書 管 類 ． の 上場\n\n\n．等の譲渡があったものとした場合に、．所得税浩施行令第．二編第一\n\n\n•し、当該移管をした時に当該移管をした特定口座内保管上場株式 章\n\n\n\n\n\n\n第四 節\n\n\n第 三 款 及 び 第 百 六 十 七 条 の 七 第 三 項 か ら 第 六 項ま\n\n\nで の規定（第一•項後段の規定により適用される場合を含む。．）により＂｀\n\n\n、\n\n\n該当特\n\n\n定 口 座 内 保 管 上 場 株 式 等 の 売 上 原 価 の 額 又 は 取 得費\n\n\nの 額費用の金額並びにこれらの金額のム品m額．）\n\n\n．\n\n\n．る金額及び当該特定口座内保管上湯株式等の数に対応する当該で定めるものがある場合には、当該取得費等の額として計算され れる金額に相当する金額（当該移管に要する費用として財務省令 （以下この項において\n\n\n． 「取得費等の額Iという。）として計算さ．\n\n\nf ・ 25 ロ\n\n\n〔 . 略 ー\n\n\n]．-\n\n\n_〔 , 略 ● 〕 9 ． ． •...\n\n\n•26居住者又は国内に恒久的施設を有する非居住者が、特定口座から特\n\n\n． ． • ●, ． ｀● ．\n\n\n'（別紙2-5)\n\n\nー\n\n\nヽ �ツ二 場 暑 た 七 一 上 場 額 か 等 式 を し に 聾 よ に む 含 口 定\n\n\n゜ 〔 略 〕 合 に 費 等 上 楊 第 三 得所 株 式 ら 控 あ で た し る 係 行 り の も 内 座は の 株 項 税 等 除 る 上 も わ と 保\n\n\n、 額 式 か 法 の す も 場 の れ し 管\n\n\n・ 同 と 等 ら 施 所 べ の 株 を る 、 上号 し は 第 行 有 き を 式 除 譲 法 場し イ 玉 、 六 令 期 売 除 等 く 渡 第 株に 械 当 項 第 間 上 く と 。 に 二 式規 さ 該 ま 二 の 原 。 同 ） ． 係 十 等\n\n\n， 9‘ 定 れ 払 で 編 判 価 ） 一 を る 七 の\n\n\nヽ す る 出 の 第 定 又 の 銘 し も 条 全\n\n\n、. ．9 る合\n\n\n金額\n\n\nしの\n\n\n規定\n\n\n一章\n\n\nにつ\n\n\nは取 渡譲\n\n\nの柄\n\n\n場た\n\n\n及の\n\n\n十の\n\n\n又部\n\n\n計 爾 時 の 第 い 得 に 上 合 び 一 は額 号 に 適 四 て 費 よ 場 に 当 の 一\n\n\n） イ 、 用 節 は の る 株 は 該 三 部\n\n\n' ） . , ..． ' に よ り に 規 定 ． 第 十 に つ い 第 三 款 、 次 に 額 の 計 の 得 所 ． 等 式 該 当 、 口 定 特 項 三 第 出 払 の取\n\n\n得す\n\n\nる二\n\n\n項て\n\n\nは 当該\n\n\n．及び\n\n\n定め\n\n\n算及 額金\n\n\n特盆\n\n\n出払\n\n\n以座\n\n\n二第\n\n\n．し\n\n\nさ 費 第 、 払 第 る び の 定 し 外 号 臼\n\n\n, ． れ た 用 が 二 号 出 し 百 六 と こ 当 該 算 計 座 口 の 後 特 の 規 に 替 振以 も あ イ を 十 ろ 同 上 内 当 定 定 に\n\n\n·· . 上 ・ の と る に 規 し 七 条 に よ 一 銘 収 総 管 保 払 該 ヤ座 口 る す る よす 定 I の る 柄、 入 上 出 へ 方 もる 。 す る ． 。 ． ． の ｀ 金 株 場 の 法 を の\n\n\n．\n\n\nゞ\n\n\n． ． ． ． ．\n\n\n． ． ．\n\n\n●\n\n\n， ．｀\n\n\n'\n\n\n•• •• • 、\n\n\n•• ． •．•..\n\n\nI\n\n\n．．，．\n\n\n' . ,,\n\n\n（別紙2-6)\n\n\n·. : , ‘附． 則 ． ＂ ・ ＂ ．． ． ＇ 所 に 開 設 さ れ て い る 当 該 居 住 者 又 は 国 内 に 恒 久 的 施 に 記 載 又 は 記 録 が さ れ て い る も の 及 び 金 融 商 品 取 引 業 に 関 す る 法 律 （ 平 成 士 二 年 法 律 第 七 十 五 号 ） に 規 定 す を い う 。 以 下 こ の 所 条 に お い て 同 じ 。 ） に 係 る 社 債 、 い う 。 ） の 営 業 所 （ 新 令 第 二 十 五 条 の 十 の 二 第 六 項 に 融 商 品 取 引 業 者 等 （ 以 下 こ の 条 に お い て 「 金 融 商 品 取 上 揚 株 式 等 （ 新 法 第 三 十 七 条 の 十 一 の 三 第 三 項 第 一 号 る 非 居 住 者 が 有 す る 新 法 第 三 十 七 条 の ＋の 三 第 二 項 に 規 1 ， 三 十 七 条 の ， 十 一 の 三 第 一 項 の 居 住 者 又 は 国 内 に 恒 久 第 十 五 項 各 号 に 掲 げ る も の の ほ か 、 当 該 特 定 口 座 を 開 ハ に 規 定 す る 政 令 で 定 め る 上 場 株 式 等 は 新 令 第 二 十 五 座 合 斧 こ の 条 に お い て 「 特 定 口 座 」 と い う 。 ） に 係 る の 間 は 、 新 法 第 三 十 七 条 の 十 一 の 三 第 三 項 第 一 号 に 規 第 十 一 条 平 序 七 年 四 月 一 日 か ら 平 成 二 十 一 年 五 月 三 十 一 ＂ 特 定 口 座 へ の 上 場 株 式 等 の 保 管 の 委 託 に 関 す る 経 過 措 合（ 翌 登 ＇ 七 年 四 月 一 日 か ら 平 成 二 十 一 年 日 五 ま 月 で 三 十 1 o ．成 十 七 年 政 令 第 ＿ 三 号 ） ・ 9 · · 〇 租 税 特 別 措 置 法 施 行 令 の 一 部 を 改 正 す る 政 令 （ 平設 者 る 株 規 引 に 定 的 設 条 同 定 日 置 のを 等 振 式 定 業 規 す 施 す の 項 す ま ）、間有 ．の 替 等 す 者 定 る 設 る ＋ 第 る で の ‘す る 非 ＇ 営 業 r 口 座 簿 の 振 替 る 営 業 等 」 と す ' る . 金 を 有 す 新 法 第 の ・ ニ 二 号 特 定 口 . l\n\n\n． ． ．\n\n\n， 居住者の有価証券の保管の委託に係る口座に保管の委託がされて 2 ． と い 平 す る 成 る も 十 ． 。 の 七 ． を 年 除 四 く 月 ． 4 。 一 以 日 下 か こ ら の 平 条 成 に 二 お 十 い 一 て 年 「 五 特 月 例 三 上 十 場 一 株 日 式ま 等で 」\n\n\nの と間 い に う 、 。\n\n\n）\n\n\n・ 定口座に特例上場株式等の保管の委託をしようとする楊合には、当 前項の居住者又は国内に恒久的施設を有する非居住者が同項の特\n\n\n.\n\n\n．•.\n\n\n9:\n\n\n.··\n\n\n.以\n\n\n•上\n\n\n所の長に提出しなければならな•い。\n\n\n口\n\n\n》鵞悶当該特定口座が開設されている釜融商品取引業者等の営業 墜株式等の種類、銘柄、数その他財務省令で定める事項を記載した． 等を当該特定口座に保管の委託をする旨、保管の委託をする特例上 該居住者又は国内に恒久的施設を有する非居住者は、特例上場株式 3\n\n\n.〔以\n\n\n下賂\n\n\n〕\n\n\n‘\n\n\n＂\n\n\n..,\n\n\n.\n\n\n.\n\n\n.\n\n\n•\n\n\n.\n\n\n•\n\n\n．．．\n\n\n. • ． ． • ． ．\n\n\n, ．\n\n\n．\n\n\n＇．\n\n\n. ．\n\n\n．．\n\n\n．\n\n\n． ．\n\n\n．\n\n\n．\n\n\n．\n\n\n．\n\n\n．\n\n\n（別紙３）\n\n\n被告の主張を前提とした各課税の根拠及び適法性\n\n\n\n\n\n\n第１ 本件更正処分の根拠被告が本訴において主張\n\n\nする原告の平成２５年分の所得税等に係る総所得金額及び納付すべき税額は、別表「課税処分等の経緯」の「被告主張額」欄に記載のとおりであり、これらの金額の計算根拠は、次のとおりである。\n１ 総所得金額（別表「被告主張額」①欄の金額） ２４４万９３７２円上記金額は、原告の平成２５年分の所得税等の確定申告書に記載された総所得金額（甲１・\n１及び３枚目の⑨欄の金額）と同額である。\n２ 株式等の譲渡所得等の金額（上場分）（別表「被告主張額」②欄の金額）\n２３億７２８１万４９５４円上記金額は、次の\n\n\n（１）の金額から\n\n\n（２）及び\n\n\n（３）の金額を差し引いた後の金額である。\n\n\n（１）譲渡価額（別表「被告主張額」③欄の金額） ２４億９０４０万４０００円上記金額は、原告が平成２５年中に本件法人株式を譲渡したことによる対価の額であり、\n原告の平成２５年分の所得税等の確定申告書に記載された金額（甲１・３枚目○ツ欄の金額）\nと同額である。\n\n\n（２）取得費（別表「被告主張額」④欄の金額） １億１５１６万１１００円上記金額は、平成２５年６月１１日及び同月１２日に譲渡した本件法人株式の概算取得費\n１億０８４９万４１００円（収入金額２１億６９８８万２０００円×５％）と本件譲渡株式の取得費６６６万７０００円（５９円／株×１１万３０００株）とを合計した金額である。\nなお、本件更正処分では、本件譲渡株式に係る取得費についても概算取得費で所得金額を算出しているが、概算取得費に係る通達の取扱いは、納税者が申告に当たって、概算取得費で算出した額をその取得費として申告しているときに認めるものであって、本来は、課税当局において概算取得費を取得費として認定するものではない。このことから、本訴においては、本件譲渡株式について、実額である１株当たり５９円を基準に計算した金額を取得費として主張する。\n\n\n（３）譲渡費用（別表「被告主張額」⑤欄の金額） ２４２万７９４６円上記金額は、本件法人株式の譲渡に係る委託手数料の額であり、原告の平成２５年分の所得税等の確定申告書に添付された「株式等に係る譲渡所得等の金額の計算明細書」に記載された金額（甲１・１３枚目「１ 所得金額の計算」の⑤欄の金額）と同額である。\n３ 分離課税の上場株式等に係る配当所得の金額（別表「被告主張額」⑥欄の金額）\n２６６９万２０７２円上記金額は、原告の平成２５年分の所得税等の確定申告書に記載された分離課税の上場株式等に係る配当所得の金額（甲１・３枚目○66欄の金額）と同額である。\n４ 所得控除の額の合計額（別表「被告主張額」⑦欄の金額） ５８万７００７円上記金額は、原告の平成２５年分の所得税等の確定申告書に記載された所得金額から差し引かれる金額の合計額（甲１・１及び３枚目㉕欄の金額）と同額である。\n５ 課税総所得金額（別表「被告主張額」⑧欄の金額） １８６万２０００円上記金額は、前記１の総所得金額２４４万９３７２円から前記４の所得控除の額の合計額５\n８万７００７円を控除して算出した金額（ただし、国税通則法〔平成２８年法律第１５号による改正前のもの。以下「通則法」という。〕１１８条１項の規定により１０００円未満の端数を切り捨てた後のもの。）である。\n６ 上場株式等に係る課税譲渡所得等の金額（別表「被告主張額」⑨欄の金額）\n２３億７２８１万４０００円上記金額は、前記２の上場株式等に係る譲渡所得等の金額２３億７２８１万４９５４円について、通則法１１８条１項の規定により１０００円未満の端数を切り捨てた後の金額である。\n７ 上場株式等に係る課税配当所得等の金額（別表「被告主張額」⑩欄の金額）\n２６６９万２０００円上記金額は、前記３の上場株式等に係る配当所得等の金額２６６９万２０７２円について、\n通則法１１８条１項の規定により１０００円未満の端数を切り捨てた後の金額である。\n８ 算出税額（別表「被告主張額」⑭欄の金額） １億６８０５万８５２０円上記金額は、次の\n\n\n（１）ないし\n\n\n（３）の合計額である。\n\n\n（１）前記５に対応する税額（別表「被告主張額」⑪欄の金額） ９万３１００円上記金額は、原告の平成２５年分の所得税等の確定申告書に記載された課税総所得金額に対応する税額（甲１・３枚目○ 78 欄の金額）と同額である。\n\n\n（２）前記６に対応する税額（別表「被告主張額」⑫欄の金額）\n１億６６０９万６９８０円上記金額は、前記６の上場株式等に係る課税譲渡所得等の金額２３億７２８１万４０００円に、平成２０年法律第２３号附則４３条２項に規定する１００分の７の税率を乗じて計算した金額である。\n\n\n（３）前記７に対応する税額（別表「被告主張額」⑬欄の金額） １８６万８４４０円上記金額は、原告の平成２５年分の所得税等の確定申告書に記載された上場株式等に係る課税配当所得等の金額に対応する税額（甲１・３枚目○ 82 欄の金額）と同額である。\n９ 政党等寄附金等特別控除の金額（別表「被告主張額」⑮欄の金額） １２００円上記金額は、原告の平成２５年分の所得税等の確定申告書に記載された政党等寄附金等特別控除の金額（甲１・１枚目㉛～㉞欄の金額）と同額である。\n10 差引所得税額（別表「被告主張額」⑯欄の金額） １億６８０５万７３２０円上記金額は、前記８の算出税額１億６８０５万８５２０円から前記９の政党等寄附金等特別控除の金額１２００円を差し引いた後の金額である。\n11 復興特別所得税額（別表「被告主張額」⑰欄の金額） ３５２万９２０３円上記金額は、前記１０の差引所得税額１億６８０５万７３２０円に、東日本大震災からの復興のための施策を実施するために必要な財源の確保に関する特別措置法（以下「復興財源確保法」という。）１３条に規定する１００分の２.１の税率を乗じて計算した金額である。\n12 源泉徴収税額（別表「被告主張額」⑱欄の金額） １９０万８５６５円上記金額は、原告の平成２５年分の所得税等の確定申告書に記載された源泉徴収税額（甲\n１・１枚目㊹欄の金額）と同額である。\n13 納付すべき税額（別表「被告主張額」⑲欄の金額） １億６９６７万７９００円上記金額は、前記１０の差引所得税額１億６８０５万７３２０円に前記１１の復興特別所得税額３５２万９２０３円を加算し、前記１２の源泉徴収税額１９０万８５６５円を控除して算出した金額に、復興財源確保法２４条２項の規定により１００円未満の端数を切り捨てた後の金額である。\n\n\n\n\n\n\n第２ 本件更正処分の適法性被告が主張する原告の\n\n\n平成２５年分の所得税等の納付すべき税額は、前記第１の１３のとおり、１億６９６７万７９００円であるところ、この金額は、本件更正処分における納付すべき税額１億６９００万９０００円（甲２・５枚目「○Ｂ更正後の額」㊶欄の金額）を上回っているから、本件更正処分は適法である。\n\n\n\n\n\n\n第３ 本件賦課決定処分の根拠及び適法性前記第\n\n\n２のとおり、本件更正処分は適法であるところ、被告が主張する原告が新たに納付すべき税額２０１９万８３００円（前記第１の１３の納付すべき税額１億６９６７万７９００円から、原告の確定申告における納付すべき所得税等の税額１億４９４７万９６００円〔甲\n\n\n１・１枚目㊺欄の金額〕を控除した後の金額）については、その計算の基礎となった事実のうちに本件更正処分前の税額の計算の基礎とされていなかったことについて、通則法６５条\n\n\n４項に規定する「正当な理由」があるとは認められない。\n\n\nしたがって、被告が主張する原告が新たに納付すべき税額２０１９万８３００円について賦課される過少申告加算税の額は、通則法６５条１項の規定に基づき、被告が主張する原告が新たに納付すべき税額２０１９万円（同法１１８条３項の規定により１万円未満の端数を切り捨てたもの）に１００分の１０の割合を乗じて計算した算出した金額２０１万９０００円である。\n\n\n当該金額は、本件賦課決定処分における過少申告加算税の額１９５万２０００円（甲２・１枚目「過少申告加算税」欄の金額）を上回っているから、本件賦課決定処分は適法である。\n\n\n以 上叩員課税娼分零の経緯\n\n\n1 □二 竺--\n\n\n・ 平：区 分平成::： 日\n\n\n:17 3�総 所 得金額 l ① 2, 449, 372',, 2,449;372 2A4ふ9,．372\n\n\nI株式等の繭裟所得等の金額\n\n\n7 4}.J�l 2;090, �01; 954 2,363,455;854 2, 372,8i4, 954\n\n\n（上繊分）（③..,.ー。 ⑤ .\n\n\n4° ヽ\n\n\n、\n\n\n譲 渡 価 額；： •2,4 90; 404, 000| • 2,-4こ90, 4,二00o\"2.，490こ, 404,000, ,\n\n\n). ·;\n\n\n；内\n\n\n取 費： ④ 397, 774, 100 1 5訳．\n\n\n；\n\n\n‘\n\n\n: 』： .. , •.“譲． ヽ ．漉-． • 費 ら： 用 · ⑤ ` ．2,427,• 9鉛 2,427�946 2A27，幽\n\n\niヽ• 冒9·\n\n\n、\n\n\nャ .分離課税の上楊株式等 I · ⑥ 26, 692, 012[. ·26/692,0 72' 26;6 9 2,072'\n\n\n·1 に . 係る配当所得 ャ の金額i ,--·---•- ― , ，,.々.. Cc .\n\n\nl所得控除の額の合計額 ⑦ 5 87, 007I 587,0. 07 587,007\n\n\n①対応分： ⑧ ’’ 1,8. 62,·909 1 · 9 . • .8 62 ・ ， ． - C , • • ― . ． O ．[ o t 0 .r ． ． 、 :·9 • • •• ” .•• • • O ·· ． ·�． 1 ， ， 9● 8 ↓ 69 f ·· n ” O : 0 ・ ' ．課税される\n\n\n�1⑨l `-\n\n\n②対応分 2, 090,2 0l, 0oo|� 2·, 363, 455, 000l 2. , 372, 814,000噺得金額 ―\n\n\n；\n\n\n⑥対応分 ⑩ 26,�92,000 26,•692, 2s� 692;_00.0l:\n\n\n、 l• r\n\n\n⑧ ！こ 対する税額 団 ⑪I' -93,: . 1001' 93, ― .100 93,•100\n\n\n9 9� 9l l l � .-、\n\n\n出 算 ⑨に対する税額 9||' ⑫ 146, 3.14,070. • •165, 441,8 50 166, 096, 980\n\n\n． C・税 .心 ’ぺ ． .. ―\n\n\n．．• ．．．―\n\n\n.\n\n\n. 1額 ⑩に対する税額・ ⑬ 1;• 868, 4＾4 0 1,�68，細． 1,868,440\n\n\n． ． •． ． ． ． ． ． ． - ・ （ ・ ⑪ ・小 +.⑫ 計 ＋⑬ ． ） .. ， '••I ⑭ i 48, 275,-61 噌·;· 0 1. 67, 403, ― 390 168,O• 58,5 20\n\n\n••\n\n\n．． ． ― ヽ\n\n\n•政党等寄附金等特別控除⑮\n\n\n·-\n\n\n1, 20 ．0\n\n\n．\n\n\n1,200 1;20.0\n\n\n• - 差·・引\n\n\nーー所 （⑭ ー 得 ⑮） ．税ヘ・\n\n\n·額 ： ・9 ⑯ ・ ^ '· 148, 274, 410 167-,4 02; ― 190 168, 0\n\n\n．と\n\n\n·,\n\n\n—\n\n\n•復興特別所得税鬱\n\n\n,\n\n\ni\n\n\n;\n\n\n・\n\n\n｀⑰・Kへ·\n\n\n33,,\n\n\n^\n\n\n:1 13) 762 3,616,445 3,929, 20·3\n\n\n（⑯XO. 02l)\n\n\n`. · ▲·� ： � ▲ ― ●� · : ； � · � · · · · · · • �”� �\n\n\n＿ ＂諏泉·徴 収税額⑱ ＾・1,9Q8,·565 '.1,908,565 1,908,565\n\n\n．\n\n\n•納付す． ・ベ• ．き税額\n\n\n⑬149;479,600 169,009;0QO 16·9,•677, 900\n\n\n（⑯十⑰ー⑱） ―量\n\n\n・ 過少申告加算税の額 ⑳ —-- //ン/\n\n\n-\n\n\n．\n\n\nl;952i000 2, 019,．000\n\n\n（注）．1 ⑧欄ないし⑩欄の各金額は、1000円未満の端数金額を切り捨―てた後の金額である。．．\n\n\n＂\n\n\n2 ⑲欄の金額は、100円未潰の端数金額を切り捨てた後の金額である。\n\n\n27 ―"
}