{
  "number": "13695",
  "title": "所得税に係る重加算税の賦課決定処分取消請求控訴事件",
  "court": "福岡高等裁判所",
  "date": "令和４年３月２９日",
  "date_iso": "2022-03-29",
  "result": "取消",
  "topics": [
    "所得税"
  ],
  "laws": [],
  "keywords": [
    "所得税",
    "決定処分",
    "賦課決定",
    "重加算税"
  ],
  "sections": {
    "主文": [
      "１ 本件控訴を棄却する。\n２ 控訴費用は控訴人の負担とする。"
    ]
  },
  "full_text": "13695 所得税に係る重加算税の賦課決定処分取消請求控訴事件 - 国税庁判決事例集\n\n\n\n\n\n\n\n\n\n\n目次に戻る\n\n\n\n\n判決 13695\n\n\n所得税に係る重加算税の賦課決定処分取消請求控訴事件\n\n\n\n\n裁判所:\n 福岡高等裁判所\n\n\n判決日:\n 令和４年３月２９日\n\n\n結果:\n 取消\n\n\n\n\n\n\n主文\n\n\n１ 本件控訴を棄却する。\n２ 控訴費用は控訴人の負担とする。\n\n\n\n\n\n\n第１ 控訴の趣旨\n\n\n１ 原判決を取り消す。\n２ 小倉税務署長が平成３１年４月２３日付けで控訴人に対してした平成２３年分の所得税に係る重加算税の賦課決定処分を取り消す。\n３ 国税不服審判所長が令和元年１１月１２日付けで控訴人に対してした控訴人の審査請求を却下する旨の裁決を取り消す。\n\n\n\n\n\n\n第２ 事案の概要\n\n\n（以下、略称は原判決の例による。）\n１\n\n\n（１）本件は、控訴人が、小倉税務署長から平成２３年分の所得税に係る重加算税の賦課決定処分（本件処分）を受けたため、本件処分につき審査請求（本件審査請求）をしたところ、\n本件審査請求は法定の不服申立期間後にされた不適法なものであるとして、これを却下する旨の裁決（本件裁決）を受けたことから、被控訴人に対し、本件処分の取消しを求めるとともに、本件裁決の取消しを求める事案である。\n\n\n（２）原審は、本件審査請求は、法定の不服申立期間後にされたもので、そのことについて正当な理由があるとはいえないとした上、本件訴えのうち本件処分の取消しを求める部分は、適法な審査請求についての裁決を経たものではなく、不適法であるとして、これを却下し、本件審査請求を却下した本件裁決に誤りはなく適法であるとして、控訴人の請求のうち本件裁決の取消しを求める部分を棄却した。\n控訴人は、これを不服として控訴を提起した。\n２ 関係法令の定め、前提事実及び当事者の主張は、原判決「事実及び理由」欄の「第２ 事案の概要」の１から３まで（原判決２頁２０行目から４頁１１行目まで）に記載のとおりであるから、これを引用する。\n\n\n\n\n\n\n第３ 当裁判所の判断\n\n\n１ 当裁判所も、本件訴えのうち本件処分の取消しを求める部分は不適法であり、これを却下すべきと、また、控訴人の請求のうち本件裁決の取消しを求める部分は理由がなく、これを棄却すべきと判断する。その理由は、原判決「事実及び理由」欄の「第３ 当裁判所の判断」\nの１から３まで（原判決４頁１３行目から６頁２０行目まで）に記載のとおりであるから、\nこれを引用する。\n２ 以上によれば、本件控訴は理由がないから、これを棄却することとして、主文のとおり判決する。\n福岡高等裁判所第１民事部裁判長裁判官 森冨 義明裁判官 佐藤 拓海裁判官 伊賀 和幸"
}