{
  "number": "13769",
  "title": "修正申告の取消等請求事件",
  "court": "千葉地方裁判所",
  "date": "令和４年１１月１１日",
  "date_iso": "2022-11-11",
  "result": "取消",
  "topics": [
    "所得税",
    "消費税"
  ],
  "laws": [
    "国税通則法23条",
    "国税通則法65条",
    "国税通則法68条"
  ],
  "keywords": [
    "地方消費税",
    "復興特別所得税",
    "所得税",
    "更正の請求",
    "消費税",
    "無申告加算税",
    "賦課決定",
    "過少申告加算税",
    "重加算税"
  ],
  "sections": {
    "主文": [
      "１ 本件訴えのうち平成２７年課税期間及び平成２８年課税期間の消費税及び地方消費税に係る無申告加算税及び重加算税の各賦課決定の取消しを求める部分を却下する。\n２ 原告のその余の訴えに係る請求をいずれも棄却する。\n３ 訴訟費用は原告の負担とする。"
    ]
  },
  "full_text": "13769 修正申告の取消等請求事件 - 国税庁判決事例集\n\n\n\n\n\n\n\n\n\n\n目次に戻る\n\n\n\n\n判決 13769\n\n\n修正申告の取消等請求事件\n\n\n\n\n裁判所:\n 千葉地方裁判所\n\n\n判決日:\n 令和４年１１月１１日\n\n\n結果:\n 取消\n\n\n\n\n\n\n主文\n\n\n１ 本件訴えのうち平成２７年課税期間及び平成２８年課税期間の消費税及び地方消費税に係る無申告加算税及び重加算税の各賦課決定の取消しを求める部分を却下する。\n２ 原告のその余の訴えに係る請求をいずれも棄却する。\n３ 訴訟費用は原告の負担とする。\n\n\n\n\n\n\n第１ 当事者が求めた裁判\n\n\n１ 請求の趣旨\n\n\n（１）処分行政庁が令和２年１月２７日付けで原告に対してした平成２４年分の所得税並びに平成２５年分ないし平成３０年分の所得税及び復興特別所得税に係る重加算税の各賦課決定をいずれも取り消す。\n\n\n（２）処分行政庁が令和２年１月２７日付けで原告に対してした平成２６年課税期間ないし平成\n２８年課税期間の消費税及び地方消費税に係る無申告加算税及び重加算税の各賦課決定、平成２９年課税期間の消費税及び地方消費税に係る重加算税の賦課決定並びに平成３０年課税期間の消費税及び地方消費税に係る無申告加算税及び重加算税の賦課決定（平成２９年課税期間及び平成３０年課税期間に係る各賦課決定については令和２年７月２７日付け変更決定により減額された後のもの）をいずれも取り消す。\n\n\n（３）処分行政庁が令和２年６月１１日付けで原告に対してした平成２６年分ないし平成３０年分の所得税及び復興特別所得税に係る更正の請求についての更正をすべき理由がない旨の各通知処分をいずれも取り消す。\n\n\n（４）処分行政庁が令和２年６月１１日付けで原告に対してした平成２６年課税期間ないし平成\n３０年課税期間の消費税及び地方消費税に係る更正の請求についての更正すべき理由がない旨の各通知処分をいずれも取り消す。\n２ 被告の答弁主文同旨\n\n\n\n\n\n\n第２ 事案の概要原告は\n\n\n、個人で型枠工事業を行っていた者であるところ、請求の趣旨記載の各年分の所得税及び復興特別所得税（以下「所得税等」という。）の確定申告を法定申告期限までにしていたが、請求の趣旨記載の各課税期間の消費税及び地方消費税（以下「消費税等」という。）の確定申告をしていなかった（平成２９年課税期間については法定申告期限後にしていた。）。\n処分行政庁は、上記各年分の所得税等及び上記各課税期間の消費税等に関する調査を行った上、その結果により、上記各年分の所得税等について事業所得の金額が過少に申告されている、上記各課税期間の消費税等について確定申告がされていないなどとして、原告に対し、\n修正申告及び期限後申告を勧奨した。これを受けて、原告は、令和元年１２月１７日、処分行政庁に対し、上記各年分の所得税等の修正申告をし、上記各課税期間の消費税等の期限後申告（平成２９年課税期間については修正申告）をした。\n処分行政庁は、令和２年１月２７日付けで、原告に対し、上記各年分の所得税等について国税通則法（平成２９年１月１日前に法定申告期限が到来した国税については平成２８年法律第１５号による改正前のもの。以下同じ。）６８条１項の規定による重加算税の賦課決定（以下「平成２４年所得税加算税賦課決定」などといい、平成２４年から平成３０年までのものを併せて「本件各所得税加算税賦課決定」という。）をし、上記各課税期間の消費税等について同法６６条１項の規定による無申告加算税の賦課決定及び同法６８条２項の規定による重加算税の賦課決定（平成２９年課税期間については重加算税の賦課決定のみ。以下「平成２\n６年消費税加算税賦課決定」などといい、平成２６年から平成３０年までのものを併せて\n「本件各消費税加算税賦課決定」という。）をした。\n原告は、令和２年３月１２日、処分行政庁に対し、上記各年分のうち平成２６年分ないし平成３０年分の所得税等の修正申告に係る事業所得の金額及び上記各課税期間の消費税等の期限後申告（平成２９年課税期間については修正申告）に係る課税標準額が過大であることを理由として、上記各年分のうち平成２６年分ないし平成３０年分の所得税等及び上記各課税期間の消費税等について更正の請求をした。処分行政庁は、令和２年６月１１日付けで、原告に対し、更正をすべき理由がない旨の通知処分をした（このうち、所得税等についての通知処分を、以下「平成２６年所得税通知処分」などといい、平成２６年から平成３０年までのものを併せて「本件各所得税通知処分」という。また、消費税等についての通知処分を、\n以下「平成２６年消費税通知処分」などといい、平成２６年から平成３０年までのものを併せて「本件各消費税通知処分」という。）。\n本件は、原告が、上記更正の請求における主張と同様に主張し、処分行政庁の所属する国を被告として、本件各所得税加算税賦課決定及び本件各消費税加算税賦課決定（平成２９年消費税加算税賦課決定及び平成３０年消費税加算税賦課決定については令和２年７月２７日付け変更決定により減額された後のもの）の取消しを求めるとともに、本件各所得税通知処分及び本件各消費税通知処分の取消しを求める事案である。\n１ 関係法令の定め別紙１のとおり\n２ 前提事実（当事者間に争いがない事実又は各項に掲記の証拠若しくは弁論の全趣旨により容易に認めることができる事実）\n\n\n（１）当事者等ア 原告（昭和●年●月生）は、平成２２年頃から「Ａ」の屋号を使用して個人で建設業を行っていた者である。（乙５、６）\n原告は、土木建築工事の設計、施工、請負等を目的として昭和６１年５月●日に設立された有限会社Ｂ（平成５年１０月２３日に株式会社に組織変更）の代表者を務めた後、建築工事、土木工事の請負、設計、施工等を目的として平成１５年１１月●日に設立された原告の妻である乙が代表者を務める有限会社Ｃ（平成１９年１月２４日に株式会社Ｄに商号変更。以下「Ｄ社」という。）の従業員として稼働していた。株式会社Ｂは、平成１６年３月●日、破産宣言を受け、Ｄ社は、平成２３年１２月●日、破産手続開始決定を受けた。（乙１ないし４、弁論の全趣旨）\nイ 処分行政庁は、請求の趣旨記載の各年分の所得税等の申告書及び請求の趣旨記載の各課税期間の消費税等の申告書の提出の際における原告の住所地を所轄する税務署長である。\n（弁論の全趣旨）\n\n\n（２）原告の事業の内容ア 原告は、Ｅ株式会社、Ｆ株式会社、株式会社Ｇ、有限会社Ｈ、Ｉ株式会社、有限会社Ｊほかの売上先（以下、単に「Ｅ」のようにいう。）から工事を受注し、その規模や納期に応じて、自ら施工を行うほか、他の施工業者（外注先）に工事の一部又は全部の施工を委託していた（以下、原告が売上先から受注した工事のうち、原告が単独で施工した工事を\n「単独工事」といい、外注先に一部又は全部の施工を委託した工事を「外注工事」という。）。（乙５、弁論の全趣旨）\nイ 原告は、売上先からの工事の受注を、全て口頭（対面のほか電話によるものを含む。）\nで行っていた。原告は、売上先に対する工事代金の請求を、出来高に基づいて月末締めで作成した請求書（乙１０の１及び２）を送付する方法により行っていた。請求書には、施工場所、施工内容、施工に要した人工数や施工した平米数、単価、人工数や平米数に単価を乗じて算出した金額、当該金額に係る消費税の金額、当該工事に要した高速代やガソリン代などの費用の金額が記載されており、送付先により、業務に従事した者（外注先を含む。）の氏名及びその月の従事の状況、従事日数等が記載された出勤表が添付されていた。\n原告は、売上先からの工事代金の支払を、請求書の作成の月の翌月又は翌々月に、主としてＫ銀行松戸支店の原告名義の普通預金口座（以下「本件口座」という。）への振込みの方法により受けていたが、一部については現金や手形の授受の方法により受けていた。原告は、月に一度は、本件口座の預金通帳の記帳を行い、売上先からの入金額が原告の請求書に記載された請求額と一致していることを確認していた。（乙５、１１、１２、１４、\n弁論の全趣旨）\nウ 原告は、外注先の外注工事への従事の状況を、作業日報（Ｄ社の社名が印字されているもの。乙１５）により把握していた。原告は、外注先に対する外注費の支払を、売上先からの工事代金の支払があった後に、本件口座からの振込み又は現金の授受の方法により行っていた。原告は、その他の経費（材料費、リース代、ガソリン代、資材置場の地代、土建組合費など）の支払についても、本件口座からの振込み又は現金の授受の方法により行っていた。（乙５、１４、弁論の全趣旨）\nエ 原告は、平成２７年分以降の所得税等の確定申告に先立ち、本件口座の預金通帳と請求書を基に、当該年分の売上金額の集計メモ（売上先ごとに月別の内訳及び合計額を記載したもの。乙５の７枚目はその平成３０年分）、作業日報を基に、当該年分の外注費の集計メモ（外注先ごとに月別の内訳及び合計額を記載したもの。乙５の８枚目はその平成３０年分）、本件口座の預金通帳や領収書を基に、その他の経費の内訳を記載した集計メモ\n（乙５の９枚目はその平成３０年分）を作成していた。（乙５、弁論の全趣旨）\n\n\n（３）課税処分及び通知処分の経緯課税処分及び通知処分の経緯は、別紙２のとおりであるほか、次のとおりである。\nア 原告は、平成２２年頃、個人で型枠工事業を行うようになったが、処分行政庁に対し、\n個人事業の開業届出書を提出しなかった。原告は、平成２３年２月１４日、処分行政庁に対し、電子申告・納税等開始届出書（乙１７）を提出したところ、職業を無職としていた。\n（弁論の全趣旨）\nイ 原告は、法定申告期限までに、処分行政庁に対し、平成２４年分ないし平成３０年分の所得税等の確定申告をした（別紙２の第１の１）。原告は、平成２４年分ないし平成２６年分の所得税等の確定申告において、職業を無職とした上、その事業に係る収入金額、必要経費の金額を雑所得の収入金額、雑所得に係る必要経費の金額としていた。原告は、平成２７年分ないし平成３０年分の所得税等の確定申告において、職業を建設業とした上、\nその事業に係る収入金額、必要経費の金額を事業所得の収入金額、事業所得に係る必要経費の金額としていた。原告は、松戸税務署が納税者の確定申告書の作成及び提出のため設置した申告書作成会場において、担当職員に相談しながら、上記各年分の所得税等の確定申告書を作成し提出しており、平成２７年分ないし平成３０年分については、会場に、上記\n\n\n（２）エの売上金額、外注費、その他の経費の各集計メモを持参し、それらの記載に基づいて当該年分のその事業に係る収支内訳書（乙１８の１ないし４）を作成し、その記載に基づいて確定申告書を作成し提出していた。原告は、平成２４年分ないし平成２６年分の所得税等の確定申告において、売上先から受注した工事のうち単独工事に係る売上金額を月額１０万円程度とし、それに１２か月を乗じた金額のみを雑所得の収入金額とし、倉庫代等の経費の金額（外注費の額は含まれていない。）を雑所得に係る必要経費の金額としていた（原告がこの際に売上金額、経費の金額の根拠としていた資料は残っていない。）。\n原告は、平成２７年分ないし平成３０年分の所得税等の確定申告において、主な売上先であるＥに対する売上金額とその他の売上先に対する売上金額の一部を売上金額の集計メモに記載し、その金額のみを事業所得の収入金額とし、外注費、その他の経費の各集計メモに記載した金額を事業所得に係る必要経費の金額としていた（収支内訳書は４か年分が全て残っているが、売上金額、外注費、その他の経費の各集計メモは平成３０年分のもののみが残っている。）。（乙５ないし７、弁論の全趣旨）\nウ 原告は、法定申告期限までに、処分行政庁に対し、平成２６年課税期間ないし平成３０年課税期間の消費税等の確定申告をしなかった。\n原告は、平成３０年５月２９日、法定申告期限後に、処分行政庁に対し、平成２９年課税期間の消費税等の確定申告をした（別紙２の第２の１\n\n\n（４））。処分行政庁は、平成３０年６月２７日付けで、原告に対し、平成２９年課税期間の消費税等についての無申告加算税の賦課決定をした（別紙２の第２の１\n\n\n（４））。\nエ 松戸税務署の調査担当職員は、令和元年７月１７日から同年１２月１７日まで、原告の平成２４年分ないし平成３０年分の所得税等及び平成２６年課税期間ないし平成３０年課税期間の消費税等の調査を行った。（乙１３）\n原告は、松戸税務署の調査担当職員に対し、上記\n\n\n（２）エの売上金額、外注費、その他の経費の各集計メモのうち、平成３０年分のものを提示したが、平成２７年分ないし平成\n２９年分のものは平成３１年１月の引越しの際に処分したとして提示しなかった。原告は、\nその事業に係る取引の年月日、売上先、外注先ほかの相手方及び金額などを記載した帳簿類を、平成３０年分の各集計メモのほかに提示しなかった。原告は、平成３０年分の売上金額に係る請求書の控えの一部、平成３０年分の経費に係る領収書の一部等を提示したが、\nその事業に係る請求書や領収書などの原始記録を、そのほかに提示しなかった。調査担当職員は、Ｋ銀行松戸支店に対する照会を行い、本件口座の取引推移一覧表（乙１４）を取得した上、売上先に対する反面調査を行った。（乙５ないし７、１１ないし１３、１６、\n２３、２４）\n松戸税務署の調査担当職員は、令和元年１２月１７日、原告に対し、調査の結果によれば平成２４年分ないし平成３０年分の所得税等及び平成２６年課税期間ないし平成３０年課税期間の消費税等のいずれについても更正又は決定をすべきであると認められるとした。\n調査担当職員は、「修正申告等について」と題する書面（乙２７）により、修正申告書又は期限後申告書を提出した場合の効果を説明した上、平成２４年分ないし平成３０年分の所得税等の修正申告及び平成２６年課税期間ないし平成３０年課税期間の消費税等の期限後申告（平成２９年課税期間については修正申告）を勧奨した。原告は、調査担当職員が提示した修正申告及び期限後申告の内容のうち外注費ほかの経費の金額に納得することができないとし、外注費ほかの経費の金額は本件口座の預金通帳から把握することができると申し立てた。調査担当職員は、外注費ほかの経費に関する書類が保存されていないことを指摘した上、外注費ほかの経費の算定方法について、本来、支出した事実を確認することができないものは必要経費として認めることができないが、原告の事業上は経費が発生するのが通常であることを考慮し、収入金額に占める経費の割合を用いて算定したこと、\n本件口座の預金通帳から外注費ほかの経費であると考えられる支出の金額を抽出し集計しても上記の経費の割合を用いて算定した外注費ほかの経費の金額に及ばないことを説明し、\n理解を求めた。（乙１３、１６、２５、２６）\n原告は、令和元年１２月１７日、処分行政庁に対し、平成２４年分ないし平成３０年分の所得税等の修正申告をし（別紙２の第１の２）、平成２６年課税期間ないし平成３０年課税期間の消費税等の期限後申告（平成２９年課税期間については修正申告）をした（別紙２の第２の１）。これらの修正申告及び期限後申告の内容は、全て、松戸税務署の調査担当職員が上記の勧奨時に原告に対して提示したものである。原告は、処分行政庁に対し、\n上記の「修正申告等について」と題する書面の控えに署名押印をし提出した。原告は、同月１８日、処分行政庁に対し、個人事業の廃業届出書を提出した。（乙１３、１６、２７、\n弁論の全趣旨）\nオ 処分行政庁は、令和２年１月２７日付けで、原告に対し、平成２４年分ないし平成３０年分の所得税等についての重加算税の賦課決定（本件各所得税加算税賦課決定）をし（別紙２の第１の３）、平成２６年課税期間ないし平成３０年課税期間の消費税等についての無申告加算税及び重加算税の賦課決定（平成２９年課税期間については重加算税の賦課決定。本件各消費税加算税賦課決定）をした（別紙２の第２の２）。\nカ 原告は、令和２年３月１２日、処分行政庁に対し、平成２６年分ないし平成３０年分の所得税等及び平成２６年課税期間ないし平成３０年課税期間の消費税等について、更正の請求をし（別紙２の第１の４及び第２の３）、所得税等について、総所得金額及び納付すべき税額をそれぞれの年分の確定申告に係る金額に更正することを求め、消費税等について、課税標準額及び消費税等の税額を０円（平成２９年課税期間についてはその課税期間の確定申告に係る金額）に更正することを求めた。\n松戸税務署の調査担当職員は、令和２年３月３０日、原告に対し、更正の請求の根拠となる新たな書類の提出の有無を確認したところ、原告は、同年４月７日、平成３０年分の外注費の集計メモ（乙５の８枚目）の写しに未計上の外注費を加入したもの（乙３５）、\n平成３０年分のその他の経費の集計メモ（乙５の９枚目）の写しに未計上の経費を加入したもの（乙３６）のほか、作業員名簿（乙３７）を提出した。調査担当職員は、令和２年\n４月９日、原告に対し、一人親方であることや売上、経費が分かる書類、例えば帳簿やその基となった請求書の控え、領収書などを提出するよう求めたところ、原告は、同年５月\n１１日、「支払内訳 ５月７日」と題するメモ（平成２４年分ないし平成３０年分の各年別に、外注費の合計金額、外注先ごとの合計金額、その他の経費として損害保険料や交際費の金額が記載されているもの。乙３８）、平成２４年分ないし平成３０年分の収支内訳書（「外注工賃」欄、「その他の経費」の「交際費」欄及び「損害保険料」欄に、上記外注費の合計額や損害保険料、交際費の各金額が記載されており、他は空欄とされているもの。\n乙３９）を提出した。（乙３４）\n処分行政庁は、令和２年６月１１日付けで、原告に対し、上記各更正の請求について、\nそれぞれ、更正をすべき理由がない旨の通知処分（本件各所得税通知処分及び本件各消費税通知処分）をした（別紙２の第１の４及び第２の３）。\nキ 原告は、国税不服審判所長に対し、令和２年２月２３日、上記オの賦課決定についての審査請求をし、同年７月８日、上記カの通知処分についての審査請求をした（別紙２の第\n１の５及び第２の４\n\n\n（１））。国税不服審判所長は、国税通則法１０４条１項の規定により、\n上記各審査請求について併合審理をした（別紙２の第１の５及び第２の４\n\n\n（１））。\n原告は、審査請求の審理において、担当国税審判官に対し、Ｌ信用組合の振込みカード\n４枚（乙４６）、「年度別外注費及び材料費、その他内訳」と記載された書面（乙４７）、\n外注費の領収証１４枚（乙４８）、Ｋ銀行松戸支店作成の本件口座の取引推移一覧表（原告が外注費、材料費の振込みと指摘するものにマーカーが付されているもの。乙４９）を提出した。\n処分行政庁は、令和２年７月２７日付けで、原告に対し、平成２７年課税期間ないし平成３０年課税期間の消費税等について、無申告加算税及び重加算税の賦課決定の変更決定をした（別紙２の第２の４\n\n\n（２））。国税不服審判所長は、国税通則法１０４条２項の規定により、上記変更決定のうち平成２７年課税期間及び平成２８年課税期間に係るものについて上記審査請求との併せ審理をした（別紙２の第２の４\n\n\n（２））。\n国税不服審判所長は、令和３年２月１６日付けで、原告の審査請求をいずれも棄却する裁決をした（別紙２の第１の５及び第２の４\n\n\n（３））。\nク 地方消費税（譲渡割）について国が処分を行っているのは、地方税法制定附則９条の４第１項の規定により、地方税消費税（譲渡割）の賦課徴収については、当分の間、地方税法の規定にかかわらず、国が、消費税の賦課徴収の例により、消費税の賦課徴収と併せて行うものとすることとするとされているためである。\n\n\n（４）訴えの提起原告は、令和３年８月１２日、本件訴えを提起した。（顕著な事実）\n３ 課税処分及び通知処分の根拠被告が主張する課税処分及び通知処分の根拠は別紙３のとおりである。\n４ 争点本件の争点は、\n\n\n（１）平成２７年消費税加算税賦課決定及び平成２８年消費税加算税賦課決定の取消しの訴えの適否、具体的には、平成２７年消費税加算税賦課決定及び平成２８年消費税加算税賦課決定は令和２年７月２７日付け変更決定がされたことにより消滅したか否か\n（本案前の争点）、\n\n\n（２）平成２６年分ないし平成３０年分の所得税等の修正申告書に記載された事業所得の金額に誤りがあることにより、当該申告書の提出により納付すべき税額が過大である（国税通則法２３条１項１号）か否か（本案の争点１の１）、平成２６年課税期間ないし平成３０年課税期間の消費税等の期限後申告書（平成２９年課税期間については修正申告書）に記載された課税売上額及び課税仕入れに係る支払対価の額に誤りがあることにより、\n当該申告書の提出により納付すべき税額が過大である（国税通則法２３条１項１号）か否か\n（本案の争点１の２）、すなわち、上記各修正申告書等に記載された原告の平成２６年分ないし平成３０年分の所得税等に係る事業所得の金額並びに平成２６年課税期間ないし平成３０年課税期間の消費税等に係る課税売上額及び課税仕入れに係る支払対価の額の適否（本案の争点１）、\n\n\n（３）原告が平成２４年分ないし平成３０年分の所得税等の期限内申告において事業所得の金額の全部又は一部を計上しなかったことについて、原告がその基礎となるべき事実を隠蔽し、又は仮装し、その隠蔽し、又は仮装したところに基づき期限内申告をしていた\n（国税通則法６８条１項）か否か（本案の争点２の１）、原告が平成２６年課税期間ないし平成３０年課税期間の消費税等について期限内申告をしなかったこと（平成２９年課税期間については、期限後申告において課税売上額の全部又は一部を計上しなかったこと）について、\n原告がその基礎となるべき事実を隠蔽し、又は仮装し、その隠蔽し、又は仮装したところに基づき期限内申告をしていなかった（平成２９年課税期間については、期限後申告をしていた）（国税通則法６８条２項）か否か（本案の争点２の２）である。\n５ 当事者の主張\n\n\n（１）本案前の主張\n（被告の主張）\n本件訴えのうち平成２７年消費税加算税賦課決定及び平成２８年消費税加算税賦課決定の取消しを求める部分は、各賦課決定が令和２年７月２７日付け変更決定の処分内容として吸収され消滅したことによって、各賦課決定の取消しを求める訴えの利益が失われているのであり、不適法である。\nア 国税通則法６５条１項の規定による過少申告加算税と同法６８条１項の規定による重加算税は、いずれも申告納税方式による国税について過少な申告をした納税者に対する行政上の制裁として賦課されるものであり、同一の修正申告又は更正に係るものである限りその賦課及び税額等の計算の基礎を同じくし、ただ、重加算税は、過少申告加算税の賦課要件に該当することに加えて、当該納税者が、その国税の課税標準等又は税額等の計算の基礎となるべき事実の全部又は一部を隠蔽し、又は仮装し、その隠蔽し、又は仮装したところに基づいて納税申告書を提出する不正な手段を用いたという特別の事由が存する場合に、\n過少申告加算税より重い制裁を課するものであるから、重加算税の賦課決定は、過少申告加算税の賦課決定と別個独立の処分でなく、過少申告加算税の賦課決定に相当する部分を含んでいると解するのが相当である（最高裁判所昭和５８年１０月２７日第一小法廷判決・民集３７巻８号１１９６頁）。ところで、過少申告加算税と無申告加算税は、いずれも申告義務違反に対する行政上の制裁であり、その本質において異ならない（最高裁判所昭和４０年２月５日第二小法廷判決・民集１９巻１号１０６頁）から、上記の過少申告加算税に代えて重加算税が賦課される場面と同様に、無申告加算税に代えて重加算税が賦課される場面（国税通則法６８条２項）においても、重加算税の賦課は、無申告加算税の賦課と別個独立の処分でなく、それに相当する部分を含んでいるものと解するのが相当である。\nイ このように重加算税と無申告加算税に包含関係があることを前提とすると、加算税の額の計算の基礎となる税額に変更がなく、隠蔽仮装に基づく加重部分に変更があることに伴い、重加算税と無申告加算税が変更される場合、変更決定は重加算税と無申告加算税を全体として一つのものとして加算税の額を変更する一個の処分であると解されるのであって、\n重加算税と無申告加算税を合わせた加算税の額が全体として増額される場合が増額の変更決定であり、重加算税と無申告加算税を合わせた加算税の額が全体として減額される場合が減額の変更決定であることとなる。そうすると、処分行政庁が令和２年７月２７日付けで原告に対してした各変更決定のうち、①無申告加算税の額を１５００円減額する一方で、\n重加算税の額を８０００円増額し、加算税の額を合わせて６５００円増額した平成２７年課税期間の消費税等に係るものと、②無申告加算税の額を３０００円減額する一方で、重加算税の額を４０００円増額し、加算税の額を合わせて１０００円増額した平成２８年課税期間の消費税等に係るものは、増額の変更決定であることとなるところ、増額の変更決定は、納税義務の内容を総額的に確定させる行為であり、一定額を追加する処分でないから、当初の賦課決定である平成２７年消費税加算税賦課決定及び平成２８年消費税加算税賦課決定は、その後、増額の変更決定がされたことにより、当該変更決定の処分内容として吸収され消滅したのであり、平成２７年消費税加算税賦課決定及び平成２８年消費税加算税賦課決定の取消しを求める訴えの利益は失われているというべきである。\nウ 仮に、原告が、平成２７年課税期間の消費税等及び平成２８年課税期間の消費税等について、処分行政庁が令和２年７月２７日付けで原告に対してした各変更決定の取消しを求めているものとしても、これらの変更決定については審査請求がされていないから、その取消しを求める訴えは、不服申立ての前置を欠くのであり、不適法である。すなわち、国税通則法１１５条１項の「審査請求についての裁決を経た」というためには当該審査請求が適法にされていることを要するところ、同法１０４条２項の併せ審理の対象となった更正決定等については、そもそも不服申立てがされておらず、職権で審理が行われたにすぎないのであり、取消しの必要がない限り裁決がされることはないから、併せ審理の対象となった更正決定等については「審査請求についての裁決を経た」ということができないと解され、その取消しを求める訴えは不服申立ての前置を欠く。\n\n\n（２）本案の主張\n（被告の主張）\nア 事業所得の金額について\n（ア）被告が主張する原告の平成２４年分ないし平成３０年分の事業所得に係る総収入金額\n（別紙３の第１の１ないし７の各\n\n\n（１）ア（ア））は、別紙２の第１の２\n\n\n（１）ないし\n\n\n（７）の上記各年分の修正申告に係る金額と同額（平成２４年分１６３４万２３９９円、\n平成２５年分２１２０万７６５９円、平成２６年分１９２５万９７５６円、平成２７年分１５３７万３５７６円、平成２８年分１２０５万０５４２円、平成２９年分１０９１万８５３３円、平成３０年分１３７３万７１１２円）である。\n上記各年分の修正申告に係る金額は、松戸税務署の調査担当職員が令和元年７月２９日から同年１２月１７日まで行った原告の平成２４年分ないし平成３０年分の所得税等及び平成２６年課税期間ないし平成３０年課税期間の消費税等の調査において、原告の上記各年分の期限内申告に係る総収入金額と、原告が保管していた原始記録及び売上先に対する反面調査により把握した売上金額との開差額から、売上除外の事実を把握し、\nその売上除外の金額を原告の上記各年分の期限内申告に係る総収入金額と合計した金額であり（売上先から本件口座への入金額の合計は、平成２４年が１８５４万２３４６円、\n平成２５年が１７４１万４５８３円、平成２６年が１９７６万２７０４円、平成２７年が１５２４万４３０９円、平成２８年が１１８３万１４９４円、平成２９年が１１６３万１１１７円、平成３０年が１３６３万６４８０円であった。乙１４）、調査により実額で把握されたものであるから、上記各年分の修正申告に係る金額が原告の上記各年分の事業所得に係る総収入金額であると認めることができる。\nしたがって、原告の上記各年分の事業所得に係る総収入金額は被告が主張する上記金額である。\n（イ）被告が主張する原告の平成２４年分ないし平成３０年分の事業所得の金額の計算上必要経費に算入すべき金額（別紙３の第１の１ないし７の各\n\n\n（１）ア（イ））は、別紙２の第１の２\n\n\n（１）ないし\n\n\n（７）の上記各年分の修正申告に係る金額と同額（平成２４年分外注費７１９万０６５６円、地代家賃１０８万０８５５円、その他の経費２４８万０\n７７５円（減価償却費３２万１９４５円を含む。）の合計１０７５万２２８６円、平成\n２５年分外注費９３３万１３７０円、地代家賃１３４万３０９３円、その他の経費３２\n１万９３２２円（減価償却費４１万７７９１円を含む。）の合計１３８９万３７８５円、\n平成２６年分外注費８４７万４２９３円、地代家賃１２３万８１０１円、その他の経費\n２９２万３６３３円（減価償却費３７万９４１７円を含む。）の合計１２６３万６０２\n７円、平成２７年分外注費７１８万２２５０円、地代家賃９４万円、その他の経費１９\n１万２７３５円（減価償却費は０円）の合計１００３万４９８５円、平成２８年分外注費５５８万５０００円、地代家賃９４万円、その他の経費２２７万９７３１円（減価償却費５４万円を含む。）の合計８８０万４７３１円、平成２９年分外注費４５２万４４\n０５円、地代家賃８８万円、その他の経費１５７万８７０９円（減価償却費２５万円を含む。）の合計６９８万３１１４円、平成３０年分外注費５６９万７９００円、地代家賃８０万円、その他の経費１９９万２９０６円（減価償却費１５万円を含む。）の合計\n８４９万０８０６円）である。\n上記各年分の修正申告に係る金額のうち、平成２７年分ないし平成３０年分の外注費の金額は、原告が当該年分の所得税等の確定申告書に添付した収支内訳書の「外注工賃」\n欄に記載された金額（平成３０年分については、上記「外注工賃」欄に記載された金額に、原告が計上漏れが生じていると指摘した１３万円を加えた金額）である。平成２７年分ないし平成３０年分の地代家賃の金額は、原告が当該年分の所得税等の確定申告書に添付した収支内訳書の「地代家賃」欄に記載された金額に、松戸税務署の調査担当職員が計上漏れが生じている事実を把握した倉庫代２０万円を加えた金額である。平成２\n７年分ないし平成３０年分のその他の経費（減価償却費を含む。）の金額は、原告が当該年分の所得税等の確定申告書に添付した収支内訳書の「減価償却費」欄に記載された金額及び「その他の経費」欄の各小項目欄に記載された金額の合計額（平成２７年分ないし平成２９年分については、上記「その他の経費」欄の末尾の「小計」欄に記載された各小項目欄の合計額の記載が違算のため誤っており、計上漏れが生じていたことから、\n平成２７年分について２万４４５５円、平成２８年分について５０万９３９０円、平成\n２９年分について４万７８５０円を加算訂正して、正確な合計額に改めたもの）である。\n上記の収支内訳書の作成の基となった外注費の集計メモ及びその他の経費の集計メモは、\n原告が、当該年分の所得税等の確定申告に先立ち、作業日報、領収証、本件口座の預金通帳などに基づいて作成したものであるところ、現存する平成３０年分のその他の経費の集計メモの内容と同年分の収支内訳書の内容がおおむね一致することからすると、原告が平成２７年分ないし平成３０年分の所得税等の確定申告書に添付した収支内訳書に記載された必要経費の金額は、実際の必要経費の金額と一致すると認めることができる。\n上記各年分の修正申告に係る金額のうち、平成２４年分ないし平成２６年分の外注費の金額は、上記の平成２７年分ないし平成３０年分の外注費の金額が当該年分の総収入金額に占める割合を平均して、外注費の平均経費率を０．４４００と算出し、平成２４年分ないし平成２６年分の各総収入金額に乗じて算定した金額である。平成２４年分ないし平成２６年分の地代家賃、その他の経費（減価償却費を含む。）の金額は、上記の平成２７年分ないし平成３０年分の地代家賃、その他の経費（減価償却費を含む。）の各小項目ごとの金額（地代家賃については倉庫代２０万円を加える前の金額）が当該年分の総収入金額を占める割合を平均して、地代家賃、その他の経費（減価償却費を含む。）の各小項目ごとの平均経費率をそれぞれ算出し、平成２４年分ないし平成２６年分の各総収入金額にそれぞれ乗じて算定した各金額（地代家賃については、平均経費率を乗じて算定した金額に、倉庫代２０万円を加えた金額）である。原告は、平成２４年分ないし平成２６年分の所得税等の確定申告に当たり、収支内訳書や必要経費の内容が分かる資料を提出しておらず、松戸税務署の調査担当職員が令和元年７月２９日から同年１２月１７日まで行った原告の平成２４年分ないし平成３０年分の所得税等及び平成\n２６年課税期間ないし平成３０年課税期間の消費税等の調査においても、調査担当職員に対し、平成２４年分ないし平成２６年分の必要経費に係る帳簿や請求書、領収書等の原始記録を提示しなかった。そのため、調査担当職員は、平成２４年分ないし平成２６年分の必要経費の金額を、当該年分の総収入金額に、原告が平成２７年分ないし平成３\n０年分の所得税等の確定申告書に添付した収支内訳書を基に算出した平均経費率を乗じて算定したものであるところ、上記収支内訳書に記載された必要経費の金額が実際の必要経費の金額と一致すると認めることができることは、上記のとおりであり、かつ、必要経費と総収入金額の間には、外注費等の必要経費の増減に合わせて総収入金額も増減するという関係性が認められ、原告の事業内容が平成２６年以前と平成２７年以後とで著しく異なるという事情はないから、上記の算定方法は合理的である。\nそうすると、上記各年分の修正申告に係る金額が原告の上記各年分の必要経費の金額であると認めることができる。\nしたがって、原告の上記各年分の事業所得の金額の計算上必要経費に算入すべき金額は被告が主張する上記金額である。\nこの点について、原告が審査請求の審理において担当国税審判官に対して提出した外注費等内訳書（乙４７）には、修正申告に係る必要経費の金額に算入されている外注費等の金額と異なる外注費等の金額（平成２４年分の外注費として振込金額１８３万５０\n２９円と現金払金額７６０万円、平成２５年分の外注費として振込金額４４８万６３８\n５円と現金払金額７００万円、平成２６年分の外注費として振込金額４８６万５６９２円と現金払金額６６５万５４００円、平成２７年分の外注費として振込金額２８３万９\n１９６円と現金払金額５０８万円、平成２８年分の外注費として振込金額２５万円と現金払金額４９５万８０００円、平成２９年分の外注費として振込金額４４万３２８０円と現金払金額４９２万４０００円、平成３０年分の外注費として振込金額１２５万３１\n７４円と現金払金額５３７万９９００円）が記載されており、同様に原告が審査請求の審理において担当国税審判官に対して提出した領収証（乙４８）、Ｋ銀行作成の本件口座の取引推移一覧表（乙４９）には、その異なる外注費等の金額と部分的に符合する記載がある。\nしかし、国税通則法２３条３項、国税通則法施行令６条２項の定めに加えて、更正をすべき理由がない旨の通知処分が税額等を確定する処分でなく、更正の請求が自らの申告によって確定した税額等を自らに有利に変更することを求めるものであることにも照らすと、更正をすべき理由がない旨の通知処分の取消しの訴えにおいて、納税者は、真実の税額等が申告によって確定した税額を下回ることを立証しなければならないのであり、原告は、真実の経費の額が修正申告等における経費の額より多額であることにより、\n修正申告等における納付すべき税額が過大であることを立証しなければならない。\nそして、事業所得の金額の計算上必要経費に算入すべき金額は、別段の定めがあるものを除き、これらの所得の総収入金額に係る売上原価その他当該総収入金額を得るため直接要した費用の額及びその年における販売費、一般管理費その他これらの所得を生ずべき業務について生じた費用の額である（所得税法３７条１項）から、事業所得の金額の計算上必要経費として控除されるためには、当該支出が存在することに加えて、当該支出が事業所得を生ずべき業務の遂行上必要であることを要すると解されるところ、原告が更正の請求の調査において調査担当職員に対して提出した資料（乙３５ないし３９）\nの中に、領収証など外注先等への現金の支払を直接証明する証拠はなく、原告は、調査担当職員の求めにかかわらず、外注費等の支払を確認することができる資料を提出しなかった。\n原告は、審査請求の審理において、担当国税審判官に対し、外注費等に関して、上記の外注費等内訳書、領収証、取引推移一覧表のほか、振込カード（乙４６）を提出したものの、担当国税審判官の求めにかかわらず、他に外注費等の支払の裏付けとなる資料を提出しなかった。\n上記領収証に記載された領収金額を上記各年分ごとに集計した金額は、平成２６年分及び平成３０年分を除き、上記外注費等内訳書の各年分の外注費の現金払金額と一致するが、その１４枚の領収証のうち日付が記載された４枚（受領者欄に「丙」と記載された２枚（ただし同一の領収証の写し２枚である。）と「丁」と記載された領収証の写しのうちの２枚）を除いた１０枚は、領収日付け欄に「２４年度分」などと記載されていることから明らかなとおり、現金払の都度作成されたものでなく、１年分の領収額をまとめて記載したものであり、何の対価であるかも記載されていないのであって、また、\n１４枚の領収証のいずれにも、収入印紙が貼付されていない。このような体裁に加えて、\n原告が、これらの領収証を、更正の請求の調査においては提出することなく、審査請求の審理において初めて提出したという経過にも照らすと、これらの領収証は、外注費の現金払の都度作成されたものでなく、審査請求後に作成されたものであることが明らかであり、原告が上記各年分の所得税等の課税期間に外注費の現金払をした事実について何らの証明力も有しない。上記取引推移一覧表に記載された本件口座からの出金が外注費等の現金払の原資となったことの裏付けとなる証拠もないのであり、原告が上記各年分の所得税等の課税期間に外注費等の現金払をしたと認めることはできない。\nまた、上記取引推移一覧表に記載された本件口座からの第三者に対する振込みについて、原告の事業に係る外注費等の支払についての帳簿等が併せて提出されていない以上、\nその振込みが原告の事業に係る外注費等の支払のためのものであると認めることはできないのであり、当該支出が原告の事業の遂行上必要であると認めることもできない。\nこのように、上記外注費等内訳書に係る外注費等の金額については、当該支出が現金払又は振込みの方法により実際にされたことを認めることができないことに加えて、当該支出が事業所得を生ずべき業務の遂行上必要であることを認めることもできないのであり、上記各年分の必要経費の金額であると認めることはできない。\nそうすると、原告の事業に係る真実の経費の額が修正申告等における経費の額より多額であると認めることはできないのであり、修正申告等における納付すべき税額が過大であると認めることはできない。\nイ 課税売上額及び課税仕入れに係る支払対価の額について\n（ア）被告が主張する原告の平成２６年課税期間ないし平成３０年課税期間の消費税等の課税標準額（別紙３の第２の１ないし５の各\n\n\n（１）の課税資産の譲渡等の対価の額の合計額（総収入金額）に１０８分の１００等を乗じて算出した課税売上額（税抜き）。１０\n００円未満の端数切捨て後の金額）は、別紙２の第２の１\n\n\n（１）ないし\n\n\n（５）の上記各課税期間の期限後申告（平成２９年課税期間については修正申告）に係る金額と同額\n（平成２６年課税期間１７９５万３０００円（端数切捨て前４３８万０８４３円と１３\n５７万３９５３円）、平成２７年課税期間１４２３万４０００円（端数切捨て前１４２\n３万４７９２円）、平成２８年課税期間１１１５万７０００円（端数切捨て前１１１５万７９０９円）、平成２９年課税期間１０１０万９０００円（端数切捨て前１０１０万\n９７５２円）、平成３０年課税期間１２７１万９０００円（端数切捨て前１２７１万９\n５４８円））である。\n上記各課税期間の期限後申告（平成２９年課税期間については修正申告）に係る金額は、松戸税務署の調査担当職員が令和元年７月２９日から同年１２月１７日まで行った原告の平成２４年分ないし平成３０年分の所得税等及び平成２６年課税期間ないし平成\n３０年課税期間の消費税等の調査において、原告の事業の上記各課税期間の決算書を基に算出した金額であり、上記各課税期間の期限後申告（平成２９年課税期間については修正申告）に係る金額が原告の上記各課税期間の消費税等の課税売上額であると認めることができる。\nしたがって、原告の上記各課税期間の消費税等の課税売上額は被告が主張する上記金額である。\n（イ）被告が主張する原告の平成２６年課税期間ないし平成３０年課税期間の消費税等の課税仕入れに係る支払対価の額（税込み）（別紙３の第２の１ないし５の各\n\n\n（３））は、別紙２の第２の１\n\n\n（１）ないし\n\n\n（５）の上記各課税期間の期限後申告（平成２９年課税期間については修正申告）に係る金額と同額（平成２６年課税期間７２３万４０２２円、\n平成２７年課税期間９２０万１２６５円、平成２８年課税期間７３９万５４３１円、平成２９年課税期間５９４万９４００円、平成３０年課税期間７６３万７０１８円）である。\n上記各課税期間の期限後申告（平成２９年課税期間については修正申告）に係る金額は、松戸税務署の調査担当職員が令和元年７月２９日から同年１２月１７日まで行った原告の平成２４年分ないし平成３０年分の所得税等及び平成２６年課税期間ないし平成\n３０年課税期間の消費税等の調査において、原告の事業の上記各課税期間の決算書を基に算出した金額であり、上記各課税期間の期限後申告（平成２９年課税期間については修正申告）に係る金額が原告の上記各課税期間の課税仕入れに係る支払対価の額であると認めることができる。\nしたがって、原告の上記各課税期間の課税仕入れに係る支払対価の額は被告が主張する上記金額である。\nこの点について、原告が審査請求の審理において担当国税審判官に対して提出した外注費等内訳書（乙４７）に修正申告に係る必要経費の金額に算入されている外注費等の金額と異なる外注費等の金額が記載されていることは、上記ア（イ）のとおりであるが、\n原告は、その外注費等内訳書に係る外注費等の金額の支払の事実を立証していないのであり、当該外注費等の金額が課税仕入れに係る支払対価の額であると認めることはできない。\nそうすると、原告の事業の真実の課税仕入れに係る支払対価の額が修正申告等における課税仕入れに係る支払対価の額より多額であると認めることはできないのであり、修正申告等における納付すべき税額が過大であると認めることはできない。\nウ 本件各所得税通知処分の適法性について上記アによれば、原告の平成２６年分ないし平成３０年分の所得税等の納付すべき税額は、別紙３の第1の３ないし７の各\n\n\n（４）のとおり、平成２６年分５６万８１００円、平成２７年分４６万５６００円、平成２８年分１２万９４００円、平成２９年分１８万９４\n００円、平成３０年分４２万０９００円であるところ、これらの金額は、別紙２の第１の\n２の各\n\n\n（３）ないし\n\n\n（７）の平成２６年分ないし平成３０年分の所得税等の修正申告に係る納付すべき税額と同額であるから、原告が令和２年３月１２日に処分行政庁に対してした平成２６年分ないし平成３０年分の所得税等についての更正の請求は理由がなく、処分行政庁が令和２年６月１１日付けで原告に対してした更正をすべき理由がない旨の通知処分（本件各所得税通知処分）は適法である。\nエ 本件各消費税通知処分の適法性について上記イによれば、原告の平成２６年課税期間ないし平成３０年課税期間の消費税等の納付すべき税額は、別紙３の第２の１ないし５の各\n\n\n（７）のとおり、平成２６年課税期間７\n９万４３００円、平成２７年課税期間４５万７１００円、平成２８年課税期間３４万４６\n００円、平成２９年課税期間３６万８０００円、平成３０年課税期間４５万１８００円であるところ、これらの金額は、別紙２の第２の１の各\n\n\n（１）ないし\n\n\n（５）の平成２６年課税期間ないし平成２８年課税期間及び平成３０年課税期間の消費税等の期限後申告に係る納付すべき税額並びに平成２９年課税期間の消費税等の修正申告に係る納付すべき税額\n（期限後申告に係る既確定税額を差し引く前の納付税額）と同額であるから、原告が令和\n２年３月１２日に処分行政庁に対してした平成２６年課税期間ないし平成３０年課税期間の消費税等についての更正の請求は理由がなく、処分行政庁が令和２年６月１１日付けで原告に対してした更正をすべき理由がない旨の通知処分（本件各消費税通知処分）は適法である。\nオ 本件各所得税加算税賦課決定の適法性について原告は、法定申告期限までに、処分行政庁に対し、平成２４年分ないし平成３０年分の所得税等の確定申告をし（別紙２の第１の１\n\n\n（１）ないし\n\n\n（７））、その後、松戸税務署の調査担当職員の勧奨を受けて、令和元年１２月１７日、処分行政庁に対し、上記各年分の所得税等の修正申告をしたのである（別紙２の第１の２\n\n\n（１）ないし\n\n\n（７））から、国税通則法６５条１項（過少申告加算税）の規定に該当する。\nところで、原告は、その事業として、売上先から単独工事及び外注工事を受注し、単独工事の施工を自ら行うほか外注先に外注工事を発注し、売上先に工事代金を請求し、売上先から本件口座への振込み（一部は現金や手形）により工事代金の支払を受け、本件口座からの振込み（一部は現金や手形）により外注費ほかの必要経費（材料費等）の支払を行っていたのであり、本件口座の預金通帳の記帳を行い請求額と入金額が一致していることを確認するなどして、その事業に係る収入金額及び必要経費の金額を正確に把握していた。\nしかし、原告は、平成２２年頃、個人で型枠工事行を行うようになった際に、処分行政庁に対し、個人事業の開業届出書を提出せず、平成２３年２月、処分行政庁に対し、電子申告・納税等開始届出書を提出した際には、職業を無職とし、平成２４年分ないし平成２６年分の所得税等の確定申告においても、職業を無職としていたのであり、そのことを前提として、上記各年分の所得税等の確定申告において、自らの所得の区分を雑所得として、\n事業所得が存在しないことを装った上、売上金額のごく一部のみを作為的に申告し、収入金額や所得金額を著しく低く装い、納付すべき税額を０円としていた。原告は、平成２７年分ないし平成３０年分の所得税等の確定申告において、職業を建設業とし、自らの所得の区分を事業所得としたものの、その確定申告においても、売上金額の相当部分を作為的に除外した集計メモをあらかじめ作成し申告書作成会場に持参して、それを基に収支内訳書を作成し、意図的に収入金額や所得金額の相当部分が存在しないことを装い、納付すべき税額を０円ないし著しく低い金額としていた。原告は、現在に至るまで、その事業に係る取引の年月日や売上先等、売上金額等を記載した帳簿を提示せず、原始記録も一部を除き提示しないのであり、原始資料を保存せず、散逸するに任せていたものである。\nそうすると、原告は、平成２４年分ないし平成３０年分の所得税等の確定申告において、\n当初から所得を過少に申告することを意図し、その意図を外部から窺い得る特段の行動をした上、その意図に基づき過少申告をしたものであるから、課税標準等又は税額等の計算の基礎となるべき事実の全部又は一部を隠蔽し、又は仮装し、その隠蔽し、又は仮装したところに基づき期限内申告をしていたということができるのであり、国税通則法６８条１項の規定に該当する。なお、重加算税の課税要件を満たすときは、国税通則法７０条４項\n１号に該当し、賦課決定の除斥期間は７年間となる。\nそして、平成２４年分ないし平成３０年分の所得税等の修正申告に基づき新たに納付すべきこととなった税額の計算の基礎となった事実のうちに、それらの修正申告前の税額の計算の基礎とされていなかったことについて国税通則法６５条４項の正当な理由があると認められるものはないから、上記各年分の所得税等の修正申告に基づく納付すべき税額について、同法６８条１項の規定により、過少申告加算税に代え、別紙３（課税処分及び通知処分の根拠）の第１の１ないし７の各\n\n\n（５）のとおり、平成２４年分として１５万７５\n００円の重加算税が、平成２５年分として２３万８０００円の重加算税が、平成２６年分として１９万６０００円の重加算税が、平成２７年分として１５万７５００円の重加算税が、平成２８年分として４万２０００円の重加算税が、平成２９年分として６万３０００円の重加算税が、平成３０年分として１４万７０００円の重加算税が、それぞれ課されるべきであり、その金額は、別紙２（課税処分及び通知処分の経緯）の第１の３の本件各所得税加算税賦課決定が賦課した上記各年分の所得税等についての重加算税の額と同額であるから、処分行政庁が令和２年１月２７日付けで原告に対してした平成２４年分ないし平成３０年分の所得税等についての重加算税の賦課決定である本件各所得税加算税賦課決定は適法である。\n原告は、請求書（乙１０の１及び２）及び本件口座の預金通帳を基として売上金の集計メモを作成していた、作業日報を基として外注費の集計メモを作成していた、本件口座の預金通帳や現金の授受の方法により支払った領収書を基としてその他の経費の集計メモを作成していたとする（乙５）が、売上金の集計メモと本件口座に入金された金額を対比すると、Ｅに対する売上金額はおおむね全て計上されているのに対して、その他の売上先\n（Ｆ、Ｇ、Ｈ、Ｍ、Ｊ）に対する売上金額は一部を除いて計上されておらず、売上金の集計メモに記載された売上金額と本件口座に入金された金額との間には開差が生じている。\nカ 本件各消費税加算税賦課決定の適法性について原告は、松戸税務署の調査担当職員の勧奨を受けて、令和元年１２月１７日、法定申告期限後に、処分行政庁に対し、平成２６年課税期間ないし平成２８年課税期間及び平成３\n０年課税期間の消費税等の確定申告をしたのである（別紙２の第２の１\n\n\n（１）ないし\n\n\n（３）\n及び\n\n\n（５））から、国税通則法６６条１項１号（無申告加算税）の規定に該当し、平成２\n９年課税期間については、平成３０年５月２９日、法定申告期限後に、処分行政庁に対し、\n上記課税期間の消費税等の確定申告をし、その後、松戸税務署の調査担当職員の勧奨を受けて、令和元年１２月１７日、処分行政庁に対し、上記課税期間の消費税等の修正申告をしたのである（別紙２の第２の１\n\n\n（４））から、国税通則法６６条１項２号（無申告加算税）の規定に該当する。\nところで、原告が、その事業に係る収入金額及び必要経費の金額を正確に把握していたが、平成２６年分の所得税等の確定申告まで、職業を無職と申告し、そのことを前提として、平成２４年分ないし平成２６年分の所得税等の確定申告において、売上金額のごく一部のみを作為的に申告し、収入金額や所得金額を著しく低く装い、平成２７年分ないし平成３０年分の所得税等の確定申告においても、売上金額の相当部分を作為的に除外した集計メモを基に収支内訳書を作成し、意図的に収入金額や所得金額の相当部分が存在しないことを装っていたことは、上記オのとおりである。原告は、平成２７年分の所得税等の確定申告の際に、申告書作成会場の職員から、平成２９年課税期間から消費税等の申告が必要になると指導を受けたことから、消費税等の納税をしたくないと考え、平成２８年分以降の所得税等の確定申告において、売上金額が１０００万円を超えないよう、売上金の集計メモを作成するに当たり、主な売上先であるＥに対する売上金額を記載した後、他の売上先に対する売上金額を調整し、合計１０００万円を超えないようにして、売上金額を少なく申告していたものであり、平成３０年分の売上金の集計メモの作成の際には、売上金額が１０００万円を超えないようにするため、平成３０年１１月３０日付けのＪ宛の請求書に係る売上金額を計算から除いている（乙５、６）。原告は、平成２６年分ないし平成\n３０年分の所得税等の確定申告において、売上金額のごく一部のみを作為的に申告し、消費税等の課税売上や課税仕入れを低く装い、平成２６年課税期間ないし平成２８年課税期間及び平成３０年課税期間の消費税等についての申告をせず、平成２９年課税期間については、同課税期間の消費税等の期限後申告において、納付すべき税額を相当に低いものとしていたものである。\nそうすると、原告は、平成２６年課税期間ないし平成２８年課税期間及び平成３０年課税期間の消費税等について、当初から確定申告をしないことを意図し、その意図を外部から窺い得る特段の行動をした上、その意図に基づき確定申告をしなかったものであるから、\n課税標準等又は税額等の計算の基礎となるべき事実の全部又は一部を隠蔽し、又は仮装し、\nその隠蔽し、又は仮装したところに基づき法定申告期限までに確定申告をしなかったということができるのであり、国税通則法６８条２項の規定に該当し、平成２９年課税期間については、同課税期間の消費税等の確定申告において、当初から課税売上を過少に申告することを意図し、その意図を外部から窺い得る特段の行動をした上、その意図に基づき過少申告をしたものであるから、課税標準等又は税額等の計算の基礎となるべき事実の全部又は一部を隠蔽し、又は仮装し、その隠蔽し、又は仮装したところに基づき期限後申告をしていたということができるのであり、国税通則法６８条２項の規定に該当する。なお、\n重加算税の課税要件を満たすときは、国税通則法７０条４項１号に該当し、賦課決定の除斥期間は７年間となる。\nそして、平成２６年課税期間ないし平成３０年課税期間の消費税等の期限内申告がなかったことについて国税通則法６６条１項ただし書の正当な理由があると認められるものはないから、上記各課税期間の消費税等の期限後申告（平成２９年課税期間については修正申告）に基づく納付すべき税額について、同法６８条２項の規定により、無申告加算税に代え、別紙３（課税処分及び通知処分の根拠）の第２の１ないし５の各\n\n\n（８）及び\n\n\n（９）\nのとおり、平成２６年課税期間について６０００円の無申告加算税及び３０万円の重加算税が、平成２７年課税期間について１万２０００円の無申告加算税及び１４万８０００円の重加算税が、平成２８年課税期間について１万８０００円の無申告加算税及び８万４０\n００円の重加算税が、平成２９年課税期間について４５００円の無申告加算税及び８万４\n０００円の重加算税が、平成３０年課税期間について１万６５００円の無申告加算税及び\n１３万２０００円の重加算税が、それぞれ課されるべきであり、その金額は、別紙２（課税処分及び通知処分の経緯）の第２の２の本件各消費税加算税賦課決定（ただし、①平成\n２７年課税期間及び平成２８年課税期間については、平成２７年消費税加算税賦課決定及び平成２８年消費税加算税賦課決定を吸収した令和２年７月２７日付け無申告加算税及び重加算税の賦課決定の変更決定、②平成２９年課税期間及び平成３０年課税期間については、令和２年７月２７日付け無申告加算税及び重加算税の賦課決定の変更決定により減額された後の平成２９年消費税加算税賦課決定及び平成３０年消費税加算税賦課決定。別紙\n２の第２の４\n\n\n（２））が賦課した上記各課税期間の消費税等についての無申告加算税及び重加算税の額と同額であるから、処分行政庁が令和２年１月２７日付けで原告に対してした平成２６年課税期間ないし平成３０年課税期間の消費税等についての重加算税の賦課決定である本件各消費税加算税賦課決定は適法である。\n（原告の主張）\nア 事業所得の金額について\n（ア）事業所得に係る総収入金額について、被告は、平成２４年分の金額を１６３４万２３\n９９円と主張するが、１８５４万２３６４円の誤りであり、同様に、平成２５年分の金額（２１２０万７６５９円）は１７４１万４５８３円の誤り、平成２６年分の金額（１\n９２５万９７５６円）は１０７６万２７０４円の誤り、平成２７年分の金額（１５３７万３５７６円）は１５２４万４３００円の誤り、平成２８年分の金額（１２０５万０５\n４２円）は１１８３万１４９４円の誤り、平成２９年分の金額（１０９１万８５３３円）\nは１４６３万１１１７円の誤り、平成３０年分の金額（１３７３万７１１２円）は１３\n６９万６４８０円の誤りである。\n平成３０年１１月３０日付けのJ宛の請求書に係る出来高の売上金額２５１万円の入金は、未成工事であることから、平成３０年分の事業所得に係る総収入金額に計上することを要しない。\n（イ）事業所得の金額の計算上必要経費に算入すべき金額について、被告は、平成２４年分の外注費を７１９万０６５６円と主張するが、１４７４万８２９２円（本件口座からの振込金額７６９万８２９２円と、現金払金額７０５万円の合計額。内訳は次のａのとおり）の誤りであり、同様に、平成２５年分の外注費（９３３万１３７０円）は１１７３万５７００円（本件口座からの振込金額３１３万８２００円と、現金払金額８５９万７\n５００円の合計額。内訳は次のｂのとおり）の誤り、平成２６年分の外注費（８４７万\n４２９３円）は１０８９万４１３６円（本件口座からの振込金額４２２万６２３６円と、\n現金払金額６６６万７９００円の合計額。内訳は次のｃのとおり）の誤り、平成２７年分の外注費（７１８万２２５０円）は８１５万６５２６円（本件口座からの振込金額３\n０７万６５２６円と、現金払金額５０８万円の合計額。内訳は次のｄのとおり）の誤り、\n平成２８年分の外注費（５５８万５０００円）は５２０万８０００円（本件口座からの振込金額２５万円と、現金払金額４９５万８０００円の合計額。内訳は次のｅのとおり）\nの誤り、平成２９年分の外注費（４５２万４４０５円）は５３６万７２００円（本件口座からの振込金額４４万３２８０円と、現金払金額４９２万４０００円の合計額。内訳は次のｆのとおり）の誤り、平成３０年分の外注費（５６９万７９００円）は６５７万\n７１７４円（本件口座からの振込金額１２５万３１７４円と、現金払金額５３２万４０\n００円の合計額。内訳は次のｇのとおり）の誤りである。\n原告は、松戸税務署の調査担当職員に対し、外注先の名刺や連絡先を知らせたが、調査担当職員は、反面調査において、売上金額のみについて調査しており、外注先に対する外注費の調査はしていないのであり、上記金額が適正な金額である。\nａ 平成２４年分\n（ａ）本件口座からの振込金額丁 ２３２万８８８５円戊 ２２万２７２０円\nＮ １２２万３８９０円\nＯ １９６万０３７５円\nＰ １８６万１９９０円\nＱ ４５万００００円\nＲ ５万０４３２円\n（ｂ）現金払金額\nＱ ３５５万００００円\nＳ ３５０万００００円\nｂ 平成２５年分\n（ａ）本件口座からの振込金額\nＴ ９万０１０５円丁 １３２万５６８０円\nＯ １４９万７１００円\nＵ ３１万５４２０円\n（ｂ）現金払金額\nＱ ４５０万００００円\nＳ ２５０万００００円\nＰ ７０万００００円\nＮ ８９万７５００円\nｃ 平成２６年分\n（ａ）本件口座からの振込金額丁 １３９万６２００円\nＯ ２３７万４７５２円\nＶ １４万０４２０円\nＥ ３１万４８６４円\n（ｂ）現金払金額\nＶ １万２５００円\nＱ ４６５万５４００円\nＳ ２００万００００円\nｄ 平成２７年分\n（ａ）本件口座からの振込金額\nＯ １３２万２１６０円\nＮ １３万８８３２円\nＰ ５０万２４８６円\nＥ ６８万１２３２円\nＷ ４２万２８２２円\n（ｂ）現金払金額丁 ４０万００００円\nＱ ４６８万００００円\nｅ 平成２８年分\n（ａ）本件口座からの振込金額\nＸ ２５万００００円\n（ｂ）現金払金額丁 ４５万００００円\nＱ ４５０万８０００円\nｆ 平成２９年分\n（ａ）本件口座からの振込金額\nＥ ４４万３２８０円\n（ｂ）現金払金額丁 １５万００００円\nＱ ４７７万４０００円\nｇ 平成３０年分\n（ａ）本件口座からの振込金額\nＦ ９０万７１４２円\nＥ ３２万４４３２円\nＷ ２万１６００円\n（ｂ）現金払金額丁 ２８万００００円\nＱ ４８４万４０００円丙 ２０万００００円\n（ウ）事業所得の金額の計算上必要経費に算入すべき金額について、調査結果の説明書（乙\n２５）は、平成２７年分ないし平成３０年分の平均経費率を算出するに当たり、平成２\n７年分の損害保険料、減価償却費、福利厚生費、平成２８年分の通信費、土建組合費、\n平成２９年分の土建組合費、平成３０年分の金物代を除外しているのであり、適切でない。この平均経費率の算出は、松戸税務署の調査担当職員が独断で行ったものにすぎない。平成２４年分ないし平成３０年分の材料費その他の経費としては次のａないしｇなどがある（括弧内の金額は、調査担当職員が平均経費率により算出した推計額（平成２\n６年分）又は平均経費率の算出のため使用した金額（平成２７年分ないし平成３０年分）\nである。）。\nａ 平成２４年分\n（ａ）本件口座からの振込金額株式会社Ｙ材料費 １１６万２９４４円\nＺ ６万０６９０円\n（ｂ）現金払金額\nⒶ ２７万００００円\nｂ 平成２５年分\n（ａ）本件口座からの振込金額\nＹ材料費 ３５万６５２２円\nⒷ ３２万８０００円\n（ｂ）現金払金額\nⒶ ２０万００００円\nｃ 平成２６年分\n（ａ）本件口座からの振込金額\nＹ材料費 １０８万１０２４円\nⒷ １３万１４３２円\nＺ １万２２７０円\n（ｂ）現金払金額\nⒶ ２７万００００円\n（平均経費率による算出においてはリース料１９万６４５０円）\nⒸ １９万７８８０円\n（平均経費率による算出においては土建組合費６万５４８３円）\n通信費 １４万１０８６円\n（平均経費率による算出においては通信費２万１１８６円）\n福利厚生 ２３万８５２０円\n（平均経費率による算出においては福利厚生費３万８５２０円）\nｄ 平成２７年分\n（ａ）本件口座からの振込金額\nＹ材料費 ７２万３２９８円\n（ｂ）現金払金額\nⒶ ２７万００００円\n（平均経費率の算出においてはリース料１０万８９７９円）\n通信費 １４万４２７６円\n（平均経費率の算出においては通信費２万４２７６円）\n福利厚生 ２４万００００円\n（平均経費率の算出においては福利厚生費０円）\n土建組合 １９万７８８０円\n（平均経費率の算出においては土建組合費０円）\nｅ 平成２８年分\n（ａ）本件口座からの振込金額\nＹ材料費 ７９万３６５３円\n（ｂ）現金払金額\nⒶ ２７万００００円\n（平均経費率の算出においてはリース料４万９３５０円）\n通信費 １２万００００円\n（平均経費率の算出においては通信費０円）\n福利厚生 ２５万７３１５円\n（平均経費率の算出においては福利厚生費１万７３１５円）\nガソリン代 ３５万００００円\n（平均経費率の算出においてはガソリン代１８万０００５円）\n土建組合 １９万８０４０円\n（平均経費率の算出においては土建組合費２万４６００円）\nｆ 平成２９年分\n（ａ）本件口座からの振込金額なし\n（ｂ）現金払金額\nＹ材料費 ３６万２２４４円\nⒶ ２５万００００円\n（平均経費率の算出においてはリース料２０万０１５０円）\n通信費 ２０万３２００円\n（平均経費率の算出においては通信費３２００円）\n福利厚生 ２０万８２５０円\n（平均経費率の算出においては福利厚生費８２５０円）\nガソリン代 ３５万００００円\n（平均経費率の算出においてはガソリン代１２万２５５２円）\n土建組合 １９万８０４０円\n（平均経費率の算出においては土建組合費０円）\nｇ 平成３０年分\n（ａ）本件口座からの振込金額なし\n（ｂ）現金払金額通信費 ２３万１１１２円\n（平均経費率の算出においては通信費３万１１１２円）\n福利厚生 ２０万７７５０円\n（平均経費率の算出においては福利厚生費７万７５００円）\n土建組合 １９万８０４０円\n（平均経費率の算出においては土建組合費１５万６２２０円）\nイ 消費税等の納付義務について原告は、平成２６年課税期間ないし平成３０年課税期間の消費税等の期限後申告書に押印をする際に、松戸税務署の調査担当職員から、個人事業の廃止届を提出すれば消費税は免除されるので個人事業の廃止届を提出するよう言われた。原告は、この調査担当職員の言葉に従い、処分行政庁に対し、個人事業の廃止届を提出したのであるから、上記各課税期間の消費税等の納付義務を負わない。\nウ 本件各所得税加算税賦課決定の違法性原告は、松戸税務署の申告書作成会場の職員から、本人分のみ申告すればよいと言われたことから、その言葉に従って申告をしていたのであり、平成２４年分ないし平成３０年分の所得税等について過少申告をしていない。\n仮に原告が上記各年分の所得税等について過少申告をしたものであるとしても、原告は、\n故意に不正申告をしていない。原告は、松戸税務署の調査担当職員などに対し、税金を払いたくないなどと言ったことがない。\nエ 本件各消費税加算税賦課決定の違法性原告が平成２６年課税期間ないし平成３０年課税期間の消費税等の納付義務を負わないことは、上記イのとおりであり、原告は、上記各課税期間の消費税等の申告義務を負わないから、上記各課税期間の消費税等について無申告加算税の賦課要件に該当するものでない。\n仮に、原告が、上記各課税期間の消費税等の納付義務を負い、上記各課税期間の消費税等について無申告加算税の賦課要件に該当するものであるとしても、原告が、故意に不正申告をしておらず、原告が、松戸税務署の調査担当職員などに対し、税金を払いたくないなどと言ったことがないことは、上記ウのとおりである。\n\n\n\n\n\n\n第３ 当裁判所の判断\n\n\n１ 平成２７年消費税加算税賦課決定及び平成２８年消費税加算税賦課決定の取消しの訴えの適否\n原告が、令和元年１２月１７日、処分行政庁に対し、平成２６年課税期間ないし平成３０年課税期間の消費税等の期限後申告（平成２９年課税期間については修正申告）をしたこと\n（別紙２の第２の１）を受けて、処分行政庁が、令和２年１月２７日付けで、原告に対し、\n①平成２６年課税期間の消費税等について、無申告加算税の額の基礎となる税額４万円、無申告加算税の額６０００円、重加算税の額の基礎となる税額７５万円、重加算税の額３０万円とする無申告加算税及び重加算税の賦課決定を、②平成２７年課税期間の消費税等について、無申告加算税の額の基礎となる税額９万円、無申告加算税の額１万３５００円、重加算税の額の基礎となる税額３５万円、重加算税の額１４万円とする無申告加算税及び重加算税の賦課決定を、③平成２８年課税期間の消費税等について、無申告加算税の額の基礎となる税額１４万円、無申告加算税の額２万１０００円、重加算税の額の基礎となる税額２０万円、\n重加算税の額８万円とする無申告加算税及び重加算税の賦課決定を、④平成２９年課税期間の消費税等について、重加算税の額の基礎となる税額２５万円、重加算税の額１０万円とする重加算税の賦課決定を、⑤平成３０年課税期間の消費税等について、無申告加算税の額の基礎となる税額５万円、無申告加算税の額７５００円、重加算税の額の基礎となる税額３９万円、重加算税の額１５万６０００円とする無申告加算税及び重加算税の賦課決定を、それぞれしたことは、別紙２の第２の２のとおりである（平成２９年課税期間については、平成\n３０年６月２７日付けで、無申告加算税の額の基礎となる税額１１万円、無申告加算税の額\n５５００円とする無申告加算税の賦課決定をしていた。別紙２の第２の１\n\n\n（４））。原告は、\n令和２年２月２３日、国税不服審判所長に対し、上記の無申告加算税及び重加算税の賦課決定（平成２９年課税期間については重加算税の賦課決定）についての審査請求をした（別紙\n２の第２の４\n\n\n（１）。平成２９年課税期間に係る無申告加算税の賦課決定については不服申立てがされていない。）ところ、処分行政庁は、無申告加算税の対象となるべき地代家賃の金額に誤りがあったこと（平成２９年課税期間については地代家賃の金額のうちに無申告加算税の対象となるべき金額があったこと）から（前提事実\n\n\n（３）キ）、令和２年７月２７日付けで、\n原告に対し、（平成２６年課税期間については変更決定をしなかったものの、）⑥平成２７年課税期間の消費税等について、無申告加算税の額の基礎となる税額８万円、無申告加算税の額１万２０００円、重加算税の額の基礎となる税額３７万円、重加算税の額１４万８０００円とする無申告加算税及び重加算税の賦課決定の変更決定を、⑦平成２８年課税期間の消費税等について、無申告加算税の額の基礎となる税額１２万円、無申告加算税の額１万８００\n０円、重加算税の額の基礎となる税額２１万円、重加算税の額８万４０００円とする無申告加算税及び重加算税の賦課決定の変更決定を、⑧平成２９年課税期間の消費税等について、\n無申告加算税の額の基礎となる税額３万円、無申告加算税の額４５００円、重加算税の額の基礎となる税額２１万円、重加算税の額８万４０００円とする無申告加算税の賦課決定及び重加算税の賦課決定の変更決定を、⑨平成３０年課税期間の消費税等について、無申告加算税の額の基礎となる税額１１万円、無申告加算税の額１万６５００円、重加算税の額の基礎となる税額３３万円、重加算税の額１３万２０００円とする無申告加算税及び重加算税の賦課決定の変更決定を、それぞれした（別紙２の第２の４\n\n\n（２））。\nそこで、平成２７年課税期間の消費税等について、無申告加算税の額の基礎となる税額９万円、無申告加算税の額１万３５００円、重加算税の額の基礎となる税額３５万円、重加算税の額１４万円とする無申告加算税及び重加算税の賦課決定（平成２７年消費税加算税賦課決定、上記②）及び、平成２８年課税期間の消費税等について、無申告加算税の額の基礎となる税額１４万円、無申告加算税の額２万１０００円、重加算税の額の基礎となる税額２０万円、重加算税の額８万円とする無申告加算税及び重加算税の賦課決定（平成２８年消費税加算税賦課決定、上記③）と、平成２７年課税期間の消費税等について、無申告加算税の額の基礎となる税額８万円、無申告加算税の額１万２０００円、重加算税の額の基礎となる税額\n３７万円、重加算税の額１４万８０００円とする無申告加算税及び重加算税の賦課決定の変更決定（上記⑥）及び、平成２８年課税期間の消費税等について、無申告加算税の額の基礎となる税額１２万円、無申告加算税の額１万８０００円、重加算税の額の基礎となる税額２\n１万円、重加算税の額８万４０００円とする無申告加算税及び重加算税の賦課決定の変更決定（上記⑦）との関係についてみると、平成２７年消費税加算税賦課決定及び平成２８年消費税加算税賦課決定は、いずれも、令和２年７月２７日付けで、無申告加算税及び重加算税の総額を増額する上記の無申告加算税及び重加算税の賦課決定の変更決定がされたことにより、それぞれの変更決定に吸収され一体となり消滅したというべきである。けだし、国税通則法６５条１項の規定による過少申告加算税と同法６８条１項の規定による重加算税は、いずれも申告納税方式による国税について過少な申告をした納税者に対する行政上の制裁として賦課されるものであり、同一の修正申告又は更正に係るものである限りその賦課及び税額等の計算の基礎を同じくし、ただ、重加算税は、過少申告加算税の賦課要件に該当することに加えて、当該納税者が、その国税の課税標準等又は税額等の計算の基礎となるべき事実の全部又は一部を隠蔽し、又は仮装し、その隠蔽し、又は仮装したところに基づいて納税申告書を提出する不正な手段を用いたという特別の事由が存する場合に、過少申告加算税より重い制裁を課するものであるから、重加算税の賦課決定は、過少申告加算税の賦課決定と別個独立の処分でなく、過少申告加算税の賦課決定に相当する部分を含んでいると解するのが相当である（最高裁判所昭和５８年１０月２７日第一小法廷判決・民集３７巻８号１１９６頁）。\nそして、この見地からすると、重加算税の賦課決定についての審査請求において、重加算税の加重事由である隠蔽又は仮装の事実の存在は認められないが、過少申告加算税の賦課要件の存在は認められる場合、重加算税の賦課決定を全部取り消した上、改めて過少申告加算税の賦課決定をさせるべきものでなく、重加算税の額のうち、重加算税の加重事由に相当する部分についてのみ重加算税の賦課決定を取り消し、過少申告加算税に相当する部分は維持すべきであることとなるのであり（上記最高裁判所昭和５８年１０月２７日第一小法廷判決）、\n加算税の額の計算の基礎となる税額のうち、当初の賦課決定においては重加算税の加重事由が存在するものとして重加算税の対象とされていた部分が、賦課決定の変更決定により、過少申告加算税の賦課要件のみが存在するものとして過少申告加算税の対象とされた場合、それにより生ずる重加算税の対象とされる部分と過少申告加算税の対象とされる部分の増減は一つの処分の中の加算税の額の計算の変更にすぎないから、賦課決定の変更決定により加算税の額が増加したか減少したかは、過少申告加算税と重加算税をそれぞれ別個に観察し判定すべきものでなく、過少申告加算税と重加算税を合わせて判定するのが相当であるところ、\n無申告加算税は、過少申告加算税と同様に、申告納税方式による国税について申告義務に違反する行為をした納税者に対する行政上の制裁として賦課されるものであり、その本質において過少申告加算税と異ならない（最高裁判所昭和４０年２月５日第二小法廷判決・民集１\n９巻１号１０６頁）から、上記の理は無申告加算税と重加算税との関係においても同様に当てはまると考えることができる。そうすると、平成２７年課税期間の消費税等について、平成２７年消費税加算税賦課決定（上記②）が定める無申告加算税の額１万３５００円、重加算税の額１４万円を、無申告加算税の額１万２０００円、重加算税の額１４万８０００円とした変更決定（上記⑥）及び、平成２８年課税期間の消費税等について、平成２８年消費税加算税賦課決定（上記③）が定める無申告加算税の額２万１０００円、重加算税の額８万円を、無申告加算税の額１万８０００円、重加算税の額８万４０００円とした変更決定（上記\n⑦）は、いずれも当初の賦課決定が定める無申告加算税及び重加算税の総額を増額するものであることとなるところ、一個の納税義務の発生原因たる課税要件事実は実体的に一体不可分であり、これを分断して部分ごとに認定し納付すべき税額を部分的に確定することはできないから、当初の賦課決定が定める加算税の額を増額する変更決定は当該加算税の賦課要件を全体的に見直しその加算税の税額を総額的に確定したものとみるべきであり、当初の賦課決定は変更決定の処分内容として吸収され一体となり消滅すると解するのが相当である。\nこのように、平成２７年消費税加算税賦課決定及び平成２８年消費税加算税賦課決定が、いずれも、令和２年７月２７日付けで、無申告加算税及び重加算税の総額を増額する無申告加算税及び重加算税の賦課決定の変更決定がされたことにより、それぞれの変更決定に吸収され一体となり消滅していることによれば、本件訴えのうち平成２７年消費税加算税賦課決定及び平成２８年消費税加算税賦課決定の取消しを求める部分は、いずれも、各賦課決定の取消しを求める訴えの利益が失われているというべきであり、不適法である。\nなお、平成２９年課税期間の消費税等について、平成２９年消費税加算税賦課決定（上記④）\nが定める重加算税の額１０万円を、無申告加算税の額４５００円、重加算税の額８万４００\n０円とした変更決定（上記⑧）及び、平成３０年課税期間の消費税等について、平成３０年消費税加算税賦課決定（上記⑤）が定める無申告加算税の額７５００円、重加算税の額１５万６０００円を、無申告加算税の額１万６５００円、重加算税の額１３万２０００円とした変更決定（上記⑨）は、いずれも当初の賦課決定が定める無申告加算税及び重加算税の総額を減額するものであることとなるところ、当初の賦課決定が定める加算税の額を減額する変更決定は、当初の賦課決定により確定した納付すべき税額を一部取り消すものとみるべきであり、それにより減少した税額に係る部分以外の当初の賦課決定に影響を及ぼさないと解されるから、本件訴えのうち平成２９年消費税加算税賦課決定及び平成３０年消費税加算税賦課決定（いずれも令和２年７月２７日付け変更決定により減額された後のもの）の取消しを求める部分はいずれも各賦課決定の取消しを求める訴えの利益が失われていないというべきである。\n２ 認定事実前提事実に加え、各項に掲記の証拠並びに弁論の全趣旨によれば、次の事実を認めることができる。\n\n\n（１）松戸税務署の調査担当職員は、令和元年７月１７日から同年１２月１７日まで、原告の平成２４年分ないし平成３０年分の所得税等及び平成２６年課税期間ないし平成３０年課税期間の消費税等の調査を行った。（乙１３）\n\n\n（２）原告は、令和元年７月２９日、松戸税務署の調査担当職員に対し、次のとおり申述した。\n調査担当職員は、原告に対し、事業所得に係る帳簿及び原始記録の提示を求めたところ、原告は、平成３０年分の売上金額に係る請求書の控えの一部、平成３０年分の必要経費に係る領収書の一部、平成３０年分の売上金額、外注費、その他の経費の各集計メモ、本件口座の預金通帳、作業員名簿を提示した。（乙５、１３、１６）\nア 平成２５年から平成２６年までは、Ｅで仕事の手伝いをする程度であったため、事業所得の確定申告をする必要はないと思っていた。平成２７年から、個人事業主として仕事をしていた。\nイ 本件口座に振り込まれた入金額が正しいか確認するため、月に１度は、本件口座の預金通帳の記帳を行い、売上先に発行した請求書の金額と一致することを確認していた。\nウ 所得税等の確定申告書に添付した収支内訳書は、自宅で作成した集計メモを申告書作成会場に持参して作成していた。売上金額の集計メモは、本件口座に振り込まれた金額を基に作成した。外注費の集計メモは、作業日報を基に作成した。その他の経費の集計メモは、\n現金で支払った領収書や本件口座の預金通帳を基に作成した。集計メモは、平成３０年分だけでなく、平成２７年分ないし平成２９年分も作成していた。\nエ Ｊ宛て平成３０年１１月３０日付け請求書（●●擁壁工事に係る請求金額２４８万０２\n２０円とするもの。乙５の１０枚目）の売上金額については、工事が年を跨いだことから\n（乙１３）、平成３０年分の売上金額が１０００万円を超えてしまい、消費税等の課税事業者となることがないようにするため、その年分の売上金額から除外した。\nオ 平成２７年分の所得税等の確定申告において、売上金額が１０００万円を超えたことから、申告書作成会場の担当職員から、翌々年である平成２９年課税期間からは課税事業者として消費税等を納付しなければならないと教えられたが、消費税等を納付したくないと考え、Ｊに対する売上金額を除外した。\n\n\n（３）松戸税務署の調査担当職員は、令和元年８月１日、Ｋ銀行松戸支店に対する照会を行い、\n本件口座の取引推移一覧表（乙１４）を取得した。（乙１３）\nこの取引推移一覧表の平成２４年１月１日から平成３０年１２月３１日までの期間に係る部分の「お預かり金額」欄には、「Ｅ（カ」からの工事代金の振込みに係る記載のほか、「カ）\nＧ」「Ⓓ（カ」「カ．Ⅰ」「Ｈ（ユ」「Ⓔ（ユ」「カ）Ⓕ」「カ）Ⓖ」「カ）Ⓗ」「Ⓘ（カ」「カ）\nⒿ」「Ⓚ（カ」「カ）Ⓛ」「ユ）Ⓜ」「カ）Ⓝ」「カ）Ⓞ」「カ）Ⓟ」「Ｆ（カ」「ユ）Ｊ」などからの工事代金の振込みに係る記載があり（このうちの最後のものは、Ｊからの平成３０年１\n２月４日の２４８万０２２０円の工事代金の振込みに係る記載である。）、「お支払金額」欄には、「戊」「丁」「Ｎ」「Ｏ」「Ｕ」「Ｖ」「Ｑ」「Ⓠ」「カ．Ｒ」などへの外注費の振込みの記載、「カ）Ｙ」への材料費の振込みの記載、「カ）Ⓐ」へのリース料の振込みの記載のほか、\n「Ⓡ」「Ⓢ」などへのその他の経費の振込みの記載がある。\n\n\n（４）松戸税務署の調査担当職員は、原告の了承を得た上、令和元年８月５日から、Ｅ、Ｆ、Ｇ、\nＩ、Ｊに対する反面調査を行った。調査担当職員は、同月２０日及び同月２２日、Ｇ及びＥをそれぞれ訪問し、原告と当該売上先の取引状況や、原告の工事の受注の方法、工事代金の請求の方法について確認した。Ｇは、原告との取引は平成２５年から行われていると説明した。調査担当職員は、他の売上先に対しても、照会書を送付し、電話を架けるなどして、原告との取引状況について確認し、原告作成の請求書などの写しの送付を受けた。（乙１１ないし１３）\n\n\n（５）原告は、令和元年８月２１日、松戸税務署の調査担当職員に対し、次のとおり申述した。\n調査担当職員は、同年７月２９日の原告の申述における個人事業主として事業を行うようになった時期の説明とＧに対する反面調査の結果が異なることから、その点について追及したところ、原告は、記憶違いであるとして、個人事業主として事業を行うようになったのは平成２２年頃であるとした。（乙６、１３、１６）\nア 平成２７年分の所得税等の確定申告の際の申告書作成会場の担当職員の指摘にかかわらず、消費税等を納付したくないと考え、平成２８年分ないし平成３０年分の所得税等の確定申告においては、売上金額が１０００万円を超えないよう少なく申告していた。\nイ その方法として、平成２８年分ないし平成３０年分の売上金額の集計メモを作成するに当たり、まず主な売上先であるＥに対する売上金額を記載し、次に、他の売上先に対する売上金額を、売上金額が合計１０００万円を超えないよう、実際より少なく記載し、又は記載自体をしないという調整をしていた。\nウ 平成２８年分及び平成２９年分の集計メモは、平成３１年１月の引越しの際に誤って処分してしまった。\nエ 平成２４年分ないし平成２７年分の所得税等の確定申告においても、Ｄ社が倒産した後、\n平成２２年に個人事業主として建設業を始めたが、生活が不安定であり、妻も病気で具合が悪く、通院している状態であったことから、平成２４年頃、まとまった収入が得られるようになった後も、生活費や妻の医療費の確保を優先し、売上金額を少なく申告していた。\n\n\n（６）原告は、令和元年９月１０日、松戸税務署の調査担当職員に対し、次のとおり申述した。\n（乙１３、２４）\nア 平成３０年分の外注費について、Ｊから受注した工事の外注費１３万円の計上漏れが生じている。同年１１月３０日付け請求書によりＪから振り込まれた工事代金２４８万０２\n２０円を、平成３０年分の売上金額として計上することなく、平成３１年分の売上金額として計上することとしたことから、その受注工事に係る外注費１３万円が計上漏れになっていたものである。平成２７年分ないし平成３０年分について、それ以外の経費の追加はなく、収支内訳書に記載された金額で間違いがない。\nイ 平成２４年分ないし平成２６年分の外注費について、本件口座から外注先の預金口座に振り込んでいるものが外注費の金額である。本件口座からの振込みによる支払先として\n「丁」「Ｏ」「Ｎ」「戊」「Ｖ」「Ｐ」に対する支払金額を確認することができる。\nウ 外注費の計算について、作業日報から現場ごとに人工を計算し、メモを付ける。売上金額の入金後、あらかじめ計算してあった外注費をＱらに支払っている。\n\n\n（７）原告は、令和元年１０月３１日、松戸税務署の調査担当職員に対し、次のとおり申述した。\n原告は、同年８月２１日の申述においては、平成２４年分ないし平成２６年分の所得税等の確定申告の内容が正しくないとしていたが、同年１０月３１日の申述においては、売上金額から外注費及びその他の経費の金額を差し引いた残額を雑所得の収入金額とし、倉庫代など必要経費を計上して、所得金額を正しく計算していたとした。（乙１３、１６）\nア 平成２４年分ないし平成２７年分の所得税等の確定申告においても、平成３０年分と同様に、確定申告に先立ち、集計メモを作成し、申告書作成会場に持参していた。その際に、\n売上金額から外注費を差し引いた自ら働いた金額のみを収入として申告するよう指導され、\nその残りの金額だけで申告書を作成していた。\nイ 平成２６年分の所得税等の確定申告の際に、申告書作成会場の担当職員から、来年から正しい申告をするよう指導され、平成２７年分からは売上金額と外注費として申告するようになった。\n\n\n（８）松戸税務署の調査担当職員は、令和元年１１月１４日、原告の平成２４年分及び平成２５年分の所得税等の確定申告書の添付書類を確認したところ、平成２４年分の添付書類にメモ書き等はなく、平成２５年分の添付書類の台紙に収入、経費等の記載はあったが、集計メモが作成された形跡はなかった。（乙１３）\n\n\n（９）原告は、令和元年１１月１９日、松戸税務署の調査担当職員に対し、次のとおり申述した。\n調査担当職員は、平成２４年分及び平成２５年分の所得税等の確定申告の添付書類を確認しても集計メモが作成された形跡はなかったことについて追及したところ、原告は、平成２４年分ないし平成２６年分の所得税等の確定申告においては、集計メモは作成しておらず、単独工事の売上金額のみを申告していたとした。（乙７、１３、１６、２３）\nア 平成２４年分ないし平成２６年分の所得税等の確定申告は正しいものでない。平成２２年、個人で事業を始め、外注先も使うようになったが、売上金額が増えたことから、税金が増えると考え、外注工事は除外し、単独工事の売上金額のみを報酬として申告していた。\n単独工事の売上金額は月額１０万円程度であったことから、それを１２か月分とした金額を収入金額とし、倉庫代などの金額を必要経費として、所得金額を計算した。\nイ 平成２４年分ないし平成２６年分の所得税等についても、本件口座の預金通帳と請求書を照らし合わせることにより売上金額は把握していたが、生活費や妻の医療費を優先して、\n単独工事の売上金額のみを報酬として申告していた。外注工事の売上金額は、外注先の売上金額であり、原告はそれを取りまとめて売上先に請求していたものである。もっとも、\n原告は、外注工事の売上金額から取り分を得ていた。原告は、その取り分を自らの収入金額に計上しなかった。\nウ 平成２７年分の所得税等の確定申告において、売上金額の集計メモを作成するに当たり、\n請求書と本件口座の預金通帳を基に、まず主な売上先であるＥに対する売上金額を記載し、\n次に他の売上先に対する売上金額は実際より少なく記載し、又は金額自体を記載しないという調整をしていた。平成２７年分の集計メモも、平成３１年１月の引越しの際に誤って処分してしまった。\n\n\n（10）松戸税務署の調査担当職員は、令和元年１２月１７日、原告に対し、調査結果の説明書\n（乙２５、２６）により、調査の結果把握した原告の平成２４年分ないし平成３０年分の売上金額、外注費の金額、その他の経費の金額及び税額の計算について説明した上、それによれば平成２４年分ないし平成３０年分の所得税等及び平成２６年課税期間ないし平成３０年課税期間の消費税等のいずれについても更正又は決定をすべきであると認められるとした。\n調査担当職員は、「修正申告等について」と題する書面（乙２７）により、修正申告書又は期限後申告書を提出した場合、当該修正申告等により納付すべき税額を納付すべきこととなるほか、過少申告加算税、無申告加算税又は重加算税を課されること、修正申告等について不服申立てをすることはできないが、所定の期間内において更正の請求をすることができ、\n加算税の賦課決定については不服申立てをすることができることなどを説明した上、平成２\n４年分ないし平成３０年分の所得税等の修正申告及び平成２６年課税期間ないし平成３０年課税期間の消費税等の期限後申告（平成２９年課税期間については修正申告）を勧奨した。\n原告は、調査担当職員が提示した修正申告及び期限後申告の内容のうち外注費ほかの経費の金額に納得することができないとし、外注費ほかの経費の金額は本件口座の預金通帳から把握することができると申し立てた。調査担当職員は、外注費ほかの経費に関する書類が保存されていないことを指摘した上、外注費ほかの経費の算定方法について、本来、支出した事実を確認することができないものは必要経費として認めることができないが、原告の事業上は経費が発生するのが通常であることを考慮し、収入金額に占める経費の割合を用いて算定したこと（すなわち、所得税等について、原告が収支内訳書に記載した平成２７年分ないし平成３０年分の経費の金額とおおむね同じ額を必要経費として、同期間の平均経費率を算出し、平成２４年分ないし平成２６年分の収入金額に当該平均経費率を乗じて、同期間の必要経費の金額を算定したこと、消費税等についても、同じ考えに基づいて、平成２４年課税期間ないし平成２６年課税期間の課税仕入れに係る支払対価の額を算定を算定したこと）、本件口座の預金通帳から外注費ほかの経費であると考えられる支出の金額を抽出し集計しても上記の経費の割合を用いて算定した外注費ほかの経費の金額に及ばないことを説明し、理解を求めた。（乙１３、１６）\n原告は、令和元年１２月１７日、いずれも松戸税務署の調査担当職員が調査の結果に基づいて準備した、上記各年分の所得税等の修正申告書に署名押印をし、上記各課税期間の消費税等の期限後申告書（平成２９年課税期間については修正申告書）の原告の記名の末尾に押印をした上、それぞれ提出して、処分行政庁に対し、平成２４年分ないし平成３０年分の所得税等の修正申告をし、平成２６年課税期間ないし平成３０年課税期間の消費税等の期限後申告（平成２９年課税期間については修正申告）をした。そのため、これらの修正申告及び期限後申告の内容は、全て、松戸税務署の調査担当職員が上記の勧奨時に原告に対して提示したものである。原告は、処分行政庁に対し、上記の「修正申告等について」と題する書面の控えに署名押印をし提出した。原告は、同月１８日、処分行政庁に対し、個人事業の廃業届出書を提出した。（乙１３、１６、２７、弁論の全趣旨）\n\n\n（11）原告の平成２４年分ないし平成３０年分の所得税等についての調査結果の説明書（乙２５）\nは、調査の結果、課税標準等に関する誤りとして、①売上金額について、申告に係る売上金額と原始記録及び売上先への反面調査により把握した売上金額との開差額から、売上除外の事実を把握した（平成２４年分１６３４万２３９９円、平成２５年分２１２０万７６５９円、\n平成２６年分１９２５万９７５６円、平成２７年分５０３万９４４４円、平成２８年分２９\n１万９５１２円、平成２９年分２９３万８７６８円、平成３０年分５０２万１０８０円）、\n②外注費について、平成３０年分の売上除外に係る外注費１３万円を認容し、平成２６年分以前の外注費を原告の平成２７年分ないし平成３０年分の経費率により認容した（平成２４年分７１９万０６５６円、平成２５年分９３３万１３７０円、平成２６年分８４７万４２９\n３円、平成３０年分１３万円）、③地代家賃について、各年分２０万円の倉庫代を認容し、\n平成２６年分以前の地代家賃を原告の平成２７年分ないし平成３０年分の経費率により認容した（平成２４年分１０８万０８５５円、平成２５年分１３４万３０９３円、平成２６年分\n１２３万８１０１円、平成２７年分２０万円、平成２８年分２０万円、平成２９年分２０万円、平成３０年分２０万円）、④その他の経費について、平成２６年分以前の必要経費を原告の平成２７年分ないし平成３０年分の経費率により算定した（平成２４年分２４８万０７\n７５円、平成２５年分３２１万９３２２円、平成２６年分２９２万３６３３円）とするものである。\n上記金額のうち、平成２４年分ないし平成２６年分の外注費、地代家賃及びその他の経費の金額は、原告が平成２７年分ないし平成３０年分の所得税等の確定申告に当たり外注費、\nその他の経費の各集計メモの記載に基づいて作成した収支内訳書（乙１８の１ないし４）記載の外注費、地代家賃及びその他の経費の金額（別表１「本件各年分の所得税等の事業所得の金額」の平成２７年分ないし平成３０年分の各対応欄の金額。「－」については「０円\n（支出の事実なし）」を意味する。）が、処分行政庁が上記①の調査により把握した原告の平成２７年分ないし平成３０年分の売上金額（別表１「本件各年分の所得税等の事業所得の金額」の平成２７年分ないし平成３０年分の「総収入金額」欄の金額）に占める割合を平均して求めた平均経費率（別表２）を、処分行政庁が上記①の調査により把握した原告の平成２\n４年分ないし平成２６年分の売上金額（別表１「本件各年分の所得税等の事業所得の金額」\nの平成２４年分ないし平成２６年分の「総収入金額」欄の金額）に乗じて得た金額（別表１\n「本件各年分の所得税等の事業所得の金額」の平成２４年分ないし平成２６年分の各対応欄の金額。別表３）である。\n原告の平成２６年課税期間ないし平成３０年課税期間の消費税等についての調査結果の説明書（乙２６）は、①課税標準額に関する誤りとして、決算書を基に算出した売上金額の誤り（平成２６年課税期間１７９５万４７９６円、平成２７年課税期間１４２３万４７０９円、\n平成２８年課税期間１１１５万７９０９円、平成２９年課税期間２７２万１０８１円、平成\n３０年課税期間１２７１万９５４８円）、②控除対象仕入税額が増減する理由として、控除対象仕入税額の誤り（平成２６年課税期間４０万２５６２円、平成２７年課税期間５３万６\n７４０円、平成２８年課税期間４３万１４００円、平成２９年課税期間△２万８０００円、\n平成３０年課税期間４４万５４９２円）とするものである。\n上記金額のうち、平成２７年課税期間ないし平成３０年課税期間の控除対象仕入税額の金額は、原告が平成２７年分ないし平成３０年分の所得税等の確定申告に当たり外注費、その他の経費の各集計メモの記載に基づいて作成した収支内訳書に記載の外注費、地代家賃及びその他の経費の金額（別表１）中の課税取引金額（別表４「本件各課税期間の消費税等に係る課税仕入れの支払対価の額」の平成２７年課税期間ないし平成３０年課税期間の各対応欄の金額）に係るものであり、平成２６年課税期間の控除対象仕入税額の金額は、上記のとおり求めた平均経費率（別表２）を処分行政庁が上記の調査により把握した原告の平成２６年分の売上金額に乗じて得た金額（別表１、３）中の課税取引金額（別表４「本件各課税期間の消費税等に係る課税仕入れの支払対価の額」の平成２６年課税期間の各対応欄の金額）に係るものである。\n\n\n（12）処分行政庁は、令和２年１月２７日付けで、原告に対し、平成２４年分ないし平成３０年分の所得税等についての重加算税の賦課決定（本件各所得加算税賦課決定）をし、平成２６年課税期間ないし平成３０年課税期間の消費税等についての無申告加算税及び重加算税の賦課決定（平成２９年課税期間については重加算税の賦課決定。本件各消費税加算税賦課決定）\nをした。\nこれらの賦課決定のうち、平成２４年分ないし平成２６年分の所得税等についてのもの及び平成２６年課税期間の消費税等についてのものの理由は、原告が、その事業について、本件口座への入金額から真実の売上金額を把握していたにもかかわらず、税金を納めたくないことから、単独工事の売上金額のみを収入金額として少なく担当職員に伝えた隠蔽又は仮装の事実が認められ、修正申告前の税額の計算の基礎としなかったこと又は期限内申告をしなかったことについて正当な理由があると認められないから、重加算税を賦課すべきであるというものであり、平成２７年分ないし平成３０年分の所得税等についてのもの及び平成２７年課税期間ないし平成３０年課税期間の消費税等についてのものの理由は、原告が、その事業について、本件口座への入金額から真実の売上金額を把握していたにもかかわらず、税金を納めたくないことから、主な売上先であるＥを除くその他の売上先に対する売上金額については（Ｅに対する売上金額と合わせて１０００万円を超えないよう）売上金額の集計メモにその一部のみを記載しその集計メモに基づき収支内訳書を作成した隠蔽又は仮装の事実が認められ、修正申告前の税額の計算の基礎としなかったこと又は期限内申告をしなかったことについて正当な理由があると認められないから、重加算税を賦課すべきであるというものである。（乙３０の１ないし７、乙３１の１ないし５）\n\n\n（13）原告は、令和２年３月１２日、処分行政庁に対し、平成２６年分ないし平成３０年分の所得税等及び平成２６年課税期間ないし平成３０年課税期間の消費税等について、更正の請求をし、所得税等について、総所得金額及び納付すべき税額をそれぞれの年分の確定申告に係る金額に更正することを求め、消費税等について、課税標準額及び消費税等の税額を０円\n（平成２９年課税期間についてはその課税期間の確定申告に係る金額）に更正することを求めた。\nこれらの更正の請求の理由は、個人事業主としての申告であるが、原告は一人親方として申告していたものであるというものである。（乙３２、３３の各１ないし５）\n\n\n（14）松戸税務署の調査担当職員は、令和２年３月３０日、原告に対し、更正の請求の根拠となる新たな書類の提出の有無を確認したところ、原告は、同年４月７日、平成３０年分の外注費の集計メモ（乙５の８枚目）の写しに未計上の外注費を加入したもの（乙３５）、平成３\n０年分のその他の経費の集計メモ（乙５の９枚目）の写しに未計上の経費を加入したもの\n（乙３６）のほか、作業員名簿（乙３７）を提出した。（乙３４）\n松戸税務署の調査担当職員は、令和２年４月９日、原告に対し、一人親方であることや売上、経費が分かる書類、例えば帳簿、その基となった請求書の控え、領収書などを提出するよう求めたところ、原告は、他に書類はないが、経費を支払ったのは間違いないと述べた。\n原告は、同年５月１１日、「支払内訳 ５月７日」と題するメモ（平成２４年分ないし平成\n３０年分の各年別に、外注費の合計金額、外注先ごとの合計金額、その他の経費として損害保険料や交際費の金額が記載されているもの。乙３８）、平成２４年分ないし平成３０年分の収支内訳書（「外注工賃」欄、「その他の経費」の「交際費」欄及び「損害保険料」欄に、\n上記外注費の合計額や損害保険料、交際費の各金額が記載されており、他は空欄とされているもの。平成３０年分については、「その他の経費」欄の「金物工具」欄にも記載がある。\n乙３９）を提出した。原告は、調査担当職員に対し、他に更正の請求の根拠となる書類はないと述べた。（乙３４）\n原告は、令和２年５月２１日、松戸税務署の調査担当職員に対し、上記メモに記載した損害保険料、交際費の金額の裏付けとなる資料は有しておらず、大体これくらいかなという金額であると説明した。（乙３４）\n\n\n（15）処分行政庁は、令和２年６月１１日付けで、原告に対し、上記\n\n\n（１３）の各更正の請求について、それぞれ、更正をすべき理由がない旨の通知処分（本件各所得税通知処分及び本件各消費税通知処分）をした。\nこれらの通知処分は、売上や経費に係る帳簿や請求書、領収書などが提出されていないことから、国税に関する法律の規定に従っていない又は当該計算に誤りがあると認めることはできないとするものである。（乙４０、４１の各１ないし５）\n\n\n（16）原告は、国税不服審判所長に対し、令和２年２月２３日、本件各所得税加算税賦課決定及び本件各消費税加算税賦課決定についての審査請求をし、同年７月８日、本件各所得税通知処分及び本件各消費税通知処分についての審査請求をした。国税不服審判所長は、国税通則法１０４条１項の規定により、上記各審査請求について併合審理をした。\nこれらの審査請求の理由は、売上先の意向もあり、他の一人親方である外注先の労賃（外注費）を一括して請求していたが、申告は自らの労賃のみを申告していたものであり、個人事業主の認識はなかったなどというものである。（乙４２、４４）\n\n\n（17）原告は、審査請求の審理において、担当国税審判官に対し、Ｌ信用組合の振込みカード４枚（依頼人を原告、受取人を「Ｎ」「丁」「Ｏ」「Ｑ」とするもの。乙４６）、「年度別外注費及び材料費、その他内訳」と記載された書面（平成２４年分ないし平成３０年分の各年別に、\n外注費の支払先ごとの振込金額、現金払金額、その他の経費として材料費、リース料、車両関係費用などの各金額が記載されているもの。乙４７）、外注費の領収証１４枚の写し（宛先を原告、領収者をそれぞれ外注先のうち丁５枚、丙２枚、Ｑ７枚とするもの。乙４８）、\nＫ銀行松戸支店作成の本件口座の取引推移一覧表（原告が外注費、材料費の振込みと指摘する「Ｑ」「外注（丁他）」「株）Ｙ」の該当部分にマーカーが付されているもの。乙４９）を提出した。\n\n\n（18）処分行政庁は、令和２年７月２７日付けで、原告に対し、平成２７年課税期間ないし平成\n３０年課税期間の消費税等について、無申告加算税及び重加算税の賦課決定の変更決定をした。国税不服審判所長は、国税通則法１０４条２項の規定により、上記変更決定のうち平成\n２７年課税期間及び平成２８年課税期間に係るものについて上記\n\n\n（１６）の審査請求との併せ審理をした。\nこれらの変更決定は、無申告加算税の対象となるべき地代家賃の金額に誤りがあったためされたもの（平成２９年課税期間については地代家賃の金額のうちに無申告加算税の対象となるべき金額があったためされたもの）である。（乙５０の１ないし４）\n\n\n（19）国税不服審判所長は、令和３年２月１６日付けで、原告の審査請求をいずれも棄却する裁決をした。\n３ 本件各所得税通知処分の適否原告の平成２４年分ないし平成３０年分の所得税等の納税義務は、当該年の終了の時に成立し（国税通則法１５条２項１号）、原告がした期限内申告により、当該年分の納付すべき税額が既に確定していた（同条１項）ところ、原告が令和元年１２月１７日にした修正申告により、当該年分の納付すべき税額が改めて確定した。原告は、修正申告書に記載した事業所得に係る総収入金額及び必要経費の金額に誤りがあったことにより、当該修正申告書の提出により納付すべき税額が過大であるとして、令和２年３月１２日、処分行政庁に対し、平成２\n６年分ないし平成３０年分の所得税等について、更正の請求をし、処分行政庁は、調査を行った上、令和２年６月１１日付けで、原告に対し、上記更正の請求について、更正をすべき理由がない旨の通知処分である本件各所得税通知処分をしたところ、これらの行為は当該年分の納付すべき税額を確定するものでないが、修正申告書に記載された事業所得に係る総収入金額及び必要経費の金額に誤りがあったことにより、当該修正申告書の提出により納付すべき税額が過大であるならば、上記更正の請求について更正をすべき理由がないとした本件各所得税通知処分が違法であり、取り消されるべきものであることとなるから、取消判決の拘束力に従い処分行政庁がした減額更正による一部取消しにより、修正申告により既に確定していた当該年分の納付すべき税額が減少することとなる。\nそこで、修正申告書に記載された事業所得に係る総収入金額及び必要経費の金額に誤りがあったことにより、当該修正申告書の提出により納付すべき税額が過大であるか否かについて検討することとするが、更正の請求が、申告又は更正により既に確定した納付すべき税額について、減額更正による一部取消しを求める行為であり、そのため、更正の請求をしようとする者は、その請求に係る更正前の課税標準等又は税額等、当該更正後の課税標準等又は税額等のほか、その更正の請求をする理由、当該請求をするに至った事情の詳細その他参考となるべき事項を記載した更正請求書を税務署長に提出しなければならず（国税通則法２３条\n３項）、更正の請求をしようとする者は、その更正の請求をする理由の基礎となる事実を証明する書類があるときは、その書類を更正請求書に添付しなければならない（その更正の請求をする理由が課税標準たる所得が過大であることその他その理由の基礎となる事実が一定期間の取引に関するものであるときは、その取引の記録等に基づいてその理由の基礎となる事実を証明する書類を更正請求書に添付しなければならない。国税通則法施行令６条２項）ことに鑑みると、修正申告書に記載された事業所得に係る総収入金額及び必要経費の金額に誤りがあったことにより、当該修正申告書の提出により納付すべき税額が過大であることについては、原告が立証責任を負うというべきである。\n\n\n（１）修正申告書に記載された事業所得に係る総収入金額に誤りがあるか否かについて原告が令和元年１２月１７日に処分行政庁に対してした平成２４年分ないし平成３０年分の所得税等の修正申告に係る修正申告書には、原告の上記各年分の事業所得に係る総収入金額として、平成２４年分１６３４万２３９９円（乙９の１）、平成２５年分２１２０万７６\n５９円（乙９の２）、平成２６年分１９２５万９７５６円（乙９の３）、平成２７年分１５３\n７万３５７６円（乙９の４）、平成２８年分１２０５万０５４２円（乙９の５）、平成２９年分１０９１万８５３３円（乙９の６）、平成３０年分１３７３万７１１２円（乙９の７）が記載されている。\n原告が法定申告期限までに処分行政庁に対してした平成２４年分ないし平成３０年分の所得税等の確定申告に係る期限内申告書のうち、平成２４年分ないし平成２６年分の所得税等の確定申告に係るものには、原告の上記各年分の事業所得に係る総収入金額の記載がなく\n（乙８の１ないし３）、平成２７年分ないし平成３０年分の所得税等の確定申告に係るものには、原告の上記各年分の事業所得に係る総収入金額として、平成２７年分１０３３万４１\n３２円（乙８の４）、平成２８年分９１３万１０３０円（乙８の５）、平成２９年分７９７万\n９７６５円（乙８の６）、平成３０年分８７１万６０３２円（乙８の７）が記載されているのであり、原告は、原始記録を基として作成した外注費、その他の経費の各集計メモの記載に基づいて収支内訳書（乙１８の１ないし４）を作成し、平成２７年分ないし平成３０年分の事業所得に係る総収入金額として、各年分の上記金額を自認していたと認めることができるところ、証拠（乙２５）によれば、原告の平成２４年分ないし平成３０年分の所得税等についての調査の結果、課税標準等に関する誤りとして、平成２４年分１６３４万２３９９円、\n平成２５年分２１２０万７６５９円、平成２６年分１９２５万９７５６円、平成２７年分５\n０３万９４４４円、平成２８年分２９１万９５１２円、平成２９年分２９３万８７６８円、\n平成３０年分５０２万１０８０円の売上除外の事実が把握されたと認めることができ、上記自認に係る金額と上記の売上除外の事実が把握された金額を合わせると、修正申告書に記載された事業所得に係る総収入金額と同額となる。\nそして、上記の売上除外の事実の把握が、原告が保管していた原始記録及び売上先への反面調査により実額で行われたものであること（乙２５）に加えて、本件全証拠によるも、上記の売上除外の事実の把握の正確性に合理的な疑いを生ぜしめる事情があると認めるに足りないことからするならば、上記の売上除外の事実の把握に誤りがあると認めることはできず、\n修正申告書に記載された事業所得に係る総収入金額に誤りがあると認めることはできない。\n原告は、修正申告書に記載された事業所得に係る総収入金額に誤りがあると指摘するが、\n採用することができない。\n原告は、平成３０年１１月３０日付けのＪ宛の請求書に係る出来高の売上金額２５１万円の入金は、未成工事であることから、平成３０年分の事業所得に係る総収入金額に計上することを要しないと主張するが、原告は、売上先に対する工事代金の請求を、出来高に基づいて月末締めで作成した請求書を送付する方法により行っていたのであり（前提事実\n\n\n（２）\nイ）、平成３０年１１月末日締めで、出来高に基づいて、Ｊに対し、２４８万０２２０円の支払を請求した（乙５の１０枚目）ところ、同年１２月４日、本件口座に、Ｊから、工事代金２４８万０２２０円の振込みがあったのである（乙１４）から、工事が年を跨いだことは平成３０年分の事業所得に係る総収入金額に計上しないことの理由とならない。\n原告は、更正の請求の理由において、原告は一人親方として申告していたものであるとし\n（認定事実\n\n\n（１２））、審査請求の理由において、売上先の意向もあり、他の一人親方である外注先の労賃（外注費）を一括して請求していたが、申告は自らの労賃のみを申告していたなどとしている（認定事実\n\n\n（１５））が、原告が売上先に対して代金を請求していた工事は、\n全て原告が受注したものであり、外注先が受注したものはなく（弁論の全趣旨）、原告が売上先に対して請求した工事代金は、全て原告の売上金額であるというべきであるから、採用することができない。\n\n\n（２）修正申告書に記載された必要経費の金額に誤りがあるか否かについて原告が令和元年１２月１７日に処分行政庁に対してした平成２４年分ないし平成３０年分の所得税等の修正申告に係る修正申告書には、原告の上記各年分の事業所得の金額として、\n平成２４年分５５９万０１１３円（上記\n\n\n（１）の事業所得に係る総収入金額１６３４万２３\n９９円から必要経費の金額１０７５万２２８６円を控除した金額。乙９の１、弁論の全趣旨）、平成２５年分７３１万３８７４円（上記\n\n\n（１）の事業所得に係る総収入金額２１２０万７６５９円から必要経費の金額１３８９万３７８５円を控除した金額。乙９の２、弁論の全趣旨）、平成２６年分６６２万３７２９円（上記\n\n\n（１）の事業所得に係る総収入金額１９\n２５万９７５６円から必要経費の金額１２６３万６０２７円を控除した金額。乙９の３、弁論の全趣旨）、平成２７年分５３３万８５９１円（上記\n\n\n（１）の事業所得に係る総収入金額\n１５３７万３５７６円から必要経費の金額１００３万４９８５円を控除した金額。乙９の４、\n弁論の全趣旨）、平成２８年分３２４万５８１１円（上記\n\n\n（１）の事業所得に係る総収入金額１２０５万０５４２円から必要経費の金額８８０万４７３１円を控除した金額。乙９の５、\n弁論の全趣旨）、平成２９年分３９３万５４１９円（上記\n\n\n（１）の事業所得に係る総収入金額１０９１万８５３３円から必要経費の金額６９８万３１１４円を控除した金額。乙９の６、\n弁論の全趣旨）、平成３０年分５２４万６３０６円（上記\n\n\n（１）の事業所得に係る総収入金額１３７３万７１１２円から必要経費の金額８４９万０８０６円を控除した金額。乙９の７、\n弁論の全趣旨）が記載されている。\n原告が法定申告期限までに処分行政庁に対してした平成２４年分ないし平成３０年分の所得税等の確定申告に係る期限内申告書のうち、平成２４年分ないし平成２６年分の所得税等の確定申告に係るものには、原告の上記各年分の事業所得の金額の記載がなく（乙８の１ないし３）、平成２７年分ないし平成３０年分の所得税等の確定申告に係るものには、原告の上記各年分の事業所得の金額として、平成２７年分５２万３６０２円（上記\n\n\n（１）の事業所得に係る総収入金額１０３３万４１３２円から必要経費の金額９８１万０５３０円を控除した金額。乙８の４、乙１８の１）、平成２８年分１０３万５６８９円（上記\n\n\n（１）の事業所得に係る総収入金額９１３万１０３０円から必要経費の金額８０９万５３４１円を控除した金額。乙８の５、乙１８の２）、平成２９年分１２４万４５０１円（上記\n\n\n（１）の事業所得に係る総収入金額７９７万９７６５円から必要経費の金額６７３万５２６４円を控除した金額。乙８の６、乙１８の３）、平成３０年分５５万５２２６円（上記\n\n\n（１）の事業所得に係る総収入金額８７１万６０３２円から必要経費の金額８１６万０８０６円を控除した金額。\n乙８の７、乙１８の４）が記載されているのであり、原告は、原始記録を基として作成した外注費、その他の経費の各集計メモの記載に基づいて収支内訳書（乙１８の１ないし４）を作成し、平成２７年分ないし平成３０年分の必要経費の金額として、各年分の上記金額を自認していたと認めることができるところ、原告の平成２４年分ないし平成３０年分の所得税等についての調査結果の説明書（乙２５）が、調査の結果、①外注費について、平成３０年分の売上除外に係る外注費１３万円を認容し、平成２６年分以前の外注費を原告の平成２７年分ないし平成３０年分の経費率により認容した（平成２４年分７１９万０６５６円、平成\n２５年分９３３万１３７０円、平成２６年分８４７万４２９３円、平成３０年分１３万円）、\n②地代家賃について、各年分２０万円の倉庫代を認容し、平成２６年分以前の地代家賃を原告の平成２７年分ないし平成３０年分の経費率により認容した（平成２４年分１０８万０８\n５５円、平成２５年分１３４万３０９３円、平成２６年分１２３万８１０１円、平成２７年分２０万円、平成２８年分２０万円、平成２９年分２０万円、平成３０年分２０万円）、③その他の経費について、平成２６年分以前の必要経費を原告の平成２７年分ないし平成３０年分の経費率により算定した（平成２４年分２４８万０７７５円、平成２５年分３２１万９\n３２２円、平成２６年分２９２万３６３３円）とするものであることは、認定事実\n\n\n（１１）\nのとおりである。この調査結果の意味について、証拠（乙１８の１ないし４、乙２５）によれば、上記の調査結果の説明書は、①平成２７年分ないし平成３０年分の必要経費の金額について、期限内申告書に添付された収支内訳書に記載の外注費、地代家賃及びその他の経費の金額（別表１）を基本的に認めることとし、平成２７年分の外注費を７１８万２２５０円、\n地代家賃を９４万円（収支内訳書に記載された金額に倉庫代２０万円を加えた金額）、その他の経費を１９１万２７３５円（合計額の算出時の違算を訂正した金額）と、平成２８年分の外注費を５５８万５０００円、地代家賃を９４万円（収支内訳書に記載された金額に倉庫代２０万円を加えた金額）、その他の経費を２２７万９７３１円（合計額の算出時の違算を訂正した金額）と、平成２９年分の外注費を４５２万４４０５円、地代家賃を８８万円（収支内訳書に記載された金額に倉庫代２０万円を加えた金額）、その他の経費を１５７万８７\n０９円（合計額の算出時の違算を訂正した金額）と、平成３０年分の外注費を５６９万７９\n００円（収支内訳書に記載された金額に、上記\n\n\n（１）の売上除外に係るＪに対する売上金額\n２４８万０２２０円に対応する外注先に対する外注費１３万円を加えた金額）、地代家賃を\n８０万円（収支内訳書に記載された金額に倉庫代２０万円を加えた金額）、その他の経費を\n１９９万２９０６円と、それぞれ認容した上、②平成２４年分ないし平成２６年分の必要経費の金額について、平成２７年分ないし平成３０年分の外注費、地代家賃及びその他の経費の金額が上記各年分の売上金額に占める割合を平均して求めた平均経費率（別表２）を、平成２４年分ないし平成２６年分の売上金額に乗じて得た金額とすることとし（認定事実（１\n１））、平成２４年分の外注費を７１９万０６５６円、地代家賃を１０８万０８５５円（平均経費率を乗じて得た金額に倉庫代２０万円を加えた金額）、その他の経費を２４８万０７７\n５円と、平成２５年分の外注費を９３３万１３７０円、地代家賃を１３４万３０９３円（平均経費率を乗じて得た金額に倉庫代２０万円を加えた金額）、その他の経費を３２１万９３\n２２円と、平成２６年分の外注費を８４７万４２９３円、地代家賃を１２３万８１０１円\n（平均経費率を乗じて得た金額に倉庫代２０万円を加えた金額）、その他の経費を２９２万\n３６３３円と、それぞれ認容したものであると認めることができる。これらの外注費、地代家賃及びその他の経費の金額の合計額は、修正申告書に記載された事業所得の金額の計算に当たり事業所得に係る総収入金額から控除された必要経費の金額と同額となる。\nそして、必要経費の多くの金額は売上金額に比例して増減する性質を有すると考えられること（地代家賃は、そのような性質を有するとはいい難いが、本件については、平成２４年分ないし平成２６年分の地代家賃が平成２７年分ないし平成３０年分の地代家賃の金額を超える金額として算定されており、原告に不利益には作用していないから、問題は生じない。）\nに加えて、本件全証拠によるも、平成２４年分ないし平成２６年分の必要経費と平成２７年分ないし平成３０年分の必要経費との間において売上金額に占める割合を異にする事情があると認めるに足りないことからするならば、収支内訳書に記載の外注費、地代家賃及びその他の経費の金額（別表１）と平均経費率（別表２）を用いて算定された上記の必要経費の金額に誤りがあると認めることはできず、修正申告書に記載された事業所得の金額に誤りがあると認めることはできない。\n原告は、必要経費の金額について種々主張し、それを裏付ける証拠として、更正の請求の調査において、①平成３０年分の外注費の集計メモ（乙５の８枚目）の写しに未計上の外注費を加入したもの（乙３５）、②平成３０年分のその他の経費の集計メモ（乙５の９枚目）\nの写しに未計上の経費を加入したもの（乙３６）、③作業員名簿（乙３７）、④「支払内訳\n５月７日」と題するメモ（平成２４年分ないし平成３０年分の各年別に、外注費の合計金額、\n外注先ごとの合計金額、その他の経費として損害保険料や交際費の金額が記載されているもの。乙３８）、⑤平成２４年分ないし平成３０年分の収支内訳書（「外注工賃」欄、「その他の経費」の「交際費」欄及び「損害保険料」欄に、上記外注費の合計額や損害保険料、交際費の各金額が記載されており、他は空欄とされているもの。平成３０年分については、「その他の経費」欄の「金物工具」欄にも記載がある。乙３９）を、審査請求の審査において、\n①Ｌ信用組合の振込みカード４枚（依頼人を原告、受取人を「Ｎ」「丁」「Ｏ」「Ｑ」とするもの。乙４６）、②「年度別外注費及び材料費、その他内訳」と記載された書面（平成２４年分ないし平成３０年分の各年別に、外注費の支払先ごとの振込金額、現金払金額、その他の経費として材料費、リース料、車両関係費用などの各金額が記載されているもの。乙４\n７）、③外注費の領収証１４枚の写し（宛先を原告、領収者をそれぞれ外注先のうち丁５枚、\n丙２枚、Ｑ７枚とするもの。乙４８）、④Ｋ銀行松戸支店作成の本件口座の取引推移一覧表\n（原告が外注費、材料費の振込みと指摘する「Ｑ」「外注（丁他）」「株）Ｙ」の該当部分にマーカーが付されているもの。乙４９）を、それぞれ提出し、本件訴えにおいても、「反論書」と題する書面（甲２）を提出する。しかし、これらの証拠は、いずれも、必要経費の金額に係る原始記録やその原始記録に基づいて作成された帳簿類等でなく、原告や外注先が事後的に作成したものであり、その実質的証拠力において、原告や外注先の供述の域を出ないものである（乙４８の領収証についても、１年分をまとめた金額について作成されたものであり、それが証拠として提出された時期が審査請求の審理に至ってからであったことに照らして、外注費の支払ごとに作成されたものでなく、事後的に一括して作成されたものであることが明らかであり、原始記録としての性格を有するものでない。）。これらの証拠は必要経費の金額に誤りがあると認めるに足りない。\n\n\n（３）当該修正申告書の提出により納付すべき税額が過大であるか否かについて原告が令和元年１２月１７日に処分行政庁に対してした平成２４年分ないし平成３０年分の所得税等の修正申告に係る修正申告書に記載された事業所得に係る総収入金額に誤りがあると認めることはできず、当該修正申告書に記載された事業所得の金額の計算に当たり事業所得に係る総収入金額から控除された必要経費の金額に誤りがあると認めることもできないことは、上記\n\n\n（１）及び\n\n\n（２）のとおりであり、当該修正申告書に記載した事業所得に係る総収入金額及び必要経費の金額に誤りがあったことにより、当該修正申告書の提出により納付すべき税額が過大であるということはできない。\n処分行政庁が原告の平成２６年分ないし平成３０年分の所得税等に係る更正の請求についてした更正をすべき理由がない旨の各通知処分である本件各所得税通知処分は適法である。\n４ 本件各所得税加算税賦課決定の適否原告は、法定申告期限までに、処分行政庁に対し、平成２４年分ないし平成３０年分の所得税等の確定申告をし（別紙２の第１の１\n\n\n（１）ないし\n\n\n（７））、その後、松戸税務署の調査担当職員の勧奨を受けて、令和元年１２月１７日、処分行政庁に対し、上記各年分の所得税等の修正申告をしたのである（別紙２の第１の２\n\n\n（１）ないし\n\n\n（７））から、国税通則法６５条\n１項（過少申告加算税）の規定に該当する。\nそして、原告は、平成２２年頃、個人で型枠工事行を行うようになったが、処分行政庁に対し、個人事業の開業届出書を提出せず、平成２３年２月、処分行政庁に対し、電子申告・納税等開始届出書を提出した際には、職業を無職とし、平成２４年分ないし平成２６年分の所得税等の確定申告においても、職業を無職としていたのであり（前提事実\n\n\n（３）ア及びイ）、\nそのことを前提として、上記各年分の所得税等の確定申告において、自らの所得の区分を雑所得として、事業所得が存在しないことを装った上、売上金額のごく一部のみを作為的に申告し、収入金額や所得金額を著しく低く装い、納付すべき税額を０円としていた。加えて、\n原告は、売上先からの工事代金の支払を、主として本件口座への振込みの方法により受けていたところ、月に一度は、本件口座の預金通帳の記帳を行い、売上先からの入金額が原告の請求書に記載された請求額と一致していることを確認していたのであり（前提事実\n\n\n（２）イ）、\nその事業に係る収入金額及び必要経費の金額を正確に把握していた。しかし、原告は、平成\n２７年分ないし平成３０年分の所得税等の確定申告において、職業を建設業とし、自らの所得の区分を事業所得としたものの、売上金額の相当部分を作為的に除外した集計メモをあらかじめ作成し申告書作成会場に持参して、それを基に収支内訳書を作成し、意図的に収入金額や所得金額の相当部分が存在しないことを装い、納付すべき税額を０円ないし著しく低い金額としていた。原告は、平成２４年分ないし平成３０年分の所得税等の確定申告において、\n課税標準等又は税額等の計算の基礎となるべき事実の全部又は一部を隠蔽し、又は仮装し、\nその隠蔽し、又は仮装したところに基づき期限内申告をしていたものであるから、国税通則法６８条１項の規定に該当する。\n平成２４年分ないし平成３０年分の所得税等の修正申告に基づき新たに納付すべきこととなった税額の計算の基礎となった事実のうちに、それらの修正申告前の税額の計算の基礎とされていなかったことについて国税通則法６５条４項の正当な理由があると認められるものはないから、上記各年分の所得税等の修正申告に基づく納付すべき税額について、同法６８条\n１項の規定により、過少申告加算税に代え、別紙３（課税処分及び通知処分の根拠）の第１の１ないし７の各\n\n\n（５）のとおり、平成２４年分として１５万７５００円の重加算税が、平成２５年分として２３万８０００円の重加算税が、平成２６年分として１９万６０００円の重加算税が、平成２７年分として１５万７５００円の重加算税が、平成２８年分として４万\n２０００円の重加算税が、平成２９年分として６万３０００円の重加算税が、平成３０年分として１４万７０００円の重加算税が、それぞれ課されるべきであり、その金額は、別紙２\n（課税処分及び通知処分の経緯）の第１の３の本件各所得税加算税賦課決定が賦課した上記各年分の所得税等についての重加算税の額と同額であるから、処分行政庁が令和２年１月２\n７日付けで原告に対してした平成２４年分ないし平成３０年分の所得税等についての重加算税の賦課決定である本件各所得税加算税賦課決定は適法である。\n５ 本件各消費税通知処分の適否原告は、期限後申告書（平成２９年課税期間については修正申告書。以下、この項においては併せて単に「期限後申告書」という。）に記載した課税売上額及び課税仕入れに係る支払対価の額に誤りがあったことにより、当該期限後申告書の提出により納付すべき税額が過大であるとして、令和２年３月１２日、処分行政庁に対し、平成２６年課税期間ないし平成３０年課税期間の消費税等について、更正の請求をし、処分行政庁は、調査を行った上、令和２年６月１１日付けで、原告に対し、上記更正の請求について、更正をすべき理由がない旨の通知処分である本件各消費税通知処分をしたところ、期限後申告書に記載された課税売上額及び課税仕入れに係る支払対価の額に誤りがあったことにより、当該期限後申告書の提出により納付すべき税額が過大であるならば、上記更正の請求について更正をすべき理由がないとした本件各消費税通知処分が違法であり、取り消されるべきものであることとなる。\nそこで、期限後申告書に記載された課税売上額及び課税仕入れに係る支払対価の額に誤りがあったことにより、当該期限後申告書の提出により納付すべき税額が過大であるか否かについて検討することとするが、期限後申告書に記載された課税売上額及び課税仕入れに係る支払対価の額に誤りがあったことにより、当該期限後申告書の提出により納付すべき税額が過大であることについては、原告が立証責任を負うというべきであることは、上記３と同様である。\n\n\n（１）期限後申告書に記載された課税売上額に誤りがあるか否かについて原告が令和元年１２月１７日に処分行政庁に対してした平成２６年課税期間ないし平成３\n０年課税期間の消費税等の期限後申告に係る期限後申告書には、原告の上記各課税期間の課税売上額として、原告の平成２６年課税期間ないし平成３０年課税期間の消費税等についての調査結果の説明書（乙２６）に記載された金額と同額が記載されている（乙２８の１ないし４、乙２９）。\nそして、上記の課税売上額が、原告が作成した決算書を基に実額で算出されたものであること（乙２６）に加えて、本件全証拠によるも、上記の課税売上額の算出の正確性に合理的な疑いを生ぜしめる事情があると認めるに足りないことからするならば、上記の課税売上額の算出に誤りがあると認めることはできず、期限後申告書に記載された課税売上額に誤りがあると認めることはできない。\n\n\n（２）期限後申告書に記載された課税仕入れに係る支払対価の額に誤りがあるか否かについて原告が令和元年１２月１７日に処分行政庁に対してした平成２６年課税期間ないし平成３\n０年課税期間の消費税等の期限後申告に係る期限後申告書には、原告の上記各課税期間の課税仕入れに係る支払対価の額を基礎として計算される控除対象仕入税額の金額として、原告の平成２６年課税期間ないし平成３０年課税期間の消費税等についての調査結果の説明書\n（乙２６）に記載された金額と同額が記載されている（乙２８の１ないし４、乙２９）。\nそして、原告の平成２６年課税期間ないし平成３０年課税期間の消費税等についての調査結果の説明書（乙２６）に記載された控除対象仕入税額の金額のうち、平成２７年課税期間ないし平成３０年課税期間の金額が、原告が平成２７年分ないし平成３０年分の所得税等の確定申告に当たり外注費、その他の経費の各集計メモの記載に基づいて作成した収支内訳書に記載の外注費、地代家賃及びその他の経費の金額（別表１）中の課税取引金額に係るものであり、平成２６年課税期間の金額が、原告の平成２４年分ないし平成３０年分の所得税等についての調査結果の説明書（乙２５）が求めた平均経費率（別表２）を処分行政庁が調査により把握した原告の平成２６年分の売上金額に乗じて得た金額中の課税取引金額に係るものであることは、認定事実\n\n\n（１１）のとおりであるところ、上記の外注費、地代家賃及びその他の経費の金額（別表１）と平均経費率（別表２）を用いて算定された上記の必要経費の金額に誤りがあると認めることはできないことは、上記３\n\n\n（２）のとおりであり、期限後申告書に記載された課税仕入れに係る支払対価の額に誤りがあると認めることはできない。\n\n\n（３）当該期限後申告書の提出により納付すべき税額が過大であるか否かについて原告が令和元年１２月１７日に処分行政庁に対してした平成２６年課税期間ないし平成３\n０年課税期間の消費税等の期限後申告に係る期限後申告書に記載された課税仕入れに係る支払対価の額に誤りがあると認めることはできず、当該期限後申告書に記載された課税仕入れに係る支払対価の額に誤りがあると認めることもできないことは、上記\n\n\n（１）及び\n\n\n（２）のとおりであり、当該期限後申告書に記載した課税売上額及び課税仕入れに係る支払対価の額に誤りがあったことにより、当該期限後申告書の提出により納付すべき税額が過大であるということはできない。\n処分行政庁が原告の平成２６年課税期間ないし平成３０年課税期間の消費税等に係る更正の請求についてした更正をすべき理由がない旨の各通知処分である本件各消費税通知処分は適法である。\n６ 本件各消費税加算税賦課決定の適否原告は、松戸税務署の調査担当職員の勧奨を受けて、令和元年１２月１７日、法定申告期限後に、処分行政庁に対し、平成２６年課税期間ないし平成２８年課税期間及び平成３０年課税期間の消費税等の確定申告をしたのである（別紙２の第２の１\n\n\n（１）ないし\n\n\n（３）及び\n\n\n（５））から、国税通則法６６条１項１号（無申告加算税）の規定に該当し、平成２９年課税期間については、平成３０年５月２９日、法定申告期限後に、処分行政庁に対し、上記課税期間の消費税等の確定申告をし、その後、松戸税務署の調査担当職員の勧奨を受けて、令和元年１２月１７日、処分行政庁に対し、上記課税期間の消費税等の修正申告をしたのである\n（別紙２の第２の１\n\n\n（４））から、国税通則法６６条１項２号（無申告加算税）の規定に該当する。\nそして、原告が、その事業に係る収入金額及び必要経費の金額を正確に把握していたが、職業を無職とし、そのことを前提として、平成２４年分ないし平成２６年分の所得税等の確定申告において、売上金額のごく一部のみを作為的に申告し、収入金額や所得金額を著しく低く装い、平成２７年分ないし平成３０年分の所得税等の確定申告においても、売上金額の相当部分を作為的に除外した集計メモを基に収支内訳書を作成し、意図的に収入金額や所得金額の相当部分が存在しないことを装っていたことは、上記４のとおりである。原告は、平成\n２７年分の所得税等の確定申告の際に、申告書作成会場の職員から、平成２９年課税期間から消費税等の申告が必要になると指導を受けたことから、平成２８年分以降の所得税等の確定申告において、売上金額が１０００万円を超えないよう、売上金の集計メモを作成するに当たり、主な売上先であるＥに対する売上金額を記載した後、他の売上先に対する売上金額を調整し、合計１０００万円を超えないようにして、売上金額を少なく申告していたものであり、平成３０年分の売上金の集計メモの作成の際には、売上金額が１０００万円を超えないようにするため、平成３０年１１月３０日付けのＪ宛の請求書に係る売上金額を計算から除いている（乙５、６）。原告は、平成２６年分ないし平成３０年分の所得税等の確定申告において、売上金額のごく一部のみを作為的に申告し、消費税等の課税売上や課税仕入れを低く装い、平成２６年課税期間ないし平成２８年課税期間及び平成３０年課税期間の消費税等についての申告をせず、平成２９年課税期間については、同課税期間の消費税等の期限後申告において、納付すべき税額を相当に低いものとしていたものである。原告は、平成２６年課税期間ないし平成２８年課税期間及び平成３０年課税期間の消費税等について、当初から確定申告をしないことを意図し、その意図を外部から窺い得る特段の行動をした上、その意図に基づき確定申告をしなかったものであるから、課税標準等又は税額等の計算の基礎となるべき事実の全部又は一部を隠蔽し、又は仮装し、その隠蔽し、又は仮装したところに基づき法定申告期限までに確定申告をしなかったということができるのであり、国税通則法６８条２項の規定に該当し、平成２９年課税期間については、同課税期間の消費税等の確定申告において、当初から課税売上を過少に申告することを意図し、その意図を外部から窺い得る特段の行動をした上、その意図に基づき過少申告をしたものであるから、課税標準等又は税額等の計算の基礎となるべき事実の全部又は一部を隠蔽し、又は仮装し、その隠蔽し、又は仮装したところに基づき期限後申告をしていたということができるのであり、国税通則法６\n８条２項の規定に該当する。\n平成２６年課税期間ないし平成３０年課税期間の消費税等の期限内申告がなかったことについて国税通則法６６条１項ただし書の正当な理由があると認められるものはないから、上記各課税期間の消費税等の期限後申告（平成２９年課税期間については修正申告）に基づく納付すべき税額について、同法６８条２項の規定により、無申告加算税に代え、別紙３（課税処分及び通知処分の根拠）の第２の１ないし５の各\n\n\n（８）及び\n\n\n（９）のとおり、平成２６年課税期間について６０００円の無申告加算税及び３０万円の重加算税が、平成２７年課税期間について１万２０００円の無申告加算税及び１４万８０００円の重加算税が、平成２８年課税期間について１万８０００円の無申告加算税及び８万４０００円の重加算税が、平成２\n９年課税期間について４５００円の無申告加算税及び８万４０００円の重加算税が、平成３\n０年課税期間について１万６５００円の無申告加算税及び１３万２０００円の重加算税が、\nそれぞれ課されるべきであり、その金額は、別紙２（課税処分及び通知処分の経緯）の第２の２の本件各消費税加算税賦課決定（ただし、①平成２７年課税期間及び平成２８年課税期間については、平成２７年消費税加算税賦課決定及び平成２８年消費税加算税賦課決定を吸収した令和２年７月２７日付け無申告加算税及び重加算税の賦課決定の変更決定、②平成２\n９年課税期間及び平成３０年課税期間については、令和２年７月２７日付け無申告加算税及び重加算税の賦課決定の変更決定により減額された後の平成２９年消費税加算税賦課決定及び平成３０年消費税加算税賦課決定。別紙２の第２の４\n\n\n（２））が賦課した上記各課税期間の消費税等についての無申告加算税及び重加算税の額と同額であるから、処分行政庁が令和２年１月２７日付けで原告に対してした平成２６年課税期間ないし平成３０年課税期間の消費税等についての重加算税の賦課決定である本件各消費税加算税賦課決定は適法である。\n\n\n\n\n\n\n第４ 結論よって\n\n\n、本件訴えのうち平成２７年消費税加算税賦課決定及び平成２８年消費税加算税賦課決定の取消しを求める部分は不適法であるから、これを却下し、原告のその余の訴えに係る請求はいずれも理由がないから、これを棄却することとし、主文のとおり判決する。\n\n\n千葉地方裁判所民事第３部裁判長裁判官 内野 俊夫裁判官 塚原 洋一裁判官 内藤 秀介\n\n\n． ・ ． ＇)．． · ． - . ·· -•·. •. . \" ● ' . ・ - ・・ 、.. ., - . ,·- . 、． .. ．， ..． .; ． - 99 → ら •, * • · ー ．ニ · ． • シ ’‘’ . → . • · ・ • 9 9 - . ';. • • • . • ,，• ,. 9,.’- ,. ．． • ， • ← ： と ・ •． ·: 、i · ． · : •. · ‘ , ‘る ・ . 、 . ヽ \" ••冴 .・ ふ ゞ 必 :.. • · ,• . ” · ー . ‘ . • . •”..` ...< _. •、,~•• '•'•9,, • ••• •. . ;· 、 •.•,,,'• 9,, . 9 · ,..、~．*ら9'・-＇心; ｀ •． • 9＂.. ．,．.． ， ．； ：ツ ：， • ； . S・ • : ` :.a . .-,,9.·, 、 ,_...:... • 9 . ●, r ．.←. • ． . 、 9知.．ゞ.ぇ• •\n\n\n. , ' · ヽ. . ．． ·.· .,\n\n\n·':\n\n\n',,ノー ，．\n\n\n．． （別紙 1)\n\n\n・ 9 .-\n\n\n• . ：令 関係法令の定め\n\n\nー所得税法の定め\n\n\n・ ：．．\n\n\n·(1) :· :2 7条 （事業所得）\n\n\n·9\n\n\n6 ア 事業所得とは、農業、漁業、製造業、卸売業、小売業、サービス業その他\n\n\n・·応 ·...” の事業で政令で定めるものから生ずる所得（山林所得又は譲渡所得に該当す •.? •\n\n\n．るものを除く。）をいうQ`(1項）\n\n\n．．\n\n\n●9 . , . イ 事業所得の金額は、その年中の事業所得に係る総収入金額から必要経費を\n\n\n• �\n\n\n' •、\n\n\n.\n\n\nJ , ; .\n\n\n.9\n\n\n.\n\n\n.\n\n\n. ‘' .い. ． . ふ ., .. ． 租 . 入 , � ． . J．\n\n\n『.\n\n\n\"\n\n\n{\n\n\n．\n\n\n.\n\n\n'\n\n\n,.\n\n\n..' J ].� `’ ●t し · , . .、 ,5 、 . � • �\n\n\n． �\n\n\n3ゎ｀ グ ．． ナ 9.\n\n\n.\n\n\n� � ~ .\n\n\n.\n\n\n. .\n\n\n. .\n\n\no ,� ん‘、 ’ �'・\n\n\n.\n\n\n‘ ● . - , , ’ . ',. ． ． r \" ? 、 d J 1 0 . · . ． ． ．9 1 ． . .‘ '. • (\n\n\n,\n\n\n2 ·'· ア )\n\n\n'に\n\n\n,9 控 3 そ 除算\n\n\n6条 の入すし 年 た （ 分 収 金べ\n\n\n入 の 額き\n\n\n各 金金\n\n\nと 種 額 す額\n\n\n） 所は\n\n\nる 得 。 •\n\n\n、 別\n\n\n·. の • . ( し 金額 · '2段\n\n\n: :: 項 •の\n\n\n· P ;··.< の定\n\n\n） :_-・． 計 •め\n\n\n':: ． . t ` 算 嗜が\n\n\n.: . <•, 上 \\あ\n\n\n\\ ：文 . : , . 収 .·る\n\n\n、, . { ..., . 入 .も\n\n\n. · : : 金 .の\n\n\n額を\n\n\n. と除\n\n\n. • ずき\n\n\n.く\n\n\nべ , 'そ\n\n\n: · き : · < 金の\n\n\n)年\n\n\n? 額 ’ / }ぢ 又に\n\n\n・ は 、\n\n\nお\n\n\n、 ’ 総い\n\n\n収て\n\n\n.. ｀ 入収\n\n\n. 金入\n\n\n額す ｀\n\n\n／\n\n\n,\n\n\n•\n\n\n.:\n\n\n＇う\n\n\n,\n\n\n.\n\n\n}\n\n\n〉\n\n\n··\n\n\n． \"● ··\n\n\nt ．.、 ,. ·\n\n\n.\n\n\n, ,, �\n\n\n..\n\n\n. . � - ． . f、 - ·\n\n\n. ぃ\n\n\nJ 洛 ．． 、 ． ． ． ． ． , 9 9 A ． ． , . : '\n\n\n. .\n\n\n．\n\n\n- ． ft2 ． ． ＇ ＂ ． ． ． ．\n\n\n．\n\n\n．\n\n\n. . ‘\n\n\n.\n\n\n.\n\n\n、 .\n\n\n.\n\n\n,● ● ● , .’.• ,9 •,. .\n\n\n.\n\n\n9 { 9\" ' 1 . r · 5 、． ．.9 ·.,.: (3 ＇・イ ア ) 9 ： 9 3べ\n\n\n項 に ： 9 • 7 そ は ） 2き\n\n\n条 部金\n\n\nの 、\n\n\n額そ 年 、（ 3 必 分 の\n\n\n（項 要 の金\n\n\n金 不 経銭\n\n\n銭 ·（ 動 ， 費 省以\n\n\n以 、 ） 産 略外\n\n\n外 所の\n\n\n） の 得 ．物\n\n\n物 ． 9 ． `又\n\n\nの 又 • ; � • 金 、:は\n\n\nは : __ 、 : ·; ど 額権\n\n\n: 権 = . - :,·:利\n\n\n， 、 .: 事 利 .::そ\n\n\nそ : ' .\\ .¢の\n\n\n業 の ; ‘ / .’ ; ; 所 •他\n\n\n: : : 他 9 : ; . ,\\ 9 得経\n\n\n. 経 . - : :済\n\n\nの 9 済 金的\n\n\n的 : . 額な\n\n\nな利\n\n\n又 • 利 • : :, · は益\n\n\n益 ..: , , ' · 雑を\n\n\n、. の '.( • 所 価も\n\n\n: 公っ\n\n\n得 • 額 ·.て\n\n\n） の • 金収\n\n\nと •• 額入\n\n\nす ,’.•す\n\n\nる • ,• （ 括る\n\n\n。 弧場\n\n\n.( 内合\n\n\nー ． l . J‘ . , 、 . - � 、 - ― ． ． ． ． ． ， ． ． ― - · · : . 2 ` . , . - . ．．省略）の計算上必要経費に算入すべき金額は、別段の定めがあるものを除き、\n\n\nこれらの所得の総収入金額に係る売上原価その他当該総収入金額を得るため直接に要した費用の額及びその年における販売費、一般管理費その他これらの所得を生ずべき業務について生じた費用（償却費以外の費用でその年におぃて債務の確定しないものを除く。）の額とする。 (1項）\n\n\n’イ ・・2項（省略）\n\n\n25 2 消費税法の定め\n\n\n(1) 2条（定義）\n\n\n....•\n\n\n·_,.;\n\n\nx． ふ．． ．．．.．.、 ,.. ·、·．，． ヽ·••ク·• • ~• • .,..`”`―....“’ • ヽv.., 9 .- ヽ ・． ． ．． ． ．． ． ー．．． · →,' . ― ヽ· →• • : ;.. 書. ・・ ・・・ · •'·- �,- ., ,・ ,.-- ―• ← • ;、 • ...9 9 ‘ ..;..,•.` . • • :· • • . ·:. ●•` 、、’·―· m.:f•’ヽ：．ーかぶぷみ‘:.. ::`.;:._・ぶ．公、： ．，，． ． “：ぷ？，ぶ此＇よ—t：二均：： 2 ．咲・、＿．：心ヰぷ厄 9 ：：ーー・・ .9 ．‘r『 ヽ\n\n\n. .\n\n\nf\n\n\n．ヽ一\n\n\nァ 当該各号に定めると\n\n\n.,_..\n\n\n·- 心 :•\n\n\n｀\n\n\n．・．．三 ． .ヽ ・•. <•’ •・•' . •. . ·\n\n\n□四\n\n\nヽ ． ' - ..\n\n\n:· •\n\n\n•{ • 1 し 9 ' ．． ． ，•． ::\n\n\n• ,•9• •.\n\n\n,． ：\n\n\n. ． • . .1 0. :., • •• •• . ' •. ·. · . '.\n\n\n. . :,\n\n\n．\n\n\n．\n\n\n．\n\n\n，．・・ ヽ\n\n\n．\n\n\n..9\n\n\n.．\n\n\n．\n\n\n＇ ・ぃ , .\n\n\n...\n\n\n.\n\n\n•9暴5\n\n\n＇\n\n\n●.\n\n\n. ．\n\n\n. ． ' ●\n\n\n.\n\n\n．.\n\n\n． . .\n\n\n．．. .\n\n\n．\n\n\n． ..\n\n\n．. :\n\n\n·\n\n\n.,\n\n\n....\n\n\n.\n\n\n.\n\n\n9.\n\n\n,\n\n\n....·\n\n\n.この法律において、次の各号に掲げる用語の意義は、\n\n\nころによる。 (1項）\n\n\n. • •\n\n\n., 9\n\n\n,\n\n\n3.\n\n\n.\n\n\n'\n\n\n.\n\n\n•(- i' ,• __ .\n\n\n. ` ‘\n\n\n•\n\n\n2()イ\n\n\n・\n\n\n(2)\n\n\nー 、 二 （ 省 略 ） ・個人事業者事業を行う個人をいう。\n\n\n事業者個人事業者及び法人をいう。\n\n\n、\n\n\n． 四の二ないレ七（省略） ．八 資産の譲渡等事業として対価を得て行われる資産の譲渡及び貸付け並\n\n\n．びに役務の提供（括弧内省略） をいう。 •.· ·： ：松••::. ● 9 ,’·· • 9. ,八 の 二 な い し 五 （ 省 略 ） ．九 課・ 税資産の譲渡等資産の譲渡等のうち、 6条1項の規定により消費税\n\n\n： を 課 さ な い こ；＇ と と さ れ る も の 以 外 の も の を い う 。\n\n\n:f:/: .._. .\n\n\n＼·::::、’•\n\n\n• + +-'\n\n\n、 ．（． 省略）\n\n\n十二課税仕入れ事業者が、・事業として他の者から資産を譲り受け、若しくは借り受け、又は役務の提供（所得税法28条1項（給与所得）に規定\n\n\n｀ する給与等を対価とする役務の提供を除く。）を受けること（当該他の者が事業として当該資産を譲り渡し；若しくは貸し付け、又は当該役務の提供 を し た と し た 場合 に 課 税 資 産 の 譲 渡 等 に 該 当 す る こ と と な る も の で\n\n\nr 1.条1項各号に掲げる資産の譲渡等に該当するもの及び8条1項その他の法律又は条約の規定により消費税が免除されるもの以外のものに限る；）を\n\n\n・しヽう。\n\n\n十三ないし二十（省略）\n\n\n2項、. 3項（省略）\n\n\n2 8 条 ・（ 課 税 標 準 ）\n\n\nア 課税資産の譲渡等に係る消費税の課税標準は、課税資産の譲渡等の対価の額（対価として収受し、又は収受すべき一切の金銭又は金銭以外の物若しくは権利その他経済的な利益の額とし、課税資産の譲渡等につき課されるべき\n\n\n,,''ヽ':•’:.’•’' : • •9 - ・｀ 、 , .’ • ·, ' ,c · ,,' : _.; :· ·/ •會; 9 : . : 9 - _ • . · · ● , ,. ·. � :、 ● ・ • ロ、,•・ ・ ＂ • · : 、• ··· ~. · .· . • . 一 • - - .ギ :.; “ · - - ヽ• --� •.・•・ ＇．、, -:.． .,_.• : •ヽ'．．.． . , · ,，．..．· ．..·.·:·.., . .: 事-� ―•-土:: • ． •.. •． ;し . ·｀古 ェ 4 • そ' ・ ‘- ·， • ← •.9•-.0 - .• ..』­.. ヽ， • 9. ·..\n\n\n. :\n\n\n- .\n\n\nヽ .•. ·\n\n\n• • • � ·.: \" · e c ·-r\n\n\n'.:,·•, . .··\n\n\nIi . (3)\n\n\n'\n\n\n,.•·-.\n\n\n...., . • •:\n\n\n―\n\n\n：：．・．．：\n\n\n:9\n\n\n.: '.. · •.. •\n\n\n・\"·: . ，．\n\n\nヽ •· ' ．・ ;、.: 9 ： ． ， 、 ヽ ．． ： そ．．・ ·· ―·;· • :..:;,ヽ：••\n\n\n(”`.{K •9. :. .., ' : ’.•, ,· ?.\n\n\n, 、 ' : ’` . :, ' .` ' ·\n\n\n9 • '.·. ,: ·...-;. • .• . :;\n\n\n••• :·.. 9 : .' , •.. : . : t: :, :\n\n\n, . •9 1 0 ,';9: 9,’•. . :· • 9\n\n\n‘‘.:\n\n\n'• ·--� :·. ' . ' ,, .\n\n\n.•· ••. . 9 ; '9 , : , ．． ．． •.\n\n\n.\n\n\n.．\n\n\n..\n\n\n：:\n\n\n.ょ ヽ • •―.·•·. .・· •. • .. ·4.. • ‘ :、 `\n\n\n; •.·\n\n\n• .\n\n\n.,,\n\n\n•. � '. · : •, ' ­\n\n\n. - ;\n\n\n. .\n\n\n• ·• • .'\n\n\n- '\n\n\n．、\n\n\n， ． ．．i :・・-··: :-ヽ・;·:� .\n\n\n`\n\n\n15 ...:•.\n\n\n: 5 . .·· · ··• ' ·; • ' . ;: • ·• · • ••. :\n\n\n:· . -. 、 <消費税額及び当該消費税額を課税標準として課されるべき地方消費税額に相当する額を含まないものとする。以下この項及び3項に· おいて同じ。）とすイ\n\n\n.· . :,. : ·••-.· ,: • ·'·-,.: -; ·: 3 (・し • ． 1 •• 、 • C �' •.' ． ;. .\n\n\n．．\n\n\n' ··.、\n\n\n�\n\n\n.,ア\n\n\nイる 。\n\n\n2 項\n\n\n（な\n\n\nた だい しし 書\n\n\n4 項省 略\n\n\n（\n\n\n）\n\n\n省 略\n\n\n（\n\n\n）\n\n\n’．項 ）\n\n\n.\n\n\n, • ．\n\n\n、..\n\n\n•.’ .\n\n\n..\n\n\n•\n\n\n:\n\n\n3 0条（仕入れに係る消費税額の控除）．事業者（括弧内省略）が、国内において行う課税仕入れ（中略）については、次の各号に掲げる場合の区分に応じ当該各号に定める日の属する課税期間の 4:5 条1項2号に掲げる課税標準額に対する消費税額（以下この章において「課税標準額に対する消費税額」：どいう5)から、当該課税期間中に国\n\n\n．．さ．：：．．．· •'内において行った課税仕入れに篠る消費税額（当該課税仕入れに係る支払対｀価の額に100分の7.8を乗じて算出した金額をいう。以下ごの章において\n\n\n： 、\n\n\n同じ。） （中略）につき課された又は課されるべき消費税額（附帯税の額に相当する額を除く。次項において同じ。）の合計額を控除する。 ． （1 項 項）\n\n\n＿ ・ 国 内 に お い て 課 税 仕 入 れ を 行 っ た 場 合 当 該 課 税 仕 入 れ を 行 っ た 日ニない U 四（省略） ． ． 9, ．．．．．応， ．｀\n\n\n• ·.. < :•••ど芯' •'·\n\n\n： 2項ないし1 0項（省略） ・・ ヤ：9, ヘ・ ：国 税 通 則 法 の 定 め ‘ ヽ ： `‘ , : . ' . ’:・ ·ざ： ‘ •· べ ・ 』 .•· : 9・ー ； 9 、 : 、: '9 . ' · 色ア\n\n\n：．； ． ．：'• ·:.: .:, , ． ． ・ば\n\n\n(1) i 7条 （期限内申告）\n\n\n申告納税方式による国税の納税者は、国税に関する法律の定めるところにより、 納税申告書を法定申告期限までに税務署長に提出しなければならなィ\n\n\n.(2項）\n\n\n'\n\n\n(2),邸\n\n\nV• 。ヽ • (、• 1 項 ） ．前項の規定により提出する納税申告書は、期限内申告書という。\n\n\n．\n\n\nl.8条（期限後申告）．ア 期限内申告書を提出すべぎであった者（括弧内省略）は、その提出期限後においても： 2 5条（決定）の規定による決定があるまでは、納税申告書を\n\n\n•(1項） 税 務 署 長 に 提 出 す る こ と が で き る 。\n\n\n'• '、卜—•企，．f .9:. ムぷ．と註．；：一．：：．．：：p．', ti.}·，Y ;:~·¢←.、;••こ4ぷ ：・ ふ ・ベ ． ．．匁五：ぷ応，．． ，． .,cc, 函； ・ よ � ’i,:m.、仁をさと｀•： •5...`ぶ ;9,. :_;;••:`` i’ 9, •ンぷ叱沿必•:ぎ ， ｝．，r尤•ぷ‘'屯；ら．． 9••5 こ硲；，ぶぷ：．\n\n\n．\n\n\n., ． ． , . ． ． , .\n\n\n、\n\n\n．\n\n\n\" ．イ 前項の規定により提出する納税申告書は、期限後申告書どいう。 (2項）\n\n\n・ウ 3項（省略）\n\n\n(3) 1 9条（修正申告）\n\n\nア 納税申告書を提出した者（括弧内省略）は、次の各号のいずれかに該当す\n\n\n6 ＇る場合には、その申告について2·4条（更正）の規定による更正があるまで\n\n\n．\n\n\n． ，＇は、•その申告に係る課税標準等(2条6号イからハまで．（定義） に掲げる事\n\n\n―·: :: · • • ．項をいう。以下同じ。）又は税額等（． 同号二からへまでに掲げる事項をいう。．．＇．\n\n\n,｀う\n\n\n．\n\n\nt ·\n\n\n.\n\n\n•• 以 下 同 じ 。 ） を 修 正 す る 納 税 申 告 書 を 税 務 署 長 に 提 出 す る こ と が で き る 。 ( 1\n\n\n・項） ．，\n\n\n1 0 •• • • 、\n\n\nー先 の 納 税 申 告 書 の 提 出 に よ り 納 付 す べ き も の と し て こ れ に 記 載 し た 税 額 ．，\n\n\n．\n\n\n\\;.. ， に不足額があるとき。\n\n\n. ..\n\n\n・・ ニないし四（省略）\n\n\n., イ 2 項 （ 省 略 ） .． .• • .:\n\n\n． ·· • ;'\n\n\n· . .\n\n\n• ，， •.. • • • ．, • 9 •• . .● . •\n\n\n. ．． . ． ． ｀魚 • •• •· .� ·.\n\n\n• 9 .\n\n\n' ' . ： ヽ ， ， ＇ヽ• ヽ ． 9,’\n\n\n.: .\n\n\n・ ・ウ 前2項の規定により提出する納税申告書は、修正申告書という。\n\n\n�1 ．・ メ， エ ． 4 項 （ 省 略 ） · ．\n\n\n(3項 ． ．、）\n\n\n_ .\n\n\n．\n\n\n••. (4}. 2 3条（更正の請求）• .'::.:'.· i; •.··\n\n\n·じ\n\n\nア 納 税 申 告 書 を 提 出 し た 者 は 、 次 の 各 号 の い ず れ か に 該 当 す る 場 合 にば 当、 · .·. .· :.·· 、\n\n\n該申告書に係る国税の法定申告期限から5年（括弧内省略）以内に限り、税．\n\n\n＇務署長に対し、その申告に係る課税標準等又は税額等 （当該課税標準等又は\n\n\n‘税額等に関し次条又は26条（再更正）の規定による更正（以下この条にお\n\n\n．いて「更正」という。．）があった場合には、、当該更正後の課税標準等又は税\n\n\n．｀額等）につき更正をすべき旨の請求をすることができる。 (1項） ．．． ．\n\n\nー 当該申告書に記載した課税標準等若しくは税額等の計算が国税に関する·\n\n\ns法律の規定に従っていなかったこと又は当該計算に誤\n\n\nりがあっt ことによ\n\n\n26 り、当該申告書の提出により納付すべき税額（当該税額に関し更正があった場合には、当該更正後の税額）が過犬であるとき。\n\n\n•\n\n\ni\n\n\n・・． ぷ . - ・•· ヽ • , — .; L :• . •・．？ . 氏． ..., . ：： 9 .▼日 ‘← ， ― ．-··· ` ·· . · c： ·· 一 · 』 · 、 ·· ，• · - '··· り・． . ．．．よー・←一 . -L . �.. � . ~ . '· • . こ . 、―‘ーッ・ 1 ·• • ’ • ' ＇^ . ． , '1 工i . · , - ― -' . ．\n\n\n．ぷ i『lヽ 1. i -t● ＝ ―転竺 ， ． p , ， , · i , l :.9 . , ' · , ． ． ^ ・ ー・ ‘ ’ , . 五でムL1 ． ， ， ‘. ' ‘ ， ｛ ヽ ． 3 ].i,}» i 1•· ~．． ． 『 , ' ` ー ・ 疇，\n\n\n，\n\n\n' ｀ '. 工\n\n\n.\n\n\n，｀ ,\n\n\n．\n\n\n． .\n\n\ni\n\n\n,二｀ 三（省略）\n\n\n.·,\n\n\n．\n\n\n•イ．2項、 3項（省略）．．．ウ；税務署長は、更正の請求があった場合には、その請求iこ係る課税標準等又は税額等について調査し、更正をし、又は更正をすべき理由がない旨をその請求をした者に通知する。 (.4項）\n\n\n• ・工 5項ないし7項（省略）．\n\n\n.`\"9, �\n\n\n. . t ｀ � 9 · ’9 9 ．． 、． � 9 9 9 5 9 | 65条（過少申告加算税）\n\n\n,• �-. 7·▼ • .. • � .\n\n\n[\n\n\n. � 、 .\"� ., 9 'ア 期限内申告書（括弧内省略）が提出された場合（括弧内省略）において、\n\n\n＇, ‘., • ．\n\n\n. . \"\" . '. ,· な 修正申告書の提出又は更正があつだとぎは、当該納税者に対し、その修正申\n\n\n‘ p �・ ] 9,. . 告又は更正に基づき 3, 5. 条 2 項（期限後申告等による納付）の規定により納\n\n\n: , •� ., ヽ·9▼ ・ • 9\n\n\n�\n\n\n. ● \" �\n\n\n●\n\n\n● ● ’ ・ ・ ・\n\n\n・\n\n\n9·\n\n\n.\n\n\n.\n\n\n.\n\n\n● ●\n\n\n'\n\n\n9\n\n\n'\n\n\n.\n\n\n.\n\n\n．\n\n\n．\n\n\n． ．\n\n\n． ．＾\n\n\n．\n\n\n．\n\n\n.\n\n\n.\n\n\n.\n\n\n. 9\n\n\n.�\n\n\n●’\n\n\n..\n\n\n. ·\n\n\n·\n\n\n. .\n\n\n.\" , . .\"\n\n\n, ' ． ． ぃ\n\n\nゞ \"\n\n\n．\n\n\n. .\n\n\n.. ,ィ\n\n\nウ付 に次\n\n\n·相\n\n\nす項\n\n\nの当 べ各\n\n\n、\n\n\nす\n\n\n•き\n\n\n号税額 る項\n\n\nに過\n\n\n掲\n\n\n（少 にげ\n\n\n省申 1略\n\n\nる告 0場\n\n\n加\n\n\n）\n\n\n． ． ．合\n\n\n分 算税に\n\n\nのは\n\n\nを J\n\n\n、\n\n\n· 課 _oの ず項\n\n\n割 るo 合又は\n\n\n． ( （括\n\n\n1項\n\n\n項 弧に\n\n\n内 ）\n\n\n規省 ＇定\n\n\n略）\n\n\nすを\n\n\nる納乗\n\n\n付じ\n\n\nすて\n\n\nべ計算き税した額\n\n\n金から額\n\n\n．\n\n\n15 当該各号に定める税額として政令で定めるところにより計算した金額を控除\n\n\n\"して、これらの項の規定を適用する。 • (4項）\n\n\n-:::- 1項又は2項に規定する納付すべき税額の計算の基礎となつた事実のう\n\n\n・；\n\n\n( :! .- —`,· ー・・\n\n\n．｀尋� ちにその修正申告又は更正前の税額（括弧内省略）の計算の基礎とされていなかったことについて正当な理由があると認められるものがある場合 当\n\n\n·20 ,該期限内申告書に係る税額（括弧内省略） に達するまでの税額二（省略）\n\n\nこ 5項（省略）\n\n\n’\n\n\n(6)..6. 6条（無申告加算税）\n\n\n｀ア 次の各号のいずれかに該当する場合には、·当該納税者に対し、当該各号に規定する申告、更正又は決定に基づき3.,5条2項（期限後申告等による納付）\n\n\nの規定により納付すべき税額に1 0 0分の1 5の割合（括弧内省略）•'を乗じ\n\n\n:;·-,:·..-•:― ., ..:' t、：．：心；！ ．｀：に•ふや．．；，ぢ：立f·•:· し ． ．． ． 2•,， ．ぷ硲ふ．．竿 、 ．r； ··;L ヽ ． ． ． ぷ：；・ダこ｀ふが比・一；：むふ,;.,ヽ・ベ·',;:、··••ぶ•ご;:.ょ 古よな，・ぶ．..-d,·.�；ふー•<\"‘年•元・唸応．＾ ヽ•こ一心・｀心“•9‘‘^`\n\n\n． ． ，．て計算した金額に相当する無申告加算税を課する。ただし、期限内申告書の提出がなかつたことについて正当な理由があると認められる場合は、この限\n\n\n9 ．りでないb : (1項） ．．\n\n\n....:.. 期限後申告書の提出又ぱ25条（決定）の規定による決定があった場合\n\n\n・\n\n\n5 二 期限後申告書の提出又は2·5条の規定による決定があった後に修正申告書の提出又は更正があった場合\n\n\n，イ 2項ないし4項．（省略）．·:.,\n\n\n・ ウ前条4項の規定は、1項2号の場合について準用する。 (5. 項）\n\n\nA.．t 1\n\n\n'.ゃ ．\n\n\n． ． ． ． ` .\n\n\n.\n\n\n‘ 9 . ヽ ． ．\n\n\n.\n\n\n． ．\n\n\n.\n\n\n.\n\n\n.\n\n\n，\n\n\n. .\n\n\n.\n\n\n.\n\n\n10, ． ， ． .• : • (7 ア ) 工い\n\n\n6. 6 8て\n\n\n6 条 5 項\n\n\n、\n\n\n条 、\n\n\n納\n\n\n（ 7税\n\n\n1 重 項者\n\n\n項 加算が\n\n\n（・ （ 税 過そ\n\n\n省略の\n\n\n少 ） 申 ）\n\n\n国告\n\n\n税の加算課税税）\n\n\n標準\n\n\n． の規等又定には税該\n\n\n額当す等のる場計算の合（基\n\n\n括礎\n\n\n弧内と\n\n\n� ・． ．な\n\n\n省 ． ． 略 .る\n\n\n． ． ）\n\n\nべ\n\n\nd にぎ\n\n\n． お事\n\n\n， 9 ． . ． ． ． ． · · ． ． ． ． ． ． ． ， 9ヽ , ` .’●● ‘\n\n\n・ ・\n\n\n．．\n\n\n.\n\n\n.\n\n\n.\n\n\n.\n\n\n.\n\n\n.\n\n\n.. 実の全部又は一部を隠蔽し、又は仮装し、その隠蔽し、又は仮装したところ\n\n\n・・．\n\n\n． ． ．\n\n\n.\n\n\n.\n\n\n.\n\n\n. .\n\n\n.\n\n\n.\n\n\n.．.\n\n\n' ● に基づき納税申告書を提出じていたときは、当該納税者に対し、政令で定め\n\n\n, ； るところにより、過少申告加算税の額の計算の基礎となるべき税額（その税 • 4\n\n\n',15\n\n\n. ;\n\n\n． “\n\n\n. 額の計算の基礎となるべき事実で隠蔽し、又は仮装されていないものに基づ ．くことが明らかであるものがあるときは、当該隠蔽し、又は仮装されていな\n\n\n：＇し．ノ\n\n\nい事実に基づく税額として政令で定めるところにより計算した金額を控除した税額）に係る過少申告加算税に代え、当該基礎となるべき税額に1·00分\n\n\n•\n\n\nP\n\n\n,20· の 5の割合を乗じて計算した金額に相当する重加算税を課する。 (1項）．イ 66条l•項（無申告加算税）の規定に該当する場合（： 括弧内省略）において、納税者がその国税の課税標準等又は税額等の計算の基礎となるべき事実の全部又l、ま一部を隠蔽し、又は仮装し、その隠蔽し、又． は仮装したところに基づき法定申告期限までに納税申告書を提出せず、又は法定申告期限後に納税申告審を提出していたときは、当該納税者に対し、政令で定めるところに\n\n\n、より、無申告加算税の額の計算の基礎となるべき税額（その税額の計算の基\n\n\n｀\n\n\n• !•' .,., , ・•. � - • • ·9 , . 「 ・ー 一 . ． 、 ． ‘ . 冷 \" .. か9 ― .5 · 勺 •・ ， ・ ． ・．．＾“ ' ，． . -• ． • ． · ．’ . →• ; • • - -• - «,· → : .. ー、： 9 貨：：・‘．： ー,・-・�: ・ · \"·_- . ら ·、 .9 _` � A ” ' 、 . 9: 、· •マ•7.: .',. 9, 9 ;:_ .•';. · ．礼r . ,．7', •: ． 9 ,.. ：．ぷ込a:'ヽ；；．：‘‘’•. ;• 心，9，..;..;；ら1;.;• · •.\n\n\n. , •疇\n\n\nヽ．\n\n\n、．\n\n\n．\n\n\n， 礎となるべき事実で隠薇し、又は仮装されていないものに基づくことが明らん かであるものがあるときは、当該隠蔽し、又は仮装されていな：い事実に基づく税額として政令で定めるところにより計算じた金額を控除した税額）に係\n\n\n.\n\n\n..\n\n\n・ よ る無申告加算税に代え、当該基礎となるべき税額に1 0 0分の4.0の割合を ,. ;.\n\n\n.・\n\n\n6 '. 、 乗じて計算した金額に相当する重加算税を課する。 (2項） ＇\n\n\n，・・ ． ・ ウ 3 項、4項（省略） ｛·-· ，． ；．．． ． ．． ＇、．：．．． ’·\n\n\n．\n\n\n．\n\n\n：\n\n\n'(8} 7. o条（国税の更正、決定等の期間制限）\n\n\n．\n\n\n．．\n\n\n． � ． 、, . V .. 9 •«さ 4, ィ ア ｀ 次 1 の 項 各 な 号 いし に掲 3項 げる 償 更 省賂） 正決定 ． 等は、1項 ， 又 ． は前 ． 項の 、 規 ・＜ャ 定 · に 、 か 9 かわらず�·,1項 ・\n\n\n．．\n\n\n10 舒．．、 各号に掲げる更正決定等の区分に応じ、同項各号に定める期限又は日から•7 ：、\n\n\n項）．．．\n\n\n, t・：乃\n\n\n.‘\n\n\n; 年を経過する日まで、することができる。 (4\n\n\n’ ．\n\n\n『 ．’ ● ． ．． .f •ヽ · .t. · · · 口：：． 9, ・ ニ 偽りその他不正の行為によりその全部若しくは一部の税額を免れ、又は ．．\n\n\n． t 9\n\n\n』�\n\n\n,\n\n\n•\n\n\n• , . .\n\n\n. 9\n\n\n\"\n\n\n.\n\n\n． ．． ． ●’ ● ●\n\n\n’ �\n\n\n.. ‘ ●\n\n\n· ‘ ． ． . .\n\n\n3.\n\n\n． ．· · ヽ• '\n\n\n•\n\n\n,\n\n\n· 1\n\n\n.\n\n\n6 • . -. / マ ;\n\n\n•\n\n\n: :. • ' ＿ ． : ； ·\n\n\n•\n\n\n: : '\n\n\n.咬 •• 、 .;.\n\n\n•\n\n\n・ , . 3 ニ ` : ； 及そ\n\n\n. 三 . : びの\n\n\n全\n\n\n過 （省 怠部\n\n\n略 税若\n\n\n. } ） . を .し\n\n\n. ． .. 、 , 含く\n\n\n. T ＇ • ；は\n\n\nむ :. : . 。\n\n\n一\n\n\n） ・ fく部\n\n\n．． • に •の\n\n\n; . つ ．． . ： · . 翠 . 9 ,税\n\n\n• , . / . い額\n\n\n: : > , ての\n\n\n. _'. の還\n\n\n'; . 更付\n\n\n· 正 :を\n\n\n決受\n\n\n'i 定 .け\n\n\n, 、 , , 等 占た\n\n\n· 9 : •· , , -� 国\n\n\n, ぐ . : ·税\n\n\n. 、• : ; : 、· . :\n\n\n（\n\n\n:\n\n\n．\n\n\n; : • / ` • ·当\n\n\n: ン \\ : : ｀ 該\n\n\n,国税に係る加\n\n\n． . ­ `『 � ·`· �.算\n\n\n． ． ． ． ． ． ． ` ;税\n\n\n， ． ． � ． ． ; \" `. . ． ▲ ． ． ． r べ ． ． ； • � · ． ． � ヽ · · · △, •. ‘ ‘ . 、 ： ' ， ． ， . ．．ヽ ．り ’.., ” . ' ー • : � ． � ； ． ．\n\n\nt\n\n\n． ，\n\n\n]'.\n\n\n． ^\n\n\n:..: .,\n\n\n: ' ; :· •\n\n\n. •.\n\n\n•\n\n\n.\n\n\n,.' : . •❖ ...· ·. . •. . ,, . `· 、 •';\n\n\n·. ，\n\n\n..、 .\n\n\n'.'\n\n\n（別紙２）\n\n\n課税処分及び通知処分の経緯\n\n\n\n\n\n\n第１ 所得税等関係\n\n\n１ 確定申告（期限内申告）\n\n\n（１）原告は、法定申告期限までに、処分行政庁に対し、総所得金額６４万４３７６円（事業所得の金額０円、雑所得の金額６４万４３７６円）、所得控除の額の合計額１３８万９８３７円、課税総所得金額０円、課税総所得金額に対する税額０円、納付すべき税額０円とする平成２４年分の所得税の確定申告をした。原告は、この確定申告に係る確定申告書において、\n職業を無職とした上、雑所得（公的年金等以外）の収入金額１２０万円、雑所得に係る必要経費等の金額７４万５３５６円としていた。（乙８の１）\n\n\n（２）原告は、法定申告期限までに、処分行政庁に対し、総所得金額６７万２００７円（事業所得の金額０円、雑所得の金額６７万２００７円）、所得控除の額の合計額２５５万１１１０円、課税総所得金額０円、課税総所得金額に対する税額０円、復興特別所得税額０円、納付すべき税額０円とする平成２５年分の所得税等の確定申告をした。原告は、この確定申告に係る確定申告書において、職業を「なし」とした上、雑所得（公的年金等以外）の収入金額\n１３８万円、雑所得に係る必要経費等の金額８９万５２７４円としていた。（乙８の２）\n\n\n（３）原告は、法定申告期限までに、処分行政庁に対し、総所得金額６４万２３９３円（事業所得の金額０円、雑所得の金額６４万２３９３円）、所得控除の額の合計額１０９万９８９１円、課税総所得金額０円、課税総所得金額に対する税額０円、復興特別所得税額０円、納付すべき税額０円とする平成２６年分の所得税等の確定申告をした。原告は、この確定申告に係る確定申告書において、職業欄を空欄とした上、雑所得（公的年金等以外）の収入金額１\n３６万円、雑所得に係る必要経費等の金額７１万７６０７円としていた。（乙８の３）\n\n\n（４）原告は、法定申告期限までに、処分行政庁に対し、総所得金額８２万３５３０円（事業所得の金額５２万３６０２円、雑所得の金額２９万９９２８円）、所得控除の額の合計額５５万７２１５円、課税総所得金額２６万６０００円、課税総所得金額に対する税額１万３３０\n０円、復興特別所得税額２７９円、納付すべき税額１万３５００円とする平成２７年分の所得税等の確定申告をした。原告は、この確定申告に係る確定申告書において、職業を建設業とした上、この確定申告に係る確定申告書に添付したその事業に係る収支内訳書（乙１８の\n１）において、売上金額１０３３万４１３２円、経費のうち、外注工賃７１８万２２５０円、\n地代家賃７４万円、その他の経費１８８万８２８０円、所得金額５２万３６０２円としていた。（乙８の４）\n原告は、平成２８年４月２８日、処分行政庁に対し、確定申告書の生命保険料控除の金額の記載に誤りがあったことを理由として、平成２７年分の所得税等について、総所得金額８\n２万３５３０円（事業所得の金額５２万３６０２円、雑所得の金額２９万９９２８円）、所得控除の額の合計額５９万４００５円、課税総所得金額２２万９０００円、課税総所得金額に対する税額１万１４５０円、復興特別所得税額２４０円、納付すべき税額１万１６００円とする更正の請求をした。（乙１９）\n処分行政庁は、平成２８年６月１６日付けで、原告に対し、平成２７年分の所得税等について、総所得金額８２万３５３０円（事業所得の金額５２万３６０２円、雑所得の金額２９万９９２８円）、所得控除の額の合計額５９万４００５円、課税総所得金額２２万９０００円、課税総所得金額に対する税額１万１４５０円、復興特別所得税額２４０円、納付すべき税額１万１６００円とする更正をした。（乙２０）\n\n\n（５）原告は、法定申告期限までに、処分行政庁に対し、総所得金額１０３万５６８９円（事業所得の金額１０３万５６８９円、雑所得の金額０円）、所得控除の額の合計額１３５万４８\n１１円、課税総所得金額０円、課税総所得金額に対する税額０円、復興特別所得税額０円、\n納付すべき税額０円とする平成２８年分の所得税等の確定申告をした。原告は、この確定申告に係る確定申告書において、職業を建設業とした上、この確定申告に係る確定申告書に添付したその事業に係る収支内訳書（乙１８の２）において、売上金額９１３万１０３０円、\n経費のうち、外注工賃５５８万５０００円、減価償却費５４万円、地代家賃７４万円、その他の経費１９７万０３４１円（１２３万０３４１円の誤記）、所得金額１０３万５６８９円としていた。（乙８の５）\n\n\n（６）原告は、法定申告期限までに、処分行政庁に対し、総所得金額１５４万７６１８円（事業所得の金額１２４万４５０１円、雑所得の金額３０万３１１７円）、所得控除の額の合計額\n１４２万９５２６円、課税総所得金額１１万８０００円、課税総所得金額に対する税額５９\n００円、復興特別所得税額１２３円、納付すべき税額６０００円とする平成２９年分の所得税等の確定申告をした。原告は、この確定申告に係る確定申告書において、職業を建設業とした上、この確定申告に係る確定申告書に添付したその事業に係る収支内訳書（乙１８の３）\nにおいて、売上金額７９７万９７６５円、経費のうち、外注工賃４５２万４４０５円、減価償却費２５万円、地代家賃６８万円、その他の経費１２８万０８５９円、所得金額１２４万\n４５０１円としていた。（乙８の６）\n\n\n（７）原告は、法定申告期限までに、処分行政庁に対し、総所得金額８５万７８９４円（事業所得の金額５５万５２２６円、雑所得の金額３０万２６６８円）、所得控除の額の合計額１３\n６万５４７０円、課税総所得金額０円、課税総所得金額に対する税額０円、復興特別所得税額０円、納付すべき税額０円とする平成３０年分の所得税等の確定申告をした。原告は、この確定申告に係る確定申告書において、職業を建設業とした上、この確定申告に係る確定申告書に添付したその事業に係る収支内訳書（乙１８の４）において、売上金額８７１万６０\n３２円、経費のうち、外注工賃５５６万７９００円、減価償却費１５万円、地代家賃６０万円、その他の経費１８４万２９０６円、所得金額５５万５２２６円としていた。（乙８の７）\n２ 修正申告\n\n\n（１）原告は、令和元年１２月１７日、処分行政庁に対し、総所得金額５７７万９８４５円（事業所得の金額５５９万０１１３円、雑所得の金額１８万９７３２円）、所得控除の額の合計額１３８万９８３７円、課税総所得金額４３９万円、課税総所得金額に対する税額４５万０\n５００円、納付すべき税額４５万０５００円とする平成２４年分の所得税の修正申告をした。\n原告は、この修正申告において、事業所得に係る総収入金額１６３４万２３９９円、必要経費のうち、外注費７１９万０６５６円、地代家賃１０８万０８５５円、その他の経費２４８万０７７５円（減価償却費３２万１９４５円を含む。）、事業所得の金額５５９万０１１３円としていた。（乙９の１、弁論の全趣旨）\n\n\n（２）原告は、令和元年１２月１７日、処分行政庁に対し、総所得金額７５０万１１５５円（事業所得の金額７３１万３８７４円、雑所得の金額１８万７２８１円）、所得控除の額の合計額２００万４７１０円、課税総所得金額５４９万６０００円、課税総所得金額に対する税額\n６７万１７００円、復興特別所得税額１万４１０５円、納付すべき税額６８万５８００円とする平成２５年分の所得税等の修正申告をした。原告は、この修正申告において、事業所得に係る総収入金額２１２０万７６５９円、必要経費のうち、外注費９３３万１３７０円、地代家賃１３４万３０９３円、その他の経費３２１万９３２２円（減価償却費４１万７７９１円を含む。）、事業所得の金額７３１万３８７４円としていた。（乙９の２、弁論の全趣旨）\n\n\n（３）原告は、令和元年１２月１７日、処分行政庁に対し、総所得金額６６２万３７２９円（事業所得の金額６６２万３７２９円、雑所得の金額０円）、所得控除の額の合計額１７０万３\n０５０円、課税総所得金額４９２万円、課税総所得金額に対する税額５５万６５００円、復興特別所得税額１万１６８６円、納付すべき税額５６万８１００円とする平成２６年分の所得税等の修正申告をした。原告は、この修正申告において、事業所得に係る総収入金額１９\n２５万９７５６円、必要経費のうち、外注費８４７万４２９３円、地代家賃１２３万８１０\n１円、その他の経費２９２万３６３３円（減価償却費３７万９４１７円を含む。）、事業所得の金額６６２万３７２９円としていた。（乙９の３、弁論の全趣旨）\n\n\n（４）原告は、令和元年１２月１７日、処分行政庁に対し、総所得金額５６３万８５１９円（事業所得の金額５３３万８５９１円、雑所得の金額２９万９９２８円）、所得控除の額の合計額１２１万９７１１円、課税総所得金額４４１万８０００円、課税総所得金額に対する税額\n４５万６１００円、復興特別所得税額９５７８円、納付すべき税額４６万５６００円とする平成２７年分の所得税等の修正申告をした。原告は、この修正申告において、事業所得に係る総収入金額１５３７万３５７６円、必要経費のうち、外注費７１８万２２５０円、地代家賃９４万円、その他の経費１９１万２７３５円（減価償却費は０円）、事業所得の金額５３\n３万８５９１円としていた。（乙９の４、弁論の全趣旨）\n\n\n（５）原告は、令和元年１２月１７日、処分行政庁に対し、総所得金額３５４万９８２０円（事業所得の金額３２４万５８１１円、雑所得の金額３０万４００９円）、所得控除の額の合計額１３０万６５９５円、課税総所得金額２２４万３０００円、課税総所得金額に対する税額\n１２万６８００円、復興特別所得税額２６６２円、納付すべき税額１２万９４００円とする平成２８年分の所得税等の修正申告をした。原告は、この修正申告において、事業所得に係る総収入金額１２０５万０５４２円、必要経費のうち、外注費５５８万５０００円、地代家賃９４万円、その他の経費２２７万９７３１円（減価償却費５４万円を含む。）、事業所得の金額３２４万５８１１円としていた。（乙９の５、弁論の全趣旨）\n\n\n（６）原告は、令和元年１２月１７日、処分行政庁に対し、総所得金額４２３万８５３６円（事業所得の金額３９３万５４１９円、雑所得の金額３０万３１１７円）、所得控除の額の合計額１４０万６９０６円、課税総所得金額２８３万１０００円、課税総所得金額に対する税額\n１８万５６００円、復興特別所得税額３８９７円、納付すべき税額１８万９４００円とする平成２９年分の所得税等の修正申告をした。原告は、この修正申告において、事業所得に係る総収入金額１０９１万８５３３円、必要経費のうち、外注費４５２万４４０５円、地代家賃８８万円、その他の経費１５７万８７０９円（減価償却費２５万円を含む。）、事業所得の金額３９３万５４１９円としていた。（乙９の６、弁論の全趣旨）\n\n\n（７）原告は、令和元年１２月１７日、処分行政庁に対し、総所得金額５５４万８９７４円（事業所得の金額５２４万６３０６円、雑所得の金額３０万２６６８円）、所得控除の額の合計額１３４万９２０５円、課税総所得金額４１９万９０００円、課税総所得金額に対する税額\n４１万２３００円、復興特別所得税額８６５８円、納付すべき税額４２万０９００円とする平成３０年分の所得税等の修正申告をした。原告は、この修正申告において、事業所得に係る総収入金額１３７３万７１１２円、必要経費のうち、外注費５６９万７９００円、地代家賃８０万円、その他の経費１９９万２９０６円（減価償却費１５万円を含む。）、事業所得の金額５２４万６３０６円としていた。（乙９の７、弁論の全趣旨）\n３ 重加算税の賦課決定\n\n\n（１）処分行政庁は、令和２年１月２７日付けで、原告に対し、平成２４年分の所得税について、\n重加算税の額の基礎となる税額４５万円、重加算税の額１５万７５００円とする重加算税の賦課決定をした。（乙３０の１）\n\n\n（２）処分行政庁は、令和２年１月２７日付けで、原告に対し、平成２５年分の所得税等について、重加算税の額の基礎となる税額６８万円、重加算税の額２３万８０００円とする重加算税の賦課決定をした。（乙３０の２）\n\n\n（３）処分行政庁は、令和２年１月２７日付けで、原告に対し、平成２６年分の所得税等について、重加算税の額の基礎となる税額５６万円、重加算税の額１９万６０００円とする重加算税の賦課決定をした。（乙３０の３）\n\n\n（４）処分行政庁は、令和２年１月２７日付けで、原告に対し、平成２７年分の所得税等について、重加算税の額の基礎となる税額４５万円、重加算税の額１５万７５００円とする重加算税の賦課決定をした。（乙３０の４）\n\n\n（５）処分行政庁は、令和２年１月２７日付けで、原告に対し、平成２８年分の所得税等について、重加算税の額の基礎となる税額１２万円、重加算税の額４万２０００円とする重加算税の賦課決定をした。（乙３０の５）\n\n\n（６）処分行政庁は、令和２年１月２７日付けで、原告に対し、平成２９年分の所得税等について、重加算税の額の基礎となる税額１８万円、重加算税の額６万３０００円とする重加算税の賦課決定をした。（乙３０の６）\n\n\n（７）処分行政庁は、令和２年１月２７日付けで、原告に対し、平成３０年分の所得税等について、重加算税の額の基礎となる税額４２万円、重加算税の額１４万７０００円とする重加算税の賦課決定をした。（乙３０の７）\n４ 更正の請求及び通知処分\n\n\n（１）原告は、令和２年３月１２日、処分行政庁に対し、修正申告に係る事業所得の金額が過大であることを理由として、平成２６年分の所得税等について、総所得金額６４万２３９３円\n（事業所得の金額０円、雑所得の金額６４万２３９３円）、所得控除の額の合計額１７４万\n９８９１円、課税総所得金額０円、課税総所得金額に対する税額０円、復興特別所得税額０円、納付すべき税額０円とする更正の請求をした。（乙３２の１）\n処分行政庁は、令和２年６月１１日付けで、原告に対し、更正をすべき理由がない旨の通知処分をした。（乙４０の１）\n\n\n（２）原告は、令和２年３月１２日、処分行政庁に対し、修正申告に係る事業所得の金額が過大であることを理由として、平成２７年分の所得税等について、総所得金額８２万３５３０円\n（事業所得の金額５２万３６０２円、雑所得の金額２９万９９２８円）、所得控除の額の合計額１２４万４００５円、課税総所得金額０円、課税総所得金額に対する税額０円、復興特別所得税額０円、納付すべき税額０円とする更正の請求をした。（乙３２の２）\n処分行政庁は、令和２年６月１１日付けで、原告に対し、更正をすべき理由がない旨の通知処分をした。（乙４０の２）\n\n\n（３）原告は、令和２年３月１２日、処分行政庁に対し、修正申告に係る事業所得の金額が過大であることを理由として、平成２８年分の所得税等について、総所得金額１３３万９６９８円（事業所得の金額１０３万５６８９円、雑所得の金額３０万４００９円）、所得控除の額の合計額１３５万４８１１円、課税総所得金額０円、課税総所得金額に対する税額０円、復興特別所得税額０円、納付すべき税額０円とする更正の請求をした。（乙３２の３）\n処分行政庁は、令和２年６月１１日付けで、原告に対し、更正をすべき理由がない旨の通知処分をした。（乙４０の３）\n\n\n（４）原告は、令和２年３月１２日、処分行政庁に対し、修正申告に係る事業所得の金額が過大であることを理由として、平成２９年分の所得税等について、総所得金額１５４万７６１８円（事業所得の金額１２４万４５０１円、雑所得の金額３０万３１１７円）、所得控除の額の合計額１４２万９５２６円、課税総所得金額１１万８０００円、課税総所得金額に対する税額５９００円、復興特別所得税額１２３円、納付すべき税額６０００円とする更正の請求をした。（乙３２の４）\n処分行政庁は、令和２年６月１１日付けで、原告に対し、更正をすべき理由がない旨の通知処分をした。（乙４０の４）\n\n\n（５）原告は、令和２年３月１２日、処分行政庁に対し、修正申告に係る事業所得の金額が過大であることを理由として、平成３０年分の所得税等について、総所得金額８５万７８９４円\n（事業所得の金額５５万５２２６円、雑所得の金額３０万２６６８円）、所得控除の額の合計額１３６万５４７０円、課税総所得金額０円、課税総所得金額に対する税額０円、復興特別所得税額０円、納付すべき税額０円とする更正の請求をした。（乙３２の５）\n処分行政庁は、令和２年６月１１日付けで、原告に対し、更正をすべき理由がない旨の通知処分をした。（乙４０の５）\n５ 審査請求及び裁決原告は、国税不服審判所長に対し、令和２年２月２３日、上記３の重加算税の賦課決定についての審査請求をし（乙４２、４３）、同年７月８日、上記４の通知処分についての審査請求をした（乙４４、４５）。国税不服審判所長は、国税通則法１０４条１項の規定により、上記各審査請求について併合審理をし、令和３年２月１６日付けで、原告の審査請求をいずれも棄却する裁決をした（甲１）。\n\n\n\n\n\n\n第２ 消費税等関係\n\n\n１ 確定申告（期限後申告）\n\n\n（１）原告は、令和元年１２月１７日、法定申告期限後に、処分行政庁に対し、課税標準額１７\n９５万３０００円、消費税額１０３万０２９９円、控除対象仕入税額４０万２５６２円、納付税額６２万７７００円、地方消費税の課税標準となる消費税額６２万７７００円、地方消費税の納付譲渡割額１６万６６００円、消費税等の合計税額７９万４３００円とする平成２\n６年課税期間の消費税等の確定申告をした。原告は、この期限後申告において、課税売上額\n（税抜き）１７９５万４７９６円（税率４％適用分４３８万０８４３円、税率６．３％適用分１３５７万３９５３円）、課税仕入れに係る支払対価の額（税込み）７２３万４０２２円\n（税率４％適用分９５万９６４４円、税率６．３％適用分６２７万４３７８円）、課税仕入れに係る消費税額４０万２５６２円（税率４％適用分３万６５５７円、税率６．３％適用分\n３６万６００５円）、控除対象仕入税額４０万２５６２円（税率４％適用分３万６５５７円、\n税率６．３％適用分３６万６００５円）としていた。（乙２８の１）\n\n\n（２）原告は、令和元年１２月１７日、法定申告期限後に、処分行政庁に対し、課税標準額１４\n２３万４０００円、消費税額８９万６７４２円、控除対象仕入税額５３万６７４０円、納付税額３６万円、地方消費税の課税標準となる消費税額３６万円、地方消費税の納付譲渡割額\n９万７１００円、消費税等の合計税額４５万７１００円とする平成２７年課税期間の消費税等の確定申告をした。原告は、この期限後申告において、課税売上額（税抜き）１４２３万\n４７９２円、課税仕入れに係る支払対価の額（税込み）９２０万１２６５円、課税仕入れに係る消費税額５３万６７４０円、控除対象仕入税額５３万６７４０円としていた。（乙２８の２）\n\n\n（３）原告は、令和元年１２月１７日、法定申告期限後に、処分行政庁に対し、課税標準額１１\n１５万７０００円、消費税額７０万２８９１円、控除対象仕入税額４３万１４００円、納付税額２７万１４００円、地方消費税の課税標準となる消費税額２７万１４００円、地方消費税の納付譲渡割額７万３２００円、消費税等の合計税額３４万４６００円とする平成２８年課税期間の消費税等の確定申告をした。原告は、この期限後申告において、課税売上額（税抜き）１１１５万７９０９円、課税仕入れに係る支払対価の額（税込み）７３９万５４３１円、課税仕入れに係る消費税額４３万１４００円、控除対象仕入税額４３万１４００円としていた。（乙２８の３）\n\n\n（４）原告は、平成３０年５月２９日、法定申告期限後に、処分行政庁に対し、課税標準額７３\n８万８０００円、消費税額４６万５４４４円、控除対象仕入税額３７万５０４８円、納付税額９万０３００円、地方消費税の課税標準となる消費税額９万０３００円、地方消費税の納付譲渡割額２万４３００円、消費税等の合計税額１１万４６００円とする平成２９年課税期間の消費税等の確定申告をした。原告は、この期限後申告において、課税売上額（税抜き）\n７３８万８６７１円、課税仕入れに係る支払対価の額（税込み）６４２万９４００円、課税仕入れに係る消費税額３７万５０４８円、控除対象仕入税額３７万５０４８円としていた。\n（乙２１）\n処分行政庁は、平成３０年６月２７日付けで、原告に対し、平成２９年課税期間の消費税等について、無申告加算税の額の基礎となる税額１１万円、無申告加算税の額５５００円とする無申告加算税の賦課決定をした。（乙２２）\n原告は、令和元年１２月１７日、処分行政庁に対し、課税標準額１０１０万９０００円、\n消費税額６３万６８６７円、控除対象仕入税額３４万７０４８円、納付税額２８万９８００円、既確定税額９万０３００円、差引納付税額１９万９５００円、地方消費税の課税標準となる消費税額２８万９８００円、地方消費税の納付譲渡割額７万８２００円、既確定税額２万４３００円、差引納付税額５万３９００円、消費税等の合計税額２５万３４００円とする平成２９年課税期間の消費税等の修正申告をした。原告は、この修正申告において、課税売上額（税抜き）１０１０万９７５２円、課税仕入れに係る支払対価の額（税込み）５９４万\n９４００円、課税仕入れに係る消費税額３４万７０４８円、控除対象仕入税額３４万７０４\n８円としていた。（乙２９）\n\n\n（５）原告は、令和元年１２月１７日、法定申告期限後に、処分行政庁に対し、課税標準額１２\n７１万９０００円、消費税額８０万１２９７円、控除対象仕入税額４４万５４９２円、納付税額３５万５８００円、地方消費税の課税標準となる消費税額３５万５８００円、地方消費税の納付譲渡割額９万６０００円、消費税等の合計税額４５万１８００円とする平成３０年課税期間の消費税等の確定申告をした。原告は、この期限後申告において、課税売上額（税抜き）１２７１万９５４８円、課税仕入れに係る支払対価の額（税込み）７６３万７０１８円、課税仕入れに係る消費税額４４万５４９２円、控除対象仕入税額４４万５４９２円としていた。（乙２８の４）\n２ 無申告加算税及び重加算税の賦課決定\n\n\n（１）処分行政庁は、令和２年１月２７日付けで、原告に対し、平成２６年課税期間の消費税等について、無申告加算税の額の基礎となる税額４万円、無申告加算税の額６０００円、重加算税の額の基礎となる税額７５万円、重加算税の額３０万円とする無申告加算税及び重加算税の賦課決定をした。（乙３１の１）\n\n\n（２）処分行政庁は、令和２年１月２７日付けで、原告に対し、平成２７年課税期間の消費税等について、無申告加算税の額の基礎となる税額９万円、無申告加算税の額１万３５００円、\n重加算税の額の基礎となる税額３５万円、重加算税の額１４万円とする無申告加算税及び重加算税の賦課決定をした。（乙３１の２）\n\n\n（３）処分行政庁は、令和２年１月２７日付けで、原告に対し、平成２８年課税期間の消費税等について、無申告加算税の額の基礎となる税額１４万円、無申告加算税の額２万１０００円、\n重加算税の額の基礎となる税額２０万円、重加算税の額８万円とする無申告加算税及び重加算税の賦課決定をした。（乙３１の３）\n\n\n（４）処分行政庁は、令和２年１月２７日付けで、原告に対し、平成２９年課税期間の消費税等について、重加算税の額の基礎となる税額２５万円、重加算税の額１０万円とする重加算税の賦課決定をした。（乙３１の４）\n\n\n（５）処分行政庁は、令和２年１月２７日付けで、原告に対し、平成３０年課税期間の消費税等について、無申告加算税の額の基礎となる税額５万円、無申告加算税の額７５００円、重加算税の額の基礎となる税額３９万円、重加算税の額１５万６０００円とする無申告加算税及び重加算税の賦課決定をした。（乙３１の５）\n３ 更正の請求及び通知処分\n\n\n（１）原告は、令和２年３月１２日、処分行政庁に対し、期限後申告に係る課税標準額が過大であることを理由として、平成２６年課税期間の消費税等について、課税標準額、消費税額、\n控除対象仕入税額、納付税額、地方消費税の課税標準となる消費税額、地方消費税の納付譲渡割額、消費税等の合計税額をいずれも０円とする更正の請求をした。（乙３３の１）\n処分行政庁は、令和２年６月１１日付けで、原告に対し、更正をすべき理由がない旨の通知処分をした。（乙４１の１）\n\n\n（２）原告は、令和２年３月１２日、処分行政庁に対し、期限後申告に係る課税標準額が過大であることを理由として、平成２７年課税期間の消費税等について、課税標準額、消費税額、\n控除対象仕入税額、納付税額、地方消費税の課税標準となる消費税額、地方消費税の納付譲渡割額、消費税等の合計税額をいずれも０円とする更正の請求をした。（乙３３の２）\n処分行政庁は、令和２年６月１１日付けで、原告に対し、更正をすべき理由がない旨の通知処分をした。（乙４１の２）\n\n\n（３）原告は、令和２年３月１２日、処分行政庁に対し、期限後申告に係る課税標準額が過大であることを理由として、平成２８年課税期間の消費税等について、課税標準額、消費税額、\n控除対象仕入税額、納付税額、地方消費税の課税標準となる消費税額、地方消費税の納付譲渡割額、消費税等の合計税額をいずれも０円とする更正の請求をした。（乙３３の３）\n処分行政庁は、令和２年６月１１日付けで、原告に対し、更正をすべき理由がない旨の通知処分をした。（乙４１の３）\n\n\n（４）原告は、令和２年３月１２日、処分行政庁に対し、修正申告に係る課税標準額が過大であることを理由として、平成２９年課税期間の消費税等について、課税標準額７３８万８００\n０円、消費税額４６万５４４４円、控除対象仕入税額３７万５０４８円、納付税額９万０３\n００円、地方消費税の課税標準となる消費税額９万０３００円、地方消費税の納付譲渡割額\n２万４３００円、消費税等の合計税額１１万４６００円とする更正の請求をした。（乙３３の４）\n処分行政庁は、令和２年６月１１日付けで、原告に対し、更正をすべき理由がない旨の通知処分をした。（乙４１の４）\n\n\n（５）原告は、令和２年３月１２日、処分行政庁に対し、期限後申告に係る課税標準額が過大であることを理由として、平成３０年課税期間の消費税等について、課税標準額、消費税額、\n控除対象仕入税額、納付税額、地方消費税の課税標準となる消費税額、地方消費税の納付譲渡割額、消費税等の合計税額をいずれも０円とする更正の請求をした。（乙３３の５）\n処分行政庁は、令和２年６月１１日付けで、原告に対し、更正をすべき理由がない旨の通知処分をした。（乙４１の５）\n４ 審査請求及び裁決\n\n\n（１）原告は、国税不服審判所長に対し、令和２年２月２３日、上記２の無申告加算税及び重加算税の賦課決定（平成２９年課税期間については重加算税の賦課決定）についての審査請求をし（上記１\n\n\n（４）の平成２９年課税期間に係る無申告加算税の賦課決定については不服申立てがされていない。乙４２、４３）、同年７月８日、上記３の更正をすべき理由がない旨の通知処分についての審査請求をした（乙４４、４５）。国税不服審判所長は、国税通則法\n１０４条１項の規定により、上記各審査請求について併合審理をした（甲１）。\n\n\n（２）処分行政庁は、令和２年７月２７日付けで、原告に対し、平成２７年課税期間の消費税等について、無申告加算税の額の基礎となる税額８万円、無申告加算税の額１万２０００円、\n重加算税の額の基礎となる税額３７万円、重加算税の額１４万８０００円とする無申告加算税及び重加算税の賦課決定の変更決定をした。（乙５０の１）\n処分行政庁は、令和２年７月２７日付けで、原告に対し、平成２８年課税期間の消費税等について、無申告加算税の額の基礎となる税額１２万円、無申告加算税の額１万８０００円、\n重加算税の額の基礎となる税額２１万円、重加算税の額８万４０００円とする無申告加算税及び重加算税の賦課決定の変更決定をした。（乙５０の２）\n処分行政庁は、令和２年７月２７日付けで、原告に対し、平成２９年課税期間の消費税等について、無申告加算税の額の基礎となる税額３万円、無申告加算税の額４５００円、重加算税の額の基礎となる税額２１万円、重加算税の額８万４０００円とする無申告加算税の賦課決定及び重加算税の賦課決定の変更決定をした。（乙５０の３）\n処分行政庁は、令和２年７月２７日付けで、原告に対し、平成３０年課税期間の消費税等について、無申告加算税の額の基礎となる税額１１万円、無申告加算税の額１万６５００円、\n重加算税の額の基礎となる税額３３万円、重加算税の額１３万２０００円とする無申告加算税及び重加算税の賦課決定の変更決定をした。（乙５０の４）\n国税不服審判所長は、国税通則法１０４条２項の規定により、上記変更決定のうち平成２\n７年課税期間及び平成２８年課税期間に係るものについて増額変更であるとして上記\n\n\n（１）\nの審査請求との併せ審理をした（平成２９年課税期間及び平成３０年課税期間に係るものについては減額変更であるとして併せ審理をしなかった。）。（甲１）\n\n\n（３）国税不服審判所長は、令和３年２月１６日付けで、原告の審査請求をいずれも棄却する裁決をした。（甲１）\n（別紙３）\n課税処分及び通知処分の根拠\n\n\n\n\n\n\n第１ 所得税等関係\n\n\n１ 平成２４年所得税通知処分及び所得税加算税賦課決定の根拠\n\n\n（１）総所得金額 ５７７万９８４５円上記金額は、次のアの事業所得の金額、イの雑所得の金額の合計額である。\nア 事業所得の金額 ５５９万０１１３円上記金額は、次の（ア）の総収入金額から、（イ）の必要経費の金額を控除した金額である。\n（ア）総収入金額 １６３４万２３９９円上記金額は、平成２４年分の修正申告書に記載された事業所得に係る総収入金額等と同額である。\n（イ）必要経費の金額 １０７５万２２８６円上記金額は、平成２４年分の外注費７１９万０６５６円、地代家賃１０８万０８５５円、その他の経費２４８万０７５５円の合計額であり、これらの金額は、平成２４年分の修正申告書に記載された金額と同額である。\nイ 雑所得の金額 １８万９７３２円上記金額は、平成２４年分の修正申告書に記載された雑所得の金額と同額である。\n\n\n（２）所得控除の額の合計額 １３８万９８３７円上記金額は、平成２４年分の修正申告書に記載された所得控除の額の合計額と同額である。\n\n\n（３）課税総所得金額 ４３９万円上記金額は、上記\n\n\n（１）の総所得金額から、上記\n\n\n（２）の所得控除の額の合計額を控除した金額（１０００円未満の端数は切捨て）である。\n\n\n（４）納付すべき税額 ４５万０５００円上記金額は、上記\n\n\n（３）の課税総所得金額に、所得税法に規定する税率を乗じて算出した金額である。\n\n\n（５）重加算税の額 １５万７５００円上記金額は、平成２４年分の所得税の修正申告により新たに納付すべきこととなった税額\n４５万０５００円と、平成２４年分の所得税の確定申告に係る納付すべき税額０円との差額\n４５万円（１万円未満の端数は切捨て）に、国税通則法６８条１項の規定により１００分の\n３５を乗じて算出した金額である。\n２ 平成２５年所得税通知処分及び所得税加算税賦課決定の根拠\n\n\n（１）総所得金額 ７５０万１１５５円上記金額は、次のアの事業所得の金額、イの雑所得の金額の合計額である。\nア 事業所得の金額 ７３１万３８７４円上記金額は、次の（ア）の総収入金額から、（イ）の必要経費の金額を控除した金額である。\n（ア）総収入金額 ２１２０万７６５９円上記金額は、平成２５年分の修正申告書に記載された事業所得に係る総収入金額等と同額である。\n（イ）必要経費の金額 １３８９万３７８５円上記金額は、平成２５年分の外注費９３３万１３７０円、地代家賃１３４万３０９３円、その他の経費３２１万９３２２円の合計額であり、これらの金額は、平成２５年分の修正申告書に記載された金額と同額である。\nイ 雑所得の金額 １８万７２８１円上記金額は、平成２５年分の修正申告書に記載された雑所得の金額と同額である。\n\n\n（２）所得控除の額の合計額 ２００万４７１０円上記金額は、平成２５年分の修正申告書に記載された所得控除の額の合計額と同額である。\n\n\n（３）課税総所得金額 ５４９万６０００円上記金額は、上記\n\n\n（１）の総所得金額から、上記\n\n\n（２）の所得控除の額の合計額を控除した金額（１０００円未満の端数は切捨て）である。\n\n\n（４）納付すべき税額 ６８万５８００円上記金額は、次のアの課税総所得金額に対する税額に、イの復興特別所得税の額を加算した金額（１００円未満の端数は切捨て）である。\nア 課税総所得金額に対する税額 ６７万１７００円上記金額は、上記\n\n\n（３）の課税総所得金額に、所得税法に規定する税率を乗じて算出した金額である。\nイ 復興特別所得税の額 １万４１０５円上記金額は、上記アの課税総所得金額に対する税額に、東日本大震災からの復興のための施策を実施するために必要な財源の確保に関する特別措置法に規定する税率を乗じて算出した金額である。\n\n\n（５）重加算税の額 ２３万８０００円上記金額は、平成２５年分の所得税の修正申告により新たに納付すべきこととなった税額\n６８万５８００円と、平成２５年分の所得税の確定申告に係る納付すべき税額０円との差額\n６８万円（１万円未満の端数は切捨て）に、国税通則法６８条１項の規定により１００分の\n３５を乗じて算出した金額である。\n３ 平成２６年所得税通知処分及び所得税加算税賦課決定の根拠\n\n\n（１）総所得金額 ６６２万３７２９円上記金額は、次のアの事業所得の金額、イの雑所得の金額の合計額である。\nア 事業所得の金額 ６６２万３７２９円上記金額は、次の（ア）の総収入金額から、（イ）の必要経費の金額を控除した金額である。\n（ア）総収入金額 １９２５万９７５６円上記金額は、平成２６年分の修正申告書に記載された事業所得に係る総収入金額等と同額である。\n（イ）必要経費の金額 １２６３万６０２７円上記金額は、平成２６年分の外注費８４７万４２９３円、地代家賃１２３万８１０１円、その他の経費２９２万３６３３円の合計額であり、これらの金額は、平成２６年分の修正申告書に記載された金額と同額である。\nイ 雑所得の金額 ０円上記金額は、平成２６年分の修正申告書に記載された雑所得の金額と同額である。\n\n\n（２）所得控除の額の合計額 １７０万３０５０円上記金額は、平成２６年分の修正申告書に記載された所得控除の額の合計額と同額である。\n\n\n（３）課税総所得金額 ４９２万円上記金額は、上記\n\n\n（１）の総所得金額から、上記\n\n\n（２）の所得控除の額の合計額を控除した金額（１０００円未満の端数は切捨て）である。\n\n\n（４）納付すべき税額 ５６万８１００円上記金額は、次のアの課税総所得金額に対する税額に、イの復興特別所得税の額を加算した金額（１００円未満の端数は切捨て）である。\nア 課税総所得金額に対する税額 ５５万６５００円上記金額は、上記\n\n\n（３）の課税総所得金額に、所得税法に規定する税率を乗じて算出した金額である。\nイ 復興特別所得税の額 １万１６８６円上記金額は、上記アの課税総所得金額に対する税額に、東日本大震災からの復興のための施策を実施するために必要な財源の確保に関する特別措置法に規定する税率を乗じて算出した金額である。\n\n\n（５）重加算税の額 １９万６０００円上記金額は、平成２６年分の所得税の修正申告により新たに納付すべきこととなった税額\n５６万８１００円と、平成２６年分の所得税の確定申告に係る納付すべき税額０円との差額\n５６万円（１万円未満の端数は切捨て）に、国税通則法６８条１項の規定により１００分の\n３５を乗じて算出した金額である。\n４ 平成２７年所得税通知処分及び所得税加算税賦課決定の根拠\n\n\n（１）総所得金額 ５６３万８５１９円上記金額は、次のアの事業所得の金額、イの雑所得の金額の合計額である。\nア 事業所得の金額 ５３３万８５９１円上記金額は、次の（ア）の総収入金額から、（イ）の必要経費の金額を控除した金額である。\n（ア）総収入金額 １５３７万３５７６円上記金額は、平成２７年分の修正申告書に記載された事業所得に係る総収入金額等と同額である。\n（イ）必要経費の金額 １００３万４９８５円上記金額は、平成２７年分の外注費７１８万２２５０円、地代家賃９４万円、その他の経費１９１万２７３５円の合計額であり、これらの金額は、平成２７年分の修正申告書に記載された金額と同額である。\nイ 雑所得の金額 ２９万９９２８円上記金額は、平成２７年分の修正申告書に記載された雑所得の金額と同額である。\n\n\n（２）所得控除の額の合計額 １２１万９７１１円上記金額は、平成２７年分の修正申告書に記載された所得控除の額の合計額と同額である。\n\n\n（３）課税総所得金額 ４４１万８０００円上記金額は、上記\n\n\n（１）の総所得金額から、上記\n\n\n（２）の所得控除の額の合計額を控除した金額（１０００円未満の端数は切捨て）である。\n\n\n（４）納付すべき税額 ４６万５６００円上記金額は、次のアの課税総所得金額に対する税額に、イの復興特別所得税の額を加算した金額（１００円未満の端数は切捨て）である。\nア 課税総所得金額に対する税額 ４５万６１００円上記金額は、上記\n\n\n（３）の課税総所得金額に、所得税法に規定する税率を乗じて算出した金額である。\nイ 復興特別所得税の額 ９５７８円上記金額は、上記アの課税総所得金額に対する税額に、東日本大震災からの復興のための施策を実施するために必要な財源の確保に関する特別措置法に規定する税率を乗じて算出した金額である。\n\n\n（５）重加算税の額 １５万７５００円上記金額は、平成２７年分の所得税の修正申告により新たに納付すべきこととなった税額\n４６万５６００円と、処分行政庁が平成２８年６月１６日付けでした平成２７年分の所得税等についての更正における納付すべき税額１万１６００円との差額４５万円（１万円未満の端数は切捨て）に、国税通則法６８条１項の規定により１００分の３５を乗じて算出した金額である。\n５ 平成２８年所得税通知処分及び所得税加算税賦課決定の根拠\n\n\n（１）総所得金額 ３５４万９８２０円上記金額は、次のアの事業所得の金額、イの雑所得の金額の合計額である。\nア 事業所得の金額 ３２４万５８１１円上記金額は、次の（ア）の総収入金額から、（イ）の必要経費の金額を控除した金額である。\n（ア）総収入金額 １２０５万０５４２円上記金額は、平成２８年分の修正申告書に記載された事業所得に係る総収入金額等と同額である。\n（イ）必要経費の金額 ８８０万４７３１円上記金額は、平成２８年分の外注費５５８万５０００円、地代家賃９４万円、その他の経費２２７万９７３１円の合計額であり、これらの金額は、平成２８年分の修正申告書に記載された金額と同額である。\nイ 雑所得の金額 ３０万４００９円上記金額は、平成２８年分の修正申告書に記載された雑所得の金額と同額である。\n\n\n（２）所得控除の額の合計額 １３０万６５９５円上記金額は、平成２８年分の修正申告書に記載された所得控除の額の合計額と同額である。\n\n\n（３）課税総所得金額 ２２４万３０００円上記金額は、上記\n\n\n（１）の総所得金額から、上記\n\n\n（２）の所得控除の額の合計額を控除した金額（１０００円未満の端数は切捨て）である。\n\n\n（４）納付すべき税額 １２万９４００円上記金額は、次のアの課税総所得金額に対する税額に、イの復興特別所得税の額を加算した金額（１００円未満の端数は切捨て）である。\nア 課税総所得金額に対する税額 １２万６８００円上記金額は、上記\n\n\n（３）の課税総所得金額に、所得税法に規定する税率を乗じて算出した金額である。\nイ 復興特別所得税の額 ２６６２円上記金額は、上記アの課税総所得金額に対する税額に、東日本大震災からの復興のための施策を実施するために必要な財源の確保に関する特別措置法に規定する税率を乗じて算出した金額である。\n\n\n（５）重加算税の額 ４万２０００円上記金額は、平成２８年分の所得税の修正申告により新たに納付すべきこととなった税額\n１２万９４００円と、平成２８年分の所得税の確定申告に係る納付すべき税額０円との差額\n１２万円（１万円未満の端数は切捨て）に、国税通則法６８条１項の規定により１００分の\n３５を乗じて算出した金額である。\n６ 平成２９年所得税通知処分及び所得税加算税賦課決定の根拠\n\n\n（１）総所得金額 ４２３万８５３６円上記金額は、次のアの事業所得の金額、イの雑所得の金額の合計額である。\nア 事業所得の金額 ３９３万５４１９円上記金額は、次の（ア）の総収入金額から、（イ）の必要経費の金額を控除した金額である。\n（ア）総収入金額 １０９１万８５３３円上記金額は、平成２９年分の修正申告書に記載された事業所得に係る総収入金額等と同額である。\n（イ）必要経費の金額 ６９８万３１１４円上記金額は、平成２９年分の外注費４５２万４４０５円、地代家賃８８万円、その他の経費１５７万８７０９円の合計額であり、これらの金額は、平成２９年分の修正申告書に記載された金額と同額である。\nイ 雑所得の金額 ３０万３１１７円上記金額は、平成２９年分の修正申告書に記載された雑所得の金額と同額である。\n\n\n（２）所得控除の額の合計額 １４０万６９０６円上記金額は、平成２９年分の修正申告書に記載された所得控除の額の合計額と同額である。\n\n\n（３）課税総所得金額 ２８３万１０００円上記金額は、上記\n\n\n（１）の総所得金額から、上記\n\n\n（２）の所得控除の額の合計額を控除した金額（１０００円未満の端数は切捨て）である。\n\n\n（４）納付すべき税額 １８万９４００円上記金額は、次のアの課税総所得金額に対する税額に、イの復興特別所得税の額を加算した金額（１００円未満の端数は切捨て）である。\nア 課税総所得金額に対する税額 １８万５６００円上記金額は、上記\n\n\n（３）の課税総所得金額に、所得税法に規定する税率を乗じて算出した金額である。\nイ 復興特別所得税の額 ３８９７円上記金額は、上記アの課税総所得金額に対する税額に、東日本大震災からの復興のための施策を実施するために必要な財源の確保に関する特別措置法に規定する税率を乗じて算出した金額である。\n\n\n（５）重加算税の額 ６万３０００円上記金額は、平成２９年分の所得税の修正申告により新たに納付すべきこととなった税額\n１８万９４００円と、平成２９年分の所得税の確定申告に係る納付すべき税額６０００円との差額１８万円（１万円未満の端数は切捨て）に、国税通則法６８条１項の規定により１０\n０分の３５を乗じて算出した金額である。\n７ 平成３０年所得税通知処分及び所得税加算税賦課決定の根拠\n\n\n（１）総所得金額 ５５４万８９７４円上記金額は、次のアの事業所得の金額、イの雑所得の金額の合計額である。\nア 事業所得の金額 ５２４万６３０６円上記金額は、次の（ア）の総収入金額から、（イ）の必要経費の金額を控除した金額である。\n（ア）総収入金額 １３７３万７１１２円上記金額は、平成３０年分の修正申告書に記載された事業所得に係る総収入金額等と同額である。\n（イ）必要経費の金額 ８４９万０８０６円上記金額は、平成３０年分の外注費５６９万７９００円、地代家賃８０万円、その他の経費１９９万２９０６円の合計額であり、これらの金額は、平成３０年分の修正申告書に記載された金額と同額である。\nイ 雑所得の金額 ３０万２６６８円上記金額は、平成３０年分の修正申告書に記載された雑所得の金額と同額である。\n\n\n（２）所得控除の額の合計額 １３４万９２０５円上記金額は、平成３０年分の修正申告書に記載された所得控除の額の合計額と同額である。\n\n\n（３）課税総所得金額 ４１９万９０００円上記金額は、上記\n\n\n（１）の総所得金額から、上記\n\n\n（２）の所得控除の額の合計額を控除した金額（１０００円未満の端数は切捨て）である。\n\n\n（４）納付すべき税額 ４２万０９００円上記金額は、次のアの課税総所得金額に対する税額に、イの復興特別所得税の額を加算した金額（１００円未満の端数は切捨て）である。\nア 課税総所得金額に対する税額 ４１万２３００円上記金額は、上記\n\n\n（３）の課税総所得金額に、所得税法に規定する税率を乗じて算出した金額である。\nイ 復興特別所得税の額 ８６５８円上記金額は、上記アの課税総所得金額に対する税額に、東日本大震災からの復興のための施策を実施するために必要な財源の確保に関する特別措置法に規定する税率を乗じて算出した金額である。\n\n\n（５）重加算税の額 １４万７０００円上記金額は、平成３０年分の所得税の修正申告により新たに納付すべきこととなった税額\n４２万０９００円と、平成３０年分の所得税の確定申告に係る納付すべき税額０円との差額\n４２万円（１万円未満の端数は切捨て）に、国税通則法６８条１項の規定により１００分の\n３５を乗じて算出した金額である。\n\n\n\n\n\n\n第２ 消費税等関係\n\n\n１ 平成２６年消費税通知処分及び消費税加算税賦課決定の根拠\n\n\n（１）課税標準額 １７９５万３０００円上記金額は、次のアの平成２６年３月３１日以前の金額、イの同年４月１日以降の金額の合計額である。\nア 平成２６年３月３１日以前の金額 ４３８万円上記金額は、平成２６年課税期間における課税資産の譲渡等の対価の額の合計額（総収入金額）１９２５万９７５６円のうち、平成２６年１月１日から同年３月３１日までの期間における課税資産の譲渡等の対価の額の合計額４５９万９８８６円に、１０５分の１０\n０を乗じて算出した金額（１０００円未満の端数は切捨て）である。\nイ 平成２６年４月１日以降の金額 １３５７万３０００円上記金額は、平成２６年課税期間における課税資産の譲渡等の対価の額の合計額（総収入金額）１９２５万９７５６円のうち、平成２６年４月１日から同年１２月３１日までの期間における課税資産の譲渡等の対価の額の合計額１４６５万９８７０円に、１０８分の\n１００を乗じて算出した金額（１０００円未満の端数は切捨て）である。\n\n\n（２）課税標準額に対する消費税額 １０３万０２９９円上記金額は、次のアの平成２６年３月３１日以前の金額、イの同年４月１日以降の金額の合計額である。\nア 平成２６年３月３１日以前の金額 １７万５２００円上記金額は、上記\n\n\n（１）アの課税標準額に、消費税法に規定する１００分の４の税率を乗じて算出した金額である。\nイ 平成２６年４月１日以降の金額 ８５万５０９９円上記金額は、上記\n\n\n（１）イの課税標準額に、消費税法に規定する１００分の６．３の税率を乗じて算出した金額である。\n\n\n（３）控除対象仕入税額 ４０万２５６２円上記金額は、次のアの平成２６年３月３１日以前の金額、イの同年４月１日以降の金額の合計額である。\nア 平成２６年３月３１日以前の金額 ３万６５５７円上記金額は、平成２６年課税期間における課税仕入れに係る支払対価の額７２３万４０\n２２円（外注費４６５万５４４０円、地代家賃２０万円、その他の経費２３７万８５８２円の合計額）のうち、平成２６年１月１日から同年３月３１日までの期間における課税仕入れに係る支払対価の額９５万９６４４円（外注費３１万５０００円、地代家賃５万円、\nその他の経費５９万４６４４円の合計額）に、１０５分の４を乗じて算出した金額である。\nイ 平成２６年４月１日以降の金額 ３６万６００５円上記金額は、平成２６年課税期間における課税仕入れに係る支払対価の額７２３万４０\n２２円（外注費４６５万５４４０円、地代家賃２０万円、その他の経費２３７万８５８２円の合計額）のうち、平成２６年４月１日から同年１２月３１日までの期間における課税仕入れに係る支払対価の額６２７万４３７８円（外注費４３４万０４４０円、地代家賃１\n５万円、その他の経費１７８万３９３８円の合計額）に、１０８分の６．３を乗じて算出した金額である。\n\n\n（４）納付すべき消費税額 ６２万７７００円上記金額は、次のアの平成２６年３月３１日以前の金額、イの同年４月１日以降の金額の合計額（１００円未満の端数は切捨て）である。\nア 平成２６年３月３１日以前の金額 １３万８６４３円上記金額は、上記\n\n\n（２）アの課税標準額に対する消費税額から、上記\n\n\n（３）アの控除対象仕入税額を控除した金額である。\nイ 平成２６年４月１日以降の金額 ４８万９０９４円上記金額は、上記\n\n\n（２）イの課税標準額に対する消費税額から、上記\n\n\n（３）イの控除対象仕入税額を控除した金額である。\n\n\n（５）地方消費税の課税標準額 ６２万７７００円上記金額は、上記\n\n\n（４）の納付すべき消費税額と同額である。\n\n\n（６）納付すべき地方消費税額 １６万６６００円上記金額は、次のアの平成２６年３月３１日以前の金額、イの同年４月１日以降の金額の合計額（１００円未満の端数は切捨て）である。\nア 平成２６年３月３１日以前の金額 ３万４６６０円上記金額は、平成２６年１月１日から同年３月３１日までの期間における地方消費税の課税標準額（上記\n\n\n（４）アの納付すべき消費税額と同額）に、地方税法に規定する１００分の２５の税率を乗じて算出した金額である。\nイ 平成２６年４月１日以降の金額 １３万１９７７円上記金額は、平成２６年４月１日から同年１２月３１日までの期間における地方消費税の課税標準額（上記\n\n\n（４）イの納付すべき消費税額と同額）に、地方税法に規定する６３分の１７の税率を乗じて算出した金額である。\n\n\n（７）納付すべき消費税等の額 ７９万４３００円上記金額は、上記\n\n\n（４）の納付すべき消費税額、上記\n\n\n（６）の納付すべき地方消費税額の合計額である。\n\n\n（８）無申告加算税の額 ６０００円上記金額は、平成２６年課税期間の期限後申告により新たに納付すべきこととなった税額\n７９万４３００円のうち隠蔽又は仮装以外の事実のみに基づく税額４万円（１万円未満の端数は切捨て）に、国税通則法６６条１項の規定により１００分の１５を乗じて算出した金額である。\n\n\n（９）重加算税の額 ３０万円上記金額は、平成２６年課税期間の消費税等の期限後申告により新たに納付すべきこととなった税額７９万４３００円のうち隠蔽又は仮装の事実に基づく税額７５万円（１万円未満の端数は切捨て）に、国税通則法６８条２項の規定により１００分の４０を乗じて算出した金額である。\n２ 平成２７年消費税通知処分及び消費税加算税賦課決定の根拠\n\n\n（１）課税標準額 １４２３万４０００円上記金額は、平成２７年課税期間における課税資産の譲渡等の対価の額の合計額（総収入金額）１５３７万３５７６円に、１０８分の１００を乗じて算出した金額（１０００円未満の端数は切捨て）である。\n\n\n（２）課税標準額に対する消費税額 ８９万６７４２円上記金額は、上記\n\n\n（１）の課税標準額に、消費税法に規定する１００分の６．３の税率を乗じて算出した金額である。\n\n\n（３）控除対象仕入税額 ５３万６７４０円上記金額は、平成２７年課税期間における課税仕入れに係る支払対価の額９２０万１２６\n５円（外注費７１８万２２５０円、地代家賃２０万円、その他の経費１８１万９０１５円の合計額）に、１０８分の６．３を乗じて算出した金額である。\n\n\n（４）納付すべき消費税額 ３６万円上記金額は、上記\n\n\n（２）の課税標準額に対する消費税額から、上記\n\n\n（３）の控除対象仕入税額を控除した金額（１００円未満の端数は切捨て）である。\n\n\n（５）地方消費税の課税標準額 ３６万円上記金額は、上記\n\n\n（４）の納付すべき消費税額と同額である。\n\n\n（６）納付すべき地方消費税額 ９万７１００円上記金額は、上記\n\n\n（５）の地方消費税の課税標準額に、地方税法に規定する６３分の１７の税率を乗じて算出した金額（１００円未満の端数は切捨て）である。\n\n\n（７）納付すべき消費税等の額 ４５万７１００円上記金額は、上記\n\n\n（４）の納付すべき消費税額、上記\n\n\n（６）の納付すべき地方消費税額の合計額である。\n\n\n（８）無申告加算税の額 １万２０００円上記金額は、平成２７年課税期間の期限後申告により新たに納付すべきこととなった税額\n４５万７１００円のうち隠蔽又は仮装以外の事実のみに基づく税額８万円（１万円未満の端数は切捨て）に、国税通則法６６条１項の規定により１００分の１５を乗じて算出した金額である。\n\n\n（９）重加算税の額 １４万８０００円上記金額は、平成２７年課税期間の消費税等の期限後申告により新たに納付すべきこととなった税額４５万７１００円のうち隠蔽又は仮装の事実に基づく税額３７万円（１万円未満の端数は切捨て）に、国税通則法６８条２項の規定により１００分の４０を乗じて算出した金額である。\n３ 平成２８年消費税通知処分及び消費税加算税賦課決定の根拠\n\n\n（１）課税標準額 １１１５万７０００円上記金額は、平成２８年課税期間における課税資産の譲渡等の対価の額の合計額（総収入金額）１２０５万０５４２円に、１０８分の１００を乗じて算出した金額（１０００円未満の端数は切捨て）である。\n\n\n（２）課税標準額に対する消費税額 ７０万２８９１円上記金額は、上記\n\n\n（１）の課税標準額に、消費税法に規定する１００分の６．３の税率を乗じて算出した金額である。\n\n\n（３）控除対象仕入税額 ４３万１４００円上記金額は、平成２８年課税期間における課税仕入れに係る支払対価の額７３９万５４３\n１円（外注費５５８万５０００円、地代家賃２０万円、その他の経費１６１万０４３１円の合計額）に、１０８分の６．３を乗じて算出した金額である。\n\n\n（４）納付すべき消費税額 ２７万１４００円上記金額は、上記\n\n\n（２）の課税標準額に対する消費税額から、上記\n\n\n（３）の控除対象仕入税額を控除した金額（１００円未満の端数は切捨て）である。\n\n\n（５）地方消費税の課税標準額 ２７万１４００円上記金額は、上記\n\n\n（４）の納付すべき消費税額と同額である。\n\n\n（６）納付すべき地方消費税額 ７万３２００円上記金額は、上記\n\n\n（５）の地方消費税の課税標準額に、地方税法に規定する６３分の１７の税率を乗じて算出した金額（１００円未満の端数は切捨て）である。\n\n\n（７）納付すべき消費税等の額 ３４万４６００円上記金額は、上記\n\n\n（４）の納付すべき消費税額、上記\n\n\n（６）の納付すべき地方消費税額の合計額である。\n\n\n（８）無申告加算税の額 １万８０００円上記金額は、平成２８年課税期間の期限後申告により新たに納付すべきこととなった税額\n３４万４６００円のうち隠蔽又は仮装以外の事実のみに基づく税額１２万円（１万円未満の端数は切捨て）に、国税通則法６６条１項の規定により１００分の１５を乗じて算出した金額である。\n\n\n（９）重加算税の額 ８万４０００円上記金額は、平成２８年課税期間の消費税等の期限後申告により新たに納付すべきこととなった税額３４万４６００円のうち隠蔽又は仮装の事実に基づく税額２１万円（１万円未満の端数は切捨て）に、国税通則法６８条２項の規定により１００分の４０を乗じて算出した金額である。\n４ 平成２９年消費税通知処分及び消費税加算税賦課決定の根拠\n\n\n（１）課税標準額 １０１０万９０００円上記金額は、平成２９年課税期間における課税資産の譲渡等の対価の額の合計額（総収入金額）１０９１万８５３３円に、１０８分の１００を乗じて算出した金額（１０００円未満の端数は切捨て）である。\n\n\n（２）課税標準額に対する消費税額 ６３万６８６７円上記金額は、上記\n\n\n（１）の課税標準額に、消費税法に規定する１００分の６．３の税率を乗じて算出した金額である。\n\n\n（３）控除対象仕入税額 ３４万７０４８円上記金額は、平成２９年課税期間における課税仕入れに係る支払対価の額５９４万９４０\n０円（外注費４５２万４４０５円、地代家賃２０万円、その他の経費１２２万４９９５円の合計額）に、１０８分の６．３を乗じて算出した金額である。\n\n\n（４）納付すべき消費税額 ２８万９８００円上記金額は、上記\n\n\n（２）の課税標準額に対する消費税額から、上記\n\n\n（３）の控除対象仕入税額を控除した金額（１００円未満の端数は切捨て）である。\n\n\n（５）地方消費税の課税標準額 ２８万９８００円上記金額は、上記\n\n\n（４）の納付すべき消費税額と同額である。\n\n\n（６）納付すべき地方消費税額 ７万８２００円上記金額は、上記\n\n\n（５）の地方消費税の課税標準額に、地方税法に規定する６３分の１７の税率を乗じて算出した金額（１００円未満の端数は切捨て）である。\n\n\n（７）納付すべき消費税等の額 ３６万８０００円上記金額は、上記\n\n\n（４）の納付すべき消費税額、上記\n\n\n（６）の納付すべき地方消費税額の合計額である。\n\n\n（８）無申告加算税の額 ４５００円上記金額は、平成２９年課税期間の修正申告により新たに納付すべきこととなった税額２\n５万３４００円のうち隠蔽又は仮装以外の事実のみに基づく税額３万円（１万円未満の端数は切捨て）に、国税通則法６６条１項の規定により１００分の１５を乗じて算出した金額である。\n\n\n（９）重加算税の額 ８万４０００円上記金額は、平成２９年課税期間の消費税等の修正申告により新たに納付すべきこととなった税額２５万３４００円のうち隠蔽又は仮装の事実に基づく税額２１万円（１万円未満の端数は切捨て）に、国税通則法６８条２項の規定により１００分の４０を乗じて算出した金額である。\n５ 平成３０年消費税通知処分及び消費税加算税賦課決定の根拠\n\n\n（１）課税標準額 １２７１万９０００円上記金額は、平成３０年課税期間における課税資産の譲渡等の対価の額の合計額（総収入金額）１３７３万７１１２円に、１０８分の１００を乗じて算出した金額（１０００円未満の端数は切捨て）である。\n\n\n（２）課税標準額に対する消費税額 ８０万１２９７円上記金額は、上記\n\n\n（１）の課税標準額に、消費税法に規定する１００分の６．３の税率を乗じて算出した金額である。\n\n\n（３）控除対象仕入税額 ４４万５４９２円上記金額は、平成３０年課税期間における課税仕入れに係る支払対価の額７６３万７０１\n８円（外注費５６９万７９００円、地代家賃２０万円、その他の経費１７３万９１１８円の合計額）に、１０８分の６．３を乗じて算出した金額である。\n\n\n（４）納付すべき消費税額 ３５万５８００円上記金額は、上記\n\n\n（２）の課税標準額に対する消費税額から、上記\n\n\n（３）の控除対象仕入税額を控除した金額（１００円未満の端数は切捨て）である。\n\n\n（５）地方消費税の課税標準額 ３５万５８００円上記金額は、上記\n\n\n（４）の納付すべき消費税額と同額である。\n\n\n（６）納付すべき地方消費税額 ９万６０００円上記金額は、上記\n\n\n（５）の地方消費税の課税標準額に、地方税法に規定する６３分の１７の税率を乗じて算出した金額（１００円未満の端数は切捨て）である。\n\n\n（７）納付すべき消費税等の額 ４５万１８００円上記金額は、上記\n\n\n（４）の納付すべき消費税額、上記\n\n\n（６）の納付すべき地方消費税額の合計額である。\n\n\n（８）無申告加算税の額 １万６５００円上記金額は、平成３０年課税期間の期限後申告により新たに納付すべきこととなった税額\n４５万１８００円のうち隠蔽又は仮装以外の事実のみに基づく税額１１万円（１万円未満の端数は切捨て）に、国税通則法６６条１項の規定により１００分の１５を乗じて算出した金額である。\n\n\n（９）重加算税の額 １３万２０００円上記金額は、平成３０年課税期間の消費税等の期限後申告により新たに納付すべきこととなった税額４５万１８００円のうち隠蔽又は仮装の事実に基づく税額３３万円（１万円未満の端数は切捨て）に、国税通則法６８条２項の規定により１００分の４０を乗じて算出した金額である。\n．． ． ．\n．吟 ．\n....\n、\n．\n． ． ，\n． ． ． ヽ ．\n．\n． ：\n・ ・\n' ,\n. .＞.. .\n‘\n. . 9 \n0.\n. .\n 9\n，り ・\n▲． ・ ．\n．\n-t\n'ー，｀がン雹ク'’人が\"｀＃令ii,\n'\n’\n:§魯tt\n｛ メ茎象ぷ\ny？・・3．む芯\n． ． 、•[ふ\n9 ． も・危\n＇＼い 、し｀lふ•\nJ ● 、』r‘¢.‘‘.\nrmt」 ^.、ど砂\n' 5、.,\n.\nP `\n\"\n▼r·-9\n\"] `\n,9,\"\n. .¢J ， 9\n·□\n·\n; · .. · . 1.i _· . :ぐ，＇·\n＇ ・ マ，こ ．\n． ＂・\ni\n．． ． 口 、 i\n,\n』`- ,‘`. ゞ -,9 ー ．．， よ ぶ｀ 一 3． . 9.. , t .\n`ゃ •9'. ,. 9; • にC I:’'' ;`凶り ・ 全＇！お’込,,\n.. 一· . ．\n．\n•\n- 1 • 9 ユ •9;心-:,•ぶ ．： .� ： >o •..？ 名 炉 ・,, ,_:セ .;,\n1 ぽ件各年分の所得税等の事業所得の金額 ・\n―.別． 表\n：円）．項目\n9, 総、·収 .4/し ・・← P\n・\n•9· ←． ． ヽ． 蛉 •・ ． 乎鯰 如 ダ 平 成年在 如 6 年 分 ：．． 平 釦 1 年 分 .I ·平 記呼分 ， 平 紀 9年 分 ： 平 成田年分 ＇ 1\n•• -9 ．，．・・\n•こ一ャ · ク ••• `ム--- 5 7 5 ， · ：\n・\n・ 入外\n•注\n: 金費\n• 額 ー\n．\n・\n．\n． ． ,\n・\n<D. 1\n②\n: ·.· 1\n,\n・· ·\n.\n· i\n& ，\n,\n；辿\n2,\n,函 3 こ 99 ’•.,, 2 . ， 1 ·• . • ·\n2.\n. 0\nJ 7 ツ\n•\n:\n;\n·\nー 6\n5 ・\n9 ヽ— ' .. 1 •\n9\n.\n,\n2 ..\n•\n9 9 :，\n.\n,一\n5 ・\ng\n6 ・一 • • \"., 1 i 5 か\n, — 3\ni : 3\n9..\n.\n, ..\n. 7\n, \n6 .\n•\n. I . ••\n.\n.., . 1 ·-\n� 2 =ゃ\n, 、\n0 ・・, 5 ． .\n． ． 0 ｀\n,と `辺 . ． .\n．\n．·\n: .\n- • ・\n:\nI .. � . -生\n \n'\n.\n9\n1\n1!:\nA\n5 . 3\n3 .. と , I , ;, ,\n31 .\n.\n, ..\n7匂\n37 .\n，\n1,函\n... 1 . 2 .\n：\n・\ni紐 代 家 賃 ． ．\n- , ,.,. •. • I .\n®； :1沼3心9 •成\n． ．． ，ー·..· :\n〇\nr\n，\n」 : 1 • , •• 0磁\n• 80;855; - '•’·庄\n` 3 · • ‘ • !\n．\n'\n.\n.\n.\n1 , 2 - 3 •; 8 . !m,\n：しぷ 9“ ． .． 0\n.\n0 ，F. 0 4 .;. ,.., •泣\n‘ 9 9 4 - 0,0 • 0 0 .. ,\n880『, . 000 `i :\nj\n• • · . •. •�ao ?. ,. .\n、 そ西：の経費 . .,;', 2,· .:· • 7 • · 1 · ' . 5 . • I , . ・ 3 ー・ . 21 T · . 9 ; • . 3 > ^ . I . ； t, し ： ＾ i.'92 ＇： 3, 633 • • . : l, 9I2.?.36 2 79-;�3q 1, 7,�. 709 1,9鉱9り6i へ． ..． '\" '- •· . I ・一 — •9• · ？ ヽ • ヽ 、 ， ． ー・ ・\n75 5 5\n!| 5痘税公• 一 0\n~\n4叩 5\ni\n5,14\n.\n?\n：\nt i 50.9 93,\n720 ヽ沼， 匹\n・\n7.4 9\n’\n! :524 nl\n、 ＇ 水道党国入費ふ・ ‘ 0i 117;6邸 l l;,•6:5 ｝ ム138,670 124'.200 ' 9 : •9 112' • 7.1,33 9 • 80,029: ,‘ - - ・ - , . : ··:· ,..� .. · • f.' ..I ': . 、 • • I ·' . · → • :• :, • ヽ ， ． ＜ ・ .• , · .-. I! · •. ’ §滋i; • • i 旅貸交通費．・9O¢ . :•. 4,•09 3:·9 - · 6, 78．』'. J ．． •7· • 4;OOO． ,• 3, 00Q•, .5‘ , 00 . 0. !•_: ...:: � ふ ．．x． •. • ー·. • '.. ,,..: •• •• ：と． ｀ ． ←• 一ぐ ， ． · ー ， し． ． ．． ． ， ・ , • • v ...:.. ·,• . • ：． ． ．． ． ← ． e , ．い ざ， •．- ．．． ， ． ： ． ． ．9 -· ・• マ— : 、 9 • ’ 一 ． ・ ． ． ．ー'•·ヽ•.,...,’c 9・ ',ヽ・中 ．．． ， ． ’｀’ヽ·-.F9;--•ー・・・--7 l · • \n． . 9\n．通． ．(m·. 費・• \"·如·. `23. 3怨· ’..、 , 21.:186•• 凶．切6 , .- 3, 200. 31, 1l2\n： 接 待 交 輝 費 ' :. 7 6 8. , 9. 9 ．泌 ．螂 ． : ， ． . 、 i . ． f や . ユ . 損 ~ • -- • 溶 L • 羨 • ' . •. ． . , . · ヽ . · 食 ． . c . • < ： . ・ · ， 料 ．． ． . \\ ： . ·、 ．： s 9• ． ·. : • . ^ ' · ; ． ． . ． ． 暑 , ． ¢◎ •• — • ． ふ ： .:ぎ .i · . • : • . • . • . • ,. ． · 、 ` 9 9 · •, . 8 .. · 9 ． : .. 向 . .,. ． , . : . 、 ， , . ｀ · ． - と - . ' • • 1 . 9 ' . • . 窃 • 9 • · 9 • . も . , : ‘ .. 砿 . 6 r ` a • 7 , ． . •へ 6 .． . , . • 9' • . ， . ＇ . ・ , ロ • · ・ : : . - t •• : · ・ . · • ) • 、 • • ． · 9 i へ p ・ r 9 0 令 , ,, 9 ． r: � •6 . • · 2 句 9 ← 苓 9 , 1 · · ヽ . ； . , | ： 1 • • : . J ·＇ ' • 9 : 4ヽ c, • 心 ^ く ·. へ ・ ·· n • ・ • 賤 ー 3 9 , 7 . - ・ 袖 .,. ' . 2 一 • • .ゞ . 、 • . • “ • ー • . ， 9 f ． • 9 . 7 · ． · ． 4 7 : , • . ？ . 8 : ：． 1 • 0 1 0 4 一 - ・ . ' , . … ← .'- ← ． 蕊 ．9 ． 6 • → .． ． .2 0 , ・ . “ ・ 0 .. 9. o 9 • .: • · ' . • • 9 5 6 0 . 2 • a ・ . ．＇修・・竃• 虻·\n.\n73豆了\n．\n.. 961\n・\n4狂 .• 86,¢ 69,r ゎ．四．、\n．\n35 糾9\n●\n‘釘、函渭耗•品費· . .⑦, 9. . 83,3 . 46. , • •1 ・ 08 ＇ i 1 • 5 : 9 •: • {,• ·.・ . : 9 ●● · 8. ● 22 . 5 9 •| . ·.'， 18K 一 06 - 6 • 9 ． 11,•91 · ・． 9 ：: ' r 上 -'-. .· •2, 5 ・ 3 .,; 8.: ・ . ヘ ` .―← • g8.，い2\n· ' - . -: 11, •. ··:· ,. ヽと・ ． ヽ '.' • •• - Iー． ． 誡餌償却斎 ·,'0 321•9国 ． I ' ． る1m. i '、 切 9， ・ ら1，7.\n·•• . .,. ·· ·· · • し· • • • 一 ··-\n• •\n.\n- .\n“ ゜.\n.. , • .25 o. , : 、\n| 、福利厚生費 ’◎ i• -.2 ―- 3 、\n32,68^6: 42ぶ5 5 0 ベ 17,15 8.260\n| 1 ・ . i ． 4 心° : ' I 、r l 駐 ..,_ · ,. 竃 .. � 編 ..: .. ． ·.I.;_ o I ． : •• . : 1 · 35i54 . 2. I:.. 7 . 6 、四 · : ,[ I: ,.· •. : . ·· l , 5g , · 856 1 9....,. ` i籾880 : • • F : :.\". i:t :\\ : `.. :· ! ·.·r l-. ↓ ．， �'I,. fi、 汀 ・ リース科一 ．． 一 1:�6,.6�� 215 .9 318、 ー・ 1�6,．:�s6．と：． 108,9．7．9．. — 49, . 35Q 200,•51 01 :1 5 0. 7認\n'·--. -··_·.··・・r.•が \"_ · ...,\".,=1..,,._ • , 第 . ー· •,.,.,• ~‘; 3 、:.,• . K ‘•・＇ i． ． ら： .. ， ．．： .、” ．ヽ ． 28 ．，． ヽ : •. 箪 3 · ガジリシ代 ® 2剥， 375, 竺： 340:•8,3 蕊． ，8 180“. 005 ‘122,•652 �-, ！ -:-·· Ii · • •. 1· ' •• .' 屯... •→ ゃ I·. ・ . 担 、 ·材料 費 0 836.73l-』粒86,.832.; 986,100 : 8?6,959 902,7 432 so\\ 侶9_.�23\n；\n・\n：0\nI 王蓬組合費 ・ ： - 65, 664 : 7年10.6.{ 66.483:. .;., 24,600\n.. 、^' ...‘ , 、 . .,.し. .:. . : , · i .. :| · : • I ・ ． ， ． 、\n＇費 ．の 四,11 -、16 • 5 ; . ・心 \".: . 0 . ? : a· r ..J .l ·' 5o，ね • ・← 6 '· · • 2 ，ョ ．4 応5 17. 6 8B1 、f . I ·忠 -二 所 ，,. 色 ,. . 計 の '⇒ ご • 必- 門 , • . .— J⑤マ •:. , , i 7 52 ;. , 286 s • ,. 9•13 , 8 . .· 9 . 3 - . , . •• 7 8 • -9 5― ':If · 、 • i2 . , 63 . 6, • 0 _. ・ . 2'Z • .: j . � 0. . 34,:• . 9 邸 -. ‘ 8 、 80も．731 .6, 98 . 3, 11•4\n. .\n®]1 5, 590. 113 7, 313;874 6..623,7 a9 6,338‘. 691 3,245,8ll.3.!935;419;• 5,246, 306,.\n. .,~ ,. �.\n―\n·-1 ·_ .\nー9\n-· ．．\n．． 、�·.. :·ヽ •• ..•必\n＇裏\n．函． l50\n．\n. . • ,•..-. •一一＿： ． ．旦 ｀ . · ;, 9:: 、.\n9 経 ·\n·.\n.� . , . 9 L．． ． ・・l5ー ・費\ni 』. ·, 『 0 \n9.\nu.し一\n., •\n●、 • )3:!,i>37 ‘ • • •9 9 •\n156,220\n30,函 ら• ; . ,9 | • 8,490;的6.'\n｀\nr.\n:\n... 一\n・ __ :. -..:ヽ・一ぷ別表2\n·→. 平成 切 年 分 な い し乎 絨 3 ・俎粒況 ） 乎均経 費 率 の算定\n・‘\n·· •�ー �.、\n、.\n. :\n.． ..\n｀ •. :_\n’• \n. . `\n.i .\n.\n.\n、'．‘'. \" ,\n..· ヽ `\n. ・ ヽ� 9:.\nrr ．． .， .,. 9,\n．． ・：・> ． ．\n． ．．．\n.\n: ' - .\n...\n•· \n•9 ..\n9,..: 0 ..· • .\n....\n•. ． ・ ·•\n＂． も . .1\n．． ，\n9 .\n ,.• .· '.. .· -\n， ・ヽ， ヽ ． ヽ\n`． \\\n· • 3 . i. ヽ ・ ｀ . `. , r‘じ ． ー． ，\n・ ． ． ..\n、\n� . - .~,- . .m 、 • ヽ . :· . ． .: ． ” ．． オ●分．: · J ・ ． ．平 9 ： 釦 . パ• ． .. · . • . ： ・ ． . ． 寧印 . 四 . ・； 、 ・ ・ 』｀、 平成 . ” . 咬 , ． . ． ・ ．． ． ． • • •.• v . •. • 、 • ・→ ． ． ． ． 9 • • ・ ・ ． ．． m ， ．・ ・ 平均蘊費寧\nI • • 「 項 ' fJ • . ; .. • ---...;, 9一 • I I 品 \"ヽ・ 泡 •.-- ＆ , “費ー • 出点 - 芯 • 王品 ・ ・ ・� ゞ••• 忠L �,-�零•••• 品- 索• . • 迄 99 ← ．i編賣• ..CA) - • • • I • •. 9. I'総双入 ． • 金額〇滋37,357 • ;61 / i ·1 ·12, ` 05.0.:· , “2’·, . ' . .: :1 b.9,1 .: 8 ,'硲3' :..、• • .• .,. •’ヽ ^ 1 ,3 1 31•， • 112 ., . .' • • • . 1... 1· : ・ ． •蛉•. F.\"=. 1'- ·．,----..--; 一 ．． .' 賃 、 ．．• • I ． ク 1. • ： -._ .. • . • '. I· . • • ， .. • • • · I • ．' ． · , : . : ·1 ;． ..'. · , 、 . : • • ·; • I . · . 、 . ． . ,_ ‘ ·· . 、• .. : 、9,• . • o←; t1 iI , ; . · •．.. \"'9 9\n｀ 外． 極、 ·,. ． �i . : '7 . ,1 · 8 . Z • 匹• • I 0·四- I• , · 6,58 ' $．珈 -1 .!-- 0心 . 35 I ヽ豆.，｀ m． I ·• 山1 “ I - - 6,691 -細 I• ：： • _48 n拗O : `‘' 嶋 ， 代拿賀 , ＇0 ‘` 1i ' D • .o蒻1 7`0,'000[' , • · o..06 \" 1 4. . I . 9 ·, • 68 . · ,o . 000 . • I .o ` “ . 筏 ..- i I .600 • ,00 •· ← 1 .. : o.“ . 31 • I ー- ' • • - 0 ， ． - こ ぉ ·. . i9 ｀ 1 ,\n|』 ん 006I 沖7\n9 d\n.羞公戸．¢ 丸7勾 0. 孔釦、゜•四占ー？A50 0 7,5a·•o (I006 . 0四I\n. , ` そ , • ， ;1 ＇ , ＊ , . 這 と . • • 免 懇. ' 9 . 賣 i · . , · J ·. • • O : • I • ~ ． ぐ ． : l江 .: . ． 20 ,. 0 I 0 ． 切8 1 • j: • 95 •. ． , i ． 1 . ． 2 ’ J ’● ・ · .: . 000 .、 ． 79 ． ． 丸 ． 1 . 碑 ．！ ， f、.- • o ． . ; o ． ， 向． • ． ． ． : ； • ， • · 8 _. • g ; • o ,· m; I ! • , 0 ． 四 • • 8 : ， I., •} 0 ．. 四 . !、 . :· . ' ,. 1· , · - - 、 、 •t • . · · . I · •・ ・・ 1 ・ ・ ・ · ・ ••·• • tペ·'. ・-.:t=-I · _ · - ..,、 ;1 ． ． ・ !' ,� )f： 費 交 逼 ＇ 費 ' · 0 . - →』 ;..4 , 0 3. 3, ': 釦o r ． ·g ` ¢ 旧 ． '. 0 ；函 ； → :I ‘信漬 ！ 。 i立 。ぶ； 。一珈\nI . の• ．9 I, I .· . 績 遍‘． . ． .·, 祀 ． . g ．m ;.- ·· -' . ： t • ・,. ． ｀正 1 i ·, ·• ¢ . c_: ， I 1 ·．． 紐 ＞ . -・ 四 ヤ,四.. 7 •.-1. 0 , Q . ． OO • · a : ,. J ．..• m • . • .• n · · . , 1 . p : · ．. 函 . '· ．っ J .・ . ., . ・.. 蕊 • 3. · 2 . 09 • 0 .H . ·.. ( 1. )- 0 ． , ・ ．‘ 磁 ． ． · 2 · ； · 1 1 ＇ ・ : • • . 5 31 ;OO ・ ・ . • · I ． o .:． 叫 ·.' 0 .． 四 9. 1 . 7 . •. I '· _· I ·'I.. .' I ロ ． ． I . : 1 '. : • ` ．. 、 • 損 ` ．書 .. ‘ . ’’· 鐸 ： ： ｀ 口 ＿ 料 ＿ ． . → . ぃ ，I , ； ． の ．, ． 、•． . 4. 』. ， . 、 ＿ ・ ? ． ., ・ ． ー . ． . ,. i , · 一 ． . ・ ． 紅珈 9 ,·• p .· ， 0 ． • ． ” , ， → • - · ,. • 一 • • 、 2“ ， 1: セ ,: ． ＇ ． b ｀ . ． 畑へ． ' . ・ · i, - I • 1 f • : 汎 ·• 9. • 、 · 2“ ` _ � \" 薔 ., . ら ． . ；： 0 ． ． ．． o ふ● o ●●. ． ? · ． 0 • ： . ． , ．， 1 , 40— \"• ． . 豆 : ¢ .:..1. · : ｀ ；、 ．，；．ー 、 ·•\n．\n: • • •• • .• ；． ． ‘・ 1 d0 ＇ • • .. ， .' • • • ：呼\n．\n．、\n、 ＇ ; ： . 、 i ‘ ｀ ,. • . 賽 富 、. . \" • 既 . • • ‘→ 臼 凸 • • .:. 費 .• `. : • J , . l 0 � ， ・ ＼ ・ 1 ・ : ・ ・ 占． 『 ．・ 諄 ；． • 9． ： 9d ． と .． ： ，l : 、 · ，． 磁 ，． ．- ·. ． o • ' ‘ ． ． ＇ “ 0 • 、 : 、 し p ; 、 l 一 蕊 • bl 9. 、 .:. と l．; 紐.• j ． ？ i 江 . ! 四 • ～ ·2 1,，. 1 . ． ． ＂ 0．心9, ： 0 .o 況 • ． ヽ 竺・ 四 ー ．・ ・ ・ ( ・ ： ・ ・： · .: ． ．� 2 ， 5 ・ ＇ り 3 9 8 ・ . ヽ 1 1 ． • ぃ . ． ” ·• お • _ 0 ·. ” 0 、 ·• 02 ― ． ・. 亀 .•' ； . · ・ • . • .. t9 . 2 8 .＼ • 7: , A ぷ . 2 1 • 印 2 ; ' 。 , ― 09 と．0 • . 如 - 加 a . •. 、 . ; • . - '. O 0 ． - ． - •,. . j磁 ! .♦: . '. '\n• 9 I - .'-:OOO g-. 15 .lニ 1 . }\n、編旦厚五E．｀ ． ． ｀ ． • 、 9． ・ 、 · ` _ . ' ―\n.,\n, 1 9 , 3 15 .e ; . 00 14 , 8 .庄 ? , 0 寧\n． ，\n•97 7 , 5 00. 、\n．\n0 四 ・ ．． 0\n．\n6 02 0 ・·• :. . ・• で ，‘： • 4 : ・編: ·I· 戴 .. ． 渾 . ・ 編 .、 ． 傘 ． ． .· . 也 •.• 函 .�- ． 碗 ． · ·: 1 ． ,.· ー ;:, t • ．• ・ . ・ ・ .-: ．＇ · I ， _l4 ー， 舷3 ． o-1 · o.o: i ． � ー I .・ 1 し 、く9 3 ' 心 •• ←． ・J o → · _ • •. . 0.1 1� · • -0 ． ; 西 • : . ' . —;`. .: • , 1. ·' 名：： ．.•． .•. • .. 'I , '.I • . • I , -1 .. _ ' , I I ． _ . I: I: ' · · : · 1: .: · · - r,.- ·II 、 ・ ． 磁 ． • `l迫＇ ．． リー 9・ ス .., 料 ..: •； • • 1 979 , 0.o011 .3:9.350 ．り血••9 20;0 ,JSo ,Pl四 ．l607, 86 0. 0110, 0Q, 1!21 • , 9: ••• , ` '. , - .' . , 、•• し ．｀ · .• ., .. :’· ‘月 ・ざ ・ ' ,1 .i < 、1. 1 ” .·· レ,• ' , ・ ・ シ代 .．，•．· ,.•I • I ·• . II I · ·: ·: -� , 、 蕊 ..'I ．Q ．． ． .. 0 ． . 斑 . ． • . ． • ． ． I , . _ • ..-.:.. ' l即 池 : 5. :'·L • _: 0, . 、 0 · l49 . · . ,1· ,.· ヽ 荏l . ・_ ． ,. 6 · 5 . I ． 2 !- ・ ,( : : • 0 、 `.· p 1 . 1 . � r,. ‘ ··. · 吟 ; • -- 、 9 函 • - • .• •:\"I· : す ： ： • D 四 9し . I ・ , 1 9. • . -. C.oガl :-\" . :l, 9材 ． ・ ·野 ． 費 ． I · 0 . I 紐 ； ·・ 函 ．守． ． ．． o ． り ．？ 魏 ． ． ． f 砥 •ー 函 • : · ，． 一 0 ．， 油 ． ． ： ． ＿ ． ． ． 位 ． 3駄, ー · o ・呻 ： ·•• • ． • - 函．，〇 . 竺 - 9 •. . • 0S63 • : • b 涌 .: l .. 2 . ：ー：\n．\n． ：： r ,. ← • • • • • •• • •← 」 • •• I· .!.. : • •: • ·‘ • ` 7 • • • • : • ↑ , ● • • • • ←: •, .9 : : 9 ` :.9• ・一· . ., . : . a • E . 、 9 『 : , 土蘊 · 纏 .• 含 • 費 • 、 • I «. 't · ..-:-. I , : I , , \" ' . 夕 . • • · ． ．2 .ヽ .. - . ； . い ' .. : .. : 0 • • . i • · I - ,. • 0 : 、 . • 切 • • 9 凶 '.. I ー I ー ． • ‘ ： I . :J絃ね •、 • .0. , < : - 、 b . : 9 onヽ 9. , ： . 切 .. “ ,• 、 ． I . ＇ ヽ ．． ＇， 血 ， ． ｀ ． ． ． ． 、 ． ．\n--1. - Q,,徊．C 0073 釘i87 0.. 7六．. : -，3 ，0. 0038 :. , . •. . •. •• .• • : • 9 : .. 9 :}. r \" ‘ •. :i 9 ● ;. , - , .· .,p· . • · : I:'·· ·.':•.•'I··. · I 'r· • • 01· ,, '· I ·.. ~.. ·• ·.2 4 屈 ' I Q. .•O • 1 l 6 \" · \"' 1 - . I I I . ' . I . ． ． ． 89,:112 ·. • 0. 001,. ・ 丸函 7。；咄 ,. 309, 蒻 0四3 ． .o：四o.· 0 . ,__; , I ・ ..L I . -._ J\". I'1-.• .\n’ 9,8払9• • 邸 ． ． •ふ帆73i.・・• ,. 6，涵.iH I 8,902 ，函 • ; ／ ● ,i · , .. 、 ,',ef . _L :. 、 、 , • : • • :, V I ,/\n9·· ,.: r ,費．\n\"•,•,, ,•-,T, .,『•\"• • • • •\n＇ :.-・ 1 |\n： 二 代•\n|0\n• l' `• ·→•• ...\n、 .． ． , ・9. , ...\nI 0 ．． 箪'·費，土 ， .l 9\n. •計..上 1 ・ ． （起・J.r経費亭」欄の各計歎氏，平成7年分なかいじ平成3碑分の「総 ． 収 ． 入金 ． 額 ． j O • ． 欄 こ ． 占 める各 ． ． 必『 妻．経 費J' ・ ②ないし⑳\n・・●の金額の割合{IJヽ数点以下第5位を四捨五入した計数）である．． ． ．． ．． ．\n• 2 あ ・ 「 ぶ 四 ． □ 」御り各計数は、乎· 血7年分ないし平 ・ 成3q年分の経費寧の平均値（Ij)数点第5位を切り上げた数饉）で ．\n• S ・＇ 「地代家賃J · ③欄の各紅累は、•本件各収支内訳書（乙18の1ないし乙18の4)の「地代家賃J®··欄に記載ざれた金額\n（倉庫代金200,000円を加算する前の金額）てあるー\n09 - 、., 9 -\n’”シーら··::..よし＿．． ，．．． ,ttJ, 9 , ．\n' .: ;,\nヽ\n、 :別表3 平成24年分ないし平成26年分の必要経費の額の算定\n”9.\n, ` , 9 .f .臀·9\n`‘\n.., ‘ .、 , , , 9・ ' J文·y ·． ‘` r電 r,． .. ． ゞ' , , ー 、 · ` l.r . ↓ ゞ. ­ァ.·.. i ｝.. ＼ ` ヽ · .. 99\n....\n？ ．．：ヽ·\n•ふー位\n：． 円｝ ． 吠 ． ． ． ッ ヽ ． ＇ ． 、 99,\n.1三 、 T、 ] .' .r; \" 一 ; ' 1 .,5 ｀i L 三 - 1 言 、 ロ . 9 ., . ニ 9.i . ,1 .． ． ． ． べ\" · ¢. ..' · • y ‘し P . ． . ヽ , ．，. . \".. ；し . t \" ., ' -r , •, し f ，‘.9 ; , .. ' _ , 、 ・ ・‘1_ f .1 ,1 . 、.し 、 .， ．．． . ‘ t 』｀ ． ヽ 三・ .j., 、 ,9 . j ; . ‘ d . ' � ． ｛ ， •[ .． ． i I· 三 L a ^ .T 、， . '`t． ' · 平ロ ・、i .,., ` ·' [ 0.-— -,• . .5si , 蛉 額 ） .、.‘ . 、.`. ,. 659.. , g .、. . \" . t c , . 093 .. 110 .. ,\" 函 :- .i., .., . 9. ]362 ‘ ·、 ,· 『 . 磁 ;... ．ヽ 、 ， 団 ， .、 . .; . , , . · , , .. , ‘ . 叫 ,9,•》 . 幻 9, • 、.‘ . • 4 ', . 、 [ . ．159 ． ―`•. 791 、 , • ’.. 四 ぃ , 9 . `1. . J . , 叩`t 4 - t . , ,:- . 砥 a.‘ [ 376 - ― . 8329 5 » i 、 ' 函 . 589 , 589 831 ． ·, 叫 ｀.. 、 . 函 I.\n.\n25金A訊竺g‘痣g .ー 臨 699,I’Jg．函 璃砥 5泣傘 ，i主 墨 竺 甥紅磁砥 ． 、平 ヘ ，こ．成 ． ・ヽ． ゞ． ． -. 間 ． ＂i . .-..： ・・‘ . 2L 、 ‘'． [ ‘. - .. ぶ , . ， ． ` .．ー． . ‘h : ． 、 . .ゞ - ’ .` ● - 5. -， \" ., i ． ． ・＂． ．ご ．． : t , 5，． ^, - i `- 9 ’:. . J．｀｀ , 5 ゞ, - ． [i ．\" ` . ＾, . し ＇ し... 、 , -• . ii，. f . ^ f ， ・ 1 ’ \" t ・ ― ・ ＂ . し ? ベ ．｀｀ ，• ． 5 、 ' ， ，．i A , ． . .l . 一 i\n. .{\n．ャ ヽ，9) 1・,.'r }'‘J{•,’.→ 了. ・•’\" .‘. ‘ , ー 、i 5 1 r ' , ‘ ’ . r I ー・ ・ . r 、 ' べ ． ． ． ． ， ． ．t ，’ `·卜' ’ 、 ' , . '. r . ,. .\n,\n >「79,'.`. .釘 . ・’いa・.. .，．｀．． ．．ぇ．一5 .'、● •ぃ｀，ヽ· .‘ . .g, パ ． ” ， ’ Y ー 、 ・ ． ぃa , , , t. ． こ四己＇璃蜘 ‘¢屯 ·生｀： ｀ ： 9四-庄 警 璃涵 ， 訊:651 i: a 分 9 39} 656 年硬喚函切疇 淑生 346`3945`685 . `q．、茫喪四 ． ：砥564[191嘉 、霙 ”蕊 、 、 一 ． ] • ・〗・ 分9 ．． 砂 ． ．． t ．i ・ロ ． ＇ ， ．． ぶ 9 . ． □． ．: ' へ ． ． ．． ． ？ ．へ .‘ ]. 9 : '\n,\n.\n.`. ., .:9 , .i\" 、.·’ (..t . .]• • 9，．ぐ．←：げ ． ．り． ．． 1 �， - .. い ．． , , し、.' , 9 . , i． 74 ． ． ． ． ， ．.tっ . ． ｀. , ，. .．．. ． ． 9 ．． . 9 ‘ ｀- ．^ ‘ ．． . ., ．．ー 5 了、 ． て ． . ．9 ‘ ． ．. . - ^ ． .. ．、、 9. ． ． ． ． ．｀ ． 9● ヽ ゃ． ＇ゞ ． ． ' . ヽ ． ． ． ． . , , . 』. ． ．．・．． . ．．． ．ふ ． ・ ・ '. ．, . ‘. . 冗 .- \"，． . J. .9'． ， ． 9 , し． ‘ ・｀ ・． ． .n i t．. t（ • 3 i 9 .- レ .・ . I . 革[・ , ,、..'^. , , ·．五’. ． ． ｀ ・り．．．，． ．． ”．均．；5．[ ..?f.\\ .・ □]．｛ ． ．、 ．． ．， ．．．，＇Jハ 守 ： ＇ 、 ” 、 ヽ ご 呼 血 t 竺 ● ＼四 硲 蜘 蜘 呻 呼 如 .. ． r g ] こ 如 ． 寧 ’. '. 0 ., ` '‘ , L[ .0.. -'r\n.\n.. 9 9 平 亀 、 • :9 ● ： ．． ．)．． · ` ， ヽ :．｀． ＂ ．色 . ＇ g 0. ② a ｀ . し7 ] 5，｛ 0．·. ．． ‘ 図 竺 . ． ．．.. i .ん \". .i. ． G ゆ’ ．． ＂ ． へ ． f 河 ． □ o ． 、 ． . ．． ． ． ． や｀ . ：＇ 、 ． ， ． . ． ， ． し ．． 紺 ． ． ． 、 ． ' . ． J .¢ ： ． ．． ． ．．．．.r．.□ 夏 〇 ｀ ． こ ． ． ． .- ． ． ， ． ． ． ． ., ．． ． 、 1 0 色 ．． 0． ． ．． . ．・ . .・ ． ． ー u ． ． . , i ⑬ 5 ． . ． ． ' ． ． 、 七 ． ． ． ． ． ＇ ，． , . 2 ” ・ ・¢ ・ ・ ・ ・・ ・ 9．． ．．，成 ．． ； ．．. ．．、 笠 ． ．．．慰 0 邑 ． ． ． ． i ． 一 、 ぶ・ ．．．i ．. ,よ 謡 ． ． ヽ．＼ ， : i ． ．． ぃi 、 競 9 ． U l5 ． -.．． ⑬ ‘.． ．.．. · .＂ ， ⑳ :-. ‘• ； 0\n.．いg]・ □ ． 0． i．：□.i , ． ．9え、..J.5,•-....`..� ] ・．．臼．4・万 ．．．．．，． ．い、い．．．．9．．．＇[＇，t．，•:'.,...' 年 日 ． 9 ク． ．、 虹課 費 費 ． 賣 費 料 i 費 費 ．費 ． 賣 ．＇ 湯 ●‘ 料 4� A �, 〗 費い • 9 費 9 代 ・ 費 ・ 紐 ．印 2し\n： 入 ＇、注い'\" ][ .\"し＂ 、 こ＂＞5 ` 5．材 [ : 笠 、 雑g『-\nf\n｀｝ 金·:”[‘ ‘、信 t[,.\".讚 ，り” い['ー事 4k □ 5:\", \"]ー ， 巴・＠ ．□ .[) 、 目 . ．． 9 収 ． . :・ ・ ．．ょ 介 . I; :， : ．．． ．． 卜． ． 門 ．． ． ーじ 芦 ． ..- ー l r � 池.. .` .r こ ぶ ＇ ． ．， I ＊＇ ‘ ． a． . ：：．ふ ， も ． ｀ ． び．グ・ ．ィ ，． ． 八‘． ＂ ・い 経9 ざ ー 、 ， 9： ヽ貰 · { ． ー． ． ． →1 ． ．． 必 . , •項心●,.、●' ．． ．．． ．必 t ． i5...£し ]'，．衰．ー ・ベ．． ．． ぐ ¢□. ． 、 経’{．い\"] -.i. . `\n.'\n' .. \" '‘ .•_ 4 ’- t ． -．（ . 5 1 5 ミ ． 、・ . `. . ’ i _ —4 1 暑 4 , 4 』3 , f t | □[ ,9 J 孔叫1 rl �， ー、 , . ．．． - 、 ．．． ． • し． ．9． ． £ � ・ ・ ．．．．． ， ．ヽ • ， .' . P ． . ． 書 ,。 ． 奮 ●， .\". ‘.9, ． ．． へ ， ． ． .‘ 9 ,. .：p ｝ 9, .、. ‘ 雙 L ．疇 、 i ,. 冷 囁 • •、 ，9\"＾←．9, ． ． ． 曹讐， ． t． ． ., · · 遺 ,｀ , ' }．、 ・ :· ． ．・．． ． ． ． ． ．． ‘ ．． ．•．f ．＂ f � ＊・ ． ．t ． ． ．．. . ． ．． . ぃ.` ヽ 3 . 一 tx ` .5 . 叉 ジ ・ ‘ ‘ . .,. ヽ ' :.9 : :' > < ’ ， A .し:,·.\n： ・ ． ・ （注�l: f.． 総 収 入 金額(B)i： 欄 の各 金 額は、｀．平成24年 分 ないし平 成 26年分の所 得 税等め各修正申告書 ． に” g ...の•1ないし乙9の．3 )\n‘．の第\n→表の「•収入金額．円・（営業鱒\n）．J、⑦襴に\n記載されF金額で ある; • •\n• 2.` 「平均経 費 寧(A)J 欄の各 計 数は、 別 表2 の 知経費 率J櫛の各計数である。.: • ·:\n3 - 「算出 金 額J欄の· 各 金額は、1．円未満の 端 数を四捨五入した後の 金 額 で ある。 ，\nA ． 「地代家賃J ②欄の「算出金 額 j 欄 の各金額は、総 収入• 金 額(B) ： に地 代家 ー・賃に係る平均経 費 率(A)\n． を乗 ．じて算出した金額1こ倉庫代200,000円を加算した金額である。\n翡ttt • ' T · 9 ` ー ' · - _1., .9 --- ( •\n.·,\ni\ntぎ唸tIr ，\n. 4\n. 〖 別表 休件各課税期間の消費税等に係る課税仕入れの支払対価の額\n.\n•\n、^\n8 マ\n:;:謳 、．；畠醤 温品ば． 品品；合 ”\n．，孟棗醤\n．（単位：円）·諌税切面-r• rnc: _ _\n、 3\n・項目\n・\n・・順号• 9 唸\n．．虹金額、\"’ 醤：：＇』．：虹日腎\n.嬰\n< . •·窃\n,'.,諫\n. ;虹\n...• °砂\n'. ' . べ .金\n•\n”額\n.•I課\n.紐雌額課税取�-\n.\nt金額m税取引\n•俎員\n•外 注 ：費・．の 4,函A40· 3・註，OO如、直．碑． 7, 182 259 5競5,0切・ �524,心5t `5,.697;900\n．．0地代蒙賃： I·\"@ I ． . 200..000•. . 50, . 9oo 15o, 09.0 200, 000.'200. 000 200, 000 •,200• •0 00\n｀ 租 ・ 税・公課 · ． .； ． り ・．，ol ··. · o�· . _<ol _·'.· 01-.· , :q O ·\n．一―\nl、 6 ．．\n｀ る 水 ・ 道光．熱 費 〇．； ． 心． ·t 6, .- 6 1 7 7 9 s ・ 9： I' ． . 豆，堕 •.1.“ · 3 • � o 2 1. : 、 •血· 200;. 1 . :95; 11 0 3 ·-1 - •• 73, 1 3 8 ．．駅）， → 02 -· 9 . ·,. .\n＼， . 1i・・旅費交通費，・⑤： ＾ ； 、 .·1．伍； ． · • •· 1. 00. �.ooo_ · ー\". 5'. ―o叶o. o• ·ぐ ．． 脅\n9;. 9 ••\nr‘\n(互べ t ,\n.\n、 .\n\" }t通\n接待信\n交際口\n墨 ：·\n¢:． 漫\n⑦ • I\n、 ．\n．\n、\n9-¢\n，．函\nl\n: �\n- I\n` •\n• 2\n•一\n.. Q.0\n：\n1 9:\n、\n.. -. .\n67\n,\n,F\n8五\n9. i · 93払\n7;•2\n. 0\n2\n.\nI\n,\n: 7\n‘\n-• 7 ,く\n. _. l\n↓\n.\n<\ni4 I'\n、\n.\n• 99 .\n·\n.\n6·\n·.3\n8.\n,\no\n2 . 00\no\n-\no\n.- •\n�\no\n1..\n.q .\nI\n. .\ni\n. o\n.\n:\n-\n: J゜ o\n↓ , , • ,. •\n·t ` \" ． ． ． ． ． 積賽保験．料 、 ‘畜::� · ·:11 ·、• g o:J ,, \"i) ...-• -.. _ 、 Q ―‘ ` ` o_,. . • •\n．． ．葱 ”翠． . ：， ．修 織・\n．\n・ 賣\n・\n；一ぐ·，，⑨．｀_: :::�‘_6,�• §t.1 ,. · .- 2_1怠7\",... ”65,:0o ．賤710. .、72,i22． 師，紅9 . g 27,280\n． ． ． ．， ． ， 、 ． ： ； ？｀・ 、 9 . ' ． ．． 精 ．減価 ． 耗 償 ' 品 . ,. 却 •: ': 費 費 . ． · r‘ `. ＇ ‘ 弧 ⑩ 9 '’ : · ご • · ; . : . • • . , 9 : : . i • · ’ ; .• ・ ` : ・・餓 9 . : •,、 . : • , 寧 • . , • ° ． ; • 2 · •• 4 _v , · • · • 函 •• 9 . 0 ·• • . J . [ · . 73 • , • 66 0 . • . 9: ・ 18 ' L函 0 . • . • _ぷ 1 _ 1 · · . •: ; 1領 0 •. ; • : ・2 . ,•53 8 o i • ` 尋 98Al゜2 , 9\n＂\n．\n．． ．虜．． ..9»． .\n. .\n.. .\n.\n “駐\n利厚寧\n•\n•生\nこ ••\n·瘍\n賣\n•\n’ ‘．⑫\n.\n@• ，·· .• •\ni\n• . 3\n8\n..;\n，\n.•5綴\n2 り t\n• :\n．`\ni\n9 1曲\n・函\n．\n•\n・\nl•\ni9,\n,8\n.\n8\n9\n2\n: .\n1 . 43, 8\n••西\n80;\n：\n.1 7, 3l5\n.\nヽ\n．\n8\n,\n, 2\n5\n<> l m れ . ， 5\noo\no.\n,.\n｀ ． i , ' } c‘ ,' . 、 | ' 2 材 ガ リ •. •· ． ジ 一 料 ． ・ ） ャ ・ • ス 9 ； ン` ．． • ？ • b — 科 •代 . · j 費 . , •, . - . ' 9 · ・・ 1 - ： , ⑮ . 9 , . :· • ⑮ . ⑰ . · . -. . : · · ? ． i ． ． • ・ · ． , . � ' • ‘ ． · バ • ` ． - ‘． . • ： : 9 、 i : 匹 . 9 g ｀ : 8 . 6 ん 6 .. / ぷ）§ ・ ,• ．恕 4 吝 .. 9 · 邸 • ·‘ . が · . : . · • ，し •． 喚 2・• 4 話 ・ 9 滋 . l 怒； i· 4 ． ? ： 、 ・丸 蝸 •••7 ‘ 3 9,. 3 6 5お . 羽 a ・ . 几 · ． | l ' • r 8 1 2 93 3 0 6 即蕊 8 , , 9 59 ; ． t ． く '• • 叩 r 1 1 8 、- .o 2 9 - , , . , . 0 7 3 9 ， 3 ら 5 0 a ° 、 5 ’ ', r . •,。 ． • 1 \" A ” ． ．3， . ， 2 ヽ2 2 ` , , ， ` . 3 5 i 9 0 5 .5 ,. ’1 . 2 0 、 • • /9` . , :·, • 位 . 5 1、5 ' 9 •; 9 9 0 、 . · ． , . ,•o ' 蕊 位 7 . 『 6• • 6 3 8. ヽ\n、\nー, •士蓬組合費． ⑰ 65．絋ぶ· ,16,371. 49, il2 24;600. ;11!6 220,•パ、 ・ 『 ‘91\n·\" • .\ntり ： ． ・ ．． 雑 ．＾ ロ ・費 計 ・ ⑬ �: ｀,; ・ . 函 23, 4 ． ,: 2 0盆 2も ， ' 1 ：• . 9 • ,•. 3 5 , 9 7 ， , . 叫 5 .9 5 ' .,. 9 - , ． . 6 ， 1 2. 1 74 2. .' 、 .3 66 7 , 8 9, 2 . 0 24 1 . , . 265 554 • . 7 . ． , 3 1 ． 9 7 5 6 , , 心 88 1 1\n. •,:·····し\n＼\n． i ` · • こ．．· - ． ·: ） ; 、 . ヽ 一\nh\n＇じr\nヽ ；\n-.\nI卜\ni\n・\n• ` ． ．"
}