{
  "number": "13770",
  "title": "法人税更正処分等取消請求上告及び上告受理事件",
  "court": "最高裁判所",
  "date": "令和４年１１月１１日",
  "date_iso": "2022-11-11",
  "result": "取消",
  "topics": [],
  "laws": [],
  "keywords": [],
  "sections": {
    "主文": [
      "１ 本件上告を棄却する。\n２ 本件を上告審として受理しない。\n３ 上告費用及び申立費用は上告人兼申立人の負担とする。"
    ]
  },
  "full_text": "13770 法人税更正処分等取消請求上告及び上告受理事件 - 国税庁判決事例集\n\n\n\n\n\n\n\n\n\n\n目次に戻る\n\n\n\n\n判決 13770\n\n\n法人税更正処分等取消請求上告及び上告受理事件\n\n\n\n\n裁判所:\n 最高裁判所\n\n\n判決日:\n 令和４年１１月１１日\n\n\n結果:\n 取消\n\n\n\n\n\n\n主文\n\n\n１ 本件上告を棄却する。\n２ 本件を上告審として受理しない。\n３ 上告費用及び申立費用は上告人兼申立人の負担とする。\n\n\n\n\n\n\n第２ 理由\n\n\n１ 上告について民事事件について最高裁判所に上告をすることが許されるのは民訴法３１２条１項又は２項所定の場合に限られるところ、本件上告の理由は、違憲及び理由の不備・食違いをいうが、\nその実質は単なる法令違反を主張するものであって、明らかに上記各項に規定する事由に該当しない。\n２ 上告受理申立てについて本件申立ての理由によれば、本件は、民訴法３１８条１項により受理すべきものとは認められない。\n令和４年１１月１１日最高裁判所第二小法廷裁判長裁判官 岡村 和美裁判官 三浦 守裁判官 草野 耕一裁判官 尾島 明\n・・上告人兼申立人同代表者代表取締役同 訴 訟 代 理 人 弁 護 士当事者目録被上告人兼相手方同代表者法務大臣同 指 定 代 理 入株 式 会 社 ・ ・ 白 · ■ �\nヽ＇\nB\ni野 信 次\n-梨\n木康．祐 弘司\n9 ` • •\n:\n.. ．\n.出 .・. ・· • ・ •\n.\n•.\n. .\n ． ． ． ． ． \n \n．\n． ．\n·-一"
}