{
  "number": "13778",
  "title": "所得税更正処分取消等請求事件",
  "court": "大阪地方裁判所",
  "date": "令和４年１１月３０日",
  "date_iso": "2022-11-30",
  "result": "取消",
  "topics": [],
  "laws": [],
  "keywords": [],
  "sections": {
    "主文": [
      "１ 原告の請求をいずれも棄却する。\n２ 訴訟費用は原告の負担とする。"
    ]
  },
  "full_text": "13778 所得税更正処分取消等請求事件 - 国税庁判決事例集\n\n\n\n\n\n\n\n\n\n\n目次に戻る\n\n\n\n\n判決 13778\n\n\n所得税更正処分取消等請求事件\n\n\n\n\n裁判所:\n 大阪地方裁判所\n\n\n判決日:\n 令和４年１１月３０日\n\n\n結果:\n 取消\n\n\n\n\n\n\n主文\n\n\n１ 原告の請求をいずれも棄却する。\n２ 訴訟費用は原告の負担とする。\n\n\n\n\n\n\n第１ 請求\n\n\n１ 処分行政庁が平成３０年１月２４日付けでした原告の平成２４年分の所得税の更正処分のうち総所得金額５７９万２３３６円、納付すべき税額マイナス９２万３４８０円を超える部分及び過少申告加算税賦課決定処分を取り消す。\n２ 処分行政庁が平成３０年１月２４日付けでした原告の平成２５年分の所得税及び復興特別所得税の更正処分のうち総所得金額５９６万００７６円、納付すべき税額マイナス１０４万８\n３９７円を超える部分並びに過少申告加算税賦課決定処分を取り消す。\n３ 処分行政庁が平成３０年１月２４日付けでした原告の平成２６年分の所得税及び復興特別所得税の更正処分のうち総所得金額６４６万４９０４円、納付すべき税額マイナス５５万７４\n９４円を超える部分並びに過少申告加算税賦課決定処分を取り消す。\n\n\n\n\n\n\n第２ 事案の概要本件は\n\n\n、弁理士業務を営む原告が、処分行政庁から、平成２４年分の所得税並びに平成２５年分及び平成２６年分の所得税及び復興特別所得税（以下、平成２４年分から平成２６年分までを「本件各年分」といい、上記各税を「本件各年分の所得税等」という。）について、本件各年分の事業所得の総収入金額及び必要経費の金額に誤りがある、すなわち、売上げの計上漏れ及び必要経費の過大計上があるなどとして、本件各年分の所得税等の各更正処分（以下「本件各更正処分」という。また、本件各更正処分のうち、平成２４年分のものを「本件平成２４年分更正処分」といい、平成２５年分のものを「本件平成２５年分更正処分」といい、平成２６年分のものを「本件平成２６年分更正処分」という。）及び各過少申告加算税賦課決定処分（以下、「本件各賦課決定処分」といい、本件各更正処分と併せて「本件各処分」\nという。）を受けたところ、本件各処分について、本件各年分の所得税等の税務調査に手続上の違法があり、また、原告の収入ではない他者の売上げが原告の事業所得に係る総収入金額に算入されているなどとして、本件各処分（本件各更正処分については各申告額を超える部分）の取消しを求める事案である。\n１ 法律の定め\n\n\n（１）国税通則法（以下「通則法」という。）７４条の１１第２項は、国税に関する調査の結果、\n更正決定等をすべきと認める場合には、当該職員は、当該納税義務者に対し、その調査結果の内容（更正決定等をすべきと認めた額及びその理由を含む。）を説明するものとすると規定する。\n\n\n（２）所得税法２７条１項は、事業所得とは、農業、漁業、製造業、卸売業、小売業、サービス業その他の事業で政令で定めるものから生ずる所得（山林所得又は譲渡所得に該当するものを除く。）をいうと規定し、同条２項は、事業所得の金額は、その年中の事業所得に係る総収入金額から必要経費を控除した金額とすると規定する。\n２ 前提事実（争いのない事実、顕著な事実及び後記の証拠（枝番号のある書証について特に明記しない限り枝番号を含む。以下同じ。）により容易に認められる事実）\n\n\n（１）原告及び株式会社Ａア 原告は、弁理士として「Ｂ」の屋号で特許事務所を経営し、国内特許及び国際特許の出願申請、特許異議の申立て並びに技術翻訳等の業務に従事している（争いのない事実。以下、原告が経営する特許事務所に係る事業を「本件事業」という。）。\nイ 株式会社Ａ（以下「Ａ社」という。）は、平成２２年８月●日、翻訳、翻訳者の派遣及びマネージメント業並びに日本語・外国語の文書作成業務等を目的として設立された（甲\n４１、乙２８）。\n原告の長女である乙（以下「乙」という。）が、Ａ社の代表者を務めている（甲４１、\n乙２５、２８）。\n\n\n（２）本件各年分の所得税等に係る確定申告、税務調査及び本件各処分の経緯（別表２「課税の経緯（所得税等）」（なお、別表１は欠番である。）参照）\nア 原告は、本件各年分の所得税等について、いずれも法定申告期限内に、原告の当時の住所地（大阪市都島区）を所轄する旭税務署長に対し、確定申告をした（乙１から３まで。\n以下、原告が提出した本件各年分の所得税等の確定申告書を、順次、「本件平成２４年分確定申告書」、「本件平成２５年分確定申告書」及び「本件平成２６年分確定申告書」という。）。\nイ 大阪国税局の調査担当職員（以下「本件調査担当者」という。）は、平成２７年１０月\n６日、原告の本件各年分の所得税等に関する調査（以下「本件調査」という。）を開始した（甲２１）。\n本件調査においては、本件調査担当者から平成２８年１月２７日時点での問題点を整理した表により問題点が指摘されたが（どの書面に基づきどのような対処がされたのかは争いがある。）、本件調査に係る通則法７４条の１１第２項所定の調査結果の内容の説明（以下「本件調査結果説明」という。）はされなかった。\nウ 旭税務署長は、平成３０年１月２４日付けで、原告に対し、本件各処分をした（甲９から１１まで）。\nエ 原告は、平成３０年３月３０日、本件各処分を不服として、国税不服審判所長に対し、\n審査請求をしたところ、国税不服審判所長は、平成３１年３月２６日付けで、これを棄却する旨の裁決をした（甲２１）。\n\n\n（３）本件訴えの提起原告は、令和元年９月２６日、本件訴えを提起した（顕著な事実）。\n原告は、本訴係属中に肩書地に転居し、同所を所轄する神田税務署長が処分行政庁としての事務を承継した（顕著な事実）。\n３ 本件各処分の適法性に関する被告の主張別紙「被告の主張する本件各処分の適法性」記載のとおりである。なお、同別紙において定める略称等は、以下においても用いることとする。\n原告は、本件訴訟において、後記４の争点に関する部分を除き、その計算の基礎となる金額及び計算方法を争っていない（第７回口頭弁論調書参照）。\n４ 争点\n\n\n（１）本件調査の終了の際の手続が通則法７４条の１１第２項に違反するか、同項に違反するとして本件各処分を取り消すべき違法があるか。\n\n\n（２）被告の主張する原告の事業所得に係る総収入金額には、原告の収入ではないＡ社の売上げ\n（Ａ社の収入）が計上されているか。\n\n\n（３）本件調査において本件調査結果説明がされず、本件調査担当者からは「国税局調査による指摘事項」と題する書面（甲１９、３７、４０。以下「本件指摘事項」という。）に基づく説明がされたことから、原告の本件各年分の「課税される総所得金額」は、本件指摘事項記載の金額に基づき算出されることになるといえるか。\n５ 争点に関する当事者の主張\n\n\n（１）争点\n\n\n（１）（本件調査の終了の際の手続が通則法７４条の１１第２項に違反するか、同項に違反するとして本件各処分を取り消すべき違法があるか。）について\n（原告の主張）\nア 本件調査担当者（大阪国税局の調査担当職員）は、原告に対し、本件調査結果説明をしなかった。\nしたがって、本件調査は、通則法７４条の１１第２項に違反する。そして、本件調査において本件調査結果説明が原告に対して一切行われなかったことは、本件各処分の取消事由に該当する。\nイ 被告は、調査結果の内容の説明を行わなかったことについて合理的な理由がある場合には、通則法７４条の１１第２項違反はないと主張するが、そのような解釈が正当とされる余地はない。\nウ 被告は、原告が本件調査担当者による本件調査結果説明のための日程調整等の依頼にあえて応じなかったと主張する。しかし、本件調査担当者から、１年以上も音沙汰がなかったところ、いきなり連絡があり、原告としては、日程調整に関し、年末年始を避けて欲しいという要望をしたにすぎない。原告は、本件調査担当者による日程調整の依頼に応じなかったわけではなく、本件調査結果説明を受ける機会を放棄したわけでもない。\n（被告の主張）\nア 通則法７４条の１１第２項所定の調査結果の内容の説明（以下「調査結果説明」という。）が行われなかった場合であっても、そのことに合理的な理由がある場合には同項に反する違法はないと解される。\n原告は、本件調査担当者による本件調査結果説明に関する日程調整等の依頼にあえて応じず、本件調査結果説明を受ける機会を自ら放棄したというべきであり、本件調査において本件調査結果説明が行われなったことに合理的な理由がある。\nしたがって、本件調査には、同項に反する違法はない。\nイ 仮に、本件調査において本件調査結果説明が行われなかったことが調査手続の瑕疵と評価されるとしても、調査手続の瑕疵は、重大な違法を帯びる場合に限り、課税処分の取消事由となるものと解すべきであり、当該瑕疵は本件各処分の取消事由とはなり得ない。\nウ したがって、本件各処分は適法である。\n\n\n（２）争点\n\n\n（２）（被告の主張する原告の事業所得に係る総収入金額には、原告の収入ではない\nＡ社の売上げ（Ａ社の収入）が計上されているか。）について\n（原告の主張）\nア 被告の主張する原告の事業所得に係る総収入金額には、次のＡ社からの業務請負収入金額が算入されているが、これはＡ社の売上げすなわちＡ社の収入であり、原告の収入ではない。なお、本件各更正処分において、原告が納付すべき所得税等の金額が高額になっているのは、Ａ社の売上げが原告の収入に含めて計算される一方で、Ａ社の経費（損金）が原告の必要経費として認められていないためである。\n平成２４年分のＡ社の売上げ\n９２３５万８０５５円（金額につき別表６－７参照）\n平成２５年分のＡ社の売上げ\n１億０３４８万９６８５円（金額につき別表７－６参照）\n平成２６年分のＡ社の売上げ\n１億１３８０万６２４２円（金額につき別表８－７参照）\nイ 前記アによれば、本件各年分における原告の事業所得に係る総収入金額は、次のとおりとなる。\n平成２４年分 ２億２８７９万５０４３円\n（計算式）３億２１１５万３０９８円（被告の主張する総収入金額の額。別紙「被告の主張する本件各処分の適法性」記載１\n\n\n（１）\nア（ア）参照）\n－９２３５万８０５５円平成２５年分 ２億２０６６万１４７６円\n（計算式）３億２４１５万１１６１円（被告の主張する総収入金額の額。同別紙記載\n１\n\n\n（２）ア（ア）参照）\n－１億０３４８万９６８５円平成２６年分 ２億０７６８万２５６８円\n（計算式）３億２１４８万８８１０円（被告の主張する総収入金額の額。同別紙記載\n１\n\n\n（３）ア（ア）参照）\n－１億１３８０万６２４２円\n（被告の主張）\n原告がＡ社の売上げすなわちＡ社の収入であって原告の収入ではないと主張する業務請負収入金額は、原告とＡ社との間の業務委託契約に基づく報酬としてＡ社から原告に対して支払われたものであるから、いずれも原告の事業所得に係る収入に当たることは明らかである。\nしたがって、本件各処分は適法である。\n\n\n（３）争点\n\n\n（３）（本件調査において本件調査結果説明がされず、本件調査担当者からは本件指摘事項に基づく説明がされたことから、原告の本件各年分の「課税される総所得金額」は、\n本件指摘事項記載の金額に基づき算出されることになるといえるか。）について\n（原告の主張）\n本件調査担当者が本件調査に基づき本件各年分の所得税等について作成したものが、本件指摘事項である。原告は、平成２８年１月２７日頃、本件調査担当者との間で、本件指摘事項を基に話合いをし、その際、本件調査担当者に対し、必要であれば、修正申告をすると伝えた。しかし、本件調査担当者から、調査中に修正申告をするとややこしくなるので修正申告をしないようにと指摘された。\n上記話合いの後、本件調査担当者から、まだ提出していない必要経費に関する書類があれば提出するようにという指示があった。原告は、クレジットカードの引き落としに必要経費に該当する支払があり、これを裏付ける書類があるのに、これを提出していなかったから、\nその書類を提出すると伝えた。そうすると、本件調査担当者から、クレジットカードの引き落としに係る必要経費該当性について、項目ごとに「○」「×」「？」の印を付けて回答するように求められたため、原告は、これに応じて、期限内に回答をした。\n原告が上記回答を提出した後、本件調査担当者は、不明点や必要経費該当性が分からない部分については再度質問等をすることになるとして、調査を進行すると回答した。しかし、\n本件調査担当者は、調査を進行すると回答した後、原告に対し、クレジットカードに係る必要経費該当性の調査結果や調査の途中経過の回答をせず、本件調査において本件調査結果説明もしなかった。\nその後、本件各更正処分がされたところ、本件各更正処分の内容と本件指摘事項の内容は、金額が大きく異なっていた。\n本件調査において本件調査結果説明がされていないのであるから、少なくとも、原告が説明を受けた本件指摘事項の範囲でのみ課税処分がされるべきである。\nそうすると、課税される総所得金額は、次のとおりとなる。\n平成２４年分 ６５４２万１０００円\n（計算式）５７９万２３３６円（平成２４年分確定申告における総所得金額。別表２参照）\n＋６１６２万５８６４円（本件指摘事項における平成２４年分の増加額）\n－ １９９万６４１２円（平成２４年分確定申告における所得控除額の合計。別表２参照）\n（１０００円未満切捨て。通則法１１８条１項）\n平成２５年分 ４８１９万３０００円\n（計算式）５９６万００７６円（平成２５年分確定申告における総所得金額。別表２参照）\n＋４４２６万３１３８円（本件指摘事項における平成２５年分の増加額）\n－ ２０２万９４７３円（平成２５年分確定申告における所得控除額の合計。別表２参照）\n（１０００円未満切捨て）\n平成２６年分 ３４８２万２０００円\n（計算式）６４６万４９０４円（平成２６年分確定申告における総所得金額。別表２参照）\n＋３０３２万６０７０円（本件指摘事項における平成２６年分の増加額）\n－ １９６万８８４５円（平成２６年分確定申告における所得控除額の合計。別表２参照）\n（１０００円未満切捨て）\n（被告の主張）\nア 本件調査担当者は、平成２８年１月２７日、原告の関与税理士であった丙税理士（以下「丙税理士」という。）と面接し、丙税理士に対し、同日までに行った調査において把握した問題点を整理した表（乙７０。以下「本件整理表」という。）を提示した。本件指摘事項は、本件調査担当者が作成したものではなく、これを原告ないし丙税理士に提示したこともない。本件整理表と本件指摘事項の記載内容がほぼ同一であること等からすると、\n本件指摘事項は、丙税理士が本件整理表の内容を基にして、原告に説明するために作成したものである可能性が極めて高い。\n本件指摘事項は、本件調査担当者が作成したものではないから、前記（原告の主張）\n記載の原告の主張は、その前提を欠くものである。\nイ もっとも、本件調査担当者が本件整理表を作成して丙税理士に提示するなどした事実はある。この点で、原告の主張が、原告の本件各年分の「課税される総所得金額」が本件整理表記載の金額に基づき算出されるべきである旨の主張であるとしても、次のとおり、\nこの主張には理由がない。\nすなわち、本件整理表は、本件調査担当者が、本件調査が継続中の平成２８年１月２\n７日時点において把握した問題点を整理した表であって、本件整理表に記載した税額等も、\nその時点において判明していた事実等に基づき算出されたものにすぎない。納税者が納付すべき税額は、納税義務の成立後、国税に関する法律の定める手続を経て確定するものである（通則法１５条１項）。税務調査が終了していない時点において判明していた事実等に基づき算出された税額等をもって、納付すべき税額が確定することはないので、上記主張には理由がない。\nウ したがって、本件各処分は適法である。\n\n\n\n\n\n\n第３ 当裁判所の判断\n\n\n１ 認定事実後記の証拠及び弁論の全趣旨によれば、以下の事実が認められる。\n\n\n（１）原告とＡ社との間の業務委託契約ア 原告及びＡ社は、平成２３年９月２日付けで、以下の内容の業務委託契約（以下「本件業務委託契約」という。）を締結した（甲５の１）。\n（ア）Ａ社は、Ａ社が受注した翻訳業務及びこれに付随する一切の業務等の全部又は一部を原告に委託し、原告はこれを受託する（本件業務委託契約に係る契約書２条１項。以下、\n本件業務委託契約に基づき、Ａ社が原告に委託する業務を「本件委託業務」という。）。\n（イ）Ａ社は、原告に対し、本件委託業務の対価として、Ａ社の毎月の売上金の８７％に相当する額を、現金手渡しの方法により支払う（同契約書３条１項及び２項）。\n経済事情の変動等により、上記対価が不相当となったときは、原告及びＡ社が協議の上、これを改定できるものとする（同契約書３条３項）。\n（ウ）本件業務委託契約の有効期間は、本件業務委託契約の締結の日から１年とし、契約期間満了の日の３か月前までに、原告及びＡ社のいずれからも何ら申出のない場合は、本件業務委託契約と同一条件で更に１年間更新するものとし、以後も同様とする（同契約書７条）。\nイ 原告は、本件業務委託契約に基づき、Ａ社から技術翻訳や特許翻訳に係る外注を受け、\n外部の翻訳業者や翻訳者に翻訳させ、Ａ社からその売上金の８７％に相当する金額を業務請負の報酬（本件委託業務の対価）として受領していた（弁論の全趣旨）。\n\n\n（２）原告の収入や必要経費に関する本件調査担当者と原告及び原告の税理士との間でのやり取り本件調査担当者は、平成２７年１０月６日、本件調査を開始した（前記前提事実\n\n\n（２）\nイ）。\n本件調査の開始後１年以上の期間にわたって、本件調査担当者と原告及び原告の税理士との間で、原告の収入や必要経費についてやり取りがされた（弁論の全趣旨）。当該やり取りの一部は、以下のとおりである。\nア 本件調査担当者は、平成２８年１月６日、原告の関与税理士であった丁税理士（以下\n「丁税理士」という。）と面接した。丁税理士は、平成２７年１２月に新たに本件調査に関与することとなったところ、本件調査における問題点について原告から説明を受けておらず、前任の関与税理士から引継ぎも受けていないと述べた。本件調査担当者は、丁税理士に対し、本件調査において把握した問題点を説明しようとしたところ、丁税理士にその後の予定があったため、上記問題点の一部について説明したにとどまった。\n本件調査担当者は、平成２８年１月１５日、丁税理士と面接し、本件調査において把握した問題点を改めて説明するなどした。本件調査担当者は、丁税理士に対し、必要経費の業務関連性等について同月末までに回答するよう依頼した。丁税理士は、同月末までに回答するのは難しいと思うが、その場合には途中経過を回答する旨述べた。\nその後しばらくして、丁税理士は、原告から解任された。\n（乙６３）\nイ 本件調査担当者は、同月２７日、新たに本件調査に関与することとなった丙税理士と面接し、丙税理士に対し、本件整理表（乙７０。本件調査担当者が同日までに行った調査において把握した問題点を整理した表）を提示した上で、本件調査担当者が同日までの調査において把握した問題点を説明するなどした。その際、本件調査担当者は、丙税理士に対し、本件整理表を提示したが、本件整理表ないしその写しを交付しなかった。一方、丙税理士は、原告に説明するための記録を残したいとして、本件整理表の内容を書き写した。\nそして、本件調査担当者は、丙税理士に対し、丁税理士に必要経費の業務関連性等について同月末までに回答するよう依頼したことを伝えた上で、丙税理士にも同様の依頼をした。\n丙税理士は、同月２８日、本件調査担当者に電話をし、上記問題点の一部について再度の説明を求めた。本件調査担当者は、これに応じて説明をした。\n本件調査担当者が、同年２月１日、丙税理士に電話をしたところ、丙税理士は、本件調査担当者に対し、同年１月２９日に原告と面接し、本件調査担当者が同月２７日に丙税理士に説明した上記問題点を原告に説明した旨等を述べた。\n本件調査担当者は、同年２月４日、丙税理士と面接し、丙税理士に対し、同年１月２７日に依頼した事項等について、同年２月１９日までに回答するように依頼した。丙税理士は、確認する事項が多いため、同日までに回答できるか分からない旨述べた。\nその後、本件調査担当者は、丙税理士と複数回面接し、進捗状況を確認するなどした。\n本件調査担当者は、同月２６日、原告の事務所において、丙税理士及び乙と面接した。\n原告は、同事務所内にいたが、体調が悪く、本件調査担当者と面接できないとして、乙が対応することとなった。本件調査担当者は、丙税理士等から、依頼していた事項に関する回答を受け、その回答内容を確認するなどした。\n（乙６３、７０、７１、弁論の全趣旨）。\nウ 原告の関与税理士と本件調査担当者との折衝の結果、原告は、同年４月１５日頃、本件調査担当者から、カードの使用明細書等を基に作成した表を示され、項目ごとに業務関連性の有無を回答するように求められた。\nそのため、原告は、上記表の項目ごとに、業務関連性があると考えたものに「〇」印を、\n業務関連性がないと考えたものに「×」印を、業務関連性の有無が不明であると考えたものに「？」印をそれぞれ付けるなどし、その表を本件調査担当者に提出した。\nその後も、原告の関与税理士と本件調査担当者との間で、上記表を基に何度も折衝が行われた。\n（甲２０、弁論の全趣旨）\n\n\n（３）本件調査結果説明に関する原告と本件調査担当者との間のやり取りア 本件調査担当者は、原告に本件調査結果説明を実施するため、平成２９年１１月２７日、\n原告に電話をし、原告に対し、本件調査の終了に向けて面会して説明したいことがあるとして、本件調査結果説明の日程調整を依頼したところ、原告は、「こちらも忙しいし。消費税の還付についてはどうなっているのか。きちんと計算したら還付になると言ったはずだし、何を説明するのか、その前に、こちらの質問に答えるべきです。」と述べた。本件調査担当者が、原告に対し、売上げや経費について検討した結果を説明する旨及び消費税についても同様に説明する旨述べたところ、原告から経理担当という者へと電話の応対者が替わり、その者は、本件調査担当者に対し、本件調査に時間が掛かっている理由を尋ねるなどした上で、本件調査担当者が噓つきであるなどと述べ、噓つきに話す必要はないとして、電話を切った。\n（乙５、６）\nイ 本件調査担当者は、本件調査結果説明の日程調整をするため、同月２８日、原告に電話をしたが、応答した事務員から、原告は不在であるとの回答を受けたため、同事務員に対し、翌日に改めて電話すると伝えた。\n（乙５、７）\nウ 本件調査担当者は、本件調査結果説明の日程調整をするため、同月２９日、原告に電話をし、原告に対し、調査結果説明について説明を始めたところ、原告が、突然激高してこれを遮り、「〇×を付けさせたことについて返事をもらっていない。」、「消費税も還付すると言ったのにまだ還付がない。」と述べた。本件調査担当者は、原告に対し、法令の定めに基づき原告に本件調査結果説明をするとして日程調整を依頼したが、原告は、「まだ調査も終わっていないのに、終了の手続とは何事か。」と述べ、電話を切った。\n（乙５、８）\nエ 本件調査担当者は、本件調査結果説明の日程調整をするため、同年１２月１日に２回、\n同月４日に１回、同月５日に３回、原告に電話をしたが、応答した事務員から、原告が来客対応中であり、多忙であり、又は不在であることを理由として電話に出ることができないと回答され、原告と話をすることができなかった。本件調査担当者は、上記事務員に対し、原告に本件調査担当者に電話するよう伝えるよう依頼したが、原告は、本件調査担当者に電話を掛けなかった。\n（乙５、９）\nオ 本件調査担当者は、本件調査結果説明を行うため、同月６日午前１０時７分頃、大阪市都島区所在の原告の事務所を訪れたが、応対した事務員から、原告はまだ出社しておらず、\nいつ頃出社するかも分からないとの回答を受けたため、同事務員に改めて訪れる旨伝え、\n上記事務所から立ち去った。\n本件調査担当者は、同日午後１時１７分頃、再び上記事務所を訪れたが、応対した事務員から、上記と同様の回答を受けた。そのため、本件調査担当者は、同事務員に対し、同日付けの「連絡せん」と題する書面（以下「本件第１連絡せん」という。）を、原告に渡すよう依頼した上で手交した。本件第１連絡せんには、①本件調査結果説明等をするために同日訪れたが不在であった旨、②本件調査結果説明等をするため、同月８日午前１０時頃に訪れるので在室しておいて欲しい旨、③都合が悪い場合は、本件調査担当者に対し、\n同月７日午後５時までに連絡して欲しい旨が記載されていた。\n本件調査担当者は、同月６日午後１時２５分頃、原告の事務員からの電話を受けたところ、同事務員は、本件調査担当者に対し、他の事務員が本件第１連絡せんを受け取ったところ、従前から原告は年内の対応が難しいと伝えていた旨、消費税の還付や経費の金額についての答えがない旨、以前に書類を出せと言われて、従業員一同必死になって作業して、\n経費の内容を提出したのに１０か月も連絡がなく、その作業のせいで心療内科に通うようになった従業員や不眠症になった従業員がいる旨等を述べた。本件調査担当者は、同事務員に対し、年内の日程は無理であるとしても、日程調整の連絡を取りたい旨等を述べた。\nこれに対し、同事務員は、原告が聞きたいことについて触れられていない旨、話し合いを拒否しているわけではなく、年内は日程調整が難しいことは伝えている旨、原告が聞きたいことは、リース料や人件費等の経費のことと、消費税の還付がいくらになるかということである旨を述べ、電話を切った。\n（乙５、１０、１１）\nカ 本件調査担当者は、本件調査結果説明を行うため、同月８日午前１０時頃、前記事務所を訪れ、応対した事務員に対し、本件第１連絡せん記載のとおり訪れたことを伝えたところ、同事務員から、原告は不在である旨の回答を受けた。そのため、本件調査担当者は、\n同事務員に対し、同日付けの「連絡せん」と題する書面（以下「本件第２連絡せん」という。）を、原告に渡すよう依頼した上で手交した。本件第２連絡せんには、①本件調査結果説明等をするために同日訪れたが不在であった旨、②これまで再三にわたり日程調整の連絡をしたが、多忙を理由として本件調査結果説明等ができていない状況となっている旨、\n③本件調査結果説明等を行うため、都合が良い日時を連絡して欲しい旨、④同月１２日午後５時までに都合が良い日時の連絡がない場合は、本件調査の結果に基づき更正等の通知を行うこととなる旨が記載されていた。\n本件調査担当者は、同月８日午前１０時５分頃、原告の事務員からの電話を受けたところ、同事務員から電話を替わった原告は、本件調査担当者に対し、「１月に資料を送ったのに何も計算しないでおいて、調査に協力しないとは何事だ。」、「〇×とかさせといて、\n資料も送らせといて１０か月もその回答がない。」、「消費税を還付するというのもそっちが言ったことではないか。」などと述べた。本件調査担当者は、その回答も含めて説明したいので、日程調整を依頼している旨述べたところ、原告は、東京での裁判もあり、年末は忙しい旨述べた。本件調査担当者は、年明けでも構わないので日程調整をして欲しいと述べたが、原告は、年末は忙しい旨述べ、電話を切った。\n本件調査担当者は、同日午前１０時２２分頃、原告の事務員から電話を受けた。同事務員は、本件調査担当者に対し、本件第２連絡せんに、同月１２日午後５時までに日程調整の連絡をするように書いてあったため電話をしたところ、年末年始は忙しいので、年が明けたら連絡ができると思うと述べた。本件調査担当者が、同事務員に対し、具体的に年明けのいつ頃になるか分かるかと尋ねたところ、同事務員は、今はめどが立たず、いつとは言えない旨述べた。本件調査担当者は、同事務員に対し、年明けであれば、平成３０年１月４日から本件調査担当者に電話がつながるので、それ以降に連絡するように依頼した。\n原告及び原告の事務員は、平成２９年１２月８日午前１１時５分頃、大阪国税局納税者支援調整官に電話をし、本件調査担当者の対応について苦情の申立てをした。これを受けて、本件調査担当者は、原告に電話をしたが、原告が不在であったことから、原告の事務員に対し、原告に折り返し電話をするように伝えるよう依頼した。\n本件調査担当者は、同日午前１１時４５分頃、原告からの電話を受け、原告に対し、①年明けの平成３０年１月４日及び同月５日に日程調整の連絡をして欲しいこと、②原告と会って本件調査結果説明を行う日を同月９日から同月１７日までの間で調整して欲しいこと、③同月５日までに連絡がない場合は、本件調査の結果に基づき更正処分をすることを、\n依頼ないし説明したところ、原告は、年末年始は忙しいので、同月４日や同月５日に連絡するのは難しい旨を一旦は回答したものの、本件調査担当者が、連絡がない場合は本件調査の結果に基づき更正処分をすることになるため、必ず連絡して欲しい旨改めて依頼ないし説明したところ、原告は、これを了承した。\n本件調査担当者は、平成２９年１２月８日午後０時５分頃、原告の事務員からの電話を受けた。同事務員は、原告から平成３０年１月４日及び同月５日は出張のため電話できないと伝えるように言われたと述べた。これに対し、本件調査担当者は、同事務員に対し、\n原告が多忙であることは承知しているが、電話で日程調整をするだけなので必ず期限を守って欲しいと述べるとともに、同月９日から同月１７日までの間で会える日を調整した上で、必ず期限までに連絡するよう、原告に伝えるよう依頼したところ、同事務員は、これを了承した。\n（乙５、１２から１６まで）\nキ 本件調査担当者は、平成２９年１２月１２日、前記事務所を訪れ、応対した事務員に対し、前記カの同月８日に原告に電話で説明した内容を文書にまとめて持参した旨伝えたところ、同事務員から、原告は不在である旨の回答を受けた。そのため、本件調査担当者は、\n同事務員に対し、同月１２日付けの「連絡せん」と題する書面（以下「本件第３連絡せん」\nという。）を、原告に渡すよう依頼した上で手交した。本件第３連絡せんには、①本件第\n２連絡せんにおいて連絡期日を同月１２日としていたが、原告から年末は多忙であるとの申出があったため、当該期日を延期する旨、②平成３０年１月９日から同月１７日までの間で本件調査結果説明等ができる都合の良い面接日時を、同月４日又は同月５日に連絡して欲しい旨、③同月５日までに連絡がない場合は、本件調査の結果に基づき更正等の通知を行うこととなる旨が記載されていた。\nなお、本件調査担当者は、このとき、不在とされていた原告が前記事務所内にいることを現認した。\n（乙５、１７）\nク 本件調査担当者は、前記カ及びキのとおり、電話及び本件第３連絡せんをもって、原告に対し、同月４日又は同月５日に連絡するよう依頼し、原告も一旦はこれを了承していたが、原告は、同月４日及び同月５日いずれの日にも、本件調査担当者に連絡をしなかった。\n本件調査担当者は、上記両日以降、本件各処分に係る各通知書の送達日である同月２４日まで、原告から連絡を受けることはなかった。\n（乙５、１８）\nケ 原告は、本件調査結果説明を受けることなく、同日付けで、本件各処分を受けた（弁論の全趣旨）。\n２ 争点\n\n\n（１）（本件調査の終了の際の手続が通則法７４条の１１第２項に違反するか、同項に違反するとして本件各処分を取り消すべき違法があるか。）について\n\n\n（１）判断枠組み税務調査は、租税の公平かつ確実な賦課徴収のために課税庁が課税要件の内容を構成する具体的事実の存否等を調査するための手続であり、課税要件そのものではないから、税務調査の手続に違法があるからといって、このことから直ちに課税処分の取消事由になるのではなく、当該調査が刑罰法規に触れたり公序良俗に反したりするような方法で行われたなどの税務調査の手続に重大な違法がある場合に限り、課税処分の取消事由になると解するのが相当である。\n\n\n（２）検討ア 原告は、前記認定事実\n\n\n（３）ケのとおり、本件調査結果説明（本件調査に係る通則法７\n４条の１１第２項所定の調査結果説明）を受けることなく、本件各処分を受けたことが認められる。\nしかしながら、前記認定事実\n\n\n（３）によれば、その経緯は、本件調査担当者が、何回にもわたって、電話及び書面（本件第１連絡せん、本件第２連絡せん及び本件第３連絡せん）\n等により、原告に対し、原告に配慮して１度は原告の日程調整の連絡期日の延期もした上で、本件調査結果説明を行う日程の調整を依頼するなどし、その日程を決めようとしていたにもかかわらず、原告において、自らの要望等を述べるなどしたのみで、上記の日程調整の依頼に誠実に対応しなかったことから、本件調査結果説明を行う日程が定まらず、その結果、本件調査結果説明が行われなかったというものであったと認められる。このような経緯に照らすと、本件調査結果説明が行われなかった主たる原因は原告にあるというべきであり、この点は、主に原告に帰責されるべきものであるといえる。\nイ これに対し、原告は、本件調査担当者から１年以上も音沙汰がなかったところ、いきなり連絡があり、原告としては、日程調整に関し、年末年始を避けて欲しいという要望をしたにすぎないと主張する。その内容に鑑みれば、原告は、前記認定事実\n\n\n（３）に係る認定事実を積極的に争う趣旨ではなく、そのような認定事実を前提とした上で、原告が本件調査担当者と日程調整がつかなかっただけで、本件調査結果説明を受ける機会を放棄したわけではないと主張しているものと解される。\nそこで検討するに、前記認定事実\n\n\n（３）のとおり、本件調査担当者は、平成２９年１１月２７日から本件調査結果説明のために原告との日程調整を開始し、年末は多忙であるとの原告の回答を踏まえ、平成３０年１月９日から同月１７日までを候補日として提示し、\nそのいずれを選択するかを、年の明けた同月４日又は同月５日に連絡するよう申し入れ、\n原告も１度はこれを了承したことが認められる。本件調査担当者による上記対応は、原告の言い分を踏まえて年末の日程を避けるとともに、日程調整の回答自体も年明けでよいとするもので、原告の事情に相当程度の配慮をしたものであるということができる。\n前記認定事実\n\n\n（３）ア、ウ、オ及びカのとおり、原告は、本件調査担当者に対し、消費税の還付や経費の認定についての回答がないことに憤りを感じていたことがうかがわれるところ、消費税の還付の可否は、本件調査の対象（本件各年分の所得税等に係る確定申告の適否）ではなく、経費の認定の可否は、まさに本件調査結果説明によって明らかにされるものである。したがって、原告による上記の憤りには一定の酌むべき事情が仮に存在していたとしても、そのことは、本件調査結果説明の日程調整に応じないことの正当な理由とはいい難い。\n確かに、原告の立場からすると、平成２９年１１月２７日に日程調整が開始され、数次の交渉を経て平成３０年１月９日から同月１７日までを候補日とされ、年末年始を挟んで\n１か月半ほどの間に本件調査結果説明を受諾せざるを得ない状態に追い込まれたと感じたことは否定できない。しかし、通則法７４条の１１第２項の定める調査結果説明は、税務調査の結果として更正決定等を行う前提として定められた手続であり、換言すれば、調査結果説明がなければ（極論すれば調査結果説明を拒絶し続ければ）税務調査に基づく更正決定等がそれだけ遅れかねないこととなるのであるから、時間的な余裕を十二分に取ることは困難な側面もある。\nしたがって、原告が本件調査結果説明の日程調整に応じなかったことに正当な理由はなく、本件調査結果説明の機会を原告自らが放棄したと受け止められてもやむを得ない事情があったといえる。\nウ そうすると、本件調査結果説明が行われなかった点について、通則法７４条の１１第２項の本来の趣旨に適合していたといえるか否かはともかく、その主たる要因は原告が正当な理由なく本件調査担当者による日程調整に応じなかったことにあったといえるから、直ちにこれを違法というのは困難であるし、少なくとも、本件調査について、刑罰法規に触れたり公序良俗に反したりするような方法で行われたなどの税務調査の手続に重大な違法があったということはできない。\nしたがって、本件調査結果説明が行われなかったことは、本件各処分の取消事由とはならず、この点に関し、本件各処分に違法はない。\n３ 争点\n\n\n（２）（被告の主張する原告の事業所得に係る総収入金額には、原告の収入ではないＡ社の売上げ（Ａ社の収入）が計上されているか。）について\n\n\n（１）被告は、原告の事業所得に係る総収入金額に算入されるべきＡ社からの業務請負収入金額として、平成２４年分について９２３５万８０５５円を（別表４－１、別表６－７参照）、\n平成２５年分について１億０３４８万９６８５円を（別表４－２、別表７－６参照）、平成\n２６年分について１億１３８０万６２４２円を（別表４－３、別表８－７参照）、それぞれ主張するのに対し、原告は、これらは、Ａ社の売上げないし収入であり、原告の収入ではないと主張する。\nそこで検討するに、前記認定事実\n\n\n（１）のとおり、原告は、本件業務委託契約に基づき、\nＡ社から、Ａ社の売上金の８７％に相当する金額を業務請負の報酬（本件委託業務の対価）\nとして受領していたところ、これが、上記の被告の主張するＡ社からの業務請負収入金額に当たると認められる。また、証拠（乙６９）によれば、Ａ社の総勘定元帳には、上記の被告の主張するＡ社からの業務請負収入金額と同額の金額が、原告（Ｂ）に対する外注費として計上されていることが認められる。\n以上によれば、上記の被告の主張するＡ社からの業務請負収入金額は、原告の事業所得に係る収入であると認められるので、原告の事業所得に係る総収入金額に算入されるべきものである。\nしたがって、これを前提とする本件各処分は、適法である。\n\n\n（２）原告は、前記\n\n\n（１）のＡ社からの業務請負収入金額は、Ａ社の売上げないし収入であり、\n原告の収入ではないと主張し、本件各更正処分において、原告が納付すべき所得税等の金額が高額になっているのは、Ａ社の売上げが原告の収入に含めて計算される一方で、Ａ社の経費（損金）が原告の必要経費として認められていないためであると主張するので、この点について改めて述べることとする。\nア 前記認定事実\n\n\n（１）の本件業務委託契約の内容等に照らし、Ａ社及び原告のそれぞれの経理処理を説示すると、以下のとおりとなる。\nまず、Ａ社の経理処理について説示すると、Ａ社が発注者から受注した翻訳業務等に係る報酬は、まさにＡ社が当該業務を履行した対価として受領するものであるから、Ａ社の売上げ（収入）に計上される。他方、Ａ社は、原告との間で本件業務委託契約を締結し、\n発注者から受注した翻訳業務等を原告に委託しているから、原告に委託した翻訳業務（本件委託業務）の履行の対価として原告に支払う報酬は、Ａ社の外注費（費用）として計上されることとなる。\n次に、原告の経理処理を説示すると、原告がＡ社から本件業務委託契約に基づき本件委託業務を受注し、これを履行する対価としてＡ社から受領する報酬は、原告にとっての売上げ（収入）に計上される。原告は、本件業務委託契約に基づき事業として本件委託業務を履行しているから、当該売上げは原告の事業所得に係る収入の金額になることとなる。\nすなわち、Ａ社が発注者から翻訳業務等につき受領した報酬がＡ社にとって売上げ（収入）となり、その金額の一部（８７％）に相当する金額が、原告との本件業務委託契約に基づき原告に委託した本件委託業務の履行の対価として原告に支払われることで、Ａ社にとっては費用として計上され、これを本件委託業務の履行の対価（報酬）として受領する原告にとっては事業所得に係る売上げ（収入）となる。\nこのように、Ａ社が、発注者からの売上金（収入）の金額の一部（８７％）に相当する金額を、本件業務委託契約に基づき本件委託業務の対価（報酬）として原告に支払うことにより、金員としては同じものでありながら、Ａ社にとっては費用として計上され、原告にとっては売上げ（収入）として計上されることは、何ら不合理ではない。\nイ また、原告は、上記の原告の主張を裏付ける証拠として、Ａ社作成の各請求書（甲３９の１から甲３９の４０まで）を提出する。\nこれは、Ａ社が受注した翻訳業務等に係るＡ社作成の発注者宛ての平成２４年１月分の請求書であると認められるから、その請求書に従って発注者がＡ社に金員を支払えば、その金員はＡ社にとって売上げに計上されるべきものである。\n証拠（乙６９の１（Ａ社の総勘定元帳））によれば、上記各請求書記載の金額の合計額\n（９０１万５０５２円）の８７％に相当する金額（７８４万３０９５円）が、Ａ社の総勘定元帳において、原告（Ｂ）に対する平成２４年１月分の外注費として計上されていることが認められる。同金額は、本件業務委託契約に基づき本件委託業務の対価としてＡ社が原告に対して支払う金額がＡ社にとって費用として計上されることを前提としたものであり、Ａ社が上記アにて説示した経理処理方法に基づいて記帳していることを示すものである。すなわち、Ａ社は、Ａ社が本件業務委託契約に基づき本件委託業務の対価として支払う金員が原告にとっての事業所得に係る売上げ（収入）として計上されることを前提としているといえる。\nそうすると、上記各請求書は、上記の原告の主張を裏付けるものとはいえず、むしろ前記\n\n\n（１）の認定を裏付けるものといえる。\nウ 前記\n\n\n（１）のとおり、Ａ社からの業務請負収入金額は、原告の事業所得に係る収入であると認められるので、これが原告の事業所得に係る総収入金額に算入されるのは当然である。\nまた、原告は、本件各更正処分に関し必要経費については争わないので（なお、原告は、\nかつては本件各更正処分に関し必要経費の一部を争う旨の主張をしていたが、その後、当該主張を全て撤回した。第７回口頭弁論調書参照）、本件において必要経費は被告主張のとおりと認められる。\nエ 以上によれば、上記の原告の主張は、理由がなく、採用することはできない。\n４ 争点\n\n\n（３）（本件調査において本件調査結果説明がされず、本件調査担当者からは本件指摘事項に基づく説明がされたことから、原告の本件各年分の「課税される総所得金額」は、本件指摘事項記載の金額に基づき算出されることになるといえるか。）について\n\n\n（１）原告は、本件調査において本件調査結果説明がされず、本件調査担当者からは本件指摘事項（甲１９、３７、４０。なお、本件指摘事項に記載の日付は平成２８年１月２７日である。）に基づく説明がされたのであるから、原告が説明を受けた本件指摘事項の範囲でのみ課税処分がされるべきである旨主張する。\n前記認定事実\n\n\n（２）イのとおり、本件調査担当者が、平成２８年１月２７日、丙税理士に対し、本件整理表（乙７０）を提示した上で、同日までの調査において把握した問題点を説明したことは認められるが、本件調査担当者が、原告に対し、本件指摘事項に基づき説明をしたと認めるに足りる証拠はない。ただし、本件整理表の内容と本件指摘事項の内容がおおむね同一であることからすると、前記認定事実\n\n\n（２）イのとおり、本件調査担当者から本件整理表に基づいて問題点等の説明を受けるとともに本件整理表の内容を書き写すなどした丙税理士が、原告に説明するために本件整理表の記載内容を基に本件指摘事項を作成し、原告に対し、本件指摘事項を交付した上で、上記の本件調査担当者から説明を受けた問題点を説明したと推認される。\nもっとも、前記認定事実\n\n\n（２）イのとおり、本件整理表及び本件指摘事項は、本件調査担当者が、本件調査が継続中であった平成２８年１月２７日において、それまでに行った調査により同日時点で把握していた問題点や、同日時点で把握していた事実関係に基づいて暫定的に算出した金額等を記載したもの、又は、その記載と同様の内容を記載したものにすぎないのであって、本件整理表及び本件指摘事項に記載された金額等は、原告の納付すべき税額を確定的に示すものではない。そして、その後も本件調査担当者と原告の関与税理士との間でカードの使用明細書についての検討等が続けられたこと（前記認定事実\n\n\n（２）ウ）、原告が本件調査結果説明の日程調整の過程で経費性の検討結果が明らかになっていないのに本件調査を終了することについて抗議したこと（前記認定事実\n\n\n（３）ア、ウ、オ及びカ）を踏まえると、原告も本件整理表ないし本件指摘事項をもって本件調査担当者の最終判断であるとは受け止めていなかったことが認められる。\nいずれにせよ、原告の主張は前提において誤りがあるから採用することができない。\n\n\n（２）仮に原告主張のとおり、本件調査担当者から原告に対して本件指摘事項に基づく説明がされたとしても、その説明どおりに課税処分がされるべきであるとの原告の主張は失当である。\nすなわち、通則法は、国税を納付する義務が成立する場合には、その成立と同時に特別の手続を要しないで納付すべき税額が確定する国税を除き、国税に関する法律の定める手続により、その国税についての納付すべき税額が確定されるものとする旨規定し（１５条１項）、\n国税についての納付すべき税額の確定の手続については、申告納税方式（納付すべき税額が納税者のする申告により確定することを原則とし、その申告がない場合又はその申告に係る税額の計算が国税に関する法律の規定に従っていなかった場合その他当該税額が税務署長又は税関長の調査したところと異なる場合に限り、税務署長又は税関長の処分により確定する方式）又は賦課課税方式（納付すべき税額がもっぱら税務署長又は税関長の処分により確定する方式）のいずれかの方式によるものとする旨規定している（１６条１項）。これらの規定に照らせば、税務調査をした国税局の職員の納税義務者に対する説明により納付すべき税額が確定することは現行法の下ではあり得ないのであって、本件調査担当者が原告に対し本件指摘事項に基づく説明をしたとしても、当該説明により原告が納付すべき税額が確定するわけではない。\n以上によれば、上記の原告の主張は採用することができない。\n\n\n（３）上記の原告の主張は、本件調査担当者が原告に本件指摘事項に基づく説明をした以上、本件指摘事項の範囲を超えて課税処分をするのは信義則に反するという主張とも解し得るので、\n検討する。\n租税法規に適合する課税処分について信義則の法理の適用による違法を考え得るのは、納税者間の平等公平という要請を犠牲にしてもなお当該課税処分に係る課税を免れしめて納税者の信頼を保護しなければ正義に反するといえるような特別の事情が存する場合でなければならないと解されるところ（最高裁昭和６２年１０月３０日第三小法廷判決・裁判集民事１\n５２号９３頁参照）、前記のとおり、本件整理表及び本件指摘事項は、本件調査担当者が、\n本件調査継続中の段階で把握していた問題点や、その段階で把握していた事実関係に基づいて算出した金額等を記載したもの等にすぎず、原告もこれを本件調査担当者による最終判断とは受け止めていなかったことが認められる。本件において、上記の特別の事情は認められない。\nそうすると、上記の原告の主張を上記のように解したとしても、本件各処分が信義則に反することを理由として違法となることはない。\nしたがって、この点に関し、本件各処分に違法はない。\n５ 本件各処分の適法性以上説示したところに弁論の全趣旨を総合すれば、原告が平成２４年分の所得税について納付すべき税額は、別紙「被告の主張する本件各処分の適法性」記載１\n\n\n（１）エのとおり３２\n８６万６３００円であり、原告が平成２５年分の所得税等について納付すべき税額は、同別紙記載１\n\n\n（２）エのとおり２７３３万８０００円であり、原告が平成２６年分の所得税等について納付すべき税額は、同別紙１\n\n\n（３）エのとおり３０８８万２８００円であると認められ、これらの金額は、いずれも本件各更正処分における納付すべき税額（別表２「課税の経緯（所得税等）」の「更正処分等」の各年分の「納付すべき税額」欄参照）を下回らないから、\n本件各更正処分は適法である。\nまた、本件各更正処分は適法であるところ、本件各更正処分に伴って賦課されるべき各過少申告加算税の額は、同別紙記載３のとおりである（平成２４年分の過少申告加算税につき４\n７９万８５００円、平成２５年分の過少申告加算税につき４０３万８０００円、平成２６年分の過少申告加算税につき４５９万３５００円）と認められ、本件各賦課決定処分における各過少申告加算税の額（同別表の「更正処分等」の各年分の「過少申告加算税の額」欄参照）\nと同額であるから、本件各賦課決定処分はいずれも適法である。\nしたがって、本件各処分はいずれも適法である。\n\n\n\n\n\n\n第４ 結論よって\n\n\n、原告の請求はいずれも理由がないからこれを棄却することとし、主文のとおり判決する。\n大阪地方裁判所第２民事部裁判長裁判官 森鍵 一裁判官 田辺 暁志裁判官 立仙 早矢別紙被告の主張する本件各処分の適法性\n１ 本件各更正処分の根拠\n\n\n（１）平成２４年分ア 総所得金額（別表３－１「平成２４年分（所得税）」欄の順号①） ９６０１万９９９５円上記金額は、本件事業に係る事業所得の金額（別表３－１「平成２４年分（所得税）」欄の順号②）と同額であり、次の（ア）の金額から（イ）の金額を控除した金額である。\n（ア）総収入金額（別表４－１「被告主張額」欄の順号①） ３億２１１５万３０９８円上記金額は、①原告が請求書の内容を手書きでまとめたノート（乙１９）、②原告が売上先に対して発行した請求書（乙２０）、③原告が売上先から受領した売上金を管理するために作成した売上げの一覧表（乙２１、２２）、④売上金の入金状況を管理していた一覧表（乙２３）、⑤原告と取引のある金融機関が作成した原告の口座への入金状況を示す資料（甲２６の１から甲２６の６まで）（以下、この①から⑤までを併せて「本件各収入関係資料」という。）のほか、本件調査等により把握した事項に基づき算出した平成２４年分の本件事業に係る収入金額の総額であり、その内訳は別表６－１ないし６－７のとおりである。\n（イ）必要経費の金額（別表４－１「被告主張額」欄の順号⑱） ２億２５１３万３１０３円上記金額は、①「Ｈ２４ 仕訳帳」、「Ｈ２５ 仕訳帳」及び「Ｈ２６ 仕訳帳 仮」と題する各データファイル（甲１２から１４まで参照）、②必要経費の支払先からの請求書及び領収書並びに③従業員の勤務表（乙２４）（以下、この①から③までを併せて「本件各経費関係資料」という。）のほか、本件調査等により把握した事項に基づき算出した平成２４年分の本件事業に係る必要経費の各金額の合計額であり、その内訳は、別表４－１の項目⑧（「被告主張額」欄の金額）、別表６－４及び６－５（いずれも「為替差損の合計金額」欄の金額）、別表９－１ないし９－１４並びに別表１２－１の順号１７の「被告主張額」の「合計」欄のとおりである。\nイ 所得控除の額の合計額（別表３－１「平成２４年分（所得税）」欄の順号③）\n１９９万６４１２円上記金額は、本件平成２４年分確定申告書に記載された所得控除の額の合計額（乙１・１枚目㉕欄）と同額である。\nウ 課税される総所得金額（別表３－１「平成２４年分（所得税）」欄の順号④）\n９４０２万３０００円上記金額は、前記アの総所得金額９６０１万９９９５円から前記イの所得控除の額の合計額１９９万６４１２円を控除した金額（ただし、通則法１１８条１項の規定により１０００円未満の端数を切り捨てた後の金額である。後記\n\n\n（２）ウ及び\n\n\n（３）ウについて同じ。）である。\nエ 納付すべき税額（別表３－１「平成２４年分（所得税）」欄の順号⑧）\n３２８６万６３００円上記金額は、次の（ア）の金額から（イ）の金額を差し引いた後の金額（ただし、通則法\n１１９条１項の規定により１００円未満の端数を切り捨てた後の金額である。）である。\n（ア）課税される総所得金額に対する税額（別表３－１「平成２４年分（所得税）」欄の順号\n⑤） ３４８１万３２００円上記金額は、前記ウの課税される総所得金額９４０２万３０００円に所得税法（平成２\n５年法律第５号による改正前のもの。以下、本条本項につき同じ。）８９条１項に規定する税率を乗じて算出した金額である。\n（イ）所得税の源泉徴収税額（別表３－１「平成２４年分（所得税）」欄の順号⑦）\n１９４万６８０６円上記金額は、本件事業に係る報酬等の受領に際し、源泉徴収されるべき所得税の金額の合計額であり、その内訳は別表６－１の「源泉徴収されるべき所得税の金額」欄のとおりである。\n\n\n（２）平成２５年分ア 総所得金額（別表３－１「平成２５年分（所得税等）」欄の順号①）\n７９９４万１３７６円上記金額は、本件事業に係る事業所得の金額（別表３－１「平成２５年分（所得税等）」\n欄の順号②）と同額であり、次の（ア）の金額から（イ）の金額を控除した金額である。\n（ア）総収入金額（別表４－２「被告主張額」欄の順号①） ３億２４１５万１１６１円上記金額は、本件各収入関係資料のほか、本件調査等により把握した事項に基づき算出した平成２５年分の本件事業に係る収入金額の総額であり、その内訳は別表７－１ないし\n７－６のとおりである。\n（イ）必要経費の金額（別表４－２「被告主張額」欄の順号⑱） ２億４４２０万９７８５円上記金額は、本件各経費関係資料のほか、本件調査等により把握した事項に基づき算出した平成２５年分の本件事業に係る必要経費の各金額の合計額であり、その内訳は、別表\n４－２の項目⑧（「被告主張額」欄の金額）、別表７－４及び７－５（いずれも「為替差損の合計金額」欄の金額）、別表１０－１ないし１０－１４並びに別表１２－２の順号１７の「被告主張額」の「合計」欄のとおりである。\nイ 所得控除の額の合計額（別表３－１「平成２５年分（所得税等）」欄の順号③）\n２０２万９４７３円上記金額は、本件平成２５年分確定申告書に記載された所得控除の額の合計額（乙２・１枚目㉕欄）と同額である。\nウ 課税される総所得金額（別表３－１「平成２５年分（所得税等）」欄の順号④）\n７７９１万１０００円上記金額は、前記アの総所得金額７９９４万１３７６円から前記イの所得控除の額の合計額２０２万９４７３円を控除した金額である。\nエ 納付すべき税額（別表３－１「平成２５年分（所得税等）」欄の順号⑧）\n２７３３万８０００円上記金額は、次の（ア）及び（イ）の各金額の合計額から（ウ）の金額を差し引いた後の金額（ただし、東日本大震災からの復興のための施策を実施するために必要な財源の確保に関する特別措置法（以下「復興財源確保法」という。）２４条２項の規定により１００円未満の端数金額を切り捨てた後のもの。後記\n\n\n（３）エについて同じ。）である。\n（ア）課税される総所得金額に対する税額（別表３－１「平成２５年分（所得税等）」欄の順号⑤） ２８３６万８４００円上記金額は、前記ウの課税される総所得金額７７９１万１０００円に所得税法８９条１項に規定する税率を乗じて算出した金額である。\n（イ）復興特別所得税額（別表３－１「平成２５年分（所得税等）」欄の順号⑥）\n５９万５７３６円上記金額は、復興財源確保法１３条の規定により、前記（ア）の課税される総所得金額に対する税額２８３６万８４００円に１００分の２．１を乗じて計算した金額である。\n（ウ）所得税及び復興特別所得税（以下「所得税等」という。）の源泉徴収税額（別表３－１\n「平成２５年分（所得税等）」欄の順号⑦） １６２万６０６４円上記金額は、本件事業に係る報酬等の受領に際し、源泉徴収されるべき所得税等の金額の合計額であり、その内訳は別表７－１の「源泉徴収されるべき所得税等の金額」欄のとおりである。\n\n\n（３）平成２６年分ア 総所得金額（別表３－１「平成２６年分（所得税等）」欄の順号①）\n８７４９万０１２２円上記金額は、本件事業に係る事業所得の金額（別表３－１「平成２６年分（所得税等）」\n欄の順号②）と同額であり、次の（ア）の金額から（イ）の金額を控除した金額である。\n（ア）総収入金額（別表４－３「被告主張額」欄の順号①） ３億２１４８万８８１０円上記金額は、本件各収入関係資料のほか、本件調査等により把握した事項に基づき算出した平成２６年分の本件事業に係る収入金額の総額であり、その内訳は、別表８－１ないし８－７のとおりである。\n（イ）必要経費の金額（別表４－３「被告主張額」欄の順号⑱） ２億３３９９万８６８８円上記金額は、本件各経費関係資料のほか、本件調査等により把握した事項に基づき算出した平成２６年分の本件事業に係る必要経費の各金額の合計額であり、その内訳は、別表\n４－３の項目⑧（「被告主張額」欄の金額）、別表８－４及び８－５（いずれも「為替差損の合計金額」欄の金額）、別表１１－１ないし１１－１４並びに別表１２－３の順号１７の「被告主張額」の「合計」欄のとおりである。\nイ 所得控除の額の合計額（別表３－１「平成２６年分（所得税等）」欄の順号③）\n２２１万９１０５円上記金額は、本件平成２６年分確定申告書に記載された所得控除の額の合計額１９６万８\n８４５円（乙３・１枚目㉕欄）に、所得税法７３条１項に規定する医療費控除の額２５万０\n２６０円（別表５の２の表の順号⑦）を加算した金額である。\nウ 課税される総所得金額（別表３－１「平成２６年分（所得税等）」欄の順号④）\n８５２７万１０００円上記金額は、前記アの総所得金額８７４９万０１２２円から前記イの所得控除の額の合計額２２１万９１０５円を控除した金額である。\nエ 納付すべき税額（別表３－１「平成２６年分（所得税等）」欄の順号⑧）\n３０８８万２８００円上記金額は、次の（ア）及び（イ）の各金額の合計額から（ウ）の金額を差し引いた後の金額である。\n（ア）課税される総所得金額に対する税額（別表３－１「平成２６年分（所得税等）欄の順号\n⑤） ３１３１万２４００円上記金額は、前記ウの課税される総所得金額８５２７万１０００円に所得税法８９条１項に規定する税率を乗じて算出した金額である。\n（イ）復興特別所得税額（別表３－１「平成２６年分（所得税等）」欄の順号⑥）\n６５万７５６０円上記金額は、復興財源確保法１３条の規定により、前記（ア）の課税される総所得金額に対する税額３１３１万２４００円に１００分の２．１を乗じて計算した金額である。\n（ウ）所得税等の源泉徴収税額（別表３－１「平成２６年分（所得税等）」欄の順号⑦）\n１０８万７０９２円上記金額は、本件事業に係る報酬等の受領に際し、源泉徴収されるべき所得税等の金額の合計額であり、その内訳は別表８－１の「源泉徴収されるべき所得税等の金額」欄のとおりである。\n２ 本件各更正処分の適法性被告が本訴において主張する本件各年分における原告の所得税又は所得税等の納付すべき税額は、前記１のとおり、平成２４年分が３２８６万６３００円、平成２５年分が２７３３万８００\n０円、平成２６年分が３０８８万２８００円であるところ、上記各金額は、いずれも本件各更正処分における所得税又は所得税等の各納付すべき税額（別表２の「更正処分等」の各年分の「納付すべき税額」欄）を上回るから、本件各更正処分はいずれも適法である。\n３ 本件各賦課決定処分の根拠前記２において述べたとおり、本件各更正処分はいずれも適法であるところ、原告が本件各更正処分により新たに納付すべきこととなった税額の計算の基礎となった事実のうちに、同更正処分前における税額の計算の基礎とされていなかったことについて、通則法（平成２８年法律第１\n５号による改正前のもの。以下、本条につき同じ。）６５条４項に規定する「正当な理由」があると認められるものはない。\nしたがって、本件各更正処分に伴い、原告に対し賦課される通則法６５条１項の規定による本件各年分の過少申告加算税の額は、同項及び同条２項に基づき計算した金額となるところ、被告が本訴において主張する原告の本件各年分の過少申告加算税の額は、次の\n\n\n（１）から\n\n\n（３）までのとおりである。\n\n\n（１）平成２４年分の過少申告加算税の額（別表３－２「平成２４年分（所得税）」欄の順号⑬）\n４７９万８５００円上記金額は、次のア及びイの各金額の合計額である。\nア 通常分の過少申告加算税の額（別表３－２「平成２４年分（所得税）」欄の順号⑨）\n３２３万３０００円上記金額は、通則法６５条１項の規定に基づき、原告が本件平成２４年分更正処分により新たに納付すべき税額３２３３万円（ただし、通則法１１８条３項の規定により１万円未満の端数を切り捨てた後のもの。別表３－２「平成２４年分（所得税）」欄の順号⑦）に１０\n０分の１０の割合を乗じて計算した金額である。\nイ 加重分の過少申告加算税の額（別表３－２「平成２４年分（所得税）」欄の順号⑫）\n１５６万５５００円上記金額は、通則法６５条２項の規定に基づき、原告が本件平成２４年分更正処分により新たに納付すべき税額３２３３万７３００円（別表３－２「平成２４年分（所得税）」欄の順号③）のうち、原告の平成２４年分の所得税に係る期限内申告税額に相当する金額１０２万３３２６円（通則法６５条３項２号の規定に基づき、前記１\n\n\n（１）エ（イ）の源泉徴収税額１９４万６８０６円から本件平成２４年分確定申告書における還付金の額９２万３４８０円（乙１・１枚目㊻欄）を控除した金額）と５０万円のいずれか多い金額である１０２万３\n３２６円を超える部分に相当する税額３１３１万円（ただし、通則法１１８条３項の規定により１万円未満の端数を切り捨てた後のもの。別表３－２「平成２４年分（所得税）」欄の順号⑩）に１００分の５の割合を乗じて計算した金額である。\n\n\n（２）平成２５年分の過少申告加算税の額（別表３－２「平成２５年分（所得税等）」欄の順号⑬）\n４０３万８０００円上記金額は、次のア及びイの各金額の合計額である。\nア 通常分の過少申告加算税の額（別表３－２「平成２５年分（所得税等）」欄の順号⑨）\n２７１万１０００円上記金額は、通則法６５条１項及び復興財源確保法２４条４項の規定に基づき、原告が本件平成２５年分更正処分により新たに納付すべき税額２７１１万円（ただし、通則法１１８条３項及び復興財源確保法２４条６項の規定により１万円未満の端数を切り捨てた後のもの。\n後記\n\n\n（３）アにおいて同じ。別表３－２「平成２５年分（所得税等）」欄の順号⑦）に１０\n０分の１０の割合を乗じて計算した金額である。\nイ 加重分の過少申告加算税の額（別表３－２「平成２５年分（所得税等）」欄の順号⑫）\n１３２万７０００円上記金額は、通則法６５条２項及び復興財源確保法２４条４項の規定に基づき、原告が本件平成２５年分更正処分により新たに納付すべき税額２７１１万８２００円（別表３－２\n「平成２５年分（所得税等）」欄の順号③）のうち、原告の平成２５年分の所得税等に係る期限内申告税額に相当する金額５７万７６６７円（通則法６５条３項２号及び復興財源確保法２４条４項の規定に基づき、前記１\n\n\n（２）エ（ウ）の源泉徴収税額１６２万６０６４円から本件平成２５年分確定申告書における還付金の額１０４万８３９７円（乙２・１枚目㊽欄）\nを控除した金額）と５０万円のいずれか多い金額である５７万７６６７円を超える部分に相当する税額２６５４万円（ただし、通則法１１８条３項及び復興財源確保法２４条６項の規定により１万円未満の端数を切り捨てた後のもの。後記\n\n\n（３）イにおいて同じ。別表３－２\n「平成２５年分（所得税等）」欄の順号⑩）に１００分の５の割合を乗じて計算した金額である。\n\n\n（３）平成２６年分の過少申告加算税の額（別表３－２「平成２６年分（所得税等）」欄の順号⑬）\n４５９万３５００円上記金額は、次のア及びイの各金額の合計額である。\nア 通常分の過少申告加算税の額（別表３－２「平成２６年分（所得税等）」欄の順号⑨）\n３０８万円上記金額は、通則法６５条１項及び復興財源確保法２４条４項の規定に基づき、原告が本件平成２６年分更正処分により新たに納付すべき税額３０８０万円（別表３－２「平成２６年分（所得税等）」欄の順号⑦）に１００分の１０の割合を乗じて計算した金額である。\nイ 加重分の過少申告加算税の額（別表３－２「平成２６年分（所得税等）」欄の順号⑫）\n１５１万３５００円上記金額は、通則法６５条２項及び復興財源確保法２４条４項の規定に基づき、原告が本件平成２６年分更正処分により新たに納付すべき税額３０８０万２７００円（別表３－２\n「平成２６年分（所得税等）」欄の順号③）のうち、原告の平成２６年分の所得税等に係る期限内申告税額に相当する金額５２万９５９８円（通則法６５条３項２号及び復興財源確保法２４条４項の規定に基づき、前記１\n\n\n（３）エ（ウ）の源泉徴収税額１０８万７０９２円から本件平成２６年分確定申告書における還付金の額５５万７４９４円（乙３・１枚目㊽欄）\nを控除した金額）と５０万円のいずれか多い金額である５２万９５９８円を超える部分に相当する税額３０２７万円（別表３－２「平成２６年分（所得税等）」欄の順号⑩）に１００分の５の割合を乗じて計算した金額である。\n４ 本件各賦課決定処分の適法性被告が本訴において主張する原告の本件各年分の所得税又は所得税等に係る過少申告加算税の額は、前記３のとおり、平成２４年分が４７９万８５００円、平成２５年分が４０３万８０００円、平成２６年分が４５９万３５００円であるところ、上記の各金額は、いずれも本件各賦課決定処分の額（別表２の「更正処分等」の各年分の「過少申告加算税の額」欄）と同額であるため、\n本件各賦課決定処分はいずれも適法である。\n以上\n' ' ＾,, ‘ ^ ` ,.\n \n•別表2課 税 の 経 緯（所得税等）\n（琳位：:13マ)・\n．．砿定申告 更正処分等． ．審査翔求 裁決年 月 •日 平 ． 成25年3月1 ． 31:l 平成30年1月24日 平成3�3月30日 平成31年3月26日、\n・総所•’ 得金額 ·5,7 92,.336 .92,3 88, 852\n•平\n・内 I 事 業所得・ 5,792,336 . 92, 388,8 52成 訳\n24 所得控除難の合計 l, 996,'112 1,996,412\n．全部取消し 茉却\n・年源泉徴収税額 1,254, 980 1,946,806\n・分\n納付すべき税額 △9.23,4即 31,'413,900'過少申告加算税の額 4,798,500 ．\n．，\nE年· ●, • 月 ． 平成26年3月1祖 平成30年1月以日 平成30年3月30日 平成3]年3月26日\n...平 総所得金・額 5,960,076 76,835,767\n; | ．\n．\n•事業所得' 5,960,076 76,835,757.と成\n:25 所得控除額の合計 2,029, 473 . 2,029,473 ｀\n・ 全部取消 一 棄却\n．年 源泉徴収税額 'l, 414,425 1,926,064 ．分\n心納付すべき税額 ．△1,0心，397 ·. 2 6. 69,900\n・ ン過少申告加算税の額 4,038,.000\n．\n・ ．\n・年 月 日 平成27年3月 . 16 ' 日 平成30年1月24日 平成3�3月3. �日 平成31年3月26日\n. .総所得金額 、．li,464,904 85,929,826.乎 ．．\n'成副事業所得！ ·6,4 64; :104 8_5,9 29,8 26\n26 所得控除額の合計 1,968,846 2,219; 105\n； 全部取消し 棄却年\n源泉徽収税額 — 1,039,099 ．． .:. 087,-09�納付すべき税額 ．△．557,494 30,24�.300過少申告加算税． の額． 4,593,500\n．\n．\n（注） ・「納付すべき税額j欄の△印は 遠付金の額に相当する金額を示す。\n3-1\n'n別表\n” ―所得税及び復興特刷所得税の金額\n9位：円；\n24年 25 成祁年分項 目． ·順号 平（成所得税）分 ・平 （所成 得税年響分） 平所（ 得税等\n.. .総所芍金額 • ①, ．鼻 • 一 ・究，019,995 79，虹l,3_ 76 87, �90. 122\n・ ．�如\n’\n999 9 9,. •\n..\n1本件事業1こ係る事如輝の金額 ② %,01a吟 、 5 79,941,376 •87,,(,の.．1 .. 22 .所得控除の額の合併饗 ③ · 1.996. 12 2,029,473. 2, 219. t05\n．課税される総所吝金額(Q)—®) ④ • 94,023,000 ?1、9ll,000 85, 271 \n〔1,000円未漬切捨て）\n® ・\n2 ヽ ，採税される緯所得金額に対ナる税齢 34,813, 00 蕊 368,400 31,312；伽\n® し •\n..筏爽特別所得税額（⑤X0.021) ． ． .5.95 ,736 657．珈\n6 6概棗微収税額 ⑦ 1.a46,806 .. L, 2 ,祖 1,0 87;09 ． 2 ．納付すぺさ税術（⑤＋@-\"<:!)· )�\n⑧\n•\n3；；\n，訳め\n、\n300 '\n7,338; 000 30,882,即o..\n(100円未窃切捨て）\n． ，\n（注） 〇粗0)金額は 本件平染に保る事歎所得の金顧（②4配と同額であり その計冥扱拠字は幻荻4 lないし4 3のとおりである．．\n3-2 •.胴表所得税及び復興特別所得税に係る過少申告加算税の金額\n（単位：Fl）\n・ 成 年分 26\n． ． • 項 目 隕 号 平 匂濡 成24 税 年 ） 分 •. 平（所得匹税 'I\\ ) ．． ． 平 所（ 成楊税年螂分）\n納付すべさ税額 ① ._31,4.13 、 900 . 26,069,900 30,245, soo\n（本件各史正処分）\nヽ納付すべき税額 ② ヽ � 923,-480 △1,048, 397 、△557,．49\n（磁定申告）\n加\n(算\nl0税\n0円\n（未\n面涜\n岱分切\n）\n怜の\nて対\n）\n象となる紋tiJ («)-②） • ③. . 32, 337, soo 2 7,118, 2 OO so, 802, 700期限内申告税額 ④ 1, 02_3; 326. 57 ?, 66? 5ぬ，598\n⇒\n④の金額と50万 の..い.ずれか多い方の\n⑤ 1,023, 3祁 67?,6 67 529,598企印\n®れ謬．税如重分）の対象となる税額\n31, 3)3, 974 26, 5-40, 533 • so, 273; 102·\n（③—｀⑤）\n． 加 Cl.O 税 , QO の O 基 円 唸 未悩 と 切 な 捨 る金 '( 額 ).. （③） 32. 33.0,. OC.-0. --• 2 • 7 .. , .. , l ― l6 ·- ,0 00 '•一 9● ·—·— • 30. 800 •一 , 00 : 0 . ’’通 --- . 函；常\n,加\n•算税.の… •--割-合-···\nー・—..一 ..一\n•\n．\nl\n．\nC'.!' 1澤\n． »加算税の顧 ⑨ .� 3 233. 900 2, 711,0•)0 3. 080, 000\n．．加箪税の送涎となる金頑(®) ⑩ 31, 31C, 000 •• 26,540、O”OO - 30, 270、00.0,.加 I\n(13,OOOR未祐切―捨て）\n ―\n\"'9-'―-•\n． •ー・＿，ー、\n分蘇に枷算税の割合 ⑪\ni .\n5`\n．． ， 1-, -\n•\n.•一\n`税の顛． ．．\n·-\n⑫ l,S6�·. 500 · ·. ], 327,000. l, ：5 13_, 50,).\n.過少．呻告沈算税。頓（⑨十⑫） ⑬ • _t, 198, 500 4, 038, 0 00 4,593、SOO\n‘r\n（注） 1 ＇• f納付 ぺさ税額（葎定申告）；． 欄の△印 ・ は、還付金の額に相当する金額を示す．\n2 順号④の「紺限内白告税頷Jとは ， 距泉徴収税額ゆJ表9-l �配ゆ）から各年分の． 沿付金の額は衰順号②）\n． ．\n：こ柑当する税額を笙鯰した後の金額である（通l!1]法65条3項2号）\n．\n: r.\n• •• - ヽヽ •• \" .、 ·、 9\n. ,..\"\n. • P .、.\n·,別表4-1本件事集に係る事業所得の計算根拠（平成24年分）\n・心：円）\nー平成24年分 ·項目 I 被告主張額の内訳更正処分 ． 被告主張額\n�云↓；どt•よ］；；；；＄ょ；金総収入金額 ① 3?2;�13,098 321,163,098 ．\n1 ぬ\n® I租税公認 一 206;200 206,200 別表9-1とおり．\n③ I滋賀交通費 5,213,644 s, 213. 544 別表9-2のとおり．\n④ ..-通信費 3,391, 019 . 3, 358, 749 l別表9-aのとおりー\n⑤\n1接待交際費\n⑥\ni 325,931\n• •\n32.5,\n←\n-\n-\n- 4\n1別\n-表\n•\n9-4のとおり。\n9 \n1 I広告宣伝贅 2,9�8. 751. 2,.9J8,\"7.�l 別表9-、5のとおり｀\n⑦ I消粍品費 3,887,937 3,887,931 別表9-63:>とおり·•減俗却貨 ⑧ f6, 132 • 66, 132|帽\n甲 .の\n2のとお\n1.り．\n2枚目「減価償却貨の計算J\nl -. _., ...\n®給料袋金 83, 306, 3.10 1• 83, 306, 310 』. 別 表 ..一 9, · ― -•7-. 7)·... と お り 。 •.‘\nJ •一•- .\nI I\nI\ni外注エ貨 ⑩ 109. 367, 630 1C9 、 299,630 別表9-8のとおり。\n⑪\n1.s旭代家賃 一 8,278,916 2, 686, 420 1J衷9-9·のとおり。·\n⑫ ・、\n湘子割引料 468,340 仕8,340 別表9-1o·v.iとおり 。\nl1秤J Ill!)\nI厚生袋 ⑬ l l72，ら19 172,519 裳9-llのとおり．\n1· . ー別表12 1呪月号i7の「被告担碑Jのリー ·· ス ·- 料 - · ⑭ ·330, 76.3 1,132,386 j f合田禰．．の．．．と� おり。 ．．\n..1 1法定福利費 ⑮ •3, 504, 786 3 504,786 別表9-12�とおり。●，悩品芦ね訟ぶ窃唸の四一· • 一\n1為 ．．．マつー菩芝扱．＿ ・値 ． 引きI ® I • 400, ss·s 400, 6.55\nl\n1 s雑按\n⑰ 8, 1 75, 7 : 8. ]15.713 朕表9-l4のとおり。\nI..必要経投計'. I•⑱ 230,024,246 225,'l3S, �03\n（②·~⑰¢\n，，計）」ー一\n·1.甜業所得（①—⑱) 92, 388, 852 96,019,995.'さ，·.．,.»‘‘‘\n・別表4-2\n＾、．、\n本件事業に係る事業所得の計算根拠'(平成25年分）\n饂f9__）\n平成2:5年分項目 被告主張額の内訳更正処分 被告主張額別表7-1よいし7-·6のおり\n• 1稔収入金額租税公練\nl.旅投交通費通信費\n① 1 3 2 5 . 4 J 1 1 , 6 ↓\n| �\n324·, 151, 161 •• の 及 令， び: 絹） - ．、 5は「為誓白益の合計金\n• I. I\nI\n② 11s, soo m·,aoo 別表10- 111;とおり．\n③\n4 6, 1 4 2, 0 8 4, 514,208 I別表l0-2のとおり。\n④ 3 • 4, 2 9 9 , 6 :i\n3, 262, 929 別表LO-3のとおり．．荻待交際費広告宜伝費祖粍品費\n・しー.. .滋 低 償 却\n―費\nー ：マ\n®\n!46;234\n-\n®\n7,046,185一\n⑦\n―\n® 4&109\n―\n⑨鈴料賃金 8 0 , 0 9 7 9 ; 7 1\n146, 234 |glJ衰io-11 rr.•・とおり．\nlsr\n7,0蛉1ss J麦0-5のとおり．\n2 , 9 7 8 6 , 5 8\n・公978;6�8 1si澤：叶6のとおり·\n4 8 1 , 09 · 甲1 2 の 2 . 2 枚 目 汲I． 術 償 輝 費 ” It 克 J\nー• ' -'-...― ヽ •欄のとおり、\n•O ·と ·• --\nl\n80, 097,971 月I裁JO-7のとおり。\n• ↓ -- - • · · · ·\n. | 1外注エ賃 ⑩ t ll7,512,949 l 15,960, 559 別表10- 8のとおりc\n. -• .- ’ -·- ··-···-\n⑪地代家貨\n―\n·12. L39, 916\n｝．\n⑫湘子邸l引料\n⑬福利厚生潰\n4 2 9 , 3 1 9\nl\n•7,243, 556 別表l0-9のとおりe\n429,379 I別表10-10(/)とたりc\n'275,'430\nI•リ：ース料 ⑭, 4 , 7 8 5 , 7 3 8\n275,430別表）0-llのとおり．\n．\n7 ,0 3 5 9, 0 1\n|沙 悶 品 猛 ？ ぢ ？ ぼ 告 主 張 額 J の法定福利紫 ⑮ 5, 230,625·為 替 差 偵 ・ 値・ 引 き\nl\n⑯ 631, 364\n＇娃費\n必要経費9t\n（ ② ～ ⑬ の 合 計 ）\n⑰ 9 2, 3 2 ; 8 7 7\n・ コ五\n三四\n9, 232, 8.77．・別表10-1めとおり。\n⑬ ．1• 碑 5， 7 5 4, 9 4 ?44,_20Q, 785.\nl.哀築所得· (•①—⑮) 76.835, 757 ?9 941. 376別 表 4 - 3\nI\n・本件事業に係る事業所得の計算根拠（平成26年分） ・年分 （単位：円平成26項 目被告主張額の内訳被告主張額更正処分滋 収 入 金 額\n.:..\n. -•-8-1ないし8 1のとおりはり汲\n①\nl .\n3 2 2 , 1 7 5 , 8 0i |\nl8-4\n321,488,81o 及び知5は「為替差益の合叶金租1 税 公 謀\n・\n② 1 8 0 ; 5 0 0\n.\n180, 500 l別表11- ir1;とおり。．．峠 究 交 通 要\nl\n③ 3,785,182 3, 785. I82 別-丑l-l-2の」｝·―.．お—り．• —-滋\n価 ·償 -·却\n--費 ·\n⑧\nl\n2; 41_2,560 ].811, 1-ll 別表】1-3のとおり．\n. 152,902 l52, 9.02 |8暖11-4のとおり。\n9 9● -—·--9 99 ●99_ _,- * ・岬芦金 ⑨\n3 , 3 � 5 , 0 6 7\nl\n．\n•一\nI •\n3, 345,067• 別表11-5のとおり\n•—· --.←— ,. .--• --。 ---•\n•. l, 290,666 1,2' 90, ti的l忠J寂11-6のとおり ． ’と\n•一•••一· •—• I - I •一 • 一•--←． ・\n4 0 4 , 0 1\nI . · I\n.4o, 401 l甲2の3. 2枚目「減佃憐却・ 費の計算\n•疇\nJ\n° 概のとおり，\n．＂ー・一ー・ ；—•\n・\n82, l65, 008I 62, 165, 008 si澤11-'lのとおり． ．外注エ紫' ⑪ l n2,233,032 l u2,233.032 1BI：�ll-8のとおり、 9\n. - • ----- 1 —:...“一 ． • - 一 -•一••I,. 池代家賃 ⑪ I • i a 4 . 8 5 1 , 1 8 I 、 ・ ・ ・ 1; s61, 97i 訊表l•1-9のとおり\nI相.-デ-寄J-引料· •一「・ ー⑫ ．\n375, 6必 375,646佃’哀1-·IOのとお如\n．． ．．．． ．福 利 旺� 生 費\nl\n⑬I -: - s6, s31 se, s31 • g,j哀1-11のとおり． ．\n� . , . ⑭一\nリース料 ⑮法定福利費\n2 , 8 8 2 0 , 3·1\n．\nglJ忍2- 3の順号17の「破を主嘉額Jの 6..253.g•3I |. r合計J．欄のとおり． ．．\n5, 347, �31為1 菩 差 損 ・ 値 引 き I\n’\n⑯\n・\n·--·\n·\n5, 347, 43: lll1J衰ll-12のとおり．\n-.. ・\n．別表8-4及び8-5 のぢ\n360,098 .360ー,0・98 計金額j・憫の ． 金額） 並びに別表Iた13の\nI · ・\n· ・ ぉ,;_.．． ． ． ．．． ．．．\n1雑費 ⑰ 8, 732, 963 8,132,963 I別表』1-14、'l}とおり匹：□ ： :::::::: f ' : : : : ::\nJ 0 •�• '..'' さ＂ t • • • •\nl\n:額張主方双る係に料スーリ - 分 i言 年42成平 2.-·· 1. ·· I 呻分冨 9印こ 名呻名社l臀.1J1\n：：：：：- ゜ 9 目 ： - Q 3 : 23 - . .9 . 3 - L n - . 50 . 7 : , - 3 · 3 . - - I I - - : · : 81 ` 6 - .5 - t: こ一、一一塁:― I - : .. -• - · 'I I 9か · ？ -· : - ーロ［ •，•一· .• •1 I ： ’ ,;- • - • ・芸：：： - - . ， • . ＿ ,. ・ 巴 ' ? ：• I ．- ・ ・ . ー · ...9 - ·一 . •— ： ..- -― . -一 :: - i - I - - ： ,: . - . ー • ：ー： . - .. : •. ? ー］り:-9:'―9 ' 7 • - I 1 - - --•- . 9--- I J - •- .· · - ._ · . — ·： I ., ： -,· ： —· . ］ ： - ］ .r - . - I . • - . 巳 .・ - ・ - •ー I ： • ・ .• ・ 一 ． ］ ． • ： •• - • 口 - • ： 0 - 絨u- 紐 帳主量 魯 - M 霞 I. ： I1I匹\n：\n＇ ．\n（ 卜 ＇ は ．．\n：\n＇一 OO32•64 ＇ .108 涵：-9： 函 .551 函 .729 一 ． ． ．． 面涵 .860 .99 ． ＿＿ · r 0 切 5 ' 4 5 訂 ,39 ；万匂 50 言函 5 .35 .. 函 055 涵 .35 言 S0 7’函函 S .35 ．：．｀百ー． ． 5揺96了 055 .35 ． 9 —｀函． 505 .35 t瞑品 055 . .35 て函 05 5. 面函 36 一 •-•70 ．―函． 55 五 .35 �: · :� “ 涵 055 百 .35 ー●● ;bbー 績攘吐 告 敏 原 ＇ 一し、 0 .II · I . • I I • I I I • I I • I I\nー.;\n- . · : o 0 o 0,.•• . ― . , - - .· ― - - ャ • 1 �•:- 1 : • : • - . - •一 ' . - ·\"' · . -- · , ·- - .--- + I , • — ·: . ' •. ●' . ● - ● ●9 ·：●●9● · ● — ● I I 一 - 9ら• ,;. • - •― •一 • · 一 : . • 一 `. • ' ' - “:'. ., - ． • . 1 · · ー ·． ' . , - ・ 一 ' • - • m • • ョ . :, . - -- . ,. •． - , ' - . - • · ., - ー ., - . ― ―, ,. :::- - .、 , . � .• - - c •• 一 - .. • — - ． .. • , ― · i . ,• . .,.,-, ·. -- , - ; v . · - , ••- - ― � 一 ． - . • . と · ' l- 1 , - : -: · • �· •• 77 . • ． : - · - ·一 •• · '� ・ - ・ 「 — , ,, . ． •. •. . , . • . - + ． , - � : 9. ． . • . •. -- . • • ・ 一 . - ． •' . • し ？ 9 ． , - ． : ．． ． ， .I . , ヽ . ● 一 .. ●● - • ● • ●● • ● 一 ：’,:· •一 :· - ●● • そ• ; • ..:. .•• ―, . , ’ 一 .. : ． ・ ， . - . ・・ · \" ● 9●そ ' • ● - ●ヽ？●9’●'\"\" ,. ••-.. — ,. : . - - • . - 9• •一 • 一 - . • •• ． . ．． - — ． � 、 — ． . ' ． •. · . ⑤ ) 0 ． · · 疇 I 呵 謂 望 ・ — 纏 ， 懇 置 入 蔓 惰主 主 露 宣 舎 槍 含 舎 原 菫 罠 i l ヽ m I郎\ntl.t\nt 台2タ \" = 塁 ン 合 リ饒 ブ1• D I\n6 L L\nヽ\n,\n, , \" · .\n,\n.. ,, ;\n0. 一 , · ～ 1:------:- . · : 0 ヤ o 0 ． · ， • - �· • , · � - ．・ ' - � · , \" · • : ． ` .,,. , ． . r . ．． f. : • t R I . 1 l と 1-:---:-:- 9 ” - • o - : -:7- · • . i - ' . · . ·• - : . • • . - . • · . - 、 . t I , . 1 ー . - : · - : , , � - 0 . : : 一 . - - • . • .• . • • . - • ： •一 — ·. • 一 ·． .I · ● •一 I I -' 、 • d .' -;: o へ ． , J . : ｀ , ― . • , • ． ― ••• . 一 . • : - .- c,\" . - • , 1 9 • I ·1 ． l 1 , - , - 、 - 一 , · · • , . 0 ,' · -: o → , .- ． • 「 , : . • 、 . - - • - 、 : ` , • ● · ． ● . — —. ． : ·一 ， •. � _ - — • 一 - . ,.· . : . ' : : . • , . · • •� I t 0. . 1 - 一 - . '. , _ :· : . - : ↓ .’ • . · • ． - ·- . , :: , ' · . · - • 一 • · - . • · • · 9 , ． • • . ' ― ~ 、 : : • . , v • : I 1 ’寄 - I r : · •• , ’ _ : •• o “ : • :. - :. · c . f マ . ·· .- • • . ,: '� • : - . · . ' · : ; ＾ · , . :, , ． ． ,; ·, ． f .- ． ： ' - ァ ：； “: • 、 · — f ： .冑 ． I I ． • . 9 言＇ か 9 - .- . : : . , • ― .,.. 9 , ': 9 - ． • } • • - : . · • . : . - , - '. ' . ― : .'.'.• . : • . - .r , . : • •； . - ． 、 ` I ‘- : I : : ； · ' ＇ — ,0 万 • · ． o ． ． - . ・ .· - こ ← - ., · . •: 9 : ・ こ？ • - 卜． : • ・ - 、 ・ , • •. • - 一• - • ? • - · ． : ' • • · ． っ 9 ［ •ヽ l· . : I I ー ,. - 。； • . • · - , · - ー ． . · . : - ー · ． ； ' ． : • 一 ． · - , • - · a · . •一 9 - た . • • • y . • · • • ； I · 9 I ヘ • •• • • .• ． - - . ぷ o ー · 一 . 9 - ．, · — _ ·. ・ 一 . 9 ＇ - - ． • . ． - • •— ·•, - ． ャ - ． · 7 . · 9 . · . I ＇ I I — . - 9 ' 9 - O' . 9 ． J • . - . 9 • ． ・ '. . - • 、 ' • . 」 . 9 - -• · • • • ― ． - - . - ． 』 • . • ． J ： I ． · · ー o ； : o ·一 ― ·- ・ -- . · - - ‘ ． - - •• - ． . • ． — . - . ● . - • . --::-: 7 _ ． ― ` . ． ＇ ． ， • - - · ·I lC) � 0 ． ． ， — 1 - ・ ::=::- 績 韻 Ill 四 鰭 •鰭 暢 霧 ＿＿ 彊 帽 覆 ・ 櫂 m 提 喧 ― ー — 函 年 主 隻 虹 主 主 · ＇ 含 ” 偽 ● \" 告 績 櫨 鎗 環 昂 績 ; . - . · | l 1 1 如 e 4 叩 &/!ff'\n’” ン膏 - ？スン ネ 盪 コ ジ ソ 會ピ 疇 複 パ, じ門\n「 ?\n•\n- · · o o· 0 0 ― 一 ‘ . — • . • - . ・ · . r .• ’ l , • . � q · ’一 () · .. · ` - • ● “ ● ·- ． , • — . 9 ，＇ · . ， I 1 ' ＇ I l . 囀 , 'O ． - o • ． • ; . • . ． - • · • - • · I I I I ． 4... · 9 ー .. 一 .. • ー :, 9. .• t �一 ·‘ I I . I I ・ 、 • ば ' . · 9 o 9·ー ・ : . ’· ＂ . 9 ·· → さ ？ .· • · ·. • . ' · ,. ．• な · ,. · I -f. I I • - . • • • · ; . ↓• • , • 9 ．、 .• ：二 • ． • ． ＇ ； . ． L ・ . I I I : ~ ｛ · - ° - o - だ - . — · - -9 - . ' -r .- - ·- . そ h ．9 • I I I .r - 0; _ · . ' .- ,. . ·- - .9、 ·-. ― .. - .•;. · , : - ..-:- . 、 . 9 1 ；， I 9 · I I 店， - - , - o · 炉 • ., - -. ，．； - · ． . で - - . ；： ・ • , , · - ' I ; 1 .. : ° o - • •-• • - : , • - - , ..: • • . •. t .- . · • . • I I .. が o .― と '、 ： , • t ；・ · •. . - • - • ・ マ ． ' , ー 一 • ． — • I I ; · : ． . — ＇ -, i o T •- •• ． •• ・ ] . 9, ． - · : - • ． - ． ， I . 1 - .O• ” ． o - ・ - - , · ., - - ， - . ` . “ . ： . 9 I _ 0 , 1 - ・ 11 II 饂 II . 襲 櫨 櫨 鶴 幻 宣 主 主 鬱 曇 紅 畠 属 櫨 櫨 瓢 · し In 四\nF ． ） ン 計 ォ - 會 フ のス ® ネ び ジ 及ビ ®怜 、 鞠（\n12 11 1\n.,· 32G ,108 iI 551 .721 . 850,99 504 .39 505,35 .0 '.65 55 .35 055．勾. 055 .3& 055·．35 055 .35‘ 055•,35 • ••055 ,35 055 ．5 .35 . 9● • 鵬讐主血計會〇⑨しいなの件檜Iぷ高言 II写言 '、‘I'涵：可 I函声 · 、薮I 宝 I●● 函気 I 翫ご ·I：声、汽汀 I西環一だ I：碑万｀ �，I置言高国． 翫I ． ， ；口云石一\n・\nm ,1 os s51 ,121 sso .99 504 _93 oss ,35 7 os5 .35 oss .35 055 .35 oss-.is.. 05s .3s ー oss .35 .I 055 .Js os5 .35 ． 饉櫨全量愴い金おるにす彊麟＊主t・入ち算うののへ額貴金鼈の嘉31彎〇;疇|\"1 面五デ元，翫互函ー苫涵i-ず涵；面戸 ． 応函嘉百 り寧滋昇函函勺紺霙 n 函勺：碇雨い蕊査ご寧寧「：；，．西、·百ー翫百面一 云―¢'るる遥 滸 1 2\n， 、 ． 翌 温 叩 は 1、 翌 .1O.9,9く ー ー ． ＇ ヤ ＂ ．，一- • ． ・ ー`“•.• 、 r ． ..? ， ·ー 一 ， • 呵,…. : ;．・ ．．．:墜b i1 ． • 9 ,0 1 1 ． 、 9．． ヽ ， ． ．墜 ： ・ o'1町 。り •0 お • • と ' •.3 の 枷. ,? 9 ! - 洩 7 . 3 - ° 0= ] 1 1 表 :` : .9 別 9 • ま · }; ，兜 l o 綱 ‘ 紐 明 ；O 払 刃 •,9` 支 `” t の .hI 分 } 蒻 0 彰 1. 切 ? 4 ． 2 • . 成 l ．． - 平 ．， • • ： る ・ ＇； ，；， 炉 9 係 !] に 1匂 ,9 · 9.＇ · 叶 '- - 彎 — ＇f; 屯 畑 社 - り 会 ．， -池 式 ：心 株 9.' ．． •.1<, ：テ :o ！．心 n、9, r 0 0 i 1 . • . ‘ ,' ：： P ふ _ ° 泊 !]. 0 0 . 1 -,-―― ！ • o ！ n ！ < ： ; 竺 0] ． ． , ．．．，．， · 。 ® ． : 竺 編 竺 彊 : 虹鬱 ; 量 昂 ; nmH\nG- スクッァフ\n4 隻式 , 樟\n9 61 9\n�1·百蕊石 .�------�� - . .•. • • • • • . •• 竺 !I\" 竺 主t!t 竺 謂 � I計會ののしいな砂臼1\n• ．す ．る 表 あ を で 諜 顎 金る 令 い たし て 除 れ 控 さ入 •ろ顎 算 金 41費 各 坦 の寄 要必 覗括 てい の お 欄． に J 分 顎入 幻 篤 正更 費搭 各件 専必 本 ！ 、 の は ， 額 5号 金 順 の笞 らか 邪 窮 括 令 の鴨 各の J 3 額 1号 入葬 召1、 費 i・1 箱 額 要 金必 各\nf の の 4 和 •!号順 晒\n2 1 ）注（\n ,. ． V ., ． ヽ ．>' . •、0 ． 3 し · •， ;. .\" 蒻張主方双る係に料スーリ分年52成平\n7 ゜ 5 4 3 2計合 21\nII 01\n1 .I紐1年 I�．l\nBお\n1 名 lH号霞言I：言□]]]]］I］［］\n］し\nD\nー一\n―一•—t\nE\nL\n[\nl\n―I\n•---1\nI王王\nー\n;---911-- - 9•\n••ー一••·ー••··+..—....、••一•-l-9•-•9..,..•,一•9·l-- • •—·�··••,•・十一•••••\n--· •--+—---•-|.----• -—·+—·卜-9．．一• ·----1\n®\n4I四\nート\no .0↓ · •• . ● I • I I I :: .: . • - . .· • -...-\n, I I . • :·. . • ·• - . I I - - • · . • - .1.. -.· I- •• • • . •て · • - 1 . -- 、 -\n- •;\n• I - :• · . 、・ .:- ・．．・ - .·f I - .. - • .. ,. - . • ., . · I I · . 一 :· . · -一 ’ ＂ • : ヽ· . —- ·: • .q 1 ·: : . - ·. - • . -··.- · , 一 ·:.: •r · I I : 一 . • - • - 、 . - l ·I - \" - - - . - I - . • -- . · • • 一の\n.“ 絨羅 璽 全 宣● 告原 犠 •• 89畑霊合積\n.I\n•\n． 02 m 7 ,864 m ＇ 980.259 ．•，＇\n080,25 ，． ,080.25 ― 080.25 • 080,25\n080,25 080.25 080,25 0807.25 : 60 ― 0 ―6 0---•-績罹三告檜\n,·\n,:函 — U函石6一\nI寧百ー函函万：盃言． ：〇鴻25ー高涵'.•涵函万：函如勺万\n、·— 「--- 百一• —\niii;:白・＇\n•:\n―`\n; .\n,9\n`\n・ 刈 • - ● . ● • . 0 o 6 5 - 5 9 1 a 2 6 8 - 3 4 汀 6 J 0 - ● • • , . 3 OO 2 8 - - 6 6 2 2 8 1 0 ● . 8 8 8 7 一 - '. . • 1 - ． - r 1 . • · 函 - 5 o 5 0 5 四 蒻 9 ii .6 - 1 5 5 ] S - ｛ , . ， 9 分 9 5 7 - 9 8 1 - 8· •. - 1 ． . ． •• • - ． ．＂ 9••\nI ． . · - ー ． ． ． 5 油 o 5 5 ． ． 0 ． 一 9 . 9 3 6 6 - 9. • 一 1 4 - 5 6 5 9.. ; し 1 、 - 5 7 , 5 - • a 2 9 1 • 8 - 一 1 • • • - •• - r -+---=-=::-I I . I 5 • 5 6 0 0 5 0 - 9 0 6 6 3 . - 5 A . 1 5 5 9 5 . - . 誠 . -, . 9 . 9 5 •7 72 8 I. . - - 1 ． , · . •• : I I ‘ , ・ ← 5 5 - 5 • - 5 0 . ·— 6 6 6 . .65. 9 5 • s 1 6 S • • - ; . , 9 s 9 !i . -り 8 8 . • 9 · ・ • - · - ．． 5I . 6 ． .5 • .• 5 - - - 5 5 6 6 , 6 ． ． 5 5 5 - 89 ． 楓 •; ． 印 9 - - 8 ． - .\n· - .· .\n- .、 .,\n． i I • - :． ・ ． 5 • · • . - 5 5 • 5 0 — -6 § § - 6 . 5 5 -5 : . - . , - . 9 9 9 - 9 · 8 一 8 8 . - 8 .- - : . • - : → . f I . 、 . F · - ’ 0 0 .., 5 5 . —• 3， 8 6 - 3 . - 5 1 1 5 : . , - - 9 - g 9 9 7 8 7 8 · 1 - 1 - • □ • ” , I . · - - - : .' . .5 5 O• •— 6 6 . - 5 5 .. — i , ・ .- 一 - . \" 9 9 ' 8 : 8 . - ••一 - . : . •.• • • I · . - z - — o 9． . 5 5 • 6 6 5 ・ 5 ー - • ー - 一 9 9 •- 8 8 . - .. , . 〒 . • 9. .· •• て · . ． - � ．． - · ・ 0 0 • ·一 - -:-+---:--, . - . - ・ .. ． . - - • • - .. - 0 ― • — ,. · • - • ·- 一 ·-� - • · よ \" ヽ c\"' 一 ·・ .. • ,• - ・- ー o •• ． 0 ● 一 •臼 - • - - -• - - —\n． 0 ®\n- • 11 饂 績 • 額 嘘 匹 II 預 ll 攘 積 .― 主 ま 主 m 烹 主 -含 官 働 鑑 台 魯 - — . 庫 複 櫨 犀 厩 鎗 9 . 3. 8 ． . 9 ／四 5 ぼ\n• F ． ． 9 ン ン 計 · ゎ 一 ォ 會 フ フ の \"ス ス ⑨ ネ ネ び - ジ ジ 及ビ ビ疇 ®叩\n・ ・・\n・ ・ 1 0 II 1 1\n-; 5 5 - 4 9. — 0 - 5 i8 32 2 - 8 8 ，必 , : 2 -珈 7 5 9 93 - , .6 4 9 72 2 - • . :••\n0 5 •- 3 9 9 3 , . 4 6 - 9 7 2 2 - • 730 5 - 93 • . ,4 69 1 2 2 : - • 、 叩 59 8 - 3 . , 0 4 6 1 ， 2 2 - •. 〒- - t 。 ·函 00 _ 8 謎 ,862\n2-\n. •研 - 0 - 0 浪 8 . - 8 8 9 6 忍 2 -； ：奇 0 函 0 . 8 、 - . ,6 .8 5 6 - 2 3`:,•.,. - . .5 0 伍 08 • .68 石 2 - ： 、 逗． - 008 : 随 - ,m862 -: ·了． 9. 5 5 - 5 51 1 - / , 7 72 ; - 1 1,. - ― : .5 · — 5 5 51 • 9 - . .7 7 - 2 2 1 ! : � • 0 55 6 1 8 . .0 72 6 1 1\n/I,闊 誠 — ll 費 ー 主 吐 書 ド 愴 犀紐の⑨しいな⑮\"'l\nn\n9● 5 9· 5 · 1 6 ·- 1 7 . 0 ;5 - 5 .5 2 2 , - 2 2 ; - : ° 5 心 5 - 1 - 蜆 ;81 - 1 1・\n..,.- 5 ao 1 6 3 、 - .4 � 4 z - z 2 - . - I - • 5 0 · 5 — 13 6 • , . 4 222 2 ． 9 . ・一 I ・ 一 ・ 0 st 2 • 7 - 3 ; • . 6 2 - 1 22 - 2• 0.. �•� 21 0 .. 2 6 u 9 :ー 2 • 12\nI 一 ； - ·: I> 0 ‘ 2 ;,-- 2 7 :, .. ; . 0 . 61 -, ..,, 2 2 —● • - 、I., 5 ,,. 0 8 2 .虹 1 一 • . — .6 0 1 • t 3 — 9 • I 9 ； 翡 0」4s lt , ? 4 9 .2 s - 1 t - 5 • I •· ooe 15 ,7 ·2 ••i• 2 --.-.. - 5 . • 55 5 ·· —1 1 ” で ; , · 7 9 - 2 2 1 1 ` - ” . - . 5 .. 5 5 5..9 1 1 一 . , 一 1 7 • 2 2 •一 1 1 • . • \" •• • 0 5 一 6 51 8 •• , • 7 d ·· 6 2 ー・ 1 1 ー••-- ・ -•\n• •\n- ： 額 匹 王： 顎 - 空 紅 - 費 ― 霰 露 壷 い f3 お るす に喧 欝本 宣を 、 入 ち ” 算 うのの ' へ 議 ” 会 費糧の\n墨 3 1 必 号 I 鱈 順 てI\n·一-— ＾ へ一·-\n.,..: ..·+ · ‘ -- — -- F----\n-rら—- --------- -- -- --9•— ．\n®\n0lt2\nI •l漣 湖 2\n_， 6 65 5B 8·， し .2 2 | 1 .2 2 4. .4 . .\n． . • • .• ．りおとの2-31表別:1:1網 . • 明払支 · の分年52成 平 • る係に • • • 社会 • 式 . 株 . • . • _ .•\n9 • 6一 薗 疇慣 召 主 却 •- 魯 匹 ● ●\nG• ー杜食it鰊l\n1 2\n• · 1 ― 0 . 9會S3 ↓ 0 . ,7\n-” --― — ．-• ．一• - - -·\n�- 顎 雹 ― 覺 揖主 ま ·’ ― 含 S―愴 原 ― l計合 0®しいなの怜會111.:\n1.54\n.•一i� 1�9',7,\n＇ 。す表を額金るいてれさ入写に費経要必ていおに分処正更各件本、は額金 ')O 書弛括の襴J額入算脊I経要必「の5号屑!,.,\nI ）注（\n．るあで顎全たし除控を顎金各の書弧括の日［J謂入算費経要必『の5号順らか額企各)931号印i\n、は頷主・各)(/4l号爵：：と、\n. ,. ·\" < ら・' •• •• • .. • ,• .,・と ,, 、,, ．し.． .， と · こ・と C 額張主方双る係に料スーリ tIa9年各件＊ 分年 計 62 合 成平 .21 9 1 ＂ ， 8 7 6 5 4 3 2 I . I 怜\n\"'l 分区 約 11 契 戴名件物名と9l号隕縫閉ーc タ 帽 ン g\n3 」 7 1バ 台2ト 佑\n］冒［ ］I 彗]t]]]]l］U ：］［］冒1\ne\nm-1\na\n）計禽の③しいな0．件物（・ 如91\nI •5\nHHH/25、:\n「\n)088 .275( 11 o\nE h\nー D\n••. - - 0 6 0 6 0 0 0 0 0 0 1 1 2 2 - 2 4 2 1. . - , . , . , 5 1 s 1 2 9 9 5 3 3 5 0 4 - - 9 1 1 3 1 1 - • ,•: - ” ― . H . l 11 0 l ` 0 , . _ . & 0 . 0 ' 0 • 6 •一 1 • 0 1 0 0 - 2 4 1 2 2 2 . , , ↓ , 5 ’ 一 . l 2 5 0 1 9● 5 3 0 ●3 i 4 ’ H ”. 1 3 ， 1 1 - : 1 • ’ - • . • · - I 1 1 1 1 [ - ’ ` り ． o 0 · 4 0 - , ー 即 - 0 — 1 9 g a 9 2 - 一 ; ． : .3 8 四 8 0 4 - 3 3 1 1 1 - 9 • ヽ •• - •， - . 疇 ． ＇ ．， ． - [ I 1 ' ・ - ＿ ' 0 わ 4 - 0 4 .. ＿ . 0 0 0 ． o 1 - ．＾ - 9 8 2 9 0 9 - : - , , ; . • 8 6 0 3 3 - 4 • 3 . 3 1 3 一 1 1 ’ • - • ． •• よ I い ． ― 叫 函 4 00 1) 0 · - 0 4 1 ↓ ·- 9 9 8 8 2 - , _ - 3 8 3 s 4 0 3 3 3 1 1 1 L - - - • • ' I I - ,. ‘ ' 9 . l o 蜘 0 4 0 - - 0 0 1 叩 4 8 8 2 9 . ' 厄 . , - 3 3 0 8 4 3 3 3 1 1 1 - • - •- - - - . • I 9t . 9 · . \" • - 9 • . 900 • - 0 0 0 · 一 . - . 0 4 1 - 9 2 9 . • • - : , 會 ． • · 8 8 . 0 一 4 , 1 1 1 - 3.· - '.• ' : I I - — • . ‘ 0 • 0 . 一 一 0. 0 .. 4 0 1 0 0 • 9 9 加 • •ャ : ． . ． . 0 8 • ． 8 ー ．， 1 1 1 3 ・ • ー ● • • ●● •- ● . \" - ” - . • . , . I : I ' 0 • • • - 一 : • 1 : 0 0 0 9 !10 0 42 9 - ; : : 0 .4 • B 8 一 - I . 3 1 1 - • • •. ・ ● • • ●● • 0 I • . • ’ • • ― 面 0 ・・ 0 - . 0 0 1 4 一 9 9 2 9 ― ; - • . , m 8 8 4 1 1 1 • - - • - 一 ー ． • - - - - I ' ! ― , - •• 0 0 ·ー B 1 · 9. 4 ー - . · . .0 4 6 1 さ ., • . - 一 • • • I : - - • • 0 - 1 . ― 9 - プ , . 「 4 — ·- 1 . 一 一 - • • で • ' • 9 . ·· I · . · .疇 ·— • - •- - •• - • 9•～ - 一 -- - •• - ー ← • t - 一 . ._. • • 一 ..,•• • - • . - 9 ' • . 9 - .. ． . .0I の ® _\n. • ' ． I 饂 - • - H. ― 霞 1!1 II 傾 襲 張 襦 ll 頁 - - 宣 ― 宣 至 土 主 主 - 信 昏 魯 号 告 告 - 9 属 檜 厩 属 甚 · 蝙 ト ·· t l 4 8 2 I / 1 叫 6 6 囮 2H\n[ 羹合複\n-←\n／\n. . 9\n9 ‘ \n., ” i \n' J • ． ． ． 、．\n9[ ’ ` 謬 ー 堕 0 . C、 0 ;, 9 5 ,: � 4 - 9 5 ． . 竺 • ; - : , 8 2 9 . 0 . ( 8 6 4 - ., ,· • · 1 1 ' - . · ・ ＿ I IJ I号 ． · 9 , 竺 0 ： . 0 7蒻 ,.. 6 4 ！ 1 1., , ; ` . 濯 ·竺 5 3 , 7 . 3 6 t . 3 .. 2 ． . 1 1 . J .• —悶 . 竺 匹 0 9一 S ·- 3 0 _ 5 - 9 - 9..:. , , - ． • . 5 お . 7 . 、 2 直 .. 9 ,,... ● ● I｝ ●● 竺 9 ・ ー 0 4 5 ·· 0 3 2 芸 - 9 0 6 - . ., - , 壁 5 5 1 2 3 1 • •，••• . • ． •• ． • — - ． I 釦 . 芸 5 4 .. _ . 3 9 2 • O 5 — 9 • , , , · 屯 5 5 7 一 2 31 •• ． — ＿ ー ． · j ｀ — 竺 4 0 一 5 ； 9 昂； 3 2 9 5 0 - 竺 ● , ， ＂ , 5 · 5 7 ＂． 2 ． 3 ！ ．． 1 1` . ．． ― ,ー • ー． , ― ．． ． I ・ ｀ 竺 0 ' . · 0 0 塁 5 3 9 22 5 9 , ； 竺 1 1 s , 2 0 1 • 号 - · 一 — I ． - ．！湿— 0 . ． - ' 壁 0 5 3 9 2 - 9 5 2 • — 9 , . , . , • ' 7 一 6 竺 1 2 0 • 1 “ ． ~ •••一 • ー : ~ · → • ' . j • · ． . 塁 • 0 .ー 5 竺 0 ー 3 9 22 5 9 ・ ・ ー：： . , 一 · 1 竺 6 7 0 2 •一 1 •• . 一 一• し• I ． • • , • . 0 竺 • 0 麟 5 ,•- 3 2 9 - 5 9 2 · - , , , 7• - 5 .9 貶 - 0 2 ＿ 1 • — ― -- I 温 •- 0 竺 、o 5 -- 3 9 6 9 5 5 . 9 - 7�. . - 2 ·竺 � 2 1 」 ·, ：ー ー 1 ●● ＿ ●● 9 } • • I · ＿ — 0 0 色唖 - 5 i 9 8 3 -- 0 · 9 5 国 - ; - 2 5 r7 •· 2 5 一•• - 一 一 4 • • ． — • 一 t •• 、 • • ． 饂 • ； ' • 竺 0 • 西 • 5 -. 9 8 5 0 .. 『 号 . 竺 5 .. 7 2 2 5 ··_一•. - . 一 — ー • . , 塁 • ． — 竺 0 6• 0 ••― 3 9 80 9 5 ― , ： 竺 . .i 9 2 ; 5 .. 2 5 . : . • . 一 ． ＿ • I ® ®\n- : 竺 鰈 額 籟 - . 憬 · 耀 甕 : 竺 ·- 9 主 i 主 主含 告 會 竺 ; -9. 原 讀 原 : .. ． 3 ， ／ I 匹 喝\n． ） ら ン ンォ ォ 忠 フ 7— ス ス ネ ネ で ジ ジ；ビ\n言 、\n． ］ I ． 1 9 9.\n、\n涵 583 韮 、019 ,1 29．—．平 029、.14 四 1 ,1 • ． 函． 061 翫 .59 ' ” : ― 函 06 H 9 ,59 11�·- ＂ 亨 061 ,% 而句 06 町 1 ,5' 9 言 函 061 詞 .59 ・る 06 百 1 ,5 可 9 ｀ • ―- 涵 061 詞 .59 畜 061 , 、m 59 7. 、 0 5 6 荘 1 .59 iT 涵 061 ． , ．石 59 -l • :J . 石 061 ,5 而 9 ― ·I涵 061 翫 ,59 一． ． ’云 験帳 て 主雷 i 鼈 h ・ •\nF )It : 品 · E\ni・29\n• •’ 1 4 - 7 29 も - , '9 2 0 5 • 3 1 一 .; ..7 7 •• 頂 - 8 - 5 5 2 - . , 9 8 4 2 -. 1 7 - . , 4 3 - 4 9 67 00 - . ,2 g. 4 7 - 3 3 9 - . 4 90 76 0 - . ,9 2 1 4 - 3 3 -- 9 47 叩 6 - . ， 9 2 7 4 - 3 3 -- . 9 - oo 476 . - . 9 24 7 - 3 3 •' - :.. 5 0 • 0 7 -. .8 2 9 , 朽 08 - 3 3 - : 0 5 1 09i 8 ●●’ ” \"· 5 08 ー 4 ·9 3 3 一•- , • . - 0. 5 7 20 8· - . ,5 8 4 0 3 3 - \" • 、ー : • O 5 - ? 02 8.. - . 5 8 4 0 - 3 3 ...● ● 0 ヽ• 5 •- 0 12 3 , . - 9 7 8 53 2 - ” • · . •• 5• 30 - 03 7 . .6 - 9 2.9 82' - · ' - 0 5 - 9 39 3 •• . 、 - 4 6 ·一 9 7 . 2 2 . ••一 • 0 — 5 - 3 9 7 3 . - .4 69 7 2. 2 -\" I/\n・ . ' I · 訊 111 -- 環 帽 主 宣書 S - 厖 包 -t ．\n'計合の）国いな）的IllI\n:39\n- 1 4 9 4 - 6 0 , ,0 ? - 2 8 1 1 、 . ., 7 6' ' - •6 65 7 2 5 ., .、, 8 . - 4 2 7 1 : , .4 1 3 - • 4 9 7 00 6 - . , 9 2 -7 4 - 3 -.. , ' ,,.. 4 9 ·· 7 0 ·- 0 6 , ,2 9 4 7 - 3 3 - 4 90 7_6 0 - , .9 24 73 - 3 ’ 4 9 •- 0 7 — 6 0 9 2 7 43 3 - .’ ' .5 0 - 1 02 8 . , ,08 45 - 3 3 . -’’ 0 5 1 0 - 8 2 ; •; 5 8 4 0 3 3 - •'. - 0 50 18 2 - 5 8 4 03 3 9• . ― 5 01 0 · 8 2 · - ー .; . 5 8 4 0 3 3 ト - • • - • o 5 i 0 · . 3 2 ＂ : 、.・9’ ·1 ● S ●8● ; 2 3 ●● : - ●9●9● ● 、 l · - 0 5 3 03 1 - . , .6 9 29 82 - - 0 59 3 ●●● 1 ● 3 . ● .49 6 •• 7 9 一 2 2 - 9＇ 中 0 5 一 9 31 3 • . , ~ 4 69 7 • 2 心 2 ' ' “' I ‘•\n·一 11 1l 彊 隠主 室 •一 告 告111 原 •I い 含る おに す揖\n＂＊ 主を 、 人 らう 尊 、 の のへ 額金 良匿の\n年 31彎 闘 II てI淫\n· 謬一化—i--+—-+—·十 — ー ー ー一 一 ―. -- • ― + —ー —+—-• • ―\n'！ゆスク ッ；；『11151湖 1 2 -\n． I 四 .632.,26 • 9 ド i．．8 ・一 7 璽 17 , ！ •52 翌 5 ＿ • . ・' 2 :● .9. り]： と ーに］ー 1·細 明 支］．b-にこ — ：： _ · : I ：言:\nG 一囀面艮f\nGI\n,..面06�.ね涵-4 ． ：.u \" 上 . H I ： : ·: 3 � 79 .352 .s • .._ _ .'- ．す表を類金るいてれさ入 ― 冥ご — i費経要 ． 必てい ＇ ． おに分姐正更各件本 、は額金の書也括の桐ゴ J 額 額 攘 入 主石舎 惇 械 巽径冥必「.m計合 5 の 号 ® • • 頃 .1いな\n2 3 1 庄 · ! 、 物注 l9 ‘ ‘ 1\n．るあで顎金たし除控を額金各の苔祁括の欄J額入第至経巽必「の5号渭らか預全各の31号．1日、は打金各の41•号順\n`別表５～１１－１４、１３－１～１３－３ 省略"
}