{
  "number": "13785",
  "title": "所得税及び復興特別所得税の各更正処分並びに過少申告加算税の各賦課決定処分の取消請求事件",
  "court": "長野地方裁判所",
  "date": "令和４年１２月９日",
  "date_iso": "2022-12-09",
  "result": "取消",
  "topics": [
    "所得税"
  ],
  "laws": [],
  "keywords": [
    "復興特別所得税",
    "所得税",
    "更正処分",
    "決定処分",
    "賦課決定",
    "過少申告加算税",
    "青色申告"
  ],
  "sections": {
    "主文": [
      "１ 原告の請求をいずれも棄却する。\n２ 訴訟費用は原告の負担とする。"
    ]
  },
  "full_text": "13785 所得税及び復興特別所得税の各更正処分並びに過少申告加算税の各賦課決定処分の取消請求事件 - 国税庁判決事例集\n\n\n\n\n\n\n\n\n\n\n目次に戻る\n\n\n\n\n判決 13785\n\n\n所得税及び復興特別所得税の各更正処分並びに過少申告加算税の各賦課決定処分の取消請求事件\n\n\n\n\n裁判所:\n 長野地方裁判所\n\n\n判決日:\n 令和４年１２月９日\n\n\n結果:\n 取消\n\n\n\n\n\n\n主文\n\n\n１ 原告の請求をいずれも棄却する。\n２ 訴訟費用は原告の負担とする。\n\n\n\n\n\n\n第１ 請求の趣旨\n\n\n１ 処分行政庁が原告に対して令和２年９月２５日付けでした原告の平成２８年分の所得税及び復興特別所得税の更正処分のうち総所得金額４０４０万７７３６円、納付すべき税額２３３万３７００円を超える部分、並びに過少申告加算税の賦課決定処分をいずれも取り消す。\n２ 処分行政庁が原告に対して令和２年９月２５日付けでした原告の平成２９年分の所得税及び復興特別所得税の更正処分のうち総所得金額３９８３万７７４１円、納付すべき税額１９３万円を超える部分、並びに過少申告加算税の賦課決定処分をいずれも取り消す。\n３ 処分行政庁が原告に対して令和２年９月２５日付けでした原告の平成３０年分の所得税及び復興特別所得税の更正処分のうち総所得金額３１１５万２４５２円、納付すべき税額マイナス５５万９６００円を超える部分、並びに過少申告加算税の賦課決定処分をいずれも取り消す。\n\n\n\n\n\n\n第２ 事案の概要\n\n\n１ 事案の要旨本件は、開業医である原告が、平成２８～３０年分の所得税及び復興特別所得税（以下「所得税等」と総称する。）の各確定申告（以下「本件各確定申告」という。）について、自己の配偶者に支払ったとする青色事業専従者給与年額１８００万円の相当性を一部否認して処分行政庁がした増額更正処分及び過少申告加算税の賦課決定処分（以下「本件各処分」と総称する。）は違法であると主張して、被告に対し、上記更正処分の増額部分及び過少申告加算税の賦課決定処分の取消しを求める事案である。\n２ 前提事実（争いがないか掲記の証拠により容易に認められる事実）\n\n\n（１）関係者等ア 原告は、長野県岡谷市内に開設された診療所（以下「本件診療所」という。）で内科等の医業（以下「本件事業」という。）を営む医師であり、平成１２年分以後の所得税について、処分行政庁から所得税法１４３条に規定する青色申告の承認を受けている。［乙１］イ 原告の配偶者（以下「本件配偶者」という。）は、原告と生計を一にし、看護師として本件事業に従事しており、平成２８～３０年（以下「本件各年」という。）において、いずれも年間を通じて青色事業専従者（所得税法５７条１項）として本件事業に従事していた。［乙２の１～３］\n\n\n（２）本件配偶者に対する青色事業専従者給与額の変遷ア 原告は、処分行政庁に対し、平成１３年３月１５日、同年１月以後の青色事業専従者給与の支給に関して、本件配偶者を専従者として、以下のとおり定めた旨の「青色事業専従者給与に関する届出書」（以下「本件届出書」という。）を提出した。［乙３］\n「仕事内容・従事の程度」 医療事務、経理\n「資格等」 （記載なし）\n「給料」欄 「支給期」月末、「金額（月額）」２０万円\n「賞与」欄 「支給期」１２月、「支給の基準（金額）」６か月以内\n「昇給の基準」 ２０％以内イ その後、原告は、処分行政庁に対し、青色事業専従者給与の支給に関して、以下のとおり変更することとした旨の「青色事業専従者給与に関する変更届出書」（以下「本件各変更届出書」と総称する。）をそれぞれ提出した。その結果、本件配偶者に支給する青色事業専従者給与の届出上限額は、平成２１年１月以降、年額１８００万円（給与１００万円\n×１２か月＋賞与１００万円×３か月分×２回）となった。［乙４の１～５］\n（ア）平成１４年３月１５日（同年４月以後から変更）\n「給料」欄 「金額（月額）」３０万円\n「賞与」欄 「支給期」７月・１２月\n「支給の基準（金額）」３か月以内\n（イ）平成１５年３月１７日（同年４月以後から変更）\nママ\n「仕事の内容・従事の程度」 看護婦、事務、経理ママ\n「資格等」 看護婦\n「給料」欄 「金額（月額）」４５万円\n（ウ）平成１８年１月２５日（同月以後から変更）\n「給料」欄 「金額（月額）」７０万円\n（エ）同年１２月２７日（平成１９年１月以後から変更）\nママ\n「仕事の内容・従事の程度」 看護士、事務、経理ママ\n「資格等」 看護士\n「給料」欄 「金額（月額）」８０万円\n（オ）平成２１年１月２９日（同月以後から変更）\n「給料」欄 「金額（月額）」１００万円\n\n\n（３）原告は、本件配偶者に対し、本件各年において、本件事業に従事した対価として年額１８\n００万円の青色事業専従者給与（以下「本件専従者給与」という。）を支払った。他方で、\n原告は、本件診療所における看護師資格を有する他の使用人ら（以下「本件看護師使用人」\nと総称する。）に対しては、本件各年において、２９１万４４８０円（従事月数１０月）から４６９万４５９９円の間で給与をそれぞれ支払った。［乙２の１～３、６］\n\n\n（４）原告は、本件各年分の所得税等について、事業所得の金額の計算上、本件専従者給与の額\n１８００万円を必要経費に算入して、いずれも法定申告期限までに、別表１－１から１－３の各「確定申告」欄のとおりに本件各確定申告を行った。［乙２の１～３、乙１２の１～３]\n\n\n（５）諏訪税務署の職員は、原告の本件各確定申告に関し、令和元年８月から令和２年７月にかけて、原告に対して各種の調査を行った（以下「本件調査」という。）。［乙５、６］\n\n\n（６）処分行政庁は、本件調査の結果、本件専従者給与の額のうちに労務の対価として相当であると認められる額（以下「適正給与相当額」という。）を超える部分があり、当該金額は原告の事業所得の金額の計算上必要経費に算入することはできないとして、令和２年９月２５日付けで、別表１－１から１－３の各「更正処分及び賦課決定処分」欄のとおりに本件各処分を行った。［甲１の１～３］\n\n\n（７）原告は、本件各処分を不服として、同年１０月１９日、国税不服審判所長に対し審査請求を行ったが、令和３年８月３日付けで審査請求をいずれも棄却する旨の裁決を受けた。［甲\n２の１・２］\n\n\n（８）原告は、上記裁決を不服として、令和４年２月３日、本件訴えを提起した。\n３ 争点\n\n\n（１）本件専従者給与の額が、所得税法５７条１項の「労務の対価として相当であると認められる」ものか（本件専従者給与の額の相当性）\n\n\n（２）本件専従者給与の額が「労務の対価として相当であると認められる」ものでない場合、相当な金額はいくらか（本件における適正給与相当額）\n４ 争点についての当事者の主張\n\n\n（１）争点１（本件専従者給与の額の相当性）について\n（被告の主張）\n本件届出書、本件各変更届出書、本件調査で本件配偶者から受領した書面に加え、本件訴訟における各証拠を見ても、本件配偶者の労務の性質及び労務の提供の程度等は明らかではなく、本件看護師使用人の労務との間に質的に異なる程の大きな差異はない。また、原告の事業と同種の事業でその規模が類似するものに従事する者が支払を受ける給与と比較する方法（以下「類似同業者給与比準方式」という。）により算出した金額（平成２８年分及び平成２９年分につきいずれも８２１万３３３４円、平成３０年分につき７９２万４９２２円）\nと比較した場合、本件専従者給与の額は、平成２８年分及び２９年分がいずれも約２．１９倍、平成３０年分が約２．２７倍と高額である。以上の事情からすれば、本件専従者給与の年額１８００万円は、「労務の対価として相当であると認められる」ものとはいえない。\n（原告の主張）\n本件配偶者は、看護師長と事務長を兼任しており、看護師と事務員の統括、外来看護、受付業務、調剤等を行っている。使用人の誰よりも早く出勤し、最後まで居残って業務を行っており、昼休みには、在宅医療の往診、特定検診、予防接種、必要品の購入、銀行への振込も行い、終業後には、当日分の日計表の作成、領収書の整理、翌日の振込準備を行っている。\nこれに加え、毎月、職員の給料計算等の労務管理や社会保険関係の書類の提出を行い、インフルエンザの予防接種の時期になれば、休日である土曜日及び日曜日にも接種及びその準備等を行うなど、時間外・休日労働が年９００時間以上にのぼる。原告と使用人の連絡係として怒られ役も担っており、精神的負荷も大きい。このように、本件配偶者の従事する業務は余人をもって代え難いものであり、質及び量のいずれの観点から見ても幅広くかつ多くの業務をこなし、本件事業に多大な貢献をしている。本件専従者給与の年額１８００万円は、本件配偶者の看護師としての経験・勤務年数、仕事の内容、労働時間及び役職等に照らし、労務の対価として相当であると認められるものである。\n\n\n（２）争点２（本件における適正給与相当額）について\n（被告の主張）\n本件各年分について、本件配偶者が本件事業のために提供していた労務の性質及び労務の提供の程度については不明であり、その事業に従事する他の使用人が支払を受ける給与の状況と比較する方法（使用人給与比準方式）は適当ではないから、類似同業者給与比準方式により適正給与相当額を算定するのが適当である。かかる方式で算出された、類似同業者の平均額である平成２８年分及び平成２９年分の８２１万３３３４円、平成３０年分の７９２万\n４９２２円が、それぞれ本件における適正給与相当額となる。\n（原告の主張）\n争う。被告が主張する金額は、本件配偶者の看護師としての経験・勤務年数、仕事の内容、\n労働時間及び役職等を全く考慮しておらず、適正給与相当額とはいえない。\n\n\n\n\n\n\n第３ 当裁判所の判断\n\n\n１ 認定事実掲記の証拠によれば、以下の事実が認められる。\n\n\n（１）本件事業についてア 本件診療所では、診療時間を、月曜日から金曜日までは午前８時３０分から午後１時まで及び午後３時から午後６時２０分まで、土曜日は午前８時３０分から午後１時までとして、診療を行っている。［甲４の１、６、乙７］イ 原告は、本件事業の一環として、平日の診療時間外、土曜日の診療時間後及び診療を実施していない日曜日に、本件各年においては定期予防接種（月に１回程度）及びインフルエンザの予防接種（１０月中旬から１２月末）を行い、加えて平成２９年及び平成３０年においては６月から１０月にかけて特定検診を行っていた。［甲４の１～３、６～９、乙\n７、９、１０］ウ 本件各年分における原告の年間の売上（収入）金額は、平成２８年分が１億９１６０万\n９８０９円、平成２９年分が１億８１４５万６２９５円、平成３０年分が１億６７１５万\n７４８０円であった。［乙２の１～３］\n\n\n（２）本件配偶者の労務等についてア 本件診療所における看護師使用人の雇用状況本件診療所では、本件各年において、本件配偶者を含め常時３～４人の看護師を雇用していた。［乙２の１～３、６］イ 本件配偶者及び本件看護師使用人の労務内容\n（ア）本件配偶者は、本件各年において、肩書を看護師長兼事務長として、本件事業に年間を通じて従事し、①看護師業務のほか、②会計業務、③消耗品の買出し、④社会保険料及び労働保険料の算定、⑤労務管理及び採用・離職手続、⑥税理士への対応、⑦診療報酬改定に伴う研修や特定検診の説明会への参加、⑧診療時間外の患者に対する電話対応、\n⑨使用人に対する指示や教育等の使用人管理、⑩薬剤の在庫管理、⑪在宅医療の際の自動車を用いた送迎、⑫近隣を含めた外部への対応、⑬清掃や雪かき等の環境整備、⑭トラブル処理等の役割を担っていた。［甲４の１、６、乙５～１０］\n（イ）本件看護師使用人は、一般的な看護師業務、受付業務及び調剤業務に従事し、本件各年において、上記（ア）②から⑭までの業務には従事していなかった。［甲４の１、乙\n６、９、１０］ウ 本件配偶者及び本件各看護師使用人が労務に従事した時間\n（ア）本件各年とも、使用人の労働時間に関し、本件看護師使用人についてはタイムカードにより管理されていたが、本件配偶者についてはタイムカードがなく、他に本件事業に従事した時間及び業務内容等を労務の都度記録するなどして作成された客観的資料はない。［乙６～１０］\n（イ）本件看護師使用人は、いずれもほぼ法定労働時間の範囲内で本件事業に従事していた。\n［甲４の１]\n（ウ）これに対し、本件配偶者は、上記イ（ア）①の看護師業務として、診療時間の前後、\n昼休み等の時間外や休診日においても、医師の往診や在宅訪問医療の補助、特定検診、\nインフルエンザの予防接種、定期予防接種等の業務に従事していたほか、上記イ（ア）\n②から⑭の業務についても時間外労働に及んでいた。もっとも、本件において、原告は、\nこれらの時間外・休日労働に関し、法定労働時間週４０時間を超える部分が平成２８年は年間約９０７時間、平成２９年は年間約９１４時間、平成３０年は年間約９２１時間に及ぶとする手書きのメモ（訴え提起後に作成されたもの）を提出するにとどまった。\n［甲４の１～３、６～９、乙７、９、１０]\n\n\n（３）その他本件専従者給与の額に関する事情についてア 原告の関与税理士である乙税理士（以下「乙税理士」という。）は、令和元年１０月２\n３日及び同年１１月７日にそれぞれ電話で、本件調査に当たった税務署の調査官に対し、\n本件事業のうち医療行為以外は全て本件配偶者が取り仕切っており、本件専従者給与の金額については乙税理士を交えて原告及び本件配偶者と話した結果である旨を述べた。［甲\n２の１、乙６］イ 原告は、同年１１月１９日、本件調査に当たった税務署の調査官に対し、本件配偶者の業務内容の概略を記載した手書きのメモ（２枚のもの）を提出した上で、本件専従者給与の金額について、本件配偶者の業務は時間、量ともに膨大で普通の３倍は働いており、看護師の資格も持っていて従業員を一人で束ね、その精神的負担も大きいことなどを総合的に見て決定した旨の説明を行った一方、それが高すぎるなら上限はいくらかなどと押し問答を仕掛けた。\n原告は、上記手書きのメモの記載などに関する調査官からの問い合わせに対して、令和\n２年１月１６日付けの回答書（本文は１枚のもの）を提出した。同回答書には、業務内容の補足説明のほか、①専従者が専門に行う業務として、看護師、薬剤師、受付業務以外のあらゆる業務、特に夜間や土日祝日の患者及び全てのあらゆる分野への対応があること、\n②専従者給与額の変更時に考慮した業務の特殊性として、「事務長兼看護師長の業務の他、\nあらゆる分野の問題に対応、解決を責任をもって対応し、特に院長先生と従業員や外部の方、近隣の方への対応」があることなどが記載されていた。［乙５～１０］ウ 調査に当たった税務署の調査官は、令和２年８月３１日、乙税理士に対し、本件専従者給与の額を決定するに際して根拠とした数字や検討過程などがわかる資料の提出を求めた。\nこれに対し、乙税理士は、「令和元年版 ＴＫＣ医業経営指標（Ｍ－ＢＡＳＴ）［医業賃金統計編］」と題する統計資料（以下「本件参考資料」という。）を税務署に送付した上で、\n同年９月３日、世間ではそのような賃金体系である旨を述べるにとどまり、上記調査官から、「労務の対価として適当である」という結論ばかりで具体的にどのような検討や計算があったのかわからない旨の指摘を受けても、特にそういった検討はしていない旨返答した。［乙６、１１］エ 原告は、本件訴訟において、医療施設等に勤務する看護師等の国家公務員に適用される\n「医療職俸給表\n\n\n（三）」（一般職の職員の給与に関する法律（昭和２５年法律第９５号）別表第８のハ、人事院規則９－２（俸給表の適用範囲）（昭和３２年人事院規則９－２）１\n４条。以下「本件俸給表」という。）を参考に、同表の７級３７号俸に相当する月額４５万３３００円を、本件配偶者が事務長と看護師長を兼ねているため１．５倍し、更に管理職手当を各６万円とすれば月額７９万９９５０円になるとし、月給８０万円に割増賃金を積算して加えれば本件専従者給与は１８００万円を上回る旨記載した書面を提出した。\n［甲３、４の１］\n\n\n（４）被告の推計方法についてア 被告は、本件における適正給与相当額の算出に当たり、類似同業者給与比準方式で推計を行った。\n類似同業者給与比準方式は、業種、業態の同一性、事業所の近隣性、事業規模の近似性などの抽出基準により類似同業者を抽出し、当該類似同業者が配偶者その他の親族に支給した給与額の平均額を算出して、当該事案で問題となる青色事業専従者に対する給与と比較するものである。\nイ 被告が本件において類似給与比準方式で行った推計過程等は、以下のとおりである。\n［乙１８、１９の各１～５］\n（ア）関東信越国税局長は、諏訪税務署長並びに同署の長野県内隣接区域を所管する松本税務署長、上田税務署長、伊那税務署長及び佐久税務署長に対し、各税務署管内の個人事業主であって以下の基準を全て満たす者（以下「本件類似同業者」という。）につき、\n本件各年分における売上金額及び配偶者に対する年間の合計支給額等を報告するよう指示した。［乙１８の１～５］\n・ 本件各年分の暦年を通じて内科医業を継続して営んでいる者（それ以外の業種目を兼業している者を除く。）\n・ 所得税の申告において青色申告の承認を受けており、青色申告決算書を提出している者\n・ 内科医業に係る年間の売上（収入）金額が、平成２８年分については９５８０万４\n９０５円以上３億８３２１万９６１８円以下、平成２９年分については９０７２万８\n１４８円以上３億６２９１万２５９０円以下、平成３０年分については８３５７万８\n７４０円以上３億３４３１万４９６０円以下（原告の売上金額の２分の１以上２倍以下）の範囲にある者\n・ 各税務署の管轄内に事業所を有する者\n・ 年間を通じて青色事業専従者給与を自身の配偶者に支払っている者であり、かつ、\n当該配偶者が看護師資格を有すること\n・ 次のａ及びｂのいずれにも該当しない者\nａ 災害等により、経営状態が異常であると認められる者\nｂ 税務署長から更正又は決定処分がされている者のうち、次のいずれかに該当する者\n（ａ）当該更正又は決定処分について国税通則法又は行政事件訴訟法の規定による不服申立期間又は出訴期間の経過していない者\n（ｂ）当該更正又は決定処分に対して不服申立てがされ、又は訴えが提起されて現在審理中である者\n（イ）上記（ア）の指示を受け、上記各税務署長から回答がされたところ、本件類似同業者の該当者数は平成２８年及び平成２９年が６、平成３０年が１２であり、本件類似同業者が配偶者に支給した青色事業専従者給与の額は、別表２－１のとおりであった。［乙\n１９の１～５］\n（ウ）被告は、その結果に基づき、本件各年分において本件類似同業者が配偶者に支給した青色事業専従者給与の年間合計額の平均額（以下「本件平均額」という。）を、別表２\n－１の「平均額」欄記載のとおり、平成２８年分及び平成２９年分につき８２１万３３\n３４円、平成３０年分につき７９２万４９２２円と算出した。\n２ 争点１（本件専従者給与の額の相当性）について\n\n\n（１）所得税法５６条は、納税者と生計を一にする親族が、その納税者の営む事業に従事したことなどの理由で対価の支払を受ける場合は、その対価の全額は、当該納税者の事業所得等の計算上、必要経費に算入しない旨を規定している。他方で、同法５７条１項は、納税者が青色申告の承認を受けている場合は、特例として、同法５６条の規定にかかわらず、前記親族が受ける給与の金額のうち、その労務に従事した期間、労務の性質及びその提供の程度、その事業の種類及び規模、その事業と同種の事業でその規模が類似するものが支給する給与の状況その他の政令で定める状況に照らしその労務の対価として相当であると認められるものは、当該納税者の事業所得等の計算上必要経費に算入することができる旨を規定している。\nこれを受けた所得税法施行令１６４条１項は、前記「政令で定める状況」について、①青色事業専従者の労務に従事した期間、労務の性質及びその提供の程度、②その事業に従事する他の使用人が支払を受ける給与の状況及びその事業と同種の事業でその規模が類似するものに従事する者が支払を受ける給与の状況、③その事業の種類及び規模並びにその収益の状況と規定している。\nこれらの規定によれば、青色事業専従者に支払った給与の額が、労務の対価として相当と認められるものとして事業所得等の計算上必要経費に算入することが認められるのは、所得税法５７条１項及び同法施行令１６４条１項の掲げる上記の各事情を踏まえ、当該青色事業専従者に支払った給与の額と提供された労務との対価関係が明確であるものに限られるというべきである。\n\n\n（２）上記認定事実のとおり、本件配偶者は、本件看護師使用人と比較すると多様な業務に従事しており、看護師長兼事務長として責任のある業務を担当し、かつ、その労務に従事した時間も多大であったものと見受けられ、それらの状況を原告、本件配偶者及び乙税理士において総合的に考慮した結果として、本件専従者給与の額が決められたことがうかがわれる。\nしかしながら、本件配偶者の労務内容や労務の量を客観的に示す証拠は断片的なものしかなく、それらが具体的に明らかであるとはいい難い。上記認定事実によっても、以下のとおり、労働時間、業務の多様性、責任や精神的負荷の大きさ等が具体的にどのように考慮されて支給額に反映されたのか、本件配偶者に対する給与の額が徐々に増加していった経緯等も含めて判然とせず、本件専従者給与の額は、本件配偶者の労務と対価関係が明確であるとはいえない。\nア 原告は、本件調査において、本件配偶者は普通の３倍働いている旨を説明しているところ、本件専従者給与の額は、本件看護師使用人の給与の最高額（４６９万４５９９円）の\n３倍（１４０８万３７９７円）を優に超えており、上記説明自体単なる感覚の域を出ないものといって差し支えない。なお、看護師長と事務長を兼ねているから給与の額が１．５倍になる旨の原告の指摘（上記１\n\n\n（３）エ）についても同様である。\nイ また、乙税理士が提供した本件参考資料は、単なる統計上の数値を示すものにすぎず、\nこれをもって本件専従者給与の額と本件配偶者の労務の対価関係が明らかになるものではない。\nウ そこで、原告は、上記１\n\n\n（３）エのとおり、本件俸給表を参考に種々の操作を加えて、\n本件専従者給与の額１８００万円の相当性を立証しようとしているものと見受けられる。\nしかしながら、それ自体、本件訴訟のための後付けにすぎないことが容易に見て取れるし、\nこの点を措くとしても、その金額の算出方法は、一方で本件配偶者についてのみタイムカ\nード等による労働時間の管理を行わず（その労働態様が労働時間等の規制になじまないと判断されたことがうかがわれる。）、その代償として管理職手当を計上していながら、他方で時間外労働等の対価として割増賃金を計上している自家撞着があることに加え、そもそも本件俸給表の７級３７号俸相当と解すべき何らの根拠もなく（人事院規則９－８（初任給、昇格、昇給等の基準）（昭和４４年人事院規則９－８）３７条、別表第７の４のとおり、本件俸給表の号俸は経験・勤務年数を意味するものではないし、同規則３条、別表第\n１のカによれば、７級の標準職務は「極めて規模の大きい医療機関の看護部長の職務」であって、本件診療所とは比較にならない。）、恣意的なこじつけといわざるを得ない。\nエ また、類似同業者給与比準方式によっても、本件専従者給与の額は、本件平均額と比較して、平成２８年分及び平成２９年分（８２１万３３３４円）は約２．１９倍、平成３０年分は（７９２万４９２２円）は約２．２７倍にもなり、上記認定事実からは、このような高額となる根拠を合理的に説明することは困難である。\nオ さらに、本件各変更届出書によれば、原告が本件配偶者に支払う青色事業専従者給与の月額は、本件配偶者が看護師資格を得て本件事業に従事し始めたことがうかがわれる平成\n１５年４月以後の月額４５万円から、平成１８年１月以後は月額７０万円、平成１９年１月以後は月額８０万円、平成２１年１月以後は月額１００万円と漸増しているところ、この間、「仕事の内容・従事の程度」欄の記載は、一貫して看護師、事務及び経理というものであって、平成１５年４月以降変更はないし、この間に本件事業が拡大するなど、本件配偶者の業務が特段に増加したような事情も格別うかがわれない（上記１\n\n\n（３）イで原告が指摘する事情はこれを基礎付けるものとはいえない。）。そうすると、平成１７年１２月までは月額４５万円であった支給額が、僅か３年余りで２倍以上に増額となった経緯についても、その具体的理由は全く不分明であり、その観点からも、本件専従者給与の月額１\n００万円と労務の対価関係は明らかであるとはいい難い。\n\n\n（３）以上の検討によれば、本件専従者給与の額１８００万円が、本件配偶者の労務の対価として相当であるとは認められない。\n３ 争点２（本件における適正給与相当額）について\n\n\n（１）上記２で検討したとおり、本件配偶者の労務内容や労務の量を具体的に認定することができず、本件専従者給与の額は、本件配偶者の労務との対価関係が明らかでない以上、処分行政庁が推計計算によって本件における適正給与相当額を算出したことは相当である。\n\n\n（２）そこで、本件における具体的な推計方法が合理的なものと認められるかどうかを検討する。\n上記認定事実によれば、処分行政庁は、類似同業者給与比準方式を採用し、同方式における類似同業者を抽出するに当たり、類似同業者の抽出基準を、原告と同じ業種（内科医業）、\n類似する収入規模（年間の売上金額が原告の売上金額の２分の１以上、２倍以下）、本件診療所と同じ又は隣接する税務署の管内に事業所を有する個人事業主、かつ、青色申告事業者で、年間を通じて青色事業専従者給与を配偶者に支払っており、当該配偶者が看護師資格を有する者として設定し、原告との類似性を確保している。加えて、その所得税等の申告が確定している者を基準として設定し、災害等の特殊状況下にある者を除外するなどして、資料の正確性も担保しており、その抽出基準の設定は合理性が認められる。その上で、各税務署長に指示して回答させる方法により、上記基準に該当するものを機械的、無作為に収集しているのであって、この過程に恣意性はない。さらに、その結果収集された類似同業者の数も各年６又は１２であり、各類似同業者の特殊性や個別事情等を平均化しうるに足りる数が確保できている。これらを踏まえると、別表２－１の本件類似同業者の例については、その信頼性及び原告との類似性は担保されているといえる。\nそうすると、本件平均額は、所得税法５７条１項に照らし、適正な青色事業専従者給与額と評価することができ、処分行政庁が採用した推計方法は合理的なものと認めることができる。\n\n\n（３）これに対し、原告は、本件平均額は、本件配偶者の看護師としての経験・勤務年数、仕事の内容、労働時間及び役職等を全く考慮しておらず、適正給与相当額ではないと主張する。\nしかしながら、本件配偶者の労務内容や労務の量を具体的に認定することができない上に、\n原告が主張するそれらの事情が、上記過程により算出された平均値に吸収され得ないほどの特殊な事情であることは具体的に明らかとなっておらず、上記主張は採用する前提を欠く。\n\n\n（４）よって、本件における適正給与相当額は、処分行政庁がとった推計方法により算出された、\n平成２８年分及び平成２９年分につき８２１万３３３４円、平成３０年分につき７９２万４\n９２２円と認めるのが相当である。\n４ 以上によれば、本件専従者給与の額１８００万円は所得税法５７条１項の「労務の対価として相当であると認められる」ものとはいえず、適正給与相当額である平成２８年分及び平成２\n９年分につき各８２１万３３３４円、平成３０年分につき７９２万４９２２円を超える額は、\n所得税等における事業所得の金額の計算上、必要経費に算入することができないというべきである。そうすると、このことを前提に処分行政庁が別表１－１から１－３の各「更正処分及び賦課決定処分」欄のとおり行った本件各処分はいずれも相当であり、原告が種々主張するところを勘案しても、本件各処分を取り消すべき違法は認められない。\n\n\n\n\n\n\n第４ 結論よって\n\n\n、原告の請求はいずれも理由がないから棄却することとして、主文のとおり判決する。\n\n\n長野地方裁判所民事部裁判長裁判官 橋本 修裁判官 大野 博隆裁判官 佐藤 杏\n\n\n（別紙1)\n\n\n・指定代 理 人：目録安 寅涼子．\n\n\n5 的 場将男松 尾・ 直 哉鈴 木尚 行\n\n\n•• 1塩川拓 也渡辺康太郎\n\n\nJO 由井 位近間 一、 郎\n\n\n． 小谷野幹 人\n\n\n、 .. ，0 ．が 、' ^ 齋藤知 子\n\n\n．‘\n\n\n,..\n\n\n．`\n\n\n.,\n\n\n, •● 、o ' ｀＇以 上\n\n\n.‘'.,\n\n\n• o\n\n\nl5別表1-1 平成28年分の所得税等の課税処分等の経緯\n\n\n1 二 : - - - - 」 」 に 竺 ？ 」 一 品， 器 認 、\n\n\n|9 — ●● ー9 審青四 求\n\n\n． ，\n\n\n,... ·,. •一ー～—•�,→●●●● “は拉：円う審査裁決\n\n\n-こ• · � �..99 9\n\n\nB 年 ・ 月\n\n\n(i) 給 所 得 金 額！,:平竺竺2巴� I 令 和 一2 年 躇 ？ 門」竺ー\n\n\n2 ！デ ゜ 、\n\n\n9 . 81 日‘\n\n\nl.令 和 3 年 8 月 3 B !l\n\n\nー ----→ 4.0,4 07•9.736 50,.l94,4.02,聾 雷\n\n\n／言\n\n\n三\n\n\n’\n\n\n-,\n\n\n597.ooo戸 詞\n\n\n□三\n\n\n三 言\n\n\n- - -全＇ 部 取 消 し\n\n\n. i ;•\n\n\nーー 9•\n\n\ni .\n\n\n1, l3,600, l - 1,113,6001°\n\n\n....J, L..\n\n\n―-\n\n\n1 1 , 1 3 6 1 1. 1, 1 36 .\n\n\n- -\n\n\n...5\n\n\n、..'4�\n\n\nI\n\n\n-\n\n\nrv,'\n\n\n、.\n\n\n_\n\n\ni ]' 除． g -----}ッ .I5\n\n\n・\n\n\n・ 課税総所得金額（①ー⑤） ⑬\n\n\n•\n\n\n.\n\n\n.、 ＝ゞ二.速\n\n\n謙税総所得金額に対す，る税額' • ⑭,―,. 10 5,•600\n\n\n― l : 雇)11者給与等支給額が増加した -s・ — ・、場合の所得税額の特別控除額 i＾⑬，I．・\"― •�.. 言 ―\n\n\n□ ）\n\n\n言喜\n\n\ni\n\n\n． 申告納税額(⑱· — ⑲) ; ⑳ 5,789,3 叩 ． : 一• 1•---5 ‘ . ,\n\n\n・1 '. ;\n\n\ni棄却\n\n\n14. 741, 200:1\n\n\n： 9 •• 9..,- ..-.叫\n\n\n:- ·・ ＇予りn· ,... 定・納 --•一．税． ．9. ．額！．•り® T - ` ． , ・． •9 • .. 9.. : 3 . , . 45 . 5 . ,6 ] 9 ・\n\n\ni — ： .2,\n\n\n：．［納付す．ぺき . 税 額 （ 一 ⑳ ．．.：. ⑪ . ) 、. : ’’ .@ .33a,100\n\n\n＇\n\n\n: ． i ．．上 過 ＂，． た． 少 ．．9 申 と＇ 告 ．．．．．．， 加 ． 算税の額 泊う會\n\n\n．\n\n\n..\n\n\n,｀ ●. ●． ,9●.\n\n\n. `\n\n\n\" 『\n\n\nf\n\n\n．\n\n\n\".\n\n\n.\n\n\n，\n\n\n” し卜\"',1\n\n\nA.\n\n\n,'\n\n\n9,\n\n\n9,\n\n\nヽ' 9・\n\n\nf `\n\n\n•\n\n\n�\n\n\n• 9 : , こ• ・ ． 9，\n\n\nJ 4 7 , 4 1 2 ,· 的 ．�・↑．·←• 9• .. I\n\n\n309,565\n\n\n•1 5 i 0 5 0 7, 6 5. ーLレ ..\n\n\n5,09(), 03.8\n\n\nヽ 9� . -\n\n\n-..\n\n\n..\n\n\n.. 一:9,· 960. ” . , 7:QO,.,\n\n\n,•\n\n\n3 4.. 5 5 6 , 0 0\n\n\n←\n\n\n，.'.\n\n\nr9 ,c•\n\n\nーょ\n\n\n叫·\n\n\n•6, 50_5,1\n\n\ni\n\n\n41* 7ぷ；函l!\n\n\n・\n\n\n（注）1 ［課税総所得金額（①ー．5）J ⑬欄の金額は、•1.oo0円未満の端数を切り捨てだ後の金額である（通則法118条l項）．．． ． •'.. •\n\n\n・\n\n\n2 「申告納税額（⑱—⑲)J⑳欄は、 JOO円未満の端数を切り捨てた後の金額である（東日本大震災からの復興の·ための施策を実施するために必要な財源の確保に関ずる特別措匿法24条2項）．、．\n\n\n1·\n\n\n，別表\n\n\n-.2’\n\n\n1 平成29年分の所得税等の課税処分等の経緯\n\n\n、\n\n\n.l l, .・,区..` 一，．，． ― ； ” ．： 1 . • . - 分一 , ； i ［ ' 一竺申告ー，芦醤塁ー 一五：請求i'』—•一：主竺， 一 •ii:\n\n\n9 • 、 ”· 3 ＇\n\n\n,1 年呈\n\n\n月 日、 ., ． 平成30年3.月: ．9J3 令和2年9月25日．令和2年i0月 ， 18日・ 令和 年8月3日碍 3 9,83 7 , 7411 49, 6 24,40 7 ,\n\n\n.., .-. ..\n\n\n39, 20 , 801'1 48, 993; 467\n\n\n·—.• -. . - ．．\n\n\n，図 ー・\n\n\n:’~9 --'•一•ヽ 630,940 ャー630,·—940’ ’ ． ．\n\n\n，\n\n\n| ’ 二• : ！ ：．．． ． ， — ．．． ， ー. の ： • 合 ー -心と 計 ， 額 ． 9 ツ ,．9 9,9 ・ ． 例 . ④‘’ー’ • .a - ー．． · 偲-一7 ー• ••9 · ニ竺翌\n\n\n7, ,021 —一竺竺竺，●～\n\n\n367 77 11\n\n\nl社会 ． 保険料芦餘 ~ 3: , l-- ；· 乱1 ··\n\n\n｛ ＇ l小 生 規 命 模 \" 企業共済 -； 等 一 掛 控 金 除 控除‘ 一⑧\n\n\n⑦三\n\n\n•\n\n\n□ 98 云 40, ： 0\n\n\nO\n\n\nO．\n\n\n0 ， ・ ｀ー一玉 84 云 0\n\n\n．．ぷ i、\n\n\n，\n\n\n9. ．\n\n\n＇\n\n\nー\n\n\nL• ．一’，\n\n\n， 9 1\n\n\nー·\n\n\n， ｀ ＇\n\n\n‘ ： l 戸\n\n\n』・\n\n\niし\n\n\n抹\n\n\n， ．．養\n\n\n．戸\n\n\n．控\n\n\n総 餘除 • ー • ． 畑 一 ． ・ ． J\n\n\n⑨憩＇ ． ． ；\n\n\n'\n\n\n・： 一 ： ． 9\n\n\n，ふ\n\n\n: ．\n\n\n― ．\n\n\n～こ ← ．\n\n\n． ． l\n\n\n．\n\n\n，\n\n\n＿\n\n\n5 77\n\n\n9\n\n\n.\n\n\n0 5\n\n\n, ,\n\n\n;\n\n\n0 0\n\n\n2.叩\n\n\n•O・O\n\n\n..\n\n\n. ，\n\n\n.\n\n\n． ヽ三 -\n\n\n，．\n\n\n'.\n\n\n．\n\n\n・\n\n\n．\n\n\n'·-\n\n\n．\n\n\n・\n\n\n\"\n\n\n．\n\n\n`’ ● ,― 言 ,\n\n\n・\n\n\nl ．\n\n\n·,\n\n\n, 5\n\n\n..\n\n\n.万\n\n\nこ\n\n\n9 7\n\n\n.\n\n\n0 5千\n\n\n.\n\n\n. .\n\n\n.\n\n\n↑\n\n\nO o '\n\n\n2 ..\n\n\n．\n\n\nO o\n\n\n．\n\n\n.'っ\n\n\nO o\n\n\n0 :\n\n\n、 ;I\n\n\nl:\n\n\n\\ , ．：\n\n\n;• ； ; 1\n\n\n，\n\n\n. . ' ,\n\n\n. - 1\n\n\n. ・ • 9\n\n\n.\n\n\n・\n\n\n..\n\n\no 3 80,OOO 全部取消し ， 棄却\n\n\n．\n\n\n．\n\n\n... ゜\n\n\n・'.\n\n\n.. ・ 、. ．\n\n\n\"· -•- . .• .\n\n\n.\n\n\n• o..\n\n\n..、.\n\n\n° `9 9•\n\n\n'· •..'` .. •， 量\n\n\n..● .;' 0. • ：：\n\n\n・ 三\n\n\n： 所 源 税及 泉 び復興 微 特別所 ．収 得 ：マ 税 ・ の 税 額 ． （ ． ー ⑮ ， 証 ． ＋ ·ー - ⑰ ・ - ） r ， ら 9 ； 9 • ● 一 ，⑬ ー ⑱ ： そ ＇ ' L · - ，· • · - • •「 - ' • ’ よ ヽ 1 - 9 4 - 0 • , , • 4 6 • . 3 l ー — · i 9 , ， , 8 1 • 5 2 9 ＇ : 5 ぐ3 9 : ギi — ,, ← •., · ・ 9 • l . 4, 4 ， , ， 臼 69 ．9 31 5 , ， 8 区 ―53` 9 , ヘ 9• ��� ；�9 ‘ ,. . � ,. .\n\n\n←-． -— , , ― . • ； q. .\n\n\n， 申告納税 - 額9 -、. （9 - ⑱ - -, - ‘⑲）：ぃ ← ⑳ t ． ’9 '.. - 5·．18\n\n\n7,20べ＇「 一9―→ -.9, - 91 - 3,7 — 00 ’\n\n\n，予定納税．·額．·9 ⑪ 3, 85,200,. . 3, 85?,2OO\n\n\n9；＇ ●●- 一 •一 @ •一�＇\n\n\n・納付すべき税額（⑳—⑪) ; 1 `: . I ,9 3 0,,000 6,9056..5. 00い\n\n\n過少申告加算税のー． 額 ＠● ， ． ＇’：.7.9 : • . 41 0®\n\n\n’・・（注）．1 ・「課税総所得金額（①二⑤）］：⑬欄の金額12、1,00•0円未満の端数を切り捨てた後の金額である（通則法118条1項）。•\n\n\n・\n\n\n、\n\n\n2 「. 申告納税額（⑱—⑲)」⑳欄は 100円未満の端数を切り捨てた後の金額である（東日本大震災からの復興のための施策を実施ずるために必要な財源の罐保に関する特別措置法24条2項）． ．別表i-3 平成3.0年分の所得税等の鰈税処分等の経緯\n\n\n.. .\n\n\nrL ．↓ ．．（． ．単 位＿皿分 更正処分及び'区 硫定申告 審査請求 審査裁決\n\n\nI • ．▲＇、 賦課決定処分年 月 ．：日 平成3•1年3月9B ・，令和2年9月25日 令和2年J0月）8El 令和3年8月3·f3\n\n\n-9斤 得得 金金、額1\n\n\nIll\n\n\n• • ①\n\n\nJ 31, 152, 4521. 41,227.530\n\n\n：：言\n\n\n芦□誓 置 ＇ ー．｀\n\n\n�.\n\n\n•I\n\n\n•·緯所．得 ·の金額\n\n\n•~ • r可，ー\n\n\n④・·\n\n\n·占\n\n\n．\n\n\nc• • ．, ↓所得控除の合計額 ー5:9510!135,l 5,510,135\n\n\na\n\n\n⑥社会保艮料控．験 i. 553,885 -2. 553,885\n\n\n-\n\n\n..小規模企業共済等掛金控除？ 9' ­ ···· '\n\n\n.\n\n\n= 8\n\n\n’ 4\n\n\n」\n\n\n0 '-' ，\n\n\n，\n\n\n,.,函\n\n\n⑩0 �・ . 心 、 994•← •\n\n\n8 . 4\n\n\n0\n\n\n．\n\n\n, '•姻\n\n\n000 ＇ •\n\n\n9 .� そ鼻 ^，円氾喜ど\n\n\n゜全部取消し 棄却\n\n\nヽ\n\n\nーマ .,課税総所得金額（①―⑤l.. 25,642,000 35, H1,000\n\n\n¢mm l— 『\n\n\n. o |1 � � 課 ． 税 m土9;t芸品日．に対ず‘る．税m 7A60,8oo•l . 11,4砥 .., 800 1\n\n\n． ヽ• g\n\n\n｀賃 ®ー＿ ＿ 1 - 的7 0 5 -\n\n\n｀ 軍 ● ● ‘ 9 \" · 9 . .\n\n\n｀ぃ ． · ， I 一 ↓所\n\n\n」, モ得\n\n\n9 復 差 ． -税\n\n\nー - 印 引 -及\n\n\n• · .,直\n\n\n所 . Jl IJ 得 所\n\n\nm得\n\n\n蛉税 税 •\n\n\nJ頴 -所\n\n\n額 -得\n\n\n{税\n\n\n（⑭ ®の\n\n\nx頓\n\n\n、 - 2\n\n\n(\n\n\n• . • 釦 l 一\n\n\n®\n\n\nー %\n\n\n+\n\n\n)\n\n\n@\n\n\n、\n\n\n)\n\n\n． ， _\n\n\n⑱\n\n\n⑰ ⑮\n\n\n'\n\n\n．\n\n\n:\n\n\n• !\n\n\n:\n\n\n- I ． , -――｀ 7一\n\n\n.\n\n\n,\n\n\n.一\n\n\n.5\n\n\n.3 I\n\n\ng ― 5 ·\n\n\n6\n\n\n,\n\n\n. ,\n\n\n4 0 7 9\n\n\n7 5 • ヒ\" ・\n\n\n- ーーニ -. , . , - 1\n\n\n_,\n\n\n1\n\n\n,\n\n\n.\n\n\n9 2 3 9. 9 3 8 ・\n\n\n•\n\n\n9 6\n\n\n,\n\n\n, ， ・\n\n\n1 叫\n\n\n0\n\n\n7\n\n\n，'\n\n\n――六，＇＇ ，｝ 9, l . 、← ． ： ,—ー ，●9 9,: ' -,------ ,..'寸\n\n\n― 源 ·― ·泉 ··. 微 ・ ・収 • 税 一 ＇額 · ⑬ � -- 4，212..16! —i. - 4 ' , 212, 1“\n\n\n9- ,-.— 予 申 で - ． 告 、一 •· - · 納 定 • 税 ． 額 納 ・ - 一 （ · - ⑱ •．・ . 税 — — . · . •⑬ 、 額 ) ・・＠ i ⑳ ., こ ' ． '•一： · . 3 3 ， ク . 98 9 5 ’ 8 a . I A d O ’` 9 3 7 ; , 8 4 5 1 s 8 9 3 - , • 9 • 0 OO 0 O 0 ヽ\n\n\n| ®｀納付すぺき税額（⑳-⑪） △559;600 3,555.000\n\n\n． ｀．―← →-·ー-,過少申告加算税の額 ⑬ ニ ..,. ·,9’ 土—- 99 ': . , 9• - 9 . � '| •I 9 41 7 1 ん OOO\n\n\n（注） 1 ］鰈税総所得金額（①·―⑤)J ⑬欄の金額は、1.の0円未潤の蟷数を切り捨てた緩の金額である（通艮I法118粂i\n\n\n•項）．、．．\n\n\n·\n\n\n．2 「更正処分及び賦課決定処分J欄の「·申告納税額（⑮:..:⑲）J⑳襴は、・100円未満の燐数を切り捨てた後の金額\n\n\n＇である（東B本大震災からの復興のための施策を実施するために必要な財諌の確保に関する特別措置法24条\n\n\n••項.） .\n\n\n3 ．確定申告J襴の「納付すぺき税額（⑳一⑪）」＠襴の△印は、．還付金の額に相当する金額セある．\n\n\nr別表２－１、２－２ 省略令和●●年（○○）第●●号 所得税及び復興特別所得税の各更正処分並びに過少申告加算税の各賦課決定処分の取消請求事件更正決定当事者の表示 別紙当事者目録記載のとおり頭書の事件につき、当裁判所において令和４年１２月９日に言い渡した判決に、明白な誤りがあるから、被告の申立てにより、当裁判所は次のとおり決定する。\n\n\n主 文上記判決の当事者の表示中、「処分行政庁 諏訪税務署長 小宮英一」とあるのを、「処分行政庁諏訪税務署長 遠山秀治」と更正する。\n\n\n令和４年１２月１９日長野地方裁判所民事部裁判長裁判官 橋本 修裁判官 大野 博隆裁判官 佐藤 杏"
}