{
  "number": "13797",
  "title": "法人税更正請求に対する更正すべき理由がない旨の通知処分取消等請求上告及び上告受理事件",
  "court": "最高裁判所",
  "date": "令和４年１２月２２日",
  "date_iso": "2022-12-22",
  "result": "取消",
  "topics": [
    "法人税"
  ],
  "laws": [],
  "keywords": [
    "法人税"
  ],
  "sections": {
    "主文": [
      "１ 本件上告を棄却する。\n２ 本件を上告審として受理しない。\n３ 上告費用及び申立費用は上告人兼申立人の負担とする。"
    ]
  },
  "full_text": "13797 法人税更正請求に対する更正すべき理由がない旨の通知処分取消等請求上告及び上告受理事件 - 国税庁判決事例集\n\n\n\n\n\n\n\n\n\n\n目次に戻る\n\n\n\n\n判決 13797\n\n\n法人税更正請求に対する更正すべき理由がない旨の通知処分取消等請求上告及び上告受理事件\n\n\n\n\n裁判所:\n 最高裁判所\n\n\n判決日:\n 令和４年１２月２２日\n\n\n結果:\n 取消\n\n\n\n\n\n\n主文\n\n\n１ 本件上告を棄却する。\n２ 本件を上告審として受理しない。\n３ 上告費用及び申立費用は上告人兼申立人の負担とする。\n\n\n\n\n\n\n第２ 理由\n\n\n１ 上告について民事事件について最高裁判所に上告をすることが許されるのは民訴法３１２条１項又は２項所定の場合に限られるところ、本件上告の理由は、明らかに上記各項に規定する事由に該当しない。\n２ 上告受理申立てについて本件申立ての理由によれば、本件は、民訴法３１８条１項により受理すべきものとは認められない。\n令和４年１２月２２日最高裁判所第一小法廷裁判長裁判官 山口 厚裁判官 深山 卓也裁判官 安浪 亮介裁判官 岡 正晶裁判官 堺 徹\n, \n. .., \n.\n•.\n.\n;,\n.\n....\n \n.. .\n·• . ．,• \n． ． ．当事者目録上 告 人兼申立 人 一般財団法同代表者代表理事甲．一同訴訟代理人弁護士・ 石披 上告人兼相手方 国\n．．同代表者法務大臣 齋同 指 定 代 理 人 入\n・寄\n信‘ 憲 ほか /藤\n健江\n純\n4'\n｀\n`‘·’·.,.'.'..:�’.\n.\n．"
}