{
  "number": "13859",
  "title": "所得税更正処分等取消請求事件",
  "court": "名古屋地方裁判所",
  "date": "令和５年６月２２日",
  "date_iso": "2023-06-22",
  "result": "取消",
  "topics": [
    "所得税"
  ],
  "laws": [],
  "keywords": [
    "復興特別所得税",
    "所得税",
    "更正の請求",
    "更正処分",
    "決定処分",
    "賦課決定",
    "過少申告加算税"
  ],
  "sections": {
    "主文": [
      "１ 原告の請求をいずれも棄却する。\n２ 訴訟費用は原告の負担とする。"
    ]
  },
  "full_text": "13859 所得税更正処分等取消請求事件 - 国税庁判決事例集\n\n\n\n\n\n\n\n\n\n\n目次に戻る\n\n\n\n\n判決 13859\n\n\n所得税更正処分等取消請求事件\n\n\n\n\n裁判所:\n 名古屋地方裁判所\n\n\n判決日:\n 令和５年６月２２日\n\n\n結果:\n 取消\n\n\n\n\n\n\n主文\n\n\n１ 原告の請求をいずれも棄却する。\n２ 訴訟費用は原告の負担とする。\n\n\n\n\n\n\n第１ 請求\n\n\n１ 昭和税務署長が、令和元年８月８日付けで原告に対してした平成２８年分の所得税及び復興特別所得税に係る更正の請求に対する更正をすべき理由がない旨の通知処分を取り消す。\n２ 昭和税務署長が、令和元年８月８日付けで原告に対してした平成２９年分の所得税及び復興特別所得税に係る更正処分のうち、総所得金額８３７万３４２４円を超える部分及び還付金の額に相当する税額３０１万６３９２円を超える部分並びに過少申告加算税の賦課決定処分を取り消す。\n３ 昭和税務署長が、令和元年８月８日付けで原告に対してした平成３０年分の所得税及び復興特別所得税に係る更正処分のうち、総所得金額２６８万１６１２円を超える部分及び還付金の額に相当する税額９２万８３３２円を超える部分並びに過少申告加算税の賦課決定処分を取り消す。\n\n\n\n\n\n\n第２ 事案の概要本件は\n\n\n、医師である原告が、健康診断業務に係る収入が給与所得に該当する収入であるとして所得税及び復興特別所得税（以下「所得税等」という。）の確定申告書を提出した平成２８年分について、当該収入の一部は事業所得に係る収入であったとして更正の請求をするとともに、健康診断業務に係る収入の一部及び意見書作成業務に係る収入について、事業所得に該当する収入であるとして平成２９年分及び平成３０年分の所得税等の確定申告書を提出したところ、処分行政庁が、平成２８年分に係る更正の請求は理由がない旨の通知（以下「本件通知処分」という。）をし、平成２９年分及び平成３０年分に係る上記収入のうち健康診断業務に係る収入は給与所得、意見書作成業務に係る収入は雑所得に該当し、また、平成２９年分の給与所得に申告漏れがあったとして、各更正処分（以下、平成２９年分の更正処分を\n「平成２９年分更正処分」、平成３０年分の更正処分を「平成３０年分更正処分」といい、これらを併せて「本件各更正処分」という。）及び過少申告加算税の各賦課決定処分（以下「本件各賦課決定処分」といい、本件通知処分及び本件各更正処分と併せ、「本件各処分」という。）をしたことから、本件各処分がいずれも違法であるとして、その取消しを求める事案である。\n１ 関係法令の定めは、別紙関係法令の定めに記載したとおりである。\n２ 前提事実（争いのない事実及び証拠（特記しない限り、枝番のあるものは各枝番を含む。以下同じ。）等により容易に認められる事実）\n\n\n（１）原告は、職業紹介会社を通じて紹介を受けるなどした医療法人等の健康診断業務等に従事する医師であり、平成２８年から平成３０年までの間に、本件各処分の対象となった別表１\n－１～別表１－３の「医療法人等名称」欄記載の各医療法人等（以下「本件各医療法人等」\nという。）の健康診断業務に従事した。(甲１～３、５)\n\n\n（２）原告は、平成２８年から平成３０年までの間、上記\n\n\n（１）の業務以外に、Ａ株式会社（以下「Ａ社」という。）から委嘱された顧問医として、医療過誤事案についての意見書等の作成業務（以下「本件意見書作成業務」という。）に従事した。（甲５）\n\n\n（３）原告は、上記\n\n\n（１）及び\n\n\n（２）のとおり従事したことなどにより、平成２８年から平成３\n０年までの間、別表１－１～別表１－３の「収入金額」欄及び別表２の「支払金額（税込）」\n欄のとおり、収入を得た。\n\n\n（４）原告は、平成２９年１０月１６日、富田林税務署長に対し、平成２８年分の所得税等の確定申告書を提出した。同申告書においては、平成２８年分の健康診断業務に係る各収入は、\n別表１－１の「所得区分」欄の「確定申告」欄のとおり、いずれも給与所得の収入金額に算入されていた。なお、同年分の本件意見書作成業務に係る収入は雑所得の収入金額に算入されていた。(乙３)\n\n\n（５）原告は、平成３０年３月１５日、上野税務署長に対し、平成２９年分の所得税等の確定申告書を法定申告期限内に提出した。同申告書においては、同年分の健康診断業務に係る各収入は、別表１－２の「所得区分」欄の「確定申告」欄のとおり、事業所得の総収入金額又は給与所得の収入金額に算入されていた。また、別表１－２の「Ｎｏ．」欄１６～２４記載の医療法人等から得た同年分の各収入については、同「所得区分」欄の「確定申告」欄のとおり、各種所得の収入金額に算入されていなかった。(甲２、乙１)\n\n\n（６）原告は、平成３０年６月１５日、平成２８年分の所得税等につき、同年分の健康診断業務に係る各収入について、別表１－１の「所得区分」欄の「更正の請求」欄のとおり、給与所得の収入金額に算入した収入の一部が事業所得の総収入金額に算入されるべきであるとして、\n更正の請求（以下「本件更正請求」という。）をした。（乙４）\n\n\n（７）原告は、平成３１年３月１５日、昭和税務署長に対し、平成３０年分の所得税等の確定申告書を法定申告期限内に提出した。同年分の各収入は、別表１－３及び別表２の「所得区分」\n欄の「確定申告」欄のとおり、事業所得の総収入金額又は給与所得の収入金額に算入されていた。（乙２）\n\n\n（８）昭和税務署長（処分行政庁）は、令和元年８月８日付けで、本件更正請求に対し、平成２\n８年分の健康診断業務に係る収入につき、別表１－１の「所得区分」欄の「通知処分」欄のとおり、いずれも給与所得の収入金額に算入され、更正をすべき理由はないとして、本件通知処分をした。（甲１）\n\n\n（９）処分行政庁は、令和元年８月８日付けで、原告に対し、平成２９年分及び平成３０年分の健康診断業務に係る各収入につき、別表１－２及び別表１－３の各「所得区分」欄の各「更正処分」欄のとおり、いずれも給与所得の収入金額に算入されるとし、平成３０年分の本件意見書作成業務に係る収入につき、別表２の「所得区分」欄の「更正処分」欄のとおり、雑所得の収入金額に算入されるとして、本件各更正処分及び本件各賦課決定処分をした（以下、\n別表１－１～別表１－３の「所得区分」欄の「確定申告」欄又は「更正の請求」欄に「事業」\nと記載された箇所に対応する収入に係る所得を、各年分ごとに「平成２８年分本件所得１」、\n「平成２９年分本件所得１」及び「平成３０年分本件所得１」といい、併せて「本件所得１」\nという。また、別表１－２の「所得区分」欄の「確定申告」欄に「申告漏れ」と記載された収入に対応する所得を「平成２９年分本件申告漏れ所得」といい、別表２に記載された支払金額に対応する所得を「平成３０年分本件所得２」という。）。（甲２、３）\n\n\n（10）原告は、令和元年１０月１７日、本件各処分をいずれも不服として、国税不服審判所長に対し、審査請求をした。（乙５）\n\n\n（11）国税不服審判所長は、令和３年１１月１９日付けで、原告に対し、上記審査請求をいずれも棄却する旨の裁決をした。（甲５）\n\n\n（12）原告は、令和４年５月２３日、本件訴えを提起した。\n３ 争点及びこれに関する当事者の主張原告は、本件において、本件所得１のうち、医療法人Ｂ（以下「Ｂ」という。）、一般社団法人Ｃ（以下「Ｃ」という。）及び一般財団法人Ｄ（以下「Ｄ」という。）から得た収入に限って事業所得に当たると主張しており、その余の医療法人等から得た収入が給与所得に当たること、平成３０年分本件所得２が雑所得に当たることは争っていない（令和５年４月９日付け原告準備書面\n\n\n（３）参照）。\nしたがって、本件の争点は、原告がＢ、Ｃ及びＤから得た収入が給与所得に該当するか、であり、これに関する当事者の主張は、以下のとおりである。\n（被告の主張）\n\n\n（１）事業所得とは、自己の計算と危険において独立して営まれ、営利性、有償性を有し、かつ反覆継続して遂行する意思と社会的地位とが客観的に認められる業務から生ずる所得をいう\n（最高裁昭和５６年４月２４日第二小法廷判決・民集３５巻３号６７２頁（以下「最高裁昭和５６年判決」という。））。そして、事業と非事業との区別の基準は必ずしも明確でなく、\nある経済活動が事業に該当するかどうかは、活動の規模と態様、相手方の範囲等、種々のファクターを参考として判断すべきであり、最終的には社会通念によって決定するほかはない。\nある所得が事業所得か給与所得かを判断する場面において、労務を提供する人に裁量の幅がある場合や提供される労務に専門性がある場合が問題となるが、労務内容が自主的で専門的であっても、その提供の態様が使用者の指揮命令に服するのであれば、その労務の対価は給与所得に当たる。例えば、議員や裁判官のように業務の内容自体が専門性が高く、他者から独立して行われるものであっても、業務を行う対象、場所、時間などの業務の一般的な態様について指揮命令を受けて業務を行っている者について、その報酬は給与所得とされるのであって、ここでいう指揮命令とは、業務内容についての判断が専門的で独立して行われるか否かによって定まるものではない。\n営利性や有償性を有し反復継続して行われる業務又は労務提供という経済的活動から得られる収入が事業所得に該当するか給与所得に該当するかは、自己の計算と危険によってその経済的活動が行われているかどうか、すなわち経済的活動の内容やその成果等によって変動し得る収益や費用が誰に帰属するか、あるいは費用が収益を上回る場合などのリスクを誰が負担するかという点、遂行する経済的活動が他者の指揮命令を受けて行うものであるか否かという点、経済的活動が何らかの空間的、時間的拘束を受けて行われるものであるか否かという点などを総合的に考慮して、個別具体的に判断すべきである。\n\n\n（２）名古屋国税局からの照会（乙９）に対するＢ、Ｃ及びＤからの回答内容等によれば、原告がこれらの医療法人等から支払を受けた報酬は、原告の計算と危険において独立して営まれる業務から生じたものとはいえず、原告において、これらの医療法人等からの指揮命令に服し、空間的、時間的拘束を受けて行った業務ないし労働提供の対価として得たものと認められるから、いずれも給与所得に該当する。\n（原告の主張）\n\n\n（１）原告は、複数の裁判所から給与所得者ではなく業務請負人であるという判決を受けている。\n最高裁昭和５６年判決によれば、身分が決定されれば自動的に課税区分も決定するところ、\n本件各医療法人等から得た収入は事業所得であり、これらを給与所得として課税した本件各処分は違法である。\n\n\n（２）名古屋地方裁判所は、Ｂと原告との関係は業務委託関係であり、原告は個人事業主であるという判決をした。また、京都地方裁判所は、一般財団法人Ｅ（以下「Ｅ」という。）と原告との関係は業務委託関係であり、原告は個人事業主であるという判決をしており、Ｃにおける原告の業務は、Ｅの業務をそのまま引き継いだものであり、全く同じ内容である。さらに、Ｄと原告との関係は、契約書は雇用契約の形態をとっているが、ＢやＣの業務と全く同一の方法で契約されているため、実質的には業務委託契約である。したがって、原告がＢ、\nＣ及びＤから得た報酬は事業所得に該当する。\n\n\n\n\n\n\n第３ 当裁判所の判断\n\n\n１ 争点（原告がＢ、Ｃ及びＤから得た収入が給与所得に該当するか。）について\n\n\n（１）判断枠組みについてア 所得税法２７条１項は、「事業所得とは、農業、漁業、製造業、卸売業、小売業、サービス業その他の事業で政令で定めるものから生ずる所得（中略）をいう」と規定し、この規定の委任を受けた同法施行令６３条は、「政令で定めるもの」について、「次に掲げる事業（中略）とする」として農業（同条１号）から医療保健業、著述業その他のサービス業\n（同条１１号）までを例示した後で、「前各号に掲げるもののほか、対価を得て継続的に行なう事業」（同条１２号）と規定する。ここでいう事業所得とは、自己の計算と危険において独立して営まれ、営利性、有償性を有し、かつ反覆継続して遂行する意思と社会的地位とが客観的に認められる業務から生ずる所得をいうと解するのが相当である（最高裁昭和５６年判決参照）。\nこれに対し、所得税法２８条１項は、「給与所得とは、俸給、給料、賃金、歳費及び賞与並びにこれらの性質を有する給与（中略）に係る所得をいう」と規定するところ、列挙されたものとの関連において考えると、「これらの性質を有する給与」とは、単に雇用関係に基づき労務の対価として支給される報酬というよりは広く、雇用契約又はこれに類する原因に基づいて、使用者の指揮命令に服して提供した労務の対価として使用者から受ける給付をいうと解するのが相当であり、給与所得該当性の判断に当たっては、給与支給者との関係において何らかの空間的、時間的な拘束を受け、継続的又は断続的に労務又は役務の提供があり、その対価として支給されるものであるかどうかを重視するのが相当である（最高裁昭和５６年判決参照）。\nしたがって、営利性や有償性を有し反復継続して行われる業務又は労務提供という経済的活動から得られる収入が事業所得に該当するか給与所得に該当するかは、自己の計算と危険によってその経済的活動が行われているかどうか、すなわち経済的活動の内容やその成果等によって変動し得る収益や費用が誰に帰属するか、あるいは費用が収益を上回る場合などのリスクを誰が負担するかという点、遂行する経済的活動が他者の指揮命令を受けて行うものであるか否かという点、経済的活動が何らかの空間的、時間的拘束を受けて行われるものであるか否かという点などを総合的に考慮して、個別具体的に判断すべきである。\nイ これに対し、原告は、原告とＥとの間での労働者性を否定した裁判例（京都地方裁判所平成●●年（○○）第●●号。甲４）や、原告とＢとの間での雇用契約の成立を否定し業務委託契約の成立を肯定した裁判例（名古屋地方裁判所令和●●年（○○）第●●号。甲\n６）を根拠として、複数の裁判所において、原告が給与所得者ではなく業務請負人であるとの判断を受けていると主張する。しかしながら、上記アのとおり、給与所得該当性については、労働契約の成否や指揮命令の有無により一義的に定まるものではなく、労働契約による対価ではなくても、所得税法上の給与所得に該当する場合があるというべきである。\nまた、原告が主張の根拠とする他の裁判例（京都地方裁判所平成●●年（○○）第●●号、\n大阪高等裁判所令和●●年（○○）第●●号、最高裁判所令和●●年（○○）第●●号。\n甲８～１０）も、原告がＥから支払を受けた業務委託料の給与所得該当性を否定する判断をしたものではなく、収入の発生原因の契約の種類によって所得区分が自動的に決定される旨の記載は、当該事件における原告の主張を記載した部分にすぎず、裁判所の判断を示したものではない。したがって、上記アと異なる原告の主張はいずれも採用できない。\nウ よって、上記アの視点から、原告がＢ、Ｃ及びＤから得た収入が給与所得に当たるかについて、以下、個別具体的に検討する。\n\n\n（２）Ｂから得た報酬についてア Ｂから原告に支払われた報酬について証拠（甲６、乙１０、１１）によれば、原告は、平成２６年６月２５日、Ｂとの間で、\n原告を非常勤職員とし、その業務内容について「健診車職種」、「医師」などとする「非常勤職員契約書」を取り交わして業務委託契約を締結し、平成２８年から平成３０年までの間においても、その契約形態に変更はなく、原告は、その間、同契約に基づき、医師として健康診断業務（子宮がん検診及び一般健診）に従事し、別表１－１～別表１－３の各\n「収入金額」欄記載の収入を得ていたこと、Ｂから原告に業務の対価として支払われる金額は、「非常勤職員契約書」に記載の内容によらず、子宮がん検診については半日７万７\n０００円、一日１０万７０００円と、一般健診については半日３万６０００円、一日５万\n１５００円とされていたこと、交通渋滞等で解散の時間が遅くなった場合等においては３\n０分ごとに１０００円の残業手当を支払うとされていたことが、それぞれ認められる。\nイ 原告の業務から生じる費用等の帰属について証拠（乙１１の２）によれば、原告が従事する健康診断業務については、Ｂが、業務に必要な白衣、聴診器等を準備することが慣例となっており、原告が持参するとされていた器具等はなかったこと、原告が業務の従事場所に赴くための交通費や宿泊費について、Ｂは、定められた交通費、宿泊費は支給していたこと、原告が携わった業務において、原告が、受診者に傷害を負わせたり、いわゆる見逃し等の誤診を含む医療事故を起こしたりした場合には、原則としてＢがその責任を負うとされていたことが、それぞれ認められる。\nウ 業務遂行における指揮命令について証拠（甲６、乙１１の２）によれば、原告は、健康診断業務に従事するに当たり、Ｂから業務への従事日及び従事時間並びに従事場所の指定を受けていたこと、ただし、原告が、\nＢからの依頼を断ることや、依頼を受けた後にキャンセルすることもあったこと、原告は、\n従事した業務の結果について、「子宮頸部がん検診問診票」又は「健康診断問診票」を作成し、Ｂに提出するとされていたことが、それぞれ認められる。\nエ 空間的、時間的拘束について上記ウのとおり、原告は、Ｂから業務への従事日及び従事時間並びに従事場所の指定を受けていたほか、証拠（乙１１の２）によれば、Ｂは、「健診出勤確認書」によって、原告の業務への従事状況を管理していたこと、原告が従事する健康診断業務の発注元が全ての健診の終了を確認し、終了と判断した場合、発注元の指示により、原告を含む健康診断に従事したＢのスタッフ全員が業務終了予定時刻よりも早く従事場所から退出できるとされていたことが、それぞれ認められる。\nオ 検討以上を総合して判断すると、原告がＢから支払を受けた報酬は、健康診断の受診者数の増減や業務の内容に応じて支払われる金額が変動する報酬体系になっておらず、従事した時間に対応して支払われることとされ、原告が従事する業務から生じる費用は、基本的に\nＢが負担しており、原告の計算と危険において独立して営まれる業務から生じたものということはできず、原告において、Ｂにおける健康診断業務に従事するに当たり、原告に業務の諾否の自由があるとしても、原告が引き受けた業務については、業務を行う対象、場所、時間等の業務の一般的な態様について、Ｂの指揮命令に服し、Ｂによる空間的、時間的拘束を受けており、その業務又は労務提供の対価として得たものであるから、給与所得に該当する。\n\n\n（３）Ｃから得た報酬についてア Ｃから原告に支払われた報酬について証拠（乙１０、１２の１～４）によれば、原告は、Ｃとの間で、平成２８年１月１日から平成３０年３月３１日までを契約期間とし、「●●」として、健康診断業務（内科問診等）に従事することなどを内容とする契約を締結し、同年４月１日、同日から平成３１年\n３月３１日までを契約期間とする「委託契約書」を取り交わしたが、原告の役職及び原告の業務内容は、従前と同様であったこと、原告は、これらの契約に基づき、平成２８年から平成３０年までの間、別表１－１～別表１－３の「収入金額」欄記載の収入を得たこと、\nＣから原告に業務の対価として支払われる金額は、半日４万５０００円、一日６万５００\n０円とされており、「委託契約書」を取り交わした平成３０年４月１日の前後を通じて変更はなかったことが、それぞれ認められる。\nイ 原告の業務から生じる費用等の帰属について証拠（乙１２の１）によれば、原告が従事する健康診断業務については、原告が、白衣、\n聴診器及び筆記具等を持参するとされていたこと、業務の従事場所に備え付けられた器具等を原告が使用することは認められていたこと、原告が業務の従事場所に赴くための交通費や宿泊費については、Ｃが原告に支給し、原告の負担する費用はなかったこと、原告が携わった業務において、原告が、受診者に傷害を負わせたり、いわゆる見逃し等の誤診を含む医療事故を起こしたりした場合には、原則としてＣがその責任を負うとされていたことが、それぞれ認められる。\nウ 業務遂行における指揮命令について証拠（乙１２の１）によれば、原告は、健康診断業務に従事するに当たり、Ｃから業務への従事日、業務開始時間及び終了時間並びに従事場所である健診会場の指示を受けていたこと、また、原告は、従事した業務の結果について、「健康診断受診票」を作成し、Ｃに提出することとされていたことが、それぞれ認められる。\nエ 空間的、時間的拘束について上記ウのとおり、原告は、Ｃから業務への従事日及び従事時間並びに従事場所の指定を受けていたほか、証拠（乙１２の１）によれば、Ｃは、「医師・技師勤務表」によって、\n原告の業務への従事状況を管理していたこと、原告は、従事する健康診断業務が業務終了予定時刻よりも前に終了した場合、最後の受診者の採血後に問題がないか医師として確認した後、当日の健診担当責任者の許可の下で、当該予定時刻よりも前に退出できるとされていたことが、それぞれ認められる。\nオ 検討以上を総合して判断すると、原告がＣから支払を受けた報酬は、健康診断の受診者数の増減や業務の内容に応じて支払われる金額が変動する報酬体系になっておらず、従事した時間に対応して支払われ、原告が従事する業務から生じる費用は、基本的にＣが負担しており、原告の負担はせいぜい白衣、聴診器及び筆記具等の持参にすぎなかったのであり、\n原告の計算と危険において独立して営まれる業務から生じたものということはできず、原告において、Ｃにおける健康診断業務に従事するに当たり、業務を行う対象、場所、時間等の業務の一般的な態様について、Ｃの指揮命令に服し、Ｃによる空間的、時間的拘束を受けて行った業務又は労務提供の対価として得たものであるから、給与所得に該当する。\n\n\n（４）Ｄから得た報酬についてア Ｄから原告に支払われた報酬について証拠（乙１０、１５の１～５）によれば、原告は、平成２７年３月１日、Ｄとの間で、\n雇用期間を同年４月１日から平成２８年３月３１日までとし、原告を非常勤医師として、\nＦ医務課において不定期の出張検診を行うことを業務内容とする「雇用契約書」（乙１５の１）を取り交わして雇用契約を締結し、同月１４日、Ｄとの間で、雇用期間を同年４月\n１日から平成２９年３月３１日までとする「雇用契約書」（乙１５の２）を取り交わして雇用契約を更新したこと、原告は、同年２月１５日、Ｄとの間で、雇用期間を同年４月１日から平成３０年３月３１日までとし、業務内容を不定期の施設外健診業務とする「非常勤医師雇用契約書」（乙１５の３）を取り交わして雇用契約を更新し、同年４月２日、Ｄとの間で、雇用期間を同月１日から平成３１年３月３１日までとする「非常勤医師雇用契約書」（乙１５の４）を取り交わして雇用契約を更新したこと、原告は、これらの契約に基づき、医師としてＤの健康診断業務（子宮がん検診など）に従事し、平成２８年から平成３０年までの間に、別表１－１～別表１－３の「収入金額」欄記載の収入を得たこと、\nＤから原告に業務の対価として支払われる金額は、上記各契約書に基づき、基本賃金日額\n１０万円とされており、残業代については定められていなかったことが、それぞれ認められる。\nイ 原告の業務から生じる費用等の帰属について証拠（乙１５の５）によれば、原告が従事する健康診断業務については、Ｄが、業務に必要な白衣、聴診器及び文房具を貸与しており、原告が持参するとされていた器具等はなかったこと、原告が業務の従事場所に赴くための交通費や宿泊費は、上限設定はあるものの、Ｄが負担していたこと、原告が携わった業務において、原告が、受診者に傷害を負わせたり、いわゆる見逃し等の誤診を含む医療事故を起こしたりした場合には、原則として\nＤがその責任を負うとされていたことが、それぞれ認められる。\nウ 業務遂行における指揮命令について証拠（乙１５の３～５）によれば、原告は、健康診断業務に従事するに当たり、Ｄから\n「検診（スポット）依頼書」により業務への従事日及び従事時間並びに従事場所の指定を受けていたほか、平成２９年４月１日以降については、Ｄの定めた「遵守事項（服務規律）」に従うとされていたこと、原告は、従事した業務の結果について「問診票」等に必要な診察事項を記載し、Ｄのスタッフに提出するとされていたことが、それぞれ認められる。\nエ 空間的、時間的拘束について上記ウのとおり、原告は、Ｄから業務への従事日及び従事時間並びに従事場所の指定を受けていたほか、証拠（乙１５の５）によれば、Ｄは、出張検診業務のため、センタースタッフにおいて「日報」に原告の氏名を記載することで、原告の業務への従事状況を管理していたこと、原告の従事する健康診断業務が業務終了予定時刻よりも前に終了した場合には、Ｄの当日の担当責任者による許可があれば、当該予定時刻よりも前に退出できるとされていたことが、それぞれ認められる。\nオ 検討以上を総合して判断すると、原告がＤから支払を受けた報酬は、健康診断の受診者数の増減や業務の内容に応じて支払われる金額が変動する報酬体系にはなっておらず、従事した時間（１日）に対応して定額が支払われ、原告が従事する業務から生じる費用は、基本的にＤが負担しており、原告の計算と危険において独立して営まれる業務から生じたものということはできず、原告において、Ｄにおける健康診断業務に従事するに当たり、業務を行う対象、場所、時間等の業務の一般的な態様について、Ｄの指揮命令に服し、Ｄによる空間的、時間的拘束を受けて行った業務又は労務提供の対価として得たものであるから、\n給与所得に該当する。\n２ 上記１のとおり、原告がＢ、Ｃ及びＤから得た収入はいずれも給与所得と認められる。また、\nその余の本件各医療法人等から得た健康診断業務に係る収入が給与所得に該当すること、及び本件意見書作成業務から得た収入が雑所得に該当することは、当事者間に争いがない。したがって、これらの所得区分を前提とした本件各処分の根拠及び適法性は、別紙本件各処分の根拠及び適法性のとおりと認められ、本件各処分は適法である。\n\n\n\n\n\n\n第４ 結論以上によれば\n\n\n、原告の請求はいずれも理由がないから、これらを棄却することとし、主文のとおり判決する。\n名古屋地方裁判所民事第９部裁判長裁判官 剱持 亮裁判官 佐久間 隆裁判官 井筒 土筆\n• s~ ~ ?ヘ・ 9.、` •\n.,\n'..\n＇ ら\n• * S\n（別紙）．\n．指定代理人目録今尾貴子 宮城朝久 森本進也 三島博文 谷 広 成以上\n10\n\n. ~.\nr\n・ヽ・\n．．\n.\n...\n・ ，．． っ\nー、令ヽ., .\n． ~\n．． ,\n.\n.\n'\n.\n.\n'\n``\n？ヘ\n（別紙）\n関係法令の定め\n\n\n\n\n\n\n第1 所得税法\n\n\n1 .2.7条（事業所得）\n)1( 1項事業所得とは、農業、漁業、製造業．、卸売業、小売業、サービス業その他の事業で政令で定め／るものから生ずる所得（山林所得又は譲渡所得に該当するものを除く。）をいう。\n.)2( 2 項事業所得の金額は、その年中の事業所得に係る総収入金額から必要経費を控除した金額とする。\n2 条（給与所得）\n)1( 1 項給与所得とは、俸給、給料、賃金、歳費及び賞与並びにこれらの性質を有\n；＂ する給与（以下この条において「給与等1 という。）に係る所得をいう。\n)2( 2~4 項 略.・・.\n\n\n\n\n\n\n第2 所得税法施行令\n\n\n.6 3 条（事業の範囲）\n\n\n20 所得税法27 条1項（事業所得）に規定する政令で定める事業は、次に掲げる事業（不動産の貸付業又は船舶若しくは航空機の貸付業に該当するものを除く。．）とする。\n\n\nア 1 号 農 業イ 2 号林業及び狩猟業ウ 3号漁業及び水産養殖業工 4 号鉱業（土石採取業を含む。）\n\n\nオ 5号 建 設 業力 6 号製造業キ 7号 卸売業及び小売業。（飲食店業及び料理店業を含む。）\n\n\nク 8 号金融業及び保険業ケ 9号不動産業コ 1 0 号運輸通信業（倉庫業を含む。）\n\n\n1 1サ 号医療保健業、著述業その他のサービス業シ 1 2 号前各号に掲げるもののほか、対価を得て継続的に行なう事業\n\n\n• 以上\n\n\n12\n\n\n（別紙）\n\n\n本件各処分の根拠及び適法性\n\n\n1 本件各更正処分の根拠\n\n\n)1( 平成 9 年分更正処分の根拠\n\n\n11 原告の平成29 年分の所得税等に係る総所得金額及び納付すぺき税額は、\n\n\n別表4 （なお、別表3 は判決に添付なし。）「被告主張額j欄に記載したとおりであり、これらの金額の計算根拠は、次のとおりである。\n\n\nア 総所得金額（別表4.「被告主張額」①欄の金額） 1723 万8490 円\n\n\nm上記金額は、．次の ～（ヴの各金額の合計額。：\n\n\nm\n\n\n•10 事業所得の金額（別表4 「被告主張額」②欄の金額） 0 円\n\n\n（イ） 給与所得の金額（別表4 「被告主張額」③欄の金額）\n\n\n1624 万3332 円上記金額は；．次の a の金額からb の金額を控除した額。 ・\n\n\na 給与所得の収入金額 ・ i 844 万3 3 32 円\n\n\n16 上記金額は、原告の平成 年分の所得税等の確定申告書に記載された給与所得の収・入金額672 万円（別表1-2 の順号1 4及び1 5の「収入金額」欄の合計額に相当する額）．iこ、別表 1 -2の順号1~\n\n\n1 3 の「収入金額j欄の合計額 1 0 0 5 万7700 円（平成29 年分本件所得 に係る収入金額）及び同表の順号1 6~24 の「収入金額」\n\n\n20 欄の合計額1 6 6万563 2 円（平成29 年分本件申告漏れ所得に係る収入金額）を加算しだ額。\n\n\nb 給与所得控除の額\n\n\n220 万円所得税法28 条3項 5 号に規定する給与所得控除の額\n\n\n、\n\n\n（ヴ雑所得の金額（別表4 「被告主張額J ④欄の金額）・•9 9 万51 5・8 円\n\n\na.z 上記金額は＜原告の平成29 年分の所得税等の確定申告書に記載された雑所得の金額と同額。\n\n\nイ 分離課税の上場株式等の顧渡所得金額（別表4 「被告主張額J ⑤欄の金額） • △8 万1 0 ,2 5 円上記金額は、原告の平成29 年分の所得税等の確定申告書に記載された ・\n\n\nc上場株式等の譲渡所得金額と同額\n\n\n6 ゥ・分離課税の先物取引に係る雑所得金額（別表4 「被告主張額」⑥欄の金額） ． ，・．0 円上記金額は、原告の平成29年分の所得税等の確定申告書に記載された先物取引に係る雑所得の金額と、同額。 ・工所得控除の額の合計額（別表4 .「被告主張額」⑦欄の金額） ．\n\n\n10 92 万4 2・4 3円上記金額は、原告の平成29 年分の所得税等の確定申告書に記載された所得から差し引かれる金額の合計額と同額。・オ課税総所得金額（別表4 「被告主張額J ⑧欄の金額）\n\n\n1631 万4000 円\n\n\n16 上記金額は、• 前記アの総所得金額 17 2 3 万84 90 円から前記工の所得控除の額の合計額9 万4 2 4 3 円を控除して算出した金額（ただし、\n\n\no国税通則法（以下「通則法」という。） 1．1 8 条1項の規定により 1 o_o .円未漠の端数を切り捨てた後のもの。＿。）\n\n\nー力 分離課税の上場株式等の課税譲渡所得金額（別表4 「被告主張額」⑨欄\n\n\nm の金額） ' 0 円上記金額は、原告の平成2.9 年分の所得税等の確定申告書に記載された上場株式等の課税譲渡所得金額と同額。\n\n\nキ分離課税の先物取引に係る課税雑所得金額（別表4 .「被告主張額」⑩欄の金額） ・．•．•... • .. 0 円匹\n\n\n上記金額は、原告の平成2・9年分の所得税等の確定申告書に記載された先物取引に係る課税雑所得の金額と同額。\n\n\nク 算出税額（別表4 「被告主張額」⑭欄の金額） 384 万 7620 円\n\n\nm上記金額は、次の ～（外の合計金額。：\n\n\nm前記オに対応する税額（別表4 「被告主張額」⑪欄の金額）\n\n\n3 8 4 万7 6 2 0 円\n\n\n6 ・ 上記金額は、前記オの課税総所得金額1 6 3 1万4・0 0 0円に、所得税法89 条 1項を適用して算出した金額。\n\n\n（イ） 前記力に対応する税額（別表4 「被告主張額」⑫欄の金額） 0 円上記金額は、原告の平成2 9年分の所得税等の確定申告書に記載された上場株式等の課税譲渡所得の金額に対応する税額と同額。・\n\n\n10 （ヴ前記キに対応する税額（別表4 「被告主張額」⑬欄の金額） 0円上記金額は、原告の平成29 年分の所得税等の確定申告書に記載された先物取引に係る課税雑所得の金額に対応する税額と同額。\n\n\nケ 差引所得税額（別表4. 「被告主張額」⑮欄の金額） 38~万76 2 0円上記金額は、前記クの算出税額3 84 万7・6 2 0 円と同額。\n\n\n16 コ ．復興特別所得税額（別表4 「被告主張額」⑯欄の金額） 8 万0 800 円上記金額は、前記ケの差引所得税額に、東日本大震災からの復興のだめの施策を実施するために必要な財源の確保に関する特別措置法（以下\n\n\n••r復興財源確保法」という。） 1 3 条に規定する 100 分の .2 1 の税率を乗じて計算した金額，•\n\n\n20 サ 所得税等の額（別表4 「被告主張額」⑰欄の金額） 3 9 2万 8 4 20 円上記金額は、前記ケの差引所得税額384 万16 .2 0 円に前記コの復興特別所得税額8 万08 00 円を加算した金額。\n\n\nシ源泉徴収税額（別表4 「被告主張額J⑱欄の金額） ,4・2 5 方 0 5 4 2 円上記金額は、原告の平成29 年分の所得税等の確定申告書に記載された\n\n\n25 所得税等の源泉徴収税額（以下「源泉徴収税額」という。） 4 1 1万6 2 8\n\n\n4 円に、別表1-2 の「所得区分」欄の「確定申告」欄のうち「・申告漏れ］と記載された欄に対応する源泉徴収税額 13 万 4~58 円を加算した金額。\n\n\nス 申告納税額（別表 「被告主張額」⑲欄の金額） △32 万2122 円上記金額は、前記サの所得税等の額39 2 万8420 円から、前記シの\n\n\nII 源泉徴収税額4 25 万0 2 円を控除して算出した金額。\n\n\nセ 所得税等の納付すべき税額（別表4 「被告主張額」⑳欄の金額）\n\n\n△3\n\n\n・2万\n\n\n2 .1 2 :2 円上記金額は、前記スの申告納税額△3 2万2\n\n\n1 '2 2 円と同額。\n\n\n)2( 平成30 年分更正処分の根拠原告の平成3 0年分の所得税等に係る総所得金額及び納付すべき税額は、\n\n\n別表5 「被告主張額」欄に記載したとおりであり、これらの金額の計算根拠は、次のとおりである。、\n\n\nア 総所得金額（別表5 「被告主張額」①欄の金額） 1 2 36 万 5.・6 6・7 円上記金額は、・次のげ）～けの各金額の合計額。\n\n\nm\n\n\n•16 事業所得の金額（別表5 「被告主張額」②欄の金額） 0 円\n\n\n（イ） 給与所得の金額（別表． 「被告主張額」③欄の金額）\n\n\n11 .9. 5 万8440 円\n\n\na上記金額は、次の の額からb の額を控除した額。\n\n\na 給与所得の収入金額 、 14 1 5 万8440 円勾 上記金額は、原告の平成30 年分の所得税等の確定申告書に記載された給与所得の収入金額46 1万9450 円（別表1- 3 の順号5~\n\n\n32 の「収入金額」欄の合計額に相当する額）に、別表1-3 の順号\n\n\n1~4 の「収入金額」欄の合計額_9 5 3万 8990 円（平成3-0年分本件所得1に係る収入金額）を加算した額。\n\n\n26 b 給与所得控除の額・．’ . 2 2 0 万円上記金額は、所得税法28 条3 項5 号に規定する給与所得控除の額。i\n\n\n（ヴ雑所得の金額（別表5 「被告主張額j ④欄の金額） 4 0 万7227 円平成3.0年分本件所得2 は雑所得に該当すると認めるのが相当であり、\n\n\n雑所得の金額は、．原告の平成30 年分の所得税等の確定申告書に記載された雑所得の金額1 2 万64 ¥2 7 円に、別表 2 の［支払金額（税込）」欄\n\n\n・o\n\n\n5 の「計」欄の金額2 8万0800 円（平成3 年分本件所得2 に係る収入金額）を加算した金額40 万7227 円。\n\n\nイ 分離課税の上場株式等の譲渡所得金額（別表5 「被告主張額J ⑤欄の金額）• ●● ．．．． ． ‘｀ △ 16 3万2926 円上記金額は、原告の平成30 年分の所得税等の確定申告書に記載された上場株式等の譲渡所得金額と同額。\n\n\nウ 分離課税の上場株式等の配当等所得金額（別表5\n\n\n「被告主張額」⑥欄の金額） ．．．． ． ・ ．.0円上記金額は、原告の平成30 年分の所得税等の確定申告書に記載された上場株式等の配当等所得金額と同額。\n\n\n61 ：エ分離課税の先物取引に係る雑所得金額（別表5\n\n\n「被告主張額J ⑦欄の金\n\n\n．．＼額）\n\n\n円上記金額は、・原告の平成3)・( 年分の所得税等の確定申告書に記載された先物取引に係る雑所得の金額と同額。\n\n\nオ所得控除の額の合計額（別表5 「被告主張額J ⑧欄の金額）\n\n\n20―-\n\n\n.\n\n\n4 5 万5989 円上記金額は、原告の平成30年分の所得税等の龍定申告書に記載された所得から差し引かれる金額の合計額と同額。\n\n\n力 課税総所得金額（別表5 .「被告主張額」⑨欄の金額） ，\n\n\n. 1 ~ 9 0 万9-o o・o 円叫， 上記金額は、前記アの総所得金額1_2 3・6 万5667 円から前記オの所得控除の額の合計額•45万5 .9-8 9 円を控除して算出した金額（ただし、\n\n\n通則法1 18 条1項の規定により 1000 円未満の端数を切り捨てた後のもの。）。\n\n\nキ 分離課税の上場株式等の課税醸渡所得金額（別表5 「被告主張額J ⑩欄の金額） ．\n\n\n0 円\n\n\nn3\n\n\n6 上記金額は、原告の平成 年分の所得税等の確定申告書に記載された上場株式等の課税譲渡所得金額と同額。 ．，ク 分離課税の上場株式等の課税配当等所得金額（別表5 「被告主張額」⑪欄の金額） ．， 0 円上記金額は、原告の平成30 年分の所得税等の確定申告書に記載された\n\n\n10 上場株式等に係る課税配当等所得金額と同額。\n\n\nケ 先物取引に係る課税雑所得の金額（別表5 「被告主張額」⑫欄の金額）\n\n\n0 円上記金額は、原告の平成30 年分の所得税等の確定申告書に記載された先物取引に係る課税雑所得の金額と同額oコ 5\n\n\n16 算出税額（別表 「被告主張額J⑰欄の金額） ・2 3 9 万3970 円\n\n\nm上記金額は、次の ～因の合計金額。\n\n\nm前記力に対応する税額（別表5 「被告主張額」⑬欄の金額）\n\n\n円\n\n\n2:39 万 3 9・7 0上記金額は、前記力の課税総所得金額i 190 万9000 円に、所得税法89 条1項を適用して算出した金額。\n\n\nH) 前記キに対応する税額（別表 5 「被告主張額」⑭欄の金額） 0 円上記金額は、原告の平成30 年分の所得税等の確定申告書に記載された上場株式等の課税譲渡所得金額に対応する税額と同額。\n\n\n（ヴ 前記クに対応する税額（別表5 「被告主張額j⑮欄の金額） 0 円\n\n\n26 上記金額は、．原告の平成30 年分の所得税等の確定申告書に記載された上場株式等の課税配当等所得金額に対応する税額と同額。\n\n\n囚前記ケに対応する税額（別表5 「被告主張額」⑯欄の金額） 0 円上記金額は、•• 原告の平成30年分の所得税等の確定申告書に記載された先物取引に係る課税雑所得の金額に対応する税額と同額。\n\n\nサ 差引所得税額（別表5 「被告主張額J⑱欄の金額） 2 3 9 方39 7 Q円 ＜\n\n\n、\n\n\n万\n\n\n》｀ 上記金額は、前記コの算出税額•2 39 39 7 0 円と同額。\n\n\nシ復興特別所得税額 ．（別表5 「被告主張額」⑲欄の金額） 5 万 0 2:7 3 円上記金額は：前記サの差引所得税額に、復輿財源確保法1\n\n\n3条に規定する1 0 0分の2 . 1の税率を乗じて計算した金額。\n\n\nス 所得税等の額｛別表5 「被告主張額」⑳欄の金額） 24 4 万4243 円\n\n\n.10 上記金額は、前記サの差引所得税額239 万3970 円に前記シの復興特別所得税額 万0 ・2 7 3.円を加算した金額。\n\n\nセ源泉徴収税額（別表 5 「被告主張額」⑪欄の金額）i O .5 万5 95.97 円上記金額は、原告の平成30 年分の所得税等の確定申告書に記載された源泉徴収税額と同額。・ヽ\n\n\n1-5 ソ 申告納税額（別表5 「被告主張額」⑫欄の金額） 1 38 万82 00 円上記金額i・士、前記スの所得税等の額 2 4・4 万 4243 円から、前記セの源泉徴収税額1.0 5 万5 9 5 7円を控除して算出した金額に、復興財源確 ．保法24 条 項の規定によりi O 0 円未満の端数を切り捨てた後の金額。\n\n\nタ 所得税等の納付すべき税額（別表5 「被告主張額」⑳欄の金額）\n\n\n・\n\n\n.1 3;8 万8 2 0 0円上記金額は、前記ソの申告納税額138 万 820 0円と同額。\n\n\n2 本件各更正処分の適法性原告の平成2 9 年分の所得税等の納付すべき税額は、前記・91(1 たのとおり、\n\n\n△32 万21 2~2 円であるところ、この金額は、平成2.9 年分更正処分におけ幻 る納付すべき税額△3 2万2 .1 2:2 円と同額である。\n\n\nまた、原告の平成30 年分の所得税等の納付すべき税額は、前記i)2( 夕のとおり 1 3 8 万8200 円であるところ、この金額は、平成3 0 年分更正処分における納付すべき税額1 3 8 万8 2 0.0 円と同額であるーしたがって、本件各更正処分はいずれも適法である。\n\n\n3 本件各賦課決定処分の根拠及び適法性\n\n\n)I( 平成2 9:年分賦課決定処分についてア 前記2 のとおり、平成2:9年分更正処分は適法であるところ、原告が新たに納付すべき平成 9年分の税額269 万4200 円（前記1(1 たの納付すべき税額△3 2万 2 .1 2.2 円と、原告の確定申告における納付すべき所得税等の税額△3 0 1 万6392 円の差額269 万4 2 .7 o 円から、復\n\n\niO 興財源確保法24 条2項の規定により 1 .0 0円未満の端数を切り捨てた後の金額）については、その計算の基礎となった事実のうちに平成2・9年分 ‘更正処分前の税額の計算の基礎とされていなかったことについて、通則法\n\n\n65 条4 項に規定する「正当な理由」があると認められるものはない。\n\n\nィ ・したがって、原告が新たに納付すべき平成29 年分の税額269 万42\n\n\n61 00 円について賦課される過少申告加算税の額は、原告が新たに納付すべき平成2 9年分の税額26 9万円（通則法 1 1 8 条3項の規定により 1万円未満の端数金額を切り捨てたもの）に通則法65 条1項の規定にょり1\n\n\n00 分の1 0の割合を乗じて算出した額26 万9'6 ・0- .0 円及び同条2項の規定により 269 万円のうち期限内申告税額1 0 9 万9 89 2 円を超える\n\n\n“ 額に相当する税額1 5 9 万円（ただし、通則法1 18条3項の規定により\n\n\n1万円未満の端数金額を切り捨てた後の金額）に1 0 0 分の5の割合を乗じて算出した額7万9500 円の合計金額34 万85 0 0 円であり、当該万\n\n\n金額は、平成29 年分賦課決定処分における過少申告加算税の額34 8\n\n\n5_0.0 円と同額であるから、平成29 年分賦課決定処分は適法である。\n\n\n)2( 平成30 年分賦課決定処分についてァ 前記2のとおり、平成30 年分更正処分は適法であるところ、原告が新たに納付すべき平成30 年分の税額2 3 1 万6500 円（前記1)2( クの納付すべき税額13 8 円8200 円と、原告の確定申告における納付すべき所得税等の税額△9 2・万83 3 2円の差額2 31 万6 5 3・2 円から、復興印原確保法2・4 条2項の規定により 1 00 円未満の端数を切り捨てた後の金額）、については、その計算の基礎となった事実のうちに平成3.0年分更正処分前の税額の計算の基礎とされていなかったことについて、通則法6\n\n\n5条4項に規定する「正当な理由」があると認められるものはない。\n\n\n•イ したがって、原告が新たに納付すべき平成30 年分の税額2 3 .1万6 5\n\n\n00 円につし、て賦課される過少申告加算税の額は、原告が新たに納付すべ\n\n\n10 き平成30 年分の税額231 万円（通則法i i 8 条3項の規定により 1万円未満の端数金額を切り捨てたもの）に通則法6 5・条 I 項の規定により 1\n\n\n00 分の1 0 の割合を乗じて算出した額23 万1 0 0 0 円及び同条．2項の規定により 2 3 1万円のうち50 万円を超える額に相当する税額1 ・a 1万\n\n\no円に 1・o 分の5 の割合を乗じて算出した額9万05 00 円の合計金額3\n\n\n16 2 万1 s・o・o 円であり、当該金額は、平成3-0年分賦課決定処分における過少申告加算税の額32 方1500 円と同額であるから、平成30 年分賦課決定処分は適法である。\n\n\n以上別表4 平成29 年分の所得税等の被告主張額 ” ) •^ `•\n\n\n， ， .. 9•\n\n\n｀ （単位：円）\n\n\n． 9V 確定申 '9 ．告．アヘ 更正処分奪・ 9 ← 被告主張額区 分\n\n\n•• 、 平成 3 .. 呻 . 辺 p. 月 . \".. B51 . 綱令和元年8 月8 日 . '-... ｀， ．ヽ• ••.— “ .\n\n\n・ ．~ 會\n\n\n·---~--• 総 所 得 金． 額 じ① 8 ，424,373 ,71 832 , 094 ,832,71 094\n\n\n．\n\n\no事 業 所 ’得 ・・ ② 662,035,2 ;o\n\n\n. 9 : . ,9 ,. ^ ‘\" '\n\n\n． 訳 ．内\n\n\n， 給\n\n\n＂‘与 所 得 ③\n\n\n＂”\n\n\n▼9，叫-\n\n\n8,000\n\n\n-•\"·・·▼ ·●ぃ：、”●9\n\n\n61 ,243, 233 61 ,342 , 233く;\n\n\n•••• ••. 、 '“唱ヽ •• 9 - •'「. .' ’雑 ‘ 所 得 ④ ,599 851 99 、5! 851 ,599 ~58\n\n\n△分離課税｀＾の上楊株式等の ⑤ △8. 1 620 .,., 8I 52O ,. 81 520\n\n\n,,., .△,., ,\n\n\n・譲 渡・ヽ・所 得・ぐ・金 額 ． 9 •, o 、.. ' o ’ o‘分離課税の先物取引 ⑥\n\n\n'. に 係 る 雑 所 得 金 額 t\n\n\n⑦所得控除の額の合計額 2,429 心 ， 429 ,243 ‘ 鯰4,243\n\n\nI•- ~.,~ヽ=·午- - ., ⑧ :, \"o q o; ..・-． 9 ・ --- ． ~\n\n\n・畑応分 ,944,7 16 ,413 ,ooo ;' ,61 413 0,. 00\n\n\n• i ' --•-o•ニ・\n\n\no閉iさ；る ⑤対応分 9'( •9\n\n\n， 額 ＂・. - . :;\n\n\no\n\n\n．⑥対応分 ‘． ⑩ ‘ 、0 `O\n\n\n`t\n\n\n⑧に対する税額 ⑪ .,.••. .7-70 ..,•• •～ 2 炉ず7,,0 .‘・. ,・・・... ,,3.748 , 026 ...3,,7•48 .026\n\n\n●← 9 .,,....\"....\n\n\nq\n\n\n• ;• . -ー• oし・: .,.\"算出• 、・⑨に対する税額 ⑫ •o •\n\n\nヽ .. -・' ：' 一• '.. o! ~： `.. o,..\n\n\no\n\n\n;g ' ⑩に対する税額 ⑬ ：\n\n\n• ．9⑭\n\n\n（⑪g,；⑬） •. 1,011,210 ,748,3 026 -------- 026,748,3 ’\n\n\n` ` |\n\n\n·~”~ ・, . \"差 引 所 ，得 税 額 ｝⑮ ,1 072:,770 026,748,3 026,748,3復興嘉烹。刃 • I ⑮ \" • -••·,.~ ••''、•\n\n\n2？税額 ’ 訟 622 ---___ _ ,.08 008 - ;OB 008\n\n\n｀｀`．．` ’ ’ `． .. ・ .--..- ~-· ＇...\n\n\n→所得税等の額（⑮十⑯） ・⑰ ,l ,990 298 ; ,3 ,829 024 ,3 ,829 024\n\n\n” —~• ▲•ー·▲~~ •.·―·●· ＾、： :源- 泉 •徴;、 収 税 額 ⑱ ;4 ,6ll 2糾 i o52,4 ,542 5,052,4 ＾位\n\n\n-•” \"\n\n\n△申 告＾ ？ 税 額 ⑬ ・△ 293,610,3 21,223 92 ヽ △⑫ 221,2\n\n\n（⑰ ⑱） ．． ,.`晃•一3\n\n\n：：・付得す ．き 去 等 の ⑳ △ 3,01•6 29 . :・.. ;△ ,2 23 221 △3 泣，221\n\n\n9 ● ▼過 少 申 告 加 算 税 の 額 ⑪―――---- - . 005,843 oo5,843\n\n\n（注） 1 一⑤欄の△印は損失金額をホ，，＾ー.. ・\"..ー ..\n\n\n2 ⑧欄の金額は000,l 円未調の蝙数金額を切り捨てた後の金額である。\n\n\n3 ⑳欄の△印は還付金の額に相当する税額を示す。 '別表5 平成30 年分の所得税等の被告主張額一\n\n\n•• •- .,. ., •-·.., ＿｀．．（ 星但円）\n\n\n． 確定申告 ．＾• 更正処分等 被告主張額区 分 平成13 年3月51 日令和元年8月 日．、\n\n\n総 所 得 金 額 C) 216,186,2 766,563,21 766,563,21ぐ 一\n\n\n-- .. ••• •• •• ' •ゃ9ヽー、\n\n\n事 業 ，所 得 ② △ 516,795 ,. 0. , 0\n\n\n:, し ＾ ． ．． ペ―内 ‘ ;-•;••—.. p訳 給 与 所 得 ③ ,251,3 80~,. 1_,~_ _. ,8 5.9 44 0- 044,859,雑 囀、 所 ・ 得 ④ ;621 42 '7 ー ,10・4 ·』• ‘\" ,22 ;1 722,704 •. ・・------ '\n\n\n~. ..,-. ~．- ''- .. 、 ·•'·.:•· •.. •分離課税の上場株式等の ． ． ． ＂ ． ．、・\n\n\nヽ\n\n\n・譲渡．．所得金，額．⑤ △ 629,236,1 • .1,•632, 926 ．△ ,1 ,2936． 629:;分離罠税の上場株式等の ⑥ 0 、 ••O配→当 等 所 得 ．金』額 ・・‘\n\n\n，分離鰈 税雑の所先: ＂取 ⑦ 0 0 cに 係 る ．・ 金・＾＾• • r ．． ．←． ; i\n\n\n．．． ．、、 ．．．．，．．．．．．．．←—-所得控除の額の合計額怨） 45~. 989 : ,564 . 989 455,:98~ ;\n\n\n①対応分 ⑨ 000,522;2 11 ;,909 -000 000,909,11\n\n\n、.- 、 ．,.\n\n\n, +』..\"o i ・ ’` ・十課税される ⑤対応分 ’⑩ ---- • -・-- 、 ro , 0所得金額一・＇．＂． 9←9 ,.,• 0\n\n\n' ⑥対応分 ⑪ 0' ・→... 0\n\n\n。\n\n\n, ・・・・・ < .;.'. ;\n\n\no o\n\n\n⑦対応分~ ⑫ 、 i ．\n\n\n9- 9 →\n\n\n・・⑨に対する税額 ⑬ 125~ 000 ,2 3,3.9 979 ,:2 393,970\n\n\n,' - ＂＂噸\"冒p`.. ••• • ‘、 ’\n\n\no算 ⑩に対する税額 ⑭， ー，•・・,. 0 •O· •乱\n\n\n⑪に対する税額 i⑮ ~ '. \" ~ •• '. 0額’ ⑫に対する税額 、通⑯ ] : . 0 , 0 o\n\n\n“ j'i .`、“ 1, , . m [、 -\n\n\n．•（⑬＋釦届十⑯） ⑰ 000,521 2,393;970 079,393,2 -.彎, ”'・・\n\n\n．\n\n\n•• .., ' -. I -・- - .ロ・~ な：差 引 所 得 ・税 額 ⑱ ． ,521 000 2,393.,•970 079,393,2\n\n\n..， '復興霜度。門― ＄h・→ バ泉額疇~．· ＂\n\n\n⑲ 2, 526 312,05 .50,273\n\n\n．』．\n\n\n, ’ ` .., '\"所得税等の額，（⑱＋⑲） ⑳ 526,721 2,4“,243 2,4“,2 位\n\n\n..＾心.●.●' , ＂ ．． .\n\n\n｀\n\n\n•9・ ．．．： P・～•源 泉 徴 収 税 額 ⑪ ,650,1 759 ,1 ,550 ~57 ;l ,550 95.7..\n\n\n． ． ~.. -·· ' •.•.• •\n\n\n..' 申 ・：告 納疇'9 ・ 税 ・額 •…•” ` >\n\n\n． （⑳一⑳） ⑫ △ 92 8,3821,388,200 002,883,1\n\n\n！\n\n\n』 ＾付珂す．きき、』の ⑬ △ 829 ．蹄 2 -1 ,3部，2oo 、 I ，蹄8，OO2過少'f；・申 •- 告加算税の額 ＇R -------— 123 , -. 5 005,123\n\n\n・（注）、 1 ②懺の△•印.は`犠’失金額を示`し•・!\n\n\n2 ⑤欄の△印は損失金額を示す。 ゜\n\n\n3 ⑨欄の金額は000,1 円未漬の蟻数金額を切り槍てた援の金額である． ．\n\n\n4 躙iの金額は、黒字の楊合、 ．001 円未潰の蝙量金額を切り捨てた後の金額である．\n\n\n5 ⑳欄の△印は還付金の額に相当する税額を示す．別紙１－１～１－３、別表２ 省略"
}