{
  "number": "13858",
  "title": "所得税等更正処分の一部取消請求事件",
  "court": "熊本地方裁判所",
  "date": "令和５年６月９日",
  "date_iso": "2023-06-09",
  "result": "取消",
  "topics": [],
  "laws": [],
  "keywords": [],
  "sections": {
    "主文": [
      "１ 原告の請求をいずれも棄却する。\n２ 訴訟費用は、原告の負担とする。"
    ]
  },
  "full_text": "13858 所得税等更正処分の一部取消請求事件 - 国税庁判決事例集\n\n\n\n\n\n\n\n\n\n\n目次に戻る\n\n\n\n\n判決 13858\n\n\n所得税等更正処分の一部取消請求事件\n\n\n\n\n裁判所:\n 熊本地方裁判所\n\n\n判決日:\n 令和５年６月９日\n\n\n結果:\n 取消\n\n\n\n\n\n\n主文\n\n\n１ 原告の請求をいずれも棄却する。\n２ 訴訟費用は、原告の負担とする。\n\n\n\n\n\n\n第１ 請求\n\n\n１ 第１事件\n\n\n（１）処分行政庁が令和３年１０月２５日付けでした原告の平成３０年分所得税及び復興特別所得税の更正処分（以下「平成３０年分更正処分」という。）のうち、分離短期譲渡所得０円、\n分離長期譲渡所得０円、納付すべき税額９３００円を超える部分及び過少申告加算税賦課決定処分（以下「平成３０年分賦課決定処分」といい、平成３０年分更正処分と併せて「平成\n３０年分更正決定等」という。）を取り消す。\n\n\n（２）被告は、原告に対し、３２万７８００円及びこれに対する納付日から支払済みまで年５分の割合による金員を支払え。\n２ 第２事件\n\n\n（１）処分行政庁が令和３年１０月２５日付けでした原告の令和元年分所得税及び復興特別所得税の更正処分（以下「令和元年分更正処分」といい、平成３０年更正処分と併せて「本件各更正処分」という。）のうち、上場株式等の課税所得０円、納付すべき税額マイナス３万２\n９６３円を超える部分及び過少申告加算税賦課決定処分（以下「令和元年分賦課決定処分」\nといい、本件令和元年分更正処分と併せて「令和元年分更正決定等」という。また、平成３\n０年分賦課決定処分と令和元年分賦課決定処分を併せて「本件各賦課決定処分」という。）\nを取り消す。\n\n\n（２）被告は、原告に対し、９万４１９３円及びこれに対する納付日から支払済みまで年５分の割合による金員を支払え。\n\n\n\n\n\n\n第２ 事案の概要\n\n\n１ 原告は、平成３１年２月７日、熊本市西区●●所在の土地及び建物（以下、同土地を「本件土地」、同建物を「本件建物」という。）の各共有持分（以下「本件各持分」という。）の譲渡による譲渡所得を分離課税の譲渡所得として、平成３０年分の所得税及び復興特別所得税\n（以下「所得税等」という。）の確定申告書を処分行政庁に提出した（以下「平成３０年分確定申告」という。）。また、原告は、令和２年３月１６日、Ａ株式会社の株式（以下「本件株式」という。）の譲渡による譲渡所得を総合課税の長期譲渡所得として、令和元年分の所得税等の確定申告書を処分行政庁に提出した（以下「令和元年分確定申告」という。）。\n第１事件は、原告が、平成３０年分確定申告の後に、本件各持分の譲渡による譲渡所得は、\n総合課税の譲渡所得として所得税等の額の計算をすべきとして更正の請求（以下「平成３０年分更正の請求」という。）をしたところ、処分行政庁が、更正をすべき理由がない旨の通知処分（以下「平成３０年分通知処分」という。）をするとともに、譲渡所得の金額に誤りがあるとして平成３０年分更正決定等をしたことから、平成３０年分更正決定等について、本件各持分の譲渡による譲渡所得を総合課税の譲渡所得として所得税等の額を計算すべきであり、\nまた、原告が本件土地の共有持分の贈与を受けた際に納付した贈与税の額の１４万５９００円及び原告の母が本件土地の共有持分の贈与を受けた際に納付した贈与税の額のうち原告が相続により取得した割合を乗じた額である７万２９５０円（以下「本件贈与税」という。）が本件土地の譲渡による譲渡所得の取得費に該当するのに譲渡所得の金額を算定するに当たって本件贈与税相当額を控除しなかったことは違法である旨を主張して、その取消しを求めるとともに、処分行政庁による平成３０年分更正決定等により、納付済みの所得税の額から原告が納付すべきであると考える税額の差額に相当する損害を受けたとして、国家賠償法１条\n１項に基づき、３２万７８００円及びこれに対する納付日から支払済みまで民法（平成２９年法律第４４号による改正前のもの。以下同じ。）所定年５分の割合による遅延損害金の支払を求める事案である。\n第２事件は、原告が、令和元年分確定申告の後に、源泉徴収税額の計上漏れにより納付すべき税額が過大であるとして更正の請求（以下「令和元年分更正の請求」という。）をしたところ、処分行政庁が、令和元年分更正の請求について、源泉徴収額の計上漏れには理由があるものの、分離課税の譲渡株式等の譲渡所得に該当するものを総合課税の長期譲渡所得に当たるとしたこと等に誤りがあるとして、校正すべき理由がない旨の通知処分（以下「令和元年分通知処分」といい、平成３０年分通知処分と併せて「本件各通知処分」という。また、本件各更正処分、本件各通知処分及び本件各賦課決定処分をまとめて、「本件各更正決定等」という。）をするとともに、令和元年分更正決定等をしたことから、令和元年分更正決定等について、上場株式の譲渡による譲渡所得を総合課税の譲渡所得として所得税等の額の計算をすべきであるため違法である旨を主張して、令和元年分更正決定等の取消しを求めるほか、処分行政庁による令和元年分更正決定等により、納付済みの所得税の額から原告が納付すべきであると考える税額の差額に相当する損害を受けたとして、国家賠償法１条１項に基づき、\n９万４１９３円及びこれに対する納付日から支払済みまで民法所定の年５分の割合による遅延損害金の支払を求める事案である。\n２ 関係法令等の定め別紙のとおり（なお、別紙における表題で定義を付けたものは、以下の本文中でも用いる。）。\n３ 前提事実証拠及び弁論の全趣旨によれば、以下の各事実（以下「前提事実」という。）が認められる。\n\n\n（１）原告による本件各持分の取得の経緯及び譲渡ア 原告は、以下のとおり、本件土地の共有持分１８分の３を取得した（乙１の２）。\n（ア）平成４年９月４日付けで、共有持分２７分の２を贈与により取得\n（イ）平成５年２月２２日付けで、共有持分２７分の１を贈与により取得\n（ウ）平成２５年４月２６日付けで、共有持分１８分の１を相続により取得イ 原告は、平成２６年９月５日付けで本件建物の共有持分２分の１を売買により取得した\n（乙１の３）。\nウ 原告は、平成３０年２月１４日付けで本件土地を他の共有者とともに、原告の共有持分\n１８分の３に応じた譲渡価額２９７万円で譲渡した。原告の共有持分に応じた取得費は、\n１４万８５００円であり、原告の共有持分に応じた譲渡費用は、９１４０円であった（乙\n１の２）。\nまた、原告は、同日付けで、本件建物を、他の共有者とともに、原告の共有持分２分の\n１に応じた譲渡価額４６万２９６２円で譲渡した（乙１の３）。原告の共有持分に応じた取得費は、４１万２３３５円であり、原告の共有持分に応じた譲渡費用は、８６００円であった（乙１の２）。\n\n\n（２）本件株式の取得の経緯及び譲渡等ア 原告は、本件株式を１株当たり●●円の平均買付価格で取得した。\nイ 原告は、令和元年１２月２５日付けで、本件株式１０４５株を１株当たり２６７０円で売却し、約定金額及び精算金額として２７９万０１５０円を取得した（乙２）。\n\n\n（３）課税処分等の経緯平成３０年分確定申告、平成３０年分更正の請求、平成３０年分通知処分、平成３０年分更正決定等、平成３０年分通知処分に対する原告の審査請求、平成３０年分更正決定等についての原告の審査請求及びこの審査請求に対する国税不服審判所長の裁決の経緯は、別表１\n「所得税等に係る課税処分等の経緯」の平成３０年分欄に記載のとおりである。\n令和元年分確定申告、令和元年分更正の請求、令和元年分通知処分、令和元年分更正決定等、令和元年分更正決定等についての原告の審査請求及びこの審査請求に対する国税不服審判所長の裁決の経緯は、別表１「所得税等に係る課税処分等の経緯」の令和元年分欄に記載のとおりである。\n\n\n（４）本件訴えの提起原告は、令和４年８月１日、本件訴え（第１事件、第２事件）を提起した（顕著な事実）。\n４ 本件各更正決定等の根拠及び適法性に関する被告の主張本件各更正決定等の根拠及び適法性に関する被告の主張は、後記５における主張のほか、別紙「本件各更正決定等の根拠及び適法性に関する被告の主張」に記載のとおりである。\n５ 争点及びこれに関する当事者の主張本件における争点は、第１事件及び第２事件について、\n\n\n（１）本件各持分及び本件株式の譲渡による各譲渡所得について、措置法が適用されて分離課税の対象となるか、所得税法が適用されて総合課税の対象となるか、第１事件について、\n\n\n（２）本件贈与税が本件土地の譲渡による譲渡所得の取得費に該当するか、である。\n\n\n（１）争点\n\n\n（１）（本件各持分及び本件株式の譲渡による各譲渡所得について、措置法が適用されて分離課税の対象となるか、所得税法が適用されて総合課税の対象となるか）について\n（原告の主張）\n所得税法３３条１項及び２項並びに所得税基本通達３３－１が譲渡所得の起因となる資産の範囲から土地、建物及び上場株式等の資産を除外していないこと、措置法の上場株式等に係る配当所得等（措置法８条の４）と上場株式等に係る譲渡所得（措置法３７条の１１）に関する各規定はほぼ同様であり、前者については申告分離課税が選択できるとされていることから、後者についてもこれと同様に解すべきであること、措置法１条が所得税の軽減のため税額の計算につき所得税法の特例を設ける旨規定していることに照らせば、譲渡所得への分離課税に関する措置法の規定は、所得税法を適用する場合と比べて所得税が軽減される場合に限って適用されると解釈すべきであるから、本件各持分及び本件株式の譲渡による譲渡所得は、措置法の規定による分離課税ではなく、所得税法の規定による総合課税の対象とすべきである。\n（被告の主張）\n措置法３１条１項、３２条１項及び３７条の１１第１項は、土地及び建物又は上場株式等の譲渡による譲渡所得につき、いずれも所得税法２２条及び８９条並びに１６５条の規定にかかわらず、他の所得と区別し、分離課税の対象とする旨規定しているところ、文理上、措置法３１条１項、３２条１項及び３７条の１１第１項の規定に該当するものについては、所得税法２２条（課税標準）、８９条（税率）及び１６５条（総合課税に係る所得税の課税標準、税額等の計算）の各規定の適用が排除され、措置法の上記各規定が適用されて、分離課税の対象となることは明らかである。したがって、本件各持分の譲渡による譲渡所得については、土地ないし建物の譲渡による譲渡所得として措置法３１条又は３２条が適用され、本件株式の譲渡による譲渡所得については、措置法３７条の１１第１項が適用され、いずれも分離課税の対象となる。\n\n\n（２）争点\n\n\n（２）（本件贈与税が本件土地の譲渡による譲渡所得の取得費に該当するか）について\n（原告の主張）\n相続税法２１条の２、所得税基本通達６０－２及び措置法３９条の各規定や、贈与税は不動産取得税と同じく不動産の贈与を受けた際に支出するものであることからすると、相続税は、資産を取得するために通常必要と認められる費用といえる。\n（被告の主張）\n所得税法３８条１項に基づき、譲渡所得の計算において控除される「資産の取得費」や、\nこれに含まれる「資産の取得に要した費用」については、当該譲渡の対象とされた個別の資産ごとに定まることが必要と解されるところ、贈与税は、財産の価額に相当する経済的価値を課税対象とするものであって、個々の贈与財産に着目し、その財産ごとに課税するものではないから、「資産の取得に要した金額」には該当せず、「資産の取得費」には含まれない。\n\n\n\n\n\n\n第３ 当裁判所の判断\n\n\n１ 争点\n\n\n（１）（本件各持分及び本件株式の譲渡による各譲渡所得について、措置法が適用されて分離課税の対象となるか、所得税法が適用されて総合課税の対象となるか）について\n\n\n（１）措置法１条は、所得税法の特例を設けることについて規定する旨を定めているところ、措置法３１条１項、３２条１項及び３７条の１１第１項は、土地及び建物又は上場株式等の譲渡による譲渡所得について、所得税法２２条及び８９条並びに１６５条の規定にかかわらず、\n他の所得と区別し、分離課税の対象とされる旨を明確に定め、その文理上、課税標準（所得税法２２条）、税率（同８９条）、総合課税にかかる計算（同１６５条）についての所得税法の規定の適用を排除しているから、措置法の上記各規定に該当する譲渡所得は、いずれも所得税法に基づく総合課税によらず、分離課税の対象としていることが明らかである。\n\n\n（２）原告は、①所得税法３３条１項及び２項並びに所得税基本通達３３－１が譲渡所得の起因となる資産の範囲から土地、建物及び上場株式等の資産を除外していないことや、②措置法の上場株式等に係る配当所得等（措置法８条の４）と上場株式等に係る譲渡所得（措置法３\n７条の１１）に関する各規定はほぼ同様であり、前者については申告分離課税が選択できるとされており、後者についてもこれと同様に解すべきであることから、本件各持分及び本件株式の譲渡による譲渡所得について、措置法の規定に基づく分離課税ではなく、所得税法に基づく総合課税によって所得税等の額を計算すべきことを選択できる旨主張する。しかしながら、前記\n\n\n（１）で述べたところに加え、措置法１条の定めを踏まえると、上記各規定と所得税法の総合課税に関する規定は、特別法と一般法の関係にあると解される以上、所得税法\n３３条１項及び２項並びに所得税基本通達３３－１が譲渡所得の基因となる資産の範囲から土地、建物及び上場株式等の資産を除外していないからといって、納税申告者に総合課税によるか分離課税によるかの選択権を与えているわけではないのは明らかであるから、①の主張は採用できない。また、措置法８条の４第２項は、特定上場株式等の配当等に係る配当所得について申告分離課税の対象とされる旨の同条１項の適用を受けるのは、同項の規定の適用を受けようとする旨の記載のある確定申告書を提出した場合に限られるとするところ、上場株式等の譲渡による譲渡所得については、これに対応する規定がないから（措置法３７条の１１参照）、措置法３７条の１１第１項が、上場株式等の譲渡による譲渡所得について、\n分離課税とするか、総合課税とするかの選択権を納税者に与えているものとは解されず、②の主張は採用できない。\nさらに、原告は、措置法１条が所得税の軽減のため税額の計算につき所得税法の特例を設ける旨規定していることに照らせば、譲渡所得への分離課税に関する措置法の規定は、所得税法を適用する場合と比べて所得税が軽減される場合に限って適用されると解釈すべきである旨主張するが、措置法１条が、「所得税（中略）を軽減し、若しくは免除し、若しくは還付し、又はこれらの税に係る納税義務、課税標準若しくは税額の計算、申告書の提出期限若しくは徴収」について特例を設けることを規定しており、所得税の軽減等のみでなく、「又は」として納税義務や課税標準若しくは税額の計算等の特例であることも同法の趣旨として掲げていることからすると、措置法の適用が所得税の軽減される場合に限られないことは明らかであるから、上記主張は採用できない。\n\n\n（３）以上を前提に本件の適用法令を検討する。\nア 本件各持分の譲渡は、土地ないし建物の譲渡であるから、措置法３１条１項又は３２条\n１項が適用される。このうち本件土地の共有持分については、前提事実のとおり、原告は、\n平成４年９月４日付け、平成５年２月２２日付け及び平成２５年４月２６日付けで、それぞれ贈与又は相続により取得し、平成３０年２月１４日付けで譲渡しており、原告が本件土地の共有持分を譲渡した年の１月１日における原告の所有期間は５年を超えているから\n（なお、原告が、平成２５年４月２６日付で相続により取得した共有持分については、被相続人が保有していた期間を引き続き原告が所有していたものとみなされる（所得税法６\n０条１項１号）。）、本件土地の共有持分の譲渡による譲渡所得は、措置法３１条１項に基づく分離課税の対象となる。\nまた、本件建物の共有持分については、前提事実のとおり、原告は、平成２６年９月５日付けで売買により取得し、平成３０年２月１４日付けで譲渡しており、原告が本件建物の共有持分を譲渡した年の１月１日における原告の所有期間が５年を超えないことから、\n本件建物の共有持分の譲渡による譲渡所得は措置法３２条１項に基づく分離課税の対象となる。\nイ 前提事実のとおり、原告は、令和元年１２月２５日付けで本件株式を売却しているところ、本件株式は上場株式であると認められ（乙２）、「株式等で金融商品取引所に上場されているものその他これに類するものとして政令で定めるもの」（措置法３７条の１１第２項１号）に当たるから、本件株式の譲渡による譲渡所得は措置法３７条の１１第１項に基づく分離課税の対象となる。\nウ 以上によれば、本件各持分及び本件株式の譲渡による譲渡所得は、措置法３１条１項、\n３２条１項及び３７条の１１第１項に基づく分離課税の対象となるところ、本件各更正決定等は、いずれもこれを前提として所得税等を算定の上でされたものであるから、その適法性に問題はなく、原告の主張は採用できない。\n２ 争点\n\n\n（２）（本件贈与税が本件土地の譲渡による譲渡所得の取得費に該当するか）について\n\n\n（１）所得税法は、譲渡所得の金額について、総収入金額から資産の取得費及び譲渡に要した費用を控除するものとし（所得税法３３条３項）、資産の取得費は、別段の定めがあるものを除き、当該資産の取得に要した金額並びに設備費及び改良費の額の合計額としている（同法\n３８条１項）。ここで、譲渡所得に対する課税は、資産の値上がりによりその資産の所有者に帰属する増加益を所得として、その資産が所有者の支配を離れて他に移転するのを機会にこれを清算して課税する趣旨のものであるところ、所得税法３８条１項にいう「資産の取得に要した金額」には、当該資産の客観的価格を構成すべき取得代金の額のほか、登録免許税、\n仲介手数料等当該資産を取得するための付随費用の額も含まれると解される（最高裁平成４年７月１４日第三小法廷判決・最高裁判所民事判例集４６巻５号４９２頁）。また、所得税基本通達６０－２は、所得税法６０条１項１号に掲げる贈与等により譲渡所得の基因となる資産を取得した場合において、当該贈与等に係る受贈者等が当該資産を取得するために通常必要と認められる費用を支出しているときには、当該費用のうち当該資産に対応する金額については、当該資産の取得費に算入できる旨を定めている。\n\n\n（２）そこで、本件贈与税が「資産の取得に要した金額」に該当するか検討すると、贈与税の納税義務者は、贈与により財産を取得した個人であり（相続税法１条の４第１項１号）、贈与税の納税義務は、贈与により財産を取得した時に成立するところ（国税通則法１５条２項５号）、贈与税の課税標準である課税価格は、贈与により財産を取得した個人で当該財産を取得した時において日本に住所を有するものにあっては、その者がその年中において贈与により取得した財産の価額の合計額である（相続税法２１条の２第１項）。このことからすると、\n贈与税は、財産の価額に相当する経済的価値を課税対象とするものであり、特定の不動産の取得等を課税対象とするものではないから、当該贈与等に係る受贈者等が当該資産を取得するために通常必要と認められる費用には当たらない。したがって、本件贈与税についても、\n本件土地の受贈者である原告が同土地を取得するために通常必要と認められる費用とはいえず、「資産の取得に要した金額」に該当し「資産の取得費」に含まれるとしてこれを控除することはできない。\nなお、所得税法９条１項１６号が、相続や個人からの贈与により所得するものにつき、所得税を課さないとしている趣旨が、財産を取得した場合、当該相続人等において、当該財産の価額に相当する新たに取得した経済的利得が本来、当該相続人等の所得として所得税の課税対象となるべきものであるにもかかわらず、他方で、当該相続人等が取得した財産の当該相続等の時点における価額（時価）は、当該相続人等に対する相続税又は贈与税の課税対象となり、二重課税を排除する趣旨であるものと解し得ることに照らして、本件贈与税について「資産の取得に要した金額」に該当するかも問題となり得るが、一般に、相続等の時点では資産の増加益が具体的に顕在化しないため、その時点における譲渡所得課税について納税者の納得を得難いことに鑑み、その時点における課税を留保して繰り延べ、その後、相続人等が資産を譲渡することによってその増加益が具体的に顕在化した時点において、被相続人等の下で実現しなかった増加益も含めてこれを清算して課税することとした所得税法６０条\n１項１号の趣旨に照らすと、所得税法９条１項１６号に抵触するものとはいえない。\nまた、原告は、本件贈与税が「資産の取得費」に含まれることの根拠として措置法３９条\n１項が存在することも主張するが、同規定は相続税額の取得費への算入を一定の要件のもとに認めたものであり、贈与税を取得費に算入するべきとする主張の根拠としては失当であるから、かかる主張は採用できない。\n\n\n（３）したがって、本件贈与税を取得費に該当するものとして譲渡所得の金額を算定しなかったことは、平成３０年分更正決定等の適法性に影響を及ぼすものではない。\n３ 本件各更正決定等の適法性及び国家賠償請求の適否について弁論の全趣旨によれば、争点１及び争点２に関する部分を除き、計算の基礎となる金額及び計算方法については当事者間に争いがなく、その算定過程に違法、不合理な点はないところ、\n上記のとおり争点１及び争点２に関して違法性は認められず、平成３０年分の納付すべき所得税の額等、令和元年の納付すべき所得税の額等は別紙２「本件更正処分等の根拠及び適法性に関する被告の主張」のとおりであるから、本件各更正処分は適法であり、本件各更正決定等におけるそれらと同額と認められるから、本件各更正決定等は、いずれも適法である。また、本件各賦課決定処分及び本件各通知処分についても、同別紙に記載のとおり、いずれも適法である。\nそうすると、第１事件及び第２事件の国家賠償法１条１項に基づく各請求は、本件各更正決定等により原告が納付することになった所得税等の返還を求めるものと解されるところ、上記のとおり本件各更正決定等が適法である以上、その前提を欠くものであり、処分行政庁においてこれらの処分をしたことについて違法性が認められないことは明らかである。\n\n\n\n\n\n\n第４ 結論以上によれば\n\n\n、原告の請求はいずれも理由がないから、これらを棄却することとして、主文のとおり判決する。\n熊本地方裁判所民事第２部裁判長裁判官 品川 英基裁判官 塚田 久美子裁判官 若松 亮太\n（別紙）\n関係法令の定め\n【所得税法】\n（非課税所得） （令和 3年法律第 1 1 号による改正前のもの）\n\n\n\n\n\n\n第9 条\n\n\n次に掲げる所得については、所得税を課さない。\nー～十五（略）\n十六 相続、遺贈又は個人からの贈与により取得するもの（相続税法（昭和-2 5 年法律第7 3 号）の規定により相続、遺贈又は個人からの贈与により取得したものとみなされるものを含む。）\n十七～十九（略）、\n, 2 （略）\n・.・. （課税標準）\n:..\", .第 2 2条 居住者に対＇•して課する所得税の課税標準は、総所得金額、退職所得金額\nヽ● i.‘•', •及び山林所得金額とする。\n, : ·•.・り総所得金額は、次節（各種所得の金額の計算）の規定により計算した次に掲げ\n61 , 2る金額の合計額（第 70 条第1項若しくは第 2 項（純損失の繰越控除）又は第7 1条第 1項（雑損失の繰越控除）の規定の適用がある場合には、その適用後の金額）\nとする。\nー 利子所得の金額、配当所得の金額、不動産所得の金額、事業所得の金額、給与所得の金額、譲渡所得の金額（第3-3 条第 3 項第 1号（譲渡所得）に掲げる所得に係る部分の金額に限る。）及び雑所得の金額（これらの金額につき第6 9 条\n（損益通算）の規定の適用がある場合には、その適用後の金額）の合計額二 譲渡所得の金額（第3 3 条第•3 項第 2 号に掲げる所得に係る部分の金額に限る。）及び一時所得の金額．（これらの金額につき第6 9 条の規定の適用がある場合には、その適用後の金額）の合計額の 2 分の 1 に相当する金額\n3 （略）\n（譲渡所得）\n第3 3 条 ，譲渡所得とは、資産の譲渡（建物又は構築物の所有を目的とする地上権又は賃借権の設定その他契約により他人に土地を長期間使用させる行為で政令で定めるものを含む。以下この条において同じ。）による所得をいう。\n5 2 次に掲げる所得は、譲渡所得に含まれないものとする。\nしたな卸資産（これに準ずる資産として政令で定めるものを含む。）の譲渡その他営利を目的として継続的に行なわれる資産の譲渡による所得二 前号に該当するもののほか、山林の伐採又は譲渡による所得 ，\n3 譲渡所得の金額は、次の各号に掲げる所得につき、それぞれその年中の当該所得に係る総収入金額から当該所得の基因となった資産の取得費及びその資産の譲渡に要した費用の額の合計額を控除し、その残額の合計額（当該各号のうちいずれか\n．． ，\n，． 、\n● .\n9 . , .\n, ．\n、 ’ 9\n＇ 書．\n、 ．．\n99景\n~, ● ， ●\n． ・ ’\n，’ ． ． ’\n》 9.\n`\n.\n・\n．\n． ．の\nの号\n資に\n産掲\nのげ\n譲る\n渡所\nに得\n要に\nし係\nたる\n費総\n用収\nの入\n額金\nの額\n合が\n計当\n額該\nに所\n滴得\nたの\nな基\nい因\n場と\n合な\nにっ\nはた\n、\n資そ\n産の\nの不\n取足\n得額\n費に\n及相\nび当\nそす\n. ≫ ●， ， る金額を他の号に掲げ・る所得に係る残額から控除した金額。以下この条において\n9 ●\n． 「譲渡益」という。）から譲渡所得の特別控除額を控除した金額とする。\n資産の譲渡（前項の規定に該当するものを除く。次号において同じ。）でその＇資産の取得の日以後 5年以内にされたむのによる所得（政令で定めるものを除く。）\n資産の譲渡による所得で前号に掲げる所得以外のもの\n4~ 5 （略）\n（該渡所得の金額の計算上控除する取得費）\n第3 8 条 譲渡所得の金額の計算上控除する資産の取得費は、別段の定めがあるものを除き、その資産の取得に要した金額並びに設備費及び改良費の額の合計額とする。\n2 （略）\n10\n\n（贈与等により取得した資産の取得費等） （令和 2 年法律\n\n\n\n\n\n\n第8 号による改正前のもの\n\n\n）\n第60 条 居住者が次に掲げる事由により取得した前条第 1項に規定する資産を譲渡した場合における事業所得の金額、山林所得の金額、譲渡所得の金額又は雑所得\n5 の金額の計算については、その者が引き続きこれを所有していたものとみなす。\n・一\n贈与、相続（限定承認に係るものを除く。）又は遺贈（包括遺贈のうち限定承認に係るものを除く。）\n二 前条\n\n\n\n\n\n\n第2 項の規定に該当する譲渡\n\n\n2 .（略）\n91 （税率）\n：・第8 9 条 居住者に対して課する所得税の額は、その年分の課税総所得金額又は課税退職所得金額をそれぞれ次の表の土欄に掲げる金額に区分してそれぞれの金額に\n9 9 ` 會\n•\n．\n・― .．\n．\n・ ．．同表の下欄に掲げる税率を乗じて計算した金額を合計した金額と、その年分の課税\n．\n.．.\n..\n．． .．山林所得金額の5 分の 1 に相当する金額を同表の上欄に掲げる金額に区分してそれ\n.\n．ぞれの金額に同表の下欄に掲げる税率を乗じて計算した金額を合計した金額に5 を乗じて計算した金額との合計額とする。\n、\n• -- 」 - -• ••• • •• - 9, . • . • ＿＿ ．・，．．．．．．．．．．．．．．．．．ー・'.“—.“., '・- _ -•ー・：：一··· •一 • -\n1 9 5 万円以下の金額 l，10 0 分の5\n1 9 5 万円を超え3 3 0 万円以下の金額 |1 0 0 分の 10\n3.3 0 万円を超え6 9 5 万円以下の金額 ho o 分の 20\n6 9 5 万円を超え 900 万円以下の金額 100 分の 2 3\n9 0 0 万円を超え 1 8 0 0 万円以下の金額 1 0 0 分の 33\n1 8 0 0 万円を超え4000 万円以下の金額 1 0 0分の40\n4000 万円を超える金額 1 0 0 分の45\n2 課税総所得金額、課税退職所得金額又は課税山林所得金額は、それぞれ、総所得金額、退職所得金額又は山林所得金額から前章\n\n\n\n\n\n\n第4 節\n\n\n（所得控除）の規定による控除をした残額とする。\n漢合課税に係る所得税の課税標準、税額等の計算） （平成3 0 年法律第 7 号による改正前のもの）\n，第1 5 条 前条第 1 項各号に掲げる非居住者の当該各号に定める国内源泉所得について課する所得税（以下この節にお・いて「総合課税に係る所得税」という)c の課税標準及び所得税の額は、当該各号に定める国内源泉所得について、別段の定めがあるものを除き、前編第 1 章から\n\n\n\n\n\n\n第4 章まで\n\n\n（居住者に係る所得税の課税標準、\n税額等の計算） （\n\n\n\n\n\n\n第44 条の\n\n\n3 （減額された外国所得税額の総収入金額不算入等）、\n\n\n\n\n\n\n第46 条\n\n\n（所得税額から控除する外国税額の必要経費不算入）、・第6 0 条の4\n（外国転出時課税の規定の適用を受)9 た場合の譲渡所得等の特例）、第 7 3 条から第 7 条まで（医療費控除等）、\n\n\n\n\n\n\n第79 条\n\n\n（障害者控除）、第81 条から第 8 5 条まで（寡婦（寡夫）控除等）、第9 5 条（外国税額控除）及び第9 5 条の 2 （国外転\n・. 出をする場合の譲渡所得等の特例に係る外国税額控除の特例）を除く。）の規定に\n, .' •9 亀 9 »・9 `・ ー • 9\n、 , ≫. , / .準じて計算した金額とする。\n” ..p \n.\n. i •· ` . ・ー\n» ● ●\n. ,、 2 前条第 1’雌項第1号に掲げる非居住者の同号イに掲げる国内源泉所得（以下この款において「恒久的施設帰属所得」という。）に係る各種所得の金額につき前項の\nl，5規定により前編\n\n\n\n\n\n\n第2 章第\n\n\n2 節第1款及び第 2款（各種所得の金額の計算）．の規定に準じて計算する場合には、 し次に定めるところによる。\n第 3 7 条第1項（必要経費）に規定する販売費、一般管理費その他同項に規定する所得を生ずべき業務について生じた費用（次号において「販売費等」 という。）及び同条\n\n\n\n\n\n\n第2 項に規定する山林の植林費\n\n\n、取得に要した費用、管理費、伐採費その他その山林の育成又は譲渡に要した費用（同号において「育成費等」という。）のうち、第 1 6 1 条第 1項第 1 号（国内源泉所得）に規定する内部取引\n,,に係るものについては、債務の確定しないものを含むものとする。\n販売費等及び育成費等並びに支出した金額（\n\n\n\n\n\n\n第34 条第\n\n\n2 項（一時所得）に規・定する支出した金額をいう。以下この号において同じ。）には、非居住者の恒久的施設を通じて行う事業及びそれ以外の事業に共通する販売費等及び育成費等並びに支出した金額のうち、当該恒久的施設を通じて行う事業に係るものとして政令で定めるところにより配分した金額を含むものとする。\n3 前項に定めるもののほか、第1項の規定の適用に関し必要な事項は、政令で定める。\n【所得税基本通達】\n（譲渡所得の基因となる資産の範囲）\n釘3 - 1.譲渡所得の基因となる資産とは、法第 3 3 条\n\n\n\n\n\n\n第2 項各号に規定する資産及び金銭債権以外の一\n\n\n切の資産をいい、当該資産には、借家権又は行政官庁の許可、\n認可、割当て等により発生した事実上の権利も含まれる。\n（贈与等の際に支出した費用）\n• . 6 0- 2 法\n\n\n\n\n\n\n第60 条第\n\n\n1項第 1号に掲げる贈与、相続又は遺贈（以下この項にお\n9... s . .\n....・.‘.、’.··•'●いて「贈与等」 という。）により譲渡所得の基因となる資産を取得した場合におい\n'; ．.．..、: .．.\n≫ て、当該贈与等に係る受贈者等が当該資産を取得するために通常必要と認められる\n9 事 ・費用を支出しているときには、当該費用のうち当該資産に対応する金額については、 37-5 及び4 9-3 の定めにより各種所得の金額の計算上必要経費に算入された登録免許税、不動産取得税等を除き、当該資産の取得費に算入できることに留意する。\n（注） 当該贈与等以外の事由により非業務用の固定資産を取得した場合の登録免許幻 税等については、 38-9 参照\n【租税特別措置法】（以下「措置法」としゞう。）\n第1条 この法律は、当分の間、所得税、法人税、地方法人税、相続税、贈与税、\n地価税、登録免許税、消費税、酒税、たばこ税、揮発油税、地方揮発油税、右油石炭税、航空機燃料税、自動車重量税、国際観光旅客税、印紙税その他の内国税を軽減し、若しくは免除し、若しくは還付し、又はこれらの税に係る納税義務、課税標準若しくは税額の計算、申告書の提出期限若しくは徴収iこつき、所得税法（昭和 4\n0 年法律第3 3 号）、法人税法（昭和40 年法律\n\n\n\n\n\n\n第34 号\n\n\n）、地方法人税法（平成2\n6 年法律第 1 1号）、相続税法（昭和2 5 年法律第7 3 号）、地価税法（平成3 年法律第6 9 号）、登録免許税法（昭和42 年法律第3 5 号）、消費税法（昭和 6 3 年法\n.5 律第 8 号）、酒税法（昭和 28 年法律\n\n\n\n\n\n\n第6 号\n\n\n）、たばこ税法（昭和 59 年法律第\n72 号）、揮発油税法（昭和 3 2年法律第 55 号）、地方揮発油税法（昭和 30 年法律第 1 0 4 号）、石油石炭税法（昭和53 年法律第・2 5 号）、航空機燃料税法（昭和\n47 年法律\n\n\n\n\n\n\n第7 号\n\n\n）、自動車重量税法（昭和46 年法律第8 9号・)、国際観光旅客税法（平成30 年法律第 1 6 号）、 •印紙税法（昭和 42年法律第2 3 号）、国税通則法\n（昭和 3 7年法律第6 6 号）及び国税徴収法（昭和34 年法律第 1 4 7 号）の特例を設けることについて規定するものとする。・\n｀・\n（ 上場株式等に係る配当所得等の課税の特例）\n・邊．覺\n8.2\n•令 ＇ ．\n\n\n\n\n\n\n第8 条の\n\n\n4 居住者又は恒久的施設を有する非居住者が、平成 年 1 月1 日以後\n• ;’噌•\nヽ$- . .\n・ ？ ＇•. に支払を受けるべき所得税法\n\n\n\n\n\n\n第23 条第\n\n\n1項に規定する利子等（第3条第 1項に規\nヽ、9定する一般利子等、第 3条の 3 第 1項に規定する国外一般公社債等の利子等その他\n` 51政令で定めるものを除く。以下この項及び\n\n\n\n\n\n\n第5 項において\n\n\n「利子等」という。）又，は同法第24 条第 1項に規定する配当等（\n\n\n\n\n\n\n第8 条の\n\n\n2第 1項に規定する私募公社債等運用投資信託等の収益の分配に係る配当等、前条第 1項に規定する国外私募公社債等運用投資信託等の配当等その他政令で定めるものを除く 0.'•以下この項、第4項及び第 5 項において「配当等」という。）で次に掲げるもの（以下この項、次項及び第4項において「上場株式等の配当等」という。）を有する場合には、当該上場 ，株式等の配当等に係る利子所得及び配当所得については、同法\n\n\n\n\n\n\n第22 条及び第\n\n\n8 9\n“・条並びに第 1 6 5 条の規定にかかわらず、他の所得と区分し、その年中の当該上場株式等の配当等に係る利子所得の金額及び配当所得の金額として政令で定めるところにより計算した金額（以下この項において「上場株式等に係る配当所得等の金額」という。）に対し、上場株式等に係る課税配当所得等の金額（上場株式等に係る配当所得等の金額（\n\n\n\n\n\n\n第3 項第\n\n\n3 号の規定により読み替えられた同法第7 2 条から第8 7 条までの規定の適用がある場合には、その適用後の金額）をいう。）の 1 0\n0分の 1 5 に相当する金額に相当する所得税を課する。この場合において．、当該上場株式等の配当等に係る配当所得については、同法第 9 2 条第 1項の規定は、適用しない。\n第3 7 条の 1 1\n\n\n\n\n\n\n第2 項第\n\n\n1 号に掲げる株式等の利子等又は配当等で、内国法人\nーから支払がされる当該配当等の支払に係る基準日（当該配当等が所得税法第 25条第 1項の規定により剰余金の配当、 ‘利益の配当、剰余金の分配又は金銭の分配とみなされるものに係る配当等である場合には、政令で定める日）においてその内国法人の発行済株式（投資法人（投資信託及び投資法人に関する法律\n\n\n\n\n\n\n第2 条第\n\n\n‘1 2 項に規定する投資法人をいう。\n\n\n\n\n\n\n第3 号\n\n\n、第9 条の 3 第3 号及び第9 条の 3 の\n· · 2\n\n\n\n\n\n\n第3 項第\n\n\n3 号において同じ。）にあっては、発行済みの投資口（投資信託及び\n·~ ~ ・ ・9 讐 ↓ ＾ ． ．． ． ． ． 9 • ． . ． 9. ヽ 會 投資法人に関する法律第 2 条\n\n\n\n\n\n\n第14 項に規定する投資口をいう\n\n\n。以下この項、次\n· 9\n＂．．\n．．． 9 9 .． ． 會 ~ ． . 9 鳥，． ． 事 条第 1項\n\n\n\n\n\n\n第4 号\n\n\n、第9 条の 3 第3号並びに第 9 条の 3 の2 第1項第 3 号及び第3毒\n項第 3 号において同じ。）。第9条の 3第 1号において同じ。）又fま出資の総数又は総額の 1 0 0 分の 3 以上に相当する数又は金額の株式（投資口を含む。以下この章において同じ。）又は出資を有する者が当該内国法人から支払を受ける配当等以外のもの二 投資信託でその設定に係る受益権の募集が公募（金融商品取引法\n\n\n\n\n\n\n第2 条第\n\n\n3 項に規定する取得勧誘のうち同項第1 号に掲げる場合に該当するものとして政令で定めるものをいう。）により行われたもの（特定株式投資信託を除く。）の収益の分配三 特定投資法人（その規約に投資信託及び投資法人に関する法律\n\n\n\n\n\n\n第2 条第\n\n\n1 6項に規定する投資主の請求により投資口の払戻しをする旨が定められており、かつ、その設立の際の投資口の金融商品取引法\n\n\n\n\n\n\n第2 条第\n\n\n3 項に規定する有価証券の\n15\n\n募集が同項に規定する取得勧誘であって同項第 1号に掲げる場合に該当するものとして政令で定めるものにより行・われた投資法人をいう。）の投資口の配当等四 特定受益証券発行信託（その信託法（平成 1 8 年法律第1 0 号）第 3 条第 1号に規定する信託契約（次条\n\n\n\n\n\n\n第1 項第\n\n\n5 号、第 9条の 3 第4 号、第9 条の 3 の2第 1項\n\n\n\n\n\n\n第4 号及び第\n\n\n37 条の 1 1 第2項第3 号の 2 において「信託契約」という。）の締結時において委託者が取得する受益権の募集が公募（金融商品取引法第 2条第 3 項に規定する取得勧誘のうち同項第1号に掲げる場合に該当するものとして政令で定めるものをいう。）により行われたものに限る。）の収益の分配五特定目的信託（その信託契約の締結時におし‘て原委託者が有する社債的受益権\n'の募集が第 8条の 2第1項\n\n\n\n\n\n\n第2 号に規定する公募により行われたものに限る\n\n\n。）\n, 10の社債的受益権の剰余金の配当\n． ． ． ． ． ．， ＇ ． ． ． ． ． ・ ・ ・・ヽ , 2六\n前第\n項の\n3 条規\n第定の\n1項う\n第ち、\n1号上\nに場\n規株\n定式\nす等\nるの\n特配\n定当\n公等\n社で\n債同\nの項\n利第\n子\n1 号から\n\n\n\n\n\n\n第3 号までに掲げる\n\n\n. ． .. 喝 ．．． . ≫\n．\n． ．． 9•\n≫ ．． もの（同項\n\n\n\n\n\n\n第2 号に掲げる収益の分配にあっては\n\n\n、公社債投資信託以外の証券投資信託に係るものに限る。以下この項において「特定上場株式等の配当等」という。）に係る配当所得に係る部分は、居住者又は恒久的施設を有する非居住者がその年中に支払を受けるべき特定上場株式等の配当等に係る配当所得につき前項の規定の適用を受けようとする旨の記載のある確定申告書を提出した場合に限り適用するものとし、居住者又は恒久的施設を有する非居住者がその年中に支払を受けるべき特定上場株式等の配当等に係る配当所得について所得税法\n\n\n\n\n\n\n第22 条及び第\n\n\n89 条又は第 1 6 5 条の規定の適用を受けた場合には、その者がその同一の年中に支払を受けるべき他の特定上場株式等の配当等に係る配当所得については、同項の規定は、適用しない。\n3~8 （略）\n（長期譲渡所得の課税の特例） （平成30 年法律第 7 号による改正前のもの）\n25 ''第3 1条 個人が、その有する土地若しくは土地の上に存する権利（以下第 3 2条までにおいて「土地等」という。）又は建物及びその附属設備若しくは構築物（以下第 32条までにおいて「建物等」という。）で、• その年1 月 1 日において所有期間が 5 年を超えるものの譲渡（建物又は構築物の所有を目的とする地上権又は賃借権の設定その他契約により他人（当該個人が非居住者である場合の所得税法第1 6\n1条第 1 項第 1 号に規定する事業場等を含む。）に土地を長期間使用させる行為で政令で定めるもの（第3 3条から第3 7 条の 9 まで及び第3 7 条の 9 の5 において\n「譲渡所得の基因となる不動産等の貸付け」という。）を含む。以下第 32 条までにおいて同じ。）をした場合には、，当該譲渡による譲渡所得については、同法第2\n2 条及び第8 9 条並びに第 1 6 5条の規定にかかわらず、他の所得と区分し、その年中の当該譲渡に係る譲渡所得の金額（同法第 3 3 条\n\n\n\n\n\n\n第3 項に規定する譲渡所得の特別控除額の控除を\n\n\nしないで計算した金額とし、第3 2条第 1項に規定する短期譲\n・つ\n．｀． ● ●、 ． ・ 量 ． ． ． ． 庫 渡所得の金額の計算上生じた損失の金額があるときは、同項後段の規定にかかわら\n，．．・ ．．\n．｀ ．ず、当該計算した金額を限度として当該損失の金額を控除した後の金額とする。\n、•..\n•••以下ごの項及び第3 1条の4 において「長期譲渡所得の金額」という。）に対し、\n長期譲渡所得の金額（\n\n\n\n\n\n\n第3 項第\n\n\n3 号の規定により読み替えられた同法第7 2 条から第 8 7 条までの規定の適用がある場合には、その適用後の金額。以下第3 1条の 3までにおいて「課税長期譲渡所得金額」という。）の 1 0 分の 1 5 に相当する金額に相当する所得税を課する。この場合において、長期譲渡所得の金額の計算上生じた損失の金額があるときは、同法その他所得税に関する法令の規定の適用については、当該損失の金額は生じなかったものとみなす。\n2 前項に規定する所有期間とは、当該個人がその譲渡をした土地等又は建物等をその取得（建設を含む。）をした日の翌日から引き続き所有していた期間として政令で定める期間をいう。\n3 （略）\nぉ\n（長期譲渡所得の概算取得費控除）\n第3 1条の4 個人が昭和 2 7年1 2月3 1 日以前から引き続き所有していた土地等又は建物等を談渡した場合における長期譲渡所得の金額の計算上収入金額から控除する取得費は、所得税法\n\n\n\n\n\n\n第38 条及び第\n\n\n6 1条の規定にかかわらず、当該収入金額の 100 分の 5 に相当する金額とする。ただし、当該金額がそれぞれ次の各号に掲げる金額に満たないことが証明された場合には、当該各号に掲げる金額とする。\nー その土地等の取得に要した金額と改良費の額との合計額二 その建物等の取得に要した金額と設備費及び改良費の額との合計額につき所得税法\n\n\n\n\n\n\n第38 条第\n\n\n2 項の規定を適用した場合に同項の規定により取得費とされる金額．\n2 （略）\n（短期譲渡所得の課税の特例）\n． 第3 2 条 個人が、その有する土地等又は建物等で、その年1 月1 日において第 3\n:::・: ．~ ・1 条\n\n\n\n\n\n\n第2 項に規定する所有期間が\n\n\n5年以下であるもの（その年中に取得をした土地\n•ふ・・\n••. ·•.書・ 等又は建物等で政令で定めるものを含む。．）の譲渡をした場合にiュ、当該譲渡によ\n●．鼻．. .る譲渡所得については、所得税法第 2 2 条及び第8 9条並びに第 1 6 5 条の規定にかかわらず、他の所得と区分し、その年中の当該譲渡に係る譲渡所得の金額（同法\n\n\n\n\n\n\n第33 条第\n\n\n3 項に規定する譲渡所得の特別控除額の控除をしないで計算じた金額とし、第3 1条第 1項に規定する長期譲渡所得の金額の計算上生じた損失の金額があるときは、同項後段の規定にかかわらず、当該計算した金額を限度として当該損失の金額を控除した後の金額とする。以下この項において「短期譲渡所得の金額」という。）に対し、課税短期譲渡所得金額（短期譲渡所得の金額（\n\n\n\n\n\n\n第4 項において準用する第\n\n\n3 条第3 項第3 号の規定により読み替えられた同法第 7 2 条から第8 7条までの規定の適用がある場合には、その適用後の金額）をいう。）の 1 0 0 分の\n30 に相当する金額に相当する所得税を諫する。この場合において、短期譲渡所得の金額の計算上生じた損失の金額があるときは、同法その他所得税に関する法令の勾\n規定の適用については、当該損失の金額は生じなかったものとみなす。\n2~ 4^＇（略）\n（上場株式等に係る譲渡所得等の課税の特例）\n第3 7条の 1 1 居住者又は恒久的施設を有する非居住者が、平成28 年1月 1 日｀以後に上場株式等の譲渡をした場合には、・当該上場株式等の譲渡による事業所得、\n譲渡所得及び雑所得（所得税法第4 1条の 2 の規定に該当する事業所得及び雑所得並びに\n\n\n\n\n\n\n第32 条第\n\n\n2 項の規定に該当する譲渡所得を除く。\n\n\n\n\n\n\n第3 項及び第\n\n\n4 項において「上場株式等に係る譲渡所得等」という)c については、同法第2‘2 条及び第8\n9 条並びに\n\n\n\n\n\n\n第165 条の規定にかかわらず\n\n\n、他の所得と区分し、その年中の当該上\n、\n場株式等の譲渡に係る事業所得の金額、譲渡所得の金額及び雑所得の金額として政令で定めるところにより計算した金額（以下この項において「上場株式等に係る譲＇渡所得等の金額」という。）に対し、上場株式等に係る課税譲渡所得等の金額（上\n． 場株式等に係る譲渡所得等の金額（\n\n\n\n\n\n\n第6 項において準用する前条第\n\n\n6 項第5 号の規\n.\n,\n． ，\n~,\n... 9 ， 9\n.疇 ． ．定により読み替えられた同法\n\n\n\n\n\n\n第72 条から第\n\n\n8 7 条までの規定の適用がある場合に\n9 , ．\n． •»．\n． 、 . ‘ 9 ｀ 鼠 ▲ , は、その適用後の金額）をいう。）の 100 分の 1 5に相当する金額に相当する所\n. ≫得税を課する。この場合において、上場株式等に係る譲渡所得等の金額の計算上生\n, 61じた損失の金額があるとぎば、同法その他所得税に関する法令の規定の適用については、当該損失の金額は生じなかったものとみなす。\n2~6 （略）\n（相続財産に係る譲渡所得の課税の特例） （平成30 年 3 月法律第 7 号改正前のもの）\n第3 9条 相続又は遺贈（贈与者の死亡により効力を生ずる贈与を含む。以下この条において同じ。）による財産の取得（相続税法又は\n\n\n\n\n\n\n第70 条の\n\n\n5若しくは第70条の 7 の3 の規定により相続又・は遺贈による財産の取得とみなされるものを含む。\n\n\n\n\n\n\n第6 項において同じ\n\n\n。）をした個人で当該相続又は遺贈につき同法の規定による相続税額があるものが、当該相続の開始があった日の翌日から当該相続に係る同法第\n2 7条第 1 項又は第 2 9 条第1項の規定による申告書（これらの申告書の提出後において同法\n\n\n\n\n\n\n第4 条に規定する事由が生じたことにより取得し\n\n\nた資産については、当該取得に係る同法第3 1条\n\n\n\n\n\n\n第2 項の規定による申告書\n\n\n。第4 項第 1号において「相続税申告書」という。）の提出期限（同号において「相続税申告期限］という。）の翌日以後3 年を経過する日までの間に当該相続税額に係る課税価格（同法第 1 9 条又は第2 1条の 1 4 から第 1条の 1 8 までの規定の適用がある場合には、これらの規定により当該課税価格とみなされた金額）の計算の基礎に算入された資産の譲渡（第3 1条第 1項に規定する譲渡所得の基因となる不動産等の貸付けを含む。以下この項、\n\n\n\n\n\n\n第4 項及び第\n\n\n8 項において同じ。）をした場合における譲渡所得に係る所得税法第3 3 条第 3 項の規定の適用については、同項に規定する取得費は、当該 、\n取得費に相当する金額に当該相続税額のうち当該譲渡をした資産に対応する部分として政令で定めるところにより計算した金額を加算した金額とする。\n01 .以上\n; .．\n．\n．\n．\n．．\n．\n． ．`\n．\n． ．\n.．\n. ｀て\n，直 ｀．\n．．.,\n．拿・\n• 9 .\n.\n（別紙）\n本件各更正決定等の根拠及び適法性に関する被告の主張\n\n\n\n\n\n\n第1 本件各更正処分の適法性\n\n\n1 平成 30 年分の納付すべき所得税の額等\n5 )1( 配当所得の金額 4 万6845 円上記金額は、原告が平成30 年分確定申告書に記載した配当所得の金額と同額である（乙 7 • 4 枚目の①欄）。\n)2( 雑所得の金額 1 6 3 万 1 9 5 0 円上記金額は、原告が平成30 年分確定申告書に記載した雑所得の金額と同額\n10 である（乙 7 • 4 枚目の②欄） 0 •\n)3( ，総所得金額 1 6 7 万8 7 9 5 円\n．．．． ．． ． 上記金額は、原告が平成30 年分確定申告書に記載した総所得金額と同額で i\n．．．\n．．\n．\n ある（乙 7 • 4 枚目の⑥欄）。\n．．．．\n．． )4( 分離短期譲渡所得の金額 7 万9065 円上記金額は、原告の本件建物の共有持分の譲渡に係る総収入金額（後記ア）\n砂、取得費（後記イ）及び譲渡費用（後記ウ）を控除した残額である（所得税法 3 3 条3項、措置法3 2 条 1項） （別表 2 。1 の④・「更正処分」 ，欄）。\nア総収入金額 50 方円上記金額は、原告が平成30 年分確定申告書に添付した建物売買契約書に基づき、原告の本件建物の譲渡金額1 0 0 万円（消費税を含む。）のうち、\n原告の所有する持分2 分の 1の金額である（乙 1 の3 • 4 ないし 6 枚目）。\nイ取得費 4 1 万 2 3 3 5 円上記金額は、原告が平成30 年分確定申告書に添付した譲渡所得の内訳書（建物用）の 3 面の「②取得費」欄に記載した金額と同額である（乙1 の\n3. 3枚目）。\nウ．譲渡費用 8600 円上記金額は、原告が平成30 年分確定申告書に添付した譲渡所得の内へ\n訳書（建物用）の 3 面の「③譲渡費用」欄に記載した金額と同額である（乙\n・1 の3 • 3枚目）。\n)5( 分離長期譲渡所得の金額 2 8 1 万2 3 6 0 円上記金額は、原告の本件土地の共有持分の譲渡に係る総収入金額（後記ア）か霰》\n．ら、取得費（後記イ）及び譲渡費用（後記ウ）を控除した残額である 、（所得税法\n33 条3 項、措置法 3 1条1項） （別表2 • 2 の④「更正処分」 、欄）。\nァ総収入金額 2 9 7 万円上記金額は、原告が平成3 0 年分確定申告書に添付した譲渡所得の内訳書\n（土地用）の 2 面の「①譲渡価額」襴に記載した金額と同額である（乙 1 の2. -\n. 2枚目）\n＇イ 取 得 費 1 4 万8500 円\nヽ\n．\n．．\n．．． ．． ．\n．\n．\n.\n.\n”． ， 息9 ・ 9本件土地の共有持分の取得に要した費用として計上できる金額は、措置法\n． ,\n#..\n..\n≫\n.\n•‘\n3 1条の4 第1項に規定する概算取得費である 1 4 万8500 円（原告の本\n．\n．．\n. 2. ． ． ・ .. ,件土地の共有持分の譲渡に係る譲渡代金 2 9 7 万円の 1 0 0 分の 5 に相当す\nlilる金額）となる。\nウ譲渡費用 9 1 4 0 円上記金額は、原告が平成3 0年分確定申告書に添付した譲渡所得の内訳書\n（土地用）の 3面の「③譲渡費用」欄に記載した金額と同額である （乙 1 の\n・2 .3 枚目）。\n)6( 所得から差し引かれる金額（所得控除額） 7 6 万4970 円上記金額は、原告が平成30 年分確定申告書に記載した「所得から差し引かれる金額」の合計欄に記載した金額と同額である（乙 7・4 枚目の⑲欄）。\n)7( 課税総所得金額 9 1 万3 0 0 0 円上記金額は、前記)3( の総所得金額から前記\n\n\n（6）の所得から差し引かれる金額を控除した金額（ただし、国税通則法（以下＾「通則法」という。） 1 1 8 条 1項により 1 0 0 0 円未満の端数を切り捨てた後のもの。）である。\n)8( 課税分離短期譲渡所得金額 7 万9000 円上記金額は、前記)4( の分離短期譲渡所得の金額と同額（ただし、・通則法 1 1\n`8 条1項により 1000 円未満の端数を切り捨てた後のもの。）である。\n)9{ 課税分離長期譲渡所得金額 2 8 1万2 0 0 円\n、\n上記金額は、前記)5( の分離長期譲渡所得の金額と同額（ただし、通則法1 1 8条 1項により 1000 円未満の端数を切り捨てた後のもの。） である。\n1( 0 算出税額 4 9 万1 1 5 0円上記金額は、次のアないしウの金額の合計額である。\n•ア 課税総所得金額に対する算出税額，4 万5650 円\n．．•••5暑 ヽ . 9 ． . ＼ “ ≫ ,.富 上記金額は、所得税法8 9 条1項により、前記)7( の課税総所得金額（9 1\n.集 .\n．． 畜 會 9 ． ． ~ ● 、 万3000 円）に 1 0 0 分の 5 の税率を乗じて計算した金額である。\nし\n.\n5,~ 9 ・・\n~\n9.ィ ．畔分離短期譲渡所得金額に対する算出税額 2 万3700 円\nー上記金額は、措置法32 条 1項により、前記)8( の課税分離短期譲渡所得の金額 (7 万9 0 0 0 円）の 1 0 0 分の 30 に相当する金額に相当する所得税である。\nウ 諌税分離長期譲渡所得金額に対する算出税額 4 2 万1 8 0 0 円上記金額は、措置法31 条 1 項により、前記)9( の課税分離長期譲渡所得の金額 (2 8 1 万2000 円）の 1 0 0 分の 1 5 に相当する金額に相当する所得税である。\n}.i l 配当控除の金額 4685 円上記金額は、原告が平成30 年分確定申告書に記載した配当控除の金額と同\n25 額である （乙 7 • 4 枚目の⑳欄）。\nU> 政党等寄附金等特別控除の金額 1 万3600 円上記金額は、原告が平成3 0 年分確定申告書に記載した政党等寄附金等特別控除の金額と同額である（乙 7 • 4 枚目の⑳欄）。\n闘差引所得税額 7 万2 8 6 5 円前記囮の金額から、前記(ll)及び 加の各金額を控除した金額である。\ni 1(0 復興特別所得税額 9930 円上記金額は、東日本大震災からの復興のための施策を実施するために必要な財源の確保に関する特別措置法（以下「復興財源確保法」という。） 1 3 条によ万\nり、前記⑬の差引所得税額(4 7 2865 円）に 1 0 0分の 2 . 1 の税率を乗 ，じて計算した金額である。\nti~ 源泉徴収税額 8 万1 4 1 4 円上記金額は、平成30 年分確定申告書に添付の平成30 年分公的年金等の源泉徴収栗及び平成30 年分上場株式配当等の支払通知書に記載された源泉徴収\n．\n． `・ ． ．． :' ・ ・ 税額の合計額であり、平成 30 年分確定申告書において含まれていた特別徴収\n.\na\n・i . 漕\n.i≫,\n..\n・ー．・｀場\n，.\n.・\n.-\n` ‘9暉（住民税額） 2342 円はこれに含まれていない（乙7 • 3 枚目）。\n閥納付すべき所得税等の額 40 万1 3 0 O 円\n5上記金額は、前記⑬の差引所得税額 (4 7万2 8 6 円）及び前記閥の復興特別所得税額（9930 円）の合計から、前記⑮の源泉徴収税額 (8 万 4 1 4円）を差し引いた後の金額（ただし、通則法 1 1 9 条1 項により 1 0 0 円未満の端数を切り捨てた後のもの。）である。\n2 令和元年分の納付すべき所得税の額等\n・ 20\n)1( 配当所得の金額 8 万2686 円上記金額は、原告が令和元年分確定申告書に記載した配当所得の金額ど同額である（乙8・4 枚目の①欄）。\n)2( 雑所得の金額 228 万2360 円上記金額は、公的年金等に係る雑所得の金額204 万 6604 円（令和元年分公的年金等の源泉徴収票に記載された支払金額の合計額 324 万6604 円から公的年金等控除額1 2 0 万円（所得税法3 5 条4 項（平成3 0 年法律 7 号による改正前のもの。）、措置法4 1条の 1 5 の3\n\n\n\n\n\n\n第1 項\n\n\n（平成 年法律7 号による改正前のもの。））を控除した金額）及び生命保険契約等に基づく年金に係る雑所得の金額2 3 万5 7 5 6 円（令和元年分生命保険契約等の年金の支払\n6 調書に記載された支払金額 1 0 3 万3 9 3 6 円から必要経費7 9 万8 1 8 0 円を控除した金額）の合計額である 2 8 万2360 円である（乙 8・4 枚目の\n② •B襴）。\n)3( 総所得金額 .2 3 6 万 5 04 6 円上記金額は、前記)1( 及び)2( の合計金額である。\n)4( 上場株式等に係る譲渡所得の金額 1 6 8 万1 8 8 2 円上記金額は、本件株式の譲渡に係る総収入金額（後記ア）から、取得費（後\n． 記イ）を控除した残額となる（所得税法 3 3 条3項、措置法3 7条の 1 1第1\n．．會．\n．\n....・\n・\n．. 9\n・ ．．鳥\n．\n．項、同 3 7条の 1\n\n\n\n\n\n\n第6 項\n\n\n3号．、同 3 7 条の 1 1第6 項）。\n,・.,...\n．． ・・ ア総収入金額 279 万0 1 S 0 円\n．＂亀・・\n＇ 上記金額は、令和元年分確定申告書に添付された株式取引報告書に記載の\n5とおり、本件株式1 0 4 5 株を単価2670 円にて、令和元年 1 2 月2 日付けで売却した精算金額である（乙2 • 5 枚目）。\nイ 取 得 費 1 1 0 万8268 円上記金額は、令和元年分確定申告書に添付された退会精算書に記載のとおり、平均買付価格 1060. 543 円に 1 0 45 株を乗じた 1 1 0 万8268円 (1 円未満切り上げ）である（乙 2 • 5 枚目）。\n)5( 所得から差し引かれる金額（所得控除額） 9 5 万0970 円上記金額はく原告が令和元年分確定申告書に記載した「所得から差し引かれる金額Jの合計欄に記載した金額と同額である（乙 8..- 4 枚目の⑬欄）。\n)6( 課税総所得金額 1 4 1 万4000 円\n25\n\n上記金額は、前記)3( の総所得金額から同\n\n\n（5）の所得から差し引かれる金額を控除した金額（ただし、通則法 1 1 8条 1項により 1 0 0 0 円未満の端数を切り捨てた後のもの。）である。\n)7( 上湯株式等に係る課税譲渡所得の金額 1 6 8 万1000 円上記金額は、前記)4( の上場株式等に係る譲渡所得の金額と同額（ただし、通\n，則法 1 1 8 条 1項により 1 0 0 0 円未満の端数を切り捨てた後のもの。．）である。\n)8( 算出税額 32 万2850 円上記金額は、次のア及びイの金額の合計額である。\nア 課税総所得金額に対する算出税額 7 万0700 円上記金額は、所得税法8 9 条1項により、前記)6( の課税総所得金額 (1 4\n1 万4000 円）に 100 分の 5 の税率を乗．じて計算した金額である。\nィ 上場株式等に係る課税譲渡所得の金額に対する算出税額 2 5 万 2 1 5\n.\n・\n9 , • . .\n・ \" ー\n5 、● ≫ ‘\n・ り\n3 ' ． ｀\n＂\n• . ． ≪ \" ^. ．．\n\".\n•\n．．疇\n、 場\n”\n・\n9 5 o A 円 上記金額は｝措置法3 7条の 1 1第 1項により、前記)7( の上場株式等に係\n●‘\n． \" る課税譲渡所得の金額（ 1 6 8 万1 0 0 0 円）の 1 0 0 分の 1 5 に相当する金\nー\n..額に相当する所得税である。\n)9( 配当控除の金額 8 2 6 9 円上記金額は、前記)1( の配当所得8 万2 6 8 6 円に 100 分の 1 0 （所得税法\n9 2条1項1号イ）を乗じた8269 円である （乙8・4 枚目の⑳B 欄）。\n20 •1 (0 政党等寄附金等特別控除の金額 1 万3600 円 い！上記金額は、令和元年分確定申告書に記載した政党等寄附金等特別控除の金攣~\n，額と同額である （乙 8 • 4 枚目の⑳ • B 欄）。\n)11( 差引所得税額 30 万0 9 8 1円前記)8( の金額から、前記)9( 及び囮の各金額を控除した金額である。\n)21( 復興特別所得税額 6 ・3 2 0 円\n26\n\n上記金額は、復興財源確保法 1 3条の規定により、前記⑪の差引所得税額（3\n0 万0 9 8 1 円）に 1 0 0 分の.2 1 の税率を乗じて計算した金額である。\n万闘源泉徴収税額 1 1 5 5 2 7 円上記金額は、本件令和元年分確定申告書に添付の令和元年分公的年金等の源泉徴収票及び令和元年分上場株式配当等の支払調書に記載された源泉徴収税額\n•• 5の合計額である（乙8. g枚目）。\n)41( 納付すべき所得税等の額 1 9 万1 7 0 0 円上記金額は、前記(1即滋男用湘拷樟員（ 36 万°98 l 円）及ぴ前記⑫の復興特別所得税額（6 3 2 0 円）の合計から、前記U即の源泉徴収税額（ 1 1万5527円）を差し引いた後の金額（ただし、通則法1 1 9 条1項により 1 0 0 円未満の端数を切り捨てた後のもの。）である。 •\n．．．． 3 本件各更正処分が適法であること\n．．\n．．．.. .\n．．．． 以上のとおり、適正に算定した原告の平成30 年分及び令和元年分における納\n．．．．．\n ·•\n．． 付すべき所得税等の額は、それぞれ平成.3 0.年分が40 万1 3 0 0 円、令和元年分が 1 9 万1 7 0 0 円であるところ、当該各金額は、本件各更正処分における納\n5l付すべき所得税等の額（別表 1の「更正決定等」の「所得税等の納付すべき税額」\n襴）といずれも同額である。\nしたがって、本件各更正処分は、いずれも適法である。\n• 第 2 ． 本件各賦課決定処分の適法性\n1 本件各賦鰈決定処分の根拠幻\n前記第 1 のとおり、本件各更正処分はいずれも適法であるところ、本件各更正処分により原告が新たに納付すべきこととなった税額の計算の基礎となった事実のぅちに、本件各更正処分前の税額の計算の基漢とされていなかったことについて、通則法6 5 条4 項 1 号に規定する「正当な理由」があると認められるものはなしヽ。\n｀ 、 .ししたがって、本件各更正処分に伴って原告に課されるべき本件各年分の過少申告加算税の額は、次の)1( 及び)2( のとおり、それぞれ平成3 0 年分が 6000 円、\n令和元年分が 1 万3000 円である。\n)1( 平成30 年分 6000 円\n・\n’上記金額は、通則法6 5条 1項及び復興財源確保法24 条4 項の規定に基づき、平成3 0年分更正処分により原告が新たに納付すべきこととなった平成3\n0 年分の所得税等の額6万4 2 0 円（甲1' の1枚目「本税の額」欄）について、通則法 1 1 8 条3 項及び復興財源確保法24 条6 項の規定により 1 万円未満の端数を切り捨てた後のものに 1 0 0 分の 1 0 の割合を乗じて算出した金額である。\n1\n)2( 令和元年分 万3000 円上記金額は、通則法6 5 条1 項及び復興財源確保法24 条4 項の規定に基づ\n． ． ． ． ． ． ．. ~ ~ 9 . 、 ． , ” ． ． 9 ' , ． ． . ． .. ● 9 , • 分\nきの\n、\n所令\n得和\n税元\n等年\nの分\n額更正処\n3 万分によ\nり原円\n告\n（が\n甲新\nたの\nに納\n枚付\n目す\n「べ\n本き\n税こ\nのと\n額」\nと欄\nな\n）\nっに\nたつ\n令い\n和て\n元\n、\n年\n‘\n• ，\n.\n，．ゞ\n.通則法 1 1 8 条 3 項及び復興財源確保法2 4 条 6 項の規定により 1 万円未満の端数を切り捨てた後のものに 100 分の 1 0 の割合を乗じて算出した金額である。\n本件各賦課決定処分が適法であること以上のとおり、適正に算定した原告の平成30 年分及び令和元年分の所得税等\n,C ’-に係る過少申告加算税の額は、前記 1 のとおりであるところ、当該各金額は、本\n20 '件各賦課決定処分における過少申告加算税の額（乙 7 及び乙8 の 枚目「過少申告加算税」欄）と、いずれも同額である。\nしたがって、本件各賦課決定処分は、いずれも適法である。\n\n\n\n\n\n\n第3 本件各通知処分の適法性原告は\n\n\n、処分行政庁に対し、平成30 年分については、本件各持分の譲渡によ四\n\n\nる譲渡所得が分離課税の対象ではなく、総合課税の対象であることを理由として、\n\n\n令和元年分については、源泉徴収税額の計上漏れを理由として、それぞれ更正の請求をした。\n\n\nしかしながら、平成30 年分更正の請求について、本件各持分の譲渡による譲渡所得は分離課税の対象となるから、平成30 年分更正の請求には理由がない。\n\n\nまた、令和元年分更正の請求について、原告が計上漏れとした源泉徴収税額は認められるが、本件株式の譲渡による麟渡所得に関しては、原告が令和元年分確定申告書において計算した総合課税の対象ではなく、分離課税の対象となり、計算の結果、令和元年分の所得税等の納付すべき税額が令和元年分確定申告書に記載された額より過大となることから、理由が：よい。\n\n\nしたがつて、本件各通知処分はいずれも適法である。\n\n\n以 上\n\n\n．\n\n\n．．．． ．\n\n\n.\n\n\n．\n\n\n..\n\n\n．\n\n\n.\n\n\n． ．． ．\n\n\n....．．.．．．\n\n\n．．別表 1\n\n\n;9所得税等に係る課税処分等の経緯\n\n\nヽ平虞30 年分：\n\n\n•．，が 9 -ら ,•. ・ . PL ・ ヽ’ •s．●●ァ・．： → ＿_ .. > :.. •9. -— ·.•・ ．．．．．：．．，と．．9 9 ,•,.. !IR_.-.,t ぇ r ？円ふ区 分 ―' 竿月‘、日`: 緯所得金額 所分葦鬱箪わ讀・麟傘額裟 ，分 離長期譲濠，＇ 納所付得す税べ攀きの税\n\n\n...., ,.,,・呵 ．所得．ーの金額... 額傘 ］ , ·•・-． 24:\n\n\n9 •-.．囀.,・: ・: :・．;;：： て・・．．：•\n\n\n~ . •-\n\n\n:\n\n\n． マ ．\n\n\n:\n\n\n．ー\n\n\n;・: . -ヽ i;'\n\n\n： 蘊定申告• ， 平成~l年’‘ 2月‘‘4日 • ,1 ,876 79~, ,, 027 ,2 81,-2 360 i ,153 000\n\n\n、i ？ (m 暉内） ，9 ハ｀ ヽ ： 9 ：: r ,. 。-. 、.,\n\n\n•ャ｀、 定訂正申後 平成13 年 2月・ 1日 1, 678 `, 7.9,6 ; ' ,?4 20,、7 \" , 2 ,284 3; ~37,100\n\n\n＇，訊 ，襲：．・!¥ ,} 凡 べ i\n\n\n.•、. ―- J+ +•• u .. 9..:. \",.,， .-.' < , . ' t ,.99 し•. ••… ―·ご―:.. ．!\n\n\n；凸更正の請求 ＇令和 3年 4月 9日 2, ,096 98~ :_• t 0 ．△ 4 301\n\n\n:.. y ' ': •• - .・,.. ~ i こ ,... “ :. ヽ ,~ ,_-· ~ , ふ\".”..'. : •:·•一: -.., - ー・ •• ・•- ・ '・. •. ,,;,』 ； ｀ぃ・ • • • - . - : -•- ・”\n\n\n••9 -年i6\n\n\n・通知姐分令和 3 月22日く更正をすべき遷由がない冒の通知1\n\n\n' ； ' • 、 . 、 ， ,.・ と ； ・:”・●← し・ ' ハ•， ”.囀 ・・ ..，・ ・ ’，・・. : ．'ー ・” ．. ＂ …—更正決定響令和.3~年 9 01 月52 '日 ； 1 ．;^ 597,8 76 79.665 .218.2 1t3. 0' • ,104 3切\n\n\n・,-.\n\n\n'、¥ ←- ・- 9 r`. ~ · , \": . 9 共 ' .•ー ,. ,,・\"·-.~• 曹 ＾.・・ • • ·..• .,`‘'• , ●.●『 ` ..• •一ー：`\n\n\n`'審査諭求 ，令和 3年11 月 1B 更王をすぺき運国がない旨の通知処分の取消し\n\n\n;,'•... • ・---, ':j; -•.• `：で な .．．.｀.. , •—:...: ::::~... :,..．デ＾．●-•＿二．＿ ―：•: ••• -・ ,.,.,- ・，- ．．：：-,-....- ;,;・，—•-::: •, •. :.”•.. -~今 ••> •.•• :\n\n\n・：. ?審. 査疇t.＇・求 ^ d. i . :. , i;令..和 3年. 1_1月‘8日: `9 -..: “ 9 ．→こ-． ・. ●. .更. .正・・ - ~ .- I 決-g 定.••. ,•・ 疇..-の螂....,. ..,.取. ..請 ...,し.. ュ・. • •• •. •• `..\n\n\n・ 9 •’ •• !•. ~` 1 •I •‘••’-•• \".;戴 決 ‘令和 4年 6月B82 • 棄 却\n\n\n．．： ，；\n\n\n’● ● ● ‘ , ` ,● ， ● ● ● ● ,\" .. , , ， ● ' 2 9 \". ● ・ . ． ・・ ． ． t ‘ 、 .. 0 , 9 ：． 令 ． 和 ．．，．、 . 元 ．． ,'≫ 区 ユ 年 .・ ， . • .. 分 . 分 .・・＇一 ・ ， . ， ・ C, ？ . ． . • ・・ ¢. ロ .9 マ 下 . ー：， ~こ~”:~·9 年 ‘ ,. ふ ― 月 f J^. ' e ，~・· ~. ・ ” • ← . ； , • ・ - .., y •• ・ー 麟 ゃ： ‘< 一 ・、:“.1.、▼ ・• ’\"....—• \"• ．， 9 ．．と．．：．． そ・ 納 \"• • ‘ . ‘ 所 . 付 '. : 9 得 - す , I 停 税 ' べ 攀 • き ↓ 鍼 の . 税 ，i , , 額 9 ・ ｀ 9 ”‘ 9_ ‘ 19 ` ．；鐘 ．、定 申 告，． 令和 年 ,16\n\n\n,866,2 0 .;’\n\n\n‘•I~（ 絹＿\n\n\nヽ '.・更正の請求 令和 3年 '3月 61 日 △ 63998! ’\n\n\n-ヽ--’・\n\n\nヽ通 知 処 分 令和 3年、01 月 22 日 更正をすぺき遅由がない旨の遍知・\n\n\n9 ~. ~•9 ,・ ”’ • \"\".-.- -\"-.. '\"\" •...\n\n\n｀ ム更正決定攀 、令和 3年 01 月'26 日： 2; .563 007,191\n\n\n，．\n\n\n．．．．．．．．．、．↓．．．.．． 、\n\n\nI l審 査・繭求 令和 3年 11 月 1B 更正をすべき運由がない旨の遍知処分の取渭し ・・審 査 請 求 令和 3年 ll 月 71 日 l: 更正決定鑢の一錦歌渭し ．••\n\n\n9. -~ i 7 □ ”,- ・’: _;.~:.•:- ~~ ..~ l ＿ー―こ：i ～•-ら： •— - --j. ..—: :..• •• • • .-. .-: ..:.-. 1• •一：．．、］一·.. ~ ● ^ · 9 •··· . ·· . · ·· . · • .戴 決 令和 μF 6月 82 日 棄 却\n\n\nf I別表2\n\n\n1 分離短期 - 譲 ・' 渡所得の金額 ヽ ..._ - .. ・・｀.＇償 ▼ 砥 ヽ．：,•印- .\n\n\n..-' ..,:. ヽ ~ ●ー. ” •\n\n\nI •項、-, 目 9--`. ．9 - ”.'. ，平 ,.• 蹟 が成定 ． 3 、 0 申年分告， て : • 更正 , 処 分 ”・分離短期鵬渡所得に係る総収入金額 ① .. 磁，9 競 ・り｀・→・9 059,0 OL OO\n\n\n① に係る取得費の金 額 、 ，~▼ヽ\"'\"'\"' 、9 ② . , : 533,214 •. . ' 533,214 :\n\n\n①に係る譲渡費用の金額 T ．． ｀；9③~ .~,.． ．．．＾.← , ・ - 8,60 ., 0 . ,` —•' ”’\"、 \" . ．ご8 9 ・，6Q.O分離短絹麟攀所得の金額（①―②―③) ’④ r^ ヽ 24’’0,`‘ 72 ]: m•.\" ,97 560鼻｀ 曹 し・ k. •-\n\n\nヽ~\n\n\n:2 分、・.離長期璽 ；， ~• 渡 ・▼ 所得の金額 、≫. ‘ ．・・ ・ 、 : 一， 平成., し、 9 3 ・9 含. -- 9 -.• -- :••`i ーシ 。（単 , 位 . t皿 ＇\n\n\n．，項 目 ,.. 、 。王•9年 ー更正処分\n\n\n， 分 ． ， 離長 期繭渡 ・ー 所 :'ロ- 得 -• に係 .•→‘·: る .卜· • 総 4. 収 ； 入金額 ’ . ① '. • ， . 確 . ， 9 』 定＾ ・2 79 ;o -0. p 0' 0• , ‘ • '. .:'.; : .- •• 000,079,2 ．;．＾、．． 口と： ＂••: . 「 •9 i\n\n\n②ーワ， ｀ ' 5 ; ヽ~\n\n\n①に係る取得費の金額 、・ ••、. ・、，｛ 』 ` ： ‘ 874 . i o :. i ： 148 ，ヨ 05 ＇Q ；、ヽ\n\n\n①に係る麟震費用の金額 F,―•'• ＇一③＿＇ 尋．~． ．▼ , 9¢41 ヽ., 9,1ヽ•4 •0\n\n\n§分離長期麟約形じの金額（①-② :. ：③） ④ ―ー，＂ん―｀ . ＾＂ ＂▲ /••, 2, 063,284 . ,,-~ .,・. & ,218 ｀ぅ o63\n\n\n·- ,·· •』 t、\n\n\n3 上場株式等の論濃爾得の金額 —•\" ・・\n\n\n•,\n\n\n~・ .、 ・ ほ 匹．．阿 ，\n\n\n”\n\n\n＇ 項 目 ． ； 百 元、申年魯 更正処分 •\n\n\n...\n\n\n:: /・総合貶期麟渡所得に係る総収入金額’・・， ①.,— ;297 05l.A 0\n\n\n”. -....^ •,\n\n\n• : ・，・．に係も取得費 ‘• 一， ＾ ＇ ，9、 ． ② .—- 1;螂，50・2 e ’ 釘 q ， ’\n\n\n， 幽合長 ＇~， ．＇に係る所得金 ：ー・③ iー一，．、 謳匹~ -、\n\n\n9. 9拿旦叫知む疇の畠日荀所得に係る、総隕じし鉦額 ，④『 ,＇ ·:、~` .0~しー、＂\n\n\n＆穴凧I随\n\n\n9 ,. ,801\n\n\n，・． ④に係る取得費 `` , R 9' ．ヽ い・ 、 ` ,,l ●団 852\n\n\nw. ^ •\n\n\n⑥上割和這釧範幻輝の金韻＾（④—⑤) ，一~ ．見1，郎し，マ· ，•て一．乞 ”ー裏 。＞ ・ •"
}