{
  "number": "13873",
  "title": "消費税及び地方消費税更正処分等取消請求事件",
  "court": "東京地方裁判所",
  "date": "令和５年８月２２日",
  "date_iso": "2023-08-22",
  "result": "取消",
  "topics": [
    "消費税"
  ],
  "laws": [
    "国税通則法65条"
  ],
  "keywords": [
    "地方消費税",
    "損害賠償",
    "更正の請求",
    "更正処分",
    "決定処分",
    "消費税",
    "賦課決定",
    "過少申告加算税"
  ],
  "sections": {
    "主文": [
      "１ 本件訴えのうち、芝税務署長が、令和３年１月２６日付けで原告に対してした、平成２７年４月１日から平成２８年３月３１日まで、平成２８年４月１日から平成２９年３月３１日まで、平成２９年４月１日から平成３０年３月３１日まで及び平成３０年４月１日から平成３１年３月３\n１日までの各課税期間の消費税及び地方消費税に係る各更正の請求に対する更正をすべき理由がない旨の各通知処分の取消しを求める部分をいずれも却下する。\n２ 原告のその余の請求をいずれも棄却する。\n３ 訴訟費用は原告の負担とする。"
    ]
  },
  "full_text": "13873 消費税及び地方消費税更正処分等取消請求事件 - 国税庁判決事例集\n\n\n\n\n\n\n\n\n\n\n目次に戻る\n\n\n\n\n判決 13873\n\n\n消費税及び地方消費税更正処分等取消請求事件\n\n\n\n\n裁判所:\n 東京地方裁判所\n\n\n判決日:\n 令和５年８月２２日\n\n\n結果:\n 取消\n\n\n\n\n\n\n主文\n\n\n１ 本件訴えのうち、芝税務署長が、令和３年１月２６日付けで原告に対してした、平成２７年４月１日から平成２８年３月３１日まで、平成２８年４月１日から平成２９年３月３１日まで、平成２９年４月１日から平成３０年３月３１日まで及び平成３０年４月１日から平成３１年３月３\n１日までの各課税期間の消費税及び地方消費税に係る各更正の請求に対する更正をすべき理由がない旨の各通知処分の取消しを求める部分をいずれも却下する。\n２ 原告のその余の請求をいずれも棄却する。\n３ 訴訟費用は原告の負担とする。\n\n\n\n\n\n\n第１ 請求\n\n\n１ 芝税務署長が、令和２年５月２９日付けで原告に対してした、平成２６年４月１日から平成\n２７年３月３１日までの課税期間の消費税及び地方消費税に係る更正処分のうち納付すべき消費税の額１億６０４１万３４００円を超える部分及び納付すべき地方消費税の譲渡割額４\n９４３万０８００円を超える部分並びに同更正処分に伴う過少申告加算税の賦課決定処分をいずれも取り消す。\n２ 芝税務署長が、令和２年５月２９日付けで原告に対してした、平成２７年４月１日から平成\n２８年３月３１日までの課税期間の消費税及び地方消費税に係る更正処分（ただし、令和４年３月２８日付けの同課税期間の消費税及び地方消費税に係る更正処分による一部取消後のもの）のうち納付すべき消費税の額マイナス５億４１９８万３０８０円及び納付すべき地方消費税の譲渡割額マイナス１億４６２４万６１０６円を超える部分並びに同更正処分に伴う過少申告加算税の賦課決定処分をいずれも取り消す。\n３ 芝税務署長が、令和２年５月２９日付けで原告に対してした、平成２８年４月１日から平成\n２９年３月３１日までの課税期間の消費税及び地方消費税に係る更正処分のうち納付すべき消費税の額３億３２４０万１０００円及び納付すべき地方消費税の譲渡割額８９６９万６３\n００円を超える部分並びに同更正処分に伴う過少申告加算税の賦課決定処分をいずれも取り消す。\n４ 芝税務署長が、令和２年５月２９日付けで原告に対してした、平成２９年４月１日から平成\n３０年３月３１日までの課税期間の消費税及び地方消費税に係る更正処分のうち納付すべき消費税の額マイナス８７３１万１９６９円及び納付すべき地方消費税の譲渡割額マイナス２\n３５５万９９９５円を超える部分並びに同更正処分に伴う過少申告加算税の賦課決定処分をいずれも取り消す。\n５ 芝税務署長が、令和２年５月２９日付けで原告に対してした、平成３０年４月１日から平成\n３１年３月３１日までの課税期間の消費税及び地方消費税に係る更正処分のうち、納付すべき消費税の額マイナス４億３３２２万９７８２円及び納付すべき地方消費税の譲渡割額マイナス１億１６９０万３２５６円を超える部分並びに同更正処分に伴う過少申告加算税の賦課決定処分をいずれも取り消す。\n６ 芝税務署長が、令和３年１月２６日付けで原告に対してした、平成２７年４月１日から平成\n２８年３月３１日までの課税期間の消費税及び地方消費税に係る更正の請求に対する更正をすべき理由がない旨の通知処分を取り消す。\n７ 芝税務署長が、令和３年１月２６日付けで原告に対してした、平成２８年４月１日から平成\n２９年３月３１日までの課税期間の消費税及び地方消費税に係る更正の請求に対する更正をすべき理由がない旨の通知処分を取り消す。\n８ 芝税務署長が、令和３年１月２６日付けで原告に対してした、平成２９年４月１日から平成\n３０年３月３１日までの課税期間の消費税及び地方消費税に係る更正の請求に対する更正をすべき理由がない旨の通知処分を取り消す。\n９ 芝税務署長が、令和３年１月２６日付けで原告に対してした、平成３０年４月１日から平成\n３１年３月３１日までの課税期間の消費税及び地方消費税に係る更正の請求に対する更正をすべき理由がない旨の通知処分を取り消す。\n\n\n\n\n\n\n第２ 事案の概要等\n\n\n１ 事案の概要本件は、不動産の売買等を目的とする株式会社である原告が、平成２７年３月課税期間（平成２６年４月１日から平成２７年３月３１日までの課税期間をいい、他の課税期間についても同様に表記する。）から平成３１年３月課税期間までの各課税期間（以下「本件各課税期間」\nという。）において、転売目的で、全部又は一部が住宅として賃貸されている建物の購入（以下「本件各課税仕入れ」という。）をし、本件各課税仕入れに係る消費税額の全額を当該課税期間の課税標準額に対する消費税額から控除して消費税及び地方消費税（以下併せて「消費税等」という。）の確定申告（以下「本件各確定申告」という。）をしたところ、処分行政庁\n（芝税務署長をいう。以下同じ。）から、その全額を控除することはできないとして更正処分\n（以下「本件各更正処分」といい、各課税期間に対応した本件各更正処分を「平成２７年３月課税期間更正処分」等という。）及びこれに伴う過少申告加算税の賦課決定処分（以下「本件各賦課決定処分」といい、本件各更正処分と併せて「本件各更正処分等」という。）を受け、\nまた、平成２７年３月課税期間以外の本件各課税期間について原告が本件各課税処分のうち争う部分のみが取り消された場合の税額相当額を「更正の請求金額」とする更正の請求（以下「本件各更正の請求」という。）をしたところ、処分行政庁から、更正をすべき理由がない旨の通知処分（以下「本件各通知処分」という。）を受けたことから、被告を相手に、本件各更正処分（ただし、平成２８年３月課税期間更正処分については令和４年３月２８日付けの同課税期間の消費税等に係る更正処分による一部取消後のもの）のうち申告額を超える部分及び本件各賦課決定処分の取消しを求める（前記第１の１ないし５の各請求）とともに、本件各通知処分の取消しを求める（同６ないし９の各請求）事案である。\n２ 関係法令の定め\n\n\n（１）消費税法（昭和６３年法律第１０８号）\nア 消費税法３０条（平成２７年９月３０日以前に行った課税仕入れについては同年法律第\n９号による改正前のもの、同年１０月１日以後に行った課税仕入れについては平成２４年法律第６８号３条による改正前のもの。以下同じ。）１項１号は、事業者が国内において行う課税仕入れについては、当該課税仕入れを行った日の属する課税期間の課税標準額に対する消費税額から、当該課税期間中に国内において行った課税仕入れに係る消費税額を控除する旨を規定する。\nイ 消費税法３０条２項１号は、当該課税期間における課税売上高が５億円を超える場合又は当該課税期間における課税売上割合（当該課税期間中に国内において行った資産の譲渡等の対価の額の合計額のうちに当該課税期間中に国内において行った課税資産の譲渡等の対価の額の合計額の占める割合として政令で定めるところにより計算した割合をいう〔同条６項〕。）が１００分の９５に満たない場合において、当該課税期間中に国内において行った課税仕入れにつき、課税資産の譲渡等にのみ要するもの（以下「課税対応課税仕入れ」\nという。）、課税資産の譲渡等以外の資産の譲渡等（以下「その他の資産の譲渡等」という。）にのみ要するもの（以下「非課税対応課税仕入れ」という。）及び課税資産の譲渡等とその他の資産の譲渡等に共通して要するもの（以下「共通対応課税仕入れ」という。）\nの区分（以下「用途区分」という。）が明らかにされているときは、控除する課税仕入れに係る消費税額（以下「控除対象仕入税額」という。）は、同条１項の規定にかかわらず、\n課税対応課税仕入れに係る消費税額に、共通対応課税仕入れに係る消費税額に課税売上割合を乗じて計算した金額を加算する方法（以下「個別対応方式」という。）により計算した金額とする旨を規定する。\nウ 消費税法３０条３項本文は、個別対応方式による場合において、課税売上割合に準ずる割合で、当該事業者の営む事業の種類等に応じ合理的に算定されるものであって、かつ、\n所轄の税務署長の承認を受けたものがあるときは、当該課税売上割合に代えて、当該割合\n（以下単に「課税売上割合に準ずる割合」という。）を用いて控除対象仕入税額を計算する旨を規定する。\n\n\n（２）国税通則法（昭和３７年法律第６６号。以下「通則法」という。）\nア 通則法６５条（本件各課税期間のうち平成２８年３月課税期間以前については同年法律第１５号による改正前のもの、それ以外の課税期間については令和２年法律第８号による改正前のもの。以下同じ。）１項は、期限内申告書が提出された場合において、更正があったときは、当該納税者に対し、その更正に基づき納付すべき税額に１００分の１０の割合を乗じて計算した金額に相当する過少申告加算税を課する旨を規定する。\nイ 通則法６５条２項は、同条１項の規定に該当する場合において、同項に規定する納付すべき税額が、その国税に係る期限内申告税額に相当する金額と５０万円とのいずれか多い金額を超えるときは、同項の過少申告加算税の額は、同項の規定にかかわらず、同項の規定により計算した金額に、当該超える部分に相当する税額に１００分の５の割合を乗じて計算した金額を加算した金額とする旨を規定する。\nウ 通則法６５条４項（１号に係る部分に限る。ただし、本件各課税期間のうち平成２８年\n３月期課税期間以前については同年法律第１５号による改正前の同項。以下、同改正の前後を通じて「通則法６５条４項」という。）は、同条１項又は２項に規定する納付すべき税額の計算の基礎となった事実のうちに、その更正前の税額の計算の基礎とされていなかったことについて正当な理由があると認められるものがある場合には、これらの項に規定する納付すべき税額からその正当な理由があると認められる事実に基づく税額を控除して、\nこれらの項の規定を適用する旨を規定する。\n３ 前提事実（争いのない事実、顕著な事実並びに掲記の証拠及び弁論の全趣旨により容易に認められる事実）\n\n\n（１）原告の事業内容等ア 原告は、昭和４４年６月●日に設立された、不動産の売買、賃貸借、仲介等を目的とする株式会社であり、Ｅ市場に上場している。（乙２）\nイ 原告は、不動産に関する事業として、「レジデンシャル事業」（新築マンション、新築一戸建て、リノベーションマンションの販売等）及び「ソリューション事業」（投資用不動産の販売等）等（以下「本件各事業」という。）を行っているところ、前者においては、\n賃借人がいる中古マンションの居室（区分所有建物）を購入し、賃借人が退去した後に専有部の内装工事等を行って資産価値を高めた上で居住希望者に売却するというビジネスモデルが採用され、後者においては、中古マンション１棟を購入し、取得後に共用部の修繕工事及び専有部の内装工事等や賃貸募集活動等を行って稼働率や収益性を高めた上で投資家に売却するというビジネスモデルが採用されている。（甲７、８）\n\n\n（２）本件各課税仕入れ原告は、本件各課税期間において、上記の各ビジネスモデルに基づき、将来における転売を目的として、複数の中古マンション（１棟又はその一部を構成する区分所有建物。以下\n「本件各建物」という。）を購入した（本件各課税仕入れ）。\n本件各建物は、いずれも、本件各課税仕入れが行われた日（以下「本件各仕入日」という。）の時点において、その一部又は全部が住宅として賃貸されていたものであり、原告は、\n本件各建物の購入によって賃貸人たる地位を承継し、本件各建物を転売するまでの間、賃借人から賃料を収受していた。（甲２の１ないし５、乙３ないし５）\n\n\n（３）本件各確定申告原告は、本件各課税期間の消費税等について、個別対応方式で控除対象仕入税額を計算することを選択した上で、本件各課税仕入れを課税対応課税仕入れに区分すべきであるとして、\n本件各課税仕入れに係る消費税額の全額を課税標準額に対する消費税額から控除して、別表\n３の「確定申告」欄記載のとおり、法定申告期限までに、本件各確定申告をした。（甲１の\n１ないし１０）\n\n\n（４）本件各更正処分等処分行政庁は、本件各課税仕入れは共通対応課税仕入れに区分すべきであるから、課税標準額に対する消費税額から控除することができるのは本件各課税仕入れに係る消費税額に本件各課税期間における課税売上割合を乗じた金額にとどまるなどとして、令和２年５月２９日付けで、原告に対し、別表３の「①更正処分」欄記載のとおり、本件各更正処分等をした。\n（甲２の１ないし５）\n\n\n（５）審査請求原告は、令和２年８月１８日付けで、本件各更正処分等を不服として、別表３の「①に対する審査請求」欄記載のとおり、国税不服審判所長に対して審査請求をした。（乙６）\n\n\n（６）本件各更正の請求原告は、令和２年１０月２８日、処分行政庁に対し、本件各課税期間のうち更正期限を経過した平成２７年３月課税期間を除く本件各課税期間について、本件各課税仕入れは共通対応課税仕入れではなく課税対応課税仕入れに区分されるとして、本件各更正の請求をした。\n（甲３の１ないし４）\n\n\n（７）本件各通知処分処分行政庁は、令和３年１月２６日付けで、本件各更正の請求に対し、その更正をすべき理由がない旨の本件各通知処分をした。（甲４の１ないし４）\n\n\n（８）本件訴訟の提起等国税不服審判所長は、上記\n\n\n（５）の審査請求がされた日の翌日から起算して３か月を経過しても裁決をせず、原告は、令和３年６月２５日、裁決を経ることなく本件訴訟を提起した。\n\n\n（９）再更正処分処分行政庁は、平成２８年３月課税期間に係る地方消費税の譲渡割額のうち還付額の金額に誤りがあったとして、令和４年３月２８日付けで、原告に対し、別表３の「本件再更正処分」欄記載のとおり、更正処分（以下「本件再更正処分」という。）をした。（乙１１）\nなお、本件再更正処分は、除斥期間を経過した後に行われたものであるが、原告は、その効力を争わず、同処分の効力が生じていることを前提に請求の減縮をした（前記第１の２参照）。\nまた、以下、特に断らない限り、平成２８年３月課税期間更正処分は、本件再更正処分による一部取消し後のものをいい、これを含めたものを本件各更正処分又は本件各更正処分等という。\n４ 争点\n\n\n（１）本案前の争点本件各通知処分の取消しを求める利益の有無（争点１）\n\n\n（２）本案の争点ア 本件各更正処分の適法性に関し本件各課税仕入れの用途区分（争点２）\nイ 本件各賦課決定処分の適法性に関し通則法６５条４項にいう「正当な理由」の有無（争点３）\n５ 争点に関する当事者の主張争点に関する当事者の主張の要旨は、別紙２記載のとおりである。また、被告が主張する本件各更正処分等に係る課税の根拠及び計算は、別紙３記載のとおりであるところ、原告は、\n上記４において争点となっている点を除き、これを争うことを明らかにしていない。なお、\n別紙２で定義した略語は、本文においても用いる。\n\n\n\n\n\n\n第３ 当裁判所の判断\n\n\n１ 争点１（本件各通知処分の取消しを求める利益の有無）について\n\n\n（１）原告は、本件訴えにおいて、本件各更正処分等の取消しを求める（前記第１の１ないし５の各請求）とともに、本件各通知処分の取消しをも求めている（同６ないし９の各請求）ところ、後者に係る訴えの利益について争いがある。\n\n\n（２）そこで検討するに、本件各更正処分は、いわゆる増額更正処分であるところ、増額更正処分及び通知処分は、手続的には別個独立の処分ではあるものの、いずれも消費税等の納税義務の確定に関する処分である。そして、通知処分は、申告に係る税額の減額のみに関わるのに対し、増額更正処分は、課税の要件に係る事実を全体的に見直し、申告された税額を含めて納税者の納税額の総額を確定するものであり、実質的には申告に係る税額を減額しないという趣旨も含むものであるから、両処分が同一の消費税等の納税義務についてされた場合、\n増額更正処分の内容は、通知処分の内容を包摂する関係にあるということができる。\nそうすると、同一課税期間の消費税等について両処分がされた場合において、その税額等を争おうとする納税者は、増額更正処分の取消訴訟において、通知処分の違法も併せて主張することにより、更正の請求に係る税額を超える部分の取消しを求めることが可能であると解される。\n\n\n（３）以上によれば、本件各通知処分については、その取消しを求める利益はないから、本件訴えのうち本件各通知処分の取消しを求める部分は、訴えの利益を欠く不適法なものとして却下すべきである。原告は、種々の主張をするが、いずれも上記の結論を左右するものではない。\n２ 争点２（本件各課税仕入れの用途区分）について\n\n\n（１）消費税法は、生産、流通等の各段階で二重、三重に税が課されて税負担が累積することを防止し、経済に対する中立性を確保するため（税制改革法１０条２項）、課税期間中に行った課税仕入れに係る消費税額を当該課税期間の課税標準額に対する消費税額から控除するものとしている（消費税法３０条１項〔１号に係る部分に限る。〕）。もっとも、同法は、所定の場合において当該課税期間中に行った課税仕入れにつき用途区分が明らかにされていないときは、課税仕入れに係る消費税額に、課税売上割合、すなわち、課税期間中の所定の売上げの総額に占める課税資産の譲渡等に係る売上げの割合を乗じて計算する方法により控除対象仕入税額を計算するものとし（同条２項〔２号に係る部分に限る。〕）、また、帳簿及び請求書等の保存がない場合には原則として当該課税仕入れに係る消費税額の控除を認めないものとする（同条７項）など、課税の明確性の確保や適正な徴税の実現といった他の目的との調和を図るため、税負担の累積が生じても課税仕入れに係る消費税額の全部又は一部が控除されない場合があることを予定しているものということができる。\nそして、個別対応方式により控除対象仕入税額を計算する場合において、税負担の累積が生ずる課税資産の譲渡等と累積が生じないその他の資産の譲渡等の双方に対応する課税仕入れにつき一律に課税売上割合を用いることは、課税の明確性の確保の観点から一般に合理的といえるのであり、課税売上割合を用いることが当該事業者の事業の状況に照らして合理的といえない場合には、課税売上割合に準ずる割合を適切に用いることにより個別に是正を図ることが予定されているものと解されることにも鑑みれば、課税資産の譲渡等とその他の資産の譲渡等の双方に対応する課税仕入れは、当該事業に関する事情等を問うことなく、共通対応課税仕入れに該当すると解するのが消費税法の趣旨に沿うものというべきである。このように解することは、課税仕入れを課税資産の譲渡等「にのみ」要するもの（課税対応課税仕入れ）、その他の資産の譲渡等「にのみ」要するもの（非課税対応課税仕入れ）及び両者\n「に共通して」要するもの（共通対応課税仕入れ）に区分する同条２項１号の文理に照らしても自然であるということができる。\nそうすると、課税対応課税仕入れとは、当該事業者の事業において課税資産の譲渡等にのみ対応する課税仕入れをいい、課税資産の譲渡等のみならずその他の資産の譲渡等にも対応する課税仕入れは、全て共通対応課税仕入れに該当するものと解するのが相当である（最高裁令和●●年（○○）第●●号同５年３月６日第一小法廷判決・裁判所時報１８１１号６頁参照）。\n\n\n（２）前記第２の３の前提事実\n\n\n（２）によれば、本件各課税仕入れは原告が転売目的で本件各建物を購入したものであるが、本件各建物はその購入時から全部又は一部が住宅として賃貸されており、原告は、転売までの間、その賃料を収受したというのである。そうすると、原告の事業において、本件各課税仕入れは、課税資産の譲渡等である本件各建物の転売のみならず、その他の資産の譲渡等である本件各建物の住宅としての賃貸にも対応するものであるということができる。\nよって、本件各課税仕入れは、その原告の事業における位置付けや原告の意図等にかかわらず、共通対応課税仕入れに該当するものというべきである。\n\n\n（３）以上によれば、本件各課税仕入れに係る控除対象仕入税額は、本件各課税仕入れに係る消費税額の全額ではなく、これに課税売上割合を乗じて計算した金額となるものというべきである。原告は、種々の主張をするが、いずれも上記の結論を左右するものではない。\n\n\n（４）以上を前提とすると、原告が本件各課税期間について納付すべき消費税額及び地方消費税の譲渡割額は、別紙３の１\n\n\n（１）記載のとおりであると認められるところ、前記第２の３の前提事実\n\n\n（４）及び\n\n\n（９）によれば、これらは本件各更正処分における納付すべき消費税額及び地方消費税の譲渡割額とそれぞれ同額であると認められるから、本件各更正処分は、いずれも適法というべきである。\n３ 争点３（通則法６５条４項にいう「正当な理由」の有無）について\n\n\n（１）認定事実各文末に掲記した証拠及び弁論の全趣旨によれば、課税対応課税仕入れに係る見解等に関し、次の事実が認められる。\nア 税務当局による回答\n（ア）国税庁は、買い取った分譲用マンションの分譲が完了するまでの間、その一部を一時期賃貸することとしている場合に、同マンションを購入する際に課される消費税額について、課税対応課税仕入れとして取り扱ってよいかとの照会に対し、平成７年２月１６日付けで、「仮に一時的に賃貸用に供されるとしても、継続して棚卸資産として処理し\n（中略）、将来的には全て分譲することとしているものについては、法３０条２項１号イの課税資産の譲渡等にのみ要する課税仕入れに該当するものとして取り扱って差し支えない。」と回答した（平成７年事例）。（甲５６、５７、６３）\n（イ）東京国税局は、平成９年頃、当初から１棟ごとに居抜き（賃借人が居住している状態をいう。）で転売するか、賃貸契約解除後に１戸ごとに転売する目的でマンションを買い取った場合の仕入税額控除の運用について、「法人の処理及び販売活動等から、マンションを転売目的で購入したことが明らかであることから、課税資産の譲渡等にのみ要する課税仕入れに該当し、仕入れ税額控除が認められる。」と回答した（平成９年事例）。\n（甲５６、５７）\nイ 平成１７年以降に作成又は発行された文献\n（ア）平成１７年１１月５日に刊行された国税庁職員の執筆に係る「こんなときどうする消費税Ｑ＆Ａ」には、「現住建造物を転売目的で購入した場合の仕入税額控除」との説例において、「事業者の最終的な目的は中古マンションの転売ということであっても、\n転売までの間非課税売上げである住宅家賃が発生することも事実であり、中古マンションの購入に係る消費税は、課税売上げと非課税売上げに共通して要するものに該当することになります。」と記載されている。（甲６１、乙１６）\n（イ）東京税理士会が平成２３年１１月１日に発行した「東京税理士界」（Ｖｏｌｕｍｅ\nＮｏ．６５８）には、上記（ア）の記載を引用した上で、「派生的かつ附随的とはいえ、\n物件の取得により確実に発生する非課税収入は、たとえ販売目的による取得であったとしても、課税仕入れの区分上無視することはできない。」と記載されている。（乙１７）\n（ウ）平成２３年１１月１０日に刊行された「消費税トラブルの傾向と対策（税理士損害賠償事故対策版）」には、「賃貸中の中古マンションを転売目的で取得し、課税売上げ対応分に区分して個別対応方式を適用したケース」のトラブル対策について、「販売用の建物を取得する場合の課税仕入れの用途区分であるが、本事例のように居住用の現住建造物を取得する場合には、原則として共通して要するものに区分することになる。」と記載されている。（乙１８）\n（エ）平成２５年１１月５日に刊行された「消費税（個別対応方式・一括比例配分方式）有利選択の実務」には、入居者のいる賃貸マンションを転売目的で取得した場合の取得費の用途区分につき、直ちに転売することができる場合（既に転売先が見つかっている状態で取得した場合）はともかく、実際に転売するまで一定の期間を要する場合、転売までに入居者から賃貸料収入がもたらされることになるとして、「取得の意図が転売目的であっても、課税売上のみならず非課税売上をももたらすことから、取得費の用途区分については、課税売上と非課税売上の双方に共通して要するものに分類すべきということになるものと考えられる」と記載されている。（乙１９）\nウ 国税不服審判所長の裁決例及び下級審の裁判例本件と同様に販売目的による居住用の建物（当該建物を信託財産とする信託受益権の場合を含む。）の取得費についての課税仕入れの区分が争点となった平成１７年１１月１０日裁決、平成２２年１１月８日裁決、同年１２月８日裁決及び平成２４年１月１９日裁決\n（いずれも公刊の裁決事例集に掲載されているもの）並びに平成２５年６月２６日のさいたま地方裁判所の判決及び平成２６年１０月２３日の名古屋地方裁判所の判決（いずれも公刊の税務訴訟資料に掲載されているもの）の各事例において、当該各事案の所轄行政庁及び被告が、当該各課税仕入れが共通対応課税仕入れに当たるとする本件各更正処分と同旨の主張をし、その主張が採用されていた。（甲３７、乙１４の１ないし３、乙１５、２\n５）\n\n\n（２）検討ア 通則法６５条４項にいう「正当な理由があると認められる」場合とは、真に納税者の責めに帰することのできない客観的な事情があり、当初から適法に申告し納税した納税者との間の客観的不公平の実質的な是正を図るとともに過少申告による納税義務違反の発生を防止して適正な申告納税の実現を図るという過少申告加算税の趣旨に照らしてもなお納税者に過少申告加算税を賦課することが不当又は酷になる場合をいうものと解するのが相当である（最高裁平成●●年（○○）第●●号同１８年４月２０日第一小法廷判決・民集６\n０巻４号１６１１頁参照）。\nイ 上記\n\n\n（１）の認定事実イ及びウによれば、税務当局は、遅くとも平成１７年以降、本件各課税仕入れと同様の課税仕入れを、当該建物が住宅として賃貸されること（その他の資産の譲渡等に対応すること）に着目して共通対応課税仕入れに区分すべきであるとの見解を採っており、そのことは、本件各確定申告当時、税務当局の職員が執筆した公刊物や、\n公表されている国税不服審判所の裁決例及び下級審の裁判例を通じて、一般の納税者も知り得たものということができる。他方、上記\n\n\n（１）の認定事実アによれば、税務当局が平成７年２月１６日付けでした関係機関からの照会に対する回答は、本件各課税仕入れと同様の課税仕入れを、事業者が当該建物の転売を目的とすることに着目して課税対応課税仕入れに区分したものとも理解し得るものの、前提となる事実関係が明らかでなく、必ずしも上記見解と矛盾するものとはいえない。また、税務当局は、平成９年頃、関係機関からの照会に対し、本件各課税仕入れと同様の課税仕入れを課税対応課税仕入れに区分すべき旨の回答をしているが、このことから直ちに、税務当局が一般的に当該課税仕入れを事業者の目的に着目して課税対応課税仕入れに区分する取扱いをしていたものということはできないし、上記回答が公表されるなどしたとの事情もうかがわれない。\nそうすると、平成１７年以降、税務当局が、本件各課税仕入れと同様の課税仕入れを当該建物が住宅として賃貸されることに着目して共通対応課税仕入れに区分する取扱いを周知するなどの積極的な措置を講じていないとしても、事業者としては、上記取扱いがされる可能性を認識してしかるべきであったということができる。\nそして、上記取扱いは消費税法３０条２項１号の文理等に照らして自然であるといえ、\n本件各確定申告当時、本件各課税仕入れと同様の課税仕入れを事業者の目的に着目して課税対応課税仕入れに区分すべきものとした裁判例等があったともうかがわれないこと等をも考慮すれば、原告が本件各確定申告において本件各課税仕入れを課税対応課税仕入れに区分して控除対象仕入税額の計算をしたことにつき、真に納税者の責めに帰することのできない客観的な事情があり、過少申告加算税の趣旨に照らしてもなお納税者に過少申告加算税を賦課することが不当又は酷になるということはできない。\nウ 以上によれば、本件各確定申告において、原告が本件各課税仕入れに係る消費税額の全額を当該課税期間の課税標準額に対する消費税額から控除したことにつき、通則法６５条\n４項にいう「正当な理由」があると認めることはできない。原告は、種々の主張をするが、\nいずれも上記の結論を左右するものではない。\nエ 以上を前提とすると、本件各更正処分に伴って原告に課されるべき過少申告加算税の額は、別紙３の２\n\n\n（１）記載のとおりであると認められるところ、前記第２の３の前提事実\n\n\n（４）によれば、これらは本件各賦課決定処分における過少申告加算税の額といずれも同額であると認められるから、本件各賦課決定処分は、いずれも適法である。\n\n\n\n\n\n\n第４ 結論以上によれば\n\n\n、本件訴えのうち本件各通知処分の取消しを求める部分は、不適法であるからいずれも却下し、その余の原告の請求は、理由がないからいずれも棄却することとして、主文のとおり判決する。\n東京地方裁判所民事第５１部裁判長裁判官 岡田 幸人裁判官 都野 道紀裁判官 曽我 学\n．．．\n．•．•．• ••\n．．\n•••••••\n．．．\n．．．響 . .\n•••ノ\n（別紙1)指定代理人目録八屋敦子、青木雄弥、神山びな、森田太、依田友和、小島愛大以 上\n（別紙２）\n当事者の主張の要旨\n１ 争点１（本件各通知処分の取消しを求める利益の有無）について\n（被告の主張の要旨）\n増額更正処分の内容は、通知処分の内容を包摂する関係にあると解されるところ、これを前提とすると、納税者の同一課税期間の消費税等について、増額更正処分と通知処分の両方の処分がされた場合において、その税額等を争う納税者は、増額更正処分に対する取消訴訟をもって争えば足り、これと別個に通知処分を争う訴えの利益や必要を有しないものと解すべきである。\nしたがって、本件各通知処分の取消しを求める訴えは、訴えの利益を欠く不適法なものであるから、却下されるべきである。\n（原告の主張の要旨）\n争う。\n２ 争点２（本件各課税仕入れの用途区分）について\n（被告の主張の要旨）\n\n\n（１）個別対応方式における用途区分の判断基準について仕入税額控除の制度趣旨、消費税法３０条２項１号の文理、消費税法の定める仕入税額控除制度の仕組み等を踏まえれば、個別対応方式による場合の用途区分について、同号の課税対応課税仕入れとは、同号の文言に即して、当該課税仕入れにつき将来課税売上げを生ずる取引のみが客観的に見込まれている課税仕入れのみを、非課税対応課税仕入れとは、当該課税仕入れにつき将来非課税売上げを生ずる取引のみが客観的に見込まれている課税仕入れのみをいい、当該課税仕入れについて将来課税売上げを生ずる取引と非課税売上げを生ずる取引の双方が客観的に見込まれる課税仕入れについては、全て共通対応課税仕入れに区分されると解するのが相当である。\n\n\n（２）本件各課税仕入れは共通対応課税仕入れに該当するものであること原告は、賃借人がいる区分所有建物の居室を購入して賃借人が退去した後に顧客に対して売却し、あるいはその全部又は一部の居室に賃借人がいる中古マンション１棟を購入してリノベーションや賃貸募集活動により稼働率や収益性を高めた上で売却するというビジネスモデルの下で本件各課税仕入れを行ったものであり、本件各仕入日の状況に基づき、将来、原告が本件各建物から生ずる各賃貸料を収受することが見込まれていた。他方、原告は本件各仕入日において本件各建物を販売用の不動産として管理しており、上記のビジネスモデルからして、将来本件各建物の販売を行うことも見込まれていた。\n以上のとおり、本件各課税仕入れは、本件各仕入日の状況等に基づいて客観的に判断すれば、\n将来課税売上げを生ずる取引（課税資産〔建物〕の譲渡等）と非課税売上げを生ずる取引\n（その他の資産の譲渡等〔住宅の貸付け〕）の双方が客観的に見込まれていたものであるから、\n消費税法３０条２項１号ロに規定する共通対応課税仕入れに該当する。\n（原告の主張の要旨）\n\n\n（１）個別対応方式における用途区分の判断基準についてア 消費税法３０条２項１号の規定の文理に加え、事業者間における税負担の累積を排除して最終消費者に適正に消費税額を転嫁するという仕入税額控除の趣旨に照らせば、「課税資産の譲渡等にのみ要するもの」とは、「課税資産の譲渡等を行う目的にのみ必要とする」課税仕入れ等をいうものと解すべきである。そして、その判断は、現実に行われた個々の課税仕入れ等を前提として、課税仕入れ等がされた日の時点において、様々な事情を考慮して個別具体的に客観的に行うべきである。\nイ 消費税法の成立当時における国税庁の公権解釈においても、「課税資産の譲渡等にのみ要するもの」とは、「課税資産の譲渡等を行うためにのみ必要な課税仕入れ等をいう。すなわち、直接、間接を問わず、また、実際に使用する時期の前後を問わず、その対価の額が最終的に課税資産の譲渡等のコストに入るような課税仕入れ等である。」とされていたものであり、被告が主張するように、資産の譲渡等が「客観的に見込まれている」などとは解釈されていなかった。\nウ 消費税法３０条２項１号の規定の文理解釈を踏まえれば、「課税資産の譲渡等にのみ要するもの」とは、「事業者が、課税資産の譲渡等を行うために必要とするが、その他の資産の譲渡等を行うために必要としないものとして行った課税仕入れ」と意味すると解釈すべきである。そして、その「事業者が、課税資産の譲渡等（又はその他の資産の譲渡等）のために必要とするものとして課税仕入れを行った」という判断は、事業者が課税仕入れと資産の譲渡等を事業として行うものである以上、事業者がどのような収益（資産の譲渡等）に係る費用（コスト）として課税仕入れを行ったのかという事業者が行う事業の収益・費用の構造、\nその他当該事業者の経済活動に関する個別の事情に即して客観的に判断すべきであるから、\n事業者が行った課税仕入れが、当該事業者において、課税資産の譲渡等に係る費用（コスト）\nとはされているがその他の資産の譲渡等に係る費用（コスト）とはされていないとの事情がある場合には、当該課税仕入れは、「課税資産の譲渡等にのみ要するもの」に当たることが強く推認されると解すべきである。\nエ 用途区分は消費税法３０条２項１号の解釈の問題であり、準ずる割合の適用は同条３項の問題であって、両者は適用法条を異にする上、同条２項１号には両者の関係を示唆するような文言は存しないことからすれば、同条３項の準ずる割合という仕組みが設けられていることを根拠に同条２項１号を解釈する被告の主張は誤りである。\n\n\n（２）本件各課税仕入れの用途区分ア 原告は、本件各事業において、中古マンション又はその居室を購入し、購入後に、その販売収益を高めるために当該物件のバリューアップを行い、顧客に物件を販売している。本件各課税仕入れも、このような本件各事業における事業活動の一環として行われており、原告は、購入した本件各建物が販売用資産であることから、当該各物件を棚卸資産として税務処理している。したがって、原告は、本件各建物の販売という課税資産の譲渡等を行う目的に必要とする課税仕入れ等として、本件各課税仕入れを行っているということができる。\nイ 本件各建物は、原告による購入の時点で住宅用賃貸に供されているため、原告による保有期間中に非課税資産の譲渡等である住宅貸付けが行われ、原告が当該貸付けによる賃料を得ることになるものの、本件各課税仕入れの目的は本件各建物の販売であって、かかる住宅貸付けではないから、本件各課税仕入れは、本件各建物の販売という課税資産の譲渡等を行う目的にのみ必要とする課税仕入れ等であり、課税対応課税仕入れに該当するものというべきである。\nウ 原告は、本件各事業において、本件各課税仕入れを、本件各建物の販売収入に係る費用\n（コスト）として行っているといえるが、保有期間中の賃料収入に係る費用（コスト）として行っているとはいえない。そうすると、原告が本件各課税仕入れを行うことにより生み出そうとした付加価値は、正にバリューアップの結果として生ずる本件各建物の仕入価格（工事費を含む。）と販売価格の差額に尽きるのであって、保有期間中の賃料とは関係がないから、消費税の課税も、かかる付加価値である本件各建物の仕入価格と販売価格の差額に対してのみ行われるべきである。\nしたがって、本件各課税仕入れは、「事業者が、課税資産の譲渡等（将来の本件各建物の販売）を行うために必要とするが、その他の資産の譲渡等（保有期間中の賃料収入の発生）\nを行うためには必要としないものとして行った課税仕入れ」に当たり、「課税資産の譲渡等にのみ要するもの」に当たるというべきである。\n３ 争点３（通則法６５条４項にいう「正当な理由」の有無）について\n（原告の主張の要旨）\n\n\n（１）用途区分に係る税務当局の解釈又は取扱いについて国税庁は、「買い取った分譲用マンションを分譲が完了するまで一時期賃貸した」との事例における用途区分について、平成６年１１月に実施した「全国国税局消費税課長・統括国税調査官会議」における意見聴取を経た上で、平成７年２月１６日付けで、全国の国税局及び税務署に対し、課税対応課税仕入れに区分して差支えない旨通知している（以下「平成７年事例」という。）。\nまた、東京国税局は、平成９年、「賃借人が居住しているマンションを転売目的でそのままの状態で購入した」との事例における用途区分について、照会元の下級行政機関に対し、「本件の場合は・・・マンションを転売目的で取得したことが明らかである」から課税対応課税仕入れ等に区分される旨回答している（以下「平成９年事例」という。）。\nこのように、税務当局は、転売用マンションに係る課税仕入れを課税対応課税仕入れ等に区分する取扱いをしていたものであり、このような取扱いは、原告の主張に沿うものであった。\nしかしながら、その後に税務当局が賃貸不動産の仕入れは共通対応課税仕入れに該当すると解釈を変更したことについて、法令や通達の改正はおろか、質疑応答事例の公表等の対応は一切されていない。また、本件の論点は、租税法規の解釈上微妙な点を含む問題であることは明らかである。\n\n\n（２）「正当な理由」の存在通則法６５条４項の「正当な理由」が認められる場合とは、真に納税者の責めに帰することのできない客観的な事情があり、過少申告加算税の趣旨に照らしてもなお納税者に過少申告加算税を賦課することが不当又は酷になる場合をいうものと解される。\nしかるところ、上記のような経過からすれば、従来の解釈又は取扱いに従って、本件課税仕入れを課税対応課税仕入れであるとして消費税及び地方消費税の申告を行った原告について、\nかかる判断が納税者の主観的な事情に基づく単なる法律解釈の誤りにすぎないものということはできない。\nよって、本件各更正処分により納付すべきこととなった税額の全額につき、原告には通則法\n６５条４項にいう「正当な理由」があるというべきである。\n（被告の主張の要旨）\n\n\n（１）用途区分に係る税務当局の解釈又は取扱いについて原告が指摘する平成７年事例は、やや判然としないが、分譲用マンション（住宅用）を買い取り、その後、当該分譲用マンションを分譲するまでの間、その一部を一時期賃貸することとした場合に、当該分譲用マンション（すなわち、いわゆる投資用の物件である本件各建物とは異なり、課税仕入れの日に住宅の賃貸の用に供されていない、又は、賃貸の用に供される見込みがない分譲用の物件）に係る控除対象仕入税額の計算における個別対応方式の用途区分について、課税資産の譲渡等にのみ要する課税仕入れに該当するものとして取り扱って差し支えないとしたものと考えられるのであって、本件とは事案が異なる。\nまた、平成９年事例は、東京国税局が更正の請求事案の処理を担当する部署からの質疑に対する回答を示したものであり、その性質上、当該部署が具体的な事案を処理するために、同局がその個別具体の事情を前提としてその見解を示したものにすぎない。その意味で、平成\n９年事例は、飽くまでも東京国税局が取り扱った個別事案に対する事例判断であり、個別対応方式の用途区分の判定に関する解釈を一般的に示したものとみることはできない。\n加えて、原告が本件各確定申告において依拠した解釈は、平成７年事例の取扱内容が根拠となり得るものではないし、平成９年事例の「回答要旨」と必ずしも一致しないから、原告が平成７年事例又は平成９年事例に依拠して本件各確定申告をしたものでないことは明らかである。\nまた、本件各確定申告の当時において、原告が依拠する解釈の論拠となり得る裁判例は全く存在しない一方、これに反する課税庁の上記解釈に沿う公表裁決や裁判例が存在していた上、\n課税庁が監修した公刊物ではないものの、課税庁の上記解釈に沿う記述をした複数の公刊物が存在していたものであり、かかる事実からすると、遅くとも平成１７年以降、課税庁が、\n本件各課税仕入れに類する態様の課税仕入れが共通対応課税仕入れに該当するとの統一的取扱いをしていたことは明らかである。\n\n\n（２）「正当な理由」の不存在以上のとおり、原告が本件各確定申告において依拠した法令解釈には相応の論拠が客観的に存在したとはいえず、申告額が過少であったことは、消費税法３０条２項１号の個別対応方式における用途区分の判定に関する一般的な解釈とは異なる解釈に基づく単なる法令解釈の誤りによるものにすぎないから、本件は、通則法６５条４項に定める「正当な理由があると認められる」場合には当たらないというべきである。\n以 上\n \n．． 囀．\n \n...\n....\n．．\n． ． ．\n...\n•••\n（別紙3)被告の主張する課税の根拠及び計算\nー 本件各更正処分の根拠及び適法性\n)1( 本件各更正処分の根拠被告が本訴において主張する原告の本件各課税期間に係る消費税等の各課税標準額及び納付すべき消費税等の額は、それぞれ次に述べるとおりである。｀ア 平成27 年 3 月課税期間更正処分の根拠 ．\n.• m 課税標準額（別表 1-1 ①C 欄） 2 5.2 億5425 万2 o o・o 円上記金額は、原告の平成2 7年 3 月課税期間の消費税等の確定申告書（以\nJO・下「平成27年3 月課税期間確定申告書」• といい：他の本件各課税期間の消費税等の確定申告書も同様に表記する。） の①「課税標準額」欄に記載された金額と同額である。・イ（l 課税標準額に対する消費税額（別表 1-1 ② c 欄）\n“~ • . ・, 1 5 億5793 万8 2 1 5 •円上記金額は、次の a の金額と b の金額との合計額であり、． 平成27 年・3月課税期間確定申告書の②「消費税額」欄に記載された金額と同額である。\nなお、本件各確定申告における課税標準額に対する消費税額は、・課税標準額に対する消費税額の計算の特例（消費税法29 条、平成24 年法律第\n6 8 知附則5 条1項ないし5項、平成 1 5年財務省令\n\n\n\n\n\n\n第92 号附則\n\n\n2 条2項等）の適用を前提とした金額となっている （後記イないしオの「（イ）課税標準額に対する消費税額」において同じ。）。\n課税標準額に対する消費税額・税率4 バーセント適用分（別表 1-1\na\n②A 欄） 5 5 9 3 万4552 円上記金額は、平成27 年3 月課税期間確定申告書に添付された「付表\nー 旧・新税率別、消費税額計算表兼地方消費税の課税標準となる消費\n...\n．．．．．\n \n..．．\n． ．．\n．．．\n．．．税額計算表」 （以下「付表 1」という。）の②「消費税額（税率4 パーセント適用分B) 」欄に記載された金額と同額である。\nb 課税標準額に対する消費税額・税率6. 3 パーセント適用分（別表 1\n-1 ②B 欄） 5億0200 万3663 円上記金額は、平成2 7 年3 月課税期間確定申告書に添付され，た付表 1の②「消費税額（税率6. 3 バーセント適用分C) 」欄に記載された金 ．額と同額である。\nc c\n．（ウ）控除対象仕入税額（別表1-1 ④ 欄・別表2-1 ⑰ 欄）\n1 3億4770 万2543 円\n。\n上記金額は、次のa の金額と b の金額との合計額であり、消費税法30\nI条1項の規定により、当該課税仕入れを行った日の属する課税期間の課税標準額に対する消費税額から控除する、課税仕入れに係る消費税額の合計額（控除対象仕入税額）である（後記イないしオの「（ヴ ・控除対象仕入税額」において同じ。）。\nなお、控除対象仕入税額の計算に当たっては、本件各課税期間における課税売上割合がいずれも 100 分の9 5 に満たないことから（後記C 、イないしオの（ウ）c) 、原告が本件各課税期間を通じて選択した個別対応方式\n．（本件各課税期間の消費税等の確定申告書に添付された各「付表 2 )2(-課税売上割合・控除対象仕入税額等の計算表」（以下「付表2・-( 2)」という。 9)により計算する（後記イないしオの「（ウ）．控除対象仕入税額」において同幻\nじ。）。\na 控除対象仕入税額・税率4 パーセント適用分（別表 1-1 ④A 欄・別\n｀表 2-1 ⑰A 欄） 3億 6 7 2 2 万4442 円上記金額は、次の)a( の金額に、)b・( の金額に c の割合を乗じて計算した金額を加算した金額であり、平成2.4 年法律\n\n\n\n\n\n\n第68 号附則\n\n\n5 条7 項の経ぉ\n\n\n過措置の適用を受ける消費税法30 条1項所定の仕入れに係る消費税額\n\n\n...\n\n\n．．．．・．．．\n\n\n..\n\n\n....\n\n\n．．．\n\n\n•\n\n\n•••\n\n\n..,;の控除に関する金額である。\n\n\nla( 課税対応課税仕入れの税額（別表2-1 ⑧A 欄）\n\n\n3億.6 47 9 万7.3 5 2 円上記金額は、次のiの金額からiiの金額を減算した金額である。\n\n\ni 申告による課税対応課税仕入れの税額（別表2-.1 ⑨A 欄）\n\n\n3億6486 万8365 円上記金額は、平成27 年 3 月課税期間確定申告書に添付された付表2-(2) の⑭「⑫のうち、課税売上げにのみ要するもの（税率4 バ\n\n\nーセント適用分B) 」欄に記載された金額と同額である。\n\n\nii 前記iの課税対応課税仕入れの税額から減算すべき金額（別表 2一\n\n\n1⑪A 欄） • ． 7 万 1 0 1 3 円上記金額は、前記iの金額に含まれた、原告が本件各建物の一部の物件の取得の際に仲介業者に対して支払った各役務の提供の対価\n\n\n（仲介手数料）、の額に係る消費税相当額であり、上記の各役務の提供を受けたこと（課税仕入れ）が課税対応課税仕入れには区分されず、共通対応課税仕入れに区分されることから、課税対応課税仕入れの税額から減算すべき金額である。\n\n\n)b(. 共通対応課税仕入れの税額（別表2-1 ⑫A 欄）\n\n\n6 1 9 万8441 円＇上記金額は、次のiの金額にiiの金額を加算した金額である。\n\n\n勾．\n\n\ni 申告による共通対応課税仕入れの税額（別表2-1 ⑬A 欄）\n\n\n9 3 万00 5 5 円上記金額は、平成27 年3 月課税期間確定申告書に添付された付表2-(2) の⑮「⑫のうち、課税売上げと非課税売上げに共通して要するもの（税率4 バーセント適用分B) 」欄に記載された金額と同額である。\n\n\n....\n\n\n．．．．．．．\n\n\n．．\n\n\n．．\n\n\n．．\n\n\n．．．\n\n\n．．．\n\n\nii 前記iの共通対応課税仕入れの税額に加算すべき金額（別表 2-\n\n\n1⑮A 欄） 426 万8386 円上記金額は、原告が本件各建物の一部の物件の取得の際に仲介業者に対して支払った各役務の提供の対価（仲介手数料）の額に係る消費税相当額41 万8786 円．（なお、同金額は課税対応課税仕入れの税額から減算される 7 万101 3 円〔前記)a( ii〕を含む。）及 ・び原告が住宅を建設して販売する目的の土地に関して造成業者に対して支払った各役務の提供の対価（土地の造成費）の額に係る消費税相当額384 万9600 円の合計金額である。原告は上記金額については課税対応課税仕入れ又は非課税対応課税仕入れに区分されるとして、共通対応課税仕入れの税額に含めていないが、上記各役務の提供（課税仕入れ）が共通対応課税仕入れに区分されることから、前記iの共通対応課税仕入れの税額に加算すべき金額である。\n\n\nb 控除対象仕入税額・税率6. 3 バーセント適用分（別表 1-1・ ④B 欄・別表2-1 ⑰B 欄） 9億8047 万8 1 0 l 円\n\n\n51 ’上記金額は、次の)a( の金額に、)b( の金額に c の割合を乗じて計算した金額を加算した金額であり、平成2 年4 月1 日以後の課税仕入れについての消費税法30 条1項所定の仕入れに係る消費税額の控除に関する金額である。\n\n\n)a( 課税対応課税仕入れの税額（別表2-1 ⑧B 欄）\n\n\n8 億1 2 0 6 万4 1 0 1 円上記金額は、＇次のiの金額からiiの金額を減算した金額である。\n\n\ni 申告による課税対応課税仕入れの税額（別表2-1 ⑨B 欄）＇\n\n\n9億 1 3 9 2 万1474 円上記金額は、・平成2 7 年3 月課税期間確定申告書に添付された付お\n\n\n．．．\n\n\n.\n\n\n．;,．.. .\n\n\n’.. .\n\n\n．．．\n\n\n... ．．・． ・\n\n\n•· .\n\n\n・表2-(2) の⑭「⑫のうち、課税売上げにのみ要するもの （税率6.\n\n\n3 パーセント適用分C) 」欄に記載された金額と同額である。\n\n\n211 前記iの課税対応課税仕入れの税額から減算すべき金額（別表 2\n\n\n-1 ⑩ B 欄及び⑪B 欄の合計額） 1億0.1 8 5 万7373 円\n\n\n• 5 上記金額は、次の(i)の金額と(ii)の金額の合計額である。\n\n\n(i)前記iに含まれた本件各課税仕入れに係る税額（別表 2-1 ⑩\n\n\nB 欄） . 1億0.o 7 9 万89 5 9 円・上記金額は、前記iの金額に含まれた本件各課税仕入れに係る消費税額（平成2 7年3 月課税期間の本件各建物の取得価額の合計額 1 5億9 9 9 8 万3396 円と、これに係る消費税等の額1億2 7 9 g・万8765 円との合計額1 7億27 9 8 万2 1 6 i円 ．に1 0 8 分の 6 . 3 を乗じて算出した金額）であり、本件各課税仕入れが、共通対応課税仕入れに区分されることから、前記iの課税対応課税仕入れの税額から減算すべき金額である。\n\n\n)ii( 前記iに含まれた共通対応課税仕入れに区分される課税仕入\n\n\nSI ・れ（各役務の提供）に係る税額（別表2-1 ⑪B 欄）\n\n\n・1 0 5 万8414 円上記金額は、前記iの金額に含まれた、原告が本件各建物の一部の物件の取得の際に仲介業者に対して支払った各役務の提供の対価（仲介手数料）の額に係る消費税相当額であり、当該各役勾・務の提供（課税仕入れ）は、課税対応課税仕入れには区分されず、\n\n\n・共通対応課税仕入れに区分されることから、前記iの課税対応課税仕入れの税額から減算すべき金額である。\n\n\n)b('. 共通対応課税仕入れの税額 ．（別表2-1 ⑫B 欄）\n\n\n4 億3010 万5 1 6 0 円お\n\n\n上記金額は、次のiの金額にiiの金額を加算した金額である。\n\n\n．．．\n\n\n．．．．．\n\n\n・ ．・．・．・．・・ ・\n\n\n.. ．．.｀ .\n\n\n．． ．\n\n\n．．．\n\n\ni 申告による共通対応課税仕入れの税額（別表2-1 ⑬B 欄）\n\n\n3億 0129 万2720 円上記金額は、平成2 7年3 月課税期間確定申告書に添付された付表2-(2) の⑮「⑫のうち、課税売上げと非課税売上げに共通して要\n\n\n，するもの（税率6. 3 パーセン，・ト適用分C) 」欄に記載された金額と同額である。\n\n\nii 前記iの共通対応課税仕入れの税額に加算すべき金額（別表 2-\n\n\n1⑭B 欄及び⑮B 欄の合計額） 1億 2881 万2440 円上記金額は、次の(i)の金額と(ii)の金額の合計額である。． ．\n\n\n(i)本件各課税仕入れに係る税額（別表 2-1 ;⑭B 欄）\n\n\n• 1億 0079 万8 9 5 9 円・・上記金額は、前記)a( ii (i)の本件各課税仕入れに係る消費税額であり、本件各課税仕入れが、共通対応課税仕入れに区分されることから、共通対応課税仕入れの税額に加算すべき金額である。\n\n\ni( i)共通対応課税仕入れに区分される各役務の提供に係る税額（別表2-1 ⑮B 欄） ｀ ． ．2 8 O 1 万3 4 8 1 円．上記金額は、原告が本件各建物の一部の物件の取得の際に伸介業者に対して支払った各役務の提供の対価（仲介手数料）の額に\n\n\n・a o係る消費税相当額2 万1543 円（なお、同金額は課税対応課税仕入れから減算した 1 0 5.万8414 円〔前記a{ii} (H ）〕を含む。）及び原告が住宅を建設して販売する目的の土・地に関して造成業者に対して支払った各役務の提供の対価（土地の造成費）\n\n\nの額に係る消費税相当額2541 万1 9 3 8 円の合計額である。\n\n\n原告は上記税額に対応する課税仕入れについては課税対応課税仕入れ又は非課税対応課税仕入れに区分されるとして、共通対応お\n\n\n課税仕入れの税額に含めていないが、上記各役務の提供（課税仕．\n\n\n．．．\n\n\n•．•．• ••\n\n\n．．\n\n\n．.．.. ．\n\n\n....\n\n\n．入れ）が共通対応課税仕入れに区分されることから、前記iの共通対応課税仕入れの税額に加算すべき金額である。\n\n\nc果税売上割合（別表2-1 ⑤ 欄）\n\n\n. 39. 156470630 （以下賂）パーセント\n\n\n.I:記割合は、次の（ a）の金額のうちに)b( の金額の占める割合である。・資産の譲渡等の対価の額の合計額（別表2-1 ④C 欄） ． ．\n\n\n645 億0794 万 0666 円上記金額は、平成27 年 3月課税期間確定申告書に添付された付表\n\n\n2-(2) の⑦「資産の譲渡等の対価の額（⑤＋⑥）」欄に記載された金預と同額である。\n\n\n課税資産の譲渡等の対価の額の合計額（別表2-1 ①C 欄）\n\n\n252 億59 0 3 万2 8 4 1 円上記金額は、平成2 7年3 月課税期間確定申告書に添付された付表\n\n\n2-(2) の④「課税資産の譲渡等の対価の額（①十②十③）」欄に記載 ：された金額と同額である。\n\n\ntt差引税額（別表i -1 ⑩C 欄） 2億 1 0 2 3 万2100 円記金額は、次の a の金額と b の金額の合計額（ただし、通則法 1 1 9頁の規定に基づき 1 0 0 円未滴の端数金額を切り捨てた後の金額。後及びエにおいて同じ。）である。\n\n\n空除不足還付税額・税率4 パーセント適用分（別表 1-1 ⑧A 欄） ．\n\n\n△3億1 1 2 8 万9890 円上記金額は、前記（イ）a の金額から前記（ウ）a の金額を減算．した金額であ奎引税額・税率6. 3パーセント適用分（別表 1-1 ⑨B 欄）\n\n\n5億 2152 万2 0 1・8 円日記金額は、前記（イ）b の金額から前記（ウ）b の金額及び貸倒れに係る税\n\n\n．．．\n\n\n．．．．．\n\n\n．．．．．．．\n\n\n．．\n\n\n.．.．.\n\n\n．．．\n\n\n．．．\n\n\n．．．\n\n\n・額3544 円を減算した金額である。\n\n\nなお、上記貸倒れに係る税額は、平成27 年3 月課税期間確定申告書 ・に添付された付表 1 の⑥「貸倒れに係る税額（税率6. 3 パーーセント適用分C) 」欄に記載された金額と同額である。\n\n\n―切既に納付の確定した本税額（別表 1• ー 1 ⑪c欄）\n\n\n1億6041 万3400 円上記金額は、'•平成27年3 月課税期間確定申告書の⑨「差引税額（②＋\n\n\n③―⑦)」欄に記載された金額と同額である。\n\n\nc切）差引納付すべき消費税額（別表・1-1 ⑫ 欄） 4 9 8 1 万8700 円上記金額は、前記に）の金額から前記出の金額を減算した額（ただし、通\n\n\nJO則法 1 1 9 条 1項の規定に基づき 1 0 0 円未満の端数金額を切り捨てた後の金額。後記イないしオの「位） 差引納付すべき消費税額」において同じ。）である。 •件） 合計差引地方消費税の課税標準額（別表 1-1 ⑮C 欄）\n\n\n2億 1 0 2 3 万2100 円上記金額は、次のa の金額と b の金額の合計額（ただし、通則法 1 1 9条 1項の規定に基づき 100 円未満の端数金額を切り捨てた後の金額。後 ．記ウ及びエの「待） 、合計差引地方消費税の課税標準額」において同じ。）．であり、地方税法72 条の82 の規定に基づく地方消費税の課税標準額である。\n\n\na 譲渡割額の還付額の基礎となる消費税額・税率4 パーセント適用分\n\n\n（別表l- .1⑬A 欄） ．． △3億 1 1 2 8 万9890 円上記金額は、前記に）a の金額と同額である。\n\n\nb 譲渡割額の納付額の基礎となる消費税額・税率6. 3 バーセント適用分（別表 1-1 ⑭B 欄） ． ．5億 2 1 5 2 万2 0 1 8 円上記金額は、前記に）b の金額と同額である。\n\n\n． . .\n\n\n·• . .\n\n\n•\n\n\n•．•．• ••\n\n\n．．\n\n\n．••．••．• ••\n\n\n．．．\n\n\n•．•．． •\n\n\nc\n\n\n（ク） 合計差引譲渡割額（別表 1-1 ⑱ 欄） 6 2 9'0 万5 6 0 O 円上記金額は、次のaの金額と b の金額の合計額（ただし、地方税法20条の の2 第3項〔令和2 年法律\n\n\n\n\n\n\n第5 号による改正前のもの\n\n\n。以下同じ。〕. .の規定に基づき 100 円未満の端数金額を切り捨てた後の金額。・後記ウ及びエの「（ク） 合計差引譲渡割額」において同じ。）である。\na 還付すべき譲渡割額・税率4 バーセント適用分（別表 1-1 ⑯A 欄）\n△\n• 7 7 8 2 万2472 円上記金額は、地方税法 72 条の8 3- （平成24 年法律第6 9 号第 1 条による改正前のもの。以下地方税の譲渡割額に関する「税率4 バーセン\n・ト適用分」について同じ。）の規定に基づき、前記囲a の金額に税率1\nJO\n00 分の 25 を乗じて算出した金額である。\nb 納付すべき譲渡割額・税率.6 3 パーセント適用分'(別表 1-1 ⑰B欄） 1億4072 万8 1 6.3 円上記金額は、地方税法7 2条の8 3 （平成24 年法律第6 9 号\n\n\n\n\n\n\n第2 条による改正前のもの\n\n\n。以下地方税の譲渡割額に関する「税率6. 3 パ．一セント適用分」について同じ。・）の規定に基づき、前記（芍b の金額に税率6 3 分の 1 7 を乗じて算出した金額である。\nc例． 既に納付の確定した譲渡割額（別表 1-1 ⑲ 欄）\no ・a o o\n4943 万 円上記金額は、平成2 7年3 月課税期間確定申告書の⑳・「譲渡割額納税額」\n加欄に記載された金額と同額である。\n（コ） 差引納付すべき譲渡割額（別表 1-1 ⑳ c 欄） 1 3 4 7 万4・8 0 0 円上記金額は、前記り）の金額から前記例の金額を減算した額である。\n)・-W 差引納付すべき消費税等の合計税額（別表 1-1 ⑪C 欄）\n6329 万3500 円\n62.上記金額は、・前記切）の金額と前記（コ）の金額との合計額であり、原告が平\n、、..\n．．．．．\n..\n~..\n．．\n．．． •.•\n．．．\n \nf.． ．．成 27 年3 月課税期間更正処分により新たに納付すべき消費税等の額である。\nィ 平成28 年 3 月課税期間更正処分の根拠げ 課税標準額（別表 1-2 ①C 欄） 3 1 1億3306 万8000 円上記金額は、原告の平成28 年3 月課税期間確定申告書の①「課税標準額」欄に記載された金額と同額である。 ．\n・\n（イ）課税標準額に対する消費税額（別表 1-2 ②C 欄）\n1 9億 5353 万4284 円上記金額は、次の a の金額と b の金額との合計額であり、平成2 .8 年 3月課税期間確定申告書の②「消費税額」欄に記載された金額と同額である。.’\nJO課税標準額に対する消費税額・税率4 バーセント適用分（別表 1-2\na\n②A欄） ．. ' . ' • △ 1 4 万8051 円上記金額は、平成28 年 3 月課税期間確定申告書に添付された付表 1 、\nの②「消費税額（税率4 パーセント適用分B) `」欄に記載された金額と同額である。\nb 課税標準額に対する消費税額 ・税率6 . 3パーセント適用分（別表 1\n-2 ②B 欄） 1 9億5368 万2 3 ・3 5 円上記金額は、平成28 年 3 月課税期間確定申告書に添付された付表 1の②「消費税額（税率6 . 3 パーセント適用分C) .」欄に記載された金額と同額である。\n勾 ．\nc\n（ウ） 控除対象仕入税額（別表 1-2 ④ 欄・別表2-2 ⑮C 欄）\n23 億 1 2 8 2 ．万 3 6 6 8 円上記金額は、次の a の金額と b の金額との合計額である。\na 控. 除対象仕入税額・税率4 バーセント適用分（別表 1- ・2 ④A 欄・別表2-2 ⑮A 欄）・ 1 万8089 円上記金額は、次の)a( の金額に、lb( の金額に c の割合を乗じて計算した\n \n \n•••••\n.．..．．\nヽ\n．.•．. ．• ・\n．．． -.金額を加算した金額であり、平成24 年法律第6 8 烹附則 5条 7項の経過措置の適用を受ける消費税法30 条1項所定の仕入れに係る消費税額の控除に関する金額である。\n}a( 課税対応課税仕入れの税額（月 表 l j 2-2 ⑧A 欄） 0 円上記金額は、平成24 年法律\n\n\n\n\n\n\n第68 号附則\n\n\n5 条の経過措置の適用を受ける課税資産の譲渡等について、・消費税29 条の規定に基づき算出\n\n\nm\n\n\n・される金額であるが、前記 の金額に当該課税資産の譲渡等に係る金額が含まれていないため生じないものであり、平成2B 年3 月課税期間確定申告書に添付，された付表2- (2)の⑭「⑫のうち、・課税売上げにのみ要するもの（税率4 バーセント適用分B) 」欄には金額が記載されていない。\n\n\n)b( 共通対応課税仕入れの税額（別表2-2 ⑪A 欄） 4 万3.5 1 8 円上記金額は、平成28 年3 月課税期間確定申告書に添付された付表\n\n\n2-(2) の⑮「⑫のうち、課税売上げと非課税売上げに共通して要するもの（税率4 パーセント適用分B) 」欄に記載された金額と同額である。\n\n\nb .控除対象仕入税額・税率6. 3 パーセント適用分（別表1-2 ④B 欄・町\n\n\n別表2-2 ⑮B 2 3億 1280 万5 5 7 9 円\n\n\n・上記金額は、次の)a( の金額に、(b)の金額に c の割合を乗じて計算した金額を加算した金額である。\n\n\n・（)a 課税対応課税仕入れの税額（別表2-2 ⑧B 欄）\n\n\n20 億 2 ・3 6 2 万0241 円上記金額は、次のiの金額からiiの金額を減算した金額である。 ．申告による課税対応課税仕入れの税額（別表2-2 ⑨B 欄）\n\n\n2 3 億4286 万1784 円\n\n\n3上記金額は、平成2 8 年 月課税期間確定申告書に添付された付\n\n\n．．．\n\n\n．•．•，• ••\n\n\n．••．•．•• ••\n\n\n．．•．•\n\n\n．．．\n\n\n•••\n\n\n．表2-(2) の⑭「⑫のうち、課税売上げにのみ要するもの （税率6. '\n\n\n3パーセント適用分C) 」欄に記載された金額と同額である。\n\n\n＼ \" \" 前記iの課税対応課税仕入れの税額から減算すべき金舘｛ （別表 2\n\n\n-2 ⑩B 欄） 3億 1 9 2 4 万 154 3 円上記金額は、次の(i)の金額と(i i)の金額の合計額に 1 0 8 分の 6.\n\n\n• 3 を乗じて算出した金額である。\n\n\n(i)前記iに含まれた本件各課税仕入れの税額に係る支払対価の額\n\n\n53 億5994 万3 1 7 5 円上記金額は、前記iの金額に含まれた本件各課税仕入れの税額に対応する支払対価の額（平成28 年3 月課税期間の本件各建物\n\n\n10 ．の取得価格の合計額49 億6 2 9 1万0645 円と、これに係る消費税等の額3 億9703 万2530 円との合計額）であり、本件各課税仕入れが、共通対応課税仕入れに区分されることから、\n\n\n上記金額に係る消費税相当額は、前記iの課税対応課税仕入れの税額から減算すべき金額である。\n\n\n(ii)前記iに含まれた、共通対応課税仕入れに区分される課税仕 、\n\n\n入れ（各役務の提供）の税額に対応する支払対価の額\n\n\n. 1億1 2 7 6 万9003 円上記金額は、前記iの金額に含まれた、原告が本件各建物の一部の物件の取得の際に仲介業者に対して支払った各役務の提供ぶ\n\n\nの対価（仲介手数料）の額であり、当該各役務の提供（課税仕入れ）は、課税対応課税仕入れには区分されず、共通対応課税仕入れに区分されることから、上記金額に係る消費税相当額は、前記\n\n\niの課税対応課税仕入れの税額から減算すべき金額である。\n\n\n)b( 共通対応課税仕入れの税額（別表2-2 ⑪B 欄） ．\n\n\n6億9568 万2825 円\n\n\n．．．\n\n\n•．•．• ••\n\n\n．．\n\n\n• ..•..•••••\n\n\nヽ\n\n\n．．．\n\n\n• •..•\n\n\n·•上記金額は、次のiの金額にiiの金額を加算した金額である。\n\n\n・1 申告による共通対応課税仕入れの税額（別表 2-2 ⑫B 欄）\n\n\n3億4 3 9・・8 万6285 円上記金額は、平成28 年3 月課税期間確定申告書に添付された付表2-(2) の⑮「⑫のうち、課税売上げと非課税売上げに共通して要するもの（税率6. 3 パーセント適用分c) 」欄に記載された金額と同額である。\n\n\n2-.\n\n\n\"ll 前記iの共通対応課税仕入れの税額に加算すべき金額（別表\n\n\n2⑬B 欄） 3億 5 1 6 9 万6540 円上記金額は、次の(i)の金額と(i i)の金額の合計額に 1 0 8 分の.6\n\n\nJO\n\n\n3 を乗じて算出した金額である•O\n\n\n(i)本件各課税仕入れに係る支払対価の額\n\n\n5. 3億5994 万3 1 7 5 円上記金額は、前記)a{ ii (i)の本件各課税仕入れに係る支払対価の額であり、本件各課税仕入れが、共通対応課税仕入れに区分され ・\n\n\nJ5ることから、上記金額の消費税相当額は、共通対応課税仕入れの税額に加算すべき金額である。\n\n\n)ii( 共通対応課税仕入れに区分される各役務の提供に係る支払対価の額 6億 6914 万0380 円・上記金額は、 ・原告が本件各建物の一部の物件の取得の際に仲介\n\n\n20 .業者に対して支払った各役務の提供の対価（仲介手数料）の額億 68 8.8 万0500 円（なお、同金額は、課税対応課税仕入れに係る税額から減算した額の計算の基礎とされた前記a(i) iの)i i(支払対価の額1億 127 6 万9003 円を含む。）及び原告が住宅を建設して販売する目的の土地に関して造成業者に対して支払った各役務の提供の対価（土地の造成費）の額4 億00 25 万9\n\n\n...\n\n\n．．．\n\n\n·•.\n\n\n•••••••\n\n\n． ．\n\n\n．．\n\n\n•••\n\n\n•\n\n\n．．． ．\n\n\n8 8 0 円の合計額である。\n\n\n原告庄上記金額に係る課税仕入れについては課税対応課税仕入れ又は非課税対応課税仕入れに区分されるとして、共通対応課税仕入れに含めていないが、上記各役務の提供（各課~仕入れ）\n\n\nが共通対応課税仕入れに区分されることから、上記金額の消費税相当額は前記iの共通対応課税仕入れの税額に加算すべき金額で\n\n\n• • ある。 •\n\n\nc\n\n\nc課税売上割合（別表2-2 ⑤ 欄）．\n\n\n4 1. 568560924 （以下略）パーセント上記割合は、次の)a( の金額のうちに)b( の金額の占め・る割合である。・\n\n\nc\n\n\n)a( 資産の譲渡等の対価の額の合計額（別表2-2 ④ 欄）．\n\n\n749 億 1 0 5 0 万2835 円上記金額は．＼平成28 年 3月課税期間確定申告書に添付された付表\n\n\n2-(2)の⑦「資産の譲渡等の対価の額（⑤＋⑥）」欄に記載された金額と‘同額である。\n\n\n)b(課税資産の譲渡等の対価の額の合計額（別表2-2 ①C 欄）\n\n\n_ 3'1 1億3 9 2 1万8 0 1 0 円上記金額は、• 平成28年．3 月課税期間確定申告書に添付された付表\n\n\n2-(2)の④「課税資産の譲渡等の対価の額（①＋②十③）」欄に記載された金額と同額である。\n\n\n図 合計差引税額（別表2..:..1 ⑩C 襴） △3億5 9 2・8 万9384 円上記金額は、次のaの金額と b の金額との合計額である。\n\n\n控除不足還付税額．．税率4 パーセント適用分（別表 1-2 ⑧A 欄）\n\n\na\n\n\n△1 6 万6140 円上記金額は、前記（イ）a の金額から前記（?)a の金額を減算した金額である。\n\n\n．．．\n\n\n...\n\n\n•••••\n\n\n．•．.•．~• •． •．••\n\n\n．\n\n\n．．．\n\n\n．．．\n\n\nb 控除不足還付税額・税率6. 3 パーセント適用分（別表 1-2 ⑧B 欄）\n\n\n△3億5 9 1 2 万3244 円\n\n\n：上記金額は、前記（イ）b の金額から前記（ウ）b の金額を減算した金額である。\n\n\nは既に納付の確定した本税額（別表 1-2 ⑪C 欄）\n\n\n△ 5億 3233 万5738 円\n\n\n’•上記金額は、平成28 年 3月課税期間確定申告書の⑧「控除不足還付税額 ．（⑦一②一③）」欄に記載された金額（還付税額であることからこれを\n\n\n「△」表記した金額。後記エ及びオの「困既に納付の確定した本税額J\n\n\n・において同じ。．）と同額である。\n\n\n• 01\n\n\nc切） 差引納付すべき消費税額（別表1-2 ⑫ 欄）\n\n\n1億7304 万6300 円上記金額は、前記に）の金額から前記団の金額を減算した金額である。\n\n\n件） 合計差引地方消費税の課税標準額（別表 1-2 ⑮C 欄）\n\n\n△3億5.9 2 8 万9384 円上記金額は、次の a の金額と b の金額の合計額であり、地方税法72 条の82 の規定に基づく地方消費税の課税標準額である。\n\n\na 譲渡割額の還付額の基礎となる消費税額 ・税率4 バーセント適用分\n\n\n（別表1-2 ⑬A 欄） △1 6.万6 1 4 0 円上記金額は、前記四a の金額と同額である。\n\n\nb 譲渡割額の還付額の基礎となる消費税額・税率6. 3 バーセント適用分（別表 1-2 ⑬B 欄）． △3億5 9 1 2 万3244 円上記金額は、前記に）b の金額と同額である。\n\n\nCり） 合計差引譲渡割額（別表 1-2 ⑱ 欄） △9694 万7 8 0 7 円上記金額は、次のa の金額と b の金額の合計額である。\n\n\n52 •\n\n\n：還付すべき譲渡割額・税率4 パーセント適用分（別表 1-2 ⑯A 欄） ・\n\n\n．．．\n\n\n・・・ ...\n\n\n．．\n\n\n.• ．．•.•.•.••• .\n\n\n.\n\n\n••．．•．\n\n\n•. .\n\n\n△4 万1 5 3 5 円\n\n\n・上記金額は、地方税法 7 2 条の83 の規定に基づき、前記告a} の金額に税率100 分の2 5 を乗じて算出した金額である。\n\n\nb 還付すべき譲渡割額・税率6. 3 パーセント適用分（別表1-2 ⑯B欄） △9690 万6.2 7 2 円\n\n\ns上記金額は、地方税法7 2 条の8 .規 定に基づき、前記(:¥=,) b の金額に税率6 3 分の 1 7 を乗じて算出した金額である。\n\n\n例既に納付の確定した譲渡割額（別表 1-2 ⑲C 欄）\n\n\n△1億4364 万2854 円上記金額は、平成28 年3 月課税期間確定申告書の⑲「譲渡割額還付額」\n\n\n欄に記載された金額（還付税額であることからこれを「△」表記した金額。\n\n\n後記エ及びオの「例 既に納付の確定した譲渡割額」において同じ。）と同額である。\n\n\n（コ） 差引納付すべき譲渡割額（別表 1-2 ⑳C 欄） 4669 万5000 円\n\n\n＇上記金額は、前記り）の金額から前記拐の金額を減算した金額（ただし、\n\n\n・地方税法2' 0 条の4 の2\n\n\n\n\n\n\n第3 項の規定に基づき\n\n\n1 0 0 円未満の端数金額を切り捨てた後の金額。後記エ及びオの「（コ） 差引納付すべき譲渡割額」において同じ。）である。\nc捌 差引納付すべき消費税等の合計税額（別表 1-2 ⑪ 欄）\n2億 1 9 7 4 万1 3 0 0 円上記金額は、前記位）の金額と前記（コ）の金額との合計額であり、原告が平成28 年 3 月課税期間更正処分により新たに納付すべき消費税等の額である。\n平成2 9 年 3 月課税期間更正処分の根拠ゥE\nc課税標準額（別表 1-3 ① 欄） 324 億 5090 万3000 円上記金額は、原告の平成2 9年 3 月課税期間確定申告書の①「課税標準\n．．．\n \n. ..\n．．\n．••．••．• ••\n．．．\n．..．..．額」欄に記載された金額と同額である。\n1-3\n• {{)課税標準額に対する消費税額（別表 ②C 欄）\n20 億・4 3 8 2 万0276 円上記金額は、次の a の金額と b の金額との合計額であり、平成29 年3月課税期間確定申告書の②「消費税額」欄に記載された金額と同額である。\na 課税標準額に対する消費税額・税率4 パーセント適用分•（別表 1-3\n②A 欄） 0 円上記金額は、平成29 年3 月課税期間確定申告書に添付された付表 1の②「消費税額（税率4 パーセント適用分B) 」欄に記載された課税標準額（0 円）に係る消費税額と同額である。\nJO\nb 課税標準額に対する消費税額・税率6 . 3 バ._セント適用分（別表 1\n3 ②B 欄 ） ， 20 億4382 万0 2.7 6 円\n9 -上記金額は、平成2 9年3 月課税期間確定申告書に添付された付表 1の②「消費税額（税率6. 3バーセント適用分C) 」欄に記載された金額と同額である。\nヽ\nc\n（ウ） 控除対象仕入税額（別表 1- ・3④ 欄・別表2-3 ⑰C 欄）\n1 5億7 3 0 1万4713 円上記金額は、次の aの金額と b の金額との合計額である。\n控除対象仕入税額・税率4 パーセント適用分（別表 1-3 ④A 欄・別\na表2-3 ⑰A 欄） 4 万3 6 1 7 円上記金額は、次の)a( の金額に、(b)の金額に cの割合を乗じて計算した金額を加算した金額であり、平成24 年法律\n\n\n\n\n\n\n第68 号附則\n\n\n5 条 7 項の経過措置の適用を受ける消費税法30 条 1項所定の仕入れに係る消費税額\n\n\n• の控除に関する金額である。 ．\n\n\n)a{ '課税対応課税仕入れの税額（別表2-3 ⑧A 欄） 0 円上記金額は、平成2 9年3 月課税期間確定申告書に添付された付表\n\n\n．．\n\n\n．．\n\n\n••．••．•．••\n\n\n．．． ヽ\n\n\n．．．\n\n\n．\n\n\n2-(2)の⑯「⑭のうち、課税売上げにのみ要するもの（税幸~4パーセ ．ント適用分B) 」欄に記載された金額と同額である。\n\n\n)b( 共通対応課税仕入れの税額（別表2-3 ⑫A 欄）\n\n\n1 1 万0128 円上記金額は、平成2 9年3 月課税期間確定申告書に添付された付表\n\n\n)2(..:....2 の⑰「⑭のうち、・課税売上げと非課税売上げに共通して要する ・もの（税率4 パーセント適用分B) .」欄に記載された金額と同額であ ・る。\n\n\nb 控除対象仕入税額・税率6. 3 パーセント適用分（別表 1-3 ④B 欄・別表2-3 ⑰B欄） • 1 5億7 2 9 7 万1 ・O 9 6 円\n\n\nJO上記金額は、次の)a( の金額に、)b( の金額に C の割合を乗じて計算した ‘金額を加算した金額である。\n\n\n)a( 課税対応課税仕入れの税額（別表2-3 ⑧B 欄）\n\n\n＇ 1 3億2422 万4 46 9 円上記金額は、次のiの金額からiiの金額を減算した金額である。\n\n\n申岩による課税対応課税仕入れの税額（別表2-3 ⑨B 柵）\n\n\n1 5億5640 万8654 円上記金額は、平成29 年 3 月課税期間確定申告書に添付された付表2-(2) の⑯「⑭のうち、課税売上げにのみ要するもの（税率6.\n\n\n3パーセント適用分C) 」欄に記載された金額と同額である。\n\n\njj 前記．iの課税対応課税仕入れの税額から減算すべき金額（別表 2\n\n\n-3 ⑩ B 欄及び⑪B 欄の合計額） ・2億3 2 1.8 万4 1 8 5 円\n\n\n・ 上記金額は、次の(i)の金額と(i i)の金額の合計額である。\n\n\n•• (i)前記iに含まれた本件各課税仕入れに係る税額（別表 2-3 ⑩\n\n\nB欄） 2億2 9 1 6 万8290 円祁\n\n\n上記金額は、 •前記i・の金額に含まれた本件各課税仕入れに係る\n\n\n．．．\n\n\n...\n\n\n•••••\n\n\n.• ．． • ． •••••\n\n\n．．．\n\n\n． ．\n\n\n-\n\n\n..．\n\n\n.\n\n\n.\n\n\n.\n\n\n.\n\n\n-消費税額（平成29 年3 月課税期間の本件各建物の取得価額の合計額36 億 3759 万 2233 円と、これに係る消費税等の額の合計額2億 9 1 0 0 万．7 0 4 1 円との合計額39 億 2 8 5 9 万9\n\n\n. 2 7 4 円に 1 0 8 分の 6. 3 を乗じて算出した金額）であり、本 ・件各課税仕入れが共通対応課税仕入れに区分されることから、前記iの課税対応課税仕入れの税額から減算されるべき金額である。\n\n\n(ii)前記iに含まれた共通対応課税仕入れに区分される課税仕入れ（各役務の提供）に係る税額（別表2-3 ⑪B 欄）\n\n\n3 0 1 万5895 円上記金額は、前記iの金額に含まれた、原告が本件各建物の一部の物件の取得の際に仲介業者に対して支払った各役務の提供の対価（仲介手数料）の額に係る消費税相当額であり、当該各役務の提供（課税仕入れ）は、課税対応課税仕入れには区分されず、\n\n\n共通対応課税仕入れに区分されることから、前記iの課税対応課税仕入れの税額から減算すべき金額である。\n\n\n)b( 共通対応課税仕入れの税額（別表2-3 ⑫B 欄）\n\n\n.6 億2805 万7 1 0 0 円上記金額は、次のiの金額にiiの金額を加算した金額である。\n\n\n・1 申告による共通対応課税仕入れの税額（別3表 :2 ⑬B 欄）\n\n\n3億 6675 万0808 円上記金額は、平成29 年3 月課税期間確定申告書に添付された付\n\n\n・表2・ー)2( の⑰「⑭のうち、課税売上げど非課税売上げに共通して要するもの（税率6. 3 パーセント適用分C) 」欄に記載された金額と同額である。\n\n\n` 前記iの共通対応課税仕入れの税額に加算すべき金額（別表 2-お ． 1\n\n\n3⑭B 欄及び⑮B 欄の合計額） 2像6130 万6292 円 ・\n\n\n．．．\n\n\nや一：； ．．\n\n\nll ぷや．ヽ’¢ ．．\n\n\n...` ぶ 睾 ＇ ， ヽ ． • 岳 :•9’ • 宅 '- ? t ’ 、( ； ’ :' l ； ’ . • 9 と `, • . 9 ● ．． ．． ． ．\n\n\n9占:‘r ~\n\n\nI·\n\n\n:，.ア\n\n\n9.\n\n\n、\n\n\n．\n\n\n＝\n\n\nc\n\n\n•\n\n\n••?\n\n\n：\n\n\n•\n\n\nJ\n\n\nヽ\n\n\n' ,..•ヂ＾9，”\n\n\n‘．・.？苺訊\n\n\n•；. ． , ． ←• . 上 , ； .；.•i ・9・ ・ F • . }• , 9 9上記金額は、次の(i)の金額と(ii)の金額の合計額である。\n\n\n(i)本件各課税仕入れに係る金額（別表 2-3 ⑭B 欄）\n\n\n2億2 9 1 6万8 2 9 0 円上記金額は、前記)a(ii (i)の本件各課税仕入れに係る消費税額であり、本件各課税仕入れが、共通対応課税仕入れに区分されることから、共通対応課税仕入れの税額に加算されるべき金額である。\n\n\ni( i)共通対応課税仕入れに区分される各役務の提供に係る金額（別表2-3 ⑮B 襴） 3213 万8002 円上記金額は、原告が本件各建物の一部の物件の取得の際に仲介\n\n\nlo業者に対して支払った各役務の提供の対価（仲介手数料）の額に係る消費税相当額873 万8 2 1 6 円（なお、同金額は課税対応\n\n\n3 1課税仕入れの税額から減算される 0 万 5 8 9 5 円〔前記\n\n\na( ii) (ii）〕を含む。）及び原告が住宅を建設して販売する目的の土地に関して造成業者に対して支払った各役務の提供の対価（士地の造成費）の額に係る消費税相当額2 3 3 9 万9 7 8 6 円の合計額である。\n\n\n原告は、上記金額に係る課税仕入れついては課税対応課税仕入れ又は非課税対応課税仕入れに区分されるとして、共通対応諌税仕入れに含めていないが、上記各役務の提供（各課税仕入れ）が共通対応課税仕入れに区分されることから、前記iの共通対応課税仕入れの税額に加算すべき金額である。\n\n\n課税売上割合（別表2-3 ⑤ c 欄）\n\n\nc\n\n\n39. '605734558 （以下略）パーセント上記割合は、次の)a( の金額のうちに)b( の金額の占める割合である。\n\n\n)a( 資産の譲渡等の対価の額の合計額（別表 2-3 ④C 欄）\n\n\n．．．\n\n\n・・\n\n\n．ヽ ． ．．\n\n\n•\n\n\n．\n\n\n．•・．\n\n\n．\n\n\n．．．．\n\n\n．．．\n\n\n...\n\n\n8 1 9億5805 万3 1 0 7 円上記金額は、平成29 年3 月課税期間確定申告書に添付された付表\n\n\n2-(2) の⑦「資産の譲渡等の対価の額（⑤＋⑥）」欄に記載された金額と同額である。\n\n\nc\n\n\n}b( 課税資産の譲渡等の対価の額の合計額（別表2-3 ① 欄）\n\n\ns\n\n\n324 億6008 万8 96 3 円上記金額は、平成2 9年3 月課税期間確定申告書に添付された付表\n\n\n2-(2) の④「課税資産の譲渡等の対価の額（①＋②十③）」欄に記載された金額と同額である。\n\n\nc目合計差引税額（別表1-3 ⑩ 欄）、 4億70 80 万.5 5 0 0 円\n\n\n・上記金額は、次のa の金額と b の金額の合計額である。\n\n\n控除不足還付税額・税率4 バーセント適用分（別表1-3 ⑧A 欄）\n\n\na\n\n\n△4 万3 6 1 7 円上記金額は、前記(1 )a の金額から前記（ウ）a の金額を減算した金額であ\n\n\n51 る。•\n\n\nb 差引税額・税率6 . 3バーセン・ ト適用分（別表 1-3•⑨B欄）\n\n\n4億7084 万9 1 8 0 円・上記金額は、．前記（イ）b の金額から前記（ヴb の金額を減算した金額である。・\n\n\nc\n\n\n• 02 出 既に納付の確定した本税額（別表 1-3 ⑪ 欄）\n\n\n3億4 2 1 1 万 3 6 00 円上記金額は、平成29 年3月課税期間確定申告書の⑨「差引税額（・②＋\n\n\n③ー⑦）」欄に記載された金額と同額である。\n\n\nc切） 差引納付すべき消費税額（別表 1-3 ⑫ 欄）\n\n\n万\n\n\n1億2869 1 9 0 0 円蕊\n\n\n上記金額は、前記に）の金額から前記けの金額を減算した額である。\n\n\n．．．\n\n\n．．．．．\n\n\n・..・・・\n\n\n. ． . ． ． . ． ． ' ．\n\n\n．．．\n\n\nc\n\n\n)-=¥:( 合計差引地方消費税の課税標準額（別表1-3 ⑮ 欄）\n\n\n釦\n\n\n4 080 万5 .5 0 0 円上記金額は、次のa の金額と b の金額の合計額であり、地方税法7 2 条の82の規定に基づく地方消費税の課税標準額である。\n\n\n・a譲渡割額の還付額の基礎となる消費税額・税率4 パーセント適用分\n\n\n• 6\n\n\n（別表1-3 ⑬A 欄） •\n\n\n△4 万3617 円上記金額は、前記に）a の金額と同額である。\n\n\nb譲渡割額の納付額の基礎となる消費税額・税率6・. 3 パーセント適用分（別表1-3 ⑭B 欄） 4 億7084 万9 1 8 0 円上記金額は、前記に）bの金額と同額である。\n\n\n（ク） 合計差引譲渡割額（別表1-3 ⑱ C 欄） 1億 2704 万3600 円上記金額は、次のa の金額と b の金額の合計額である。\n\n\na.還付すべき譲渡割額・税率4 バーセント適用分（別表1-3 ⑯A 欄）\n\n\n△1 万0904 円上記金額は、地方税法72 条の83 の規定に基づき、前記囲a の金額に税率 1 0 0分の25 を乗じて算出した金額である。\n\n\nb納付すべき譲渡割額・税率6. 3 パーセント適用分（別表l・-3 ⑰B欄） ・ 1億 2705 万4540 円\n\n\n・上記金額は、地方税法7 2条の83 の規定に基づき、前記囲b の金額に税率6 3分の1 7 を乗じて算出した金額である。\n\n\nc仇 既に納付の確定した譲渡割額（別表1-3 ⑲ 欄）\n\n\n9 2 3 I 万7200 円上記金額は、平成29 年3月課税期間確定申告書の⑳「譲渡割額納税額J欄に記載された金額と同額である。\n\n\n（コ）\n\n\n差引納付すべき譲渡割額（別表1-3 ⑳C 欄） 3 4 7 ・2 万6400 円蕊\n\n\n上記金額は、前記（ク）の金額から前記例の金額を減算した額である。\n\n\n．．．\n\n\n．．．．．\n\n\n..．．\n\n\n.\n\n\n.．.．.\n\n\n- . .\n\n\n．．．捌差引納付すべき消費税等の合計額（別表 1-3 ⑪C 欄）\n\n\n1億6 3 4 1万 8300 円上記金額は、前記切）の金額と前記（コ）の金額との合計額であり、原告が平 ・成 2 .9 年 3 月課税期間更正処分により新たに納付すべき消費税等の額である。\n\n\n工 平成30 年3 月課税期間更正処分の根拠げ課税標準額（別表 1-4 ①C 欄） 335 億2634 万5000 円上記金額は、原告の平成30 年 3 月課税期間確定申告書の①「課税標準額」欄に記載された金額と同額である。\n\n\n．・: （イ） 課税標準額に対する消費税額（別表 1-,4 ②C 欄） ＇\n\n\nJO\n\n\n20 億8644 万 7.3 7 円上記金額は、次のa の金額とb の金額との合計額であり、平成0..3 年 3月課税期間確定申告書の②「消費税額」襴に記載された金額と同額である。\n\n\na 課税標準額に対する消費税額・税率4 バーセント適用分（別表 1-4\n\n\n51 ②A欄） ． ． 』 • ・ 0 円上記金額は、平成30 年3 月課税期間確定申告書に添付された付表 1の②「消費税額（税率 4 パ・ーセント適用分B) 」欄に記載された課税標準額（0 円）に対する消費税額と同額である。 •\n\n\nb 課税標準額に対する消費税額・税率6. 3 バーセント適用分（別表 1\n\n\n-4 ②B 欄） ・ 20 億8644 万97 3 7 円\n\n\n20 .上記金額は、平成30 年3 月課税期間確定申告書に添付された付表 1の②「消費税額（税率 6. 3 パーセント適用分C) 」欄に記載された金額と同額である。\n\n\nc\n\n\n（ウ） 控除対象仕入税額（別表4_.:1 ④C 欄・別表2-4 ⑰ 欄）\n\n\n• 20 億00 41 万5640 円蕊\n\n\n上記金額は、次の a の金額と b の金額との合計額である。\n\n\n．．．\n\n\n．．\n\n\n．． ..\n\n\n．．\n\n\n．．．\n\n\n．．．\n\n\na 控除対象仕入税額・税率4~~ーセント適用分（別表 1-4④A欄・別表2-4 ⑰A 欄） ． 1 万8966 円上記金額は、次の(a)の金額に、 •(b)の金額に c の割合を乗じて計算した金額を加算した金額であり、平成2.4 年法律第6 8 号附則5条 7 項の経\n\n\ns過措置の適用を受ける消費税法30 条1項所定の仕入れに係る消費税額の控除に関する金額である。\n\n\n)a( ●課税対応課税仕入れの税額（別4..表...:.2 ⑧A 欄） 0 円上記金額は、平成24 年法律第6.8 号附則5 条の経過措置の適用を受ける課税資産の譲渡等について、消費税法29 条の規定に基づき算\n\n\nm出される金額であるが、前記 の金額に、当該課税資産の譲渡等に係る金額が含まれていないため生じないものであり、平成30 年3 月課税期間確定申告書に添付された付表.2-(2) の⑯「⑭のうち、・課税売上・げにのみ要するもの（税率4 パーセント適用分B) 」欄には金額が記載されていない。\n\n\n)b( 共通対応課税仕入れの税額（別表2-4 ⑫A 欄） 4 万9 6 1 9 円\n\n\ns1 .上記金額は、平成30 年3 月課税期間確定申告書に添付された付表\n\n\n2-(2)の⑰「⑭の店、課税売上げと非課税売上げに共通して要するもの（税率4 バーセント適用分B) 」欄に記載された金額と同額である。\n\n\nb 控除対象仕入税額・税率6. 3 パーセント適用分（別表1-4 ④B 欄・勾\n\n\n別表2-4 ⑰B 欄） ． 20 億0039 万6674 円上記金額は、次の)a( の金額に、)b( の金額に c の割合を乗じて計算した金額を加算した金額である。\n\n\nB\n\n\n)a( 課税対応課税仕入れの税額（別表2-4 ⑧ 欄）\n\n\n1 7億3057 万2557 円\n\n\n62 . .上記金額は、次のiの金額からiiの金額を減算した金額である。\n\n\n....\n\n\n. .\n\n\n•・▼ ●\n\n\n..\n\n\n．... ．．\n\n\n..．．．\n\n\n. .\n\n\n．．．申告による課税対応課税仕入れの税額（別表2-4 ⑨B 欄）\n\n\nー\n\n\n20 億 2 0 1 7 万3978 円上記金額は、平成30 年 3月課税期間確定申告書に添付された付表2-(2) の⑯「⑭のうち、課税売上げにのみ要するもの（税率6.パーセント適用分C) 」欄に記載された金額と同額である。・\n\n\nii. 前記iの課税対応課税仕入れの税額から減算すべき金額（別表 2 ‘•\n\n\n-4 ⑩B欄及び⑪B 欄の合計額） 2億 8960 万14. 2 1 円上記金額は、次の(i)の金額と(i i)の金額の合計額である。\n\n\n(i)前記iに含まれた本件各課税仕入れに係る税額（別表 2-4 ⑩\n\n\nB欄） 2億 8058 万2757 円上記金額は、前記iの金額に含まれた本件各課税仕入れに係る消費税額（平成30 年 3月課税期間の本件各建物の取得価額の合計額44 億 5.3 6 9 万4621 円と、これに係る消費税等の額の合計額3億 5629 万5508 円との合計額4.8億0999 万0 .\n\n\n1 2 9 円に 1 O 8 分の 6. 3 を乗じて算出した金額）であり、本件各課税仕入れが、共通対応課税仕入れに区分されることから、\n\n\n， 前記iの課税対応課税仕入れの税額から減算すべき金額である。\n\n\n(ii)前記iに含まれた共通対応課税仕入れに区分される課税仕入れ（各役務の提供）に係る税額（別表 2- .4 ⑪B欄）\n\n\n9 0 1万8664 円加\n\n\n上記金額は、前記iの金額に含まれた、原告が本件各建物の一部の物件の取得の際に仲介業者に対して支払った各役務の提供の対価（仲介手数料）の額に係る消費税相当額7 6 5 万7 6 6 3 ・円及び原告の共同出資型不動産事業部において行った各課税仕 ・入れについて一般管理費として計上した額に係る消費税相当額\n\n\n1 3 6 万10 0 1 円の合計額である。上記各役務の提供（課税仕\n\n\n．．．\n\n\n..\n\n\n．．\n\n\n．．．\n\n\n．．．\n\n\n． .．..．入れ）は課税対応課税仕入れには区分されず共通対応課税仕入れに区分され、また、同事業部は、土地と建物の販売を行う部署であり 、その一般管理費に当たるものとして行われた上記各課税仕入れは、同事業部における事業全般t土地〔非課税資産〕及び建物〔課税資産〕双方の譲渡という課税売上げ）に要するものであ ・って、課税対応課税仕入れには区分されず、共通対応課税仕入れに区分されることから、上記合計額は、前記iの課税対応課税仕入れの税額から減算すべき金額である。\n\n\n)b( 共通対応課税仕入れの税額（別表2-4 ⑫B 欄）\n\n\n7億~591万 1 3 8 5 円上記金額は、次のiの金額にiiの金額を加算した金額である。\n\n\n. 申告による共通対応課税仕入れの税額（別表2-4 ⑬B 欄）\n\n\nl\n\n\n3億2700 万6 0 1 7 円上記金額は、平成30 年3 月課税期間確定申告書に添付された付表2-(2) の⑰「⑭のうち、課税売上げと非課税売上げに共通して要するもの（税率6. 3 パーセント適用分C) 」欄に記載された金額と同額である。\n\n\nぶ 前記iの共通対応課税仕入れの税額に加算すべき金額（別表 2-ユ\n\n\n4 ⑭B 欄及び⑮B 欄の合計額） 3億 7890 万5368 円上記金額は、次の(i)の金額と(ii)の金額の合計額である。\n\n\nB\n\n\n(i)本件各課税仕入れに係る税額（別表 2・-4 ⑭ 欄） ．\n\n\n2億8058 万2 7 5 7 円上記金額は、＇前記 )a( ii (i)の本件各課税仕入れに係る消費税額であり、本件各課税仕入れが、共通対応課税仕入れに区分される\n\n\n• ことから、共通対応課税仕入れの税額に含まれるべき金額である。\n\n\ni( i)共通対応課税仕入れに区分される各役務の提供に係る金額（別\n\n\n．．．\n\n\n．．．．．．．\n\n\n..．．\n\n\n．．．\n\n\n．．．\n\n\n．....．．表2-4 ⑮B 欄） 9 8 3 2 万2 6 1 1 円上記金額は、原告が本件各建物の一部の物件の取得の際に仲介業者に対して支払った各役務の提供（仲介手数料） ＇の額に係る消費税相当額 5 6 3 万1 8 9 2 円（なお、課税対応課税仕入れの万\n\n\n税額から減算される 765 7663 円（前記H)a( (ii))を含む。）\n\n\n及び原告の共同出資型不動産事業部において行った課税仕入れについて一般管理費として計上した額に係る消費税相当額1 3 6 万 ．\n\n\n1 0 0 1 円（課税対応課税仕入れの税額から減算される額〔前記・\n\n\na( ii} (ii）〕と同じ。）並びに原告が住宅を建設して販売する目的の土地に関して造成業者に対して支払った各役務の提供の対価\n\n\nOI\n\n\n（土地の造成費）の額に係る消費税相当額8 1 3 2 万9 1 8 円の合計額である。 ・原告は、上記金額に係る課税仕入れについては、課税対応課税＇仕入れ又は非課税対応課税仕入れに区分されるとして、共通対応課税仕入れに含めていないが、上記各役務の提供等の各課脱仕入れが共通対応課税仕入れに区分されることから、前記iの共通対応課税仕入れの税額に加算すべき金額である。\n\n\nc 課税売上割合（別表2-4 ⑤c欄）\n\n\n38. 223511223 （以下略）パーセント上記割合は、次の)a( の金額のぅちに)b( の金額の占める割合である。\n\n\n)a( 資産の譲渡等の対価の額の合計額（ ] 月 I 表2-4 ④c襴）．\n\n\n8 7 7億5049 万1 4 2 7 円上記金額は、平成30 年 3 月課税期間確定申告書に添付された付表\n\n\n.2-(2) の⑦「資産の譲渡等の対価の額（⑤＋⑥）」欄に記載された金額と同額である。\n\n\n)b( 課税資産の譲渡等の対価の額の合計額（別表 2-4 ①c欄）\n\n\n．．．\n\n\n．．．．．\n\n\n.\n\n\n•,\n\n\n．．\n\n\n．．．\n\n\n..．.• ．•．\n\n\n．．．\n\n\n3 3 5億4 1_3 ・1 万8939 円上記金額は、平成30 年3月課税期間確定申告書に添付された付表\n\n\n2-(2) の④「課税資産の譲渡等の対価の額．（①十②十③）」欄に記載された金額と同額である。\n\n\nに） 合計差引税額（別表1-4 ⑩ c 欄） 8602 万2200 円上記金額は、次の a の金額と b の金額の合計額である。\n\n\na 控除不足還付税額・税率4 パー・セント適用分（別表1-4 ⑧A 欄）\n\n\n△1 万8966 円上記金額は、前記（イ）a の金額から前記（ヴa の金額を減算した金額である。\n\n\nb 差引税額・税率6. 3 パーセント適用分（別表 1 .-4 ⑨B 欄）．\n\n\n8604 万．1 1 7 3 円上記金額は、前記（イ）b の金額か・ら前記（ウ）b の金額及び貸倒れに係る税額1万1 8 9 0 円を減算した金額である。\n\n\nなお、上記貸倒れに係る税額は、平成3 0 年3 月課税期間確定申告書に添付された付表 1 の⑥「貸倒れに係る税額（税率6. 3 バーセント適用分C) 」欄に記載された金額と同額である。\n\n\ncけ 既に納付の確定した本税額（別表 1-4 ⑪ 欄）\n\n\n△5 S.7 4 万8 2 78 円上記金額は、平成30 年 3 月課税期間確定申告書の⑧「控除不足還付税額（⑦―②―③)」欄に記載された金額と同額である。\n\n\n切） 差引納付すべき消費税額（別表 1-4 ⑫C 欄）\n\n\n1億4477 万0400 円上記金額は、前記国の金額から前記団の金額を減算した金額である。\n\n\n2S . ~) 合計差引地方消費税の課税標準額・（別表 1-4 ⑮C 欄）\n\n\n8602 万2200 円\n\n\n．．．\n\n\n...\n\n\n:\n\n\n．．\n\n\n． ．． ．•. ·•．. ..\n\n\n．．．\n\n\n．．．\n\n\n•••上記金額は、次のa の金額と b の金額の合計額であり、地方税法7 2 条の82 の規定に基づく地方消費税の課税標準額である。\n\n\na譲渡割額の還付額の基礎となる消費税額・税率4 パーセント適用分\n\n\n（別表 1-4 ⑬A 欄） • • △ 1 万8966 円上記金額は、前記に）a の金額と同額である。\n\n\nb譲渡割額の納付額の基礎となる消費税額・税率6. 3 パーセント適用分（別表1-4 ⑭B 欄） .8 6 0 4 万1 1 7 3 円\n\n\nb上記金額は、前記因 の金額と同額である。\n\n\n例 合計差引譲渡割額（別表1-4 ⑱ c 欄） 2 3 2 1万2700 円上記金額は、次のa の金額と b の金額の合計額である。\n\n\n還付すべき譲渡割額・税率4 パーセント適用分（別表 1-4 ⑯A 欄）\n\n\na\n\n\n． ．△4741 円上記金額は、地方税法72 条の8 3 の規定に基づき、前記~a の金額に税率i OO 分の25 を乗じて算出した金額である。\n\n\nb 納付すべき譲渡割額・税率6. 3バーセント適用分（別表 1-4 ⑰ B\n\n\n16 ｀\n\n\n2 3 2 1万7459 円欄）\n\n\n・上記金額は、地方税法72 条の8 3 の規定に基づき、前記(:¥:-) b の金額に税率63 分の 1 7 を乗じて算出した金額である。\n\n\nc仇 既に還付の確定した譲渡割額（別表1.-4 ⑲ 欄）\n\n\n△1 5 8 5 万2333 円 ．上記金額は、平成30 年3月課税期間確定申告書の⑲「譲渡割額還付額」\n\n\n欄に記載された金額と同額である。 ．i\n\n\nc ・s\n\n\n（コ）差引納付すべき譲渡割額（別表1-4 ⑳ 禰）\n\n\n・\n\n\n3906 万 円上記金額は、前記（ク）の金額から前記例の金額を減算した額である。\n\n\nc捌差引納付すべき消費税等の合計税額（別表 1-4 ⑪ 欄）\n\n\n1億8383 万5400 円\n\n\n．．．\n\n\n．．．．．．．\n\n\n．．\n\n\n．．． ．．\n\n\n．．．\n\n\n...\n\n\n● •• ・\n\n\n•••上記金額は、前記渕の金額と前記（コ）の金額との合計額であり、 ．原告が平成30 年3 月課税期間更正処分により新たに納付すべき消費税等の額である。\n\n\nオ 平 成3 1年3月課税期間更正処分の根拠げ）課税標準額（別表1-5 ①C 欄） 3 1 1億8 5 65 万9000 円上記金額は、．原告の平成3 1年3 月課税期間確定申告書の①「課税標準額」欄に記載された金額と同額である。\n\n\nc\n\n\n（イ） 課税標準額に対する消費税額（別表 1-5 ② 欄）．\n\n\n1 9億6467 万2635 円上記金額は、次のa の金額と b の金額との合計額であり、平成3 1 年3月課税期間確定申告書の②「消費税額J欄に記載された金額と同額である。\n\n\na 課税標準額に対する消費税額・税率4 バーセント適用分（別表1・-5\n\n\n②A 欄）’ ’ 0 円． I上記金額は、平成3 1年3月課税期間確定申告書に添付された付表 1の②「消費税額（税率4 パーセント適用分B) 」欄に記載された課税標準額 (0 円）に係る消費税額と同額である。\n\n\nb 課税標準額に対する消費税額・税率6. 3パーセント適用分・（別表1\n\n\n-5 ②B 欄 ） ． ・ 1 9億6467 万2 6 3 5 円上記金額は、平成3 1年3月課税期間確定申告書に添付された付表 1\n\n\n．の②「消費税額（税率6. 3 パーセント適用分C) 」欄に記載された金額と同額である。\n\n\nc\n\n\n（ウ）控除対象仕入税額（別表1-5 ④ 欄・別表2-5 ⑱C欄）\n\n\n・2 2億1 6 9 1万0920 円上記金額は、次のa の金額と b の金額との合計額である。\n\n\na ・控除対象仕入税額・税率4 バーセント適用分（別表1-5 ④A 欄・別\n\n\nI• 表 2 - 5⑱A 欄） 882 円\n\n\n...\n\n\n．．，．．\n\n\n．．．．．．．\n\n\n．．\n\n\n..\n\n\n.-\n\n\n●\n\n\n．•．•\n\n\n．\n\n\n．\n\n\n． ●． ●‘上記金額は、次の)a( の金額に、)b( の金額にcの割合を乗じて計算した金額を加算した金額であり：平成24 年法律\n\n\n\n\n\n\n第6 号附則\n\n\n5条 7 項の経\no過措置の適用を受ける消費税法3 条1項所定の仕入れに係る消費税額・の控除に関する金額である。・\n)a( 課税対応課税仕入れの税額（別表2-5 ⑧A 欄） 0 円上記金額は、平成24 年法律第6 8 号附則5 条の経過措置の適用を受ける課税資産の譲渡等について、消費税法2 9条の規定に基づき算\nm出される金額であるが、前記 の金額に、当該課税資産の譲渡等に係 ・る金額が含まれていないため生じないものであり、• 平成 3\n1 年3月課税期間確定申告書に添付された付表2-(2) の⑯「⑭のうち、課税売上げにのみ要するもの（税率4 バーセント適用分B) 」欄には金額が記載されていない。\n)b( 共通対応課税仕入れの税額（別表2-5 ⑫A 欄） .2 6 2 0 円上記金額は、平成3 1年3 月課税期間確定申告書に添付された付表\n2-(2)の⑰「⑭のうち、課税売上げと非課税売上げに共通して要するもの（税率4 パーセント適用分B) 」欄に記載された金額と同額である。\nb 控除対象仕入税額・税率6. 3パーセント適用分（別表．1-5 ④B 欄・円\n別表2-5 ⑱B 欄） 2 2億1'6 9 1 万0038上記金額は、次の)a( の金額に、)b( の金額にc の割合を乗じて計算した金額を加算した金額である。\n)a( 課税対応課税仕入れの税額（別表2-5 ⑧B 欄）\n. 1・9 億 9650 万7 51 8 円上記金額は、次のiの金額からiiの金額を減算した金額である。\n. i 申告による課税対応課税仕入れの税額 ・（別表.2-5 ⑨B 欄）\n2 2億7329 万7 5 8 1 円\n '\n•••\n．•.\n.\n・..．. ．.\n.\n.． .．\n.\n. .． ..\n••\n．．．上記金額は、平成3 1年 3月課税期間確定申告書に添付された付\n・表2 ~(2)の⑯「⑭のうち、課税売上げにのみ要するもの （税率6.\n3バーセント適用分C) j欄に記載された金額と同額である。\nぶ前記iの課税対応課税仕入れの税額から減算すべき金額（別表 2\n-5 ⑩B 欄及び⑪B 欄の合計額）： ・2億7679 万0063 円．\n-\n-上記金額は、．次の(i)の金額と(ii)の金額の合計額である。\n(i)前記iに含まれた本件各課税仕入れに係る税額（別表 2-5 ⑩ ,\nI円\nB欄） ・ 2億 7287 万9197上記金額は、前記i・の金額に含まれた本件各課税仕入れに係る\n・ ・消費税額（平成3 1年3 月課税期間の本件各建物の取得価額の合計額4 3億3 1 4 1万5906 円と、 ．これに係る消費税等の額の合計額3憶4651 万320 2 円との合計額46 億 7 7 9 ・2万9\n108 円＇に1.0 8 分の6 . 3 を乗じて算出した金額）であり、．本件各課税仕入れが、共通対応課税仕入れに区分されることから、\n前記iの課税対応課税仕入れの税額から減算すべき金額である。\n)ii(前記iに含まれた共通対応課税仕入れに区分される課税仕入れ（各役務の提供）に係る税額（別表2,-5 ⑪B 欄） ．\n3 9 1 万0 8 6 6 円上記金額は、前記iに含まれた、原告が本件各建物の一部の物件の取得の際に仲介業者に対して支払った各役務の提供（仲介手数料）の額に係る消費税相当額200 万3204 円及び原告の共同出資型不動産事業部において行った課税仕入れについて一般管理費に計上した額に係る消費税相当額 1 9 0 万 7 6 6 2 円の合計額である。．上記各役務の提供（課税仕入れ） ！ま課税対応課税．\n．仕入れには区分されず共通対応課税仕入れに区分され、また、同事業部は、土地と建物の・販売を行う部署であり、その一般管理費\n•• ••••• •\n．\n．\n．\n．\n．．．． ．．\n． ．\n．．\n．\n．．．\n.\n． ． .\n．\n．に当たるものとして行われた上記各課税仕入れは、同事業部における事業全般（土地 ．〔非課税資産〕及び建物〔課税資産〕双方の譲渡という課税売上げ）に要するものであって、課税対応課税仕入れには区分されず、共通対応課税仕入れに区分されることから、\n上記合計額は、前記iの課税対応課税仕入れの税額から減算すぺき金額である。\n)b( 共通対応課税仕入れの税額（別表2-5 ⑫B 欄）\n• 6億 5438 万1 2 5 7 円上記金額は、次のiの金額にiiの金額を加算し 、iiiの金額を減算し ．た額である。 ..\nJO\ni\n.申告による共通対応課税仕入れの税額（別表2-5 ⑬B 欄）\n億 万 円\n. • . 3 2 1 1 0 2 4 48上記金額は、平成 年 月課税期間確定申告書に添付された付\n3 1 3表2-(2) の⑰「⑭のうち、課税売上げと非課税売上げに共通して要するもの（税率6 . 3 パーセント適用分C) 」欄に記載された金額と同額である。\n\"ll 前記iの共通対応課税仕入れの税額に加算す べき金額（別表2-\n3億3 3 8 9 万5096 円\n5⑭B欄及び⑮B欄の合計額）•上記金額は、次の(i)の金額と( ii)の金額の合計額である。\n(i)本件各課税仕入れに係る税額（別表 2-5 ⑭B 襴）\n2億7287759197 円上記金額は、前記)a( ii (i)の本件各課税仕入れに係る消費税額であり、本件各課税仕入れが、共通対応課税仕入れに区分されることから、共通対応課税仕入れの税額に加算すべき金額である。\ni(\ni)共通対応課税仕入れに区分される各役務の提供に係る金額（別お\n表2-5 ⑮B 欄） 6 1 0 1・万5 8 9 9 円\n．．．\n•．•．• ••\n•.• •.•.•.••\n．．．\n．．．\n・~．．．\n｀上記金額は、原告が本件各建物の一部の物件の取得の際に仲介業者に対して支払った各役務の提供の対価（仲介手数料）の額に係る消費税相当額5 2 9 万8 8 5 3 円（なお、課税対応渭し税仕入れの税額から減算される 200 万3204 円〔前記a( )ii(ii))を含む。）及び原告の共同出資型不動産事業部において行った課税\ns仕入れについて一般管理費として計上した額に係る消費税相当額．．\n190 万7662 円（課税対応課税仕入れの税額から減算される金額〔前記)a( ii (ii))と同じ。） ・並びに原告が住宅を建設して販売する目的の土地に関して造成業者に対して支払った各役務の提供の対価（土地の造成費）の額に係る消費税相当額5 3 8・0 万9\n384 円の合計額である。\n原告は、上記金額に係る課税仕入れついては、課税対応課税仕入れ又は非課税対応課税仕入れに区分されるとして、共通対応課税仕入れに含めていないが、上記各役務の提供等の各課税仕入れが共通対応課税仕入れに区分されることから、前記iの共通対応 ・課税仕入れの税額に加算すべき金額である。＇泣 前記iの共通対応課税仕入れの税額から減算すべき金額（別表 2\n-5 ⑯B 欄） - 6 1 万6287 円上記金額は、前記iの金額に含まれた、原告が平成 31 年 3 月課税期間の翌課税期間以後に受ける各役務の提供に対して支払った、\n採用費の額に係る消費税相当額1 8 万0327 円及び支払手数料の\n．額に係る消費税相当額1 8 万9000 円並びに広告費の額に係る消費税相当額24 万6 9 0 円の合計額である。\n上記各役務の提供（課税仕入れ）は、原告が平成3 1年 3 月課税・期間中に国内において行った課税仕入れではないから、前記iの共通対応課税仕入れから減算すべき金額である。\n•••\n•．•．• ••\n．•\n♦\n．\n••\n．\n• ••\n．•．•\n．\n．\n． ．\n••\nc\nc 課税売上割合（別表2-5 ⑤ 欄） ．\n33. 681056381 （以下略）パーセント上記割合は、．次の)a( の金額のうちに)b( の金額の占める割合である。\nc\n)a( 資産の譲渡等の対価の額の合計額（別表2-5 ④ 欄）．\n925 億9 1 3 万4949 円上記金額は、平成3 1年3月課税期間確定申告書に添付された付表 ’'\n2 )2(-の⑦「資産の譲渡等の対価の額（⑤＋⑥）」欄に記載された金額と同額である。\nc\n)b( 課税資産の譲渡等の対価の額の合計額（別表2-5 ① 欄）\n3 1 1億8803 万0040 円上記金額は、平成3 1年3月課税期間確定申告書に添付された付表\n2-(2)の④「課税資産の譲渡等の対価の額（①＋②＋・③）」欄に記載された金額と同額である。．に） 合計差引税額（別表1-5 ⑩C 欄） △2億5 2 2 5 万 181 円上記金額は、次の a の金額と b の金額との合計額である。 ・\na 控除不足還付税額・税率4 パーセント適用分（別表1.-5 ⑧A 欄）\n• △882 円上記金額は、前記（イ）a の金額から前記（ヴa の金額を減算した金額である。\n⑧\nb 控除不足還付税額・税率6. 3 バ.;_セント適用分（別表 1-5 B欄）\n△2億5225 万8 ・ 2 9 9 円上記金額は、前記（イ）b の金額から前記（ウ）b の金額及び貸倒れに係る税額2 万0896 円を減算した額である。\nなお、上記貸倒れに係る税額は、平成3 1年3月課税期間確定申告書に添付された付表1 の⑥「貸倒れに係る税額（税率6. 3 パーセント適\nS2用分C) 」欄に記載された金額と同額である。\n．．．\n...•.. • . '••.•.•.\n．．．\n．．．\n．•．•．\n．．．\nc団既に納付の確定した本税額（別表 1-5 ⑪ 欄）\n△4億 1・6 7 9 万7421 円上記金額は、平成3 1年3月課税期間確定申告書の⑧「控除不足還付税額（⑦一②一③）」欄に記載された金額と同額である。\nc切） 差引納付すべき消費税額（別表1-5 ⑫ 欄）\n. 5\n1億6453 万8200 円上記金額は、前記に）の金額から前記はの金額を減算した金額である。・\nc\n（胡合計差弓1地方消費税の課税標準額（別表 1-5 ⑮.• 欄）\n△2億522 5 万9 181 円・上記金額は、次の a の金額と b の金額との合計額であり、地方税法7 2条の8 2の規定に基づく地方消費税の課税標準額である。\na譲渡割額の還付額の基礎となる消費税額・税率4 パ・ーセント適用分\n（別表 1-5 ⑬A欄） ・ △882 円上記金額は、前記に）a の金額と同額である。 ・\nb 譲渡割額の還付額の基礎となる消費税額・税率6 . 3 バーセント適用\n. s・1分（別表1-5 ⑬B 欄） △2億 5 2 2 5 万8 2 9 9 円上記金額は、前記に）b の金額と同額である。\n切合計差引譲渡割（別表1-5 ⑱ c 欄） △68 Q 6 万9 9 1 9 円上記金額は、次のa の金額と b の金額との合計額である。\na 還付すべき譲渡割額・税率4 バーセント適用分（別表 1-5 ⑯A 欄）\n△_2 20 円上記金額は、地方税法72 条の8 3 の規定に基づき、前記囲 の金額に税率 1 0 0 分の2 5 を乗じて算出した金額である。\nb 還付すべき譲渡割額・税率6. 3 パーセント適用分（別表 1- 5⑯B欄）\n△6806 万9699 円\n52 '\nb上記金額は、地方税法72 条の83 の規定に基づき、前記囲 の金額\n．．．\n．．．．．\n．．\n•．•．••．• ••\n．．．\n.. •..•.\n．．．に税率63 分の 1 7 を乗じて算出した金額である。\nc例 既に納付の確定した譲渡割額（別表 1-5 ⑲ 欄）\n△1億 1246 万9 1 2 7 円上記金額は、平成3 1年3 月課税期間確定申告書の⑲「譲渡割額還付額J欄に記載された金額と同額である。・\nc\n（コ） 差引納付・すべき譲渡割額（別表 1-5 ⑳ 欄） 4439 万9200 円上記金額は、前記り）の金額から前記例の金額を減算した額である。\n捌 差引納付すべき・消費税等の合計税額（別表 1-5 ⑪ c 欄）\n2億0 8 9 3 万7400 円上記金額は、前記切）の金額と前記（コめ金額との合計額であり、原告が平成 3 1 年 3 月課税期間更正処分により新たに納付すべき消費税等の額である。\n)2( 本件各更正処分の適法性被告が本訴において主張する原告の本件各課税期間の納付（又は還付）すべき消費税額及び地方消費税の譲渡割額は、それぞれ前記\n\n\n（1）のとおりであるとこ・ろ、本件各更正処分における納付すべき消費税額及び地方消費税の譲渡割額とそれぞれ同額か又はこれを上回るから、本件各更正処分はいずれも適法である。\n・.・\n2 本件各賦課決定処分の根拠及び適法性 .•\n)1( 本件各賦課決定処分の根拠本件各更正処分の適法性に（ついては前記)2(1 で述べたとおりであるから、本\n1(2件各更正処分に伴つて原告に課されるべき過少申告加算税の額は、以下に述べるとおりである。\nア 平成2 7年 3 月課税期間 • 6 3 2 .万9000 円上記金額は、通則法6 5条1項の規定に基づき、平成2 7 年 3 月課税期間更正処分により原告が新たに納付すべきこととなった税額6329 万円（ただし、通則法1 1 8条 3項の規定に基づき 1 万円未満の端数金額を切り捨てた\n \n..\n．．; \n. • ．． •． •．••．••\n．．．\n-.．．.．後の金額。後記イないしオにおいて同じ。）に100 分の 1 0の割合を乗じて算出した金額である。\n3 2 9 3 万6000 円イ •平成28年3 月課税期間上記金額は、通則法6 5条1項の規定に基づき、平成28 年 3月課税期間 ・更正処分により原告が新たに納付すべきこととなった税額2 億 1 9 7 4 万円に 1 0 0 分の1 0 の割合を乗じて算出した2 1 9 7万4000 円と、同条2\n• 項の規定に基づき、新たに納付すべき税額2億 1974万 1300 円のうち 5\n0万円を超える部分に相当する金額2億 1924 万円（ただし、通則法1 1 8条3 項の規定に基づき\n1万円未濶の端数金額を切り捨てた後の金額。以下工及びオにおいて同じ。）に 1 0 0分の5 の割合を乗じて算出した 1096 万20\n00 円との合計額である。\nウ 平 成29 年3月課税期間 ・ 1634 万1 0 円上記金額は、通則法65 条1項の規定に基づき、平成2 9.年3 月課税期間更正処分により原告が新たに納付すべきこととなった税額1 億6 3 4 .1 万円に 100 分の1 0 の割合を乗じて算出した金額である。\n工平成30 年3月課税期間 2754 万9 5 0 0 円 ．上記金額は、通則法6 5条1項の規定に基づき、平成30 年3月課税期間更正処分により原告が新たに納付すべきこととなった税額1億 83 8'3 万円に1. 0 0 分の・1 0 の割合を乗じて算出した 1838 万3000 円と、同条2 ・項の規定に基づき、新たに納付すべき税額1億8383 万5400 円のうち5\n0 万円を超える部分に相当する金額1億8 3 3 ・3 万円に 100 分の 5 の割合を乗じて算出した9 1 6 万6500 円との合計額である。\n才 平成3 1年3 月課税期間 3 1 3 1万4500 円 ・上記金額は、通則法65 条1項の規定に基づき、平成3 1年3 月課税期間\n•. 更正処分により原告が新たに納付すべきこととなっtこ税額\n2億\n0 8 9 3 万円に 100 分の1 0 の割合を乗じて算出した2089 万3000 円と、同条2\n \n. ..\n•••••\n.••- •..••.••\n．．．\n．•．•．\n．．．項の規定に基づき、新たに納付すべき税額2億0 8 9 3 万7400 円のうち 5 .\n0 万円を超える部分に相当する金額2億0843 万円に 100 分の 5 の割合を乗じて算出した 1042 万150 .0 円との合計額である。\n)2( 本件各賦課決定処分の適法性被告が本訴において主張する本件各更正処分に伴って原告に課されるべき過少申告加算税の額は、それぞれ前記)1( アないしオのとおりであり、本件各賦課決定処分における過少申告加算税の額といずれも同額であるから、本件各賦課 ．\n.r決定処分はいずれも適法である。\n、以 上\n・10\n．．\n \n．．．．．． ．\n’・‘ • • 9 ：・ 99‘ ← ヤ•； •．• `● ， ¢ し?． ャ ：iが't. ぐ :` ・ . ぷ t'i ．． ． ．\nー、一...9一9,・....,.\n.9、‘'• .9.9..9.9,` 19 9.~9:: :、. ．． ．．•． •笠`•，'：•., i.i, .iぶ “；芯？と；．＾9 •、 .と“•b．～迂ヽーぶ：．•:\n．＇9':~、：：＃・さt\n．．-・ .る．\n‘み‘`t、•..;·,・...•.\"\"'・‘·’、‘\n• 、 ; • b · ● _ ． 9 ヽ • ( ` .,' ’ ••9 .へ '．O 9 ヽ • I別表1-1 平成27 年3 月課税期間に係る消費税等の課税橿準額及び納付すべき消費税疇の額\n（単位：円）\n順税率4 ％適用分 税率3.6 ％適用分 合計区 分 号 A B C(A+B) .課税標準額 ① 000,455,892,1 896,559,32 ,000 ,52 !452 000,252\n、\n課税標準額に対する消費税額 ② ,55 93.4,552 ,l 05 °,2 ,300 663 1.. ,755 ,839 2°15控除過大調整税額 ③ ゜ ゜ ゜消 ＇ 控 （別 除 表 対 2 象 -1 仕入 ⑰欄 税 の 額 金額） ④ 367,224,442 98 ,90 874 ぅ l01 1, ,743 70-2, 345控 ・囀返還等対価に係る税額 I@ ゜ ゜ •. ゜除 し，税\n貸倒れに係る税額 ⑥ ゜ 3,544 345, 4額\n費控除税額小計（④＋⑤十⑥） ⑦ 244,422,763 089 ,184 ,6 45 ,l ,743 ,607 780控除不足還付税額（⑦ー②ー③） ⑧ ,113 邸9,890 Q 113 ,2 8~. 098\nヽ税 差引税額（②＋③一⑦） @| ゜521,522 ,018 25,1 ,225 810し\nc ⑩ 232,012 , 001計R合( 差欄引ー税額R C9欄．001 円未潰の端数切捨て）\n既(Cに欄納：付01の0蹟円未定漏したの端本税数額切捨て‘） ⑪ △ ,90.3 689 ;554 ,074 i03,050 061 .,4 004,31し 、\nこ差（⑩引C納瓢付―す⑪べcき欄梢，費01税0円額未満の端数切捨•て） ⑫ 007,818,94還控除付税不額足（⑧） ⑬ ,113 ,982 890 ゜ 098,982,113鰈消地税方費概消税費準額税とのなる差引税額（⑨） ⑭ ゜25 .1 522,018 810,225,125\n/地 合（⑭計C茎•引—地⑬方c消欄費，税10の0課円税未標満準の燐と数な切る捨情費て税）綱 ⑮ I ~ ,232,012 001\n.方 還付額 ⑯ 228,77 ,47 2 ゜ 77 4,228, 27\n（⑬A欄X25,0.01/ ⑬B欄X1136/ )譲渡消\n割額 納 （⑭ 付 A 額 欄001/52x ，⑭B欄-)36/7lX --⑰ --- ゜ - 361,827,041 , ~, 361,82 7,041費\n／税 合（⑪計c差欄引—’⑮箪渡c割欄．額0，01 円未漬の端数切捨て） ⑱ 006,509,26既に納付の確定した該渡割額 ⑲ △ ,77 224 .,883 . ,621 853 ,204 008,034,94\n(C欄： 001 円未満の端数切捨て）\nレ\n| / /差引納付すぺき譲渡割額(®c欄—⑲c欄） ⑳ 008,474,31レ し差引納付すぺき消費税等の合計税額（⑫＋⑳） ＠ 36 32,};! 05, 0\n（注） 「△」は還付金の額に相当する税額を表す。\n....\n \n． ． ・畿\n● ● ● ●\n．．•\n．命•\n．\n•\n．\n．\n\"..別表1-2 平成28 年．3 月課税期間に偏る清費税等の課税楓準額及び納付すべき爛費覗等の麟\n（単位：円）\n順 税寧4 ％遍用分 税寧.6 3％適用分 合 計区 分 号 A B C(A+B)課税標準額 ① △ .3 000,107 ,13 l邸，000,967 000,860,331,13\n;課税標準額に対する消費税額・・ ② △ 150,841 533,286,359,1 435,359,1 ，蕊4控除過大調整税額 R ゜ ゜ ゜書 亀消 ．控 （別 除 嶽 対 2 象仕 2 入 R 税 渭の 額 金麟） • ④ 980,81 書 975,608,213,2 866,328;213,2控 返還等対価に係る税額 ⑤ ゜ ゜ ゜\nI除 會税\n額貸倒れに係る税額 ⑥ ゜\n．\n゜ . 0\n．費\n控除税額小計（④＋⑤十⑥） 2< 980,81 976,508.213,2 866,328,213,2控除不足還付税韻（⑦一②一③） ⑧！ ,661 041 21,953 ,3 442 53. ,9,982 .483\nー\n, •税 差弓l税額（②＋R―⑦) iIC ゜ ゜ ゜\n．禰\nし咽 △ 483,982,963合計董引説鄭(®C椙l—⑧C欄）\n／既こ納付の鶴定した本税額 0| △ ,661 l~l △ 796,961,235 △四，3孤 837\n31 し し差引納付すべき消O費OI税円額未調の 1'1 .3 .60.4 003鴻量切捨て）\n(®C■—{@C栢，純ガ謂炭楓の 控 還付 除 象 不 額 足 (R) 園l ,661 }“ ,953 32 ，幻4 細，2韓．483課税標準となる消特鷹額 差 I9 税額(R) 3 ゜ ゜ ,0\n／ ／地\n税合額肝董(991地c方●\n）\n謂—⑬費C瓢●の開璽編窮となる消費 ⑮ △謁9,2\", ． 483方 遼付麟 ⑮ .14 5邸 9,6 272,609 708,749,69\n（⑬A欄,001/52X OB 梱X)SJ6/7譲渡消\n割韻納（⑭付A麟櫃,001/52X 8B 欄-E>)88/71 ⑰ ゜ ゜ ゜費\nン ン税 紐（⑰C如欄一1麟⑮渡C割欄頓，001 円未調の端数切捨て） 愈 △ “78\"既に納付の確定した鶴諷割額 ＠， △ 535,14 913,106,341 △ l ,・241 SM差（⑲IC9納欄付―す⑬べCき欄麟．汀01割0円麟未調の嬬数切捨て） R < , ,596, 64 OOO\n／ ／ 一\n／羞引納付すべき消費覗等の合計楓● （◎十⑳） ゜ン ，\n.912 :003,147\n；（注） 〇批の「△」は売上げに係る鮒価の這選等の額を表す．霰額に関ずる欄の「△Jは還付金の頓に樟当する税蠣と表す。\n....\n \n \n．．\n．．\n．．．\n.,. ．\n．．\n．．．別覆 1-3 平成29 年3月課税期間に係る消費税等の課税欄準額及び納付すべき消費税簿の額\n（単位 ：円）\n順税率4％適用分 税率3.6 ％適用分 合 計 ，\n．区 分 号 A .B C(A+B)課税標準額 ① ゜ 000,309,054,23 ,23 ,054 ,309 000課税標準額に対する消費税額 •② ゜・672;028,340,2 340,2 ,820 , 672\n・o\nGI ゜ ゜控除過大調整税韻控除対象仕入税額 ④ 34 , 716 I,｀ 690,179,275 • ,410,3 76,1 317消 （別表2-3 ⑰欄の金額）\no.・控 返還等対価に係る税額 ． ⑤ ゜ ゜除\n税額\n貸倒れに係る税額 I⑥ ゜ ゜ ゜費\n控除税額小計（④＋⑤十⑥）・ ⑦ 716,34 690,179,275,1 ,410,376,1 317控除不足還付税額（⑦―②―③) ⑧ 716,34 ゜ 716,34税 差引税額（②＋③ー⑦） ⑨ ゜ 081,948,074 081,948,074\n．．合計差引税額（⑨Cn欄捨一て⑧）\nc欄） ⑩\n／\n005,508,071\n1(00 円未瀾の端数切 し ・既に納付の醜定した本税額 し⑪ △ 34 ,6 71 072,751,243 243 , 006, 311\n001( 円未満の端数切捨て）\nン差引納付すべき消費税額 • ＠ 009,196,821\n（⑳C曇—⑪C●,100.円未満の爆数切檜て） し控除不足 R 716,34 ゜ 716,34地方消費税の 還付税額（⑧）\n課税標準となる消費税額 差引税額（⑨） ⑭ ゜470 , 081,948 • ,074 ,948 81 Q\n--------\n／地 合 （⑭ 計羞 C l 欄 9熾 ー◎ 方惰 c襴 費 ， 税 00 の 1 識 円 税 傘 繹 鯛 準 の蟷 と 徴 な 切 る 檜 情 て 費 ） 税 ） 額 ， ⑮ 005,508,074方 還付額 ⑯ 01 409, ゜ “9,01\n（⑬A楓X25 1/,00 ⑬B鱈X7l/)36譲渡消\n割額 納 （⑭ 付 A 額 欄X2 5I/OO,RB 欄X)36/7l ⑰ ゜450,721 045, ,721 05 _4, 045費 --------税 合（⑰計C差●引—麒⑯裟c割瓢，額001 円未調の蟷数切檜て） ⑱ し 12 006,340,7既に納付の確定した譲渡割額 ⑲ • △ 409,01 ,29 ,823 251 • 002,713,29\n(C 欄 ：001 円未満の端数切捨て）\nン差弓1納付-すぺき-麒攘割-額（⑱-c欄,-Rc-欄）-⑳ -\n／ ／ ／ ．\n004,627,43差引納付すべき消費税等の合計税額（⑫＋⑳） ◎ ー ／ ／． 814,361 , 003\n（注） 「△」は還付金の額に相当する税額を表す。\n \n．’ ●．．、．．.\n． ．\n．． ．\n． ． ．\n． ． ．\n．．\n．．．別表1-4 平成30 年3 月課税期間に係る消費税等の課税欅準額及び納付すぺき消費税疇の額 ・\n・（単位 ：円）\n順 税率4％適用分 税率3.6 ％適用分 合 計区 分 号 A B C(A+B)課税標準額 ．① ゜625,33 , 000,543 ,33 ,625 ,543 000課税標準額に対する消費税額 ② ゜ 137,944,680,2 737,944,680,2控除過大調整税額 0| 0 . ゜ ゜控除対象仕入税額 G| 669,81 476,693,000,2 2, 046,514,000消 B(表IJ 2-4 ⑰欄の・金額）\n控 返還等対価に係る税額 ⑤ ゜ ゜ ゜除\n税貸倒れに係る税額 ⑥ ゜ ,ll 890 098,11\n．額費\n控除税額小計（④＋⑤十⑥） ⑦ 669,81 465,804,000,2 ,000,2 ,724 , 035控除不足還付税額（⑦―②—③) ⑧ 669,81 ゜ 669,81税 差引税額（②＋③一⑦） ⑨ •O 371,140,68 ,140,68 371合計差引税額（⑨C欄―⑧c欄） ⑩ し／／ • ／ 002,220,68\n001( 円未潰の端数切捨て）\n既に納付の確定した本税額‘\n⑪ △ 669,81 △ 213,927,85 △ 58!', ,84 87?\n. (C 欄：001 円未漕の端数切捨て）\n: /甍引納付すべき消費税額 • ' .R 004,077,441\n（⑩c 櫛―⑪ c襴，001 円未満の蟷数切捨て）\n控除不足 ＠ 669,81 ゜ 669,81地方消費税の 還付税額（⑧）\n課税標準となる\nI消費税額 差引税額（⑨） ⑭ ゜ 371,140,68 ,140,68 371地 合計甍~I建方清費税の課税檬準となる情費桟額 ． ⑮ ／ し .68 02.i 002\n（⑭c欄—◎C襴． 100円未調の嶋徽切檜て））\n方 ，還（⑬付A額欄 ,X0・01/62 ⑬B欄 X)36/71 ⑯ 147,4 ゜ 147,4譲渡消\n割額 納付額 •. ⑰ ゜ 954,712,32 964,712,32\n（⑭A欄,001/52X ⑭B欄 X)36/71費\n／ ／税 合（⑰計C差襴弓1—譲⑯鍍c割欄．額001 円未潰の蟷数切檜て） ⑱ ,212,32 007既に納付の礁定した譲渡割額 ⑲ △ ,4 147 △ 295,748,51 △ ,51 258 ,333 _ン\n／差引納付すぺき麒猿割額（⑮C欄ー⑲€欄） ⑳ ， 0,560,93 卯\n／差引納付すぺき消費税等の合計税額（⑫＋⑳） ⑪ ー ・ 538,381 , 004\n（注） 「△」は還付金の額に相当する税額を表す．\n..\n \n \n....\n... ．\n． ． ． ． ． ．\n．．．別表1-5 平成3 1年3 月課税期間に係る消費税等の課税欄準額及び納付すぺき消費税等の額\n（単位：円）\n順 税寧4％適用分 税率6・.3％適用分 合計区 '分 号 A B C(A+B)\noo・o課税標準額 ① ゜ 000,956,681,13 3 , I ,581 ,956課税標準額に対する消費税額 ② ゜ ,l ,276,469 636 6•36,276,469,1控除過大調整税額・ •③ ゜ ゜ ゜控除対象仕入税額 ④ 288 2,216,910,03~ 029,019,612,2消 表Jli( 5...:.2 ⑬欄の金額）．\n．控 返還等対価に係る税額' ⑤ ゜ ゜ ゜除\n税貸側れに係る税額 I~ ゜ 20,896 698,02額\n費\n.rc控除税額小計（④＋⑤十⑥） 288 439,039,612,2 2, 618,139,612控除不足還付税額（⑦—②―③) ⑧ i 288 992,852,252 ,252 181,,952税 差引税額．．（②＋③ー⑦） lDl< ゜ ゜ ゜\n/ .\nc合計差引税額（⑨ c欄―⑧ 欄） RI △ ,252 ,952 181し\n既に納付の確定した本税額 ⑪ ．△ 288 ．△ 936,697,6!4 △ 614 , 124,797差（⑩引C納欄付—す⑪ぺcき欄．消費10税0円額未調の嶋数切檜て） ⑫ 002,835,461し し\n・控除不足 RI 288 ,252 ,852 _299 ,252 ,952 181地方消費税の 還付税額（⑧）.課税標準となる消費税額 差引税額｛⑨） Q ゜ ゜ ゜ン\n地 合計麓I!嶋方鯛費税の課税標準となるillJ費税顧 ⑮ △ 181,952,252\n（⑭c饗—⑬c鵬） し ・方\n還（⑬付A額欄X25 ・,001/ ⑬B欄)36/?lX ⑯ 022 996,960,86 919,960,86譲渡消\n割額 納\n(RA付額欄x 妬\n・\n／,001 @B 欄 X)36/71\n・ ⑰ ゜ー ゜ ゜費\nし税\n合（⑰計C差●引譲-渡R c割欄額） ⑱ △ 919,960,86\n！既に納付の確定した譲渡割額 ⑲ △ 022 △ 709,864,211 △ ,964,211 721ン\n／差引納付すぺき霞濃割額（⑲C●—⑲C●) ⑳ー 002!993,44\nJ(OO円未調の蟷数切捨て）\n／差引納付すべき消費税等の合計税額（⑫＋⑳） R 004,739,802\n（注） 「△」は還付金の額に相当する税額を表す．\n．．．\n \n•． ．•． ．••．•• •\n' ．.． ． ．\n・\n．．．\n• .別表2-1 平成27 年3 月課税期閻に係る課税売上割合・控餘対象仕入税額等の計算覆\n（単位：円）\n順 税寧4％適用分 税率3.6 ％適用分 合計項 目 号 A B C(A+B)\n／鰈税資産の譲渡等の対価の額 ① ·~ 25,259,032 , 148\n／ ／鰈税資産の麒渡等の対価の額 ② )48,230,952,52\n((Dの金額）\n／非課税売上額 ③ . ,93 ,842 ,709 ,825\n9 /\n／ ／資産の顛渡等の対価の額（②＋③） ④ ,705,46 ,049 666\n／ ／課税売上割合 （① ／④） ⑤ .93 036074661 ・・・％確定申告書添付の付表2-(2) に記載された ⑥ 525,85(,826,9 8,02 訟.24623,3 ,03 ,064 ,107 158課税仕入れに係る支払対価の額（税込み）\n確定申告書添付の付表2-(2) に記載された\n⑦ 024,897,663 .1,512 .412 , 49 1 ,I 582,012,614\n．課税仕入れに係る消費税額\n⑦（⑨の一う⑩ちー．課 税売上げ1このみ要するもの ⑧ ,463 ,797 :¼52 ,460,218 101 ． 354,168,671,1\n⑪) '葎れ定た課申告書売添上付げのに付表2-(2) に記載さ税 のみ要するものの金 ⑨ 663,868,463 474,129,319 ,I ,872 ,987 938額\n⑨のうち．本件各課税仕入れに係るも ⑩ ゜897,001 , 959 959,897,001のの金額 ．鰈税売き金上額げにのみ要するものから減算 ⑪ ,)7 310 ), ,850 414 724,921,1すべ盟\n⑦のうち，課税亮 と非課税売上げに共 ⑫ • ,6 144;891 ,034 01 ら061 106,303,634通して要するもの 十⑭十⑮）\n確れし定たて課専申告税す書売る添上も付のげののと付非表課2税 売 2上(）げにに記共戴通さ⑬ 550,039,1 103 , ,292 027 577,222,303して要するも 金額\n' ⑨のうち，本件各課税仕入れに係るも\n⑭ ゜ ,001 ,897 959 959,897,001のの金額課税売上げと非課税売上げに共通して ⑮ 683,862,4 ,3]0;82 184 ;23 768,182要するものに加算すべき金額値別対応方式によ會り控除する課税仕入れ等の税額（⑧+（⑫ x①／④）） ⑮ 244,422,763 101,874,089 ,] 345,207,743控除対象仕入税額（⑯の金額） ⑰ 244,422,763 101,874,089 345,207,743,1\n．．．\n \n \n．\n．\n..\n．． ．\n．．\n．．．\n••別表2-2 平成28 年3月鰈税期閻に係る課税売上割合・控餘対象仕入税額等の計算表 ・\n（単位：円）\n順 税率4 ％遍用分 税率3.6 ％適用分 合 計項 目 号 A B C(A+B)\n／ ／課税賣産の譲渡等の対価の額 ① 812,931,13 ,010\n／課税資産の譲渡等の対価の額 ② )3 , 010,812,9 31\n（①の金額）\n／ ／非臓税売上額 ③ ,34 77], 528,482\n／ ／資産の顧渡等の対価の額（②＋③） ④ ,47 538,205,019\n／鰈税売上割 •合 （① ／④） ⑤ 4.1429065865 …%確定申告書添付の付表2-(2) に記戴された ⑥ .,.I 843,241 060,64 ,252 ,612 069,493,160,64鰈税仕入れに係る支払対価の額（税込み）\n確定仕申告入れ書添に係付の付表2-(2) に記載された ⑦ 815,34 686,2 ，糾960,8 2、198,686 ,785課税 る消費税額\n⑦（⑨の一う⑩ち），鰈税売上げにのみ妻するもの ⑧ ゜ 142,026,320,2 ,2 ,320 ,026 421,蘊 れた 課申税告書売添上げ付の に 付 の 表 み賽 2-(2) するも に の 記 の 載 金 さ ⑨ ゜2.,.S ,2 ,168 78 t- ,2.43 487,168,2額\n凸\n⑨のう 課税売上げ1このみ要するも ⑩ ゜ ,9)3 142 ., 34& 142,913 , 345のから すべき金額 ・\n⑦のうち，課税売上げと非課税売上げに共 ⑪ ◄3,518 ,696 ,286 826 695 ｀, 627 ,3 43通して賽するもの（⑫＋⑬）\nれ藁定た繹申税告書添付の付表2-(2) に記載さ売上げと非課税売上げに共通 ⑫ . 34 , 815 343 ,689 ,285 443 , ,92 0 803して蔓するものの金額\n⑨のうち， 要鰈す税売る．上 げと非課税売上げに共通して ものに加算すべき金 ⑬ ゜153 , 045,696 696,153 , 045額 ・税個額別対（⑧応方+（⑪式｛xこより控餘する鰊税仕入れ等の ⑭ )•8,089 2, 975,508,213\n．\n,2 312, 866,32 8\n・ ①／④）．)控除対象仕入税額 •（⑭の金額） ⑮ 81 , 980 . 975,508, 213,2 2,328,213 , 866\n，\n．．．\n \n•••••\n．．\n． ． ． ． ． ．\n..•• ．\n．．．別襄2-3 平成29 年3月課税期間に係る課税売上割合・控餘対象仕入税額等の計算豪\n（単位：，円）\n順 税率 ％適用分 税亭3.6 ％適用分 合計・項 目 号 A B C (A+B)\n／ ／課税資産の譲渡等の対価の額 ① 369,880.064,23\n／ ／税課D(の(資金産額の） 譲渡彎の対価の額 ② 369,880,064,23\n／ ／非課税売上額 ③ 94 , ,794 ,469 441\n./\n／資産の譲攘等の対価の額（②＋③） ④ 859,18 , ,350 701\n／ ／諜税売 ・上割合 （① / •() ⑤ .93・856 4.3.7606 %\n＇確定申告書添付の付表2-(2) に記載された ⑥ 068,098,2 3,63 乱655,989 614,088,763,63諫税仕入れ等に係る支払対価の蒙（税込み） ．．\n. .蹟定申告書れ添等付にの係付表2-(2) に記載された ⑦ 821,011 739,303,121,2 2121, , 560,414課税仕入 る消費税額 •\n⑦のうち，課税売上げ9このみ蔓するもの ・ ⑧ ．． ゜ ,l ,422,423 ~69 ,)423 4,422, 69\n（⑨一⑩一⑪） 、．れ確定た課申税告売書添 上 付 げ のに付の表み要2 す -(2 る ）もに ． の記の載 金さ ⑨ ゜655,1 ,804 息 456 ,I 456,804,656額\n⑨のうち．本件各課税仕入れに係るも\n⑩ ゜四，092,861 092.861,922のの金額課税売上げにのみ要するものから減算・\n⑪‘ ゜ 598,610,3 598,510,3すべき金額\n，\n⑦のうち，課税売上げと非課税売上げに共\n⑫ 821,011 001,750,826 822,761,826通して聾するもの，，（⑬＋⑭十⑮）・確定申告書添付の付表...2 )2上(げにに記共載通された課税売上げと非臓税売 ．⑬ 011 821, 808,057,663 639,068,663して要するものの金額 ．\n⑨のうち，本件各課税仕入れに係るも\n⑭ ゜922 , 092,861 092,861,922のの金額課税売上げにと加非課算税す売べ上げに共通して ⑮ ゜~2. 20 0,831 23 , 200,831 ）\n賽するもの き金額 ・‘錮別対応方式により控除する課税仕入れ等の ⑯ 6,34 7.1 1.,79,275 J.. 69 0 ) ,,410,375 317税額（⑧+（⑫ x(J)/R))控除対象仕入税額（⑯の金額） ⑰ 716,34 ,I 690,179,275 ,) ,410,375 317\n • ・・\n••..••.•\n..\n.\n．\n．・．\n．\n• .\n•• ，\n●‘. ..別表2-4 平成 30 年3月課税期間に係る課税売上割合・控除対象仕入税額等の計算表\n（単位：円）\n項・ 目 ．． 、． 順 号 税寧4 ％ A・ 遍 用分 税率6.3 B ％ 適用分 C 合 (A+ 計 .B) ・\n／ ／課税資産の譲渡等の対価の額 ① . 939,813,145,33\n／ ／課税資産の譲渡等の対価の額． ② 145,33 ,3 ,81 939\n（①の金額）\n／ ／非謙税売上額 ③ ,45 ,902 211 ; 488\n／資産の麒猿等の対価の額（②＋R) ④\n9 /\n,78 ,057 ,194 427\n／ ／／／\n．鰈 税売上割合 （① ／④．） ⑤ ・322115322.83・・ %課確税定仕申告入れ書等添付に係の付表2- に)2( 記載された ⑥ ,) 994,203 278,647,078,44 ,44 ,278 ,940 173る支払対値の額（税込み〉\n・. ヽ葎定申告書添付の付表)2(-:-2 に記載された ⑦ 49 , 916 ,374,716,2 i:97 i326,716, 、611課税仕入れ等に係る消費税額 ，．\n＇\n⑦のうち，課税売上げ1このみ蔓するもの・ R ・ ゜ ,I037 76,6',2_76 . ,I 730 , 572 ,657\n(®—(—()\n,\n•葎 れ定た課申税告書売添上付げの に 付 の ...表 み .:. 蔓 2 す る る ()2もにの記の鐵金さ・・ ⑨ ゜ ,2 ,020 ,371 978 _ 37]\",020,2 ,978\n，額\n，\n．⑨のうち，本件各課税仕入れに係るも\n⑩\nヽ\n゜• , 082 ,285 757 757,285,082のの金額 •税売上げにのみ妻するものから減算\n⑪ 、0 466,810,9 .9 46,6,,81 0べき金額\n⑦のうち，課税売上げと非課税売上げに共 ⑫ _,94 619 ,507 1-9 l, 58 3 ,607 ,.169 400通して要するもの（⑬+⑭＋⑮）\n陣れ定た諫申税告売書添上付げのと非付表課税2売上-)2( げにに記共鐵通さ ⑬ 6,94 91 ‘ ヽ 600,723 710, . 32 ＇,7 ,660 636して要するものの金額\n＇\n⑨のうち，本件各課税仕入れに係るも R ゜蹄,286,0 757 ,082 ,286 757\n' のの金額 ．．課税売上げと非課税売上げに共通して ⑮ ゜ ,89 ,223 116 • 223,89 , 116要するものに加算すべき金額個別対（⑧応＋方(式 により控除する課税仕入れ等の ⑯ 669,81 476,693,000,2 ,2 ,ooo 415 ,~ o税額 （⑫x①／④ ））\n控除対象仕入税額（⑯の金額） ⑰ 81,966 '2 476,693,000, 2., 415 “. °\n．．．\n \n・・ \n．．\n．．．\n..・ ．\n．．\n•• ． • ．． . - .別表~-5 平成3 1年3 月課税期閻に係る課税亮上割合・控除対象仕入税額等の計算襄\n（単位：円）\n順 税寧4％適用分 税率6.3％適用分 合計項 目号 A B ， C(A+B)\n／課税資産の麒渡等の対価の額 ＼ ① ,13 881 ，り040,03\n／\n／\n.oso\n．課（①税の資金産額の）譲渡等の対価の額 ② ,13 ,881 040\n／\n／ ／非課税売上額 ． ③ 16 , ,014 909:,401\n／ ．\n•\n／賣産の譲渡等の対価の額（②＋③） ④ ,29 ,895 ,431 9心\n／\n..\n＇ ・課税売上割合 （① / ④・） ⑤ .33 183660186 ・ ・%:\n／ ／確定申告書添付の付表2-(2) に記載された\n⑤ 邸，577 002,739,020,94 579,500,120,94\n・課税仕入れに係る支払対価の額（税込み）\nば品 ．．確定申告書添付の -(2) に記載された ⑦ 2, 026 076,466,968,2 092,766,968,2課税仕入れに係る 額． ．\n⑦ （⑨ の ー う ⑩ ち 一 ， ⑪） 課税売上げ9このみ要するもの ‘ ⑧ .0 815,705,699.1 816,706,699,1 ， ．確定申告書添付の付表2-(2) に記職された謀税売上げ9このみ要するものの金 ⑨ ゜ 185,792,372,2 • 2, 2,37． ,792 185額\n⑨のうち，本件各課税仕入れに係るも\n⑩ ゜272 , 791,978 791,978,272のの金額課税売上げ1このみ要するものから減算\n⑪ ゜ 019,3 , 668 668,019,3すべき金額\nヽ器\n．⑦のうち，課税売 と十⑭非課十税⑮亮一⑯上）げに共 ⑫ 026,2 752,183,456 邸778,383,4通して要するもの ．\nI '確定申告書添付の付表2-)、2上(げにに記共載通された鰈税売上げと非諫税亮 ⑬ 026,2 ,123 1;_29 844 ~21, , 501 860して要するものの金額\n⑨のうら，本件各課税仕入れに係るも\n⑭ ゜• 272 , ,978 791 791,978,272のの金額 ． ＇課税売上げと非課税売上げに共通して\n⑮ ゜ 998,510,16 998,510,16要するものに加算すべき金額\n..課税売上げかと非ら減課税算す売上げに共通して ⑯ ゜ 616 , 782 782,616要するもの ぺき金額個別対（⑧応方+（⑫式により控除する課税仕入れ等の ⑰ 288 ,612,2 ,019 038 029,019,612,2税額（⑧ X ①／④））\nヽ. .\n，控除対象仕入税額（⑰の金額） ⑱ 288 830,019,612,2 029,019,612,2\n．．．\n \n...•.• •••••\n．．•) . ．\n● ．．．別襄3消費税等に係る課税処分等の経緯\n“\"ii':口 1\n：繹税剛関 区分 蘊定“告 (I)更正処分 0審に査対鵡す求る 〇更正の鰭求 ②過に知対処す分る ②審1こ査対籍す拿る 絨決 ＊件胃更王処分\n.. 年JI .I.I 平慮”¥5 月”II 會わ2年6月29n 令和2年8月19B ／ ／ ／ /-/' ，羅農憤攣額 25.a .26.2 000 ぉ．254,•お2.ooo鰹仕餘入対艮象麟 1.3”•521. n5 3.1 3ヽ45,207,7寧 ¥3 月鵡租躙聞付納lf費lす農べ菖 e 004,314,061 012 ．ぉZ, 001 金欝の厩消し （審査“＊中）．\n▼ ，納付すべき嶋llI費皇麟 008.034,94 四．509 ．“鳩遍少鰤 ， 鬱 ，瓢 編算艮 一 6．四．OOO ．．尋月日' 平 8響6IJGIP 會わ21F6 月おB 會わ2年8月B81 會和2年01月孤日 令事3年l月訓日 含fa 3年2月1121 令右4皐39“B\nI轟霰＇檬準麟 ,IS 000,860,331 3“』.331. 違．OOO 13、1 .SS ,860 000 ,IS 1 ..33 ,860 000\n、\n控入:it製象● • 2 078,58 ．匹 .2 132.m .“ 20S,511B“ 13,2 ,2•~ 8.81 1旱•3JI鰈 納調費鼠 ぺ・●t △紐．533 ,3/'8 △953 ' ．函．“ 全饒のl歌lI し △“’・賢丸螂 !JE な を い冒 す ， べ ， 亀 ii知 慮●が 金郎の取嗣し 膚檀；＂中） △ 2,関.．.譴 4皐鵬叶●費べ置e麟 △1 ,3' 46 .2 458 △“'嶋808,7 △14`“`'“ △%, 708,749過少庫曹加算覆 m．匹．OOO ・r\n，，瓢ク\n年月11 旱四旱6月四a 令和2停6月1192 會和2年8月II.1 會和2尋DI1}82 日 會和3隼1月16B 會わ3年2\"'28饂霰羅攣麟 000109.054.23 .23 450.“n,000 . 21:“.054, 瓜000\n・筏鶴紺仕象． 1.701.106.m ,I5,37 410 , 317 • ,I ,117 91( , 912 ¥.亭虞“響3IJ瓢覆爆罰 納惰付費磁ぺ編き． ,243 311 ．細 508,074 6,OO 全鰐の歌楕し 104,233 , 000 更正 な を い す 冒 べ ，， e 遍 ● 細 “が 金鰐の取梢し 直査M＊中）\n嶋納力讀費ぺ畿會鱗 ”.317.200 721 ,340 , 00 6 “.“6 . 003\n＇過少ゆ鬱加算観 ,143,61 OOC\n'の麟\nI鋼月11 旱 5月1113 令和2年sIJ92 日會わ2'11 8月1111 會籍2響01月鵡B 令駒3”1 月鵡B 會 3.2 月128 ・鵡畿犀攀麟 “.625,33 000,5 ,33 函．3000,54 S3，磁．“5,000 ．鑓仕入良鯖瓢象 2 ,,54 1 ,681 521 2000,416,6 伯 .2 171749916平慮諜叩覗翔年閲3月費納I'l鼠tべ麟 き △58.149.”' “.220 .” 全籐の取謂し △m.31 .1\" 更・正な1eす19べのe量糧細“aI 全鶴の取桐し （響＊中）\n尾 納 方 付 鯛 す 費 べ 畿 き 麟 △“.61 |`3,2 12,32 ,2 007 l △m.“`”6過ウ寧賣”算畿 “.94572°の鱗\n・•\n／皐1111 令わ元隼115 ヽ”II 令和2!ff 5月1192 令和2年8月111・1 合和2響01月“a 令和3\"'1 月為B 會和3年2月21日\nヽ 識檀疇瓢 13,1郎．“, 581,13 ．碑．OOO `.1 蒻l“9.OOO饉入:tt楓対象 績 埠.2 1,944,1 ヽ0 .229,019,612 1 2397.981 ． 12S平咸1響3月\n`‘諜紐関 納\n＂付\n費す\n製麟べき △ 124,797,614 △匹．ぉ281,9 全纏の軍情し ・△“',2:11\nヽ\n7,むt更王なを1すヽ●ぺの愈過●鰺繭 全饒の歌鳩し （響査請求中）\n尾 納 力 付 祖 す 費 べ 裏 e 麟 △ .2ll ,964 721 △960.86 . 029 △116903 . 652遍少攣9加算覗 13,13 ヽ，紐 ・‘の額 ・ •\n・（注） 1納付すべき清費税瓢J及び 1納付すぺき建方清費税麟J欄のf△ l印は．ii付金編を示す．"
}