{
  "number": "13895",
  "title": "更正処分等取消請求上告及び上告受理事件",
  "court": "最高裁判所",
  "date": "令和５年１０月２５日",
  "date_iso": "2023-10-25",
  "result": "取消",
  "topics": [],
  "laws": [],
  "keywords": [],
  "sections": {
    "主文": [
      "１ 本件上告を棄却する。\n２ 本件を上告審として受理しない。\n３ 上告費用及び申立費用は上告人兼申立人らの負担とする。"
    ]
  },
  "full_text": "13895 更正処分等取消請求上告及び上告受理事件 - 国税庁判決事例集\n\n\n\n\n\n\n\n\n\n\n目次に戻る\n\n\n\n\n判決 13895\n\n\n更正処分等取消請求上告及び上告受理事件\n\n\n\n\n裁判所:\n 最高裁判所\n\n\n判決日:\n 令和５年１０月２５日\n\n\n結果:\n 取消\n\n\n\n\n\n\n主文\n\n\n１ 本件上告を棄却する。\n２ 本件を上告審として受理しない。\n３ 上告費用及び申立費用は上告人兼申立人らの負担とする。\n\n\n\n\n\n\n第２ 理由\n\n\n１ 上告について民事事件について最高裁判所に上告をすることが許されるのは民訴法３１２条１項又は２項所定の場合に限られるところ、本件上告の理由は、理由の不備・食違いをいうが、その実質は事実誤認を主張するものであって、明らかに上記各項に規定する事由に該当しない。\n２ 上告受理申立てについて本件申立ての理由によれば、本件は、民訴法３１８条１項により受理すべきものとは認められない。\n令和５年１０月２５日最高裁判所第三小法廷裁判長裁判官 宇賀 克也裁判官 林 道晴裁判官 長嶺 安政裁判官 渡邉 惠理子裁判官 今崎 幸彦当事者目録\ne上 告 人 兼 申 立 人 株式舌同 代表者 代 表 取 締 役 f - -上 告表人 兼 申 ， 立 人 株 式 会 社 一G同 代 者 代 表取締 役一\n上 告 人 兼 申 立 人\n`t会；\n[同 代 表 者 代 表 取 締 役 J上 告 人 兼 申・立 人\nk同代表者代表、取 締 役 L上記 4名訴訟代理人弁護士 新 穂 均・ほか被 上 告 人 兼 相 手 方 国・同 代 表 者 法 務 大 臣 小 泉 .. 龍 司\nヽ．同 指 定 代 理 人 ．笹 木 ． 祐 司\n.\n．\n -\n．．．\n...\n．． ，ノ\n....・.\n..\n．．．． ．\n• • ． ● ．● •.·•"
}