{
  "number": "13892",
  "title": "課税処分取消請求事件",
  "court": "水戸地方裁判所",
  "date": "令和５年１０月１２日",
  "date_iso": "2023-10-12",
  "result": "取消",
  "topics": [
    "法人税",
    "所得税"
  ],
  "laws": [
    "国税通則法23条"
  ],
  "keywords": [
    "復興特別所得税",
    "所得税",
    "更正の請求",
    "更正処分",
    "決定処分",
    "法人税",
    "滞納処分",
    "無申告加算税",
    "賦課決定"
  ],
  "sections": {
    "主文": [
      "１ 本件訴えのうち別紙１記載の各部分の取消しを求める部分をいずれも却下する。\n２ 原告のその余の請求をいずれも棄却する。\n３ 訴訟費用は原告の負担とする。"
    ]
  },
  "full_text": "13892 課税処分取消請求事件 - 国税庁判決事例集\n\n\n\n\n\n\n\n\n\n\n目次に戻る\n\n\n\n\n判決 13892\n\n\n課税処分取消請求事件\n\n\n\n\n裁判所:\n 水戸地方裁判所\n\n\n判決日:\n 令和５年１０月１２日\n\n\n結果:\n 取消\n\n\n\n\n\n\n主文\n\n\n１ 本件訴えのうち別紙１記載の各部分の取消しを求める部分をいずれも却下する。\n２ 原告のその余の請求をいずれも棄却する。\n３ 訴訟費用は原告の負担とする。\n\n\n\n\n\n\n第１ 請求の趣旨下館税務署長が令和\n\n\n２年９月９日付けで原告に対してした平成２７年分ないし平成３０年分の所得税及び復興特別所得税の各更正処分を取り消す。\n\n\n\n\n\n\n第２ 事案の概要原告は\n\n\n、令和２年３月１４日、処分行政庁に対し、平成２５年分の所得税及び復興特別所得税（以下「所得税等」という。）について、租税特別措置法（以下「措置法」という。）に規定する上場株式等に係る譲渡損失の金額及び先物取引の差金等決済に係る損失の金額（以下\n「本件各損失額」という。）が生じたとして、これらの損失金額を翌年へ繰り越す旨記載した確定申告書（以下「本件期限後申告書」という。）を提出した上で、同年６月８日、平成２７年分ないし平成３０年分（以下「本件各年分」という。）の所得税等の確定申告（以下「本件各確定申告」という。）をした。\n本件は、原告が、処分行政庁から、本件期限後申告書の提出は法定申告期限から５年を経過してなされたものであるから無効であり、本件各損失額を平成２６年分以後に繰り越すことはできないなどとして、本件各年分の所得税等の更正処分（以下「本件各更正処分」という。）\nを受けたことから、本件各更正処分は平成２７年分及び平成２８年分の上場株式等に係る配当所得の金額、株式等に係る譲渡所得等の金額又は先物取引に係る雑所得等の金額の計算上、\n本件各損失額を控除していないから違法であるとして、その取消しを求める事案である。\n１ 関係法令の定め別紙２に記載したとおりであるが、上場株式等に係る譲渡損失及び先物取引の差金等決済に係る損失の繰越控除に関する規定（以下、措置法３７条の１２の２第５項の規定及び同法４\n１条の１５第１項の規定を併せて「本件各繰越損失控除規定」という。）及び国税の徴収権の消滅時効に関する規定の概要は以下のとおりである。\nなお、以下では、平成２７年分の「上場株式等に係る配当所得の金額」（平成２５年法律第\n５号による改正前の措置法８条４項）と平成２８年分ないし平成３０年分の「上場株式等に係る配当所得等の金額」（平成３０年法律第７号による改正前の措置法８条の４第１項）を併せて述べるときは「上場株式等に係る配当所得（等）の金額」という。また、平成２７年分の「株式等に係る譲渡所得等の金額」（平成２５年法律第５号による改正前の措置法３７条の\n１０第１項）と平成２８年分ないし平成３０年分の「上場株式等に係る譲渡所得等の金額\n（同法３７条の１１第１項）を併せて述べるときは「（上場）株式等に係る譲渡所得等の金額」\nという。\n\n\n（１）上場株式等に係る譲渡損失の繰越控除措置法３７条の１２の２第５項は、上場株式等に係る譲渡損失を繰越控除できる旨を規定している。\nすなわち、同項は、確定申告書を提出する居住者が、その年の前年以前３年内の各年において生じた上場株式等に係る譲渡損失の金額を有する場合には、当該譲渡損失の金額に相当する金額を当該確定申告書に係る年分の（上場）株式等に係る譲渡所得等の金額及び上場株式等に係る配当所得（等）の金額を限度として、当該年分の当該（上場）株式等に係る譲渡所得等の金額及び上場株式等に係る配当所得（等）の金額の計算上控除する旨を規定している。\nまた、同条第７項は、同条第５項の規定を適用するための要件として、譲渡損失の金額が生じた年分の所得税につき所定の確定申告書を有効に提出することを求めている。\nすなわち、同条第７項は、同条第５項に規定する居住者が上場株式等に係る譲渡損失の金額が生じた年分の所得税につき当該上場株式等に係る譲渡損失の金額の計算に関する明細書その他の財務省令で定める書類の添付がある確定申告書を提出し、かつ、その後において連続して確定申告書を提出している場合であって、同項の確定申告書に同行の規定による控除を受ける金額の計算に関する明細書その他の財務省令で定める書類の添付がある場合に限り、\n同項を適用する旨を規定している。\n\n\n（２）先物取引の差金等決済に係る損失の繰越控除措置法４１条の１５は、先物取引の差金等決済に係る損失について、同法３７条の１２の\n２第５項及び同条第７項と同様に、繰越控除できる旨及び繰越控除の規定の適用要件として損失の金額が生じた年分の所得税につき所定の確定申告書を有効に提出する必要がある旨を規定している。\nすなわち、同法４１条の１５第１項は、確定申告書を提出する居住者が、その年の前年以前３年内の各年において生じた先物取引の差金等決済に係る損失の金額を有する場合には、\n当該損失の金額に相当する金額を当該確定申告書に係る年分の同項に規定する先物取引に係る雑所得等の金額を限度として、当該年分の当該先物取引に係る雑所得等の計算上控除する旨を規定している。また、同条第３項は、同条第１項に規定する居住者が先物取引の差金等決済に係る損失の金額が生じた年分の所得税につき当該先物取引の差金等決済に係る損失の金額の計算に関する明細書その他の財務省令で定める書類の添付がある確定申告書を提出し、\nかつ、その後において連続して確定申告書を提出している場合であって、同項の確定申告書に同項の規定による控除を受ける金額の計算に関する明細書その他の財務省令で定める書類の添付がある場合に限り、同項を適用する旨を規定している。\n\n\n（３）国税の徴収権の消滅時効国税の徴収権は、原則として法定納期限から５年間行使しないことによって、時効により消滅する（国税通則法（以下「通則法」という。）７２条１項）。ただし、偽りその他不正の行為により全部若しくは一部の税額を免れ、又は全部若しくは一部の税額の還付を受けた国税については、その時効は、原則として当該国税の法定納期限から２年間は進行しないこととされている（同法７３条３項）。\n２ 前提事実\n\n\n（１）原告による確定申告書の提出ア 原告は、令和２年３月１４日、処分行政庁に対し、平成２５年分の所得税等について、\n別表２の「平成２５年分」欄のとおり、措置法に規定する上場株式等に係る譲渡損失の金額５０００万円及び先物取引の差金等決済に係る損失の金額１５３５万８７３５円が生じたとして、これらの損失金額（本件各損失額）を翌年以降へ繰り越す旨、並びに課税される所得金額及び納付すべき税額がいずれも０円である旨記載した確定申告書（本件期限後申告書）を提出した。（乙６）\nイ 原告は、令和２年３月１４日、処分行政庁に対し、平成２６年分の所得税等について、\n別表２の「平成２６年分」欄のとおり、本件各損失額を翌年以降へ繰り越す旨、並びに課税される所得金額及び納付すべき税額がいずれも０円である旨記載した確定申告書を提出した。（乙７）\nウ 原告は、令和２年６月８日、処分行政庁に対し、平成２７年分の所得税等について、別表１－１の「確定申告」欄のとおり、同年分の上場株式等に係る配当所得の金額から本件各損失額を控除し、本件各損失額の残額は翌年以降へ繰り越す上場株式等に係る譲渡損失の金額又は先物取引の差金等決済に係る損失の金額であるとして確定申告をした。（乙２）\nエ 原告は、令和２年６月８日、処分行政庁に対し、平成２８年分の所得税等について、別表１－２の「確定申告」欄のとおり確定申告をした。同確定申告時に提出された確定申告書の付表の「前年分までに引ききれなかった先物取引の差金等決済に係る所得の損失の額」\n欄及び「本年の３年前分」の「前年から繰り越された上場株式等に係る譲渡損失の金額」\n欄には、本件各損失額に係る金額が記載されていた。（乙３）\nオ 原告は、令和２年６月８日、処分行政庁に対し、平成２９年分及び平成３０年分の所得税等について、別表１－３及び別表１－４の「確定申告」欄のとおりそれぞれ確定申告をした。（乙４、５）\n\n\n（２）本件各更正処分等処分行政庁は、令和２年９月９日付けで、原告に対し、原告の平成２５年分の所得税等について、本件期限後申告書は期限後申告をすることができる期間を経過して提出されたものであるから、本件各損失額を平成２６年分以後に繰り越すことはできないなどとして、本件各年分の所得税等について別表１－１ないし１－４の「更正処分等」欄のとおりの各更正処分（本件各更正処分）をすると共に、平成２７年分及び平成２８年分の所得税等について無申告加算税の各賦課決定処分（以下「本件各賦課決定処分」という。）をした。（乙８ないし\n１１）\n\n\n（３）原告による再調査の請求及び審査請求ア 原告は、令和２年１１月５日、処分行政庁に対し、本件各更正処分及び本件各賦課決定処分を不服として再調査の請求をした。これに対し、処分行政庁は、令和３年１月２８日付けで、原告の上記再調査の請求をいずれも棄却する決定をした。（乙１２）\nイ 原告は、令和３年２月２２日、国税不服審判所長に対し、本件各更正処分及び本件各賦課決定処分を不服として審査請求をした。これに対し、国税不服審判所長は、令和４年１月１２日付けで、原告の上記審査請求をいずれも棄却する裁決をした。（甲１）\n\n\n（４）原告による訴えの提起原告は、令和４年７月５日、本件訴えを提起した。（顕著な事実）\n\n\n（５）平成２５年分の所得税等の徴収権が時効消滅する日平成２５年分の所得税等の法定納期限は、平成２６年３月１７日である。したがって、その徴収権が時効消滅する日は、通則法７２条１項の規定による場合は平成３１年３月１８日、\n同法７３条３項の規定による場合は令和３年３月１８日である。\n３ 争点及びこれに関する当事者の主張\n\n\n（１）本案前の争点本件各更正処分のうち原告の申告額を超えない部分の取消しを求める訴えの適法性（争点\n\n\n（１））\n（被告の主張）\n所得税等は申告納税方式を採用しているところ、納税すべき税額は、原則として納税者がする納税申告により確定するものであり、納税者が一旦確定した課税標準等又は税額等を自己に有利に変更しようとする場合には、更正の請求をする必要がある（通則法２３条）。したがって、更正の請求の手続を執ることなく、抗告訴訟において更正処分のうち申告に係る納付すべき税額等を超えない部分の取消しを求める請求は、訴えの利益を欠き不適法である。\n原告は、本件各確定申告により自ら本件各年分の税額等を確定させた後、通則法が定める更正の請求をいずれも行うことなく本件訴えを提起しているから、本件訴えのうち、本件各確定申告に係る納付すべき税額を超えない部分の取消しを求める訴えは、訴えの利益を欠き不適法である。\n（原告の主張）\n上記被告の主張は争う。\n\n\n（２）本案の争点本件の本案の争点は、本件各更正処分において、本件期限後申告書がその提出が可能な期間内に有効に提出されておらず本件各繰越損失控除規定の適用要件を満たさないとして、原告の平成２７年分及び平成２８年分の上場株式等に係る配当所得（等）の金額、（上場）株式等に係る譲渡所得等の金額又は先物取引に係る雑所得の金額の計算上、本件各損失額を控除しなかったことが適法であるか（争点\n\n\n（２））であり、これに関する当事者の主張は、以下のとおりである。\n（被告の主張）\n原告の平成２５年分の所得税等の期限後申告については、通則法７３条３項所定の事情は認められない。したがって、原告の平成２５年分の所得税等の期限後申告書の提出が可能な期間は平成３１年３月１７日までの期間となる。\nそうだとすると、本件期限後申告書の提出は無効であるから、原告は、平成２７年分及び平成２８年分の上場株式等に係る配当所得（等）の金額、（上場）株式等に係る譲渡所得等の金額又は先物取引に係る雑所得の金額の計算上、本件各損失額を控除することはできない。\nよって、原告の平成２７年分及び平成２８年分の上場株式等に係る配当所得（等）の金額、\n（上場）株式等に係る譲渡所得等の金額又は先物取引に係る雑所得の金額の計算上、本件各損失額を控除しなかった本件各更正処分は適法である。\n（原告の主張）\n原告は、平成２４年分及び平成２５年分の所得税について、課税の対象となることを回避する意図をもって申告せず、その結果所得税の支払を免れているから、「不正の行為によりその全部（中略）の税額を免れた場合」（通則法７３条３項）にあたる。したがって、原告の平成２５年分の所得税等の期限後申告書の提出が可能な期間は令和３年３月１８日までの期間となる。\nそうだとすると、本件期限後申告書の提出は有効であるから、原告は、平成２７年分及び平成２８年分の上場株式等に係る配当所得（等）の金額、（上場）株式等に係る譲渡所得等の金額又は先物取引に係る雑所得の金額の計算上、本件各損失額を控除することができる。\nよって、原告の平成２７年分及び平成２８年分の上場株式等に係る配当所得（等）の金額、\n（上場）株式等に係る譲渡所得等の金額又は先物取引に係る雑所得の金額の計算上、本件各損失額を控除しなかった本件各更正処分は違法である。\n４ 被告が主張する所得税等平成２７年分及び平成２８年分の上場株式等に係る配当所得（等）の金額、（上場）株式等に係る譲渡所得等の金額又は先物取引に係る雑所得の金額の計算上、本件各損失額を控除できないことを前提として被告が主張する原告の本件各年分の所得税等に係る課税標準等及び納付すべき税額等は、別表３記載のとおりである。\n\n\n\n\n\n\n第３ 当裁判所の判断\n\n\n１ 争点\n\n\n（１）（本件訴えのうち、別紙１記載の部分の取消しを求める訴えの適法性）について所得税等が採用する申告納税制度（通則法１６条１項１号、同条２項１号、所得税法１２０条、東日本大震災からの復興のための施策を実施するために必要な財源の確保に関する特別措置法１７条）の下では、納付すべき所得税等の税額は、原則として納税者がする納税申告により確定する。そして、申告納税方式である国税について、納税者が自らした申告により確定した税額等を自己に有利に変更しようとするためには、更正の請求によらなければならない（通則法２３条）。このように、所得税等が申告納税方式を採用し、確定申告書記載事項の過誤の是正につき更正の請求という特別の手続を設けていることによれば、更正処分のうち申告に係る納付すべき税額等を超えない部分の取消しを求めることは、確定申告の錯誤が客観的に明白かつ重大であって、通則法が定める方法以外にその是正を許さなければ、納税者の利益を著しく害すると認められる特段の事情がない限り、許されないものと解される\n（最高裁判所第一小法廷昭和３９年１０月２２日判決・民集１８巻８号１７６２頁参照）。したがって、更正処分のうち申告に係る納付すべき税額を超えない部分の取消しを求める訴えは、前記特段の事情がない限り、不適法というべきである。\nこれを本件についてみると、原告は、本件各確定申告により本件各年分の税額等を確定させた後、通則法が規定する更正の請求をいずれも行わないまま、本件訴えにおいて、本件各更正処分のうち本件各確定申告に係る納付すべき税額等を超えない部分についてもその取消しを求めている。しかし、本件全証拠によっても、本件各確定申告の錯誤が客観的に明白かつ重大であって、通則法が定める方法以外にその是正を許さなければ、納税者たる原告の利益を著しく害すると認められる特段の事情を認めることはできない。\nよって、本件訴えのうち、本件各更正処分中本件各確定申告に係る納付すべき税額等を超えない部分、すなわち別紙１記載の各部分の取消しを求める訴えは不適法である。\n２ 争点\n\n\n（２）（本件各更正処分において、本件期限後申告書がその提出が可能な期間内に有効に提出されておらず本件各繰越損失控除規定の適用要件を満たさないとして、原告の平成２\n７年分及び平成２８年分の上場株式等に係る配当所得（等）の金額、（上場）株式等に係る譲渡所得等の金額又は先物取引に係る雑所得の金額の計算上、本件各損失額を控除しなかったことが適法であるか）について\n\n\n（１）期限後申告書の提出が可能な期間所得税等の期限後申告について、通則法は、「２５条の規定による決定があるまで」（同法\n１８条１項）することができる旨規定するほかは、その期間について明示していない。\nしかしながら、国税の徴収権は、その国税の法定納期限から５年間（通則法７３条３項の適用がある場合は実質７年間）行使しないことによって時効により消滅し（同法７２条１項）、その時効については援用を要せず、また、利益を放棄することもできない（同条２項）\nことによれば、国税の徴収権は、時効期間の経過後は、納税者が時効を援用するかどうかを問わず絶対的に消滅し、税務官庁は徴収手続をとることができないと解するのが相当である。\nまた、国税の徴収権の消滅時効の完成により、具体化されなかった抽象的納税義務そのものも消滅してしまうと解されるところ、確定申告は、納税者が自らその納税義務の内容を確定させるための手続であると解されるから、通則法２５条の規定による決定がされない場合であっても、当該申告の対象となる国税の徴収権の時効期間が経過し、抽象的な納税義務自体が消滅し、具体的な納税義務の内容をおよそ確定することができなくなったときには、期限後申告をすることはできなくなると解するほかはない。\nしたがって、期限後申告書の提出が可能な期間は、その国税の徴収権が時効により消滅するまでと解するのが相当である。\nよって、期限後申告書の提出が可能な期間は、原則として、当該国税に係る法定納期限から５年間であり、７３条３項所定の事情がある場合にはその国税に係る法定納期限から７年間となる。\n\n\n（２）本件期限後申告書はその提出が可能な期間内に有効に提出されたか前述のとおり、通則法７３条３項所定の事情がある場合には、期限後申告書の提出が可能な期間はその国税に係る法定納期限から７年間となるところ、同項にいう「偽りその他の不正の行為」とは、税額を免れる意図の下に、税の賦課徴収を不能又は著しく困難にするような何らかの偽計その他の工作を伴う不正な行為を行っていることをいい、単なる不申告行為はこれに含まれないと解される（最高裁判所第三小法廷昭和５２年１月２５日判決・訴訟月報２３巻５６３頁参照）。\nこれを本件についてみるに、原告の平成２５年分の所得税等の期限後申告について、原告が税額を免れる意図の下に、税の賦課徴収を不能又は著しく困難にするような何らかの偽計その他の工作を伴う不正な行為を行ったことについては、証拠が全くない。そうすると、原告の平成２５年分の所得税等の期限後申告書の提出が可能な期間は、原則どおり、法定納期限である平成２６年３月１７日から５年間である平成３１年３月１７日までの期間となる\n（前記前提事実\n\n\n（５））。\nこれに対し、原告は、平成２４年分及び平成２５年分の所得税について、課税の対象となることを回避する意図をもって申告せず、その結果所得税の支払を免れているから、原告の平成２５年分の所得税等の期限後申告書の提出が可能な期間は、法定納期限から７年間であると主張する。\nしかし、通則法７３条３項が、国税の徴収権で偽りその他の不正の行為によりその税額を免れた国税等に係るものの時効は「当該国税の法定納期限」から一定期間進行しないと規定していることからも明らかなとおり、同項所定の事情が存在するために期限後申告をすることができる期間が法定納期限から７年間となるかどうかについては、年分ごとに定まるものである。したがって、平成２４年分の所得税に関する事情を理由とする原告の主張は前提を欠く。\n結局のところ、原告の主張は、単なる不申告を主張するにすぎないのであり、前述のとおり、単なる不申告行為は「偽りその他の不正の行為」（通則法７３条３項）に該当しない。\nしたがって、原告の上記主張は理由がない。\n以上によれば、原告の平成２５年分の所得税等の期限後申告書の提出が可能な期間は平成\n３１年３月１７日までの期間であるところ、本件期限後申告書は上記期間を経過して提出されたものであるから（前記前提事実\n\n\n（１）ア）、その提出は無効である。\n\n\n（３）小括上記\n\n\n（２）のとおり、本件期限後申告書はその提出が可能な期間内に有効に提出されていないから、平成２７年分及び平成２８年分の所得税等につき、本件各繰越損失控除規定の適用要件である所定の確定申告書の有効な提出がなされているとはいえない。よって、原告は、\n平成２７年分及び平成２８年分の上場株式等に係る配当所得（等）の金額、（上場）株式等に係る譲渡所得等の金額又は先物取引に係る雑所得等の金額の計算上、本件各損失額を控除することはできない。\nしたがって、処分行政庁が、本件各更正処分において、原告の平成２７年分及び平成２８年分の上場株式等に係る配当所得（等）の金額、（上場）株式等に係る譲渡所得等の金額又は先物取引に係る雑所得等の金額の計算上、本件各損失額を控除しなかったことは適法である。\n３ 本件各更正処分の適法性\n\n\n（１）原告の本件各年分の所得税等の納付すべき税額等原告の本件各年分の所得税等の納付すべき税額等は、平成２７年分及び平成２８年分の上場株式等に係る配当所得（等）の金額、（上場）株式等に係る譲渡所得等の金額又は先物取引に係る雑所得等の金額の計算上、本件各損失額を控除することができないことを前提として算出すると、被告が本訴において主張するとおり（別表３記載のとおり）であると認められる。\n\n\n（２）平成２７年分の更正処分の適法性平成２７年分の更正処分は、同年分の所得税等の納付すべき税額を、上記認定額を下回る\n２８万５６００円としたものであり、翌年へ繰り越す上場株式等に係る譲渡損失の金額及び翌年へ繰り越す先物取引の差金等決済に係る損失の金額を上記認定額と同額としたものであるから（前記前提事実\n\n\n（２））、全て適法である。\nなお、原告は、本件各損失額を翌年へ繰り越す旨記載した平成２６年分の所得税等の確定申告書に係る税額等が更正されていないことから、本件各損失額を控除しないことを前提とした平成２７年分の更正処分の内容と平成２６年分の期限後申告の内容とが矛盾することを理由に、平成２７年分の更正処分が違法であると主張する。しかし、平成２６年分の所得税等の確定申告書に係る税額等については、同確定申告書が更正をすることができる期間が経過する直前、すなわち、法定申告期限から５年を経過する日（通則法７０条１項柱書、同項\n１号）の直前である令和２年３月１４日に提出されたため、処分行政庁においてその更正をすることができなかったと推認され、同確定申告書に係る所得税等の税額等の更正をしなかった理由が、処分行政庁において本件各損失額を翌年へ繰り越す旨の記載が適法であると判断したためであるとは認められない。そうだとすると、平成２７年分の更正処分の内容と平成２６年分の期限後申告の内容とが矛盾するからといって、これを理由に本件各損失額を控除しないことを前提とした平成２７年分の更正処分が違法となるわけではないから、原告の上記主張は理由がない。\n\n\n（３）平成２８年分ないし平成３０年分の更正処分の適法性平成２８年分ないし平成３０年分の更正処分は、所得税等の納付すべき税額、翌年へ繰り越す上場株式等に係る譲渡損失の金額及び翌年へ繰り越す先物取引の差金等決済に係る損失の金額を上記認定額と同額としたものであるから（前記前提事実\n\n\n（２））、全て適法である。\n\n\n\n\n\n\n第４ 結語よって\n\n\n、本件訴えのうち、別紙１記載の各部分の取消しを求める部分については不適法であるからこれを却下し、その余の部分はいずれも理由がないからこれを棄却することとし、訴訟費用の負担につき行政事件訴訟法７条、民事訴訟法６１条を適用して、主文のとおり判決する。\n水戸地方裁判所民事第２部裁判長裁判官 廣澤 諭裁判官 𠮷野内 謙志裁判官 溝口 千恵\n（別紙１）\n却下部分目録\n１ 処分行政庁が令和２年９月９日付けで原告に対してした、原告の平成２７年分の所得税及び復興所得税の更正処分のうち、次の\n\n\n（１）ないし\n\n\n（７）の金額を超えない部分\n\n\n（１）総所得金額 ０円\n\n\n（２）上場株式等に係る配当所得の金額 １万６９００円\n\n\n（３）株式等に係る譲渡所得等の金額 ０円\n\n\n（４）先物取引に係る雑所得等の金額 △８３４万１０２０円\n\n\n（５）還付金の額に相当する税額 ２５８３円\n\n\n（６）翌年へ繰り越す上場株式等に係る譲渡損失の金額 ４９９８万３１００円\n\n\n（７）翌年へ繰り越す先物取引の差金等決済に係る損失の金額 ２３６９万９７７３円\n２ 処分行政庁が令和２年９月９日付けで原告に対してした、原告の平成２８年分の所得税及び復興所得税の更正処分のうち、次の\n\n\n（１）ないし\n\n\n（７）の金額を超えない部分\n\n\n（１）総所得金額 ０円\n\n\n（２）上場株式等に係る配当所得等の金額 １４万３１００円\n\n\n（３）上場株式等に係る譲渡所得等の金額 △４２２万２０００円\n\n\n（４）先物取引に係る雑所得等の金額 ０円\n\n\n（５）還付金の額に相当する税額 ２万１９１０円\n\n\n（６）翌年へ繰り越す上場株式等に係る譲渡損失の金額 ４０７万８９００円\n\n\n（７）翌年へ繰り越す先物取引の差金等決済に係る損失の金額 ８３４万１０２０円\n３ 処分行政庁が令和２年９月９日付けで原告に対してした、原告の平成２９年分の所得税及び復興所得税の更正処分のうち、次の\n\n\n（１）ないし\n\n\n（６）の金額を超えない部分\n\n\n（１）総所得金額 ０円\n\n\n（２）上場株式等に係る譲渡所得等の金額 △３４００万００００円\n\n\n（３）先物取引に係る雑所得等の金額 △１８６６万２００８円\n\n\n（４）納付すべき税額 ０円\n\n\n（５）翌年へ繰り越す上場株式等に係る譲渡損失の金額 ３８０７万８９００円\n\n\n（６）翌年へ繰り越す先物取引の差金等決済に係る損失の金額 ２７００万３０２８円\n４ 処分行政庁が令和２年９月９日付けで原告に対してした、原告の平成３０年分の所得税及び復興所得税の更正処分のうち、次の\n\n\n（１）ないし\n\n\n（５）の金額を超えない部分\n\n\n（１）総所得金額 ０円\n\n\n（２）上場株式等に係る譲渡所得等の金額 △２４５０万００００円\n\n\n（３）納付すべき税額 ０円\n\n\n（４）翌年へ繰り越す上場株式等に係る譲渡損失の金額 ６２５７万８９００円\n\n\n（５）翌年へ繰り越す先物取引の差金等決済に係る損失の金額 １８６６万２００８円以 上\n（別紙2)関係法令の定め\n\n\n\n\n\n\n第1 国税通則法\n\n\n... 1 1-6条1項国税についでの納付すべき税額の確定の手続については、次の各号に掲げるい ・ずれかの方式によるものとし、これらの方式の内容は、当該各号に掲げるところによる。 ・\n)1( :1号 ・申告納税方式 納付すべき税額が納税者のする申告により確定することを・\n．原則とし、その申告がない場合又はその申告に係る税額の計算が国税に関する\n・法律の規定に従っていなかった場合その他当該税額が税務署長又ば税関長の ，\n， ．・調査したところと異なる場合に限り、税務署長又は税関長の処分により確定す\n`;\nc\n:・ ←， ,,°. ・ る方式をいっ\n;~ • )2( 2号 省 略\n1 6条項．国税（前条第3項各号に掲げるものを除く。）についての納付すべき税額の確 ．．．\n・定が前項各号に掲げる方式のうちいずれの方式によりされるかは、次に定めるところにょる，o- ．．． .•• ．、．．．\n)1{ 1号 ・ ・．訳）\n納税義務が成立する場合において、．．納税者が、国税に関する法律の規定により、納付すべき税額を申告すべきものとされている国税 申告納税方式 ・\n)2( 2号 省 略\n‘9\n3. 1 8条1項\n“ 期限内申告書を提出すべきであった者（所得税法第1 2 3条第 1 項（確定損失 ・申告）3第\n1 2 5 条第3項（年の中途で死亡した場合の確定損失申告）又は第1 2\n7条第3項・（年の中途で出国をする場合の確定損失申告） （これらの規定を同法第1 6.6条（非居住者に対する準用）において準用する場合を含む。）の規定によ‘る申告書を提出することができる者でその提出期限内に当該申告書を提出しなかったもの及びこれらの者の相続人その他これらの者の財産に属する権利義務・を包括して承継した者（法人が分割をした場合にあっては、・第7条の2\n\n\n\n\n\n\n第4 項\n\n\n（信\n.. 6.託に係る国税の納付義務の承継）の規定により当該分割をした法人の国税を納め\n＇ る義務ーを承雛した法人に限る。）を含む。）は、その提出期限後においても、第2条（決定）の規定による決定があるまでは、納税申告書を税務署長に提出する ．\n..•ことができる。． ．・． ． ．\n4 1 8条2項 ・・\nー0\n.,前項の規定により提出する納税申告書は、期限後申告書という。\n5 23 条1項 ・． ．\n． ． 、 、ヽ ．\n、\"'\n． 拿\n・\n『 ． · ~ 納税申告書を提出しtゴ者は‘、次の各号のいずれかに該当する場合には、当該申\n, - ~ I\n 、 •\n•‘` 』.｀ · .‘.ヽ\n-告 書に係る国税の法定申告期限から 5年（第2号に掲げる場合のうち法人税に係ベ ◄\n、•.一＇ る場合については、 1()年）以内に限り ．、税務署長に対し、その申告に係る課税標準等又は税額等 ．（当該課税標準等又は税額等に関し次条又は2'6条（再更正） ’の規定による更正（以下この条において「更正」．という。）があった場合には、当該更正後の課税標準等又は税額等）につき更正をすべき旨の請求をすることができる。 ・・．\n)1( 1号 当該申告書に記載した課税標準等若しくは税額等の計算が国税に関．．印\n・．．する法律の規定に従っていなかったこと又は当該計算に誤りがあったことに ．．より、当該申告書の提出により納付すべき税額（当該税額に関し更正があった\n・・．場合には、当該更正後の税額）が過大であるとき。 .. ・,\n)2.( 2・号 前号に規定する理由により、 当該申告書に記載した純損失等の金額 • '\n・（当該金額に関し更正があった場合には、当該更正後の金額）が過少であると ・き、又は当該申告書（当該申告書に関し更正があった場合には、更正通知書） ．に純損失等の金額の記載がなかったとき。・\n)3( 3号 第1号に規定する理由により、当該申告書に記載した還付金の額に相当する脱額（当該税額に関し更正があった場合には、当該更正後の税額）が過少であるとき、又は当該申告書（当該申告書に関し更正がぁった場合には、更正通知書）に還付金の額に相当する税額の記載がなかったとき。\n6.\n6 .2 5 条 ． ．．紐翻は、納税申告書を提出する義務があると認められる者が当該申告書を提出しなかった場合には、その調査により、当該申告書に係る課税標準等及び税額等を決定する。：ただし、決定により納付すべき税額及び還付金の額に相当する..\n10 ・ 税額が生じないときは、この限りでない。 ．．\nヽ\n、' 7 • 7 •O条1項柱書\n2・_次の各号に掲げる更正決定等は、当該各号に定める期限又は日から5年．．（第号に規定する課税標準申告書の提出を要する国税で当該申告書の提出があった\n． ものに係る賦課決定（納付ずべき税額を減少させるものを除く。）については、 3\n． 年）を経過した日以後においては、・することができない。\n• 16\n・ •••. ・)1( 1号更正又は決定 その更正又は決定に係る国税の法定申告期限．（還付請求申告書に係る更正については当該申告書を提出した日とし、還付請求申告書 ． ．の提出がない場合にする決定又はその決定後にする更正については政令で定\n・．める日とする。）．．\nm 8 7..2条 1 項\n．． 国税の徴収を目的とする国の権利（以下この節において［国税の徴収権」という。）は、その国税の法定納期限（\n\n\n\n\n\n\n第7 条第\n\n\n3項・（国税の更正、決定等ーの期間制限）の規定による更正若しくは賦課決定、同条第 項の規定による賦課決定、前\n．． 条第1項第1号の規定による更正決定等、同項\n\n\n\n\n\n\n第3 号の規定による更正若しくは賦課決定又は同\n\n\n項第 号の規定による更正決定等によ・り納付すべきものについ応\nては、第7 .0 条第3項若しくは前条\n\n\n\n\n\n\n第1 項第\n\n\n号若しくは第3 号に規定する更正、：第7 0条\n\n\n\n\n\n\n第4 項に規定する賦課決定\n\n\n、前条第1項第1号に規定する裁決等又は同\n• 項第4号に規定する更正決定等があった日とし、還付請求申告書に係る還付金の ．額に相当する税額が過大である•ことにより納付す・ベきもの及び国税の滞納処分費については、これらにっき徴収権を行使することができる日とし、過、怠税につ\n6 いては、その納税義務の成立の日とする。次条\n\n\n\n\n\n\n第3 項において同じ\n\n\n。）から 5年間行使しないことによって、時効により消滅する。 ．．条\n9 7 2 2項 ．. . ¥ . .国税の徴収権の時効については、その援用を要せず．、また｀その利益を放棄することができないものとする。• ・•\n• io• 1 O 7 3条3項柱書 ． ．．．国税の徴収権で、偽りその他不正の行為によりその全部若しくは一部の税額を免れ、若しくはその全部若しぐは一部の税額の還付を受けた国税又は国外転出等\n． 疇 . 9 `ヽ ｀． ．' •`c< 特例の適用がある場合の所得税に係るものの時効ぱ、当該国税の法定納期限から ・\n~\n、\n'.. ヽ9 土\n．．\n.\n‘\nV ・\n`\n9．\n．` C\ne\n2 年間は、進行しない。ただし、当該法定納期限の翌日から同日以後2年を経過 ..嶋 .\n-\n• 51 する日までの期間内に次の各号に掲げる行為又は処分があった場合においては '当該各号に掲げる行為又は処分の区分に応じ当該行為又は処分に係る部分の国 ．．\n. ·.•.税ごとに当該各号に定める日の翌日から、• 当該法定納期限までに当該行為又は処\n:...\n：分があった場合においては当該行為又は処分に係る部分の国税ごとに当該法定'納期限の翌日から進行する。 I.\n02 ・・'第2 .所得税法\n1 120 条1項柱書騨 者 は、その年分の総所得金額、・退職所得金額及び山林所得金額の合計額が第 心 第4節（所得控除）の規定による雑損控除その他の控除の額の合計額を超\n25 える場合におい℃当該総所得金額、退職所得金額又は山林所得金額からこれらの控除の額を第87条第2項〶r得控除の順序）．．の規定に準じて控除した後の金\nr・..額をそれぞれ課税総所得金額J課税退職所得金額又は課税山林所得金額とみなして\n\n\n\n\n\n\n第89 条\n\n\n（税率）の規定を適用して計算した場合の所得税の額の合計額が配当控除の額を超、えるとき（中略）は、第1.2.3条第1項（確定損失申告）の規定による申告書を提出する場合を除き、第3期（その年の翌年2月1 6・日から 月1 ・\n5 日までの期間をいう。以下この節において同じ。）において、税務署長に対し、\n次に掲げる事項を記載した申告書を提出しなければならない。この場合にぉいて；その年において支払を受けるべき\n\n\n\n\n\n\n第28 条第\n\n\n1項（給与所得）に規定する給与等で第L90 条（年末調整）の規定の適用を受けたものを有する居住者が、当該申 ・告書を提出するときは、・次に掲げる事項のうち財務省令で定めるものについては、\n．． 財務省令で定める記載によることができる。\n第 3 措置法（平成2 ・7年分は平成25 年法律第5号による改正前のもの、平成28\nc ー\n、¢\n`（\n＇．\n＇ 、.“年分ないし平成・3_0年分は平成30 年法律第7号による改正前のもの。以下同じ。）\n．` ．．\n｀ ．令` ヽ\n9ヽ ＇ . 1 3 7条の1 2の2 第5項（平成27 年分以前については平成25 年法律第5号乞\n．\n≪\n≪による改正前の同条第6況以下同じ。） ’\n．． 確定申告書を提出する居住者又は恒久的施設を有する非居住者が、その年の前 ・年以前3年内の各年において生じた上場株式等に係る譲渡損失の金額（この項の\n' 規定の適用を受けて前年以前において控除されたものを除く。）を有する場合には、第3 7条の 1 1第 1項後段の規定にかかわらず、・当該上場株式等に係る譲渡損失の金額に相当する金額は、政令で定めるところにより、当該確定申告書に係幻\nる年分の同項に規定する上場株式等に係る譲渡所得等の金額及び第8条の 第\n｀\n＾\n． -・1項に規定する上場株式等に係る配当所得等の金額（第一項の規定の適用がある\n・場合にはその適用後の金額。以下この項において同じd) を限度として、当該年分の当該上場株式等に係る譲渡所得等の金額及び上場株式等に係囚記当所得等の幻． ・． 金額の計算上控除する。\n2 . 3 7条の 1 2 の2 第7項（平成 2 7年分以前については平成25 年法律第5号\n• Iによる改正前の同条\n\n\n\n\n\n\n第8 項\n\n\n。以下同じ。） ．第 5項の規定は、同項に規定する居住者又は恒久的施設を有する非居住者が前 ―項1こ規定する上場株式等に係る譲渡損失の金額が生じた年分の所得税につき当該上場株式等に係る譲渡損失の金額の計算に関する明細書その他の財務省令で．．・\n・．定める書類の添付がある確定申告書を提出し、かつ、その後において連続して確 ．\n5 .定申告書を提出している揚合であ・って、第5項の確定申告書に同項の規定による控除を受ける金額の計算に関する明細書その他の財務省令で定める書類の添付 ．\n． がある場合に限り 、適用する。\n3 4 1条の 第1項\n・確定申告書（第5項において準用する所得税法第1 23 条第 1項（同法第1 6\n•6条において準用する揚合を含む。）の規定による申告書を含む。以下この項及 ．．\n・．． 直 3項においで同じ。）を提出する居住者又は恒久的施設を有する非居住者が、．・\n. •C‘ `．．\n`\n.\n．\n．、\n. 9 ＂. その年の前年以前3 年内の各年において生じた先物取引の差金等決済に係る損\n. ‘\n. . ,.ず t I c、 ≪ ヽ . « « 失の金額（この項の規定の適用を受けて前年以前において控除されたものを除\nt • 、\nく~)を有する場合には、前条第1項後段の規定にかかわらず、当該先物取引の差\nill金等決済に係る損失の金額に相当する金額は、政令で定めるところにより、当該 ，確定申告書に係る年分の同項に規定する先物取引に係る雑所得等の金額を限度\n, Iとして．、当該年分の当該先物取引に係る雑所得等の金額の計算上控除する。 ． •\n•• 4_ 4 1条の 1 5\n\n\n\n\n\n\n第3 項\n\n\n． ..幻\n第1項の規定は同項に規定する居住者又は恒久的施設を有する非居住者が前\n•項に規定する先物取引の差金等決済に係る損失の金額が生じた年分の所得税に ＇つき当該先物取引の差金等決済に係る損失の金額の計算に関する明細書その他\n． の財務省令で定める書類の添付がある葎定申告書を提出し、・かつ、その後におい ・て連続して確定申告書を提出している場合であって、第1項の確定申告書に同項の規定による控除を受ける金額の計算に関する明細書その他の財務省令で定め・邸\n．る書類の添付がある場合に限り、適用する。\n`•\n\n\n\n\n\n\n第4 東日本大震災からの復興のための施策を実施\n\n\nするために必要な財源の確保に関する特別措置法 ．\n\n\n‘\n\n\n1 i ・7条1項柱書 ．暉税法第1.2 0条第1項、・第1:24 条第1項（同法第12 .5条第5項において準用する場合を含む。）．、第1 2 5条第1項、・第i 2.6条第1項又は第 12 7条第1項 •（これらの規定を同法第 1 6 6 条において準用する場合を含む。．）の規定により確定申告書を提出すべき者は、次に掲げる事項を記載した申告書を、当該 ・．確定申告書の提出期限までにく税務署長に提出しなければならない。\n\n\nー\n\n\n．\n\n\nio : 以 上 ．\n\n\n． ．‘ . ．． 噌\n\n\n«\n\n\n9 ．\n\n\n．\n\n\n« ~ ．\n\n\n.. 會\n\n\n‘\n\n\n,\n\n\n． ，．• ヽ\n\n\n`， ヽ尋‘ ｀\n\n\n・ c． 、 . u別,表....1 1. 平成27 年分の所得税等の課税処分等の経緯\n\n\n（単位：円）\n\n\n・・ '\n\n\nC 更田是分• mmm\n\n\n.- - 畔摩 ・ 、 印覧慶決定 ・ 審査＊ ・戴\n\n\n”響．の年月日 令和碍J! 8B 令和坪9月9P 令徊年11月5日令和3年l月匹百會窯坪2月22P 會和4年1月．I咋鑢 の Q) ．． 瓜227 ヽ鰺 麟 Z1 o ．狐？2 ．．\n\n\n9, .. • •\n\n\nI衡瀾鳴＆鵬 ． 躙 攀成績 ．． DG - 1.2 ,68 ． 1日\n\n\n゜”｀坦に鐸る配口の④ 61．ゆ l\n\n\n． 、\n\n\n紐取引に鍋る細所飢9の傘績• O △a;•功．02CI △い諷四\n\n\n・ー ．・ ． ．\n\n\n' . '•. 隋暉“'の幻鳩 :08S 蹴囀\n\n\n・ロ範暉傘額●、 ...•⑦ •0 0ぞぶ礁心に饂る匹叩、(≫ • - . ,I緬．四閂溢屯出•F“·るIi!自® ,. •O • I`• : :.\n\n\n． ． ． ． ． 錫 処\n\n\n<出＆る紐印1に保る匹．R ． 0 0 . ｀．：\n\n\n；\n\n\n・ ・ ` `\n\n\nヽ\n\n\n‘ & ’\n\n\n．\n\n\n`\n\n\nc\n\n\n． ． ， • 9\n\n\n,\n\n\nー、 ，\n\n\n．\n\n\nヽ す\n\n\nr\n\n\n≪\n\n\nc . • 電 の\n\n\n②\n\n\n(1) 、 1項\n\n\n：こ ． す •\n\n\n：蜻 る鯖\n\n\nす 裏す\n\n\n麟 るる裏農\n\n\n麟鯛\n\n\n゜\n\n\n@\n\n\n⑫ ヽ ・・．\n\n\n．．\n\n\n＿ ・ .• 0\n\n\n・ •• m\n\n\n'\n\n\n．\n\n\n009\n\n\n,“\n\n\n°分挟 鶴の\n\n\n定姐 ． 棄へ\n\n\n匂 ・の\n\n\n決 ．． ．•. ． 処 霞 麟分\n\n\n定 び 疇 ・• ．．棄 輝\n\n\nu ．. . ― ，⑩にヽ鯖冦暉・・ . ⑭ ,0 0 鶴 金 ・ 全 鱈 •\n\n\n9 碍 • 取取\n\n\n. 忠 ． tR> ． •• ． • ． t 0 00,,282 ・一 . •. ・ 讀 し ・亀 .• . •調 し • ．！・ ． ． ． . I\n\n\nI\n\n\nJ;•四、 ’屯笠閉臼．．：． ・ ⑩ 0\n\n\n． ．・． ． —\n\n\n・翼皐徽-． ・. ・◎ 2,紐 1駁 ・:\n\n\nヽ． F.\n\n\n：．． 常お曙 ‘. ⑱ ．・・ △公却 磁008 ,. ．．臼 ぽ 溢 一 四．0 .\n\n\n,61 009 : : • •荘悶温ば芯L臼緯式⑳ . 49．砥 001 • ・o柘●養分漬でに嚢肇る U 損l失く先の働彙●直19の．董 ⑳ ーば\n\n\nば翡：り鑢される紐印I1・1 ・ ・丸•四．713 •• •. l,7!鴫 訟》\n\n\n＇に鐸る景失の童瓢． ．． ‘ ..．鍾摩書算算狐の額 ． ◎ — “•OOO\n\n\n（)lf 1 r~屯に停碩四得●直J暉及び『先虹nl“‘刃攣輝嶋の傘釦 0鰤碩9は、損失の金·を攣す． ．\n\n\n.' 2 『上雌鵡に鼻る配崖詞の瓢〇瓢り“ば、 『＊尋分で饂し引く上獣紅＊吐る麟裟損失¢U り暉の“'を甍し19く薗 ．＇．\n\n\n` 3 の金 直 ●で 覆 あ さ り れ 、 雑 f 鵡 諜 に 覆 鐸 さ る れ 麟 廷 即 楊棒 印 式 螂 ● の に 金 傷 額 る・ J 配 O 当 鳳 所の釦 頃 ® 楓 • さ の れ 金 る 釦 上 、 楊 印 釦 該 'a 傘鯛 碍 ( 碑 Q l! I I頁 I 得 ) の を 傘 甍 績 し引い rR た菖 鵬 〇 及び 傘績 r 瓢 で 覆 あ さ t れ . る先働夏99 .に保る輯輝等の傘額J鋼q綱は、J 000, 円乗調の・徽を切り檜てた葦り傘績である． ．\n\n\nr 納什すべき a ● （⑲十⑯—⑰)』 0．の“m、．△印がある●合は、 遍付金の額に帽畠する税額であり、そのぽかの曇合ば、 lOOPI未調の蠅量を切り檜てた襲の傘績である． ． ．別表 1-2 平成28 年分の所得税等の課税処分等の経緯\n\n\n□\n\n\n―_―-- （単位：円）\n\n\nニ：し： 二|：」こ：こに：：'\"鴫定亨告\n\n\nー―\n\n\n..”゜の隼月•II .,令和筑屯月118\n\n\n．\n\n\n・J~．の ① 147“綸貰得傘額 ,0 01 . てて u ,2“7\n\n\n1上紐心に“る麟丘 9 臼 , の 食 ol △.4;i2,2．函 12.、93` m鯛 ．．\n\n\n］点ー鍋る一の—IO\n\n\n｀\n\n\nl公001,3\n\n\n，．\n\n\n001,341\n\n\n1 紐扇g91こ鐸礁言貴疇の傘麟 l ◎ ,01 672, 23) 1\n\n\n・ご：：”計“|: 寧“OOO • 一 • •.\n\n\n。 ゜声 9. , l鼻楓される上纏釦頑に“る匹1R 。 “3.12 ,000\n\n\n，\n\n\n-1::戸 ― 。\n\n\n..3781\n\n\nt 更正処分及び重露挟定是分の金●軍 更正給分及び賦繹挟定蛤分の金繹諏隋し\n\n\n・ 0 .'o . 。\n\n\n. . 鼻 • 、 ． . e . ・,' ~ « 伝 ⑦`·に ”述“ 、‘ - A 0 . ， ,103,S 067 ヽ r 棄 輝 ． 棄 鋼\n\n\n. .\n\n\n、 ..．≪ ` : ．．． ・. く 一 ゜ ゜ 。\n\n\n. C\n\n\n. 、\n\n\nし`\n\n\n〇に鮒ずる覆麟\n\n\n⑭\n\n\nt ー I . , . 仰、． , 暉 0詈 ' . 1\n\n\n:, . - 10 • 3，匹 007 1 し ‘ ',\n\n\n‘\n\n\nlo .1. '諏\n\n\n・'.,\n\n\n' 12 ,101, ,t) 011写\n\n\nニユ— 1釦．ゆ\n\n\n; ・o主ば益製品J:::.—心に円LO\n\n\n.;t 870 0,011 。\n\n\n゜\n\n\n. 、. ば船品iねば＂直傘 l\n\n\n•I ⑳ T,”‘”笠；；：巴庄町：\n\n\naM.020\n\n\nー ・叫 OOO\n\n\n．．（注） 2 1 . 「 r.. 先 I:叡 鞠 厄 取 虹 \"i渥る m 繰 m 所得 四 疇の f賃 金 疇 額 の J 拿 ・ 釦 ⑤ “ 鵬の '及 彙 u 額 - は、 r紐 『 l 木 t 年 l 分 l ．で に 肇 傾 し13 る く先 血 ・ ． 履 ” 13 “ の 山 肇 “ 金 ' ● の 紐 △印 に は 儡 : る • 印 慣知 彙 金 額 釦◎ \"E 員 す の ． 傘頓を甍し1, ． <\n\n\n. 3 貫の 「 傘 璽 瓢 製 で さ ．あ れ り、 る ． 追 r瓢 線 農 が さ 杯 れ ： る 繹 先 る 働- ● ~ ● , 印 に儡 疇 る の 緯房 傘 霧 鎮 鴫 R の 鳳 傘甑J 1 t 8 i.さ 蝙 れ の る 傘 上 額 叫 は 庄 、． 渇 ．当該 に 傘 僑 額 る (O 記 即 血 を 得疇 董 の し ・ 91 M い .1 た輩の0傘 瓢 額 及 で び あ l る 皿 ． さ ．． れる先綸翻屯直•響の傘饂J””四 1、000面釦鴫と曇り綸てた量吸績である. •• ••. .\n\n\nI 4 . 「紐すべき覆額•(Oれ949)・ハ暉の金額は、△印がある編合は、 遭付傘の鱈．に樟目する楓額であり．そのほ3｀の編合は、 100円未繍の鍾翫を”9篇てた量の・額である． ．別表-'t -._ 3 平成29 年分の所得税等の課税処分等の経緯\n\n\n（単位：~)\n\n\n・鶴定攣＇ 更正蛤分● 再舅皇讀車 \"“査紅 書査請拿 戴峡寧賣●の年月fl ..•. 令碕月9日 會和坪9月9日 會和坪11.JI租 令和ltJ8.2 P 令年2月22B 合和4尋1月IJII\n\n\n. ¥ .緯胃の傘額 ゜ s. 9釦 鶴 ゜ “‘’“\n\n\n゜\n\n\n’1上’騨•‘鵡 ’に儡る鰭訊'‘” ゜ • “• △ 77a.3S ，馴這\n\n\n．上●楊緯．式剛こ儡る配畠所得●の傘\n\n\n゜\n\n\n・先●扇19に儡る艤賣得攀の傘鎮 ゜ △ 1ぃ~008 6 1..“`”e一\n\n\n房得．鐙．鱒の麟の合計• R 珈~000 珈．匹\n\n\n．．\n\n\n゜ ゜ .. 0饂覆されるJ:..練式● 1こ““胄菫 ゜ ゜所の•.. ·. •.. • ゜\n\n\nF得れの傘る鎮.J:•．駈｀ ．．“`る配畜 R ,.閉辻｀紐重 • ゜\n\n\n19に．が 四． . 0更 更\n\n\n.. ヽ 正 コゆに髯する楓● ．． 〇 ． .• . 0 : Q . 処．．\n\n\n≪ e. . ． . ・ ． ． 、 ． ．． ． ・・如蛉\"“[ . ◎ 0 0 金 の （．·．• : • ．棄囀 ． 金 分 の・ 棄 鶴\n\n\n. ． ． ‘ , べ 、 .u . .． .・ 疇 ヽ ． ． ， ． 〇心fる四 •.Q ， ・. ● : .- ？ 鶴 取\n\n\nC\n\n\n.\n\n\n．\n\n\n. ． 鳩 0一\n\n\n鯖す・る裏鑽． ゜し\n\n\n'..電 ．． ゜基•(叩O+0+0+. 0. ) ◎ 0 ．； .. ．． ゜\n\n\n． ゜ ・o\n\n\nm複・員(O 2() し\"） 、〇\n\n\n＼\n\n\n:0 0 . ゜糧●●納（●べ.'iき0.:.嘱)瓢 R ゜ ゜\n\n\n．．芯匹溢i五：式＇に偏 ◎ • ．・:..\n\n\n・' .\n\n\n·•·璽●響に繹凶鳥\" .に.繊 9量鑢のされる上・・・樟．．式． • 81 ,,I70 008 .. S9mme\n\n\n.,: ••出；印ば迂'i直今 ◎\n\n\nr召岱；：出はば：弓I. .・. ”’“,09 .26il:1,S 800 ..\n\n\nヽ\n\n\n／＾\n\n\n..釦心衷” 0 . ' -\n\n\n（注) 2 l 樽 『J 覆 : さ 楊樟 れ 式筆 砧 に 紐 鐵る 鵡 麟四 に 環 儡 ●の る m 量 o 匹 • \" 及 ” び 釦 ＇ “ 紐融 ; 弓 r 1 ● に 覆 偏る さ 鑢 れ 頸 る ＂ 上 ゜ ● 傘 広 額 ● j K偏 o る • m •の△ 所 印 ”\" は ” ． m 績の“‘裏 及 す び ． J●裏され ・ る ・― 紐\n\n\nS歌1\n\n\n・\n\n\n『に\n\n\n鉦鍋\n\n\n汁る\n\n\nぺ緯所き\n\n\n得専\n\n\n●鯛\n\n\nn\n\n\ni傘\n\n\n⑮鎮』\n\n\n0-@\n\n\n)\n\n\n・の傘\n\n\n』..績\n\n\n.のはI、POOO\n\n\n・\n\n\n,傘\n\n\nl麟は、\n\n\n＊\n\n\n“調\n\n\n印の\n\n\nが嶋\n\n\nあ量\n\n\nるを\n\n\n・切\n\n\n合は\n\n\n鎗\n\n\n、\n\n\nてた置\n\n\n●旺\n\n\nの彙\n\n\n麟躙\n\n\nにで\n\n\n檜あ\n\n\n当る\n\n\nす\n\n\n、\n\n\nる颯瓢であり、その\n\n\nm\n\n\n、の・合氏 1呵味調の鍾●を愕り檜てた董の傘額である．\n\n\nヽ別表1-4平成30 年分の所得税等の課税処分等の経緯\n\n\n. （皐位f)lP鶴定申借 ． • 更主処分● 再査鵡＊ 再鯛査決定 ．．・書査請＊ 戴\n\n\n---—ー\n\n\nヽ ．：専曹響の年月B 令和年月8日．會和2年9月9B 令和坪11月5日 令和坪1月28B 令和 3等2月229 ．．令 和“¥1 月12B五褐位鯛 〇 ．\n\n\n＇織預得紐 ゜ ゜ 0 . ．．\n\n\n: ．．\n\n\n9 額 ..I: 捻式 . ● . に 、 傷 . る 麟菖所得響の傘 R • △ .42 ,006 000 △ . れ . 占狐 . 調 1\n\n\n“3 ・- : •.上鎮釦.わ'；町.に 配嶋所得疇の金 .0拿 一 ・、\n\n\n：\n\n\n：\n\n\n・先●融919 こ偏る綽所得螂の傘麟 ◎ - ： ．． , e801,297 .\n\n\n•. ヽ所得鰭饒の.額.の..合計額. R. 函． 083\n\n\n｀\n\n\n.. ''麗覗纏所得拿観 ・⑦ ・O • 0 .\n\n\nヽ翡品社i虹式，に心 5叩 ®• ゜ ． ゜冒縁覆得響されの遍る鎮楊:J ，練式●に鐸る配当 R .. - ＼\n\n\n．．\n\n\n.. •.\n\n\n．麟の覆紐される・先働取り 1 に絹る籟預得 ゜ー！ 0 .\n\n\n・更 ・・ 更\n\n\n．． 正． 正 ｀\n\n\n⑦に対する税額，• @・ ゜ ゜処 処分 ；． ． 分\n\n\n. . 、. c ． ． 9 r ．• ● , ． ． •. 9 Rに鯖する税額 ゜ .、. ゜ ゜ の 全 ヽ 棄 囀 ．． 全 の ・ 棄 鋒 I\n\n\n1 止 ヽ ヽ 9 C ．． ． .. —Rに贄する税額 .. ゜ .. •. ．． 綽 最 濃 ． ・ ．． ll • 饂 I\n\n\nヽ v .. ・じ • し・\n\n\n. .\n\n\nr、\n\n\n0に対する税績 .・ ・ • ⑭ ゜\n\n\n` •\n\n\n．．\n\n\n(@+0.+@.+9.) ,・. 、R ・o ゜ ＼ ．I．復(舅0糟.~印2l.\"得) ヽ ．⑯ ．． ゜ q ： ヽ ；\n\n\n． ．\n\n\n•.· ヽ\n\n\n．巖徽順覆額 ．． ＠ ． ． ’ ゜ ・ 0 . ヽ ゜ ．． ．． ．．納“付'す+0べき-税@韻) .． • ⑲ .. ．． ・o\n\n\n＊る麟年分董損で失菫のし1傘9麟<J:．楊棒式嶋1：：偏 ⑲ ヽ J ヽ ..\n\n\n，夏蠍隼に係以鼻る麟1ピ繰箪損り鑢失のされ倉麟る上副紀t ゜認」009.876 68.u6.8 鵡 • • ≫\n\n\n. .本●庚分演でに繹摯るし1鱗9失く先の創●取顧91““: ◎ ヽ・ •~． ． ．.6 ,237 80l\n\n\n...璽の年“以鼻嶋決に繰演にり贔鑢るされ賎る先叫・重•99 唱》 81.“2. 800 u．四．009 I\n\n\n..\n\n\n. .,.撫●告”算覗の額’・\n\n\n.・\n\n\n◎\n\n\n． （ )tt 2 3 1 麟の 層 吐 「 “ 畠 紐 楊 で a, さ 1 あ 釦 り れ t に 、 剛 る 倶 ． 凜 上 \" i ” る 輝 貫 i\" 鵬 和 覆 の 四 囁 傘 さ 額 る 『 れ J 鶴 得 る 四 ● 紐 ⑤ 褐 の 初 欄 嶋 の 知 に 傘 の 匹 傾 鶴 “ 証 る は u 、 卿 • r先 “ 臼 r 本 ' 鰤 ” 分 ヽ 取 釦 で 引 ｀ 聾 に ・ 覆 “ し 繹 さ ” 引 る れ く 正 即 る 浣 、 印 上 ● 彰 当 樹 履 准 試 該 19 釦 攀 の 金 呵 に 甍 頓 恥 傘 叡 暉 響 △ る 良 ） 印 配 膏 ば を 叩 9こ 、 滑 董 繹 損 嶋 し る 失 の 1 復 9 の 失 金 い ・ の 額 た 傘 頗 l 懺 額 劇 を \"“ 』 賽 及 で 〇 す あ 綱 び ． る の r 金 ． 襲 戴 覆 ． を さ ・ 差 れ ． じ 6 輝 引 ． ． ぐ ． ・\n\n\n4 取 「 引 納 に 付す 保 べき 這 税冑 房 (〇 得 +⑯ わ -@) 知臼 J疇 心 編 2I の 、 傘 lPood.1 ●ば．△ … 印 の が ” あ “ る \" ・ 綸 合 て は た 、 書 量付 の 傘 傘 の 績 額 で に あ 楕当 や る ． a額で ． あ 9、そのほか ． の ● ． 合 は、001 円末調の鐵徽を切り鎗てた贄の傘綱である．．．\n\n\n'別表2.平成25 年分及び平成26 年分の所得税等の確定申告書の記載内容等\n\n\n- - - （単位：円）\n\n\n平成2・5年分 平成26 年ダ\n\n\n↓\n\n\n． ．． 鰤告書提出年月 a: ' 令和2年3月41 日 令和2年3月41 日．．．．算所得の金額 ， ① rロ\n\n\n緯所得金額\n\n\n②．\n\n\nヽ＇\n\n\nI 蛛式嶋に孫る麟蒙所得響の金額 ③ • △印．,000;000 .\n\n\n·• 0上湯株式嶋に保る配当所得の金績\n\n\n＇先働取引1こ係る繰所得●の金麟 ⑤ △ 16 , 3 ・．認．76 3\n\n\n・\n\n\n｀\n\n\n1 所得控餘の額の合計額・ ．⑥ 函屯,:OOQ ， •380 ．函\n\n\n1,, . , ...課農緯所得金額\n\n\n⑦' °'. 。\n\n\n●農される株式攀に係る鯛衛所得9の顧 ． 竺 ゜ I 。\n\n\n・ 一\n\n\n.―t.\n\n\n• r.氣さ臼る上釦豆等に係る ．配羞\n\n\nmn“'\n\n\n. .\n\n\ne o.\n\n\n＇\n\n\n. . ．．． ． ． ． ． . .． , 璽税される先綸取引に碍る繰所得等の金額 - 0 °'.\n\n\n.疇 ・ -\n\n\n. 9 ． ． ． ．、 ， ．｀ ・ 竺~ 9 \" ' ' ・ ⑪ ．．\n\n\n｀．． ．,、 .\n\n\nヽ． -\n\n\n. ・ . ①に蜻ヤる税額 ⑫\n\n\nー. .如付する税額 ⑬\n\n\n..\n\n\n. 1,\n\n\nI ⑩に州する税麟 ⑭ ↓\n\n\n••.. ••... 、I':--・: 一\n\n\n｀唸守＄十⑭） ．． •.•. ・⑮\n\n\n.嗜守悶！税麟 •,\n\n\n⑲\n\n\n．． ニ．\n\n\n.\n\n\n- -. .•., .\n\n\nmI\n\n\n・ 蜘税額 ⑰\n\n\nヽ ，\n\n\n，，\n\n\n・\n\n\n.o\n\n\n1納付すべき税額、 ⑱ 'O ‘\n\n\nー ・（⑲が 一 ®—® ' ) - 一 • ： る 一 一本的分で差し弓<-I ..I:楊氏式響に保る麟績綱失 ⑲ ’’\n\n\n1 の金額 ．．． ？\n\n\n,| . , •湿\n\n\n裟年\n\n\n損以\n\n\n失隣\n\n\nのに\n\n\n金織\n\n\n額り\n\n\n．越さ\n\n\n．れ る上\n\n\n．場\n\n\n．株 式疇に係る麟 ⑳. 訊gJ000. 05 , 000,000瓦\n\n\n本年分で差し弓lく洗輪取引の差金嶋決済に係 ⑳ ..\n\n\nI る . 損失の金麟 . ．． . 、 ．｀．翌\n\n\n済年\n\n\nに以\n\n\n保隣\n\n\nるに\n\n\n損繰\n\n\n失り\n\n\nの鑢\n\n\n金さ\n\n\n顧れる先舶取引の差金囀決 ． ⑳ 358\n\n\n．\n\n\nJ853,5 . 367別表3 本訴における被告主張額\n\n\n（単位：円）\n\n\n平成27 年 平成2.8紗 平成29 年分 平成30 年緯得の金嘱 ゜ . 227,06 •. 1“\"6 ・3“,44 し 8\n\n\n. '\n\n\n·m.~馳 傘 ． ・② 砥た2 1位“1 ゜\n\n\n... 亀•\n\n\n．上 傘 ● ● 捻式疇1：：保ろ配当所得（響） ． の R \"J on • 1,3' 001 --\n\n\n..仕楊）棒●に傾る譲箪頁.得 鱒の ゜ ,2 1誠，231 以L.o.'” △33,”8‘ 幻＇ △ .842,42 789\n\n\n．． ．，\n\n\n．．\n\n\n・先働履!Iに儡る縫房.得彎.の 金• ゜△ ,7 7,892lJ 0 1,0762,12 3 △ 800.266,8l .&.,732 .. 801,\n\n\n所 ． の ． ~ f . tll . .' R\n\n\n,•\n\n\n000,083\n\n\n．珈\n\n\n．\n\n\n• ．． 函，l>O O 380 ．函\n\n\n.. ，麟農所傘\n\n\nヽ⑦\n\n\n゜ ゜ ゜ ゜\n\n\n． 所 麟 得 農 （ さ 螂 れ ） る の品正\n\n\n•• に儡る配当 R 卜 ゜ ゜ ・・ 9‘ I •\n\n\n．．悶お溢f心響屯 ・る肇 ◎ 1.,,388. 000 2J“3, J ゜ ゜\n\n\n..\n\n\n． 等 霞襲さ \" れる先綸敢 . 引に儡 . る緯所得 ゜ ゜ •• 2,873•四\n\n\n．．\n\n\n， ゜ ｀ o・\n\n\n⑦ピ対する事霞 ●● ⑪ ゜\n\n\n..\n\n\n°.•\n\n\n0 ｀\n\n\n゜\n\n\n．．\n\n\n. ． ． ．．． ⑧に吋る税額 ・⑫ ．． • 0 ' . ゜ 、． ． ． ．．\n\n\n． ． ` ⑤に対する税麟 ．． ◎ •四 .. 血 `201 . 057 • • ゜ ．． ゜\n\n\n. Rに ． 対する四員 ． ， ⑭ ゜.. ． ． a4 ，ゅ ．． ゜ C\n\n\n・ 基 ・（ 箪． 釦 房得 R 税 心 額 ⑭） •. ． ． •. ． ・⑮ 匹．054 3 ...,砥加 ．． ゜．． 疇．．．． •• 0.-\n\n\n.. ．．復 (@ 枷 X 9 ~ 断 : 得 l 攣 \") 額 . ・ ⑯ .5 ’ 9 13 67 ．紐6. .0 . ・o . ・.'\n\n\n．．瓢攣載 ao ・ ｀ R • ,2 砥 11-.12 01 ゜ ゜\n\n\n”納仔 F ぺき一⑰税額）• ⑱ • ．． 磁 7OO 000,786.9 ．． . :o • 0\n\n\nI. （＠．十⑳ ．． ．．\n\n\n・当 る麟 蛉 績楓 で 失 董 の 9 傘 1 • ←£ ・ ● ・・ 棒式嶋に偏 ． ⑲ ゜ ．． ..゜\n\n\n．． ．鴫雙隼四以累鱒る蒙に繰筐損り鎗失のされ金額る・上楊樟式 .- ⑳ . 0. ゜ • 809;778.33 ,85 i孤 ．箪鱒 当 ” 蛉 1 コ ：： い 鼻 、 る 弓1 損 ・く 失 知 の彙 紐 編 引の菫 • ・ • ◎ —· 7．函； ． ”゜ ． ‘ 7.6 出 lto •よ咄i:;g辻鯰芸弓 I ゜ ,77鑢，920 0 . ,81 磁．008 .. / 1.1，.四 ．漬 ．\n\n\n．．．\n\n\n..薫申告緯算税の績 ．． ゜ “°゜ l? icooi '• ｀ ヽ . •一 .\n\n\n（W l 『止湯）練式攀1こ保る麟釦mぃじ．の傘甑」④欄及び．『紐歌~Iに攘る繰預得筆の金瓢 ° 』 “ 0 m 綱の△珈、損失の金績を賽．．． ．\n\n\n• . • 2 金額 「 を 先 葺 舶 し 歌1 1 1, 3 り こ 賃 保 の る 金 鑢 攀 房 で 得 あ ● り の金 、 顧」 旧裏 0 ． さ の れる 傘 先 顧 働 は 歌 ｀ 引 「 に 当 鐸 竿 る 分 繍 で 所 甍 得 凶 ● ＜ の 先 彙 働 蠣 最 J ~, ⑩欄 の甍傘響決 、 漬 当 1； ' ； “ 停 直 る < 損 N 失 )を 0 董 金 し 綱J@IIの 99 ぃ・ ・\n\n\n. i:・ た :・ 種 r の 戴 傘 税 績 さ で れ あ が る 上 ． ●）樟式•に鍋る鵬釦mぃ！の傘・」 0•及びf●楓される先綸ll引に保る鑢所得鱒の傘額J O劃り傘韻\n\n\nヽ は、 「 t 納 ,000 付す 円 ．ぺ 末 き 鯛 衷 の 麟（ 爆 ⑩ を ＋ 切 0 り 一 檜 ⑰ て ） た J 魯 4 の )鯛 金 の 綱 傘 で 韻は ある． 、1 ． 00 円東 ． 濃 の嶋徽い切り鎗てた畿の金霞である．． ．"
}