{
  "number": "13916",
  "title": "消費税及び地方消費税更正処分等取消請求事件",
  "court": "東京地方裁判所",
  "date": "令和５年１２月２２日",
  "date_iso": "2023-12-22",
  "result": "取消",
  "topics": [
    "消費税"
  ],
  "laws": [],
  "keywords": [
    "地方消費税",
    "更正の請求",
    "更正処分",
    "決定処分",
    "消費税",
    "賦課決定",
    "過少申告加算税"
  ],
  "sections": {
    "主文": [
      "１ 原告の請求をいずれも棄却する。\n２ 訴訟費用は原告の負担とする。"
    ]
  },
  "full_text": "13916 消費税及び地方消費税更正処分等取消請求事件 - 国税庁判決事例集\n\n\n\n\n\n\n\n\n\n\n目次に戻る\n\n\n\n\n判決 13916\n\n\n消費税及び地方消費税更正処分等取消請求事件\n\n\n\n\n裁判所:\n 東京地方裁判所\n\n\n判決日:\n 令和５年１２月２２日\n\n\n結果:\n 取消\n\n\n\n\n\n\n主文\n\n\n１ 原告の請求をいずれも棄却する。\n２ 訴訟費用は原告の負担とする。\n\n\n\n\n\n\n第１ 請求\n\n\n１ 武蔵野税務署長（以下「本件税務署長」という。）が令和２年３月３０日付けで原告に対してした原告の平成２７年１１月１日から平成２８年１０月３１日までの課税期間（以下「平成２８年１０月課税期間」という。）の消費税及び地方消費税（以下、併せて「消費税等」という。）に係る更正処分（以下「本件更正処分（平成２８年１０月課税期間分）」という。）のうち、納付すべき消費税額１億２４３１万１０００円を超える部分及び納付すべき地方消費税の譲渡割額３３５６万６８００円を超える部分並びに過少申告加算税の賦課決定処分（以下「本件賦課決定処分（平成２８年１０月課税期間分）」という。）をいずれも取り消す。\n２ 本件税務署長が令和２年３月３０日付けで原告に対してした原告の平成２８年１１月１日から平成２９年１０月３１日までの課税期間（以下「平成２９年１０月課税期間」という。）の消費税等に係る更正処分（以下「本件更正処分（平成２９年１０月課税期間分）」という。）\nのうち、納付すべき消費税額２億２７９０万７４００円を超える部分及び納付すべき地方消費税の譲渡割額６１４９万９１００円を超える部分並びに過少申告加算税の賦課決定処分\n（以下「本件賦課決定処分（平成２９年１０月課税期間分）」という。）をいずれも取り消す。\n３ 本件税務署長が令和２年３月３０日付けで原告に対してした原告の平成２９年１１月１日から平成３０年１０月３１日までの課税期間（以下「平成３０年１０月課税期間」という。）の消費税等に係る更正処分（以下「本件更正処分（平成３０年１０月課税期間分）」という。また、本件更正処分（平成２８年１０月課税期間分）、本件更正処分（平成２９年１０月課税期間分）及び本件更正処分（平成３０年１０月課税期間分）を併せて「本件各更正処分」という。）のうち、納付すべき消費税額マイナス３８７４万１２２６円を超える部分及び納付すべき地方消費税の譲渡割額マイナス１０４５万２９５７円を超える部分並びに過少申告加算税の賦課決定処分（以下「本件賦課決定処分（平成３０年１０月課税期間分）」という。また、\n本件賦課決定処分（平成２８年１０月課税期間分）、本件賦課決定処分（平成２９年１０月課税期間分）及び本件賦課決定処分（平成３０年１０月課税期間分）を併せて「本件各賦課決定処分」、本件各更正処分及び本件各賦課決定処分を併せて「本件各更正処分等」という。）\nをいずれも取り消す。\n\n\n\n\n\n\n第２ 事案の概要等\n\n\n１ 事案の概要本件は、新築又は中古の収益不動産の販売業を営む原告が、平成２８年１０月課税期間から平成３０年１０月課税期間まで（以下、併せて「本件各課税期間」という。）の消費税等について、消費税法３０条１項（平成２８年法律第１５号による改正前のもの。以下同じ。）の規定の適用上、同条２項１号所定の方法（以下「個別対応方式」という。）を選択して、合計２\n３棟の新築建物（別紙２の各表の「名称」欄記載の各建物。以下「本件各新築建物」という。）\nに係る課税仕入れ（以下「本件各課税仕入れ」という。）につき、同号にいう「課税資産の譲渡等にのみ要するもの」（以下「課税対応課税仕入れ」という。）に区分すべきであるとして、\n課税仕入れに係る消費税額（以下、同条１項の規定に基づき控除される消費税額を「控除対象仕入税額」という。）を算出して各確定申告をしたところ（以下「本件各確定申告」といい、\n原告が提出した確定申告書をそれぞれの課税期間ごとに「本件確定申告書（平成２８年１０月課税期間分）」などという。）、本件税務署長が、本件各課税仕入れについては同号にいう\n「課税資産の譲渡等とその他の資産の譲渡等に共通して要するもの」（以下「共通対応課税仕入れ」という。）に区分されるべきであることなどを理由として、本件各更正処分等をしたことから、原告が、これを不服として、前記第１のとおりの取消しを求めた事案である。\n２ 主な関係法令等の規定主な関係法令等の規定は、別紙３のとおりである（なお、別紙において定義した略語については、以下においても用いることとする。）。\n３ 前提事実次の事実は、当事者間に争いのない事実又は当裁判所に顕著な事実のほか、掲記の証拠（なお、以下、書証番号は、特記しない限り、枝番の記載を省略する。）又は弁論の全趣旨によって認めることができる事実である。\n\n\n（１）原告の事業の概要等ア 原告は、平成元年２月●日に設立された株式会社であり、主として、マンションの企画・開発・販売、不動産の売買・仲介事業及び不動産の賃貸事業を行っており、その際、\n事業の一環として、新築ないし中古の収益不動産を取得するとともに、原告の関連会社であり建物管理や賃貸管理業等を営む株式会社Ｅ（以下「Ｅ社」という。）に委託して賃借人を募集し、その収益力及び投資物件としての資産価値を向上させた上で、これを個人投資家等に販売するというビジネスモデル（以下「本件ビジネスモデル」という。）を採用していた。（甲１０、乙４、５、弁論の全趣旨）\nイ（ア）原告は、平成２６年４月１日、Ｅ社との間で賃貸住宅管理業務委託契約（以下「本件業務委託契約」という。）を締結したところ、これに係る契約書（以下「本件業務委託契約書」という。）の主な内容は、別紙４のとおりであった（以下、本件業務委託契約書に規定する「管理物件」を単に「管理物件」という。）。（乙５）\n（イ）原告は、平成２６年４月１日に、Ｅ社との間で、「株式会社Ｄ所有に係る賃貸住宅の管理について」と題する文書を取り交わし、「管理物件」の追加等をした旨の通知をする際に用いる「賃貸借住宅管理業務追加委託物件通知書」及び「賃貸借住宅管理業務委託解除物件通知書」の各様式を定めた。（乙５）\nウ 原告は、本件ビジネスモデルの一環として、他の者から役務の提供（建設工事）等を受け、別紙２の「課税仕入日」記載の日（以下「本件各課税仕入日」という。）に、本件各新築建物の引渡しを受けてこれを取得し、棚卸資産として計上していた（原告が当該役務の提供を受けたことは、消費税法２条１項１２号所定の課税仕入れに該当する。）。（弁論の全趣旨）\nエ 本件各新築建物は、いずれもマンションであり、このうち、別紙２の２の表の順号４記載の「Ｆ」という建物（以下「Ｆ」といい、他の建物についても同様に呼称する。）及び別紙２の３の表の順号１０記載のＧ（以下、Ｆと併せて「本件各新築建物（仕入日非管理物件）」という。）以外の建物（以下「本件各新築建物（仕入日管理物件）」という。）については、別紙２の各表のとおり、各建物の各課税仕入日以前から「管理物件」とされており、Ｅ社において、本件業務委託契約に基づき、賃借人の募集等をしており、中には、ＨやＩなど、原告が取得するよりも前に、原告が賃借人との間で賃貸借契約を締結した物件もあった。\nもっとも、それらの物件においても、賃貸借期間の始期は原告が物件を取得した日よりも後の日とされており、本件各課税仕入日において、本件各新築建物に現に居住する賃借人はいなかった。（乙６、８～１４、弁論の全趣旨）\nオ 他方で、本件各新築建物（仕入日非管理物件）については、それに係る各課税仕入日以前には「管理物件」とされていなかったところ、これらに係る賃借人の募集等の状況は、\n次のとおりであった。（乙６、１１、１５～１９、弁論の全趣旨）\n（ア）Ｆ原告は、平成２９年３月１３日、Ｆの引渡しを受けて取得した上で（別紙２の２の表のとおり、同日が課税仕入日となる。）、同月１４日、Ｅ社との間で、これに係る賃貸借契約を締結し、当該契約に基づき、その全居室を貸し付けた。\nＥ社は、同日、賃借人（転借人）との間で、Ｆの２０１号室に係る賃貸借（転貸借）\n契約（居住用）を締結し、当該契約に基づき、これを賃貸（転貸）した。\n（イ）Ｇ原告は、平成３０年６月２０日、Ｇの引渡しを受けて取得した（別紙２の３の表のとおり、同日が課税仕入日となる。）。\n原告は、別紙２の３の表のとおり、同年７月１日付けでＧを「管理物件」とした上で、\n同月２１日、その６０４号室に係る賃貸借契約（居住用）を締結し、当該契約に基づき、\nこれを賃借人に貸し付けた。\nカ 原告は、本件各課税仕入日以降、買主への引渡日（所有権の移転日）までの間に、本件各新築建物の全棟について、居室の全部又は一部を居住の用に供する目的で賃貸し、その賃料を収受しており、これを計上する際には、その消費税の区分を「非売上」としていた。\n（乙７、弁論の全趣旨）\n\n\n（２）本件訴えの提起に至る経緯等ア 原告は、本件各課税期間の消費税等について、個別対応方式を選択した上で、本件各課税仕入れを課税対応課税仕入れに区分すべきであるとして、本件各課税仕入れに係る消費税額の全額を課税標準額に対する消費税額から控除して、別紙５の各表の「確定申告」欄のとおり、法定申告期限までに本件各確定申告をした。（甲２、乙１）\nイ 本件税務署長は、本件各課税期間の消費税等について、個別対応方式による控除対象仕入税額の計算上、本件各課税仕入れは共通対応課税仕入れに区分されるべきであることなどを理由として、令和２年３月３０日付けで、別紙５の各表の「更正処分等」欄のとおりの本件各更正処分等をした。（甲２）\nウ 原告は、別紙５の各表の「審査請求」欄のとおり、令和２年５月２６日、本件各更正処分等を不服とする審査請求をしたが、国税不服審判所長は、令和３年５月１１日付けで、\nいずれも棄却する旨の裁決をした。（甲５、７）\nエ 原告は、令和３年１１月１１日、本件訴えを提起した。\n\n\n（３）本件各更正処分等の根拠及び適法性に係る被告の主張本件各更正処分等の根拠及び適法性に係る被告の主張は、別紙６のとおりである。\n４ 争点\n\n\n（１）本件各課税仕入れの用途区分（争点１）\n\n\n（２）通則法６５条４項所定の「正当な理由」の有無（争点２）\n５ 争点に関する当事者の主張\n\n\n（１）争点１（本件各課税仕入れの用途区分）について\n（被告の主張）\n消費税法３０条２項１号所定の用途区分の判定について、課税資産の譲渡等とその他の資産の譲渡等の双方に対応する課税仕入れは、当該事業者の事業に関する事情等を問うことなく、共通対応課税仕入れに該当すると解するのが同法の趣旨に沿うものというべきであり、\n課税対応課税仕入れとは、当該事業者の事業において課税資産の譲渡等にのみ対応する課税仕入れをいい、課税資産の譲渡等のみならずその他の資産の譲渡等にも対応する課税仕入れは、全て共通対応課税仕入れに該当すると解するのが相当であるところ（最高裁令和●●年\n（○○）第●●号同５年３月６日第一小法廷判決・民集７７巻３号４４０頁（以下「最高裁令和５年判決」という。）参照）、その用途区分の判断に当たっては、事業者が建物を最終的に転売しようとしているなどの事業者の主観的な目的は考慮せず、課税仕入れ時の状況のほか、その前後の状況に関する客観的な事実関係を総合考慮した上で、客観的に判断すべきである。\n本件各課税仕入れは、原告が、新築の不動産物件を取得し、Ｅ社に委託して賃借人の募集を行い、その資産価値等を高めた上で、これらの物件を顧客に販売することにより利益を得るというビジネスモデルに基づいて本件各新築建物を取得したものである。そして、本件各新築建物は、いずれも本件各課税仕入日の時点で住宅として賃貸することが予定されており、\nまた、原告は、本件各新築建物の各居室の全部又は一部について住宅として賃貸し、賃料を収受していた。このような客観的な事実関係からすれば、本件各新築建物課税仕入れは、課税資産の譲渡等である本件各新築建物の販売のみならず、その資産の譲渡等である本件各新築建物の住宅としての賃貸にも対応するものということができる。\nしたがって、本件各課税仕入れは、その原告の事業における位置付けや原告の意図等にかかわらず、共通対応課税仕入れに該当するというべきである。\n（原告の主張）\n「課税対応課税仕入れとは、当該事業者の事業において課税資産の譲渡等にのみ対応する課税仕入れをいい、課税資産の譲渡等のみならずその他の資産の譲渡等にも対応する課税仕入れは、全て共通対応課税仕入れに該当すると解するのが相当である。」との最高裁令和５年判決の規範を当てはめたとしても、本件においては、次のとおり、課税対応課税仕入れに該当する。\nすなわち、まず、最高裁令和５年判決の事案は、購入時から全部又は一部が住宅として賃貸されていた中古物件に係るものであり、そのような賃貸の実態のない新築物件については、\nなお納税者の事業における位置付けや意図等を考慮すべきである。\n原告の営む事業は、飽くまでも新築物件を購入し、それを顧客である個人投資家に部屋\n（戸）単位で販売するという販売業であって、不動産賃貸業ではない。そして、新築物件については、取得時に賃借人は存在しておらず、原告による保有期間中は資産価値及び収益力を向上させるためのバリューアップの一環として、Ｅ社による賃借人の募集が行われているにすぎないし、原告が投資家（顧客）に物件を販売する際には、原則として、Ｅ社が投資家から４年間借り上げた上でＥ社が賃借人に貸付けをするというマスターリース及びサブリースの方式がとられており、投資家にとって、収益不動産の購入後の賃料収入が一定期間保証されることから、収益不動産の取得時までに賃借人が存在することを要求する動機付けは強くない。したがって、賃借人が存在しない状態で顧客が収益不動産を購入することも十分にあり得ることであり、実際にも、本件各新築建物の部屋の一部については賃借人が存在しない状態で販売されており、その場合には、結局原告は賃料収入を得ていない。\nこのような原告の事業の実態に照らせば、最高裁令和５年判決を前提としても、本件各課税仕入れは、「事業者の事業において課税資産の譲渡等にのみ対応する課税仕入れ」として、\n課税対応課税仕入れに該当する。\n\n\n（２）争点２（通則法６５条４項所定の「正当な理由」の有無）について\n（原告の主張）\nア 「正当な理由」が認められる場合通則法６５条４項にいう「正当な理由」が認められる場合とは、真に納税者の責めに帰することのできない客観的な事情があり、過少申告加算税の趣旨に照らしてもなお納税者に過少申告加算税を賦課することが不当又は酷になる場合をいうものと解される。\nイ 用途区分に係る税務当局の解釈等事業者の経済活動に関する個別の事情に即して仕入れの目的に基づいて用途区分の判定を行うべきであり、収益の発生が客観的に見込まれていることをもって用途区分の判定をすべきではないという国税庁の解釈は、消費税法成立当時に一般に周知されていた。\nそして、平成６年に作成された全国国税局消費税課長・統括国税調査官会議資料「消費税審理事務当面の問題について」と題する国税庁内部の正式な資料（甲５９。以下「平成\n６年文書」という。）及び平成９年に作成された東京国税局の質疑事項回答整理表（甲６\n０。以下「平成９年文書」という。）からも明らかなとおり、平成９年の時点において、\n本件各課税仕入れ類似の課税仕入れは課税対応課税仕入れに用途区分すべき旨が課税庁の執行上の公式の解釈として採用されていた（以下、当該解釈を「平成９年見解」という。）。\n平成９年見解は、事実上、原告を含む不動産業界の納税者の間において周知共有され、納税者の税務処理に当たって依拠される高度の蓋然性を有するものであるところ、課税庁は、\n本件各課税期間に係る消費税の法定申告期限までに、平成９年見解を変更したことについて、法令改正や通達の改正はおろか、質疑応答事例の公表等の課税庁として考え得る対応を一切行わなかった。課税庁は、租税法規の解釈上微妙な点を含む問題について、従来の解釈を改め、課税上の取扱いを変更したにもかかわらず、変更後の取扱いが国民の間に定着するような必要な措置を講じていなかったことによって生じた「新解釈の未定着状態」\nがあったとみるべきであり、従来の解釈・取扱いに従って本件各課税仕入れを課税対応課税仕入れに用途区分して本件各確定申告を行った原告の判断について、納税者の主観的な事情に基づく単なる法令解釈の誤りにすぎないということはできない。\nしたがって、本件各更正処分により納付すべきこととなった税額の全額について、「正当な理由」があるというべきである。\nウ 税務調査での回答等原告は、平成２７年４月２日から同月２２日にかけて原告に対して実施された消費税の税務調査（以下「平成２７年税務調査」という。）において、税務調査の担当者との間で具体的に新築物件に関する消費税の取扱いについて問答を行い、これに従ってその後も新築物件に係る仕入れにつき、課税対応課税仕入れとして税務処理を行ってきた。\nすなわち、平成２７年税務調査において、税務調査の担当者が、中古物件については、\n購入時に賃借人が存在するか否かで用途区分を判断し、存在する場合には共通対応課税仕入れに、存在しない場合には課税対応課税仕入れに該当すると発言したことを受け、原告の従業員が、同担当者に対し、建物購入時は空室で購入の翌日に賃借人が付いた場合は課税対応課税仕入れでよいのかを尋ねたところ、同担当者は、これを肯定し、また、同従業員が「そういうことであれば、新築はそもそも引渡しを受ける際に賃借人は当然存在していないので、今のままの課税対応課税仕入れという処理でよいのでしょうか。」と質問したところ、同担当者は、これを肯定した上、新築は共通対応課税仕入れの対象外となる旨を回答した。原告は、同担当者から明確な見解が示されたことに依拠して、引き続きその後の課税期間についても、新築物件の仕入れに関しては課税対応課税仕入れに区分して税務処理をしてきたものの、その後、突如としてこの点が覆され、本件各更正処分等を受けるに至ったものである。\nこのように、原告は、税務当局より示された見解に即して税務処理を行ってきたにもかかわらず、それが突如として覆されたのであるから、この点からも、「真に納税者の責めに帰することのできない客観的な事情があり、過少申告加算税の趣旨に照らしてもなお納税者に過少申告加算税を賦課することが不当又は酷になる場合」に該当し、通則法６５条\n４項にいう「正当な理由」があるというべきである。\n（被告の主張）\nア 「正当な理由」の有無の判断枠組み納税者が法令解釈を誤り、その結果過少申告となった場合に「正当な理由」があると認められるのは、納税者が申告において依拠した法令解釈について、相応の論拠が客観的に存在し、真に納税者の責めに帰することのできない客観的事情が認められ、過少申告加算税の趣旨に照らしてもなお納税者に過少申告加算税を賦課することが不当又は酷になると評価し得る場合に限られるというべきである。\nそして、課税庁が納税者に対して法令解釈に係る見解を示す場合、当該見解について、\n課税庁が統一的に用いるものとして一般に広く周知されて初めて、それに対する法的安定性と予測可能性が生じ、納税者の信頼の保護が要請されることからすれば、上記の納税者の依拠した法令解釈に相応の論拠が客観的に存在するといえるためには、少なくとも、当該確定申告以前に、課税庁において当該問題に係る課税庁の公権的解釈ないし課税上の取扱いが統一的に採用されていたことを示す通達や課税庁監修の公刊物が存在するなどしてその公権的解釈ないし課税上の取扱いが一般の納税者に明らかにされていたことが必要であり、その上で、当該解釈に関連する裁判例の状況等の諸要素を総合的に考慮し、「正当な理由」の有無を判断するのが相当というべきである。\nイ 用途区分に係る税務当局の解釈等原告が本件各確定申告において依拠した法令解釈（原告がいかなる法解釈に基づき本件各確定申告を行ったのかは不明であるが、原告は、本件訴訟において、当初、個別対応方式における用途区分の判定は、事業者がどのような収益（資産の譲渡等）に係る費用（コスト）として課税仕入れを行ったのかという事業者が行う事業の収益・費用の構造等に即して行うべきであるとの判断基準（訴状・４０頁）に基づき、本件各課税仕入れが課税対応課税仕入れに該当する旨を主張していた。）については、課税庁において統一的に採用されていたことを示す通達や課税庁監修の公刊物が存在していない。\nまた、原告が指摘する平成６年文書は、課税仕入れの日に住宅の賃貸の用に供される客観的見込みがない分譲用の物件の課税仕入れに関する個別対応方式における用途区分について、課税対応課税仕入れに該当するものとして取り扱って差し支えないとしたものと考えられるのであって、原告が主張する前記の判断基準の根拠になるものとはいえない。そして、平成９年文書は、東京国税局が更正の請求事案の処理を担当する部署からの質疑に対する回答を示したものであり、その性質上、当該部署が具体的な事案を処理するために、\n同局がその個別具体の事情を前提としてその見解を示したものにすぎない。その意味で、\n平成９年文書は、飽くまでも東京国税局が取り扱った個別事案に対する事例判断であり、\nそれも同局内での使用を念頭に置いた内部資料にとどまるものであって、個別対応方式の用途区分の判定に関する解釈を一般的に示したものとみることはできない。\n加えて、原告が依拠した前記判断基準は、平成６年文書の記載内容及び平成９年文書における回答要旨と必ずしも一致せず、原告が平成６年文書及び平成９年文書に依拠して本件各確定申告をしたものでないことは明らかである。\nしかも、本件各確定申告の当時において、原告が依拠する判断基準の論拠となり得る裁判例は全く存在しない一方、これに反して、本件各課税仕入れのような課税仕入れ一般に類する態様の課税仕入れを共通対応課税仕入れに区分すべきものとした課税処分について、\nこれを是認する判断を示した公表裁決や裁判例が存在していた上、課税庁が監修した公刊物ではないものの、課税庁の上記解釈に沿う記述をした複数の公刊物が存在しており、このような事実からすると、遅くとも平成１７年以降、課税庁が本件各課税仕入れ又はこれに類する態様の課税仕入れが共通対応課税仕入れに該当するとの統一的取扱いをしていたことは明らかである。\nウ 「正当な理由」はないこと以上のとおり、原告が本件各確定申告において依拠した用途区分の判断基準に相応の論拠が客観的に存在したとはいえず、本件各確定申告の申告額が過少であったことは、個別対応方式における用途区分の判定に関する一般的な解釈とは異なる解釈（判断基準）に基づく単なる法令解釈の誤りによるものにすぎないから、本件は、通則法６５条４項に定める「正当な理由があると認められる」場合に当たらない。\nまた、原告の主張によれば、平成２７年税務調査の前より、新築の建物に係る課税仕入れを課税対応課税仕入れに区分して税務処理をしていたことが明らかであるから、平成２\n７年税務調査の担当者がしたとされる説明の有無にかかわらず、原告は、本件各課税仕入れを課税対応課税仕入れに区分していたものと認められる。したがって、仮に、前記説明があったとしても、国税当局による税務調査時の説明の過誤による不利益を原告に被らせたという事情は存在しないから、本件において「正当な理由」は認められない。\n\n\n\n\n\n\n第３ 当裁判所の判断\n\n\n１ 争点１（本件各課税仕入れの用途区分）について\n\n\n（１）消費税法は、生産、流通等の各段階で二重、三重に税が課されて税負担が累積することを防止し、経済に対する中立性を確保するため、課税期間中に行った課税仕入れに係る消費税額を当該課税期間の課税標準額に対する消費税額から控除するものとしている（消費税法３\n０条１項１号）。もっとも、同法は、所定の場合において当該課税期間中に行った課税仕入れにつき用途区分が明らかにされていないときは、課税仕入れに係る消費税額に、課税売上割合、すなわち、課税期間中の所定の売上げの総額に占める課税資産の譲渡等に係る売上げの割合を乗じて計算する方法により控除対象仕入税額を計算するものとし（同条２項２号）、\nまた、帳簿及び請求書等の保存がない場合には原則として当該課税仕入れに係る消費税額の控除を認めないものとする（同条７項）など、課税の明確性の確保や適正な徴税の実現といった他の目的との調和を図るため、税負担の累積が生じても課税仕入れに係る消費税額の全部又は一部が控除されない場合があることを予定しているものということができる。\nそして、個別対応方式により控除対象仕入税額を計算する場合において、税負担の累積が生ずる課税資産の譲渡等と累積が生じないその他の資産の譲渡等の双方に対応する課税仕入れにつき一律に課税売上割合を用いることは、課税の明確性の確保の観点から一般に合理的といえるのであり、課税売上割合を用いることが当該事業者の事業の状況に照らして合理的といえない場合には、課税売上割合に準ずる割合を適切に用いることにより個別に是正を図ることが予定されていると解されることにも鑑みれば、課税資産の譲渡等とその他の資産の譲渡等の双方に対応する課税仕入れは、当該事業に関する事情等を問うことなく、共通対応課税仕入れに該当すると解するのが消費税法の趣旨に沿うものというべきである。このように解することは、課税仕入れを課税資産の譲渡等「にのみ」要するもの（課税対応課税仕入れ）、その他の資産の譲渡等「にのみ」要するもの（非課税対応課税仕入れ）及び両者「に共通して」要するもの（共通対応課税仕入れ）に区分する同法３０条２項１号の文理に照らしても自然であるということができる。\nそうすると、課税対応課税仕入れとは、当該事業者の事業において課税資産の譲渡等にのみ対応する課税仕入れをいい、課税資産の譲渡等のみならずその他の資産の譲渡等にも対応する課税仕入れは、全て共通対応課税仕入れに該当すると解するのが相当である（最高裁令和５年判決参照）。\n\n\n（２）これを本件についてみると、確かに、本件各課税仕入日において、本件各新築建物に現に居住する賃借人はいなかったものの（前提事実\n\n\n（１）エ）、Ｅ社に委託して賃借人を募集し、\nその収益力及び投資物件としての資産価値を向上させた上で個人投資家等に販売するという本件ビジネスモデルの一環として、本件各新築建物（仕入日管理物件）については、その各課税仕入日以前から「管理物件」とされてＥ社による賃借人の募集が行われており、中には課税仕入日よりも前に原告が賃借人との間で賃貸借契約を締結した物件もあったし（前提事実\n\n\n（１）エ）、本件各新築建物（仕入日非管理物件）であるＦ及びＧについても、課税仕入日の翌日ないし１１日後にＥ社の「管理物件」とされ、課税仕入日の翌日ないし約１か月後には賃貸借契約が締結されているのであるから（前提事実\n\n\n（１）オ）、本件各新築建物は、\nいずれも、客観的にみて、本件各課税仕入日の時点において、住宅として賃貸されることが予定されていたと認められる。しかも、原告は、本件各課税仕入日以降、買主への引渡日までの間、本件各新築建物の全棟について、居室の全部又は一部を居住の用に供する目的で賃貸し、その賃料を収受していたものである（前提事実\n\n\n（１）カ）。そうすると、本件各課税仕入れは、原告の事業において、「課税資産の譲渡等」である本件各新築建物の販売のみならず、「その他の資産の譲渡等」である本件各新築建物の住宅としての貸付けにも対応するものであるということができる。\nよって、原告が本件各新築建物を購入したのはこれらを販売するためであり、本件各新築建物の収益力及び投資物件としての資産価値を向上させるために賃借人を募集しているにすぎないといった、原告の事業における位置付けや原告の意図等にかかわらず、本件各課税仕入れは、共通対応課税仕入れに該当するものと認められる。\n\n\n（３）これに対し、原告は、前記第２の５\n\n\n（１）のとおり、最高裁令和５年判決の事案は、購入時から全部又は一部が住宅として賃貸されていた中古物件に係るものであり、そのような賃貸の実態のない新築物件については、なお納税者の事業における位置付けや意図等を考慮すべきであるとした上で、原告の営む事業は、飽くまでも新築物件を購入し、それを顧客である個人投資家に部屋（戸）単位で販売するという販売業であることや、新築物件については、\n取得時に賃借人は存在しておらず、原告による保有期間中は資産価値及び収益力を向上させるためのバリューアップの一環としてＥ社による賃借人の募集が行われているにすぎず、実際にも、本件各新築建物の部屋の一部については賃借人が存在しない状態で販売されており、\nその場合には、結局原告は賃料収入を得ていないといった原告の事業の実態に照らせば、本件各課税仕入れは、「事業者の事業において課税資産の譲渡等にのみ対応する課税仕入れ」\nとして、課税対応課税仕入れに該当するなどと主張する。\nしかしながら、前記\n\n\n（２）で認定、説示したとおり、本件各新築建物は、本件各課税仕入日において、現に居住する賃借人はいなかったものの、客観的にみて、住宅として賃貸されることが予定されており、実際、原告は、本件各課税仕入日以降、買主への引渡日までの間、\n本件各新築建物の全棟について、居室の全部又は一部を居住の用に供する目的で賃貸し、その賃料を収受していたのであるから、課税仕入れの時点でみても、課税期間の終了時点でみても、本件各課税仕入れが「その他の資産の譲渡等」である本件各新築建物の住宅としての貸付けにも対応するものであると認められるのであって、これが「課税資産の譲渡等にのみ対応する課税仕入れ」に当たらないことは明らかである。\n\n\n（４）原告は、このほか種々の主張をするが、前記\n\n\n（２）及び\n\n\n（３）で認定、説示したところに照らし、採用することができない。\n２ 争点２（通則法６５条４項所定の「正当な理由」の有無）について\n\n\n（１）過少申告加算税は、過少申告による納税義務違反の事実があれば、原則としてその違反者に対し課されるものであり、これによって、当初から適法に申告し納税した納税者との間の客観的不公平の実質的な是正を図るとともに、過少申告による納税義務違反の発生を防止し、\n適正な申告納税の実現を図り、もって納税の実を挙げようとする行政上の措置である。このような過少申告加算税の趣旨に照らすと、通則法６５条４項にいう「正当な理由があると認められる」場合とは、真に納税者の責めに帰することのできない客観的な事情があり、当初から適法に申告し納税した納税者との間の客観的不公平の実質的な是正を図るとともに過少申告による納税義務違反の発生を防止して適正な申告納税の実現を図るという過少申告加算税の趣旨に照らしても、なお、納税者に過少申告加算税を賦課することが不当又は酷になる場合をいうものと解するのが相当である（最高裁平成●●年（○○）第●●号同１８年４月\n２０日第一小法廷判決・民集６０巻４号１６１１頁、最高裁平成●●年（○○）第●●号、\n同第●●号同１８年４月２５日第三小法廷判決・民集６０巻４号１７２８頁参照）。\n\n\n（２）これを本件についてみると、証拠（甲３８、乙３５から４１）及び弁論の全趣旨によれば、\n平成１７年以降、本件各確定申告がされるまでの間、税務当局の元職員らが執筆した公刊物において、事業者の最終的な目的は（中古）マンションの転売であっても、転売までの間に非課税売上げである家賃が発生する場合には、当該マンションの購入は共通対応課税仕入れに該当する旨の見解が示され、また、本件各確定申告当時に公表されていた複数の国税不服審判所の裁決例及び下級審の裁判例において、中古マンションの事例のみならず、本件各課税仕入れと同様、新築建物の取得の事例においても、その用途区分につき、上記と同様の見解に基づく税務当局側の主張が採用されていたこと（甲３８、乙３５の２、乙３６）が認められる。\nこのような事実関係等によれば、税務当局は、遅くとも平成１７年以降、本件各課税仕入れと同様の課税仕入れを、当該建物が住宅として賃貸されること（その他の資産の譲渡等に対応すること）に着目して共通対応課税仕入れに区分すべきであるとの見解を採っており、\nそのことは、本件各確定申告当時、税務当局の職員が執筆した公刊物や、公表されている国税不服審判所の裁決例及び下級審の裁判例を通じて、一般の納税者も知り得たものということができる。\n他方、原告が指摘する平成６年文書には、仮に一時的に賃貸用に供されるとしても、継続して棚卸資産として処理し、将来的には全て分譲することとしている住宅の購入については、\n課税対応課税仕入れに該当するものとして取り扱って差し支えないとの記載があるが、これは、マンション市況の状況等から、買い取った分譲用マンションの分譲の完了までに数年\n（最長７年程度）を見込んでおり、それまでの間はこの分譲用マンションの一部を一時期賃貸することとしたという事案に関するものであり、課税仕入れの時点では課税資産の譲渡等にのみ要するものに該当することが明らかであることから、課税対応課税仕入れに該当するとされたものであって（甲５９）、前記１\n\n\n（２）のとおり課税仕入れの時点から住宅として賃貸されることが予定されていた本件とは事案が大きく異なるものといわざるを得ない。むしろ、平成６年文書の上記見解は、分譲用マンションのような販売用の住宅を取得した後に、\n資金繰りその他の事情によりこれを一時的に賃貸した場合には、課税対応課税仕入れに該当するとされている（乙３９）のと同様、課税仕入れを行った日の状況により課税仕入れの用途区分を判定するという課税実務（消費税法基本通達１１－２－２０（乙２））からの帰結を説明したにすぎないと考えられる。また、平成９年文書からは、税務当局は、平成９年頃、\n関係機関からの照会に対し、賃借人が居住している状態でマンションを購入した場合でも、\n転売目的で購入したことが明らかであれば、課税対応課税仕入れに該当する旨の回答をしたことがうかがわれるものの、このことから、直ちに、税務当局が一般的に当該課税仕入れを事業者の目的に着目して課税対応課税仕入れに区分する取扱いをしていたものということはできないし、平成９年文書が公表されるなどしたとの事情もうかがわれない。\nそうすると、平成１７年以降、税務当局が、本件各課税仕入れと同様の課税仕入れを当該建物が住宅として賃貸されることに着目して共通対応課税仕入れに区分する取扱いを周知するなどの積極的な措置を講じていないとしても、事業者としては、上記取扱いがされる可能性を認識してしかるべきであったということができる。\nそして、上記取扱いは消費税法３０条２項１号の文理等に照らして自然であるといえ、本件各確定申告当時、本件各課税仕入れと同様の課税仕入れを事業者の目的に着目して課税対応課税仕入れに区分すべきものとした裁判例等があったともうかがわれないこと等をも考慮すれば、原告が本件各確定申告において本件各課税仕入れを課税対応課税仕入れに区分して控除対象仕入税額の計算をしたことにつき、真に納税者の責めに帰することのできない客観的な事情があり、過少申告加算税の趣旨に照らしてもなお納税者に過少申告加算税を賦課することが不当又は酷になるということはできない。\n\n\n（３）原告は、前記第２の５\n\n\n（２）（原告の主張）イ記載のとおり、平成６年文書や平成９年文書等を基に、本件各課税仕入れを課税対応課税仕入れに用途区分して本件各確定申告を行った原告の判断を納税者の主観的な事情に基づく単なる法令解釈の誤りにすぎないということはできないなどと主張するが、前記\n\n\n（２）の認定、説示から明らかなとおり、この主張には理由がない。\n\n\n（４）また、原告は、前記第２の５\n\n\n（２）（原告の主張）ウ記載のとおり、平成２７年税務調査において、税務調査の担当者は新築建物に係る仕入れについて課税対応課税仕入れとして区分することを原告に対して是認したものであり、原告はこれに依拠して本件各課税仕入れについても同様に区分したなどとして、前記「正当な理由」が認められる旨主張する。\nしかしながら、本件記録を精査しても、平成２７年税務調査において、税務調査の担当者が原告の主張する発言を行ったことを認定するに足りる的確な証拠はないし、仮に、税務調査の担当者がそのような発言を行ったとしても、これをもって、税務当局がその公権的な解釈ないし課税上の統一的な取扱いを公表していたとはいえない。以上に加え、前記\n\n\n（２）のとおり、税務当局は、遅くとも平成１７年以降、本件各課税仕入れと同様の課税仕入れを、\n当該建物が住宅として賃貸されることに着目して共通対応課税仕入れに区分すべきであるとの見解を採っており、そのことは、本件各確定申告当時、税務当局の職員が執筆した公刊物や公表されている国税不服審判所の裁決例及び下級審の裁判例を通じて一般の納税者も知り得たこと、原告は、平成２７年税務調査よりも前から、本件と同種の事案について課税対応課税仕入れに該当するものとして確定申告を行ってきたこと（弁論の全趣旨）を併せ考えると、平成２７年税務調査の際に原告の主張するやり取りがあったとしても、本件において、\n「真に納税者の責めに帰することのできない客観的な事情があり、過少申告加算税の趣旨に照らしてもなお納税者に過少申告加算税を賦課することが不当又は酷になる場合」に該当するとまではいえない。\n原告の上記主張も、理由がない。\n\n\n（５）以上によれば、本件において、通則法６５条４項所定の「正当な理由」があるとは認められない。\n３ 本件各更正処分等の適法性\n\n\n（１）本件各更正処分について以上の検討の結果を前提として、原告の本件各課税期間の納付すべき消費税額及び地方消費税の譲渡割額を計算すると、別紙６「本件各更正処分等の根拠及び適法性（被告の主張）」\nのとおりとなり（消費税額について別紙６の１\n\n\n（１）アからウまでの各（エ）「差引税額」\n欄、地方消費税の譲渡割額について同各（ク）「納付すべき譲渡割額」欄）、本件各更正処分における納付すべき消費税額（別紙５の各表の各「更正処分等」欄の「納付すべき消費税額」\n欄）及び地方消費税の譲渡割額（別紙５の各表の各「更正処分等」欄の「納付すべき地方消費税額」欄）とそれぞれ同額であるから、本件各更正処分は、いずれも適法である。\n\n\n（２）本件各賦課決定処分について上記\n\n\n（１）のとおり、本件各更正処分はいずれも適法であるところ、前記２のとおり、原告が本件各更正処分により新たに納付すべき税額の計算の基礎となった事実につき、本件各更正処分前における税額の計算の基礎とされていなかったことについて、通則法６５条４項に規定する「正当な理由」があるとは認められない。\n以上を前提として、本件各更正処分に伴って原告に課されるべき過少申告加算税の額を計算すると、別紙６「本件各更正処分等の根拠及び適法性（被告の主張）」の２\n\n\n（１）のとおりとなり、本件各賦課決定処分における過少申告加算税の額（別紙５の各表の各「更正処分等」欄の「過少申告加算税の額」欄）とそれぞれ同額であるから、本件各賦課決定処分は、\nいずれも適法である。\n\n\n（３）したがって、本件各更正処分等は、いずれも適法である。\n\n\n\n\n\n\n第４ 結論よって\n\n\n、原告の請求は、いずれも理由がないから、これらを棄却することとして、主文のとおり判決する。\n東京地方裁判所民事第３部裁判長裁判官 篠田 賢治裁判官 渡邉 哲裁判官 鈴木 真耶\n．．．\n．．．．． ．\n. .,...-.-・.\n．．\n．．\n．..．.. ．\n \n．．．\n.•\n＼\n【別紙 1 ]代理人等目録\nー 原告訴訟代理人弁護士大石篤史、東陽介\n2 原告訴訟復代理人弁護士 ・山川佳子\n3' 原告補佐人税埋士・\n・丸山木綿子\n4 被告指定代理人印南真吾、青木雄弥、田中暁人、高橋正朗、竹本寛、加藤栞 ・\n13\n\n....\n.\n ．.,．\n•\n.\n．•．\n..\n•\n.\n••\n~.、\n．．．\n．．．\n． ．．．\n'\n【別紙3 】主な関係法令等の規定\nー 消費税法の規定\n)1( 消費税法6 条1項（ただし、平成2 8 年法律第 1 5 号による改正前のもの。．以下同じ。）は、国内において行われる資産の譲渡等のうち、同法別表第 1 に掲げるものには、消費税を課さない旨を規定している。\nそして、同法別表第 1 は、その 1 3 号（ただし、令和 2年法律\n\n\n\n\n\n\n第8 号による改正前のもの\n\n\n。以下同じ。）において、 「住宅（人の居住の用に供する家屋又は家屋のうち人の居住の用に供する部分をいう。）・の貸付け（当該貸付けに係る契約において人の居住の用に供することが明らかにされているものに限るものとし、一時的に使用させる場合その他の政令で定める場合を除く。）」を掲げている。\n)2( ア 消費税法30 条1項は、事業者が、国内において行う課税仕入れについては、当該課税仕入れを行った日の属する課税期間の消費税法45 条 1項（平成 28 年法律第 1 5 号による改正前のもの。以下同じ。） 2 号に掲げる課税標準額に対する消費税額から、当該課税期間中に国内において行った課税仕入れに係る消費税額を控除する旨を規定している。\nイ 消費税法30 条2 項は、同条 1 項の場合において、同項に規定する課税期間における課税売上高が 5 億円を超えるとき、又は当該課税期間における課税売上割合が 1 0 0 分の 9 5 に満たないときは、同項の規定により控除する課税仕入れに係る消費税額等の合計額は、同項の規定にかかわらず、次の各号に掲げる場合の区分に応じ当該各号に定め・る方法により計算した金額とす\n・る旨を規定している。\nそして、消費税法 30 条2 項 1 号は、 「当該課税期間中に国内において行った課税仕入れ（中略）．につき、課税資産の譲渡等にのみ要するもの、課税 ・資産の譲渡等以外の資産の譲渡等（以下この号において「その他の資産の譲\n ．．．\n \n．．\n. .．．.\n．．．\n．．．\n...渡等」 という。．）にのみ要するもの及び課税資産の譲渡等とその他の資産の譲渡等に共通して要するものにその区分が明らかにされている場合」には、\n同号イに掲げる金額に同号口に掲げる金額を加算する方法（個別対応方式）\nとするとした上で、①同号イ•において、 「課税資産の譲渡等にのみ要する課税仕入れ」 （課税対応課税仕入れ）に係る消費税額等の合計額を掲げ、②同号口において、•' 「課税資産の譲渡等とその他の資産の譲渡等に共通して要する課税仕入れ」 （共通対応課税仕入れ）に係る消費税額等の合計額に課税売上割合を乗じて計算した金額（以下「共通仕入控除税額」という。）を掲げている。\n• 01 また、消費税法30 条2 項2 号は、同項 1 号に掲げる場合以外の場合については、当該課税期間における課税仕入れに係る消費税額等の合計額に課税\n・売上割合を乗じて計算する方法とする旨を規定している。\nウ 消費税法3 0条 3項は、個別対応方式による場合において、共通仕入控除税額の計算の基礎となる課税売上割合に準ずる割合（当該割合が当該事業者・の営む事業の種類の異なるごと又は当該事業に係る販売費、一般管理費その他の費用の種類の異なるごとに区分して算出したものである場合には：当該区分して算出しtこそれぞれの割合）で次に掲げる要件の全てに該当するものがあるときは、当該事業者の同項2 号に規定する承認を受けた日の属する課税期間以後の課税期間については、同条 2 項1 号の規定にかかわらず、共通\n、仕入控除税額は、当該課税売上割合に代えて、当該割合を用いて計算した金額とするとした上で（以下、当該割合を「課税売上割合に準ずる割合」という。）、①同条 3 項 1 号において、 「当該割合が当該事業者の営む事業の種類又は当該事業に係る販売費、一般管理費その他の費用の種類に応じ合理的に算定されるものであること」を掲げ、②同項 2 号において、 「当該割合を用いて前項第 1 号口に掲げる金額を計算することにつき、その納税地を所轄\n25 ・する税務署長の承認を受けたものであること」を掲げている。\n ．．．\n..•••.••\n． ．\n．．\n．．\n． ． ．\n．． ．\n2 国税通則法（以下「通則法」という。）の規定\n)1( 通則法6 5 条（ただし、平成28 年 1 0 月課税期間については、同年法律第1 5号による改正前のもの。平成 2 9 年 1 0 月課税期間及び平成 3 0 年 1\n0 月課税期間については、令和 2 年法律\n\n\n\n\n\n\n第8 号による改正前のもの\n\n\n・。以下同じ。） 1 項は、期限内申告書が提出された場合において、修正申告書の提出又は更正があったときは、当該納税者に対し、その修正．申告又は更正に基づき納付すべき税額に 1 0 0 分の 1 0 の割合を乗ヽじて計算した金額に相当する過少申告加算税を課する旨規定している。\n\n\n)2( 通則法 6 5 条2 項は、同条 1 項の規定に該当する場合において、同項に規定する納付すぺき税額がその国税に係る期限内申告税額に相当する金額と 5\n\n\nJO\n\n\n0 万円とのいずれか多・い金額を超えるときは、同項の過少申告加算税の額は、\n\n\n同項の規定にかかわらず同項の規定により計算した金額に、当該超える部分に相当する税額に 1 0 0 分の 5 の割合を乗じて計算した金額を加算した金額とする旨規定している。 ． ．\n\n\n)3( 通則法6 5 条4 項 (1 号に係る部分に限る。ただし、平成 2 8 年 1 0 月課\n\n\n・ .. 税期間については同年法律第 1 5 号による改正前の同項 c 以下、同改正の前後を通じて「通則法6 5 条4 項」という。）は、同条 1 項又は2 項に規定する納付すべき税額の計算の基礎となった事実のうちにその修正申告又は更正前の税額（還付金の額に相当する税額を含む。）の計算の基礎とされていなかったことについて正当な理由があると認められるものがある場合には、これらの項に規定する納付すべき税額からその正当な理由があると認められる事実に基づぐ税額として政令で定めるところにより計算した金額を控除して、\n\n\nこれらの項の規定を適用する旨を規定している。，\n\n\n．．．\n\n\n．．．．．．\n\n\n..．．.\n\n\n••• •．•．••\n\n\n．．．\n\n\n...\n\n\n•••\n\n\n【別紙5 】・本件処分に係る経緯等\n\n\n1 平成28 年 1 0 月課税期間について\n\n\n..\n\n\n（．単 位：円）\n\n\n区分 礁定申告 更正処分等， 審査請求 裁決年 月 日 法定申告期限内 令和2年3月30 日 令和2年5月26 日 令和3年5月1.1 日\n\n\n．．課 税 標 準 額 000,503,646,9 ,646,9 - 000,503\n\n\n・,控除対象仕入税額 483 ',417 ,902 472,338,623納付すぺき消費税額 000,113,421 280,895.~00 全部取消し 棄却納付すべき地方消費税額 665,33 ,800 007,018,67\n\n\nJ\n\n\n．．\n\n\n、\n\n\n過少申告加算税の．額 929,12 500 . .\n\n\n2 平成29 年 1 0 月課税期間について厚：円i\n\n\n..区分 確定申告 更正処分等 審査請求 裁決年 月 日 法定申告期限内 令和2年3月03 日 令和2年5月26 日 令和3年5月］1日課 税 標 準 額 ,8．函．000,833 , 000,83 3,498,8控除対象仕入税額 332.~22,647 ,602 598,827納付すぺき消費税額 722 , 004,709 106,353 , 002 全部取消し 棄却納付すべき地方消費税額 001,994,16 614,59 , 005過少申告加算税の額 169,51 , 000\n\n\n.\n\n\n．．．． ．．．\n\n\n． ．\n\n\n．．．．\n\n\n． .\n\n\n． ．．\n\n\n．．\n\n\n● '．\n\n\n．\n\n\n．\n\n\n.．\n\n\n．．\n\n\n．\n\n\n．\n\n\n．\n\n\n3 ・平成30 年1 0 月課税期間について心；円）\n\n\n区分 確定申告 更正処分等 審査請求 裁決年 月 日 法定申告期限内 令和2年3月30 日 令和2年5月3162 令和3年5月11 日課 税 標 準 額 000,300,922,9 ,9 000,300,_922\n\n\nヽ控除対象仕入税額 ．． 890,871,026 083 ; 866,395\n\n\n｀納付すぺき消費税額 △ 622,147,83 002,348,002 全部取消し 棄却納付すべき地方消費税額 △J0, 759,254 008,691,45過少申告加算税の額 005,906,54\n\n\n（注）．「納付すべき消費税額J及び「納付すべき地方消費税額J欄の「△J印は、還付金額を示す。\n\n\n．．．\n\n\n．．．．．．．\n\n\n．．\n\n\n．．\n\n\n．．\n\n\n．．\n\n\n．．．\n\n\n．．、\n\n\n【別紙6 】本件各更正処分等の根拠及び適法性（被告の主張）\n\n\n1 本件各更正処分の根拠及び適法性\n\n\n)1( 本件各更正処分の根拠 ・\n\n\ns 被告力.口•本訴において主張する原告の本件各課税期間に係る消費税等の各課税標準額及び納付すべき消費税等の額は、それぞれ次に述べるとおりである。\n\n\nア 本件更正処分（平成2 8 年 1 月課税期間分）の根拠\n\n\nc\n\n\n('i)課税標準額（別紙 7 の 1 の表の① 欄） 9 6 億46 30 万5000 円上記金額は、本件確定申告書（平成 28 年 1 0 月課税期間分） （乙 1 の\n\n\n2) の①「課税標準額J欄に記載された金額と同額である。 ・\n\n\nPI •\n\n\n（イ）課税標準額に対する消費税額 （別紙7 の1 の表の②C 欄の金額）\n\n\n6 億0 7 7 :2 万8 9 4 5 円上記金額は、次のaの金額とbの金額との合計額であり、本件確定申告書\n\n\n（平成 28 年 1 0 月課税期間分） （乙 1 の2) の②「消費税額」欄に記載された金額と同額である。 ．\n\n\n51 •\n\n\na 課税標準額に対する消費税額・税率4 ％適用分（別紙•7 の 1 の表の②\n\n\nA 欄の金額） △ 2 万0400 円 ・上記金額は、・平成26 年3 月3 1 日以前の課税資産の譲渡等について、\n\n\n号消費税法29 条（平成24 年法律第68 3 条による改正前のもの。以下、 同じ。•)の規定に基づき、前記mの金額のうち、平成 24 年法律第\n\n\n・6 8 号附則 5 条の経過措置の適用を受ける課税資産の譲渡等に係る課税標準額△ 5 1 万円（別紙7 の1 の表の①A 欄の金額）に税率 1 0 0分の\n\n\n4 を乗じて算出した金額であり、本件確定申告書（平成 28 年 1 0 月課税期間分） （乙 1 の2) の付表1 の②「消費税額（税率4 ％適用分B) 」\n\n\n欄に記載された金額と同額である（なお、課税標準額に対する消費税額\n\n\n, 52の△は、売上げに係る対価の返還等の額に係る消費税額のことを意味す\n\n\n．．．\n\n\n.•• •••\n\n\n•.•\n\n\n．．．\n\n\n'．..．. ．\n\n\n~． ．．\n\n\n、 ••. .・る。．以下同じ。）。\n\n\n.6\n\n\n・ b 課税標準額に対する消費税額・税率 3 ％適用分（別紙7 の1 の表の②B 欄の金額） 6億 0774 万•9 3.4 5 円上記金額は、消費税法2 9 条の規定に基づき、•前記げ）の金額の．うち、\n\n\n前記a の金額を除いた課税資産の譲渡等に係る課税標準額 9 6 億468\n\n\n1 万5 0 0.0 円（別紙 7 の1 の表の①B 欄）に税率 1 0 0 分の 6. 3 を乗\n\n\n．じて算出した金額であり、本件確定申告書（平成28 年 1 0 月課税期間分） （乙 1 の2) の付表 1 の②「消費税額（税率 6. ・3 ％適用分C) 」\n\n\n欄に記載された金額と同額である。\n\n\n（ウ） 控除対象仕入税額（別紙7 の1 の表の④C 欄、別紙8 の1 の表の⑮C 欄）\n\n\n3億2 6 8 3 万3274 円上記金額は、次のa の金額と b の金額との合計額であり、消費税法 3 .0条1 項により、当該課税仕入れを行った日の属する課税期間の課税標準額に対する消費税額から控除する、課税仕入れに係る消費税額の合計額（控除対象仕入税額）である。・なお、控除対象仕入税額の計算に当たっては、本件各課税期間における課税売上割合がいずれも 1 0 0 分の 9 5 に満たないことから（後記c 、イ\n\n\n（ヴc 及びウ（ウ｝c) 、原告が本件各課税期間を通じて選択した個別対応方式\n\n\n（原告が提出した確定申告書に添付された各付表2 ー（)2 （乙 1 の2 、1 の\n\n\n3 、.1 の4) 参照）により計算する（後記イ及びウの「（ウ）控除対象仕入税額」\n\n\nにおいて同じ。）。 ．控除対象仕入税額・税率4 バーセント適用分（別紙 7 の 1 の表④A\n\n\na欄・別紙8 の1 の表⑮A 欄）・ 6 6 万0754 円上記金額は、次の)a( の金額に、 )b( の金額に c の割合を乗じて計算した金額を加算した金額であり、平成24 年法律第6 8 号附則 条7項の経過措置の適用を受ける消費税法30 条1項所定の課税仕入れに係る消\n\n\n．．．\n\n\n...\n\n\n•，•．••．• •｀•\n\n\n．．．\n\n\n••\n\n\n．．．\n\n\n·•・・\n\n\nヽ費税額の控除に関する金額である。\n\n\n)a( 課税対応課税仕入れの税額（別紙8 の1 の表⑧A 欄} 1 万5 6 0' 0 円上記金額は、次のiの金額からiiの金額を減算した金額である。\n\n\n申告による課税対応課税仕入れの税額（別紙8 の1 の表R A 欄）\n\n\n1 0 3 万9 6 0 0 円上記金額は、本件確定申告書・平成2 8 年 1 0 月課税期間分）に添付された付表2-(2) の⑯「⑭の・うち、課税売上げにのみ要するもの（税率4 ％適用分B) 」欄（乙 1 の2) に記載された金額と同額である。\n\n\nii .・前記iの課税対応課税仕入れの税額から減算すべき金~（別紙8の1 の表⑩A 欄） ・ 1 ・0 _2 万4 ・0 .0 0 円上記金額は、前記iの金額に含まれる本件各課税仕入れに係る消\n\n\n、費税額（本件各更正処分等に係る通知書、（甲 2 。これらを併せて、\n\n\n以下「本件各更正処分等通知書」といい、各通知書については、本件各更正処分の対象とされた課税期間に合わせ、 ＇「平成 2 8 年1 0月課税期間更正処分等通知書」などと表記する。また、そのうち、\n\n\n各更正の理由 1)1( の各表（ただし、本件更正処分（平成3 0 年1 01月課税期間分）等通知書においては、更正の理由 1)1( の［〈表\n\n\n1〉」）（各表を併せて、以下「本件各更正処分対象物件表」といい、\n\n\n特定の課税期間に係る表を指す場合比課税期間に合わせて・「平成\n\n\n• 20\n\n\n28 年 1 0 月課税期間更正処分対象物件表」などという。）のうち平成 28 年 1 0 月課税期間更正処分対象物件表中、 「5 ％合計」襴 ．のうち「本体価格（税込金額）」欄の金額 2 6 8 8 万円（甲 2 の1 .\n\n\n7 枚目）に 1 0 5 分の4 を乗じて算出した金額）であり、本件各課税仕入れが、課税対応課税仕入れには区分されず、共通対応課税仕入\n\n\n．れに区分されることから、前記iの課税対応課税仕入れの税額から\n\n\n．．．\n\n\n•．•．• ••\n\n\n． •．．•．••．• ••\n\n\n．．．\n\n\n．．．\n\n\n．．．減算すべき金額である。\n\n\n(b) 共通対応課税仕入れの税額（・別紙8 の1 の表⑪A 欄）\n\n\n1 1 6 万6944 円上記金額は、次のiの金額にiiの金額を加算した金額である。\n\n\ni 申告による共通対応課税仕入・れの税額（別紙8 の1 の表⑫A 欄）\n\n\n4\n\n\n1 4 万2 9 4 円上記金額ほ、本件確定申告書（平成 28 年 1 0 月課税期間分）に添付された付)2(表.:....2 の⑰「⑭のうち、課税売上げと非課税売上げに共通して要するもの（税率4 ％適用分B) 」欄（乙 1 の2) に記載された金額と同額である。\n\n\nIO\n\n\nii 共通対応課税仕入れの税額に加算すべき金額（別紙 8 の 1 の表⑬\n\n\nヽ\n\n\nA 欄） . 1 O 2万 4000 円..上記金額は、前記)a( iiの本件各課税仕入れに係る消費税額であり、本件各課税仕入れが、共通対応課税仕入れに区分されることから、共通対応課税仕入れの税額に加算すべき金額である。\n\n\nb 控除対象仕入税額・税率 6. 3 パーセント適用分（別紙7 の 1の表④\n\n\nI\n\n\nB 欄・別紙8 の の表⑮B欄） 3億 2 6 1 7 万2520 円上記金額は、次の)a( の金額に、 )b( の金額に c の割合を乗じて計算じた金額を加算しfこ金額であり、平成 26 年4 月1 日以後令和元年 月3\n\n\n0 日以前の課税仕入れについての消費税法 30 条 1 項所定の課税仕入れに係る消費税額の控除に関する金額である。\n\n\n)a( 課税対応課税仕入れの税額（別紙8 の1 の表⑧B 欄）\n\n\n5 8 8 0 万1 7 3 9 円上記金額は、次のiの金額からiiの金額を減算した金額である。\n\n\ni 申告による課税対応課税仕入れの税額（別紙8 の の表⑨B 欄）\n\n\n4 億 0 7 9 6 万 8 0 7 5 円\n\n\n、...\n\n\n.・・. ・・\n\n\n．．\n\n\n．••．••．• ••\n\n\n．．．\n\n\n．•．•．\n\n\n．．．上記金額は、本件確定申告書（平成2 8 年 1 0 月課税期間分）に添付された付表 2-(2) の⑯「⑭のうち、課税売上げにのみ要するもの（税率6. 3 ％適用分C) 」欄（乙 1 の2) に記載された金額と同額である。\n\n\n\"11 前記i,の課税対応課税仕入れの税額から減算すべき金額（別紙 8の1 の表⑩B 欄） ・ 3 億4.91 6 万6 3.3 6 円上記金額は、前記iの金額に含まれる本件各課税仕入れに係る消費税額（平成・28 年 1 0 月課税期間更正処分対象物件表中、 「8%合計」欄のうち．「本体価格（税込金額）」欄の金額 5 9 億 8570 万\n\n\n8 6 1 9 円（甲 2 の1. 7 枚目）に 0 8 分の．6 . 3 を乗じて算出し\n\n\nJOた金額）であり、本件各課税仕入れが、課税対応課税仕入れには区分されず、共通対応課税仕入れに区分されることから、前記iの課税対応課税仕入れの税額から減算すべき金額である。\n\n\n，\n\n\n• (b) 共通対応課税仕入れの税額（別紙 8 の 1 の表⑪B欄）•\n\n\n4 万\n\n\n• 億 83 6 1 5 ・2 0 2 円上記金額は、次のiの金額にiiの金額を加算した金額である。\n\n\n申告による共通対応課税仕入れの税額（別紙8 の1 の表⑫B 欄）\n\n\n. 1億3444 万8 8 6 6 円上記金額は、本件確定申告書（平成 2 8 年、1 0 月課税期間分）に添付された付表)22(-:- の⑰「⑭のうち、課税売上げと非課税売上げに共通して要するもの（税率6 . 3 ％適用分C) 」'欄（乙 1 の2) に記載された金額と同額である。 ．の表⑬\n\n\nii 共通対応課税仕入れの税額に加算すべき金額（別祇8 の1\n\n\nB 欄） 3 億 4 9 1 6 万6336 円上記金額は、前記)a( iiの本件各課税仕入れに係る消費税額であり、本件各課税仕入れが、共通対応課税仕入れに区分されることか\n\n\n．．．．．\n\n\n... •.••. .•.\n\n\n．．\n\n\n．．\n\n\n．．．\n\n\n．.．、．・\n\n\n．．．ら、共通対応課税仕入れの税額に加算すべき金額である。\n\n\nc 課税売上割合（別紙8 の1の表⑤ c 欄） ・\n\n\n5 5.' ぞ8 5 8 5 1 2 6 1 （以下略）パーセント\n\n\n・上記割合は、次の（a）の金額のうちに)b( の金額の占める割合である。 •\n\n\n)a( 資産の譲渡等の対価の額の合計額（別紙8 の1 の表④C 欄）\n\n\n1・7 4億 4 8 0・5 万2478 円上記金額は、本件確定申告書（平成・2_8 年 1 0 月課税期間分）に添付された付表 2-(2)の⑦「資産の譲渡等の対価の額•（⑤．十⑥）」欄（乙 . .\n\n\n1 の2) に記載された金額と同額である。\n\n\n)b( 課税資産の譲渡等の対価の額の合計額（別紙8 の 1 の表①C 欄）．\n\n\n6\n\n\n9 6億 4 30 万4341 円上記金額は、・本件確定申告書（平成28 年 1 0 月課税期間分）に添付された付表2-(2) の④「課税資産の譲渡等の対価の額（①＋②十③）」\n\n\n欄（乙 1 の2) に記載された金額と同額である。 ・\n\n\ncに）差引税額（別紙7 の1 の表⑩ 欄） ・ 2 億8 0 8 9 万5600 円上記金額は、次の a の金額と b の金額、との合計額（ただし、・通則法 1II\n\n\n9 条 1 項の規定に基づき 1 0 0 円未満の端数金額を切り捨てた後の金額。\n\n\n後記イ及びウの「に）差引税額」において同じ。）である。\n\n\na 控除不足還付税額・税率4 バーセント適用分（別紙7 の1 の表⑧A 欄の金額を△で表記したもの） △6 8 万1 1 5 4 円上記金額は、前記（イ）a の金額から前記（ウ）a の金額を減算した金額であ．る。\n\n\nb 差引税額・税率.96 3 バーセント適用分（別紙7 の 1 ・の表⑨B 欄）．\n\n\n2億.8 15 7 万6 8 2 5 円上記金額は、前記（イ）b の金額から前記（ウ）b の金額を減算した金額である。．\n\n\n．．．\n\n\n．．● ．●．\n\n\n．．\n\n\n．．．\n\n\n••. -.、\n\n\n＇団既に納付の確定した本税額（別紙 7 の1 の表⑪c欄）\n\n\n' 1 億 2 4 31 万 1000 円上記金額は、本件確定申告書（平成28 年 1 0 月課税期間分）の⑨「差\n\n\n．引税額（②十③一⑦）」欄（乙 1 の2) ！こ記載された金額と同額である。\n\n\nc切）差引納付すべき消費税額（別紙 7 の 1 の表⑫ 欄）\n\n\n1 億 5658 万4600 円上記金額は、前記因の金額から前記団の金額を差し引いた金額である。\n\n\n囲合計差引地方消費税の課税標準額（別紙7 の1 の表⑮c欄）\n\n\n2 億 8089 万5 .6 0.o 円上記金額は、次の a の金額と b の金額との合計額（ただし、通則法 1 1\n\n\n9条 1項の規定に基づき 1・00 円未滴の端数金額を切り捨てた後の金額。\n\n\n後記イ及びウの「（培合計差引地方消費税の課税標準額」において同じ。）\n\n\nであり、地方税法 7 2 条の 82 の規定に基づく地方消費税の課税標準額である。\n\n\na ．譲渡割額の還付額の基礎となる消費税の控除不足還付税額・税率4パーセント適用分（別紙7 の1 の表⑬A 欄の金額を△で表記したもの）\n\n\n△6 8 万1 1 5 4 円上記金額は、前記~)a の金額と同額である。・\n\n\nb 地方消費税の課税標準額・税率6. 3 パーセント適用分（別紙7 の\n\n\n1 の表⑭B 欄） 2 億 5 7 万6825 円\n\n\n・ 上記金額は、前記に）b の金額と同額である。\n\n\n（ク）納付すべき譲渡割額（別紙7 の 1 の表⑱c 欄） 7 5 8 1 万0 7 0 0 円上記金額は、次の a の金額と b の金額との合計額（ただし、地方税法 2\n\n\n0条の 4 の2\n\n\n\n\n\n\n第3 項の規定に基づき\n\n\n1 0 0 円未満の端数金額を切り捨てた後の金額。後記イ及びウの「(ti)納付すべき譲渡割額」において同じ。） である。\n•••\n•．•． •••\n...・・・・・\n．．．\n．・ー．・．\n••．．．•\na 還付すべき譲渡割額・・税率4 バーセント適用分（別紙7 の1 の表⑯A欄の金額を△で表記したもの） ・ △1 7 万0288 円上記金額は、地方税法 72 条の 8 3 （平成 24 年法律第6 9 号1条による改正前のもの。）の規定に基づき、前記待）a の金額に税率 1 0 0 分の2 5 を乗じて算出した金額である。\nb 納付すべき譲渡割額・税率6. 3 パーセント適用分（別紙7 の1 の表\n⑰B 欄） ・・ ・ 7 9 8 万 1 0 4 8 円上記金額は、地方税法 7 2 条の8.3 （平成 4 年法律\n\n\n\n\n\n\n第69 号\n\n\n2 条に\nbよる改正前のもの。）の規定に基づき、前記囲 の金額に税率6 3 分の\n1 7 を乗じて算出した金額である。\n拐既に納付の確定した譲渡割額（別紙7 の1 の表⑲ c 欄）\n3 3 5 6 万．6800 円上記金額は、本件確定申告書（平成28 年 10 月課税期間分）の⑳「；納税額」欄に記載された金額と同額である。・\n1 c\n（コ）差引納付すべき譲渡割額（別紙7 の の表⑳ 欄） 4224 万3900 円上記金額は、前記（ク）の金額から前記仇の金額を差し引いた金額である。•の\nC捌差引納付ずべき消費税等の合計額（別紙 7 1 の表⑳ 欄）\n1億 9882 万8 5 0 0 円上記金額は、前記渕の金額と前記（コ）の金額との合計額であり、原告が本件更正処分（平成28 年 1 0 月課税期間分）によ、り新たに納付すべき消費\n20 .税等の額である。\nイ 本件更正処分（平成2.9 年 1 0 月課税期間分）の根拠\nc\n(7)課税標準額（別紙 7 の2 の表① 欄） 8 8 億 9 4 3 3 万80 0 0 円上記金額は、原告の本件確定申告書（平成2 9 年 1 0 月課税期間分）の\n25 ①「課税標準額」欄（乙 1 の 3) に記載された金額と同額である~ .\nc\n（イ）課税標準額に対する消費税額（別紙7 の2 の表② 欄）\n \n \n．．．．．．．\n．．\n．．．\n．．．\n．．．\n•• \n5億6033 万0138 円\na上記金額は、次の の金額と b の金額との合計額であり、本件確定申告書（平成 9 年 1 0 月課税期間分）の②「消費税額」欄（乙 1の 3) に記載された金額と同額である。\n5 a課税標準額に対する消費税額・・税率4バーセント適用分（月l紙j 7 の2の表②A 欄） • ． 2 万2880 円上記金額は、平成26 年 3 月3 1.日以前の課税資産の譲渡等について、＇\nm\nr ．消費税法 29 条の規定に基づき、前記 の金額のうち、平成24 年法律\n\n\n\n\n\n\n第68 号附則\n\n\n5条の経過措置の適用を受ける課税資産の譲渡等に係る課税標準額 5 7 万2000 円（別紙7 の2の表①A 欄）に税率 100 分の4を乗じて算出した金額であり、本件確定申告書（平成2 9年1 0 月課税 ・期間分）に添付された付表 1 の②「消費税額（税率4 ％適用分B) 」欄'.\n（乙 1 の3) に記載された金額と同額である。\nb 課税標準額に対する消費税額・税率.6. .・3 パーセント適用分（別紙7の2 の表②B 欄） 億6030 万7258 円\nm上記金額は、消費税法2 9 条の規定に基づき、前記 の金額のうち前記aの金額を除いた課税資産の譲渡等に係る課税標準額8 8 億9376\no・o万6000 円（別紙7 の2 の表①B 欄）に税率 1 分の 6. 3 を乗じて算出した金額であり 、本件確定申告書（平成2 9年 1 0 月課税期間分）\n．に添付された付表 1 の②「消費税額（税率 6. 3 ％適用分C) 」欄（乙 1の3) に記載された金額と同額である。\nc c\n（ヴ 控除対象仕入税額（別紙7 の2 の表④ 欄・別紙8 の2 の表⑮ 欄）\n2 億0 6 7 2 万8 8 9 5 円上記金額は、次の a の金額と b の金額との合計額であり、消費税法30条1 項により、当該課税仕入れを行った日の属する課税期間の課税標準額 ．に対する消費税額から控除する、課税仕入れに係る消費税額の合計額であ\n．．．\n ,. .\n•．•． •••\n．．．\n....\n．．．\n••．． ．る。\na 控除対象仕入税額・ 税率 4 パーセント適用分（別紙7 の 2 の表④Aの\n欄・別紙8 2 の表⑮A 欄） 3 方7764 円上記金額はへ本件確定申告書（平成29 年i 0 月課税期間分）に添付\n.された付表 2 )2(- の⑰「⑭のうち、課税売上げと非課税売上げに共通して要するもの（税率4 ％適用分B) 」欄（乙 1 の3) に記載された金額7 万\n・24: 3 2 円に の割合を乗じて計算した金額であり、平成24 年法律第\nC\n6 8 号附則 5 条7 項の経過措置の適用を受ける消費税法3 0 条 1項所定の課税仕入れに係る消費税額の控除に関する金額である。\nb 控除対象仕入税額・税率6.. 3 パーセント適用分（別紙 7 の2 の表④\nB 欄・別紙8 の2 の表⑮B 欄） ． ． •'2億 0669万 1 1 3 1 円上記金額は、次の（a）の金額に●、 )b( の金額に c の割合を乗じて計算した金額を加算した金額であり、平成26 年4 月 1 日以後令和元年 9 月3\n0 日以前の課税仕入れについての消費税法3 0 条1 項所定の課税仕入れに係る消費税額の控除に関する金額である。\n)a( 課税対応課税仕入れの税額（別紙8 の2 の表⑧B 欄）\n7 3 6 万1 9.8 4 円上記金額は、次のiの金額からiiの・金額を減算した金額である。\ni 申告による課税対応課税仕入れの税額（別紙8 の2 の表⑨B 欄）\n2億6 ~ 9 8 万1 6 、6 9 円上記金額は、本件確定申告書（平成29 年 1 0 月課税期間分）\nに添付された付表 2 -(2) の⑯「⑭のうち、・課税売上げにのみ要す\n)Cるもの（税率6. 3 ％適用分 」欄（乙1 の3) に記載された金額と同額である。 •\nii 前記i・の課税対応課税仕入れの税額から減算すべき金額（別紙\nS2\n8 の2 の表⑩B 欄） _2 億6,2 6 1 万9685 円\n•••\n．．•．•． •••\n•••••••\n．．．\n....\n••．．．•上記金額は、前記iの金額に含まれる本件各課税仕入れに係る消費税額（平成 2 9 年 1 0 月課税期間更正処分対象物件表中、\n億\n「合計」欄のうち・「本体価格（税込金額）」欄の金額45 0 _2 0\n5 万 1 7 4 6 円（甲 2 の2 • 6 枚目）に、i O 8 分の 6 . 3 を乗じて算出した金額）であり、本件各課税仕入れが、課税対応課税仕入れには区分されず、共通対応課税仕入れに区分されることから、\n前記iの課税対応課税仕入れの税額から減算すべき金額である。\n)b( 共通対応課税仕入れの税額（別紙8 の2 の表⑪B 欄）\n3 億 8230 万7.11 2 円上記金額は、次のiの金額にiiの金額を加算した金額である。\ni 申告による共通対応課税仕入れの税額（別紙8 の2 の表⑫B 欄）\n1億 1 9 6 8 万7427 円上記金額は、本件確定申告書（平成2 9 年 1 0 月課税期間分）に添付されtこ付表 2-(2) の⑰「⑭のうち、課税売上げと非課税売上げに共通して要するもの（税率6. 3 ％適用分C) 」欄（乙 1 の3) に記載された金額と同額である。\nの\nii 共通対応課税仕入れの税額に加算すべき金額（別紙8 2 の表⑬\nB 欄） 2 億 62 6 1万9 68 5 円上記金額は、前記)a( iiの本件各課税仕入れに係る消費税額であり、本件各課税仕入れが、共通対応課税仕入れに区分されることか．ら、共通対応課税仕入れの税額に加算すべき金額である。\nc\nc 課税売上割合（別紙8 の2 の表⑤ 欄）\n~ 2. 1_3 8 4 8 7 8 8 2 （以下略）パーセント ．．上記割合は、次の)a( の金額のうちに)b( の金額の占める割合である。\n)a( 資産の譲渡等の対価の額の合計額（別紙8 の2 の表④C 欄）\n0 5\n•1 7 億 6 0 8 2万 0.9 8 円\n \n \n...\n．•.•．•.•．.• •.•\n．．．\n．．．\n．．．上記金額は、本件確定申告書（平成 2 9 年 1 0 月課税期間分）に添付された付表 2-(2) の⑦「資産の譲渡等の対価の額（⑤十⑥）」欄（乙\n1 の3) に記載された金額と同額である。\nc\n)b( 課税資産の譲渡等の対価の額の合計額（別紙 ．の 2 の表① 欄）．\n8 8億 9 5 2 5 万4 0 8 2:円\n2上記金額は、本件確定申告書（平成 9 年 1 0 月課税期間分）に添付された付表2-(2) の④「課税資産の譲渡等の対価の額（①＋②十③）」\n欄（乙 1 の3) に記載された金額と同額である。 ，に） 差引税額（別紙7 の2 の表⑩c欄） 3 億 5 3 6 0 万 ・1200 円\n｀ 上記金額は、次の a の金額と b の金額との合計額である。\nJO控除不足還付税額・税率4 パーセント適用分（別紙7 の2 の表⑧A 欄\naの金額を△で表記したもの） • ． △1万4884 円上記金額は、前記（イ）a の金額から前記（ウ）a の金額を減算じた金額である。\nb 差引税額・税率6. 3 パーセント適用分（別紙7 の2 の表⑨B 欄） ・\n3億 5 3 6 1 万6 1 2 7 円上記金額は、前記（イ）b の金額から前記（ウ）b の金額を減算した金額である。\n，団 c既に納付の確定した本税額（別紙7 の2 の表⑪ 欄）\n2 億 2 7 9 0 万 7.4 0 円上記金額は、本件確定申告書（平成2 9 年 1 0 月課税期間分）．の⑨「差引税額（②＋③一⑦）J欄（乙 1 の3) に記載された金額と同額である。\n切） 差引納付すべき消費税額（別紙7の2 の表⑫c欄） ．\n1億2 5 6 9 万3800 円・上記金額は、前記に）の金額から前記切の金額を差し引いた金額である。\n件） 合計差引地方消費税の課税標準額（別紙7 の2 の表⑮ c 欄）\n．．．\n．\n．．．．． ． ．．．．．．\n．． ．．． ． ． ． ． ． ．． ． ． ．. ．• ． • ． • ． ••\n．．．． ．．．\n． ． . ． ． ． ．．．\n．\n．\n.\n.・ 3 億 5 3 6 0 万1 .2 00 円 ・上記金額は、次の a の金額と bの金額との合計額であり、地~ 2条の，8 2 の規定に基づく地方消費税の課税標準額である。\na .譲渡割額の還付額の基礎となる消費税の控除不足還付税額・税率4 パ\nーセント適用分（別紙7 の2 の表⑬A 欄の金額を△で表記したもの）・\nF\n△ 1 万4・8 8 4 円上記金額は、．前記に）a の金額と同額である。\nb 地方消費税の課税標準額・税率 6 . 3 パーセント適用分（別紙 の2\n．の表⑭B 欄） • 億 5 3 6 1 万 6 1 2 7 円上記金額は、前記に）bの金額と同額である。\n（ク） 納付ずべき譲渡割額（別紙7 の2 の表⑱C 欄） 9 5 4 1万6 5 0 0 円上記金額は、次の a の金額と b の金額との合計額である•O還付すべき譲渡割額 ・税率4 パーセント適用分（別紙7 の2 の表⑯A\na欄の金額を△で表記したもの） △3 7 2 1 円\n，上記金額は、地方税法 7 2 条の 8 3 （平成 24 年法律第6 9 号 1条による改正前のもの）の規定に基づき、前記件）a の金額に税率 1 0 0 分の\n2 5 を乗じて算出した金額である。\nb 納付すべき譲渡割額・税率6. 3 パーセント適用分（別紙7 の 2 の表円\n⑰B 欄） ・ 9542 万0224上記金額は、地方税法 7 2条の 8 3 （平成 24 年法律第 6 9 号 2 条による改正前のもの）の規定に基づき、前記囲b の金額に税率 6 3 分の 1\n.• 7 を乗じて算出した金額である。\n例既に納付の確定した譲渡割額（別紙7 の2 の表⑲C 欄）\n6 1 4 9 万9 1 0 0 円上記金額は、本件確定申告書 （平成 29 年1 0 月課税期間分）の⑳「納税額」欄（乙 1 の3) 9に記載された金額と同額である。\n．．．．．\n．．．．．．．\n．．\n．．\n..\n．．．\n．．．\n．．．\nc\n(:::r)差引納付すべき譲渡割額（別紙 7 の2 の表⑳ 欄） 3 3 9,1 万 7400 円上記金額は、前記り）の金額から前記例の金額を差し引いた金額である。・捌差引納付すべき消費税等の合計額（別紙7 の2 の表⑪ c 欄）\n億5961 万 1200 円上記金額は、前記切）の金額と前記（コ）の金額との合計額であり、原告が本・件更正処分（平成29 年 1 0・月課税期間分）により新たに納付すべき消費税等の額である。\nウ 本件更正処分（平成30 年 1 0 月課税期間分）の根拠\nm課税標準額（別紙 7 の3 の表① c 欄） 92 億2900 万3000 円上記金額は、 ・の本件確定申告書 （平成30 年 1 0月課税期間分）の\n①「課税標準額」欄（乙 1 の•4) に記載された金額と同額である。・\n（イ）課税標準額に対する消費税額（別紙7 の3 の表②C 欄）\n5 億8 1 4 万6872 円上記金額は、次の a の金額と b の金額との合計額であり 、本件確定申告．．書（平成3 0 年 1 0 月課税期間分）の②「消費税額」欄（乙 の4) に記載\nJSされた金額と同額である。 ・の\na 課税標準額に対する消費税額・税率4 パーセント適用分（別紙7 3の表②A 欄） ・ • . • △ 1 万6840 円上記金額は、平成26 年 3 月3 1 日以前の課税資産の譲渡等について、\nm消費税法 29 条の規定に基づき、前記 の金額のうち、平成24 年法律第6 8 号附則 5 条の経過措置の適用を受ける課税資産の譲渡等に係る課\noo税標準額△42 万1000 円（月り紙7 の3 の表①A 欄）に税率i 分の\n4 を乗じて算出した金額であり、本件確定申告書 ．（平成3.0 年 1 0 月課税期間分）に添付された付表 1 の②「消費税額（税率4 ％適用分B) 」欄\n（乙 1 の4) に記載された金額と同額である。\n..6\nb 課税標準額に対する消費税額・税率 3 パーセント適用分（別紙 7\n... ~ •\n•．•．• ••\n．．\n．．．\n．．．\n．．．\n．．．の 3 の表②B 欄） 5億8 1 4 5 万3 7 1 2 円\nm上記金額は、消費税法2 9 条の規定に基づき、前記 の金甜Uのうち前記a の金額を除いた課税資産の譲渡等に係る課税標準額9 2億：2942万 4000 円（別紙7 の3 の表①B 欄）に税率 1 0 0 分の6. ・3 を乗じて\n．算出した金額であり、本件確定申告書（平成30 年 1 0 月課税期間分）\nに添付された付表 1 の②「消費税額（税率6. 3 ％適用分C) 」欄（乙 1の4) に記載された金額と同額である。 '\nc\n（ヴ 控除対象仕入税額（別紙7 の3 の表④ 欄・別紙8 の3 の表⑮C 欄）\n3億 8 0・5 9 万3 6 6 8 円上記金額は、次の a の金額と．b の金額との合計額であり、’消費税法3 0条1項により、当該課税仕入れを行った日の属する課税期間の課税標準額に対する消費税額から控除する、課税仕入れに係る消費税額の合計額である。\na控除対象仕入税額・税率4 パーセント適用分（別紙7 の3 の表④A欄・別紙8 の3 の表⑮A 欄） 3 万4 7 8 5 円上記金額は、• 本件確定申告書（平成 3 0 年 1 0 月課税期間分）に添付された付表2-(2)の⑰「⑭のうち、課税売上げと非課税売上げに共通して要するもの（税率 4 ％適用分B) 」欄（乙1 の4) に記載された金額6 万\n6 3 6 0 円に c の割合を乗じて計算した金額であり、平成24 年法律第\n6 8 号附則5 条7 項の経過措置の適用を受ける消費税法3 0条 1項所定 ・の課税仕入れに係る消費税額の控除に関する金額である。\nb 控除対象仕入税額・税率6 . 3 バーセント適用分（別紙7 の3 の表④\nB 欄・別紙8 の3 の表⑮B 欄） • ’3 億8 0 5 5 万8883 円上記金額は、次の)a( の金額に、 )b( の金額にc の割合を乗じて計算し\n． た金額を加算した金額であり、平成2 6 年4 月1 日以後令和元年 月3\n0 日以前の課税仕入れについての消費税法3 0 条 1項所定の課税仕入れ\n...．．.． .\n;\n．．\n•． ．•． ．••．• ••\n．．．\n．．．\n.. ・ •に係る消費税額の控除に関する金額である。・\n)a( 課税対応課税仕入れの税額（別紙8 の3 の表⑧B 欄）\n1 6 8 7 万3 8 1 5 円上記金額は、次のiの金額からiiの金額を減算した金額である。\ni 申告による課税対応課税仕入れの税額（別紙8 の3 の表⑨B 欄）\n. 5億3 2 6 1 万1・2 1 7 円上記金額は、本件確定申告書（平成3 0 年 1 0 月課税期間分）に添付された付表2-( )・2 の⑯「⑭のうち、課税売上げにのみ要するも\n'の（税率6. 3 ％適用分C) 」欄（乙 1 の4) に記載された金額と同額である。\nii 前記i・の課税対応課税仕入れの税額から減算すべき金額（別紙 8の3 の表⑩B 欄） • 5億 1 5 7 4 万 3 4.0 2 円上記金額は、前記iの金額に含まれる本件各課税仕入れに係る消 ，費税額（平成 30 年 1・0 月課税期間更正処分対象物件表中、 「③上記①のうも、 「課税売上げにのみ要するもの」とされた額」欄のうち「消費税等の額」欄の金額（甲 2 の3 • 1 1 枚目））であり、本件各課税仕入れが、課税対応課税仕入れには区分されず、共通対応課税仕入れに区分されることから、前記iの課税対応課税仕入れの税額から減算すべき金額である。\n)b( 共通対応課税仕入れの税額（別紙8 の3 の表⑪B 欄）\n6 億9 3 7 9 万0 4 -2 2 円上記・金額は、次のi．の金額にiiの金額を加算した金額である。\n申告による共通対応課税仕入れの税額（別紙8 の3 の表⑫B 欄）\n1億 6 6 9 7 万0746 円上記金額は、本件確定申告書（平成 30 年 1 0 月課税期間分）に添付された付表2 -(2) の⑰「⑭のうち、課税売上げと非課税売上げ\n．．,．.．.．.\n．．\n．．\n．••．••．• ••\n．．．\n．．．\n...に共通して要するもの（税率6. 3 ％適用分・)C 」欄（乙 1 の4) に記\n'載された金額と同額である。\nii 共通対応課税仕入れの税額に加算すべき金額（別紙 の 3 の表⑬\nB 欄） 5 億 6 8 1 万 9 6 .7 6 円上記金額は、前記(a)~ の本件各課税仕入れ（平成 30 年 1 0 月課税期間に係る消費税等の確定申告において課税対応課税仕入れに区分されていたもの）に係る消費税額 5億1 57 4 万3 .4 0 2 円と、\n本件各課税仕入れのうち当該確定申告において非課税対応課税仕入・れに区分されていたものに係る消費税額 1 1 0 7 万6 7 4 円（平成 3 0 年 1 0 月課税期間更正処分対象物件表中、 「②上記①のうち、\n「課税資産の譲渡等以外の資産の譲渡等にのみ要するもの」とされた額」欄のうち「消費税等の額」欄の金額（甲 2 の3 • 1 1枚目））\nとの合計額であり、本件各課税仕入れが、共通対応課税仕入れに区分されることから、共通対応課税仕入れの税額に加算すべき金額である。\nc\nc 課税売上割合（別紙8 の3 の表⑤ 欄）\n_i\n5 2 ~ 4 2 0 0 8 6 7 8 （以下略）パーセント上記割合は、次の (a)の金額のうちに(b)の金額の占める割合である。 •\n)a( 資産の譲渡等の対価の額の合計額（別紙8 の3 の表④C 欄）．、\n1 7 6 億0680 万9827 円上記金額は、本件確定申告書（平成 3 0 年 1 0 月課税期間分）に添付された付表 2-(2) の⑦「資産の譲渡等の対価の額（⑤＋⑥）」欄（乙\n1 の4) に記載された金額と同額である。 •\n)b( 課税資産の譲渡等の対価の額の合計額（別紙8 の3 の表①C 欄）．\n9 2 億 2949 万 3000 円蕊\n上記金額は、本件確定申告書（平成 3 0 年1 0 月課税期間分）に添\n．．．\n．．．．．\n．．\n.• ． • ．. •.••.••\n．．．\n•••\n•' ...付された付表 2-(2) の④「課税資産の譲渡等の対価の額（①＋②十③）」\n欄（乙 1 の4) に記載された金額と同額である。 ．\n(:x:.).差引税額（別紙 7 の3 の表⑩ c 欄） 2億 0084 万3200 円上記金額は、次の a の金額と b の金額との合計額である。\n7 3控除不足還付税額・税率4 パーセント適用分lB( 紙J の の表⑧A 欄\n5 aの金額を△で表記したもの） ． △5 万1 6 25 円\n6 a上記金額は、前記（イ） の金額から前記（ウ） の金額を減算した金額である。\nb 差引税額・税率6 . 3 パーセント適用分（別紙 7 の3 の表⑨B 欄）\n2 億 0089 万4829 円上記金額は、前記（イ）b の金額から前記（ウ）b の金額を減算した金額である。\n団既に納付の確定した本税額（別紙7 の3 の表⑪ c 欄）\n△3 8 7,4 万1 2-.2 6 円上記金額は、本件確定申告書（平成30 年 1 月課税期間分）の⑧「控除不足還付税額（⑦—②—③)」欄（乙 1 の 4)に記載された金額と同額である。\nc切） 差引納付すべき消費税額（別紙7 の3 の表⑫ 欄）\n2億・3 9 5 8 万4400 円上記金額は、前記に）の金額から前記団の金額を差し引いた金額（ただし、\n・通則法i 1 9条 1 項の規定に基づき 1 0 0 円未満の端数金額を切り捨てた\nD2後の金額）である。・\nc\n（キ 合計差引地方消費税の課税標準額（別紙 7 の3 の表⑮ 禰）\n2 億 0084 万3200 円\na上記金額は、次の の金額と b の金額との合計額であり、地方税法72条の 82 の規定に基づく地方消費税の課税標準額である。\na 譲渡割額の還付額の基礎となる消費税の控除不足還付税額・税率4 パ\n．．．\n...\n. .\n．． •·\n．．\n．•.•.．••．• •.• .\n.\n｀\n•••\n•·.\nーセント適用分（別紙 7 の3 の表⑬A 欄の金額を△で表記したもの） ＇\n△5 万 1625 円上記金額は、前記に）a の金額と同額である。\nb 地方消費税の課税標準額..税率6. 3 パーセント適用分(}3 1紙J 7 の3の表⑭B 欄） 2 億0089 万4 8 2 9 円\n，上記金額は、前記にbl の金額と同額である。\n（ク）・納付すべき譲渡割額（別紙7 の3 の表⑱C 欄） 5 4 1 9 万6 8 0 0 円上記金額は、次の a の金額と b の金額との合計額である。\n還付すべき譲渡割額・税率4 パーセント適用分（別紙7 の3 の表⑯A\na欄の金額を△で表記したもの） ．． △1 万2906 円\n10 '上記金額は、地方税法7 2 条の 8 3 （平成 2 4 年法律第 6 9 号 1 条による改正前のもの）の規定に基づき、前記囲a の金額に税率 1 0 0 分の\n・2 5 を乗じて算出した金額である。\nb 納付すべき譲渡割額・税率 6. 3 パーセント適用分（別紙7 の3 の表\n⑰B 欄） 5420 万9 7 1 5 円上記金額は、地方税法7 2 条の 8 3 （平成24 年法律第 6 9 号2条による改正前のもの）の規定に基づき、前記特）b の金額に税率6 3 分の 1\n7 を乗じて算出した金額である。\nc拐 既に納付の確定した譲渡割額（別紙7 の3 の表⑲ 欄ヽ）\n△1 0 4 5 万 2957 円•,\n．上記金額は、本件確定申告書（平成30 年 1 0 月課税期間分）の⑲「還付額」欄（乙 1 の4) に記載された金額と同額である。\nc\n（コ） 差引納付すべき譲渡割額（別紙7 の3 の表⑳ 欄） 6464 万9700 円上記金額は、前記り）の金額から前記仇の金額を差し引いた金額（ただし、\n地方税法2 0 条の 4 の2 第3項の規定に基づき 1 0 0 円未潰の端数金額を切り捨てた後の金額）である。\n．．．\n•．•．• ••\n.• ．.． •. ••• • •\n．．．\n．．．\n．．．捌差引納付すべき消費税等の合計額（別紙7 の の⑪C 欄）\n3 億0 4 2.3万 4 1 0 0 円上記金額は、前記団の金額と前記（コ）の金額との合計額であり、・原告が本件更正処分（平成30 年 1 0 月課税期間分）により新たに納付すべき消費税等の額である。\n)2( 本件各更正処分の適法性 ．被告が本訴において主張する原告の本件各課税期間の納付すべき消費税額及び地方消費税の譲渡割額は、それぞれ前記\n\n\n（1）のとおりであり、本件各更正処分における納付すべき消費税額及び地方消費税の譲渡割額（甲 2 の1 ないし 2 の\nJO 3 •各 1 枚目 1 1欄及び 1 7 欄）とそれぞれ同額であるから、本件各更正処分\n．はいずれも適法である。\n2 本件各賦課決定処分の根拠及び適法性\n)1( 本件各賦課決定処分の根拠＼．期限内申告書が提出された場合において、更正がされ、当初の申告に係る税\n16 額より更正後の税額力口上回ることとなったときには·,その更•正により納付すべき税額に 1 0 0 分の・1 0 の割合を乗じて計算した金額に相当する過少申告加算税を課することとされている（通則法 6 5 条1項）。そして、更正により納付すべき税額が、その国税に係る期限内申告税額に相当する金額と 50 万円とのいずれか多い金額を超えるときは、当該超える部分に相当する税額に 1 0 0 分の\n5 の割合を乗じて計算した金額を加算することとされている（同条2 項）。\n2o前 記1)2( で述べたとおり、本件各更正処分は適法であるところ、原告が本件各更正処分により新たに納付すべき税額の計算の基礎となった事実につき 、•本件各更正処分前における税額の計算の基礎とされていなかったことについて、\n通貝；法J 6 5 条4 項に規定する「正当な理由」があるとは認められない。\n・したがって、．本件各更正処分に伴って原告に課されるべき過少申告加算税の額は、それぞれ次に述べるとおりである。\n．．．．\n．．．．．．．\n.•..••••\n．．\n....\n．．．\n•．•．． •ア 平成28 年 1 0 月課税期間 2 1 9 2 万9 5 O 0 円上記金額は、通則法 6 5 条1項の規定に基づき、本件更正処分（平成28年1 0 月課税期間分）にょり原告が新たに納付すべきこととなった税額 1億\n9882 万円（前記 1)1( ア捌。ただし、同法 11 ・g条 3 項の規定に基づき万円未満の端数金額を切り捨てた後の金額。以下ウまでにおいて同じ。）に\n100 分の 1 0 の割合を乗じて算出した 1 9 8 8 万2000 円と、新たに納付すべき税額 1億 9 8 8 2 万8 50 0 円のうち期限内申告税額 1{&5787万7800 円（本件確定申告書（平成28 年1 0 月課税期間分）の⑨「差引税額」欄の金額1 億 2 4 3 1 万1 0 0 0 円と⑳「納税額」欄の金額3356万6800 円（乙 1 の2) の合計額）を超える部分に相当する金額である 40 ・\n9 5万円に 1 0 0 分の•5 の割合を乗じて算出した 2 0..4 万 7'5 0 0 円との合計額である。\nィ、平成2 9 年 1 0 月課税期間 • 1 5 9 6 万1 0 0 0 円上記金額は、通則法 5 条1項の規定に基づき、本件更正処分（平成29年 1 0 月課税期間分）により原告が新たiこ納付すぺきこととなった税額 1億\n5 9 6 1万円（前記 ll.( lイ捌）に 1 0 0 分の 1 0 の割合を乗じて算出した金額である。\n3・oウ 平成 年1 0 月課税期間 ．． 4 5 6 O 万9 -5 0 0 円上記金額は、通則法 6 5 条1項の規定に基づき、本件更正処分（平成3.0年 I 0 月課税期間分）により原告が新たに納付すべきこととなった税額3億\n20 ・\n0 1- 2 3 万円（前記 1)1( ウ捌）に 1 0 0 分の 1 0 の割合を乗じて算出した 3 0 .\n• 4 2 万3,000 円と、新たに納付すべき税額3 億0423 万4 1 0 0 円・のうち50 万円を超える部分に相当する金額である 3 億0 3 7 3 万円に 1 0 0 分の5 の割合を乗じて算出した 1 5 1 8 万6500 円との合計額であ否\n}2( 本件各賦課決定処分の適法性被告が本訴において主張する本件各更正処分に伴って原告に課されるべき過\n....\n ． ．．．．\n \n.. .\n．．\n. .．.． ．．\n．．．\n．．． ．．．\n．．． ．．．\n ．． ．少申告加算税の額は、それぞれ前記)1( アないしウのとおりであり、本件各賦課決定処分における過少申告加算税の額（甲 2 の1 ないし2 の3 •各 1 枚目「この通知により納付すべき又は減少（一印）する税額」の「過少申告加算税」欄）\nといずれも同額であるから、本件各賦課決定処分はいずれも適法である。\n、..\n．．．．．\n．．\n．．\n．● ●.． .●..． \n．．．\n．．．\n【別紙7】、\n納付すべき消費税等の額等に係る計算過程（被告の主張）\n， 平成28 年 10 月課税窺間について\n（単位・：円）\n順 税寧4 ％適用分 税率.6 3％遍用分 合 計区 分号 A B C(A+B)課税標準額 ① 、△ 000,015 9,646,815,000 ; ,9 ,646 ,503 000課税標準額に対する消費税額 ② • △ 20,400 607,749,345 ,706 ,827 945控除逼大調整税額 ' ③ ． ゜ ゜ ゜消 控除対象仕入税額\n④ 467,066 ,623' ,271 520 ,623 ,338 2. 47\n（別紙8の1の表の⑮襴の金額） ｀ヽ控\n返還等対価に係る税額 ⑤ ゜ . 0 ゜除 ..\n，税貸倒れに係る税額 ⑥ ゜ ゜ ゜額\n費 ..控除税額小計（④十⑤十⑥）， ⑦ 457,066 • 271,623 ,620 326,833,274控除不足還付税額 ．（⑦―②.―③) ・⑧ 681- 451, ゜ 186 , 451差引税額（②＋③ー⑦） ⑨ ゜一281,576,825 281,576,826税\nc合計差引税額（⑨ 襴―⑧C 欄）\n⑩ ,082 ,598 600\n001( 円未満の端数切捨て）\n既に納付の確定した本税額\n⑪ △ 720,931,1 070,054,521 000,113,421\n(C 欄 ：001 円未滴の端数切捨て）\n—差引納付すべき消費税額\n（⑩C 欄―⑪C欄） ⑫ ~ ,485 ,65 600控除不足地方消費税の ⑬ 451,186 ゜ ,186 451還付税額（⑧）\n課税標準となる\n----- .消費税額 差引税額（⑨） ⑭ ゜一281,576,825 28,I. 528,675地 合計蓋弓1砲方綱費税の鰈鋭樋鵡となる謂費税額\n（⑭c欄-@c ●.IPOOI 未鯛の編駄切檜て） ⑮ 280,895,600方\n還付額\n⑯ . 882,071 ゜ 882,071譲渡（⑬A欄X25 /1 00 、⑬B欄X/ll' )36消\n割額納付額\n⑰ 一゜一75,981,048 840,)89,57\n（⑭A欄X001/52 、⑭B欄X 17/ )36費\n合計差引譲R c筐欄割、蒙 ⑱ 018,57 ．, 007 .\n（⑰C欄ー 001 円未満の嶋徴切捨て）\n税既に納付の瀧定した譲渡割額\n⑬ 一△ 482 . 57.6 一33 、]58 ,606 33,566,800\n(C 欄： 001 円未満の端数切捨て）\n差引納付すぺき譲渡割額\n⑳ 42,243,900\n（⑱c欄—⑲C欄）\nー ン差弓1納付すべき消費税螂の合計税額（⑫＋⑳） ＠ 1 ,89 ,828 50 .0\n（注i ①欄の「△」は売上げに係る対価の返還等の額を表す。\n税額に関する欄の ・「△」は還付金の額に相当する税額を表す。\n． ．\n．．．\n... ．.．.． ．． .\n．．．．．．．．\n....\n． ． ．\n． ． ．\n• ・・・\n2 平咸 年1 0 月霧税鋼間について\n（単位：円）\n順 税率4 ％適用分 税率6.3 ％適用分 合 計区 分 号 A . B ・ C (A+B) •課税標熔額 ① 672,000 8,398, 766 ,0 00 . ,8 498 ', ,833 000課税標準額に対する消費税額 ② 22,880 703,065 ,258 831,033,065控餘過大調整税額 ③ ゜ ゜ ゜消 控除対象仕入税額\n④ • ,73 764 206 ,196 , 131 598,827,602償l紙8の2の表の⑮欄の金績）\n控 返還等対価に係る税額 ⑤ ゜ 0 . ゜除\n税 貸倒れに係る税額 ⑥ 0 . ゜ ゜額\n費控除税頼小計（④+⑤＋⑥） ⑦ 37,764 ,196,602 131 827,602 8, 95\n• 控除不足還付税額（⑦一②一③） ( • 488,41 ゜ 14,~4差引税額（②＋③一⑦） ⑨ ゜一353 ,616,127 ,616,363 721税\n合計差引税額（⑨ c 欄―⑧ c 欄） ／\n⑩ 002,106,353\n1( 00 円未満の端数切捨て）\n既に納付の罐定した本税額\n(.c 襴： 001 円未満の端数切捨て） ⑪ 一△ 488,41 一227 ,922,376 -~27,907,400差引納付すべき消費税額\nc c ⑫ 521 , 008,396\n．（⑩ 欄―⑪ 欄）\n控除不足・ ：地方消費税の ⑬ • 488,41 ゜ 488,41還付税額(R)課税標準となる消費税額 差引税額（⑨） ⑭ ゜一353,616,127 ,616,353 721\n—地 ＂合計艶引柁方＂費覆の謁税霧攣となる清費製麟\n(RC ●-OC 編． 1lP未績の嶋駄切綸て）） ⑮ 002,106,353方\n遭付額 ・譲渡 (@A 欄X001/52 、⑬B 欄X )36/71 ⑯ . 127,3 . ・O 127,3消 ¥.割額納付額\n)36/71 ⑰\nー゜\n96,420,224 024,59 422,\n（⑭A襴X~S/100、⑭B欄X費\n合計差弓1譲櫨割額 ／\n⑱ ,69 14 ,6. 005\n（⑰c欄ーRc 欄、001 円未調の嶋数切捨て）\n税既に納付の確定した顧渡割額\n⑲ 一△ 127,3 16 ,502,863 ,994,16 001\n(C 欄： 001 円未識の端数切捨て）\n—\n．差引納付すべき譲筐割額\n⑳ ,719,33 4・ 00\n（⑱C欄—⑲C欄） ．．差引納付すべき情費税等の合計税績（⑫＋⑳） ＠ ,951 ,116 002\n ／ ／ ン —/// •\n（注） 「△」は還付金の額に相当する税額を表す． ．\n．．．\n•..．．.．..．.．． .\n．•． •\n． ． ．\n． ． ．\n． ． ．\n．．．\n3 平成30 年 1 0 月課税期間について\n（単位：円）\nロー順 税率4 ％適用分 '税率6.3％適用分 合 計 ・区 分号 ‘A B C (A+B)課税標準額 ① △ 124 , 000 000,424,922,9 ,9 ,922 ,300 000課税標準額に対する消費税額 ・ ② △ ,61 48 .0 .185 , ,354 217 278,634,185控除過大調整税額 R . 0. ゜ ゜消 控除対象仕入税額\n④ 587,43 388,855,083 38~. , 395 866紙J18.( 8の3の表の⑮欄の金額）\n控 返還等対価に係る税額 ⑤ ゜ ゜ ゜除\n税貸倒れに係る税額 ⑥ ゜ ゜ ゜額\n費控除税額小計（④十⑤十⑥） ⑦ 34,785 ．083 , 388,855 380 , ,395 6~8控除不足還付税額（⑦—②—③) ⑧ 5],625 ゜ 526,15差引税額（②＋③—⑦) ' ⑨ 一゜一 928,498,002 ,002 ,498 928税\nc合計差引税額（⑨ 欄―⑧C 欄）\n⑩ ,002 ,348 002\n001( 円未満の端数切捨て）\n既に納付の磯定した本税額 ⑪ △ 526,15 • △ 83 , 106,986 △ 622,147,83\n—差引納付すぺき消費税韻\n⑫ ,932 ,486 004\n(Rc 欄ーRc 欄、001 円未調の蝙歓切檜て）\n地方消費税の ． 控 除不足・ ⑬ .si625 ゜ 526,15還付税額(R)課税標準となる消費税額 ．- -差-引税-額（-⑨）--⑭- - ゜ 928,498,002 200 ,,498 . 928地 合計甍弓l嬉方清費覆の謙製編準となる滑費-税観---------\n(RC 欄ー@C ●●JIPOO 未調の鰭験切檜て）） ⑮ 200 , ,348 002方 •還付額\n⑯ 609,21 ゜ 609,21\n)36/71顕渡（⑬A欄~25/100、 ⑬B欄X消\n割額納付額 • ⑰ ゜一 ,902,46 517 ,46 ,902 . 517\n（⑭A 欄001/52X 、⑭B欄X )36/71費 ---------合計差うl麒濃割頓\n（⑰c欄ーRC 欄、001 円来瀾の蟷数切檜て） ⑱ 008,691,45税 既に納付の蹟定した譲渡割額 ⑲ ー △ 609,21 △ 150,044,01 △ 759,264,01差引納付すぺき顕濤割額\n（⑩c概―⑬C欄、001 円未調の蟷数切捨て） ⑳ 一 ー ン． •6 4 ,(.6 ,9 007\n—差引納付すぺき消費税等の合計税額（⑫＋⑳） ◎ ,432,403 001\n（注） ①欄の「△」は売上げに係る対伍の返還等の額を表す。\n税額に関する襴の「△．」は還付金の額に相当する税額を表す。\n．．．\n・.\n．\n● ● ● • ．．．ヽ・・・\n•．•．• •• •．•．• ••\n．． ．．\n．••．••．• •• ．．．\n．．． ．．．\n．．．\n．．． ．．．\n•••\n【別紙8 】\n・課税売上割合等に係る計算過程（被告の主張）\nー 平成28 年, 0 月鰈税期間について\n（単位：》円）\n｀順 税寧4 ％適用分 税率6.3 ％遍用分 合計項 目号 A B C .(A+B)\n／ ／課税資産の麒霰等の対価の額 ① - ,9 ,403,646 3 .14\nヽ / /\n／課税資産の譲渡等の対値の額\n② 9, ,646 143,403\n（①の金額） •\n／ ／ ヽ非震税売上額 ③ 731,847,108,7\n／ ／資産の麟撲等の対価の額（②＋③） ． ④ 17,448,052 , 874\n／ ／課 税 売 上 割 合 （① ／④） ⑤ .55 162158682 ・・・ %\n．\n・確定申告・書添付の付表2-(2) に記載された課\n⑥ 31,034,430 313,703,850,01 3(7,1(3,980,01税仕入れに係る支払対価の額（税込み）\n課税仕入れに係る消費税額・\n⑦ 462,281,1 586,734,693 619,786 、758\n（⑥A 欄X 601/4 、⑥B欄X6. )801/3\n⑦のうち、課税売上げにのみ妻するもの\n⑧ 006,61 937,108,86 718,86 , 933\n（⑨―⑭)\n・確定申告書添付の付表2 -)2( に記載さ\n⑨ 1,039,600 • 570 ,869,704 576,700,904れた課税売上げ1このみ蔓するものの金額\n⑨のうち、課税売上げにのみ要するもの\n． ⑲ ,1 02,f. 000 633,661,943 053 , ,09 1 336から減算すべき金額・\n⑦のうち、課税売上げと非諫税売上げに共\n⑪ ,1 449,661 202,516,384 ,44-8 ,287 641通して妻するもの（⑫＋⑬） ＇確定申告書垢付の付表2 -(2) に記載さ ヽれた課税売上げと非課税売上げに共通し ⑫ 241 , 449 J ,4 3 ,844 668 195,431 ,810て賽するものの金額\nRのうち 、課税売上げと非課税売上げ1こ\n⑬ 420,1 , 000 633,661,943 633,091,063共通して要するものに加算すべき金額個別対応方式により控除する課税仕入れ等の税額（⑧+（⑪ x①／④）） ⑭ 467,066 326,172,620 .623 ,338 472控除対象仕入税額（⑭の金額） ⑮ 邸0, 457 326,172 , 925 338,623 , 472\n \n•．•． •••\n．．．\n・・．・．・・．・・ •\n..••. .\n.\n•\n・・・\n2 平成29 年, 0 月課税鑽間について\n（単位：円）\n順 税率4％遍用分 税率6.3 ％適用分 合計項 目号 A B C (A+ B)\n／ ／鰈税資産の瞑筐等の対価の額 ① ,8 ,698 ,452 280\n／ ／課税資産の誤猿等の対価の額\n② ,8 895 ,254 , 28 0\n（①の金額）\n，\n／ ／非課税売上額 ③ ,8 309,665,561\n／ ／資産の譲裟等の対価の額（②＋③） ④ 1. ,7 ,060 ,028 986\n／ ／課 税 売 上 割 合 （① ／④） ⑤ .25 138487882 ..・%蹟定申告書添付の付表2 - )2( に記載された課\n⑧ ,I 043,109 512,166,864,7 7,470,462,566税仕入れに係る文払対価の額（鋭込み）\n・課税仕入れに係る消費税額\n(RA 欄X 41/ 05 、RB 欄X6. )801/3 ⑦ 72 ,432 ＇ 070,666,634 435,738,502\n．\n⑦のうち、課税売上げにのみ賽するもの\n③ ゜ 489,163,7 7, 489,163\n(R―⑩)\n＇箪定申告書添付の付表 2-(2) に記載さ\n⑨ ゜ 966,189,962 189,962 ,669れた牒税売上げ1このみ妻するものの金額\n⑨のうち、諌税売上げ1このみ要するもの\n⑩ ゜ 586,916,262 ,262 6 ,9,1 686から減算すべき金額 '\n⑦のうち、饒税売上げと非諜税売上げに共\n⑪ 234,27 ,283 307 , 211 445,973,283通して蔓するもの（⑫＋⑬）\n．．確定申告書添付の付表2 -(2) に記載された課税売上げと非課税売上げに共通し ⑫ 72 ．心2 786,911 ,427 968,957,911て要するものの金額\n・Rのうち、課税売上げと非課税売上げに\n⑬ ゜ 686,916,262 . 262 , 686,916共通して要するものに加算すべき金額饂別対応方式により控除する課税仕入れ等の税\n⑭ 37 ,7 6~ ,196,602 131 206,728,896額（⑧+（⑪ X①／④））\n控除対象仕入税額（⑭の金額） ⑮ '37 , 467 ,196,602 131 ,602 ,827 895\n．．．\n \n•．•．• ••\n．．.\n．．．\n \n...·.•\n3 平成30 年1 0 月課税期間について\n（単位：円）\n順 税率4 ％適用分 税寧6.3 ％遍用分 合計項 目 号 A B C (A+ B)\n／ ／課税資産の譲渡等の対価の額 ① 000,394,922,9\n／ ／\n．課税賓産の麟猿等の対価の額\n② ,394,922,9 00.0\n（①の金額）\n／ ／非課税売上額 ③ 8,377,316 , 728\n／ ／資産の顧檎等の対価の額（②＋③） ④ 728,908,606,71\n/ 9\n／鰈税売上’割合 （① / ・④） ⑤ 52 .・87681002 4・・ %陣定申告書添付の付表2-(2) に記戴された饒 ヽ\n⑥ 069,147,1 587,355,047,21 21 , ,24 7 592 , 53 7税仕入れに係る支払対価の額（税込み）\n'課税仕入れに係る消費税額\n⑦. 66,360 079,891,347 033,562,347\n（⑥A 欄X4/105 、⑥B欄'X 6. )801/ 3 •‘\n⑦のうち．課税売上げ1このみ要するもの\n⑧ ゜ 518,378,61 518,378,61\n(R―⑩)蘊定申告書添付の付表2- )2( に記載さ\n⑨ ゜ 712,716,235 712,716,235れた課税売上げにのみ要するものの金頼\n⑨のうち、諜税売上げ1このみ妻するもの ・o\n⑩ 204,347,515 ,616 204;347から減算すべき金額\nヽ\n⑦のうち、課税売上げと非課税売上げに共\n⑪ 66,360 693,790,422 287,668,396通して要するもの（⑫＋⑬）\n確定申告書添付の付表2-(2) に記載された諫税売上げと非課税売上げに共通し ⑫ 66,360 79,661 ｀0,746 601,730,761て蔓するものの金額\n⑨のうち、課税売上げと非課税売上げに\n⑬ ゜ 526,819 ,676 676,918,626\n，共通して憂するものに加算すぺき金額個別対応方式により控除する鰈税仕入れ等の税額（⑧+（⑪ x①／④）） ⑭ 3478.5 380 ,855 ,883 866,396,083控除対象仕入税額（⑭の金額） • ⑮ 34.785 380 ,. 558, 883 3_80 , ,396 668別紙２、４ 省略"
}